hostname,name,descriptivename,description,path,md5,arguments,type,servicedll,pathsignatureexists,pathsignatureverified,pathsignaturedescription,pathcertificatesubject,pathcertificateissuer
EW0001EOV,WbioSrvc,Windows Biometric Service,The Windows biometric service gives client applications the ability to capture  compare  manipulate  and store biometric data without gaining direct access to any biometric hardware or samples. The service is hosted in a privileged SVCHOST process.,C:\Windows\System32\svchost.exe,2b896bd48f79676debeb14974ec5189d,C:\Windows\system32\svchost.exe -k WbioSvcGroup,SERVICE_WIN32_SHARE_PROCESS,C:\Windows\System32\wbiosrvc.dll,true,true,The file is signed and the signature was verified.,Microsoft Windows,Microsoft Windows Production PCA 2011
EW0001EOV,vhdmp,vhdmp,,C:\Windows\System32\drivers\vhdmp.sys,185a5f09fc0be06574692e27e396a558,\SystemRoot\System32\drivers\vhdmp.sys,SERVICE_KERNEL_DRIVER,,true,true,The file is signed and the signature was verified.,Microsoft Windows,Microsoft Windows Production PCA 2011
EW0001EOV,Dhcp,DHCP Client,Registers and updates IP addresses and DNS records for this computer. If this service is stopped  this computer will not receive dynamic IP addresses and DNS updates. If this service is disabled  any services that explicitly depend on it will fail to start.,C:\Windows\System32\svchost.exe,2b896bd48f79676debeb14974ec5189d,C:\Windows\system32\svchost.exe -k LocalServiceNetworkRestricted,SERVICE_WIN32_SHARE_PROCESS,C:\Windows\System32\dhcpcore.dll,true,true,The file is signed and the signature was verified.,Microsoft Windows,Microsoft Windows Production PCA 2011
EW0001EOV,pla,Performance Logs &amp; Alerts,Performance Logs and Alerts Collects performance data from local or remote computers based on preconfigured schedule parameters  then writes the data to a log or triggers an alert. If this service is stopped  performance information will not be collected. If this service is disabled  any services that explicitly depend on it will fail to start.,C:\Windows\System32\svchost.exe,2b896bd48f79676debeb14974ec5189d,C:\Windows\System32\svchost.exe -k LocalServiceNoNetwork,SERVICE_WIN32_SHARE_PROCESS,C:\Windows\System32\pla.dll,true,true,The file is signed and the signature was verified.,Microsoft Windows,Microsoft Windows Production PCA 2011
EW0001EOV,lfsvc,Geolocation Service,This service monitors the current location of the system and manages geofences (a geographical location with associated events).  If you turn off this service  applications will be unable to use or receive notifications for geolocation or geofences.,C:\Windows\System32\svchost.exe,2b896bd48f79676debeb14974ec5189d,C:\Windows\system32\svchost.exe -k netsvcs,SERVICE_WIN32_SHARE_PROCESS,C:\Windows\System32\lfsvc.dll,true,true,The file is signed and the signature was verified.,Microsoft Windows,Microsoft Windows Production PCA 2011
EW0001EOV,WINUSB,WinUsb Driver,,C:\Windows\System32\drivers\winusb.sys,bf72f6517c253a511d25a295e2042d63,\SystemRoot\System32\drivers\WinUSB.SYS,SERVICE_KERNEL_DRIVER,,true,true,The file is signed and the signature was verified.,Microsoft Windows,Microsoft Windows Production PCA 2011
EW0001EOV,OneSyncSvc_6934d,Sync Host_6934d,This service synchronizes mail  contacts  calendar and various other user data. Mail and other applications dependent on this functionality will not work properly when this service is not running.,C:\Windows\System32\svchost.exe,2b896bd48f79676debeb14974ec5189d,C:\Windows\system32\svchost.exe -k UnistackSvcGroup,SERVICE_WIN32_SHARE_PROCESS,,true,true,The file is signed and the signature was verified.,Microsoft Windows,Microsoft Windows Production PCA 2011
EW0001EOV,terminpt,Microsoft Remote Desktop Input Driver,,C:\Windows\System32\drivers\terminpt.sys,416d556e1d33d521320c738c9e3a3667,\SystemRoot\System32\drivers\terminpt.sys,SERVICE_KERNEL_DRIVER,,true,true,The file is signed and the signature was verified.,Microsoft Windows,Microsoft Windows Production PCA 2011
EW0001EOV,ql40xx2i,QLogic iSCSI Miniport Inbox Driver,,C:\Windows\System32\drivers\ql40xx2i.sys,2ecd66e6ddd68b5d8adf7d31914ddd4a,\SystemRoot\System32\drivers\ql40xx2i.sys,SERVICE_KERNEL_DRIVER,,true,true,The file is signed and the signature was verified.,Microsoft Windows,Microsoft Windows Production PCA 2011
EW0001EOV,vmicvss,Hyper-V Volume Shadow Copy Requestor,Coordinates the communications that are required to use Volume Shadow Copy Service to back up applications and data on this virtual machine from the operating system on the physical computer.,C:\Windows\System32\svchost.exe,2b896bd48f79676debeb14974ec5189d,C:\Windows\system32\svchost.exe -k LocalSystemNetworkRestricted,SERVICE_WIN32_SHARE_PROCESS,C:\Windows\System32\icsvcext.dll,true,true,The file is signed and the signature was verified.,Microsoft Windows,Microsoft Windows Production PCA 2011
EW0001EOV,MSDTC,Distributed Transaction Coordinator,Coordinates transactions that span multiple resource managers  such as databases  message queues  and file systems. If this service is stopped  these transactions will fail. If this service is disabled  any services that explicitly depend on it will fail to start.,C:\Windows\System32\msdtc.exe,9ba60b1948c0e78955050b861018666e,C:\Windows\System32\msdtc.exe,SERVICE_WIN32_OWN_PROCESS,,true,true,The file is signed and the signature was verified.,Microsoft Windows,Microsoft Windows Production PCA 2011
EW0001EOV,UALSVC,User Access Logging Service,This service logs unique client access requests  in the form of IP addresses and user names  of installed products and roles on the local server. This information can be queried  via Powershell  by administrators needing to quantify client demand of server software for offline Client Access License (CAL) management. If the service is disabled  client requests will not be logged and will not be retrievable via Powershell queries. Stopping the service will not affect query of historical data (see supporting documentation for steps to delete historical data). The local system administrator must consult his  or her  Windows Server license terms to determine the number of CALs that are required for the server software to be appropriately licensed; use of the UAL service and data does not alter this obligation.,C:\Windows\System32\svchost.exe,2b896bd48f79676debeb14974ec5189d,C:\Windows\system32\svchost.exe -k LocalSystemNetworkRestricted,SERVICE_WIN32_SHARE_PROCESS,C:\Windows\System32\ualsvc.dll,true,true,The file is signed and the signature was verified.,Microsoft Windows,Microsoft Windows Production PCA 2011
EW0001EOV,nvme,nvme,,C:\Windows\System32\drivers\nvme.sys,709224e64c25143651d503e67a2b309b,\SystemRoot\System32\drivers\nvme.sys,SERVICE_KERNEL_DRIVER,,true,true,The file is signed and the signature was verified.,Google Inc,Symantec Class 3 SHA256 Code Signing CA
EW0001EOV,wcifs,Windows Container Isolation,Provides a virtual filesystem view for processes running within Windows Containers,C:\Windows\System32\drivers\wcifs.sys,75b4721d0339f22e56bf7bdf91cf47f8,\SystemRoot\system32\drivers\wcifs.sys,SERVICE_FILE_SYSTEM_DRIVER,,true,true,The file is signed and the signature was verified.,Microsoft Windows,Microsoft Windows Production PCA 2011
EW0001EOV,buttonconverter,Service for Portable Device Control devices,,C:\Windows\System32\drivers\buttonconverter.sys,dafa7511b762b2bfbcee03b8713c5aec,\SystemRoot\System32\drivers\buttonconverter.sys,SERVICE_KERNEL_DRIVER,,true,true,The file is signed and the signature was verified.,Microsoft Windows,Microsoft Windows Production PCA 2011
EW0001EOV,KtmRm,KtmRm for Distributed Transaction Coordinator,Coordinates transactions between the Distributed Transaction Coordinator (MSDTC) and the Kernel Transaction Manager (KTM). If it is not needed  it is recommended that this service remain stopped. If it is needed  both MSDTC and KTM will start this service automatically. If this service is disabled  any MSDTC transaction interacting with a Kernel Resource Manager will fail and any services that explicitly depend on it will fail to start.,C:\Windows\System32\svchost.exe,2b896bd48f79676debeb14974ec5189d,C:\Windows\System32\svchost.exe -k NetworkServiceAndNoImpersonation,SERVICE_WIN32_SHARE_PROCESS,C:\Windows\System32\msdtckrm.dll,true,true,The file is signed and the signature was verified.,Microsoft Windows,Microsoft Windows Production PCA 2011
EW0001EOV,LSI_SAS,LSI_SAS,,C:\Windows\System32\drivers\lsi_sas.sys,931189a11246d0e4c4bcdb856e7f9c5d,\SystemRoot\System32\drivers\lsi_sas.sys,SERVICE_KERNEL_DRIVER,,true,true,The file is signed and the signature was verified.,Microsoft Windows,Microsoft Windows Production PCA 2011
EW0001EOV,nvstor,nvstor,,C:\Windows\System32\drivers\nvstor.sys,28e2d05b5bf55ebe115a656540459b67,\SystemRoot\System32\drivers\nvstor.sys,SERVICE_KERNEL_DRIVER,,true,true,The file is signed and the signature was verified.,Microsoft Windows,Microsoft Windows Production PCA 2011
EW0001EOV,NDIS,NDIS System Driver,NDIS System Driver,C:\Windows\System32\drivers\ndis.sys,7dfd0da497f2afecbcfbc625849bb559,\SystemRoot\system32\drivers\ndis.sys,SERVICE_KERNEL_DRIVER,,true,true,The file is signed and the signature was verified.,Microsoft Windows,Microsoft Windows Production PCA 2011
EW0001EOV,TsUsbFlt,TsUsbFlt,Remote Desktop USB Hub Class Filter Driver,C:\Windows\System32\drivers\TsUsbFlt.sys,e781b63a78cc5208a1328db3af923094,system32\drivers\tsusbflt.sys,SERVICE_KERNEL_DRIVER,,true,true,The file is signed and the signature was verified.,Microsoft Windows,Microsoft Windows Production PCA 2011
EW0001EOV,UEFI,Microsoft UEFI Driver,,C:\Windows\System32\drivers\uefi.sys,f74f8646b55160ecdb7127b6a8adb48d,\SystemRoot\System32\drivers\UEFI.sys,SERVICE_KERNEL_DRIVER,,true,true,The file is signed and the signature was verified.,Microsoft Windows,Microsoft Windows Production PCA 2011
EW0001EOV,WerSvc,Windows Error Reporting Service,Allows errors to be reported when programs stop working or responding and allows existing solutions to be delivered. Also allows logs to be generated for diagnostic and repair services. If this service is stopped  error reporting might not work correctly and results of diagnostic services and repairs might not be displayed.,C:\Windows\System32\svchost.exe,2b896bd48f79676debeb14974ec5189d,C:\Windows\System32\svchost.exe -k WerSvcGroup,SERVICE_WIN32_OWN_PROCESS,C:\Windows\System32\wersvc.dll,true,true,The file is signed and the signature was verified.,Microsoft Windows,Microsoft Windows Production PCA 2011
EW0001EOV,s3cap,s3cap,,C:\Windows\System32\drivers\vms3cap.sys,315efe6f61c0d8aa5a4fbe26743a2d8b,\SystemRoot\System32\drivers\vms3cap.sys,SERVICE_KERNEL_DRIVER,,true,true,The file is signed and the signature was verified.,Microsoft Windows,Microsoft Windows Production PCA 2011
EW0001EOV,EhStorClass,Enhanced Storage Filter Driver,Enhanced Storage Filter Driver,C:\Windows\System32\drivers\EhStorClass.sys,570e926c0f8588c1f6f175085667d3ed,\SystemRoot\System32\drivers\EhStorClass.sys,SERVICE_KERNEL_DRIVER,,true,true,The file is signed and the signature was verified.,Microsoft Windows,Microsoft Windows Production PCA 2011
EW0001EOV,mrxsmb,SMB MiniRedirector Wrapper and Engine,Implements the framework for the SMB filesystem redirector,C:\Windows\System32\drivers\mrxsmb.sys,0960f50b7dabd98adeeb72475f210cdc,system32\DRIVERS\mrxsmb.sys,SERVICE_FILE_SYSTEM_DRIVER,,true,true,The file is signed and the signature was verified.,Microsoft Windows,Microsoft Windows Production PCA 2011
EW0001EOV,AppIDSvc,Application Identity,Determines and verifies the identity of an application. Disabling this service will prevent AppLocker from being enforced.,C:\Windows\System32\svchost.exe,2b896bd48f79676debeb14974ec5189d,C:\Windows\system32\svchost.exe -k LocalServiceNetworkRestricted,SERVICE_WIN32_SHARE_PROCESS,C:\Windows\System32\appidsvc.dll,true,true,The file is signed and the signature was verified.,Microsoft Windows,Microsoft Windows Production PCA 2011
EW0001EOV,tunnel,Microsoft Tunnel Miniport Adapter Driver,,C:\Windows\System32\drivers\tunnel.sys,53e09102c4148c574c70627a1330e894,\SystemRoot\System32\drivers\tunnel.sys,SERVICE_KERNEL_DRIVER,,true,true,The file is signed and the signature was verified.,Microsoft Windows,Microsoft Windows Production PCA 2011
EW0001EOV,HTTP,HTTP Service,HTTP Service,C:\Windows\System32\drivers\http.sys,80ec5a435f08ad5d3d2f71d5e8333e48,system32\drivers\HTTP.sys,SERVICE_KERNEL_DRIVER,,true,true,The file is signed and the signature was verified.,Microsoft Windows,Microsoft Windows Production PCA 2011
EW0001EOV,VSS,Volume Shadow Copy,Manages and implements Volume Shadow Copies used for backup and other purposes. If this service is stopped  shadow copies will be unavailable for backup and the backup may fail. If this service is disabled  any services that explicitly depend on it will fail to start.,C:\Windows\System32\VSSVC.exe,c7192321eef20812c49f3b7f3afd9939,C:\Windows\system32\vssvc.exe,SERVICE_WIN32_OWN_PROCESS,,true,true,The file is signed and the signature was verified.,Microsoft Windows,Microsoft Windows Production PCA 2011
EW0001EOV,sppsvc,Software Protection,Enables the download  installation and enforcement of digital licenses for Windows and Windows applications. If the service is disabled  the operating system and licensed applications may run in a notification mode. It is strongly recommended that you not disable the Software Protection service.,C:\Windows\System32\sppsvc.exe,ad707ecf42f79db648666bb6d3779aff,C:\Windows\system32\sppsvc.exe,SERVICE_WIN32_OWN_PROCESS,,true,true,The file is signed and the signature was verified.,Microsoft Windows,Microsoft Windows Production PCA 2011
EW0001EOV,volmgr,Volume Manager Driver,,C:\Windows\System32\drivers\volmgr.sys,7104ba8d2f23b0c81a4790fc099d263b,\SystemRoot\System32\drivers\volmgr.sys,SERVICE_KERNEL_DRIVER,,true,true,The file is signed and the signature was verified.,Microsoft Windows,Microsoft Windows Production PCA 2011
EW0001EOV,ufxsynopsys,USB Synopsys Controller,,C:\Windows\System32\drivers\ufxsynopsys.sys,c71b4f233f4e21303d4556aaa1e6ef37,\SystemRoot\System32\drivers\ufxsynopsys.sys,SERVICE_KERNEL_DRIVER,,true,true,The file is signed and the signature was verified.,Microsoft Windows,Microsoft Windows Production PCA 2011
EW0001EOV,pci,PCI Bus Driver,,C:\Windows\System32\drivers\pci.sys,550050ac84a6d0477b28c0047556cacb,\SystemRoot\System32\drivers\pci.sys,SERVICE_KERNEL_DRIVER,,true,true,The file is signed and the signature was verified.,Microsoft Windows,Microsoft Windows Production PCA 2011
EW0001EOV,Netman,Network Connections,Manages objects in the Network and Dial-Up Connections folder  in which you can view both local area network and remote connections.,C:\Windows\System32\svchost.exe,2b896bd48f79676debeb14974ec5189d,C:\Windows\System32\svchost.exe -k LocalSystemNetworkRestricted,SERVICE_WIN32_SHARE_PROCESS,C:\Windows\System32\netman.dll,true,true,The file is signed and the signature was verified.,Microsoft Windows,Microsoft Windows Production PCA 2011
EW0001EOV,usbohci,Microsoft USB Open Host Controller Miniport Driver,,C:\Windows\System32\drivers\usbohci.sys,b35b4570b2cef8fae04c815810508d4e,\SystemRoot\System32\drivers\usbohci.sys,SERVICE_KERNEL_DRIVER,,true,true,The file is signed and the signature was verified.,Microsoft Windows,Microsoft Windows Production PCA 2011
EW0001EOV,vmicrdv,Hyper-V Remote Desktop Virtualization Service,Provides a platform for communication between the virtual machine and the operating system running on the physical computer.,C:\Windows\System32\svchost.exe,2b896bd48f79676debeb14974ec5189d,C:\Windows\system32\svchost.exe -k ICService,SERVICE_WIN32_SHARE_PROCESS,C:\Windows\System32\icsvcext.dll,true,true,The file is signed and the signature was verified.,Microsoft Windows,Microsoft Windows Production PCA 2011
EW0001EOV,QWAVE,Quality Windows Audio Video Experience,Quality Windows Audio Video Experience (qWave) is a networking platform for Audio Video (AV) streaming applications on IP home networks. qWave enhances AV streaming performance and reliability by ensuring network quality-of-service (QoS) for AV applications. It provides mechanisms for admission control  run time monitoring and enforcement  application feedback  and traffic prioritization.,C:\Windows\System32\svchost.exe,2b896bd48f79676debeb14974ec5189d,C:\Windows\system32\svchost.exe -k LocalServiceAndNoImpersonation,SERVICE_WIN32_SHARE_PROCESS,C:\Windows\System32\qwave.dll,true,true,The file is signed and the signature was verified.,Microsoft Windows,Microsoft Windows Production PCA 2011
EW0001EOV,msisadrv,msisadrv,,C:\Windows\System32\drivers\msisadrv.sys,aee3db452bdd5df05d3d2edc9cd0f8d1,\SystemRoot\System32\drivers\msisadrv.sys,SERVICE_KERNEL_DRIVER,,true,true,The file is signed and the signature was verified.,Microsoft Windows,Microsoft Windows Production PCA 2011
EW0001EOV,PolicyAgent,IPsec Policy Agent,"""Internet Protocol security (IPsec) supports network-level peer authentication  data origin authentication  data integrity  data confidentiality (encryption)  and replay protection.  This service enforces IPsec policies created through the IP Security Policies snap-in or the command-line tool """"netsh ipsec"""".  If you stop this service  you may experience network connectivity issues if your policy requires that connections use IPsec.  Also remote management of Windows Firewall is not available when this service is stopped.""",C:\Windows\System32\svchost.exe,2b896bd48f79676debeb14974ec5189d,C:\Windows\system32\svchost.exe -k NetworkServiceNetworkRestricted,SERVICE_WIN32_SHARE_PROCESS,C:\Windows\System32\IPSECSVC.DLL,true,true,The file is signed and the signature was verified.,Microsoft Windows,Microsoft Windows Production PCA 2011
EW0001EOV,storvsc,storvsc,,C:\Windows\System32\drivers\storvsc.sys,935676e2ba57d2e60495ec272185548e,\SystemRoot\System32\drivers\storvsc.sys,SERVICE_KERNEL_DRIVER,,true,true,The file is signed and the signature was verified.,Microsoft Windows,Microsoft Windows Production PCA 2011
EW0001EOV,UcmCx0101,USB Connector Manager KMDF Class Extension,,C:\Windows\System32\drivers\UcmCx.sys,2edef7f0cd0bd32579252fdaca700bc3,System32\Drivers\UcmCx.sys,SERVICE_KERNEL_DRIVER,,true,true,The file is signed and the signature was verified.,Microsoft Windows,Microsoft Windows Production PCA 2011
EW0001EOV,Eaphost,Extensible Authentication Protocol,The Extensible Authentication Protocol (EAP) service provides network authentication in such scenarios as 802.1x wired and wireless  VPN  and Network Access Protection (NAP).  EAP also provides application programming interfaces (APIs) that are used by network access clients  including wireless and VPN clients  during the authentication process.  If you disable this service  this computer is prevented from accessing networks that require EAP authentication.,C:\Windows\System32\svchost.exe,2b896bd48f79676debeb14974ec5189d,C:\Windows\System32\svchost.exe -k netsvcs,SERVICE_WIN32_SHARE_PROCESS,C:\Windows\System32\eapsvc.dll,true,true,The file is signed and the signature was verified.,Microsoft Windows,Microsoft Windows Production PCA 2011
EW0001EOV,IPNAT,IP Network Address Translator,,C:\Windows\System32\drivers\ipnat.sys,bf0ab41510e1bdc91fbfb73488af1fb9,System32\drivers\ipnat.sys,SERVICE_KERNEL_DRIVER,,true,true,The file is signed and the signature was verified.,Microsoft Windows,Microsoft Windows Production PCA 2011
EW0001EOV,DsSvc,Data Sharing Service,Provides data brokering between applications.,C:\Windows\System32\svchost.exe,2b896bd48f79676debeb14974ec5189d,C:\Windows\System32\svchost.exe -k LocalSystemNetworkRestricted,SERVICE_WIN32_SHARE_PROCESS,C:\Windows\System32\dssvc.dll,true,true,The file is signed and the signature was verified.,Microsoft Windows,Microsoft Windows Production PCA 2011
EW0001EOV,USBSTOR,USB Mass Storage Driver,,C:\Windows\System32\drivers\USBSTOR.SYS,9d09084864754f41329ad41b0ee42745,\SystemRoot\System32\drivers\USBSTOR.SYS,SERVICE_KERNEL_DRIVER,,true,true,The file is signed and the signature was verified.,Microsoft Windows,Microsoft Windows Production PCA 2011
EW0001EOV,FltMgr,FltMgr,File System Filter Manager Driver,C:\Windows\System32\drivers\fltMgr.sys,600ed5b9bf84ef1a5b20da77e633b82c,\SystemRoot\system32\drivers\fltmgr.sys,SERVICE_FILE_SYSTEM_DRIVER,,true,true,The file is signed and the signature was verified.,Microsoft Windows,Microsoft Windows Production PCA 2011
EW0001EOV,volmgrx,Dynamic Volume Manager,Extension of the volume manager driver that manages software RAID volumes (spanned  striped  mirrored  RAID-5) on dynamic disks,C:\Windows\System32\drivers\volmgrx.sys,c4ef1ae8c5aff1209c2f10e6fdf6acc2,\SystemRoot\System32\drivers\volmgrx.sys,SERVICE_KERNEL_DRIVER,,true,true,The file is signed and the signature was verified.,Microsoft Windows,Microsoft Windows Production PCA 2011
EW0001EOV,UrsCx01000,USB Role-Switch Support Library,,C:\Windows\System32\drivers\urscx01000.sys,dd681e3c83f93f02e3e59cbff7d7f930,system32\drivers\urscx01000.sys,SERVICE_KERNEL_DRIVER,,true,true,The file is signed and the signature was verified.,Microsoft Windows,Microsoft Windows Production PCA 2011
EW0001EOV,RasAuto,Remote Access Auto Connection Manager,Creates a connection to a remote network whenever a program references a remote DNS or NetBIOS name or address.,C:\Windows\System32\svchost.exe,2b896bd48f79676debeb14974ec5189d,C:\Windows\System32\svchost.exe -k netsvcs,SERVICE_WIN32_SHARE_PROCESS,C:\Windows\System32\rasauto.dll,true,true,The file is signed and the signature was verified.,Microsoft Windows,Microsoft Windows Production PCA 2011
EW0001EOV,AppID,AppID Driver,Identifies an application and enforces software restriction policies.,C:\Windows\System32\drivers\appid.sys,59ddb7227fc1efec73df2167abda2a77,system32\drivers\appid.sys,SERVICE_KERNEL_DRIVER,,true,true,The file is signed and the signature was verified.,Microsoft Windows,Microsoft Windows Production PCA 2011
EW0001EOV,BITS,Background Intelligent Transfer Service,Transfers files in the background using idle network bandwidth. If the service is disabled  then any applications that depend on BITS  such as Windows Update or MSN Explorer  will be unable to automatically download programs and other information.,C:\Windows\System32\svchost.exe,2b896bd48f79676debeb14974ec5189d,C:\Windows\System32\svchost.exe -k netsvcs,SERVICE_WIN32_SHARE_PROCESS,C:\Windows\System32\qmgr.dll,true,true,The file is signed and the signature was verified.,Microsoft Windows,Microsoft Windows Production PCA 2011
EW0001EOV,Mup,Mup,Multiple UNC Provider Driver,C:\Windows\System32\drivers\mup.sys,ce731bb321b60b796e1fb958ba387a3f,\SystemRoot\System32\Drivers\mup.sys,SERVICE_FILE_SYSTEM_DRIVER,,true,true,The file is signed and the signature was verified.,Microsoft Windows,Microsoft Windows Production PCA 2011
EW0001EOV,W3SVC,World Wide Web Publishing Service,Provides Web connectivity and administration through the Internet Information Services Manager,C:\Windows\System32\svchost.exe,2b896bd48f79676debeb14974ec5189d,C:\WINDOWS\system32\svchost.exe -k iissvcs,SERVICE_WIN32_SHARE_PROCESS,C:\Windows\System32\inetsrv\iisw3adm.dll,true,true,The file is signed and the signature was verified.,Microsoft Windows,Microsoft Windows Production PCA 2011
EW0001EOV,pdc,pdc,Power Dependency Coordinator Driver,C:\Windows\System32\drivers\pdc.sys,5bc34b9e17c2f631e59de19157629273,\SystemRoot\system32\drivers\pdc.sys,SERVICE_KERNEL_DRIVER,,true,true,The file is signed and the signature was verified.,Microsoft Windows,Microsoft Windows Production PCA 2011
EW0001EOV,wanarp,Remote Access IP ARP Driver,Remote Access IP ARP Driver,C:\Windows\System32\drivers\wanarp.sys,cba7fc10229996e876c7d791222f9c17,System32\DRIVERS\wanarp.sys,SERVICE_KERNEL_DRIVER,,true,true,The file is signed and the signature was verified.,Microsoft Windows,Microsoft Windows Production PCA 2011
EW0001EOV,genericusbfn,Generic USB Function Class,,C:\Windows\System32\drivers\genericusbfn.sys,41dcca234221d0ddd9ee416385bd0952,\SystemRoot\System32\drivers\genericusbfn.sys,SERVICE_KERNEL_DRIVER,,true,true,The file is signed and the signature was verified.,Microsoft Windows,Microsoft Windows Production PCA 2011
EW0001EOV,MsLbfoProvider,Microsoft Load Balancing/Failover Provider,Microsoft Load Balancing/Failover Provider,C:\Windows\System32\drivers\MsLbfoProvider.sys,f3fb0edab83f42e552ac4cc95061b9c0,System32\drivers\MsLbfoProvider.sys,SERVICE_KERNEL_DRIVER,,true,true,The file is signed and the signature was verified.,Microsoft Windows,Microsoft Windows Production PCA 2011
EW0001EOV,vmgid,Microsoft Hyper-V Guest Infrastructure Driver,,C:\Windows\System32\drivers\vmgid.sys,60f3863a0646bc2991b8eebcbced0590,\SystemRoot\System32\drivers\vmgid.sys,SERVICE_KERNEL_DRIVER,,true,true,The file is signed and the signature was verified.,Microsoft Windows,Microsoft Windows Production PCA 2011
EW0001EOV,bxfcoe,QLogic FCoE Offload driver,,C:\Windows\System32\drivers\bxfcoe.sys,8c38ac12839e95d2138c826d1ff7b184,\SystemRoot\System32\drivers\bxfcoe.sys,SERVICE_KERNEL_DRIVER,,true,true,The file is signed and the signature was verified.,Microsoft Windows,Microsoft Windows Production PCA 2011
EW0001EOV,PhoneSvc,Phone Service,Manages the telephony state on the device,C:\Windows\System32\svchost.exe,2b896bd48f79676debeb14974ec5189d,C:\Windows\system32\svchost.exe -k LocalService,SERVICE_WIN32_SHARE_PROCESS,C:\Windows\System32\PhoneService.dll,true,true,The file is signed and the signature was verified.,Microsoft Windows,Microsoft Windows Production PCA 2011
EW0001EOV,WinNat,Windows NAT Driver,This service provides network address translation functionality,C:\Windows\System32\drivers\winnat.sys,b3fdd8e555b8a4622c9442782321d02a,system32\drivers\winnat.sys,SERVICE_KERNEL_DRIVER,,true,true,The file is signed and the signature was verified.,Microsoft Windows,Microsoft Windows Production PCA 2011
