hostname,name,descriptivename,description,path,md5,arguments,type,servicedll,pathsignatureexists,pathsignatureverified,pathsignaturedescription,pathcertificatesubject,pathcertificateissuer
EW0001EOV,SpbCx,Simple Peripheral Bus Support Library,,C:\Windows\System32\drivers\SpbCx.sys,efcd42858c604de6c2860e542149d24f,system32\drivers\SpbCx.sys,SERVICE_KERNEL_DRIVER,,true,true,The file is signed and the signature was verified.,Microsoft Windows,Microsoft Windows Production PCA 2011
EW0001EOV,WpnService,Windows Push Notifications System Service,This service runs in session 0 and hosts the notification platform and connection provider which handles the connection between the device and WNS server.,C:\Windows\System32\svchost.exe,2b896bd48f79676debeb14974ec5189d,C:\Windows\system32\svchost.exe -k netsvcs,SERVICE_WIN32_SHARE_PROCESS,C:\Windows\System32\WpnService.dll,true,true,The file is signed and the signature was verified.,Microsoft Windows,Microsoft Windows Production PCA 2011
EW0001EOV,HidUsb,Microsoft HID Class Driver,,C:\Windows\System32\drivers\hidusb.sys,aac1e923a825a43d24961a3dde27e260,\SystemRoot\System32\drivers\hidusb.sys,SERVICE_KERNEL_DRIVER,,true,true,The file is signed and the signature was verified.,Microsoft Windows,Microsoft Windows Production PCA 2011
EW0001EOV,bcmfn2,bcmfn2 Service,,C:\Windows\System32\drivers\bcmfn2.sys,618e4f7d77a7a0190e2fec2592124f3d,\SystemRoot\System32\drivers\bcmfn2.sys,SERVICE_KERNEL_DRIVER,,true,true,The file is signed and the signature was verified.,Microsoft Windows,Microsoft Windows Production PCA 2011
EW0001EOV,mshidumdf,Pass-through HID to UMDF Driver,,C:\Windows\System32\drivers\mshidumdf.sys,9981ee0168f3830f8c07c7c163447287,\SystemRoot\System32\drivers\mshidumdf.sys,SERVICE_KERNEL_DRIVER,,true,true,The file is signed and the signature was verified.,Microsoft Windows,Microsoft Windows Production PCA 2011
EW0001EOV,smphost,Microsoft Storage Spaces SMP,Host service for the Microsoft Storage Spaces management provider. If this service is stopped or disabled  Storage Spaces cannot be managed.,C:\Windows\System32\svchost.exe,2b896bd48f79676debeb14974ec5189d,C:\Windows\System32\svchost.exe -k smphost,SERVICE_WIN32_OWN_PROCESS,C:\Windows\System32\smphost.dll,true,true,The file is signed and the signature was verified.,Microsoft Windows,Microsoft Windows Production PCA 2011
EW0001EOV,RasSstp,WAN Miniport (SSTP),WAN Miniport (SSTP),C:\Windows\System32\drivers\rassstp.sys,c70dabe9da676ef2d6c1132e164ca251,\SystemRoot\System32\drivers\rassstp.sys,SERVICE_KERNEL_DRIVER,,true,true,The file is signed and the signature was verified.,Microsoft Windows,Microsoft Windows Production PCA 2011
EW0001EOV,AxInstSV,ActiveX Installer (AxInstSV),Provides User Account Control validation for the installation of ActiveX controls from the Internet and enables management of ActiveX control installation based on Group Policy settings. This service is started on demand and if disabled the installation of ActiveX controls will behave according to default browser settings.,C:\Windows\System32\svchost.exe,2b896bd48f79676debeb14974ec5189d,C:\Windows\system32\svchost.exe -k AxInstSVGroup,SERVICE_WIN32_SHARE_PROCESS,C:\Windows\System32\AxInstSv.dll,true,true,The file is signed and the signature was verified.,Microsoft Windows,Microsoft Windows Production PCA 2011
EW0001EOV,CoreMessagingRegistrar,CoreMessaging,Manages communication between system components.,C:\Windows\System32\svchost.exe,2b896bd48f79676debeb14974ec5189d,C:\Windows\system32\svchost.exe -k LocalServiceNoNetwork,SERVICE_WIN32_SHARE_PROCESS,C:\Windows\System32\coremessaging.dll,true,true,The file is signed and the signature was verified.,Microsoft Windows,Microsoft Windows Production PCA 2011
EW0001EOV,VaultSvc,Credential Manager,Provides secure storage and retrieval of credentials to users  applications and security service packages.,C:\Windows\System32\lsass.exe,66dfbd4320122771ebf9577f3ca7c73b,C:\Windows\system32\lsass.exe,SERVICE_WIN32_SHARE_PROCESS,C:\Windows\System32\vaultsvc.dll,true,true,The file is signed and the signature was verified.,Microsoft Windows,Microsoft Windows Production PCA 2011
EW0001EOV,amdxata,amdxata,,C:\Windows\System32\drivers\amdxata.sys,9689629e7784c2eb916727d8c40ad9ad,\SystemRoot\System32\drivers\amdxata.sys,SERVICE_KERNEL_DRIVER,,true,true,The file is signed and the signature was verified.,Microsoft Windows,Microsoft Windows Production PCA 2011
EW0001EOV,wmiApSrv,WMI Performance Adapter,Provides performance library information from Windows Management Instrumentation (WMI) providers to clients on the network. This service only runs when Performance Data Helper is activated.,C:\Windows\System32\wbem\WmiApSrv.exe,e2925f61f40cdab75d6213e5396ad8a8,C:\Windows\system32\wbem\WmiApSrv.exe,SERVICE_WIN32_OWN_PROCESS,,true,true,The file is signed and the signature was verified.,Microsoft Windows,Microsoft Windows Production PCA 2011
EW0001EOV,Audiosrv,Windows Audio,Manages audio for Windows-based programs.  If this service is stopped  audio devices and effects will not function properly.  If this service is disabled  any services that explicitly depend on it will fail to start,C:\Windows\System32\svchost.exe,2b896bd48f79676debeb14974ec5189d,C:\Windows\System32\svchost.exe -k LocalServiceNetworkRestricted,SERVICE_WIN32_OWN_PROCESS,C:\Windows\System32\audiosrv.dll,true,true,The file is signed and the signature was verified.,Microsoft Windows,Microsoft Windows Production PCA 2011
EW0001EOV,CmBatt,Microsoft ACPI Control Method Battery Driver,,C:\Windows\System32\drivers\CmBatt.sys,6d568b7344ecf4713edda5d71e981cae,\SystemRoot\System32\drivers\CmBatt.sys,SERVICE_KERNEL_DRIVER,,true,true,The file is signed and the signature was verified.,Microsoft Windows,Microsoft Windows Production PCA 2011
EW0001EOV,PcaSvc,Program Compatibility Assistant Service,This service provides support for the Program Compatibility Assistant (PCA).  PCA monitors programs installed and run by the user and detects known compatibility problems. If this service is stopped  PCA will not function properly.,C:\Windows\System32\svchost.exe,2b896bd48f79676debeb14974ec5189d,C:\Windows\system32\svchost.exe -k LocalSystemNetworkRestricted,SERVICE_WIN32_SHARE_PROCESS,C:\Windows\System32\pcasvc.dll,true,true,The file is signed and the signature was verified.,Microsoft Windows,Microsoft Windows Production PCA 2011
EW0001EOV,CDPUserSvc_6934d,CDPUserSvc_6934d,,C:\Windows\System32\svchost.exe,2b896bd48f79676debeb14974ec5189d,C:\Windows\system32\svchost.exe -k UnistackSvcGroup,SERVICE_WIN32_SHARE_PROCESS,,true,true,The file is signed and the signature was verified.,Microsoft Windows,Microsoft Windows Production PCA 2011
EW0001EOV,WdNisSvc,Windows Defender Network Inspection Service,Helps guard against intrusion attempts targeting known and newly discovered vulnerabilities in network protocols,C:\Program Files\Windows Defender\NisSrv.exe,1cdc38cabf3db1dedc4e3282b5a45c41,C:\Program Files\Windows Defender\NisSrv.exe,SERVICE_WIN32_OWN_PROCESS,,true,true,The file is signed and the signature was verified.,Microsoft Windows,Microsoft Windows Production PCA 2011
EW0001EOV,Rasl2tp,WAN Miniport (L2TP),WAN Miniport (L2TP),C:\Windows\System32\drivers\rasl2tp.sys,1d0a82d8629857d6a8d8336e85072d6f,\SystemRoot\System32\drivers\rasl2tp.sys,SERVICE_KERNEL_DRIVER,,true,true,The file is signed and the signature was verified.,Microsoft Windows,Microsoft Windows Production PCA 2011
EW0001EOV,BrokerInfrastructure,Background Tasks Infrastructure Service,Windows infrastructure service that controls which background tasks can run on the system.,C:\Windows\System32\svchost.exe,2b896bd48f79676debeb14974ec5189d,C:\Windows\system32\svchost.exe -k DcomLaunch,SERVICE_WIN32_SHARE_PROCESS,C:\Windows\System32\bisrv.dll,true,true,The file is signed and the signature was verified.,Microsoft Windows,Microsoft Windows Production PCA 2011
EW0001EOV,wanarpv6,Remote Access IPv6 ARP Driver,Remote Access IPv6 ARP Driver,C:\Windows\System32\drivers\wanarp.sys,cba7fc10229996e876c7d791222f9c17,System32\DRIVERS\wanarp.sys,SERVICE_KERNEL_DRIVER,,true,true,The file is signed and the signature was verified.,Microsoft Windows,Microsoft Windows Production PCA 2011
EW0001EOV,NetBT,NetBT,This service implements NetBios over TCP/IP.,C:\Windows\System32\drivers\netbt.sys,703029723a2baf3b64b823d37a3746a0,System32\DRIVERS\netbt.sys,SERVICE_KERNEL_DRIVER,,true,true,The file is signed and the signature was verified.,Microsoft Windows,Microsoft Windows Production PCA 2011
EW0001EOV,WIMMount,WIMMount,WIM Image mount service driver,C:\Windows\System32\drivers\wimmount.sys,5343fceb587b6aa90efc5c25fa23aeac,system32\drivers\wimmount.sys,SERVICE_FILE_SYSTEM_DRIVER,,true,true,The file is signed and the signature was verified.,Microsoft Windows,Microsoft Windows Production PCA 2011
EW0001EOV,WacomPen,Wacom Serial Pen HID Driver,,C:\Windows\System32\drivers\wacompen.sys,1defd2baa6045edbaa02d28e8e705f14,\SystemRoot\System32\drivers\wacompen.sys,SERVICE_KERNEL_DRIVER,,true,true,The file is signed and the signature was verified.,Microsoft Windows,Microsoft Windows Production PCA 2011
EW0001EOV,IpFilterDriver,IP Traffic Filter Driver,IP Traffic Filter Driver,C:\Windows\System32\drivers\ipfltdrv.sys,5b949a39428ed3a9672560b6cd03f32c,system32\DRIVERS\ipfltdrv.sys,SERVICE_KERNEL_DRIVER,,true,true,The file is signed and the signature was verified.,Microsoft Windows,Microsoft Windows Production PCA 2011
EW0001EOV,PrintNotify,Printer Extensions and Notifications,This service opens custom printer dialog boxes and handles notifications from a remote print server or a printer. If you turn off this service  you won’t be able to see printer extensions or notifications.,C:\Windows\System32\svchost.exe,2b896bd48f79676debeb14974ec5189d,C:\Windows\system32\svchost.exe -k print,SERVICE_WIN32_SHARE_PROCESS,C:\Windows\System32\spool\drivers\x64\3\PrintConfig.dll,true,true,The file is signed and the signature was verified.,Microsoft Windows,Microsoft Windows Production PCA 2011
EW0001EOV,lmhosts,TCP/IP NetBIOS Helper,Provides support for the NetBIOS over TCP/IP (NetBT) service and NetBIOS name resolution for clients on the network  therefore enabling users to share files  print  and log on to the network. If this service is stopped  these functions might be unavailable. If this service is disabled  any services that explicitly depend on it will fail to start.,C:\Windows\System32\svchost.exe,2b896bd48f79676debeb14974ec5189d,C:\Windows\System32\svchost.exe -k LocalServiceNetworkRestricted,SERVICE_WIN32_SHARE_PROCESS,C:\Windows\System32\lmhsvc.dll,true,true,The file is signed and the signature was verified.,Microsoft Windows,Microsoft Windows Production PCA 2011
EW0001EOV,percsas3i,percsas3i,,C:\Windows\System32\drivers\percsas3i.sys,c085c9364b11a0c29919b4f1565d8ff0,\SystemRoot\System32\drivers\percsas3i.sys,SERVICE_KERNEL_DRIVER,,true,true,The file is signed and the signature was verified.,Microsoft Windows,Microsoft Windows Production PCA 2011
EW0001EOV,iScsiPrt,iScsiPort Driver,,C:\Windows\System32\drivers\msiscsi.sys,0842344cd4075b316410850c4e2e02ff,\SystemRoot\System32\drivers\msiscsi.sys,SERVICE_KERNEL_DRIVER,,true,true,The file is signed and the signature was verified.,Microsoft Windows,Microsoft Windows Production PCA 2011
EW0001EOV,vmicshutdown,Hyper-V Guest Shutdown Service,Provides a mechanism to shut down the operating system of this virtual machine from the management interfaces on the physical computer.,C:\Windows\System32\svchost.exe,2b896bd48f79676debeb14974ec5189d,C:\Windows\system32\svchost.exe -k LocalSystemNetworkRestricted,SERVICE_WIN32_SHARE_PROCESS,C:\Windows\System32\icsvc.dll,true,true,The file is signed and the signature was verified.,Microsoft Windows,Microsoft Windows Production PCA 2011
EW0001EOV,StorSvc,Storage Service,Provides enabling services for storage settings and external storage expansion,C:\Windows\System32\svchost.exe,2b896bd48f79676debeb14974ec5189d,C:\Windows\System32\svchost.exe -k LocalSystemNetworkRestricted,SERVICE_WIN32_SHARE_PROCESS,C:\Windows\System32\StorSvc.dll,true,true,The file is signed and the signature was verified.,Microsoft Windows,Microsoft Windows Production PCA 2011
EW0001EOV,vmickvpexchange,Hyper-V Data Exchange Service,Provides a mechanism to exchange data between the virtual machine and the operating system running on the physical computer.,C:\Windows\System32\svchost.exe,2b896bd48f79676debeb14974ec5189d,C:\Windows\system32\svchost.exe -k LocalSystemNetworkRestricted,SERVICE_WIN32_SHARE_PROCESS,C:\Windows\System32\icsvc.dll,true,true,The file is signed and the signature was verified.,Microsoft Windows,Microsoft Windows Production PCA 2011
EW0001EOV,partmgr,Partition driver,Disk class filter driver that manages and auctions out partitions to volume managers.,C:\Windows\System32\drivers\partmgr.sys,a53bf3d70bd253833d32700abf9ea8fa,\SystemRoot\System32\drivers\partmgr.sys,SERVICE_KERNEL_DRIVER,,true,true,The file is signed and the signature was verified.,Microsoft Windows,Microsoft Windows Production PCA 2011
EW0001EOV,FileInfo,File Information FS MiniFilter,Collects information about files in memory to be consumed by other system services.,C:\Windows\System32\drivers\fileinfo.sys,1e2515baacef0464cfac49f2e0c77a14,\SystemRoot\System32\drivers\fileinfo.sys,SERVICE_FILE_SYSTEM_DRIVER,,true,true,The file is signed and the signature was verified.,Microsoft Windows,Microsoft Windows Production PCA 2011
EW0001EOV,srvnet,srvnet,,C:\Windows\System32\drivers\srvnet.sys,892b8d5b8dcfd668cd484ab9e9901fc5,System32\DRIVERS\srvnet.sys,SERVICE_FILE_SYSTEM_DRIVER,,true,true,The file is signed and the signature was verified.,Microsoft Windows,Microsoft Windows Production PCA 2011
EW0001EOV,bthserv,Bluetooth Support Service,The Bluetooth service supports discovery and association of remote Bluetooth devices.  Stopping or disabling this service may cause already installed Bluetooth devices to fail to operate properly and prevent new devices from being discovered or associated.,C:\Windows\System32\svchost.exe,2b896bd48f79676debeb14974ec5189d,C:\Windows\system32\svchost.exe -k LocalService,SERVICE_WIN32_SHARE_PROCESS,C:\Windows\System32\bthserv.dll,true,true,The file is signed and the signature was verified.,Microsoft Windows,Microsoft Windows Production PCA 2011
EW0001EOV,spaceport,Storage Spaces Driver,,C:\Windows\System32\drivers\spaceport.sys,0aca56b5dc5a0d95996f6a1d59a2cc74,\SystemRoot\System32\drivers\spaceport.sys,SERVICE_KERNEL_DRIVER,,true,true,The file is signed and the signature was verified.,Microsoft Windows,Microsoft Windows Production PCA 2011
EW0001EOV,RemoteAccess,Routing and Remote Access,Offers routing services to businesses in local area and wide area network environments.,C:\Windows\System32\svchost.exe,2b896bd48f79676debeb14974ec5189d,C:\Windows\System32\svchost.exe -k netsvcs,SERVICE_WIN32_SHARE_PROCESS,C:\Windows\System32\mprdim.dll,true,true,The file is signed and the signature was verified.,Microsoft Windows,Microsoft Windows Production PCA 2011
EW0001EOV,UrsChipidea,Chipidea USB Role-Switch Driver,,C:\Windows\System32\drivers\urschipidea.sys,9de280609345dfde07c7af2a9d458447,\SystemRoot\System32\drivers\urschipidea.sys,SERVICE_KERNEL_DRIVER,,true,true,The file is signed and the signature was verified.,Microsoft Windows,Microsoft Windows Production PCA 2011
EW0001EOV,AppvStrm,AppvStrm,Microsoft App-V Streaming Mini-Filter Driver,C:\Windows\System32\drivers\AppVStrm.sys,f3185962ef9c6f0dc6c6f08d5a50c7c3,\SystemRoot\system32\drivers\AppvStrm.sys,SERVICE_FILE_SYSTEM_DRIVER,,true,true,The file is signed and the signature was verified.,Microsoft Windows,Microsoft Windows Production PCA 2011
EW0001EOV,usbprint,Microsoft USB PRINTER Class,,C:\Windows\System32\drivers\usbprint.sys,e53527052a4503b7d850645f439eedb6,\SystemRoot\System32\drivers\usbprint.sys,SERVICE_KERNEL_DRIVER,,true,true,The file is signed and the signature was verified.,Microsoft Windows,Microsoft Windows Production PCA 2011
EW0001EOV,BFE,Base Filtering Engine,The Base Filtering Engine (BFE) is a service that manages firewall and Internet Protocol security (IPsec) policies and implements user mode filtering. Stopping or disabling the BFE service will significantly reduce the security of the system. It will also result in unpredictable behavior in IPsec management and firewall applications.,C:\Windows\System32\svchost.exe,2b896bd48f79676debeb14974ec5189d,C:\Windows\system32\svchost.exe -k LocalServiceNoNetwork,SERVICE_WIN32_SHARE_PROCESS,C:\Windows\System32\BFE.DLL,true,true,The file is signed and the signature was verified.,Microsoft Windows,Microsoft Windows Production PCA 2011
EW0001EOV,intelide,intelide,,C:\Windows\System32\drivers\intelide.sys,f34669c146f170c9739db7cf49dda129,\SystemRoot\System32\drivers\intelide.sys,SERVICE_KERNEL_DRIVER,,true,true,The file is signed and the signature was verified.,Microsoft Windows,Microsoft Windows Production PCA 2011
EW0001EOV,swenum,Software Bus Driver,,C:\Windows\System32\drivers\swenum.sys,46ae501eb78e8686cecc6ed92de87056,\SystemRoot\System32\drivers\swenum.sys,SERVICE_KERNEL_DRIVER,,true,true,The file is signed and the signature was verified.,Microsoft Windows,Microsoft Windows Production PCA 2011
EW0001EOV,ndproxy,@%SystemRoot%\system32\drivers\todo.sys -101;NDIS Proxy,,C:\Windows\System32\drivers\ndproxy.sys,4125bf871e76639f325f8d42f248d272,System32\DRIVERS\NDProxy.sys,SERVICE_KERNEL_DRIVER,,true,true,The file is signed and the signature was verified.,Microsoft Windows,Microsoft Windows Production PCA 2011
EW0001EOV,usbccgp,Microsoft USB Generic Parent Driver,,C:\Windows\System32\drivers\usbccgp.sys,53c5b359803e071813a44750480d66d2,\SystemRoot\System32\drivers\usbccgp.sys,SERVICE_KERNEL_DRIVER,,true,true,The file is signed and the signature was verified.,Microsoft Windows,Microsoft Windows Production PCA 2011
EW0001EOV,tiledatamodelsvc,Tile Data model server,Tile Server for tile updates.,C:\Windows\System32\svchost.exe,2b896bd48f79676debeb14974ec5189d,C:\Windows\system32\svchost.exe -k appmodel,SERVICE_WIN32_SHARE_PROCESS,C:\Windows\System32\tileobjserver.dll,true,true,The file is signed and the signature was verified.,Microsoft Windows,Microsoft Windows Production PCA 2011
EW0001EOV,Tcpip6,@todo.dll -100;Microsoft IPv6 Protocol Driver,@todo.dll -100;Microsoft IPv6 Protocol Driver,C:\Windows\System32\drivers\tcpip.sys,58b3c0c1b6c11d3f2809640016e29eba,System32\drivers\tcpip.sys,SERVICE_KERNEL_DRIVER,,true,true,The file is signed and the signature was verified.,Microsoft Windows,Microsoft Windows Production PCA 2011
EW0001EOV,flpydisk,Floppy Disk Driver,,C:\Windows\System32\drivers\flpydisk.sys,d079d7969d105f1c925a39557df1c691,\SystemRoot\System32\drivers\flpydisk.sys,SERVICE_KERNEL_DRIVER,,true,true,The file is signed and the signature was verified.,Microsoft Windows,Microsoft Windows Production PCA 2011
EW0001EOV,SCPolicySvc,Smart Card Removal Policy,Allows the system to be configured to lock the user desktop upon smart card removal.,C:\Windows\System32\svchost.exe,2b896bd48f79676debeb14974ec5189d,C:\Windows\system32\svchost.exe -k netsvcs,SERVICE_WIN32_SHARE_PROCESS,C:\Windows\System32\certprop.dll,true,true,The file is signed and the signature was verified.,Microsoft Windows,Microsoft Windows Production PCA 2011
EW0001EOV,RpcSs,Remote Procedure Call (RPC),The RPCSS service is the Service Control Manager for COM and DCOM servers. It performs object activations requests  object exporter resolutions and distributed garbage collection for COM and DCOM servers. If this service is stopped or disabled  programs using COM or DCOM will not function properly. It is strongly recommended that you have the RPCSS service running.,C:\Windows\System32\svchost.exe,2b896bd48f79676debeb14974ec5189d,C:\Windows\system32\svchost.exe -k rpcss,SERVICE_WIN32_SHARE_PROCESS,C:\Windows\System32\rpcss.dll,true,true,The file is signed and the signature was verified.,Microsoft Windows,Microsoft Windows Production PCA 2011
EW0001EOV,RasAgileVpn,WAN Miniport (IKEv2),WAN Miniport (IKEv2),C:\Windows\System32\drivers\agilevpn.sys,34114914ec407d699acf1e8ef303ad9e,\SystemRoot\System32\drivers\AgileVpn.sys,SERVICE_KERNEL_DRIVER,,true,true,The file is signed and the signature was verified.,Microsoft Windows,Microsoft Windows Production PCA 2011
EW0001EOV,umbus,UMBus Enumerator Driver,,C:\Windows\System32\drivers\umbus.sys,8d6fcf15412b9ce7b1d0707f53f1f1ed,\SystemRoot\System32\drivers\umbus.sys,SERVICE_KERNEL_DRIVER,,true,true,The file is signed and the signature was verified.,Microsoft Windows,Microsoft Windows Production PCA 2011
EW0001EOV,iaStorV,Intel RAID Controller Windows 7,,C:\Windows\System32\drivers\iaStorV.sys,3202b64b240d3a0463072aaeae20ea70,\SystemRoot\System32\drivers\iaStorV.sys,SERVICE_KERNEL_DRIVER,,true,true,The file is signed and the signature was verified.,Microsoft Windows,Microsoft Windows Production PCA 2011
EW0001EOV,UcmTcpciCx0101,UCM-TCPCI KMDF Class Extension,,C:\Windows\System32\drivers\UcmTcpciCx.sys,069c3dcb62133fcaa19c2a177f853da9,System32\Drivers\UcmTcpciCx.sys,SERVICE_KERNEL_DRIVER,,true,true,The file is signed and the signature was verified.,Microsoft Windows,Microsoft Windows Production PCA 2011
EW0001EOV,gpsvc,Group Policy Client,The service is responsible for applying settings configured by administrators for the computer and users through the Group Policy component. If the service is disabled  the settings will not be applied and applications and components will not be manageable through Group Policy. Any components or applications that depend on the Group Policy component might not be functional if the service is disabled.,C:\Windows\System32\svchost.exe,2b896bd48f79676debeb14974ec5189d,C:\Windows\system32\svchost.exe -k netsvcs,SERVICE_WIN32_SHARE_PROCESS,C:\Windows\System32\gpsvc.dll,true,true,The file is signed and the signature was verified.,Microsoft Windows,Microsoft Windows Production PCA 2011
EW0001EOV,vmicheartbeat,Hyper-V Heartbeat Service,Monitors the state of this virtual machine by reporting a heartbeat at regular intervals. This service helps you identify running virtual machines that have stopped responding.,C:\Windows\System32\svchost.exe,2b896bd48f79676debeb14974ec5189d,C:\Windows\system32\svchost.exe -k ICService,SERVICE_WIN32_SHARE_PROCESS,C:\Windows\System32\icsvc.dll,true,true,The file is signed and the signature was verified.,Microsoft Windows,Microsoft Windows Production PCA 2011
EW0001EOV,WdiSystemHost,Diagnostic System Host,The Diagnostic System Host is used by the Diagnostic Policy Service to host diagnostics that need to run in a Local System context.  If this service is stopped  any diagnostics that depend on it will no longer function.,C:\Windows\System32\svchost.exe,2b896bd48f79676debeb14974ec5189d,C:\Windows\System32\svchost.exe -k LocalSystemNetworkRestricted,SERVICE_WIN32_SHARE_PROCESS,C:\Windows\System32\wdi.dll,true,true,The file is signed and the signature was verified.,Microsoft Windows,Microsoft Windows Production PCA 2011
EW0001EOV,udfs,udfs,Reads/Writes UDF 1.02 1.5 2.0x 2.5 disc formats  usually found on C/DVD discs. (Core) (All pieces),C:\Windows\System32\drivers\udfs.sys,537b0d021ac2fc7b9518ed3026ed2bf4,system32\DRIVERS\udfs.sys,SERVICE_FILE_SYSTEM_DRIVER,,true,true,The file is signed and the signature was verified.,Microsoft Windows,Microsoft Windows Production PCA 2011
EW0001EOV,tzautoupdate,Auto Time Zone Updater,Automatically sets the system time zone.,C:\Windows\System32\svchost.exe,2b896bd48f79676debeb14974ec5189d,C:\Windows\system32\svchost.exe -k LocalService,SERVICE_WIN32_SHARE_PROCESS,C:\Windows\System32\tzautoupdate.dll,true,true,The file is signed and the signature was verified.,Microsoft Windows,Microsoft Windows Production PCA 2011
EW0001EOV,kbdclass,Keyboard Class Driver,,C:\Windows\System32\drivers\kbdclass.sys,99a3557fc21e2b4cb1cad481636e442a,\SystemRoot\System32\drivers\kbdclass.sys,SERVICE_KERNEL_DRIVER,,true,true,The file is signed and the signature was verified.,Microsoft Windows,Microsoft Windows Production PCA 2011
EW0001EOV,wcnfs,Windows Container Name Virtualization,Virtualizes file system names for processes running within Windows Containers,C:\Windows\System32\drivers\wcnfs.sys,5716d458a5f2d9416fc94756dcdf6d0b,\SystemRoot\system32\drivers\wcnfs.sys,SERVICE_FILE_SYSTEM_DRIVER,,true,true,The file is signed and the signature was verified.,Microsoft Windows,Microsoft Windows Production PCA 2011
EW0001EOV,scfilter,Smart card PnP Class Filter Driver,Smart card reader filter driver enabling smart card PnP.,C:\Windows\System32\drivers\scfilter.sys,a513b5500fdb999f3a194bb4f4724fdb,System32\DRIVERS\scfilter.sys,SERVICE_KERNEL_DRIVER,,true,true,The file is signed and the signature was verified.,Microsoft Windows,Microsoft Windows Production PCA 2011
EW0001EOV,b06bdrv,QLogic Network Adapter VBD,,C:\Windows\System32\drivers\bxvbda.sys,402df342a39d2ca053c2e678af21c52e,\SystemRoot\System32\drivers\bxvbda.sys,SERVICE_KERNEL_DRIVER,,true,true,The file is signed and the signature was verified.,Microsoft Windows,Microsoft Windows Production PCA 2011
EW0001EOV,storflt,Microsoft Hyper-V Storage Accelerator,,C:\Windows\System32\drivers\vmstorfl.sys,033d66597d2c5a371e84a64cc5177c25,\SystemRoot\System32\drivers\vmstorfl.sys,SERVICE_KERNEL_DRIVER,,true,true,The file is signed and the signature was verified.,Microsoft Windows,Microsoft Windows Production PCA 2011
EW0001EOV,rdbss,Redirected Buffering Sub System,Provides the framework for network mini-redirectors,C:\Windows\System32\drivers\rdbss.sys,b5e4fa8d4daa87268ab74d8e8c127db6,system32\DRIVERS\rdbss.sys,SERVICE_FILE_SYSTEM_DRIVER,,true,true,The file is signed and the signature was verified.,Microsoft Windows,Microsoft Windows Production PCA 2011
