hostname,name,descriptivename,description,path,md5,arguments,type,servicedll,pathsignatureexists,pathsignatureverified,pathsignaturedescription,pathcertificatesubject,pathcertificateissuer
EW0001EOV,arcsas,Adaptec SAS/SATA-II RAID Storport's Miniport Driver,,C:\Windows\System32\drivers\arcsas.sys,cb9466d9610bdc276dcb691d0053614c,\SystemRoot\System32\drivers\arcsas.sys,SERVICE_KERNEL_DRIVER,,true,true,The file is signed and the signature was verified.,Microsoft Windows,Microsoft Windows Production PCA 2011
EW0001EOV,GpuEnergyDrv,GPU Energy Driver,Computes energy consumed by GPU,C:\Windows\System32\drivers\gpuenergydrv.sys,c6548c0fd720847040083fa859f3c8cc,System32\drivers\gpuenergydrv.sys,SERVICE_KERNEL_DRIVER,,true,true,The file is signed and the signature was verified.,Microsoft Windows,Microsoft Windows Production PCA 2011
EW0001EOV,WinHttpAutoProxySvc,WinHTTP Web Proxy Auto-Discovery Service,WinHTTP implements the client HTTP stack and provides developers with a Win32 API and COM Automation component for sending HTTP requests and receiving responses. In addition  WinHTTP provides support for auto-discovering a proxy configuration via its implementation of the Web Proxy Auto-Discovery (WPAD) protocol.,C:\Windows\System32\svchost.exe,2b896bd48f79676debeb14974ec5189d,C:\Windows\system32\svchost.exe -k LocalService,SERVICE_WIN32_SHARE_PROCESS,C:\Windows\System32\winhttp.dll,true,true,The file is signed and the signature was verified.,Microsoft Windows,Microsoft Windows Production PCA 2011
EW0001EOV,UrsSynopsys,Synopsys USB Role-Switch Driver,,C:\Windows\System32\drivers\urssynopsys.sys,e5876c94d706026dadaeba98e42d460f,\SystemRoot\System32\drivers\urssynopsys.sys,SERVICE_KERNEL_DRIVER,,true,true,The file is signed and the signature was verified.,Microsoft Windows,Microsoft Windows Production PCA 2011
EW0001EOV,volume,Volume driver,,C:\Windows\System32\drivers\volume.sys,d099bdbd118c2c1250d09b7088c584bf,\SystemRoot\System32\drivers\volume.sys,SERVICE_KERNEL_DRIVER,,true,true,The file is signed and the signature was verified.,Microsoft Windows,Microsoft Windows Production PCA 2011
EW0001EOV,AppVClient,Microsoft App-V Client,Manages App-V users and virtual applications,C:\Windows\System32\AppVClient.exe,5c3c130b7eeb84e38d7665bff46d8c35,C:\Windows\system32\AppVClient.exe,SERVICE_WIN32_OWN_PROCESS,,true,true,The file is signed and the signature was verified.,Microsoft Windows,Microsoft Windows Production PCA 2011
EW0001EOV,hyperkbd,hyperkbd,,C:\Windows\System32\drivers\hyperkbd.sys,dbbbf583b568ddf056f27fde1aac13ad,\SystemRoot\System32\drivers\hyperkbd.sys,SERVICE_KERNEL_DRIVER,,true,true,The file is signed and the signature was verified.,Microsoft Windows,Microsoft Windows Production PCA 2011
EW0001EOV,UsoSvc,Update Orchestrator Service for Windows Update,UsoSvc,C:\Windows\System32\svchost.exe,2b896bd48f79676debeb14974ec5189d,C:\Windows\system32\svchost.exe -k netsvcs,SERVICE_WIN32_SHARE_PROCESS,C:\Windows\System32\usocore.dll,true,true,The file is signed and the signature was verified.,Microsoft Windows,Microsoft Windows Production PCA 2011
EW0001EOV,iphlpsvc,IP Helper,Provides tunnel connectivity using IPv6 transition technologies (6to4  ISATAP  Port Proxy  and Teredo)  and IP-HTTPS. If this service is stopped  the computer will not have the enhanced connectivity benefits that these technologies offer.,C:\Windows\System32\svchost.exe,2b896bd48f79676debeb14974ec5189d,C:\Windows\System32\svchost.exe -k NetSvcs,SERVICE_WIN32_SHARE_PROCESS,C:\Windows\System32\iphlpsvc.dll,true,true,The file is signed and the signature was verified.,Microsoft Windows,Microsoft Windows Production PCA 2011
EW0001EOV,Psched,QoS Packet Scheduler,QoS Packet Scheduler,C:\Windows\System32\drivers\pacer.sys,0936367b1cd1dd1d1122e9805f84eb39,System32\drivers\pacer.sys,SERVICE_KERNEL_DRIVER,,true,true,The file is signed and the signature was verified.,Microsoft Windows,Microsoft Windows Production PCA 2011
EW0001EOV,ibbus,Mellanox InfiniBand Bus/AL (Filter Driver),,C:\Windows\System32\drivers\ibbus.sys,9b601562da47f8cc56894372757271a1,\SystemRoot\System32\drivers\ibbus.sys,SERVICE_KERNEL_DRIVER,,true,true,The file is signed and the signature was verified.,Microsoft Windows,Microsoft Windows Production PCA 2011
EW0001EOV,LanmanWorkstation,Workstation,Creates and maintains client network connections to remote servers using the SMB protocol. If this service is stopped  these connections will be unavailable. If this service is disabled  any services that explicitly depend on it will fail to start.,C:\Windows\System32\svchost.exe,2b896bd48f79676debeb14974ec5189d,C:\Windows\System32\svchost.exe -k NetworkService,SERVICE_WIN32_SHARE_PROCESS,C:\Windows\System32\wkssvc.dll,true,true,The file is signed and the signature was verified.,Microsoft Windows,Microsoft Windows Production PCA 2011
EW0001EOV,Modem,Modem,,C:\Windows\System32\drivers\modem.sys,1a46164fe117ae7d1f9d7ce714555652,system32\drivers\modem.sys,SERVICE_KERNEL_DRIVER,,true,true,The file is signed and the signature was verified.,Microsoft Windows,Microsoft Windows Production PCA 2011
EW0001EOV,scmbus,Microsoft Storage Class Memory Bus Driver,,C:\Windows\System32\drivers\scmbus.sys,79e2501e7a758d836315a671bc918299,\SystemRoot\System32\drivers\scmbus.sys,SERVICE_KERNEL_DRIVER,,true,true,The file is signed and the signature was verified.,Microsoft Windows,Microsoft Windows Production PCA 2011
EW0001EOV,VMBusHID,VMBusHID,,C:\Windows\System32\drivers\VMBusHID.sys,767ddbcbc72661b4650235e9821654b7,\SystemRoot\System32\drivers\VMBusHID.sys,SERVICE_KERNEL_DRIVER,,true,true,The file is signed and the signature was verified.,Microsoft Windows,Microsoft Windows Production PCA 2011
EW0001EOV,mrxsmb10,SMB 1.x MiniRedirector,Implements the SMB 1.x (CIFS) protocol. This protocol provides connectivity to network resources on pre-Windows Vista servers,C:\Windows\System32\drivers\mrxsmb10.sys,9896f1901649ee43e3375e0156992551,system32\DRIVERS\mrxsmb10.sys,SERVICE_FILE_SYSTEM_DRIVER,,true,true,The file is signed and the signature was verified.,Microsoft Windows,Microsoft Windows Production PCA 2011
EW0001EOV,pciide,pciide,,C:\Windows\System32\drivers\pciide.sys,afde4ac894b4ad959e8c5293e64f26e2,\SystemRoot\System32\drivers\pciide.sys,SERVICE_KERNEL_DRIVER,,true,true,The file is signed and the signature was verified.,Microsoft Windows,Microsoft Windows Production PCA 2011
EW0001EOV,clreg,Virtual Registry for Containers,Provides a virtual registry view for processes running within Windows Containers,C:\Windows\System32\drivers\registry.sys,e14820f273fe0424d6a0130b8c460d01,\SystemRoot\System32\drivers\registry.sys,SERVICE_KERNEL_DRIVER,,true,true,The file is signed and the signature was verified.,Microsoft Windows,Microsoft Windows Production PCA 2011
EW0001EOV,Filetrace,Filetrace,ETW File Trace Filter,C:\Windows\System32\drivers\filetrace.sys,51e764ef40796df4965571a209851a9c,system32\drivers\filetrace.sys,SERVICE_FILE_SYSTEM_DRIVER,,true,true,The file is signed and the signature was verified.,Microsoft Windows,Microsoft Windows Production PCA 2011
EW0001EOV,UdeCx,USB Device Emulation Support Library,,C:\Windows\System32\drivers\Udecx.sys,5b280c429cb9312c99c2a1e890651a0c,system32\drivers\udecx.sys,SERVICE_KERNEL_DRIVER,,true,true,The file is signed and the signature was verified.,Microsoft Windows,Microsoft Windows Production PCA 2011
EW0001EOV,NgcCtnrSvc,Microsoft Passport Container,Manages local user identity keys used to authenticate user to identity providers as well as TPM virtual smart cards. If this service is disabled  local user identity keys and TPM virtual smart cards will not be accessible. It is recommended that you do not reconfigure this service.,C:\Windows\System32\svchost.exe,2b896bd48f79676debeb14974ec5189d,C:\Windows\system32\svchost.exe -k LocalServiceNetworkRestricted,SERVICE_WIN32_SHARE_PROCESS,C:\Windows\System32\NgcCtnrSvc.dll,true,true,The file is signed and the signature was verified.,Microsoft Windows,Microsoft Windows Production PCA 2011
EW0001EOV,DPS,Diagnostic Policy Service,The Diagnostic Policy Service enables problem detection  troubleshooting and resolution for Windows components.  If this service is stopped  diagnostics will no longer function.,C:\Windows\System32\svchost.exe,2b896bd48f79676debeb14974ec5189d,C:\Windows\System32\svchost.exe -k LocalServiceNoNetwork,SERVICE_WIN32_SHARE_PROCESS,C:\Windows\System32\dps.dll,true,true,The file is signed and the signature was verified.,Microsoft Windows,Microsoft Windows Production PCA 2011
EW0001EOV,msgpiowin32,Common Driver for Buttons  DockMode and Laptop/Slate Indicator,,C:\Windows\System32\drivers\msgpiowin32.sys,092d72355ca92c9b43b1e33a230b5bb0,\SystemRoot\System32\drivers\msgpiowin32.sys,SERVICE_KERNEL_DRIVER,,true,true,The file is signed and the signature was verified.,Microsoft Windows,Microsoft Windows Production PCA 2011
EW0001EOV,NgcSvc,Microsoft Passport,Provides process isolation for cryptographic keys used to authenticate to a user’s associated identity providers. If this service is disabled  all uses and management of these keys will not be available  which includes machine logon and single-sign on for apps and websites. This service starts and stops automatically. It is recommended that you do not reconfigure this service.,C:\Windows\System32\svchost.exe,2b896bd48f79676debeb14974ec5189d,C:\Windows\system32\svchost.exe -k LocalSystemNetworkRestricted,SERVICE_WIN32_SHARE_PROCESS,C:\Windows\System32\ngcsvc.dll,true,true,The file is signed and the signature was verified.,Microsoft Windows,Microsoft Windows Production PCA 2011
EW0001EOV,intelppm,Intel Processor Driver,,C:\Windows\System32\drivers\intelppm.sys,0bf1bf46ce5478baa50c7bf620780b04,\SystemRoot\System32\drivers\intelppm.sys,SERVICE_KERNEL_DRIVER,,true,true,The file is signed and the signature was verified.,Microsoft Windows,Microsoft Windows Production PCA 2011
EW0001EOV,FontCache,Windows Font Cache Service,Optimizes performance of applications by caching commonly used font data. Applications will start this service if it is not already running. It can be disabled  though doing so will degrade application performance.,C:\Windows\System32\svchost.exe,2b896bd48f79676debeb14974ec5189d,C:\Windows\system32\svchost.exe -k LocalService,SERVICE_WIN32_SHARE_PROCESS,C:\Windows\System32\FntCache.dll,true,true,The file is signed and the signature was verified.,Microsoft Windows,Microsoft Windows Production PCA 2011
EW0001EOV,AmdPPM,AMD Processor Driver,,C:\Windows\System32\drivers\amdppm.sys,176b9447882b8a1739401b47df2e93af,\SystemRoot\System32\drivers\amdppm.sys,SERVICE_KERNEL_DRIVER,,true,true,The file is signed and the signature was verified.,Microsoft Windows,Microsoft Windows Production PCA 2011
EW0001EOV,pcw,Performance Counters for Windows Driver,,C:\Windows\System32\drivers\pcw.sys,29f2751dc3e01bea6b173f85226b329b,\SystemRoot\System32\drivers\pcw.sys,SERVICE_KERNEL_DRIVER,,true,true,The file is signed and the signature was verified.,Microsoft Windows,Microsoft Windows Production PCA 2011
EW0001EOV,DcomLaunch,DCOM Server Process Launcher,The DCOMLAUNCH service launches COM and DCOM servers in response to object activation requests. If this service is stopped or disabled  programs using COM or DCOM will not function properly. It is strongly recommended that you have the DCOMLAUNCH service running.,C:\Windows\System32\svchost.exe,2b896bd48f79676debeb14974ec5189d,C:\Windows\system32\svchost.exe -k DcomLaunch,SERVICE_WIN32_SHARE_PROCESS,C:\Windows\System32\rpcss.dll,true,true,The file is signed and the signature was verified.,Microsoft Windows,Microsoft Windows Production PCA 2011
EW0001EOV,monitor,Microsoft Monitor Class Function Driver Service,,C:\Windows\System32\drivers\monitor.sys,f9cf7a2f10e6d89433fd3e919d514006,\SystemRoot\System32\drivers\monitor.sys,SERVICE_KERNEL_DRIVER,,true,true,The file is signed and the signature was verified.,Microsoft Windows,Microsoft Windows Production PCA 2011
EW0001EOV,dam,Desktop Activity Moderator Driver,Controls activity of desktop applications,C:\Windows\System32\drivers\dam.sys,9ede394512fc1b029c6d6ad2d4c97614,system32\drivers\dam.sys,SERVICE_KERNEL_DRIVER,,true,true,The file is signed and the signature was verified.,Microsoft Windows,Microsoft Windows Production PCA 2011
EW0001EOV,DsmSvc,Device Setup Manager,Enables the detection  download and installation of device-related software. If this service is disabled  devices may be configured with outdated software  and may not work correctly.,C:\Windows\System32\svchost.exe,2b896bd48f79676debeb14974ec5189d,C:\Windows\system32\svchost.exe -k netsvcs,SERVICE_WIN32_SHARE_PROCESS,C:\Windows\System32\DeviceSetupManager.dll,true,true,The file is signed and the signature was verified.,Microsoft Windows,Microsoft Windows Production PCA 2011
EW0001EOV,RDPDR,Remote Desktop Device Redirector Driver,Remote Desktop Device Redirector Driver,C:\Windows\System32\drivers\rdpdr.sys,2a8f6dd9869e8c5c47ecaa6afd7eb891,System32\drivers\rdpdr.sys,SERVICE_KERNEL_DRIVER,,true,true,The file is signed and the signature was verified.,Microsoft Windows,Microsoft Windows Production PCA 2011
EW0001EOV,WdFilter,Windows Defender Mini-Filter Driver,Windows Defender On-Access Malware Protection Mini-Filter Driver,C:\Windows\System32\drivers\WdFilter.sys,4d7ff6b2fe7d35c621fda5ea7d211258,\SystemRoot\system32\drivers\WdFilter.sys,SERVICE_FILE_SYSTEM_DRIVER,,true,true,The file is signed and the signature was verified.,Microsoft Windows,Microsoft Windows Production PCA 2011
EW0001EOV,StateRepository,State Repository Service,Provides required infrastructure support for the application model.,C:\Windows\System32\svchost.exe,2b896bd48f79676debeb14974ec5189d,C:\Windows\system32\svchost.exe -k appmodel,SERVICE_WIN32_SHARE_PROCESS,C:\Windows\System32\windows.staterepository.dll,true,true,The file is signed and the signature was verified.,Microsoft Windows,Microsoft Windows Production PCA 2011
EW0001EOV,Synth3dVsc,Synth3dVsc,,C:\Windows\System32\drivers\Synth3dVsc.sys,32c2077af132802ff5bf3d1b6b63c590,\SystemRoot\System32\drivers\Synth3dVsc.sys,SERVICE_KERNEL_DRIVER,,true,true,The file is signed and the signature was verified.,Microsoft Windows,Microsoft Windows Production PCA 2011
EW0001EOV,diagnosticshub.standardcollector.service,Microsoft (R) Diagnostics Hub Standard Collector Service,Diagnostics Hub Standard Collector Service. When running  this service collects real time ETW events and processes them.,C:\Windows\System32\DiagSvcs\DiagnosticsHub.StandardCollector.Service.exe,c45418ba4d0722db0c909416240ab91d,C:\Windows\system32\DiagSvcs\DiagnosticsHub.StandardCollector.Service.exe,SERVICE_WIN32_OWN_PROCESS,,true,true,The file is signed and the signature was verified.,Microsoft Windows,Microsoft Windows Production PCA 2011
EW0001EOV,HidBth,Microsoft Bluetooth HID Miniport,,C:\Windows\System32\drivers\hidbth.sys,69bade7450c4e9702ceee08664a91930,\SystemRoot\System32\drivers\hidbth.sys,SERVICE_KERNEL_DRIVER,,true,true,The file is signed and the signature was verified.,Microsoft Windows,Microsoft Windows Production PCA 2011
EW0001EOV,MSiSCSI,Microsoft iSCSI Initiator Service,Manages Internet SCSI (iSCSI) sessions from this computer to remote iSCSI target devices. If this service is stopped  this computer will not be able to login or access iSCSI targets. If this service is disabled  any services that explicitly depend on it will fail to start.,C:\Windows\System32\svchost.exe,2b896bd48f79676debeb14974ec5189d,C:\Windows\system32\svchost.exe -k netsvcs,SERVICE_WIN32_SHARE_PROCESS,C:\Windows\System32\iscsiexe.dll,true,true,The file is signed and the signature was verified.,Microsoft Windows,Microsoft Windows Production PCA 2011
EW0001EOV,bfadfcoei,bfadfcoei,,C:\Windows\System32\drivers\bfadfcoei.sys,9042ca271a86529bfd767c672b634fbe,\SystemRoot\System32\drivers\bfadfcoei.sys,SERVICE_KERNEL_DRIVER,,true,true,The file is signed and the signature was verified.,Microsoft Windows,Microsoft Windows Production PCA 2011
EW0001EOV,Power,Power,Manages power policy and power policy notification delivery.,C:\Windows\System32\svchost.exe,2b896bd48f79676debeb14974ec5189d,C:\Windows\system32\svchost.exe -k DcomLaunch,SERVICE_WIN32_SHARE_PROCESS,C:\Windows\System32\umpo.dll,true,true,The file is signed and the signature was verified.,Microsoft Windows,Microsoft Windows Production PCA 2011
EW0001EOV,ebdrv,QLogic 10 Gigabit Ethernet Adapter VBD,,C:\Windows\System32\drivers\evbda.sys,26b9f13b08bf018f57bd4323d9c37452,\SystemRoot\System32\drivers\evbda.sys,SERVICE_KERNEL_DRIVER,,true,true,The file is signed and the signature was verified.,Microsoft Windows,Microsoft Windows Production PCA 2011
EW0001EOV,CompositeBus,Composite Bus Enumerator Driver,,C:\Windows\System32\DriverStore\FileRepository\compositebus.inf_amd64_a140581a8f8b58b7\CompositeBus.sys,1f007ae1adb4cc4a9d64aec15ec8725e,\SystemRoot\System32\DriverStore\FileRepository\compositebus.inf_amd64_a140581a8f8b58b7\CompositeBus.sys,SERVICE_KERNEL_DRIVER,,true,true,The file is signed and the signature was verified.,Microsoft Windows,Microsoft Windows Production PCA 2011
EW0001EOV,rspndr,Link-Layer Topology Discovery Responder,Link-Layer Topology Discovery Responder,C:\Windows\System32\drivers\rspndr.sys,8986baee1015b54ab1ee8ce234dd3420,system32\drivers\rspndr.sys,SERVICE_KERNEL_DRIVER,,true,true,The file is signed and the signature was verified.,Microsoft Windows,Microsoft Windows Production PCA 2011
EW0001EOV,WdBoot,Windows Defender Boot Driver,Windows Defender Boot Driver,C:\Windows\System32\drivers\WdBoot.sys,bb4ab8ac209359045196c58460f3b61d,\SystemRoot\system32\drivers\WdBoot.sys,SERVICE_KERNEL_DRIVER,,true,true,The file is signed and the signature was verified.,Microsoft Windows,Microsoft Windows Production PCA 2011
EW0001EOV,EntAppSvc,Enterprise App Management Service,Enables enterprise application management.,C:\Windows\System32\svchost.exe,2b896bd48f79676debeb14974ec5189d,C:\Windows\system32\svchost.exe -k appmodel,SERVICE_WIN32_SHARE_PROCESS,C:\Windows\System32\EnterpriseAppMgmtSvc.dll,true,true,The file is signed and the signature was verified.,Microsoft Windows,Microsoft Windows Production PCA 2011
EW0001EOV,RasMan,Remote Access Connection Manager,Manages dial-up and virtual private network (VPN) connections from this computer to the Internet or other remote networks. If this service is disabled  any services that explicitly depend on it will fail to start.,C:\Windows\System32\svchost.exe,2b896bd48f79676debeb14974ec5189d,C:\Windows\System32\svchost.exe -k netsvcs,SERVICE_WIN32_SHARE_PROCESS,C:\Windows\System32\rasmans.dll,true,true,The file is signed and the signature was verified.,Microsoft Windows,Microsoft Windows Production PCA 2011
EW0001EOV,CertPropSvc,Certificate Propagation,Copies user certificates and root certificates from smart cards into the current user's certificate store  detects when a smart card is inserted into a smart card reader  and  if needed  installs the smart card Plug and Play minidriver.,C:\Windows\System32\svchost.exe,2b896bd48f79676debeb14974ec5189d,C:\Windows\system32\svchost.exe -k netsvcs,SERVICE_WIN32_SHARE_PROCESS,C:\Windows\System32\certprop.dll,true,true,The file is signed and the signature was verified.,Microsoft Windows,Microsoft Windows Production PCA 2011
EW0001EOV,BasicDisplay,BasicDisplay,,C:\Windows\System32\drivers\BasicDisplay.sys,64d194ffb99ca2c205461ed4a0082389,\SystemRoot\System32\drivers\BasicDisplay.sys,SERVICE_KERNEL_DRIVER,,true,true,The file is signed and the signature was verified.,Microsoft Windows,Microsoft Windows Production PCA 2011
EW0001EOV,Parport,Parallel port driver,,C:\Windows\System32\drivers\parport.sys,c25077934f8c6e2311e36a6450887f0d,\SystemRoot\System32\drivers\parport.sys,SERVICE_KERNEL_DRIVER,,true,true,The file is signed and the signature was verified.,Microsoft Windows,Microsoft Windows Production PCA 2011
EW0001EOV,swprv,Microsoft Software Shadow Copy Provider,Manages software-based volume shadow copies taken by the Volume Shadow Copy service. If this service is stopped  software-based volume shadow copies cannot be managed. If this service is disabled  any services that explicitly depend on it will fail to start.,C:\Windows\System32\svchost.exe,2b896bd48f79676debeb14974ec5189d,C:\Windows\System32\svchost.exe -k swprv,SERVICE_WIN32_OWN_PROCESS,C:\Windows\System32\swprv.dll,true,true,The file is signed and the signature was verified.,Microsoft Windows,Microsoft Windows Production PCA 2011
EW0001EOV,NanoServiceMain,Panda Protection Service,Panda Protection Service,C:\Program Files (x86)\Panda Security\Panda Security Protection\PSANHost.exe,958ac0fe0bda85094933d94e05dddfe8,C:\Program Files (x86)\Panda Security\Panda Security Protection\PSANHost.exe,SERVICE_WIN32_OWN_PROCESS,,true,true,The file is signed and the signature was verified.,Panda Security S.L.,DigiCert Assured ID Code Signing CA-1
EW0001EOV,vmictimesync,Hyper-V Time Synchronization Service,Synchronizes the system time of this virtual machine with the system time of the physical computer.,C:\Windows\System32\svchost.exe,2b896bd48f79676debeb14974ec5189d,C:\Windows\system32\svchost.exe -k LocalServiceNetworkRestricted,SERVICE_WIN32_SHARE_PROCESS,C:\Windows\System32\icsvc.dll,true,true,The file is signed and the signature was verified.,Microsoft Windows,Microsoft Windows Production PCA 2011
EW0001EOV,FDResPub,Function Discovery Resource Publication,Publishes this computer and resources attached to this computer so they can be discovered over the network.  If this service is stopped  network resources will no longer be published and they will not be discovered by other computers on the network.,C:\Windows\System32\svchost.exe,2b896bd48f79676debeb14974ec5189d,C:\Windows\system32\svchost.exe -k LocalServiceAndNoImpersonation,SERVICE_WIN32_SHARE_PROCESS,C:\Windows\System32\FDResPub.dll,true,true,The file is signed and the signature was verified.,Microsoft Windows,Microsoft Windows Production PCA 2011
EW0001EOV,scmdisk0101,Microsoft NVDIMM-N disk driver,,C:\Windows\System32\drivers\scmdisk0101.sys,9a9c4263f6f86fc67223c016b8fcd95a,\SystemRoot\System32\drivers\scmdisk0101.sys,SERVICE_KERNEL_DRIVER,,true,true,The file is signed and the signature was verified.,Microsoft Windows,Microsoft Windows Production PCA 2011
EW0001EOV,sacdrv,sacdrv,,C:\Windows\System32\drivers\sacdrv.sys,01006a453f2fe45ec7205bc8e8f2a30d,\SystemRoot\system32\DRIVERS\sacdrv.sys,SERVICE_KERNEL_DRIVER,,true,true,The file is signed and the signature was verified.,Microsoft Windows,Microsoft Windows Production PCA 2011
EW0001EOV,RasPppoe,Remote Access PPPOE Driver,Remote Access PPPOE Driver,C:\Windows\System32\drivers\raspppoe.sys,3fe728de429d17de6024c08dbb052cb4,\SystemRoot\System32\drivers\raspppoe.sys,SERVICE_KERNEL_DRIVER,,true,true,The file is signed and the signature was verified.,Microsoft Windows,Microsoft Windows Production PCA 2011
EW0001EOV,Appinfo,Application Information,Facilitates the running of interactive applications with additional administrative privileges.  If this service is stopped  users will be unable to launch applications with the additional administrative privileges they may require to perform desired user tasks.,C:\Windows\System32\svchost.exe,2b896bd48f79676debeb14974ec5189d,C:\Windows\system32\svchost.exe -k netsvcs,SERVICE_WIN32_SHARE_PROCESS,C:\Windows\System32\appinfo.dll,true,true,The file is signed and the signature was verified.,Microsoft Windows,Microsoft Windows Production PCA 2011
EW0001EOV,RpcEptMapper,RPC Endpoint Mapper,Resolves RPC interfaces identifiers to transport endpoints. If this service is stopped or disabled  programs using Remote Procedure Call (RPC) services will not function properly.,C:\Windows\System32\svchost.exe,2b896bd48f79676debeb14974ec5189d,C:\Windows\system32\svchost.exe -k RPCSS,SERVICE_WIN32_SHARE_PROCESS,C:\Windows\System32\RpcEpMap.dll,true,true,The file is signed and the signature was verified.,Microsoft Windows,Microsoft Windows Production PCA 2011
EW0001EOV,LanmanServer,Server,Supports file  print  and named-pipe sharing over the network for this computer. If this service is stopped  these functions will be unavailable. If this service is disabled  any services that explicitly depend on it will fail to start.,C:\Windows\System32\svchost.exe,2b896bd48f79676debeb14974ec5189d,C:\Windows\System32\svchost.exe -k smbsvcs,SERVICE_WIN32_SHARE_PROCESS,C:\Windows\System32\srvsvc.dll,true,true,The file is signed and the signature was verified.,Microsoft Windows,Microsoft Windows Production PCA 2011
EW0001EOV,SystemEventsBroker,System Events Broker,Coordinates execution of background work for WinRT application. If this service is stopped or disabled  then background work might not be triggered.,C:\Windows\System32\svchost.exe,2b896bd48f79676debeb14974ec5189d,C:\Windows\system32\svchost.exe -k DcomLaunch,SERVICE_WIN32_SHARE_PROCESS,C:\Windows\System32\SystemEventsBrokerServer.dll,true,true,The file is signed and the signature was verified.,Microsoft Windows,Microsoft Windows Production PCA 2011
EW0001EOV,AcpiDev,ACPI Devices driver,,C:\Windows\System32\drivers\AcpiDev.sys,e749aeca17941a7303637d750463d0a3,\SystemRoot\System32\drivers\AcpiDev.sys,SERVICE_KERNEL_DRIVER,,true,true,The file is signed and the signature was verified.,Microsoft Windows,Microsoft Windows Production PCA 2011
EW0001EOV,PlugPlay,Plug and Play,Enables a computer to recognize and adapt to hardware changes with little or no user input. Stopping or disabling this service will result in system instability.,C:\Windows\System32\svchost.exe,2b896bd48f79676debeb14974ec5189d,C:\Windows\system32\svchost.exe -k DcomLaunch,SERVICE_WIN32_SHARE_PROCESS,C:\Windows\System32\umpnpmgr.dll,true,true,The file is signed and the signature was verified.,Microsoft Windows,Microsoft Windows Production PCA 2011
