hostname,name,descriptivename,description,path,md5,arguments,type,servicedll,pathsignatureexists,pathsignatureverified,pathsignaturedescription,pathcertificatesubject,pathcertificateissuer
SB0001TEG,hyperkbd,hyperkbd,,C:\Windows\System32\drivers\hyperkbd.sys,7df86bfccd7df9bd42ca66dfe91ea5ff,\SystemRoot\System32\drivers\hyperkbd.sys,SERVICE_KERNEL_DRIVER,,true,true,The file is signed and the signature was verified.,Microsoft Windows,Microsoft Windows Production PCA 2011
SB0001TEG,smphost,Microsoft Storage Spaces SMP,Host service for the Microsoft Storage Spaces management provider. If this service is stopped or disabled  Storage Spaces cannot be managed.,C:\Windows\System32\svchost.exe,ec9b8ceb5d8152de1624ca8455fa0974,C:\Windows\System32\svchost.exe -k smphost,SERVICE_WIN32_OWN_PROCESS,C:\Windows\System32\smphost.dll,true,true,The file is signed and the signature was verified.,Microsoft Windows,Microsoft Windows Production PCA 2011
SB0001TEG,dot3svc,Wired AutoConfig,The Wired AutoConfig (DOT3SVC) service is responsible for performing IEEE 802.1X authentication on Ethernet interfaces. If your current wired network deployment enforces 802.1X authentication  the DOT3SVC service should be configured to run for establishing Layer 2 connectivity and/or providing access to network resources. Wired networks that do not enforce 802.1X authentication are unaffected by the DOT3SVC service.,C:\Windows\System32\svchost.exe,ec9b8ceb5d8152de1624ca8455fa0974,C:\Windows\system32\svchost.exe -k LocalSystemNetworkRestricted,SERVICE_WIN32_SHARE_PROCESS,C:\Windows\System32\dot3svc.dll,true,true,The file is signed and the signature was verified.,Microsoft Windows,Microsoft Windows Production PCA 2011
SB0001TEG,hidserv,Human Interface Device Service,Activates and maintains the use of hot buttons on keyboards  remote controls  and other multimedia devices. It is recommended that you keep this service running.,C:\Windows\System32\svchost.exe,ec9b8ceb5d8152de1624ca8455fa0974,C:\Windows\system32\svchost.exe -k LocalSystemNetworkRestricted,SERVICE_WIN32_SHARE_PROCESS,C:\Windows\System32\hidserv.dll,true,true,The file is signed and the signature was verified.,Microsoft Windows,Microsoft Windows Production PCA 2011
SB0001TEG,IPMIDRV,IPMIDRV,,C:\Windows\System32\drivers\IPMIDrv.sys,6d3d0f967fdf984d0a433438fffa043f,\SystemRoot\System32\drivers\IPMIDrv.sys,SERVICE_KERNEL_DRIVER,,true,true,The file is signed and the signature was verified.,Microsoft Windows,Microsoft Windows Production PCA 2011
SB0001TEG,wmiApSrv,WMI Performance Adapter,Provides performance library information from Windows Management Instrumentation (WMI) providers to clients on the network. This service only runs when Performance Data Helper is activated.,C:\Windows\System32\wbem\WmiApSrv.exe,3958ec37aa963faddc1dcd7add6db71e,C:\Windows\system32\wbem\WmiApSrv.exe,SERVICE_WIN32_OWN_PROCESS,,true,true,The file is signed and the signature was verified.,Microsoft Windows,Microsoft Windows Production PCA 2011
SB0001TEG,WinRM,Windows Remote Management (WS-Management),Windows Remote Management (WinRM) service implements the WS-Management protocol for remote management. WS-Management is a standard web services protocol used for remote software and hardware management. The WinRM service listens on the network for WS-Management requests and processes them. The WinRM Service needs to be configured with a listener using winrm.cmd command line tool or through Group Policy in order for it to listen over the network. The WinRM service provides access to WMI data and enables event collection. Event collection and subscription to events require that the service is running. WinRM messages use HTTP and HTTPS as transports. The WinRM service does not depend on IIS but is preconfigured to share a port with IIS on the same machine.  The WinRM service reserves the /wsman URL prefix. To prevent conflicts with IIS  administrators should ensure that any websites hosted on IIS do not use the /wsman URL prefix.,C:\Windows\System32\svchost.exe,ec9b8ceb5d8152de1624ca8455fa0974,C:\Windows\System32\svchost.exe -k NetworkService,SERVICE_WIN32_SHARE_PROCESS,C:\Windows\System32\WsmSvc.dll,true,true,The file is signed and the signature was verified.,Microsoft Windows,Microsoft Windows Production PCA 2011
SB0001TEG,FontCache3.0.0.0,Windows Presentation Foundation Font Cache 3.0.0.0,Optimizes performance of Windows Presentation Foundation (WPF) applications by caching commonly used font data. WPF applications will start this service if it is not already running. It can be disabled  though doing so will degrade the performance of WPF applications.,C:\Windows\Microsoft.Net\Framework64\v3.0\WPF\PresentationFontCache.exe,44692afd93c60070499700939304b8fd,C:\Windows\Microsoft.Net\Framework64\v3.0\WPF\PresentationFontCache.exe,SERVICE_WIN32_OWN_PROCESS,,true,true,The file is signed and the signature was verified.,Microsoft Windows,Microsoft Windows Production PCA 2011
SB0001TEG,UASPStor,USB Attached SCSI (UAS) Driver,,C:\Windows\System32\drivers\uaspstor.sys,e87eb9d4d85faf4e9b819dc36f72cde4,\SystemRoot\System32\drivers\uaspstor.sys,SERVICE_KERNEL_DRIVER,,true,true,The file is signed and the signature was verified.,Microsoft Windows,Microsoft Windows Production PCA 2011
SB0001TEG,RemoteAccess,Routing and Remote Access,Offers routing services to businesses in local area and wide area network environments.,C:\Windows\System32\svchost.exe,ec9b8ceb5d8152de1624ca8455fa0974,C:\Windows\System32\svchost.exe -k netsvcs,SERVICE_WIN32_SHARE_PROCESS,C:\Windows\System32\mprdim.dll,true,true,The file is signed and the signature was verified.,Microsoft Windows,Microsoft Windows Production PCA 2011
SB0001TEG,cdrom,CD-ROM Driver,,C:\Windows\System32\drivers\cdrom.sys,a14af88df4048fce53b12bd5b4fb3f9f,\SystemRoot\System32\drivers\cdrom.sys,SERVICE_KERNEL_DRIVER,,true,true,The file is signed and the signature was verified.,Microsoft Windows,Microsoft Windows Production PCA 2011
SB0001TEG,vmbus,Virtual Machine Bus,,C:\Windows\System32\drivers\vmbus.sys,7a778f3043708ca8226078361c796aaf,\SystemRoot\System32\drivers\vmbus.sys,SERVICE_KERNEL_DRIVER,,true,true,The file is signed and the signature was verified.,Microsoft Windows,Microsoft Windows Production PCA 2011
SB0001TEG,PptpMiniport,WAN Miniport (PPTP),WAN Miniport (PPTP),C:\Windows\System32\drivers\raspptp.sys,8a400922e1edb734c2d979a32dbf777b,\SystemRoot\System32\drivers\raspptp.sys,SERVICE_KERNEL_DRIVER,,true,true,The file is signed and the signature was verified.,Microsoft Windows,Microsoft Windows Production PCA 2011
SB0001TEG,uagp35,Microsoft AGPv3.5 Filter,,C:\Windows\System32\drivers\UAGP35.SYS,3471e974971c8e589c79e7eafa0cf365,\SystemRoot\System32\drivers\uagp35.sys,SERVICE_KERNEL_DRIVER,,true,true,The file is signed and the signature was verified.,Microsoft Windows,Microsoft Windows Production PCA 2011
SB0001TEG,b06bdrv,Broadcom NetXtreme II VBD,,C:\Windows\System32\drivers\bxvbda.sys,cc3075787a3e2e9c4d8d67e21d953e85,\SystemRoot\System32\drivers\bxvbda.sys,SERVICE_KERNEL_DRIVER,,true,true,The file is signed and the signature was verified.,Microsoft Windows,Microsoft Windows Production PCA 2011
SB0001TEG,MsLbfoProvider,Microsoft Load Balancing/Failover Provider,Microsoft Load Balancing/Failover Provider,C:\Windows\System32\drivers\MsLbfoProvider.sys,f3fb0edab83f42e552ac4cc95061b9c0,\SystemRoot\system32\DRIVERS\MsLbfoProvider.sys,SERVICE_KERNEL_DRIVER,,true,true,The file is signed and the signature was verified.,Microsoft Windows,Microsoft Windows Production PCA 2011
SB0001TEG,CmBatt,Microsoft ACPI Control Method Battery Driver,,C:\Windows\System32\drivers\CmBatt.sys,4f582c4709b397b0c43f0729ae2d6965,\SystemRoot\System32\drivers\CmBatt.sys,SERVICE_KERNEL_DRIVER,,true,true,The file is signed and the signature was verified.,Microsoft Windows,Microsoft Windows Production PCA 2011
SB0001TEG,swenum,Software Bus Driver,,C:\Windows\System32\drivers\swenum.sys,c8966736d5e3585bd22677406d68c0d0,\SystemRoot\System32\drivers\swenum.sys,SERVICE_KERNEL_DRIVER,,true,true,The file is signed and the signature was verified.,Microsoft Windows,Microsoft Windows Production PCA 2011
SB0001TEG,AFD,Ancillary Function Driver for Winsock,Ancillary Function Driver for Winsock,C:\Windows\System32\drivers\afd.sys,e3026ea834f66aa9d8f55c53c7dede38,\SystemRoot\system32\drivers\afd.sys,SERVICE_KERNEL_DRIVER,,true,true,The file is signed and the signature was verified.,Microsoft Windows,Microsoft Windows Production PCA 2011
SB0001TEG,LSI_SSS,LSI_SSS,,C:\Windows\System32\drivers\lsi_sss.sys,f2bea4c3239bd844510bfc4e51d5adaf,\SystemRoot\System32\drivers\lsi_sss.sys,SERVICE_KERNEL_DRIVER,,true,true,The file is signed and the signature was verified.,Microsoft Windows,Microsoft Windows Production PCA 2011
SB0001TEG,BITS,Background Intelligent Transfer Service,Transfers files in the background using idle network bandwidth. If the service is disabled  then any applications that depend on BITS  such as Windows Update or MSN Explorer  will be unable to automatically download programs and other information.,C:\Windows\System32\svchost.exe,ec9b8ceb5d8152de1624ca8455fa0974,C:\Windows\System32\svchost.exe -k netsvcs,SERVICE_WIN32_SHARE_PROCESS,C:\Windows\System32\qmgr.dll,true,true,The file is signed and the signature was verified.,Microsoft Windows,Microsoft Windows Production PCA 2011
SB0001TEG,SpbCx,Simple Peripheral Bus Support Library,,C:\Windows\System32\drivers\SpbCx.sys,8d24a923c7b00b1b0c3a5c046bdffb09,system32\drivers\SpbCx.sys,SERVICE_KERNEL_DRIVER,,true,true,The file is signed and the signature was verified.,Microsoft Windows,Microsoft Windows Production PCA 2011
SB0001TEG,Filetrace,Filetrace,ETW File Trace Filter,C:\Windows\System32\drivers\filetrace.sys,e6488a1045c788ec7bfa071b3f6fd9dc,system32\drivers\filetrace.sys,SERVICE_FILE_SYSTEM_DRIVER,,true,true,The file is signed and the signature was verified.,Microsoft Windows,Microsoft Windows Production PCA 2011
SB0001TEG,atapi,IDE Channel,,C:\Windows\System32\drivers\atapi.sys,ae0a1bfa930e5c5272ee77077bb08c9a,\SystemRoot\System32\drivers\atapi.sys,SERVICE_KERNEL_DRIVER,,true,true,The file is signed and the signature was verified.,Microsoft Windows,Microsoft Windows Production PCA 2011
SB0001TEG,LSI_SAS3,LSI_SAS3,,C:\Windows\System32\drivers\lsi_sas3.sys,509044e3c94dacf60c504226ae587f9b,\SystemRoot\System32\drivers\lsi_sas3.sys,SERVICE_KERNEL_DRIVER,,true,true,The file is signed and the signature was verified.,Microsoft Windows,Microsoft Windows Production PCA 2011
SB0001TEG,SharedAccess,Internet Connection Sharing (ICS),Provides network address translation  addressing  name resolution and/or intrusion prevention services for a home or small office network.,C:\Windows\System32\svchost.exe,ec9b8ceb5d8152de1624ca8455fa0974,C:\Windows\System32\svchost.exe -k netsvcs,SERVICE_WIN32_SHARE_PROCESS,C:\Windows\System32\ipnathlp.dll,true,true,The file is signed and the signature was verified.,Microsoft Windows,Microsoft Windows Production PCA 2011
SB0001TEG,seclogon,Secondary Logon,Enables starting processes under alternate credentials. If this service is stopped  this type of logon access will be unavailable. If this service is disabled  any services that explicitly depend on it will fail to start.,C:\Windows\System32\svchost.exe,ec9b8ceb5d8152de1624ca8455fa0974,C:\Windows\system32\svchost.exe -k netsvcs,SERVICE_WIN32_SHARE_PROCESS,C:\Windows\System32\seclogon.dll,true,true,The file is signed and the signature was verified.,Microsoft Windows,Microsoft Windows Production PCA 2011
SB0001TEG,Processor,Processor Driver,,C:\Windows\System32\drivers\processr.sys,9daec3045364ab0c269edeb71f149774,\SystemRoot\System32\drivers\processr.sys,SERVICE_KERNEL_DRIVER,,true,true,The file is signed and the signature was verified.,Microsoft Windows,Microsoft Windows Production PCA 2011
SB0001TEG,HTTP,HTTP Service,HTTP Service,C:\Windows\System32\drivers\http.sys,80ec5a435f08ad5d3d2f71d5e8333e48,system32\drivers\HTTP.sys,SERVICE_KERNEL_DRIVER,,true,true,The file is signed and the signature was verified.,Microsoft Windows,Microsoft Windows Production PCA 2011
SB0001TEG,usbccgp,Microsoft USB Generic Parent Driver,,C:\Windows\System32\drivers\usbccgp.sys,4391e3ad93160f9331524872e9b19041,\SystemRoot\System32\drivers\usbccgp.sys,SERVICE_KERNEL_DRIVER,,true,true,The file is signed and the signature was verified.,Microsoft Windows,Microsoft Windows Production PCA 2011
SB0001TEG,Tcpip,TCP/IP Protocol Driver,TCP/IP Protocol Driver,C:\Windows\System32\drivers\tcpip.sys,9eaf00f20fbc844f65a0f3a960624e2d,\SystemRoot\System32\drivers\tcpip.sys,SERVICE_KERNEL_DRIVER,,true,true,The file is signed and the signature was verified.,Microsoft Windows,Microsoft Windows Production PCA 2011
SB0001TEG,usbehci,Microsoft USB 2.0 Enhanced Host Controller Miniport Driver,,C:\Windows\System32\drivers\usbehci.sys,261cb2f514d7888941682d79a0cb7ba8,\SystemRoot\System32\drivers\usbehci.sys,SERVICE_KERNEL_DRIVER,,true,true,The file is signed and the signature was verified.,Microsoft Windows,Microsoft Windows Production PCA 2011
SB0001TEG,Wanarp,Remote Access IP ARP Driver,Remote Access IP ARP Driver,C:\Windows\System32\drivers\wanarp.sys,71d1035bf2c9bd5d5c0351c807e97f83,\SystemRoot\system32\DRIVERS\wanarp.sys,SERVICE_KERNEL_DRIVER,,true,true,The file is signed and the signature was verified.,Microsoft Windows,Microsoft Windows Production PCA 2011
SB0001TEG,AppXSvc,AppX Deployment Service (AppXSVC),Provides infrastructure support for deploying Store applications. This service is started on demand and if disabled Store applications will not be deployed to the system  and may not function properly.,C:\Windows\System32\svchost.exe,ec9b8ceb5d8152de1624ca8455fa0974,C:\Windows\system32\svchost.exe -k wsappx,SERVICE_WIN32_SHARE_PROCESS,C:\Windows\System32\appxdeploymentserver.dll,true,true,The file is signed and the signature was verified.,Microsoft Windows,Microsoft Windows Production PCA 2011
SB0001TEG,PrintNotify,Printer Extensions and Notifications,This service opens custom printer dialog boxes and handles notifications from a remote print server or a printer. If you turn off this service  you won’t be able to see printer extensions or notifications.,C:\Windows\System32\svchost.exe,ec9b8ceb5d8152de1624ca8455fa0974,C:\Windows\system32\svchost.exe -k print,SERVICE_WIN32_SHARE_PROCESS,C:\Windows\System32\spool\drivers\x64\3\PrintConfig.dll,true,true,The file is signed and the signature was verified.,Microsoft Windows,Microsoft Windows Production PCA 2011
SB0001TEG,nsi,Network Store Interface Service,This service delivers network notifications (e.g. interface addition/deleting etc) to user mode clients. Stopping this service will cause loss of network connectivity. If this service is disabled  any other services that explicitly depend on this service will fail to start.,C:\Windows\System32\svchost.exe,ec9b8ceb5d8152de1624ca8455fa0974,C:\Windows\system32\svchost.exe -k LocalService,SERVICE_WIN32_SHARE_PROCESS,C:\Windows\System32\nsisvc.dll,true,true,The file is signed and the signature was verified.,Microsoft Windows,Microsoft Windows Production PCA 2011
SB0001TEG,sbp2port,SBP-2 Transport/Protocol Bus Driver,,C:\Windows\System32\drivers\sbp2port.sys,7ced74cc6e4f62ed803797f267cbc3bf,\SystemRoot\System32\drivers\sbp2port.sys,SERVICE_KERNEL_DRIVER,,true,true,The file is signed and the signature was verified.,Microsoft Windows,Microsoft Windows Production PCA 2011
SB0001TEG,bowser,Browser Support Driver,Implements the kernel datagram receiver for the computer browser browser service.,C:\Windows\System32\drivers\bowser.sys,44957aa31428f371ad4b77e9a93448d8,system32\DRIVERS\bowser.sys,SERVICE_FILE_SYSTEM_DRIVER,,true,true,The file is signed and the signature was verified.,Microsoft Windows,Microsoft Windows Production PCA 2011
SB0001TEG,spaceport,Storage Spaces Driver,,C:\Windows\System32\drivers\spaceport.sys,3e117e7bce7cd2957d0d5de68a28acfe,\SystemRoot\System32\drivers\spaceport.sys,SERVICE_KERNEL_DRIVER,,true,true,The file is signed and the signature was verified.,Microsoft Windows,Microsoft Windows Production PCA 2011
SB0001TEG,usbuhci,Microsoft USB Universal Host Controller Miniport Driver,,C:\Windows\System32\drivers\usbuhci.sys,3c5a933bffa4e26ba78e1db5398ba637,\SystemRoot\System32\drivers\usbuhci.sys,SERVICE_KERNEL_DRIVER,,true,true,The file is signed and the signature was verified.,Microsoft Windows,Microsoft Windows Production PCA 2011
SB0001TEG,vds,Virtual Disk,Provides management services for disks  volumes  file systems  and storage arrays.,C:\Windows\System32\vds.exe,c4c7bfcbd3234a708abfd7347cea82f6,C:\Windows\System32\vds.exe,SERVICE_WIN32_OWN_PROCESS,,true,true,The file is signed and the signature was verified.,Microsoft Windows,Microsoft Windows Production PCA 2011
SB0001TEG,3ware,3ware,,C:\Windows\System32\drivers\3ware.sys,2d26d928d0842c40d30ce0264df1938f,\SystemRoot\System32\drivers\3ware.sys,SERVICE_KERNEL_DRIVER,,true,true,The file is signed and the signature was verified.,Microsoft Windows,Microsoft Windows Production PCA 2011
SB0001TEG,WinHttpAutoProxySvc,WinHTTP Web Proxy Auto-Discovery Service,WinHTTP implements the client HTTP stack and provides developers with a Win32 API and COM Automation component for sending HTTP requests and receiving responses. In addition  WinHTTP provides support for auto-discovering a proxy configuration via its implementation of the Web Proxy Auto-Discovery (WPAD) protocol.,C:\Windows\System32\svchost.exe,ec9b8ceb5d8152de1624ca8455fa0974,C:\Windows\system32\svchost.exe -k LocalService,SERVICE_WIN32_SHARE_PROCESS,C:\Windows\System32\winhttp.dll,true,true,The file is signed and the signature was verified.,Microsoft Windows,Microsoft Windows Production PCA 2011
SB0001TEG,NetBT,NetBT,This service implements NetBios over TCP/IP.,C:\Windows\System32\drivers\netbt.sys,a5ef7ae4a867b7a48201f3db47e70b37,System32\DRIVERS\netbt.sys,SERVICE_KERNEL_DRIVER,,true,true,The file is signed and the signature was verified.,Microsoft Windows,Microsoft Windows Production PCA 2011
SB0001TEG,1394ohci,1394 OHCI Compliant Host Controller,,C:\Windows\System32\drivers\1394ohci.sys,bee56abbf46a0a435ff252132e1bb0b6,\SystemRoot\System32\drivers\1394ohci.sys,SERVICE_KERNEL_DRIVER,,true,true,The file is signed and the signature was verified.,Microsoft Windows,Microsoft Windows Production PCA 2011
SB0001TEG,Power,Power,Manages power policy and power policy notification delivery.,C:\Windows\System32\svchost.exe,ec9b8ceb5d8152de1624ca8455fa0974,C:\Windows\system32\svchost.exe -k DcomLaunch,SERVICE_WIN32_SHARE_PROCESS,C:\Windows\System32\umpo.dll,true,true,The file is signed and the signature was verified.,Microsoft Windows,Microsoft Windows Production PCA 2011
SB0001TEG,TCPIP6,Microsoft IPv6 Protocol Driver,Microsoft IPv6 Protocol Driver,C:\Windows\System32\drivers\tcpip.sys,9eaf00f20fbc844f65a0f3a960624e2d,\SystemRoot\system32\DRIVERS\tcpip.sys,SERVICE_KERNEL_DRIVER,,true,true,The file is signed and the signature was verified.,Microsoft Windows,Microsoft Windows Production PCA 2011
SB0001TEG,TPM,TPM,TPM Driver,C:\Windows\System32\drivers\tpm.sys,cb74a14e8d82f9348015f2f2ebfc26b1,\SystemRoot\system32\drivers\tpm.sys,SERVICE_KERNEL_DRIVER,,true,true,The file is signed and the signature was verified.,Microsoft Windows,Microsoft Windows Production PCA 2011
SB0001TEG,XENBUS,AWS PV Bus,,C:\Windows\System32\drivers\xenbus.sys,4a5973367eb10d435c72a8ad24e3112f,\SystemRoot\system32\DRIVERS\xenbus.sys,SERVICE_KERNEL_DRIVER,,true,true,The file is signed and the signature was verified.,Microsoft Windows Hardware Compatibility Publisher,Microsoft Windows Hardware Compatibility PCA
SB0001TEG,Wanarpv6,Remote Access IPv6 ARP Driver,Remote Access IPv6 ARP Driver,C:\Windows\System32\drivers\wanarp.sys,71d1035bf2c9bd5d5c0351c807e97f83,\SystemRoot\system32\DRIVERS\wanarp.sys,SERVICE_KERNEL_DRIVER,,true,true,The file is signed and the signature was verified.,Microsoft Windows,Microsoft Windows Production PCA 2011
SB0001TEG,NdisCap,Microsoft NDIS Capture,Microsoft NDIS Capture,C:\Windows\System32\drivers\ndiscap.sys,d21762a5cf77229136aafb31abeedd64,\SystemRoot\system32\DRIVERS\ndiscap.sys,SERVICE_KERNEL_DRIVER,,true,true,The file is signed and the signature was verified.,Microsoft Windows,Microsoft Windows Production PCA 2011
SB0001TEG,PerfHost,Performance Counter DLL Host,Enables remote users and 64-bit processes to query performance counters provided by 32-bit DLLs. If this service is stopped  only local users and 32-bit processes will be able to query performance counters provided by 32-bit DLLs.,C:\Windows\SysWOW64\perfhost.exe,6e52284d3c634f27138587e078f4130c,C:\Windows\SysWow64\perfhost.exe,SERVICE_WIN32_OWN_PROCESS,,true,true,The file is signed and the signature was verified.,Microsoft Windows,Microsoft Windows Production PCA 2011
SB0001TEG,NDIS,NDIS System Driver,NDIS System Driver,C:\Windows\System32\drivers\ndis.sys,a7854ecfa9b4ac3ccf305520e928ee92,\SystemRoot\system32\drivers\ndis.sys,SERVICE_KERNEL_DRIVER,,true,true,The file is signed and the signature was verified.,Microsoft Windows,Microsoft Windows Production PCA 2011
SB0001TEG,qlfcoei,QLogic [FCoE] STOR Miniport Inbox Driver (wx64),,C:\Windows\System32\drivers\qlfcoei.sys,1ca9bce604d5bc1887b7c20184c52731,\SystemRoot\System32\drivers\qlfcoei.sys,SERVICE_KERNEL_DRIVER,,true,true,The file is signed and the signature was verified.,Microsoft Windows,Microsoft Windows Production PCA 2011
SB0001TEG,LSM,Local Session Manager,Core Windows Service that manages local user sessions. Stopping or disabling this service will result in system instability.,C:\Windows\System32\svchost.exe,ec9b8ceb5d8152de1624ca8455fa0974,C:\Windows\system32\svchost.exe -k DcomLaunch,SERVICE_WIN32_SHARE_PROCESS,C:\Windows\System32\lsm.dll,true,true,The file is signed and the signature was verified.,Microsoft Windows,Microsoft Windows Production PCA 2011
SB0001TEG,volmgrx,Dynamic Volume Manager,Extension of the volume manager driver that manages software RAID volumes (spanned  striped  mirrored  RAID-5) on dynamic disks,C:\Windows\System32\drivers\volmgrx.sys,a5ccde23e3acba0e1a340311c1afbcfd,\SystemRoot\System32\drivers\volmgrx.sys,SERVICE_KERNEL_DRIVER,,true,true,The file is signed and the signature was verified.,Microsoft Windows,Microsoft Windows Production PCA 2011
SB0001TEG,CryptSvc,Cryptographic Services,Provides three management services: Catalog Database Service  which confirms the signatures of Windows files and allows new programs to be installed; Protected Root Service  which adds and removes Trusted Root Certification Authority certificates from this computer; and Automatic Root Certificate Update Service  which retrieves root certificates from Windows Update and enable scenarios such as SSL. If this service is stopped  these management services will not function properly. If this service is disabled  any services that explicitly depend on it will fail to start.,C:\Windows\System32\svchost.exe,ec9b8ceb5d8152de1624ca8455fa0974,C:\Windows\system32\svchost.exe -k NetworkService,SERVICE_WIN32_SHARE_PROCESS,C:\Windows\System32\cryptsvc.dll,true,true,The file is signed and the signature was verified.,Microsoft Windows,Microsoft Windows Production PCA 2011
SB0001TEG,gpsvc,Group Policy Client,The service is responsible for applying settings configured by administrators for the computer and users through the Group Policy component. If the service is disabled  the settings will not be applied and applications and components will not be manageable through Group Policy. Any components or applications that depend on the Group Policy component might not be functional if the service is disabled.,C:\Windows\System32\svchost.exe,ec9b8ceb5d8152de1624ca8455fa0974,C:\Windows\system32\svchost.exe -k netsvcs,SERVICE_WIN32_SHARE_PROCESS,C:\Windows\System32\gpsvc.dll,true,true,The file is signed and the signature was verified.,Microsoft Windows,Microsoft Windows Production PCA 2011
SB0001TEG,UALSVC,User Access Logging Service,This service logs unique client access requests  in the form of IP addresses and user names  of installed products and roles on the local server. This information can be queried  via Powershell  by administrators needing to quantify client demand of server software for offline Client Access License (CAL) management. If the service is disabled  client requests will not be logged and will not be retrievable via Powershell queries. Stopping the service will not affect query of historical data (see supporting documentation for steps to delete historical data). The local system administrator must consult his  or her  Windows Server license terms to determine the number of CALs that are required for the server software to be appropriately licensed; use of the UAL service and data does not alter this obligation.,C:\Windows\System32\svchost.exe,ec9b8ceb5d8152de1624ca8455fa0974,C:\Windows\system32\svchost.exe -k LocalSystemNetworkRestricted,SERVICE_WIN32_SHARE_PROCESS,C:\Windows\System32\ualsvc.dll,true,true,The file is signed and the signature was verified.,Microsoft Windows,Microsoft Windows Production PCA 2011
SB0001TEG,USBXHCI,USB xHCI Compliant Host Controller,,C:\Windows\System32\drivers\USBXHCI.SYS,cb16bea4f94e28851962440f0b8171e8,\SystemRoot\System32\drivers\USBXHCI.SYS,SERVICE_KERNEL_DRIVER,,true,true,The file is signed and the signature was verified.,Microsoft Windows,Microsoft Windows Production PCA 2011
SB0001TEG,RdpVideoMiniport,Remote Desktop Video Miniport Driver,,C:\Windows\System32\drivers\rdpvideominiport.sys,e5393580dff1703c80ff6d772f933c50,System32\drivers\rdpvideominiport.sys,SERVICE_KERNEL_DRIVER,,true,true,The file is signed and the signature was verified.,Microsoft Windows,Microsoft Windows Production PCA 2011
