hostname,name,descriptivename,description,path,md5,arguments,type,servicedll,pathsignatureexists,pathsignatureverified,pathsignaturedescription,pathcertificatesubject,pathcertificateissuer
SB0001TEG,acpiex,Microsoft ACPIEx Driver,,C:\Windows\System32\drivers\acpiex.sys,c64cd385c6bd328e47c0f22f2964fc6d,\SystemRoot\System32\Drivers\acpiex.sys,SERVICE_KERNEL_DRIVER,,true,true,The file is signed and the signature was verified.,Microsoft Windows,Microsoft Windows Production PCA 2011
SB0001TEG,PolicyAgent,IPsec Policy Agent,"""Internet Protocol security (IPsec) supports network-level peer authentication  data origin authentication  data integrity  data confidentiality (encryption)  and replay protection.  This service enforces IPsec policies created through the IP Security Policies snap-in or the command-line tool """"netsh ipsec"""".  If you stop this service  you may experience network connectivity issues if your policy requires that connections use IPsec.  Also remote management of Windows Firewall is not available when this service is stopped.""",C:\Windows\System32\svchost.exe,ec9b8ceb5d8152de1624ca8455fa0974,C:\Windows\system32\svchost.exe -k NetworkServiceNetworkRestricted,SERVICE_WIN32_SHARE_PROCESS,C:\Windows\System32\IPSECSVC.DLL,true,true,The file is signed and the signature was verified.,Microsoft Windows,Microsoft Windows Production PCA 2011
SB0001TEG,vmicguestinterface,Hyper-V Guest Service Interface,Provides an interface for the Hyper-V host to interact with specific services running inside the virtual machine.,C:\Windows\System32\svchost.exe,ec9b8ceb5d8152de1624ca8455fa0974,C:\Windows\system32\svchost.exe -k LocalSystemNetworkRestricted,SERVICE_WIN32_SHARE_PROCESS,C:\Windows\System32\icsvc.dll,true,true,The file is signed and the signature was verified.,Microsoft Windows,Microsoft Windows Production PCA 2011
SB0001TEG,gagp30kx,Microsoft Generic AGPv3.0 Filter for K8 Processor Platforms,,C:\Windows\System32\drivers\GAGP30KX.SYS,93bafb6bd35e9ea505b14390da904576,\SystemRoot\System32\drivers\gagp30kx.sys,SERVICE_KERNEL_DRIVER,,true,true,The file is signed and the signature was verified.,Microsoft Windows,Microsoft Windows Production PCA 2011
SB0001TEG,mouhid,Mouse HID Driver,,C:\Windows\System32\drivers\mouhid.sys,45637ad7233127e1c9c27998406c763f,\SystemRoot\System32\drivers\mouhid.sys,SERVICE_KERNEL_DRIVER,,true,true,The file is signed and the signature was verified.,Microsoft Windows,Microsoft Windows Production PCA 2011
SB0001TEG,KSecPkg,KSecPkg,,C:\Windows\System32\drivers\ksecpkg.sys,4a98e88cc5808a41d46ab5109dfc6dcb,\SystemRoot\System32\Drivers\ksecpkg.sys,SERVICE_KERNEL_DRIVER,,true,true,The file is signed and the signature was verified.,Microsoft Windows,Microsoft Windows Production PCA 2011
SB0001TEG,megasas,megasas,,C:\Windows\System32\drivers\megasas.sys,8f5643aef3f6550f4004b41306cc9cad,\SystemRoot\System32\drivers\megasas.sys,SERVICE_KERNEL_DRIVER,,true,true,The file is signed and the signature was verified.,Microsoft Windows,Microsoft Windows Production PCA 2011
SB0001TEG,UCX01000,USB Controller Extension,,C:\Windows\System32\drivers\UCX01000.SYS,d0d3cd454b54bc82e32e041afa1bf95c,\SystemRoot\System32\drivers\ucx01000.sys,SERVICE_KERNEL_DRIVER,,true,true,The file is signed and the signature was verified.,Microsoft Windows,Microsoft Windows Production PCA 2011
SB0001TEG,SENS,System Event Notification Service,Monitors system events and notifies subscribers to COM+ Event System of these events.,C:\Windows\System32\svchost.exe,ec9b8ceb5d8152de1624ca8455fa0974,C:\Windows\system32\svchost.exe -k netsvcs,SERVICE_WIN32_SHARE_PROCESS,C:\Windows\System32\Sens.dll,true,true,The file is signed and the signature was verified.,Microsoft Windows,Microsoft Windows Production PCA 2011
SB0001TEG,AmdK8,AMD K8 Processor Driver,,C:\Windows\System32\drivers\amdk8.sys,e2e98eb9d21f2a7fb06b804bca56e24a,\SystemRoot\System32\drivers\amdk8.sys,SERVICE_KERNEL_DRIVER,,true,true,The file is signed and the signature was verified.,Microsoft Windows,Microsoft Windows Production PCA 2011
SB0001TEG,KtmRm,KtmRm for Distributed Transaction Coordinator,Coordinates transactions between the Distributed Transaction Coordinator (MSDTC) and the Kernel Transaction Manager (KTM). If it is not needed  it is recommended that this service remain stopped. If it is needed  both MSDTC and KTM will start this service automatically. If this service is disabled  any MSDTC transaction interacting with a Kernel Resource Manager will fail and any services that explicitly depend on it will fail to start.,C:\Windows\System32\svchost.exe,ec9b8ceb5d8152de1624ca8455fa0974,C:\Windows\System32\svchost.exe -k NetworkServiceAndNoImpersonation,SERVICE_WIN32_SHARE_PROCESS,C:\Windows\System32\msdtckrm.dll,true,true,The file is signed and the signature was verified.,Microsoft Windows,Microsoft Windows Production PCA 2011
SB0001TEG,IEEtwCollectorService,Internet Explorer ETW Collector Service,ETW Collector Service for Internet Explorer. When running  this service collects real time ETW events and processes them.,C:\Windows\System32\IEEtwCollector.exe,68dc85859df630b17f533b6085bd603d,C:\Windows\system32\IEEtwCollector.exe /V,SERVICE_WIN32_OWN_PROCESS,,true,true,The file is signed and the signature was verified.,Microsoft Windows,Microsoft Windows Production PCA 2011
SB0001TEG,xenfilt,AWS Bus Filter,,C:\Windows\System32\drivers\xenfilt.sys,f09f0d0d25fea2965d7e63b3b27b14e2,\SystemRoot\system32\DRIVERS\xenfilt.sys,SERVICE_KERNEL_DRIVER,,true,true,The file is signed and the signature was verified.,Microsoft Windows Hardware Compatibility Publisher,Microsoft Windows Hardware Compatibility PCA
SB0001TEG,Audiosrv,Windows Audio,Manages audio for Windows-based programs.  If this service is stopped  audio devices and effects will not function properly.  If this service is disabled  any services that explicitly depend on it will fail to start,C:\Windows\System32\svchost.exe,ec9b8ceb5d8152de1624ca8455fa0974,C:\Windows\System32\svchost.exe -k LocalServiceNetworkRestricted,SERVICE_WIN32_SHARE_PROCESS,C:\Windows\System32\audiosrv.dll,true,true,The file is signed and the signature was verified.,Microsoft Windows,Microsoft Windows Production PCA 2011
SB0001TEG,xeniface,AWS Interface,,C:\Windows\System32\drivers\xeniface.sys,ff9cf70119b53d4a05e00505c24b305c,\SystemRoot\System32\drivers\xeniface.sys,SERVICE_KERNEL_DRIVER,,true,true,The file is signed and the signature was verified.,Microsoft Windows Hardware Compatibility Publisher,Microsoft Windows Hardware Compatibility PCA
SB0001TEG,lltdsvc,Link-Layer Topology Discovery Mapper,Creates a Network Map  consisting of PC and device topology (connectivity) information  and metadata describing each PC and device.  If this service is disabled  the Network Map will not function properly.,C:\Windows\System32\svchost.exe,ec9b8ceb5d8152de1624ca8455fa0974,C:\Windows\System32\svchost.exe -k LocalService,SERVICE_WIN32_SHARE_PROCESS,C:\Windows\System32\lltdsvc.dll,true,true,The file is signed and the signature was verified.,Microsoft Windows,Microsoft Windows Production PCA 2011
SB0001TEG,vdrvroot,Microsoft Virtual Drive Enumerator,,C:\Windows\System32\drivers\vdrvroot.sys,e94eb8f793ec00e5f30a7829441c6267,\SystemRoot\System32\drivers\vdrvroot.sys,SERVICE_KERNEL_DRIVER,,true,true,The file is signed and the signature was verified.,Microsoft Windows,Microsoft Windows Production PCA 2011
SB0001TEG,vmicheartbeat,Hyper-V Heartbeat Service,Monitors the state of this virtual machine by reporting a heartbeat at regular intervals. This service helps you identify running virtual machines that have stopped responding.,C:\Windows\System32\svchost.exe,ec9b8ceb5d8152de1624ca8455fa0974,C:\Windows\system32\svchost.exe -k ICService,SERVICE_WIN32_SHARE_PROCESS,C:\Windows\System32\icsvc.dll,true,true,The file is signed and the signature was verified.,Microsoft Windows,Microsoft Windows Production PCA 2011
SB0001TEG,disk,Disk Driver,,C:\Windows\System32\drivers\disk.sys,9251100cee47ff6b2f832abca3712f13,\SystemRoot\System32\drivers\disk.sys,SERVICE_KERNEL_DRIVER,,true,true,The file is signed and the signature was verified.,Microsoft Windows,Microsoft Windows Production PCA 2011
SB0001TEG,xennet,AWS PV Network Device,,C:\Windows\System32\drivers\xennet.sys,fb4caa2dc9e21ade0b18345c054747bd,\SystemRoot\system32\DRIVERS\xennet.sys,SERVICE_KERNEL_DRIVER,,true,true,The file is signed and the signature was verified.,Microsoft Windows Hardware Compatibility Publisher,Microsoft Windows Hardware Compatibility PCA
SB0001TEG,mouclass,Mouse Class Driver,,C:\Windows\System32\drivers\mouclass.sys,f957b0549c63f3c2eeea1c2e558a2943,\SystemRoot\System32\drivers\mouclass.sys,SERVICE_KERNEL_DRIVER,,true,true,The file is signed and the signature was verified.,Microsoft Windows,Microsoft Windows Production PCA 2011
SB0001TEG,srv2,Server SMB 2.xxx Driver,Enables connectivity from Windows Vista and later clients,C:\Windows\System32\drivers\srv2.sys,6928ae594c27bbc636b8eac68a228c35,System32\DRIVERS\srv2.sys,SERVICE_FILE_SYSTEM_DRIVER,,true,true,The file is signed and the signature was verified.,Microsoft Windows,Microsoft Windows Production PCA 2011
SB0001TEG,SCardSvr,Smart Card,Manages access to smart cards read by this computer. If this service is stopped  this computer will be unable to read smart cards. If this service is disabled  any services that explicitly depend on it will fail to start.,C:\Windows\System32\svchost.exe,ec9b8ceb5d8152de1624ca8455fa0974,C:\Windows\system32\svchost.exe -k LocalServiceAndNoImpersonation,SERVICE_WIN32_SHARE_PROCESS,C:\Windows\System32\SCardSvr.dll,true,true,The file is signed and the signature was verified.,Microsoft Windows,Microsoft Windows Production PCA 2011
SB0001TEG,WudfPf,User Mode Driver Frameworks Platform Driver,,C:\Windows\System32\drivers\WUDFPf.sys,10eaf95a0d35f28ccecafcb505ce5f1c,system32\drivers\WudfPf.sys,SERVICE_KERNEL_DRIVER,,true,true,The file is signed and the signature was verified.,Microsoft Windows,Microsoft Windows Production PCA 2011
SB0001TEG,volmgr,Volume Manager Driver,,C:\Windows\System32\drivers\volmgr.sys,d087d45dcd8f717cc0bb9d1e515bb638,\SystemRoot\System32\drivers\volmgr.sys,SERVICE_KERNEL_DRIVER,,true,true,The file is signed and the signature was verified.,Microsoft Windows,Microsoft Windows Production PCA 2011
SB0001TEG,NetBIOS,NetBIOS Interface,NetBIOS Interface,C:\Windows\System32\drivers\netbios.sys,859c87153ccef6404cc9f2abb0df2c4b,system32\DRIVERS\netbios.sys,SERVICE_FILE_SYSTEM_DRIVER,,true,true,The file is signed and the signature was verified.,Microsoft Windows,Microsoft Windows Production PCA 2011
SB0001TEG,RDPDR,Remote Desktop Device Redirector Driver,Remote Desktop Device Redirector Driver,C:\Windows\System32\drivers\rdpdr.sys,e0c79cedd93148e8ca29f340e473490c,System32\drivers\rdpdr.sys,SERVICE_KERNEL_DRIVER,,true,true,The file is signed and the signature was verified.,Microsoft Windows,Microsoft Windows Production PCA 2011
SB0001TEG,DcomLaunch,DCOM Server Process Launcher,The DCOMLAUNCH service launches COM and DCOM servers in response to object activation requests. If this service is stopped or disabled  programs using COM or DCOM will not function properly. It is strongly recommended that you have the DCOMLAUNCH service running.,C:\Windows\System32\svchost.exe,ec9b8ceb5d8152de1624ca8455fa0974,C:\Windows\system32\svchost.exe -k DcomLaunch,SERVICE_WIN32_SHARE_PROCESS,C:\Windows\System32\rpcss.dll,true,true,The file is signed and the signature was verified.,Microsoft Windows,Microsoft Windows Production PCA 2011
SB0001TEG,sfloppy,High-Capacity Floppy Disk Drive,,C:\Windows\System32\drivers\sfloppy.sys,6972facee2394ade34fa321c6b2c5b93,\SystemRoot\System32\drivers\sfloppy.sys,SERVICE_KERNEL_DRIVER,,true,true,The file is signed and the signature was verified.,Microsoft Windows,Microsoft Windows Production PCA 2011
SB0001TEG,agp440,Intel AGP Bus Filter,,C:\Windows\System32\drivers\AGP440.sys,bcf39a3153b03eee3f4ab6178ff4da8a,\SystemRoot\System32\drivers\agp440.sys,SERVICE_KERNEL_DRIVER,,true,true,The file is signed and the signature was verified.,Microsoft Windows,Microsoft Windows Production PCA 2011
SB0001TEG,kbdhid,Keyboard HID Driver,,C:\Windows\System32\drivers\kbdhid.sys,fdad453f3df1d1efe48f5d45b2dbd9ab,\SystemRoot\System32\drivers\kbdhid.sys,SERVICE_KERNEL_DRIVER,,true,true,The file is signed and the signature was verified.,Microsoft Windows,Microsoft Windows Production PCA 2011
SB0001TEG,fdPHost,Function Discovery Provider Host,The FDPHOST service hosts the Function Discovery (FD) network discovery providers. These FD providers supply network discovery services for the Simple Services Discovery Protocol (SSDP) and Web Services – Discovery (WS-D) protocol. Stopping or disabling the FDPHOST service will disable network discovery for these protocols when using FD. When this service is unavailable  network services using FD and relying on these discovery protocols will be unable to find network devices or resources.,C:\Windows\System32\svchost.exe,ec9b8ceb5d8152de1624ca8455fa0974,C:\Windows\system32\svchost.exe -k LocalService,SERVICE_WIN32_SHARE_PROCESS,C:\Windows\System32\fdPHost.dll,true,true,The file is signed and the signature was verified.,Microsoft Windows,Microsoft Windows Production PCA 2011
SB0001TEG,iphlpsvc,IP Helper,Provides tunnel connectivity using IPv6 transition technologies (6to4  ISATAP  Port Proxy  and Teredo)  and IP-HTTPS. If this service is stopped  the computer will not have the enhanced connectivity benefits that these technologies offer.,C:\Windows\System32\svchost.exe,ec9b8ceb5d8152de1624ca8455fa0974,C:\Windows\System32\svchost.exe -k NetSvcs,SERVICE_WIN32_SHARE_PROCESS,C:\Windows\System32\iphlpsvc.dll,true,true,The file is signed and the signature was verified.,Microsoft Windows,Microsoft Windows Production PCA 2011
SB0001TEG,DiagTrack,Diagnostics Tracking Service,The Diagnostics Tracking Service enables data collection about functional issues in Windows components.,C:\Windows\System32\svchost.exe,ec9b8ceb5d8152de1624ca8455fa0974,C:\Windows\System32\svchost.exe -k utcsvc,SERVICE_WIN32_OWN_PROCESS,C:\Windows\System32\diagtrack.dll,true,true,The file is signed and the signature was verified.,Microsoft Windows,Microsoft Windows Production PCA 2011
SB0001TEG,ShellHWDetection,Shell Hardware Detection,Provides notifications for AutoPlay hardware events.,C:\Windows\System32\svchost.exe,ec9b8ceb5d8152de1624ca8455fa0974,C:\Windows\System32\svchost.exe -k netsvcs,SERVICE_WIN32_SHARE_PROCESS,C:\Windows\System32\shsvcs.dll,true,true,The file is signed and the signature was verified.,Microsoft Windows,Microsoft Windows Production PCA 2011
SB0001TEG,AppReadiness,App Readiness,Gets apps ready for use the first time a user signs in to this PC and when adding new apps.,C:\Windows\System32\svchost.exe,ec9b8ceb5d8152de1624ca8455fa0974,C:\Windows\System32\svchost.exe -k AppReadiness,SERVICE_WIN32_SHARE_PROCESS,C:\Windows\System32\AppReadiness.dll,true,true,The file is signed and the signature was verified.,Microsoft Windows,Microsoft Windows Production PCA 2011
SB0001TEG,Psched,QoS Packet Scheduler,QoS Packet Scheduler,C:\Windows\System32\drivers\pacer.sys,6ec13b9cb4ef40390c4c1e06abaa2e9d,\SystemRoot\system32\DRIVERS\pacer.sys,SERVICE_KERNEL_DRIVER,,true,true,The file is signed and the signature was verified.,Microsoft Windows,Microsoft Windows Production PCA 2011
SB0001TEG,srvnet,srvnet,,C:\Windows\System32\drivers\srvnet.sys,8f9323b8fd4ccd9ecd6d75be655d33f4,System32\DRIVERS\srvnet.sys,SERVICE_FILE_SYSTEM_DRIVER,,true,true,The file is signed and the signature was verified.,Microsoft Windows,Microsoft Windows Production PCA 2011
SB0001TEG,RemoteRegistry,Remote Registry,Enables remote users to modify registry settings on this computer. If this service is stopped  the registry can be modified only by users on this computer. If this service is disabled  any services that explicitly depend on it will fail to start.,C:\Windows\System32\svchost.exe,ec9b8ceb5d8152de1624ca8455fa0974,C:\Windows\system32\svchost.exe -k localService,SERVICE_WIN32_SHARE_PROCESS,C:\Windows\System32\regsvc.dll,true,true,The file is signed and the signature was verified.,Microsoft Windows,Microsoft Windows Production PCA 2011
SB0001TEG,HidUsb,Microsoft HID Class Driver,,C:\Windows\System32\drivers\hidusb.sys,ce4d8e76e240abc8f24533d930f860a9,\SystemRoot\System32\drivers\hidusb.sys,SERVICE_KERNEL_DRIVER,,true,true,The file is signed and the signature was verified.,Microsoft Windows,Microsoft Windows Production PCA 2011
SB0001TEG,mrxsmb,SMB MiniRedirector Wrapper and Engine,Implements the framework for the SMB filesystem redirector,C:\Windows\System32\drivers\mrxsmb.sys,2f86e137142da5ca111a0801346c30b6,system32\DRIVERS\mrxsmb.sys,SERVICE_FILE_SYSTEM_DRIVER,,true,true,The file is signed and the signature was verified.,Microsoft Windows,Microsoft Windows Production PCA 2011
SB0001TEG,ALG,Application Layer Gateway Service,Provides support for 3rd party protocol plug-ins for Internet Connection Sharing,C:\Windows\System32\alg.exe,e54a7e24dd93e5344f5a62e00e51bae0,C:\Windows\System32\alg.exe,SERVICE_WIN32_OWN_PROCESS,,true,true,The file is signed and the signature was verified.,Microsoft Windows,Microsoft Windows Production PCA 2011
SB0001TEG,WPDBusEnum,Portable Device Enumerator Service,Enforces group policy for removable mass-storage devices. Enables applications such as Windows Media Player and Image Import Wizard to transfer and synchronize content using removable mass-storage devices.,C:\Windows\System32\svchost.exe,ec9b8ceb5d8152de1624ca8455fa0974,C:\Windows\system32\svchost.exe -k LocalSystemNetworkRestricted,SERVICE_WIN32_SHARE_PROCESS,C:\Windows\System32\wpdbusenum.dll,true,true,The file is signed and the signature was verified.,Microsoft Windows,Microsoft Windows Production PCA 2011
SB0001TEG,amdsbs,amdsbs,,C:\Windows\System32\drivers\amdsbs.sys,40c02a0297cebb8f0f47c0bff52edce5,\SystemRoot\System32\drivers\amdsbs.sys,SERVICE_KERNEL_DRIVER,,true,true,The file is signed and the signature was verified.,Microsoft Windows,Microsoft Windows Production PCA 2011
SB0001TEG,MsBridge,Microsoft MAC Bridge,Microsoft MAC Bridge,C:\Windows\System32\drivers\bridge.sys,a44289e9a6e37f2f0fe0c09dde2264f3,\SystemRoot\system32\DRIVERS\bridge.sys,SERVICE_KERNEL_DRIVER,,true,true,The file is signed and the signature was verified.,Microsoft Windows,Microsoft Windows Production PCA 2011
SB0001TEG,WerSvc,Windows Error Reporting Service,Allows errors to be reported when programs stop working or responding and allows existing solutions to be delivered. Also allows logs to be generated for diagnostic and repair services. If this service is stopped  error reporting might not work correctly and results of diagnostic services and repairs might not be displayed.,C:\Windows\System32\svchost.exe,ec9b8ceb5d8152de1624ca8455fa0974,C:\Windows\System32\svchost.exe -k WerSvcGroup,SERVICE_WIN32_OWN_PROCESS,C:\Windows\System32\wersvc.dll,true,true,The file is signed and the signature was verified.,Microsoft Windows,Microsoft Windows Production PCA 2011
SB0001TEG,AeLookupSvc,Application Experience,Processes application compatibility cache requests for applications as they are launched,C:\Windows\System32\svchost.exe,ec9b8ceb5d8152de1624ca8455fa0974,C:\Windows\system32\svchost.exe -k netsvcs,SERVICE_WIN32_SHARE_PROCESS,C:\Windows\System32\aelupsvc.dll,true,true,The file is signed and the signature was verified.,Microsoft Windows,Microsoft Windows Production PCA 2011
SB0001TEG,pcw,Performance Counters for Windows Driver,,C:\Windows\System32\drivers\pcw.sys,7064f04e5a511c9b5df989846177ac06,\SystemRoot\System32\drivers\pcw.sys,SERVICE_KERNEL_DRIVER,,true,true,The file is signed and the signature was verified.,Microsoft Windows,Microsoft Windows Production PCA 2011
SB0001TEG,iaStorAV,Intel(R) SATA RAID Controller Windows,,C:\Windows\System32\drivers\iaStorAV.sys,e287cf292a910421257b9bd261b1be89,\SystemRoot\System32\drivers\iaStorAV.sys,SERVICE_KERNEL_DRIVER,,true,true,The file is signed and the signature was verified.,Microsoft Windows,Microsoft Windows Production PCA 2011
SB0001TEG,sdstor,SD Storage Port Driver,,C:\Windows\System32\drivers\sdstor.sys,7c953c40c30af3c130553cc60e0e9af9,\SystemRoot\System32\drivers\sdstor.sys,SERVICE_KERNEL_DRIVER,,true,true,The file is signed and the signature was verified.,Microsoft Windows,Microsoft Windows Production PCA 2011
SB0001TEG,dmvsc,dmvsc,,C:\Windows\System32\drivers\dmvsc.sys,47061a184866a5082c2a14e5a1ebfd90,\SystemRoot\System32\drivers\dmvsc.sys,SERVICE_KERNEL_DRIVER,,true,true,The file is signed and the signature was verified.,Microsoft Windows,Microsoft Windows Production PCA 2011
SB0001TEG,ndfltr,NetworkDirect Service,,C:\Windows\System32\drivers\ndfltr.sys,32258598331ac6eca3d28775c97db2aa,\SystemRoot\System32\drivers\ndfltr.sys,SERVICE_KERNEL_DRIVER,,true,true,The file is signed and the signature was verified.,Microsoft Windows,Microsoft Windows Production PCA 2011
SB0001TEG,FontCache,Windows Font Cache Service,Optimizes performance of applications by caching commonly used font data. Applications will start this service if it is not already running. It can be disabled  though doing so will degrade application performance.,C:\Windows\System32\svchost.exe,ec9b8ceb5d8152de1624ca8455fa0974,C:\Windows\system32\svchost.exe -k LocalService,SERVICE_WIN32_SHARE_PROCESS,C:\Windows\System32\FntCache.dll,true,true,The file is signed and the signature was verified.,Microsoft Windows,Microsoft Windows Production PCA 2011
SB0001TEG,gencounter,Microsoft Hyper-V Generation Counter,,C:\Windows\System32\drivers\vmgencounter.sys,4caf89f84def5819f2add6afd5fb94e2,\SystemRoot\System32\drivers\vmgencounter.sys,SERVICE_KERNEL_DRIVER,,true,true,The file is signed and the signature was verified.,Microsoft Windows,Microsoft Windows Production PCA 2011
SB0001TEG,SNMPTRAP,SNMP Trap,Receives trap messages generated by local or remote Simple Network Management Protocol (SNMP) agents and forwards the messages to SNMP management programs running on this computer. If this service is stopped  SNMP-based programs on this computer will not receive SNMP trap messages. If this service is disabled  any services that explicitly depend on it will fail to start.,C:\Windows\System32\snmptrap.exe,718b61e1e03963723c5d2455c1a14b17,C:\Windows\System32\snmptrap.exe,SERVICE_WIN32_OWN_PROCESS,,true,true,The file is signed and the signature was verified.,Microsoft Windows,Microsoft Windows Production PCA 2011
SB0001TEG,ACPI,Microsoft ACPI Driver,,C:\Windows\System32\drivers\acpi.sys,64d2ff145a2d6d8f759da6dd97d861bc,\SystemRoot\System32\drivers\ACPI.sys,SERVICE_KERNEL_DRIVER,,true,true,The file is signed and the signature was verified.,Microsoft Windows,Microsoft Windows Production PCA 2011
SB0001TEG,UEFI,Microsoft UEFI Driver,,C:\Windows\System32\drivers\uefi.sys,af25526495bbe820fc55d7d4988d469c,\SystemRoot\System32\drivers\UEFI.sys,SERVICE_KERNEL_DRIVER,,true,true,The file is signed and the signature was verified.,Microsoft Windows,Microsoft Windows Production PCA 2011
SB0001TEG,Serial,Serial port driver,,C:\Windows\System32\drivers\serial.sys,2aa075686c4986ded7c49352e48b2824,\SystemRoot\System32\drivers\serial.sys,SERVICE_KERNEL_DRIVER,,true,true,The file is signed and the signature was verified.,Microsoft Windows,Microsoft Windows Production PCA 2011
SB0001TEG,DsmSvc,Device Setup Manager,Enables the detection  download and installation of device-related software. If this service is disabled  devices may be configured with outdated software  and may not work correctly.,C:\Windows\System32\svchost.exe,ec9b8ceb5d8152de1624ca8455fa0974,C:\Windows\system32\svchost.exe -k netsvcs,SERVICE_WIN32_SHARE_PROCESS,C:\Windows\System32\DeviceSetupManager.dll,true,true,The file is signed and the signature was verified.,Microsoft Windows,Microsoft Windows Production PCA 2011
SB0001TEG,defragsvc,Optimize drives,Helps the computer run more efficiently by optimizing files on storage drives.,C:\Windows\System32\svchost.exe,ec9b8ceb5d8152de1624ca8455fa0974,C:\Windows\system32\svchost.exe -k defragsvc,SERVICE_WIN32_OWN_PROCESS,C:\Windows\System32\defragsvc.dll,true,true,The file is signed and the signature was verified.,Microsoft Windows,Microsoft Windows Production PCA 2011
SB0001TEG,mrxsmb20,SMB 2.0 MiniRedirector,Implements the SMB 2.0 protocol  which provides connectivity to network resources on Windows Vista and later servers,C:\Windows\System32\drivers\mrxsmb20.sys,2b54f4c921d44481f68e4924b33be6ac,system32\DRIVERS\mrxsmb20.sys,SERVICE_FILE_SYSTEM_DRIVER,,true,true,The file is signed and the signature was verified.,Microsoft Windows,Microsoft Windows Production PCA 2011
SB0001TEG,ql40xx2i,QLogic iSCSI Miniport Inbox Driver,,C:\Windows\System32\drivers\ql40xx2i.sys,77ee14543db9191f241145f2f31e1b55,\SystemRoot\System32\drivers\ql40xx2i.sys,SERVICE_KERNEL_DRIVER,,true,true,The file is signed and the signature was verified.,Microsoft Windows,Microsoft Windows Production PCA 2011
SB0001TEG,PEAUTH,PEAUTH,,C:\Windows\System32\drivers\PEAuth.sys,b9f7970b5527a281d06b4a3b46081ecb,system32\drivers\peauth.sys,SERVICE_KERNEL_DRIVER,,true,true,The file is signed and the signature was verified.,Microsoft Windows,Microsoft Windows Production PCA 2011
SB0001TEG,smbdirect,smbdirect,,C:\Windows\System32\drivers\smbdirect.sys,194d916de198972f37e39f02d4b422e9,System32\DRIVERS\smbdirect.sys,SERVICE_FILE_SYSTEM_DRIVER,,true,true,The file is signed and the signature was verified.,Microsoft Windows,Microsoft Windows Production PCA 2011
SB0001TEG,tsusbhub,Remote Desktop USB Hub,,C:\Windows\System32\drivers\tsusbhub.sys,98c68415089b1f7a77d49a06a8393c5b,\SystemRoot\System32\drivers\tsusbhub.sys,SERVICE_KERNEL_DRIVER,,true,true,The file is signed and the signature was verified.,Microsoft Windows,Microsoft Windows Production PCA 2011
