hostname,name,descriptivename,description,path,md5,arguments,type,servicedll,pathsignatureexists,pathsignatureverified,pathsignaturedescription,pathcertificatesubject,pathcertificateissuer
SB0001TEG,AcpiPmi,ACPI Power Meter Driver,,C:\Windows\System32\drivers\acpipmi.sys,4d3af8bde0d24883c7f47d319810ace2,\SystemRoot\System32\drivers\acpipmi.sys,SERVICE_KERNEL_DRIVER,,true,true,The file is signed and the signature was verified.,Microsoft Windows,Microsoft Windows Production PCA 2011
SB0001TEG,sppsvc,Software Protection,Enables the download  installation and enforcement of digital licenses for Windows and Windows applications. If the service is disabled  the operating system and licensed applications may run in a notification mode. It is strongly recommended that you not disable the Software Protection service.,C:\Windows\System32\sppsvc.exe,4c90d5abc2e34bcfee87f754ba8b4baa,C:\Windows\system32\sppsvc.exe,SERVICE_WIN32_OWN_PROCESS,,true,true,The file is signed and the signature was verified.,Microsoft Windows,Microsoft Windows Production PCA 2011
SB0001TEG,RasPppoe,Remote Access PPPOE Driver,Remote Access PPPOE Driver,C:\Windows\System32\drivers\raspppoe.sys,0efb3c5e5ce2dc260a32b5afa0377192,\SystemRoot\System32\drivers\raspppoe.sys,SERVICE_KERNEL_DRIVER,,true,true,The file is signed and the signature was verified.,Microsoft Windows,Microsoft Windows Production PCA 2011
SB0001TEG,HDAudBus,Microsoft UAA Bus Driver for High Definition Audio,,C:\Windows\System32\drivers\hdaudbus.sys,26eb03194e7040c9a2be32673e0af672,\SystemRoot\System32\drivers\HDAudBus.sys,SERVICE_KERNEL_DRIVER,,true,true,The file is signed and the signature was verified.,Microsoft Windows,Microsoft Windows Production PCA 2011
SB0001TEG,SystemEventsBroker,System Events Broker,Coordinates execution of background work for WinRT application. If this service is stopped or disabled  then background work might not be triggered.,C:\Windows\System32\svchost.exe,ec9b8ceb5d8152de1624ca8455fa0974,C:\Windows\system32\svchost.exe -k DcomLaunch,SERVICE_WIN32_SHARE_PROCESS,C:\Windows\System32\SystemEventsBrokerServer.dll,true,true,The file is signed and the signature was verified.,Microsoft Windows,Microsoft Windows Production PCA 2011
SB0001TEG,AppIDSvc,Application Identity,Determines and verifies the identity of an application. Disabling this service will prevent AppLocker from being enforced.,C:\Windows\System32\svchost.exe,ec9b8ceb5d8152de1624ca8455fa0974,C:\Windows\system32\svchost.exe -k LocalServiceNetworkRestricted,SERVICE_WIN32_SHARE_PROCESS,C:\Windows\System32\appidsvc.dll,true,true,The file is signed and the signature was verified.,Microsoft Windows,Microsoft Windows Production PCA 2011
SB0001TEG,PSUAService,Panda Product Service,Panda Product Service,C:\Program Files (x86)\Panda Security\Panda Security Protection\PSUAService.exe,350dadbc3c4ce65bea91324fe6f9e73f,C:\Program Files (x86)\Panda Security\Panda Security Protection\PSUAService.exe,SERVICE_WIN32_OWN_PROCESS,,true,true,The file is signed and the signature was verified.,Panda Security S.L.,DigiCert Assured ID Code Signing CA-1
SB0001TEG,MSDTC,Distributed Transaction Coordinator,Coordinates transactions that span multiple resource managers  such as databases  message queues  and file systems. If this service is stopped  these transactions will fail. If this service is disabled  any services that explicitly depend on it will fail to start.,C:\Windows\System32\msdtc.exe,1a95c6429072fd4180d3fbf627a8e649,C:\Windows\System32\msdtc.exe,SERVICE_WIN32_OWN_PROCESS,,true,true,The file is signed and the signature was verified.,Microsoft Windows,Microsoft Windows Production PCA 2011
SB0001TEG,TermService,Remote Desktop Services,Allows users to connect interactively to a remote computer. Remote Desktop and Remote Desktop Session Host Server depend on this service.  To prevent remote use of this computer  clear the checkboxes on the Remote tab of the System properties control panel item.,C:\Windows\System32\svchost.exe,ec9b8ceb5d8152de1624ca8455fa0974,C:\Windows\System32\svchost.exe -k termsvcs,SERVICE_WIN32_SHARE_PROCESS,C:\Windows\System32\termsrv.dll,true,true,The file is signed and the signature was verified.,Microsoft Windows,Microsoft Windows Production PCA 2011
SB0001TEG,CNG,CNG,,C:\Windows\System32\drivers\cng.sys,64faa9514cdeaf38dcaec418ee7d8405,\SystemRoot\System32\Drivers\cng.sys,SERVICE_KERNEL_DRIVER,,true,true,The file is signed and the signature was verified.,Microsoft Windows,Microsoft Windows Production PCA 2011
SB0001TEG,xenvbd,AWS PV Storage Host Adapter,,C:\Windows\System32\drivers\xenvbd.sys,93c778514366156b7f58346b43721e54,\SystemRoot\system32\DRIVERS\xenvbd.sys,SERVICE_KERNEL_DRIVER,,true,true,The file is signed and the signature was verified.,Microsoft Windows Hardware Compatibility Publisher,Microsoft Windows Hardware Compatibility PCA
SB0001TEG,ebdrv,Broadcom NetXtreme II 10 GigE VBD,,C:\Windows\System32\drivers\evbda.sys,81ad26eb883cfe3841666c7d04713c88,\SystemRoot\System32\drivers\evbda.sys,SERVICE_KERNEL_DRIVER,,true,true,The file is signed and the signature was verified.,Microsoft Windows,Microsoft Windows Production PCA 2011
SB0001TEG,Panda VPN Service,Panda VPN Service,,C:\Program Files (x86)\Panda Security\Panda Security Protection\Hydra.Sdk.Windows.Service.exe,e8f155ccddc50de00cfedc6f7449cc19,C:\Program Files (x86)\Panda Security\Panda Security Protection\Hydra.Sdk.Windows.Service.exe,SERVICE_WIN32_OWN_PROCESS,,true,true,The file is signed and the signature was verified.,AnchorFree Inc,Symantec Class 3 SHA256 Code Signing CA
SB0001TEG,rdpbus,Remote Desktop Device Redirector Bus Driver,,C:\Windows\System32\drivers\rdpbus.sys,0367392d78803f2442eada006fc787ae,\SystemRoot\System32\drivers\rdpbus.sys,SERVICE_KERNEL_DRIVER,,true,true,The file is signed and the signature was verified.,Microsoft Windows,Microsoft Windows Production PCA 2011
SB0001TEG,ADP80XX,ADP80XX,,C:\Windows\System32\drivers\adp80xx.sys,ba5a7e277abf8b70e06ad21215faedf6,\SystemRoot\System32\drivers\ADP80XX.SYS,SERVICE_KERNEL_DRIVER,,true,true,The file is signed and the signature was verified.,Microsoft Windows,Microsoft Windows Production PCA 2011
SB0001TEG,elxstor,elxstor,,C:\Windows\System32\drivers\elxstor.sys,deba469a9d0b4aa9d7c7b286780b4982,\SystemRoot\System32\drivers\elxstor.sys,SERVICE_KERNEL_DRIVER,,true,true,The file is signed and the signature was verified.,Microsoft Windows,Microsoft Windows Production PCA 2011
SB0001TEG,FileInfo,File Information FS MiniFilter,Collects information about files in memory to be consumed by other system services.,C:\Windows\System32\drivers\fileinfo.sys,04f1aae764a3411118ce5b4fe115ae9f,\SystemRoot\System32\drivers\fileinfo.sys,SERVICE_FILE_SYSTEM_DRIVER,,true,true,The file is signed and the signature was verified.,Microsoft Windows,Microsoft Windows Production PCA 2011
SB0001TEG,rdpbus,Remote Desktop Device Redirector Bus Driver,,C:\Windows\System32\drivers\rdpbus.sys,1120bd235d0f3d99002efde17e0381b5,\SystemRoot\System32\drivers\rdpbus.sys,SERVICE_KERNEL_DRIVER,,true,true,The file is signed and the signature was verified.,Microsoft Windows,Microsoft Windows Production PCA 2011
SB0001TEG,nvstor,nvstor,,C:\Windows\System32\drivers\nvstor.sys,d9b2eb508ee63f403e4bb0dbe4384c44,\SystemRoot\System32\drivers\nvstor.sys,SERVICE_KERNEL_DRIVER,,true,true,The file is signed and the signature was verified.,Microsoft Windows,Microsoft Windows Production PCA 2011
SB0001TEG,msisadrv,msisadrv,,C:\Windows\System32\drivers\msisadrv.sys,717970aaca7e86ec696dbc37fb46f792,\SystemRoot\System32\drivers\msisadrv.sys,SERVICE_KERNEL_DRIVER,,true,true,The file is signed and the signature was verified.,Microsoft Windows,Microsoft Windows Production PCA 2011
SB0001TEG,vmictimesync,Hyper-V Time Synchronization Service,Synchronizes the system time of this virtual machine with the system time of the physical computer.,C:\Windows\System32\svchost.exe,ec9b8ceb5d8152de1624ca8455fa0974,C:\Windows\system32\svchost.exe -k LocalServiceNetworkRestricted,SERVICE_WIN32_SHARE_PROCESS,C:\Windows\System32\icsvc.dll,true,true,The file is signed and the signature was verified.,Microsoft Windows,Microsoft Windows Production PCA 2011
SB0001TEG,partmgr,Partition Manager,Disk class filter driver that auctions out partitions to volume managers,C:\Windows\System32\drivers\partmgr.sys,da4df19632e5267cbdad66ef61170c86,\SystemRoot\System32\drivers\partmgr.sys,SERVICE_KERNEL_DRIVER,,true,true,The file is signed and the signature was verified.,Microsoft Windows,Microsoft Windows Production PCA 2011
SB0001TEG,WMPNetworkSvc,Windows Media Player Network Sharing Service,Shares Windows Media Player libraries with other networked players and media devices using Universal Plug and Play,C:\Program Files\Windows Media Player\wmpnetwk.exe,f71e7889037e8ee51a80ab76092c1c84,C:\Program Files\Windows Media Player\wmpnetwk.exe,SERVICE_WIN32_OWN_PROCESS,,true,true,The file is signed and the signature was verified.,Microsoft Windows,Microsoft Windows Production PCA 2011
SB0001TEG,SCPolicySvc,Smart Card Removal Policy,Allows the system to be configured to lock the user desktop upon smart card removal.,C:\Windows\System32\svchost.exe,ec9b8ceb5d8152de1624ca8455fa0974,C:\Windows\system32\svchost.exe -k netsvcs,SERVICE_WIN32_SHARE_PROCESS,C:\Windows\System32\certprop.dll,true,true,The file is signed and the signature was verified.,Microsoft Windows,Microsoft Windows Production PCA 2011
SB0001TEG,SstpSvc,Secure Socket Tunneling Protocol Service,Provides support for the Secure Socket Tunneling Protocol (SSTP) to connect to remote computers using VPN. If this service is disabled  users will not be able to use SSTP to access remote servers.,C:\Windows\System32\svchost.exe,ec9b8ceb5d8152de1624ca8455fa0974,C:\Windows\system32\svchost.exe -k LocalService,SERVICE_WIN32_SHARE_PROCESS,C:\Windows\System32\sstpsvc.dll,true,true,The file is signed and the signature was verified.,Microsoft Windows,Microsoft Windows Production PCA 2011
SB0001TEG,DXGKrnl,LDDM Graphics Subsystem,Controls the underlying video driver stacks to provide fully-featured display capabilities.,C:\Windows\System32\drivers\dxgkrnl.sys,715c16d0ae8232ea197359d88ed54751,\SystemRoot\System32\drivers\dxgkrnl.sys,SERVICE_KERNEL_DRIVER,,true,true,The file is signed and the signature was verified.,Microsoft Windows,Microsoft Windows Production PCA 2011
SB0001TEG,vpci,Microsoft Hyper-V Virtual PCI Bus,,C:\Windows\System32\drivers\vpci.sys,32c367244c0cc09c32181baf25c2300c,\SystemRoot\System32\drivers\vpci.sys,SERVICE_KERNEL_DRIVER,,true,true,The file is signed and the signature was verified.,Microsoft Windows,Microsoft Windows Production PCA 2011
SB0001TEG,LanmanServer,Server,Supports file  print  and named-pipe sharing over the network for this computer. If this service is stopped  these functions will be unavailable. If this service is disabled  any services that explicitly depend on it will fail to start.,C:\Windows\System32\svchost.exe,ec9b8ceb5d8152de1624ca8455fa0974,C:\Windows\system32\svchost.exe -k netsvcs,SERVICE_WIN32_SHARE_PROCESS,C:\Windows\System32\srvsvc.dll,true,true,The file is signed and the signature was verified.,Microsoft Windows,Microsoft Windows Production PCA 2011
SB0001TEG,netvsc,netvsc,,C:\Windows\System32\drivers\netvsc63.sys,2774c2e2976c5cd7feb3315d668526cc,\SystemRoot\System32\drivers\netvsc63.sys,SERVICE_KERNEL_DRIVER,,true,true,The file is signed and the signature was verified.,Microsoft Windows,Microsoft Windows Production PCA 2011
SB0001TEG,VSTXRAID,VIA StorX Storage RAID Controller Windows Driver,,C:\Windows\System32\drivers\VSTXRAID.SYS,3473a92fb2585f6964ff87d53bdb028f,\SystemRoot\System32\drivers\vstxraid.sys,SERVICE_KERNEL_DRIVER,,true,true,The file is signed and the signature was verified.,Microsoft Windows,Microsoft Windows Production PCA 2011
SB0001TEG,Mup,Mup,Multiple UNC Provider Driver,C:\Windows\System32\drivers\mup.sys,3af219a14e37ffdbb5adcb69c553029f,\SystemRoot\System32\Drivers\mup.sys,SERVICE_FILE_SYSTEM_DRIVER,,true,true,The file is signed and the signature was verified.,Microsoft Windows,Microsoft Windows Production PCA 2011
SB0001TEG,storvsp,storvsp,,C:\Windows\System32\drivers\storvsp.sys,d979ef6269a04c9ee450d790b46e2317,\SystemRoot\System32\drivers\storvsp.sys,SERVICE_KERNEL_DRIVER,,true,true,The file is signed and the signature was verified.,Microsoft Windows,Microsoft Windows Production PCA 2011
SB0001TEG,viaide,viaide,,C:\Windows\System32\drivers\viaide.sys,03ccd44658a31ef4d925c7e981989679,\SystemRoot\System32\drivers\viaide.sys,SERVICE_KERNEL_DRIVER,,true,true,The file is signed and the signature was verified.,Microsoft Windows,Microsoft Windows Production PCA 2011
SB0001TEG,pla,Performance Logs &amp; Alerts,Performance Logs and Alerts Collects performance data from local or remote computers based on preconfigured schedule parameters  then writes the data to a log or triggers an alert. If this service is stopped  performance information will not be collected. If this service is disabled  any services that explicitly depend on it will fail to start.,C:\Windows\System32\svchost.exe,ec9b8ceb5d8152de1624ca8455fa0974,C:\Windows\System32\svchost.exe -k LocalServiceNoNetwork,SERVICE_WIN32_SHARE_PROCESS,C:\Windows\System32\pla.dll,true,true,The file is signed and the signature was verified.,Microsoft Windows,Microsoft Windows Production PCA 2011
SB0001TEG,npsvctrig,Named pipe service trigger provider,,C:\Windows\System32\drivers\npsvctrig.sys,38a83a3603ef180bb8d629d51f8cbf1a,\SystemRoot\System32\drivers\npsvctrig.sys,SERVICE_KERNEL_DRIVER,,true,true,The file is signed and the signature was verified.,Microsoft Windows,Microsoft Windows Production PCA 2011
SB0001TEG,DeviceAssociationService,Device Association Service,Enables pairing between the system and wired or wireless devices.,C:\Windows\System32\svchost.exe,ec9b8ceb5d8152de1624ca8455fa0974,C:\Windows\system32\svchost.exe -k LocalSystemNetworkRestricted,SERVICE_WIN32_SHARE_PROCESS,C:\Windows\System32\das.dll,true,true,The file is signed and the signature was verified.,Microsoft Windows,Microsoft Windows Production PCA 2011
SB0001TEG,intelppm,Intel Processor Driver,,C:\Windows\System32\drivers\intelppm.sys,afe46e924dcac079de306cf2cd4009cd,\SystemRoot\System32\drivers\intelppm.sys,SERVICE_KERNEL_DRIVER,,true,true,The file is signed and the signature was verified.,Microsoft Windows,Microsoft Windows Production PCA 2011
SB0001TEG,mountmgr,Mount Point Manager,Driver responsible with maintaining persistent drive letters and names for volumes,C:\Windows\System32\drivers\mountmgr.sys,f210ded6c1e6de9b95fbb4f68d45a9c3,\SystemRoot\System32\drivers\mountmgr.sys,SERVICE_KERNEL_DRIVER,,true,true,The file is signed and the signature was verified.,Microsoft Windows,Microsoft Windows Production PCA 2011
SB0001TEG,AudioEndpointBuilder,Windows Audio Endpoint Builder,Manages audio devices for the Windows Audio service.  If this service is stopped  audio devices and effects will not function properly.  If this service is disabled  any services that explicitly depend on it will fail to start,C:\Windows\System32\svchost.exe,ec9b8ceb5d8152de1624ca8455fa0974,C:\Windows\System32\svchost.exe -k LocalSystemNetworkRestricted,SERVICE_WIN32_SHARE_PROCESS,C:\Windows\System32\AudioEndpointBuilder.dll,true,true,The file is signed and the signature was verified.,Microsoft Windows,Microsoft Windows Production PCA 2011
SB0001TEG,cfn-hup,CloudFormation cfn-hup,CloudFormation cfn-hup for Windows,C:\Program Files\Amazon\cfn-bootstrap\winhup.exe,37781e13d70ddb192c05099e66598f41,C:\Program Files\Amazon\cfn-bootstrap\winhup.exe,SERVICE_WIN32_OWN_PROCESS,,false,false,The file is not signed.,,
SB0001TEG,SSDPSRV,SSDP Discovery,Discovers networked devices and services that use the SSDP discovery protocol  such as UPnP devices. Also announces SSDP devices and services running on the local computer. If this service is stopped  SSDP-based devices will not be discovered. If this service is disabled  any services that explicitly depend on it will fail to start.,C:\Windows\System32\svchost.exe,ec9b8ceb5d8152de1624ca8455fa0974,C:\Windows\system32\svchost.exe -k LocalServiceAndNoImpersonation,SERVICE_WIN32_SHARE_PROCESS,C:\Windows\System32\ssdpsrv.dll,true,true,The file is signed and the signature was verified.,Microsoft Windows,Microsoft Windows Production PCA 2011
SB0001TEG,usbhub,Microsoft USB Standard Hub Driver,,C:\Windows\System32\drivers\usbhub.sys,1bafb28ba5f79d57866e943eaee6b05c,\SystemRoot\System32\drivers\usbhub.sys,SERVICE_KERNEL_DRIVER,,true,true,The file is signed and the signature was verified.,Microsoft Windows,Microsoft Windows Production PCA 2011
SB0001TEG,IPNAT,IP Network Address Translator,,C:\Windows\System32\drivers\ipnat.sys,b48f3f382965d654419a67b271f2c7a3,System32\drivers\ipnat.sys,SERVICE_KERNEL_DRIVER,,true,true,The file is signed and the signature was verified.,Microsoft Windows,Microsoft Windows Production PCA 2011
SB0001TEG,SiSRaid2,SiSRaid2,,C:\Windows\System32\drivers\sisraid2.sys,d373792528a6de4f21f98d77d3d09d09,\SystemRoot\System32\drivers\SiSRaid2.sys,SERVICE_KERNEL_DRIVER,,true,true,The file is signed and the signature was verified.,Microsoft Windows,Microsoft Windows Production PCA 2011
SB0001TEG,Themes,Themes,Provides user experience theme management.,C:\Windows\System32\svchost.exe,ec9b8ceb5d8152de1624ca8455fa0974,C:\Windows\System32\svchost.exe -k netsvcs,SERVICE_WIN32_SHARE_PROCESS,C:\Windows\System32\themeservice.dll,true,true,The file is signed and the signature was verified.,Microsoft Windows,Microsoft Windows Production PCA 2011
SB0001TEG,RasAuto,Remote Access Auto Connection Manager,Creates a connection to a remote network whenever a program references a remote DNS or NetBIOS name or address.,C:\Windows\System32\svchost.exe,ec9b8ceb5d8152de1624ca8455fa0974,C:\Windows\System32\svchost.exe -k netsvcs,SERVICE_WIN32_SHARE_PROCESS,C:\Windows\System32\rasauto.dll,true,true,The file is signed and the signature was verified.,Microsoft Windows,Microsoft Windows Production PCA 2011
SB0001TEG,WinNat,Windows NAT Driver,This service provides network address translation functionality,C:\Windows\System32\drivers\winnat.sys,1a4fd18b3012d3644acf80bdcdcc2a4e,system32\drivers\winnat.sys,SERVICE_KERNEL_DRIVER,,true,true,The file is signed and the signature was verified.,Microsoft Windows,Microsoft Windows Production PCA 2011
SB0001TEG,TapiSrv,Telephony,Provides Telephony API (TAPI) support for programs that control telephony devices on the local computer and  through the LAN  on servers that are also running the service.,C:\Windows\System32\svchost.exe,ec9b8ceb5d8152de1624ca8455fa0974,C:\Windows\System32\svchost.exe -k tapisrv,SERVICE_WIN32_OWN_PROCESS,C:\Windows\System32\tapisrv.dll,true,true,The file is signed and the signature was verified.,Microsoft Windows,Microsoft Windows Production PCA 2011
SB0001TEG,FltMgr,FltMgr,File System Filter Manager Driver,C:\Windows\System32\drivers\fltMgr.sys,634778138e0e3caa6ccf06272f736a9f,\SystemRoot\system32\drivers\fltmgr.sys,SERVICE_FILE_SYSTEM_DRIVER,,true,true,The file is signed and the signature was verified.,Microsoft Windows,Microsoft Windows Production PCA 2011
SB0001TEG,NcaSvc,Network Connectivity Assistant,Provides DirectAccess status notification for UI components,C:\Windows\System32\svchost.exe,ec9b8ceb5d8152de1624ca8455fa0974,C:\Windows\System32\svchost.exe -k NetSvcs,SERVICE_WIN32_SHARE_PROCESS,C:\Windows\System32\NcaSvc.dll,true,true,The file is signed and the signature was verified.,Microsoft Windows,Microsoft Windows Production PCA 2011
SB0001TEG,WmiAcpi,Microsoft Windows Management Interface for ACPI,,C:\Windows\System32\drivers\wmiacpi.sys,0a833b34e721ffa92886db3b777dae56,\SystemRoot\System32\drivers\wmiacpi.sys,SERVICE_KERNEL_DRIVER,,true,true,The file is signed and the signature was verified.,Microsoft Windows,Microsoft Windows Production PCA 2011
SB0001TEG,TsUsbGD,Remote Desktop Generic USB Device,,C:\Windows\System32\drivers\TsUsbGD.sys,66c52349ac606fdf059cae10e4d5eb6c,\SystemRoot\System32\drivers\TsUsbGD.sys,SERVICE_KERNEL_DRIVER,,true,true,The file is signed and the signature was verified.,Microsoft Windows,Microsoft Windows Production PCA 2011
SB0001TEG,rspndr,Link-Layer Topology Discovery Responder,,C:\Windows\System32\drivers\rspndr.sys,9962debb482a951c8ddf6f0009fb74e2,\SystemRoot\system32\DRIVERS\rspndr.sys,SERVICE_KERNEL_DRIVER,,true,true,The file is signed and the signature was verified.,Microsoft Windows,Microsoft Windows Production PCA 2011
SB0001TEG,udfs,udfs,Reads/Writes UDF 1.02 1.5 2.0x 2.5 disc formats  usually found on C/DVD discs. (Core) (All pieces),C:\Windows\System32\drivers\udfs.sys,cb6c785e8fda29cca0c79f94ee69927d,system32\DRIVERS\udfs.sys,SERVICE_FILE_SYSTEM_DRIVER,,true,true,The file is signed and the signature was verified.,Microsoft Windows,Microsoft Windows Production PCA 2011
SB0001TEG,ErrDev,Microsoft Hardware Error Device Driver,,C:\Windows\System32\drivers\errdev.sys,9c1171163bd789b245f48c4cf6cf8d4d,\SystemRoot\System32\drivers\errdev.sys,SERVICE_KERNEL_DRIVER,,true,true,The file is signed and the signature was verified.,Microsoft Windows,Microsoft Windows Production PCA 2011
SB0001TEG,HidBatt,HID UPS Battery Driver,,C:\Windows\System32\drivers\hidbatt.sys,b32a5e336b1e7882a3e200a2303f7c8d,\SystemRoot\System32\drivers\HidBatt.sys,SERVICE_KERNEL_DRIVER,,true,true,The file is signed and the signature was verified.,Microsoft Windows,Microsoft Windows Production PCA 2011
SB0001TEG,upnphost,UPnP Device Host,Allows UPnP devices to be hosted on this computer. If this service is stopped  any hosted UPnP devices will stop functioning and no additional hosted devices can be added. If this service is disabled  any services that explicitly depend on it will fail to start.,C:\Windows\System32\svchost.exe,ec9b8ceb5d8152de1624ca8455fa0974,C:\Windows\system32\svchost.exe -k LocalServiceAndNoImpersonation,SERVICE_WIN32_SHARE_PROCESS,C:\Windows\System32\upnphost.dll,true,true,The file is signed and the signature was verified.,Microsoft Windows,Microsoft Windows Production PCA 2011
SB0001TEG,LSI_SAS2,LSI_SAS2,,C:\Windows\System32\drivers\lsi_sas2.sys,238ed53acb40e7bdb22629de9e58cd3e,\SystemRoot\System32\drivers\lsi_sas2.sys,SERVICE_KERNEL_DRIVER,,true,true,The file is signed and the signature was verified.,Microsoft Windows,Microsoft Windows Production PCA 2011
SB0001TEG,vmicshutdown,Hyper-V Guest Shutdown Service,Provides a mechanism to shut down the operating system of this virtual machine from the management interfaces on the physical computer.,C:\Windows\System32\svchost.exe,ec9b8ceb5d8152de1624ca8455fa0974,C:\Windows\system32\svchost.exe -k LocalSystemNetworkRestricted,SERVICE_WIN32_SHARE_PROCESS,C:\Windows\System32\icsvc.dll,true,true,The file is signed and the signature was verified.,Microsoft Windows,Microsoft Windows Production PCA 2011
SB0001TEG,i8042prt,i8042 Keyboard and PS/2 Mouse Port Driver,,C:\Windows\System32\drivers\i8042prt.sys,9db47b5718f00d9cb2a8dbacd9d0ebb7,\SystemRoot\System32\drivers\i8042prt.sys,SERVICE_KERNEL_DRIVER,,true,true,The file is signed and the signature was verified.,Microsoft Windows,Microsoft Windows Production PCA 2011
SB0001TEG,Vid,Vid,,C:\Windows\System32\drivers\Vid.sys,54be341034170e9998e7a8a2749bf4a9,\SystemRoot\System32\drivers\Vid.sys,SERVICE_KERNEL_DRIVER,,true,true,The file is signed and the signature was verified.,Microsoft Windows,Microsoft Windows Production PCA 2011
SB0001TEG,VSS,Volume Shadow Copy,Manages and implements Volume Shadow Copies used for backup and other purposes. If this service is stopped  shadow copies will be unavailable for backup and the backup may fail. If this service is disabled  any services that explicitly depend on it will fail to start.,C:\Windows\System32\VSSVC.exe,7606beac21f4249081eeda89a165b69c,C:\Windows\system32\vssvc.exe,SERVICE_WIN32_OWN_PROCESS,,true,true,The file is signed and the signature was verified.,Microsoft Windows,Microsoft Windows Production PCA 2011
SB0001TEG,tdx,NetIO Legacy TDI Support Driver,NetIO Legacy TDI Support Driver,C:\Windows\System32\drivers\tdx.sys,b45122e57c62168f31f6c06ef34dcdcc,\SystemRoot\system32\DRIVERS\tdx.sys,SERVICE_KERNEL_DRIVER,,true,true,The file is signed and the signature was verified.,Microsoft Windows,Microsoft Windows Production PCA 2011
SB0001TEG,isapnp,isapnp,,C:\Windows\System32\drivers\isapnp.sys,77c71caaa481fc08c101f05a3b168f08,\SystemRoot\System32\drivers\isapnp.sys,SERVICE_KERNEL_DRIVER,,true,true,The file is signed and the signature was verified.,Microsoft Windows,Microsoft Windows Production PCA 2011
SB0001TEG,Ndisuio,NDIS Usermode I/O Protocol,,C:\Windows\System32\drivers\ndisuio.sys,a5207f3267e72fe0de73d748beab1f64,\SystemRoot\system32\DRIVERS\ndisuio.sys,SERVICE_KERNEL_DRIVER,,true,true,The file is signed and the signature was verified.,Microsoft Windows,Microsoft Windows Production PCA 2011
SB0001TEG,KPSSVC,KDC Proxy Server service (KPS),KDC Proxy Server service runs on edge servers to proxy Kerberos protocol messages to domain controllers on the corporate network.,C:\Windows\System32\svchost.exe,ec9b8ceb5d8152de1624ca8455fa0974,C:\Windows\system32\svchost.exe -k KpsSvcGroup,SERVICE_WIN32_SHARE_PROCESS,C:\Windows\System32\kpssvc.dll,true,true,The file is signed and the signature was verified.,Microsoft Windows,Microsoft Windows Production PCA 2011
SB0001TEG,FsDepends,File System Dependency Minifilter,This minifilter tracks the dependencies associated with the various nested volumes/filesystems,C:\Windows\System32\drivers\FsDepends.sys,20f5c95d609ffda2833f9144708cbead,System32\drivers\FsDepends.sys,SERVICE_FILE_SYSTEM_DRIVER,,true,true,The file is signed and the signature was verified.,Microsoft Windows,Microsoft Windows Production PCA 2011
