hostname,name,pid,descriptivename,description,path,pathmd5sum,arguments,pathcertificatesubject,pathsignatureverified,pathsignaturedescription,pathcertificateissuer
EL0001DHA,Serenum,0,Serenum Filter Driver,,C:\Windows\System32\drivers\serenum.sys,f6a3c2ad02f6c1fb4eac650cb1de932d,\SystemRoot\system32\drivers\serenum.sys,Microsoft Windows,true,The file is signed and the signature was verified.,Microsoft Windows Verification PCA
EL0001DHA,TermDD,0,Terminal Device Driver,,C:\Windows\System32\drivers\termdd.sys,e01187435335490f7c4d505f93bf2a1a,\SystemRoot\system32\drivers\termdd.sys,Microsoft Windows,true,The file is signed and the signature was verified.,Microsoft Windows Verification PCA
EL0001DHA,sffp_sd,0,SFF Storage Protocol Driver for SDBus,,C:\Windows\System32\drivers\sffp_sd.sys,b519eac8f1494e1440c4b057e90c0a7b,\SystemRoot\system32\drivers\sffp_sd.sys,Microsoft Windows,true,The file is signed and the signature was verified.,Microsoft Windows Verification PCA
EL0001DHA,storflt,0,Disk Virtual Machine Bus Acceleration Filter Driver,,C:\Windows\System32\drivers\vmstorfl.sys,86f74f4b165ff2ae9e47c54b6254b887,\SystemRoot\system32\drivers\vmstorfl.sys,Microsoft Windows,true,The file is signed and the signature was verified.,Microsoft Windows Verification PCA
EL0001DHA,BrSerWdm,0,Brother WDM Serial driver,,C:\Windows\System32\drivers\BrSerWdm.sys,10e82f3d506503bd1a0dbe7f3854e9eb,\SystemRoot\System32\Drivers\BrSerWdm.sys,Microsoft Windows,true,The file is signed and the signature was verified.,Microsoft Windows Verification PCA
EL0001DHA,mrxsmb10,0,SMB 1.x MiniRedirector,Implements the SMB 1.x (CIFS) protocol. This protocol provides connectivity to network resources on pre-Windows Vista servers,C:\Windows\System32\drivers\mrxsmb10.sys,004a9c2075b36a36e4cbd0f269434094,system32\DRIVERS\mrxsmb10.sys,Microsoft Windows,true,The file is signed and the signature was verified.,Microsoft Windows Verification PCA
EL0001DHA,NetTcpPortSharing,0,Net.Tcp Port Sharing Service,Provides ability to share TCP ports over the net.tcp protocol.,C:\Windows\Microsoft.NET\Framework64\v4.0.30319\SMSvcHost.exe,23ce3d543727580c9e3ba203cba30581,C:\Windows\Microsoft.NET\Framework64\v4.0.30319\SMSvcHost.exe,Microsoft Corporation,true,The file is signed and the signature was verified.,Microsoft Code Signing PCA
EL0001DHA,DPS,768,Diagnostic Policy Service,The Diagnostic Policy Service enables problem detection  troubleshooting and resolution for Windows components.  If this service is stopped  diagnostics will no longer function.,C:\Windows\System32\svchost.exe,963af53a6aa75d0adab976f536638a6f,C:\Windows\System32\svchost.exe -k LocalServiceNoNetwork,Microsoft Windows,true,The file is signed and the signature was verified.,Microsoft Windows Verification PCA
EL0001DHA,ws2ifsl,0,Winsock IFS Driver,Winsock IFS Driver,C:\Windows\System32\drivers\ws2ifsl.sys,7cd991080b6d5076c94a216c095c3ab0,\SystemRoot\system32\drivers\ws2ifsl.sys,Microsoft Windows,true,The file is signed and the signature was verified.,Microsoft Windows Verification PCA
EL0001DHA,usbhub,0,Microsoft USB Standard Hub Driver,,C:\Windows\System32\drivers\usbhub.sys,a8a180438459a79fe818154bf9767660,\SystemRoot\system32\drivers\usbhub.sys,Microsoft Windows,true,The file is signed and the signature was verified.,Microsoft Windows Verification PCA
EL0001DHA,RDPDR,0,Terminal Server Device Redirector Driver,,C:\Windows\System32\drivers\rdpdr.sys,452a4428e70e5b43ddbb0827fd4f993c,System32\drivers\rdpdr.sys,Microsoft Windows,true,The file is signed and the signature was verified.,Microsoft Windows Verification PCA
EL0001DHA,mountmgr,0,Mount Point Manager,Driver responsible with maintaining persistent drive letters and names for volumes,C:\Windows\System32\drivers\mountmgr.sys,803fcf82aecfd2a6977b6c588e8bcf52,\SystemRoot\System32\drivers\mountmgr.sys,Microsoft Windows,true,The file is signed and the signature was verified.,Microsoft Windows Verification PCA
EL0001DHA,rspndr,0,Link-Layer Topology Discovery Responder,,C:\Windows\System32\drivers\rspndr.sys,10d50190b9c60acbf7f933725571844c,system32\DRIVERS\rspndr.sys,Microsoft Windows,true,The file is signed and the signature was verified.,Microsoft Windows Verification PCA
EL0001DHA,lltdio,0,Link-Layer Topology Discovery Mapper I/O Driver,,C:\Windows\System32\drivers\lltdio.sys,60578263ecb274ef3beba08402fb6f3b,system32\DRIVERS\lltdio.sys,Microsoft Windows,true,The file is signed and the signature was verified.,Microsoft Windows Verification PCA
EL0001DHA,clr_optimization_v2.0.50727_32,0,Microsoft .NET Framework NGEN v2.0.50727_X86,Microsoft .NET Framework NGEN,C:\Windows\Microsoft.NET\Framework\v2.0.50727\mscorsvw.exe,29c9abf71230660209c9f7e9f1d5b9ba,C:\Windows\Microsoft.NET\Framework\v2.0.50727\mscorsvw.exe,Microsoft Windows,true,The file is signed and the signature was verified.,Microsoft Windows Verification PCA
EL0001DHA,HDAudBus,0,Microsoft UAA Bus Driver for High Definition Audio,,C:\Windows\System32\drivers\hdaudbus.sys,f5097d6175ddf63496a419385e32a1fc,\SystemRoot\system32\drivers\HDAudBus.sys,Microsoft Windows,true,The file is signed and the signature was verified.,Microsoft Windows Verification PCA
EL0001DHA,LSI_SAS2,0,LSI_SAS2,,C:\Windows\System32\drivers\lsi_sas2.sys,33d07972045a2513e44e0a1400ca1b9f,\SystemRoot\system32\drivers\lsi_sas2.sys,Microsoft Windows,true,The file is signed and the signature was verified.,Microsoft Windows Verification PCA
EL0001DHA,Browser,0,Computer Browser,Maintains an updated list of computers on the network and supplies this list to computers designated as browsers. If this service is stopped  this list will not be updated or maintained. If this service is disabled  any services that explicitly depend on it will fail to start.,C:\Windows\System32\svchost.exe,963af53a6aa75d0adab976f536638a6f,C:\Windows\System32\svchost.exe -k netsvcs,Microsoft Windows,true,The file is signed and the signature was verified.,Microsoft Windows Verification PCA
EL0001DHA,udfs,0,udfs,Reads/Writes UDF 1.02 1.5 2.0x 2.5 disc formats  usually found on C/DVD discs. (Core) (All pieces),C:\Windows\System32\drivers\udfs.sys,cb6c785e8fda29cca0c79f94ee69927d,system32\DRIVERS\udfs.sys,Microsoft Windows,true,The file is signed and the signature was verified.,Microsoft Windows Verification PCA
EL0001DHA,atapi,0,atapi,,C:\Windows\System32\drivers\atapi.sys,842397d8412557b15293f7bbf4fe1a91,\SystemRoot\system32\drivers\atapi.sys,Microsoft Windows,true,The file is signed and the signature was verified.,Microsoft Windows Verification PCA
EL0001DHA,FontCache,828,Windows Font Cache Service,Optimizes performance of applications by caching commonly used font data. Applications will start this service if it is not already running. It can be disabled  though doing so will degrade application performance.,C:\Windows\System32\svchost.exe,963af53a6aa75d0adab976f536638a6f,C:\Windows\system32\svchost.exe -k LocalService,Microsoft Windows,true,The file is signed and the signature was verified.,Microsoft Windows Verification PCA
EL0001DHA,seclogon,0,Secondary Logon,Enables starting processes under alternate credentials. If this service is stopped  this type of logon access will be unavailable. If this service is disabled  any services that explicitly depend on it will fail to start.,C:\Windows\System32\svchost.exe,963af53a6aa75d0adab976f536638a6f,C:\Windows\system32\svchost.exe -k netsvcs,Microsoft Windows,true,The file is signed and the signature was verified.,Microsoft Windows Verification PCA
EL0001DHA,GCEAgent,1108,GCEAgent,Google Compute Engine Agent,C:\Program Files\Google\Compute Engine\agent\GCEWindowsAgent.exe,e396dbe897a17f5a7a6235530176d47f,C:\Program Files\Google\Compute Engine\agent\GCEWindowsAgent.exe,Google Inc,true,The file is signed and the signature was verified.,Symantec Class 3 SHA256 Code Signing CA
EL0001DHA,ksthunk,0,Kernel Streaming Thunks,,C:\Windows\System32\drivers\ksthunk.sys,c7334181163d44ec8c4de1af464266e5,\SystemRoot\system32\drivers\ksthunk.sys,Microsoft Windows,true,The file is signed and the signature was verified.,Microsoft Windows Verification PCA
EL0001DHA,uagp35,0,Microsoft AGPv3.5 Filter,,C:\Windows\System32\drivers\UAGP35.SYS,de0a03b4163d08f2a9f9627d4d63f5a4,\SystemRoot\system32\drivers\uagp35.sys,Microsoft Windows,true,The file is signed and the signature was verified.,Microsoft Windows Verification PCA
EL0001DHA,ErrDev,0,Microsoft Hardware Error Device Driver,,C:\Windows\System32\drivers\errdev.sys,7d49dd5b79e4b4cfe3d74e8b15afea32,\SystemRoot\system32\drivers\errdev.sys,Microsoft Windows,true,The file is signed and the signature was verified.,Microsoft Windows Verification PCA
EL0001DHA,Vid,0,Vid,,C:\Windows\System32\drivers\Vid.sys,e3aa3c8b2d8b0de2c200ae6d0ce2c509,\SystemRoot\system32\drivers\Vid.sys,Microsoft Windows,true,The file is signed and the signature was verified.,Microsoft Windows Verification PCA
EL0001DHA,ql2300,0,ql2300,,C:\Windows\System32\drivers\ql2300.sys,79a91404ec255b2bb126b7fec0b12ba0,\SystemRoot\system32\drivers\ql2300.sys,Microsoft Windows,true,The file is signed and the signature was verified.,Microsoft Windows Verification PCA
EL0001DHA,EventSystem,828,COM+ Event System,Supports System Event Notification Service (SENS)  which provides automatic distribution of events to subscribing Component Object Model (COM) components. If the service is stopped  SENS will close and will not be able to provide logon and logoff notifications. If this service is disabled  any services that explicitly depend on it will fail to start.,C:\Windows\System32\svchost.exe,963af53a6aa75d0adab976f536638a6f,C:\Windows\system32\svchost.exe -k LocalService,Microsoft Windows,true,The file is signed and the signature was verified.,Microsoft Windows Verification PCA
EL0001DHA,RasMan,0,Remote Access Connection Manager,Manages dial-up and virtual private network (VPN) connections from this computer to the Internet or other remote networks. If this service is disabled  any services that explicitly depend on it will fail to start.,C:\Windows\System32\svchost.exe,963af53a6aa75d0adab976f536638a6f,C:\Windows\System32\svchost.exe -k netsvcs,Microsoft Windows,true,The file is signed and the signature was verified.,Microsoft Windows Verification PCA
EL0001DHA,SiSRaid2,0,SiSRaid2,,C:\Windows\System32\drivers\sisraid2.sys,976a50745c78bff07bd2ff52009d6430,\SystemRoot\system32\drivers\SiSRaid2.sys,Microsoft Windows,true,The file is signed and the signature was verified.,Microsoft Windows Verification PCA
EL0001DHA,mouclass,0,Mouse Class Driver,,C:\Windows\System32\drivers\mouclass.sys,c5518b98336c17906acf4b8da29d6d14,\SystemRoot\system32\drivers\mouclass.sys,Microsoft Windows,true,The file is signed and the signature was verified.,Microsoft Windows Verification PCA
EL0001DHA,eventlog,932,Windows Event Log,This service manages events and event logs. It supports logging events  querying events  subscribing to events  archiving event logs  and managing event metadata. It can display events in both XML and plain text format. Stopping this service may compromise security and reliability of the system.,C:\Windows\System32\svchost.exe,963af53a6aa75d0adab976f536638a6f,C:\Windows\System32\svchost.exe -k LocalServiceNetworkRestricted,Microsoft Windows,true,The file is signed and the signature was verified.,Microsoft Windows Verification PCA
EL0001DHA,SNMPTRAP,0,SNMP Trap,Receives trap messages generated by local or remote Simple Network Management Protocol (SNMP) agents and forwards the messages to SNMP management programs running on this computer. If this service is stopped  SNMP-based programs on this computer will not receive SNMP trap messages. If this service is disabled  any services that explicitly depend on it will fail to start.,C:\Windows\System32\snmptrap.exe,1ae30168f56845649bbd0cd0b5ad81ad,C:\Windows\System32\snmptrap.exe,Microsoft Windows,true,The file is signed and the signature was verified.,Microsoft Windows Verification PCA
EL0001DHA,RDPCDD,0,RDPCDD,RDPDD Chained DD,C:\Windows\System32\drivers\RDPCDD.sys,3f56fc29cbf213725eefee73022193ac,System32\DRIVERS\RDPCDD.sys,Microsoft Windows,true,The file is signed and the signature was verified.,Microsoft Windows Verification PCA
EL0001DHA,BFE,768,Base Filtering Engine,The Base Filtering Engine (BFE) is a service that manages firewall and Internet Protocol security (IPsec) policies and implements user mode filtering. Stopping or disabling the BFE service will significantly reduce the security of the system. It will also result in unpredictable behavior in IPsec management and firewall applications.,C:\Windows\System32\svchost.exe,963af53a6aa75d0adab976f536638a6f,C:\Windows\system32\svchost.exe -k LocalServiceNoNetwork,Microsoft Windows,true,The file is signed and the signature was verified.,Microsoft Windows Verification PCA
EL0001DHA,DfsC,0,DFS Namespace Client Driver,Client driver for access to DFS Namespaces,C:\Windows\System32\drivers\dfsc.sys,6c6d5e2853dbd40e369d1048d5caca09,System32\Drivers\dfsc.sys,Microsoft Windows,true,The file is signed and the signature was verified.,Microsoft Windows Verification PCA
EL0001DHA,LanmanServer,968,Server,Supports file  print  and named-pipe sharing over the network for this computer. If this service is stopped  these functions will be unavailable. If this service is disabled  any services that explicitly depend on it will fail to start.,C:\Windows\System32\svchost.exe,963af53a6aa75d0adab976f536638a6f,C:\Windows\system32\svchost.exe -k netsvcs,Microsoft Windows,true,The file is signed and the signature was verified.,Microsoft Windows Verification PCA
EL0001DHA,storvsp,0,storvsp,,C:\Windows\System32\drivers\storvsp.sys,048f23384c04b2087f4cf6f804bc2f58,\SystemRoot\system32\drivers\storvsp.sys,Microsoft Windows,true,The file is signed and the signature was verified.,Microsoft Windows Verification PCA
EL0001DHA,sermouse,0,Serial Mouse Driver,,C:\Windows\System32\drivers\sermouse.sys,003b31458aaccd67b2312b056fd10d38,\SystemRoot\system32\drivers\sermouse.sys,Microsoft Windows,true,The file is signed and the signature was verified.,Microsoft Windows Verification PCA
EL0001DHA,crcdisk,0,Crcdisk Filter Driver,,C:\Windows\System32\drivers\crcdisk.sys,53cd2daa6244afd2a6280f0e0fbcd0da,\SystemRoot\system32\drivers\crcdisk.sys,Microsoft Windows,true,The file is signed and the signature was verified.,Microsoft Windows Verification PCA
EL0001DHA,SharedAccess,0,Internet Connection Sharing (ICS),Provides network address translation  addressing  name resolution and/or intrusion prevention services for a home or small office network.,C:\Windows\System32\svchost.exe,963af53a6aa75d0adab976f536638a6f,C:\Windows\System32\svchost.exe -k netsvcs,Microsoft Windows,true,The file is signed and the signature was verified.,Microsoft Windows Verification PCA
EL0001DHA,Psched,0,QoS Packet Scheduler,QoS Packet Scheduler,C:\Windows\System32\drivers\pacer.sys,716d7aded5204ed1564b84ea18a1b230,system32\DRIVERS\pacer.sys,Microsoft Windows,true,The file is signed and the signature was verified.,Microsoft Windows Verification PCA
EL0001DHA,vds,0,Virtual Disk,Provides management services for disks  volumes  file systems  and storage arrays.,C:\Windows\System32\vds.exe,bf847ca11ea437bed87e3e3c3c4f1578,C:\Windows\System32\vds.exe,Microsoft Windows,true,The file is signed and the signature was verified.,Microsoft Windows Verification PCA
EL0001DHA,intelppm,0,Intel Processor Driver,,C:\Windows\System32\drivers\intelppm.sys,d8a5d3135ca2f82013b908909793c245,system32\DRIVERS\intelppm.sys,Microsoft Windows,true,The file is signed and the signature was verified.,Microsoft Windows Verification PCA
EL0001DHA,AudioSrv,0,Windows Audio,Manages audio for Windows-based programs.  If this service is stopped  audio devices and effects will not function properly.  If this service is disabled  any services that explicitly depend on it will fail to start,C:\Windows\System32\svchost.exe,963af53a6aa75d0adab976f536638a6f,C:\Windows\System32\svchost.exe -k LocalServiceNetworkRestricted,Microsoft Windows,true,The file is signed and the signature was verified.,Microsoft Windows Verification PCA
EL0001DHA,AeLookupSvc,968,Application Experience,Processes application compatibility cache requests for applications as they are launched,C:\Windows\System32\svchost.exe,963af53a6aa75d0adab976f536638a6f,C:\Windows\system32\svchost.exe -k netsvcs,Microsoft Windows,true,The file is signed and the signature was verified.,Microsoft Windows Verification PCA
EL0001DHA,gagp30kx,0,Microsoft Generic AGPv3.0 Filter for K8 Processor Platforms,,C:\Windows\System32\drivers\GAGP30KX.SYS,0fec5603bb6fdfd9adc19b54a2bbd568,\SystemRoot\system32\drivers\gagp30kx.sys,Microsoft Windows,true,The file is signed and the signature was verified.,Microsoft Windows Verification PCA
EL0001DHA,stornvme,0,stornvme,,C:\Windows\System32\drivers\stornvme.sys,79c2302cdd986b69ab45eb7f1dd70979,\SystemRoot\system32\drivers\stornvme.sys,Microsoft Windows,true,The file is signed and the signature was verified.,Microsoft Windows Verification PCA
EL0001DHA,NlaSvc,852,Network Location Awareness,Collects and stores configuration information for the network and notifies programs when this information is modified. If this service is stopped  configuration information might be unavailable. If this service is disabled  any services that explicitly depend on it will fail to start.,C:\Windows\System32\svchost.exe,963af53a6aa75d0adab976f536638a6f,C:\Windows\System32\svchost.exe -k NetworkService,Microsoft Windows,true,The file is signed and the signature was verified.,Microsoft Windows Verification PCA
EL0001DHA,pciide,0,pciide,,C:\Windows\System32\drivers\pciide.sys,24e812767629feb6be16a5e1b44c870c,\SystemRoot\system32\drivers\pciide.sys,Microsoft Windows,true,The file is signed and the signature was verified.,Microsoft Windows Verification PCA
EL0001DHA,AFD,0,Ancillary Function Driver for Winsock,Ancillary Function Driver for Winsock,C:\Windows\System32\drivers\afd.sys,b16fb397993d3c1a29930bd2adbe9dd7,\SystemRoot\system32\drivers\afd.sys,Microsoft Windows,true,The file is signed and the signature was verified.,Microsoft Windows Verification PCA
EL0001DHA,HidBatt,0,HID UPS Battery Driver,,C:\Windows\System32\drivers\hidbatt.sys,af40853ef51886cf2146b112d57e519d,\SystemRoot\system32\drivers\HidBatt.sys,Microsoft Windows,true,The file is signed and the signature was verified.,Microsoft Windows Verification PCA
EL0001DHA,CertPropSvc,968,Certificate Propagation,Copies user certificates and root certificates from smart cards into the current user's certificate store  detects when a smart card is inserted into a smart card reader  and  if needed  installs the smart card Plug and Play minidriver.,C:\Windows\System32\svchost.exe,963af53a6aa75d0adab976f536638a6f,C:\Windows\system32\svchost.exe -k netsvcs,Microsoft Windows,true,The file is signed and the signature was verified.,Microsoft Windows Verification PCA
EL0001DHA,MpsSvc,768,Windows Firewall,Windows Firewall helps protect your computer by preventing unauthorized users from gaining access to your computer through the Internet or a network.,C:\Windows\System32\svchost.exe,963af53a6aa75d0adab976f536638a6f,C:\Windows\system32\svchost.exe -k LocalServiceNoNetwork,Microsoft Windows,true,The file is signed and the signature was verified.,Microsoft Windows Verification PCA
EL0001DHA,wercplsupport,0,Problem Reports and Solutions Control Panel Support,This service provides support for viewing  sending and deletion of system-level problem reports for the Problem Reports and Solutions control panel.,C:\Windows\System32\svchost.exe,963af53a6aa75d0adab976f536638a6f,C:\Windows\System32\svchost.exe -k netsvcs,Microsoft Windows,true,The file is signed and the signature was verified.,Microsoft Windows Verification PCA
EL0001DHA,ShellHWDetection,968,Shell Hardware Detection,Provides notifications for AutoPlay hardware events.,C:\Windows\System32\svchost.exe,963af53a6aa75d0adab976f536638a6f,C:\Windows\System32\svchost.exe -k netsvcs,Microsoft Windows,true,The file is signed and the signature was verified.,Microsoft Windows Verification PCA
EL0001DHA,pcmcia,0,pcmcia,,C:\Windows\System32\drivers\pcmcia.sys,7d6cf2b1f3c91a0590c462efb317c9c6,\SystemRoot\system32\drivers\pcmcia.sys,Microsoft Windows,true,The file is signed and the signature was verified.,Microsoft Windows Verification PCA
EL0001DHA,dmvsc,0,dmvsc,,C:\Windows\System32\drivers\dmvsc.sys,b21a13075dce1024a57263338f57f256,\SystemRoot\system32\drivers\dmvsc.sys,Microsoft Windows,true,The file is signed and the signature was verified.,Microsoft Windows Verification PCA
EL0001DHA,ProfSvc,968,User Profile Service,This service is responsible for loading and unloading user profiles. If this service is stopped or disabled  users will no longer be able to successfully logon or logoff  applications may have problems getting to users' data  and components registered to receive profile event notifications will not receive them.,C:\Windows\System32\svchost.exe,963af53a6aa75d0adab976f536638a6f,C:\Windows\system32\svchost.exe -k netsvcs,Microsoft Windows,true,The file is signed and the signature was verified.,Microsoft Windows Verification PCA
EL0001DHA,swenum,0,Software Bus Driver,,C:\Windows\System32\drivers\swenum.sys,f94c1eb7c92a118b23869c7dcd49060a,\SystemRoot\system32\drivers\swenum.sys,Microsoft Windows,true,The file is signed and the signature was verified.,Microsoft Windows Verification PCA
EL0001DHA,RpcSs,632,Remote Procedure Call (RPC),The RPCSS service is the Service Control Manager for COM and DCOM servers. It performs object activations requests  object exporter resolutions and distributed garbage collection for COM and DCOM servers. If this service is stopped or disabled  programs using COM or DCOM will not function properly. It is strongly recommended that you have the RPCSS service running,C:\Windows\System32\svchost.exe,963af53a6aa75d0adab976f536638a6f,C:\Windows\system32\svchost.exe -k rpcss,Microsoft Windows,true,The file is signed and the signature was verified.,Microsoft Windows Verification PCA
EL0001DHA,sppuinotify,0,SPP Notification Service,Provides Software Licensing activation and notification,C:\Windows\System32\svchost.exe,963af53a6aa75d0adab976f536638a6f,C:\Windows\system32\svchost.exe -k LocalService,Microsoft Windows,true,The file is signed and the signature was verified.,Microsoft Windows Verification PCA
EL0001DHA,fdPHost,0,Function Discovery Provider Host,The FDPHOST service hosts the Function Discovery (FD) network discovery providers. These FD providers supply network discovery services for the Simple Services Discovery Protocol (SSDP) and Web Services – Discovery (WS-D) protocol. Stopping or disabling the FDPHOST service will disable network discovery for these protocols when using FD. When this service is unavailable  network services using FD and relying on these discovery protocols will be unable to find network devices or resources.,C:\Windows\System32\svchost.exe,963af53a6aa75d0adab976f536638a6f,C:\Windows\system32\svchost.exe -k LocalService,Microsoft Windows,true,The file is signed and the signature was verified.,Microsoft Windows Verification PCA
EL0001DHA,WPDBusEnum,0,Portable Device Enumerator Service,Enforces group policy for removable mass-storage devices. Enables applications such as Windows Media Player and Image Import Wizard to transfer and synchronize content using removable mass-storage devices.,C:\Windows\System32\svchost.exe,963af53a6aa75d0adab976f536638a6f,C:\Windows\system32\svchost.exe -k LocalSystemNetworkRestricted,Microsoft Windows,true,The file is signed and the signature was verified.,Microsoft Windows Verification PCA
EL0001DHA,FltMgr,0,FltMgr,File System Filter Manager Driver,C:\Windows\System32\drivers\fltMgr.sys,485304fb98f3301f8db10c644a8ea39f,\SystemRoot\system32\drivers\fltmgr.sys,Microsoft Windows,true,The file is signed and the signature was verified.,Microsoft Windows Verification PCA
EL0001DHA,BrUsbSer,0,Brother MFC USB Serial WDM Driver,,C:\Windows\System32\drivers\BrUsbSer.sys,23c68e33d32fc6e97ebe48d633d37633,\SystemRoot\System32\Drivers\BrUsbSer.sys,Microsoft Windows,true,The file is signed and the signature was verified.,Microsoft Windows Verification PCA
EL0001DHA,Filetrace,0,Filetrace,ETW File Trace Filter,C:\Windows\System32\drivers\filetrace.sys,7b2c2586b28f0f601f7c142e82eef34a,system32\drivers\filetrace.sys,Microsoft Windows,true,The file is signed and the signature was verified.,Microsoft Windows Verification PCA
EL0001DHA,cmdide,0,cmdide,,C:\Windows\System32\drivers\cmdide.sys,9fde4f0d15c4838fe8692ff55a1344d4,\SystemRoot\system32\drivers\cmdide.sys,Microsoft Windows,true,The file is signed and the signature was verified.,Microsoft Windows Verification PCA
EL0001DHA,volmgrx,0,Dynamic Volume Manager,Extension of the volume manager driver that manages software RAID volumes (spanned  striped  mirrored  RAID-5) on dynamic disks,C:\Windows\System32\drivers\volmgrx.sys,08fc5457e55b038181ea3d63f2dfbcbc,\SystemRoot\System32\drivers\volmgrx.sys,Microsoft Windows,true,The file is signed and the signature was verified.,Microsoft Windows Verification PCA
EL0001DHA,mpsdrv,0,Windows Firewall Authorization Driver,Windows Firewall Authorization Driver is a kernel mode driver that provides deep inspection services on inbound and outbound network traffic.,C:\Windows\System32\drivers\mpsdrv.sys,38c400e46ad99de8a6fb47297eb151d7,System32\drivers\mpsdrv.sys,Microsoft Windows,true,The file is signed and the signature was verified.,Microsoft Windows Verification PCA
EL0001DHA,Ndisuio,0,NDIS Usermode I/O Protocol,,C:\Windows\System32\drivers\ndisuio.sys,58a19b05b45e2c771977a12b030b0425,system32\DRIVERS\ndisuio.sys,Microsoft Windows,true,The file is signed and the signature was verified.,Microsoft Windows Verification PCA
