hostname,name,pid,descriptivename,description,path,pathmd5sum,arguments,pathcertificatesubject,pathsignatureverified,pathsignaturedescription,pathcertificateissuer
EL0001DHA,ql40xx,0,ql40xx,,C:\Windows\System32\drivers\ql40xx.sys,d4e0c318b2aca54a47796ec632eb7c1d,\SystemRoot\system32\drivers\ql40xx.sys,Microsoft Windows,true,The file is signed and the signature was verified.,Microsoft Windows Verification PCA
EL0001DHA,monitor,0,Microsoft Monitor Class Function Driver Service,,C:\Windows\System32\drivers\monitor.sys,589b86513824d551adba5fc23da941b6,system32\DRIVERS\monitor.sys,Microsoft Windows,true,The file is signed and the signature was verified.,Microsoft Windows Verification PCA
EL0001DHA,MMCSS,0,Multimedia Class Scheduler,Enables relative prioritization of work based on system-wide task priorities. This is intended mainly for multimedia applications.  If this service is stopped  individual tasks resort to their default priority.,C:\Windows\System32\svchost.exe,963af53a6aa75d0adab976f536638a6f,C:\Windows\system32\svchost.exe -k netsvcs,Microsoft Windows,true,The file is signed and the signature was verified.,Microsoft Windows Verification PCA
EL0001DHA,cdfs,0,CD/DVD File System Reader,ISO9660/Joliet File System Reader for CD/DVDs. (Core) (All pieces),C:\Windows\System32\drivers\cdfs.sys,df7712413eb6572ff75e7414983ea0fa,system32\DRIVERS\cdfs.sys,Microsoft Windows,true,The file is signed and the signature was verified.,Microsoft Windows Verification PCA
EL0001DHA,sfloppy,0,High-Capacity Floppy Disk Drive,,C:\Windows\System32\drivers\sfloppy.sys,204c49dc69280ccbb3343d86f50b18f6,\SystemRoot\system32\drivers\sfloppy.sys,Microsoft Windows,true,The file is signed and the signature was verified.,Microsoft Windows Verification PCA
EL0001DHA,adpahci,0,adpahci,,C:\Windows\System32\drivers\adpahci.sys,b4031f3fbc7959f8db856c133aee34a4,\SystemRoot\system32\drivers\adpahci.sys,Microsoft Windows,true,The file is signed and the signature was verified.,Microsoft Windows Verification PCA
EL0001DHA,GoogleVssProvider,1264,GoogleVssProvider,Google Vss Hardware Provider,C:\Windows\System32\dllhost.exe,2bb08595572868fe10b9b512dba0a504,C:\Windows\system32\dllhost.exe /Processid:{3EAE8C5E-B51F-4CBD-9DCE-FA6AA0BDF8B8},Microsoft Windows,true,The file is signed and the signature was verified.,Microsoft Windows Verification PCA
EL0001DHA,Netlogon,0,Netlogon,Maintains a secure channel between this computer and the domain controller for authenticating users and services. If this service is stopped  the computer may not authenticate users and services and the domain controller cannot register DNS records. If this service is disabled  any services that explicitly depend on it will fail to start.,C:\Windows\System32\lsass.exe,f443cf637fc8f1d8497f252e9324334c,C:\Windows\system32\lsass.exe,Microsoft Windows,true,The file is signed and the signature was verified.,Microsoft Windows Verification PCA
EL0001DHA,blbdrive,0,blbdrive,,C:\Windows\System32\drivers\blbdrive.sys,8219dd8aa87d15d65ab2484ee39ea30c,\SystemRoot\system32\drivers\blbdrive.sys,Microsoft Windows,true,The file is signed and the signature was verified.,Microsoft Windows Verification PCA
EL0001DHA,s3cap,0,s3cap,,C:\Windows\System32\drivers\vms3cap.sys,71c747ac1fc7debb9b5d6757be63867c,\SystemRoot\system32\drivers\vms3cap.sys,Microsoft Windows,true,The file is signed and the signature was verified.,Microsoft Windows Verification PCA
EL0001DHA,stexstor,0,stexstor,,C:\Windows\System32\drivers\stexstor.sys,79bf1934b8ce2039d02ed72ba5dc7941,\SystemRoot\system32\drivers\stexstor.sys,Microsoft Windows,true,The file is signed and the signature was verified.,Microsoft Windows Verification PCA
EL0001DHA,1394ohci,0,1394 OHCI Compliant Host Controller,,C:\Windows\System32\drivers\1394ohci.sys,018213bca6bcd8a1e21961826d96e1d3,\SystemRoot\system32\drivers\1394ohci.sys,Microsoft Windows,true,The file is signed and the signature was verified.,Microsoft Windows Verification PCA
EL0001DHA,NetPipeActivator,0,Net.Pipe Listener Adapter,Receives activation requests over the net.pipe protocol and passes them to the Windows Process Activation Service.,C:\Windows\Microsoft.NET\Framework64\v4.0.30319\SMSvcHost.exe,23ce3d543727580c9e3ba203cba30581,C:\Windows\Microsoft.NET\Framework64\v4.0.30319\SMSvcHost.exe,Microsoft Corporation,true,The file is signed and the signature was verified.,Microsoft Code Signing PCA
EL0001DHA,pla,0,Performance Logs &amp; Alerts,Performance Logs and Alerts Collects performance data from local or remote computers based on preconfigured schedule parameters  then writes the data to a log or triggers an alert. If this service is stopped  performance information will not be collected. If this service is disabled  any services that explicitly depend on it will fail to start.,C:\Windows\System32\svchost.exe,963af53a6aa75d0adab976f536638a6f,C:\Windows\System32\svchost.exe -k LocalServiceNoNetwork,Microsoft Windows,true,The file is signed and the signature was verified.,Microsoft Windows Verification PCA
EL0001DHA,Processor,0,Processor Driver,,C:\Windows\System32\drivers\processr.sys,7028207ad37114799149c06ac41d04d6,\SystemRoot\system32\drivers\processr.sys,Microsoft Windows,true,The file is signed and the signature was verified.,Microsoft Windows Verification PCA
EL0001DHA,NetTcpActivator,0,Net.Tcp Listener Adapter,Receives activation requests over the net.tcp protocol and passes them to the Windows Process Activation Service.,C:\Windows\Microsoft.NET\Framework64\v4.0.30319\SMSvcHost.exe,23ce3d543727580c9e3ba203cba30581,C:\Windows\Microsoft.NET\Framework64\v4.0.30319\SMSvcHost.exe,Microsoft Corporation,true,The file is signed and the signature was verified.,Microsoft Code Signing PCA
EL0001DHA,tdx,0,NetIO Legacy TDI Support Driver,NetIO Legacy TDI Support Driver,C:\Windows\System32\drivers\tdx.sys,07b943a6eae054e0fb1fbfc4d677d17a,system32\DRIVERS\tdx.sys,Microsoft Windows,true,The file is signed and the signature was verified.,Microsoft Windows Verification PCA
EL0001DHA,mouhid,0,Mouse HID Driver,,C:\Windows\System32\drivers\mouhid.sys,71e84aa52bdafb9d10c22b3af70b2ae6,\SystemRoot\system32\drivers\mouhid.sys,Microsoft Windows,true,The file is signed and the signature was verified.,Microsoft Windows Verification PCA
EL0001DHA,srv,0,Server SMB 1.xxx Driver,Enables connectivity from Windows XP and earlier clients,C:\Windows\System32\drivers\srv.sys,25f6811fc975fad5d82513335d51285a,System32\DRIVERS\srv.sys,Microsoft Windows,true,The file is signed and the signature was verified.,Microsoft Windows Verification PCA
EL0001DHA,Winmgmt,968,Windows Management Instrumentation,Provides a common interface and object model to access management information about operating system  devices  applications and services. If this service is stopped  most Windows-based software will not function properly. If this service is disabled  any services that explicitly depend on it will fail to start.,C:\Windows\System32\svchost.exe,963af53a6aa75d0adab976f536638a6f,C:\Windows\system32\svchost.exe -k netsvcs,Microsoft Windows,true,The file is signed and the signature was verified.,Microsoft Windows Verification PCA
EL0001DHA,KSecDD,0,KSecDD,,C:\Windows\System32\drivers\ksecdd.sys,87de0ba77c399f5d6e0e5364a0c17658,\SystemRoot\System32\Drivers\ksecdd.sys,Microsoft Windows,true,The file is signed and the signature was verified.,Microsoft Windows Verification PCA
EL0001DHA,DXGKrnl,0,LDDM Graphics Subsystem,Controls the underlying video driver stacks to provide fully-featured display capabilities.,C:\Windows\System32\drivers\dxgkrnl.sys,fe081978cd010a81a8a176be696b353d,\SystemRoot\System32\drivers\dxgkrnl.sys,Microsoft Windows,true,The file is signed and the signature was verified.,Microsoft Windows Verification PCA
EL0001DHA,SamSs,460,Security Accounts Manager,The startup of this service signals other services that the Security Accounts Manager (SAM) is ready to accept requests.  Disabling this service will prevent other services in the system from being notified when the SAM is ready  which may in turn cause those services to fail to start correctly. This service should not be disabled.,C:\Windows\System32\lsass.exe,f443cf637fc8f1d8497f252e9324334c,C:\Windows\system32\lsass.exe,Microsoft Windows,true,The file is signed and the signature was verified.,Microsoft Windows Verification PCA
EL0001DHA,sffdisk,0,SFF Storage Class Driver,,C:\Windows\System32\drivers\sffdisk.sys,ff1464e7717ab9517761a68e10c19057,\SystemRoot\system32\drivers\sffdisk.sys,Microsoft Windows,true,The file is signed and the signature was verified.,Microsoft Windows Verification PCA
EL0001DHA,UmRdpService,244,Remote Desktop Services UserMode Port Redirector,Allows the redirection of Printers/Drives/Ports for RDP connections,C:\Windows\System32\svchost.exe,963af53a6aa75d0adab976f536638a6f,C:\Windows\System32\svchost.exe -k LocalSystemNetworkRestricted,Microsoft Windows,true,The file is signed and the signature was verified.,Microsoft Windows Verification PCA
EL0001DHA,uliagpkx,0,Uli AGP Bus Filter,,C:\Windows\System32\drivers\ULIAGPKX.SYS,80a390a8478f0f2ef98568323d232610,\SystemRoot\system32\drivers\uliagpkx.sys,Microsoft Windows,true,The file is signed and the signature was verified.,Microsoft Windows Verification PCA
EL0001DHA,IEEtwCollectorService,0,Internet Explorer ETW Collector Service,ETW Collector Service for Internet Explorer. When running  this service collects real time ETW events and processes them.,C:\Windows\System32\IEEtwCollector.exe,f74f9d0b7049d282d04bfc2034cf635d,C:\Windows\system32\IEEtwCollector.exe /V,Microsoft Windows,true,The file is signed and the signature was verified.,Microsoft Windows Verification PCA
EL0001DHA,PptpMiniport,0,WAN Miniport (PPTP),WAN Miniport (PPTP),C:\Windows\System32\drivers\raspptp.sys,f5b0078fcc4069c45f51bf5d5f1ea1e8,system32\DRIVERS\raspptp.sys,Microsoft Windows,true,The file is signed and the signature was verified.,Microsoft Windows Verification PCA
EL0001DHA,PerfHost,0,Performance Counter DLL Host,Enables remote users and 64-bit processes to query performance counters provided by 32-bit DLLs. If this service is stopped  only local users and 32-bit processes will be able to query performance counters provided by 32-bit DLLs.,C:\Windows\SysWOW64\perfhost.exe,1baf5f1f33de74e69ae187c5fe7919a2,C:\Windows\SysWow64\perfhost.exe,Microsoft Windows,true,The file is signed and the signature was verified.,Microsoft Windows Verification PCA
EL0001DHA,Wdf01000,0,Kernel Mode Driver Frameworks service,,C:\Windows\System32\drivers\Wdf01000.sys,a04c85a6b6390d786f66b1d7343303fa,\SystemRoot\system32\drivers\Wdf01000.sys,Microsoft Windows,true,The file is signed and the signature was verified.,Microsoft Windows Verification PCA
EL0001DHA,NdisCap,0,NDIS Capture LightWeight Filter,NDIS Capture LightWeight Filter,C:\Windows\System32\drivers\ndiscap.sys,0db1dd3282e39cd86f633780f031ddba,system32\DRIVERS\ndiscap.sys,Microsoft Windows,true,The file is signed and the signature was verified.,Microsoft Windows Verification PCA
EL0001DHA,vdrvroot,0,Microsoft Virtual Drive Enumerator Driver,,C:\Windows\System32\drivers\vdrvroot.sys,a5916960f71fdae33500e68cc82085ec,\SystemRoot\system32\drivers\vdrvroot.sys,Microsoft Windows,true,The file is signed and the signature was verified.,Microsoft Windows Verification PCA
EL0001DHA,vmbus,0,vmbus,,C:\Windows\System32\drivers\vmbus.sys,062915fbd77e99c0951f2aa7baf5ad51,\SystemRoot\system32\drivers\vmbus.sys,Microsoft Windows,true,The file is signed and the signature was verified.,Microsoft Windows Verification PCA
EL0001DHA,BITS,968,Background Intelligent Transfer Service,Transfers files in the background using idle network bandwidth. If the service is disabled  then any applications that depend on BITS  such as Windows Update or MSN Explorer  will be unable to automatically download programs and other information.,C:\Windows\System32\svchost.exe,963af53a6aa75d0adab976f536638a6f,C:\Windows\System32\svchost.exe -k netsvcs,Microsoft Windows,true,The file is signed and the signature was verified.,Microsoft Windows Verification PCA
EL0001DHA,VSS,0,Volume Shadow Copy,Manages and implements Volume Shadow Copies used for backup and other purposes. If this service is stopped  shadow copies will be unavailable for backup and the backup may fail. If this service is disabled  any services that explicitly depend on it will fail to start.,C:\Windows\System32\VSSVC.exe,a1d5b0b03d0fa1390313fc2fca5fcd21,C:\Windows\system32\vssvc.exe,Microsoft Windows,true,The file is signed and the signature was verified.,Microsoft Windows Verification PCA
EL0001DHA,Smb,0,Message-oriented TCP/IP and TCP/IPv6 Protocol (SMB session),Microsoft NetbiosSmb Device Driver,C:\Windows\System32\drivers\smb.sys,e36fe8c3b5da1453ea767c908cca30b6,system32\DRIVERS\smb.sys,Microsoft Windows,true,The file is signed and the signature was verified.,Microsoft Windows Verification PCA
EL0001DHA,vsmraid,0,vsmraid,,C:\Windows\System32\drivers\vsmraid.sys,c4900026a25d6650bbae216debaed9d8,\SystemRoot\system32\drivers\vsmraid.sys,Microsoft Windows,true,The file is signed and the signature was verified.,Microsoft Windows Verification PCA
EL0001DHA,Disk,0,Disk Driver,,C:\Windows\System32\drivers\disk.sys,67de3e0a65d99536de788b604ce8b24c,\SystemRoot\system32\drivers\disk.sys,Microsoft Windows,true,The file is signed and the signature was verified.,Microsoft Windows Verification PCA
EL0001DHA,TrustedInstaller,0,Windows Modules Installer,Enables installation  modification  and removal of Windows updates and optional components. If this service is disabled  install or uninstall of Windows updates might fail for this computer.,C:\Windows\servicing\TrustedInstaller.exe,a2649dca9a2eaebde268f6cc9c9446eb,C:\Windows\servicing\TrustedInstaller.exe,Microsoft Windows,true,The file is signed and the signature was verified.,Microsoft Windows Verification PCA
EL0001DHA,usbuhci,0,Microsoft USB Universal Host Controller Miniport Driver,,C:\Windows\System32\drivers\usbuhci.sys,eb01f22bf391dbcd5facd20ae7845ed6,\SystemRoot\system32\drivers\usbuhci.sys,Microsoft Windows,true,The file is signed and the signature was verified.,Microsoft Windows Verification PCA
EL0001DHA,FDResPub,0,Function Discovery Resource Publication,Publishes this computer and resources attached to this computer so they can be discovered over the network.  If this service is stopped  network resources will no longer be published and they will not be discovered by other computers on the network.,C:\Windows\System32\svchost.exe,963af53a6aa75d0adab976f536638a6f,C:\Windows\system32\svchost.exe -k LocalServiceAndNoImpersonation,Microsoft Windows,true,The file is signed and the signature was verified.,Microsoft Windows Verification PCA
EL0001DHA,ProtectedStorage,0,Protected Storage,Provides protected storage for sensitive data  such as passwords  to prevent access by unauthorized services  processes  or users.,C:\Windows\System32\lsass.exe,f443cf637fc8f1d8497f252e9324334c,C:\Windows\system32\lsass.exe,Microsoft Windows,true,The file is signed and the signature was verified.,Microsoft Windows Verification PCA
EL0001DHA,flpydisk,0,Floppy Disk Driver,,C:\Windows\System32\drivers\flpydisk.sys,958ba9d2066614532286652e96d2f997,\SystemRoot\system32\drivers\flpydisk.sys,Microsoft Windows,true,The file is signed and the signature was verified.,Microsoft Windows Verification PCA
EL0001DHA,CryptSvc,852,Cryptographic Services,Provides four management services: Catalog Database Service  which confirms the signatures of Windows files and allows new programs to be installed; Protected Root Service  which adds and removes Trusted Root Certification Authority certificates from this computer; Automatic Root Certificate Update Service  which retrieves root certificates from Windows Update and enable scenarios such as SSL; and Key Service  which helps enroll this computer for certificates. If this service is stopped  these management services will not function properly. If this service is disabled  any services that explicitly depend on it will fail to start.,C:\Windows\System32\svchost.exe,963af53a6aa75d0adab976f536638a6f,C:\Windows\system32\svchost.exe -k NetworkService,Microsoft Windows,true,The file is signed and the signature was verified.,Microsoft Windows Verification PCA
EL0001DHA,NdisTapi,0,Remote Access NDIS TAPI Driver,Remote Access NDIS TAPI Driver,C:\Windows\System32\drivers\ndistapi.sys,a07d3e4058196fad9259862cc1b7d288,system32\DRIVERS\ndistapi.sys,Microsoft Windows,true,The file is signed and the signature was verified.,Microsoft Windows Verification PCA
EL0001DHA,nv_agp,0,NVIDIA nForce AGP Bus Filter,,C:\Windows\System32\drivers\NV_AGP.SYS,e71cf38486a1ba95e494b65ccf1cefac,\SystemRoot\system32\drivers\nv_agp.sys,Microsoft Windows,true,The file is signed and the signature was verified.,Microsoft Windows Verification PCA
EL0001DHA,NetMsmqActivator,0,Net.Msmq Listener Adapter,Receives activation requests over the net.msmq and msmq.formatname protocols and passes them to the Windows Process Activation Service.,C:\Windows\Microsoft.NET\Framework64\v4.0.30319\SMSvcHost.exe,23ce3d543727580c9e3ba203cba30581,C:\Windows\Microsoft.NET\Framework64\v4.0.30319\SMSvcHost.exe -NetMsmqActivator,Microsoft Corporation,true,The file is signed and the signature was verified.,Microsoft Code Signing PCA
EL0001DHA,AppID,0,AppID Driver,Identifies an application and enforces software restriction policies.,C:\Windows\System32\drivers\appid.sys,ba24f2c4512669f319ec73b8e7c7d446,\SystemRoot\system32\drivers\appid.sys,Microsoft Windows,true,The file is signed and the signature was verified.,Microsoft Windows Verification PCA
EL0001DHA,EFS,0,Encrypting File System (EFS),Provides the core file encryption technology used to store encrypted files on NTFS file system volumes. If this service is stopped or disabled  applications will be unable to access encrypted files.,C:\Windows\System32\lsass.exe,f443cf637fc8f1d8497f252e9324334c,C:\Windows\System32\lsass.exe,Microsoft Windows,true,The file is signed and the signature was verified.,Microsoft Windows Verification PCA
EL0001DHA,nfrd960,0,nfrd960,,C:\Windows\System32\drivers\nfrd960.sys,db1b2c7b65a9af7584f1bf8c1cade7df,\SystemRoot\system32\drivers\nfrd960.sys,Microsoft Windows,true,The file is signed and the signature was verified.,Microsoft Windows Verification PCA
EL0001DHA,PlugPlay,560,Plug and Play,Enables a computer to recognize and adapt to hardware changes with little or no user input. Stopping or disabling this service will result in system instability.,C:\Windows\System32\svchost.exe,963af53a6aa75d0adab976f536638a6f,C:\Windows\system32\svchost.exe -k DcomLaunch,Microsoft Windows,true,The file is signed and the signature was verified.,Microsoft Windows Verification PCA
EL0001DHA,hkmsvc,0,Health Key and Certificate Management,Provides X.509 certificate and key management services for the Network Access Protection Agent (NAPAgent). Enforcement technologies that use X.509 certificates may not function properly without this service,C:\Windows\System32\svchost.exe,963af53a6aa75d0adab976f536638a6f,C:\Windows\System32\svchost.exe -k netsvcs,Microsoft Windows,true,The file is signed and the signature was verified.,Microsoft Windows Verification PCA
EL0001DHA,sppsvc,0,Software Protection,Enables the download  installation and enforcement of digital licenses for Windows and Windows applications. If the service is disabled  the operating system and licensed applications may run in a notification mode. It is strongly recommended that you not disable the Software Protection service.,C:\Windows\System32\sppsvc.exe,ca3cba15d60bd4a9e8c3d333460185ca,C:\Windows\system32\sppsvc.exe,Microsoft Windows,true,The file is signed and the signature was verified.,Microsoft Windows Verification PCA
EL0001DHA,WANARP,0,Remote Access IP ARP Driver,Remote Access IP ARP Driver,C:\Windows\System32\drivers\wanarp.sys,f8168c8f668cf84257d21f937fab1c91,system32\DRIVERS\wanarp.sys,Microsoft Windows,true,The file is signed and the signature was verified.,Microsoft Windows Verification PCA
EL0001DHA,amdsbs,0,amdsbs,,C:\Windows\System32\drivers\amdsbs.sys,bbc0ffa566de539cbb6f57a03f0e7d3d,\SystemRoot\system32\drivers\amdsbs.sys,Microsoft Windows,true,The file is signed and the signature was verified.,Microsoft Windows Verification PCA
EL0001DHA,luafv,0,UAC File Virtualization,Virtualizes file write failures to per-user locations.,C:\Windows\System32\drivers\luafv.sys,d8eb80896ec17a0a7369dee4ecc8fe20,\SystemRoot\system32\drivers\luafv.sys,Microsoft Windows,true,The file is signed and the signature was verified.,Microsoft Windows Verification PCA
EL0001DHA,TDPIPE,0,TDPIPE,,C:\Windows\System32\drivers\tdpipe.sys,ab5a0edbddf95ebb437aa671413944d6,system32\drivers\tdpipe.sys,Microsoft Windows,true,The file is signed and the signature was verified.,Microsoft Windows Verification PCA
EL0001DHA,RpcEptMapper,632,RPC Endpoint Mapper,Resolves RPC interfaces identifiers to transport endpoints. If this service is stopped or disabled  programs using Remote Procedure Call (RPC) services will not function properly.,C:\Windows\System32\svchost.exe,963af53a6aa75d0adab976f536638a6f,C:\Windows\system32\svchost.exe -k RPCSS,Microsoft Windows,true,The file is signed and the signature was verified.,Microsoft Windows Verification PCA
EL0001DHA,bowser,0,Browser Support Driver,Implements the kernel datagram receiver for the computer browser browser service.,C:\Windows\System32\drivers\bowser.sys,a9164a753063cd64d2b9657f058d28b7,system32\DRIVERS\bowser.sys,Microsoft Windows,true,The file is signed and the signature was verified.,Microsoft Windows Verification PCA
EL0001DHA,RpcLocator,0,Remote Procedure Call (RPC) Locator,In Windows 2003 and earlier versions of Windows  the Remote Procedure Call (RPC) Locator service manages the RPC name service database. In Windows Vista and later versions of Windows  this service does not provide any functionality and is present for application compatibility.,C:\Windows\System32\Locator.exe,13ccfe29bc286e6d145b6e2f2989fead,C:\Windows\system32\locator.exe,Microsoft Windows,true,The file is signed and the signature was verified.,Microsoft Windows Verification PCA
EL0001DHA,SCardSvr,0,Smart Card,Manages access to smart cards read by this computer. If this service is stopped  this computer will be unable to read smart cards. If this service is disabled  any services that explicitly depend on it will fail to start.,C:\Windows\System32\svchost.exe,963af53a6aa75d0adab976f536638a6f,C:\Windows\system32\svchost.exe -k LocalServiceAndNoImpersonation,Microsoft Windows,true,The file is signed and the signature was verified.,Microsoft Windows Verification PCA
EL0001DHA,KtmRm,0,KtmRm for Distributed Transaction Coordinator,Coordinates transactions between the Distributed Transaction Coordinator (MSDTC) and the Kernel Transaction Manager (KTM). If it is not needed  it is recommended that this service remain stopped. If it is needed  both MSDTC and KTM will start this service automatically. If this service is disabled  any MSDTC transaction interacting with a Kernel Resource Manager will fail and any services that explicitly depend on it will fail to start.,C:\Windows\System32\svchost.exe,963af53a6aa75d0adab976f536638a6f,C:\Windows\System32\svchost.exe -k NetworkServiceAndNoImpersonation,Microsoft Windows,true,The file is signed and the signature was verified.,Microsoft Windows Verification PCA
EL0001DHA,Brserid,0,Brother MFC Serial Port Interface Driver (WDM),,C:\Windows\System32\drivers\BrSerId.sys,6fff1ae3cdf201df869a4155b3c33133,\SystemRoot\System32\Drivers\Brserid.sys,Microsoft Windows,true,The file is signed and the signature was verified.,Microsoft Windows Verification PCA
EL0001DHA,HidUsb,0,Microsoft HID Class Driver,,C:\Windows\System32\drivers\hidusb.sys,23e80ca32f6394571fe95eb32f9ee388,\SystemRoot\system32\drivers\hidusb.sys,Microsoft Windows,true,The file is signed and the signature was verified.,Microsoft Windows Verification PCA
EL0001DHA,CLFS,0,Common Log (CLFS),General-purpose logging service,C:\Windows\System32\clfs.sys,1ef5d06924d13275610762296cf120a5,\SystemRoot\System32\CLFS.sys,Microsoft Windows,true,The file is signed and the signature was verified.,Microsoft Windows Verification PCA
EL0001DHA,Mup,0,Mup,Multiple UNC Provider Driver,C:\Windows\System32\drivers\mup.sys,59ec9acc2b8d78345db81e3948cc3d1c,\SystemRoot\System32\Drivers\mup.sys,Microsoft Windows,true,The file is signed and the signature was verified.,Microsoft Windows Verification PCA
EL0001DHA,SiSRaid4,0,SiSRaid4,,C:\Windows\System32\drivers\sisraid4.sys,53eab9816395abea750d6eb6adce71f9,\SystemRoot\system32\drivers\sisraid4.sys,Microsoft Windows,true,The file is signed and the signature was verified.,Microsoft Windows Verification PCA
EL0001DHA,kbdclass,0,Keyboard Class Driver,,C:\Windows\System32\drivers\kbdclass.sys,9466588aee6f599fd13f2eec545b9ef2,\SystemRoot\system32\drivers\kbdclass.sys,Microsoft Windows,true,The file is signed and the signature was verified.,Microsoft Windows Verification PCA
EL0001DHA,KSecPkg,0,KSecPkg,,C:\Windows\System32\drivers\ksecpkg.sys,7494bf743b49b04e000c649f01222ef6,\SystemRoot\System32\Drivers\ksecpkg.sys,Microsoft Windows,true,The file is signed and the signature was verified.,Microsoft Windows Verification PCA
EL0001DHA,amdxata,0,amdxata,,C:\Windows\System32\drivers\amdxata.sys,e0ab6e927301a38609021c6d90ff058e,\SystemRoot\system32\drivers\amdxata.sys,Microsoft Windows,true,The file is signed and the signature was verified.,Microsoft Windows Verification PCA
EL0001DHA,Parport,0,Parallel port driver,,C:\Windows\System32\drivers\parport.sys,c8fbca4d9823dd7ce319f53a5fa088df,\SystemRoot\system32\drivers\parport.sys,Microsoft Windows,true,The file is signed and the signature was verified.,Microsoft Windows Verification PCA
