hostname,name,pid,descriptivename,description,path,pathmd5sum,arguments,pathcertificatesubject,pathsignatureverified,pathsignaturedescription,pathcertificateissuer
EL0001DHA,IPBusEnum,0,PnP-X IP Bus Enumerator,The PnP-X bus enumerator service manages the virtual network bus. It discovers network connected devices using the SSDP/WS discovery protocols and gives them presence in PnP. If this service is stopped or disabled  presence of NCD devices will not be maintained in PnP. All pnpx based scenarios will stop functioning.,C:\Windows\System32\svchost.exe,963af53a6aa75d0adab976f536638a6f,C:\Windows\system32\svchost.exe -k LocalSystemNetworkRestricted,Microsoft Windows,true,The file is signed and the signature was verified.,Microsoft Windows Verification PCA
EL0001DHA,MSDTC,1864,Distributed Transaction Coordinator,Coordinates transactions that span multiple resource managers  such as databases  message queues  and file systems. If this service is stopped  these transactions will fail. If this service is disabled  any services that explicitly depend on it will fail to start.,C:\Windows\System32\msdtc.exe,a92e6073ecf3035ab00ede4a3b9f58e2,C:\Windows\System32\msdtc.exe,Microsoft Windows,true,The file is signed and the signature was verified.,Microsoft Windows Verification PCA
EL0001DHA,napagent,0,Network Access Protection Agent,The Network Access Protection (NAP) agent service collects and manages health information for client computers on a network. Information collected by NAP agent is used to make sure that the client computer has the required software and settings. If a client computer is not compliant with health policy  it can be provided with restricted network access until its configuration is updated. Depending on the configuration of health policy  client computers might be automatically updated so that users quickly regain full network access without having to manually update their computer.,C:\Windows\System32\svchost.exe,963af53a6aa75d0adab976f536638a6f,C:\Windows\System32\svchost.exe -k NetworkService,Microsoft Windows,true,The file is signed and the signature was verified.,Microsoft Windows Verification PCA
EL0001DHA,ebdrv,0,Broadcom NetXtreme II 10 GigE VBD,,C:\Windows\System32\drivers\evbda.sys,06167dfc10de41b2cc0eb188169f9e8a,\SystemRoot\system32\drivers\evbda.sys,Microsoft Windows,true,The file is signed and the signature was verified.,Microsoft Windows Verification PCA
EL0001DHA,WacomPen,0,Wacom Serial Pen HID Driver,,C:\Windows\System32\drivers\wacompen.sys,bae8337ff6d062b68f75026696d988a6,\SystemRoot\system32\drivers\wacompen.sys,Microsoft Windows,true,The file is signed and the signature was verified.,Microsoft Windows Verification PCA
EL0001DHA,PVPanic,0,QEMU PVPanic Service,,C:\Windows\System32\drivers\pvpanic.sys,952641420be887c3cda582001d7f5f23,\SystemRoot\system32\drivers\pvpanic.sys,Google Inc,true,The file is signed and the signature was verified.,Symantec Class 3 SHA256 Code Signing CA
EL0001DHA,wuauserv,968,Windows Update,Enables the detection  download  and installation of updates for Windows and other programs. If this service is disabled  users of this computer will not be able to use Windows Update or its automatic updating feature  and programs will not be able to use the Windows Update Agent (WUA) API.,C:\Windows\System32\svchost.exe,963af53a6aa75d0adab976f536638a6f,C:\Windows\system32\svchost.exe -k netsvcs,Microsoft Windows,true,The file is signed and the signature was verified.,Microsoft Windows Verification PCA
EL0001DHA,vioscsi,0,vioscsi,,C:\Windows\System32\drivers\vioscsi.sys,b60e79113fcfbe0a35c86d5d7f2e6052,\SystemRoot\system32\drivers\vioscsi.sys,Google Inc,true,The file is signed and the signature was verified.,Symantec Class 3 SHA256 Code Signing CA
EL0001DHA,b57nd60a,0,Broadcom NetXtreme Gigabit Ethernet - NDIS 6.0,,C:\Windows\System32\drivers\b57nd60a.sys,12727b77f75224656b23f1ad211a61d7,system32\DRIVERS\b57nd60a.sys,Microsoft Windows,true,The file is signed and the signature was verified.,Microsoft Windows Verification PCA
EL0001DHA,clr_optimization_v4.0.30319_32,0,Microsoft .NET Framework NGEN v4.0.30319_X86,Microsoft .NET Framework NGEN,C:\Windows\Microsoft.NET\Framework\v4.0.30319\mscorsvw.exe,cf4a3c5789c380d09b5e2f76b8ace186,C:\Windows\Microsoft.NET\Framework\v4.0.30319\mscorsvw.exe,Microsoft Dynamic Code Publisher,true,The file is signed and the signature was verified.,Microsoft Code Signing PCA
EL0001DHA,sacdrv,0,sacdrv,,C:\Windows\System32\drivers\sacdrv.sys,30dcfe86c6ad280546f25f72acc8c906,\SystemRoot\system32\DRIVERS\sacdrv.sys,Microsoft Windows,true,The file is signed and the signature was verified.,Microsoft Windows Verification PCA
EL0001DHA,rdbss,0,Redirected Buffering Sub Sysytem,Provides the framework for network mini-redirectors,C:\Windows\System32\drivers\rdbss.sys,7dbd5dfe40eb4204d2e4df9c96e5caf2,system32\DRIVERS\rdbss.sys,Microsoft Windows,true,The file is signed and the signature was verified.,Microsoft Windows Verification PCA
EL0001DHA,tcpipreg,0,TCP/IP Registry Compatibility,Provides compatibility for legacy applications which interact with TCP/IP through the registry. If this service is stopped  certain applications may have impaired functionality.,C:\Windows\System32\drivers\tcpipreg.sys,b327c5c9831eb1e8eaa5153ddc7b1df0,System32\drivers\tcpipreg.sys,Microsoft Windows,true,The file is signed and the signature was verified.,Microsoft Windows Verification PCA
EL0001DHA,TapiSrv,0,Telephony,Provides Telephony API (TAPI) support for programs that control telephony devices on the local computer and  through the LAN  on servers that are also running the service.,C:\Windows\System32\svchost.exe,963af53a6aa75d0adab976f536638a6f,C:\Windows\System32\svchost.exe -k tapisrv,Microsoft Windows,true,The file is signed and the signature was verified.,Microsoft Windows Verification PCA
EL0001DHA,fdc,0,Floppy Disk Controller Driver,,C:\Windows\System32\drivers\fdc.sys,1d21d0c4eddfb0983d8cd2f04c81baed,\SystemRoot\system32\drivers\fdc.sys,Microsoft Windows,true,The file is signed and the signature was verified.,Microsoft Windows Verification PCA
EL0001DHA,megasas,0,megasas,,C:\Windows\System32\drivers\megasas.sys,162b07b8ec524c1ca6df36e7431ed7ab,\SystemRoot\system32\drivers\megasas.sys,Microsoft Windows,true,The file is signed and the signature was verified.,Microsoft Windows Verification PCA
EL0001DHA,mssmbios,0,Microsoft System Management BIOS Driver,,C:\Windows\System32\drivers\mssmbios.sys,11564d63ceeca31fde46a584a1063864,\SystemRoot\system32\drivers\mssmbios.sys,Microsoft Windows,true,The file is signed and the signature was verified.,Microsoft Windows Verification PCA
EL0001DHA,arc,0,arc,,C:\Windows\System32\drivers\arc.sys,6e91dc680e59dddd94b532cc24db67d0,\SystemRoot\system32\drivers\arc.sys,Microsoft Windows,true,The file is signed and the signature was verified.,Microsoft Windows Verification PCA
EL0001DHA,AmdK8,0,AMD K8 Processor Driver,,C:\Windows\System32\drivers\amdk8.sys,e6cc545471c2a83b312534d56211398b,\SystemRoot\system32\drivers\amdk8.sys,Microsoft Windows,true,The file is signed and the signature was verified.,Microsoft Windows Verification PCA
EL0001DHA,BrUsbMdm,0,Brother MFC USB Fax Only Modem,,C:\Windows\System32\drivers\BrUsbMdm.sys,5e49f93e0316e5fc4567f4bc4ef28b79,\SystemRoot\System32\Drivers\BrUsbMdm.sys,Microsoft Windows,true,The file is signed and the signature was verified.,Microsoft Windows Verification PCA
EL0001DHA,BrFiltLo,0,Brother USB Mass-Storage Lower Filter Driver,,C:\Windows\System32\drivers\BrFiltLo.sys,9f0c1563fa8d6772a6afda667a95d294,\SystemRoot\system32\drivers\BrFiltLo.sys,Microsoft Windows,true,The file is signed and the signature was verified.,Microsoft Windows Verification PCA
EL0001DHA,Power,560,Power,Manages power policy and power policy notification delivery.,C:\Windows\System32\svchost.exe,963af53a6aa75d0adab976f536638a6f,C:\Windows\system32\svchost.exe -k DcomLaunch,Microsoft Windows,true,The file is signed and the signature was verified.,Microsoft Windows Verification PCA
EL0001DHA,nsiproxy,0,NSI proxy service driver.,NSI proxy service.,C:\Windows\System32\drivers\nsiproxy.sys,0389280607032233550621e32da82b26,system32\drivers\nsiproxy.sys,Microsoft Windows,true,The file is signed and the signature was verified.,Microsoft Windows Verification PCA
EL0001DHA,HTTP,0,HTTP,This service implements the hypertext transfer protocol (HTTP). If this service is disabled  any services that explicitly depend on it will fail to start.,C:\Windows\System32\drivers\http.sys,87c813f7d662035ddbdf9f8edd64f96e,system32\drivers\HTTP.sys,Microsoft Windows,true,The file is signed and the signature was verified.,Microsoft Windows Verification PCA
EL0001DHA,vhdmp,0,vhdmp,,C:\Windows\System32\drivers\vhdmp.sys,3d3d2e2d7552fe6905cc66aa639821fb,\SystemRoot\system32\drivers\vhdmp.sys,Microsoft Windows,true,The file is signed and the signature was verified.,Microsoft Windows Verification PCA
EL0001DHA,RasPppoe,0,Remote Access PPPOE Driver,Remote Access PPPOE Driver,C:\Windows\System32\drivers\raspppoe.sys,65d3e539711333959b1fd4de87b43704,system32\DRIVERS\raspppoe.sys,Microsoft Windows,true,The file is signed and the signature was verified.,Microsoft Windows Verification PCA
EL0001DHA,iphlpsvc,968,IP Helper,Provides tunnel connectivity using IPv6 transition technologies (6to4  ISATAP  Port Proxy  and Teredo)  and IP-HTTPS. If this service is stopped  the computer will not have the enhanced connectivity benefits that these technologies offer.,C:\Windows\System32\svchost.exe,963af53a6aa75d0adab976f536638a6f,C:\Windows\System32\svchost.exe -k NetSvcs,Microsoft Windows,true,The file is signed and the signature was verified.,Microsoft Windows Verification PCA
EL0001DHA,TDTCP,0,TDTCP,,C:\Windows\System32\drivers\tdtcp.sys,9321d8bc5055450423a4666f3dc2de94,system32\drivers\tdtcp.sys,Microsoft Windows,true,The file is signed and the signature was verified.,Microsoft Windows Verification PCA
EL0001DHA,TsUsbFlt,0,TsUsbFlt,Remote Desktop USB Hub Class Filter Driver,C:\Windows\System32\drivers\TsUsbFlt.sys,23512055bf4a791aa03b27074ffe1127,system32\drivers\tsusbflt.sys,Microsoft Windows,true,The file is signed and the signature was verified.,Microsoft Windows Verification PCA
EL0001DHA,Netman,244,Network Connections,Manages objects in the Network and Dial-Up Connections folder  in which you can view both local area network and remote connections.,C:\Windows\System32\svchost.exe,963af53a6aa75d0adab976f536638a6f,C:\Windows\System32\svchost.exe -k LocalSystemNetworkRestricted,Microsoft Windows,true,The file is signed and the signature was verified.,Microsoft Windows Verification PCA
EL0001DHA,tssecsrv,0,Remote Desktop Services Security Filter Driver,Remote Desktop Services Security Filter Driver,C:\Windows\System32\drivers\tssecsrv.sys,65fbfb45ce3045da9a40aaf50d7ec120,System32\DRIVERS\tssecsrv.sys,Microsoft Windows,true,The file is signed and the signature was verified.,Microsoft Windows Verification PCA
EL0001DHA,lltdsvc,0,Link-Layer Topology Discovery Mapper,Creates a Network Map  consisting of PC and device topology (connectivity) information  and metadata describing each PC and device.  If this service is disabled  the Network Map will not function properly.,C:\Windows\System32\svchost.exe,963af53a6aa75d0adab976f536638a6f,C:\Windows\System32\svchost.exe -k LocalService,Microsoft Windows,true,The file is signed and the signature was verified.,Microsoft Windows Verification PCA
EL0001DHA,iaStorV,0,iaStorV,,C:\Windows\System32\drivers\iaStorV.sys,762ec97e4c4c5a87a4ca6550709ba580,\SystemRoot\system32\drivers\iaStorV.sys,Microsoft Windows,true,The file is signed and the signature was verified.,Microsoft Windows Verification PCA
EL0001DHA,VMBusHID,0,VMBusHID,,C:\Windows\System32\drivers\VMBusHID.sys,a4c88342125e917da28b188e01cbb1b1,\SystemRoot\system32\drivers\VMBusHID.sys,Microsoft Windows,true,The file is signed and the signature was verified.,Microsoft Windows Verification PCA
EL0001DHA,SstpSvc,0,Secure Socket Tunneling Protocol Service,Provides support for the Secure Socket Tunneling Protocol (SSTP) to connect to remote computers using VPN. If this service is disabled  users will not be able to use SSTP to access remote servers.,C:\Windows\System32\svchost.exe,963af53a6aa75d0adab976f536638a6f,C:\Windows\system32\svchost.exe -k LocalService,Microsoft Windows,true,The file is signed and the signature was verified.,Microsoft Windows Verification PCA
EL0001DHA,WerSvc,0,Windows Error Reporting Service,Allows errors to be reported when programs stop working or responding and allows existing solutions to be delivered. Also allows logs to be generated for diagnostic and repair services. If this service is stopped  error reporting might not work correctly and results of diagnostic services and repairs might not be displayed.,C:\Windows\System32\svchost.exe,963af53a6aa75d0adab976f536638a6f,C:\Windows\System32\svchost.exe -k WerSvcGroup,Microsoft Windows,true,The file is signed and the signature was verified.,Microsoft Windows Verification PCA
EL0001DHA,Serial,0,Serial port driver,,C:\Windows\System32\drivers\serial.sys,103690af9118333797f5d3cb7319faf1,\SystemRoot\system32\drivers\serial.sys,Microsoft Windows,true,The file is signed and the signature was verified.,Microsoft Windows Verification PCA
EL0001DHA,sbp2port,0,sbp2port,,C:\Windows\System32\drivers\sbp2port.sys,15b1fe9712722143e552816d4de257be,\SystemRoot\system32\drivers\sbp2port.sys,Microsoft Windows,true,The file is signed and the signature was verified.,Microsoft Windows Verification PCA
EL0001DHA,RemoteAccess,0,Routing and Remote Access,Offers routing services to businesses in local area and wide area network environments.,C:\Windows\System32\svchost.exe,963af53a6aa75d0adab976f536638a6f,C:\Windows\System32\svchost.exe -k netsvcs,Microsoft Windows,true,The file is signed and the signature was verified.,Microsoft Windows Verification PCA
EL0001DHA,w32time,828,Windows Time,Maintains date and time synchronization on all clients and servers in the network. If this service is stopped  date and time synchronization will be unavailable. If this service is disabled  any services that explicitly depend on it will fail to start.,C:\Windows\System32\svchost.exe,963af53a6aa75d0adab976f536638a6f,C:\Windows\system32\svchost.exe -k LocalService,Microsoft Windows,true,The file is signed and the signature was verified.,Microsoft Windows Verification PCA
EL0001DHA,dot3svc,0,Wired AutoConfig,The Wired AutoConfig (DOT3SVC) service is responsible for performing IEEE 802.1X authentication on Ethernet interfaces. If your current wired network deployment enforces 802.1X authentication  the DOT3SVC service should be configured to run for establishing Layer 2 connectivity and/or providing access to network resources. Wired networks that do not enforce 802.1X authentication are unaffected by the DOT3SVC service.,C:\Windows\System32\svchost.exe,963af53a6aa75d0adab976f536638a6f,C:\Windows\system32\svchost.exe -k LocalSystemNetworkRestricted,Microsoft Windows,true,The file is signed and the signature was verified.,Microsoft Windows Verification PCA
EL0001DHA,Wd,0,Wd,,C:\Windows\System32\drivers\wd.sys,409ccb0d741c0ea1adf75fc9cdf4240a,\SystemRoot\system32\drivers\wd.sys,Microsoft Windows,true,The file is signed and the signature was verified.,Microsoft Windows Verification PCA
EL0001DHA,mpio,0,mpio,,C:\Windows\System32\drivers\mpio.sys,a5b133406d31b4c960cad074320e2347,\SystemRoot\system32\drivers\mpio.sys,Microsoft Windows,true,The file is signed and the signature was verified.,Microsoft Windows Verification PCA
EL0001DHA,hwpolicy,0,Hardware Policy Driver,Contains Processor and other policies,C:\Windows\System32\drivers\hwpolicy.sys,b5287022bfa8fa0ea34148dbdce26a3d,\SystemRoot\System32\drivers\hwpolicy.sys,Microsoft Windows,true,The file is signed and the signature was verified.,Microsoft Windows Verification PCA
EL0001DHA,UxSms,244,Desktop Window Manager Session Manager,Provides Desktop Window Manager startup and maintenance services,C:\Windows\System32\svchost.exe,963af53a6aa75d0adab976f536638a6f,C:\Windows\System32\svchost.exe -k LocalSystemNetworkRestricted,Microsoft Windows,true,The file is signed and the signature was verified.,Microsoft Windows Verification PCA
EL0001DHA,clr_optimization_v4.0.30319_64,0,Microsoft .NET Framework NGEN v4.0.30319_X64,Microsoft .NET Framework NGEN,C:\Windows\Microsoft.NET\Framework64\v4.0.30319\mscorsvw.exe,86c38ec6514a880fb8ffe7e648bbbf24,C:\Windows\Microsoft.NET\Framework64\v4.0.30319\mscorsvw.exe,Microsoft Dynamic Code Publisher,true,The file is signed and the signature was verified.,Microsoft Code Signing PCA
EL0001DHA,lmhosts,932,TCP/IP NetBIOS Helper,Provides support for the NetBIOS over TCP/IP (NetBT) service and NetBIOS name resolution for clients on the network  therefore enabling users to share files  print  and log on to the network. If this service is stopped  these functions might be unavailable. If this service is disabled  any services that explicitly depend on it will fail to start.,C:\Windows\System32\svchost.exe,963af53a6aa75d0adab976f536638a6f,C:\Windows\system32\svchost.exe -k LocalServiceNetworkRestricted,Microsoft Windows,true,The file is signed and the signature was verified.,Microsoft Windows Verification PCA
EL0001DHA,kbdhid,0,Keyboard HID Driver,,C:\Windows\System32\drivers\kbdhid.sys,59015e4ddbabb2408060371ff2acfde5,\SystemRoot\system32\drivers\kbdhid.sys,Microsoft Windows,true,The file is signed and the signature was verified.,Microsoft Windows Verification PCA
EL0001DHA,rdpbus,0,Remote Desktop Device Redirector Bus Driver,,C:\Windows\System32\drivers\rdpbus.sys,85f2bc223aa397144f68ae4ea3664e2e,\SystemRoot\system32\drivers\rdpbus.sys,Microsoft Windows,true,The file is signed and the signature was verified.,Microsoft Windows Verification PCA
EL0001DHA,mrxsmb20,0,SMB 2.0 MiniRedirector,Implements the SMB 2.0 protocol  which provides connectivity to network resources on Windows Vista and later servers,C:\Windows\System32\drivers\mrxsmb20.sys,19b38b4e8d48682fb6d81d71fcc573f6,system32\DRIVERS\mrxsmb20.sys,Microsoft Windows,true,The file is signed and the signature was verified.,Microsoft Windows Verification PCA
EL0001DHA,Dnscache,852,DNS Client,The DNS Client service (dnscache) caches Domain Name System (DNS) names and registers the full computer name for this computer. If the service is stopped  DNS names will continue to be resolved. However  the results of DNS name queries will not be cached and the computer's name will not be registered. If the service is disabled  any services that explicitly depend on it will fail to start.,C:\Windows\System32\svchost.exe,963af53a6aa75d0adab976f536638a6f,C:\Windows\system32\svchost.exe -k NetworkService,Microsoft Windows,true,The file is signed and the signature was verified.,Microsoft Windows Verification PCA
EL0001DHA,LSI_SAS,0,LSI_SAS,,C:\Windows\System32\drivers\lsi_sas.sys,afb25d9ef19c6a256edee8708bdd867c,\SystemRoot\system32\drivers\lsi_sas.sys,Microsoft Windows,true,The file is signed and the signature was verified.,Microsoft Windows Verification PCA
EL0001DHA,AppIDSvc,0,Application Identity,Determines and verifies the identity of an application. Disabling this service will prevent AppLocker from being enforced.,C:\Windows\System32\svchost.exe,963af53a6aa75d0adab976f536638a6f,C:\Windows\system32\svchost.exe -k LocalServiceAndNoImpersonation,Microsoft Windows,true,The file is signed and the signature was verified.,Microsoft Windows Verification PCA
EL0001DHA,usbccgp,0,Microsoft USB Generic Parent Driver,,C:\Windows\System32\drivers\usbccgp.sys,f807e3d62fc7d2e704d51e2281a792fa,\SystemRoot\system32\drivers\usbccgp.sys,Microsoft Windows,true,The file is signed and the signature was verified.,Microsoft Windows Verification PCA
EL0001DHA,WudfPf,0,User Mode Driver Frameworks Platform Driver,,C:\Windows\System32\drivers\WUDFPf.sys,ef6677619d4d9f0d257126ac3d78cbb4,system32\drivers\WudfPf.sys,Microsoft Windows,true,The file is signed and the signature was verified.,Microsoft Windows Verification PCA
EL0001DHA,aliide,0,aliide,,C:\Windows\System32\drivers\aliide.sys,a4e6dd73a302276aad7116c48fddb5b0,\SystemRoot\system32\drivers\aliide.sys,Microsoft Windows,true,The file is signed and the signature was verified.,Microsoft Windows Verification PCA
EL0001DHA,NetBIOS,0,NetBIOS Interface,NetBIOS Interface,C:\Windows\System32\drivers\netbios.sys,20d04839ecf1c615b0af7318556f559b,system32\DRIVERS\netbios.sys,Microsoft Windows,true,The file is signed and the signature was verified.,Microsoft Windows Verification PCA
EL0001DHA,FileInfo,0,File Information FS MiniFilter,Collects information about files in memory to be consumed by other system services.,C:\Windows\System32\drivers\fileinfo.sys,aa894eb2275825ca456eb3deae2b362c,system32\drivers\fileinfo.sys,Microsoft Windows,true,The file is signed and the signature was verified.,Microsoft Windows Verification PCA
EL0001DHA,VgaSave,0,VgaSave,,C:\Windows\System32\drivers\vga.sys,1b7c1d4333d4899f27889e6e5c5b568e,\SystemRoot\System32\drivers\vga.sys,Microsoft Windows,true,The file is signed and the signature was verified.,Microsoft Windows Verification PCA
EL0001DHA,BrFiltUp,0,Brother USB Mass-Storage Upper Filter Driver,,C:\Windows\System32\drivers\BrFiltUp.sys,c10a7bd23aed48550a49d51f0bb46c3f,\SystemRoot\system32\drivers\BrFiltUp.sys,Microsoft Windows,true,The file is signed and the signature was verified.,Microsoft Windows Verification PCA
EL0001DHA,RasAgileVpn,0,WAN Miniport (IKEv2),WAN Miniport (IKEv2),C:\Windows\System32\drivers\agilevpn.sys,b769486040088d9c95f65a27b14e963a,system32\DRIVERS\AgileVpn.sys,Microsoft Windows,true,The file is signed and the signature was verified.,Microsoft Windows Verification PCA
EL0001DHA,gpsvc,968,Group Policy Client,The service is responsible for applying settings configured by administrators for the computer and users through the Group Policy component. If the service is stopped or disabled  the settings will not be applied and applications and components will not be manageable through Group Policy. Any components or applications that depend on the Group Policy component might not be functional if the service is stopped or disabled.,C:\Windows\System32\svchost.exe,963af53a6aa75d0adab976f536638a6f,C:\Windows\system32\svchost.exe -k netsvcs,Microsoft Windows,true,The file is signed and the signature was verified.,Microsoft Windows Verification PCA
EL0001DHA,srv2,0,Server SMB 2.xxx Driver,Enables connectivity from Windows Vista and later clients,C:\Windows\System32\drivers\srv2.sys,1cc25b103a491c5cdd725f039210b52e,System32\DRIVERS\srv2.sys,Microsoft Windows,true,The file is signed and the signature was verified.,Microsoft Windows Verification PCA
EL0001DHA,THREADORDER,0,Thread Ordering Server,Provides ordered execution for a group of threads within a specific period of time.,C:\Windows\System32\svchost.exe,963af53a6aa75d0adab976f536638a6f,C:\Windows\system32\svchost.exe -k LocalService,Microsoft Windows,true,The file is signed and the signature was verified.,Microsoft Windows Verification PCA
EL0001DHA,AmdPPM,0,AMD Processor Driver,,C:\Windows\System32\drivers\amdppm.sys,830baeb35a1d35a9afeafac8af59805f,\SystemRoot\system32\drivers\amdppm.sys,Microsoft Windows,true,The file is signed and the signature was verified.,Microsoft Windows Verification PCA
EL0001DHA,FCRegSvc,0,Microsoft Fibre Channel Platform Registration Service,Registers the platform with all available Fibre Channel fabrics  and maintains the registrations.,C:\Windows\System32\svchost.exe,963af53a6aa75d0adab976f536638a6f,C:\Windows\system32\svchost.exe -k LocalServiceNetworkRestricted,Microsoft Windows,true,The file is signed and the signature was verified.,Microsoft Windows Verification PCA
EL0001DHA,cdrom,0,cdrom,,C:\Windows\System32\drivers\cdrom.sys,e6c7bae203d218add9a08358b90ef161,\SystemRoot\system32\drivers\cdrom.sys,Microsoft Windows,true,The file is signed and the signature was verified.,Microsoft Windows Verification PCA
EL0001DHA,pcw,0,Performance Counters for Windows Driver,,C:\Windows\System32\drivers\pcw.sys,69968c8622f9229c61ab62160cff9294,\SystemRoot\System32\drivers\pcw.sys,Microsoft Windows,true,The file is signed and the signature was verified.,Microsoft Windows Verification PCA
EL0001DHA,nvraid,0,nvraid,,C:\Windows\System32\drivers\nvraid.sys,386ecc23c56fa507b19519aad6a376ac,\SystemRoot\system32\drivers\nvraid.sys,Microsoft Windows,true,The file is signed and the signature was verified.,Microsoft Windows Verification PCA
EL0001DHA,VaultSvc,0,Credential Manager,Provides secure storage and retrieval of credentials to users  applications and security service packages.,C:\Windows\System32\lsass.exe,f443cf637fc8f1d8497f252e9324334c,C:\Windows\system32\lsass.exe,Microsoft Windows,true,The file is signed and the signature was verified.,Microsoft Windows Verification PCA
EL0001DHA,AudioEndpointBuilder,0,Windows Audio Endpoint Builder,Manages audio devices for the Windows Audio service.  If this service is stopped  audio devices and effects will not function properly.  If this service is disabled  any services that explicitly depend on it will fail to start,C:\Windows\System32\svchost.exe,963af53a6aa75d0adab976f536638a6f,C:\Windows\System32\svchost.exe -k LocalSystemNetworkRestricted,Microsoft Windows,true,The file is signed and the signature was verified.,Microsoft Windows Verification PCA
EL0001DHA,CompositeBus,0,Composite Bus Enumerator Driver,,C:\Windows\System32\drivers\CompositeBus.sys,77a48fd38004856739f238f6bc136885,\SystemRoot\system32\drivers\CompositeBus.sys,Microsoft Windows,true,The file is signed and the signature was verified.,Microsoft Windows Verification PCA
EL0001DHA,viaide,0,viaide,,C:\Windows\System32\drivers\viaide.sys,b6f5b178ebe40ba6aca7126478504011,\SystemRoot\system32\drivers\viaide.sys,Microsoft Windows,true,The file is signed and the signature was verified.,Microsoft Windows Verification PCA
