hostname,name,pid,descriptivename,description,path,pathmd5sum,arguments,pathcertificatesubject,pathsignatureverified,pathsignaturedescription,pathcertificateissuer
EL0001DHA,srvnet,0,srvnet,,C:\Windows\System32\drivers\srvnet.sys,998ca9d0a9f9078c61c830d09f78a6e4,System32\DRIVERS\srvnet.sys,Microsoft Windows,true,The file is signed and the signature was verified.,Microsoft Windows Verification PCA
EL0001DHA,RasAcd,0,Remote Access Auto Connection Driver,Remote Access Auto Connection Driver,C:\Windows\System32\drivers\rasacd.sys,4d871bc2ff698a5ce14c46fbda7d5145,System32\DRIVERS\rasacd.sys,Microsoft Windows,true,The file is signed and the signature was verified.,Microsoft Windows Verification PCA
EL0001DHA,Modem,0,Modem,,C:\Windows\System32\drivers\modem.sys,026fa99e44d8dcc75861733daffbcd72,system32\drivers\modem.sys,Microsoft Windows,true,The file is signed and the signature was verified.,Microsoft Windows Verification PCA
EL0001DHA,RasSstp,0,WAN Miniport (SSTP),WAN Miniport (SSTP),C:\Windows\System32\drivers\rassstp.sys,2fc92c60a4662c853e3afd391685aa3c,system32\DRIVERS\rassstp.sys,Microsoft Windows,true,The file is signed and the signature was verified.,Microsoft Windows Verification PCA
EL0001DHA,FsDepends,0,File System Dependency Minifilter,This minifilter tracks the dependencies associated with the various nested volumes/filesystems,C:\Windows\System32\drivers\FsDepends.sys,e77cecfb0fb120ced45687fbf2ce907c,System32\drivers\FsDepends.sys,Microsoft Windows,true,The file is signed and the signature was verified.,Microsoft Windows Verification PCA
EL0001DHA,RSoPProv,0,Resultant Set of Policy Provider,Provides a network service that processes requests to simulate application of Group Policy settings for a target user or computer in various situations and computes the Resultant Set of Policy settings.,C:\Windows\System32\rsopprov.exe,5543073c406c10b4b3471ce0605b8c6c,C:\Windows\system32\RSoPProv.exe,Microsoft Windows,true,The file is signed and the signature was verified.,Microsoft Windows Verification PCA
EL0001DHA,Schedule,968,Task Scheduler,Enables a user to configure and schedule automated tasks on this computer. The service also hosts multiple Windows system-critical tasks. If this service is stopped or disabled  these tasks will not be run at their scheduled times. If this service is disabled  any services that explicitly depend on it will fail to start.,C:\Windows\System32\svchost.exe,963af53a6aa75d0adab976f536638a6f,C:\Windows\system32\svchost.exe -k netsvcs,Microsoft Windows,true,The file is signed and the signature was verified.,Microsoft Windows Verification PCA
EL0001DHA,ohci1394,0,1394 OHCI Compliant Host Controller (Legacy),,C:\Windows\System32\drivers\ohci1394.sys,224f79341d1ad5d88f2bcdd51d5d0655,\SystemRoot\system32\drivers\ohci1394.sys,Microsoft Windows,true,The file is signed and the signature was verified.,Microsoft Windows Verification PCA
EL0001DHA,defragsvc,0,Disk Defragmenter,Provides Disk Defragmentation Capabilities.,C:\Windows\System32\svchost.exe,963af53a6aa75d0adab976f536638a6f,C:\Windows\system32\svchost.exe -k defragsvc,Microsoft Windows,true,The file is signed and the signature was verified.,Microsoft Windows Verification PCA
EL0001DHA,tunnel,0,Microsoft Tunnel Miniport Adapter Driver,,C:\Windows\System32\drivers\tunnel.sys,f2825f3995a82cd8a9324c8fac283acd,system32\DRIVERS\tunnel.sys,Microsoft Windows,true,The file is signed and the signature was verified.,Microsoft Windows Verification PCA
EL0001DHA,EapHost,0,Extensible Authentication Protocol,The Extensible Authentication Protocol (EAP) service provides network authentication in such scenarios as 802.1x wired and wireless  VPN  and Network Access Protection (NAP).  EAP also provides application programming interfaces (APIs) that are used by network access clients  including wireless and VPN clients  during the authentication process.  If you disable this service  this computer is prevented from accessing networks that require EAP authentication.,C:\Windows\System32\svchost.exe,963af53a6aa75d0adab976f536638a6f,C:\Windows\System32\svchost.exe -k netsvcs,Microsoft Windows,true,The file is signed and the signature was verified.,Microsoft Windows Verification PCA
EL0001DHA,UmPass,0,Microsoft UMPass Driver,,C:\Windows\System32\drivers\umpass.sys,6a387589f6110dc48db0056a0f572b21,\SystemRoot\system32\drivers\umpass.sys,Microsoft Windows,true,The file is signed and the signature was verified.,Microsoft Windows Verification PCA
EL0001DHA,ALG,0,Application Layer Gateway Service,Provides support for 3rd party protocol plug-ins for Internet Connection Sharing,C:\Windows\System32\alg.exe,5bfe86a3714f7d5194ba62a3d9bca513,C:\Windows\System32\alg.exe,Microsoft Windows,true,The file is signed and the signature was verified.,Microsoft Windows Verification PCA
EL0001DHA,ioatdma,0,Intel(R) QuickData Technology Device,,C:\Windows\System32\drivers\qd260x64.sys,de67d6fe68c3a97c9a54f9e3a0f47186,\SystemRoot\System32\Drivers\qd260x64.sys,Microsoft Windows,true,The file is signed and the signature was verified.,Microsoft Windows Verification PCA
EL0001DHA,iScsiPrt,0,iScsiPort Driver,,C:\Windows\System32\drivers\msiscsi.sys,c7797112445d15ebae324e5d85e46ff5,\SystemRoot\system32\drivers\msiscsi.sys,Microsoft Windows,true,The file is signed and the signature was verified.,Microsoft Windows Verification PCA
EL0001DHA,mshidkmdf,0,Pass-through HID to KMDF Filter Driver,Device Filter to provide pass-through interface between HIDCLASS and KMDF,C:\Windows\System32\drivers\mshidkmdf.sys,101b2e3f8551c005da52bd23e1b6aacc,\SystemRoot\System32\drivers\mshidkmdf.sys,Microsoft Windows,true,The file is signed and the signature was verified.,Microsoft Windows Verification PCA
EL0001DHA,MegaSR,0,MegaSR,,C:\Windows\System32\drivers\MegaSR.sys,5619838b6588c53c7f02fa91f7d21279,\SystemRoot\system32\drivers\MegaSR.sys,Microsoft Windows,true,The file is signed and the signature was verified.,Microsoft Windows Verification PCA
EL0001DHA,wmiApSrv,0,WMI Performance Adapter,Provides performance library information from Windows Management Instrumentation (WMI) providers to clients on the network. This service only runs when Performance Data Helper is activated.,C:\Windows\System32\wbem\WmiApSrv.exe,2be1ff5c4e9dbafa99c32282c87aa156,C:\Windows\system32\wbem\WmiApSrv.exe,Microsoft Windows,true,The file is signed and the signature was verified.,Microsoft Windows Verification PCA
EL0001DHA,Compbatt,0,Compbatt,,C:\Windows\System32\drivers\compbatt.sys,64b9256226e0e4f008a83fdbd268eebd,\SystemRoot\system32\drivers\compbatt.sys,Microsoft Windows,true,The file is signed and the signature was verified.,Microsoft Windows Verification PCA
EL0001DHA,AcpiPmi,0,ACPI Power Meter Driver,,C:\Windows\System32\drivers\acpipmi.sys,771c77bd4ef44ceee7d8c7ab9bc14aae,\SystemRoot\system32\drivers\acpipmi.sys,Microsoft Windows,true,The file is signed and the signature was verified.,Microsoft Windows Verification PCA
EL0001DHA,usbehci,0,Microsoft USB 2.0 Enhanced Host Controller Miniport Driver,,C:\Windows\System32\drivers\usbehci.sys,279e4b4ec7eb92941ba7dc25bd234fac,\SystemRoot\system32\drivers\usbehci.sys,Microsoft Windows,true,The file is signed and the signature was verified.,Microsoft Windows Verification PCA
EL0001DHA,TrkWks,244,Distributed Link Tracking Client,Maintains links between NTFS files within a computer or across computers in a network.,C:\Windows\System32\svchost.exe,963af53a6aa75d0adab976f536638a6f,C:\Windows\System32\svchost.exe -k LocalSystemNetworkRestricted,Microsoft Windows,true,The file is signed and the signature was verified.,Microsoft Windows Verification PCA
EL0001DHA,Appinfo,968,Application Information,Facilitates the running of interactive applications with additional administrative privileges.  If this service is stopped  users will be unable to launch applications with the additional administrative privileges they may require to perform desired user tasks.,C:\Windows\System32\svchost.exe,963af53a6aa75d0adab976f536638a6f,C:\Windows\system32\svchost.exe -k netsvcs,Microsoft Windows,true,The file is signed and the signature was verified.,Microsoft Windows Verification PCA
EL0001DHA,sacsvr,968,Special Administration Console Helper,Allows administrators to remotely access a command prompt using Emergency Management Services.,C:\Windows\System32\svchost.exe,963af53a6aa75d0adab976f536638a6f,C:\Windows\System32\svchost.exe -k netsvcs,Microsoft Windows,true,The file is signed and the signature was verified.,Microsoft Windows Verification PCA
EL0001DHA,Spooler,1052,Print Spooler,Loads files to memory for later printing,C:\Windows\System32\spoolsv.exe,82c46f63d7416fe5ef2079b9397b6bdf,C:\Windows\System32\spoolsv.exe,Microsoft Windows,true,The file is signed and the signature was verified.,Microsoft Windows Verification PCA
EL0001DHA,AxInstSV,0,ActiveX Installer (AxInstSV),Provides User Account Control validation for the installation of ActiveX controls from the Internet and enables management of ActiveX control installation based on Group Policy settings. This service is started on demand and if disabled the installation of ActiveX controls will behave according to default browser settings.,C:\Windows\System32\svchost.exe,963af53a6aa75d0adab976f536638a6f,C:\Windows\system32\svchost.exe -k AxInstSVGroup,Microsoft Windows,true,The file is signed and the signature was verified.,Microsoft Windows Verification PCA
EL0001DHA,NetBT,0,NetBT,This service implements NetBios over TCP/IP.,C:\Windows\System32\drivers\netbt.sys,fecb090ceb1d44095cba515effdcd416,System32\DRIVERS\netbt.sys,Microsoft Windows,true,The file is signed and the signature was verified.,Microsoft Windows Verification PCA
EL0001DHA,ACPI,0,Microsoft ACPI Driver,,C:\Windows\System32\drivers\acpi.sys,81630fe1a447dc0c92776e045fe0c518,\SystemRoot\system32\drivers\ACPI.sys,Microsoft Windows,true,The file is signed and the signature was verified.,Microsoft Windows Verification PCA
EL0001DHA,partmgr,0,Partition Manager,Disk class filter driver that auctions out partitions to volume managers,C:\Windows\System32\drivers\partmgr.sys,00b675c0b7dd77b49a967af32c5dc2b2,\SystemRoot\System32\drivers\partmgr.sys,Microsoft Windows,true,The file is signed and the signature was verified.,Microsoft Windows Verification PCA
EL0001DHA,SSDPSRV,0,SSDP Discovery,Discovers networked devices and services that use the SSDP discovery protocol  such as UPnP devices. Also announces SSDP devices and services running on the local computer. If this service is stopped  SSDP-based devices will not be discovered. If this service is disabled  any services that explicitly depend on it will fail to start.,C:\Windows\System32\svchost.exe,963af53a6aa75d0adab976f536638a6f,C:\Windows\system32\svchost.exe -k LocalServiceAndNoImpersonation,Microsoft Windows,true,The file is signed and the signature was verified.,Microsoft Windows Verification PCA
EL0001DHA,COMSysApp,1656,COM+ System Application,Manages the configuration and tracking of Component Object Model (COM)+-based components. If the service is stopped  most COM+-based components will not function properly. If this service is disabled  any services that explicitly depend on it will fail to start.,C:\Windows\System32\dllhost.exe,2bb08595572868fe10b9b512dba0a504,C:\Windows\system32\dllhost.exe /Processid:{02D4B3F1-FD88-11D1-960D-00805FC79235},Microsoft Windows,true,The file is signed and the signature was verified.,Microsoft Windows Verification PCA
EL0001DHA,hidserv,0,Human Interface Device Access,Enables generic input access to Human Interface Devices (HID)  which activates and maintains the use of predefined hot buttons on keyboards  remote controls  and other multimedia devices. If this service is stopped  hot buttons controlled by this service will no longer function. If this service is disabled  any services that explicitly depend on it will fail to start.,C:\Windows\System32\svchost.exe,963af53a6aa75d0adab976f536638a6f,C:\Windows\system32\svchost.exe -k LocalSystemNetworkRestricted,Microsoft Windows,true,The file is signed and the signature was verified.,Microsoft Windows Verification PCA
EL0001DHA,nvme,0,nvme,,C:\Windows\System32\drivers\nvme.sys,b7b4dc17ab2b4d9869a7a5bbb42a4d41,\SystemRoot\system32\drivers\nvme.sys,Google Inc,true,The file is signed and the signature was verified.,Symantec Class 3 SHA256 Code Signing CA
EL0001DHA,AsyncMac,0,RAS Asynchronous Media Driver,RAS Asynchronous Media Driver,C:\Windows\System32\drivers\asyncmac.sys,1643a30418114a03ab71c267a3e3e848,system32\DRIVERS\asyncmac.sys,Microsoft Windows,true,The file is signed and the signature was verified.,Microsoft Windows Verification PCA
EL0001DHA,IPNAT,0,IP Network Address Translator,,C:\Windows\System32\drivers\ipnat.sys,afc04753587890a8a0e69c96396ef087,System32\drivers\ipnat.sys,Microsoft Windows,true,The file is signed and the signature was verified.,Microsoft Windows Verification PCA
EL0001DHA,WdiSystemHost,244,Diagnostic System Host,The Diagnostic System Host is used by the Diagnostic Policy Service to host diagnostics that need to run in a Local System context.  If this service is stopped  any diagnostics that depend on it will no longer function.,C:\Windows\System32\svchost.exe,963af53a6aa75d0adab976f536638a6f,C:\Windows\System32\svchost.exe -k LocalSystemNetworkRestricted,Microsoft Windows,true,The file is signed and the signature was verified.,Microsoft Windows Verification PCA
EL0001DHA,SENS,968,System Event Notification Service,Monitors system events and notifies subscribers to COM+ Event System of these events.,C:\Windows\System32\svchost.exe,963af53a6aa75d0adab976f536638a6f,C:\Windows\system32\svchost.exe -k netsvcs,Microsoft Windows,true,The file is signed and the signature was verified.,Microsoft Windows Verification PCA
EL0001DHA,netkvm,0,Red Hat VirtIO Ethernet Adapter Service,,C:\Windows\System32\drivers\netkvm.sys,b3420893f09399b04f5d2b051f1bad9c,system32\DRIVERS\netkvm.sys,Google Inc,true,The file is signed and the signature was verified.,Symantec Class 3 SHA256 Code Signing CA
EL0001DHA,WinHttpAutoProxySvc,0,WinHTTP Web Proxy Auto-Discovery Service,WinHTTP implements the client HTTP stack and provides developers with a Win32 API and COM Automation component for sending HTTP requests and receiving responses. In addition  WinHTTP provides support for auto-discovering a proxy configuration via its implementation of the Web Proxy Auto-Discovery (WPAD) protocol.,C:\Windows\System32\svchost.exe,963af53a6aa75d0adab976f536638a6f,C:\Windows\system32\svchost.exe -k LocalService,Microsoft Windows,true,The file is signed and the signature was verified.,Microsoft Windows Verification PCA
EL0001DHA,DcomLaunch,560,DCOM Server Process Launcher,The DCOMLAUNCH service launches COM and DCOM servers in response to object activation requests. If this service is stopped or disabled  programs using COM or DCOM will not function properly. It is strongly recommended that you have the DCOMLAUNCH service running.,C:\Windows\System32\svchost.exe,963af53a6aa75d0adab976f536638a6f,C:\Windows\system32\svchost.exe -k DcomLaunch,Microsoft Windows,true,The file is signed and the signature was verified.,Microsoft Windows Verification PCA
EL0001DHA,WmiAcpi,0,Microsoft Windows Management Interface for ACPI,,C:\Windows\System32\drivers\wmiacpi.sys,0c5145ce34575669615125ee177521b0,\SystemRoot\system32\drivers\wmiacpi.sys,Microsoft Windows,true,The file is signed and the signature was verified.,Microsoft Windows Verification PCA
EL0001DHA,aspnet_state,0,ASP.NET State Service,Provides support for out-of-process session states for ASP.NET. If this service is stopped  out-of-process requests will not be processed. If this service is disabled  any services that explicitly depend on it will fail to start.,C:\Windows\Microsoft.NET\Framework64\v4.0.30319\aspnet_state.exe,79268931cde9c2e7d2af014971c03db5,C:\Windows\Microsoft.NET\Framework64\v4.0.30319\aspnet_state.exe,Microsoft Corporation,true,The file is signed and the signature was verified.,Microsoft Code Signing PCA
EL0001DHA,iirsp,0,iirsp,,C:\Windows\System32\drivers\iirsp.sys,4a37b6462cc320b5f1467b2aebefdf34,\SystemRoot\system32\drivers\iirsp.sys,Microsoft Windows,true,The file is signed and the signature was verified.,Microsoft Windows Verification PCA
EL0001DHA,volmgr,0,Volume Manager Driver,,C:\Windows\System32\drivers\volmgr.sys,7af81dcd087cf71b0da1b60e93d8ae95,\SystemRoot\system32\drivers\volmgr.sys,Microsoft Windows,true,The file is signed and the signature was verified.,Microsoft Windows Verification PCA
EL0001DHA,nsi,828,Network Store Interface Service,This service delivers network notifications (e.g. interface addition/deleting etc) to user mode clients. Stopping this service will cause loss of network connectivity. If this service is disabled  any other services that explicitly depend on this service will fail to start.,C:\Windows\System32\svchost.exe,963af53a6aa75d0adab976f536638a6f,C:\Windows\system32\svchost.exe -k LocalService,Microsoft Windows,true,The file is signed and the signature was verified.,Microsoft Windows Verification PCA
EL0001DHA,IPMIDRV,0,IPMIDRV,,C:\Windows\System32\drivers\IPMIDrv.sys,e4c44a1f3b7ec91130f7fafd66df19e4,\SystemRoot\system32\drivers\IPMIDrv.sys,Microsoft Windows,true,The file is signed and the signature was verified.,Microsoft Windows Verification PCA
EL0001DHA,Rasl2tp,0,WAN Miniport (L2TP),WAN Miniport (L2TP),C:\Windows\System32\drivers\rasl2tp.sys,bfa2bc3bbee247e884abd36968bc02a0,system32\DRIVERS\rasl2tp.sys,Microsoft Windows,true,The file is signed and the signature was verified.,Microsoft Windows Verification PCA
EL0001DHA,TCPIP6,0,Microsoft IPv6 Protocol Driver,Microsoft IPv6 Protocol Driver,C:\Windows\System32\drivers\tcpip.sys,367b9eb0f06c151fe331be18562d389b,system32\DRIVERS\tcpip.sys,Microsoft Windows,true,The file is signed and the signature was verified.,Microsoft Windows Verification PCA
EL0001DHA,Wecsvc,0,Windows Event Collector,This service manages persistent subscriptions to events from remote sources that support WS-Management protocol. This includes Windows Vista event logs  hardware and IPMI-enabled event sources. The service stores forwarded events in a local Event Log. If this service is stopped or disabled event subscriptions cannot be created and forwarded events cannot be accepted.,C:\Windows\System32\svchost.exe,963af53a6aa75d0adab976f536638a6f,C:\Windows\system32\svchost.exe -k NetworkService,Microsoft Windows,true,The file is signed and the signature was verified.,Microsoft Windows Verification PCA
EL0001DHA,RemoteRegistry,1320,Remote Registry,Enables remote users to modify registry settings on this computer. If this service is stopped  the registry can be modified only by users on this computer. If this service is disabled  any services that explicitly depend on it will fail to start.,C:\Windows\System32\svchost.exe,963af53a6aa75d0adab976f536638a6f,C:\Windows\system32\svchost.exe -k regsvc,Microsoft Windows,true,The file is signed and the signature was verified.,Microsoft Windows Verification PCA
EL0001DHA,PEAUTH,0,PEAUTH,,C:\Windows\System32\drivers\PEAuth.sys,b725632dbeb092e03fdade8c9c27b619,system32\drivers\peauth.sys,Microsoft Windows,true,The file is signed and the signature was verified.,Microsoft Windows Verification PCA
EL0001DHA,msahci,0,msahci,,C:\Windows\System32\drivers\msahci.sys,58914f96a3669c29ba5f3e505d87db7c,\SystemRoot\system32\drivers\msahci.sys,Microsoft Windows,true,The file is signed and the signature was verified.,Microsoft Windows Verification PCA
EL0001DHA,amdide,0,amdide,,C:\Windows\System32\drivers\amdide.sys,098d1be2a58b471ca88bf03fa51e72b6,\SystemRoot\system32\drivers\amdide.sys,Microsoft Windows,true,The file is signed and the signature was verified.,Microsoft Windows Verification PCA
EL0001DHA,RDPENCDD,0,RDP Encoder Mirror Driver,RDP Encoder Mirror Driver,C:\Windows\System32\drivers\RDPENCDD.sys,12983dedceaa4b001b3f44d433809121,system32\drivers\rdpencdd.sys,Microsoft Windows,true,The file is signed and the signature was verified.,Microsoft Windows Verification PCA
EL0001DHA,intelide,0,intelide,,C:\Windows\System32\drivers\intelide.sys,4aa0b5ffc866b4fdc90d2fb1af7d0c7a,\SystemRoot\system32\drivers\intelide.sys,Microsoft Windows,true,The file is signed and the signature was verified.,Microsoft Windows Verification PCA
EL0001DHA,arcsas,0,arcsas,,C:\Windows\System32\drivers\arcsas.sys,d68a3972253540c3555d145139e9dc21,\SystemRoot\system32\drivers\arcsas.sys,Microsoft Windows,true,The file is signed and the signature was verified.,Microsoft Windows Verification PCA
EL0001DHA,USBSTOR,0,USB Mass Storage Driver,,C:\Windows\System32\drivers\USBSTOR.SYS,2581bc09e75d340f20be4e37451839fe,\SystemRoot\system32\drivers\USBSTOR.SYS,Microsoft Windows,true,The file is signed and the signature was verified.,Microsoft Windows Verification PCA
EL0001DHA,NdisWan,0,Remote Access NDIS WAN Driver,Remote Access NDIS WAN Driver,C:\Windows\System32\drivers\ndiswan.sys,4f5d6d5932fb7c8997022515e36cf3f8,system32\DRIVERS\ndiswan.sys,Microsoft Windows,true,The file is signed and the signature was verified.,Microsoft Windows Verification PCA
EL0001DHA,msdsm,0,msdsm,,C:\Windows\System32\drivers\msdsm.sys,b9f86124e50f84d5d8c8a3c52ca25fc1,\SystemRoot\system32\drivers\msdsm.sys,Microsoft Windows,true,The file is signed and the signature was verified.,Microsoft Windows Verification PCA
EL0001DHA,Dhcp,932,DHCP Client,Registers and updates IP addresses and DNS records for this computer. If this service is stopped  this computer will not receive dynamic IP addresses and DNS updates. If this service is disabled  any services that explicitly depend on it will fail to start.,C:\Windows\System32\svchost.exe,963af53a6aa75d0adab976f536638a6f,C:\Windows\system32\svchost.exe -k LocalServiceNetworkRestricted,Microsoft Windows,true,The file is signed and the signature was verified.,Microsoft Windows Verification PCA
EL0001DHA,umbus,0,UMBus Enumerator Driver,,C:\Windows\System32\drivers\umbus.sys,f4fb436d6f73667b929ff4163b5ee852,system32\DRIVERS\umbus.sys,Microsoft Windows,true,The file is signed and the signature was verified.,Microsoft Windows Verification PCA
EL0001DHA,Wanarpv6,0,Remote Access IPv6 ARP Driver,Remote Access IPv6 ARP Driver,C:\Windows\System32\drivers\wanarp.sys,f8168c8f668cf84257d21f937fab1c91,system32\DRIVERS\wanarp.sys,Microsoft Windows,true,The file is signed and the signature was verified.,Microsoft Windows Verification PCA
EL0001DHA,PolicyAgent,1712,IPsec Policy Agent,"""Internet Protocol security (IPsec) supports network-level peer authentication  data origin authentication  data integrity  data confidentiality (encryption)  and replay protection.  This service enforces IPsec policies created through the IP Security Policies snap-in or the command-line tool """"netsh ipsec"""".  If you stop this service  you may experience network connectivity issues if your policy requires that connections use IPsec.  Also remote management of Windows Firewall is not available when this service is stopped.""",C:\Windows\System32\svchost.exe,963af53a6aa75d0adab976f536638a6f,C:\Windows\system32\svchost.exe -k NetworkServiceNetworkRestricted,Microsoft Windows,true,The file is signed and the signature was verified.,Microsoft Windows Verification PCA
EL0001DHA,IpFilterDriver,0,IP Traffic Filter Driver,IP Traffic Filter Driver,C:\Windows\System32\drivers\ipfltdrv.sys,ff06ca5d0688759dbe77c46fc26b1a45,system32\DRIVERS\ipfltdrv.sys,Microsoft Windows,true,The file is signed and the signature was verified.,Microsoft Windows Verification PCA
EL0001DHA,SCPolicySvc,0,Smart Card Removal Policy,Allows the system to be configured to lock the user desktop upon smart card removal.,C:\Windows\System32\svchost.exe,963af53a6aa75d0adab976f536638a6f,C:\Windows\system32\svchost.exe -k netsvcs,Microsoft Windows,true,The file is signed and the signature was verified.,Microsoft Windows Verification PCA
EL0001DHA,NDIS,0,NDIS System Driver,NDIS System Driver,C:\Windows\System32\drivers\ndis.sys,4b9273c66f480cf514fcaaaaf0ef3bf6,\SystemRoot\system32\drivers\ndis.sys,Microsoft Windows,true,The file is signed and the signature was verified.,Microsoft Windows Verification PCA
EL0001DHA,LSI_SCSI,0,LSI_SCSI,,C:\Windows\System32\drivers\lsi_scsi.sys,f488ef61c2f13002e3e849e7c84358f1,\SystemRoot\system32\drivers\lsi_scsi.sys,Microsoft Windows,true,The file is signed and the signature was verified.,Microsoft Windows Verification PCA
EL0001DHA,WIMMount,0,WIMMount,WIM Image mount service driver,C:\Windows\System32\drivers\wimmount.sys,1b6ac3d08b51a9ec7032ead94d400f02,system32\drivers\wimmount.sys,Microsoft Windows,true,The file is signed and the signature was verified.,Microsoft Windows Verification PCA
EL0001DHA,upnphost,0,UPnP Device Host,Allows UPnP devices to be hosted on this computer. If this service is stopped  any hosted UPnP devices will stop functioning and no additional hosted devices can be added. If this service is disabled  any services that explicitly depend on it will fail to start.,C:\Windows\System32\svchost.exe,963af53a6aa75d0adab976f536638a6f,C:\Windows\system32\svchost.exe -k LocalServiceAndNoImpersonation,Microsoft Windows,true,The file is signed and the signature was verified.,Microsoft Windows Verification PCA
EL0001DHA,netprofm,828,Network List Service,Identifies the networks to which the computer has connected  collects and stores properties for these networks  and notifies applications when these properties change.,C:\Windows\System32\svchost.exe,963af53a6aa75d0adab976f536638a6f,C:\Windows\System32\svchost.exe -k LocalService,Microsoft Windows,true,The file is signed and the signature was verified.,Microsoft Windows Verification PCA
EL0001DHA,Tcpip,0,TCP/IP Protocol Driver,TCP/IP Protocol Driver,C:\Windows\System32\drivers\tcpip.sys,367b9eb0f06c151fe331be18562d389b,\SystemRoot\System32\drivers\tcpip.sys,Microsoft Windows,true,The file is signed and the signature was verified.,Microsoft Windows Verification PCA
