hostname,name,pid,descriptivename,description,path,pathmd5sum,arguments,pathcertificatesubject,pathsignatureverified,pathsignaturedescription,pathcertificateissuer
NT0003VEO,SSDPSRV,0,SSDP Discovery,Discovers networked devices and services that use the SSDP discovery protocol  such as UPnP devices. Also announces SSDP devices and services running on the local computer. If this service is stopped  SSDP-based devices will not be discovered. If this service is disabled  any services that explicitly depend on it will fail to start.,C:\Windows\System32\svchost.exe,4e13a941b99fe98effb858ff11a4415e,C:\Windows\system32\svchost.exe -k LocalServiceAndNoImpersonation,Microsoft Windows,true,The file is signed and the signature was verified.,Microsoft Windows Production PCA 2011
NT0003VEO,acpitime,0,ACPI Wake Alarm Driver,,C:\Windows\System32\drivers\acpitime.sys,f405afcb477819e7301f538fc87f17da,\SystemRoot\System32\drivers\acpitime.sys,Microsoft Windows,true,The file is signed and the signature was verified.,Microsoft Windows Production PCA 2011
NT0003VEO,WinHttpAutoProxySvc,928,WinHTTP Web Proxy Auto-Discovery Service,WinHTTP implements the client HTTP stack and provides developers with a Win32 API and COM Automation component for sending HTTP requests and receiving responses. In addition  WinHTTP provides support for auto-discovering a proxy configuration via its implementation of the Web Proxy Auto-Discovery (WPAD) protocol.,C:\Windows\System32\svchost.exe,4e13a941b99fe98effb858ff11a4415e,C:\Windows\system32\svchost.exe -k LocalService,Microsoft Windows,true,The file is signed and the signature was verified.,Microsoft Windows Production PCA 2011
NT0003VEO,NDISWANLEGACY,0,Remote Access LEGACY NDIS WAN Driver,Remote Access LEGACY NDIS WAN Driver,C:\Windows\System32\drivers\ndiswan.sys,4f5d6d5932fb7c8997022515e36cf3f8,\SystemRoot\system32\DRIVERS\ndiswan.sys,Microsoft Windows,true,The file is signed and the signature was verified.,Microsoft Windows Production PCA 2011
NT0003VEO,wudfsvc,0,Windows Driver Foundation - User-mode Driver Framework,Creates and manages user-mode driver processes. This service cannot be stopped.,C:\Windows\System32\svchost.exe,4e13a941b99fe98effb858ff11a4415e,C:\Windows\system32\svchost.exe -k LocalSystemNetworkRestricted,Microsoft Windows,true,The file is signed and the signature was verified.,Microsoft Windows Production PCA 2011
NT0003VEO,sermouse,0,Serial Mouse Driver,,C:\Windows\System32\drivers\sermouse.sys,2102697391c1c14e9c24d2de928b8dfb,\SystemRoot\System32\drivers\sermouse.sys,Microsoft Windows,true,The file is signed and the signature was verified.,Microsoft Windows Production PCA 2011
NT0003VEO,vmbus,0,Virtual Machine Bus,,C:\Windows\System32\drivers\vmbus.sys,50d656f4e619af6eacca3168369e19c8,\SystemRoot\System32\drivers\vmbus.sys,Microsoft Windows,true,The file is signed and the signature was verified.,Microsoft Windows Production PCA 2011
NT0003VEO,Audiosrv,0,Windows Audio,Manages audio for Windows-based programs.  If this service is stopped  audio devices and effects will not function properly.  If this service is disabled  any services that explicitly depend on it will fail to start,C:\Windows\System32\svchost.exe,4e13a941b99fe98effb858ff11a4415e,C:\Windows\System32\svchost.exe -k LocalServiceNetworkRestricted,Microsoft Windows,true,The file is signed and the signature was verified.,Microsoft Windows Production PCA 2011
NT0003VEO,BFE,808,Base Filtering Engine,The Base Filtering Engine (BFE) is a service that manages firewall and Internet Protocol security (IPsec) policies and implements user mode filtering. Stopping or disabling the BFE service will significantly reduce the security of the system. It will also result in unpredictable behavior in IPsec management and firewall applications.,C:\Windows\System32\svchost.exe,4e13a941b99fe98effb858ff11a4415e,C:\Windows\system32\svchost.exe -k LocalServiceNoNetwork,Microsoft Windows,true,The file is signed and the signature was verified.,Microsoft Windows Production PCA 2011
NT0003VEO,FsDepends,0,File System Dependency Minifilter,This minifilter tracks the dependencies associated with the various nested volumes/filesystems,C:\Windows\System32\drivers\FsDepends.sys,f0c8096b30d4a8ada491d4fac4070b39,System32\drivers\FsDepends.sys,Microsoft Windows,true,The file is signed and the signature was verified.,Microsoft Windows Production PCA 2011
NT0003VEO,sppsvc,0,Software Protection,Enables the download  installation and enforcement of digital licenses for Windows and Windows applications. If the service is disabled  the operating system and licensed applications may run in a notification mode. It is strongly recommended that you not disable the Software Protection service.,C:\Windows\System32\sppsvc.exe,2f537d8532f497ad920a1001cf82240e,C:\Windows\system32\sppsvc.exe,Microsoft Windows,true,The file is signed and the signature was verified.,Microsoft Windows Production PCA 2011
NT0003VEO,rdpbus,0,Remote Desktop Device Redirector Bus Driver,,C:\Windows\System32\drivers\rdpbus.sys,8d1fe03338838a6f462de40a14fd6e08,\SystemRoot\System32\drivers\rdpbus.sys,Microsoft Windows,true,The file is signed and the signature was verified.,Microsoft Windows Production PCA 2011
NT0003VEO,cfn-hup,0,CloudFormation cfn-hup,CloudFormation cfn-hup for Windows,C:\Program Files\Amazon\cfn-bootstrap\winhup.exe,310c95d981a15b8f5b53925c64f2b95f,C:\Program Files\Amazon\cfn-bootstrap\winhup.exe,,false,The file is not signed.,
NT0003VEO,BrokerInfrastructure,688,Background Tasks Infrastructure Service,Windows infrastructure service that controls which background tasks can run on the system.,C:\Windows\System32\svchost.exe,4e13a941b99fe98effb858ff11a4415e,C:\Windows\system32\svchost.exe -k DcomLaunch,Microsoft Windows,true,The file is signed and the signature was verified.,Microsoft Windows Production PCA 2011
NT0003VEO,XENBUS,0,AWS PV Bus,,C:\Windows\System32\drivers\xenbus.sys,27498965f1b0b7ffd64e561c4249da1c,\SystemRoot\system32\DRIVERS\xenbus.sys,Microsoft Windows Hardware Compatibility Publisher,true,The file is signed and the signature was verified.,Microsoft Windows Hardware Compatibility PCA
NT0003VEO,PrintNotify,0,Printer Extensions and Notifications,This service opens custom printer dialog boxes and handles notifications from a remote print server or a printer. If you turn off this service  you won’t be able to see printer extensions or notifications.,C:\Windows\System32\svchost.exe,4e13a941b99fe98effb858ff11a4415e,C:\Windows\system32\svchost.exe -k print,Microsoft Windows,true,The file is signed and the signature was verified.,Microsoft Windows Production PCA 2011
NT0003VEO,CLFS,0,Common Log (CLFS),General-purpose logging service,C:\Windows\System32\drivers\clfs.sys,ce2f84a6a92ff2dfc07d7c94ad77614c,\SystemRoot\System32\drivers\CLFS.sys,Microsoft Windows,true,The file is signed and the signature was verified.,Microsoft Windows Production PCA 2011
NT0003VEO,TsUsbGD,0,Remote Desktop Generic USB Device,,C:\Windows\System32\drivers\TsUsbGD.sys,98c45ccf6a4d616fc10d99794c34558e,\SystemRoot\System32\drivers\TsUsbGD.sys,Microsoft Windows,true,The file is signed and the signature was verified.,Microsoft Windows Production PCA 2011
NT0003VEO,usbhub,0,Microsoft USB Standard Hub Driver,,C:\Windows\System32\drivers\usbhub.sys,d475d2e8b189b97cf126e0665de4ca36,\SystemRoot\System32\drivers\usbhub.sys,Microsoft Windows,true,The file is signed and the signature was verified.,Microsoft Windows Production PCA 2011
NT0003VEO,USBHUB3,0,SuperSpeed Hub,,C:\Windows\System32\drivers\USBHUB3.SYS,3daed9cae0f83b721e6c459ecfe95afa,\SystemRoot\System32\drivers\UsbHub3.sys,Microsoft Windows,true,The file is signed and the signature was verified.,Microsoft Windows Production PCA 2011
NT0003VEO,SysMain,0,Superfetch,Maintains and improves system performance over time.,C:\Windows\System32\svchost.exe,4e13a941b99fe98effb858ff11a4415e,C:\Windows\system32\svchost.exe -k LocalSystemNetworkRestricted,Microsoft Windows,true,The file is signed and the signature was verified.,Microsoft Windows Production PCA 2011
NT0003VEO,Tcpip,0,TCP/IP Protocol Driver,TCP/IP Protocol Driver,C:\Windows\System32\drivers\tcpip.sys,a17131b994d0b0ec9cb632bca130f73a,\SystemRoot\System32\drivers\tcpip.sys,Microsoft Windows,true,The file is signed and the signature was verified.,Microsoft Windows Production PCA 2011
NT0003VEO,RSoPProv,0,Resultant Set of Policy Provider,Provides a network service that processes requests to simulate application of Group Policy settings for a target user or computer in various situations and computes the Resultant Set of Policy settings.,C:\Windows\System32\rsopprov.exe,a59df459c9f03ebb3bfb81f952193e0d,C:\Windows\system32\RSoPProv.exe,Microsoft Windows,true,The file is signed and the signature was verified.,Microsoft Windows Production PCA 2011
NT0003VEO,swenum,0,Software Bus Driver,,C:\Windows\System32\drivers\swenum.sys,7d1afaef505a127ebd505acf24b8b47e,\SystemRoot\System32\drivers\swenum.sys,Microsoft Windows,true,The file is signed and the signature was verified.,Microsoft Windows Production PCA 2011
NT0003VEO,i8042prt,0,i8042 Keyboard and PS/2 Mouse Port Driver,,C:\Windows\System32\drivers\i8042prt.sys,ada325fb69624d99ac61eebb96d22eec,\SystemRoot\System32\drivers\i8042prt.sys,Microsoft Windows,true,The file is signed and the signature was verified.,Microsoft Windows Production PCA 2011
NT0003VEO,DPS,808,Diagnostic Policy Service,The Diagnostic Policy Service enables problem detection  troubleshooting and resolution for Windows components.  If this service is stopped  diagnostics will no longer function.,C:\Windows\System32\svchost.exe,4e13a941b99fe98effb858ff11a4415e,C:\Windows\System32\svchost.exe -k LocalServiceNoNetwork,Microsoft Windows,true,The file is signed and the signature was verified.,Microsoft Windows Production PCA 2011
NT0003VEO,SystemEventsBroker,688,System Events Broker,Coordinates execution of background work for WinRT application. If this service is stopped or disabled  then background work might not be triggered.,C:\Windows\System32\svchost.exe,4e13a941b99fe98effb858ff11a4415e,C:\Windows\system32\svchost.exe -k DcomLaunch,Microsoft Windows,true,The file is signed and the signature was verified.,Microsoft Windows Production PCA 2011
NT0003VEO,MpsSvc,808,Windows Firewall,Windows Firewall helps protect your computer by preventing unauthorized users from gaining access to your computer through the Internet or a network.,C:\Windows\System32\svchost.exe,4e13a941b99fe98effb858ff11a4415e,C:\Windows\system32\svchost.exe -k LocalServiceNoNetwork,Microsoft Windows,true,The file is signed and the signature was verified.,Microsoft Windows Production PCA 2011
NT0003VEO,NdisImPlatform,0,Microsoft Network Adapter Multiplexor Protocol,Microsoft Network Adapter Multiplexor Protocol,C:\Windows\System32\drivers\NdisImPlatform.sys,350a00fa382bd479539fe0c776b5abe3,\SystemRoot\system32\DRIVERS\NdisImPlatform.sys,Microsoft Windows,true,The file is signed and the signature was verified.,Microsoft Windows Production PCA 2011
NT0003VEO,sfloppy,0,High-Capacity Floppy Disk Drive,,C:\Windows\System32\drivers\sfloppy.sys,bac669fdf89c27e2f2af5008df9277f6,\SystemRoot\System32\drivers\sfloppy.sys,Microsoft Windows,true,The file is signed and the signature was verified.,Microsoft Windows Production PCA 2011
NT0003VEO,CmBatt,0,Microsoft ACPI Control Method Battery Driver,,C:\Windows\System32\drivers\CmBatt.sys,533d70ca0aab0f4a7864d6fcc7727cd7,\SystemRoot\System32\drivers\CmBatt.sys,Microsoft Windows,true,The file is signed and the signature was verified.,Microsoft Windows Production PCA 2011
NT0003VEO,Processor,0,Processor Driver,,C:\Windows\System32\drivers\processr.sys,a046b1446c8a0256bb1a25575229d9f3,\SystemRoot\System32\drivers\processr.sys,Microsoft Windows,true,The file is signed and the signature was verified.,Microsoft Windows Production PCA 2011
NT0003VEO,COMSysApp,0,COM+ System Application,Manages the configuration and tracking of Component Object Model (COM)+-based components. If the service is stopped  most COM+-based components will not function properly. If this service is disabled  any services that explicitly depend on it will fail to start.,C:\Windows\System32\dllhost.exe,56cb6f36a0c55f8d9ac09a68c8605989,C:\Windows\system32\dllhost.exe /Processid:{02D4B3F1-FD88-11D1-960D-00805FC79235},Microsoft Windows,true,The file is signed and the signature was verified.,Microsoft Windows Production PCA 2011
NT0003VEO,3ware,0,3ware,,C:\Windows\System32\drivers\3ware.sys,9401d258c3cd4de0802d53757d7b67fd,\SystemRoot\System32\drivers\3ware.sys,Microsoft Windows,true,The file is signed and the signature was verified.,Microsoft Windows Production PCA 2011
NT0003VEO,Power,688,Power,Manages power policy and power policy notification delivery.,C:\Windows\System32\svchost.exe,4e13a941b99fe98effb858ff11a4415e,C:\Windows\system32\svchost.exe -k DcomLaunch,Microsoft Windows,true,The file is signed and the signature was verified.,Microsoft Windows Production PCA 2011
NT0003VEO,vmickvpexchange,0,Hyper-V Data Exchange Service,Provides a mechanism to exchange data between the virtual machine and the operating system running on the physical computer.,C:\Windows\System32\svchost.exe,4e13a941b99fe98effb858ff11a4415e,C:\Windows\system32\svchost.exe -k LocalSystemNetworkRestricted,Microsoft Windows,true,The file is signed and the signature was verified.,Microsoft Windows Production PCA 2011
NT0003VEO,hkmsvc,0,Health Key and Certificate Management,Provides X.509 certificate and key management services for the Network Access Protection Agent (NAPAgent). Enforcement technologies that use X.509 certificates may not function properly without this service,C:\Windows\System32\svchost.exe,4e13a941b99fe98effb858ff11a4415e,C:\Windows\System32\svchost.exe -k netsvcs,Microsoft Windows,true,The file is signed and the signature was verified.,Microsoft Windows Production PCA 2011
NT0003VEO,LSI_SAS3,0,LSI_SAS3,,C:\Windows\System32\drivers\lsi_sas3.sys,0faf28c236ec7280e7dd93b1f05b2b1a,\SystemRoot\System32\drivers\lsi_sas3.sys,Microsoft Windows,true,The file is signed and the signature was verified.,Microsoft Windows Production PCA 2011
NT0003VEO,pcmcia,0,pcmcia,,C:\Windows\System32\drivers\pcmcia.sys,d97d1cd62f999f7c8f533780ef23d909,\SystemRoot\System32\drivers\pcmcia.sys,Microsoft Windows,true,The file is signed and the signature was verified.,Microsoft Windows Production PCA 2011
NT0003VEO,TsUsbFlt,0,TsUsbFlt,Remote Desktop USB Hub Class Filter Driver,C:\Windows\System32\drivers\TsUsbFlt.sys,45bc08e52181d2a9969fbce766f899af,system32\drivers\tsusbflt.sys,Microsoft Windows,true,The file is signed and the signature was verified.,Microsoft Windows Production PCA 2011
NT0003VEO,WEPHOSTSVC,0,Windows Encryption Provider Host Service,Windows Encryption Provider Host Service brokers encryption related functionalities from 3rd Party Encryption Providers to processes that need to evaluate and apply EAS policies. Stopping this will compromise EAS compliancy checks that have been established by the connected Mail Accounts,C:\Windows\System32\svchost.exe,4e13a941b99fe98effb858ff11a4415e,C:\Windows\system32\svchost.exe -k WepHostSvcGroup,Microsoft Windows,true,The file is signed and the signature was verified.,Microsoft Windows Production PCA 2011
NT0003VEO,bowser,0,Browser Support Driver,Implements the kernel datagram receiver for the computer browser browser service.,C:\Windows\System32\drivers\bowser.sys,9f29819199361a48bba0364916a4a46c,system32\DRIVERS\bowser.sys,Microsoft Windows,true,The file is signed and the signature was verified.,Microsoft Windows Production PCA 2011
NT0003VEO,AmdPPM,0,AMD Processor Driver,,C:\Windows\System32\drivers\amdppm.sys,0a43f98718ca65168ec0c621c26aa18d,\SystemRoot\System32\drivers\amdppm.sys,Microsoft Windows,true,The file is signed and the signature was verified.,Microsoft Windows Production PCA 2011
NT0003VEO,ql40xx2i,0,QLogic iSCSI Miniport Inbox Driver,,C:\Windows\System32\drivers\ql40xx2i.sys,47a6e01b6faa12021949b537523c6551,\SystemRoot\System32\drivers\ql40xx2i.sys,Microsoft Windows,true,The file is signed and the signature was verified.,Microsoft Windows Production PCA 2011
NT0003VEO,tsusbhub,0,Remote Desktop USB Hub,,C:\Windows\System32\drivers\tsusbhub.sys,f5a1c097cb2fee38e7a8b54b68bde70d,\SystemRoot\System32\drivers\tsusbhub.sys,Microsoft Windows,true,The file is signed and the signature was verified.,Microsoft Windows Production PCA 2011
NT0003VEO,volmgr,0,Volume Manager Driver,,C:\Windows\System32\drivers\volmgr.sys,c0bb931e93a2f824890ea0f9507292e5,\SystemRoot\System32\drivers\volmgr.sys,Microsoft Windows,true,The file is signed and the signature was verified.,Microsoft Windows Production PCA 2011
NT0003VEO,monitor,0,Microsoft Monitor Class Function Driver Service,,C:\Windows\System32\drivers\monitor.sys,00256ddf45d3044c23bbddd27dff6bcf,\SystemRoot\System32\drivers\monitor.sys,Microsoft Windows,true,The file is signed and the signature was verified.,Microsoft Windows Production PCA 2011
NT0003VEO,mpsdrv,0,Windows Firewall Authorization Driver,Windows Firewall Authorization Driver is a kernel mode driver that provides deep inspection services on inbound and outbound network traffic.,C:\Windows\System32\drivers\mpsdrv.sys,56ebdf2278b9c0b99f469e7f18406cc7,System32\drivers\mpsdrv.sys,Microsoft Windows,true,The file is signed and the signature was verified.,Microsoft Windows Production PCA 2011
NT0003VEO,VSTXRAID,0,VIA StorX Storage RAID Controller Windows Driver,,C:\Windows\System32\drivers\VSTXRAID.SYS,edbe6dbe7aae2a31337bb95c34cf763d,\SystemRoot\System32\drivers\vstxraid.sys,Microsoft Windows,true,The file is signed and the signature was verified.,Microsoft Windows Production PCA 2011
NT0003VEO,viaide,0,viaide,,C:\Windows\System32\drivers\viaide.sys,73d857c3b24820d554abe179b0928ecf,\SystemRoot\System32\drivers\viaide.sys,Microsoft Windows,true,The file is signed and the signature was verified.,Microsoft Windows Production PCA 2011
NT0003VEO,SharedAccess,0,Internet Connection Sharing (ICS),Provides network address translation  addressing  name resolution and/or intrusion prevention services for a home or small office network.,C:\Windows\System32\svchost.exe,4e13a941b99fe98effb858ff11a4415e,C:\Windows\System32\svchost.exe -k netsvcs,Microsoft Windows,true,The file is signed and the signature was verified.,Microsoft Windows Production PCA 2011
NT0003VEO,rspndr,0,Link-Layer Topology Discovery Responder,,C:\Windows\System32\drivers\rspndr.sys,d4dde9caa840ba7d8190886d3977082a,\SystemRoot\system32\DRIVERS\rspndr.sys,Microsoft Windows,true,The file is signed and the signature was verified.,Microsoft Windows Production PCA 2011
NT0003VEO,KtmRm,0,KtmRm for Distributed Transaction Coordinator,Coordinates transactions between the Distributed Transaction Coordinator (MSDTC) and the Kernel Transaction Manager (KTM). If it is not needed  it is recommended that this service remain stopped. If it is needed  both MSDTC and KTM will start this service automatically. If this service is disabled  any MSDTC transaction interacting with a Kernel Resource Manager will fail and any services that explicitly depend on it will fail to start.,C:\Windows\System32\svchost.exe,4e13a941b99fe98effb858ff11a4415e,C:\Windows\System32\svchost.exe -k NetworkServiceAndNoImpersonation,Microsoft Windows,true,The file is signed and the signature was verified.,Microsoft Windows Production PCA 2011
NT0003VEO,UCX01000,0,USB Controller Extension,,C:\Windows\System32\drivers\UCX01000.SYS,11aea1c530599bf1ea1a48b863607655,\SystemRoot\System32\drivers\ucx01000.sys,Microsoft Windows,true,The file is signed and the signature was verified.,Microsoft Windows Production PCA 2011
NT0003VEO,defragsvc,0,Optimize drives,Helps the computer run more efficiently by optimizing files on storage drives.,C:\Windows\System32\svchost.exe,4e13a941b99fe98effb858ff11a4415e,C:\Windows\system32\svchost.exe -k defragsvc,Microsoft Windows,true,The file is signed and the signature was verified.,Microsoft Windows Production PCA 2011
NT0003VEO,RpcSs,716,Remote Procedure Call (RPC),The RPCSS service is the Service Control Manager for COM and DCOM servers. It performs object activations requests  object exporter resolutions and distributed garbage collection for COM and DCOM servers. If this service is stopped or disabled  programs using COM or DCOM will not function properly. It is strongly recommended that you have the RPCSS service running.,C:\Windows\System32\svchost.exe,4e13a941b99fe98effb858ff11a4415e,C:\Windows\system32\svchost.exe -k rpcss,Microsoft Windows,true,The file is signed and the signature was verified.,Microsoft Windows Production PCA 2011
NT0003VEO,amdxata,0,amdxata,,C:\Windows\System32\drivers\amdxata.sys,0ec2e830fd9d4f751557e05a5dbbdac8,\SystemRoot\System32\drivers\amdxata.sys,Microsoft Windows,true,The file is signed and the signature was verified.,Microsoft Windows Production PCA 2011
NT0003VEO,vmicheartbeat,0,Hyper-V Heartbeat Service,Monitors the state of this virtual machine by reporting a heartbeat at regular intervals. This service helps you identify running virtual machines that have stopped responding.,C:\Windows\System32\svchost.exe,4e13a941b99fe98effb858ff11a4415e,C:\Windows\system32\svchost.exe -k ICService,Microsoft Windows,true,The file is signed and the signature was verified.,Microsoft Windows Production PCA 2011
NT0003VEO,WmiAcpi,0,Microsoft Windows Management Interface for ACPI,,C:\Windows\System32\drivers\wmiacpi.sys,f0c131a80fe15f0c1ffd6b55ddf14f9f,\SystemRoot\System32\drivers\wmiacpi.sys,Microsoft Windows,true,The file is signed and the signature was verified.,Microsoft Windows Production PCA 2011
NT0003VEO,vmicrdv,0,Hyper-V Remote Desktop Virtualization Service,Provides a platform for communication between the virtual machine and the operating system running on the physical computer.,C:\Windows\System32\svchost.exe,4e13a941b99fe98effb858ff11a4415e,C:\Windows\system32\svchost.exe -k ICService,Microsoft Windows,true,The file is signed and the signature was verified.,Microsoft Windows Production PCA 2011
NT0003VEO,stexstor,0,stexstor,,C:\Windows\System32\drivers\stexstor.sys,a18f7fb21d72cc0f5535faf105743c5a,\SystemRoot\System32\drivers\stexstor.sys,Microsoft Windows,true,The file is signed and the signature was verified.,Microsoft Windows Production PCA 2011
NT0003VEO,sbp2port,0,SBP-2 Transport/Protocol Bus Driver,,C:\Windows\System32\drivers\sbp2port.sys,12a057741dcb48fa7c952a5986d94210,\SystemRoot\System32\drivers\sbp2port.sys,Microsoft Windows,true,The file is signed and the signature was verified.,Microsoft Windows Production PCA 2011
NT0003VEO,mvumis,0,mvumis,,C:\Windows\System32\drivers\mvumis.sys,cc47a529abf3df83294ce1f4a9a04504,\SystemRoot\System32\drivers\mvumis.sys,Microsoft Windows,true,The file is signed and the signature was verified.,Microsoft Windows Production PCA 2011
NT0003VEO,RdpVideoMiniport,0,Remote Desktop Video Miniport Driver,,C:\Windows\System32\drivers\rdpvideominiport.sys,50046afa421782118cb680398303c4c2,System32\drivers\rdpvideominiport.sys,Microsoft Windows,true,The file is signed and the signature was verified.,Microsoft Windows Production PCA 2011
NT0003VEO,hyperkbd,0,hyperkbd,,C:\Windows\System32\drivers\hyperkbd.sys,63e32db94a42cf355fdbc3e671811bf3,\SystemRoot\System32\drivers\hyperkbd.sys,Microsoft Windows,true,The file is signed and the signature was verified.,Microsoft Windows Production PCA 2011
NT0003VEO,sacsvr,0,Special Administration Console Helper,Allows administrators to remotely access a command prompt using Emergency Management Services.,C:\Windows\System32\svchost.exe,4e13a941b99fe98effb858ff11a4415e,C:\Windows\System32\svchost.exe -k netsvcs,Microsoft Windows,true,The file is signed and the signature was verified.,Microsoft Windows Production PCA 2011
NT0003VEO,wercplsupport,0,Problem Reports and Solutions Control Panel Support,This service provides support for viewing  sending and deletion of system-level problem reports for the Problem Reports and Solutions control panel.,C:\Windows\System32\svchost.exe,4e13a941b99fe98effb858ff11a4415e,C:\Windows\System32\svchost.exe -k netsvcs,Microsoft Windows,true,The file is signed and the signature was verified.,Microsoft Windows Production PCA 2011
NT0003VEO,tunnel,0,Microsoft Tunnel Miniport Adapter Driver,,C:\Windows\System32\drivers\tunnel.sys,0d8009b704f98713f41c99a88b7d57fd,\SystemRoot\system32\DRIVERS\tunnel.sys,Microsoft Windows,true,The file is signed and the signature was verified.,Microsoft Windows Production PCA 2011
NT0003VEO,usbprint,0,Microsoft USB PRINTER Class,,C:\Windows\System32\drivers\usbprint.sys,e7466ca557a22950ea8e561d6ff780c2,\SystemRoot\System32\drivers\usbprint.sys,Microsoft Windows,true,The file is signed and the signature was verified.,Microsoft Windows Production PCA 2011
NT0003VEO,vsmraid,0,vsmraid,,C:\Windows\System32\drivers\vsmraid.sys,28c93afc5e1fd9e15e7b0221e7d596bd,\SystemRoot\System32\drivers\vsmraid.sys,Microsoft Windows,true,The file is signed and the signature was verified.,Microsoft Windows Production PCA 2011
NT0003VEO,vmictimesync,0,Hyper-V Time Synchronization Service,Synchronizes the system time of this virtual machine with the system time of the physical computer.,C:\Windows\System32\svchost.exe,4e13a941b99fe98effb858ff11a4415e,C:\Windows\system32\svchost.exe -k LocalServiceNetworkRestricted,Microsoft Windows,true,The file is signed and the signature was verified.,Microsoft Windows Production PCA 2011
NT0003VEO,wtlmdrv,0,Microsoft iSCSI Target LocalMount Adapter,,C:\Windows\System32\drivers\wtlmdrv.sys,41798e0a0842be05bdb5a2c29d8ad600,\SystemRoot\System32\drivers\wtlmdrv.sys,Microsoft Windows,true,The file is signed and the signature was verified.,Microsoft Windows Production PCA 2011
