hostname,name,pid,descriptivename,description,path,pathmd5sum,arguments,pathcertificatesubject,pathsignatureverified,pathsignaturedescription,pathcertificateissuer
NT0003VEO,NetBIOS,0,NetBIOS Interface,NetBIOS Interface,C:\Windows\System32\drivers\netbios.sys,fe16f65569db24f80670ba3d00ecb22d,system32\DRIVERS\netbios.sys,Microsoft Windows,true,The file is signed and the signature was verified.,Microsoft Windows Production PCA 2011
NT0003VEO,ndfltr,0,NetworkDirect Service,,C:\Windows\System32\drivers\ndfltr.sys,541724f784b97162eaa066fc4e498cf3,\SystemRoot\System32\drivers\ndfltr.sys,Microsoft Windows,true,The file is signed and the signature was verified.,Microsoft Windows Production PCA 2011
NT0003VEO,AcpiPmi,0,ACPI Power Meter Driver,,C:\Windows\System32\drivers\acpipmi.sys,46b62a6162f9dad40ef8f9a3ccd38839,\SystemRoot\System32\drivers\acpipmi.sys,Microsoft Windows,true,The file is signed and the signature was verified.,Microsoft Windows Production PCA 2011
NT0003VEO,RasMan,0,Remote Access Connection Manager,Manages dial-up and virtual private network (VPN) connections from this computer to the Internet or other remote networks. If this service is disabled  any services that explicitly depend on it will fail to start.,C:\Windows\System32\svchost.exe,4e13a941b99fe98effb858ff11a4415e,C:\Windows\System32\svchost.exe -k netsvcs,Microsoft Windows,true,The file is signed and the signature was verified.,Microsoft Windows Production PCA 2011
NT0003VEO,Wanarp,0,Remote Access IP ARP Driver,Remote Access IP ARP Driver,C:\Windows\System32\drivers\wanarp.sys,5e1293ad9ab00bbebbd9c70193de7949,\SystemRoot\system32\DRIVERS\wanarp.sys,Microsoft Windows,true,The file is signed and the signature was verified.,Microsoft Windows Production PCA 2011
NT0003VEO,LSM,688,Local Session Manager,Core Windows Service that manages local user sessions. Stopping or disabling this service will result in system instability.,C:\Windows\System32\svchost.exe,4e13a941b99fe98effb858ff11a4415e,C:\Windows\system32\svchost.exe -k DcomLaunch,Microsoft Windows,true,The file is signed and the signature was verified.,Microsoft Windows Production PCA 2011
NT0003VEO,MSDTC,1132,Distributed Transaction Coordinator,Coordinates transactions that span multiple resource managers  such as databases  message queues  and file systems. If this service is stopped  these transactions will fail. If this service is disabled  any services that explicitly depend on it will fail to start.,C:\Windows\System32\msdtc.exe,65a6c3fd6a3c81e1ecab58187f2f27f3,C:\Windows\System32\msdtc.exe,Microsoft Windows,true,The file is signed and the signature was verified.,Microsoft Windows Production PCA 2011
NT0003VEO,VMBusHID,0,VMBusHID,,C:\Windows\System32\drivers\VMBusHID.sys,12fd891a812536f3d9920e04c1aa62c7,\SystemRoot\System32\drivers\VMBusHID.sys,Microsoft Windows,true,The file is signed and the signature was verified.,Microsoft Windows Production PCA 2011
NT0003VEO,AppReadiness,0,App Readiness,Gets apps ready for use the first time a user signs in to this PC and when adding new apps.,C:\Windows\System32\svchost.exe,4e13a941b99fe98effb858ff11a4415e,C:\Windows\System32\svchost.exe -k AppReadiness,Microsoft Windows,true,The file is signed and the signature was verified.,Microsoft Windows Production PCA 2011
NT0003VEO,tdx,0,NetIO Legacy TDI Support Driver,NetIO Legacy TDI Support Driver,C:\Windows\System32\drivers\tdx.sys,5aacaa3f058188a506d091a4bd46508c,\SystemRoot\system32\DRIVERS\tdx.sys,Microsoft Windows,true,The file is signed and the signature was verified.,Microsoft Windows Production PCA 2011
NT0003VEO,vds,0,Virtual Disk,Provides management services for disks  volumes  file systems  and storage arrays.,C:\Windows\System32\vds.exe,8553ebedd33665461c4fd67d329d1682,C:\Windows\System32\vds.exe,Microsoft Windows,true,The file is signed and the signature was verified.,Microsoft Windows Production PCA 2011
NT0003VEO,hidserv,0,Human Interface Device Service,Activates and maintains the use of hot buttons on keyboards  remote controls  and other multimedia devices. It is recommended that you keep this service running.,C:\Windows\System32\svchost.exe,4e13a941b99fe98effb858ff11a4415e,C:\Windows\system32\svchost.exe -k LocalSystemNetworkRestricted,Microsoft Windows,true,The file is signed and the signature was verified.,Microsoft Windows Production PCA 2011
NT0003VEO,FxPPM,0,Power Framework Processor Driver,,C:\Windows\System32\drivers\fxppm.sys,69e4e39f0ddd9808efaae5ea90c5f477,\SystemRoot\System32\drivers\fxppm.sys,Microsoft Windows,true,The file is signed and the signature was verified.,Microsoft Windows Production PCA 2011
NT0003VEO,nsiproxy,0,NSI Proxy Service Driver,NSI Proxy Service,C:\Windows\System32\drivers\nsiproxy.sys,2a3ecea4c37e0e9b543146edec2cb51f,system32\drivers\nsiproxy.sys,Microsoft Windows,true,The file is signed and the signature was verified.,Microsoft Windows Production PCA 2011
NT0003VEO,FontCache3.0.0.0,0,Windows Presentation Foundation Font Cache 3.0.0.0,Optimizes performance of Windows Presentation Foundation (WPF) applications by caching commonly used font data. WPF applications will start this service if it is not already running. It can be disabled  though doing so will degrade the performance of WPF applications.,C:\Windows\Microsoft.Net\Framework64\v3.0\WPF\PresentationFontCache.exe,a44fe86e8cc0b12329b0202d1cf81b32,C:\Windows\Microsoft.Net\Framework64\v3.0\WPF\PresentationFontCache.exe,Microsoft Windows,true,The file is signed and the signature was verified.,Microsoft Windows Production PCA 2011
NT0003VEO,WdiSystemHost,0,Diagnostic System Host,The Diagnostic System Host is used by the Diagnostic Policy Service to host diagnostics that need to run in a Local System context.  If this service is stopped  any diagnostics that depend on it will no longer function.,C:\Windows\System32\svchost.exe,4e13a941b99fe98effb858ff11a4415e,C:\Windows\System32\svchost.exe -k LocalSystemNetworkRestricted,Microsoft Windows,true,The file is signed and the signature was verified.,Microsoft Windows Production PCA 2011
NT0003VEO,kbdclass,0,Keyboard Class Driver,,C:\Windows\System32\drivers\kbdclass.sys,e1d6ea246222abca0eb385a141084ff3,\SystemRoot\System32\drivers\kbdclass.sys,Microsoft Windows,true,The file is signed and the signature was verified.,Microsoft Windows Production PCA 2011
NT0003VEO,agp440,0,Intel AGP Bus Filter,,C:\Windows\System32\drivers\AGP440.sys,4e6dc5678e1704256a31010958990884,\SystemRoot\System32\drivers\agp440.sys,Microsoft Windows,true,The file is signed and the signature was verified.,Microsoft Windows Production PCA 2011
NT0003VEO,Mup,0,Mup,Multiple UNC Provider Driver,C:\Windows\System32\drivers\mup.sys,9ab70548e3a5129042f19bd4135b1cbf,\SystemRoot\System32\Drivers\mup.sys,Microsoft Windows,true,The file is signed and the signature was verified.,Microsoft Windows Production PCA 2011
NT0003VEO,ibbus,0,Mellanox InfiniBand Bus/AL (Filter Driver),,C:\Windows\System32\drivers\ibbus.sys,cf00f88560110a343707b6dd3012d945,\SystemRoot\System32\drivers\ibbus.sys,Microsoft Windows,true,The file is signed and the signature was verified.,Microsoft Windows Production PCA 2011
NT0003VEO,SiSRaid2,0,SiSRaid2,,C:\Windows\System32\drivers\sisraid2.sys,dc66585e77376157e5840aa2eddec081,\SystemRoot\System32\drivers\SiSRaid2.sys,Microsoft Windows,true,The file is signed and the signature was verified.,Microsoft Windows Production PCA 2011
NT0003VEO,PptpMiniport,0,WAN Miniport (PPTP),WAN Miniport (PPTP),C:\Windows\System32\drivers\raspptp.sys,239abaafd0f2ba1bc935e53f4e4a373d,\SystemRoot\System32\drivers\raspptp.sys,Microsoft Windows,true,The file is signed and the signature was verified.,Microsoft Windows Production PCA 2011
NT0003VEO,PEAUTH,0,PEAUTH,,C:\Windows\System32\drivers\PEAuth.sys,2c07f1999c01287aaab33d492c08ad2c,system32\drivers\peauth.sys,Microsoft Windows,true,The file is signed and the signature was verified.,Microsoft Windows Production PCA 2011
NT0003VEO,LanmanWorkstation,56,Workstation,Creates and maintains client network connections to remote servers using the SMB protocol. If this service is stopped  these connections will be unavailable. If this service is disabled  any services that explicitly depend on it will fail to start.,C:\Windows\System32\svchost.exe,4e13a941b99fe98effb858ff11a4415e,C:\Windows\System32\svchost.exe -k NetworkService,Microsoft Windows,true,The file is signed and the signature was verified.,Microsoft Windows Production PCA 2011
NT0003VEO,AsyncMac,0,RAS Asynchronous Media Driver,RAS Asynchronous Media Driver,C:\Windows\System32\drivers\asyncmac.sys,9b53e1e04759e7ebf4df1bcf7f8aca52,\SystemRoot\System32\drivers\asyncmac.sys,Microsoft Windows,true,The file is signed and the signature was verified.,Microsoft Windows Production PCA 2011
NT0003VEO,USBSTOR,0,USB Mass Storage Driver,,C:\Windows\System32\drivers\USBSTOR.SYS,b3a0680a6a2555d9dec0f6271a56be4a,\SystemRoot\System32\drivers\USBSTOR.SYS,Microsoft Windows,true,The file is signed and the signature was verified.,Microsoft Windows Production PCA 2011
NT0003VEO,smphost,0,Microsoft Storage Spaces SMP,Host service for the Microsoft Storage Spaces management provider. If this service is stopped or disabled  Storage Spaces cannot be managed.,C:\Windows\System32\svchost.exe,4e13a941b99fe98effb858ff11a4415e,C:\Windows\System32\svchost.exe -k smphost,Microsoft Windows,true,The file is signed and the signature was verified.,Microsoft Windows Production PCA 2011
NT0003VEO,VerifierExt,0,VerifierExt,,C:\Windows\System32\drivers\VerifierExt.sys,d358eca8e2bc5c2de874b42312fd8bf5,system32\drivers\VerifierExt.sys,Microsoft Windows,true,The file is signed and the signature was verified.,Microsoft Windows Production PCA 2011
NT0003VEO,pci,0,PCI Bus Driver,,C:\Windows\System32\drivers\pci.sys,f8dac6e8698cf7f37b15276a6499fc44,\SystemRoot\System32\drivers\pci.sys,Microsoft Windows,true,The file is signed and the signature was verified.,Microsoft Windows Production PCA 2011
NT0003VEO,BITS,0,Background Intelligent Transfer Service,Transfers files in the background using idle network bandwidth. If the service is disabled  then any applications that depend on BITS  such as Windows Update or MSN Explorer  will be unable to automatically download programs and other information.,C:\Windows\System32\svchost.exe,4e13a941b99fe98effb858ff11a4415e,C:\Windows\System32\svchost.exe -k netsvcs,Microsoft Windows,true,The file is signed and the signature was verified.,Microsoft Windows Production PCA 2011
NT0003VEO,IpFilterDriver,0,IP Traffic Filter Driver,IP Traffic Filter Driver,C:\Windows\System32\drivers\ipfltdrv.sys,921d32e7adabdc63f90b9e0a3c08beb9,system32\DRIVERS\ipfltdrv.sys,Microsoft Windows,true,The file is signed and the signature was verified.,Microsoft Windows Production PCA 2011
NT0003VEO,Serenum,0,Serenum Filter Driver,,C:\Windows\System32\drivers\serenum.sys,b647bd9ec7a7645e632b4cd5618bc1a4,\SystemRoot\System32\drivers\serenum.sys,Microsoft Windows,true,The file is signed and the signature was verified.,Microsoft Windows Production PCA 2011
NT0003VEO,SstpSvc,0,Secure Socket Tunneling Protocol Service,Provides support for the Secure Socket Tunneling Protocol (SSTP) to connect to remote computers using VPN. If this service is disabled  users will not be able to use SSTP to access remote servers.,C:\Windows\System32\svchost.exe,4e13a941b99fe98effb858ff11a4415e,C:\Windows\system32\svchost.exe -k LocalService,Microsoft Windows,true,The file is signed and the signature was verified.,Microsoft Windows Production PCA 2011
NT0003VEO,sacdrv,0,sacdrv,,C:\Windows\System32\drivers\sacdrv.sys,30dcfe86c6ad280546f25f72acc8c906,\SystemRoot\system32\DRIVERS\sacdrv.sys,Microsoft Windows,true,The file is signed and the signature was verified.,Microsoft Windows Production PCA 2011
NT0003VEO,1394ohci,0,1394 OHCI Compliant Host Controller,,C:\Windows\System32\drivers\1394ohci.sys,4da552b99e23c6f37e124996d16cca77,\SystemRoot\System32\drivers\1394ohci.sys,Microsoft Windows,true,The file is signed and the signature was verified.,Microsoft Windows Production PCA 2011
NT0003VEO,RasSstp,0,WAN Miniport (SSTP),WAN Miniport (SSTP),C:\Windows\System32\drivers\rassstp.sys,c0586c18b02c3a48d3357d4ab30f1913,\SystemRoot\system32\DRIVERS\rassstp.sys,Microsoft Windows,true,The file is signed and the signature was verified.,Microsoft Windows Production PCA 2011
NT0003VEO,MMCSS,0,Multimedia Class Scheduler,Enables relative prioritization of work based on system-wide task priorities. This is intended mainly for multimedia applications.  If this service is stopped  individual tasks resort to their default priority.,C:\Windows\System32\svchost.exe,4e13a941b99fe98effb858ff11a4415e,C:\Windows\system32\svchost.exe -k netsvcs,Microsoft Windows,true,The file is signed and the signature was verified.,Microsoft Windows Production PCA 2011
NT0003VEO,WerSvc,0,Windows Error Reporting Service,Allows errors to be reported when programs stop working or responding and allows existing solutions to be delivered. Also allows logs to be generated for diagnostic and repair services. If this service is stopped  error reporting might not work correctly and results of diagnostic services and repairs might not be displayed.,C:\Windows\System32\svchost.exe,4e13a941b99fe98effb858ff11a4415e,C:\Windows\System32\svchost.exe -k WerSvcGroup,Microsoft Windows,true,The file is signed and the signature was verified.,Microsoft Windows Production PCA 2011
NT0003VEO,AppXSvc,0,AppX Deployment Service (AppXSVC),Provides infrastructure support for deploying Store applications. This service is started on demand and if disabled Store applications will not be deployed to the system  and may not function properly.,C:\Windows\System32\svchost.exe,4e13a941b99fe98effb858ff11a4415e,C:\Windows\system32\svchost.exe -k wsappx,Microsoft Windows,true,The file is signed and the signature was verified.,Microsoft Windows Production PCA 2011
NT0003VEO,PlugPlay,688,Plug and Play,Enables a computer to recognize and adapt to hardware changes with little or no user input. Stopping or disabling this service will result in system instability.,C:\Windows\System32\svchost.exe,4e13a941b99fe98effb858ff11a4415e,C:\Windows\system32\svchost.exe -k DcomLaunch,Microsoft Windows,true,The file is signed and the signature was verified.,Microsoft Windows Production PCA 2011
NT0003VEO,EventLog,844,Windows Event Log,This service manages events and event logs. It supports logging events  querying events  subscribing to events  archiving event logs  and managing event metadata. It can display events in both XML and plain text format. Stopping this service may compromise security and reliability of the system.,C:\Windows\System32\svchost.exe,4e13a941b99fe98effb858ff11a4415e,C:\Windows\System32\svchost.exe -k LocalServiceNetworkRestricted,Microsoft Windows,true,The file is signed and the signature was verified.,Microsoft Windows Production PCA 2011
NT0003VEO,MTConfig,0,Microsoft Input Configuration Driver,,C:\Windows\System32\drivers\MTConfig.sys,a29e6b43352c26d7bd29e8fde519a39c,\SystemRoot\System32\drivers\MTConfig.sys,Microsoft Windows,true,The file is signed and the signature was verified.,Microsoft Windows Production PCA 2011
NT0003VEO,W32Time,0,Windows Time,Maintains date and time synchronization on all clients and servers in the network. If this service is stopped  date and time synchronization will be unavailable. If this service is disabled  any services that explicitly depend on it will fail to start.,C:\Windows\System32\svchost.exe,4e13a941b99fe98effb858ff11a4415e,C:\Windows\system32\svchost.exe -k LocalService,Microsoft Windows,true,The file is signed and the signature was verified.,Microsoft Windows Production PCA 2011
NT0003VEO,HidBatt,0,HID UPS Battery Driver,,C:\Windows\System32\drivers\hidbatt.sys,82438088f44c6aaa35df218dc110dc2d,\SystemRoot\System32\drivers\HidBatt.sys,Microsoft Windows,true,The file is signed and the signature was verified.,Microsoft Windows Production PCA 2011
NT0003VEO,acpipagr,0,ACPI Processor Aggregator Driver,,C:\Windows\System32\drivers\acpipagr.sys,8bfd6169f2e294bf6eabcd3b942a081e,\SystemRoot\System32\drivers\acpipagr.sys,Microsoft Windows,true,The file is signed and the signature was verified.,Microsoft Windows Production PCA 2011
NT0003VEO,lltdsvc,0,Link-Layer Topology Discovery Mapper,Creates a Network Map  consisting of PC and device topology (connectivity) information  and metadata describing each PC and device.  If this service is disabled  the Network Map will not function properly.,C:\Windows\System32\svchost.exe,4e13a941b99fe98effb858ff11a4415e,C:\Windows\System32\svchost.exe -k LocalService,Microsoft Windows,true,The file is signed and the signature was verified.,Microsoft Windows Production PCA 2011
NT0003VEO,volmgrx,0,Dynamic Volume Manager,Extension of the volume manager driver that manages software RAID volumes (spanned  striped  mirrored  RAID-5) on dynamic disks,C:\Windows\System32\drivers\volmgrx.sys,ad886273552dd9416e15d2a216a83908,\SystemRoot\System32\drivers\volmgrx.sys,Microsoft Windows,true,The file is signed and the signature was verified.,Microsoft Windows Production PCA 2011
NT0003VEO,KeyIso,0,CNG Key Isolation,The CNG key isolation service is hosted in the LSA process. The service provides key process isolation to private keys and associated cryptographic operations as required by the Common Criteria. The service stores and uses long-lived keys in a secure process complying with Common Criteria requirements.,C:\Windows\System32\lsass.exe,52693cc90bac8da6fef75dfb27d098bb,C:\Windows\system32\lsass.exe,Microsoft Windows,true,The file is signed and the signature was verified.,Microsoft Windows Production PCA 2011
NT0003VEO,Ndisuio,0,NDIS Usermode I/O Protocol,,C:\Windows\System32\drivers\ndisuio.sys,04370c4b9e441e2ba0adce75c21e2d7a,\SystemRoot\system32\DRIVERS\ndisuio.sys,Microsoft Windows,true,The file is signed and the signature was verified.,Microsoft Windows Production PCA 2011
NT0003VEO,Wcmsvc,844,Windows Connection Manager,Makes automatic connect/disconnect decisions based on the network connectivity options currently available to the PC and enables management of network connectivity based on Group Policy settings.,C:\Windows\System32\svchost.exe,4e13a941b99fe98effb858ff11a4415e,C:\Windows\system32\svchost.exe -k LocalServiceNetworkRestricted,Microsoft Windows,true,The file is signed and the signature was verified.,Microsoft Windows Production PCA 2011
NT0003VEO,volsnap,0,Storage volumes,,C:\Windows\System32\drivers\volsnap.sys,8c68c62ed4e8e92b026892d101103920,\SystemRoot\System32\drivers\volsnap.sys,Microsoft Windows,true,The file is signed and the signature was verified.,Microsoft Windows Production PCA 2011
NT0003VEO,uliagpkx,0,Uli AGP Bus Filter,,C:\Windows\System32\drivers\ULIAGPKX.SYS,3b11319d6611eb9cdd52c727d5925d0f,\SystemRoot\System32\drivers\uliagpkx.sys,Microsoft Windows,true,The file is signed and the signature was verified.,Microsoft Windows Production PCA 2011
NT0003VEO,Netman,0,Network Connections,Manages objects in the Network and Dial-Up Connections folder  in which you can view both local area network and remote connections.,C:\Windows\System32\svchost.exe,4e13a941b99fe98effb858ff11a4415e,C:\Windows\System32\svchost.exe -k LocalSystemNetworkRestricted,Microsoft Windows,true,The file is signed and the signature was verified.,Microsoft Windows Production PCA 2011
NT0003VEO,IEEtwCollectorService,0,Internet Explorer ETW Collector Service,ETW Collector Service for Internet Explorer. When running  this service collects real time ETW events and processes them.,C:\Windows\System32\IEEtwCollector.exe,b4089658438a4630711b343dd6737fdc,C:\Windows\system32\IEEtwCollector.exe /V,Microsoft Windows,true,The file is signed and the signature was verified.,Microsoft Windows Production PCA 2011
NT0003VEO,xennet,0,AWS PV Network Device,,C:\Windows\System32\drivers\xennet.sys,beaf63d554b507356065c5b24df4ba89,\SystemRoot\system32\DRIVERS\xennet.sys,Microsoft Windows Hardware Compatibility Publisher,true,The file is signed and the signature was verified.,Microsoft Windows Hardware Compatibility PCA
NT0003VEO,ksthunk,0,Kernel Streaming Thunks,,C:\Windows\System32\drivers\ksthunk.sys,fd6c1ac015da7ef93b04c935e31ab575,\SystemRoot\system32\drivers\ksthunk.sys,Microsoft Windows,true,The file is signed and the signature was verified.,Microsoft Windows Production PCA 2011
NT0003VEO,WudfPf,0,User Mode Driver Frameworks Platform Driver,,C:\Windows\System32\drivers\WUDFPf.sys,e1e50cd910fc2139ecb10795be6ae3cd,system32\drivers\WudfPf.sys,Microsoft Windows,true,The file is signed and the signature was verified.,Microsoft Windows Production PCA 2011
NT0003VEO,nvraid,0,nvraid,,C:\Windows\System32\drivers\nvraid.sys,5ee8c7f551e66df5495dba9772feccc9,\SystemRoot\System32\drivers\nvraid.sys,Microsoft Windows,true,The file is signed and the signature was verified.,Microsoft Windows Production PCA 2011
NT0003VEO,UASPStor,0,USB Attached SCSI (UAS) Driver,,C:\Windows\System32\drivers\uaspstor.sys,e21a859149d39696241807cd5a86e4d7,\SystemRoot\System32\drivers\uaspstor.sys,Microsoft Windows,true,The file is signed and the signature was verified.,Microsoft Windows Production PCA 2011
NT0003VEO,AppMgmt,0,Application Management,Processes installation  removal  and enumeration requests for software deployed through Group Policy. If the service is disabled  users will be unable to install  remove  or enumerate software deployed through Group Policy. If this service is disabled  any services that explicitly depend on it will fail to start.,C:\Windows\System32\svchost.exe,4e13a941b99fe98effb858ff11a4415e,C:\Windows\system32\svchost.exe -k netsvcs,Microsoft Windows,true,The file is signed and the signature was verified.,Microsoft Windows Production PCA 2011
NT0003VEO,hwpolicy,0,Hardware Policy Driver,Contains Processor and other policies,C:\Windows\System32\drivers\hwpolicy.sys,84bc51e7cc7f417ea05213551c2fb1a4,\SystemRoot\System32\drivers\hwpolicy.sys,Microsoft Windows,true,The file is signed and the signature was verified.,Microsoft Windows Production PCA 2011
NT0003VEO,NDIS,0,NDIS System Driver,NDIS System Driver,C:\Windows\System32\drivers\ndis.sys,c97080c9f3c76786a6405b6902807ca7,\SystemRoot\system32\drivers\ndis.sys,Microsoft Windows,true,The file is signed and the signature was verified.,Microsoft Windows Production PCA 2011
NT0003VEO,wuauserv,0,Windows Update,Enables the detection  download  and installation of updates for Windows and other programs. If this service is disabled  users of this computer will not be able to use Windows Update or its automatic updating feature  and programs will not be able to use the Windows Update Agent (WUA) API.,C:\Windows\System32\svchost.exe,4e13a941b99fe98effb858ff11a4415e,C:\Windows\system32\svchost.exe -k netsvcs,Microsoft Windows,true,The file is signed and the signature was verified.,Microsoft Windows Production PCA 2011
NT0003VEO,ErrDev,0,Microsoft Hardware Error Device Driver,,C:\Windows\System32\drivers\errdev.sys,c06daa81802937c3cabac7a56a7cc421,\SystemRoot\System32\drivers\errdev.sys,Microsoft Windows,true,The file is signed and the signature was verified.,Microsoft Windows Production PCA 2011
NT0003VEO,pdc,0,pdc,Power Dependency Coordinator Driver,C:\Windows\System32\drivers\pdc.sys,75b6c325bd34de42ae815a22a051ce8b,\SystemRoot\system32\drivers\pdc.sys,Microsoft Windows,true,The file is signed and the signature was verified.,Microsoft Windows Production PCA 2011
NT0003VEO,LSI_SAS,0,LSI_SAS,,C:\Windows\System32\drivers\lsi_sas.sys,6da23c7ed0f95755289caea398e722ab,\SystemRoot\System32\drivers\lsi_sas.sys,Microsoft Windows,true,The file is signed and the signature was verified.,Microsoft Windows Production PCA 2011
NT0003VEO,atapi,0,IDE Channel,,C:\Windows\System32\drivers\atapi.sys,39d40093b31969cc5e61b75a2ff4be2e,\SystemRoot\System32\drivers\atapi.sys,Microsoft Windows,true,The file is signed and the signature was verified.,Microsoft Windows Production PCA 2011
NT0003VEO,RemoteAccess,0,Routing and Remote Access,Offers routing services to businesses in local area and wide area network environments.,C:\Windows\System32\svchost.exe,4e13a941b99fe98effb858ff11a4415e,C:\Windows\System32\svchost.exe -k netsvcs,Microsoft Windows,true,The file is signed and the signature was verified.,Microsoft Windows Production PCA 2011
NT0003VEO,amdsata,0,amdsata,,C:\Windows\System32\drivers\amdsata.sys,bd00641030fa3dd69206649e12c50ca8,\SystemRoot\System32\drivers\amdsata.sys,Microsoft Windows,true,The file is signed and the signature was verified.,Microsoft Windows Production PCA 2011
NT0003VEO,AmdK8,0,AMD K8 Processor Driver,,C:\Windows\System32\drivers\amdk8.sys,53e79547bbd15a33bada81207a3c3c29,\SystemRoot\System32\drivers\amdk8.sys,Microsoft Windows,true,The file is signed and the signature was verified.,Microsoft Windows Production PCA 2011
NT0003VEO,iaStorAV,0,Intel(R) SATA RAID Controller Windows,,C:\Windows\System32\drivers\iaStorAV.sys,837d372acbebf38d6112378d518650a3,\SystemRoot\System32\drivers\iaStorAV.sys,Microsoft Windows,true,The file is signed and the signature was verified.,Microsoft Windows Production PCA 2011
NT0003VEO,WPDBusEnum,0,Portable Device Enumerator Service,Enforces group policy for removable mass-storage devices. Enables applications such as Windows Media Player and Image Import Wizard to transfer and synchronize content using removable mass-storage devices.,C:\Windows\System32\svchost.exe,4e13a941b99fe98effb858ff11a4415e,C:\Windows\system32\svchost.exe -k LocalSystemNetworkRestricted,Microsoft Windows,true,The file is signed and the signature was verified.,Microsoft Windows Production PCA 2011
NT0003VEO,isapnp,0,isapnp,,C:\Windows\System32\drivers\isapnp.sys,8d5bdaf7e1909ae02191b29383b3f14b,\SystemRoot\System32\drivers\isapnp.sys,Microsoft Windows,true,The file is signed and the signature was verified.,Microsoft Windows Production PCA 2011
