hostname,name,pid,descriptivename,description,path,pathmd5sum,arguments,pathcertificatesubject,pathsignatureverified,pathsignaturedescription,pathcertificateissuer
NT0003VEO,Dhcp,844,DHCP Client,Registers and updates IP addresses and DNS records for this computer. If this service is stopped  this computer will not receive dynamic IP addresses and DNS updates. If this service is disabled  any services that explicitly depend on it will fail to start.,C:\Windows\System32\svchost.exe,4e13a941b99fe98effb858ff11a4415e,C:\Windows\system32\svchost.exe -k LocalServiceNetworkRestricted,Microsoft Windows,true,The file is signed and the signature was verified.,Microsoft Windows Production PCA 2011
NT0003VEO,VSS,0,Volume Shadow Copy,Manages and implements Volume Shadow Copies used for backup and other purposes. If this service is stopped  shadow copies will be unavailable for backup and the backup may fail. If this service is disabled  any services that explicitly depend on it will fail to start.,C:\Windows\System32\VSSVC.exe,a6384890def82bdea01aa96f060da33d,C:\Windows\system32\vssvc.exe,Microsoft Windows,true,The file is signed and the signature was verified.,Microsoft Windows Production PCA 2011
NT0003VEO,NdisWan,0,Remote Access NDIS WAN Driver,Remote Access NDIS WAN Driver,C:\Windows\System32\drivers\ndiswan.sys,4f5d6d5932fb7c8997022515e36cf3f8,\SystemRoot\System32\drivers\ndiswan.sys,Microsoft Windows,true,The file is signed and the signature was verified.,Microsoft Windows Production PCA 2011
NT0003VEO,qlfcoei,0,QLogic [FCoE] STOR Miniport Inbox Driver (wx64),,C:\Windows\System32\drivers\qlfcoei.sys,829da3fb56aa0141a5f1ca9483250326,\SystemRoot\System32\drivers\qlfcoei.sys,Microsoft Windows,true,The file is signed and the signature was verified.,Microsoft Windows Production PCA 2011
NT0003VEO,Winmgmt,888,Windows Management Instrumentation,Provides a common interface and object model to access management information about operating system  devices  applications and services. If this service is stopped  most Windows-based software will not function properly. If this service is disabled  any services that explicitly depend on it will fail to start.,C:\Windows\System32\svchost.exe,4e13a941b99fe98effb858ff11a4415e,C:\Windows\system32\svchost.exe -k netsvcs,Microsoft Windows,true,The file is signed and the signature was verified.,Microsoft Windows Production PCA 2011
NT0003VEO,WcsPlugInService,0,Windows Color System,The WcsPlugInService service hosts third-party Windows Color System color device model and gamut map model plug-in modules. These plug-in modules are vendor-specific extensions to the Windows Color System baseline color device and gamut map models. Stopping or disabling the WcsPlugInService service will disable this extensibility feature  and the Windows Color System will use its baseline model processing rather than the vendor's desired processing. This might result in inaccurate color rendering.,C:\Windows\System32\svchost.exe,4e13a941b99fe98effb858ff11a4415e,C:\Windows\system32\svchost.exe -k wcssvc,Microsoft Windows,true,The file is signed and the signature was verified.,Microsoft Windows Production PCA 2011
NT0003VEO,HDAudBus,0,Microsoft UAA Bus Driver for High Definition Audio,,C:\Windows\System32\drivers\hdaudbus.sys,f781066c2095049207e68e05aaefc99c,\SystemRoot\System32\drivers\HDAudBus.sys,Microsoft Windows,true,The file is signed and the signature was verified.,Microsoft Windows Production PCA 2011
NT0003VEO,napagent,0,Network Access Protection Agent,The Network Access Protection (NAP) agent service collects and manages health information for client computers on a network. Information collected by NAP agent is used to make sure that the client computer has the required software and settings. If a client computer is not compliant with health policy  it can be provided with restricted network access until its configuration is updated. Depending on the configuration of health policy  client computers might be automatically updated so that users quickly regain full network access without having to manually update their computer.,C:\Windows\System32\svchost.exe,4e13a941b99fe98effb858ff11a4415e,C:\Windows\System32\svchost.exe -k NetworkService,Microsoft Windows,true,The file is signed and the signature was verified.,Microsoft Windows Production PCA 2011
NT0003VEO,pciide,0,pciide,,C:\Windows\System32\drivers\pciide.sys,2c414acbf5e7b43364fb519485b3d5bf,\SystemRoot\System32\drivers\pciide.sys,Microsoft Windows,true,The file is signed and the signature was verified.,Microsoft Windows Production PCA 2011
NT0003VEO,Spooler,1156,Print Spooler,This service spools print jobs and handles interaction with the printer.  If you turn off this service  you won’t be able to print or see your printers.,C:\Windows\System32\spoolsv.exe,080cc9a68082f6ddd1170978808d6c44,C:\Windows\System32\spoolsv.exe,Microsoft Windows,true,The file is signed and the signature was verified.,Microsoft Windows Production PCA 2011
NT0003VEO,SerCx2,0,Serial UART Support Library,,C:\Windows\System32\drivers\SerCx2.sys,fc7a65ca290a41dfc8894e9b039cfda5,system32\drivers\SerCx2.sys,Microsoft Windows,true,The file is signed and the signature was verified.,Microsoft Windows Production PCA 2011
NT0003VEO,WinRM,56,Windows Remote Management (WS-Management),Windows Remote Management (WinRM) service implements the WS-Management protocol for remote management. WS-Management is a standard web services protocol used for remote software and hardware management. The WinRM service listens on the network for WS-Management requests and processes them. The WinRM Service needs to be configured with a listener using winrm.cmd command line tool or through Group Policy in order for it to listen over the network. The WinRM service provides access to WMI data and enables event collection. Event collection and subscription to events require that the service is running. WinRM messages use HTTP and HTTPS as transports. The WinRM service does not depend on IIS but is preconfigured to share a port with IIS on the same machine.  The WinRM service reserves the /wsman URL prefix. To prevent conflicts with IIS  administrators should ensure that any websites hosted on IIS do not use the /wsman URL prefix.,C:\Windows\System32\svchost.exe,4e13a941b99fe98effb858ff11a4415e,C:\Windows\System32\svchost.exe -k NetworkService,Microsoft Windows,true,The file is signed and the signature was verified.,Microsoft Windows Production PCA 2011
NT0003VEO,vpci,0,Microsoft Hyper-V Virtual PCI Bus,,C:\Windows\System32\drivers\vpci.sys,7e03989ea226f354fea756b8ca5da97a,\SystemRoot\System32\drivers\vpci.sys,Microsoft Windows,true,The file is signed and the signature was verified.,Microsoft Windows Production PCA 2011
NT0003VEO,mshidumdf,0,Pass-through HID to UMDF Driver,Device Driver to provide pass-through interface between HIDCLASS and UMDF,C:\Windows\System32\drivers\mshidumdf.sys,ee0bcc76bce51f3f65e62512757ecd70,\SystemRoot\System32\drivers\mshidumdf.sys,Microsoft Windows,true,The file is signed and the signature was verified.,Microsoft Windows Production PCA 2011
NT0003VEO,TCPIP6,0,Microsoft IPv6 Protocol Driver,Microsoft IPv6 Protocol Driver,C:\Windows\System32\drivers\tcpip.sys,a17131b994d0b0ec9cb632bca130f73a,\SystemRoot\system32\DRIVERS\tcpip.sys,Microsoft Windows,true,The file is signed and the signature was verified.,Microsoft Windows Production PCA 2011
NT0003VEO,srv,0,Server SMB 1.xxx Driver,Enables connectivity from Windows XP and earlier clients,C:\Windows\System32\drivers\srv.sys,7568cc5142bb1e89b80165a160539064,System32\DRIVERS\srv.sys,Microsoft Windows,true,The file is signed and the signature was verified.,Microsoft Windows Production PCA 2011
NT0003VEO,ec2winutildriver,0,EC2 Windows Utility Agent,,C:\Windows\System32\drivers\EC2WinUtilDriver.sys,9a17a4a81196d1302c45010894ab020e,\SystemRoot\System32\drivers\EC2WinUtilDriver.sys,Microsoft Windows Hardware Compatibility Publisher,true,The file is signed and the signature was verified.,Microsoft Windows Hardware Compatibility PCA
NT0003VEO,Psched,0,QoS Packet Scheduler,QoS Packet Scheduler,C:\Windows\System32\drivers\pacer.sys,7c3ae2421ad3a69a8a52151bb2b3f30c,\SystemRoot\system32\DRIVERS\pacer.sys,Microsoft Windows,true,The file is signed and the signature was verified.,Microsoft Windows Production PCA 2011
NT0003VEO,UmPass,0,Microsoft UMPass Driver,,C:\Windows\System32\drivers\umpass.sys,438e634330a88ebbf4b3a46212baf925,\SystemRoot\System32\drivers\umpass.sys,Microsoft Windows,true,The file is signed and the signature was verified.,Microsoft Windows Production PCA 2011
NT0003VEO,Vid,0,Vid,,C:\Windows\System32\drivers\Vid.sys,cab51a7076b87ad2da6d57cd6e6d21ac,\SystemRoot\System32\drivers\Vid.sys,Microsoft Windows,true,The file is signed and the signature was verified.,Microsoft Windows Production PCA 2011
NT0003VEO,DXGKrnl,0,LDDM Graphics Subsystem,Controls the underlying video driver stacks to provide fully-featured display capabilities.,C:\Windows\System32\drivers\dxgkrnl.sys,f8fc7fa7e4bbc5621009369bbc58b7a4,\SystemRoot\System32\drivers\dxgkrnl.sys,Microsoft Windows,true,The file is signed and the signature was verified.,Microsoft Windows Production PCA 2011
NT0003VEO,EventSystem,928,COM+ Event System,Supports System Event Notification Service (SENS)  which provides automatic distribution of events to subscribing Component Object Model (COM) components. If the service is stopped  SENS will close and will not be able to provide logon and logoff notifications. If this service is disabled  any services that explicitly depend on it will fail to start.,C:\Windows\System32\svchost.exe,4e13a941b99fe98effb858ff11a4415e,C:\Windows\system32\svchost.exe -k LocalService,Microsoft Windows,true,The file is signed and the signature was verified.,Microsoft Windows Production PCA 2011
NT0003VEO,msisadrv,0,msisadrv,,C:\Windows\System32\drivers\msisadrv.sys,983da6a1f8d6045718d7125395120d8c,\SystemRoot\System32\drivers\msisadrv.sys,Microsoft Windows,true,The file is signed and the signature was verified.,Microsoft Windows Production PCA 2011
NT0003VEO,Filetrace,0,Filetrace,ETW File Trace Filter,C:\Windows\System32\drivers\filetrace.sys,74ad28582bd52da0a68621387f1e39de,system32\drivers\filetrace.sys,Microsoft Windows,true,The file is signed and the signature was verified.,Microsoft Windows Production PCA 2011
NT0003VEO,cht4vbd,0,Chelsio T4 Virtual Bus Driver,,C:\Windows\System32\drivers\cht4vx64.sys,9293e4fb608c05279ff583d28a576628,\SystemRoot\System32\drivers\cht4vx64.sys,Microsoft Windows,true,The file is signed and the signature was verified.,Microsoft Windows Production PCA 2011
NT0003VEO,Modem,0,Modem,,C:\Windows\System32\drivers\modem.sys,828f6dfd4dc15baffa1903715107ba29,system32\drivers\modem.sys,Microsoft Windows,true,The file is signed and the signature was verified.,Microsoft Windows Production PCA 2011
NT0003VEO,wmiApSrv,0,WMI Performance Adapter,Provides performance library information from Windows Management Instrumentation (WMI) providers to clients on the network. This service only runs when Performance Data Helper is activated.,C:\Windows\System32\wbem\WmiApSrv.exe,1b89c9d8e6dd4dab147b0c5de02a89f7,C:\Windows\system32\wbem\WmiApSrv.exe,Microsoft Windows,true,The file is signed and the signature was verified.,Microsoft Windows Production PCA 2011
NT0003VEO,NetBT,0,NetBT,This service implements NetBios over TCP/IP.,C:\Windows\System32\drivers\netbt.sys,e5353c2660a35b2002a401f7ae230698,System32\DRIVERS\netbt.sys,Microsoft Windows,true,The file is signed and the signature was verified.,Microsoft Windows Production PCA 2011
NT0003VEO,seclogon,0,Secondary Logon,Enables starting processes under alternate credentials. If this service is stopped  this type of logon access will be unavailable. If this service is disabled  any services that explicitly depend on it will fail to start.,C:\Windows\System32\svchost.exe,4e13a941b99fe98effb858ff11a4415e,C:\Windows\system32\svchost.exe -k netsvcs,Microsoft Windows,true,The file is signed and the signature was verified.,Microsoft Windows Production PCA 2011
NT0003VEO,WdiServiceHost,0,Diagnostic Service Host,The Diagnostic Service Host is used by the Diagnostic Policy Service to host diagnostics that need to run in a Local Service context.  If this service is stopped  any diagnostics that depend on it will no longer function.,C:\Windows\System32\svchost.exe,4e13a941b99fe98effb858ff11a4415e,C:\Windows\System32\svchost.exe -k LocalService,Microsoft Windows,true,The file is signed and the signature was verified.,Microsoft Windows Production PCA 2011
NT0003VEO,KSecPkg,0,KSecPkg,,C:\Windows\System32\drivers\ksecpkg.sys,670bd60ab9f1eb90c77f57837e58631d,\SystemRoot\System32\Drivers\ksecpkg.sys,Microsoft Windows,true,The file is signed and the signature was verified.,Microsoft Windows Production PCA 2011
NT0003VEO,RasAcd,0,Remote Access Auto Connection Driver,Remote Access Auto Connection Driver,C:\Windows\System32\drivers\rasacd.sys,44a934f6701c4595ace86e0757b73491,System32\DRIVERS\rasacd.sys,Microsoft Windows,true,The file is signed and the signature was verified.,Microsoft Windows Production PCA 2011
NT0003VEO,arcsas,0,Adaptec SAS/SATA-II RAID Storport's Miniport Driver,,C:\Windows\System32\drivers\arcsas.sys,4e000042326af7dc2a45c5853a5ff879,\SystemRoot\System32\drivers\arcsas.sys,Microsoft Windows,true,The file is signed and the signature was verified.,Microsoft Windows Production PCA 2011
NT0003VEO,RDPDR,0,Remote Desktop Device Redirector Driver,Remote Desktop Device Redirector Driver,C:\Windows\System32\drivers\rdpdr.sys,469c6a855394d3efd4da31ea50d57dd4,System32\drivers\rdpdr.sys,Microsoft Windows,true,The file is signed and the signature was verified.,Microsoft Windows Production PCA 2011
NT0003VEO,ahcache,0,Application Compatibility Cache,Cache Compatibility Data and Attributes for Individual PE File,C:\Windows\System32\drivers\ahcache.sys,ded232f095d0b96f9591533d8fca35b8,system32\DRIVERS\ahcache.sys,Microsoft Windows,true,The file is signed and the signature was verified.,Microsoft Windows Production PCA 2011
NT0003VEO,CryptSvc,56,Cryptographic Services,Provides three management services: Catalog Database Service  which confirms the signatures of Windows files and allows new programs to be installed; Protected Root Service  which adds and removes Trusted Root Certification Authority certificates from this computer; and Automatic Root Certificate Update Service  which retrieves root certificates from Windows Update and enable scenarios such as SSL. If this service is stopped  these management services will not function properly. If this service is disabled  any services that explicitly depend on it will fail to start.,C:\Windows\System32\svchost.exe,4e13a941b99fe98effb858ff11a4415e,C:\Windows\system32\svchost.exe -k NetworkService,Microsoft Windows,true,The file is signed and the signature was verified.,Microsoft Windows Production PCA 2011
NT0003VEO,xeniface,0,AWS Interface,,C:\Windows\System32\drivers\xeniface.sys,de13e4a804e17c3596b1a3a6c4af1fdd,\SystemRoot\System32\drivers\xeniface.sys,Microsoft Windows Hardware Compatibility Publisher,true,The file is signed and the signature was verified.,Microsoft Windows Hardware Compatibility PCA
NT0003VEO,pla,0,Performance Logs &amp; Alerts,Performance Logs and Alerts Collects performance data from local or remote computers based on preconfigured schedule parameters  then writes the data to a log or triggers an alert. If this service is stopped  performance information will not be collected. If this service is disabled  any services that explicitly depend on it will fail to start.,C:\Windows\System32\svchost.exe,4e13a941b99fe98effb858ff11a4415e,C:\Windows\System32\svchost.exe -k LocalServiceNoNetwork,Microsoft Windows,true,The file is signed and the signature was verified.,Microsoft Windows Production PCA 2011
NT0003VEO,flpydisk,0,Floppy Disk Driver,,C:\Windows\System32\drivers\flpydisk.sys,06f00db0b9c10539bcbd85b9aa2c9ae9,\SystemRoot\System32\drivers\flpydisk.sys,Microsoft Windows,true,The file is signed and the signature was verified.,Microsoft Windows Production PCA 2011
NT0003VEO,vmicshutdown,0,Hyper-V Guest Shutdown Service,Provides a mechanism to shut down the operating system of this virtual machine from the management interfaces on the physical computer.,C:\Windows\System32\svchost.exe,4e13a941b99fe98effb858ff11a4415e,C:\Windows\system32\svchost.exe -k LocalSystemNetworkRestricted,Microsoft Windows,true,The file is signed and the signature was verified.,Microsoft Windows Production PCA 2011
NT0003VEO,stornvme,0,Microsoft Standard NVM Express Driver,,C:\Windows\System32\drivers\stornvme.sys,1a7bc3649bf2b351b170f63de0c30f65,\SystemRoot\System32\drivers\stornvme.sys,Microsoft Windows,true,The file is signed and the signature was verified.,Microsoft Windows Production PCA 2011
NT0003VEO,dot3svc,0,Wired AutoConfig,The Wired AutoConfig (DOT3SVC) service is responsible for performing IEEE 802.1X authentication on Ethernet interfaces. If your current wired network deployment enforces 802.1X authentication  the DOT3SVC service should be configured to run for establishing Layer 2 connectivity and/or providing access to network resources. Wired networks that do not enforce 802.1X authentication are unaffected by the DOT3SVC service.,C:\Windows\System32\svchost.exe,4e13a941b99fe98effb858ff11a4415e,C:\Windows\system32\svchost.exe -k LocalSystemNetworkRestricted,Microsoft Windows,true,The file is signed and the signature was verified.,Microsoft Windows Production PCA 2011
NT0003VEO,bfadi,0,bfadi,,C:\Windows\System32\drivers\bfadi.sys,39352c1cffb90a642946917c39884037,\SystemRoot\System32\drivers\bfadi.sys,Microsoft Windows,true,The file is signed and the signature was verified.,Microsoft Windows Production PCA 2011
NT0003VEO,MsBridge,0,Microsoft MAC Bridge,Microsoft MAC Bridge,C:\Windows\System32\drivers\bridge.sys,d603e0332c1bc0280f65ca725019f0db,\SystemRoot\system32\DRIVERS\bridge.sys,Microsoft Windows,true,The file is signed and the signature was verified.,Microsoft Windows Production PCA 2011
NT0003VEO,scfilter,0,Smart card PnP Class Filter Driver,Smart card reader filter driver enabling smart card PnP.,C:\Windows\System32\drivers\scfilter.sys,a9c67732076c9e0497545a0c3a8705d5,System32\DRIVERS\scfilter.sys,Microsoft Windows,true,The file is signed and the signature was verified.,Microsoft Windows Production PCA 2011
NT0003VEO,xenfilt,0,AWS Bus Filter,,C:\Windows\System32\drivers\xenfilt.sys,512c3070c0b983e123e4eeb0ef857a66,\SystemRoot\system32\DRIVERS\xenfilt.sys,Microsoft Windows Hardware Compatibility Publisher,true,The file is signed and the signature was verified.,Microsoft Windows Hardware Compatibility PCA
NT0003VEO,SENS,888,System Event Notification Service,Monitors system events and notifies subscribers to COM+ Event System of these events.,C:\Windows\System32\svchost.exe,4e13a941b99fe98effb858ff11a4415e,C:\Windows\system32\svchost.exe -k netsvcs,Microsoft Windows,true,The file is signed and the signature was verified.,Microsoft Windows Production PCA 2011
NT0003VEO,nv_agp,0,NVIDIA nForce AGP Bus Filter,,C:\Windows\System32\drivers\NV_AGP.SYS,e45c4ca28e2c8557ac00814d2bf0cbdc,\SystemRoot\System32\drivers\nv_agp.sys,Microsoft Windows,true,The file is signed and the signature was verified.,Microsoft Windows Production PCA 2011
NT0003VEO,NcaSvc,0,Network Connectivity Assistant,Provides DirectAccess status notification for UI components,C:\Windows\System32\svchost.exe,4e13a941b99fe98effb858ff11a4415e,C:\Windows\System32\svchost.exe -k NetSvcs,Microsoft Windows,true,The file is signed and the signature was verified.,Microsoft Windows Production PCA 2011
NT0003VEO,Wdf01000,0,Kernel Mode Driver Frameworks service,,C:\Windows\System32\drivers\Wdf01000.sys,994db5fb947738ed94c322e3421b2fb3,\SystemRoot\system32\drivers\Wdf01000.sys,Microsoft Windows,true,The file is signed and the signature was verified.,Microsoft Windows Production PCA 2011
NT0003VEO,swprv,0,Microsoft Software Shadow Copy Provider,Manages software-based volume shadow copies taken by the Volume Shadow Copy service. If this service is stopped  software-based volume shadow copies cannot be managed. If this service is disabled  any services that explicitly depend on it will fail to start.,C:\Windows\System32\svchost.exe,4e13a941b99fe98effb858ff11a4415e,C:\Windows\System32\svchost.exe -k swprv,Microsoft Windows,true,The file is signed and the signature was verified.,Microsoft Windows Production PCA 2011
NT0003VEO,nsi,928,Network Store Interface Service,This service delivers network notifications (e.g. interface addition/deleting etc) to user mode clients. Stopping this service will cause loss of network connectivity. If this service is disabled  any other services that explicitly depend on this service will fail to start.,C:\Windows\System32\svchost.exe,4e13a941b99fe98effb858ff11a4415e,C:\Windows\system32\svchost.exe -k LocalService,Microsoft Windows,true,The file is signed and the signature was verified.,Microsoft Windows Production PCA 2011
NT0003VEO,EFS,0,Encrypting File System (EFS),Provides the core file encryption technology used to store encrypted files on NTFS file system volumes. If this service is stopped or disabled  applications will be unable to access encrypted files.,C:\Windows\System32\lsass.exe,52693cc90bac8da6fef75dfb27d098bb,C:\Windows\System32\lsass.exe,Microsoft Windows,true,The file is signed and the signature was verified.,Microsoft Windows Production PCA 2011
NT0003VEO,mrxsmb,0,SMB MiniRedirector Wrapper and Engine,Implements the framework for the SMB filesystem redirector,C:\Windows\System32\drivers\mrxsmb.sys,b8885aedcfcf9d3f0bddb7ceb95954d5,system32\DRIVERS\mrxsmb.sys,Microsoft Windows,true,The file is signed and the signature was verified.,Microsoft Windows Production PCA 2011
NT0003VEO,AppID,0,AppID Driver,Identifies an application and enforces software restriction policies.,C:\Windows\System32\drivers\appid.sys,4a5fc9aeeadc6fc0f065b92ca15127b9,\SystemRoot\system32\drivers\appid.sys,Microsoft Windows,true,The file is signed and the signature was verified.,Microsoft Windows Production PCA 2011
NT0003VEO,DcomLaunch,688,DCOM Server Process Launcher,The DCOMLAUNCH service launches COM and DCOM servers in response to object activation requests. If this service is stopped or disabled  programs using COM or DCOM will not function properly. It is strongly recommended that you have the DCOMLAUNCH service running.,C:\Windows\System32\svchost.exe,4e13a941b99fe98effb858ff11a4415e,C:\Windows\system32\svchost.exe -k DcomLaunch,Microsoft Windows,true,The file is signed and the signature was verified.,Microsoft Windows Production PCA 2011
NT0003VEO,iaStorV,0,Intel RAID Controller Windows 7,,C:\Windows\System32\drivers\iaStorV.sys,509341ed1cc3d0b6c50b69c87cb0f476,\SystemRoot\System32\drivers\iaStorV.sys,Microsoft Windows,true,The file is signed and the signature was verified.,Microsoft Windows Production PCA 2011
NT0003VEO,netprofm,928,Network List Service,Identifies the networks to which the computer has connected  collects and stores properties for these networks  and notifies applications when these properties change.,C:\Windows\System32\svchost.exe,4e13a941b99fe98effb858ff11a4415e,C:\Windows\System32\svchost.exe -k LocalService,Microsoft Windows,true,The file is signed and the signature was verified.,Microsoft Windows Production PCA 2011
NT0003VEO,BasicDisplay,0,BasicDisplay,,C:\Windows\System32\drivers\BasicDisplay.sys,4db1f7f494fb5c08badfb47d8008315e,\SystemRoot\System32\drivers\BasicDisplay.sys,Microsoft Windows,true,The file is signed and the signature was verified.,Microsoft Windows Production PCA 2011
NT0003VEO,megasr,0,megasr,,C:\Windows\System32\drivers\megasr.sys,b507d6e07b3c1c18fdaeba76625caa97,\SystemRoot\System32\drivers\megasr.sys,Microsoft Windows,true,The file is signed and the signature was verified.,Microsoft Windows Production PCA 2011
NT0003VEO,Dnscache,56,DNS Client,The DNS Client service (dnscache) caches Domain Name System (DNS) names and registers the full computer name for this computer. If the service is stopped  DNS names will continue to be resolved. However  the results of DNS name queries will not be cached and the computer's name will not be registered. If the service is disabled  any services that explicitly depend on it will fail to start.,C:\Windows\System32\svchost.exe,4e13a941b99fe98effb858ff11a4415e,C:\Windows\system32\svchost.exe -k NetworkService,Microsoft Windows,true,The file is signed and the signature was verified.,Microsoft Windows Production PCA 2011
NT0003VEO,ACPI,0,Microsoft ACPI Driver,,C:\Windows\System32\drivers\acpi.sys,574d986d2d534ed8ffe7a77558746561,\SystemRoot\System32\drivers\ACPI.sys,Microsoft Windows,true,The file is signed and the signature was verified.,Microsoft Windows Production PCA 2011
NT0003VEO,BasicRender,0,BasicRender,,C:\Windows\System32\drivers\BasicRender.sys,c30f113a1eaaa929657edbab5690db43,\SystemRoot\System32\drivers\BasicRender.sys,Microsoft Windows,true,The file is signed and the signature was verified.,Microsoft Windows Production PCA 2011
NT0003VEO,umbus,0,UMBus Enumerator Driver,,C:\Windows\System32\drivers\umbus.sys,64ed94075674b0e7b9fe79fb370ddcf2,\SystemRoot\System32\drivers\umbus.sys,Microsoft Windows,true,The file is signed and the signature was verified.,Microsoft Windows Production PCA 2011
NT0003VEO,Browser,0,Computer Browser,Maintains an updated list of computers on the network and supplies this list to computers designated as browsers. If this service is stopped  this list will not be updated or maintained. If this service is disabled  any services that explicitly depend on it will fail to start.,C:\Windows\System32\svchost.exe,4e13a941b99fe98effb858ff11a4415e,C:\Windows\System32\svchost.exe -k netsvcs,Microsoft Windows,true,The file is signed and the signature was verified.,Microsoft Windows Production PCA 2011
