hostname,name,pid,descriptivename,description,path,pathmd5sum,arguments,pathcertificatesubject,pathsignatureverified,pathsignaturedescription,pathcertificateissuer
NT0003VEO,vdrvroot,0,Microsoft Virtual Drive Enumerator,,C:\Windows\System32\drivers\vdrvroot.sys,ca827ba0eea9324a94460e4c91029767,\SystemRoot\System32\drivers\vdrvroot.sys,Microsoft Windows,true,The file is signed and the signature was verified.,Microsoft Windows Production PCA 2011
NT0003VEO,UmRdpService,1292,Remote Desktop Services UserMode Port Redirector,Allows the redirection of Printers/Drives/Ports for RDP connections,C:\Windows\System32\svchost.exe,4e13a941b99fe98effb858ff11a4415e,C:\Windows\System32\svchost.exe -k LocalSystemNetworkRestricted,Microsoft Windows,true,The file is signed and the signature was verified.,Microsoft Windows Production PCA 2011
NT0003VEO,UI0Detect,0,Interactive Services Detection,Enables user notification of user input for interactive services  which enables access to dialogs created by interactive services when they appear. If this service is stopped  notifications of new interactive service dialogs will no longer function and there might not be access to interactive service dialogs. If this service is disabled  both notifications of and access to new interactive service dialogs will no longer function.,C:\Windows\System32\UI0Detect.exe,a74434fca737decfb361501f7896bca7,C:\Windows\system32\UI0Detect.exe,Microsoft Windows,true,The file is signed and the signature was verified.,Microsoft Windows Production PCA 2011
NT0003VEO,WFPLWFS,0,Microsoft Windows Filtering Platform,Microsoft Windows Filtering Platform,C:\Windows\System32\drivers\wfplwfs.sys,61fa7dc1971a8dfdcf66546a6374da19,\SystemRoot\system32\DRIVERS\wfplwfs.sys,Microsoft Windows,true,The file is signed and the signature was verified.,Microsoft Windows Production PCA 2011
NT0003VEO,disk,0,Disk Driver,,C:\Windows\System32\drivers\disk.sys,8f70dd0ea5461b34c74806789e092515,\SystemRoot\System32\drivers\disk.sys,Microsoft Windows,true,The file is signed and the signature was verified.,Microsoft Windows Production PCA 2011
NT0003VEO,Dfsc,0,DFS Namespace Client Driver,Client driver for access to DFS Namespaces,C:\Windows\System32\drivers\dfsc.sys,3ff016e03a4b8c080c6d035f961eff5a,System32\Drivers\dfsc.sys,Microsoft Windows,true,The file is signed and the signature was verified.,Microsoft Windows Production PCA 2011
NT0003VEO,msiserver,0,Windows Installer,Adds  modifies  and removes applications provided as a Windows Installer (*.msi  *.msp) package. If this service is disabled  any services that explicitly depend on it will fail to start.,C:\Windows\System32\msiexec.exe,1584de6c6c4aca1b5030411a6d953291,C:\Windows\system32\msiexec.exe /V,Microsoft Windows,true,The file is signed and the signature was verified.,Microsoft Windows Production PCA 2011
NT0003VEO,VaultSvc,0,Credential Manager,Provides secure storage and retrieval of credentials to users  applications and security service packages.,C:\Windows\System32\lsass.exe,52693cc90bac8da6fef75dfb27d098bb,C:\Windows\system32\lsass.exe,Microsoft Windows,true,The file is signed and the signature was verified.,Microsoft Windows Production PCA 2011
NT0003VEO,Themes,888,Themes,Provides user experience theme management.,C:\Windows\System32\svchost.exe,4e13a941b99fe98effb858ff11a4415e,C:\Windows\System32\svchost.exe -k netsvcs,Microsoft Windows,true,The file is signed and the signature was verified.,Microsoft Windows Production PCA 2011
NT0003VEO,vhdmp,0,vhdmp,,C:\Windows\System32\drivers\vhdmp.sys,19876e29f904e08669d3a291b3d9a4f0,\SystemRoot\System32\drivers\vhdmp.sys,Microsoft Windows,true,The file is signed and the signature was verified.,Microsoft Windows Production PCA 2011
NT0003VEO,bxois,0,Broadcom NetXtreme II Offload iSCSI Driver,,C:\Windows\System32\drivers\bxois.sys,4e32a27b6bc0d36750ef60fbf39d8fbc,\SystemRoot\System32\drivers\bxois.sys,Microsoft Windows,true,The file is signed and the signature was verified.,Microsoft Windows Production PCA 2011
NT0003VEO,fdPHost,0,Function Discovery Provider Host,The FDPHOST service hosts the Function Discovery (FD) network discovery providers. These FD providers supply network discovery services for the Simple Services Discovery Protocol (SSDP) and Web Services – Discovery (WS-D) protocol. Stopping or disabling the FDPHOST service will disable network discovery for these protocols when using FD. When this service is unavailable  network services using FD and relying on these discovery protocols will be unable to find network devices or resources.,C:\Windows\System32\svchost.exe,4e13a941b99fe98effb858ff11a4415e,C:\Windows\system32\svchost.exe -k LocalService,Microsoft Windows,true,The file is signed and the signature was verified.,Microsoft Windows Production PCA 2011
NT0003VEO,gencounter,0,Microsoft Hyper-V Generation Counter,,C:\Windows\System32\drivers\vmgencounter.sys,706e743d0fd58fe7791864580d23b911,\SystemRoot\System32\drivers\vmgencounter.sys,Microsoft Windows,true,The file is signed and the signature was verified.,Microsoft Windows Production PCA 2011
NT0003VEO,MSiSCSI,0,Microsoft iSCSI Initiator Service,Manages Internet SCSI (iSCSI) sessions from this computer to remote iSCSI target devices. If this service is stopped  this computer will not be able to login or access iSCSI targets. If this service is disabled  any services that explicitly depend on it will fail to start.,C:\Windows\System32\svchost.exe,4e13a941b99fe98effb858ff11a4415e,C:\Windows\system32\svchost.exe -k netsvcs,Microsoft Windows,true,The file is signed and the signature was verified.,Microsoft Windows Production PCA 2011
NT0003VEO,KSecDD,0,KSecDD,,C:\Windows\System32\drivers\ksecdd.sys,a3f05e0eb5cc223fc88640633b08b832,\SystemRoot\System32\Drivers\ksecdd.sys,Microsoft Windows,true,The file is signed and the signature was verified.,Microsoft Windows Production PCA 2011
NT0003VEO,luafv,0,UAC File Virtualization,Virtualizes file write failures to per-user locations.,C:\Windows\System32\drivers\luafv.sys,6dd03b50a426bd26ce049d581bef523f,\SystemRoot\system32\drivers\luafv.sys,Microsoft Windows,true,The file is signed and the signature was verified.,Microsoft Windows Production PCA 2011
NT0003VEO,TPM,0,TPM,TPM Driver,C:\Windows\System32\drivers\tpm.sys,cb74a14e8d82f9348015f2f2ebfc26b1,\SystemRoot\system32\drivers\tpm.sys,Microsoft Windows,true,The file is signed and the signature was verified.,Microsoft Windows Production PCA 2011
NT0003VEO,TermService,1772,Remote Desktop Services,Allows users to connect interactively to a remote computer. Remote Desktop and Remote Desktop Session Host Server depend on this service.  To prevent remote use of this computer  clear the checkboxes on the Remote tab of the System properties control panel item.,C:\Windows\System32\svchost.exe,4e13a941b99fe98effb858ff11a4415e,C:\Windows\System32\svchost.exe -k termsvcs,Microsoft Windows,true,The file is signed and the signature was verified.,Microsoft Windows Production PCA 2011
NT0003VEO,NdisVirtualBus,0,Microsoft Virtual Network Adapter Enumerator,,C:\Windows\System32\drivers\NdisVirtualBus.sys,8346fb66b39ba645bbf886abaf2934c7,\SystemRoot\System32\drivers\NdisVirtualBus.sys,Microsoft Windows,true,The file is signed and the signature was verified.,Microsoft Windows Production PCA 2011
NT0003VEO,vxn,0,Intel(R) 10G Virtual Network Connection,,C:\Windows\System32\drivers\vxn64x64.sys,52583a8d1e12eb9deb9d6c7afabe65ff,\SystemRoot\system32\DRIVERS\vxn64x64.sys,Microsoft Windows Hardware Compatibility Publisher,true,The file is signed and the signature was verified.,Microsoft Windows Third Party Component CA 2012
NT0003VEO,netvsc,0,netvsc,,C:\Windows\System32\drivers\netvsc63.sys,2774c2e2976c5cd7feb3315d668526cc,\SystemRoot\System32\drivers\netvsc63.sys,Microsoft Windows,true,The file is signed and the signature was verified.,Microsoft Windows Production PCA 2011
NT0003VEO,bxfcoe,0,Broadcom NetXtreme II Offload FCoE Driver,,C:\Windows\System32\drivers\bxfcoe.sys,12c924aca293331fcefff5a7565f2280,\SystemRoot\System32\drivers\bxfcoe.sys,Microsoft Windows,true,The file is signed and the signature was verified.,Microsoft Windows Production PCA 2011
NT0003VEO,ALG,0,Application Layer Gateway Service,Provides support for 3rd party protocol plug-ins for Internet Connection Sharing,C:\Windows\System32\alg.exe,ad38242f35db32d0eafd328e90cfc895,C:\Windows\System32\alg.exe,Microsoft Windows,true,The file is signed and the signature was verified.,Microsoft Windows Production PCA 2011
NT0003VEO,Appinfo,888,Application Information,Facilitates the running of interactive applications with additional administrative privileges.  If this service is stopped  users will be unable to launch applications with the additional administrative privileges they may require to perform desired user tasks.,C:\Windows\System32\svchost.exe,4e13a941b99fe98effb858ff11a4415e,C:\Windows\system32\svchost.exe -k netsvcs,Microsoft Windows,true,The file is signed and the signature was verified.,Microsoft Windows Production PCA 2011
NT0003VEO,mrxsmb10,0,SMB 1.x MiniRedirector,Implements the SMB 1.x (CIFS) protocol. This protocol provides connectivity to network resources on pre-Windows Vista servers,C:\Windows\System32\drivers\mrxsmb10.sys,c9635877daf94ccf0d9bcadbe203354d,system32\DRIVERS\mrxsmb10.sys,Microsoft Windows,true,The file is signed and the signature was verified.,Microsoft Windows Production PCA 2011
NT0003VEO,acpiex,0,Microsoft ACPIEx Driver,,C:\Windows\System32\drivers\acpiex.sys,c60eba37b4b372a6b14721faab29f9b2,\SystemRoot\System32\Drivers\acpiex.sys,Microsoft Windows,true,The file is signed and the signature was verified.,Microsoft Windows Production PCA 2011
NT0003VEO,HTTP,0,HTTP Service,HTTP Service,C:\Windows\System32\drivers\http.sys,1268a4e6144037dd5bb3832377b00fde,system32\drivers\HTTP.sys,Microsoft Windows,true,The file is signed and the signature was verified.,Microsoft Windows Production PCA 2011
NT0003VEO,DeviceAssociationService,0,Device Association Service,Enables pairing between the system and wired or wireless devices.,C:\Windows\System32\svchost.exe,4e13a941b99fe98effb858ff11a4415e,C:\Windows\system32\svchost.exe -k LocalSystemNetworkRestricted,Microsoft Windows,true,The file is signed and the signature was verified.,Microsoft Windows Production PCA 2011
NT0003VEO,AeLookupSvc,0,Application Experience,Processes application compatibility cache requests for applications as they are launched,C:\Windows\System32\svchost.exe,4e13a941b99fe98effb858ff11a4415e,C:\Windows\system32\svchost.exe -k netsvcs,Microsoft Windows,true,The file is signed and the signature was verified.,Microsoft Windows Production PCA 2011
NT0003VEO,TieringEngineService,0,Storage Tiers Management,Optimizes the placement of data in storage tiers on all tiered storage spaces in the system.,C:\Windows\System32\TieringEngineService.exe,59dd9a843d3e92ab1265afb0d6e53267,C:\Windows\system32\TieringEngineService.exe,Microsoft Windows,true,The file is signed and the signature was verified.,Microsoft Windows Production PCA 2011
NT0003VEO,DeviceInstall,0,Device Install Service,Enables a computer to recognize and adapt to hardware changes with little or no user input. Stopping or disabling this service will result in system instability.,C:\Windows\System32\svchost.exe,4e13a941b99fe98effb858ff11a4415e,C:\Windows\system32\svchost.exe -k DcomLaunch,Microsoft Windows,true,The file is signed and the signature was verified.,Microsoft Windows Production PCA 2011
NT0003VEO,AudioEndpointBuilder,0,Windows Audio Endpoint Builder,Manages audio devices for the Windows Audio service.  If this service is stopped  audio devices and effects will not function properly.  If this service is disabled  any services that explicitly depend on it will fail to start,C:\Windows\System32\svchost.exe,4e13a941b99fe98effb858ff11a4415e,C:\Windows\System32\svchost.exe -k LocalSystemNetworkRestricted,Microsoft Windows,true,The file is signed and the signature was verified.,Microsoft Windows Production PCA 2011
NT0003VEO,DsmSvc,0,Device Setup Manager,Enables the detection  download and installation of device-related software. If this service is disabled  devices may be configured with outdated software  and may not work correctly.,C:\Windows\System32\svchost.exe,4e13a941b99fe98effb858ff11a4415e,C:\Windows\system32\svchost.exe -k netsvcs,Microsoft Windows,true,The file is signed and the signature was verified.,Microsoft Windows Production PCA 2011
NT0003VEO,HyperVideo,0,HyperVideo,,C:\Windows\System32\drivers\HyperVideo.sys,0daca467b1858e249d84e64b98f340ee,\SystemRoot\system32\DRIVERS\HyperVideo.sys,Microsoft Windows,true,The file is signed and the signature was verified.,Microsoft Windows Production PCA 2011
NT0003VEO,spaceport,0,Storage Spaces Driver,,C:\Windows\System32\drivers\spaceport.sys,a6872337b1d75034a9d7bc7784a9d278,\SystemRoot\System32\drivers\spaceport.sys,Microsoft Windows,true,The file is signed and the signature was verified.,Microsoft Windows Production PCA 2011
NT0003VEO,mouhid,0,Mouse HID Driver,,C:\Windows\System32\drivers\mouhid.sys,7114b8052043e2dae4af7804256097db,\SystemRoot\System32\drivers\mouhid.sys,Microsoft Windows,true,The file is signed and the signature was verified.,Microsoft Windows Production PCA 2011
NT0003VEO,usbuhci,0,Microsoft USB Universal Host Controller Miniport Driver,,C:\Windows\System32\drivers\usbuhci.sys,4bdea5a98bbeb49e8eddc92a5d674683,\SystemRoot\System32\drivers\usbuhci.sys,Microsoft Windows,true,The file is signed and the signature was verified.,Microsoft Windows Production PCA 2011
NT0003VEO,USBXHCI,0,USB xHCI Compliant Host Controller,,C:\Windows\System32\drivers\USBXHCI.SYS,6ed9ff2b0847fd2d9ce2c19e7ac58aa0,\SystemRoot\System32\drivers\USBXHCI.SYS,Microsoft Windows,true,The file is signed and the signature was verified.,Microsoft Windows Production PCA 2011
NT0003VEO,RasAgileVpn,0,WAN Miniport (IKEv2),WAN Miniport (IKEv2),C:\Windows\System32\drivers\agilevpn.sys,257820a7a378343fcc8b8c0a2f7e35aa,\SystemRoot\system32\DRIVERS\AgileVpn.sys,Microsoft Windows,true,The file is signed and the signature was verified.,Microsoft Windows Production PCA 2011
NT0003VEO,srvnet,0,srvnet,,C:\Windows\System32\drivers\srvnet.sys,c3c55d48386dd7bae38ef66e6418c675,System32\DRIVERS\srvnet.sys,Microsoft Windows,true,The file is signed and the signature was verified.,Microsoft Windows Production PCA 2011
NT0003VEO,GPIOClx0101,0,Microsoft GPIO Class Extension Driver,,C:\Windows\System32\drivers\msgpioclx.sys,1623f295f075390509bf7c60a530446f,System32\Drivers\msgpioclx.sys,Microsoft Windows,true,The file is signed and the signature was verified.,Microsoft Windows Production PCA 2011
NT0003VEO,UEFI,0,Microsoft UEFI Driver,,C:\Windows\System32\drivers\uefi.sys,fbc56dcc1e82337a73e0faf9c919c52e,\SystemRoot\System32\drivers\UEFI.sys,Microsoft Windows,true,The file is signed and the signature was verified.,Microsoft Windows Production PCA 2011
NT0003VEO,condrv,0,Console Driver,,C:\Windows\System32\drivers\condrv.sys,aa6779ecda4ac738d33eaa68a354652d,System32\drivers\condrv.sys,Microsoft Windows,true,The file is signed and the signature was verified.,Microsoft Windows Production PCA 2011
NT0003VEO,Parport,0,Parallel port driver,,C:\Windows\System32\drivers\parport.sys,2558f02871947ef25df9c73acef87936,\SystemRoot\System32\drivers\parport.sys,Microsoft Windows,true,The file is signed and the signature was verified.,Microsoft Windows Production PCA 2011
NT0003VEO,storahci,0,Microsoft Standard SATA AHCI Driver,,C:\Windows\System32\drivers\storahci.sys,81caaeebfc8f36f1a2923944a683f634,\SystemRoot\System32\drivers\storahci.sys,Microsoft Windows,true,The file is signed and the signature was verified.,Microsoft Windows Production PCA 2011
NT0003VEO,WinNat,0,Windows NAT Driver,This service provides network address translation functionality,C:\Windows\System32\drivers\winnat.sys,d6997ae035dc3da966648d02946aa140,system32\drivers\winnat.sys,Microsoft Windows,true,The file is signed and the signature was verified.,Microsoft Windows Production PCA 2011
NT0003VEO,MsLbfoProvider,0,Microsoft Load Balancing/Failover Provider,Microsoft Load Balancing/Failover Provider,C:\Windows\System32\drivers\MsLbfoProvider.sys,640cc7217aadb22226ecd9555e0012e0,\SystemRoot\system32\DRIVERS\MsLbfoProvider.sys,Microsoft Windows,true,The file is signed and the signature was verified.,Microsoft Windows Production PCA 2011
NT0003VEO,elxfcoe,0,elxfcoe,,C:\Windows\System32\drivers\elxfcoe.sys,55ae17f89b81f8414c48736be9296546,\SystemRoot\System32\drivers\elxfcoe.sys,Microsoft Windows,true,The file is signed and the signature was verified.,Microsoft Windows Production PCA 2011
NT0003VEO,vmbusr,0,Virtual Machine Bus Provider,,C:\Windows\System32\drivers\vmbusr.sys,5bd08ec0f94802286338ce5433f44ed1,\SystemRoot\System32\drivers\vmbusr.sys,Microsoft Windows,true,The file is signed and the signature was verified.,Microsoft Windows Production PCA 2011
NT0003VEO,mssmbios,0,Microsoft System Management BIOS Driver,,C:\Windows\System32\drivers\mssmbios.sys,7a09b8b0c91143015573db3c1c471017,\SystemRoot\System32\drivers\mssmbios.sys,Microsoft Windows,true,The file is signed and the signature was verified.,Microsoft Windows Production PCA 2011
NT0003VEO,ScDeviceEnum,1292,Smart Card Device Enumeration Service,Creates software device nodes for all smart card readers accessible to a given session. If this service is disabled  WinRT APIs will not be able to enumerate smart card readers.,C:\Windows\System32\svchost.exe,4e13a941b99fe98effb858ff11a4415e,C:\Windows\system32\svchost.exe -k LocalSystemNetworkRestricted,Microsoft Windows,true,The file is signed and the signature was verified.,Microsoft Windows Production PCA 2011
NT0003VEO,intelppm,0,Intel Processor Driver,,C:\Windows\System32\drivers\intelppm.sys,86a15e0c832f00067c22f4877788c99d,\SystemRoot\System32\drivers\intelppm.sys,Microsoft Windows,true,The file is signed and the signature was verified.,Microsoft Windows Production PCA 2011
NT0003VEO,RpcLocator,0,Remote Procedure Call (RPC) Locator,In Windows 2003 and earlier versions of Windows  the Remote Procedure Call (RPC) Locator service manages the RPC name service database. In Windows Vista and later versions of Windows  this service does not provide any functionality and is present for application compatibility.,C:\Windows\System32\Locator.exe,7d8345eb5a99da7597156e89a63b8e32,C:\Windows\system32\locator.exe,Microsoft Windows,true,The file is signed and the signature was verified.,Microsoft Windows Production PCA 2011
NT0003VEO,WSService,0,Windows Store Service (WSService),Provides infrastructure support for Windows Store.This service is started on demand and if disabled applications bought using Windows Store will not behave correctly.,C:\Windows\System32\svchost.exe,4e13a941b99fe98effb858ff11a4415e,C:\Windows\System32\svchost.exe -k wsappx,Microsoft Windows,true,The file is signed and the signature was verified.,Microsoft Windows Production PCA 2011
NT0003VEO,AFD,0,Ancillary Function Driver for Winsock,Ancillary Function Driver for Winsock,C:\Windows\System32\drivers\afd.sys,de5c8ba9ff892767feb59e041c892437,\SystemRoot\system32\drivers\afd.sys,Microsoft Windows,true,The file is signed and the signature was verified.,Microsoft Windows Production PCA 2011
NT0003VEO,sdbus,0,sdbus,,C:\Windows\System32\drivers\sdbus.sys,57f76c3bcf52830658d48c50e27c9ef4,\SystemRoot\System32\drivers\sdbus.sys,Microsoft Windows,true,The file is signed and the signature was verified.,Microsoft Windows Production PCA 2011
NT0003VEO,THREADORDER,0,Thread Ordering Server,Provides ordered execution for a group of threads within a specific period of time.,C:\Windows\System32\svchost.exe,4e13a941b99fe98effb858ff11a4415e,C:\Windows\system32\svchost.exe -k LocalService,Microsoft Windows,true,The file is signed and the signature was verified.,Microsoft Windows Production PCA 2011
NT0003VEO,HidUsb,0,Microsoft HID Class Driver,,C:\Windows\System32\drivers\hidusb.sys,4b287ec1fab28274f23ab96cae8132fb,\SystemRoot\System32\drivers\hidusb.sys,Microsoft Windows,true,The file is signed and the signature was verified.,Microsoft Windows Production PCA 2011
NT0003VEO,WIMMount,0,WIMMount,WIM Image mount service driver,C:\Windows\System32\drivers\wimmount.sys,e16d0c3c57da5290a4d1077827343cdb,system32\drivers\wimmount.sys,Microsoft Windows,true,The file is signed and the signature was verified.,Microsoft Windows Production PCA 2011
NT0003VEO,NdisCap,0,Microsoft NDIS Capture,Microsoft NDIS Capture,C:\Windows\System32\drivers\ndiscap.sys,d21762a5cf77229136aafb31abeedd64,\SystemRoot\system32\DRIVERS\ndiscap.sys,Microsoft Windows,true,The file is signed and the signature was verified.,Microsoft Windows Production PCA 2011
NT0003VEO,SessionEnv,888,Remote Desktop Configuration,Remote Desktop Configuration service (RDCS) is responsible for all Remote Desktop Services and Remote Desktop related configuration and session maintenance activities that require SYSTEM context. These include per-session temporary folders  RD themes  and RD certificates.,C:\Windows\System32\svchost.exe,4e13a941b99fe98effb858ff11a4415e,C:\Windows\System32\svchost.exe -k netsvcs,Microsoft Windows,true,The file is signed and the signature was verified.,Microsoft Windows Production PCA 2011
NT0003VEO,s3cap,0,s3cap,,C:\Windows\System32\drivers\vms3cap.sys,fa51016ca97fbc10d9e79fe467287c56,\SystemRoot\System32\drivers\vms3cap.sys,Microsoft Windows,true,The file is signed and the signature was verified.,Microsoft Windows Production PCA 2011
NT0003VEO,RasPppoe,0,Remote Access PPPOE Driver,Remote Access PPPOE Driver,C:\Windows\System32\drivers\raspppoe.sys,dc607c8e3f3decadaa34a79be0c03eea,\SystemRoot\System32\drivers\raspppoe.sys,Microsoft Windows,true,The file is signed and the signature was verified.,Microsoft Windows Production PCA 2011
NT0003VEO,FileInfo,0,File Information FS MiniFilter,Collects information about files in memory to be consumed by other system services.,C:\Windows\System32\drivers\fileinfo.sys,8fe028c5cfa5ee834c8ba9d1e58b14c0,\SystemRoot\System32\drivers\fileinfo.sys,Microsoft Windows,true,The file is signed and the signature was verified.,Microsoft Windows Production PCA 2011
NT0003VEO,Wanarpv6,0,Remote Access IPv6 ARP Driver,Remote Access IPv6 ARP Driver,C:\Windows\System32\drivers\wanarp.sys,5e1293ad9ab00bbebbd9c70193de7949,\SystemRoot\system32\DRIVERS\wanarp.sys,Microsoft Windows,true,The file is signed and the signature was verified.,Microsoft Windows Production PCA 2011
NT0003VEO,vmicvss,0,Hyper-V Volume Shadow Copy Requestor,Coordinates the communications that are required to use Volume Shadow Copy Service to back up applications and data on this virtual machine from the operating system on the physical computer.,C:\Windows\System32\svchost.exe,4e13a941b99fe98effb858ff11a4415e,C:\Windows\system32\svchost.exe -k LocalSystemNetworkRestricted,Microsoft Windows,true,The file is signed and the signature was verified.,Microsoft Windows Production PCA 2011
NT0003VEO,SNMPTRAP,0,SNMP Trap,Receives trap messages generated by local or remote Simple Network Management Protocol (SNMP) agents and forwards the messages to SNMP management programs running on this computer. If this service is stopped  SNMP-based programs on this computer will not receive SNMP trap messages. If this service is disabled  any services that explicitly depend on it will fail to start.,C:\Windows\System32\snmptrap.exe,b2f1a364c7dd6bcb8366a2fe37c83efa,C:\Windows\System32\snmptrap.exe,Microsoft Windows,true,The file is signed and the signature was verified.,Microsoft Windows Production PCA 2011
NT0003VEO,mlx4_bus,0,Mellanox ConnectX Bus Enumerator,,C:\Windows\System32\drivers\mlx4_bus.sys,9538d4d616656215dbab36863c259311,\SystemRoot\System32\drivers\mlx4_bus.sys,Microsoft Windows,true,The file is signed and the signature was verified.,Microsoft Windows Production PCA 2011
NT0003VEO,NetTcpPortSharing,0,Net.Tcp Port Sharing Service,Provides ability to share TCP ports over the net.tcp protocol.,C:\Windows\Microsoft.NET\Framework64\v4.0.30319\SMSvcHost.exe,becc6cc8fc89b12c4e1e8499673ac2b7,C:\Windows\Microsoft.NET\Framework64\v4.0.30319\SMSvcHost.exe,Microsoft Windows,true,The file is signed and the signature was verified.,Microsoft Windows Production PCA 2011
NT0003VEO,SamSs,632,Security Accounts Manager,The startup of this service signals other services that the Security Accounts Manager (SAM) is ready to accept requests.  Disabling this service will prevent other services in the system from being notified when the SAM is ready  which may in turn cause those services to fail to start correctly. This service should not be disabled.,C:\Windows\System32\lsass.exe,52693cc90bac8da6fef75dfb27d098bb,C:\Windows\system32\lsass.exe,Microsoft Windows,true,The file is signed and the signature was verified.,Microsoft Windows Production PCA 2011
NT0003VEO,WinMad,0,WinMad Service,,C:\Windows\System32\drivers\winmad.sys,3e3ea18fa3d49de71d9800c6260d701d,\SystemRoot\System32\drivers\winmad.sys,Microsoft Windows,true,The file is signed and the signature was verified.,Microsoft Windows Production PCA 2011
NT0003VEO,SCardSvr,0,Smart Card,Manages access to smart cards read by this computer. If this service is stopped  this computer will be unable to read smart cards. If this service is disabled  any services that explicitly depend on it will fail to start.,C:\Windows\System32\svchost.exe,4e13a941b99fe98effb858ff11a4415e,C:\Windows\system32\svchost.exe -k LocalServiceAndNoImpersonation,Microsoft Windows,true,The file is signed and the signature was verified.,Microsoft Windows Production PCA 2011
NT0003VEO,usbccgp,0,Microsoft USB Generic Parent Driver,,C:\Windows\System32\drivers\usbccgp.sys,cc237df06332c0052642d90aa59bced9,\SystemRoot\System32\drivers\usbccgp.sys,Microsoft Windows,true,The file is signed and the signature was verified.,Microsoft Windows Production PCA 2011
