hostname,name,pid,descriptivename,description,path,pathmd5sum,arguments,pathcertificatesubject,pathsignatureverified,pathsignaturedescription,pathcertificateissuer
WW0004GOO,upnphost,0,UPnP Device Host,Allows UPnP devices to be hosted on this computer. If this service is stopped  any hosted UPnP devices will stop functioning and no additional hosted devices can be added. If this service is disabled  any services that explicitly depend on it will fail to start.,C:\Windows\System32\svchost.exe,793714f016df50c2502afb5bd60031fb,C:\Windows\system32\svchost.exe -k LocalServiceAndNoImpersonation,Microsoft Windows,true,The file is signed and the signature was verified.,Microsoft Windows Verification PCA
WW0004GOO,Vid,0,Vid,,C:\Windows\System32\drivers\Vid.sys,ef5fcad9273b2667949e64ce34d33847,\SystemRoot\system32\drivers\Vid.sys,Microsoft Windows,true,The file is signed and the signature was verified.,Microsoft Windows Verification PCA
WW0004GOO,msisadrv,0,msisadrv,,C:\Windows\System32\drivers\msisadrv.sys,89290d1b124711729f58e1eb4bdf59ba,\SystemRoot\system32\drivers\msisadrv.sys,Microsoft Windows,true,The file is signed and the signature was verified.,Microsoft Windows Verification PCA
WW0004GOO,SCardSvr,0,Smart Card,Manages access to smart cards read by this computer. If this service is stopped  this computer will be unable to read smart cards. If this service is disabled  any services that explicitly depend on it will fail to start.,C:\Windows\System32\svchost.exe,793714f016df50c2502afb5bd60031fb,C:\Windows\system32\svchost.exe -k LocalServiceAndNoImpersonation,Microsoft Windows,true,The file is signed and the signature was verified.,Microsoft Windows Verification PCA
WW0004GOO,seclogon,0,Secondary Logon,Enables starting processes under alternate credentials. If this service is stopped  this type of logon access will be unavailable. If this service is disabled  any services that explicitly depend on it will fail to start.,C:\Windows\System32\svchost.exe,793714f016df50c2502afb5bd60031fb,C:\Windows\system32\svchost.exe -k netsvcs,Microsoft Windows,true,The file is signed and the signature was verified.,Microsoft Windows Verification PCA
WW0004GOO,MTConfig,0,Microsoft Input Configuration Driver,,C:\Windows\System32\drivers\MTConfig.sys,869b98d620cd0cd9efe900cf38477fa7,\SystemRoot\system32\drivers\MTConfig.sys,Microsoft Windows,true,The file is signed and the signature was verified.,Microsoft Windows Verification PCA
WW0004GOO,uliagpkx,0,Uli AGP Bus Filter,,C:\Windows\System32\drivers\ULIAGPKX.SYS,dd86556c3d04aae29ba0686aef518594,\SystemRoot\system32\drivers\uliagpkx.sys,Microsoft Windows,true,The file is signed and the signature was verified.,Microsoft Windows Verification PCA
WW0004GOO,WfpLwf,0,WFP Lightweight Filter,WFP Lightweight Filter,C:\Windows\System32\drivers\wfplwf.sys,ae493796bfcb8c98cd8c4b35c606c7f0,\SystemRoot\system32\DRIVERS\wfplwf.sys,Microsoft Windows,true,The file is signed and the signature was verified.,Microsoft Windows Verification PCA
WW0004GOO,Browser,0,Computer Browser,Maintains an updated list of computers on the network and supplies this list to computers designated as browsers. If this service is stopped  this list will not be updated or maintained. If this service is disabled  any services that explicitly depend on it will fail to start.,C:\Windows\System32\svchost.exe,793714f016df50c2502afb5bd60031fb,C:\Windows\System32\svchost.exe -k netsvcs,Microsoft Windows,true,The file is signed and the signature was verified.,Microsoft Windows Verification PCA
WW0004GOO,VgaSave,0,VgaSave,,C:\Windows\System32\drivers\vga.sys,78734a4e695d733e32946e4a78e637f5,\SystemRoot\System32\drivers\vga.sys,Microsoft Windows,true,The file is signed and the signature was verified.,Microsoft Windows Verification PCA
WW0004GOO,NetTcpPortSharing,0,Net.Tcp Port Sharing Service,Provides ability to share TCP ports over the net.tcp protocol.,C:\Windows\Microsoft.NET\Framework64\v4.0.30319\SMSvcHost.exe,af3fe4d7fa33996cafbdd30da439d509,C:\Windows\Microsoft.NET\Framework64\v4.0.30319\SMSvcHost.exe,Microsoft Corporation,true,The file is signed and the signature was verified.,Microsoft Code Signing PCA
WW0004GOO,lltdsvc,0,Link-Layer Topology Discovery Mapper,Creates a Network Map  consisting of PC and device topology (connectivity) information  and metadata describing each PC and device.  If this service is disabled  the Network Map will not function properly.,C:\Windows\System32\svchost.exe,793714f016df50c2502afb5bd60031fb,C:\Windows\System32\svchost.exe -k LocalService,Microsoft Windows,true,The file is signed and the signature was verified.,Microsoft Windows Verification PCA
WW0004GOO,sacsvr,968,Special Administration Console Helper,Allows administrators to remotely access a command prompt using Emergency Management Services.,C:\Windows\System32\svchost.exe,793714f016df50c2502afb5bd60031fb,C:\Windows\System32\svchost.exe -k netsvcs,Microsoft Windows,true,The file is signed and the signature was verified.,Microsoft Windows Verification PCA
WW0004GOO,clr_optimization_v4.0.30319_64,0,Microsoft .NET Framework NGEN v4.0.30319_X64,Microsoft .NET Framework NGEN,C:\Windows\Microsoft.NET\Framework64\v4.0.30319\mscorsvw.exe,ccbe8fd4882b381c1058a85fbb80387c,C:\Windows\Microsoft.NET\Framework64\v4.0.30319\mscorsvw.exe,Microsoft Dynamic Code Publisher,true,The file is signed and the signature was verified.,Microsoft Code Signing PCA
WW0004GOO,nv_agp,0,NVIDIA nForce AGP Bus Filter,,C:\Windows\System32\drivers\NV_AGP.SYS,d0c1c8e6e0db1e0ff7172c1eab2fcb18,\SystemRoot\system32\drivers\nv_agp.sys,Microsoft Windows,true,The file is signed and the signature was verified.,Microsoft Windows Verification PCA
WW0004GOO,HpSAMD,0,HpSAMD,,C:\Windows\System32\drivers\HpSAMD.sys,fb43f361e1b0a0fcc3e4b7bc3d47f85f,\SystemRoot\system32\drivers\HpSAMD.sys,Microsoft Windows,true,The file is signed and the signature was verified.,Microsoft Windows Verification PCA
WW0004GOO,amdxata,0,amdxata,,C:\Windows\System32\drivers\amdxata.sys,d1d270202df77752128a3849b4537ce8,\SystemRoot\system32\drivers\amdxata.sys,Microsoft Windows,true,The file is signed and the signature was verified.,Microsoft Windows Verification PCA
WW0004GOO,iirsp,0,iirsp,,C:\Windows\System32\drivers\iirsp.sys,c330970366c4232d550e93cfdfc7bf12,\SystemRoot\system32\drivers\iirsp.sys,Microsoft Windows,true,The file is signed and the signature was verified.,Microsoft Windows Verification PCA
WW0004GOO,s3cap,0,s3cap,,C:\Windows\System32\drivers\vms3cap.sys,a7fc7dc2481c48eab7ae4ea2b3affc7f,\SystemRoot\system32\drivers\vms3cap.sys,Microsoft Windows,true,The file is signed and the signature was verified.,Microsoft Windows Verification PCA
WW0004GOO,wuauserv,968,Windows Update,Enables the detection  download  and installation of updates for Windows and other programs. If this service is disabled  users of this computer will not be able to use Windows Update or its automatic updating feature  and programs will not be able to use the Windows Update Agent (WUA) API.,C:\Windows\System32\svchost.exe,793714f016df50c2502afb5bd60031fb,C:\Windows\system32\svchost.exe -k netsvcs,Microsoft Windows,true,The file is signed and the signature was verified.,Microsoft Windows Verification PCA
WW0004GOO,TermDD,0,Terminal Device Driver,,C:\Windows\System32\drivers\termdd.sys,e5fc1c1a4d018a8b7ab7a0ac4d4a9749,\SystemRoot\system32\drivers\termdd.sys,Microsoft Windows,true,The file is signed and the signature was verified.,Microsoft Windows Verification PCA
WW0004GOO,udfs,0,udfs,Reads/Writes UDF 1.02 1.5 2.0x 2.5 disc formats  usually found on C/DVD discs. (Core) (All pieces),C:\Windows\System32\drivers\udfs.sys,9fa1cae4ed55f524d7f1ac5247d6e738,system32\DRIVERS\udfs.sys,Microsoft Windows,true,The file is signed and the signature was verified.,Microsoft Windows Verification PCA
WW0004GOO,iScsiPrt,0,iScsiPort Driver,,C:\Windows\System32\drivers\msiscsi.sys,ded3374d09fcc342f7942145e97d469f,\SystemRoot\system32\drivers\msiscsi.sys,Microsoft Windows,true,The file is signed and the signature was verified.,Microsoft Windows Verification PCA
WW0004GOO,VMBusHID,0,VMBusHID,,C:\Windows\System32\drivers\VMBusHID.sys,154040ec377ac2d0b6fb36c9e2c9057c,\SystemRoot\system32\drivers\VMBusHID.sys,Microsoft Windows,true,The file is signed and the signature was verified.,Microsoft Windows Verification PCA
WW0004GOO,discache,0,System Attribute Cache,Attribute Cache Indexer,C:\Windows\System32\drivers\discache.sys,89ce7cdf50ddd395e707088eeb03be6e,System32\drivers\discache.sys,Microsoft Windows,true,The file is signed and the signature was verified.,Microsoft Windows Verification PCA
WW0004GOO,RasSstp,0,WAN Miniport (SSTP),WAN Miniport (SSTP),C:\Windows\System32\drivers\rassstp.sys,3ae31a66dbce1e4d66906f87ca7213a1,system32\DRIVERS\rassstp.sys,Microsoft Windows,true,The file is signed and the signature was verified.,Microsoft Windows Verification PCA
WW0004GOO,iphlpsvc,968,IP Helper,Provides tunnel connectivity using IPv6 transition technologies (6to4  ISATAP  Port Proxy  and Teredo)  and IP-HTTPS. If this service is stopped  the computer will not have the enhanced connectivity benefits that these technologies offer.,C:\Windows\System32\svchost.exe,793714f016df50c2502afb5bd60031fb,C:\Windows\System32\svchost.exe -k NetSvcs,Microsoft Windows,true,The file is signed and the signature was verified.,Microsoft Windows Verification PCA
WW0004GOO,uagp35,0,Microsoft AGPv3.5 Filter,,C:\Windows\System32\drivers\UAGP35.SYS,e2de5e5dfcfbc7c9bd56d4772f8e0e2e,\SystemRoot\system32\drivers\uagp35.sys,Microsoft Windows,true,The file is signed and the signature was verified.,Microsoft Windows Verification PCA
WW0004GOO,isapnp,0,isapnp,,C:\Windows\System32\drivers\isapnp.sys,a14bf2a552a80f8f6d3324076d76d09a,\SystemRoot\system32\drivers\isapnp.sys,Microsoft Windows,true,The file is signed and the signature was verified.,Microsoft Windows Verification PCA
WW0004GOO,hwpolicy,0,Hardware Policy Driver,Contains Processor and other policies,C:\Windows\System32\drivers\hwpolicy.sys,7e77dfae91259454a23a3bdca692b7ff,\SystemRoot\System32\drivers\hwpolicy.sys,Microsoft Windows,true,The file is signed and the signature was verified.,Microsoft Windows Verification PCA
WW0004GOO,gagp30kx,0,Microsoft Generic AGPv3.0 Filter for K8 Processor Platforms,,C:\Windows\System32\drivers\GAGP30KX.SYS,eca3bc22a2dae0126bc824ca2834af59,\SystemRoot\system32\drivers\gagp30kx.sys,Microsoft Windows,true,The file is signed and the signature was verified.,Microsoft Windows Verification PCA
WW0004GOO,PVPanic,0,QEMU PVPanic Service,,C:\Windows\System32\drivers\pvpanic.sys,df58081e716cce05ed513a6afa1469ab,\SystemRoot\system32\drivers\pvpanic.sys,Google Inc,true,The file is signed and the signature was verified.,Symantec Class 3 SHA256 Code Signing CA
WW0004GOO,defragsvc,0,Disk Defragmenter,Provides Disk Defragmentation Capabilities.,C:\Windows\System32\svchost.exe,793714f016df50c2502afb5bd60031fb,C:\Windows\system32\svchost.exe -k defragsvc,Microsoft Windows,true,The file is signed and the signature was verified.,Microsoft Windows Verification PCA
WW0004GOO,MpsSvc,768,Windows Firewall,Windows Firewall helps protect your computer by preventing unauthorized users from gaining access to your computer through the Internet or a network.,C:\Windows\System32\svchost.exe,793714f016df50c2502afb5bd60031fb,C:\Windows\system32\svchost.exe -k LocalServiceNoNetwork,Microsoft Windows,true,The file is signed and the signature was verified.,Microsoft Windows Verification PCA
WW0004GOO,AcpiPmi,0,ACPI Power Meter Driver,,C:\Windows\System32\drivers\acpipmi.sys,831abf6416d6843caac958aef5d362d4,\SystemRoot\system32\drivers\acpipmi.sys,Microsoft Windows,true,The file is signed and the signature was verified.,Microsoft Windows Verification PCA
WW0004GOO,napagent,0,Network Access Protection Agent,The Network Access Protection (NAP) agent service collects and manages health information for client computers on a network. Information collected by NAP agent is used to make sure that the client computer has the required software and settings. If a client computer is not compliant with health policy  it can be provided with restricted network access until its configuration is updated. Depending on the configuration of health policy  client computers might be automatically updated so that users quickly regain full network access without having to manually update their computer.,C:\Windows\System32\svchost.exe,793714f016df50c2502afb5bd60031fb,C:\Windows\System32\svchost.exe -k NetworkService,Microsoft Windows,true,The file is signed and the signature was verified.,Microsoft Windows Verification PCA
WW0004GOO,pcw,0,Performance Counters for Windows Driver,,C:\Windows\System32\drivers\pcw.sys,a6afe902b00b4fb537427bcc02846d95,\SystemRoot\System32\drivers\pcw.sys,Microsoft Windows,true,The file is signed and the signature was verified.,Microsoft Windows Verification PCA
WW0004GOO,KSecPkg,0,KSecPkg,,C:\Windows\System32\drivers\ksecpkg.sys,9ddd64d2c052520a14c7849aaeaaa34d,\SystemRoot\System32\Drivers\ksecpkg.sys,Microsoft Windows,true,The file is signed and the signature was verified.,Microsoft Windows Verification PCA
WW0004GOO,gpsvc,968,Group Policy Client,The service is responsible for applying settings configured by administrators for the computer and users through the Group Policy component. If the service is stopped or disabled  the settings will not be applied and applications and components will not be manageable through Group Policy. Any components or applications that depend on the Group Policy component might not be functional if the service is stopped or disabled.,C:\Windows\System32\svchost.exe,793714f016df50c2502afb5bd60031fb,C:\Windows\system32\svchost.exe -k netsvcs,Microsoft Windows,true,The file is signed and the signature was verified.,Microsoft Windows Verification PCA
WW0004GOO,WdiServiceHost,0,Diagnostic Service Host,The Diagnostic Service Host is used by the Diagnostic Policy Service to host diagnostics that need to run in a Local Service context.  If this service is stopped  any diagnostics that depend on it will no longer function.,C:\Windows\System32\svchost.exe,793714f016df50c2502afb5bd60031fb,C:\Windows\System32\svchost.exe -k LocalService,Microsoft Windows,true,The file is signed and the signature was verified.,Microsoft Windows Verification PCA
WW0004GOO,LanmanWorkstation,852,Workstation,Creates and maintains client network connections to remote servers using the SMB protocol. If this service is stopped  these connections will be unavailable. If this service is disabled  any services that explicitly depend on it will fail to start.,C:\Windows\System32\svchost.exe,793714f016df50c2502afb5bd60031fb,C:\Windows\System32\svchost.exe -k NetworkService,Microsoft Windows,true,The file is signed and the signature was verified.,Microsoft Windows Verification PCA
WW0004GOO,NlaSvc,852,Network Location Awareness,Collects and stores configuration information for the network and notifies programs when this information is modified. If this service is stopped  configuration information might be unavailable. If this service is disabled  any services that explicitly depend on it will fail to start.,C:\Windows\System32\svchost.exe,793714f016df50c2502afb5bd60031fb,C:\Windows\System32\svchost.exe -k NetworkService,Microsoft Windows,true,The file is signed and the signature was verified.,Microsoft Windows Verification PCA
WW0004GOO,BrUsbMdm,0,Brother MFC USB Fax Only Modem,,C:\Windows\System32\drivers\BrUsbMdm.sys,20dfcc0ebf04d1e7b8b3e6ed6997c3c0,\SystemRoot\System32\Drivers\BrUsbMdm.sys,Microsoft Windows,true,The file is signed and the signature was verified.,Microsoft Windows Verification PCA
WW0004GOO,MSiSCSI,0,Microsoft iSCSI Initiator Service,Manages Internet SCSI (iSCSI) sessions from this computer to remote iSCSI target devices. If this service is stopped  this computer will not be able to login or access iSCSI targets. If this service is disabled  any services that explicitly depend on it will fail to start.,C:\Windows\System32\svchost.exe,793714f016df50c2502afb5bd60031fb,C:\Windows\system32\svchost.exe -k netsvcs,Microsoft Windows,true,The file is signed and the signature was verified.,Microsoft Windows Verification PCA
WW0004GOO,partmgr,0,Partition Manager,Disk class filter driver that auctions out partitions to volume managers,C:\Windows\System32\drivers\partmgr.sys,dbb8297549ee1a1b8eb47e71c93538dd,\SystemRoot\System32\drivers\partmgr.sys,Microsoft Windows,true,The file is signed and the signature was verified.,Microsoft Windows Verification PCA
WW0004GOO,b57nd60a,0,Broadcom NetXtreme Gigabit Ethernet - NDIS 6.0,,C:\Windows\System32\drivers\b57nd60a.sys,bbbaa56bcc7e2a405ddb0556ef3c3900,system32\DRIVERS\b57nd60a.sys,Microsoft Windows,true,The file is signed and the signature was verified.,Microsoft Windows Verification PCA
WW0004GOO,DiagTrack,1084,Diagnostics Tracking Service,The Diagnostics Tracking Service enables data collection about functional issues in Windows components.,C:\Windows\System32\svchost.exe,793714f016df50c2502afb5bd60031fb,C:\Windows\System32\svchost.exe -k utcsvc,Microsoft Windows,true,The file is signed and the signature was verified.,Microsoft Windows Verification PCA
WW0004GOO,msahci,0,msahci,,C:\Windows\System32\drivers\msahci.sys,cf46bfaf71349aa2b4eb4729689162e6,\SystemRoot\system32\drivers\msahci.sys,Microsoft Windows,true,The file is signed and the signature was verified.,Microsoft Windows Verification PCA
WW0004GOO,PEAUTH,0,PEAUTH,,C:\Windows\System32\drivers\PEAuth.sys,8facaae8ef216576cd467c4116a06a19,system32\drivers\peauth.sys,Microsoft Windows,true,The file is signed and the signature was verified.,Microsoft Windows Verification PCA
WW0004GOO,HidBatt,0,HID UPS Battery Driver,,C:\Windows\System32\drivers\hidbatt.sys,92e4f0981967ada243de687044b1840a,\SystemRoot\system32\drivers\HidBatt.sys,Microsoft Windows,true,The file is signed and the signature was verified.,Microsoft Windows Verification PCA
WW0004GOO,umbus,0,UMBus Enumerator Driver,,C:\Windows\System32\drivers\umbus.sys,15b0e6f6c79fb18951534cd3b35bc5e3,system32\DRIVERS\umbus.sys,Microsoft Windows,true,The file is signed and the signature was verified.,Microsoft Windows Verification PCA
WW0004GOO,UmPass,0,Microsoft UMPass Driver,,C:\Windows\System32\drivers\umpass.sys,c777f6b46258bbf386fb30c85f3d9903,\SystemRoot\system32\drivers\umpass.sys,Microsoft Windows,true,The file is signed and the signature was verified.,Microsoft Windows Verification PCA
WW0004GOO,aliide,0,aliide,,C:\Windows\System32\drivers\aliide.sys,f699ebb37d32dc2f46343edf5db45c79,\SystemRoot\system32\drivers\aliide.sys,Microsoft Windows,true,The file is signed and the signature was verified.,Microsoft Windows Verification PCA
WW0004GOO,rspndr,0,Link-Layer Topology Discovery Responder,,C:\Windows\System32\drivers\rspndr.sys,906903301883c7f1013b3946ed5a0534,system32\DRIVERS\rspndr.sys,Microsoft Windows,true,The file is signed and the signature was verified.,Microsoft Windows Verification PCA
WW0004GOO,HTTP,0,HTTP,This service implements the hypertext transfer protocol (HTTP). If this service is disabled  any services that explicitly depend on it will fail to start.,C:\Windows\System32\drivers\http.sys,ff6629348590f25613f5eb26b4be7b65,system32\drivers\HTTP.sys,Microsoft Windows,true,The file is signed and the signature was verified.,Microsoft Windows Verification PCA
WW0004GOO,COMSysApp,1656,COM+ System Application,Manages the configuration and tracking of Component Object Model (COM)+-based components. If the service is stopped  most COM+-based components will not function properly. If this service is disabled  any services that explicitly depend on it will fail to start.,C:\Windows\System32\dllhost.exe,24771afbc3615d94711e026f987b90df,C:\Windows\system32\dllhost.exe /Processid:{02D4B3F1-FD88-11D1-960D-00805FC79235},Microsoft Windows,true,The file is signed and the signature was verified.,Microsoft Windows Verification PCA
WW0004GOO,KeyIso,0,CNG Key Isolation,The CNG key isolation service is hosted in the LSA process. The service provides key process isolation to private keys and associated cryptographic operations as required by the Common Criteria. The service stores and uses long-lived keys in a secure process complying with Common Criteria requirements.,C:\Windows\System32\lsass.exe,13849064fb2ebcdc64e5d45fcd171a93,C:\Windows\system32\lsass.exe,Microsoft Windows,true,The file is signed and the signature was verified.,Microsoft Windows Verification PCA
WW0004GOO,AmdK8,0,AMD K8 Processor Driver,,C:\Windows\System32\drivers\amdk8.sys,127ecf55cde9bad213035510c67e3a7c,\SystemRoot\system32\drivers\amdk8.sys,Microsoft Windows,true,The file is signed and the signature was verified.,Microsoft Windows Verification PCA
WW0004GOO,FontCache,828,Windows Font Cache Service,Optimizes performance of applications by caching commonly used font data. Applications will start this service if it is not already running. It can be disabled  though doing so will degrade application performance.,C:\Windows\System32\svchost.exe,793714f016df50c2502afb5bd60031fb,C:\Windows\system32\svchost.exe -k LocalService,Microsoft Windows,true,The file is signed and the signature was verified.,Microsoft Windows Verification PCA
WW0004GOO,SiSRaid2,0,SiSRaid2,,C:\Windows\System32\drivers\sisraid2.sys,7f606ce529b8681615edb3051fc27ac8,\SystemRoot\system32\drivers\SiSRaid2.sys,Microsoft Windows,true,The file is signed and the signature was verified.,Microsoft Windows Verification PCA
WW0004GOO,vga,0,vga,,C:\Windows\System32\drivers\vgapnp.sys,83a29b04930da9fb7492947f36552af3,system32\DRIVERS\vgapnp.sys,Microsoft Windows,true,The file is signed and the signature was verified.,Microsoft Windows Verification PCA
WW0004GOO,BrFiltUp,0,Brother USB Mass-Storage Upper Filter Driver,,C:\Windows\System32\drivers\BrFiltUp.sys,d8f301c2bd0d2ca695276e18c19ace7a,\SystemRoot\system32\drivers\BrFiltUp.sys,Microsoft Windows,true,The file is signed and the signature was verified.,Microsoft Windows Verification PCA
WW0004GOO,mrxsmb,0,SMB MiniRedirector Wrapper and Engine,Implements the framework for the SMB filesystem redirector,C:\Windows\System32\drivers\mrxsmb.sys,59d40d7f7cae7200d40e16e02fb9cbef,system32\DRIVERS\mrxsmb.sys,Microsoft Windows,true,The file is signed and the signature was verified.,Microsoft Windows Verification PCA
WW0004GOO,volmgrx,0,Dynamic Volume Manager,Extension of the volume manager driver that manages software RAID volumes (spanned  striped  mirrored  RAID-5) on dynamic disks,C:\Windows\System32\drivers\volmgrx.sys,6c35f267d7e1a7a200487fa56d5b8cd9,\SystemRoot\System32\drivers\volmgrx.sys,Microsoft Windows,true,The file is signed and the signature was verified.,Microsoft Windows Verification PCA
WW0004GOO,KSecDD,0,KSecDD,,C:\Windows\System32\drivers\ksecdd.sys,7783653e8646bf763c3311ba1f0c9dd6,\SystemRoot\System32\Drivers\ksecdd.sys,Microsoft Windows,true,The file is signed and the signature was verified.,Microsoft Windows Verification PCA
WW0004GOO,DXGKrnl,0,LDDM Graphics Subsystem,Controls the underlying video driver stacks to provide fully-featured display capabilities.,C:\Windows\System32\drivers\dxgkrnl.sys,7714e270703d3b15c780621a34488ea8,\SystemRoot\System32\drivers\dxgkrnl.sys,Microsoft Windows,true,The file is signed and the signature was verified.,Microsoft Windows Verification PCA
WW0004GOO,sacdrv,0,sacdrv,,C:\Windows\System32\drivers\sacdrv.sys,c008d6aca9d2388f32710d029d03c707,\SystemRoot\system32\DRIVERS\sacdrv.sys,Microsoft Windows,true,The file is signed and the signature was verified.,Microsoft Windows Verification PCA
WW0004GOO,Tcpip,0,TCP/IP Protocol Driver,TCP/IP Protocol Driver,C:\Windows\System32\drivers\tcpip.sys,cb67d81d80b5beebf0c24ca6e08cd47d,\SystemRoot\System32\drivers\tcpip.sys,Microsoft Windows,true,The file is signed and the signature was verified.,Microsoft Windows Verification PCA
WW0004GOO,vhdmp,0,vhdmp,,C:\Windows\System32\drivers\vhdmp.sys,dc3215c64487b99d1fc989abe160e9f6,\SystemRoot\system32\drivers\vhdmp.sys,Microsoft Windows,true,The file is signed and the signature was verified.,Microsoft Windows Verification PCA
WW0004GOO,RasAgileVpn,0,WAN Miniport (IKEv2),WAN Miniport (IKEv2),C:\Windows\System32\drivers\agilevpn.sys,31dad24b2c639424b7f88bf283cc1dae,system32\DRIVERS\AgileVpn.sys,Microsoft Windows,true,The file is signed and the signature was verified.,Microsoft Windows Verification PCA
WW0004GOO,pci,0,PCI Bus Driver,,C:\Windows\System32\drivers\pci.sys,7eb763c91e1d5e76fc35652d7ad1df7f,\SystemRoot\system32\drivers\pci.sys,Microsoft Windows,true,The file is signed and the signature was verified.,Microsoft Windows Verification PCA
WW0004GOO,EventSystem,828,COM+ Event System,Supports System Event Notification Service (SENS)  which provides automatic distribution of events to subscribing Component Object Model (COM) components. If the service is stopped  SENS will close and will not be able to provide logon and logoff notifications. If this service is disabled  any services that explicitly depend on it will fail to start.,C:\Windows\System32\svchost.exe,793714f016df50c2502afb5bd60031fb,C:\Windows\system32\svchost.exe -k LocalService,Microsoft Windows,true,The file is signed and the signature was verified.,Microsoft Windows Verification PCA
WW0004GOO,storvsp,0,storvsp,,C:\Windows\System32\drivers\storvsp.sys,3631bb5126836115d0e13d0f8ae4caa6,\SystemRoot\system32\drivers\storvsp.sys,Microsoft Windows,true,The file is signed and the signature was verified.,Microsoft Windows Verification PCA
WW0004GOO,mouhid,0,Mouse HID Driver,,C:\Windows\System32\drivers\mouhid.sys,909199696585743efc3881e9e1e06429,\SystemRoot\system32\drivers\mouhid.sys,Microsoft Windows,true,The file is signed and the signature was verified.,Microsoft Windows Verification PCA
