hostname,name,pid,descriptivename,description,path,pathmd5sum,arguments,pathcertificatesubject,pathsignatureverified,pathsignaturedescription,pathcertificateissuer
WW0004GOO,RasAcd,0,Remote Access Auto Connection Driver,Remote Access Auto Connection Driver,C:\Windows\System32\drivers\rasacd.sys,d9708cc43734015ee77704d04486ee89,System32\DRIVERS\rasacd.sys,Microsoft Windows,true,The file is signed and the signature was verified.,Microsoft Windows Verification PCA
WW0004GOO,aspnet_state,0,ASP.NET State Service,Provides support for out-of-process session states for ASP.NET. If this service is stopped  out-of-process requests will not be processed. If this service is disabled  any services that explicitly depend on it will fail to start.,C:\Windows\Microsoft.NET\Framework64\v4.0.30319\aspnet_state.exe,0a2f0cb91c2841a3b9a956ec3906170a,C:\Windows\Microsoft.NET\Framework64\v4.0.30319\aspnet_state.exe,Microsoft Corporation,true,The file is signed and the signature was verified.,Microsoft Code Signing PCA
WW0004GOO,RasPppoe,0,Remote Access PPPOE Driver,Remote Access PPPOE Driver,C:\Windows\System32\drivers\raspppoe.sys,dc607c8e3f3decadaa34a79be0c03eea,system32\DRIVERS\raspppoe.sys,Microsoft Windows,true,The file is signed and the signature was verified.,Microsoft Windows Verification PCA
WW0004GOO,FCRegSvc,0,Microsoft Fibre Channel Platform Registration Service,Registers the platform with all available Fibre Channel fabrics  and maintains the registrations.,C:\Windows\System32\svchost.exe,793714f016df50c2502afb5bd60031fb,C:\Windows\system32\svchost.exe -k LocalServiceNetworkRestricted,Microsoft Windows,true,The file is signed and the signature was verified.,Microsoft Windows Verification PCA
WW0004GOO,hidserv,0,Human Interface Device Access,Enables generic input access to Human Interface Devices (HID)  which activates and maintains the use of predefined hot buttons on keyboards  remote controls  and other multimedia devices. If this service is stopped  hot buttons controlled by this service will no longer function. If this service is disabled  any services that explicitly depend on it will fail to start.,C:\Windows\System32\svchost.exe,793714f016df50c2502afb5bd60031fb,C:\Windows\system32\svchost.exe -k LocalSystemNetworkRestricted,Microsoft Windows,true,The file is signed and the signature was verified.,Microsoft Windows Verification PCA
WW0004GOO,Wecsvc,0,Windows Event Collector,This service manages persistent subscriptions to events from remote sources that support WS-Management protocol. This includes Windows Vista event logs  hardware and IPMI-enabled event sources. The service stores forwarded events in a local Event Log. If this service is stopped or disabled event subscriptions cannot be created and forwarded events cannot be accepted.,C:\Windows\System32\svchost.exe,793714f016df50c2502afb5bd60031fb,C:\Windows\system32\svchost.exe -k NetworkService,Microsoft Windows,true,The file is signed and the signature was verified.,Microsoft Windows Verification PCA
WW0004GOO,vmbus,0,vmbus,,C:\Windows\System32\drivers\vmbus.sys,d920a74b4ec18ba2090524be92c950ca,\SystemRoot\system32\drivers\vmbus.sys,Microsoft Windows,true,The file is signed and the signature was verified.,Microsoft Windows Verification PCA
WW0004GOO,Appinfo,968,Application Information,Facilitates the running of interactive applications with additional administrative privileges.  If this service is stopped  users will be unable to launch applications with the additional administrative privileges they may require to perform desired user tasks.,C:\Windows\System32\svchost.exe,793714f016df50c2502afb5bd60031fb,C:\Windows\system32\svchost.exe -k netsvcs,Microsoft Windows,true,The file is signed and the signature was verified.,Microsoft Windows Verification PCA
WW0004GOO,BrUsbSer,0,Brother MFC USB Serial WDM Driver,,C:\Windows\System32\drivers\BrUsbSer.sys,d666d96bf028e5e3aa4220549e6f6d7e,\SystemRoot\System32\Drivers\BrUsbSer.sys,Microsoft Windows,true,The file is signed and the signature was verified.,Microsoft Windows Verification PCA
WW0004GOO,WacomPen,0,Wacom Serial Pen HID Driver,,C:\Windows\System32\drivers\wacompen.sys,f67a6b3370ca911a2c349b4fd81d703a,\SystemRoot\system32\drivers\wacompen.sys,Microsoft Windows,true,The file is signed and the signature was verified.,Microsoft Windows Verification PCA
WW0004GOO,WPDBusEnum,0,Portable Device Enumerator Service,Enforces group policy for removable mass-storage devices. Enables applications such as Windows Media Player and Image Import Wizard to transfer and synchronize content using removable mass-storage devices.,C:\Windows\System32\svchost.exe,793714f016df50c2502afb5bd60031fb,C:\Windows\system32\svchost.exe -k LocalSystemNetworkRestricted,Microsoft Windows,true,The file is signed and the signature was verified.,Microsoft Windows Verification PCA
WW0004GOO,tcpipreg,0,TCP/IP Registry Compatibility,Provides compatibility for legacy applications which interact with TCP/IP through the registry. If this service is stopped  certain applications may have impaired functionality.,C:\Windows\System32\drivers\tcpipreg.sys,5556d092782c49a524fd14d819ec0208,System32\drivers\tcpipreg.sys,Microsoft Windows,true,The file is signed and the signature was verified.,Microsoft Windows Verification PCA
WW0004GOO,elxstor,0,elxstor,,C:\Windows\System32\drivers\elxstor.sys,872f90c1e8c65960002204df60038bf6,\SystemRoot\system32\drivers\elxstor.sys,Microsoft Windows,true,The file is signed and the signature was verified.,Microsoft Windows Verification PCA
WW0004GOO,RasAuto,0,Remote Access Auto Connection Manager,Creates a connection to a remote network whenever a program references a remote DNS or NetBIOS name or address.,C:\Windows\System32\svchost.exe,793714f016df50c2502afb5bd60031fb,C:\Windows\System32\svchost.exe -k netsvcs,Microsoft Windows,true,The file is signed and the signature was verified.,Microsoft Windows Verification PCA
WW0004GOO,cdrom,0,cdrom,,C:\Windows\System32\drivers\cdrom.sys,f52ca436dcbcb9972ebe20c018570edb,\SystemRoot\system32\drivers\cdrom.sys,Microsoft Windows,true,The file is signed and the signature was verified.,Microsoft Windows Verification PCA
WW0004GOO,NetBT,0,NetBT,This service implements NetBios over TCP/IP.,C:\Windows\System32\drivers\netbt.sys,798f386446577661f9cbdd00295b1aba,System32\DRIVERS\netbt.sys,Microsoft Windows,true,The file is signed and the signature was verified.,Microsoft Windows Verification PCA
WW0004GOO,nvme,0,nvme,,C:\Windows\System32\drivers\nvme.sys,0f728caa777a6a26172da9310808041d,\SystemRoot\system32\drivers\nvme.sys,Google Inc,true,The file is signed and the signature was verified.,Symantec Class 3 SHA256 Code Signing CA
WW0004GOO,LSI_FC,0,LSI_FC,,C:\Windows\System32\drivers\lsi_fc.sys,d8942aee5b9d20bc4db115af9854060e,\SystemRoot\system32\drivers\lsi_fc.sys,Microsoft Windows,true,The file is signed and the signature was verified.,Microsoft Windows Verification PCA
WW0004GOO,SamSs,460,Security Accounts Manager,The startup of this service signals other services that the Security Accounts Manager (SAM) is ready to accept requests.  Disabling this service will prevent other services in the system from being notified when the SAM is ready  which may in turn cause those services to fail to start correctly. This service should not be disabled.,C:\Windows\System32\lsass.exe,13849064fb2ebcdc64e5d45fcd171a93,C:\Windows\system32\lsass.exe,Microsoft Windows,true,The file is signed and the signature was verified.,Microsoft Windows Verification PCA
WW0004GOO,ACPI,0,Microsoft ACPI Driver,,C:\Windows\System32\drivers\acpi.sys,131ccfcabcf62eacecf39543c96b837c,\SystemRoot\system32\drivers\ACPI.sys,Microsoft Windows,true,The file is signed and the signature was verified.,Microsoft Windows Verification PCA
WW0004GOO,luafv,0,UAC File Virtualization,Virtualizes file write failures to per-user locations.,C:\Windows\System32\drivers\luafv.sys,1e90344565c8c24402fd2fb855ff3776,\SystemRoot\system32\drivers\luafv.sys,Microsoft Windows,true,The file is signed and the signature was verified.,Microsoft Windows Verification PCA
WW0004GOO,HDAudBus,0,Microsoft UAA Bus Driver for High Definition Audio,,C:\Windows\System32\drivers\hdaudbus.sys,c27f602a13280c7eb5ed12c538d23226,\SystemRoot\system32\drivers\HDAudBus.sys,Microsoft Windows,true,The file is signed and the signature was verified.,Microsoft Windows Verification PCA
WW0004GOO,cdfs,0,CD/DVD File System Reader,ISO9660/Joliet File System Reader for CD/DVDs. (Core) (All pieces),C:\Windows\System32\drivers\cdfs.sys,46d87a7131c96d286bce48ea5a358639,system32\DRIVERS\cdfs.sys,Microsoft Windows,true,The file is signed and the signature was verified.,Microsoft Windows Verification PCA
WW0004GOO,msiserver,0,Windows Installer,Adds  modifies  and removes applications provided as a Windows Installer (*.msi) package. If this service is disabled  any services that explicitly depend on it will fail to start.,C:\Windows\System32\msiexec.exe,7ccbd82fb3c2ce8740a077e9cba3533f,C:\Windows\system32\msiexec.exe /V,Microsoft Windows,true,The file is signed and the signature was verified.,Microsoft Windows Verification PCA
WW0004GOO,SCPolicySvc,0,Smart Card Removal Policy,Allows the system to be configured to lock the user desktop upon smart card removal.,C:\Windows\System32\svchost.exe,793714f016df50c2502afb5bd60031fb,C:\Windows\system32\svchost.exe -k netsvcs,Microsoft Windows,true,The file is signed and the signature was verified.,Microsoft Windows Verification PCA
WW0004GOO,RDPDR,0,Terminal Server Device Redirector Driver,,C:\Windows\System32\drivers\rdpdr.sys,bcce2c9f51c74e93baddbec11b42cddd,System32\drivers\rdpdr.sys,Microsoft Windows,true,The file is signed and the signature was verified.,Microsoft Windows Verification PCA
WW0004GOO,kbdhid,0,Keyboard HID Driver,,C:\Windows\System32\drivers\kbdhid.sys,75fae6098d280043fdecb11af3effbed,\SystemRoot\system32\drivers\kbdhid.sys,Microsoft Windows,true,The file is signed and the signature was verified.,Microsoft Windows Verification PCA
WW0004GOO,RemoteAccess,0,Routing and Remote Access,Offers routing services to businesses in local area and wide area network environments.,C:\Windows\System32\svchost.exe,793714f016df50c2502afb5bd60031fb,C:\Windows\System32\svchost.exe -k netsvcs,Microsoft Windows,true,The file is signed and the signature was verified.,Microsoft Windows Verification PCA
WW0004GOO,UmRdpService,244,Remote Desktop Services UserMode Port Redirector,Allows the redirection of Printers/Drives/Ports for RDP connections,C:\Windows\System32\svchost.exe,793714f016df50c2502afb5bd60031fb,C:\Windows\System32\svchost.exe -k LocalSystemNetworkRestricted,Microsoft Windows,true,The file is signed and the signature was verified.,Microsoft Windows Verification PCA
WW0004GOO,LanmanServer,968,Server,Supports file  print  and named-pipe sharing over the network for this computer. If this service is stopped  these functions will be unavailable. If this service is disabled  any services that explicitly depend on it will fail to start.,C:\Windows\System32\svchost.exe,793714f016df50c2502afb5bd60031fb,C:\Windows\system32\svchost.exe -k netsvcs,Microsoft Windows,true,The file is signed and the signature was verified.,Microsoft Windows Verification PCA
WW0004GOO,SessionEnv,968,Remote Desktop Configuration,Remote Desktop Configuration service (RDCS) is responsible for all Remote Desktop Services and Remote Desktop related configuration and session maintenance activities that require SYSTEM context. These include per-session temporary folders  RD themes  and RD certificates.,C:\Windows\System32\svchost.exe,793714f016df50c2502afb5bd60031fb,C:\Windows\System32\svchost.exe -k netsvcs,Microsoft Windows,true,The file is signed and the signature was verified.,Microsoft Windows Verification PCA
WW0004GOO,srv,0,Server SMB 1.xxx Driver,Enables connectivity from Windows XP and earlier clients,C:\Windows\System32\drivers\srv.sys,36fc281fdeb4f7b42d3a799a5a58e0aa,System32\DRIVERS\srv.sys,Microsoft Windows,true,The file is signed and the signature was verified.,Microsoft Windows Verification PCA
WW0004GOO,WIMMount,0,WIMMount,WIM Image mount service driver,C:\Windows\System32\drivers\wimmount.sys,27189600d71bcbcdb0944362a692ccba,system32\drivers\wimmount.sys,Microsoft Windows,true,The file is signed and the signature was verified.,Microsoft Windows Verification PCA
WW0004GOO,usbprint,0,Microsoft USB PRINTER Class,,C:\Windows\System32\drivers\usbprint.sys,1af3ed97b00a769d62a1f8318b6d950c,\SystemRoot\system32\drivers\usbprint.sys,Microsoft Windows,true,The file is signed and the signature was verified.,Microsoft Windows Verification PCA
WW0004GOO,vds,0,Virtual Disk,Provides management services for disks  volumes  file systems  and storage arrays.,C:\Windows\System32\vds.exe,45867cb335adb3f17651e62e3c6e7ade,C:\Windows\System32\vds.exe,Microsoft Windows,true,The file is signed and the signature was verified.,Microsoft Windows Verification PCA
WW0004GOO,ShellHWDetection,968,Shell Hardware Detection,Provides notifications for AutoPlay hardware events.,C:\Windows\System32\svchost.exe,793714f016df50c2502afb5bd60031fb,C:\Windows\System32\svchost.exe -k netsvcs,Microsoft Windows,true,The file is signed and the signature was verified.,Microsoft Windows Verification PCA
WW0004GOO,LSI_SAS2,0,LSI_SAS2,,C:\Windows\System32\drivers\lsi_sas2.sys,f165b2f170552c3f0abf6cb277dc820f,\SystemRoot\system32\drivers\lsi_sas2.sys,Microsoft Windows,true,The file is signed and the signature was verified.,Microsoft Windows Verification PCA
WW0004GOO,blbdrive,0,blbdrive,,C:\Windows\System32\drivers\blbdrive.sys,11119fca3ed8d4253e1917276eed154f,\SystemRoot\system32\drivers\blbdrive.sys,Microsoft Windows,true,The file is signed and the signature was verified.,Microsoft Windows Verification PCA
WW0004GOO,AxInstSV,0,ActiveX Installer (AxInstSV),Provides User Account Control validation for the installation of ActiveX controls from the Internet and enables management of ActiveX control installation based on Group Policy settings. This service is started on demand and if disabled the installation of ActiveX controls will behave according to default browser settings.,C:\Windows\System32\svchost.exe,793714f016df50c2502afb5bd60031fb,C:\Windows\system32\svchost.exe -k AxInstSVGroup,Microsoft Windows,true,The file is signed and the signature was verified.,Microsoft Windows Verification PCA
WW0004GOO,RemoteRegistry,1320,Remote Registry,Enables remote users to modify registry settings on this computer. If this service is stopped  the registry can be modified only by users on this computer. If this service is disabled  any services that explicitly depend on it will fail to start.,C:\Windows\System32\svchost.exe,793714f016df50c2502afb5bd60031fb,C:\Windows\system32\svchost.exe -k regsvc,Microsoft Windows,true,The file is signed and the signature was verified.,Microsoft Windows Verification PCA
WW0004GOO,vdrvroot,0,Microsoft Virtual Drive Enumerator Driver,,C:\Windows\System32\drivers\vdrvroot.sys,461c20fda5beb82c115fb6666623282c,\SystemRoot\system32\drivers\vdrvroot.sys,Microsoft Windows,true,The file is signed and the signature was verified.,Microsoft Windows Verification PCA
WW0004GOO,rdbss,0,Redirected Buffering Sub Sysytem,Provides the framework for network mini-redirectors,C:\Windows\System32\drivers\rdbss.sys,dff537381e99c809983a25804e3a9a69,system32\DRIVERS\rdbss.sys,Microsoft Windows,true,The file is signed and the signature was verified.,Microsoft Windows Verification PCA
WW0004GOO,GoogleVssProvider,1264,GoogleVssProvider,Google Vss Hardware Provider,C:\Windows\System32\dllhost.exe,24771afbc3615d94711e026f987b90df,C:\Windows\system32\dllhost.exe /Processid:{3EAE8C5E-B51F-4CBD-9DCE-FA6AA0BDF8B8},Microsoft Windows,true,The file is signed and the signature was verified.,Microsoft Windows Verification PCA
WW0004GOO,usbohci,0,Microsoft USB Open Host Controller Miniport Driver,,C:\Windows\System32\drivers\usbohci.sys,5aad06c8a51c9f669e9020480a78e487,\SystemRoot\system32\drivers\usbohci.sys,Microsoft Windows,true,The file is signed and the signature was verified.,Microsoft Windows Verification PCA
WW0004GOO,usbuhci,0,Microsoft USB Universal Host Controller Miniport Driver,,C:\Windows\System32\drivers\usbuhci.sys,f1012f7cb5fa3281e156aca5687e6bc9,\SystemRoot\system32\drivers\usbuhci.sys,Microsoft Windows,true,The file is signed and the signature was verified.,Microsoft Windows Verification PCA
WW0004GOO,megasas,0,megasas,,C:\Windows\System32\drivers\megasas.sys,4c99e85d7af68765ac1d5453bad78a96,\SystemRoot\system32\drivers\megasas.sys,Microsoft Windows,true,The file is signed and the signature was verified.,Microsoft Windows Verification PCA
WW0004GOO,rdpbus,0,Remote Desktop Device Redirector Bus Driver,,C:\Windows\System32\drivers\rdpbus.sys,90cd79b3e6bc539abd1f81a3ff414bad,\SystemRoot\system32\drivers\rdpbus.sys,Microsoft Windows,true,The file is signed and the signature was verified.,Microsoft Windows Verification PCA
WW0004GOO,NDIS,0,NDIS System Driver,NDIS System Driver,C:\Windows\System32\drivers\ndis.sys,7dfd0da497f2afecbcfbc625849bb559,\SystemRoot\system32\drivers\ndis.sys,Microsoft Windows,true,The file is signed and the signature was verified.,Microsoft Windows Verification PCA
WW0004GOO,RDPENCDD,0,RDP Encoder Mirror Driver,RDP Encoder Mirror Driver,C:\Windows\System32\drivers\RDPENCDD.sys,0e9a0b5b106f1ebc56068a2e6a79b1f9,system32\drivers\rdpencdd.sys,Microsoft Windows,true,The file is signed and the signature was verified.,Microsoft Windows Verification PCA
WW0004GOO,WinRM,852,Windows Remote Management (WS-Management),Windows Remote Management (WinRM) service implements the WS-Management protocol for remote management. WS-Management is a standard web services protocol used for remote software and hardware management. The WinRM service listens on the network for WS-Management requests and processes them. The WinRM Service needs to be configured with a listener using winrm.cmd command line tool or through Group Policy in order for it to listen over the network. The WinRM service provides access to WMI data and enables event collection. Event collection and subscription to events require that the service is running. WinRM messages use HTTP and HTTPS as transports. The WinRM service does not depend on IIS but is preconfigured to share a port with IIS on the same machine.  The WinRM service reserves the /wsman URL prefix. To prevent conflicts with IIS  administrators should ensure that any websites hosted on IIS do not use the /wsman URL prefix.,C:\Windows\System32\svchost.exe,793714f016df50c2502afb5bd60031fb,C:\Windows\System32\svchost.exe -k NetworkService,Microsoft Windows,true,The file is signed and the signature was verified.,Microsoft Windows Verification PCA
WW0004GOO,IpFilterDriver,0,IP Traffic Filter Driver,IP Traffic Filter Driver,C:\Windows\System32\drivers\ipfltdrv.sys,51589f1efbdfa1e5a28d3ef736c1ab36,system32\DRIVERS\ipfltdrv.sys,Microsoft Windows,true,The file is signed and the signature was verified.,Microsoft Windows Verification PCA
WW0004GOO,SNMPTRAP,0,SNMP Trap,Receives trap messages generated by local or remote Simple Network Management Protocol (SNMP) agents and forwards the messages to SNMP management programs running on this computer. If this service is stopped  SNMP-based programs on this computer will not receive SNMP trap messages. If this service is disabled  any services that explicitly depend on it will fail to start.,C:\Windows\System32\snmptrap.exe,c1cb17b3ccacf109da74198509f8f671,C:\Windows\System32\snmptrap.exe,Microsoft Windows,true,The file is signed and the signature was verified.,Microsoft Windows Verification PCA
WW0004GOO,AudioEndpointBuilder,0,Windows Audio Endpoint Builder,Manages audio devices for the Windows Audio service.  If this service is stopped  audio devices and effects will not function properly.  If this service is disabled  any services that explicitly depend on it will fail to start,C:\Windows\System32\svchost.exe,793714f016df50c2502afb5bd60031fb,C:\Windows\System32\svchost.exe -k LocalSystemNetworkRestricted,Microsoft Windows,true,The file is signed and the signature was verified.,Microsoft Windows Verification PCA
WW0004GOO,mrxsmb10,0,SMB 1.x MiniRedirector,Implements the SMB 1.x (CIFS) protocol. This protocol provides connectivity to network resources on pre-Windows Vista servers,C:\Windows\System32\drivers\mrxsmb10.sys,044cf8a683b54ccce6eaebd2cd04e06d,system32\DRIVERS\mrxsmb10.sys,Microsoft Windows,true,The file is signed and the signature was verified.,Microsoft Windows Verification PCA
WW0004GOO,BITS,968,Background Intelligent Transfer Service,Transfers files in the background using idle network bandwidth. If the service is disabled  then any applications that depend on BITS  such as Windows Update or MSN Explorer  will be unable to automatically download programs and other information.,C:\Windows\System32\svchost.exe,793714f016df50c2502afb5bd60031fb,C:\Windows\System32\svchost.exe -k netsvcs,Microsoft Windows,true,The file is signed and the signature was verified.,Microsoft Windows Verification PCA
WW0004GOO,FileInfo,0,File Information FS MiniFilter,Collects information about files in memory to be consumed by other system services.,C:\Windows\System32\drivers\fileinfo.sys,60053bc2ec650106dd402c2e26a31a47,system32\drivers\fileinfo.sys,Microsoft Windows,true,The file is signed and the signature was verified.,Microsoft Windows Verification PCA
WW0004GOO,sfloppy,0,High-Capacity Floppy Disk Drive,,C:\Windows\System32\drivers\sfloppy.sys,177282fdc4e67563874fa89be99ad5fa,\SystemRoot\system32\drivers\sfloppy.sys,Microsoft Windows,true,The file is signed and the signature was verified.,Microsoft Windows Verification PCA
WW0004GOO,HidUsb,0,Microsoft HID Class Driver,,C:\Windows\System32\drivers\hidusb.sys,7fe365f85b09a754b49f49251230b1d5,\SystemRoot\system32\drivers\hidusb.sys,Microsoft Windows,true,The file is signed and the signature was verified.,Microsoft Windows Verification PCA
WW0004GOO,TDPIPE,0,TDPIPE,,C:\Windows\System32\drivers\tdpipe.sys,4d7be9c841244d2613862b6cf95e1595,system32\drivers\tdpipe.sys,Microsoft Windows,true,The file is signed and the signature was verified.,Microsoft Windows Verification PCA
WW0004GOO,Dnscache,852,DNS Client,The DNS Client service (dnscache) caches Domain Name System (DNS) names and registers the full computer name for this computer. If the service is stopped  DNS names will continue to be resolved. However  the results of DNS name queries will not be cached and the computer's name will not be registered. If the service is disabled  any services that explicitly depend on it will fail to start.,C:\Windows\System32\svchost.exe,793714f016df50c2502afb5bd60031fb,C:\Windows\system32\svchost.exe -k NetworkService,Microsoft Windows,true,The file is signed and the signature was verified.,Microsoft Windows Verification PCA
WW0004GOO,FDResPub,0,Function Discovery Resource Publication,Publishes this computer and resources attached to this computer so they can be discovered over the network.  If this service is stopped  network resources will no longer be published and they will not be discovered by other computers on the network.,C:\Windows\System32\svchost.exe,793714f016df50c2502afb5bd60031fb,C:\Windows\system32\svchost.exe -k LocalServiceAndNoImpersonation,Microsoft Windows,true,The file is signed and the signature was verified.,Microsoft Windows Verification PCA
WW0004GOO,Mup,0,Mup,Multiple UNC Provider Driver,C:\Windows\System32\drivers\mup.sys,4dad34db239f4f851b5ab4f9e5de30a5,\SystemRoot\System32\Drivers\mup.sys,Microsoft Windows,true,The file is signed and the signature was verified.,Microsoft Windows Verification PCA
WW0004GOO,CNG,0,CNG,,C:\Windows\System32\drivers\cng.sys,d65ebd3d723ef9817d8e046a32d6ecdd,\SystemRoot\System32\Drivers\cng.sys,Microsoft Windows,true,The file is signed and the signature was verified.,Microsoft Windows Verification PCA
WW0004GOO,pcmcia,0,pcmcia,,C:\Windows\System32\drivers\pcmcia.sys,930d9b9f1a0af63fc38929a3d60ef862,\SystemRoot\system32\drivers\pcmcia.sys,Microsoft Windows,true,The file is signed and the signature was verified.,Microsoft Windows Verification PCA
WW0004GOO,Winmgmt,968,Windows Management Instrumentation,Provides a common interface and object model to access management information about operating system  devices  applications and services. If this service is stopped  most Windows-based software will not function properly. If this service is disabled  any services that explicitly depend on it will fail to start.,C:\Windows\System32\svchost.exe,793714f016df50c2502afb5bd60031fb,C:\Windows\system32\svchost.exe -k netsvcs,Microsoft Windows,true,The file is signed and the signature was verified.,Microsoft Windows Verification PCA
WW0004GOO,FltMgr,0,FltMgr,File System Filter Manager Driver,C:\Windows\System32\drivers\fltMgr.sys,a6a9556a9fc19b123678b1ce9a3af9e0,\SystemRoot\system32\drivers\fltmgr.sys,Microsoft Windows,true,The file is signed and the signature was verified.,Microsoft Windows Verification PCA
WW0004GOO,TsUsbFlt,0,TsUsbFlt,Remote Desktop USB Hub Class Filter Driver,C:\Windows\System32\drivers\TsUsbFlt.sys,b8e25899f05ab7980960318ca3147988,system32\drivers\tsusbflt.sys,Microsoft Windows,true,The file is signed and the signature was verified.,Microsoft Windows Verification PCA
WW0004GOO,RpcSs,632,Remote Procedure Call (RPC),The RPCSS service is the Service Control Manager for COM and DCOM servers. It performs object activations requests  object exporter resolutions and distributed garbage collection for COM and DCOM servers. If this service is stopped or disabled  programs using COM or DCOM will not function properly. It is strongly recommended that you have the RPCSS service running,C:\Windows\System32\svchost.exe,793714f016df50c2502afb5bd60031fb,C:\Windows\system32\svchost.exe -k rpcss,Microsoft Windows,true,The file is signed and the signature was verified.,Microsoft Windows Verification PCA
