hostname,name,pid,descriptivename,description,path,pathmd5sum,arguments,pathcertificatesubject,pathsignatureverified,pathsignaturedescription,pathcertificateissuer
WW0004GOO,mountmgr,0,Mount Point Manager,Driver responsible with maintaining persistent drive letters and names for volumes,C:\Windows\System32\drivers\mountmgr.sys,0e6d3014b8107309e86635f47303ef33,\SystemRoot\System32\drivers\mountmgr.sys,Microsoft Windows,true,The file is signed and the signature was verified.,Microsoft Windows Verification PCA
WW0004GOO,pciide,0,pciide,,C:\Windows\System32\drivers\pciide.sys,0391fb1b32fc93c9411f59e65cd6b8d4,\SystemRoot\system32\drivers\pciide.sys,Microsoft Windows,true,The file is signed and the signature was verified.,Microsoft Windows Verification PCA
WW0004GOO,sppuinotify,0,SPP Notification Service,Provides Software Licensing activation and notification,C:\Windows\System32\svchost.exe,793714f016df50c2502afb5bd60031fb,C:\Windows\system32\svchost.exe -k LocalService,Microsoft Windows,true,The file is signed and the signature was verified.,Microsoft Windows Verification PCA
WW0004GOO,NetPipeActivator,0,Net.Pipe Listener Adapter,Receives activation requests over the net.pipe protocol and passes them to the Windows Process Activation Service.,C:\Windows\Microsoft.NET\Framework64\v4.0.30319\SMSvcHost.exe,af3fe4d7fa33996cafbdd30da439d509,C:\Windows\Microsoft.NET\Framework64\v4.0.30319\SMSvcHost.exe,Microsoft Corporation,true,The file is signed and the signature was verified.,Microsoft Code Signing PCA
WW0004GOO,PerfHost,0,Performance Counter DLL Host,Enables remote users and 64-bit processes to query performance counters provided by 32-bit DLLs. If this service is stopped  only local users and 32-bit processes will be able to query performance counters provided by 32-bit DLLs.,C:\Windows\SysWOW64\perfhost.exe,71b563e3c1b85ea30589d919745cb23e,C:\Windows\SysWow64\perfhost.exe,Microsoft Windows,true,The file is signed and the signature was verified.,Microsoft Windows Verification PCA
WW0004GOO,AeLookupSvc,968,Application Experience,Processes application compatibility cache requests for applications as they are launched,C:\Windows\System32\svchost.exe,793714f016df50c2502afb5bd60031fb,C:\Windows\system32\svchost.exe -k netsvcs,Microsoft Windows,true,The file is signed and the signature was verified.,Microsoft Windows Verification PCA
WW0004GOO,arcsas,0,arcsas,,C:\Windows\System32\drivers\arcsas.sys,43aad2f3caccbd5c335b6978a8e59c03,\SystemRoot\system32\drivers\arcsas.sys,Microsoft Windows,true,The file is signed and the signature was verified.,Microsoft Windows Verification PCA
WW0004GOO,kbdclass,0,Keyboard Class Driver,,C:\Windows\System32\drivers\kbdclass.sys,72d2c64577a759ae229d12353890cad1,\SystemRoot\system32\drivers\kbdclass.sys,Microsoft Windows,true,The file is signed and the signature was verified.,Microsoft Windows Verification PCA
WW0004GOO,ALG,0,Application Layer Gateway Service,Provides support for 3rd party protocol plug-ins for Internet Connection Sharing,C:\Windows\System32\alg.exe,ad38242f35db32d0eafd328e90cfc895,C:\Windows\System32\alg.exe,Microsoft Windows,true,The file is signed and the signature was verified.,Microsoft Windows Verification PCA
WW0004GOO,PptpMiniport,0,WAN Miniport (PPTP),WAN Miniport (PPTP),C:\Windows\System32\drivers\raspptp.sys,dadde49f357e38d9af13b2ef7f36f8dc,system32\DRIVERS\raspptp.sys,Microsoft Windows,true,The file is signed and the signature was verified.,Microsoft Windows Verification PCA
WW0004GOO,CompositeBus,0,Composite Bus Enumerator Driver,,C:\Windows\System32\drivers\CompositeBus.sys,e28bdb3b3560362bf8df7d8a6f644a0c,\SystemRoot\system32\drivers\CompositeBus.sys,Microsoft Windows,true,The file is signed and the signature was verified.,Microsoft Windows Verification PCA
WW0004GOO,pla,0,Performance Logs &amp; Alerts,Performance Logs and Alerts Collects performance data from local or remote computers based on preconfigured schedule parameters  then writes the data to a log or triggers an alert. If this service is stopped  performance information will not be collected. If this service is disabled  any services that explicitly depend on it will fail to start.,C:\Windows\System32\svchost.exe,793714f016df50c2502afb5bd60031fb,C:\Windows\System32\svchost.exe -k LocalServiceNoNetwork,Microsoft Windows,true,The file is signed and the signature was verified.,Microsoft Windows Verification PCA
WW0004GOO,IEEtwCollectorService,0,Internet Explorer ETW Collector Service,ETW Collector Service for Internet Explorer. When running  this service collects real time ETW events and processes them.,C:\Windows\System32\IEEtwCollector.exe,b4089658438a4630711b343dd6737fdc,C:\Windows\system32\IEEtwCollector.exe /V,Microsoft Windows,true,The file is signed and the signature was verified.,Microsoft Windows Verification PCA
WW0004GOO,UxSms,244,Desktop Window Manager Session Manager,Provides Desktop Window Manager startup and maintenance services,C:\Windows\System32\svchost.exe,793714f016df50c2502afb5bd60031fb,C:\Windows\System32\svchost.exe -k LocalSystemNetworkRestricted,Microsoft Windows,true,The file is signed and the signature was verified.,Microsoft Windows Verification PCA
WW0004GOO,AppID,0,AppID Driver,Identifies an application and enforces software restriction policies.,C:\Windows\System32\drivers\appid.sys,abe1f198b448ccafc550993e34b3b252,\SystemRoot\system32\drivers\appid.sys,Microsoft Windows,true,The file is signed and the signature was verified.,Microsoft Windows Verification PCA
WW0004GOO,KtmRm,0,KtmRm for Distributed Transaction Coordinator,Coordinates transactions between the Distributed Transaction Coordinator (MSDTC) and the Kernel Transaction Manager (KTM). If it is not needed  it is recommended that this service remain stopped. If it is needed  both MSDTC and KTM will start this service automatically. If this service is disabled  any MSDTC transaction interacting with a Kernel Resource Manager will fail and any services that explicitly depend on it will fail to start.,C:\Windows\System32\svchost.exe,793714f016df50c2502afb5bd60031fb,C:\Windows\System32\svchost.exe -k NetworkServiceAndNoImpersonation,Microsoft Windows,true,The file is signed and the signature was verified.,Microsoft Windows Verification PCA
WW0004GOO,CertPropSvc,968,Certificate Propagation,Copies user certificates and root certificates from smart cards into the current user's certificate store  detects when a smart card is inserted into a smart card reader  and  if needed  installs the smart card Plug and Play minidriver.,C:\Windows\System32\svchost.exe,793714f016df50c2502afb5bd60031fb,C:\Windows\system32\svchost.exe -k netsvcs,Microsoft Windows,true,The file is signed and the signature was verified.,Microsoft Windows Verification PCA
WW0004GOO,Spooler,1052,Print Spooler,Loads files to memory for later printing,C:\Windows\System32\spoolsv.exe,85535ed171cf231164ffc2cef4a136c3,C:\Windows\System32\spoolsv.exe,Microsoft Windows,true,The file is signed and the signature was verified.,Microsoft Windows Verification PCA
WW0004GOO,MegaSR,0,MegaSR,,C:\Windows\System32\drivers\MegaSR.sys,b7ca6acdbff1f3111ec7e4011975d1c1,\SystemRoot\system32\drivers\MegaSR.sys,Microsoft Windows,true,The file is signed and the signature was verified.,Microsoft Windows Verification PCA
WW0004GOO,AsyncMac,0,RAS Asynchronous Media Driver,RAS Asynchronous Media Driver,C:\Windows\System32\drivers\asyncmac.sys,399142799793ea9247bc795657b7d822,system32\DRIVERS\asyncmac.sys,Microsoft Windows,true,The file is signed and the signature was verified.,Microsoft Windows Verification PCA
WW0004GOO,adpahci,0,adpahci,,C:\Windows\System32\drivers\adpahci.sys,4d2c76e7da4b06ca524893041acef5f0,\SystemRoot\system32\drivers\adpahci.sys,Microsoft Windows,true,The file is signed and the signature was verified.,Microsoft Windows Verification PCA
WW0004GOO,EFS,0,Encrypting File System (EFS),Provides the core file encryption technology used to store encrypted files on NTFS file system volumes. If this service is stopped or disabled  applications will be unable to access encrypted files.,C:\Windows\System32\lsass.exe,13849064fb2ebcdc64e5d45fcd171a93,C:\Windows\System32\lsass.exe,Microsoft Windows,true,The file is signed and the signature was verified.,Microsoft Windows Verification PCA
WW0004GOO,ProfSvc,968,User Profile Service,This service is responsible for loading and unloading user profiles. If this service is stopped or disabled  users will no longer be able to successfully logon or logoff  applications may have problems getting to users' data  and components registered to receive profile event notifications will not receive them.,C:\Windows\System32\svchost.exe,793714f016df50c2502afb5bd60031fb,C:\Windows\system32\svchost.exe -k netsvcs,Microsoft Windows,true,The file is signed and the signature was verified.,Microsoft Windows Verification PCA
WW0004GOO,SENS,968,System Event Notification Service,Monitors system events and notifies subscribers to COM+ Event System of these events.,C:\Windows\System32\svchost.exe,793714f016df50c2502afb5bd60031fb,C:\Windows\system32\svchost.exe -k netsvcs,Microsoft Windows,true,The file is signed and the signature was verified.,Microsoft Windows Verification PCA
WW0004GOO,NetBIOS,0,NetBIOS Interface,NetBIOS Interface,C:\Windows\System32\drivers\netbios.sys,20d04839ecf1c615b0af7318556f559b,system32\DRIVERS\netbios.sys,Microsoft Windows,true,The file is signed and the signature was verified.,Microsoft Windows Verification PCA
WW0004GOO,volsnap,0,Storage volumes,,C:\Windows\System32\drivers\volsnap.sys,19fc1824d69eb1bb6ff304d2de233f9d,\SystemRoot\system32\drivers\volsnap.sys,Microsoft Windows,true,The file is signed and the signature was verified.,Microsoft Windows Verification PCA
WW0004GOO,BrSerWdm,0,Brother WDM Serial driver,,C:\Windows\System32\drivers\BrSerWdm.sys,a49279dae8b24011f44fbc908dba624e,\SystemRoot\System32\Drivers\BrSerWdm.sys,Microsoft Windows,true,The file is signed and the signature was verified.,Microsoft Windows Verification PCA
WW0004GOO,NetMsmqActivator,0,Net.Msmq Listener Adapter,Receives activation requests over the net.msmq and msmq.formatname protocols and passes them to the Windows Process Activation Service.,C:\Windows\Microsoft.NET\Framework64\v4.0.30319\SMSvcHost.exe,af3fe4d7fa33996cafbdd30da439d509,C:\Windows\Microsoft.NET\Framework64\v4.0.30319\SMSvcHost.exe -NetMsmqActivator,Microsoft Corporation,true,The file is signed and the signature was verified.,Microsoft Code Signing PCA
WW0004GOO,iaStorV,0,iaStorV,,C:\Windows\System32\drivers\iaStorV.sys,a52955eb1512f073ed2dacba059fc46e,\SystemRoot\system32\drivers\iaStorV.sys,Microsoft Windows,true,The file is signed and the signature was verified.,Microsoft Windows Verification PCA
WW0004GOO,WdiSystemHost,244,Diagnostic System Host,The Diagnostic System Host is used by the Diagnostic Policy Service to host diagnostics that need to run in a Local System context.  If this service is stopped  any diagnostics that depend on it will no longer function.,C:\Windows\System32\svchost.exe,793714f016df50c2502afb5bd60031fb,C:\Windows\System32\svchost.exe -k LocalSystemNetworkRestricted,Microsoft Windows,true,The file is signed and the signature was verified.,Microsoft Windows Verification PCA
WW0004GOO,lmhosts,932,TCP/IP NetBIOS Helper,Provides support for the NetBIOS over TCP/IP (NetBT) service and NetBIOS name resolution for clients on the network  therefore enabling users to share files  print  and log on to the network. If this service is stopped  these functions might be unavailable. If this service is disabled  any services that explicitly depend on it will fail to start.,C:\Windows\System32\svchost.exe,793714f016df50c2502afb5bd60031fb,C:\Windows\system32\svchost.exe -k LocalServiceNetworkRestricted,Microsoft Windows,true,The file is signed and the signature was verified.,Microsoft Windows Verification PCA
WW0004GOO,tssecsrv,0,Remote Desktop Services Security Filter Driver,Remote Desktop Services Security Filter Driver,C:\Windows\System32\drivers\tssecsrv.sys,65fbfb45ce3045da9a40aaf50d7ec120,System32\DRIVERS\tssecsrv.sys,Microsoft Windows,true,The file is signed and the signature was verified.,Microsoft Windows Verification PCA
WW0004GOO,clr_optimization_v4.0.30319_32,0,Microsoft .NET Framework NGEN v4.0.30319_X86,Microsoft .NET Framework NGEN,C:\Windows\Microsoft.NET\Framework\v4.0.30319\mscorsvw.exe,b27f709ae1344cf59ea8f7bc324c7f05,C:\Windows\Microsoft.NET\Framework\v4.0.30319\mscorsvw.exe,Microsoft Dynamic Code Publisher,true,The file is signed and the signature was verified.,Microsoft Code Signing PCA
WW0004GOO,TCPIP6,0,Microsoft IPv6 Protocol Driver,Microsoft IPv6 Protocol Driver,C:\Windows\System32\drivers\tcpip.sys,cb67d81d80b5beebf0c24ca6e08cd47d,system32\DRIVERS\tcpip.sys,Microsoft Windows,true,The file is signed and the signature was verified.,Microsoft Windows Verification PCA
WW0004GOO,sffdisk,0,SFF Storage Class Driver,,C:\Windows\System32\drivers\sffdisk.sys,0a847898842c81ecc0810f6ae6ea53ad,\SystemRoot\system32\drivers\sffdisk.sys,Microsoft Windows,true,The file is signed and the signature was verified.,Microsoft Windows Verification PCA
WW0004GOO,Brserid,0,Brother MFC Serial Port Interface Driver (WDM),,C:\Windows\System32\drivers\BrSerId.sys,7f38f116a18bd4546d817be2f65d0c94,\SystemRoot\System32\Drivers\Brserid.sys,Microsoft Windows,true,The file is signed and the signature was verified.,Microsoft Windows Verification PCA
WW0004GOO,WerSvc,0,Windows Error Reporting Service,Allows errors to be reported when programs stop working or responding and allows existing solutions to be delivered. Also allows logs to be generated for diagnostic and repair services. If this service is stopped  error reporting might not work correctly and results of diagnostic services and repairs might not be displayed.,C:\Windows\System32\svchost.exe,793714f016df50c2502afb5bd60031fb,C:\Windows\System32\svchost.exe -k WerSvcGroup,Microsoft Windows,true,The file is signed and the signature was verified.,Microsoft Windows Verification PCA
WW0004GOO,Serenum,0,Serenum Filter Driver,,C:\Windows\System32\drivers\serenum.sys,5f1f0fe4d25e1144093ad417fe031bbe,\SystemRoot\system32\drivers\serenum.sys,Microsoft Windows,true,The file is signed and the signature was verified.,Microsoft Windows Verification PCA
WW0004GOO,nvraid,0,nvraid,,C:\Windows\System32\drivers\nvraid.sys,fd3592d60f944318b9df6a898ac98bd6,\SystemRoot\system32\drivers\nvraid.sys,Microsoft Windows,true,The file is signed and the signature was verified.,Microsoft Windows Verification PCA
WW0004GOO,UI0Detect,0,Interactive Services Detection,Enables user notification of user input for interactive services  which enables access to dialogs created by interactive services when they appear. If this service is stopped  notifications of new interactive service dialogs will no longer function and there might not be access to interactive service dialogs. If this service is disabled  both notifications of and access to new interactive service dialogs will no longer function.,C:\Windows\System32\UI0Detect.exe,83faaad8083058bccc9681359895c32c,C:\Windows\system32\UI0Detect.exe,Microsoft Windows,true,The file is signed and the signature was verified.,Microsoft Windows Verification PCA
WW0004GOO,CmBatt,0,Microsoft ACPI Control Method Battery Driver,,C:\Windows\System32\drivers\CmBatt.sys,1a3a0b383d1173e45371773be8ce365e,\SystemRoot\system32\drivers\CmBatt.sys,Microsoft Windows,true,The file is signed and the signature was verified.,Microsoft Windows Verification PCA
WW0004GOO,fdPHost,0,Function Discovery Provider Host,The FDPHOST service hosts the Function Discovery (FD) network discovery providers. These FD providers supply network discovery services for the Simple Services Discovery Protocol (SSDP) and Web Services  Discovery (WS-D) protocol. Stopping or disabling the FDPHOST service will disable network discovery for these protocols when using FD. When this service is unavailable  network services using FD and relying on these discovery protocols will be unable to find network devices or resources.,C:\Windows\System32\svchost.exe,793714f016df50c2502afb5bd60031fb,C:\Windows\system32\svchost.exe -k LocalService,Microsoft Windows,true,The file is signed and the signature was verified.,Microsoft Windows Verification PCA
WW0004GOO,nsiproxy,0,NSI proxy service driver.,NSI proxy service.,C:\Windows\System32\drivers\nsiproxy.sys,2410129e18a042851c03b432c6aac884,system32\drivers\nsiproxy.sys,Microsoft Windows,true,The file is signed and the signature was verified.,Microsoft Windows Verification PCA
WW0004GOO,RpcEptMapper,632,RPC Endpoint Mapper,Resolves RPC interfaces identifiers to transport endpoints. If this service is stopped or disabled  programs using Remote Procedure Call (RPC) services will not function properly.,C:\Windows\System32\svchost.exe,793714f016df50c2502afb5bd60031fb,C:\Windows\system32\svchost.exe -k RPCSS,Microsoft Windows,true,The file is signed and the signature was verified.,Microsoft Windows Verification PCA
WW0004GOO,dmvsc,0,dmvsc,,C:\Windows\System32\drivers\dmvsc.sys,e1783cd6028b4793bd97e484a11cf726,\SystemRoot\system32\drivers\dmvsc.sys,Microsoft Windows,true,The file is signed and the signature was verified.,Microsoft Windows Verification PCA
WW0004GOO,hkmsvc,0,Health Key and Certificate Management,Provides X.509 certificate and key management services for the Network Access Protection Agent (NAPAgent). Enforcement technologies that use X.509 certificates may not function properly without this service,C:\Windows\System32\svchost.exe,793714f016df50c2502afb5bd60031fb,C:\Windows\System32\svchost.exe -k netsvcs,Microsoft Windows,true,The file is signed and the signature was verified.,Microsoft Windows Verification PCA
WW0004GOO,TermService,2224,Remote Desktop Services,Allows users to connect interactively to a remote computer. Remote Desktop and Remote Desktop Session Host Server depend on this service.  To prevent remote use of this computer  clear the checkboxes on the Remote tab of the System properties control panel item.,C:\Windows\System32\svchost.exe,793714f016df50c2502afb5bd60031fb,C:\Windows\System32\svchost.exe -k termsvcs,Microsoft Windows,true,The file is signed and the signature was verified.,Microsoft Windows Verification PCA
WW0004GOO,IPMIDRV,0,IPMIDRV,,C:\Windows\System32\drivers\IPMIDrv.sys,f6fd23bb45da05251f93c76412aa746e,\SystemRoot\system32\drivers\IPMIDrv.sys,Microsoft Windows,true,The file is signed and the signature was verified.,Microsoft Windows Verification PCA
WW0004GOO,Compbatt,0,Compbatt,,C:\Windows\System32\drivers\compbatt.sys,b01ba1c09c965640d2f62212364918bc,\SystemRoot\system32\drivers\compbatt.sys,Microsoft Windows,true,The file is signed and the signature was verified.,Microsoft Windows Verification PCA
WW0004GOO,WcsPlugInService,0,Windows Color System,The WcsPlugInService service hosts third-party Windows Color System color device model and gamut map model plug-in modules. These plug-in modules are vendor-specific extensions to the Windows Color System baseline color device and gamut map models. Stopping or disabling the WcsPlugInService service will disable this extensibility feature  and the Windows Color System will use its baseline model processing rather than the vendor's desired processing. This might result in inaccurate color rendering.,C:\Windows\System32\svchost.exe,793714f016df50c2502afb5bd60031fb,C:\Windows\system32\svchost.exe -k wcssvc,Microsoft Windows,true,The file is signed and the signature was verified.,Microsoft Windows Verification PCA
WW0004GOO,clr_optimization_v2.0.50727_64,0,Microsoft .NET Framework NGEN v2.0.50727_X64,Microsoft .NET Framework NGEN,C:\Windows\Microsoft.NET\Framework64\v2.0.50727\mscorsvw.exe,9449c3e8c6fccb79e740befeb22e7290,C:\Windows\Microsoft.NET\Framework64\v2.0.50727\mscorsvw.exe,Microsoft Windows,true,The file is signed and the signature was verified.,Microsoft Windows Verification PCA
WW0004GOO,GCEAgent,1108,GCEAgent,Google Compute Engine Agent,C:\Program Files\Google\Compute Engine\agent\GCEWindowsAgent.exe,a7020c20b26b723c9bae7d7bd1b61d80,C:\Program Files\Google\Compute Engine\agent\GCEWindowsAgent.exe,Google Inc,true,The file is signed and the signature was verified.,Symantec Class 3 SHA256 Code Signing CA
WW0004GOO,Psched,0,QoS Packet Scheduler,QoS Packet Scheduler,C:\Windows\System32\drivers\pacer.sys,f974f0c44082a6a64daf0507a8aa5bd0,system32\DRIVERS\pacer.sys,Microsoft Windows,true,The file is signed and the signature was verified.,Microsoft Windows Verification PCA
WW0004GOO,ebdrv,0,Broadcom NetXtreme II 10 GigE VBD,,C:\Windows\System32\drivers\evbda.sys,cbfeda8147456621c169460a9f11bcf7,\SystemRoot\system32\drivers\evbda.sys,Microsoft Windows,true,The file is signed and the signature was verified.,Microsoft Windows Verification PCA
WW0004GOO,wmiApSrv,0,WMI Performance Adapter,Provides performance library information from Windows Management Instrumentation (WMI) providers to clients on the network. This service only runs when Performance Data Helper is activated.,C:\Windows\System32\wbem\WmiApSrv.exe,6400d5dfe8cad72bd087eed03b07da6d,C:\Windows\system32\wbem\WmiApSrv.exe,Microsoft Windows,true,The file is signed and the signature was verified.,Microsoft Windows Verification PCA
WW0004GOO,TrustedInstaller,0,Windows Modules Installer,Enables installation  modification  and removal of Windows updates and optional components. If this service is disabled  install or uninstall of Windows updates might fail for this computer.,C:\Windows\servicing\TrustedInstaller.exe,5a4dd2191e0e903b2088c7c75c55cb2a,C:\Windows\servicing\TrustedInstaller.exe,Microsoft Windows,true,The file is signed and the signature was verified.,Microsoft Windows Verification PCA
WW0004GOO,bowser,0,Browser Support Driver,Implements the kernel datagram receiver for the computer browser browser service.,C:\Windows\System32\drivers\bowser.sys,5ccb52c13fed0dd589d4ae0382587f8d,system32\DRIVERS\bowser.sys,Microsoft Windows,true,The file is signed and the signature was verified.,Microsoft Windows Verification PCA
WW0004GOO,MMCSS,0,Multimedia Class Scheduler,Enables relative prioritization of work based on system-wide task priorities. This is intended mainly for multimedia applications.  If this service is stopped  individual tasks resort to their default priority.,C:\Windows\System32\svchost.exe,793714f016df50c2502afb5bd60031fb,C:\Windows\system32\svchost.exe -k netsvcs,Microsoft Windows,true,The file is signed and the signature was verified.,Microsoft Windows Verification PCA
WW0004GOO,intelide,0,intelide,,C:\Windows\System32\drivers\intelide.sys,95e65d7c78f8da663026146bcf0d54e5,\SystemRoot\system32\drivers\intelide.sys,Microsoft Windows,true,The file is signed and the signature was verified.,Microsoft Windows Verification PCA
WW0004GOO,agp440,0,Intel AGP Bus Filter,,C:\Windows\System32\drivers\AGP440.sys,3edbb7efb23ce5933fe37d68d63e765a,\SystemRoot\system32\drivers\agp440.sys,Microsoft Windows,true,The file is signed and the signature was verified.,Microsoft Windows Verification PCA
WW0004GOO,AppMgmt,0,Application Management,Processes installation  removal  and enumeration requests for software deployed through Group Policy. If the service is disabled  users will be unable to install  remove  or enumerate software deployed through Group Policy. If this service is disabled  any services that explicitly depend on it will fail to start.,C:\Windows\System32\svchost.exe,793714f016df50c2502afb5bd60031fb,C:\Windows\system32\svchost.exe -k netsvcs,Microsoft Windows,true,The file is signed and the signature was verified.,Microsoft Windows Verification PCA
WW0004GOO,Disk,0,Disk Driver,,C:\Windows\System32\drivers\disk.sys,1ed20bb45f40362bbf84691b754f7c23,\SystemRoot\system32\drivers\disk.sys,Microsoft Windows,true,The file is signed and the signature was verified.,Microsoft Windows Verification PCA
WW0004GOO,netkvm,0,Red Hat VirtIO Ethernet Adapter Service,,C:\Windows\System32\drivers\netkvm.sys,946a9100046c2c51209f7673d107f5ff,system32\DRIVERS\netkvm.sys,Google Inc,true,The file is signed and the signature was verified.,Symantec Class 3 SHA256 Code Signing CA
WW0004GOO,LSI_SCSI,0,LSI_SCSI,,C:\Windows\System32\drivers\lsi_scsi.sys,9c7a66286d3ee2cb48ee97c299ae15b9,\SystemRoot\system32\drivers\lsi_scsi.sys,Microsoft Windows,true,The file is signed and the signature was verified.,Microsoft Windows Verification PCA
WW0004GOO,RDPREFMP,0,Reflector Display Driver used to gain access to graphics data,RDP Reflector Driver Miniport,C:\Windows\System32\drivers\RDPREFMP.sys,830a5d98a36865b81b16efd689929361,system32\drivers\rdprefmp.sys,Microsoft Windows,true,The file is signed and the signature was verified.,Microsoft Windows Verification PCA
WW0004GOO,adp94xx,0,adp94xx,,C:\Windows\System32\drivers\adp94xx.sys,d053319eaa558436e630e37f3bcec045,\SystemRoot\system32\drivers\adp94xx.sys,Microsoft Windows,true,The file is signed and the signature was verified.,Microsoft Windows Verification PCA
WW0004GOO,fdc,0,Floppy Disk Controller Driver,,C:\Windows\System32\drivers\fdc.sys,05a08f9543d2a573871160035015705a,\SystemRoot\system32\drivers\fdc.sys,Microsoft Windows,true,The file is signed and the signature was verified.,Microsoft Windows Verification PCA
WW0004GOO,wercplsupport,0,Problem Reports and Solutions Control Panel Support,This service provides support for viewing  sending and deletion of system-level problem reports for the Problem Reports and Solutions control panel.,C:\Windows\System32\svchost.exe,793714f016df50c2502afb5bd60031fb,C:\Windows\System32\svchost.exe -k netsvcs,Microsoft Windows,true,The file is signed and the signature was verified.,Microsoft Windows Verification PCA
