hostname,name,pid,descriptivename,description,path,pathmd5sum,arguments,pathcertificatesubject,pathsignatureverified,pathsignaturedescription,pathcertificateissuer
ST234FAJ,UALSVC,1292,User Access Logging Service,This service logs unique client access requests  in the form of IP addresses and user names  of installed products and roles on the local server. This information can be queried  via Powershell  by administrators needing to quantify client demand of server software for offline Client Access License (CAL) management. If the service is disabled  client requests will not be logged and will not be retrievable via Powershell queries. Stopping the service will not affect query of historical data (see supporting documentation for steps to delete historical data). The local system administrator must consult his  or her  Windows Server license terms to determine the number of CALs that are required for the server software to be appropriately licensed; use of the UAL service and data does not alter this obligation.,C:\Windows\System32\svchost.exe,fba9363c07dd22802dfc84600441c028,C:\Windows\system32\svchost.exe -k LocalSystemNetworkRestricted,Microsoft Windows,true,The file is signed and the signature was verified.,Microsoft Windows Production PCA 2011
ST234FAJ,usbohci,0,Microsoft USB Open Host Controller Miniport Driver,,C:\Windows\System32\drivers\usbohci.sys,b3c03fb88bda6ec4bcc1e89f69165b8d,\SystemRoot\System32\drivers\usbohci.sys,Microsoft Windows,true,The file is signed and the signature was verified.,Microsoft Windows Production PCA 2011
ST234FAJ,vmicshutdown,0,Hyper-V Guest Shutdown Service,Provides a mechanism to shut down the operating system of this virtual machine from the management interfaces on the physical computer.,C:\Windows\System32\svchost.exe,fba9363c07dd22802dfc84600441c028,C:\Windows\system32\svchost.exe -k LocalSystemNetworkRestricted,Microsoft Windows,true,The file is signed and the signature was verified.,Microsoft Windows Production PCA 2011
ST234FAJ,BITS,0,Background Intelligent Transfer Service,Transfers files in the background using idle network bandwidth. If the service is disabled  then any applications that depend on BITS  such as Windows Update or MSN Explorer  will be unable to automatically download programs and other information.,C:\Windows\System32\svchost.exe,fba9363c07dd22802dfc84600441c028,C:\Windows\System32\svchost.exe -k netsvcs,Microsoft Windows,true,The file is signed and the signature was verified.,Microsoft Windows Production PCA 2011
ST234FAJ,Appinfo,888,Application Information,Facilitates the running of interactive applications with additional administrative privileges.  If this service is stopped  users will be unable to launch applications with the additional administrative privileges they may require to perform desired user tasks.,C:\Windows\System32\svchost.exe,fba9363c07dd22802dfc84600441c028,C:\Windows\system32\svchost.exe -k netsvcs,Microsoft Windows,true,The file is signed and the signature was verified.,Microsoft Windows Production PCA 2011
ST234FAJ,RpcEptMapper,716,RPC Endpoint Mapper,Resolves RPC interfaces identifiers to transport endpoints. If this service is stopped or disabled  programs using Remote Procedure Call (RPC) services will not function properly.,C:\Windows\System32\svchost.exe,fba9363c07dd22802dfc84600441c028,C:\Windows\system32\svchost.exe -k RPCSS,Microsoft Windows,true,The file is signed and the signature was verified.,Microsoft Windows Production PCA 2011
ST234FAJ,Mup,0,Mup,Multiple UNC Provider Driver,C:\Windows\System32\drivers\mup.sys,3e5635dace911c66eef71a26a7508629,\SystemRoot\System32\Drivers\mup.sys,Microsoft Windows,true,The file is signed and the signature was verified.,Microsoft Windows Production PCA 2011
ST234FAJ,HidUsb,0,Microsoft HID Class Driver,,C:\Windows\System32\drivers\hidusb.sys,d651253ec55f17c069a32902ec66164c,\SystemRoot\System32\drivers\hidusb.sys,Microsoft Windows,true,The file is signed and the signature was verified.,Microsoft Windows Production PCA 2011
ST234FAJ,intelide,0,intelide,,C:\Windows\System32\drivers\intelide.sys,1ca51c8ffd9810b9b97699cfdf99b522,\SystemRoot\System32\drivers\intelide.sys,Microsoft Windows,true,The file is signed and the signature was verified.,Microsoft Windows Production PCA 2011
ST234FAJ,hyperkbd,0,hyperkbd,,C:\Windows\System32\drivers\hyperkbd.sys,1a67bc656eedd78ca1ea9cf4c150b727,\SystemRoot\System32\drivers\hyperkbd.sys,Microsoft Windows,true,The file is signed and the signature was verified.,Microsoft Windows Production PCA 2011
ST234FAJ,acpitime,0,ACPI Wake Alarm Driver,,C:\Windows\System32\drivers\acpitime.sys,043787b84734c9624dc6283fc6fe78f8,\SystemRoot\System32\drivers\acpitime.sys,Microsoft Windows,true,The file is signed and the signature was verified.,Microsoft Windows Production PCA 2011
ST234FAJ,TermService,1772,Remote Desktop Services,Allows users to connect interactively to a remote computer. Remote Desktop and Remote Desktop Session Host Server depend on this service.  To prevent remote use of this computer  clear the checkboxes on the Remote tab of the System properties control panel item.,C:\Windows\System32\svchost.exe,fba9363c07dd22802dfc84600441c028,C:\Windows\System32\svchost.exe -k termsvcs,Microsoft Windows,true,The file is signed and the signature was verified.,Microsoft Windows Production PCA 2011
ST234FAJ,sppsvc,0,Software Protection,Enables the download  installation and enforcement of digital licenses for Windows and Windows applications. If the service is disabled  the operating system and licensed applications may run in a notification mode. It is strongly recommended that you not disable the Software Protection service.,C:\Windows\System32\sppsvc.exe,d1607f7e2993563cd06826f0ae09c8cd,C:\Windows\system32\sppsvc.exe,Microsoft Windows,true,The file is signed and the signature was verified.,Microsoft Windows Production PCA 2011
ST234FAJ,PrintNotify,0,Printer Extensions and Notifications,This service opens custom printer dialog boxes and handles notifications from a remote print server or a printer. If you turn off this service  you won’t be able to see printer extensions or notifications.,C:\Windows\System32\svchost.exe,fba9363c07dd22802dfc84600441c028,C:\Windows\system32\svchost.exe -k print,Microsoft Windows,true,The file is signed and the signature was verified.,Microsoft Windows Production PCA 2011
ST234FAJ,PerfHost,0,Performance Counter DLL Host,Enables remote users and 64-bit processes to query performance counters provided by 32-bit DLLs. If this service is stopped  only local users and 32-bit processes will be able to query performance counters provided by 32-bit DLLs.,C:\Windows\SysWOW64\perfhost.exe,b64dd36aadf5df4cdfb2981f8ff20e64,C:\Windows\SysWow64\perfhost.exe,Microsoft Windows,true,The file is signed and the signature was verified.,Microsoft Windows Production PCA 2011
ST234FAJ,fcvsc,0,fcvsc,,C:\Windows\System32\drivers\fcvsc.sys,c2e20258583ffec46db038ef4b030b82,\SystemRoot\System32\drivers\fcvsc.sys,Microsoft Windows,true,The file is signed and the signature was verified.,Microsoft Windows Production PCA 2011
ST234FAJ,SNMPTRAP,0,SNMP Trap,Receives trap messages generated by local or remote Simple Network Management Protocol (SNMP) agents and forwards the messages to SNMP management programs running on this computer. If this service is stopped  SNMP-based programs on this computer will not receive SNMP trap messages. If this service is disabled  any services that explicitly depend on it will fail to start.,C:\Windows\System32\snmptrap.exe,00b826db16f74a8a1d33f7f556c0c306,C:\Windows\System32\snmptrap.exe,Microsoft Windows,true,The file is signed and the signature was verified.,Microsoft Windows Production PCA 2011
ST234FAJ,RasAuto,0,Remote Access Auto Connection Manager,Creates a connection to a remote network whenever a program references a remote DNS or NetBIOS name or address.,C:\Windows\System32\svchost.exe,fba9363c07dd22802dfc84600441c028,C:\Windows\System32\svchost.exe -k netsvcs,Microsoft Windows,true,The file is signed and the signature was verified.,Microsoft Windows Production PCA 2011
ST234FAJ,WcsPlugInService,0,Windows Color System,The WcsPlugInService service hosts third-party Windows Color System color device model and gamut map model plug-in modules. These plug-in modules are vendor-specific extensions to the Windows Color System baseline color device and gamut map models. Stopping or disabling the WcsPlugInService service will disable this extensibility feature  and the Windows Color System will use its baseline model processing rather than the vendor's desired processing. This might result in inaccurate color rendering.,C:\Windows\System32\svchost.exe,fba9363c07dd22802dfc84600441c028,C:\Windows\system32\svchost.exe -k wcssvc,Microsoft Windows,true,The file is signed and the signature was verified.,Microsoft Windows Production PCA 2011
ST234FAJ,npsvctrig,0,Named pipe service trigger provider,,C:\Windows\System32\drivers\npsvctrig.sys,e9e1f5756ed5523fc0304127211ac073,\SystemRoot\System32\drivers\npsvctrig.sys,Microsoft Windows,true,The file is signed and the signature was verified.,Microsoft Windows Production PCA 2011
ST234FAJ,smbdirect,0,smbdirect,,C:\Windows\System32\drivers\smbdirect.sys,928d8aef50188270bffc27ffdda78311,System32\DRIVERS\smbdirect.sys,Microsoft Windows,true,The file is signed and the signature was verified.,Microsoft Windows Production PCA 2011
ST234FAJ,mvumis,0,mvumis,,C:\Windows\System32\drivers\mvumis.sys,bbd8ba64634c40e6dd11ef463222d459,\SystemRoot\System32\drivers\mvumis.sys,Microsoft Windows,true,The file is signed and the signature was verified.,Microsoft Windows Production PCA 2011
ST234FAJ,Spooler,1156,Print Spooler,This service spools print jobs and handles interaction with the printer.  If you turn off this service  you won’t be able to print or see your printers.,C:\Windows\System32\spoolsv.exe,121d8a84127662c37dc875f664f380cf,C:\Windows\System32\spoolsv.exe,Microsoft Windows,true,The file is signed and the signature was verified.,Microsoft Windows Production PCA 2011
ST234FAJ,WPDBusEnum,0,Portable Device Enumerator Service,Enforces group policy for removable mass-storage devices. Enables applications such as Windows Media Player and Image Import Wizard to transfer and synchronize content using removable mass-storage devices.,C:\Windows\System32\svchost.exe,fba9363c07dd22802dfc84600441c028,C:\Windows\system32\svchost.exe -k LocalSystemNetworkRestricted,Microsoft Windows,true,The file is signed and the signature was verified.,Microsoft Windows Production PCA 2011
ST234FAJ,xenvbd,0,AWS PV Storage Host Adapter,,C:\Windows\System32\drivers\xenvbd.sys,48c6868ee8f0a5d949fcdae0969b7610,\SystemRoot\system32\DRIVERS\xenvbd.sys,Microsoft Windows Hardware Compatibility Publisher,true,The file is signed and the signature was verified.,Microsoft Windows Hardware Compatibility PCA
ST234FAJ,DeviceAssociationService,0,Device Association Service,Enables pairing between the system and wired or wireless devices.,C:\Windows\System32\svchost.exe,fba9363c07dd22802dfc84600441c028,C:\Windows\system32\svchost.exe -k LocalSystemNetworkRestricted,Microsoft Windows,true,The file is signed and the signature was verified.,Microsoft Windows Production PCA 2011
ST234FAJ,MMCSS,0,Multimedia Class Scheduler,Enables relative prioritization of work based on system-wide task priorities. This is intended mainly for multimedia applications.  If this service is stopped  individual tasks resort to their default priority.,C:\Windows\System32\svchost.exe,fba9363c07dd22802dfc84600441c028,C:\Windows\system32\svchost.exe -k netsvcs,Microsoft Windows,true,The file is signed and the signature was verified.,Microsoft Windows Production PCA 2011
ST234FAJ,fdc,0,Floppy Disk Controller Driver,,C:\Windows\System32\drivers\fdc.sys,1383c022540512dfb94c144edaa80182,\SystemRoot\System32\drivers\fdc.sys,Microsoft Windows,true,The file is signed and the signature was verified.,Microsoft Windows Production PCA 2011
ST234FAJ,KSecDD,0,KSecDD,,C:\Windows\System32\drivers\ksecdd.sys,47e095021d93c1f24217d58a3b35080f,\SystemRoot\System32\Drivers\ksecdd.sys,Microsoft Windows,true,The file is signed and the signature was verified.,Microsoft Windows Production PCA 2011
ST234FAJ,GPIOClx0101,0,Microsoft GPIO Class Extension Driver,,C:\Windows\System32\drivers\msgpioclx.sys,c672e9fb9dca682eb99d43c44645ebae,System32\Drivers\msgpioclx.sys,Microsoft Windows,true,The file is signed and the signature was verified.,Microsoft Windows Production PCA 2011
ST234FAJ,amdsata,0,amdsata,,C:\Windows\System32\drivers\amdsata.sys,e55b0b7d9efb6835fecada693319136f,\SystemRoot\System32\drivers\amdsata.sys,Microsoft Windows,true,The file is signed and the signature was verified.,Microsoft Windows Production PCA 2011
ST234FAJ,kbdclass,0,Keyboard Class Driver,,C:\Windows\System32\drivers\kbdclass.sys,d1dcc6bde4bd541c1077bcc0d6a140bd,\SystemRoot\System32\drivers\kbdclass.sys,Microsoft Windows,true,The file is signed and the signature was verified.,Microsoft Windows Production PCA 2011
ST234FAJ,vmicguestinterface,0,Hyper-V Guest Service Interface,Provides an interface for the Hyper-V host to interact with specific services running inside the virtual machine.,C:\Windows\System32\svchost.exe,fba9363c07dd22802dfc84600441c028,C:\Windows\system32\svchost.exe -k LocalSystemNetworkRestricted,Microsoft Windows,true,The file is signed and the signature was verified.,Microsoft Windows Production PCA 2011
ST234FAJ,PolicyAgent,1812,IPsec Policy Agent,"""Internet Protocol security (IPsec) supports network-level peer authentication  data origin authentication  data integrity  data confidentiality (encryption)  and replay protection.  This service enforces IPsec policies created through the IP Security Policies snap-in or the command-line tool """"netsh ipsec"""".  If you stop this service  you may experience network connectivity issues if your policy requires that connections use IPsec.  Also remote management of Windows Firewall is not available when this service is stopped.""",C:\Windows\System32\svchost.exe,fba9363c07dd22802dfc84600441c028,C:\Windows\system32\svchost.exe -k NetworkServiceNetworkRestricted,Microsoft Windows,true,The file is signed and the signature was verified.,Microsoft Windows Production PCA 2011
ST234FAJ,VSS,0,Volume Shadow Copy,Manages and implements Volume Shadow Copies used for backup and other purposes. If this service is stopped  shadow copies will be unavailable for backup and the backup may fail. If this service is disabled  any services that explicitly depend on it will fail to start.,C:\Windows\System32\VSSVC.exe,97ce308f678e7efce18e20aba9d68386,C:\Windows\system32\vssvc.exe,Microsoft Windows,true,The file is signed and the signature was verified.,Microsoft Windows Production PCA 2011
ST234FAJ,amdxata,0,amdxata,,C:\Windows\System32\drivers\amdxata.sys,794ae53823ae5f0942f692b7b93b31e2,\SystemRoot\System32\drivers\amdxata.sys,Microsoft Windows,true,The file is signed and the signature was verified.,Microsoft Windows Production PCA 2011
ST234FAJ,UASPStor,0,USB Attached SCSI (UAS) Driver,,C:\Windows\System32\drivers\uaspstor.sys,3a1039040b50f55da8645a56b6b6acea,\SystemRoot\System32\drivers\uaspstor.sys,Microsoft Windows,true,The file is signed and the signature was verified.,Microsoft Windows Production PCA 2011
ST234FAJ,srv,0,Server SMB 1.xxx Driver,Enables connectivity from Windows XP and earlier clients,C:\Windows\System32\drivers\srv.sys,8496850f323b7468d3fb87eef8598a95,System32\DRIVERS\srv.sys,Microsoft Windows,true,The file is signed and the signature was verified.,Microsoft Windows Production PCA 2011
ST234FAJ,mouclass,0,Mouse Class Driver,,C:\Windows\System32\drivers\mouclass.sys,1f3ff9f69279cbd4c292e13dca7a3300,\SystemRoot\System32\drivers\mouclass.sys,Microsoft Windows,true,The file is signed and the signature was verified.,Microsoft Windows Production PCA 2011
ST234FAJ,ProfSvc,888,User Profile Service,This service is responsible for loading and unloading user profiles. If this service is stopped or disabled  users will no longer be able to successfully sign in or sign out  apps might have problems getting to users' data  and components registered to receive profile event notifications won't receive them.,C:\Windows\System32\svchost.exe,fba9363c07dd22802dfc84600441c028,C:\Windows\system32\svchost.exe -k netsvcs,Microsoft Windows,true,The file is signed and the signature was verified.,Microsoft Windows Production PCA 2011
ST234FAJ,PptpMiniport,0,WAN Miniport (PPTP),WAN Miniport (PPTP),C:\Windows\System32\drivers\raspptp.sys,7dfd341b1ed91ec55dd251448053711b,\SystemRoot\System32\drivers\raspptp.sys,Microsoft Windows,true,The file is signed and the signature was verified.,Microsoft Windows Production PCA 2011
ST234FAJ,AppReadiness,0,App Readiness,Gets apps ready for use the first time a user signs in to this PC and when adding new apps.,C:\Windows\System32\svchost.exe,fba9363c07dd22802dfc84600441c028,C:\Windows\System32\svchost.exe -k AppReadiness,Microsoft Windows,true,The file is signed and the signature was verified.,Microsoft Windows Production PCA 2011
ST234FAJ,RasAgileVpn,0,WAN Miniport (IKEv2),WAN Miniport (IKEv2),C:\Windows\System32\drivers\agilevpn.sys,ff00bb5dddbcf136bc3af2423a9ee5e2,\SystemRoot\system32\DRIVERS\AgileVpn.sys,Microsoft Windows,true,The file is signed and the signature was verified.,Microsoft Windows Production PCA 2011
ST234FAJ,nsi,928,Network Store Interface Service,This service delivers network notifications (e.g. interface addition/deleting etc) to user mode clients. Stopping this service will cause loss of network connectivity. If this service is disabled  any other services that explicitly depend on this service will fail to start.,C:\Windows\System32\svchost.exe,fba9363c07dd22802dfc84600441c028,C:\Windows\system32\svchost.exe -k LocalService,Microsoft Windows,true,The file is signed and the signature was verified.,Microsoft Windows Production PCA 2011
ST234FAJ,viaide,0,viaide,,C:\Windows\System32\drivers\viaide.sys,39ae0dba6648a56643ef037f8c3b952e,\SystemRoot\System32\drivers\viaide.sys,Microsoft Windows,true,The file is signed and the signature was verified.,Microsoft Windows Production PCA 2011
ST234FAJ,pci,0,PCI Bus Driver,,C:\Windows\System32\drivers\pci.sys,766314b318a6a6261da857181fa454c6,\SystemRoot\System32\drivers\pci.sys,Microsoft Windows,true,The file is signed and the signature was verified.,Microsoft Windows Production PCA 2011
ST234FAJ,gagp30kx,0,Microsoft Generic AGPv3.0 Filter for K8 Processor Platforms,,C:\Windows\System32\drivers\GAGP30KX.SYS,c2fa0152e40f2a684df2e056232152de,\SystemRoot\System32\drivers\gagp30kx.sys,Microsoft Windows,true,The file is signed and the signature was verified.,Microsoft Windows Production PCA 2011
ST234FAJ,RSoPProv,0,Resultant Set of Policy Provider,Provides a network service that processes requests to simulate application of Group Policy settings for a target user or computer in various situations and computes the Resultant Set of Policy settings.,C:\Windows\System32\rsopprov.exe,0581d79aca96c9165770c274074d1136,C:\Windows\system32\RSoPProv.exe,Microsoft Windows,true,The file is signed and the signature was verified.,Microsoft Windows Production PCA 2011
ST234FAJ,bfadfcoei,0,bfadfcoei,,C:\Windows\System32\drivers\bfadfcoei.sys,020f526284abbc1890c48444079811a8,\SystemRoot\System32\drivers\bfadfcoei.sys,Microsoft Windows,true,The file is signed and the signature was verified.,Microsoft Windows Production PCA 2011
ST234FAJ,TapiSrv,0,Telephony,Provides Telephony API (TAPI) support for programs that control telephony devices on the local computer and  through the LAN  on servers that are also running the service.,C:\Windows\System32\svchost.exe,fba9363c07dd22802dfc84600441c028,C:\Windows\System32\svchost.exe -k tapisrv,Microsoft Windows,true,The file is signed and the signature was verified.,Microsoft Windows Production PCA 2011
ST234FAJ,udfs,0,udfs,Reads/Writes UDF 1.02 1.5 2.0x 2.5 disc formats  usually found on C/DVD discs. (Core) (All pieces),C:\Windows\System32\drivers\udfs.sys,19812e4b2f2421ea323b183a5439465f,system32\DRIVERS\udfs.sys,Microsoft Windows,true,The file is signed and the signature was verified.,Microsoft Windows Production PCA 2011
ST234FAJ,RasAcd,0,Remote Access Auto Connection Driver,Remote Access Auto Connection Driver,C:\Windows\System32\drivers\rasacd.sys,c8ee2693c44d4d5cad9b702db04814c9,System32\DRIVERS\rasacd.sys,Microsoft Windows,true,The file is signed and the signature was verified.,Microsoft Windows Production PCA 2011
ST234FAJ,agp440,0,Intel AGP Bus Filter,,C:\Windows\System32\drivers\AGP440.sys,c2c668d315f85bb226134cc98c8dde48,\SystemRoot\System32\drivers\agp440.sys,Microsoft Windows,true,The file is signed and the signature was verified.,Microsoft Windows Production PCA 2011
ST234FAJ,TrustedInstaller,0,Windows Modules Installer,Enables installation  modification  and removal of Windows updates and optional components. If this service is disabled  install or uninstall of Windows updates might fail for this computer.,C:\Windows\servicing\TrustedInstaller.exe,dbb94412d99232af8daa77002f4756a2,C:\Windows\servicing\TrustedInstaller.exe,Microsoft Windows,true,The file is signed and the signature was verified.,Microsoft Windows Production PCA 2011
ST234FAJ,seclogon,0,Secondary Logon,Enables starting processes under alternate credentials. If this service is stopped  this type of logon access will be unavailable. If this service is disabled  any services that explicitly depend on it will fail to start.,C:\Windows\System32\svchost.exe,fba9363c07dd22802dfc84600441c028,C:\Windows\system32\svchost.exe -k netsvcs,Microsoft Windows,true,The file is signed and the signature was verified.,Microsoft Windows Production PCA 2011
ST234FAJ,Wcmsvc,844,Windows Connection Manager,Makes automatic connect/disconnect decisions based on the network connectivity options currently available to the PC and enables management of network connectivity based on Group Policy settings.,C:\Windows\System32\svchost.exe,fba9363c07dd22802dfc84600441c028,C:\Windows\system32\svchost.exe -k LocalServiceNetworkRestricted,Microsoft Windows,true,The file is signed and the signature was verified.,Microsoft Windows Production PCA 2011
ST234FAJ,srv2,0,Server SMB 2.xxx Driver,Enables connectivity from Windows Vista and later clients,C:\Windows\System32\drivers\srv2.sys,2f62115724c48b4fbb74bbeca8137ca1,System32\DRIVERS\srv2.sys,Microsoft Windows,true,The file is signed and the signature was verified.,Microsoft Windows Production PCA 2011
ST234FAJ,swenum,0,Software Bus Driver,,C:\Windows\System32\drivers\swenum.sys,a5e83321487a6863bffc7fb9d2467101,\SystemRoot\System32\drivers\swenum.sys,Microsoft Windows,true,The file is signed and the signature was verified.,Microsoft Windows Production PCA 2011
ST234FAJ,SiSRaid4,0,SiSRaid4,,C:\Windows\System32\drivers\sisraid4.sys,bec48c3a1f58e1aeabd92d2ba1426889,\SystemRoot\System32\drivers\sisraid4.sys,Microsoft Windows,true,The file is signed and the signature was verified.,Microsoft Windows Production PCA 2011
ST234FAJ,ql40xx2i,0,QLogic iSCSI Miniport Inbox Driver,,C:\Windows\System32\drivers\ql40xx2i.sys,a6e4c207bf7744ef85d3376216248977,\SystemRoot\System32\drivers\ql40xx2i.sys,Microsoft Windows,true,The file is signed and the signature was verified.,Microsoft Windows Production PCA 2011
ST234FAJ,COMSysApp,0,COM+ System Application,Manages the configuration and tracking of Component Object Model (COM)+-based components. If the service is stopped  most COM+-based components will not function properly. If this service is disabled  any services that explicitly depend on it will fail to start.,C:\Windows\System32\dllhost.exe,3c1a0db1f8b217920d05daba4da79b0f,C:\Windows\system32\dllhost.exe /Processid:{02D4B3F1-FD88-11D1-960D-00805FC79235},Microsoft Windows,true,The file is signed and the signature was verified.,Microsoft Windows Production PCA 2011
ST234FAJ,gpsvc,888,Group Policy Client,The service is responsible for applying settings configured by administrators for the computer and users through the Group Policy component. If the service is disabled  the settings will not be applied and applications and components will not be manageable through Group Policy. Any components or applications that depend on the Group Policy component might not be functional if the service is disabled.,C:\Windows\System32\svchost.exe,fba9363c07dd22802dfc84600441c028,C:\Windows\system32\svchost.exe -k netsvcs,Microsoft Windows,true,The file is signed and the signature was verified.,Microsoft Windows Production PCA 2011
ST234FAJ,TieringEngineService,0,Storage Tiers Management,Optimizes the placement of data in storage tiers on all tiered storage spaces in the system.,C:\Windows\System32\TieringEngineService.exe,0f0d31f24d99fb0d9cadeb210cf08694,C:\Windows\system32\TieringEngineService.exe,Microsoft Windows,true,The file is signed and the signature was verified.,Microsoft Windows Production PCA 2011
ST234FAJ,iphlpsvc,888,IP Helper,Provides tunnel connectivity using IPv6 transition technologies (6to4  ISATAP  Port Proxy  and Teredo)  and IP-HTTPS. If this service is stopped  the computer will not have the enhanced connectivity benefits that these technologies offer.,C:\Windows\System32\svchost.exe,fba9363c07dd22802dfc84600441c028,C:\Windows\System32\svchost.exe -k NetSvcs,Microsoft Windows,true,The file is signed and the signature was verified.,Microsoft Windows Production PCA 2011
ST234FAJ,Vid,0,Vid,,C:\Windows\System32\drivers\Vid.sys,283774ef2f52360373d516f65999b07e,\SystemRoot\System32\drivers\Vid.sys,Microsoft Windows,true,The file is signed and the signature was verified.,Microsoft Windows Production PCA 2011
