hostname,name,pid,descriptivename,description,path,pathmd5sum,arguments,pathcertificatesubject,pathsignatureverified,pathsignaturedescription,pathcertificateissuer
ST234FAJ,HpSAMD,0,HpSAMD,,C:\Windows\System32\drivers\HpSAMD.sys,ffbd6a478c0c55b2d856669a08972a19,\SystemRoot\System32\drivers\HpSAMD.sys,Microsoft Windows,true,The file is signed and the signature was verified.,Microsoft Windows Production PCA 2011
ST234FAJ,NcaSvc,0,Network Connectivity Assistant,Provides DirectAccess status notification for UI components,C:\Windows\System32\svchost.exe,fba9363c07dd22802dfc84600441c028,C:\Windows\System32\svchost.exe -k NetSvcs,Microsoft Windows,true,The file is signed and the signature was verified.,Microsoft Windows Production PCA 2011
ST234FAJ,vmictimesync,0,Hyper-V Time Synchronization Service,Synchronizes the system time of this virtual machine with the system time of the physical computer.,C:\Windows\System32\svchost.exe,fba9363c07dd22802dfc84600441c028,C:\Windows\system32\svchost.exe -k LocalServiceNetworkRestricted,Microsoft Windows,true,The file is signed and the signature was verified.,Microsoft Windows Production PCA 2011
ST234FAJ,CLFS,0,Common Log (CLFS),General-purpose logging service,C:\Windows\System32\drivers\clfs.sys,9ffb6357fdf4f1e1f7fdb9c714d3b728,\SystemRoot\System32\drivers\CLFS.sys,Microsoft Windows,true,The file is signed and the signature was verified.,Microsoft Windows Production PCA 2011
ST234FAJ,W32Time,0,Windows Time,Maintains date and time synchronization on all clients and servers in the network. If this service is stopped  date and time synchronization will be unavailable. If this service is disabled  any services that explicitly depend on it will fail to start.,C:\Windows\System32\svchost.exe,fba9363c07dd22802dfc84600441c028,C:\Windows\system32\svchost.exe -k LocalService,Microsoft Windows,true,The file is signed and the signature was verified.,Microsoft Windows Production PCA 2011
ST234FAJ,FDResPub,0,Function Discovery Resource Publication,Publishes this computer and resources attached to this computer so they can be discovered over the network.  If this service is stopped  network resources will no longer be published and they will not be discovered by other computers on the network.,C:\Windows\System32\svchost.exe,fba9363c07dd22802dfc84600441c028,C:\Windows\system32\svchost.exe -k LocalServiceAndNoImpersonation,Microsoft Windows,true,The file is signed and the signature was verified.,Microsoft Windows Production PCA 2011
ST234FAJ,fdPHost,0,Function Discovery Provider Host,The FDPHOST service hosts the Function Discovery (FD) network discovery providers. These FD providers supply network discovery services for the Simple Services Discovery Protocol (SSDP) and Web Services – Discovery (WS-D) protocol. Stopping or disabling the FDPHOST service will disable network discovery for these protocols when using FD. When this service is unavailable  network services using FD and relying on these discovery protocols will be unable to find network devices or resources.,C:\Windows\System32\svchost.exe,fba9363c07dd22802dfc84600441c028,C:\Windows\system32\svchost.exe -k LocalService,Microsoft Windows,true,The file is signed and the signature was verified.,Microsoft Windows Production PCA 2011
ST234FAJ,cht4vbd,0,Chelsio T4 Virtual Bus Driver,,C:\Windows\System32\drivers\cht4vx64.sys,d4c02d429b5fc5860d8456acb7535e21,\SystemRoot\System32\drivers\cht4vx64.sys,Microsoft Windows,true,The file is signed and the signature was verified.,Microsoft Windows Production PCA 2011
ST234FAJ,spaceport,0,Storage Spaces Driver,,C:\Windows\System32\drivers\spaceport.sys,5a330ca4f016bdb4a4ab683ab330bcd4,\SystemRoot\System32\drivers\spaceport.sys,Microsoft Windows,true,The file is signed and the signature was verified.,Microsoft Windows Production PCA 2011
ST234FAJ,Wanarp,0,Remote Access IP ARP Driver,Remote Access IP ARP Driver,C:\Windows\System32\drivers\wanarp.sys,76a43e00f1029e48ede6b8eed964a9b3,\SystemRoot\system32\DRIVERS\wanarp.sys,Microsoft Windows,true,The file is signed and the signature was verified.,Microsoft Windows Production PCA 2011
ST234FAJ,SiSRaid2,0,SiSRaid2,,C:\Windows\System32\drivers\sisraid2.sys,7bc511734b2cb72f1635b1522d44259f,\SystemRoot\System32\drivers\SiSRaid2.sys,Microsoft Windows,true,The file is signed and the signature was verified.,Microsoft Windows Production PCA 2011
ST234FAJ,BrokerInfrastructure,688,Background Tasks Infrastructure Service,Windows infrastructure service that controls which background tasks can run on the system.,C:\Windows\System32\svchost.exe,fba9363c07dd22802dfc84600441c028,C:\Windows\system32\svchost.exe -k DcomLaunch,Microsoft Windows,true,The file is signed and the signature was verified.,Microsoft Windows Production PCA 2011
ST234FAJ,usbhub,0,Microsoft USB Standard Hub Driver,,C:\Windows\System32\drivers\usbhub.sys,19b52eaa4956ece7e2c86eb3330b26d4,\SystemRoot\System32\drivers\usbhub.sys,Microsoft Windows,true,The file is signed and the signature was verified.,Microsoft Windows Production PCA 2011
ST234FAJ,VaultSvc,0,Credential Manager,Provides secure storage and retrieval of credentials to users  applications and security service packages.,C:\Windows\System32\lsass.exe,0612f1945277278ad88bb311abfcbe02,C:\Windows\system32\lsass.exe,Microsoft Windows,true,The file is signed and the signature was verified.,Microsoft Windows Production PCA 2011
ST234FAJ,sbp2port,0,SBP-2 Transport/Protocol Bus Driver,,C:\Windows\System32\drivers\sbp2port.sys,32f989ab2a25130d6076c3e0939c4c2f,\SystemRoot\System32\drivers\sbp2port.sys,Microsoft Windows,true,The file is signed and the signature was verified.,Microsoft Windows Production PCA 2011
ST234FAJ,CompositeBus,0,Composite Bus Enumerator Driver,,C:\Windows\System32\drivers\CompositeBus.sys,8e40e4f360296327764c6a3a735ac581,\SystemRoot\System32\drivers\CompositeBus.sys,Microsoft Windows,true,The file is signed and the signature was verified.,Microsoft Windows Production PCA 2011
ST234FAJ,napagent,0,Network Access Protection Agent,The Network Access Protection (NAP) agent service collects and manages health information for client computers on a network. Information collected by NAP agent is used to make sure that the client computer has the required software and settings. If a client computer is not compliant with health policy  it can be provided with restricted network access until its configuration is updated. Depending on the configuration of health policy  client computers might be automatically updated so that users quickly regain full network access without having to manually update their computer.,C:\Windows\System32\svchost.exe,fba9363c07dd22802dfc84600441c028,C:\Windows\System32\svchost.exe -k NetworkService,Microsoft Windows,true,The file is signed and the signature was verified.,Microsoft Windows Production PCA 2011
ST234FAJ,TPM,0,TPM,TPM Driver,C:\Windows\System32\drivers\tpm.sys,288bdeb54bf422535da467229a9dd391,\SystemRoot\system32\drivers\tpm.sys,Microsoft Windows,true,The file is signed and the signature was verified.,Microsoft Windows Production PCA 2011
ST234FAJ,WinNat,0,Windows NAT Driver,This service provides network address translation functionality,C:\Windows\System32\drivers\winnat.sys,56ebf09a970ff20686c0a2a325b9d37f,system32\drivers\winnat.sys,Microsoft Windows,true,The file is signed and the signature was verified.,Microsoft Windows Production PCA 2011
ST234FAJ,RemoteRegistry,0,Remote Registry,Enables remote users to modify registry settings on this computer. If this service is stopped  the registry can be modified only by users on this computer. If this service is disabled  any services that explicitly depend on it will fail to start.,C:\Windows\System32\svchost.exe,fba9363c07dd22802dfc84600441c028,C:\Windows\system32\svchost.exe -k localService,Microsoft Windows,true,The file is signed and the signature was verified.,Microsoft Windows Production PCA 2011
ST234FAJ,NetBIOS,0,NetBIOS Interface,NetBIOS Interface,C:\Windows\System32\drivers\netbios.sys,d0d96edd82804e3d24361aef08cfb736,system32\DRIVERS\netbios.sys,Microsoft Windows,true,The file is signed and the signature was verified.,Microsoft Windows Production PCA 2011
ST234FAJ,NetTcpPortSharing,0,Net.Tcp Port Sharing Service,Provides ability to share TCP ports over the net.tcp protocol.,C:\Windows\Microsoft.NET\Framework64\v4.0.30319\SMSvcHost.exe,2d8efef32ead0815a0ae792d9fd5b4c3,C:\Windows\Microsoft.NET\Framework64\v4.0.30319\SMSvcHost.exe,Microsoft Windows,true,The file is signed and the signature was verified.,Microsoft Windows Production PCA 2011
ST234FAJ,volmgrx,0,Dynamic Volume Manager,Extension of the volume manager driver that manages software RAID volumes (spanned  striped  mirrored  RAID-5) on dynamic disks,C:\Windows\System32\drivers\volmgrx.sys,1fd61d259021e04f05454798c37b1f4f,\SystemRoot\System32\drivers\volmgrx.sys,Microsoft Windows,true,The file is signed and the signature was verified.,Microsoft Windows Production PCA 2011
ST234FAJ,lmhosts,844,TCP/IP NetBIOS Helper,Provides support for the NetBIOS over TCP/IP (NetBT) service and NetBIOS name resolution for clients on the network  therefore enabling users to share files  print  and log on to the network. If this service is stopped  these functions might be unavailable. If this service is disabled  any services that explicitly depend on it will fail to start.,C:\Windows\System32\svchost.exe,fba9363c07dd22802dfc84600441c028,C:\Windows\system32\svchost.exe -k LocalServiceNetworkRestricted,Microsoft Windows,true,The file is signed and the signature was verified.,Microsoft Windows Production PCA 2011
ST234FAJ,PlugPlay,688,Plug and Play,Enables a computer to recognize and adapt to hardware changes with little or no user input. Stopping or disabling this service will result in system instability.,C:\Windows\System32\svchost.exe,fba9363c07dd22802dfc84600441c028,C:\Windows\system32\svchost.exe -k DcomLaunch,Microsoft Windows,true,The file is signed and the signature was verified.,Microsoft Windows Production PCA 2011
ST234FAJ,WIMMount,0,WIMMount,WIM Image mount service driver,C:\Windows\System32\drivers\wimmount.sys,27b3574f90054cbf1246af3e061f7b5c,system32\drivers\wimmount.sys,Microsoft Windows,true,The file is signed and the signature was verified.,Microsoft Windows Production PCA 2011
ST234FAJ,s3cap,0,s3cap,,C:\Windows\System32\drivers\vms3cap.sys,813ae554d15033e232f4ad3bf5d76e0e,\SystemRoot\System32\drivers\vms3cap.sys,Microsoft Windows,true,The file is signed and the signature was verified.,Microsoft Windows Production PCA 2011
ST234FAJ,WFPLWFS,0,Microsoft Windows Filtering Platform,Microsoft Windows Filtering Platform,C:\Windows\System32\drivers\wfplwfs.sys,33acc21b48a6337b83d5820ccfbbdb96,\SystemRoot\system32\DRIVERS\wfplwfs.sys,Microsoft Windows,true,The file is signed and the signature was verified.,Microsoft Windows Production PCA 2011
ST234FAJ,LanmanWorkstation,56,Workstation,Creates and maintains client network connections to remote servers using the SMB protocol. If this service is stopped  these connections will be unavailable. If this service is disabled  any services that explicitly depend on it will fail to start.,C:\Windows\System32\svchost.exe,fba9363c07dd22802dfc84600441c028,C:\Windows\System32\svchost.exe -k NetworkService,Microsoft Windows,true,The file is signed and the signature was verified.,Microsoft Windows Production PCA 2011
ST234FAJ,TCPIP6,0,Microsoft IPv6 Protocol Driver,Microsoft IPv6 Protocol Driver,C:\Windows\System32\drivers\tcpip.sys,c86f8a4d32408f666fb52bc343730199,\SystemRoot\system32\DRIVERS\tcpip.sys,Microsoft Windows,true,The file is signed and the signature was verified.,Microsoft Windows Production PCA 2011
ST234FAJ,WdiServiceHost,0,Diagnostic Service Host,The Diagnostic Service Host is used by the Diagnostic Policy Service to host diagnostics that need to run in a Local Service context.  If this service is stopped  any diagnostics that depend on it will no longer function.,C:\Windows\System32\svchost.exe,fba9363c07dd22802dfc84600441c028,C:\Windows\System32\svchost.exe -k LocalService,Microsoft Windows,true,The file is signed and the signature was verified.,Microsoft Windows Production PCA 2011
ST234FAJ,Winmgmt,888,Windows Management Instrumentation,Provides a common interface and object model to access management information about operating system  devices  applications and services. If this service is stopped  most Windows-based software will not function properly. If this service is disabled  any services that explicitly depend on it will fail to start.,C:\Windows\System32\svchost.exe,fba9363c07dd22802dfc84600441c028,C:\Windows\system32\svchost.exe -k netsvcs,Microsoft Windows,true,The file is signed and the signature was verified.,Microsoft Windows Production PCA 2011
ST234FAJ,VMBusHID,0,VMBusHID,,C:\Windows\System32\drivers\VMBusHID.sys,06af4275391617989bdfde915e328c6e,\SystemRoot\System32\drivers\VMBusHID.sys,Microsoft Windows,true,The file is signed and the signature was verified.,Microsoft Windows Production PCA 2011
ST234FAJ,cfn-hup,0,CloudFormation cfn-hup,CloudFormation cfn-hup for Windows,C:\Program Files\Amazon\cfn-bootstrap\winhup.exe,72b5cff69366680d3ac7f4bba760dc1e,C:\Program Files\Amazon\cfn-bootstrap\winhup.exe,,false,The file is not signed.,
ST234FAJ,vdrvroot,0,Microsoft Virtual Drive Enumerator,,C:\Windows\System32\drivers\vdrvroot.sys,26cf4efbbc5e53921998d9b426e3c9bf,\SystemRoot\System32\drivers\vdrvroot.sys,Microsoft Windows,true,The file is signed and the signature was verified.,Microsoft Windows Production PCA 2011
ST234FAJ,Dnscache,56,DNS Client,The DNS Client service (dnscache) caches Domain Name System (DNS) names and registers the full computer name for this computer. If the service is stopped  DNS names will continue to be resolved. However  the results of DNS name queries will not be cached and the computer's name will not be registered. If the service is disabled  any services that explicitly depend on it will fail to start.,C:\Windows\System32\svchost.exe,fba9363c07dd22802dfc84600441c028,C:\Windows\system32\svchost.exe -k NetworkService,Microsoft Windows,true,The file is signed and the signature was verified.,Microsoft Windows Production PCA 2011
ST234FAJ,uagp35,0,Microsoft AGPv3.5 Filter,,C:\Windows\System32\drivers\UAGP35.SYS,8fe20b40ca88f10558d7ada16a2e6a04,\SystemRoot\System32\drivers\uagp35.sys,Microsoft Windows,true,The file is signed and the signature was verified.,Microsoft Windows Production PCA 2011
ST234FAJ,Wanarpv6,0,Remote Access IPv6 ARP Driver,Remote Access IPv6 ARP Driver,C:\Windows\System32\drivers\wanarp.sys,76a43e00f1029e48ede6b8eed964a9b3,\SystemRoot\system32\DRIVERS\wanarp.sys,Microsoft Windows,true,The file is signed and the signature was verified.,Microsoft Windows Production PCA 2011
ST234FAJ,KSecPkg,0,KSecPkg,,C:\Windows\System32\drivers\ksecpkg.sys,f197f3df7e06707f69987ee61b3795c4,\SystemRoot\System32\Drivers\ksecpkg.sys,Microsoft Windows,true,The file is signed and the signature was verified.,Microsoft Windows Production PCA 2011
ST234FAJ,Netlogon,0,Netlogon,Maintains a secure channel between this computer and the domain controller for authenticating users and services. If this service is stopped  the computer may not authenticate users and services and the domain controller cannot register DNS records. If this service is disabled  any services that explicitly depend on it will fail to start.,C:\Windows\System32\lsass.exe,0612f1945277278ad88bb311abfcbe02,C:\Windows\system32\lsass.exe,Microsoft Windows,true,The file is signed and the signature was verified.,Microsoft Windows Production PCA 2011
ST234FAJ,AFD,0,Ancillary Function Driver for Winsock,Ancillary Function Driver for Winsock,C:\Windows\System32\drivers\afd.sys,dc3d0ebae623e94763d741546648adb2,\SystemRoot\system32\drivers\afd.sys,Microsoft Windows,true,The file is signed and the signature was verified.,Microsoft Windows Production PCA 2011
ST234FAJ,vmicheartbeat,0,Hyper-V Heartbeat Service,Monitors the state of this virtual machine by reporting a heartbeat at regular intervals. This service helps you identify running virtual machines that have stopped responding.,C:\Windows\System32\svchost.exe,fba9363c07dd22802dfc84600441c028,C:\Windows\system32\svchost.exe -k ICService,Microsoft Windows,true,The file is signed and the signature was verified.,Microsoft Windows Production PCA 2011
ST234FAJ,lltdsvc,0,Link-Layer Topology Discovery Mapper,Creates a Network Map  consisting of PC and device topology (connectivity) information  and metadata describing each PC and device.  If this service is disabled  the Network Map will not function properly.,C:\Windows\System32\svchost.exe,fba9363c07dd22802dfc84600441c028,C:\Windows\System32\svchost.exe -k LocalService,Microsoft Windows,true,The file is signed and the signature was verified.,Microsoft Windows Production PCA 2011
ST234FAJ,ql2300i,0,QLogic Fibre Channel STOR Miniport Inbox Driver (wx64),,C:\Windows\System32\drivers\ql2300i.sys,fcd86a7551e7a8a888203df1096e7108,\SystemRoot\System32\drivers\ql2300i.sys,Microsoft Windows,true,The file is signed and the signature was verified.,Microsoft Windows Production PCA 2011
ST234FAJ,SharedAccess,0,Internet Connection Sharing (ICS),Provides network address translation  addressing  name resolution and/or intrusion prevention services for a home or small office network.,C:\Windows\System32\svchost.exe,fba9363c07dd22802dfc84600441c028,C:\Windows\System32\svchost.exe -k netsvcs,Microsoft Windows,true,The file is signed and the signature was verified.,Microsoft Windows Production PCA 2011
ST234FAJ,FontCache,928,Windows Font Cache Service,Optimizes performance of applications by caching commonly used font data. Applications will start this service if it is not already running. It can be disabled  though doing so will degrade application performance.,C:\Windows\System32\svchost.exe,fba9363c07dd22802dfc84600441c028,C:\Windows\system32\svchost.exe -k LocalService,Microsoft Windows,true,The file is signed and the signature was verified.,Microsoft Windows Production PCA 2011
ST234FAJ,UCX01000,0,USB Controller Extension,,C:\Windows\System32\drivers\UCX01000.SYS,e922434f7881967f38da9c7a3e4b45f1,\SystemRoot\System32\drivers\ucx01000.sys,Microsoft Windows,true,The file is signed and the signature was verified.,Microsoft Windows Production PCA 2011
ST234FAJ,Wecsvc,0,Windows Event Collector,This service manages persistent subscriptions to events from remote sources that support WS-Management protocol. This includes Windows Vista event logs  hardware and IPMI-enabled event sources. The service stores forwarded events in a local Event Log. If this service is stopped or disabled event subscriptions cannot be created and forwarded events cannot be accepted.,C:\Windows\System32\svchost.exe,fba9363c07dd22802dfc84600441c028,C:\Windows\system32\svchost.exe -k NetworkService,Microsoft Windows,true,The file is signed and the signature was verified.,Microsoft Windows Production PCA 2011
ST234FAJ,stornvme,0,Microsoft Standard NVM Express Driver,,C:\Windows\System32\drivers\stornvme.sys,2896e287ade5315dcc4818b5796e472a,\SystemRoot\System32\drivers\stornvme.sys,Microsoft Windows,true,The file is signed and the signature was verified.,Microsoft Windows Production PCA 2011
ST234FAJ,KtmRm,0,KtmRm for Distributed Transaction Coordinator,Coordinates transactions between the Distributed Transaction Coordinator (MSDTC) and the Kernel Transaction Manager (KTM). If it is not needed  it is recommended that this service remain stopped. If it is needed  both MSDTC and KTM will start this service automatically. If this service is disabled  any MSDTC transaction interacting with a Kernel Resource Manager will fail and any services that explicitly depend on it will fail to start.,C:\Windows\System32\svchost.exe,fba9363c07dd22802dfc84600441c028,C:\Windows\System32\svchost.exe -k NetworkServiceAndNoImpersonation,Microsoft Windows,true,The file is signed and the signature was verified.,Microsoft Windows Production PCA 2011
ST234FAJ,1394ohci,0,1394 OHCI Compliant Host Controller,,C:\Windows\System32\drivers\1394ohci.sys,cfbcad5e8c07e9966f844c3fe7bc09de,\SystemRoot\System32\drivers\1394ohci.sys,Microsoft Windows,true,The file is signed and the signature was verified.,Microsoft Windows Production PCA 2011
ST234FAJ,AppMgmt,0,Application Management,Processes installation  removal  and enumeration requests for software deployed through Group Policy. If the service is disabled  users will be unable to install  remove  or enumerate software deployed through Group Policy. If this service is disabled  any services that explicitly depend on it will fail to start.,C:\Windows\System32\svchost.exe,fba9363c07dd22802dfc84600441c028,C:\Windows\system32\svchost.exe -k netsvcs,Microsoft Windows,true,The file is signed and the signature was verified.,Microsoft Windows Production PCA 2011
ST234FAJ,storvsp,0,storvsp,,C:\Windows\System32\drivers\storvsp.sys,fc54e2c69e4f77e985dc1940103181d3,\SystemRoot\System32\drivers\storvsp.sys,Microsoft Windows,true,The file is signed and the signature was verified.,Microsoft Windows Production PCA 2011
ST234FAJ,NetBT,0,NetBT,This service implements NetBios over TCP/IP.,C:\Windows\System32\drivers\netbt.sys,78d0bc6a40f96bd446f0feeba89ad021,System32\DRIVERS\netbt.sys,Microsoft Windows,true,The file is signed and the signature was verified.,Microsoft Windows Production PCA 2011
ST234FAJ,WerSvc,0,Windows Error Reporting Service,Allows errors to be reported when programs stop working or responding and allows existing solutions to be delivered. Also allows logs to be generated for diagnostic and repair services. If this service is stopped  error reporting might not work correctly and results of diagnostic services and repairs might not be displayed.,C:\Windows\System32\svchost.exe,fba9363c07dd22802dfc84600441c028,C:\Windows\System32\svchost.exe -k WerSvcGroup,Microsoft Windows,true,The file is signed and the signature was verified.,Microsoft Windows Production PCA 2011
ST234FAJ,wuauserv,0,Windows Update,Enables the detection  download  and installation of updates for Windows and other programs. If this service is disabled  users of this computer will not be able to use Windows Update or its automatic updating feature  and programs will not be able to use the Windows Update Agent (WUA) API.,C:\Windows\System32\svchost.exe,fba9363c07dd22802dfc84600441c028,C:\Windows\system32\svchost.exe -k netsvcs,Microsoft Windows,true,The file is signed and the signature was verified.,Microsoft Windows Production PCA 2011
ST234FAJ,SENS,888,System Event Notification Service,Monitors system events and notifies subscribers to COM+ Event System of these events.,C:\Windows\System32\svchost.exe,fba9363c07dd22802dfc84600441c028,C:\Windows\system32\svchost.exe -k netsvcs,Microsoft Windows,true,The file is signed and the signature was verified.,Microsoft Windows Production PCA 2011
ST234FAJ,WinMad,0,WinMad Service,,C:\Windows\System32\drivers\winmad.sys,0a12646cc8e22b9555e9d5f5b66f69fe,\SystemRoot\System32\drivers\winmad.sys,Microsoft Windows,true,The file is signed and the signature was verified.,Microsoft Windows Production PCA 2011
ST234FAJ,USBHUB3,0,SuperSpeed Hub,,C:\Windows\System32\drivers\USBHUB3.SYS,b489c2c9bdd05cd3420da5fe480e84dd,\SystemRoot\System32\drivers\UsbHub3.sys,Microsoft Windows,true,The file is signed and the signature was verified.,Microsoft Windows Production PCA 2011
ST234FAJ,WinRM,56,Windows Remote Management (WS-Management),Windows Remote Management (WinRM) service implements the WS-Management protocol for remote management. WS-Management is a standard web services protocol used for remote software and hardware management. The WinRM service listens on the network for WS-Management requests and processes them. The WinRM Service needs to be configured with a listener using winrm.cmd command line tool or through Group Policy in order for it to listen over the network. The WinRM service provides access to WMI data and enables event collection. Event collection and subscription to events require that the service is running. WinRM messages use HTTP and HTTPS as transports. The WinRM service does not depend on IIS but is preconfigured to share a port with IIS on the same machine.  The WinRM service reserves the /wsman URL prefix. To prevent conflicts with IIS  administrators should ensure that any websites hosted on IIS do not use the /wsman URL prefix.,C:\Windows\System32\svchost.exe,fba9363c07dd22802dfc84600441c028,C:\Windows\System32\svchost.exe -k NetworkService,Microsoft Windows,true,The file is signed and the signature was verified.,Microsoft Windows Production PCA 2011
ST234FAJ,ScDeviceEnum,1292,Smart Card Device Enumeration Service,Creates software device nodes for all smart card readers accessible to a given session. If this service is disabled  WinRT APIs will not be able to enumerate smart card readers.,C:\Windows\System32\svchost.exe,fba9363c07dd22802dfc84600441c028,C:\Windows\system32\svchost.exe -k LocalSystemNetworkRestricted,Microsoft Windows,true,The file is signed and the signature was verified.,Microsoft Windows Production PCA 2011
ST234FAJ,hwpolicy,0,Hardware Policy Driver,Contains Processor and other policies,C:\Windows\System32\drivers\hwpolicy.sys,907d79b788bf63cdb2caad702b7f107d,\SystemRoot\System32\drivers\hwpolicy.sys,Microsoft Windows,true,The file is signed and the signature was verified.,Microsoft Windows Production PCA 2011
ST234FAJ,msisadrv,0,msisadrv,,C:\Windows\System32\drivers\msisadrv.sys,5e112401e9cd97d2aef6579a90be7ed8,\SystemRoot\System32\drivers\msisadrv.sys,Microsoft Windows,true,The file is signed and the signature was verified.,Microsoft Windows Production PCA 2011
