hostname,name,pid,descriptivename,description,path,pathmd5sum,arguments,pathcertificatesubject,pathsignatureverified,pathsignaturedescription,pathcertificateissuer
ST234FAJ,RasMan,0,Remote Access Connection Manager,Manages dial-up and virtual private network (VPN) connections from this computer to the Internet or other remote networks. If this service is disabled  any services that explicitly depend on it will fail to start.,C:\Windows\System32\svchost.exe,fba9363c07dd22802dfc84600441c028,C:\Windows\System32\svchost.exe -k netsvcs,Microsoft Windows,true,The file is signed and the signature was verified.,Microsoft Windows Production PCA 2011
ST234FAJ,NDIS,0,NDIS System Driver,NDIS System Driver,C:\Windows\System32\drivers\ndis.sys,3f9d1a866e89fe0f57538ebbd01916d9,\SystemRoot\system32\drivers\ndis.sys,Microsoft Windows,true,The file is signed and the signature was verified.,Microsoft Windows Production PCA 2011
ST234FAJ,rspndr,0,Link-Layer Topology Discovery Responder,,C:\Windows\System32\drivers\rspndr.sys,6848919ff8c78625519729d137cce6f3,\SystemRoot\system32\DRIVERS\rspndr.sys,Microsoft Windows,true,The file is signed and the signature was verified.,Microsoft Windows Production PCA 2011
ST234FAJ,RasPppoe,0,Remote Access PPPOE Driver,Remote Access PPPOE Driver,C:\Windows\System32\drivers\raspppoe.sys,bc2079525b8e2b6fe133ace6b92008bf,\SystemRoot\System32\drivers\raspppoe.sys,Microsoft Windows,true,The file is signed and the signature was verified.,Microsoft Windows Production PCA 2011
ST234FAJ,Filetrace,0,Filetrace,ETW File Trace Filter,C:\Windows\System32\drivers\filetrace.sys,4a6afd85c62efb0dee8ed24f601003d2,system32\drivers\filetrace.sys,Microsoft Windows,true,The file is signed and the signature was verified.,Microsoft Windows Production PCA 2011
ST234FAJ,mouhid,0,Mouse HID Driver,,C:\Windows\System32\drivers\mouhid.sys,72c87c7d784af58b9a20e4386767287b,\SystemRoot\System32\drivers\mouhid.sys,Microsoft Windows,true,The file is signed and the signature was verified.,Microsoft Windows Production PCA 2011
ST234FAJ,usbccgp,0,Microsoft USB Generic Parent Driver,,C:\Windows\System32\drivers\usbccgp.sys,fafa06718d7051806f958814a1dacb64,\SystemRoot\System32\drivers\usbccgp.sys,Microsoft Windows,true,The file is signed and the signature was verified.,Microsoft Windows Production PCA 2011
ST234FAJ,monitor,0,Microsoft Monitor Class Function Driver Service,,C:\Windows\System32\drivers\monitor.sys,b7ac8a05a3c310beb36d48ffc93571ee,\SystemRoot\System32\drivers\monitor.sys,Microsoft Windows,true,The file is signed and the signature was verified.,Microsoft Windows Production PCA 2011
ST234FAJ,cdfs,0,CD/DVD File System Reader,ISO9660/Joliet File System Reader for CD/DVDs. (Core) (All pieces),C:\Windows\System32\drivers\cdfs.sys,31fb4128a01aa57562840b2774c2d55c,system32\DRIVERS\cdfs.sys,Microsoft Windows,true,The file is signed and the signature was verified.,Microsoft Windows Production PCA 2011
ST234FAJ,Browser,0,Computer Browser,Maintains an updated list of computers on the network and supplies this list to computers designated as browsers. If this service is stopped  this list will not be updated or maintained. If this service is disabled  any services that explicitly depend on it will fail to start.,C:\Windows\System32\svchost.exe,fba9363c07dd22802dfc84600441c028,C:\Windows\System32\svchost.exe -k netsvcs,Microsoft Windows,true,The file is signed and the signature was verified.,Microsoft Windows Production PCA 2011
ST234FAJ,tdx,0,NetIO Legacy TDI Support Driver,NetIO Legacy TDI Support Driver,C:\Windows\System32\drivers\tdx.sys,77e394fcb6b4be1b80b57c8f6bba1872,\SystemRoot\system32\DRIVERS\tdx.sys,Microsoft Windows,true,The file is signed and the signature was verified.,Microsoft Windows Production PCA 2011
ST234FAJ,IEEtwCollectorService,0,Internet Explorer ETW Collector Service,ETW Collector Service for Internet Explorer. When running  this service collects real time ETW events and processes them.,C:\Windows\System32\IEEtwCollector.exe,786e60ced843add2ece56206f839b6e6,C:\Windows\system32\IEEtwCollector.exe /V,Microsoft Windows,true,The file is signed and the signature was verified.,Microsoft Windows Production PCA 2011
ST234FAJ,WmiAcpi,0,Microsoft Windows Management Interface for ACPI,,C:\Windows\System32\drivers\wmiacpi.sys,59f7d196f40e6bd9cc202f3d0d5cffc0,\SystemRoot\System32\drivers\wmiacpi.sys,Microsoft Windows,true,The file is signed and the signature was verified.,Microsoft Windows Production PCA 2011
ST234FAJ,Rasl2tp,0,WAN Miniport (L2TP),WAN Miniport (L2TP),C:\Windows\System32\drivers\rasl2tp.sys,a262c7d326b3572d8982539f10d7610a,\SystemRoot\System32\drivers\rasl2tp.sys,Microsoft Windows,true,The file is signed and the signature was verified.,Microsoft Windows Production PCA 2011
ST234FAJ,nvstor,0,nvstor,,C:\Windows\System32\drivers\nvstor.sys,6b4f47df04c22bd9f6355ba1484051a8,\SystemRoot\System32\drivers\nvstor.sys,Microsoft Windows,true,The file is signed and the signature was verified.,Microsoft Windows Production PCA 2011
ST234FAJ,mrxsmb10,0,SMB 1.x MiniRedirector,Implements the SMB 1.x (CIFS) protocol. This protocol provides connectivity to network resources on pre-Windows Vista servers,C:\Windows\System32\drivers\mrxsmb10.sys,eef71469d73153be83cb69361532e57d,system32\DRIVERS\mrxsmb10.sys,Microsoft Windows,true,The file is signed and the signature was verified.,Microsoft Windows Production PCA 2011
ST234FAJ,UmRdpService,1292,Remote Desktop Services UserMode Port Redirector,Allows the redirection of Printers/Drives/Ports for RDP connections,C:\Windows\System32\svchost.exe,fba9363c07dd22802dfc84600441c028,C:\Windows\System32\svchost.exe -k LocalSystemNetworkRestricted,Microsoft Windows,true,The file is signed and the signature was verified.,Microsoft Windows Production PCA 2011
ST234FAJ,ws2ifsl,0,Winsock IFS Driver,Winsock IFS Driver,C:\Windows\System32\drivers\ws2ifsl.sys,3361fe2290272e59dc78ac0ba77ef532,\SystemRoot\system32\drivers\ws2ifsl.sys,Microsoft Windows,true,The file is signed and the signature was verified.,Microsoft Windows Production PCA 2011
ST234FAJ,THREADORDER,0,Thread Ordering Server,Provides ordered execution for a group of threads within a specific period of time.,C:\Windows\System32\svchost.exe,fba9363c07dd22802dfc84600441c028,C:\Windows\system32\svchost.exe -k LocalService,Microsoft Windows,true,The file is signed and the signature was verified.,Microsoft Windows Production PCA 2011
ST234FAJ,IpFilterDriver,0,IP Traffic Filter Driver,IP Traffic Filter Driver,C:\Windows\System32\drivers\ipfltdrv.sys,a99324c59507a8cd1e17a695ff608415,system32\DRIVERS\ipfltdrv.sys,Microsoft Windows,true,The file is signed and the signature was verified.,Microsoft Windows Production PCA 2011
ST234FAJ,wmiApSrv,0,WMI Performance Adapter,Provides performance library information from Windows Management Instrumentation (WMI) providers to clients on the network. This service only runs when Performance Data Helper is activated.,C:\Windows\System32\wbem\WmiApSrv.exe,346b8ea3d3c77d8fb52de5913259dc9a,C:\Windows\system32\wbem\WmiApSrv.exe,Microsoft Windows,true,The file is signed and the signature was verified.,Microsoft Windows Production PCA 2011
ST234FAJ,rdpbus,0,Remote Desktop Device Redirector Bus Driver,,C:\Windows\System32\drivers\rdpbus.sys,ca3e8c166d57cffa63760d20014915b2,\SystemRoot\System32\drivers\rdpbus.sys,Microsoft Windows,true,The file is signed and the signature was verified.,Microsoft Windows Production PCA 2011
ST234FAJ,Dhcp,844,DHCP Client,Registers and updates IP addresses and DNS records for this computer. If this service is stopped  this computer will not receive dynamic IP addresses and DNS updates. If this service is disabled  any services that explicitly depend on it will fail to start.,C:\Windows\System32\svchost.exe,fba9363c07dd22802dfc84600441c028,C:\Windows\system32\svchost.exe -k LocalServiceNetworkRestricted,Microsoft Windows,true,The file is signed and the signature was verified.,Microsoft Windows Production PCA 2011
ST234FAJ,DcomLaunch,688,DCOM Server Process Launcher,The DCOMLAUNCH service launches COM and DCOM servers in response to object activation requests. If this service is stopped or disabled  programs using COM or DCOM will not function properly. It is strongly recommended that you have the DCOMLAUNCH service running.,C:\Windows\System32\svchost.exe,fba9363c07dd22802dfc84600441c028,C:\Windows\system32\svchost.exe -k DcomLaunch,Microsoft Windows,true,The file is signed and the signature was verified.,Microsoft Windows Production PCA 2011
ST234FAJ,dmvsc,0,dmvsc,,C:\Windows\System32\drivers\dmvsc.sys,ce032bbb3cdcba44e2ab3f1659ba13f3,\SystemRoot\System32\drivers\dmvsc.sys,Microsoft Windows,true,The file is signed and the signature was verified.,Microsoft Windows Production PCA 2011
ST234FAJ,bfadi,0,bfadi,,C:\Windows\System32\drivers\bfadi.sys,c934ac77bf0c5171acc074dd942ec7c8,\SystemRoot\System32\drivers\bfadi.sys,Microsoft Windows,true,The file is signed and the signature was verified.,Microsoft Windows Production PCA 2011
ST234FAJ,volmgr,0,Volume Manager Driver,,C:\Windows\System32\drivers\volmgr.sys,3e704b8860b64f3cfb709e9bb1637763,\SystemRoot\System32\drivers\volmgr.sys,Microsoft Windows,true,The file is signed and the signature was verified.,Microsoft Windows Production PCA 2011
ST234FAJ,mountmgr,0,Mount Point Manager,Driver responsible with maintaining persistent drive letters and names for volumes,C:\Windows\System32\drivers\mountmgr.sys,00c14e2cc74fac8402d7250197e4cd3f,\SystemRoot\System32\drivers\mountmgr.sys,Microsoft Windows,true,The file is signed and the signature was verified.,Microsoft Windows Production PCA 2011
ST234FAJ,msiserver,0,Windows Installer,Adds  modifies  and removes applications provided as a Windows Installer (*.msi  *.msp) package. If this service is disabled  any services that explicitly depend on it will fail to start.,C:\Windows\System32\msiexec.exe,79a1af53e332b446a2aab4eadc3f7667,C:\Windows\system32\msiexec.exe /V,Microsoft Windows,true,The file is signed and the signature was verified.,Microsoft Windows Production PCA 2011
ST234FAJ,CertPropSvc,888,Certificate Propagation,Copies user certificates and root certificates from smart cards into the current user's certificate store  detects when a smart card is inserted into a smart card reader  and  if needed  installs the smart card Plug and Play minidriver.,C:\Windows\System32\svchost.exe,fba9363c07dd22802dfc84600441c028,C:\Windows\system32\svchost.exe -k netsvcs,Microsoft Windows,true,The file is signed and the signature was verified.,Microsoft Windows Production PCA 2011
ST234FAJ,RdpVideoMiniport,0,Remote Desktop Video Miniport Driver,,C:\Windows\System32\drivers\rdpvideominiport.sys,81d7eb8afec287307b839770c168f88a,System32\drivers\rdpvideominiport.sys,Microsoft Windows,true,The file is signed and the signature was verified.,Microsoft Windows Production PCA 2011
ST234FAJ,SessionEnv,888,Remote Desktop Configuration,Remote Desktop Configuration service (RDCS) is responsible for all Remote Desktop Services and Remote Desktop related configuration and session maintenance activities that require SYSTEM context. These include per-session temporary folders  RD themes  and RD certificates.,C:\Windows\System32\svchost.exe,fba9363c07dd22802dfc84600441c028,C:\Windows\System32\svchost.exe -k netsvcs,Microsoft Windows,true,The file is signed and the signature was verified.,Microsoft Windows Production PCA 2011
ST234FAJ,UmPass,0,Microsoft UMPass Driver,,C:\Windows\System32\drivers\umpass.sys,80f7933c16500ac084e96158ca70eba7,\SystemRoot\System32\drivers\umpass.sys,Microsoft Windows,true,The file is signed and the signature was verified.,Microsoft Windows Production PCA 2011
ST234FAJ,AmdK8,0,AMD K8 Processor Driver,,C:\Windows\System32\drivers\amdk8.sys,b132406ff520421ba88a78c56e047687,\SystemRoot\System32\drivers\amdk8.sys,Microsoft Windows,true,The file is signed and the signature was verified.,Microsoft Windows Production PCA 2011
ST234FAJ,Tcpip,0,TCP/IP Protocol Driver,TCP/IP Protocol Driver,C:\Windows\System32\drivers\tcpip.sys,c86f8a4d32408f666fb52bc343730199,\SystemRoot\System32\drivers\tcpip.sys,Microsoft Windows,true,The file is signed and the signature was verified.,Microsoft Windows Production PCA 2011
ST234FAJ,CNG,0,CNG,,C:\Windows\System32\drivers\cng.sys,739f3e118f524793dc94f4397a40a873,\SystemRoot\System32\Drivers\cng.sys,Microsoft Windows,true,The file is signed and the signature was verified.,Microsoft Windows Production PCA 2011
ST234FAJ,TsUsbGD,0,Remote Desktop Generic USB Device,,C:\Windows\System32\drivers\TsUsbGD.sys,ac94edcbb165549efb9487791b2f6af6,\SystemRoot\System32\drivers\TsUsbGD.sys,Microsoft Windows,true,The file is signed and the signature was verified.,Microsoft Windows Production PCA 2011
ST234FAJ,defragsvc,0,Optimize drives,Helps the computer run more efficiently by optimizing files on storage drives.,C:\Windows\System32\svchost.exe,fba9363c07dd22802dfc84600441c028,C:\Windows\system32\svchost.exe -k defragsvc,Microsoft Windows,true,The file is signed and the signature was verified.,Microsoft Windows Production PCA 2011
ST234FAJ,MsBridge,0,Microsoft MAC Bridge,Microsoft MAC Bridge,C:\Windows\System32\drivers\bridge.sys,febafece4791013c2f4f6735c1766e06,\SystemRoot\system32\DRIVERS\bridge.sys,Microsoft Windows,true,The file is signed and the signature was verified.,Microsoft Windows Production PCA 2011
ST234FAJ,AppID,0,AppID Driver,Identifies an application and enforces software restriction policies.,C:\Windows\System32\drivers\appid.sys,41aa27b7ebeb761a7707b633af655bc7,\SystemRoot\system32\drivers\appid.sys,Microsoft Windows,true,The file is signed and the signature was verified.,Microsoft Windows Production PCA 2011
ST234FAJ,MTConfig,0,Microsoft Input Configuration Driver,,C:\Windows\System32\drivers\MTConfig.sys,a2f276d429b416d20e68a3d4e2ebbb3f,\SystemRoot\System32\drivers\MTConfig.sys,Microsoft Windows,true,The file is signed and the signature was verified.,Microsoft Windows Production PCA 2011
ST234FAJ,nv_agp,0,NVIDIA nForce AGP Bus Filter,,C:\Windows\System32\drivers\NV_AGP.SYS,d900952b658252eb2788c637adbd31e7,\SystemRoot\System32\drivers\nv_agp.sys,Microsoft Windows,true,The file is signed and the signature was verified.,Microsoft Windows Production PCA 2011
ST234FAJ,vmicvss,0,Hyper-V Volume Shadow Copy Requestor,Coordinates the communications that are required to use Volume Shadow Copy Service to back up applications and data on this virtual machine from the operating system on the physical computer.,C:\Windows\System32\svchost.exe,fba9363c07dd22802dfc84600441c028,C:\Windows\system32\svchost.exe -k LocalSystemNetworkRestricted,Microsoft Windows,true,The file is signed and the signature was verified.,Microsoft Windows Production PCA 2011
ST234FAJ,flpydisk,0,Floppy Disk Driver,,C:\Windows\System32\drivers\flpydisk.sys,7fb03b8d752f4a104be14d915d9527d8,\SystemRoot\System32\drivers\flpydisk.sys,Microsoft Windows,true,The file is signed and the signature was verified.,Microsoft Windows Production PCA 2011
ST234FAJ,UI0Detect,0,Interactive Services Detection,Enables user notification of user input for interactive services  which enables access to dialogs created by interactive services when they appear. If this service is stopped  notifications of new interactive service dialogs will no longer function and there might not be access to interactive service dialogs. If this service is disabled  both notifications of and access to new interactive service dialogs will no longer function.,C:\Windows\System32\UI0Detect.exe,43353a3376cac3e1dc7f022aec2e1136,C:\Windows\system32\UI0Detect.exe,Microsoft Windows,true,The file is signed and the signature was verified.,Microsoft Windows Production PCA 2011
ST234FAJ,mrxsmb,0,SMB MiniRedirector Wrapper and Engine,Implements the framework for the SMB filesystem redirector,C:\Windows\System32\drivers\mrxsmb.sys,f7bb56cc049ae94ac24d69342c93c083,system32\DRIVERS\mrxsmb.sys,Microsoft Windows,true,The file is signed and the signature was verified.,Microsoft Windows Production PCA 2011
ST234FAJ,ndfltr,0,NetworkDirect Service,,C:\Windows\System32\drivers\ndfltr.sys,bf6d3c4c8395dc032b86029d73bbf963,\SystemRoot\System32\drivers\ndfltr.sys,Microsoft Windows,true,The file is signed and the signature was verified.,Microsoft Windows Production PCA 2011
ST234FAJ,kbdhid,0,Keyboard HID Driver,,C:\Windows\System32\drivers\kbdhid.sys,3378ba9f35e9286488983ec2db357259,\SystemRoot\System32\drivers\kbdhid.sys,Microsoft Windows,true,The file is signed and the signature was verified.,Microsoft Windows Production PCA 2011
ST234FAJ,pcmcia,0,pcmcia,,C:\Windows\System32\drivers\pcmcia.sys,8966c2ae86e772ed4cc9223f989d05b1,\SystemRoot\System32\drivers\pcmcia.sys,Microsoft Windows,true,The file is signed and the signature was verified.,Microsoft Windows Production PCA 2011
ST234FAJ,nvraid,0,nvraid,,C:\Windows\System32\drivers\nvraid.sys,602df171c6048446a939b6f7c9197c14,\SystemRoot\System32\drivers\nvraid.sys,Microsoft Windows,true,The file is signed and the signature was verified.,Microsoft Windows Production PCA 2011
ST234FAJ,dot3svc,0,Wired AutoConfig,The Wired AutoConfig (DOT3SVC) service is responsible for performing IEEE 802.1X authentication on Ethernet interfaces. If your current wired network deployment enforces 802.1X authentication  the DOT3SVC service should be configured to run for establishing Layer 2 connectivity and/or providing access to network resources. Wired networks that do not enforce 802.1X authentication are unaffected by the DOT3SVC service.,C:\Windows\System32\svchost.exe,fba9363c07dd22802dfc84600441c028,C:\Windows\system32\svchost.exe -k LocalSystemNetworkRestricted,Microsoft Windows,true,The file is signed and the signature was verified.,Microsoft Windows Production PCA 2011
ST234FAJ,NlaSvc,56,Network Location Awareness,Collects and stores configuration information for the network and notifies programs when this information is modified. If this service is stopped  configuration information might be unavailable. If this service is disabled  any services that explicitly depend on it will fail to start.,C:\Windows\System32\svchost.exe,fba9363c07dd22802dfc84600441c028,C:\Windows\System32\svchost.exe -k NetworkService,Microsoft Windows,true,The file is signed and the signature was verified.,Microsoft Windows Production PCA 2011
ST234FAJ,gencounter,0,Microsoft Hyper-V Generation Counter,,C:\Windows\System32\drivers\vmgencounter.sys,5cc38643f7ac48953fe06d611baa1519,\SystemRoot\System32\drivers\vmgencounter.sys,Microsoft Windows,true,The file is signed and the signature was verified.,Microsoft Windows Production PCA 2011
ST234FAJ,smphost,0,Microsoft Storage Spaces SMP,Host service for the Microsoft Storage Spaces management provider. If this service is stopped or disabled  Storage Spaces cannot be managed.,C:\Windows\System32\svchost.exe,fba9363c07dd22802dfc84600441c028,C:\Windows\System32\svchost.exe -k smphost,Microsoft Windows,true,The file is signed and the signature was verified.,Microsoft Windows Production PCA 2011
ST234FAJ,xenfilt,0,AWS Bus Filter,,C:\Windows\System32\drivers\xenfilt.sys,740ba9ac0d1c67673cb3de4d16f45c7a,\SystemRoot\system32\DRIVERS\xenfilt.sys,Microsoft Windows Hardware Compatibility Publisher,true,The file is signed and the signature was verified.,Microsoft Windows Hardware Compatibility PCA
ST234FAJ,megasr,0,megasr,,C:\Windows\System32\drivers\megasr.sys,e4976ff8e16cf3f535488c8324dfe23c,\SystemRoot\System32\drivers\megasr.sys,Microsoft Windows,true,The file is signed and the signature was verified.,Microsoft Windows Production PCA 2011
ST234FAJ,ErrDev,0,Microsoft Hardware Error Device Driver,,C:\Windows\System32\drivers\errdev.sys,c5eaca31c937dd6878de6c712e54d8a4,\SystemRoot\System32\drivers\errdev.sys,Microsoft Windows,true,The file is signed and the signature was verified.,Microsoft Windows Production PCA 2011
ST234FAJ,qlfcoei,0,QLogic [FCoE] STOR Miniport Inbox Driver (wx64),,C:\Windows\System32\drivers\qlfcoei.sys,5530f7cc74409a06b74835092eaecb08,\SystemRoot\System32\drivers\qlfcoei.sys,Microsoft Windows,true,The file is signed and the signature was verified.,Microsoft Windows Production PCA 2011
ST234FAJ,UEFI,0,Microsoft UEFI Driver,,C:\Windows\System32\drivers\uefi.sys,7db33f49b87df5a493330d150d259245,\SystemRoot\System32\drivers\UEFI.sys,Microsoft Windows,true,The file is signed and the signature was verified.,Microsoft Windows Production PCA 2011
ST234FAJ,iaStorAV,0,Intel(R) SATA RAID Controller Windows,,C:\Windows\System32\drivers\iaStorAV.sys,ede6b051021ec01aa8dfe488951fb111,\SystemRoot\System32\drivers\iaStorAV.sys,Microsoft Windows,true,The file is signed and the signature was verified.,Microsoft Windows Production PCA 2011
ST234FAJ,HyperVideo,0,HyperVideo,,C:\Windows\System32\drivers\HyperVideo.sys,74993f0baaaa1b66040737b32a850e52,\SystemRoot\system32\DRIVERS\HyperVideo.sys,Microsoft Windows,true,The file is signed and the signature was verified.,Microsoft Windows Production PCA 2011
ST234FAJ,wercplsupport,0,Problem Reports and Solutions Control Panel Support,This service provides support for viewing  sending and deletion of system-level problem reports for the Problem Reports and Solutions control panel.,C:\Windows\System32\svchost.exe,fba9363c07dd22802dfc84600441c028,C:\Windows\System32\svchost.exe -k netsvcs,Microsoft Windows,true,The file is signed and the signature was verified.,Microsoft Windows Production PCA 2011
ST234FAJ,cdrom,0,CD-ROM Driver,,C:\Windows\System32\drivers\cdrom.sys,f067dd34df4f2cdbae05a8d6798b0e96,\SystemRoot\System32\drivers\cdrom.sys,Microsoft Windows,true,The file is signed and the signature was verified.,Microsoft Windows Production PCA 2011
ST234FAJ,DiagTrack,1256,Diagnostics Tracking Service,The Diagnostics Tracking Service enables data collection about functional issues in Windows components.,C:\Windows\System32\svchost.exe,fba9363c07dd22802dfc84600441c028,C:\Windows\System32\svchost.exe -k utcsvc,Microsoft Windows,true,The file is signed and the signature was verified.,Microsoft Windows Production PCA 2011
ST234FAJ,Processor,0,Processor Driver,,C:\Windows\System32\drivers\processr.sys,2719c5ae70188cd3e7d6b1c8d22faff1,\SystemRoot\System32\drivers\processr.sys,Microsoft Windows,true,The file is signed and the signature was verified.,Microsoft Windows Production PCA 2011
ST234FAJ,uliagpkx,0,Uli AGP Bus Filter,,C:\Windows\System32\drivers\ULIAGPKX.SYS,c8d9a8d58742c28808d9a7a2a85abc4a,\SystemRoot\System32\drivers\uliagpkx.sys,Microsoft Windows,true,The file is signed and the signature was verified.,Microsoft Windows Production PCA 2011
ST234FAJ,TrkWks,1292,Distributed Link Tracking Client,Maintains links between NTFS files within a computer or across computers in a network.,C:\Windows\System32\svchost.exe,fba9363c07dd22802dfc84600441c028,C:\Windows\System32\svchost.exe -k LocalSystemNetworkRestricted,Microsoft Windows,true,The file is signed and the signature was verified.,Microsoft Windows Production PCA 2011
ST234FAJ,XENBUS,0,AWS PV Bus,,C:\Windows\System32\drivers\xenbus.sys,dccaaad7e60f5b1f37a40f3894a6b1d9,\SystemRoot\system32\DRIVERS\xenbus.sys,Microsoft Windows Hardware Compatibility Publisher,true,The file is signed and the signature was verified.,Microsoft Windows Hardware Compatibility PCA
ST234FAJ,pdc,0,pdc,Power Dependency Coordinator Driver,C:\Windows\System32\drivers\pdc.sys,f48fc3747bb03db5ae391b21edd040c4,\SystemRoot\system32\drivers\pdc.sys,Microsoft Windows,true,The file is signed and the signature was verified.,Microsoft Windows Production PCA 2011
ST234FAJ,mshidkmdf,0,Pass-through HID to KMDF Filter Driver,Device Filter to provide pass-through interface between HIDCLASS and KMDF,C:\Windows\System32\drivers\mshidkmdf.sys,b3bdbec4c6e151f90b231dac1a6bd575,\SystemRoot\System32\drivers\mshidkmdf.sys,Microsoft Windows,true,The file is signed and the signature was verified.,Microsoft Windows Production PCA 2011
ST234FAJ,WacomPen,0,Wacom Serial Pen HID Driver,,C:\Windows\System32\drivers\wacompen.sys,af0a146f4b4ed6aa2576547c95f66b49,\SystemRoot\System32\drivers\wacompen.sys,Microsoft Windows,true,The file is signed and the signature was verified.,Microsoft Windows Production PCA 2011
ST234FAJ,HTTP,0,HTTP Service,HTTP Service,C:\Windows\System32\drivers\http.sys,3c937ca8b6d2facb46e8d8f0aa79b438,system32\drivers\HTTP.sys,Microsoft Windows,true,The file is signed and the signature was verified.,Microsoft Windows Production PCA 2011
ST234FAJ,ec2winutildriver,0,EC2 Windows Utility Agent,,C:\Windows\System32\drivers\EC2WinUtilDriver.sys,0575b56be8a2946f9b95776bfeca31fd,\SystemRoot\System32\drivers\EC2WinUtilDriver.sys,Microsoft Windows Hardware Compatibility Publisher,true,The file is signed and the signature was verified.,Microsoft Windows Hardware Compatibility PCA
ST234FAJ,pla,0,Performance Logs &amp; Alerts,Performance Logs and Alerts Collects performance data from local or remote computers based on preconfigured schedule parameters  then writes the data to a log or triggers an alert. If this service is stopped  performance information will not be collected. If this service is disabled  any services that explicitly depend on it will fail to start.,C:\Windows\System32\svchost.exe,fba9363c07dd22802dfc84600441c028,C:\Windows\System32\svchost.exe -k LocalServiceNoNetwork,Microsoft Windows,true,The file is signed and the signature was verified.,Microsoft Windows Production PCA 2011
ST234FAJ,RasSstp,0,WAN Miniport (SSTP),WAN Miniport (SSTP),C:\Windows\System32\drivers\rassstp.sys,479ca607c195794621a4d9337a0f69ca,\SystemRoot\system32\DRIVERS\rassstp.sys,Microsoft Windows,true,The file is signed and the signature was verified.,Microsoft Windows Production PCA 2011
ST234FAJ,acpipagr,0,ACPI Processor Aggregator Driver,,C:\Windows\System32\drivers\acpipagr.sys,1b9030f263d027731ef00dae3b2b8d7f,\SystemRoot\System32\drivers\acpipagr.sys,Microsoft Windows,true,The file is signed and the signature was verified.,Microsoft Windows Production PCA 2011
