hostname,name,pid,descriptivename,description,path,pathmd5sum,arguments,pathcertificatesubject,pathsignatureverified,pathsignaturedescription,pathcertificateissuer
ST234FAJ,scfilter,0,Smart card PnP Class Filter Driver,Smart card reader filter driver enabling smart card PnP.,C:\Windows\System32\drivers\scfilter.sys,b1a085675eb04ee81417c592cd0a66ca,System32\DRIVERS\scfilter.sys,Microsoft Windows,true,The file is signed and the signature was verified.,Microsoft Windows Production PCA 2011
ST234FAJ,KeyIso,0,CNG Key Isolation,The CNG key isolation service is hosted in the LSA process. The service provides key process isolation to private keys and associated cryptographic operations as required by the Common Criteria. The service stores and uses long-lived keys in a secure process complying with Common Criteria requirements.,C:\Windows\System32\lsass.exe,0612f1945277278ad88bb311abfcbe02,C:\Windows\system32\lsass.exe,Microsoft Windows,true,The file is signed and the signature was verified.,Microsoft Windows Production PCA 2011
ST234FAJ,WinHttpAutoProxySvc,928,WinHTTP Web Proxy Auto-Discovery Service,WinHTTP implements the client HTTP stack and provides developers with a Win32 API and COM Automation component for sending HTTP requests and receiving responses. In addition  WinHTTP provides support for auto-discovering a proxy configuration via its implementation of the Web Proxy Auto-Discovery (WPAD) protocol.,C:\Windows\System32\svchost.exe,fba9363c07dd22802dfc84600441c028,C:\Windows\system32\svchost.exe -k LocalService,Microsoft Windows,true,The file is signed and the signature was verified.,Microsoft Windows Production PCA 2011
ST234FAJ,vpcivsp,0,Microsoft Hyper-V PCI Server,,C:\Windows\System32\drivers\vpcivsp.sys,d621b29c597ea77ab4c534d43cda5eb8,\SystemRoot\System32\drivers\vpcivsp.sys,Microsoft Windows,true,The file is signed and the signature was verified.,Microsoft Windows Production PCA 2011
ST234FAJ,WEPHOSTSVC,0,Windows Encryption Provider Host Service,Windows Encryption Provider Host Service brokers encryption related functionalities from 3rd Party Encryption Providers to processes that need to evaluate and apply EAS policies. Stopping this will compromise EAS compliancy checks that have been established by the connected Mail Accounts,C:\Windows\System32\svchost.exe,fba9363c07dd22802dfc84600441c028,C:\Windows\system32\svchost.exe -k WepHostSvcGroup,Microsoft Windows,true,The file is signed and the signature was verified.,Microsoft Windows Production PCA 2011
ST234FAJ,vhdmp,0,vhdmp,,C:\Windows\System32\drivers\vhdmp.sys,f3c5b2daaf9d9a1056768a1d7715d227,\SystemRoot\System32\drivers\vhdmp.sys,Microsoft Windows,true,The file is signed and the signature was verified.,Microsoft Windows Production PCA 2011
ST234FAJ,WinVerbs,0,WinVerbs Service,,C:\Windows\System32\drivers\winverbs.sys,58e9d195cfe83dcd476b56b7fe35807e,\SystemRoot\System32\drivers\winverbs.sys,Microsoft Windows,true,The file is signed and the signature was verified.,Microsoft Windows Production PCA 2011
ST234FAJ,storahci,0,Microsoft Standard SATA AHCI Driver,,C:\Windows\System32\drivers\storahci.sys,b80f71e43df4862346e4003c02078988,\SystemRoot\System32\drivers\storahci.sys,Microsoft Windows,true,The file is signed and the signature was verified.,Microsoft Windows Production PCA 2011
ST234FAJ,tunnel,0,Microsoft Tunnel Miniport Adapter Driver,,C:\Windows\System32\drivers\tunnel.sys,e7f9a685403452d5234a2a315161a348,\SystemRoot\system32\DRIVERS\tunnel.sys,Microsoft Windows,true,The file is signed and the signature was verified.,Microsoft Windows Production PCA 2011
ST234FAJ,mshidumdf,0,Pass-through HID to UMDF Driver,Device Driver to provide pass-through interface between HIDCLASS and UMDF,C:\Windows\System32\drivers\mshidumdf.sys,2b910dbc368b940b3568de81a729779a,\SystemRoot\System32\drivers\mshidumdf.sys,Microsoft Windows,true,The file is signed and the signature was verified.,Microsoft Windows Production PCA 2011
ST234FAJ,netprofm,928,Network List Service,Identifies the networks to which the computer has connected  collects and stores properties for these networks  and notifies applications when these properties change.,C:\Windows\System32\svchost.exe,fba9363c07dd22802dfc84600441c028,C:\Windows\System32\svchost.exe -k LocalService,Microsoft Windows,true,The file is signed and the signature was verified.,Microsoft Windows Production PCA 2011
ST234FAJ,Ndisuio,0,NDIS Usermode I/O Protocol,,C:\Windows\System32\drivers\ndisuio.sys,7dc479843ed478501f47be5f52265f87,\SystemRoot\system32\DRIVERS\ndisuio.sys,Microsoft Windows,true,The file is signed and the signature was verified.,Microsoft Windows Production PCA 2011
ST234FAJ,xennet,0,AWS PV Network Device,,C:\Windows\System32\drivers\xennet.sys,587bd0a33a4699215769d855c4f911c0,\SystemRoot\system32\DRIVERS\xennet.sys,Microsoft Windows Hardware Compatibility Publisher,true,The file is signed and the signature was verified.,Microsoft Windows Hardware Compatibility PCA
ST234FAJ,KPSSVC,0,KDC Proxy Server service (KPS),KDC Proxy Server service runs on edge servers to proxy Kerberos protocol messages to domain controllers on the corporate network.,C:\Windows\System32\svchost.exe,fba9363c07dd22802dfc84600441c028,C:\Windows\system32\svchost.exe -k KpsSvcGroup,Microsoft Windows,true,The file is signed and the signature was verified.,Microsoft Windows Production PCA 2011
ST234FAJ,vpci,0,Microsoft Hyper-V Virtual PCI Bus,,C:\Windows\System32\drivers\vpci.sys,a5145b64547f94f7925502759bc94c12,\SystemRoot\System32\drivers\vpci.sys,Microsoft Windows,true,The file is signed and the signature was verified.,Microsoft Windows Production PCA 2011
ST234FAJ,xeniface,0,AWS Interface,,C:\Windows\System32\drivers\xeniface.sys,fc7f3b547591c0dfc8c2ec6966a17feb,\SystemRoot\System32\drivers\xeniface.sys,Microsoft Windows Hardware Compatibility Publisher,true,The file is signed and the signature was verified.,Microsoft Windows Hardware Compatibility PCA
ST234FAJ,luafv,0,UAC File Virtualization,Virtualizes file write failures to per-user locations.,C:\Windows\System32\drivers\luafv.sys,0e4088d42304830c01409f2836beb8d8,\SystemRoot\system32\drivers\luafv.sys,Microsoft Windows,true,The file is signed and the signature was verified.,Microsoft Windows Production PCA 2011
ST234FAJ,Parport,0,Parallel port driver,,C:\Windows\System32\drivers\parport.sys,ef78273b4b8621567853cabd34cddefc,\SystemRoot\System32\drivers\parport.sys,Microsoft Windows,true,The file is signed and the signature was verified.,Microsoft Windows Production PCA 2011
ST234FAJ,Audiosrv,0,Windows Audio,Manages audio for Windows-based programs.  If this service is stopped  audio devices and effects will not function properly.  If this service is disabled  any services that explicitly depend on it will fail to start,C:\Windows\System32\svchost.exe,fba9363c07dd22802dfc84600441c028,C:\Windows\System32\svchost.exe -k LocalServiceNetworkRestricted,Microsoft Windows,true,The file is signed and the signature was verified.,Microsoft Windows Production PCA 2011
ST234FAJ,EventLog,844,Windows Event Log,This service manages events and event logs. It supports logging events  querying events  subscribing to events  archiving event logs  and managing event metadata. It can display events in both XML and plain text format. Stopping this service may compromise security and reliability of the system.,C:\Windows\System32\svchost.exe,fba9363c07dd22802dfc84600441c028,C:\Windows\System32\svchost.exe -k LocalServiceNetworkRestricted,Microsoft Windows,true,The file is signed and the signature was verified.,Microsoft Windows Production PCA 2011
ST234FAJ,SCPolicySvc,0,Smart Card Removal Policy,Allows the system to be configured to lock the user desktop upon smart card removal.,C:\Windows\System32\svchost.exe,fba9363c07dd22802dfc84600441c028,C:\Windows\system32\svchost.exe -k netsvcs,Microsoft Windows,true,The file is signed and the signature was verified.,Microsoft Windows Production PCA 2011
ST234FAJ,upnphost,0,UPnP Device Host,Allows UPnP devices to be hosted on this computer. If this service is stopped  any hosted UPnP devices will stop functioning and no additional hosted devices can be added. If this service is disabled  any services that explicitly depend on it will fail to start.,C:\Windows\System32\svchost.exe,fba9363c07dd22802dfc84600441c028,C:\Windows\system32\svchost.exe -k LocalServiceAndNoImpersonation,Microsoft Windows,true,The file is signed and the signature was verified.,Microsoft Windows Production PCA 2011
ST234FAJ,mpsdrv,0,Windows Firewall Authorization Driver,Windows Firewall Authorization Driver is a kernel mode driver that provides deep inspection services on inbound and outbound network traffic.,C:\Windows\System32\drivers\mpsdrv.sys,1ccbca9b1dfba728965d838952de5ad2,System32\drivers\mpsdrv.sys,Microsoft Windows,true,The file is signed and the signature was verified.,Microsoft Windows Production PCA 2011
ST234FAJ,vsmraid,0,vsmraid,,C:\Windows\System32\drivers\vsmraid.sys,86da78d73daad75d3a5020f4beff94f1,\SystemRoot\System32\drivers\vsmraid.sys,Microsoft Windows,true,The file is signed and the signature was verified.,Microsoft Windows Production PCA 2011
ST234FAJ,Schedule,888,Task Scheduler,Enables a user to configure and schedule automated tasks on this computer. The service also hosts multiple Windows system-critical tasks. If this service is stopped or disabled  these tasks will not be run at their scheduled times. If this service is disabled  any services that explicitly depend on it will fail to start.,C:\Windows\System32\svchost.exe,fba9363c07dd22802dfc84600441c028,C:\Windows\system32\svchost.exe -k netsvcs,Microsoft Windows,true,The file is signed and the signature was verified.,Microsoft Windows Production PCA 2011
ST234FAJ,RpcLocator,0,Remote Procedure Call (RPC) Locator,In Windows 2003 and earlier versions of Windows  the Remote Procedure Call (RPC) Locator service manages the RPC name service database. In Windows Vista and later versions of Windows  this service does not provide any functionality and is present for application compatibility.,C:\Windows\System32\Locator.exe,fea4ade414e2d870a3ac9b18ee6e84e3,C:\Windows\system32\locator.exe,Microsoft Windows,true,The file is signed and the signature was verified.,Microsoft Windows Production PCA 2011
ST234FAJ,LSI_SAS2,0,LSI_SAS2,,C:\Windows\System32\drivers\lsi_sas2.sys,319013eab171195915fb5ec7294e5c57,\SystemRoot\System32\drivers\lsi_sas2.sys,Microsoft Windows,true,The file is signed and the signature was verified.,Microsoft Windows Production PCA 2011
ST234FAJ,SpbCx,0,Simple Peripheral Bus Support Library,,C:\Windows\System32\drivers\SpbCx.sys,1ece73cb3b0e3fc83c1839c3ab22899d,system32\drivers\SpbCx.sys,Microsoft Windows,true,The file is signed and the signature was verified.,Microsoft Windows Production PCA 2011
ST234FAJ,partmgr,0,Partition Manager,Disk class filter driver that auctions out partitions to volume managers,C:\Windows\System32\drivers\partmgr.sys,23ff2851f847df6c7bbedf8bd8d29aec,\SystemRoot\System32\drivers\partmgr.sys,Microsoft Windows,true,The file is signed and the signature was verified.,Microsoft Windows Production PCA 2011
ST234FAJ,NdisWan,0,Remote Access NDIS WAN Driver,Remote Access NDIS WAN Driver,C:\Windows\System32\drivers\ndiswan.sys,657659e9ea83b8ccd744b7532306cb0e,\SystemRoot\System32\drivers\ndiswan.sys,Microsoft Windows,true,The file is signed and the signature was verified.,Microsoft Windows Production PCA 2011
ST234FAJ,AppIDSvc,0,Application Identity,Determines and verifies the identity of an application. Disabling this service will prevent AppLocker from being enforced.,C:\Windows\System32\svchost.exe,fba9363c07dd22802dfc84600441c028,C:\Windows\system32\svchost.exe -k LocalServiceNetworkRestricted,Microsoft Windows,true,The file is signed and the signature was verified.,Microsoft Windows Production PCA 2011
ST234FAJ,NdisVirtualBus,0,Microsoft Virtual Network Adapter Enumerator,,C:\Windows\System32\drivers\NdisVirtualBus.sys,d20c066f4b5c95bb936c606154a606d2,\SystemRoot\System32\drivers\NdisVirtualBus.sys,Microsoft Windows,true,The file is signed and the signature was verified.,Microsoft Windows Production PCA 2011
ST234FAJ,SerCx,0,Serial UART Support Library,,C:\Windows\System32\drivers\SerCx.sys,6c6d1cf5a4dd6f915dbb2346720a0aa9,system32\drivers\SerCx.sys,Microsoft Windows,true,The file is signed and the signature was verified.,Microsoft Windows Production PCA 2011
ST234FAJ,BasicDisplay,0,BasicDisplay,,C:\Windows\System32\drivers\BasicDisplay.sys,5c7da51808729fb5caf323a3101ce249,\SystemRoot\System32\drivers\BasicDisplay.sys,Microsoft Windows,true,The file is signed and the signature was verified.,Microsoft Windows Production PCA 2011
ST234FAJ,vxn,0,Intel(R) 10G Virtual Network Connection,,C:\Windows\System32\drivers\vxn64x64.sys,6308b6d39e7ee54e291069fe86cf78b3,\SystemRoot\system32\DRIVERS\vxn64x64.sys,Microsoft Windows Hardware Compatibility Publisher,true,The file is signed and the signature was verified.,Microsoft Windows Third Party Component CA 2012
ST234FAJ,condrv,0,Console Driver,,C:\Windows\System32\drivers\condrv.sys,9049964a15fc7e58a9cff88b8135ed99,System32\drivers\condrv.sys,Microsoft Windows,true,The file is signed and the signature was verified.,Microsoft Windows Production PCA 2011
ST234FAJ,Wdf01000,0,Kernel Mode Driver Frameworks service,,C:\Windows\System32\drivers\Wdf01000.sys,47349ed0c9e7a31eaeae4590536ed572,\SystemRoot\system32\drivers\Wdf01000.sys,Microsoft Windows,true,The file is signed and the signature was verified.,Microsoft Windows Production PCA 2011
ST234FAJ,ksthunk,0,Kernel Streaming Thunks,,C:\Windows\System32\drivers\ksthunk.sys,f356613c8aff6af3ebd2a2c7964721d7,\SystemRoot\system32\drivers\ksthunk.sys,Microsoft Windows,true,The file is signed and the signature was verified.,Microsoft Windows Production PCA 2011
ST234FAJ,LSM,688,Local Session Manager,Core Windows Service that manages local user sessions. Stopping or disabling this service will result in system instability.,C:\Windows\System32\svchost.exe,fba9363c07dd22802dfc84600441c028,C:\Windows\system32\svchost.exe -k DcomLaunch,Microsoft Windows,true,The file is signed and the signature was verified.,Microsoft Windows Production PCA 2011
ST234FAJ,IPNAT,0,IP Network Address Translator,,C:\Windows\System32\drivers\ipnat.sys,08e23e3312950d54b164ca69926cd99c,System32\drivers\ipnat.sys,Microsoft Windows,true,The file is signed and the signature was verified.,Microsoft Windows Production PCA 2011
ST234FAJ,ShellHWDetection,888,Shell Hardware Detection,Provides notifications for AutoPlay hardware events.,C:\Windows\System32\svchost.exe,fba9363c07dd22802dfc84600441c028,C:\Windows\System32\svchost.exe -k netsvcs,Microsoft Windows,true,The file is signed and the signature was verified.,Microsoft Windows Production PCA 2011
ST234FAJ,kdnic,0,Microsoft Kernel Debug Network Miniport (NDIS 6.20),,C:\Windows\System32\drivers\kdnic.sys,85fb5927e650116c920b099ad8601b2a,\SystemRoot\system32\DRIVERS\kdnic.sys,Microsoft Windows,true,The file is signed and the signature was verified.,Microsoft Windows Production PCA 2011
ST234FAJ,vmbusr,0,Virtual Machine Bus Provider,,C:\Windows\System32\drivers\vmbusr.sys,c8cea012d2f200d617d66e3d64a259f8,\SystemRoot\System32\drivers\vmbusr.sys,Microsoft Windows,true,The file is signed and the signature was verified.,Microsoft Windows Production PCA 2011
ST234FAJ,IPMIDRV,0,IPMIDRV,,C:\Windows\System32\drivers\IPMIDrv.sys,da59498aecc79b40621d967d05399b9d,\SystemRoot\System32\drivers\IPMIDrv.sys,Microsoft Windows,true,The file is signed and the signature was verified.,Microsoft Windows Production PCA 2011
ST234FAJ,LSI_SAS,0,LSI_SAS,,C:\Windows\System32\drivers\lsi_sas.sys,4ee3456eafa33b4c57816be04d9e6489,\SystemRoot\System32\drivers\lsi_sas.sys,Microsoft Windows,true,The file is signed and the signature was verified.,Microsoft Windows Production PCA 2011
ST234FAJ,i8042prt,0,i8042 Keyboard and PS/2 Mouse Port Driver,,C:\Windows\System32\drivers\i8042prt.sys,8fa390bc33a01659bc7937205740bb22,\SystemRoot\System32\drivers\i8042prt.sys,Microsoft Windows,true,The file is signed and the signature was verified.,Microsoft Windows Production PCA 2011
ST234FAJ,tsusbhub,0,Remote Desktop USB Hub,,C:\Windows\System32\drivers\tsusbhub.sys,9cb601aa2e85b16be991c2d985e8924e,\SystemRoot\System32\drivers\tsusbhub.sys,Microsoft Windows,true,The file is signed and the signature was verified.,Microsoft Windows Production PCA 2011
ST234FAJ,pciide,0,pciide,,C:\Windows\System32\drivers\pciide.sys,ea42c9d25f93394d7f4ea1f903ade4b4,\SystemRoot\System32\drivers\pciide.sys,Microsoft Windows,true,The file is signed and the signature was verified.,Microsoft Windows Production PCA 2011
ST234FAJ,hkmsvc,0,Health Key and Certificate Management,Provides X.509 certificate and key management services for the Network Access Protection Agent (NAPAgent). Enforcement technologies that use X.509 certificates may not function properly without this service,C:\Windows\System32\svchost.exe,fba9363c07dd22802dfc84600441c028,C:\Windows\System32\svchost.exe -k netsvcs,Microsoft Windows,true,The file is signed and the signature was verified.,Microsoft Windows Production PCA 2011
ST234FAJ,MsLbfoProvider,0,Microsoft Load Balancing/Failover Provider,Microsoft Load Balancing/Failover Provider,C:\Windows\System32\drivers\MsLbfoProvider.sys,9c7af6063a749705554b1bd358636685,\SystemRoot\system32\DRIVERS\MsLbfoProvider.sys,Microsoft Windows,true,The file is signed and the signature was verified.,Microsoft Windows Production PCA 2011
ST234FAJ,RemoteAccess,0,Routing and Remote Access,Offers routing services to businesses in local area and wide area network environments.,C:\Windows\System32\svchost.exe,fba9363c07dd22802dfc84600441c028,C:\Windows\System32\svchost.exe -k netsvcs,Microsoft Windows,true,The file is signed and the signature was verified.,Microsoft Windows Production PCA 2011
ST234FAJ,ACPI,0,Microsoft ACPI Driver,,C:\Windows\System32\drivers\acpi.sys,0ffbb40cf7b8f266a396bda8027f4822,\SystemRoot\System32\drivers\ACPI.sys,Microsoft Windows,true,The file is signed and the signature was verified.,Microsoft Windows Production PCA 2011
ST234FAJ,srvnet,0,srvnet,,C:\Windows\System32\drivers\srvnet.sys,4edc449ed77c9bef53e0415f6db184b6,System32\DRIVERS\srvnet.sys,Microsoft Windows,true,The file is signed and the signature was verified.,Microsoft Windows Production PCA 2011
ST234FAJ,AsyncMac,0,RAS Asynchronous Media Driver,RAS Asynchronous Media Driver,C:\Windows\System32\drivers\asyncmac.sys,afd1b87d84b2162e77fbf103be58b9bc,\SystemRoot\System32\drivers\asyncmac.sys,Microsoft Windows,true,The file is signed and the signature was verified.,Microsoft Windows Production PCA 2011
ST234FAJ,EFS,0,Encrypting File System (EFS),Provides the core file encryption technology used to store encrypted files on NTFS file system volumes. If this service is stopped or disabled  applications will be unable to access encrypted files.,C:\Windows\System32\lsass.exe,0612f1945277278ad88bb311abfcbe02,C:\Windows\System32\lsass.exe,Microsoft Windows,true,The file is signed and the signature was verified.,Microsoft Windows Production PCA 2011
ST234FAJ,disk,0,Disk Driver,,C:\Windows\System32\drivers\disk.sys,fc35246c13ba2ed349b4500603bb93d8,\SystemRoot\System32\drivers\disk.sys,Microsoft Windows,true,The file is signed and the signature was verified.,Microsoft Windows Production PCA 2011
ST234FAJ,volsnap,0,Storage volumes,,C:\Windows\System32\drivers\volsnap.sys,d4b8bb322d7730e7fe4d9842a3270d57,\SystemRoot\System32\drivers\volsnap.sys,Microsoft Windows,true,The file is signed and the signature was verified.,Microsoft Windows Production PCA 2011
ST234FAJ,MSDTC,1132,Distributed Transaction Coordinator,Coordinates transactions that span multiple resource managers  such as databases  message queues  and file systems. If this service is stopped  these transactions will fail. If this service is disabled  any services that explicitly depend on it will fail to start.,C:\Windows\System32\msdtc.exe,dc5da42fc2fa9c4b43a2c155df063cd9,C:\Windows\System32\msdtc.exe,Microsoft Windows,true,The file is signed and the signature was verified.,Microsoft Windows Production PCA 2011
ST234FAJ,tcpipreg,0,TCP/IP Registry Compatibility,Provides compatibility for legacy applications which interact with TCP/IP through the registry. If this service is stopped  certain applications may have impaired functionality.,C:\Windows\System32\drivers\tcpipreg.sys,a13bd0c5050e92334f96f532176c52d7,System32\drivers\tcpipreg.sys,Microsoft Windows,true,The file is signed and the signature was verified.,Microsoft Windows Production PCA 2011
ST234FAJ,AudioEndpointBuilder,0,Windows Audio Endpoint Builder,Manages audio devices for the Windows Audio service.  If this service is stopped  audio devices and effects will not function properly.  If this service is disabled  any services that explicitly depend on it will fail to start,C:\Windows\System32\svchost.exe,fba9363c07dd22802dfc84600441c028,C:\Windows\System32\svchost.exe -k LocalSystemNetworkRestricted,Microsoft Windows,true,The file is signed and the signature was verified.,Microsoft Windows Production PCA 2011
ST234FAJ,bxois,0,Broadcom NetXtreme II Offload iSCSI Driver,,C:\Windows\System32\drivers\bxois.sys,dfa439661c463fb6d4e2a443353e111a,\SystemRoot\System32\drivers\bxois.sys,Microsoft Windows,true,The file is signed and the signature was verified.,Microsoft Windows Production PCA 2011
ST234FAJ,iScsiPrt,0,iScsiPort Driver,,C:\Windows\System32\drivers\msiscsi.sys,ba1b3408700d2414f2643fa795734fc1,\SystemRoot\System32\drivers\msiscsi.sys,Microsoft Windows,true,The file is signed and the signature was verified.,Microsoft Windows Production PCA 2011
ST234FAJ,NDISWANLEGACY,0,Remote Access LEGACY NDIS WAN Driver,Remote Access LEGACY NDIS WAN Driver,C:\Windows\System32\drivers\ndiswan.sys,657659e9ea83b8ccd744b7532306cb0e,\SystemRoot\system32\DRIVERS\ndiswan.sys,Microsoft Windows,true,The file is signed and the signature was verified.,Microsoft Windows Production PCA 2011
ST234FAJ,VSTXRAID,0,VIA StorX Storage RAID Controller Windows Driver,,C:\Windows\System32\drivers\VSTXRAID.SYS,09688e46976d37b77c965a901faeeb74,\SystemRoot\System32\drivers\vstxraid.sys,Microsoft Windows,true,The file is signed and the signature was verified.,Microsoft Windows Production PCA 2011
ST234FAJ,NdisTapi,0,Remote Access NDIS TAPI Driver,Remote Access NDIS TAPI Driver,C:\Windows\System32\drivers\ndistapi.sys,ed24959a2f558d403388e8ddb4880391,\SystemRoot\system32\DRIVERS\ndistapi.sys,Microsoft Windows,true,The file is signed and the signature was verified.,Microsoft Windows Production PCA 2011
ST234FAJ,intelppm,0,Intel Processor Driver,,C:\Windows\System32\drivers\intelppm.sys,09a7c4283228e1a8eb2e2d07887b15b4,\SystemRoot\System32\drivers\intelppm.sys,Microsoft Windows,true,The file is signed and the signature was verified.,Microsoft Windows Production PCA 2011
ST234FAJ,Netman,0,Network Connections,Manages objects in the Network and Dial-Up Connections folder  in which you can view both local area network and remote connections.,C:\Windows\System32\svchost.exe,fba9363c07dd22802dfc84600441c028,C:\Windows\System32\svchost.exe -k LocalSystemNetworkRestricted,Microsoft Windows,true,The file is signed and the signature was verified.,Microsoft Windows Production PCA 2011
ST234FAJ,CryptSvc,56,Cryptographic Services,Provides three management services: Catalog Database Service  which confirms the signatures of Windows files and allows new programs to be installed; Protected Root Service  which adds and removes Trusted Root Certification Authority certificates from this computer; and Automatic Root Certificate Update Service  which retrieves root certificates from Windows Update and enable scenarios such as SSL. If this service is stopped  these management services will not function properly. If this service is disabled  any services that explicitly depend on it will fail to start.,C:\Windows\System32\svchost.exe,fba9363c07dd22802dfc84600441c028,C:\Windows\system32\svchost.exe -k NetworkService,Microsoft Windows,true,The file is signed and the signature was verified.,Microsoft Windows Production PCA 2011
ST234FAJ,Serial,0,Serial port driver,,C:\Windows\System32\drivers\serial.sys,7a6fccfd62f3d2cb12f96f313d755d78,\SystemRoot\System32\drivers\serial.sys,Microsoft Windows,true,The file is signed and the signature was verified.,Microsoft Windows Production PCA 2011
ST234FAJ,bowser,0,Browser Support Driver,Implements the kernel datagram receiver for the computer browser browser service.,C:\Windows\System32\drivers\bowser.sys,e3f506aa7d52c3632bf887a14d0bad48,system32\DRIVERS\bowser.sys,Microsoft Windows,true,The file is signed and the signature was verified.,Microsoft Windows Production PCA 2011
ST234FAJ,mssmbios,0,Microsoft System Management BIOS Driver,,C:\Windows\System32\drivers\mssmbios.sys,3ea80b9b875573ca6c71ea0a7c5be6cf,\SystemRoot\System32\drivers\mssmbios.sys,Microsoft Windows,true,The file is signed and the signature was verified.,Microsoft Windows Production PCA 2011
ST234FAJ,swprv,0,Microsoft Software Shadow Copy Provider,Manages software-based volume shadow copies taken by the Volume Shadow Copy service. If this service is stopped  software-based volume shadow copies cannot be managed. If this service is disabled  any services that explicitly depend on it will fail to start.,C:\Windows\System32\svchost.exe,fba9363c07dd22802dfc84600441c028,C:\Windows\System32\svchost.exe -k swprv,Microsoft Windows,true,The file is signed and the signature was verified.,Microsoft Windows Production PCA 2011
