hostname,name,pid,descriptivename,description,path,pathmd5sum,arguments,pathcertificatesubject,pathsignatureverified,pathsignaturedescription,pathcertificateissuer
EE171MIY,rdpbus,0,Remote Desktop Device Redirector Bus Driver,,C:\Windows\System32\drivers\rdpbus.sys,4367ca823f0c5015205d7d65094b49d5,\SystemRoot\system32\drivers\rdpbus.sys,Microsoft Windows,true,The file is signed and the signature was verified.,Microsoft Windows Verification PCA
EE171MIY,TrkWks,244,Distributed Link Tracking Client,Maintains links between NTFS files within a computer or across computers in a network.,C:\Windows\System32\svchost.exe,aa51ceaff93cd76a18af70c36d7c2899,C:\Windows\System32\svchost.exe -k LocalSystemNetworkRestricted,Microsoft Windows,true,The file is signed and the signature was verified.,Microsoft Windows Verification PCA
EE171MIY,amdxata,0,amdxata,,C:\Windows\System32\drivers\amdxata.sys,287b1805603894ca14074b77c58ae1b1,\SystemRoot\system32\drivers\amdxata.sys,Microsoft Windows,true,The file is signed and the signature was verified.,Microsoft Windows Verification PCA
EE171MIY,VgaSave,0,VgaSave,,C:\Windows\System32\drivers\vga.sys,0a6d5e3d89f0ccf0ec1bd1fa937165d1,\SystemRoot\System32\drivers\vga.sys,Microsoft Windows,true,The file is signed and the signature was verified.,Microsoft Windows Verification PCA
EE171MIY,gagp30kx,0,Microsoft Generic AGPv3.0 Filter for K8 Processor Platforms,,C:\Windows\System32\drivers\GAGP30KX.SYS,6f5e02afe964dd0d66004079f8ef16f9,\SystemRoot\system32\drivers\gagp30kx.sys,Microsoft Windows,true,The file is signed and the signature was verified.,Microsoft Windows Verification PCA
EE171MIY,SiSRaid4,0,SiSRaid4,,C:\Windows\System32\drivers\sisraid4.sys,bf7e67125bdefca2656c6cc77f4001b2,\SystemRoot\system32\drivers\sisraid4.sys,Microsoft Windows,true,The file is signed and the signature was verified.,Microsoft Windows Verification PCA
EE171MIY,lltdsvc,0,Link-Layer Topology Discovery Mapper,Creates a Network Map  consisting of PC and device topology (connectivity) information  and metadata describing each PC and device.  If this service is disabled  the Network Map will not function properly.,C:\Windows\System32\svchost.exe,aa51ceaff93cd76a18af70c36d7c2899,C:\Windows\System32\svchost.exe -k LocalService,Microsoft Windows,true,The file is signed and the signature was verified.,Microsoft Windows Verification PCA
EE171MIY,HDAudBus,0,Microsoft UAA Bus Driver for High Definition Audio,,C:\Windows\System32\drivers\hdaudbus.sys,1b1338a3c9848af2eaa52a3839f8b90a,\SystemRoot\system32\drivers\HDAudBus.sys,Microsoft Windows,true,The file is signed and the signature was verified.,Microsoft Windows Verification PCA
EE171MIY,AcpiPmi,0,ACPI Power Meter Driver,,C:\Windows\System32\drivers\acpipmi.sys,911884a6daa16211915bd5ebed5037f2,\SystemRoot\system32\drivers\acpipmi.sys,Microsoft Windows,true,The file is signed and the signature was verified.,Microsoft Windows Verification PCA
EE171MIY,ErrDev,0,Microsoft Hardware Error Device Driver,,C:\Windows\System32\drivers\errdev.sys,f93fb80fc03e6d5bf93b50459c162d5d,\SystemRoot\system32\drivers\errdev.sys,Microsoft Windows,true,The file is signed and the signature was verified.,Microsoft Windows Verification PCA
EE171MIY,pcw,0,Performance Counters for Windows Driver,,C:\Windows\System32\drivers\pcw.sys,60de6f25217b7ca03b12ed06dcda7e3b,\SystemRoot\System32\drivers\pcw.sys,Microsoft Windows,true,The file is signed and the signature was verified.,Microsoft Windows Verification PCA
EE171MIY,uliagpkx,0,Uli AGP Bus Filter,,C:\Windows\System32\drivers\ULIAGPKX.SYS,b6ac7dd8ffb274644cc2bf44deb198cf,\SystemRoot\system32\drivers\uliagpkx.sys,Microsoft Windows,true,The file is signed and the signature was verified.,Microsoft Windows Verification PCA
EE171MIY,Compbatt,0,Compbatt,,C:\Windows\System32\drivers\compbatt.sys,4e3ab2a8dc2a9823f34881828d2b61eb,\SystemRoot\system32\drivers\compbatt.sys,Microsoft Windows,true,The file is signed and the signature was verified.,Microsoft Windows Verification PCA
EE171MIY,Tcpip,0,TCP/IP Protocol Driver,TCP/IP Protocol Driver,C:\Windows\System32\drivers\tcpip.sys,0f9719c612d18755bcd5cf5d8ea28c6f,\SystemRoot\System32\drivers\tcpip.sys,Microsoft Windows,true,The file is signed and the signature was verified.,Microsoft Windows Verification PCA
EE171MIY,DPS,768,Diagnostic Policy Service,The Diagnostic Policy Service enables problem detection  troubleshooting and resolution for Windows components.  If this service is stopped  diagnostics will no longer function.,C:\Windows\System32\svchost.exe,aa51ceaff93cd76a18af70c36d7c2899,C:\Windows\System32\svchost.exe -k LocalServiceNoNetwork,Microsoft Windows,true,The file is signed and the signature was verified.,Microsoft Windows Verification PCA
EE171MIY,HTTP,0,HTTP,This service implements the hypertext transfer protocol (HTTP). If this service is disabled  any services that explicitly depend on it will fail to start.,C:\Windows\System32\drivers\http.sys,728c81465ed22eacde4bf9fcdcec5a40,system32\drivers\HTTP.sys,Microsoft Windows,true,The file is signed and the signature was verified.,Microsoft Windows Verification PCA
EE171MIY,AppID,0,AppID Driver,Identifies an application and enforces software restriction policies.,C:\Windows\System32\drivers\appid.sys,a24aae0f58348fac6a6c85eb5016150f,\SystemRoot\system32\drivers\appid.sys,Microsoft Windows,true,The file is signed and the signature was verified.,Microsoft Windows Verification PCA
EE171MIY,IKEEXT,968,IKE and AuthIP IPsec Keying Modules,The IKEEXT service hosts the Internet Key Exchange (IKE) and Authenticated Internet Protocol (AuthIP) keying modules. These keying modules are used for authentication and key exchange in Internet Protocol security (IPsec). Stopping or disabling the IKEEXT service will disable IKE and AuthIP key exchange with peer computers. IPsec is typically configured to use IKE or AuthIP; therefore  stopping or disabling the IKEEXT service might result in an IPsec failure and might compromise the security of the system. It is strongly recommended that you have the IKEEXT service running.,C:\Windows\System32\svchost.exe,aa51ceaff93cd76a18af70c36d7c2899,C:\Windows\system32\svchost.exe -k netsvcs,Microsoft Windows,true,The file is signed and the signature was verified.,Microsoft Windows Verification PCA
EE171MIY,RSoPProv,0,Resultant Set of Policy Provider,Provides a network service that processes requests to simulate application of Group Policy settings for a target user or computer in various situations and computes the Resultant Set of Policy settings.,C:\Windows\System32\rsopprov.exe,df0011a4063a37304819db9bb6c1fcf9,C:\Windows\system32\RSoPProv.exe,Microsoft Windows,true,The file is signed and the signature was verified.,Microsoft Windows Verification PCA
EE171MIY,NetBT,0,NetBT,This service implements NetBios over TCP/IP.,C:\Windows\System32\drivers\netbt.sys,fcce3ce6a9520dfd877ddf12d781a0dc,System32\DRIVERS\netbt.sys,Microsoft Windows,true,The file is signed and the signature was verified.,Microsoft Windows Verification PCA
EE171MIY,IPNAT,0,IP Network Address Translator,,C:\Windows\System32\drivers\ipnat.sys,b2c38fb90be2c31aef857dfee5f23119,System32\drivers\ipnat.sys,Microsoft Windows,true,The file is signed and the signature was verified.,Microsoft Windows Verification PCA
EE171MIY,BrUsbSer,0,Brother MFC USB Serial WDM Driver,,C:\Windows\System32\drivers\BrUsbSer.sys,0854afd0af6c94fdd44c3e865aeff063,\SystemRoot\System32\Drivers\BrUsbSer.sys,Microsoft Windows,true,The file is signed and the signature was verified.,Microsoft Windows Verification PCA
EE171MIY,FltMgr,0,FltMgr,File System Filter Manager Driver,C:\Windows\System32\drivers\fltMgr.sys,2714a69484f67242a8b9b5144db1fa69,\SystemRoot\system32\drivers\fltmgr.sys,Microsoft Windows,true,The file is signed and the signature was verified.,Microsoft Windows Verification PCA
EE171MIY,partmgr,0,Partition Manager,Disk class filter driver that auctions out partitions to volume managers,C:\Windows\System32\drivers\partmgr.sys,01664136e99715f5fcd03e7daca20d8b,\SystemRoot\System32\drivers\partmgr.sys,Microsoft Windows,true,The file is signed and the signature was verified.,Microsoft Windows Verification PCA
EE171MIY,Ndisuio,0,NDIS Usermode I/O Protocol,,C:\Windows\System32\drivers\ndisuio.sys,76a78fee621ae5234f69b217c1d38566,system32\DRIVERS\ndisuio.sys,Microsoft Windows,true,The file is signed and the signature was verified.,Microsoft Windows Verification PCA
EE171MIY,ws2ifsl,0,Winsock IFS Driver,Winsock IFS Driver,C:\Windows\System32\drivers\ws2ifsl.sys,108fc8453d4b6c539edbc26f382cad8c,\SystemRoot\system32\drivers\ws2ifsl.sys,Microsoft Windows,true,The file is signed and the signature was verified.,Microsoft Windows Verification PCA
EE171MIY,eventlog,932,Windows Event Log,This service manages events and event logs. It supports logging events  querying events  subscribing to events  archiving event logs  and managing event metadata. It can display events in both XML and plain text format. Stopping this service may compromise security and reliability of the system.,C:\Windows\System32\svchost.exe,aa51ceaff93cd76a18af70c36d7c2899,C:\Windows\System32\svchost.exe -k LocalServiceNetworkRestricted,Microsoft Windows,true,The file is signed and the signature was verified.,Microsoft Windows Verification PCA
EE171MIY,usbprint,0,Microsoft USB PRINTER Class,,C:\Windows\System32\drivers\usbprint.sys,3ae8121b2b243590142926867b3a913b,\SystemRoot\system32\drivers\usbprint.sys,Microsoft Windows,true,The file is signed and the signature was verified.,Microsoft Windows Verification PCA
EE171MIY,CompositeBus,0,Composite Bus Enumerator Driver,,C:\Windows\System32\drivers\CompositeBus.sys,4ad9ac31760f8fb79734239459b8488c,\SystemRoot\system32\drivers\CompositeBus.sys,Microsoft Windows,true,The file is signed and the signature was verified.,Microsoft Windows Verification PCA
EE171MIY,cdrom,0,cdrom,,C:\Windows\System32\drivers\cdrom.sys,b9eaefe75e2c1d81bf3115123efe876d,\SystemRoot\system32\drivers\cdrom.sys,Microsoft Windows,true,The file is signed and the signature was verified.,Microsoft Windows Verification PCA
EE171MIY,AppMgmt,0,Application Management,Processes installation  removal  and enumeration requests for software deployed through Group Policy. If the service is disabled  users will be unable to install  remove  or enumerate software deployed through Group Policy. If this service is disabled  any services that explicitly depend on it will fail to start.,C:\Windows\System32\svchost.exe,aa51ceaff93cd76a18af70c36d7c2899,C:\Windows\system32\svchost.exe -k netsvcs,Microsoft Windows,true,The file is signed and the signature was verified.,Microsoft Windows Verification PCA
EE171MIY,VSS,0,Volume Shadow Copy,Manages and implements Volume Shadow Copies used for backup and other purposes. If this service is stopped  shadow copies will be unavailable for backup and the backup may fail. If this service is disabled  any services that explicitly depend on it will fail to start.,C:\Windows\System32\VSSVC.exe,71cd89faa507c9979fd1048acad3cdfc,C:\Windows\system32\vssvc.exe,Microsoft Windows,true,The file is signed and the signature was verified.,Microsoft Windows Verification PCA
EE171MIY,WerSvc,0,Windows Error Reporting Service,Allows errors to be reported when programs stop working or responding and allows existing solutions to be delivered. Also allows logs to be generated for diagnostic and repair services. If this service is stopped  error reporting might not work correctly and results of diagnostic services and repairs might not be displayed.,C:\Windows\System32\svchost.exe,aa51ceaff93cd76a18af70c36d7c2899,C:\Windows\System32\svchost.exe -k WerSvcGroup,Microsoft Windows,true,The file is signed and the signature was verified.,Microsoft Windows Verification PCA
EE171MIY,clr_optimization_v2.0.50727_64,0,Microsoft .NET Framework NGEN v2.0.50727_X64,Microsoft .NET Framework NGEN,C:\Windows\Microsoft.NET\Framework64\v2.0.50727\mscorsvw.exe,9104c5755b0bf7f6f626f458d8e5d90b,C:\Windows\Microsoft.NET\Framework64\v2.0.50727\mscorsvw.exe,Microsoft Windows,true,The file is signed and the signature was verified.,Microsoft Windows Verification PCA
EE171MIY,RDPENCDD,0,RDP Encoder Mirror Driver,RDP Encoder Mirror Driver,C:\Windows\System32\drivers\RDPENCDD.sys,7251db59dbd92f7368da1a34817eed1d,system32\drivers\rdpencdd.sys,Microsoft Windows,true,The file is signed and the signature was verified.,Microsoft Windows Verification PCA
EE171MIY,CLFS,0,Common Log (CLFS),General-purpose logging service,C:\Windows\System32\clfs.sys,7c4d94d0ace1ca2c062204af2b05789c,\SystemRoot\System32\CLFS.sys,Microsoft Windows,true,The file is signed and the signature was verified.,Microsoft Windows Verification PCA
EE171MIY,amdsata,0,amdsata,,C:\Windows\System32\drivers\amdsata.sys,c50211b5647efc4df292d7e0cd071e3a,\SystemRoot\system32\drivers\amdsata.sys,Microsoft Windows,true,The file is signed and the signature was verified.,Microsoft Windows Verification PCA
EE171MIY,Smb,0,Message-oriented TCP/IP and TCP/IPv6 Protocol (SMB session),Microsoft NetbiosSmb Device Driver,C:\Windows\System32\drivers\smb.sys,ce39e575db94e7f5274e5a7a99674802,system32\DRIVERS\smb.sys,Microsoft Windows,true,The file is signed and the signature was verified.,Microsoft Windows Verification PCA
EE171MIY,vioscsi,0,vioscsi,,C:\Windows\System32\drivers\vioscsi.sys,a5e3e091b3e7e4c52b9e7c0168510964,\SystemRoot\system32\drivers\vioscsi.sys,Google Inc,true,The file is signed and the signature was verified.,Symantec Class 3 SHA256 Code Signing CA
EE171MIY,mrxsmb10,0,SMB 1.x MiniRedirector,Implements the SMB 1.x (CIFS) protocol. This protocol provides connectivity to network resources on pre-Windows Vista servers,C:\Windows\System32\drivers\mrxsmb10.sys,5e062654b29c45e68c953a6816f8917d,system32\DRIVERS\mrxsmb10.sys,Microsoft Windows,true,The file is signed and the signature was verified.,Microsoft Windows Verification PCA
EE171MIY,w32time,828,Windows Time,Maintains date and time synchronization on all clients and servers in the network. If this service is stopped  date and time synchronization will be unavailable. If this service is disabled  any services that explicitly depend on it will fail to start.,C:\Windows\System32\svchost.exe,aa51ceaff93cd76a18af70c36d7c2899,C:\Windows\system32\svchost.exe -k LocalService,Microsoft Windows,true,The file is signed and the signature was verified.,Microsoft Windows Verification PCA
EE171MIY,EFS,0,Encrypting File System (EFS),Provides the core file encryption technology used to store encrypted files on NTFS file system volumes. If this service is stopped or disabled  applications will be unable to access encrypted files.,C:\Windows\System32\lsass.exe,2b59d3f1b81999abd58d3335d87ca799,C:\Windows\System32\lsass.exe,Microsoft Windows,true,The file is signed and the signature was verified.,Microsoft Windows Verification PCA
EE171MIY,AxInstSV,0,ActiveX Installer (AxInstSV),Provides User Account Control validation for the installation of ActiveX controls from the Internet and enables management of ActiveX control installation based on Group Policy settings. This service is started on demand and if disabled the installation of ActiveX controls will behave according to default browser settings.,C:\Windows\System32\svchost.exe,aa51ceaff93cd76a18af70c36d7c2899,C:\Windows\system32\svchost.exe -k AxInstSVGroup,Microsoft Windows,true,The file is signed and the signature was verified.,Microsoft Windows Verification PCA
EE171MIY,TsUsbFlt,0,TsUsbFlt,Remote Desktop USB Hub Class Filter Driver,C:\Windows\System32\drivers\TsUsbFlt.sys,7fe86144bdd4be66d7f974d00de67ad3,system32\drivers\tsusbflt.sys,Microsoft Windows,true,The file is signed and the signature was verified.,Microsoft Windows Verification PCA
EE171MIY,DiagTrack,1084,Diagnostics Tracking Service,The Diagnostics Tracking Service enables data collection about functional issues in Windows components.,C:\Windows\System32\svchost.exe,aa51ceaff93cd76a18af70c36d7c2899,C:\Windows\System32\svchost.exe -k utcsvc,Microsoft Windows,true,The file is signed and the signature was verified.,Microsoft Windows Verification PCA
EE171MIY,sppuinotify,0,SPP Notification Service,Provides Software Licensing activation and notification,C:\Windows\System32\svchost.exe,aa51ceaff93cd76a18af70c36d7c2899,C:\Windows\system32\svchost.exe -k LocalService,Microsoft Windows,true,The file is signed and the signature was verified.,Microsoft Windows Verification PCA
EE171MIY,BrSerWdm,0,Brother WDM Serial driver,,C:\Windows\System32\drivers\BrSerWdm.sys,b273809ae1bcfbb9698ca88eb31fc525,\SystemRoot\System32\Drivers\BrSerWdm.sys,Microsoft Windows,true,The file is signed and the signature was verified.,Microsoft Windows Verification PCA
EE171MIY,swprv,0,Microsoft Software Shadow Copy Provider,Manages software-based volume shadow copies taken by the Volume Shadow Copy service. If this service is stopped  software-based volume shadow copies cannot be managed. If this service is disabled  any services that explicitly depend on it will fail to start.,C:\Windows\System32\svchost.exe,aa51ceaff93cd76a18af70c36d7c2899,C:\Windows\System32\svchost.exe -k swprv,Microsoft Windows,true,The file is signed and the signature was verified.,Microsoft Windows Verification PCA
EE171MIY,MMCSS,0,Multimedia Class Scheduler,Enables relative prioritization of work based on system-wide task priorities. This is intended mainly for multimedia applications.  If this service is stopped  individual tasks resort to their default priority.,C:\Windows\System32\svchost.exe,aa51ceaff93cd76a18af70c36d7c2899,C:\Windows\system32\svchost.exe -k netsvcs,Microsoft Windows,true,The file is signed and the signature was verified.,Microsoft Windows Verification PCA
EE171MIY,storflt,0,Disk Virtual Machine Bus Acceleration Filter Driver,,C:\Windows\System32\drivers\vmstorfl.sys,dd888ff9bbeda8b9179cbf7cdd437c9a,\SystemRoot\system32\drivers\vmstorfl.sys,Microsoft Windows,true,The file is signed and the signature was verified.,Microsoft Windows Verification PCA
EE171MIY,pci,0,PCI Bus Driver,,C:\Windows\System32\drivers\pci.sys,a79bb3661adb86213b0bafc94510ccaa,\SystemRoot\system32\drivers\pci.sys,Microsoft Windows,true,The file is signed and the signature was verified.,Microsoft Windows Verification PCA
EE171MIY,Netlogon,0,Netlogon,Maintains a secure channel between this computer and the domain controller for authenticating users and services. If this service is stopped  the computer may not authenticate users and services and the domain controller cannot register DNS records. If this service is disabled  any services that explicitly depend on it will fail to start.,C:\Windows\System32\lsass.exe,2b59d3f1b81999abd58d3335d87ca799,C:\Windows\system32\lsass.exe,Microsoft Windows,true,The file is signed and the signature was verified.,Microsoft Windows Verification PCA
EE171MIY,discache,0,System Attribute Cache,Attribute Cache Indexer,C:\Windows\System32\drivers\discache.sys,c3c079c72ea9051f2ee14a3c728aace8,System32\drivers\discache.sys,Microsoft Windows,true,The file is signed and the signature was verified.,Microsoft Windows Verification PCA
EE171MIY,lltdio,0,Link-Layer Topology Discovery Mapper I/O Driver,,C:\Windows\System32\drivers\lltdio.sys,60eb4f10b2e8056aae8a969e64caaf17,system32\DRIVERS\lltdio.sys,Microsoft Windows,true,The file is signed and the signature was verified.,Microsoft Windows Verification PCA
EE171MIY,DXGKrnl,0,LDDM Graphics Subsystem,Controls the underlying video driver stacks to provide fully-featured display capabilities.,C:\Windows\System32\drivers\dxgkrnl.sys,bf7a2c2e1ead6792cfcf2a4aa53e27cd,\SystemRoot\System32\drivers\dxgkrnl.sys,Microsoft Windows,true,The file is signed and the signature was verified.,Microsoft Windows Verification PCA
EE171MIY,nvstor,0,nvstor,,C:\Windows\System32\drivers\nvstor.sys,ebdc39e008d723a3d16ea61d76b136fb,\SystemRoot\system32\drivers\nvstor.sys,Microsoft Windows,true,The file is signed and the signature was verified.,Microsoft Windows Verification PCA
EE171MIY,SSDPSRV,0,SSDP Discovery,Discovers networked devices and services that use the SSDP discovery protocol  such as UPnP devices. Also announces SSDP devices and services running on the local computer. If this service is stopped  SSDP-based devices will not be discovered. If this service is disabled  any services that explicitly depend on it will fail to start.,C:\Windows\System32\svchost.exe,aa51ceaff93cd76a18af70c36d7c2899,C:\Windows\system32\svchost.exe -k LocalServiceAndNoImpersonation,Microsoft Windows,true,The file is signed and the signature was verified.,Microsoft Windows Verification PCA
EE171MIY,DfsC,0,DFS Namespace Client Driver,Client driver for access to DFS Namespaces,C:\Windows\System32\drivers\dfsc.sys,435e5b3854d82353e871f926d5300ec7,System32\Drivers\dfsc.sys,Microsoft Windows,true,The file is signed and the signature was verified.,Microsoft Windows Verification PCA
EE171MIY,AppIDSvc,0,Application Identity,Determines and verifies the identity of an application. Disabling this service will prevent AppLocker from being enforced.,C:\Windows\System32\svchost.exe,aa51ceaff93cd76a18af70c36d7c2899,C:\Windows\system32\svchost.exe -k LocalServiceAndNoImpersonation,Microsoft Windows,true,The file is signed and the signature was verified.,Microsoft Windows Verification PCA
EE171MIY,Spooler,1052,Print Spooler,Loads files to memory for later printing,C:\Windows\System32\spoolsv.exe,c2bd40a590003ce93dc9d927b57eb140,C:\Windows\System32\spoolsv.exe,Microsoft Windows,true,The file is signed and the signature was verified.,Microsoft Windows Verification PCA
EE171MIY,IEEtwCollectorService,0,Internet Explorer ETW Collector Service,ETW Collector Service for Internet Explorer. When running  this service collects real time ETW events and processes them.,C:\Windows\System32\IEEtwCollector.exe,9174a8283a8d2385cc31014cf0cef128,C:\Windows\system32\IEEtwCollector.exe /V,Microsoft Windows,true,The file is signed and the signature was verified.,Microsoft Windows Verification PCA
EE171MIY,cdfs,0,CD/DVD File System Reader,ISO9660/Joliet File System Reader for CD/DVDs. (Core) (All pieces),C:\Windows\System32\drivers\cdfs.sys,31fb4128a01aa57562840b2774c2d55c,system32\DRIVERS\cdfs.sys,Microsoft Windows,true,The file is signed and the signature was verified.,Microsoft Windows Verification PCA
EE171MIY,RemoteAccess,0,Routing and Remote Access,Offers routing services to businesses in local area and wide area network environments.,C:\Windows\System32\svchost.exe,aa51ceaff93cd76a18af70c36d7c2899,C:\Windows\System32\svchost.exe -k netsvcs,Microsoft Windows,true,The file is signed and the signature was verified.,Microsoft Windows Verification PCA
EE171MIY,NetBIOS,0,NetBIOS Interface,NetBIOS Interface,C:\Windows\System32\drivers\netbios.sys,4db4a9b6fbf3d11fd443c90fe24213d5,system32\DRIVERS\netbios.sys,Microsoft Windows,true,The file is signed and the signature was verified.,Microsoft Windows Verification PCA
EE171MIY,Wecsvc,0,Windows Event Collector,This service manages persistent subscriptions to events from remote sources that support WS-Management protocol. This includes Windows Vista event logs  hardware and IPMI-enabled event sources. The service stores forwarded events in a local Event Log. If this service is stopped or disabled event subscriptions cannot be created and forwarded events cannot be accepted.,C:\Windows\System32\svchost.exe,aa51ceaff93cd76a18af70c36d7c2899,C:\Windows\system32\svchost.exe -k NetworkService,Microsoft Windows,true,The file is signed and the signature was verified.,Microsoft Windows Verification PCA
EE171MIY,netprofm,828,Network List Service,Identifies the networks to which the computer has connected  collects and stores properties for these networks  and notifies applications when these properties change.,C:\Windows\System32\svchost.exe,aa51ceaff93cd76a18af70c36d7c2899,C:\Windows\System32\svchost.exe -k LocalService,Microsoft Windows,true,The file is signed and the signature was verified.,Microsoft Windows Verification PCA
EE171MIY,rdbss,0,Redirected Buffering Sub Sysytem,Provides the framework for network mini-redirectors,C:\Windows\System32\drivers\rdbss.sys,465515e24fb0e4300cd26b7e37f7bf20,system32\DRIVERS\rdbss.sys,Microsoft Windows,true,The file is signed and the signature was verified.,Microsoft Windows Verification PCA
EE171MIY,Power,560,Power,Manages power policy and power policy notification delivery.,C:\Windows\System32\svchost.exe,aa51ceaff93cd76a18af70c36d7c2899,C:\Windows\system32\svchost.exe -k DcomLaunch,Microsoft Windows,true,The file is signed and the signature was verified.,Microsoft Windows Verification PCA
EE171MIY,amdide,0,amdide,,C:\Windows\System32\drivers\amdide.sys,dd57afa695c946ffd1ea726d079fe0d2,\SystemRoot\system32\drivers\amdide.sys,Microsoft Windows,true,The file is signed and the signature was verified.,Microsoft Windows Verification PCA
EE171MIY,KSecPkg,0,KSecPkg,,C:\Windows\System32\drivers\ksecpkg.sys,9714159f17a90214df985caf7b4d3497,\SystemRoot\System32\Drivers\ksecpkg.sys,Microsoft Windows,true,The file is signed and the signature was verified.,Microsoft Windows Verification PCA
EE171MIY,msdsm,0,msdsm,,C:\Windows\System32\drivers\msdsm.sys,af81ece026ffc98966a42709be578846,\SystemRoot\system32\drivers\msdsm.sys,Microsoft Windows,true,The file is signed and the signature was verified.,Microsoft Windows Verification PCA
EE171MIY,i8042prt,0,i8042 Keyboard and PS/2 Mouse Port Driver,,C:\Windows\System32\drivers\i8042prt.sys,dede72e8488a8c23989ed27023bcf4ea,\SystemRoot\system32\drivers\i8042prt.sys,Microsoft Windows,true,The file is signed and the signature was verified.,Microsoft Windows Verification PCA
EE171MIY,mouhid,0,Mouse HID Driver,,C:\Windows\System32\drivers\mouhid.sys,e9fe65fcb648e464e02040d5651a198d,\SystemRoot\system32\drivers\mouhid.sys,Microsoft Windows,true,The file is signed and the signature was verified.,Microsoft Windows Verification PCA
