hostname,name,pid,descriptivename,description,path,pathmd5sum,arguments,pathcertificatesubject,pathsignatureverified,pathsignaturedescription,pathcertificateissuer
EE171MIY,ALG,0,Application Layer Gateway Service,Provides support for 3rd party protocol plug-ins for Internet Connection Sharing,C:\Windows\System32\alg.exe,87dd1e8607da2f225161f2963c04537e,C:\Windows\System32\alg.exe,Microsoft Windows,true,The file is signed and the signature was verified.,Microsoft Windows Verification PCA
EE171MIY,iScsiPrt,0,iScsiPort Driver,,C:\Windows\System32\drivers\msiscsi.sys,a809f0e7aadbcf7ee786a98c8167a8f6,\SystemRoot\system32\drivers\msiscsi.sys,Microsoft Windows,true,The file is signed and the signature was verified.,Microsoft Windows Verification PCA
EE171MIY,volsnap,0,Storage volumes,,C:\Windows\System32\drivers\volsnap.sys,c1ef8bb2eed42183c2729f568876588d,\SystemRoot\system32\drivers\volsnap.sys,Microsoft Windows,true,The file is signed and the signature was verified.,Microsoft Windows Verification PCA
EE171MIY,msisadrv,0,msisadrv,,C:\Windows\System32\drivers\msisadrv.sys,1e0ebdb6f1a1be92ec4ea425bb0fc5b7,\SystemRoot\system32\drivers\msisadrv.sys,Microsoft Windows,true,The file is signed and the signature was verified.,Microsoft Windows Verification PCA
EE171MIY,KSecDD,0,KSecDD,,C:\Windows\System32\drivers\ksecdd.sys,c7f1c0dcb68600d5e52f5d93738bfc15,\SystemRoot\System32\Drivers\ksecdd.sys,Microsoft Windows,true,The file is signed and the signature was verified.,Microsoft Windows Verification PCA
EE171MIY,UmRdpService,244,Remote Desktop Services UserMode Port Redirector,Allows the redirection of Printers/Drives/Ports for RDP connections,C:\Windows\System32\svchost.exe,aa51ceaff93cd76a18af70c36d7c2899,C:\Windows\System32\svchost.exe -k LocalSystemNetworkRestricted,Microsoft Windows,true,The file is signed and the signature was verified.,Microsoft Windows Verification PCA
EE171MIY,mpio,0,mpio,,C:\Windows\System32\drivers\mpio.sys,6b190573077c7f7b1f1fb8bc59d82204,\SystemRoot\system32\drivers\mpio.sys,Microsoft Windows,true,The file is signed and the signature was verified.,Microsoft Windows Verification PCA
EE171MIY,WcsPlugInService,0,Windows Color System,The WcsPlugInService service hosts third-party Windows Color System color device model and gamut map model plug-in modules. These plug-in modules are vendor-specific extensions to the Windows Color System baseline color device and gamut map models. Stopping or disabling the WcsPlugInService service will disable this extensibility feature  and the Windows Color System will use its baseline model processing rather than the vendor's desired processing. This might result in inaccurate color rendering.,C:\Windows\System32\svchost.exe,aa51ceaff93cd76a18af70c36d7c2899,C:\Windows\system32\svchost.exe -k wcssvc,Microsoft Windows,true,The file is signed and the signature was verified.,Microsoft Windows Verification PCA
EE171MIY,intelide,0,intelide,,C:\Windows\System32\drivers\intelide.sys,7ad75a4d34637825fc1e3f0a153d2b65,\SystemRoot\system32\drivers\intelide.sys,Microsoft Windows,true,The file is signed and the signature was verified.,Microsoft Windows Verification PCA
EE171MIY,dot3svc,0,Wired AutoConfig,The Wired AutoConfig (DOT3SVC) service is responsible for performing IEEE 802.1X authentication on Ethernet interfaces. If your current wired network deployment enforces 802.1X authentication  the DOT3SVC service should be configured to run for establishing Layer 2 connectivity and/or providing access to network resources. Wired networks that do not enforce 802.1X authentication are unaffected by the DOT3SVC service.,C:\Windows\System32\svchost.exe,aa51ceaff93cd76a18af70c36d7c2899,C:\Windows\system32\svchost.exe -k LocalSystemNetworkRestricted,Microsoft Windows,true,The file is signed and the signature was verified.,Microsoft Windows Verification PCA
EE171MIY,b57nd60a,0,Broadcom NetXtreme Gigabit Ethernet - NDIS 6.0,,C:\Windows\System32\drivers\b57nd60a.sys,a174770f74d5ab6ee492fa0fe7526027,system32\DRIVERS\b57nd60a.sys,Microsoft Windows,true,The file is signed and the signature was verified.,Microsoft Windows Verification PCA
EE171MIY,flpydisk,0,Floppy Disk Driver,,C:\Windows\System32\drivers\flpydisk.sys,7fb436c956b3f53385a41b5adde8e8e4,\SystemRoot\system32\drivers\flpydisk.sys,Microsoft Windows,true,The file is signed and the signature was verified.,Microsoft Windows Verification PCA
EE171MIY,RasMan,0,Remote Access Connection Manager,Manages dial-up and virtual private network (VPN) connections from this computer to the Internet or other remote networks. If this service is disabled  any services that explicitly depend on it will fail to start.,C:\Windows\System32\svchost.exe,aa51ceaff93cd76a18af70c36d7c2899,C:\Windows\System32\svchost.exe -k netsvcs,Microsoft Windows,true,The file is signed and the signature was verified.,Microsoft Windows Verification PCA
EE171MIY,iirsp,0,iirsp,,C:\Windows\System32\drivers\iirsp.sys,c64b48f926dd2eb06b1d9275338ef0aa,\SystemRoot\system32\drivers\iirsp.sys,Microsoft Windows,true,The file is signed and the signature was verified.,Microsoft Windows Verification PCA
EE171MIY,volmgrx,0,Dynamic Volume Manager,Extension of the volume manager driver that manages software RAID volumes (spanned  striped  mirrored  RAID-5) on dynamic disks,C:\Windows\System32\drivers\volmgrx.sys,74da1713d4db344a18e6d4e4f54a246b,\SystemRoot\System32\drivers\volmgrx.sys,Microsoft Windows,true,The file is signed and the signature was verified.,Microsoft Windows Verification PCA
EE171MIY,ProfSvc,968,User Profile Service,This service is responsible for loading and unloading user profiles. If this service is stopped or disabled  users will no longer be able to successfully logon or logoff  applications may have problems getting to users' data  and components registered to receive profile event notifications will not receive them.,C:\Windows\System32\svchost.exe,aa51ceaff93cd76a18af70c36d7c2899,C:\Windows\system32\svchost.exe -k netsvcs,Microsoft Windows,true,The file is signed and the signature was verified.,Microsoft Windows Verification PCA
EE171MIY,isapnp,0,isapnp,,C:\Windows\System32\drivers\isapnp.sys,c2e251d642dad0ebee06076335e6ebfb,\SystemRoot\system32\drivers\isapnp.sys,Microsoft Windows,true,The file is signed and the signature was verified.,Microsoft Windows Verification PCA
EE171MIY,TrustedInstaller,0,Windows Modules Installer,Enables installation  modification  and removal of Windows updates and optional components. If this service is disabled  install or uninstall of Windows updates might fail for this computer.,C:\Windows\servicing\TrustedInstaller.exe,92e7cdb225362586a8022b9b8bf23e62,C:\Windows\servicing\TrustedInstaller.exe,Microsoft Windows,true,The file is signed and the signature was verified.,Microsoft Windows Verification PCA
EE171MIY,mouclass,0,Mouse Class Driver,,C:\Windows\System32\drivers\mouclass.sys,c2ffc60d330b2da5db1b278c90b6d678,\SystemRoot\system32\drivers\mouclass.sys,Microsoft Windows,true,The file is signed and the signature was verified.,Microsoft Windows Verification PCA
EE171MIY,kbdclass,0,Keyboard Class Driver,,C:\Windows\System32\drivers\kbdclass.sys,2ca913e768c54488eb9ed670b4bc3012,\SystemRoot\system32\drivers\kbdclass.sys,Microsoft Windows,true,The file is signed and the signature was verified.,Microsoft Windows Verification PCA
EE171MIY,vhdmp,0,vhdmp,,C:\Windows\System32\drivers\vhdmp.sys,4e981e5d675a1f1338bb7b7c427ad7cf,\SystemRoot\system32\drivers\vhdmp.sys,Microsoft Windows,true,The file is signed and the signature was verified.,Microsoft Windows Verification PCA
EE171MIY,VaultSvc,0,Credential Manager,Provides secure storage and retrieval of credentials to users  applications and security service packages.,C:\Windows\System32\lsass.exe,2b59d3f1b81999abd58d3335d87ca799,C:\Windows\system32\lsass.exe,Microsoft Windows,true,The file is signed and the signature was verified.,Microsoft Windows Verification PCA
EE171MIY,IpFilterDriver,0,IP Traffic Filter Driver,IP Traffic Filter Driver,C:\Windows\System32\drivers\ipfltdrv.sys,5bbf9faf9acfb394765095f81365c8ef,system32\DRIVERS\ipfltdrv.sys,Microsoft Windows,true,The file is signed and the signature was verified.,Microsoft Windows Verification PCA
EE171MIY,nsi,828,Network Store Interface Service,This service delivers network notifications (e.g. interface addition/deleting etc) to user mode clients. Stopping this service will cause loss of network connectivity. If this service is disabled  any other services that explicitly depend on this service will fail to start.,C:\Windows\System32\svchost.exe,aa51ceaff93cd76a18af70c36d7c2899,C:\Windows\system32\svchost.exe -k LocalService,Microsoft Windows,true,The file is signed and the signature was verified.,Microsoft Windows Verification PCA
EE171MIY,sacsvr,968,Special Administration Console Helper,Allows administrators to remotely access a command prompt using Emergency Management Services.,C:\Windows\System32\svchost.exe,aa51ceaff93cd76a18af70c36d7c2899,C:\Windows\System32\svchost.exe -k netsvcs,Microsoft Windows,true,The file is signed and the signature was verified.,Microsoft Windows Verification PCA
EE171MIY,GCEAgent,1108,GCEAgent,Google Compute Engine Agent,C:\Program Files\Google\Compute Engine\agent\GCEWindowsAgent.exe,02cfc30489e8f7222780568f64b2b010,C:\Program Files\Google\Compute Engine\agent\GCEWindowsAgent.exe,Google Inc,true,The file is signed and the signature was verified.,Symantec Class 3 SHA256 Code Signing CA
EE171MIY,Psched,0,QoS Packet Scheduler,QoS Packet Scheduler,C:\Windows\System32\drivers\pacer.sys,b007071f4d20c4e3d5baaf8ba666d006,system32\DRIVERS\pacer.sys,Microsoft Windows,true,The file is signed and the signature was verified.,Microsoft Windows Verification PCA
EE171MIY,RpcEptMapper,632,RPC Endpoint Mapper,Resolves RPC interfaces identifiers to transport endpoints. If this service is stopped or disabled  programs using Remote Procedure Call (RPC) services will not function properly.,C:\Windows\System32\svchost.exe,aa51ceaff93cd76a18af70c36d7c2899,C:\Windows\system32\svchost.exe -k RPCSS,Microsoft Windows,true,The file is signed and the signature was verified.,Microsoft Windows Verification PCA
EE171MIY,UI0Detect,0,Interactive Services Detection,Enables user notification of user input for interactive services  which enables access to dialogs created by interactive services when they appear. If this service is stopped  notifications of new interactive service dialogs will no longer function and there might not be access to interactive service dialogs. If this service is disabled  both notifications of and access to new interactive service dialogs will no longer function.,C:\Windows\System32\UI0Detect.exe,c7de59fb3af7884c5aa1fee42a6be270,C:\Windows\system32\UI0Detect.exe,Microsoft Windows,true,The file is signed and the signature was verified.,Microsoft Windows Verification PCA
EE171MIY,clr_optimization_v2.0.50727_32,0,Microsoft .NET Framework NGEN v2.0.50727_X86,Microsoft .NET Framework NGEN,C:\Windows\Microsoft.NET\Framework\v2.0.50727\mscorsvw.exe,8550e777a4ded413020f43b7f9f0f3a7,C:\Windows\Microsoft.NET\Framework\v2.0.50727\mscorsvw.exe,Microsoft Windows,true,The file is signed and the signature was verified.,Microsoft Windows Verification PCA
EE171MIY,wmiApSrv,0,WMI Performance Adapter,Provides performance library information from Windows Management Instrumentation (WMI) providers to clients on the network. This service only runs when Performance Data Helper is activated.,C:\Windows\System32\wbem\WmiApSrv.exe,a1745f988a63f4e2dcad77253ce73ef8,C:\Windows\system32\wbem\WmiApSrv.exe,Microsoft Windows,true,The file is signed and the signature was verified.,Microsoft Windows Verification PCA
EE171MIY,nvme,0,nvme,,C:\Windows\System32\drivers\nvme.sys,f033f5ca02b1eaf051062207fa4dee7a,\SystemRoot\system32\drivers\nvme.sys,Google Inc,true,The file is signed and the signature was verified.,Symantec Class 3 SHA256 Code Signing CA
EE171MIY,CryptSvc,852,Cryptographic Services,Provides four management services: Catalog Database Service  which confirms the signatures of Windows files and allows new programs to be installed; Protected Root Service  which adds and removes Trusted Root Certification Authority certificates from this computer; Automatic Root Certificate Update Service  which retrieves root certificates from Windows Update and enable scenarios such as SSL; and Key Service  which helps enroll this computer for certificates. If this service is stopped  these management services will not function properly. If this service is disabled  any services that explicitly depend on it will fail to start.,C:\Windows\System32\svchost.exe,aa51ceaff93cd76a18af70c36d7c2899,C:\Windows\system32\svchost.exe -k NetworkService,Microsoft Windows,true,The file is signed and the signature was verified.,Microsoft Windows Verification PCA
EE171MIY,luafv,0,UAC File Virtualization,Virtualizes file write failures to per-user locations.,C:\Windows\System32\drivers\luafv.sys,86e9bf37b0dd917a60c04ed150c924d6,\SystemRoot\system32\drivers\luafv.sys,Microsoft Windows,true,The file is signed and the signature was verified.,Microsoft Windows Verification PCA
EE171MIY,viaide,0,viaide,,C:\Windows\System32\drivers\viaide.sys,3e9c1265cef1955114d68f7e8a09c264,\SystemRoot\system32\drivers\viaide.sys,Microsoft Windows,true,The file is signed and the signature was verified.,Microsoft Windows Verification PCA
EE171MIY,vds,0,Virtual Disk,Provides management services for disks  volumes  file systems  and storage arrays.,C:\Windows\System32\vds.exe,420295c34f29b92f91dbad0723685eea,C:\Windows\System32\vds.exe,Microsoft Windows,true,The file is signed and the signature was verified.,Microsoft Windows Verification PCA
EE171MIY,SessionEnv,968,Remote Desktop Configuration,Remote Desktop Configuration service (RDCS) is responsible for all Remote Desktop Services and Remote Desktop related configuration and session maintenance activities that require SYSTEM context. These include per-session temporary folders  RD themes  and RD certificates.,C:\Windows\System32\svchost.exe,aa51ceaff93cd76a18af70c36d7c2899,C:\Windows\System32\svchost.exe -k netsvcs,Microsoft Windows,true,The file is signed and the signature was verified.,Microsoft Windows Verification PCA
EE171MIY,sffdisk,0,SFF Storage Class Driver,,C:\Windows\System32\drivers\sffdisk.sys,f06299b1b1a27813179b9d91eeead1f1,\SystemRoot\system32\drivers\sffdisk.sys,Microsoft Windows,true,The file is signed and the signature was verified.,Microsoft Windows Verification PCA
EE171MIY,sffp_mmc,0,SFF Storage Protocol Driver for MMC,,C:\Windows\System32\drivers\sffp_mmc.sys,e38418f5934a3e4ba3677f0890962f2f,\SystemRoot\system32\drivers\sffp_mmc.sys,Microsoft Windows,true,The file is signed and the signature was verified.,Microsoft Windows Verification PCA
EE171MIY,UmPass,0,Microsoft UMPass Driver,,C:\Windows\System32\drivers\umpass.sys,a238ce3697ef6842fa74e3ebd00cfc94,\SystemRoot\system32\drivers\umpass.sys,Microsoft Windows,true,The file is signed and the signature was verified.,Microsoft Windows Verification PCA
EE171MIY,CNG,0,CNG,,C:\Windows\System32\drivers\cng.sys,1a09c2f04b294207d95af79fcb60a1a7,\SystemRoot\System32\Drivers\cng.sys,Microsoft Windows,true,The file is signed and the signature was verified.,Microsoft Windows Verification PCA
EE171MIY,RasSstp,0,WAN Miniport (SSTP),WAN Miniport (SSTP),C:\Windows\System32\drivers\rassstp.sys,d9c5f3d50b444d1a553bbd2e2b677948,system32\DRIVERS\rassstp.sys,Microsoft Windows,true,The file is signed and the signature was verified.,Microsoft Windows Verification PCA
EE171MIY,TermService,2224,Remote Desktop Services,Allows users to connect interactively to a remote computer. Remote Desktop and Remote Desktop Session Host Server depend on this service.  To prevent remote use of this computer  clear the checkboxes on the Remote tab of the System properties control panel item.,C:\Windows\System32\svchost.exe,aa51ceaff93cd76a18af70c36d7c2899,C:\Windows\System32\svchost.exe -k termsvcs,Microsoft Windows,true,The file is signed and the signature was verified.,Microsoft Windows Verification PCA
EE171MIY,USBSTOR,0,USB Mass Storage Driver,,C:\Windows\System32\drivers\USBSTOR.SYS,623143375f1f885048a3ebdcd7fa2ee2,\SystemRoot\system32\drivers\USBSTOR.SYS,Microsoft Windows,true,The file is signed and the signature was verified.,Microsoft Windows Verification PCA
EE171MIY,stexstor,0,stexstor,,C:\Windows\System32\drivers\stexstor.sys,3361282c6802bcb3077963d2af79c756,\SystemRoot\system32\drivers\stexstor.sys,Microsoft Windows,true,The file is signed and the signature was verified.,Microsoft Windows Verification PCA
EE171MIY,rspndr,0,Link-Layer Topology Discovery Responder,,C:\Windows\System32\drivers\rspndr.sys,7ec27b735030fd34d7d5f724cf4b6eb6,system32\DRIVERS\rspndr.sys,Microsoft Windows,true,The file is signed and the signature was verified.,Microsoft Windows Verification PCA
EE171MIY,mssmbios,0,Microsoft System Management BIOS Driver,,C:\Windows\System32\drivers\mssmbios.sys,90fa599d63840a511c85e4347ca4439a,\SystemRoot\system32\drivers\mssmbios.sys,Microsoft Windows,true,The file is signed and the signature was verified.,Microsoft Windows Verification PCA
EE171MIY,gpsvc,968,Group Policy Client,The service is responsible for applying settings configured by administrators for the computer and users through the Group Policy component. If the service is stopped or disabled  the settings will not be applied and applications and components will not be manageable through Group Policy. Any components or applications that depend on the Group Policy component might not be functional if the service is stopped or disabled.,C:\Windows\System32\svchost.exe,aa51ceaff93cd76a18af70c36d7c2899,C:\Windows\system32\svchost.exe -k netsvcs,Microsoft Windows,true,The file is signed and the signature was verified.,Microsoft Windows Verification PCA
EE171MIY,scfilter,0,Smart card PnP Class Filter Driver,Smart card reader filter driver enabling smart card PnP.,C:\Windows\System32\drivers\scfilter.sys,03dbb2228d8a54ab0686c3276aed3940,System32\DRIVERS\scfilter.sys,Microsoft Windows,true,The file is signed and the signature was verified.,Microsoft Windows Verification PCA
EE171MIY,HidUsb,0,Microsoft HID Class Driver,,C:\Windows\System32\drivers\hidusb.sys,0a6ae213e5f82ef416225739b21ee6d3,\SystemRoot\system32\drivers\hidusb.sys,Microsoft Windows,true,The file is signed and the signature was verified.,Microsoft Windows Verification PCA
EE171MIY,SCardSvr,0,Smart Card,Manages access to smart cards read by this computer. If this service is stopped  this computer will be unable to read smart cards. If this service is disabled  any services that explicitly depend on it will fail to start.,C:\Windows\System32\svchost.exe,aa51ceaff93cd76a18af70c36d7c2899,C:\Windows\system32\svchost.exe -k LocalServiceAndNoImpersonation,Microsoft Windows,true,The file is signed and the signature was verified.,Microsoft Windows Verification PCA
EE171MIY,WinRM,852,Windows Remote Management (WS-Management),Windows Remote Management (WinRM) service implements the WS-Management protocol for remote management. WS-Management is a standard web services protocol used for remote software and hardware management. The WinRM service listens on the network for WS-Management requests and processes them. The WinRM Service needs to be configured with a listener using winrm.cmd command line tool or through Group Policy in order for it to listen over the network. The WinRM service provides access to WMI data and enables event collection. Event collection and subscription to events require that the service is running. WinRM messages use HTTP and HTTPS as transports. The WinRM service does not depend on IIS but is preconfigured to share a port with IIS on the same machine.  The WinRM service reserves the /wsman URL prefix. To prevent conflicts with IIS  administrators should ensure that any websites hosted on IIS do not use the /wsman URL prefix.,C:\Windows\System32\svchost.exe,aa51ceaff93cd76a18af70c36d7c2899,C:\Windows\System32\svchost.exe -k NetworkService,Microsoft Windows,true,The file is signed and the signature was verified.,Microsoft Windows Verification PCA
EE171MIY,PEAUTH,0,PEAUTH,,C:\Windows\System32\drivers\PEAuth.sys,24a7effa6095b79b468d03549ad53e63,system32\drivers\peauth.sys,Microsoft Windows,true,The file is signed and the signature was verified.,Microsoft Windows Verification PCA
EE171MIY,RemoteRegistry,1320,Remote Registry,Enables remote users to modify registry settings on this computer. If this service is stopped  the registry can be modified only by users on this computer. If this service is disabled  any services that explicitly depend on it will fail to start.,C:\Windows\System32\svchost.exe,aa51ceaff93cd76a18af70c36d7c2899,C:\Windows\system32\svchost.exe -k regsvc,Microsoft Windows,true,The file is signed and the signature was verified.,Microsoft Windows Verification PCA
EE171MIY,vsmraid,0,vsmraid,,C:\Windows\System32\drivers\vsmraid.sys,9b2b54ee10f6a11d5a8eeff62a5234ea,\SystemRoot\system32\drivers\vsmraid.sys,Microsoft Windows,true,The file is signed and the signature was verified.,Microsoft Windows Verification PCA
EE171MIY,WdiSystemHost,244,Diagnostic System Host,The Diagnostic System Host is used by the Diagnostic Policy Service to host diagnostics that need to run in a Local System context.  If this service is stopped  any diagnostics that depend on it will no longer function.,C:\Windows\System32\svchost.exe,aa51ceaff93cd76a18af70c36d7c2899,C:\Windows\System32\svchost.exe -k LocalSystemNetworkRestricted,Microsoft Windows,true,The file is signed and the signature was verified.,Microsoft Windows Verification PCA
EE171MIY,RDPDR,0,Terminal Server Device Redirector Driver,,C:\Windows\System32\drivers\rdpdr.sys,940f250ea5b5cf2950fd850860704836,System32\drivers\rdpdr.sys,Microsoft Windows,true,The file is signed and the signature was verified.,Microsoft Windows Verification PCA
EE171MIY,NDIS,0,NDIS System Driver,NDIS System Driver,C:\Windows\System32\drivers\ndis.sys,e4b5a0be37829200409497fa3697bcab,\SystemRoot\system32\drivers\ndis.sys,Microsoft Windows,true,The file is signed and the signature was verified.,Microsoft Windows Verification PCA
EE171MIY,adp94xx,0,adp94xx,,C:\Windows\System32\drivers\adp94xx.sys,8aee5d7772165595e9131c2987d6d36e,\SystemRoot\system32\drivers\adp94xx.sys,Microsoft Windows,true,The file is signed and the signature was verified.,Microsoft Windows Verification PCA
EE171MIY,nsiproxy,0,NSI proxy service driver.,NSI proxy service.,C:\Windows\System32\drivers\nsiproxy.sys,662e2b31df902113c92bdb83ad599680,system32\drivers\nsiproxy.sys,Microsoft Windows,true,The file is signed and the signature was verified.,Microsoft Windows Verification PCA
EE171MIY,adpahci,0,adpahci,,C:\Windows\System32\drivers\adpahci.sys,2a158915aa0bb7c670c22a581aa8bf36,\SystemRoot\system32\drivers\adpahci.sys,Microsoft Windows,true,The file is signed and the signature was verified.,Microsoft Windows Verification PCA
EE171MIY,udfs,0,udfs,Reads/Writes UDF 1.02 1.5 2.0x 2.5 disc formats  usually found on C/DVD discs. (Core) (All pieces),C:\Windows\System32\drivers\udfs.sys,db913773b78283a955f36d64e1cb0a3b,system32\DRIVERS\udfs.sys,Microsoft Windows,true,The file is signed and the signature was verified.,Microsoft Windows Verification PCA
EE171MIY,LanmanWorkstation,852,Workstation,Creates and maintains client network connections to remote servers using the SMB protocol. If this service is stopped  these connections will be unavailable. If this service is disabled  any services that explicitly depend on it will fail to start.,C:\Windows\System32\svchost.exe,aa51ceaff93cd76a18af70c36d7c2899,C:\Windows\System32\svchost.exe -k NetworkService,Microsoft Windows,true,The file is signed and the signature was verified.,Microsoft Windows Verification PCA
EE171MIY,BFE,768,Base Filtering Engine,The Base Filtering Engine (BFE) is a service that manages firewall and Internet Protocol security (IPsec) policies and implements user mode filtering. Stopping or disabling the BFE service will significantly reduce the security of the system. It will also result in unpredictable behavior in IPsec management and firewall applications.,C:\Windows\System32\svchost.exe,aa51ceaff93cd76a18af70c36d7c2899,C:\Windows\system32\svchost.exe -k LocalServiceNoNetwork,Microsoft Windows,true,The file is signed and the signature was verified.,Microsoft Windows Verification PCA
EE171MIY,nv_agp,0,NVIDIA nForce AGP Bus Filter,,C:\Windows\System32\drivers\NV_AGP.SYS,c99b2a402c90e6aa38cd6beb08ce4a2b,\SystemRoot\system32\drivers\nv_agp.sys,Microsoft Windows,true,The file is signed and the signature was verified.,Microsoft Windows Verification PCA
EE171MIY,Filetrace,0,Filetrace,ETW File Trace Filter,C:\Windows\System32\drivers\filetrace.sys,a14e3d27f49ef500847360d9eeaf3348,system32\drivers\filetrace.sys,Microsoft Windows,true,The file is signed and the signature was verified.,Microsoft Windows Verification PCA
EE171MIY,TCPIP6,0,Microsoft IPv6 Protocol Driver,Microsoft IPv6 Protocol Driver,C:\Windows\System32\drivers\tcpip.sys,0f9719c612d18755bcd5cf5d8ea28c6f,system32\DRIVERS\tcpip.sys,Microsoft Windows,true,The file is signed and the signature was verified.,Microsoft Windows Verification PCA
EE171MIY,BrFiltUp,0,Brother USB Mass-Storage Upper Filter Driver,,C:\Windows\System32\drivers\BrFiltUp.sys,08269fd8016b50945011f2cd57afd7f8,\SystemRoot\system32\drivers\BrFiltUp.sys,Microsoft Windows,true,The file is signed and the signature was verified.,Microsoft Windows Verification PCA
EE171MIY,vdrvroot,0,Microsoft Virtual Drive Enumerator Driver,,C:\Windows\System32\drivers\vdrvroot.sys,aad8f17566addfbb9cf7119f79538740,\SystemRoot\system32\drivers\vdrvroot.sys,Microsoft Windows,true,The file is signed and the signature was verified.,Microsoft Windows Verification PCA
