hostname,name,pid,descriptivename,description,path,pathmd5sum,arguments,pathcertificatesubject,pathsignatureverified,pathsignaturedescription,pathcertificateissuer
EE171MIY,aliide,0,aliide,,C:\Windows\System32\drivers\aliide.sys,383cf6471c2f739eba9a32dbf33fea1d,\SystemRoot\system32\drivers\aliide.sys,Microsoft Windows,true,The file is signed and the signature was verified.,Microsoft Windows Verification PCA
EE171MIY,AeLookupSvc,968,Application Experience,Processes application compatibility cache requests for applications as they are launched,C:\Windows\System32\svchost.exe,aa51ceaff93cd76a18af70c36d7c2899,C:\Windows\system32\svchost.exe -k netsvcs,Microsoft Windows,true,The file is signed and the signature was verified.,Microsoft Windows Verification PCA
EE171MIY,defragsvc,0,Disk Defragmenter,Provides Disk Defragmentation Capabilities.,C:\Windows\System32\svchost.exe,aa51ceaff93cd76a18af70c36d7c2899,C:\Windows\system32\svchost.exe -k defragsvc,Microsoft Windows,true,The file is signed and the signature was verified.,Microsoft Windows Verification PCA
EE171MIY,AFD,0,Ancillary Function Driver for Winsock,Ancillary Function Driver for Winsock,C:\Windows\System32\drivers\afd.sys,b06a9ab1a21e55d7c7b6a564558d3d07,\SystemRoot\system32\drivers\afd.sys,Microsoft Windows,true,The file is signed and the signature was verified.,Microsoft Windows Verification PCA
EE171MIY,Brserid,0,Brother MFC Serial Port Interface Driver (WDM),,C:\Windows\System32\drivers\BrSerId.sys,76eaa4ebf674d820c40467ed745ccf9a,\SystemRoot\System32\Drivers\Brserid.sys,Microsoft Windows,true,The file is signed and the signature was verified.,Microsoft Windows Verification PCA
EE171MIY,pcmcia,0,pcmcia,,C:\Windows\System32\drivers\pcmcia.sys,4cdcae3dc88d00e6287a73e9f941d29d,\SystemRoot\system32\drivers\pcmcia.sys,Microsoft Windows,true,The file is signed and the signature was verified.,Microsoft Windows Verification PCA
EE171MIY,nfrd960,0,nfrd960,,C:\Windows\System32\drivers\nfrd960.sys,ceb80e9305cf99e92407dc883ff4ab60,\SystemRoot\system32\drivers\nfrd960.sys,Microsoft Windows,true,The file is signed and the signature was verified.,Microsoft Windows Verification PCA
EE171MIY,b06bdrv,0,Broadcom NetXtreme II VBD,,C:\Windows\System32\drivers\bxvbda.sys,1d6103bb8ce54cf3a34e1fffd2777d9f,\SystemRoot\system32\drivers\bxvbda.sys,Microsoft Windows,true,The file is signed and the signature was verified.,Microsoft Windows Verification PCA
EE171MIY,mpsdrv,0,Windows Firewall Authorization Driver,Windows Firewall Authorization Driver is a kernel mode driver that provides deep inspection services on inbound and outbound network traffic.,C:\Windows\System32\drivers\mpsdrv.sys,5badd15ec32d75d3f4b9d284741f7b1c,System32\drivers\mpsdrv.sys,Microsoft Windows,true,The file is signed and the signature was verified.,Microsoft Windows Verification PCA
EE171MIY,CertPropSvc,968,Certificate Propagation,Copies user certificates and root certificates from smart cards into the current user's certificate store  detects when a smart card is inserted into a smart card reader  and  if needed  installs the smart card Plug and Play minidriver.,C:\Windows\System32\svchost.exe,aa51ceaff93cd76a18af70c36d7c2899,C:\Windows\system32\svchost.exe -k netsvcs,Microsoft Windows,true,The file is signed and the signature was verified.,Microsoft Windows Verification PCA
EE171MIY,Browser,0,Computer Browser,Maintains an updated list of computers on the network and supplies this list to computers designated as browsers. If this service is stopped  this list will not be updated or maintained. If this service is disabled  any services that explicitly depend on it will fail to start.,C:\Windows\System32\svchost.exe,aa51ceaff93cd76a18af70c36d7c2899,C:\Windows\System32\svchost.exe -k netsvcs,Microsoft Windows,true,The file is signed and the signature was verified.,Microsoft Windows Verification PCA
EE171MIY,pla,0,Performance Logs &amp; Alerts,Performance Logs and Alerts Collects performance data from local or remote computers based on preconfigured schedule parameters  then writes the data to a log or triggers an alert. If this service is stopped  performance information will not be collected. If this service is disabled  any services that explicitly depend on it will fail to start.,C:\Windows\System32\svchost.exe,aa51ceaff93cd76a18af70c36d7c2899,C:\Windows\System32\svchost.exe -k LocalServiceNoNetwork,Microsoft Windows,true,The file is signed and the signature was verified.,Microsoft Windows Verification PCA
EE171MIY,cmdide,0,cmdide,,C:\Windows\System32\drivers\cmdide.sys,2e3c53b03673e6b8a3c89e414def00d9,\SystemRoot\system32\drivers\cmdide.sys,Microsoft Windows,true,The file is signed and the signature was verified.,Microsoft Windows Verification PCA
EE171MIY,sffp_sd,0,SFF Storage Protocol Driver for SDBus,,C:\Windows\System32\drivers\sffp_sd.sys,117b3f0fa38d1834981fb0b65b57e59a,\SystemRoot\system32\drivers\sffp_sd.sys,Microsoft Windows,true,The file is signed and the signature was verified.,Microsoft Windows Verification PCA
EE171MIY,Wanarpv6,0,Remote Access IPv6 ARP Driver,Remote Access IPv6 ARP Driver,C:\Windows\System32\drivers\wanarp.sys,05e1cdf374420016479575d2bdffae2d,system32\DRIVERS\wanarp.sys,Microsoft Windows,true,The file is signed and the signature was verified.,Microsoft Windows Verification PCA
EE171MIY,monitor,0,Microsoft Monitor Class Function Driver Service,,C:\Windows\System32\drivers\monitor.sys,e5521067a79f40272d12060585315fb6,system32\DRIVERS\monitor.sys,Microsoft Windows,true,The file is signed and the signature was verified.,Microsoft Windows Verification PCA
EE171MIY,FileInfo,0,File Information FS MiniFilter,Collects information about files in memory to be consumed by other system services.,C:\Windows\System32\drivers\fileinfo.sys,265d86609bc6a3143b6bd048c104da44,system32\drivers\fileinfo.sys,Microsoft Windows,true,The file is signed and the signature was verified.,Microsoft Windows Verification PCA
EE171MIY,ebdrv,0,Broadcom NetXtreme II 10 GigE VBD,,C:\Windows\System32\drivers\evbda.sys,53f1d738615f0ee0e40f5de012208eab,\SystemRoot\system32\drivers\evbda.sys,Microsoft Windows,true,The file is signed and the signature was verified.,Microsoft Windows Verification PCA
EE171MIY,MegaSR,0,MegaSR,,C:\Windows\System32\drivers\MegaSR.sys,dd252d5f441c4fc791ca3f5baa776dd3,\SystemRoot\system32\drivers\MegaSR.sys,Microsoft Windows,true,The file is signed and the signature was verified.,Microsoft Windows Verification PCA
EE171MIY,Dhcp,932,DHCP Client,Registers and updates IP addresses and DNS records for this computer. If this service is stopped  this computer will not receive dynamic IP addresses and DNS updates. If this service is disabled  any services that explicitly depend on it will fail to start.,C:\Windows\System32\svchost.exe,aa51ceaff93cd76a18af70c36d7c2899,C:\Windows\system32\svchost.exe -k LocalServiceNetworkRestricted,Microsoft Windows,true,The file is signed and the signature was verified.,Microsoft Windows Verification PCA
EE171MIY,clr_optimization_v4.0.30319_64,0,Microsoft .NET Framework NGEN v4.0.30319_X64,Microsoft .NET Framework NGEN,C:\Windows\Microsoft.NET\Framework64\v4.0.30319\mscorsvw.exe,4ab601171b0dcf9f970667d63da396e7,C:\Windows\Microsoft.NET\Framework64\v4.0.30319\mscorsvw.exe,Microsoft Dynamic Code Publisher,true,The file is signed and the signature was verified.,Microsoft Code Signing PCA
EE171MIY,SNMPTRAP,0,SNMP Trap,Receives trap messages generated by local or remote Simple Network Management Protocol (SNMP) agents and forwards the messages to SNMP management programs running on this computer. If this service is stopped  SNMP-based programs on this computer will not receive SNMP trap messages. If this service is disabled  any services that explicitly depend on it will fail to start.,C:\Windows\System32\snmptrap.exe,9c7250bee202030453be5d01c3062316,C:\Windows\System32\snmptrap.exe,Microsoft Windows,true,The file is signed and the signature was verified.,Microsoft Windows Verification PCA
EE171MIY,ShellHWDetection,968,Shell Hardware Detection,Provides notifications for AutoPlay hardware events.,C:\Windows\System32\svchost.exe,aa51ceaff93cd76a18af70c36d7c2899,C:\Windows\System32\svchost.exe -k netsvcs,Microsoft Windows,true,The file is signed and the signature was verified.,Microsoft Windows Verification PCA
EE171MIY,hidserv,0,Human Interface Device Access,Enables generic input access to Human Interface Devices (HID)  which activates and maintains the use of predefined hot buttons on keyboards  remote controls  and other multimedia devices. If this service is stopped  hot buttons controlled by this service will no longer function. If this service is disabled  any services that explicitly depend on it will fail to start.,C:\Windows\System32\svchost.exe,aa51ceaff93cd76a18af70c36d7c2899,C:\Windows\system32\svchost.exe -k LocalSystemNetworkRestricted,Microsoft Windows,true,The file is signed and the signature was verified.,Microsoft Windows Verification PCA
EE171MIY,SCPolicySvc,0,Smart Card Removal Policy,Allows the system to be configured to lock the user desktop upon smart card removal.,C:\Windows\System32\svchost.exe,aa51ceaff93cd76a18af70c36d7c2899,C:\Windows\system32\svchost.exe -k netsvcs,Microsoft Windows,true,The file is signed and the signature was verified.,Microsoft Windows Verification PCA
EE171MIY,RDPCDD,0,RDPCDD,RDPDD Chained DD,C:\Windows\System32\drivers\RDPCDD.sys,e2a522d6dc48e5e74f2f9cdc7cedde9f,System32\DRIVERS\RDPCDD.sys,Microsoft Windows,true,The file is signed and the signature was verified.,Microsoft Windows Verification PCA
EE171MIY,arcsas,0,arcsas,,C:\Windows\System32\drivers\arcsas.sys,354e183795b1ffcfa3c19b66b5ca283e,\SystemRoot\system32\drivers\arcsas.sys,Microsoft Windows,true,The file is signed and the signature was verified.,Microsoft Windows Verification PCA
EE171MIY,SharedAccess,0,Internet Connection Sharing (ICS),Provides network address translation  addressing  name resolution and/or intrusion prevention services for a home or small office network.,C:\Windows\System32\svchost.exe,aa51ceaff93cd76a18af70c36d7c2899,C:\Windows\System32\svchost.exe -k netsvcs,Microsoft Windows,true,The file is signed and the signature was verified.,Microsoft Windows Verification PCA
EE171MIY,SiSRaid2,0,SiSRaid2,,C:\Windows\System32\drivers\sisraid2.sys,729a661d982e6dc8da9b53215a13f8c8,\SystemRoot\system32\drivers\SiSRaid2.sys,Microsoft Windows,true,The file is signed and the signature was verified.,Microsoft Windows Verification PCA
EE171MIY,WfpLwf,0,WFP Lightweight Filter,WFP Lightweight Filter,C:\Windows\System32\drivers\wfplwf.sys,80e54eaf844ced74fd8d1548d735db8d,\SystemRoot\system32\DRIVERS\wfplwf.sys,Microsoft Windows,true,The file is signed and the signature was verified.,Microsoft Windows Verification PCA
EE171MIY,NdisCap,0,NDIS Capture LightWeight Filter,NDIS Capture LightWeight Filter,C:\Windows\System32\drivers\ndiscap.sys,60aaf7e2c924609711e4d471813ee9c3,system32\DRIVERS\ndiscap.sys,Microsoft Windows,true,The file is signed and the signature was verified.,Microsoft Windows Verification PCA
EE171MIY,NetPipeActivator,0,Net.Pipe Listener Adapter,Receives activation requests over the net.pipe protocol and passes them to the Windows Process Activation Service.,C:\Windows\Microsoft.NET\Framework64\v4.0.30319\SMSvcHost.exe,bb12c21a39ebaff79237fa7222d6ef0b,C:\Windows\Microsoft.NET\Framework64\v4.0.30319\SMSvcHost.exe,Microsoft Corporation,true,The file is signed and the signature was verified.,Microsoft Code Signing PCA
EE171MIY,upnphost,0,UPnP Device Host,Allows UPnP devices to be hosted on this computer. If this service is stopped  any hosted UPnP devices will stop functioning and no additional hosted devices can be added. If this service is disabled  any services that explicitly depend on it will fail to start.,C:\Windows\System32\svchost.exe,aa51ceaff93cd76a18af70c36d7c2899,C:\Windows\system32\svchost.exe -k LocalServiceAndNoImpersonation,Microsoft Windows,true,The file is signed and the signature was verified.,Microsoft Windows Verification PCA
EE171MIY,BITS,968,Background Intelligent Transfer Service,Transfers files in the background using idle network bandwidth. If the service is disabled  then any applications that depend on BITS  such as Windows Update or MSN Explorer  will be unable to automatically download programs and other information.,C:\Windows\System32\svchost.exe,aa51ceaff93cd76a18af70c36d7c2899,C:\Windows\System32\svchost.exe -k netsvcs,Microsoft Windows,true,The file is signed and the signature was verified.,Microsoft Windows Verification PCA
EE171MIY,IPMIDRV,0,IPMIDRV,,C:\Windows\System32\drivers\IPMIDrv.sys,ca176b73c968bea7bc9d27133d25a241,\SystemRoot\system32\drivers\IPMIDrv.sys,Microsoft Windows,true,The file is signed and the signature was verified.,Microsoft Windows Verification PCA
EE171MIY,SstpSvc,0,Secure Socket Tunneling Protocol Service,Provides support for the Secure Socket Tunneling Protocol (SSTP) to connect to remote computers using VPN. If this service is disabled  users will not be able to use SSTP to access remote servers.,C:\Windows\System32\svchost.exe,aa51ceaff93cd76a18af70c36d7c2899,C:\Windows\system32\svchost.exe -k LocalService,Microsoft Windows,true,The file is signed and the signature was verified.,Microsoft Windows Verification PCA
EE171MIY,seclogon,0,Secondary Logon,Enables starting processes under alternate credentials. If this service is stopped  this type of logon access will be unavailable. If this service is disabled  any services that explicitly depend on it will fail to start.,C:\Windows\System32\svchost.exe,aa51ceaff93cd76a18af70c36d7c2899,C:\Windows\system32\svchost.exe -k netsvcs,Microsoft Windows,true,The file is signed and the signature was verified.,Microsoft Windows Verification PCA
EE171MIY,LSI_SAS,0,LSI_SAS,,C:\Windows\System32\drivers\lsi_sas.sys,3d102a68763261b6bde02727f1300abf,\SystemRoot\system32\drivers\lsi_sas.sys,Microsoft Windows,true,The file is signed and the signature was verified.,Microsoft Windows Verification PCA
EE171MIY,LSI_FC,0,LSI_FC,,C:\Windows\System32\drivers\lsi_fc.sys,ad4d8637c2e96b6116c261ad5ff620d7,\SystemRoot\system32\drivers\lsi_fc.sys,Microsoft Windows,true,The file is signed and the signature was verified.,Microsoft Windows Verification PCA
EE171MIY,NdisWan,0,Remote Access NDIS WAN Driver,Remote Access NDIS WAN Driver,C:\Windows\System32\drivers\ndiswan.sys,57f6c849db23ac919202ff4f34a90c9e,system32\DRIVERS\ndiswan.sys,Microsoft Windows,true,The file is signed and the signature was verified.,Microsoft Windows Verification PCA
EE171MIY,ACPI,0,Microsoft ACPI Driver,,C:\Windows\System32\drivers\acpi.sys,80188d2415e2eae9a7a27a42ec7c4b71,\SystemRoot\system32\drivers\ACPI.sys,Microsoft Windows,true,The file is signed and the signature was verified.,Microsoft Windows Verification PCA
EE171MIY,TDTCP,0,TDTCP,,C:\Windows\System32\drivers\tdtcp.sys,8c52d4b19a14b340ae4d9a3b668ad2fb,system32\drivers\tdtcp.sys,Microsoft Windows,true,The file is signed and the signature was verified.,Microsoft Windows Verification PCA
EE171MIY,RpcLocator,0,Remote Procedure Call (RPC) Locator,In Windows 2003 and earlier versions of Windows  the Remote Procedure Call (RPC) Locator service manages the RPC name service database. In Windows Vista and later versions of Windows  this service does not provide any functionality and is present for application compatibility.,C:\Windows\System32\Locator.exe,f0dffddf01df56cff239a4f7e7f6f868,C:\Windows\system32\locator.exe,Microsoft Windows,true,The file is signed and the signature was verified.,Microsoft Windows Verification PCA
EE171MIY,dmvsc,0,dmvsc,,C:\Windows\System32\drivers\dmvsc.sys,30cc6864066f049b0da75dfba0ae5ae3,\SystemRoot\system32\drivers\dmvsc.sys,Microsoft Windows,true,The file is signed and the signature was verified.,Microsoft Windows Verification PCA
EE171MIY,TermDD,0,Terminal Device Driver,,C:\Windows\System32\drivers\termdd.sys,1477563e5342f4735e38bac1a4b6b2bf,\SystemRoot\system32\drivers\termdd.sys,Microsoft Windows,true,The file is signed and the signature was verified.,Microsoft Windows Verification PCA
EE171MIY,agp440,0,Intel AGP Bus Filter,,C:\Windows\System32\drivers\AGP440.sys,c9148b9e0d0ed772346d6a0b3c0be97c,\SystemRoot\system32\drivers\agp440.sys,Microsoft Windows,true,The file is signed and the signature was verified.,Microsoft Windows Verification PCA
EE171MIY,megasas,0,megasas,,C:\Windows\System32\drivers\megasas.sys,035c1e45c024436c8f6fa81456153b0f,\SystemRoot\system32\drivers\megasas.sys,Microsoft Windows,true,The file is signed and the signature was verified.,Microsoft Windows Verification PCA
EE171MIY,DcomLaunch,560,DCOM Server Process Launcher,The DCOMLAUNCH service launches COM and DCOM servers in response to object activation requests. If this service is stopped or disabled  programs using COM or DCOM will not function properly. It is strongly recommended that you have the DCOMLAUNCH service running.,C:\Windows\System32\svchost.exe,aa51ceaff93cd76a18af70c36d7c2899,C:\Windows\system32\svchost.exe -k DcomLaunch,Microsoft Windows,true,The file is signed and the signature was verified.,Microsoft Windows Verification PCA
EE171MIY,PerfHost,0,Performance Counter DLL Host,Enables remote users and 64-bit processes to query performance counters provided by 32-bit DLLs. If this service is stopped  only local users and 32-bit processes will be able to query performance counters provided by 32-bit DLLs.,C:\Windows\SysWOW64\perfhost.exe,cbd5c4d84a85bacf273cf3b19c0fcfd2,C:\Windows\SysWow64\perfhost.exe,Microsoft Windows,true,The file is signed and the signature was verified.,Microsoft Windows Verification PCA
EE171MIY,EapHost,0,Extensible Authentication Protocol,The Extensible Authentication Protocol (EAP) service provides network authentication in such scenarios as 802.1x wired and wireless  VPN  and Network Access Protection (NAP).  EAP also provides application programming interfaces (APIs) that are used by network access clients  including wireless and VPN clients  during the authentication process.  If you disable this service  this computer is prevented from accessing networks that require EAP authentication.,C:\Windows\System32\svchost.exe,aa51ceaff93cd76a18af70c36d7c2899,C:\Windows\System32\svchost.exe -k netsvcs,Microsoft Windows,true,The file is signed and the signature was verified.,Microsoft Windows Verification PCA
EE171MIY,vga,0,vga,,C:\Windows\System32\drivers\vgapnp.sys,25f0d652631819f4a015067f67b20587,system32\DRIVERS\vgapnp.sys,Microsoft Windows,true,The file is signed and the signature was verified.,Microsoft Windows Verification PCA
EE171MIY,RDPREFMP,0,Reflector Display Driver used to gain access to graphics data,RDP Reflector Driver Miniport,C:\Windows\System32\drivers\RDPREFMP.sys,cb2ba63861e1690177dbd9f86cab3ab5,system32\drivers\rdprefmp.sys,Microsoft Windows,true,The file is signed and the signature was verified.,Microsoft Windows Verification PCA
EE171MIY,tunnel,0,Microsoft Tunnel Miniport Adapter Driver,,C:\Windows\System32\drivers\tunnel.sys,b679143207e0cf715e6ddbe6e74054ca,system32\DRIVERS\tunnel.sys,Microsoft Windows,true,The file is signed and the signature was verified.,Microsoft Windows Verification PCA
EE171MIY,AmdPPM,0,AMD Processor Driver,,C:\Windows\System32\drivers\amdppm.sys,27d277412c6a0b7c595c35a9942e387c,\SystemRoot\system32\drivers\amdppm.sys,Microsoft Windows,true,The file is signed and the signature was verified.,Microsoft Windows Verification PCA
EE171MIY,msahci,0,msahci,,C:\Windows\System32\drivers\msahci.sys,ad6be1bcfb86a0598462369fe72aa4ee,\SystemRoot\system32\drivers\msahci.sys,Microsoft Windows,true,The file is signed and the signature was verified.,Microsoft Windows Verification PCA
EE171MIY,Serial,0,Serial port driver,,C:\Windows\System32\drivers\serial.sys,b45fc8f50a0f0273d7e23407af611f21,\SystemRoot\system32\drivers\serial.sys,Microsoft Windows,true,The file is signed and the signature was verified.,Microsoft Windows Verification PCA
EE171MIY,AmdK8,0,AMD K8 Processor Driver,,C:\Windows\System32\drivers\amdk8.sys,5e1d3b52e0b01cfe74a0f6431e9b1417,\SystemRoot\system32\drivers\amdk8.sys,Microsoft Windows,true,The file is signed and the signature was verified.,Microsoft Windows Verification PCA
EE171MIY,NetMsmqActivator,0,Net.Msmq Listener Adapter,Receives activation requests over the net.msmq and msmq.formatname protocols and passes them to the Windows Process Activation Service.,C:\Windows\Microsoft.NET\Framework64\v4.0.30319\SMSvcHost.exe,bb12c21a39ebaff79237fa7222d6ef0b,C:\Windows\Microsoft.NET\Framework64\v4.0.30319\SMSvcHost.exe -NetMsmqActivator,Microsoft Corporation,true,The file is signed and the signature was verified.,Microsoft Code Signing PCA
EE171MIY,storvsc,0,storvsc,,C:\Windows\System32\drivers\storvsc.sys,4b21189d401912ac76c649db49446b38,\SystemRoot\system32\drivers\storvsc.sys,Microsoft Windows,true,The file is signed and the signature was verified.,Microsoft Windows Verification PCA
EE171MIY,MpsSvc,768,Windows Firewall,Windows Firewall helps protect your computer by preventing unauthorized users from gaining access to your computer through the Internet or a network.,C:\Windows\System32\svchost.exe,aa51ceaff93cd76a18af70c36d7c2899,C:\Windows\system32\svchost.exe -k LocalServiceNoNetwork,Microsoft Windows,true,The file is signed and the signature was verified.,Microsoft Windows Verification PCA
EE171MIY,Schedule,968,Task Scheduler,Enables a user to configure and schedule automated tasks on this computer. The service also hosts multiple Windows system-critical tasks. If this service is stopped or disabled  these tasks will not be run at their scheduled times. If this service is disabled  any services that explicitly depend on it will fail to start.,C:\Windows\System32\svchost.exe,aa51ceaff93cd76a18af70c36d7c2899,C:\Windows\system32\svchost.exe -k netsvcs,Microsoft Windows,true,The file is signed and the signature was verified.,Microsoft Windows Verification PCA
EE171MIY,storvsp,0,storvsp,,C:\Windows\System32\drivers\storvsp.sys,b43c918bd188d0ec8e4ef56e2b87f89b,\SystemRoot\system32\drivers\storvsp.sys,Microsoft Windows,true,The file is signed and the signature was verified.,Microsoft Windows Verification PCA
EE171MIY,COMSysApp,1656,COM+ System Application,Manages the configuration and tracking of Component Object Model (COM)+-based components. If the service is stopped  most COM+-based components will not function properly. If this service is disabled  any services that explicitly depend on it will fail to start.,C:\Windows\System32\dllhost.exe,714351c371ff03cf3bbbc012ccc3195b,C:\Windows\system32\dllhost.exe /Processid:{02D4B3F1-FD88-11D1-960D-00805FC79235},Microsoft Windows,true,The file is signed and the signature was verified.,Microsoft Windows Verification PCA
EE171MIY,sfloppy,0,High-Capacity Floppy Disk Drive,,C:\Windows\System32\drivers\sfloppy.sys,0abbc58cf890ba1734b137e713c9cd3a,\SystemRoot\system32\drivers\sfloppy.sys,Microsoft Windows,true,The file is signed and the signature was verified.,Microsoft Windows Verification PCA
EE171MIY,atapi,0,atapi,,C:\Windows\System32\drivers\atapi.sys,3bdb5d7170fcc4e6ed78aacedc4b2a6e,\SystemRoot\system32\drivers\atapi.sys,Microsoft Windows,true,The file is signed and the signature was verified.,Microsoft Windows Verification PCA
EE171MIY,RasAgileVpn,0,WAN Miniport (IKEv2),WAN Miniport (IKEv2),C:\Windows\System32\drivers\agilevpn.sys,a0f4aa1a71aecf0bb13c737af2891e62,system32\DRIVERS\AgileVpn.sys,Microsoft Windows,true,The file is signed and the signature was verified.,Microsoft Windows Verification PCA
EE171MIY,srv,0,Server SMB 1.xxx Driver,Enables connectivity from Windows XP and earlier clients,C:\Windows\System32\drivers\srv.sys,e26465e75fec0f8baf755ffe09c9e0c8,System32\DRIVERS\srv.sys,Microsoft Windows,true,The file is signed and the signature was verified.,Microsoft Windows Verification PCA
EE171MIY,Winmgmt,968,Windows Management Instrumentation,Provides a common interface and object model to access management information about operating system  devices  applications and services. If this service is stopped  most Windows-based software will not function properly. If this service is disabled  any services that explicitly depend on it will fail to start.,C:\Windows\System32\svchost.exe,aa51ceaff93cd76a18af70c36d7c2899,C:\Windows\system32\svchost.exe -k netsvcs,Microsoft Windows,true,The file is signed and the signature was verified.,Microsoft Windows Verification PCA
EE171MIY,PolicyAgent,1712,IPsec Policy Agent,"""Internet Protocol security (IPsec) supports network-level peer authentication  data origin authentication  data integrity  data confidentiality (encryption)  and replay protection.  This service enforces IPsec policies created through the IP Security Policies snap-in or the command-line tool """"netsh ipsec"""".  If you stop this service  you may experience network connectivity issues if your policy requires that connections use IPsec.  Also remote management of Windows Firewall is not available when this service is stopped.""",C:\Windows\System32\svchost.exe,aa51ceaff93cd76a18af70c36d7c2899,C:\Windows\system32\svchost.exe -k NetworkServiceNetworkRestricted,Microsoft Windows,true,The file is signed and the signature was verified.,Microsoft Windows Verification PCA
EE171MIY,umbus,0,UMBus Enumerator Driver,,C:\Windows\System32\drivers\umbus.sys,81e760c45f83a403651171eacf36c0be,system32\DRIVERS\umbus.sys,Microsoft Windows,true,The file is signed and the signature was verified.,Microsoft Windows Verification PCA
