hostname,name,pid,descriptivename,description,path,pathmd5sum,arguments,pathcertificatesubject,pathsignatureverified,pathsignaturedescription,pathcertificateissuer
EE171MIY,clr_optimization_v4.0.30319_32,0,Microsoft .NET Framework NGEN v4.0.30319_X86,Microsoft .NET Framework NGEN,C:\Windows\Microsoft.NET\Framework\v4.0.30319\mscorsvw.exe,7fa06dea4137a4e196114a57b9932528,C:\Windows\Microsoft.NET\Framework\v4.0.30319\mscorsvw.exe,Microsoft Dynamic Code Publisher,true,The file is signed and the signature was verified.,Microsoft Code Signing PCA
EE171MIY,ioatdma,0,Intel(R) QuickData Technology Device,,C:\Windows\System32\drivers\qd260x64.sys,6b6d2aaa9da5e7530bb115b5bc437e60,\SystemRoot\System32\Drivers\qd260x64.sys,Microsoft Windows,true,The file is signed and the signature was verified.,Microsoft Windows Verification PCA
EE171MIY,Appinfo,968,Application Information,Facilitates the running of interactive applications with additional administrative privileges.  If this service is stopped  users will be unable to launch applications with the additional administrative privileges they may require to perform desired user tasks.,C:\Windows\System32\svchost.exe,aa51ceaff93cd76a18af70c36d7c2899,C:\Windows\system32\svchost.exe -k netsvcs,Microsoft Windows,true,The file is signed and the signature was verified.,Microsoft Windows Verification PCA
EE171MIY,CmBatt,0,Microsoft ACPI Control Method Battery Driver,,C:\Windows\System32\drivers\CmBatt.sys,be0215dd9e6c6d87b86efb51fbc42617,\SystemRoot\system32\drivers\CmBatt.sys,Microsoft Windows,true,The file is signed and the signature was verified.,Microsoft Windows Verification PCA
EE171MIY,FDResPub,0,Function Discovery Resource Publication,Publishes this computer and resources attached to this computer so they can be discovered over the network.  If this service is stopped  network resources will no longer be published and they will not be discovered by other computers on the network.,C:\Windows\System32\svchost.exe,aa51ceaff93cd76a18af70c36d7c2899,C:\Windows\system32\svchost.exe -k LocalServiceAndNoImpersonation,Microsoft Windows,true,The file is signed and the signature was verified.,Microsoft Windows Verification PCA
EE171MIY,napagent,0,Network Access Protection Agent,The Network Access Protection (NAP) agent service collects and manages health information for client computers on a network. Information collected by NAP agent is used to make sure that the client computer has the required software and settings. If a client computer is not compliant with health policy  it can be provided with restricted network access until its configuration is updated. Depending on the configuration of health policy  client computers might be automatically updated so that users quickly regain full network access without having to manually update their computer.,C:\Windows\System32\svchost.exe,aa51ceaff93cd76a18af70c36d7c2899,C:\Windows\System32\svchost.exe -k NetworkService,Microsoft Windows,true,The file is signed and the signature was verified.,Microsoft Windows Verification PCA
EE171MIY,WPDBusEnum,0,Portable Device Enumerator Service,Enforces group policy for removable mass-storage devices. Enables applications such as Windows Media Player and Image Import Wizard to transfer and synchronize content using removable mass-storage devices.,C:\Windows\System32\svchost.exe,aa51ceaff93cd76a18af70c36d7c2899,C:\Windows\system32\svchost.exe -k LocalSystemNetworkRestricted,Microsoft Windows,true,The file is signed and the signature was verified.,Microsoft Windows Verification PCA
EE171MIY,tssecsrv,0,Remote Desktop Services Security Filter Driver,Remote Desktop Services Security Filter Driver,C:\Windows\System32\drivers\tssecsrv.sys,4776ffeb42f944cf860d7f40d4ee1211,System32\DRIVERS\tssecsrv.sys,Microsoft Windows,true,The file is signed and the signature was verified.,Microsoft Windows Verification PCA
EE171MIY,kbdhid,0,Keyboard HID Driver,,C:\Windows\System32\drivers\kbdhid.sys,b172d71740e796a63b20e80f56243208,\SystemRoot\system32\drivers\kbdhid.sys,Microsoft Windows,true,The file is signed and the signature was verified.,Microsoft Windows Verification PCA
EE171MIY,Dnscache,852,DNS Client,The DNS Client service (dnscache) caches Domain Name System (DNS) names and registers the full computer name for this computer. If the service is stopped  DNS names will continue to be resolved. However  the results of DNS name queries will not be cached and the computer's name will not be registered. If the service is disabled  any services that explicitly depend on it will fail to start.,C:\Windows\System32\svchost.exe,aa51ceaff93cd76a18af70c36d7c2899,C:\Windows\system32\svchost.exe -k NetworkService,Microsoft Windows,true,The file is signed and the signature was verified.,Microsoft Windows Verification PCA
EE171MIY,sermouse,0,Serial Mouse Driver,,C:\Windows\System32\drivers\sermouse.sys,c2e529ce0595b2cc16e58a250aef92f1,\SystemRoot\system32\drivers\sermouse.sys,Microsoft Windows,true,The file is signed and the signature was verified.,Microsoft Windows Verification PCA
EE171MIY,ProtectedStorage,0,Protected Storage,Provides protected storage for sensitive data  such as passwords  to prevent access by unauthorized services  processes  or users.,C:\Windows\System32\lsass.exe,2b59d3f1b81999abd58d3335d87ca799,C:\Windows\system32\lsass.exe,Microsoft Windows,true,The file is signed and the signature was verified.,Microsoft Windows Verification PCA
EE171MIY,EventSystem,828,COM+ Event System,Supports System Event Notification Service (SENS)  which provides automatic distribution of events to subscribing Component Object Model (COM) components. If the service is stopped  SENS will close and will not be able to provide logon and logoff notifications. If this service is disabled  any services that explicitly depend on it will fail to start.,C:\Windows\System32\svchost.exe,aa51ceaff93cd76a18af70c36d7c2899,C:\Windows\system32\svchost.exe -k LocalService,Microsoft Windows,true,The file is signed and the signature was verified.,Microsoft Windows Verification PCA
EE171MIY,tdx,0,NetIO Legacy TDI Support Driver,NetIO Legacy TDI Support Driver,C:\Windows\System32\drivers\tdx.sys,08e0c7016304a53610188468eb9cf864,system32\DRIVERS\tdx.sys,Microsoft Windows,true,The file is signed and the signature was verified.,Microsoft Windows Verification PCA
EE171MIY,srvnet,0,srvnet,,C:\Windows\System32\drivers\srvnet.sys,a395f1dcd720f5f3664e1f4ea92593a8,System32\DRIVERS\srvnet.sys,Microsoft Windows,true,The file is signed and the signature was verified.,Microsoft Windows Verification PCA
EE171MIY,mrxsmb20,0,SMB 2.0 MiniRedirector,Implements the SMB 2.0 protocol  which provides connectivity to network resources on Windows Vista and later servers,C:\Windows\System32\drivers\mrxsmb20.sys,a246f78b1a56368a31b4ff638cfe0641,system32\DRIVERS\mrxsmb20.sys,Microsoft Windows,true,The file is signed and the signature was verified.,Microsoft Windows Verification PCA
EE171MIY,ohci1394,0,1394 OHCI Compliant Host Controller (Legacy),,C:\Windows\System32\drivers\ohci1394.sys,9c9b55f8edd8893dc8c17d6175fad527,\SystemRoot\system32\drivers\ohci1394.sys,Microsoft Windows,true,The file is signed and the signature was verified.,Microsoft Windows Verification PCA
EE171MIY,tcpipreg,0,TCP/IP Registry Compatibility,Provides compatibility for legacy applications which interact with TCP/IP through the registry. If this service is stopped  certain applications may have impaired functionality.,C:\Windows\System32\drivers\tcpipreg.sys,fcee473376a7a97076f3de0385266369,System32\drivers\tcpipreg.sys,Microsoft Windows,true,The file is signed and the signature was verified.,Microsoft Windows Verification PCA
EE171MIY,LSI_SAS2,0,LSI_SAS2,,C:\Windows\System32\drivers\lsi_sas2.sys,05afe14df9e11f2cad4fbeb7c08dfb3b,\SystemRoot\system32\drivers\lsi_sas2.sys,Microsoft Windows,true,The file is signed and the signature was verified.,Microsoft Windows Verification PCA
EE171MIY,WANARP,0,Remote Access IP ARP Driver,Remote Access IP ARP Driver,C:\Windows\System32\drivers\wanarp.sys,05e1cdf374420016479575d2bdffae2d,system32\DRIVERS\wanarp.sys,Microsoft Windows,true,The file is signed and the signature was verified.,Microsoft Windows Verification PCA
EE171MIY,PptpMiniport,0,WAN Miniport (PPTP),WAN Miniport (PPTP),C:\Windows\System32\drivers\raspptp.sys,4e4416e112d4073ceba16033a284c05d,system32\DRIVERS\raspptp.sys,Microsoft Windows,true,The file is signed and the signature was verified.,Microsoft Windows Verification PCA
EE171MIY,mrxsmb,0,SMB MiniRedirector Wrapper and Engine,Implements the framework for the SMB filesystem redirector,C:\Windows\System32\drivers\mrxsmb.sys,582ad66ee61f3631a66774d6873e0585,system32\DRIVERS\mrxsmb.sys,Microsoft Windows,true,The file is signed and the signature was verified.,Microsoft Windows Verification PCA
EE171MIY,vmbus,0,vmbus,,C:\Windows\System32\drivers\vmbus.sys,171b4180e1083065231f502acbf31713,\SystemRoot\system32\drivers\vmbus.sys,Microsoft Windows,true,The file is signed and the signature was verified.,Microsoft Windows Verification PCA
EE171MIY,HpSAMD,0,HpSAMD,,C:\Windows\System32\drivers\HpSAMD.sys,8ef30e3161c045dbf2f9faf01688f9df,\SystemRoot\system32\drivers\HpSAMD.sys,Microsoft Windows,true,The file is signed and the signature was verified.,Microsoft Windows Verification PCA
EE171MIY,AudioEndpointBuilder,0,Windows Audio Endpoint Builder,Manages audio devices for the Windows Audio service.  If this service is stopped  audio devices and effects will not function properly.  If this service is disabled  any services that explicitly depend on it will fail to start,C:\Windows\System32\svchost.exe,aa51ceaff93cd76a18af70c36d7c2899,C:\Windows\System32\svchost.exe -k LocalSystemNetworkRestricted,Microsoft Windows,true,The file is signed and the signature was verified.,Microsoft Windows Verification PCA
EE171MIY,Processor,0,Processor Driver,,C:\Windows\System32\drivers\processr.sys,a33500d45580e8a409d60ea833975cac,\SystemRoot\system32\drivers\processr.sys,Microsoft Windows,true,The file is signed and the signature was verified.,Microsoft Windows Verification PCA
EE171MIY,FontCache,828,Windows Font Cache Service,Optimizes performance of applications by caching commonly used font data. Applications will start this service if it is not already running. It can be disabled  though doing so will degrade application performance.,C:\Windows\System32\svchost.exe,aa51ceaff93cd76a18af70c36d7c2899,C:\Windows\system32\svchost.exe -k LocalService,Microsoft Windows,true,The file is signed and the signature was verified.,Microsoft Windows Verification PCA
EE171MIY,stornvme,0,stornvme,,C:\Windows\System32\drivers\stornvme.sys,beca06e91d2f3d4ea55325ec5a78cc73,\SystemRoot\system32\drivers\stornvme.sys,Microsoft Windows,true,The file is signed and the signature was verified.,Microsoft Windows Verification PCA
EE171MIY,GoogleVssProvider,1264,GoogleVssProvider,Google Vss Hardware Provider,C:\Windows\System32\dllhost.exe,714351c371ff03cf3bbbc012ccc3195b,C:\Windows\system32\dllhost.exe /Processid:{3EAE8C5E-B51F-4CBD-9DCE-FA6AA0BDF8B8},Microsoft Windows,true,The file is signed and the signature was verified.,Microsoft Windows Verification PCA
EE171MIY,PlugPlay,560,Plug and Play,Enables a computer to recognize and adapt to hardware changes with little or no user input. Stopping or disabling this service will result in system instability.,C:\Windows\System32\svchost.exe,aa51ceaff93cd76a18af70c36d7c2899,C:\Windows\system32\svchost.exe -k DcomLaunch,Microsoft Windows,true,The file is signed and the signature was verified.,Microsoft Windows Verification PCA
EE171MIY,NetTcpActivator,0,Net.Tcp Listener Adapter,Receives activation requests over the net.tcp protocol and passes them to the Windows Process Activation Service.,C:\Windows\Microsoft.NET\Framework64\v4.0.30319\SMSvcHost.exe,bb12c21a39ebaff79237fa7222d6ef0b,C:\Windows\Microsoft.NET\Framework64\v4.0.30319\SMSvcHost.exe,Microsoft Corporation,true,The file is signed and the signature was verified.,Microsoft Code Signing PCA
EE171MIY,arc,0,arc,,C:\Windows\System32\drivers\arc.sys,dddb73ad500b6fec8994736b7984df2d,\SystemRoot\system32\drivers\arc.sys,Microsoft Windows,true,The file is signed and the signature was verified.,Microsoft Windows Verification PCA
EE171MIY,mountmgr,0,Mount Point Manager,Driver responsible with maintaining persistent drive letters and names for volumes,C:\Windows\System32\drivers\mountmgr.sys,00bae3fd70cd7757998354765feb9b2e,\SystemRoot\System32\drivers\mountmgr.sys,Microsoft Windows,true,The file is signed and the signature was verified.,Microsoft Windows Verification PCA
EE171MIY,Rasl2tp,0,WAN Miniport (L2TP),WAN Miniport (L2TP),C:\Windows\System32\drivers\rasl2tp.sys,545dd536519df796a1dbeca02183cd28,system32\DRIVERS\rasl2tp.sys,Microsoft Windows,true,The file is signed and the signature was verified.,Microsoft Windows Verification PCA
EE171MIY,hwpolicy,0,Hardware Policy Driver,Contains Processor and other policies,C:\Windows\System32\drivers\hwpolicy.sys,3413584fee3ac3f307a6b2146ac6bcda,\SystemRoot\System32\drivers\hwpolicy.sys,Microsoft Windows,true,The file is signed and the signature was verified.,Microsoft Windows Verification PCA
EE171MIY,MSiSCSI,0,Microsoft iSCSI Initiator Service,Manages Internet SCSI (iSCSI) sessions from this computer to remote iSCSI target devices. If this service is stopped  this computer will not be able to login or access iSCSI targets. If this service is disabled  any services that explicitly depend on it will fail to start.,C:\Windows\System32\svchost.exe,aa51ceaff93cd76a18af70c36d7c2899,C:\Windows\system32\svchost.exe -k netsvcs,Microsoft Windows,true,The file is signed and the signature was verified.,Microsoft Windows Verification PCA
EE171MIY,WudfPf,0,User Mode Driver Frameworks Platform Driver,,C:\Windows\System32\drivers\WUDFPf.sys,a80b79c86d7346b2fb1df479b2f97d08,system32\drivers\WudfPf.sys,Microsoft Windows,true,The file is signed and the signature was verified.,Microsoft Windows Verification PCA
EE171MIY,amdsbs,0,amdsbs,,C:\Windows\System32\drivers\amdsbs.sys,4d6f8a5494a1c0345cb93da7836ff19a,\SystemRoot\system32\drivers\amdsbs.sys,Microsoft Windows,true,The file is signed and the signature was verified.,Microsoft Windows Verification PCA
EE171MIY,Serenum,0,Serenum Filter Driver,,C:\Windows\System32\drivers\serenum.sys,96f391ad421fe3a19d5df21db92911d6,\SystemRoot\system32\drivers\serenum.sys,Microsoft Windows,true,The file is signed and the signature was verified.,Microsoft Windows Verification PCA
EE171MIY,TapiSrv,0,Telephony,Provides Telephony API (TAPI) support for programs that control telephony devices on the local computer and  through the LAN  on servers that are also running the service.,C:\Windows\System32\svchost.exe,aa51ceaff93cd76a18af70c36d7c2899,C:\Windows\System32\svchost.exe -k tapisrv,Microsoft Windows,true,The file is signed and the signature was verified.,Microsoft Windows Verification PCA
EE171MIY,AudioSrv,0,Windows Audio,Manages audio for Windows-based programs.  If this service is stopped  audio devices and effects will not function properly.  If this service is disabled  any services that explicitly depend on it will fail to start,C:\Windows\System32\svchost.exe,aa51ceaff93cd76a18af70c36d7c2899,C:\Windows\System32\svchost.exe -k LocalServiceNetworkRestricted,Microsoft Windows,true,The file is signed and the signature was verified.,Microsoft Windows Verification PCA
EE171MIY,RasAuto,0,Remote Access Auto Connection Manager,Creates a connection to a remote network whenever a program references a remote DNS or NetBIOS name or address.,C:\Windows\System32\svchost.exe,aa51ceaff93cd76a18af70c36d7c2899,C:\Windows\System32\svchost.exe -k netsvcs,Microsoft Windows,true,The file is signed and the signature was verified.,Microsoft Windows Verification PCA
EE171MIY,lmhosts,932,TCP/IP NetBIOS Helper,Provides support for the NetBIOS over TCP/IP (NetBT) service and NetBIOS name resolution for clients on the network  therefore enabling users to share files  print  and log on to the network. If this service is stopped  these functions might be unavailable. If this service is disabled  any services that explicitly depend on it will fail to start.,C:\Windows\System32\svchost.exe,aa51ceaff93cd76a18af70c36d7c2899,C:\Windows\system32\svchost.exe -k LocalServiceNetworkRestricted,Microsoft Windows,true,The file is signed and the signature was verified.,Microsoft Windows Verification PCA
EE171MIY,MSDTC,1864,Distributed Transaction Coordinator,Coordinates transactions that span multiple resource managers  such as databases  message queues  and file systems. If this service is stopped  these transactions will fail. If this service is disabled  any services that explicitly depend on it will fail to start.,C:\Windows\System32\msdtc.exe,bf23f35e93caf6961d85f921a3f20d13,C:\Windows\System32\msdtc.exe,Microsoft Windows,true,The file is signed and the signature was verified.,Microsoft Windows Verification PCA
EE171MIY,Mup,0,Mup,Multiple UNC Provider Driver,C:\Windows\System32\drivers\mup.sys,3e5635dace911c66eef71a26a7508629,\SystemRoot\System32\Drivers\mup.sys,Microsoft Windows,true,The file is signed and the signature was verified.,Microsoft Windows Verification PCA
EE171MIY,ql40xx,0,ql40xx,,C:\Windows\System32\drivers\ql40xx.sys,c77572b1576c8b88544991bf4a71fc4a,\SystemRoot\system32\drivers\ql40xx.sys,Microsoft Windows,true,The file is signed and the signature was verified.,Microsoft Windows Verification PCA
EE171MIY,LSI_SCSI,0,LSI_SCSI,,C:\Windows\System32\drivers\lsi_scsi.sys,81fb3fabb200131eb5c47827f0e2aeda,\SystemRoot\system32\drivers\lsi_scsi.sys,Microsoft Windows,true,The file is signed and the signature was verified.,Microsoft Windows Verification PCA
EE171MIY,hkmsvc,0,Health Key and Certificate Management,Provides X.509 certificate and key management services for the Network Access Protection Agent (NAPAgent). Enforcement technologies that use X.509 certificates may not function properly without this service,C:\Windows\System32\svchost.exe,aa51ceaff93cd76a18af70c36d7c2899,C:\Windows\System32\svchost.exe -k netsvcs,Microsoft Windows,true,The file is signed and the signature was verified.,Microsoft Windows Verification PCA
EE171MIY,SamSs,460,Security Accounts Manager,The startup of this service signals other services that the Security Accounts Manager (SAM) is ready to accept requests.  Disabling this service will prevent other services in the system from being notified when the SAM is ready  which may in turn cause those services to fail to start correctly. This service should not be disabled.,C:\Windows\System32\lsass.exe,2b59d3f1b81999abd58d3335d87ca799,C:\Windows\system32\lsass.exe,Microsoft Windows,true,The file is signed and the signature was verified.,Microsoft Windows Verification PCA
EE171MIY,wuauserv,968,Windows Update,Enables the detection  download  and installation of updates for Windows and other programs. If this service is disabled  users of this computer will not be able to use Windows Update or its automatic updating feature  and programs will not be able to use the Windows Update Agent (WUA) API.,C:\Windows\System32\svchost.exe,aa51ceaff93cd76a18af70c36d7c2899,C:\Windows\system32\svchost.exe -k netsvcs,Microsoft Windows,true,The file is signed and the signature was verified.,Microsoft Windows Verification PCA
EE171MIY,Vid,0,Vid,,C:\Windows\System32\drivers\Vid.sys,763119bdac4521d69ba0f528a88e6842,\SystemRoot\system32\drivers\Vid.sys,Microsoft Windows,true,The file is signed and the signature was verified.,Microsoft Windows Verification PCA
EE171MIY,FsDepends,0,File System Dependency Minifilter,This minifilter tracks the dependencies associated with the various nested volumes/filesystems,C:\Windows\System32\drivers\FsDepends.sys,e74cdb133c44cac83f83bd4aa5a7782a,System32\drivers\FsDepends.sys,Microsoft Windows,true,The file is signed and the signature was verified.,Microsoft Windows Verification PCA
EE171MIY,1394ohci,0,1394 OHCI Compliant Host Controller,,C:\Windows\System32\drivers\1394ohci.sys,82a068644ae63e6847391c33a6eefda8,\SystemRoot\system32\drivers\1394ohci.sys,Microsoft Windows,true,The file is signed and the signature was verified.,Microsoft Windows Verification PCA
EE171MIY,IPBusEnum,0,PnP-X IP Bus Enumerator,The PnP-X bus enumerator service manages the virtual network bus. It discovers network connected devices using the SSDP/WS discovery protocols and gives them presence in PnP. If this service is stopped or disabled  presence of NCD devices will not be maintained in PnP. All pnpx based scenarios will stop functioning.,C:\Windows\System32\svchost.exe,aa51ceaff93cd76a18af70c36d7c2899,C:\Windows\system32\svchost.exe -k LocalSystemNetworkRestricted,Microsoft Windows,true,The file is signed and the signature was verified.,Microsoft Windows Verification PCA
EE171MIY,KtmRm,0,KtmRm for Distributed Transaction Coordinator,Coordinates transactions between the Distributed Transaction Coordinator (MSDTC) and the Kernel Transaction Manager (KTM). If it is not needed  it is recommended that this service remain stopped. If it is needed  both MSDTC and KTM will start this service automatically. If this service is disabled  any MSDTC transaction interacting with a Kernel Resource Manager will fail and any services that explicitly depend on it will fail to start.,C:\Windows\System32\svchost.exe,aa51ceaff93cd76a18af70c36d7c2899,C:\Windows\System32\svchost.exe -k NetworkServiceAndNoImpersonation,Microsoft Windows,true,The file is signed and the signature was verified.,Microsoft Windows Verification PCA
EE171MIY,aspnet_state,0,ASP.NET State Service,Provides support for out-of-process session states for ASP.NET. If this service is stopped  out-of-process requests will not be processed. If this service is disabled  any services that explicitly depend on it will fail to start.,C:\Windows\Microsoft.NET\Framework64\v4.0.30319\aspnet_state.exe,f389944a29feb857eeadab354eb6a74c,C:\Windows\Microsoft.NET\Framework64\v4.0.30319\aspnet_state.exe,Microsoft Corporation,true,The file is signed and the signature was verified.,Microsoft Code Signing PCA
EE171MIY,ksthunk,0,Kernel Streaming Thunks,,C:\Windows\System32\drivers\ksthunk.sys,3710c61cc7f0420a7d69d49090c752c4,\SystemRoot\system32\drivers\ksthunk.sys,Microsoft Windows,true,The file is signed and the signature was verified.,Microsoft Windows Verification PCA
EE171MIY,PVPanic,0,QEMU PVPanic Service,,C:\Windows\System32\drivers\pvpanic.sys,da5889d3abf9cf7c198425a7811850ee,\SystemRoot\system32\drivers\pvpanic.sys,Google Inc,true,The file is signed and the signature was verified.,Symantec Class 3 SHA256 Code Signing CA
EE171MIY,Wd,0,Wd,,C:\Windows\System32\drivers\wd.sys,4233a0df94fceb1a2a965a80468693db,\SystemRoot\system32\drivers\wd.sys,Microsoft Windows,true,The file is signed and the signature was verified.,Microsoft Windows Verification PCA
EE171MIY,iphlpsvc,968,IP Helper,Provides tunnel connectivity using IPv6 transition technologies (6to4  ISATAP  Port Proxy  and Teredo)  and IP-HTTPS. If this service is stopped  the computer will not have the enhanced connectivity benefits that these technologies offer.,C:\Windows\System32\svchost.exe,aa51ceaff93cd76a18af70c36d7c2899,C:\Windows\System32\svchost.exe -k NetSvcs,Microsoft Windows,true,The file is signed and the signature was verified.,Microsoft Windows Verification PCA
EE171MIY,adpu320,0,adpu320,,C:\Windows\System32\drivers\adpu320.sys,f4ad779f24a43ba91c365309741d31b3,\SystemRoot\system32\drivers\adpu320.sys,Microsoft Windows,true,The file is signed and the signature was verified.,Microsoft Windows Verification PCA
EE171MIY,netkvm,0,Red Hat VirtIO Ethernet Adapter Service,,C:\Windows\System32\drivers\netkvm.sys,c141a98e703f4df740734c7b2e54a645,system32\DRIVERS\netkvm.sys,Google Inc,true,The file is signed and the signature was verified.,Symantec Class 3 SHA256 Code Signing CA
EE171MIY,VMBusHID,0,VMBusHID,,C:\Windows\System32\drivers\VMBusHID.sys,ba6db9de8badc605c9e8cd590bfeecc4,\SystemRoot\system32\drivers\VMBusHID.sys,Microsoft Windows,true,The file is signed and the signature was verified.,Microsoft Windows Verification PCA
EE171MIY,Modem,0,Modem,,C:\Windows\System32\drivers\modem.sys,012d979928b88347734eb0de03772630,system32\drivers\modem.sys,Microsoft Windows,true,The file is signed and the signature was verified.,Microsoft Windows Verification PCA
EE171MIY,TDPIPE,0,TDPIPE,,C:\Windows\System32\drivers\tdpipe.sys,8221ff847e3360c8181bd7dbd133bc25,system32\drivers\tdpipe.sys,Microsoft Windows,true,The file is signed and the signature was verified.,Microsoft Windows Verification PCA
EE171MIY,msiserver,0,Windows Installer,Adds  modifies  and removes applications provided as a Windows Installer (*.msi) package. If this service is disabled  any services that explicitly depend on it will fail to start.,C:\Windows\System32\msiexec.exe,9ba4606b538da6ac89435f4af97813d3,C:\Windows\system32\msiexec.exe /V,Microsoft Windows,true,The file is signed and the signature was verified.,Microsoft Windows Verification PCA
EE171MIY,srv2,0,Server SMB 2.xxx Driver,Enables connectivity from Windows Vista and later clients,C:\Windows\System32\drivers\srv2.sys,67c02aee61b00319c1ea1e6e042cb329,System32\DRIVERS\srv2.sys,Microsoft Windows,true,The file is signed and the signature was verified.,Microsoft Windows Verification PCA
EE171MIY,NdisTapi,0,Remote Access NDIS TAPI Driver,Remote Access NDIS TAPI Driver,C:\Windows\System32\drivers\ndistapi.sys,2df3aa6484e37579ede99c61cb299f54,system32\DRIVERS\ndistapi.sys,Microsoft Windows,true,The file is signed and the signature was verified.,Microsoft Windows Verification PCA
EE171MIY,WmiAcpi,0,Microsoft Windows Management Interface for ACPI,,C:\Windows\System32\drivers\wmiacpi.sys,95aabda64c8b43b3dbaf196000b2ca0d,\SystemRoot\system32\drivers\wmiacpi.sys,Microsoft Windows,true,The file is signed and the signature was verified.,Microsoft Windows Verification PCA
