hostname,name,pid,descriptivename,description,path,pathmd5sum,arguments,pathcertificatesubject,pathsignatureverified,pathsignaturedescription,pathcertificateissuer
ST869VRJ,BrokerInfrastructure,688,Background Tasks Infrastructure Service,Windows infrastructure service that controls which background tasks can run on the system.,C:\Windows\System32\svchost.exe,e8a50e71ccad69cee0faf29f092b1381,C:\Windows\system32\svchost.exe -k DcomLaunch,Microsoft Windows,true,The file is signed and the signature was verified.,Microsoft Windows Production PCA 2011
ST869VRJ,KtmRm,0,KtmRm for Distributed Transaction Coordinator,Coordinates transactions between the Distributed Transaction Coordinator (MSDTC) and the Kernel Transaction Manager (KTM). If it is not needed  it is recommended that this service remain stopped. If it is needed  both MSDTC and KTM will start this service automatically. If this service is disabled  any MSDTC transaction interacting with a Kernel Resource Manager will fail and any services that explicitly depend on it will fail to start.,C:\Windows\System32\svchost.exe,e8a50e71ccad69cee0faf29f092b1381,C:\Windows\System32\svchost.exe -k NetworkServiceAndNoImpersonation,Microsoft Windows,true,The file is signed and the signature was verified.,Microsoft Windows Production PCA 2011
ST869VRJ,FDResPub,0,Function Discovery Resource Publication,Publishes this computer and resources attached to this computer so they can be discovered over the network.  If this service is stopped  network resources will no longer be published and they will not be discovered by other computers on the network.,C:\Windows\System32\svchost.exe,e8a50e71ccad69cee0faf29f092b1381,C:\Windows\system32\svchost.exe -k LocalServiceAndNoImpersonation,Microsoft Windows,true,The file is signed and the signature was verified.,Microsoft Windows Production PCA 2011
ST869VRJ,DsmSvc,0,Device Setup Manager,Enables the detection  download and installation of device-related software. If this service is disabled  devices may be configured with outdated software  and may not work correctly.,C:\Windows\System32\svchost.exe,e8a50e71ccad69cee0faf29f092b1381,C:\Windows\system32\svchost.exe -k netsvcs,Microsoft Windows,true,The file is signed and the signature was verified.,Microsoft Windows Production PCA 2011
ST869VRJ,sbp2port,0,SBP-2 Transport/Protocol Bus Driver,,C:\Windows\System32\drivers\sbp2port.sys,8c0f63143e512a8943e00e38425d26e5,\SystemRoot\System32\drivers\sbp2port.sys,Microsoft Windows,true,The file is signed and the signature was verified.,Microsoft Windows Production PCA 2011
ST869VRJ,Appinfo,888,Application Information,Facilitates the running of interactive applications with additional administrative privileges.  If this service is stopped  users will be unable to launch applications with the additional administrative privileges they may require to perform desired user tasks.,C:\Windows\System32\svchost.exe,e8a50e71ccad69cee0faf29f092b1381,C:\Windows\system32\svchost.exe -k netsvcs,Microsoft Windows,true,The file is signed and the signature was verified.,Microsoft Windows Production PCA 2011
ST869VRJ,amdsbs,0,amdsbs,,C:\Windows\System32\drivers\amdsbs.sys,3fd92dbeab87ad78e2dcc0e7ddd752f1,\SystemRoot\System32\drivers\amdsbs.sys,Microsoft Windows,true,The file is signed and the signature was verified.,Microsoft Windows Production PCA 2011
ST869VRJ,LanmanWorkstation,56,Workstation,Creates and maintains client network connections to remote servers using the SMB protocol. If this service is stopped  these connections will be unavailable. If this service is disabled  any services that explicitly depend on it will fail to start.,C:\Windows\System32\svchost.exe,e8a50e71ccad69cee0faf29f092b1381,C:\Windows\System32\svchost.exe -k NetworkService,Microsoft Windows,true,The file is signed and the signature was verified.,Microsoft Windows Production PCA 2011
ST869VRJ,Power,688,Power,Manages power policy and power policy notification delivery.,C:\Windows\System32\svchost.exe,e8a50e71ccad69cee0faf29f092b1381,C:\Windows\system32\svchost.exe -k DcomLaunch,Microsoft Windows,true,The file is signed and the signature was verified.,Microsoft Windows Production PCA 2011
ST869VRJ,SerCx,0,Serial UART Support Library,,C:\Windows\System32\drivers\SerCx.sys,33931f0677dffcbfc22c57dc5741eca3,system32\drivers\SerCx.sys,Microsoft Windows,true,The file is signed and the signature was verified.,Microsoft Windows Production PCA 2011
ST869VRJ,UASPStor,0,USB Attached SCSI (UAS) Driver,,C:\Windows\System32\drivers\uaspstor.sys,304e26442c3f91943084bfa92e0b19fe,\SystemRoot\System32\drivers\uaspstor.sys,Microsoft Windows,true,The file is signed and the signature was verified.,Microsoft Windows Production PCA 2011
ST869VRJ,condrv,0,Console Driver,,C:\Windows\System32\drivers\condrv.sys,e699619b401285055c626df8e6cdf55a,System32\drivers\condrv.sys,Microsoft Windows,true,The file is signed and the signature was verified.,Microsoft Windows Production PCA 2011
ST869VRJ,svsvc,0,Spot Verifier,Verifies potential file system corruptions.,C:\Windows\System32\svchost.exe,e8a50e71ccad69cee0faf29f092b1381,C:\Windows\system32\svchost.exe -k LocalSystemNetworkRestricted,Microsoft Windows,true,The file is signed and the signature was verified.,Microsoft Windows Production PCA 2011
ST869VRJ,KPSSVC,0,KDC Proxy Server service (KPS),KDC Proxy Server service runs on edge servers to proxy Kerberos protocol messages to domain controllers on the corporate network.,C:\Windows\System32\svchost.exe,e8a50e71ccad69cee0faf29f092b1381,C:\Windows\system32\svchost.exe -k KpsSvcGroup,Microsoft Windows,true,The file is signed and the signature was verified.,Microsoft Windows Production PCA 2011
ST869VRJ,Netlogon,0,Netlogon,Maintains a secure channel between this computer and the domain controller for authenticating users and services. If this service is stopped  the computer may not authenticate users and services and the domain controller cannot register DNS records. If this service is disabled  any services that explicitly depend on it will fail to start.,C:\Windows\System32\lsass.exe,fbcd3bd9a4ed05d97dc8fc549d87fc24,C:\Windows\system32\lsass.exe,Microsoft Windows,true,The file is signed and the signature was verified.,Microsoft Windows Production PCA 2011
ST869VRJ,KeyIso,0,CNG Key Isolation,The CNG key isolation service is hosted in the LSA process. The service provides key process isolation to private keys and associated cryptographic operations as required by the Common Criteria. The service stores and uses long-lived keys in a secure process complying with Common Criteria requirements.,C:\Windows\System32\lsass.exe,fbcd3bd9a4ed05d97dc8fc549d87fc24,C:\Windows\system32\lsass.exe,Microsoft Windows,true,The file is signed and the signature was verified.,Microsoft Windows Production PCA 2011
ST869VRJ,gagp30kx,0,Microsoft Generic AGPv3.0 Filter for K8 Processor Platforms,,C:\Windows\System32\drivers\GAGP30KX.SYS,be1c1e573c87f48f310cbbeecd5ee071,\SystemRoot\System32\drivers\gagp30kx.sys,Microsoft Windows,true,The file is signed and the signature was verified.,Microsoft Windows Production PCA 2011
ST869VRJ,NdisTapi,0,Remote Access NDIS TAPI Driver,Remote Access NDIS TAPI Driver,C:\Windows\System32\drivers\ndistapi.sys,73baec5dbe3874f49b06bc277fc73abd,\SystemRoot\system32\DRIVERS\ndistapi.sys,Microsoft Windows,true,The file is signed and the signature was verified.,Microsoft Windows Production PCA 2011
ST869VRJ,amdsata,0,amdsata,,C:\Windows\System32\drivers\amdsata.sys,1fd8d305bfe83df0999c524c953e660b,\SystemRoot\System32\drivers\amdsata.sys,Microsoft Windows,true,The file is signed and the signature was verified.,Microsoft Windows Production PCA 2011
ST869VRJ,AmdPPM,0,AMD Processor Driver,,C:\Windows\System32\drivers\amdppm.sys,38e5faa5e65cfcd88bbd8a935eacfa08,\SystemRoot\System32\drivers\amdppm.sys,Microsoft Windows,true,The file is signed and the signature was verified.,Microsoft Windows Production PCA 2011
ST869VRJ,storflt,0,Hyper-V Storage Accelerator,,C:\Windows\System32\drivers\vmstorfl.sys,265e871f7bbeb42b40bb1ae61f8c8868,\SystemRoot\System32\drivers\vmstorfl.sys,Microsoft Windows,true,The file is signed and the signature was verified.,Microsoft Windows Production PCA 2011
ST869VRJ,wudfsvc,0,Windows Driver Foundation - User-mode Driver Framework,Creates and manages user-mode driver processes. This service cannot be stopped.,C:\Windows\System32\svchost.exe,e8a50e71ccad69cee0faf29f092b1381,C:\Windows\system32\svchost.exe -k LocalSystemNetworkRestricted,Microsoft Windows,true,The file is signed and the signature was verified.,Microsoft Windows Production PCA 2011
ST869VRJ,USBHUB3,0,SuperSpeed Hub,,C:\Windows\System32\drivers\USBHUB3.SYS,bb3e4124ea331a2767cb73da3abe1d05,\SystemRoot\System32\drivers\UsbHub3.sys,Microsoft Windows,true,The file is signed and the signature was verified.,Microsoft Windows Production PCA 2011
ST869VRJ,RDPDR,0,Remote Desktop Device Redirector Driver,Remote Desktop Device Redirector Driver,C:\Windows\System32\drivers\rdpdr.sys,e64a673ae4cceb8fb8633f980ef5afe7,System32\drivers\rdpdr.sys,Microsoft Windows,true,The file is signed and the signature was verified.,Microsoft Windows Production PCA 2011
ST869VRJ,vdrvroot,0,Microsoft Virtual Drive Enumerator,,C:\Windows\System32\drivers\vdrvroot.sys,5ab760bcee77476e5d205cde9261b3b6,\SystemRoot\System32\drivers\vdrvroot.sys,Microsoft Windows,true,The file is signed and the signature was verified.,Microsoft Windows Production PCA 2011
ST869VRJ,WacomPen,0,Wacom Serial Pen HID Driver,,C:\Windows\System32\drivers\wacompen.sys,cc99c2ac12dbae370ce3caa001d808df,\SystemRoot\System32\drivers\wacompen.sys,Microsoft Windows,true,The file is signed and the signature was verified.,Microsoft Windows Production PCA 2011
ST869VRJ,HyperVideo,0,HyperVideo,,C:\Windows\System32\drivers\HyperVideo.sys,92c40a4786c95cb47de761cd09733ebc,\SystemRoot\system32\DRIVERS\HyperVideo.sys,Microsoft Windows,true,The file is signed and the signature was verified.,Microsoft Windows Production PCA 2011
ST869VRJ,srv2,0,Server SMB 2.xxx Driver,Enables connectivity from Windows Vista and later clients,C:\Windows\System32\drivers\srv2.sys,bb7ed050aee183a509e0a703483de9bd,System32\DRIVERS\srv2.sys,Microsoft Windows,true,The file is signed and the signature was verified.,Microsoft Windows Production PCA 2011
ST869VRJ,elxfcoe,0,elxfcoe,,C:\Windows\System32\drivers\elxfcoe.sys,f7c3105b244fe4addd156ea390233146,\SystemRoot\System32\drivers\elxfcoe.sys,Microsoft Windows,true,The file is signed and the signature was verified.,Microsoft Windows Production PCA 2011
ST869VRJ,EventLog,844,Windows Event Log,This service manages events and event logs. It supports logging events  querying events  subscribing to events  archiving event logs  and managing event metadata. It can display events in both XML and plain text format. Stopping this service may compromise security and reliability of the system.,C:\Windows\System32\svchost.exe,e8a50e71ccad69cee0faf29f092b1381,C:\Windows\System32\svchost.exe -k LocalServiceNetworkRestricted,Microsoft Windows,true,The file is signed and the signature was verified.,Microsoft Windows Production PCA 2011
ST869VRJ,qlfcoei,0,QLogic [FCoE] STOR Miniport Inbox Driver (wx64),,C:\Windows\System32\drivers\qlfcoei.sys,953d73de229611e59f6ba72ecf6143e6,\SystemRoot\System32\drivers\qlfcoei.sys,Microsoft Windows,true,The file is signed and the signature was verified.,Microsoft Windows Production PCA 2011
ST869VRJ,sacsvr,0,Special Administration Console Helper,Allows administrators to remotely access a command prompt using Emergency Management Services.,C:\Windows\System32\svchost.exe,e8a50e71ccad69cee0faf29f092b1381,C:\Windows\System32\svchost.exe -k netsvcs,Microsoft Windows,true,The file is signed and the signature was verified.,Microsoft Windows Production PCA 2011
ST869VRJ,Wecsvc,0,Windows Event Collector,This service manages persistent subscriptions to events from remote sources that support WS-Management protocol. This includes Windows Vista event logs  hardware and IPMI-enabled event sources. The service stores forwarded events in a local Event Log. If this service is stopped or disabled event subscriptions cannot be created and forwarded events cannot be accepted.,C:\Windows\System32\svchost.exe,e8a50e71ccad69cee0faf29f092b1381,C:\Windows\system32\svchost.exe -k NetworkService,Microsoft Windows,true,The file is signed and the signature was verified.,Microsoft Windows Production PCA 2011
ST869VRJ,Netman,0,Network Connections,Manages objects in the Network and Dial-Up Connections folder  in which you can view both local area network and remote connections.,C:\Windows\System32\svchost.exe,e8a50e71ccad69cee0faf29f092b1381,C:\Windows\System32\svchost.exe -k LocalSystemNetworkRestricted,Microsoft Windows,true,The file is signed and the signature was verified.,Microsoft Windows Production PCA 2011
ST869VRJ,xenvbd,0,AWS PV Storage Host Adapter,,C:\Windows\System32\drivers\xenvbd.sys,47383877a510a727ce8cef3f0d2e8e50,\SystemRoot\system32\DRIVERS\xenvbd.sys,Microsoft Windows Hardware Compatibility Publisher,true,The file is signed and the signature was verified.,Microsoft Windows Hardware Compatibility PCA
ST869VRJ,bxfcoe,0,Broadcom NetXtreme II Offload FCoE Driver,,C:\Windows\System32\drivers\bxfcoe.sys,53f99b51834200cff66eabb199fd6ef5,\SystemRoot\System32\drivers\bxfcoe.sys,Microsoft Windows,true,The file is signed and the signature was verified.,Microsoft Windows Production PCA 2011
ST869VRJ,HDAudBus,0,Microsoft UAA Bus Driver for High Definition Audio,,C:\Windows\System32\drivers\hdaudbus.sys,715c4f708edadde8ce2893120c4c1e45,\SystemRoot\System32\drivers\HDAudBus.sys,Microsoft Windows,true,The file is signed and the signature was verified.,Microsoft Windows Production PCA 2011
ST869VRJ,RasSstp,0,WAN Miniport (SSTP),WAN Miniport (SSTP),C:\Windows\System32\drivers\rassstp.sys,06ab12fc707444f29c8f0f520ca346ef,\SystemRoot\system32\DRIVERS\rassstp.sys,Microsoft Windows,true,The file is signed and the signature was verified.,Microsoft Windows Production PCA 2011
ST869VRJ,WudfPf,0,User Mode Driver Frameworks Platform Driver,,C:\Windows\System32\drivers\WUDFPf.sys,25caf28ac39a04d02524dfcd15c41d12,system32\drivers\WudfPf.sys,Microsoft Windows,true,The file is signed and the signature was verified.,Microsoft Windows Production PCA 2011
ST869VRJ,AppMgmt,0,Application Management,Processes installation  removal  and enumeration requests for software deployed through Group Policy. If the service is disabled  users will be unable to install  remove  or enumerate software deployed through Group Policy. If this service is disabled  any services that explicitly depend on it will fail to start.,C:\Windows\System32\svchost.exe,e8a50e71ccad69cee0faf29f092b1381,C:\Windows\system32\svchost.exe -k netsvcs,Microsoft Windows,true,The file is signed and the signature was verified.,Microsoft Windows Production PCA 2011
ST869VRJ,ibbus,0,Mellanox InfiniBand Bus/AL (Filter Driver),,C:\Windows\System32\drivers\ibbus.sys,68ab782a265320dea55311617f8e9500,\SystemRoot\System32\drivers\ibbus.sys,Microsoft Windows,true,The file is signed and the signature was verified.,Microsoft Windows Production PCA 2011
ST869VRJ,DeviceAssociationService,0,Device Association Service,Enables pairing between the system and wired or wireless devices.,C:\Windows\System32\svchost.exe,e8a50e71ccad69cee0faf29f092b1381,C:\Windows\system32\svchost.exe -k LocalSystemNetworkRestricted,Microsoft Windows,true,The file is signed and the signature was verified.,Microsoft Windows Production PCA 2011
ST869VRJ,Mup,0,Mup,Multiple UNC Provider Driver,C:\Windows\System32\drivers\mup.sys,4c1b2aadf38799cf94572b653eaa61b4,\SystemRoot\System32\Drivers\mup.sys,Microsoft Windows,true,The file is signed and the signature was verified.,Microsoft Windows Production PCA 2011
ST869VRJ,uagp35,0,Microsoft AGPv3.5 Filter,,C:\Windows\System32\drivers\UAGP35.SYS,4e015aebd59d99b64bf29f08be82c42e,\SystemRoot\System32\drivers\uagp35.sys,Microsoft Windows,true,The file is signed and the signature was verified.,Microsoft Windows Production PCA 2011
ST869VRJ,1394ohci,0,1394 OHCI Compliant Host Controller,,C:\Windows\System32\drivers\1394ohci.sys,e0a28fd150d767c6875f8b87df72b936,\SystemRoot\System32\drivers\1394ohci.sys,Microsoft Windows,true,The file is signed and the signature was verified.,Microsoft Windows Production PCA 2011
ST869VRJ,hyperkbd,0,hyperkbd,,C:\Windows\System32\drivers\hyperkbd.sys,8a5843a913aaf04b09cedd9b3f548578,\SystemRoot\System32\drivers\hyperkbd.sys,Microsoft Windows,true,The file is signed and the signature was verified.,Microsoft Windows Production PCA 2011
ST869VRJ,fdPHost,0,Function Discovery Provider Host,The FDPHOST service hosts the Function Discovery (FD) network discovery providers. These FD providers supply network discovery services for the Simple Services Discovery Protocol (SSDP) and Web Services – Discovery (WS-D) protocol. Stopping or disabling the FDPHOST service will disable network discovery for these protocols when using FD. When this service is unavailable  network services using FD and relying on these discovery protocols will be unable to find network devices or resources.,C:\Windows\System32\svchost.exe,e8a50e71ccad69cee0faf29f092b1381,C:\Windows\system32\svchost.exe -k LocalService,Microsoft Windows,true,The file is signed and the signature was verified.,Microsoft Windows Production PCA 2011
ST869VRJ,pla,0,Performance Logs &amp; Alerts,Performance Logs and Alerts Collects performance data from local or remote computers based on preconfigured schedule parameters  then writes the data to a log or triggers an alert. If this service is stopped  performance information will not be collected. If this service is disabled  any services that explicitly depend on it will fail to start.,C:\Windows\System32\svchost.exe,e8a50e71ccad69cee0faf29f092b1381,C:\Windows\System32\svchost.exe -k LocalServiceNoNetwork,Microsoft Windows,true,The file is signed and the signature was verified.,Microsoft Windows Production PCA 2011
ST869VRJ,VMBusHID,0,VMBusHID,,C:\Windows\System32\drivers\VMBusHID.sys,e831dfae7a76a165d337d26a14d7d1a9,\SystemRoot\System32\drivers\VMBusHID.sys,Microsoft Windows,true,The file is signed and the signature was verified.,Microsoft Windows Production PCA 2011
ST869VRJ,PlugPlay,688,Plug and Play,Enables a computer to recognize and adapt to hardware changes with little or no user input. Stopping or disabling this service will result in system instability.,C:\Windows\System32\svchost.exe,e8a50e71ccad69cee0faf29f092b1381,C:\Windows\system32\svchost.exe -k DcomLaunch,Microsoft Windows,true,The file is signed and the signature was verified.,Microsoft Windows Production PCA 2011
ST869VRJ,USBXHCI,0,USB xHCI Compliant Host Controller,,C:\Windows\System32\drivers\USBXHCI.SYS,02337161f7d4b7d10eaad442e117a987,\SystemRoot\System32\drivers\USBXHCI.SYS,Microsoft Windows,true,The file is signed and the signature was verified.,Microsoft Windows Production PCA 2011
ST869VRJ,flpydisk,0,Floppy Disk Driver,,C:\Windows\System32\drivers\flpydisk.sys,3eb407c3ef40a672f9a82646c3feb888,\SystemRoot\System32\drivers\flpydisk.sys,Microsoft Windows,true,The file is signed and the signature was verified.,Microsoft Windows Production PCA 2011
ST869VRJ,SCardSvr,0,Smart Card,Manages access to smart cards read by this computer. If this service is stopped  this computer will be unable to read smart cards. If this service is disabled  any services that explicitly depend on it will fail to start.,C:\Windows\System32\svchost.exe,e8a50e71ccad69cee0faf29f092b1381,C:\Windows\system32\svchost.exe -k LocalServiceAndNoImpersonation,Microsoft Windows,true,The file is signed and the signature was verified.,Microsoft Windows Production PCA 2011
ST869VRJ,isapnp,0,isapnp,,C:\Windows\System32\drivers\isapnp.sys,56e897612c7877bd505d747666d96b4f,\SystemRoot\System32\drivers\isapnp.sys,Microsoft Windows,true,The file is signed and the signature was verified.,Microsoft Windows Production PCA 2011
ST869VRJ,mpsdrv,0,Windows Firewall Authorization Driver,Windows Firewall Authorization Driver is a kernel mode driver that provides deep inspection services on inbound and outbound network traffic.,C:\Windows\System32\drivers\mpsdrv.sys,a13cb604ea6cf0ed72c3d07d99daf77e,System32\drivers\mpsdrv.sys,Microsoft Windows,true,The file is signed and the signature was verified.,Microsoft Windows Production PCA 2011
ST869VRJ,msisadrv,0,msisadrv,,C:\Windows\System32\drivers\msisadrv.sys,bdefd3a7bc8c820b9c9aa174ba9c5021,\SystemRoot\System32\drivers\msisadrv.sys,Microsoft Windows,true,The file is signed and the signature was verified.,Microsoft Windows Production PCA 2011
ST869VRJ,mrxsmb10,0,SMB 1.x MiniRedirector,Implements the SMB 1.x (CIFS) protocol. This protocol provides connectivity to network resources on pre-Windows Vista servers,C:\Windows\System32\drivers\mrxsmb10.sys,d35d61ba7d7df170017c1e0668e22142,system32\DRIVERS\mrxsmb10.sys,Microsoft Windows,true,The file is signed and the signature was verified.,Microsoft Windows Production PCA 2011
ST869VRJ,ebdrv,0,Broadcom NetXtreme II 10 GigE VBD,,C:\Windows\System32\drivers\evbda.sys,fa3d4def7125d53d7052a62ecd3e3a06,\SystemRoot\System32\drivers\evbda.sys,Microsoft Windows,true,The file is signed and the signature was verified.,Microsoft Windows Production PCA 2011
ST869VRJ,BasicDisplay,0,BasicDisplay,,C:\Windows\System32\drivers\BasicDisplay.sys,78c9334195667ce7e079929a767f7b02,\SystemRoot\System32\drivers\BasicDisplay.sys,Microsoft Windows,true,The file is signed and the signature was verified.,Microsoft Windows Production PCA 2011
ST869VRJ,HidUsb,0,Microsoft HID Class Driver,,C:\Windows\System32\drivers\hidusb.sys,3f4e50c8dff049313dbf86befeaea3de,\SystemRoot\System32\drivers\hidusb.sys,Microsoft Windows,true,The file is signed and the signature was verified.,Microsoft Windows Production PCA 2011
ST869VRJ,IKEEXT,0,IKE and AuthIP IPsec Keying Modules,The IKEEXT service hosts the Internet Key Exchange (IKE) and Authenticated Internet Protocol (AuthIP) keying modules. These keying modules are used for authentication and key exchange in Internet Protocol security (IPsec). Stopping or disabling the IKEEXT service will disable IKE and AuthIP key exchange with peer computers. IPsec is typically configured to use IKE or AuthIP; therefore  stopping or disabling the IKEEXT service might result in an IPsec failure and might compromise the security of the system. It is strongly recommended that you have the IKEEXT service running.,C:\Windows\System32\svchost.exe,e8a50e71ccad69cee0faf29f092b1381,C:\Windows\system32\svchost.exe -k netsvcs,Microsoft Windows,true,The file is signed and the signature was verified.,Microsoft Windows Production PCA 2011
ST869VRJ,volsnap,0,Storage volumes,,C:\Windows\System32\drivers\volsnap.sys,9780908cc4c1eda6463baef05920494c,\SystemRoot\System32\drivers\volsnap.sys,Microsoft Windows,true,The file is signed and the signature was verified.,Microsoft Windows Production PCA 2011
ST869VRJ,pdc,0,pdc,Power Dependency Coordinator Driver,C:\Windows\System32\drivers\pdc.sys,5c536e1ddcfc504095627bd1d84fa1d9,\SystemRoot\system32\drivers\pdc.sys,Microsoft Windows,true,The file is signed and the signature was verified.,Microsoft Windows Production PCA 2011
ST869VRJ,IEEtwCollectorService,0,Internet Explorer ETW Collector Service,ETW Collector Service for Internet Explorer. When running  this service collects real time ETW events and processes them.,C:\Windows\System32\IEEtwCollector.exe,64ba3d73f3ce11bb0ed4d438e1d7114a,C:\Windows\system32\IEEtwCollector.exe /V,Microsoft Windows,true,The file is signed and the signature was verified.,Microsoft Windows Production PCA 2011
ST869VRJ,megasr,0,megasr,,C:\Windows\System32\drivers\megasr.sys,228f3947455792aab103eb549de663f0,\SystemRoot\System32\drivers\megasr.sys,Microsoft Windows,true,The file is signed and the signature was verified.,Microsoft Windows Production PCA 2011
ST869VRJ,AeLookupSvc,0,Application Experience,Processes application compatibility cache requests for applications as they are launched,C:\Windows\System32\svchost.exe,e8a50e71ccad69cee0faf29f092b1381,C:\Windows\system32\svchost.exe -k netsvcs,Microsoft Windows,true,The file is signed and the signature was verified.,Microsoft Windows Production PCA 2011
ST869VRJ,ws2ifsl,0,Winsock IFS Driver,Winsock IFS Driver,C:\Windows\System32\drivers\ws2ifsl.sys,8068365d14a1995716009470c38e16aa,\SystemRoot\system32\drivers\ws2ifsl.sys,Microsoft Windows,true,The file is signed and the signature was verified.,Microsoft Windows Production PCA 2011
ST869VRJ,bxois,0,Broadcom NetXtreme II Offload iSCSI Driver,,C:\Windows\System32\drivers\bxois.sys,9402e6b155fd2cf73cf9c77e499c4405,\SystemRoot\System32\drivers\bxois.sys,Microsoft Windows,true,The file is signed and the signature was verified.,Microsoft Windows Production PCA 2011
ST869VRJ,WmiAcpi,0,Microsoft Windows Management Interface for ACPI,,C:\Windows\System32\drivers\wmiacpi.sys,e8904aaf2ef7a846c600d94b63a3c5e7,\SystemRoot\System32\drivers\wmiacpi.sys,Microsoft Windows,true,The file is signed and the signature was verified.,Microsoft Windows Production PCA 2011
ST869VRJ,DiagTrack,1256,Diagnostics Tracking Service,The Diagnostics Tracking Service enables data collection about functional issues in Windows components.,C:\Windows\System32\svchost.exe,e8a50e71ccad69cee0faf29f092b1381,C:\Windows\System32\svchost.exe -k utcsvc,Microsoft Windows,true,The file is signed and the signature was verified.,Microsoft Windows Production PCA 2011
ST869VRJ,mouhid,0,Mouse HID Driver,,C:\Windows\System32\drivers\mouhid.sys,44448fd338479b84631aa8bacbc1cf46,\SystemRoot\System32\drivers\mouhid.sys,Microsoft Windows,true,The file is signed and the signature was verified.,Microsoft Windows Production PCA 2011
