hostname,name,pid,descriptivename,description,path,pathmd5sum,arguments,pathcertificatesubject,pathsignatureverified,pathsignaturedescription,pathcertificateissuer
ST869VRJ,pcmcia,0,pcmcia,,C:\Windows\System32\drivers\pcmcia.sys,e3969c1f78ba46d68de327b5a03130bc,\SystemRoot\System32\drivers\pcmcia.sys,Microsoft Windows,true,The file is signed and the signature was verified.,Microsoft Windows Production PCA 2011
ST869VRJ,Filetrace,0,Filetrace,ETW File Trace Filter,C:\Windows\System32\drivers\filetrace.sys,fa4e186272250522cafa76b147e7970b,system32\drivers\filetrace.sys,Microsoft Windows,true,The file is signed and the signature was verified.,Microsoft Windows Production PCA 2011
ST869VRJ,Wanarp,0,Remote Access IP ARP Driver,Remote Access IP ARP Driver,C:\Windows\System32\drivers\wanarp.sys,a9e03b4dfc5ac827f8609c07be14bcc9,\SystemRoot\system32\DRIVERS\wanarp.sys,Microsoft Windows,true,The file is signed and the signature was verified.,Microsoft Windows Production PCA 2011
ST869VRJ,UALSVC,1292,User Access Logging Service,This service logs unique client access requests  in the form of IP addresses and user names  of installed products and roles on the local server. This information can be queried  via Powershell  by administrators needing to quantify client demand of server software for offline Client Access License (CAL) management. If the service is disabled  client requests will not be logged and will not be retrievable via Powershell queries. Stopping the service will not affect query of historical data (see supporting documentation for steps to delete historical data). The local system administrator must consult his  or her  Windows Server license terms to determine the number of CALs that are required for the server software to be appropriately licensed; use of the UAL service and data does not alter this obligation.,C:\Windows\System32\svchost.exe,e8a50e71ccad69cee0faf29f092b1381,C:\Windows\system32\svchost.exe -k LocalSystemNetworkRestricted,Microsoft Windows,true,The file is signed and the signature was verified.,Microsoft Windows Production PCA 2011
ST869VRJ,fcvsc,0,fcvsc,,C:\Windows\System32\drivers\fcvsc.sys,a32789e4c0bf8121649f4ef3a05e44a6,\SystemRoot\System32\drivers\fcvsc.sys,Microsoft Windows,true,The file is signed and the signature was verified.,Microsoft Windows Production PCA 2011
ST869VRJ,tcpipreg,0,TCP/IP Registry Compatibility,Provides compatibility for legacy applications which interact with TCP/IP through the registry. If this service is stopped  certain applications may have impaired functionality.,C:\Windows\System32\drivers\tcpipreg.sys,974f4988e0607560ebb3f42427c40d51,System32\drivers\tcpipreg.sys,Microsoft Windows,true,The file is signed and the signature was verified.,Microsoft Windows Production PCA 2011
ST869VRJ,FxPPM,0,Power Framework Processor Driver,,C:\Windows\System32\drivers\fxppm.sys,fd506525578cb34adcca2ea87dc84957,\SystemRoot\System32\drivers\fxppm.sys,Microsoft Windows,true,The file is signed and the signature was verified.,Microsoft Windows Production PCA 2011
ST869VRJ,netprofm,928,Network List Service,Identifies the networks to which the computer has connected  collects and stores properties for these networks  and notifies applications when these properties change.,C:\Windows\System32\svchost.exe,e8a50e71ccad69cee0faf29f092b1381,C:\Windows\System32\svchost.exe -k LocalService,Microsoft Windows,true,The file is signed and the signature was verified.,Microsoft Windows Production PCA 2011
ST869VRJ,WinHttpAutoProxySvc,928,WinHTTP Web Proxy Auto-Discovery Service,WinHTTP implements the client HTTP stack and provides developers with a Win32 API and COM Automation component for sending HTTP requests and receiving responses. In addition  WinHTTP provides support for auto-discovering a proxy configuration via its implementation of the Web Proxy Auto-Discovery (WPAD) protocol.,C:\Windows\System32\svchost.exe,e8a50e71ccad69cee0faf29f092b1381,C:\Windows\system32\svchost.exe -k LocalService,Microsoft Windows,true,The file is signed and the signature was verified.,Microsoft Windows Production PCA 2011
ST869VRJ,Audiosrv,0,Windows Audio,Manages audio for Windows-based programs.  If this service is stopped  audio devices and effects will not function properly.  If this service is disabled  any services that explicitly depend on it will fail to start,C:\Windows\System32\svchost.exe,e8a50e71ccad69cee0faf29f092b1381,C:\Windows\System32\svchost.exe -k LocalServiceNetworkRestricted,Microsoft Windows,true,The file is signed and the signature was verified.,Microsoft Windows Production PCA 2011
ST869VRJ,LSM,688,Local Session Manager,Core Windows Service that manages local user sessions. Stopping or disabling this service will result in system instability.,C:\Windows\System32\svchost.exe,e8a50e71ccad69cee0faf29f092b1381,C:\Windows\system32\svchost.exe -k DcomLaunch,Microsoft Windows,true,The file is signed and the signature was verified.,Microsoft Windows Production PCA 2011
ST869VRJ,TieringEngineService,0,Storage Tiers Management,Optimizes the placement of data in storage tiers on all tiered storage spaces in the system.,C:\Windows\System32\TieringEngineService.exe,2494ec2bd554ddf3e35a96588b148124,C:\Windows\system32\TieringEngineService.exe,Microsoft Windows,true,The file is signed and the signature was verified.,Microsoft Windows Production PCA 2011
ST869VRJ,disk,0,Disk Driver,,C:\Windows\System32\drivers\disk.sys,ab86ee513d00bcc26dcc454961e0c47e,\SystemRoot\System32\drivers\disk.sys,Microsoft Windows,true,The file is signed and the signature was verified.,Microsoft Windows Production PCA 2011
ST869VRJ,vpcivsp,0,Microsoft Hyper-V PCI Server,,C:\Windows\System32\drivers\vpcivsp.sys,d6f13f08099ef25ed5a0c83ea71b681e,\SystemRoot\System32\drivers\vpcivsp.sys,Microsoft Windows,true,The file is signed and the signature was verified.,Microsoft Windows Production PCA 2011
ST869VRJ,THREADORDER,0,Thread Ordering Server,Provides ordered execution for a group of threads within a specific period of time.,C:\Windows\System32\svchost.exe,e8a50e71ccad69cee0faf29f092b1381,C:\Windows\system32\svchost.exe -k LocalService,Microsoft Windows,true,The file is signed and the signature was verified.,Microsoft Windows Production PCA 2011
ST869VRJ,storahci,0,Microsoft Standard SATA AHCI Driver,,C:\Windows\System32\drivers\storahci.sys,8e6f428c54a3ff4ecd5bf25e944760cc,\SystemRoot\System32\drivers\storahci.sys,Microsoft Windows,true,The file is signed and the signature was verified.,Microsoft Windows Production PCA 2011
ST869VRJ,FsDepends,0,File System Dependency Minifilter,This minifilter tracks the dependencies associated with the various nested volumes/filesystems,C:\Windows\System32\drivers\FsDepends.sys,17ba7c657e154ef197d22fed894f0db9,System32\drivers\FsDepends.sys,Microsoft Windows,true,The file is signed and the signature was verified.,Microsoft Windows Production PCA 2011
ST869VRJ,cfn-hup,0,CloudFormation cfn-hup,CloudFormation cfn-hup for Windows,C:\Program Files\Amazon\cfn-bootstrap\winhup.exe,d43f4f90ed43c75437a06da13fbc4b2c,C:\Program Files\Amazon\cfn-bootstrap\winhup.exe,,false,The file is not signed.,
ST869VRJ,storvsc,0,storvsc,,C:\Windows\System32\drivers\storvsc.sys,ad3ecdb16d7b46979996ffd18fc804b7,\SystemRoot\System32\drivers\storvsc.sys,Microsoft Windows,true,The file is signed and the signature was verified.,Microsoft Windows Production PCA 2011
ST869VRJ,HidBatt,0,HID UPS Battery Driver,,C:\Windows\System32\drivers\hidbatt.sys,62f44723a333b0330e6baf63bcc0c502,\SystemRoot\System32\drivers\HidBatt.sys,Microsoft Windows,true,The file is signed and the signature was verified.,Microsoft Windows Production PCA 2011
ST869VRJ,MTConfig,0,Microsoft Input Configuration Driver,,C:\Windows\System32\drivers\MTConfig.sys,e2848aa434aea752fe80f4ac5aa68a47,\SystemRoot\System32\drivers\MTConfig.sys,Microsoft Windows,true,The file is signed and the signature was verified.,Microsoft Windows Production PCA 2011
ST869VRJ,vxn,0,Intel(R) 10G Virtual Network Connection,,C:\Windows\System32\drivers\vxn64x64.sys,e884d00d0a2949995eb37604c21b6f2e,\SystemRoot\system32\DRIVERS\vxn64x64.sys,Microsoft Windows Hardware Compatibility Publisher,true,The file is signed and the signature was verified.,Microsoft Windows Third Party Component CA 2012
ST869VRJ,pcw,0,Performance Counters for Windows Driver,,C:\Windows\System32\drivers\pcw.sys,acee8cd51d85c680d63cdc58cb876552,\SystemRoot\System32\drivers\pcw.sys,Microsoft Windows,true,The file is signed and the signature was verified.,Microsoft Windows Production PCA 2011
ST869VRJ,kbdhid,0,Keyboard HID Driver,,C:\Windows\System32\drivers\kbdhid.sys,f111e5a73a190a69ef0bc44d71a8da69,\SystemRoot\System32\drivers\kbdhid.sys,Microsoft Windows,true,The file is signed and the signature was verified.,Microsoft Windows Production PCA 2011
ST869VRJ,mssmbios,0,Microsoft System Management BIOS Driver,,C:\Windows\System32\drivers\mssmbios.sys,581ae88c7076730fdeca2f4dab79bebf,\SystemRoot\System32\drivers\mssmbios.sys,Microsoft Windows,true,The file is signed and the signature was verified.,Microsoft Windows Production PCA 2011
ST869VRJ,VSTXRAID,0,VIA StorX Storage RAID Controller Windows Driver,,C:\Windows\System32\drivers\VSTXRAID.SYS,cd2f6a33524ebf1bb4791132200ae06e,\SystemRoot\System32\drivers\vstxraid.sys,Microsoft Windows,true,The file is signed and the signature was verified.,Microsoft Windows Production PCA 2011
ST869VRJ,vmicrdv,0,Hyper-V Remote Desktop Virtualization Service,Provides a platform for communication between the virtual machine and the operating system running on the physical computer.,C:\Windows\System32\svchost.exe,e8a50e71ccad69cee0faf29f092b1381,C:\Windows\system32\svchost.exe -k ICService,Microsoft Windows,true,The file is signed and the signature was verified.,Microsoft Windows Production PCA 2011
ST869VRJ,Themes,888,Themes,Provides user experience theme management.,C:\Windows\System32\svchost.exe,e8a50e71ccad69cee0faf29f092b1381,C:\Windows\System32\svchost.exe -k netsvcs,Microsoft Windows,true,The file is signed and the signature was verified.,Microsoft Windows Production PCA 2011
ST869VRJ,usbehci,0,Microsoft USB 2.0 Enhanced Host Controller Miniport Driver,,C:\Windows\System32\drivers\usbehci.sys,19d5a59104eff57e70c54c2869874b88,\SystemRoot\System32\drivers\usbehci.sys,Microsoft Windows,true,The file is signed and the signature was verified.,Microsoft Windows Production PCA 2011
ST869VRJ,SerCx2,0,Serial UART Support Library,,C:\Windows\System32\drivers\SerCx2.sys,6ab65fbfbbbb16bf308cddfd266ade33,system32\drivers\SerCx2.sys,Microsoft Windows,true,The file is signed and the signature was verified.,Microsoft Windows Production PCA 2011
ST869VRJ,RasAcd,0,Remote Access Auto Connection Driver,Remote Access Auto Connection Driver,C:\Windows\System32\drivers\rasacd.sys,6498088fcddff964cc84cc0365f75fd6,System32\DRIVERS\rasacd.sys,Microsoft Windows,true,The file is signed and the signature was verified.,Microsoft Windows Production PCA 2011
ST869VRJ,vmicshutdown,0,Hyper-V Guest Shutdown Service,Provides a mechanism to shut down the operating system of this virtual machine from the management interfaces on the physical computer.,C:\Windows\System32\svchost.exe,e8a50e71ccad69cee0faf29f092b1381,C:\Windows\system32\svchost.exe -k LocalSystemNetworkRestricted,Microsoft Windows,true,The file is signed and the signature was verified.,Microsoft Windows Production PCA 2011
ST869VRJ,ql40xx2i,0,QLogic iSCSI Miniport Inbox Driver,,C:\Windows\System32\drivers\ql40xx2i.sys,5d01e4ca03b855ff563f04391fc9c0bb,\SystemRoot\System32\drivers\ql40xx2i.sys,Microsoft Windows,true,The file is signed and the signature was verified.,Microsoft Windows Production PCA 2011
ST869VRJ,xenfilt,0,AWS Bus Filter,,C:\Windows\System32\drivers\xenfilt.sys,87eeeb797278bacb7557ab51c947391e,\SystemRoot\system32\DRIVERS\xenfilt.sys,Microsoft Windows Hardware Compatibility Publisher,true,The file is signed and the signature was verified.,Microsoft Windows Hardware Compatibility PCA
ST869VRJ,MSDTC,1132,Distributed Transaction Coordinator,Coordinates transactions that span multiple resource managers  such as databases  message queues  and file systems. If this service is stopped  these transactions will fail. If this service is disabled  any services that explicitly depend on it will fail to start.,C:\Windows\System32\msdtc.exe,a16f359b00ca2396ef2a2a968d274226,C:\Windows\System32\msdtc.exe,Microsoft Windows,true,The file is signed and the signature was verified.,Microsoft Windows Production PCA 2011
ST869VRJ,usbohci,0,Microsoft USB Open Host Controller Miniport Driver,,C:\Windows\System32\drivers\usbohci.sys,c2e645b2d7f8b342e5bb4615bf54973e,\SystemRoot\System32\drivers\usbohci.sys,Microsoft Windows,true,The file is signed and the signature was verified.,Microsoft Windows Production PCA 2011
ST869VRJ,ksthunk,0,Kernel Streaming Thunks,,C:\Windows\System32\drivers\ksthunk.sys,556355fa68de3b104a2701eff7628427,\SystemRoot\system32\drivers\ksthunk.sys,Microsoft Windows,true,The file is signed and the signature was verified.,Microsoft Windows Production PCA 2011
ST869VRJ,nvraid,0,nvraid,,C:\Windows\System32\drivers\nvraid.sys,318ca13fc696679b9af3e5fb79c9ea40,\SystemRoot\System32\drivers\nvraid.sys,Microsoft Windows,true,The file is signed and the signature was verified.,Microsoft Windows Production PCA 2011
ST869VRJ,UmPass,0,Microsoft UMPass Driver,,C:\Windows\System32\drivers\umpass.sys,d3a5443367f965065059b0c56d86c988,\SystemRoot\System32\drivers\umpass.sys,Microsoft Windows,true,The file is signed and the signature was verified.,Microsoft Windows Production PCA 2011
ST869VRJ,ALG,0,Application Layer Gateway Service,Provides support for 3rd party protocol plug-ins for Internet Connection Sharing,C:\Windows\System32\alg.exe,29f1a5fa0b74bf16915b91c73e880f71,C:\Windows\System32\alg.exe,Microsoft Windows,true,The file is signed and the signature was verified.,Microsoft Windows Production PCA 2011
ST869VRJ,wuauserv,0,Windows Update,Enables the detection  download  and installation of updates for Windows and other programs. If this service is disabled  users of this computer will not be able to use Windows Update or its automatic updating feature  and programs will not be able to use the Windows Update Agent (WUA) API.,C:\Windows\System32\svchost.exe,e8a50e71ccad69cee0faf29f092b1381,C:\Windows\system32\svchost.exe -k netsvcs,Microsoft Windows,true,The file is signed and the signature was verified.,Microsoft Windows Production PCA 2011
ST869VRJ,nsi,928,Network Store Interface Service,This service delivers network notifications (e.g. interface addition/deleting etc) to user mode clients. Stopping this service will cause loss of network connectivity. If this service is disabled  any other services that explicitly depend on this service will fail to start.,C:\Windows\System32\svchost.exe,e8a50e71ccad69cee0faf29f092b1381,C:\Windows\system32\svchost.exe -k LocalService,Microsoft Windows,true,The file is signed and the signature was verified.,Microsoft Windows Production PCA 2011
ST869VRJ,PrintNotify,0,Printer Extensions and Notifications,This service opens custom printer dialog boxes and handles notifications from a remote print server or a printer. If you turn off this service  you won’t be able to see printer extensions or notifications.,C:\Windows\System32\svchost.exe,e8a50e71ccad69cee0faf29f092b1381,C:\Windows\system32\svchost.exe -k print,Microsoft Windows,true,The file is signed and the signature was verified.,Microsoft Windows Production PCA 2011
ST869VRJ,DeviceInstall,0,Device Install Service,Enables a computer to recognize and adapt to hardware changes with little or no user input. Stopping or disabling this service will result in system instability.,C:\Windows\System32\svchost.exe,e8a50e71ccad69cee0faf29f092b1381,C:\Windows\system32\svchost.exe -k DcomLaunch,Microsoft Windows,true,The file is signed and the signature was verified.,Microsoft Windows Production PCA 2011
ST869VRJ,IpFilterDriver,0,IP Traffic Filter Driver,IP Traffic Filter Driver,C:\Windows\System32\drivers\ipfltdrv.sys,f81bfc2fae070a8c29c8533e7ff494ca,system32\DRIVERS\ipfltdrv.sys,Microsoft Windows,true,The file is signed and the signature was verified.,Microsoft Windows Production PCA 2011
ST869VRJ,MMCSS,0,Multimedia Class Scheduler,Enables relative prioritization of work based on system-wide task priorities. This is intended mainly for multimedia applications.  If this service is stopped  individual tasks resort to their default priority.,C:\Windows\System32\svchost.exe,e8a50e71ccad69cee0faf29f092b1381,C:\Windows\system32\svchost.exe -k netsvcs,Microsoft Windows,true,The file is signed and the signature was verified.,Microsoft Windows Production PCA 2011
ST869VRJ,rspndr,0,Link-Layer Topology Discovery Responder,,C:\Windows\System32\drivers\rspndr.sys,d1da88bc64343a64a273399cf6a3be3c,\SystemRoot\system32\DRIVERS\rspndr.sys,Microsoft Windows,true,The file is signed and the signature was verified.,Microsoft Windows Production PCA 2011
ST869VRJ,TCPIP6,0,Microsoft IPv6 Protocol Driver,Microsoft IPv6 Protocol Driver,C:\Windows\System32\drivers\tcpip.sys,b90fc5f4cf7f0e7c915bebb8a0047ead,\SystemRoot\system32\DRIVERS\tcpip.sys,Microsoft Windows,true,The file is signed and the signature was verified.,Microsoft Windows Production PCA 2011
ST869VRJ,pci,0,PCI Bus Driver,,C:\Windows\System32\drivers\pci.sys,65ec85cbd03f5d9cc7697c9936ce4041,\SystemRoot\System32\drivers\pci.sys,Microsoft Windows,true,The file is signed and the signature was verified.,Microsoft Windows Production PCA 2011
ST869VRJ,rdbss,0,Redirected Buffering Sub System,Provides the framework for network mini-redirectors,C:\Windows\System32\drivers\rdbss.sys,fd837522f1d50425b4c984ba527be0fb,system32\DRIVERS\rdbss.sys,Microsoft Windows,true,The file is signed and the signature was verified.,Microsoft Windows Production PCA 2011
ST869VRJ,EFS,0,Encrypting File System (EFS),Provides the core file encryption technology used to store encrypted files on NTFS file system volumes. If this service is stopped or disabled  applications will be unable to access encrypted files.,C:\Windows\System32\lsass.exe,fbcd3bd9a4ed05d97dc8fc549d87fc24,C:\Windows\System32\lsass.exe,Microsoft Windows,true,The file is signed and the signature was verified.,Microsoft Windows Production PCA 2011
ST869VRJ,FontCache,928,Windows Font Cache Service,Optimizes performance of applications by caching commonly used font data. Applications will start this service if it is not already running. It can be disabled  though doing so will degrade application performance.,C:\Windows\System32\svchost.exe,e8a50e71ccad69cee0faf29f092b1381,C:\Windows\system32\svchost.exe -k LocalService,Microsoft Windows,true,The file is signed and the signature was verified.,Microsoft Windows Production PCA 2011
ST869VRJ,intelppm,0,Intel Processor Driver,,C:\Windows\System32\drivers\intelppm.sys,1ae90371e3f4ef5b4c82418e90f2b875,\SystemRoot\System32\drivers\intelppm.sys,Microsoft Windows,true,The file is signed and the signature was verified.,Microsoft Windows Production PCA 2011
ST869VRJ,DcomLaunch,688,DCOM Server Process Launcher,The DCOMLAUNCH service launches COM and DCOM servers in response to object activation requests. If this service is stopped or disabled  programs using COM or DCOM will not function properly. It is strongly recommended that you have the DCOMLAUNCH service running.,C:\Windows\System32\svchost.exe,e8a50e71ccad69cee0faf29f092b1381,C:\Windows\system32\svchost.exe -k DcomLaunch,Microsoft Windows,true,The file is signed and the signature was verified.,Microsoft Windows Production PCA 2011
ST869VRJ,ADP80XX,0,ADP80XX,,C:\Windows\System32\drivers\adp80xx.sys,04e185c7ed0098e5086c216c2b40843c,\SystemRoot\System32\drivers\ADP80XX.SYS,Microsoft Windows,true,The file is signed and the signature was verified.,Microsoft Windows Production PCA 2011
ST869VRJ,Wcmsvc,844,Windows Connection Manager,Makes automatic connect/disconnect decisions based on the network connectivity options currently available to the PC and enables management of network connectivity based on Group Policy settings.,C:\Windows\System32\svchost.exe,e8a50e71ccad69cee0faf29f092b1381,C:\Windows\system32\svchost.exe -k LocalServiceNetworkRestricted,Microsoft Windows,true,The file is signed and the signature was verified.,Microsoft Windows Production PCA 2011
ST869VRJ,SSDPSRV,0,SSDP Discovery,Discovers networked devices and services that use the SSDP discovery protocol  such as UPnP devices. Also announces SSDP devices and services running on the local computer. If this service is stopped  SSDP-based devices will not be discovered. If this service is disabled  any services that explicitly depend on it will fail to start.,C:\Windows\System32\svchost.exe,e8a50e71ccad69cee0faf29f092b1381,C:\Windows\system32\svchost.exe -k LocalServiceAndNoImpersonation,Microsoft Windows,true,The file is signed and the signature was verified.,Microsoft Windows Production PCA 2011
ST869VRJ,lltdio,0,Link-Layer Topology Discovery Mapper I/O Driver,,C:\Windows\System32\drivers\lltdio.sys,0e9893555f78855750a2029722553294,\SystemRoot\system32\DRIVERS\lltdio.sys,Microsoft Windows,true,The file is signed and the signature was verified.,Microsoft Windows Production PCA 2011
ST869VRJ,sppsvc,0,Software Protection,Enables the download  installation and enforcement of digital licenses for Windows and Windows applications. If the service is disabled  the operating system and licensed applications may run in a notification mode. It is strongly recommended that you not disable the Software Protection service.,C:\Windows\System32\sppsvc.exe,75362cc562427ac5de008d18f7c27528,C:\Windows\system32\sppsvc.exe,Microsoft Windows,true,The file is signed and the signature was verified.,Microsoft Windows Production PCA 2011
ST869VRJ,NcaSvc,0,Network Connectivity Assistant,Provides DirectAccess status notification for UI components,C:\Windows\System32\svchost.exe,e8a50e71ccad69cee0faf29f092b1381,C:\Windows\System32\svchost.exe -k NetSvcs,Microsoft Windows,true,The file is signed and the signature was verified.,Microsoft Windows Production PCA 2011
ST869VRJ,RpcLocator,0,Remote Procedure Call (RPC) Locator,In Windows 2003 and earlier versions of Windows  the Remote Procedure Call (RPC) Locator service manages the RPC name service database. In Windows Vista and later versions of Windows  this service does not provide any functionality and is present for application compatibility.,C:\Windows\System32\Locator.exe,4cbcdb78d19c019a404365c85965b1f9,C:\Windows\system32\locator.exe,Microsoft Windows,true,The file is signed and the signature was verified.,Microsoft Windows Production PCA 2011
ST869VRJ,tdx,0,NetIO Legacy TDI Support Driver,NetIO Legacy TDI Support Driver,C:\Windows\System32\drivers\tdx.sys,e3aa1c8ecbb3672a7ef3c1d874021935,\SystemRoot\system32\DRIVERS\tdx.sys,Microsoft Windows,true,The file is signed and the signature was verified.,Microsoft Windows Production PCA 2011
ST869VRJ,ErrDev,0,Microsoft Hardware Error Device Driver,,C:\Windows\System32\drivers\errdev.sys,ae915b96cb8aed2baa66bf541e449275,\SystemRoot\System32\drivers\errdev.sys,Microsoft Windows,true,The file is signed and the signature was verified.,Microsoft Windows Production PCA 2011
ST869VRJ,RpcSs,716,Remote Procedure Call (RPC),The RPCSS service is the Service Control Manager for COM and DCOM servers. It performs object activations requests  object exporter resolutions and distributed garbage collection for COM and DCOM servers. If this service is stopped or disabled  programs using COM or DCOM will not function properly. It is strongly recommended that you have the RPCSS service running.,C:\Windows\System32\svchost.exe,e8a50e71ccad69cee0faf29f092b1381,C:\Windows\system32\svchost.exe -k rpcss,Microsoft Windows,true,The file is signed and the signature was verified.,Microsoft Windows Production PCA 2011
ST869VRJ,lmhosts,844,TCP/IP NetBIOS Helper,Provides support for the NetBIOS over TCP/IP (NetBT) service and NetBIOS name resolution for clients on the network  therefore enabling users to share files  print  and log on to the network. If this service is stopped  these functions might be unavailable. If this service is disabled  any services that explicitly depend on it will fail to start.,C:\Windows\System32\svchost.exe,e8a50e71ccad69cee0faf29f092b1381,C:\Windows\system32\svchost.exe -k LocalServiceNetworkRestricted,Microsoft Windows,true,The file is signed and the signature was verified.,Microsoft Windows Production PCA 2011
ST869VRJ,megasas,0,megasas,,C:\Windows\System32\drivers\megasas.sys,a8adb7d9855d08a90748bf63ef579d55,\SystemRoot\System32\drivers\megasas.sys,Microsoft Windows,true,The file is signed and the signature was verified.,Microsoft Windows Production PCA 2011
ST869VRJ,swenum,0,Software Bus Driver,,C:\Windows\System32\drivers\swenum.sys,c59877deb79349abfb8a245c767b9297,\SystemRoot\System32\drivers\swenum.sys,Microsoft Windows,true,The file is signed and the signature was verified.,Microsoft Windows Production PCA 2011
ST869VRJ,tunnel,0,Microsoft Tunnel Miniport Adapter Driver,,C:\Windows\System32\drivers\tunnel.sys,05bd5188797d3fcee3670f44b36dc2e7,\SystemRoot\system32\DRIVERS\tunnel.sys,Microsoft Windows,true,The file is signed and the signature was verified.,Microsoft Windows Production PCA 2011
