hostname,name,pid,descriptivename,description,path,pathmd5sum,arguments,pathcertificatesubject,pathsignatureverified,pathsignaturedescription,pathcertificateissuer
ST869VRJ,WinRM,56,Windows Remote Management (WS-Management),Windows Remote Management (WinRM) service implements the WS-Management protocol for remote management. WS-Management is a standard web services protocol used for remote software and hardware management. The WinRM service listens on the network for WS-Management requests and processes them. The WinRM Service needs to be configured with a listener using winrm.cmd command line tool or through Group Policy in order for it to listen over the network. The WinRM service provides access to WMI data and enables event collection. Event collection and subscription to events require that the service is running. WinRM messages use HTTP and HTTPS as transports. The WinRM service does not depend on IIS but is preconfigured to share a port with IIS on the same machine.  The WinRM service reserves the /wsman URL prefix. To prevent conflicts with IIS  administrators should ensure that any websites hosted on IIS do not use the /wsman URL prefix.,C:\Windows\System32\svchost.exe,e8a50e71ccad69cee0faf29f092b1381,C:\Windows\System32\svchost.exe -k NetworkService,Microsoft Windows,true,The file is signed and the signature was verified.,Microsoft Windows Production PCA 2011
ST869VRJ,FileInfo,0,File Information FS MiniFilter,Collects information about files in memory to be consumed by other system services.,C:\Windows\System32\drivers\fileinfo.sys,76d238a3f313a3a35d9c6a2045f80004,\SystemRoot\System32\drivers\fileinfo.sys,Microsoft Windows,true,The file is signed and the signature was verified.,Microsoft Windows Production PCA 2011
ST869VRJ,SNMPTRAP,0,SNMP Trap,Receives trap messages generated by local or remote Simple Network Management Protocol (SNMP) agents and forwards the messages to SNMP management programs running on this computer. If this service is stopped  SNMP-based programs on this computer will not receive SNMP trap messages. If this service is disabled  any services that explicitly depend on it will fail to start.,C:\Windows\System32\snmptrap.exe,073c7cd85894f7dff4567b9b5f51975c,C:\Windows\System32\snmptrap.exe,Microsoft Windows,true,The file is signed and the signature was verified.,Microsoft Windows Production PCA 2011
ST869VRJ,viaide,0,viaide,,C:\Windows\System32\drivers\viaide.sys,cf7f7f21b038091c0c8ddc4cc23d1691,\SystemRoot\System32\drivers\viaide.sys,Microsoft Windows,true,The file is signed and the signature was verified.,Microsoft Windows Production PCA 2011
ST869VRJ,DXGKrnl,0,LDDM Graphics Subsystem,Controls the underlying video driver stacks to provide fully-featured display capabilities.,C:\Windows\System32\drivers\dxgkrnl.sys,e02c513e262cf10ce12556e28abdc130,\SystemRoot\System32\drivers\dxgkrnl.sys,Microsoft Windows,true,The file is signed and the signature was verified.,Microsoft Windows Production PCA 2011
ST869VRJ,elxstor,0,elxstor,,C:\Windows\System32\drivers\elxstor.sys,b071c1e5d7ad601ff25079d97bc1c87a,\SystemRoot\System32\drivers\elxstor.sys,Microsoft Windows,true,The file is signed and the signature was verified.,Microsoft Windows Production PCA 2011
ST869VRJ,CNG,0,CNG,,C:\Windows\System32\drivers\cng.sys,6bee4440862a6dcef0287a9da164c5fd,\SystemRoot\System32\Drivers\cng.sys,Microsoft Windows,true,The file is signed and the signature was verified.,Microsoft Windows Production PCA 2011
ST869VRJ,CompositeBus,0,Composite Bus Enumerator Driver,,C:\Windows\System32\drivers\CompositeBus.sys,613b4f8e70b50ea4162920a60df8d4b9,\SystemRoot\System32\drivers\CompositeBus.sys,Microsoft Windows,true,The file is signed and the signature was verified.,Microsoft Windows Production PCA 2011
ST869VRJ,acpipagr,0,ACPI Processor Aggregator Driver,,C:\Windows\System32\drivers\acpipagr.sys,4aab1dd125e25c73cc7c0b233e03af4f,\SystemRoot\System32\drivers\acpipagr.sys,Microsoft Windows,true,The file is signed and the signature was verified.,Microsoft Windows Production PCA 2011
ST869VRJ,AcpiPmi,0,ACPI Power Meter Driver,,C:\Windows\System32\drivers\acpipmi.sys,4e00a56635331177e4e59a9f1db67e66,\SystemRoot\System32\drivers\acpipmi.sys,Microsoft Windows,true,The file is signed and the signature was verified.,Microsoft Windows Production PCA 2011
ST869VRJ,cdfs,0,CD/DVD File System Reader,ISO9660/Joliet File System Reader for CD/DVDs. (Core) (All pieces),C:\Windows\System32\drivers\cdfs.sys,da11439e81769496d2a4cd6836f5215b,system32\DRIVERS\cdfs.sys,Microsoft Windows,true,The file is signed and the signature was verified.,Microsoft Windows Production PCA 2011
ST869VRJ,sfloppy,0,High-Capacity Floppy Disk Drive,,C:\Windows\System32\drivers\sfloppy.sys,364fa85b46ceffdf9858087f60fa76b7,\SystemRoot\System32\drivers\sfloppy.sys,Microsoft Windows,true,The file is signed and the signature was verified.,Microsoft Windows Production PCA 2011
ST869VRJ,PEAUTH,0,PEAUTH,,C:\Windows\System32\drivers\PEAuth.sys,c08501487409de1d22442b5661549ea9,system32\drivers\peauth.sys,Microsoft Windows,true,The file is signed and the signature was verified.,Microsoft Windows Production PCA 2011
ST869VRJ,SessionEnv,888,Remote Desktop Configuration,Remote Desktop Configuration service (RDCS) is responsible for all Remote Desktop Services and Remote Desktop related configuration and session maintenance activities that require SYSTEM context. These include per-session temporary folders  RD themes  and RD certificates.,C:\Windows\System32\svchost.exe,e8a50e71ccad69cee0faf29f092b1381,C:\Windows\System32\svchost.exe -k netsvcs,Microsoft Windows,true,The file is signed and the signature was verified.,Microsoft Windows Production PCA 2011
ST869VRJ,stornvme,0,Microsoft Standard NVM Express Driver,,C:\Windows\System32\drivers\stornvme.sys,f93d3b6138f1930efe51ec47314814de,\SystemRoot\System32\drivers\stornvme.sys,Microsoft Windows,true,The file is signed and the signature was verified.,Microsoft Windows Production PCA 2011
ST869VRJ,npsvctrig,0,Named pipe service trigger provider,,C:\Windows\System32\drivers\npsvctrig.sys,5e79864a56602fc2df9cd5356c9f9360,\SystemRoot\System32\drivers\npsvctrig.sys,Microsoft Windows,true,The file is signed and the signature was verified.,Microsoft Windows Production PCA 2011
ST869VRJ,WSService,0,Windows Store Service (WSService),Provides infrastructure support for Windows Store.This service is started on demand and if disabled applications bought using Windows Store will not behave correctly.,C:\Windows\System32\svchost.exe,e8a50e71ccad69cee0faf29f092b1381,C:\Windows\System32\svchost.exe -k wsappx,Microsoft Windows,true,The file is signed and the signature was verified.,Microsoft Windows Production PCA 2011
ST869VRJ,NDISWANLEGACY,0,Remote Access LEGACY NDIS WAN Driver,Remote Access LEGACY NDIS WAN Driver,C:\Windows\System32\drivers\ndiswan.sys,1bb35f239a62dd830f912a1af1ff2d60,\SystemRoot\system32\DRIVERS\ndiswan.sys,Microsoft Windows,true,The file is signed and the signature was verified.,Microsoft Windows Production PCA 2011
ST869VRJ,Schedule,888,Task Scheduler,Enables a user to configure and schedule automated tasks on this computer. The service also hosts multiple Windows system-critical tasks. If this service is stopped or disabled  these tasks will not be run at their scheduled times. If this service is disabled  any services that explicitly depend on it will fail to start.,C:\Windows\System32\svchost.exe,e8a50e71ccad69cee0faf29f092b1381,C:\Windows\system32\svchost.exe -k netsvcs,Microsoft Windows,true,The file is signed and the signature was verified.,Microsoft Windows Production PCA 2011
ST869VRJ,sermouse,0,Serial Mouse Driver,,C:\Windows\System32\drivers\sermouse.sys,3e6c4938476db33563f978e9d851825f,\SystemRoot\System32\drivers\sermouse.sys,Microsoft Windows,true,The file is signed and the signature was verified.,Microsoft Windows Production PCA 2011
ST869VRJ,hkmsvc,0,Health Key and Certificate Management,Provides X.509 certificate and key management services for the Network Access Protection Agent (NAPAgent). Enforcement technologies that use X.509 certificates may not function properly without this service,C:\Windows\System32\svchost.exe,e8a50e71ccad69cee0faf29f092b1381,C:\Windows\System32\svchost.exe -k netsvcs,Microsoft Windows,true,The file is signed and the signature was verified.,Microsoft Windows Production PCA 2011
ST869VRJ,NetBIOS,0,NetBIOS Interface,NetBIOS Interface,C:\Windows\System32\drivers\netbios.sys,f5a50ae90eac000dff134155dc9b56b0,system32\DRIVERS\netbios.sys,Microsoft Windows,true,The file is signed and the signature was verified.,Microsoft Windows Production PCA 2011
ST869VRJ,SpbCx,0,Simple Peripheral Bus Support Library,,C:\Windows\System32\drivers\SpbCx.sys,675c363f1513a0936df3a755ae6463f0,system32\drivers\SpbCx.sys,Microsoft Windows,true,The file is signed and the signature was verified.,Microsoft Windows Production PCA 2011
ST869VRJ,ACPI,0,Microsoft ACPI Driver,,C:\Windows\System32\drivers\acpi.sys,a1e3381c0d62928a60c8eea303399759,\SystemRoot\System32\drivers\ACPI.sys,Microsoft Windows,true,The file is signed and the signature was verified.,Microsoft Windows Production PCA 2011
ST869VRJ,SiSRaid2,0,SiSRaid2,,C:\Windows\System32\drivers\sisraid2.sys,4c840dad8ec58fb60e95d447380859cc,\SystemRoot\System32\drivers\SiSRaid2.sys,Microsoft Windows,true,The file is signed and the signature was verified.,Microsoft Windows Production PCA 2011
ST869VRJ,wercplsupport,0,Problem Reports and Solutions Control Panel Support,This service provides support for viewing  sending and deletion of system-level problem reports for the Problem Reports and Solutions control panel.,C:\Windows\System32\svchost.exe,e8a50e71ccad69cee0faf29f092b1381,C:\Windows\System32\svchost.exe -k netsvcs,Microsoft Windows,true,The file is signed and the signature was verified.,Microsoft Windows Production PCA 2011
ST869VRJ,agp440,0,Intel AGP Bus Filter,,C:\Windows\System32\drivers\AGP440.sys,81cca49da4bad3fd055deb02c41bff31,\SystemRoot\System32\drivers\agp440.sys,Microsoft Windows,true,The file is signed and the signature was verified.,Microsoft Windows Production PCA 2011
ST869VRJ,napagent,0,Network Access Protection Agent,The Network Access Protection (NAP) agent service collects and manages health information for client computers on a network. Information collected by NAP agent is used to make sure that the client computer has the required software and settings. If a client computer is not compliant with health policy  it can be provided with restricted network access until its configuration is updated. Depending on the configuration of health policy  client computers might be automatically updated so that users quickly regain full network access without having to manually update their computer.,C:\Windows\System32\svchost.exe,e8a50e71ccad69cee0faf29f092b1381,C:\Windows\System32\svchost.exe -k NetworkService,Microsoft Windows,true,The file is signed and the signature was verified.,Microsoft Windows Production PCA 2011
ST869VRJ,AppXSvc,0,AppX Deployment Service (AppXSVC),Provides infrastructure support for deploying Store applications. This service is started on demand and if disabled Store applications will not be deployed to the system  and may not function properly.,C:\Windows\System32\svchost.exe,e8a50e71ccad69cee0faf29f092b1381,C:\Windows\system32\svchost.exe -k wsappx,Microsoft Windows,true,The file is signed and the signature was verified.,Microsoft Windows Production PCA 2011
ST869VRJ,upnphost,0,UPnP Device Host,Allows UPnP devices to be hosted on this computer. If this service is stopped  any hosted UPnP devices will stop functioning and no additional hosted devices can be added. If this service is disabled  any services that explicitly depend on it will fail to start.,C:\Windows\System32\svchost.exe,e8a50e71ccad69cee0faf29f092b1381,C:\Windows\system32\svchost.exe -k LocalServiceAndNoImpersonation,Microsoft Windows,true,The file is signed and the signature was verified.,Microsoft Windows Production PCA 2011
ST869VRJ,Dfsc,0,DFS Namespace Client Driver,Client driver for access to DFS Namespaces,C:\Windows\System32\drivers\dfsc.sys,08461b90563ebb3a0c5ee90cc764ca02,System32\Drivers\dfsc.sys,Microsoft Windows,true,The file is signed and the signature was verified.,Microsoft Windows Production PCA 2011
ST869VRJ,usbccgp,0,Microsoft USB Generic Parent Driver,,C:\Windows\System32\drivers\usbccgp.sys,92ae9a0fd290bee56304c684673841a1,\SystemRoot\System32\drivers\usbccgp.sys,Microsoft Windows,true,The file is signed and the signature was verified.,Microsoft Windows Production PCA 2011
ST869VRJ,kbdclass,0,Keyboard Class Driver,,C:\Windows\System32\drivers\kbdclass.sys,ba5de0e293060fec83809485656a3c2e,\SystemRoot\System32\drivers\kbdclass.sys,Microsoft Windows,true,The file is signed and the signature was verified.,Microsoft Windows Production PCA 2011
ST869VRJ,UI0Detect,0,Interactive Services Detection,Enables user notification of user input for interactive services  which enables access to dialogs created by interactive services when they appear. If this service is stopped  notifications of new interactive service dialogs will no longer function and there might not be access to interactive service dialogs. If this service is disabled  both notifications of and access to new interactive service dialogs will no longer function.,C:\Windows\System32\UI0Detect.exe,4040c522032aa0560d7507078c64a3d5,C:\Windows\system32\UI0Detect.exe,Microsoft Windows,true,The file is signed and the signature was verified.,Microsoft Windows Production PCA 2011
ST869VRJ,AmdK8,0,AMD K8 Processor Driver,,C:\Windows\System32\drivers\amdk8.sys,24e2bef38cf066ab9fe14eeebf49e5f2,\SystemRoot\System32\drivers\amdk8.sys,Microsoft Windows,true,The file is signed and the signature was verified.,Microsoft Windows Production PCA 2011
ST869VRJ,Serenum,0,Serenum Filter Driver,,C:\Windows\System32\drivers\serenum.sys,72b72068c6525dcae476dd9f1d7500f6,\SystemRoot\System32\drivers\serenum.sys,Microsoft Windows,true,The file is signed and the signature was verified.,Microsoft Windows Production PCA 2011
ST869VRJ,SstpSvc,0,Secure Socket Tunneling Protocol Service,Provides support for the Secure Socket Tunneling Protocol (SSTP) to connect to remote computers using VPN. If this service is disabled  users will not be able to use SSTP to access remote servers.,C:\Windows\System32\svchost.exe,e8a50e71ccad69cee0faf29f092b1381,C:\Windows\system32\svchost.exe -k LocalService,Microsoft Windows,true,The file is signed and the signature was verified.,Microsoft Windows Production PCA 2011
ST869VRJ,scfilter,0,Smart card PnP Class Filter Driver,Smart card reader filter driver enabling smart card PnP.,C:\Windows\System32\drivers\scfilter.sys,194e2f0c9d10f51e8a7e38fb848b6f04,System32\DRIVERS\scfilter.sys,Microsoft Windows,true,The file is signed and the signature was verified.,Microsoft Windows Production PCA 2011
ST869VRJ,VerifierExt,0,VerifierExt,,C:\Windows\System32\drivers\VerifierExt.sys,87fceef132dd217f3f847f7973854299,system32\drivers\VerifierExt.sys,Microsoft Windows,true,The file is signed and the signature was verified.,Microsoft Windows Production PCA 2011
ST869VRJ,3ware,0,3ware,,C:\Windows\System32\drivers\3ware.sys,7d3dad64bd1d3ce0d953334c5caf0784,\SystemRoot\System32\drivers\3ware.sys,Microsoft Windows,true,The file is signed and the signature was verified.,Microsoft Windows Production PCA 2011
ST869VRJ,RdpVideoMiniport,0,Remote Desktop Video Miniport Driver,,C:\Windows\System32\drivers\rdpvideominiport.sys,acee350b6ee76e42ec85b9a0473a23ca,System32\drivers\rdpvideominiport.sys,Microsoft Windows,true,The file is signed and the signature was verified.,Microsoft Windows Production PCA 2011
ST869VRJ,PerfHost,0,Performance Counter DLL Host,Enables remote users and 64-bit processes to query performance counters provided by 32-bit DLLs. If this service is stopped  only local users and 32-bit processes will be able to query performance counters provided by 32-bit DLLs.,C:\Windows\SysWOW64\perfhost.exe,a81ace63dd50560a55004fbc8869c3b5,C:\Windows\SysWow64\perfhost.exe,Microsoft Windows,true,The file is signed and the signature was verified.,Microsoft Windows Production PCA 2011
ST869VRJ,xennet,0,AWS PV Network Device,,C:\Windows\System32\drivers\xennet.sys,8d2e45eb7c1cd5b0d636fad6439991a2,\SystemRoot\system32\DRIVERS\xennet.sys,Microsoft Windows Hardware Compatibility Publisher,true,The file is signed and the signature was verified.,Microsoft Windows Hardware Compatibility PCA
ST869VRJ,AudioEndpointBuilder,0,Windows Audio Endpoint Builder,Manages audio devices for the Windows Audio service.  If this service is stopped  audio devices and effects will not function properly.  If this service is disabled  any services that explicitly depend on it will fail to start,C:\Windows\System32\svchost.exe,e8a50e71ccad69cee0faf29f092b1381,C:\Windows\System32\svchost.exe -k LocalSystemNetworkRestricted,Microsoft Windows,true,The file is signed and the signature was verified.,Microsoft Windows Production PCA 2011
ST869VRJ,swprv,0,Microsoft Software Shadow Copy Provider,Manages software-based volume shadow copies taken by the Volume Shadow Copy service. If this service is stopped  software-based volume shadow copies cannot be managed. If this service is disabled  any services that explicitly depend on it will fail to start.,C:\Windows\System32\svchost.exe,e8a50e71ccad69cee0faf29f092b1381,C:\Windows\System32\svchost.exe -k swprv,Microsoft Windows,true,The file is signed and the signature was verified.,Microsoft Windows Production PCA 2011
ST869VRJ,TsUsbGD,0,Remote Desktop Generic USB Device,,C:\Windows\System32\drivers\TsUsbGD.sys,4c3b00025cbbe350b7376aca0f7907f0,\SystemRoot\System32\drivers\TsUsbGD.sys,Microsoft Windows,true,The file is signed and the signature was verified.,Microsoft Windows Production PCA 2011
ST869VRJ,mouclass,0,Mouse Class Driver,,C:\Windows\System32\drivers\mouclass.sys,807b234ce7cdd23c9c43da4287fe856f,\SystemRoot\System32\drivers\mouclass.sys,Microsoft Windows,true,The file is signed and the signature was verified.,Microsoft Windows Production PCA 2011
ST869VRJ,UmRdpService,1292,Remote Desktop Services UserMode Port Redirector,Allows the redirection of Printers/Drives/Ports for RDP connections,C:\Windows\System32\svchost.exe,e8a50e71ccad69cee0faf29f092b1381,C:\Windows\System32\svchost.exe -k LocalSystemNetworkRestricted,Microsoft Windows,true,The file is signed and the signature was verified.,Microsoft Windows Production PCA 2011
ST869VRJ,WcsPlugInService,0,Windows Color System,The WcsPlugInService service hosts third-party Windows Color System color device model and gamut map model plug-in modules. These plug-in modules are vendor-specific extensions to the Windows Color System baseline color device and gamut map models. Stopping or disabling the WcsPlugInService service will disable this extensibility feature  and the Windows Color System will use its baseline model processing rather than the vendor's desired processing. This might result in inaccurate color rendering.,C:\Windows\System32\svchost.exe,e8a50e71ccad69cee0faf29f092b1381,C:\Windows\system32\svchost.exe -k wcssvc,Microsoft Windows,true,The file is signed and the signature was verified.,Microsoft Windows Production PCA 2011
ST869VRJ,AWSNVMe,0,AWSNVMe,,C:\Windows\System32\drivers\AWSNVMe.sys,a31b93f16542b2f2fb010d0a971a118a,\SystemRoot\System32\drivers\AWSNVMe.sys,Microsoft Windows Hardware Compatibility Publisher,true,The file is signed and the signature was verified.,Microsoft Windows Hardware Compatibility PCA
ST869VRJ,Eaphost,0,Extensible Authentication Protocol,The Extensible Authentication Protocol (EAP) service provides network authentication in such scenarios as 802.1x wired and wireless  VPN  and Network Access Protection (NAP).  EAP also provides application programming interfaces (APIs) that are used by network access clients  including wireless and VPN clients  during the authentication process.  If you disable this service  this computer is prevented from accessing networks that require EAP authentication.,C:\Windows\System32\svchost.exe,e8a50e71ccad69cee0faf29f092b1381,C:\Windows\System32\svchost.exe -k netsvcs,Microsoft Windows,true,The file is signed and the signature was verified.,Microsoft Windows Production PCA 2011
ST869VRJ,AFD,0,Ancillary Function Driver for Winsock,Ancillary Function Driver for Winsock,C:\Windows\System32\drivers\afd.sys,597b72f62c9adb5e1d87d76811030fe9,\SystemRoot\system32\drivers\afd.sys,Microsoft Windows,true,The file is signed and the signature was verified.,Microsoft Windows Production PCA 2011
ST869VRJ,UCX01000,0,USB Controller Extension,,C:\Windows\System32\drivers\UCX01000.SYS,7163f28ed6202f06428d28b709029e21,\SystemRoot\System32\drivers\ucx01000.sys,Microsoft Windows,true,The file is signed and the signature was verified.,Microsoft Windows Production PCA 2011
ST869VRJ,partmgr,0,Partition Manager,Disk class filter driver that auctions out partitions to volume managers,C:\Windows\System32\drivers\partmgr.sys,7cd325034ea0ad9ee0a3b63a1883e1a8,\SystemRoot\System32\drivers\partmgr.sys,Microsoft Windows,true,The file is signed and the signature was verified.,Microsoft Windows Production PCA 2011
ST869VRJ,WinNat,0,Windows NAT Driver,This service provides network address translation functionality,C:\Windows\System32\drivers\winnat.sys,aa73c2e16e6e6e51f491c026ae027ece,system32\drivers\winnat.sys,Microsoft Windows,true,The file is signed and the signature was verified.,Microsoft Windows Production PCA 2011
ST869VRJ,Vid,0,Vid,,C:\Windows\System32\drivers\Vid.sys,e1df9970b3dc59b860abe574162ffe1e,\SystemRoot\System32\drivers\Vid.sys,Microsoft Windows,true,The file is signed and the signature was verified.,Microsoft Windows Production PCA 2011
ST869VRJ,WFPLWFS,0,Microsoft Windows Filtering Platform,Microsoft Windows Filtering Platform,C:\Windows\System32\drivers\wfplwfs.sys,4829579dde5e532cdcedde6a6a569d7f,\SystemRoot\system32\DRIVERS\wfplwfs.sys,Microsoft Windows,true,The file is signed and the signature was verified.,Microsoft Windows Production PCA 2011
ST869VRJ,WinVerbs,0,WinVerbs Service,,C:\Windows\System32\drivers\winverbs.sys,1a450c01ebf5c662877c7e921368d32f,\SystemRoot\System32\drivers\winverbs.sys,Microsoft Windows,true,The file is signed and the signature was verified.,Microsoft Windows Production PCA 2011
ST869VRJ,LSI_SAS,0,LSI_SAS,,C:\Windows\System32\drivers\lsi_sas.sys,97b45a4fa0603d4eece3e893e854d875,\SystemRoot\System32\drivers\lsi_sas.sys,Microsoft Windows,true,The file is signed and the signature was verified.,Microsoft Windows Production PCA 2011
ST869VRJ,UEFI,0,Microsoft UEFI Driver,,C:\Windows\System32\drivers\uefi.sys,f1dd0886f8e4a5d6a4e722b9cba1ec47,\SystemRoot\System32\drivers\UEFI.sys,Microsoft Windows,true,The file is signed and the signature was verified.,Microsoft Windows Production PCA 2011
ST869VRJ,Parport,0,Parallel port driver,,C:\Windows\System32\drivers\parport.sys,ee68c49b651f27dfd3ef856c75ef6b96,\SystemRoot\System32\drivers\parport.sys,Microsoft Windows,true,The file is signed and the signature was verified.,Microsoft Windows Production PCA 2011
ST869VRJ,Wanarpv6,0,Remote Access IPv6 ARP Driver,Remote Access IPv6 ARP Driver,C:\Windows\System32\drivers\wanarp.sys,a9e03b4dfc5ac827f8609c07be14bcc9,\SystemRoot\system32\DRIVERS\wanarp.sys,Microsoft Windows,true,The file is signed and the signature was verified.,Microsoft Windows Production PCA 2011
ST869VRJ,intelide,0,intelide,,C:\Windows\System32\drivers\intelide.sys,d9390c26bc60cc5f2b6e216ba6f12db2,\SystemRoot\System32\drivers\intelide.sys,Microsoft Windows,true,The file is signed and the signature was verified.,Microsoft Windows Production PCA 2011
ST869VRJ,MsLbfoProvider,0,Microsoft Load Balancing/Failover Provider,Microsoft Load Balancing/Failover Provider,C:\Windows\System32\drivers\MsLbfoProvider.sys,2be5555b478610a8537ec11dbbc0a932,\SystemRoot\system32\DRIVERS\MsLbfoProvider.sys,Microsoft Windows,true,The file is signed and the signature was verified.,Microsoft Windows Production PCA 2011
ST869VRJ,wtlmdrv,0,Microsoft iSCSI Target LocalMount Adapter,,C:\Windows\System32\drivers\wtlmdrv.sys,2c2ec8b848c773c4a7d75a07ac17a072,\SystemRoot\System32\drivers\wtlmdrv.sys,Microsoft Windows,true,The file is signed and the signature was verified.,Microsoft Windows Production PCA 2011
ST869VRJ,GPIOClx0101,0,Microsoft GPIO Class Extension Driver,,C:\Windows\System32\drivers\msgpioclx.sys,308d335b75bce1972f709da5dfb08657,System32\Drivers\msgpioclx.sys,Microsoft Windows,true,The file is signed and the signature was verified.,Microsoft Windows Production PCA 2011
ST869VRJ,RasAgileVpn,0,WAN Miniport (IKEv2),WAN Miniport (IKEv2),C:\Windows\System32\drivers\agilevpn.sys,be22506623205df58110e049a218f196,\SystemRoot\system32\DRIVERS\AgileVpn.sys,Microsoft Windows,true,The file is signed and the signature was verified.,Microsoft Windows Production PCA 2011
ST869VRJ,BITS,0,Background Intelligent Transfer Service,Transfers files in the background using idle network bandwidth. If the service is disabled  then any applications that depend on BITS  such as Windows Update or MSN Explorer  will be unable to automatically download programs and other information.,C:\Windows\System32\svchost.exe,e8a50e71ccad69cee0faf29f092b1381,C:\Windows\System32\svchost.exe -k netsvcs,Microsoft Windows,true,The file is signed and the signature was verified.,Microsoft Windows Production PCA 2011
ST869VRJ,vmbus,0,Virtual Machine Bus,,C:\Windows\System32\drivers\vmbus.sys,4ab75da5b196c944b462dc2e1356dab8,\SystemRoot\System32\drivers\vmbus.sys,Microsoft Windows,true,The file is signed and the signature was verified.,Microsoft Windows Production PCA 2011
ST869VRJ,terminpt,0,Microsoft Remote Desktop Input Driver,,C:\Windows\System32\drivers\terminpt.sys,07c67992726b128d868dcfb98fb63f48,\SystemRoot\System32\drivers\terminpt.sys,Microsoft Windows,true,The file is signed and the signature was verified.,Microsoft Windows Production PCA 2011
