hostname,name,descriptivename,description,path,md5,arguments,type,servicedll,pathsignatureexists,pathsignatureverified,pathsignaturedescription,pathcertificatesubject,pathcertificateissuer
EE280KUW,mlx4_bus,Mellanox ConnectX Bus Enumerator,,C:\Windows\System32\drivers\mlx4_bus.sys,496a31acc1deeedf672411c4abc98dda,\SystemRoot\System32\drivers\mlx4_bus.sys,SERVICE_KERNEL_DRIVER,,true,true,The file is signed and the signature was verified.,Microsoft Windows,Microsoft Windows Production PCA 2011
EE280KUW,UI0Detect,Interactive Services Detection,Enables user notification of user input for interactive services  which enables access to dialogs created by interactive services when they appear. If this service is stopped  notifications of new interactive service dialogs will no longer function and there might not be access to interactive service dialogs. If this service is disabled  both notifications of and access to new interactive service dialogs will no longer function.,C:\Windows\System32\UI0Detect.exe,3b519c04ca8ca1a52b67b9c069e01b65,C:\Windows\system32\UI0Detect.exe,SERVICE_WIN32_OWN_PROCESS,,true,true,The file is signed and the signature was verified.,Microsoft Windows,Microsoft Windows Production PCA 2011
EE280KUW,NdisCap,Microsoft NDIS Capture,Microsoft NDIS Capture,C:\Windows\System32\drivers\ndiscap.sys,cc5679b9e5608525614fd5786410dbb4,System32\drivers\ndiscap.sys,SERVICE_KERNEL_DRIVER,,true,true,The file is signed and the signature was verified.,Microsoft Windows,Microsoft Windows Production PCA 2011
EE280KUW,ndiswanlegacy,Remote Access LEGACY NDIS WAN Driver,Remote Access LEGACY NDIS WAN Driver,C:\Windows\System32\drivers\ndiswan.sys,55a1d0083cffdf2492be9ca0fbae161f,System32\DRIVERS\ndiswan.sys,SERVICE_KERNEL_DRIVER,,true,true,The file is signed and the signature was verified.,Microsoft Windows,Microsoft Windows Production PCA 2011
EE280KUW,RemoteRegistry,Remote Registry,Enables remote users to modify registry settings on this computer. If this service is stopped  the registry can be modified only by users on this computer. If this service is disabled  any services that explicitly depend on it will fail to start.,C:\Windows\System32\svchost.exe,b2a21dd4ad6ed25ca3440d6389675758,C:\Windows\system32\svchost.exe -k localService,SERVICE_WIN32_SHARE_PROCESS,C:\Windows\System32\regsvc.dll,true,true,The file is signed and the signature was verified.,Microsoft Windows,Microsoft Windows Production PCA 2011
EE280KUW,pciide,pciide,,C:\Windows\System32\drivers\pciide.sys,af30956b1dff6dc58d3194705a5de118,\SystemRoot\System32\drivers\pciide.sys,SERVICE_KERNEL_DRIVER,,true,true,The file is signed and the signature was verified.,Microsoft Windows,Microsoft Windows Production PCA 2011
EE280KUW,fdPHost,Function Discovery Provider Host,The FDPHOST service hosts the Function Discovery (FD) network discovery providers. These FD providers supply network discovery services for the Simple Services Discovery Protocol (SSDP) and Web Services – Discovery (WS-D) protocol. Stopping or disabling the FDPHOST service will disable network discovery for these protocols when using FD. When this service is unavailable  network services using FD and relying on these discovery protocols will be unable to find network devices or resources.,C:\Windows\System32\svchost.exe,b2a21dd4ad6ed25ca3440d6389675758,C:\Windows\system32\svchost.exe -k LocalService,SERVICE_WIN32_SHARE_PROCESS,C:\Windows\System32\fdPHost.dll,true,true,The file is signed and the signature was verified.,Microsoft Windows,Microsoft Windows Production PCA 2011
EE280KUW,svsvc,Spot Verifier,Verifies potential file system corruptions.,C:\Windows\System32\svchost.exe,b2a21dd4ad6ed25ca3440d6389675758,C:\Windows\system32\svchost.exe -k LocalSystemNetworkRestricted,SERVICE_WIN32_SHARE_PROCESS,C:\Windows\System32\svsvc.dll,true,true,The file is signed and the signature was verified.,Microsoft Windows,Microsoft Windows Production PCA 2011
EE280KUW,netvsc,netvsc,,C:\Windows\System32\drivers\netvsc.sys,6ba5241a739b76fe2482df70e59fc424,\SystemRoot\System32\drivers\netvsc.sys,SERVICE_KERNEL_DRIVER,,true,true,The file is signed and the signature was verified.,Microsoft Windows,Microsoft Windows Production PCA 2011
EE280KUW,isapnp,isapnp,,C:\Windows\System32\drivers\isapnp.sys,c5d86ecb509aaf22666d37cc52e2b7a9,\SystemRoot\System32\drivers\isapnp.sys,SERVICE_KERNEL_DRIVER,,true,true,The file is signed and the signature was verified.,Microsoft Windows,Microsoft Windows Production PCA 2011
EE280KUW,IndirectKmd,Indirect Displays Kernel-Mode Driver,Kernel mode driver that implements the Indirect Displays framework.,C:\Windows\System32\drivers\IndirectKmd.sys,1c31f9dd3cfa1a3bb7bbe79a41f6e2ef,\SystemRoot\System32\drivers\IndirectKmd.sys,SERVICE_KERNEL_DRIVER,,true,true,The file is signed and the signature was verified.,Microsoft Windows,Microsoft Windows Production PCA 2011
EE280KUW,cdfs,CD/DVD File System Reader,ISO9660/Joliet File System Reader for CD/DVDs. (Core) (All pieces),C:\Windows\System32\drivers\cdfs.sys,a2ca2545a8248d80f1f02d5a1aacdcfb,system32\DRIVERS\cdfs.sys,SERVICE_FILE_SYSTEM_DRIVER,,true,true,The file is signed and the signature was verified.,Microsoft Windows,Microsoft Windows Production PCA 2011
EE280KUW,storvsc,storvsc,,C:\Windows\System32\drivers\storvsc.sys,927839da63bfa33a6e6df660f962668a,\SystemRoot\System32\drivers\storvsc.sys,SERVICE_KERNEL_DRIVER,,true,true,The file is signed and the signature was verified.,Microsoft Windows,Microsoft Windows Production PCA 2011
EE280KUW,Dfsc,DFS Namespace Client Driver,Client driver for access to DFS Namespaces,C:\Windows\System32\drivers\dfsc.sys,7c95f644eb6505d5f309bdda2a3d7260,System32\Drivers\dfsc.sys,SERVICE_FILE_SYSTEM_DRIVER,,true,true,The file is signed and the signature was verified.,Microsoft Windows,Microsoft Windows Production PCA 2011
EE280KUW,WEPHOSTSVC,Windows Encryption Provider Host Service,Windows Encryption Provider Host Service brokers encryption related functionalities from 3rd Party Encryption Providers to processes that need to evaluate and apply EAS policies. Stopping this will compromise EAS compliancy checks that have been established by the connected Mail Accounts,C:\Windows\System32\svchost.exe,b2a21dd4ad6ed25ca3440d6389675758,C:\Windows\system32\svchost.exe -k WepHostSvcGroup,SERVICE_WIN32_SHARE_PROCESS,C:\Windows\System32\wephostsvc.dll,true,true,The file is signed and the signature was verified.,Microsoft Windows,Microsoft Windows Production PCA 2011
EE280KUW,RSoPProv,Resultant Set of Policy Provider,Provides a network service that processes requests to simulate application of Group Policy settings for a target user or computer in various situations and computes the Resultant Set of Policy settings.,C:\Windows\System32\rsopprov.exe,a156a5db6a0851e3594c05b41bae8339,C:\Windows\system32\RSoPProv.exe,SERVICE_WIN32_SHARE_PROCESS,,true,true,The file is signed and the signature was verified.,Microsoft Windows,Microsoft Windows Production PCA 2011
EE280KUW,diagnosticshub.standardcollector.service,Microsoft (R) Diagnostics Hub Standard Collector Service,Diagnostics Hub Standard Collector Service. When running  this service collects real time ETW events and processes them.,C:\Windows\System32\DiagSvcs\DiagnosticsHub.StandardCollector.Service.exe,ade0064879ee1b20f4fd4ba43dde4b46,C:\Windows\system32\DiagSvcs\DiagnosticsHub.StandardCollector.Service.exe,SERVICE_WIN32_OWN_PROCESS,,true,true,The file is signed and the signature was verified.,Microsoft Windows,Microsoft Windows Production PCA 2011
EE280KUW,cnghwassist,CNG Hardware Assist algorithm provider,CNG Hardware Assist algorithm provider,C:\Windows\System32\drivers\cnghwassist.sys,778e41d408a22da5f68f565a09eabc0c,System32\DRIVERS\cnghwassist.sys,SERVICE_KERNEL_DRIVER,,true,true,The file is signed and the signature was verified.,Microsoft Windows,Microsoft Windows Production PCA 2011
EE280KUW,scmdisk0101,Microsoft NVDIMM-N disk driver,,C:\Windows\System32\drivers\scmdisk0101.sys,5cf7c88251aa92b6087e74c2b1da8b7a,\SystemRoot\System32\drivers\scmdisk0101.sys,SERVICE_KERNEL_DRIVER,,true,true,The file is signed and the signature was verified.,Microsoft Windows,Microsoft Windows Production PCA 2011
EE280KUW,0062601541359992mcinstcleanup,McAfee Application Installer Cleanup (0062601541359992),,C:\Users\$user\AppData\Local\Temp\0062601541359992mcinst.exe,e96e6782ecd2e82199cf9818ec64684c,C:\Users\$user\AppData\Local\Temp\006260~1.EXE -cleanup -nolog,SERVICE_WIN32_OWN_PROCESS,,true,true,The file is signed and the signature was verified.,"McAfee""",VeriSign Class 3 Code Signing 2010 CA
EE280KUW,sdbus,sdbus,,C:\Windows\System32\drivers\sdbus.sys,59c439c0efb0ae5275b83f3fb4a36319,\SystemRoot\System32\drivers\sdbus.sys,SERVICE_KERNEL_DRIVER,,true,true,The file is signed and the signature was verified.,Microsoft Windows,Microsoft Windows Production PCA 2011
EE280KUW,cdrom,CD-ROM Driver,,C:\Windows\System32\drivers\cdrom.sys,00b66306cfce2450fd4f7e8eff559dd7,\SystemRoot\System32\drivers\cdrom.sys,SERVICE_KERNEL_DRIVER,,true,true,The file is signed and the signature was verified.,Microsoft Windows,Microsoft Windows Production PCA 2011
EE280KUW,mfewfpk,McAfee Inc. mfewfpk,,C:\Windows\System32\drivers\mfewfpk.sys,04b728d783b34fba6cc04cc8e5920ba9,\SystemRoot\system32\drivers\mfewfpk.sys,SERVICE_KERNEL_DRIVER,,true,true,The file is signed and the signature was verified.,Microsoft Windows Hardware Compatibility Publisher,Microsoft Windows Hardware Compatibility PCA
EE280KUW,RasAuto,Remote Access Auto Connection Manager,Creates a connection to a remote network whenever a program references a remote DNS or NetBIOS name or address.,C:\Windows\System32\svchost.exe,b2a21dd4ad6ed25ca3440d6389675758,C:\Windows\System32\svchost.exe -k netsvcs,SERVICE_WIN32_SHARE_PROCESS,C:\Windows\System32\rasauto.dll,true,true,The file is signed and the signature was verified.,Microsoft Windows,Microsoft Windows Production PCA 2011
EE280KUW,DPS,Diagnostic Policy Service,The Diagnostic Policy Service enables problem detection  troubleshooting and resolution for Windows components.  If this service is stopped  diagnostics will no longer function.,C:\Windows\System32\svchost.exe,b2a21dd4ad6ed25ca3440d6389675758,C:\Windows\System32\svchost.exe -k LocalServiceNoNetwork,SERVICE_WIN32_SHARE_PROCESS,C:\Windows\System32\dps.dll,true,true,The file is signed and the signature was verified.,Microsoft Windows,Microsoft Windows Production PCA 2011
EE280KUW,CapImg,HID driver for CapImg touch screen,,C:\Windows\System32\drivers\capimg.sys,8c8527253a2baad081135fc7c36e7bd2,\SystemRoot\System32\drivers\capimg.sys,SERVICE_KERNEL_DRIVER,,true,true,The file is signed and the signature was verified.,Microsoft Windows,Microsoft Windows Production PCA 2011
EE280KUW,CryptSvc,Cryptographic Services,Provides three management services: Catalog Database Service  which confirms the signatures of Windows files and allows new programs to be installed; Protected Root Service  which adds and removes Trusted Root Certification Authority certificates from this computer; and Automatic Root Certificate Update Service  which retrieves root certificates from Windows Update and enable scenarios such as SSL. If this service is stopped  these management services will not function properly. If this service is disabled  any services that explicitly depend on it will fail to start.,C:\Windows\System32\svchost.exe,b2a21dd4ad6ed25ca3440d6389675758,C:\Windows\system32\svchost.exe -k NetworkService,SERVICE_WIN32_SHARE_PROCESS,C:\Windows\System32\cryptsvc.dll,true,true,The file is signed and the signature was verified.,Microsoft Windows,Microsoft Windows Production PCA 2011
EE280KUW,SpbCx,Simple Peripheral Bus Support Library,,C:\Windows\System32\drivers\SpbCx.sys,5d39c3b859ea8d8270961e92d8d8698b,system32\drivers\SpbCx.sys,SERVICE_KERNEL_DRIVER,,true,true,The file is signed and the signature was verified.,Microsoft Windows,Microsoft Windows Production PCA 2011
EE280KUW,StorSvc,Storage Service,Provides enabling services for storage settings and external storage expansion,C:\Windows\System32\svchost.exe,b2a21dd4ad6ed25ca3440d6389675758,C:\Windows\System32\svchost.exe -k LocalSystemNetworkRestricted,SERVICE_WIN32_SHARE_PROCESS,C:\Windows\System32\StorSvc.dll,true,true,The file is signed and the signature was verified.,Microsoft Windows,Microsoft Windows Production PCA 2011
EE280KUW,Spooler,Print Spooler,This service spools print jobs and handles interaction with the printer.  If you turn off this service  you won’t be able to print or see your printers.,C:\Windows\System32\spoolsv.exe,b9e3b4a2aa9f63efa1a5093e993055ef,C:\Windows\System32\spoolsv.exe,SERVICE_WIN32_OWN_PROCESS,,true,true,The file is signed and the signature was verified.,Microsoft Windows,Microsoft Windows Production PCA 2011
EE280KUW,RpcEptMapper,RPC Endpoint Mapper,Resolves RPC interfaces identifiers to transport endpoints. If this service is stopped or disabled  programs using Remote Procedure Call (RPC) services will not function properly.,C:\Windows\System32\svchost.exe,b2a21dd4ad6ed25ca3440d6389675758,C:\Windows\system32\svchost.exe -k RPCSS,SERVICE_WIN32_SHARE_PROCESS,C:\Windows\System32\RpcEpMap.dll,true,true,The file is signed and the signature was verified.,Microsoft Windows,Microsoft Windows Production PCA 2011
EE280KUW,ACPI,Microsoft ACPI Driver,,C:\Windows\System32\drivers\acpi.sys,3d5b61e5865d1ef4bef3537ce1625b5f,\SystemRoot\System32\drivers\ACPI.sys,SERVICE_KERNEL_DRIVER,,true,true,The file is signed and the signature was verified.,Microsoft Windows,Microsoft Windows Production PCA 2011
EE280KUW,LSI_SAS2i,LSI_SAS2i,,C:\Windows\System32\drivers\lsi_sas2i.sys,0da07713c40e546d34d25736e27b3eff,\SystemRoot\System32\drivers\lsi_sas2i.sys,SERVICE_KERNEL_DRIVER,,true,true,The file is signed and the signature was verified.,Microsoft Windows,Microsoft Windows Production PCA 2011
EE280KUW,WerSvc,Windows Error Reporting Service,Allows errors to be reported when programs stop working or responding and allows existing solutions to be delivered. Also allows logs to be generated for diagnostic and repair services. If this service is stopped  error reporting might not work correctly and results of diagnostic services and repairs might not be displayed.,C:\Windows\System32\svchost.exe,b2a21dd4ad6ed25ca3440d6389675758,C:\Windows\System32\svchost.exe -k WerSvcGroup,SERVICE_WIN32_OWN_PROCESS,C:\Windows\System32\wersvc.dll,true,true,The file is signed and the signature was verified.,Microsoft Windows,Microsoft Windows Production PCA 2011
EE280KUW,Wecsvc,Windows Event Collector,This service manages persistent subscriptions to events from remote sources that support WS-Management protocol. This includes Windows Vista event logs  hardware and IPMI-enabled event sources. The service stores forwarded events in a local Event Log. If this service is stopped or disabled event subscriptions cannot be created and forwarded events cannot be accepted.,C:\Windows\System32\svchost.exe,b2a21dd4ad6ed25ca3440d6389675758,C:\Windows\system32\svchost.exe -k NetworkService,SERVICE_WIN32_SHARE_PROCESS,C:\Windows\System32\wecsvc.dll,true,true,The file is signed and the signature was verified.,Microsoft Windows,Microsoft Windows Production PCA 2011
EE280KUW,spaceport,Storage Spaces Driver,,C:\Windows\System32\drivers\spaceport.sys,2bc8d5680fe46ac2d59ef4d9bc66445e,\SystemRoot\System32\drivers\spaceport.sys,SERVICE_KERNEL_DRIVER,,true,true,The file is signed and the signature was verified.,Microsoft Windows,Microsoft Windows Production PCA 2011
EE280KUW,xboxgip,Xbox Game Input Protocol Driver,Xbox Game Input Protocol Driver,C:\Windows\System32\drivers\xboxgip.sys,fccdaa206a348d4c3c9d7695c7ce6b5b,\SystemRoot\System32\drivers\xboxgip.sys,SERVICE_KERNEL_DRIVER,,true,true,The file is signed and the signature was verified.,Microsoft Windows,Microsoft Windows Production PCA 2011
EE280KUW,SCPolicySvc,Smart Card Removal Policy,Allows the system to be configured to lock the user desktop upon smart card removal.,C:\Windows\System32\svchost.exe,b2a21dd4ad6ed25ca3440d6389675758,C:\Windows\system32\svchost.exe -k netsvcs,SERVICE_WIN32_SHARE_PROCESS,C:\Windows\System32\certprop.dll,true,true,The file is signed and the signature was verified.,Microsoft Windows,Microsoft Windows Production PCA 2011
EE280KUW,wcifs,Windows Container Isolation,Provides a virtual filesystem view for processes running within Windows Containers,C:\Windows\System32\drivers\wcifs.sys,e76ac5b1a668457d8181e2660ae0a444,\SystemRoot\system32\drivers\wcifs.sys,SERVICE_FILE_SYSTEM_DRIVER,,true,true,The file is signed and the signature was verified.,Microsoft Windows,Microsoft Windows Production PCA 2011
EE280KUW,WindowsTrustedRT,Windows Trusted Execution Environment Class Extension,,C:\Windows\System32\drivers\WindowsTrustedRT.sys,a4b6d39424cf882ede34a881bb9bd5fb,\SystemRoot\system32\drivers\WindowsTrustedRT.sys,SERVICE_KERNEL_DRIVER,,true,true,The file is signed and the signature was verified.,Microsoft Windows,Microsoft Windows Production PCA 2011
EE280KUW,WUDFRd,WUDFRd,,C:\Windows\System32\drivers\WUDFRd.sys,14bcd0c7af3541db6f8b38da3a96d8c1,\SystemRoot\System32\drivers\WUDFRd.sys,SERVICE_KERNEL_DRIVER,,true,true,The file is signed and the signature was verified.,Microsoft Windows,Microsoft Windows Production PCA 2011
EE280KUW,TermService,Remote Desktop Services,Allows users to connect interactively to a remote computer. Remote Desktop and Remote Desktop Session Host Server depend on this service.  To prevent remote use of this computer  clear the checkboxes on the Remote tab of the System properties control panel item.,C:\Windows\System32\svchost.exe,b2a21dd4ad6ed25ca3440d6389675758,C:\Windows\System32\svchost.exe -k termsvcs,SERVICE_WIN32_SHARE_PROCESS,C:\Windows\System32\termsrv.dll,true,true,The file is signed and the signature was verified.,Microsoft Windows,Microsoft Windows Production PCA 2011
EE280KUW,tdx,NetIO Legacy TDI Support Driver,NetIO Legacy TDI Support Driver,C:\Windows\System32\drivers\tdx.sys,20b4da13b9e47253364e23b835e31095,\SystemRoot\system32\DRIVERS\tdx.sys,SERVICE_KERNEL_DRIVER,,true,true,The file is signed and the signature was verified.,Microsoft Windows,Microsoft Windows Production PCA 2011
EE280KUW,WpnService,Windows Push Notifications System Service,This service runs in session 0 and hosts the notification platform and connection provider which handles the connection between the device and WNS server.,C:\Windows\System32\svchost.exe,b2a21dd4ad6ed25ca3440d6389675758,C:\Windows\system32\svchost.exe -k netsvcs,SERVICE_WIN32_SHARE_PROCESS,C:\Windows\System32\WpnService.dll,true,true,The file is signed and the signature was verified.,Microsoft Windows,Microsoft Windows Production PCA 2011
EE280KUW,USBXHCI,USB xHCI Compliant Host Controller,,C:\Windows\System32\drivers\USBXHCI.SYS,eaa5a9b1896d83a8aac1fecd2b77b6f4,\SystemRoot\System32\drivers\USBXHCI.SYS,SERVICE_KERNEL_DRIVER,,true,true,The file is signed and the signature was verified.,Microsoft Windows,Microsoft Windows Production PCA 2011
EE280KUW,BasicDisplay,BasicDisplay,,C:\Windows\System32\drivers\BasicDisplay.sys,f53d63ee605dc6d6dae44df2da9f3244,\SystemRoot\System32\drivers\BasicDisplay.sys,SERVICE_KERNEL_DRIVER,,true,true,The file is signed and the signature was verified.,Microsoft Windows,Microsoft Windows Production PCA 2011
EE280KUW,ql2300i,QLogic Fibre Channel STOR Miniport Inbox Driver (wx64),,C:\Windows\System32\drivers\ql2300i.sys,673e0df5af82b4df0b51c1367e417ffb,\SystemRoot\System32\drivers\ql2300i.sys,SERVICE_KERNEL_DRIVER,,true,true,The file is signed and the signature was verified.,Microsoft Windows,Microsoft Windows Production PCA 2011
EE280KUW,npsvctrig,Named pipe service trigger provider,,C:\Windows\System32\drivers\npsvctrig.sys,8ee6efc7decaad4a4f2f58280d35b4fd,\SystemRoot\System32\drivers\npsvctrig.sys,SERVICE_KERNEL_DRIVER,,true,true,The file is signed and the signature was verified.,Microsoft Windows,Microsoft Windows Production PCA 2011
EE280KUW,mfefirek,McAfee Inc. mfefirek,,C:\Windows\System32\drivers\mfefirek.sys,a8b69306086acb2ead459f6bd1a9379b,system32\drivers\mfefirek.sys,SERVICE_KERNEL_DRIVER,,true,true,The file is signed and the signature was verified.,Microsoft Windows Hardware Compatibility Publisher,Microsoft Windows Hardware Compatibility PCA
EE280KUW,rdbss,Redirected Buffering Sub System,Provides the framework for network mini-redirectors,C:\Windows\System32\drivers\rdbss.sys,23dd40ffda0d50a163351883a4197a9f,system32\DRIVERS\rdbss.sys,SERVICE_FILE_SYSTEM_DRIVER,,true,true,The file is signed and the signature was verified.,Microsoft Windows,Microsoft Windows Production PCA 2011
EE280KUW,vhdmp,vhdmp,,C:\Windows\System32\drivers\vhdmp.sys,8b3e001fc15756ea8171a6e7a8fad13a,\SystemRoot\System32\drivers\vhdmp.sys,SERVICE_KERNEL_DRIVER,,true,true,The file is signed and the signature was verified.,Microsoft Windows,Microsoft Windows Production PCA 2011
EE280KUW,AmdPPM,AMD Processor Driver,,C:\Windows\System32\drivers\amdppm.sys,a91d64adf8e4f02bbedec24dd1adbaf2,\SystemRoot\System32\drivers\amdppm.sys,SERVICE_KERNEL_DRIVER,,true,true,The file is signed and the signature was verified.,Microsoft Windows,Microsoft Windows Production PCA 2011
EE280KUW,mfemms,McAfee Service Controller,Manages McAfee Services,C:\Program Files\Common Files\McAfee\SystemCore\mfemms.exe,5ba889f538409d5e772758011f4a5364,C:\Program Files\Common Files\McAfee\SystemCore\mfemms.exe,SERVICE_WIN32_OWN_PROCESS,,true,true,The file is signed and the signature was verified.,"""McAfee",VeriSign Class 3 Code Signing 2010 CA
EE280KUW,usbohci,Microsoft USB Open Host Controller Miniport Driver,,C:\Windows\System32\drivers\usbohci.sys,80b2f0a26d31c099479d5dbe6ff7a455,\SystemRoot\System32\drivers\usbohci.sys,SERVICE_KERNEL_DRIVER,,true,true,The file is signed and the signature was verified.,Microsoft Windows,Microsoft Windows Production PCA 2011
EE280KUW,McAPExe,McAfee AP Service,McAfee AP Service,C:\Program Files\Common Files\McAfee\VSCore_18_6\mcapexe.exe,b6583d141a87fe22fe27073b3a15e9d9,"C:\Program Files\Common Files\McAfee\VSCore_18_6\McApExe.exe""""""",SERVICE_WIN32_OWN_PROCESS,,true,true,The file is signed and the signature was verified.,"""McAfee",Symantec Class 3 SHA256 Code Signing CA
EE280KUW,WPDBusEnum,Portable Device Enumerator Service,Enforces group policy for removable mass-storage devices. Enables applications such as Windows Media Player and Image Import Wizard to transfer and synchronize content using removable mass-storage devices.,C:\Windows\System32\svchost.exe,b2a21dd4ad6ed25ca3440d6389675758,C:\Windows\system32\svchost.exe -k LocalSystemNetworkRestricted,SERVICE_WIN32_SHARE_PROCESS,C:\Windows\System32\wpdbusenum.dll,true,true,The file is signed and the signature was verified.,Microsoft Windows,Microsoft Windows Production PCA 2011
EE280KUW,MpsSvc,Windows Firewall,Windows Firewall helps protect your computer by preventing unauthorized users from gaining access to your computer through the Internet or a network.,C:\Windows\System32\svchost.exe,b2a21dd4ad6ed25ca3440d6389675758,C:\Windows\system32\svchost.exe -k LocalServiceNoNetwork,SERVICE_WIN32_SHARE_PROCESS,C:\Windows\System32\MPSSVC.dll,true,true,The file is signed and the signature was verified.,Microsoft Windows,Microsoft Windows Production PCA 2011
EE280KUW,UdeCx,USB Device Emulation Support Library,,C:\Windows\System32\drivers\Udecx.sys,237e341d1210ed1c9d19c5c90fd16b7d,system32\drivers\udecx.sys,SERVICE_KERNEL_DRIVER,,true,true,The file is signed and the signature was verified.,Microsoft Windows,Microsoft Windows Production PCA 2011
EE280KUW,wanarp,Remote Access IP ARP Driver,Remote Access IP ARP Driver,C:\Windows\System32\drivers\wanarp.sys,c77b9cff18df4f5b0a3d96b344c340f7,System32\DRIVERS\wanarp.sys,SERVICE_KERNEL_DRIVER,,true,true,The file is signed and the signature was verified.,Microsoft Windows,Microsoft Windows Production PCA 2011
EE280KUW,WinVerbs,WinVerbs Service,,C:\Windows\System32\drivers\winverbs.sys,c9e19ad4e0a298f6df79794a9635afcd,\SystemRoot\System32\drivers\winverbs.sys,SERVICE_KERNEL_DRIVER,,true,true,The file is signed and the signature was verified.,Microsoft Windows,Microsoft Windows Production PCA 2011
EE280KUW,SensorDataService,Sensor Data Service,Delivers data from a variety of sensors,C:\Windows\System32\SensorDataService.exe,59634a3e6c1e949db6a2a6ec1e5fcb94,C:\Windows\System32\SensorDataService.exe,SERVICE_WIN32_OWN_PROCESS,,true,true,The file is signed and the signature was verified.,Microsoft Windows,Microsoft Windows Production PCA 2011
EE280KUW,srv,Server SMB 1.xxx Driver,Enables connectivity from Windows XP and earlier clients,C:\Windows\System32\drivers\srv.sys,e26465e75fec0f8baf755ffe09c9e0c8,System32\DRIVERS\srv.sys,SERVICE_FILE_SYSTEM_DRIVER,,true,true,The file is signed and the signature was verified.,Microsoft Windows,Microsoft Windows Production PCA 2011
EE280KUW,vmicheartbeat,Hyper-V Heartbeat Service,Monitors the state of this virtual machine by reporting a heartbeat at regular intervals. This service helps you identify running virtual machines that have stopped responding.,C:\Windows\System32\svchost.exe,b2a21dd4ad6ed25ca3440d6389675758,C:\Windows\system32\svchost.exe -k ICService,SERVICE_WIN32_SHARE_PROCESS,C:\Windows\System32\icsvc.dll,true,true,The file is signed and the signature was verified.,Microsoft Windows,Microsoft Windows Production PCA 2011
EE280KUW,mfefire,McAfee Firewall Core Service,Provides firewall services to McAfee products,C:\Program Files\Common Files\McAfee\SystemCore\mfefire.exe,257a7302b86685c0b46439a99be31b64,"C:\Program Files\Common Files\McAfee\SystemCore\mfefire.exe""""""",SERVICE_WIN32_OWN_PROCESS,,true,true,The file is signed and the signature was verified.,"""McAfee",VeriSign Class 3 Code Signing 2010 CA
