hostname,name,descriptivename,description,path,md5,arguments,type,servicedll,pathsignatureexists,pathsignatureverified,pathsignaturedescription,pathcertificatesubject,pathcertificateissuer
EE280KUW,RpcSs,Remote Procedure Call (RPC),The RPCSS service is the Service Control Manager for COM and DCOM servers. It performs object activations requests  object exporter resolutions and distributed garbage collection for COM and DCOM servers. If this service is stopped or disabled  programs using COM or DCOM will not function properly. It is strongly recommended that you have the RPCSS service running.,C:\Windows\System32\svchost.exe,b2a21dd4ad6ed25ca3440d6389675758,C:\Windows\system32\svchost.exe -k rpcss,SERVICE_WIN32_SHARE_PROCESS,C:\Windows\System32\rpcss.dll,true,true,The file is signed and the signature was verified.,Microsoft Windows,Microsoft Windows Production PCA 2011
EE280KUW,MSDTC,Distributed Transaction Coordinator,Coordinates transactions that span multiple resource managers  such as databases  message queues  and file systems. If this service is stopped  these transactions will fail. If this service is disabled  any services that explicitly depend on it will fail to start.,C:\Windows\System32\msdtc.exe,057739df3ecdd484e29c5073adc32aa0,C:\Windows\System32\msdtc.exe,SERVICE_WIN32_OWN_PROCESS,,true,true,The file is signed and the signature was verified.,Microsoft Windows,Microsoft Windows Production PCA 2011
EE280KUW,CmBatt,Microsoft ACPI Control Method Battery Driver,,C:\Windows\System32\drivers\CmBatt.sys,be0215dd9e6c6d87b86efb51fbc42617,\SystemRoot\System32\drivers\CmBatt.sys,SERVICE_KERNEL_DRIVER,,true,true,The file is signed and the signature was verified.,Microsoft Windows,Microsoft Windows Production PCA 2011
EE280KUW,sermouse,Serial Mouse Driver,,C:\Windows\System32\drivers\sermouse.sys,43e924c1803e98cbc2bb807cfba1ac3f,\SystemRoot\System32\drivers\sermouse.sys,SERVICE_KERNEL_DRIVER,,true,true,The file is signed and the signature was verified.,Microsoft Windows,Microsoft Windows Production PCA 2011
EE280KUW,pdc,pdc,Power Dependency Coordinator Driver,C:\Windows\System32\drivers\pdc.sys,404f173d8e5a6574ff9083aec63f468b,\SystemRoot\system32\drivers\pdc.sys,SERVICE_KERNEL_DRIVER,,true,true,The file is signed and the signature was verified.,Microsoft Windows,Microsoft Windows Production PCA 2011
EE280KUW,iScsiPrt,iScsiPort Driver,,C:\Windows\System32\drivers\msiscsi.sys,3036052079acb6e4acdb76c1a48ef6d9,\SystemRoot\System32\drivers\msiscsi.sys,SERVICE_KERNEL_DRIVER,,true,true,The file is signed and the signature was verified.,Microsoft Windows,Microsoft Windows Production PCA 2011
EE280KUW,Processor,Processor Driver,,C:\Windows\System32\drivers\processr.sys,528a31f8b9a1dd4c699a382415a3b29f,\SystemRoot\System32\drivers\processr.sys,SERVICE_KERNEL_DRIVER,,true,true,The file is signed and the signature was verified.,Microsoft Windows,Microsoft Windows Production PCA 2011
EE280KUW,nvstor,nvstor,,C:\Windows\System32\drivers\nvstor.sys,f3c4621a340a552143b8a716ce6d0e28,\SystemRoot\System32\drivers\nvstor.sys,SERVICE_KERNEL_DRIVER,,true,true,The file is signed and the signature was verified.,Microsoft Windows,Microsoft Windows Production PCA 2011
EE280KUW,UEFI,Microsoft UEFI Driver,,C:\Windows\System32\drivers\uefi.sys,362fc2c2dbd9d05324e18e4c1f4679a5,\SystemRoot\System32\drivers\UEFI.sys,SERVICE_KERNEL_DRIVER,,true,true,The file is signed and the signature was verified.,Microsoft Windows,Microsoft Windows Production PCA 2011
EE280KUW,AmdK8,AMD K8 Processor Driver,,C:\Windows\System32\drivers\amdk8.sys,53d3f354e72564672c3696e0e614e297,\SystemRoot\System32\drivers\amdk8.sys,SERVICE_KERNEL_DRIVER,,true,true,The file is signed and the signature was verified.,Microsoft Windows,Microsoft Windows Production PCA 2011
EE280KUW,nvraid,nvraid,,C:\Windows\System32\drivers\nvraid.sys,9fb0108a59b785cab53b9634fd3fcb79,\SystemRoot\System32\drivers\nvraid.sys,SERVICE_KERNEL_DRIVER,,true,true,The file is signed and the signature was verified.,Microsoft Windows,Microsoft Windows Production PCA 2011
EE280KUW,COMSysApp,COM+ System Application,Manages the configuration and tracking of Component Object Model (COM)+-based components. If the service is stopped  most COM+-based components will not function properly. If this service is disabled  any services that explicitly depend on it will fail to start.,C:\Windows\System32\dllhost.exe,b133e6406e7a11c5a3eeecff6d3cddc5,C:\Windows\system32\dllhost.exe /Processid:{02D4B3F1-FD88-11D1-960D-00805FC79235},SERVICE_WIN32_OWN_PROCESS,,true,true,The file is signed and the signature was verified.,Microsoft Windows,Microsoft Windows Production PCA 2011
EE280KUW,wanarpv6,Remote Access IPv6 ARP Driver,Remote Access IPv6 ARP Driver,C:\Windows\System32\drivers\wanarp.sys,c77b9cff18df4f5b0a3d96b344c340f7,System32\DRIVERS\wanarp.sys,SERVICE_KERNEL_DRIVER,,true,true,The file is signed and the signature was verified.,Microsoft Windows,Microsoft Windows Production PCA 2011
EE280KUW,mountmgr,Mount Point Manager,Driver responsible with maintaining persistent drive letters and names for volumes,C:\Windows\System32\drivers\mountmgr.sys,674eff77c7892584a2798e19960e3e76,\SystemRoot\System32\drivers\mountmgr.sys,SERVICE_KERNEL_DRIVER,,true,true,The file is signed and the signature was verified.,Microsoft Windows,Microsoft Windows Production PCA 2011
EE280KUW,vwifibus,vwifibus,,C:\Windows\System32\drivers\vwifibus.sys,ab33528eb3d488961ca894b5f94145d3,\SystemRoot\System32\drivers\vwifibus.sys,SERVICE_KERNEL_DRIVER,,,,,,
EE280KUW,volmgrx,Dynamic Volume Manager,Extension of the volume manager driver that manages software RAID volumes (spanned  striped  mirrored  RAID-5) on dynamic disks,C:\Windows\System32\drivers\volmgrx.sys,88c02991e51bca38292e996f102b73e6,\SystemRoot\System32\drivers\volmgrx.sys,SERVICE_KERNEL_DRIVER,,true,true,The file is signed and the signature was verified.,Microsoft Windows,Microsoft Windows Production PCA 2011
EE280KUW,CscService,Offline Files,The Offline Files service performs maintenance activities on the Offline Files cache  responds to user logon and logoff events  implements the internals of the public API  and dispatches interesting events to those interested in Offline Files activities and changes in cache state.,C:\Windows\System32\svchost.exe,b2a21dd4ad6ed25ca3440d6389675758,C:\Windows\System32\svchost.exe -k LocalSystemNetworkRestricted,SERVICE_WIN32_SHARE_PROCESS,C:\Windows\System32\cscsvc.dll,true,true,The file is signed and the signature was verified.,Microsoft Windows,Microsoft Windows Production PCA 2011
EE280KUW,intelppm,Intel Processor Driver,,C:\Windows\System32\drivers\intelppm.sys,df435b0e5d322c9a7d9b644c32d3012c,\SystemRoot\System32\drivers\intelppm.sys,SERVICE_KERNEL_DRIVER,,true,true,The file is signed and the signature was verified.,Microsoft Windows,Microsoft Windows Production PCA 2011
EE280KUW,PerfHost,Performance Counter DLL Host,Enables remote users and 64-bit processes to query performance counters provided by 32-bit DLLs. If this service is stopped  only local users and 32-bit processes will be able to query performance counters provided by 32-bit DLLs.,C:\Windows\SysWOW64\perfhost.exe,bf000fa4c28be7e0b0729424de119b79,C:\Windows\SysWow64\perfhost.exe,SERVICE_WIN32_OWN_PROCESS,,true,true,The file is signed and the signature was verified.,Microsoft Windows,Microsoft Windows Production PCA 2011
EE280KUW,percsas3i,percsas3i,,C:\Windows\System32\drivers\percsas3i.sys,67d2fc86854a1b49043cbc5178228e13,\SystemRoot\System32\drivers\percsas3i.sys,SERVICE_KERNEL_DRIVER,,true,true,The file is signed and the signature was verified.,Microsoft Windows,Microsoft Windows Production PCA 2011
EE280KUW,SystemEventsBroker,System Events Broker,Coordinates execution of background work for WinRT application. If this service is stopped or disabled  then background work might not be triggered.,C:\Windows\System32\svchost.exe,b2a21dd4ad6ed25ca3440d6389675758,C:\Windows\system32\svchost.exe -k DcomLaunch,SERVICE_WIN32_SHARE_PROCESS,C:\Windows\System32\SystemEventsBrokerServer.dll,true,true,The file is signed and the signature was verified.,Microsoft Windows,Microsoft Windows Production PCA 2011
EE280KUW,DsmSvc,Device Setup Manager,Enables the detection  download and installation of device-related software. If this service is disabled  devices may be configured with outdated software  and may not work correctly.,C:\Windows\System32\svchost.exe,b2a21dd4ad6ed25ca3440d6389675758,C:\Windows\system32\svchost.exe -k netsvcs,SERVICE_WIN32_SHARE_PROCESS,C:\Windows\System32\DeviceSetupManager.dll,true,true,The file is signed and the signature was verified.,Microsoft Windows,Microsoft Windows Production PCA 2011
EE280KUW,BFE,Base Filtering Engine,The Base Filtering Engine (BFE) is a service that manages firewall and Internet Protocol security (IPsec) policies and implements user mode filtering. Stopping or disabling the BFE service will significantly reduce the security of the system. It will also result in unpredictable behavior in IPsec management and firewall applications.,C:\Windows\System32\svchost.exe,b2a21dd4ad6ed25ca3440d6389675758,C:\Windows\system32\svchost.exe -k LocalServiceNoNetwork,SERVICE_WIN32_SHARE_PROCESS,C:\Windows\System32\BFE.DLL,true,true,The file is signed and the signature was verified.,Microsoft Windows,Microsoft Windows Production PCA 2011
EE280KUW,IpFilterDriver,IP Traffic Filter Driver,IP Traffic Filter Driver,C:\Windows\System32\drivers\ipfltdrv.sys,a99324c59507a8cd1e17a695ff608415,system32\DRIVERS\ipfltdrv.sys,SERVICE_KERNEL_DRIVER,,true,true,The file is signed and the signature was verified.,Microsoft Windows,Microsoft Windows Production PCA 2011
EE280KUW,dmvsc,dmvsc,,C:\Windows\System32\drivers\dmvsc.sys,57997a093be529f27ec17824889049bc,\SystemRoot\System32\drivers\dmvsc.sys,SERVICE_KERNEL_DRIVER,,true,true,The file is signed and the signature was verified.,Microsoft Windows,Microsoft Windows Production PCA 2011
EE280KUW,NdisWan,Remote Access NDIS WAN Driver,Remote Access NDIS WAN Driver,C:\Windows\System32\drivers\ndiswan.sys,55a1d0083cffdf2492be9ca0fbae161f,\SystemRoot\System32\drivers\ndiswan.sys,SERVICE_KERNEL_DRIVER,,true,true,The file is signed and the signature was verified.,Microsoft Windows,Microsoft Windows Production PCA 2011
EE280KUW,hidserv,Human Interface Device Service,Activates and maintains the use of hot buttons on keyboards  remote controls  and other multimedia devices. It is recommended that you keep this service running.,C:\Windows\System32\svchost.exe,b2a21dd4ad6ed25ca3440d6389675758,C:\Windows\system32\svchost.exe -k LocalSystemNetworkRestricted,SERVICE_WIN32_SHARE_PROCESS,C:\Windows\System32\hidserv.dll,true,true,The file is signed and the signature was verified.,Microsoft Windows,Microsoft Windows Production PCA 2011
EE280KUW,TPM,TPM,TPM Driver,C:\Windows\System32\drivers\tpm.sys,27fbbfb0b2b887466b8d4d18a3acaf03,\SystemRoot\System32\drivers\tpm.sys,SERVICE_KERNEL_DRIVER,,true,true,The file is signed and the signature was verified.,Microsoft Windows,Microsoft Windows Production PCA 2011
EE280KUW,WinHttpAutoProxySvc,WinHTTP Web Proxy Auto-Discovery Service,WinHTTP implements the client HTTP stack and provides developers with a Win32 API and COM Automation component for sending HTTP requests and receiving responses. In addition  WinHTTP provides support for auto-discovering a proxy configuration via its implementation of the Web Proxy Auto-Discovery (WPAD) protocol.,C:\Windows\System32\svchost.exe,b2a21dd4ad6ed25ca3440d6389675758,C:\Windows\system32\svchost.exe -k LocalService,SERVICE_WIN32_SHARE_PROCESS,C:\Windows\System32\winhttp.dll,true,true,The file is signed and the signature was verified.,Microsoft Windows,Microsoft Windows Production PCA 2011
EE280KUW,Ufx01000,USB Function Class Extension,,C:\Windows\System32\drivers\ufx01000.sys,50a53c86337ab59d047f72264c5a064f,system32\drivers\ufx01000.sys,SERVICE_KERNEL_DRIVER,,true,true,The file is signed and the signature was verified.,Microsoft Windows,Microsoft Windows Production PCA 2011
EE280KUW,hidinterrupt,Common Driver for HID Buttons implemented with interrupts,,C:\Windows\System32\drivers\hidinterrupt.sys,07e510b8fc8cee0a173f8608b5ccc889,\SystemRoot\System32\drivers\hidinterrupt.sys,SERVICE_KERNEL_DRIVER,,true,true,The file is signed and the signature was verified.,Microsoft Windows,Microsoft Windows Production PCA 2011
EE280KUW,PEAUTH,PEAUTH,,C:\Windows\System32\drivers\PEAuth.sys,e4659e078f69a046d16e18092c1caa7c,system32\drivers\peauth.sys,SERVICE_KERNEL_DRIVER,,true,true,The file is signed and the signature was verified.,Microsoft Windows,Microsoft Windows Production PCA 2011
EE280KUW,tcpipreg,TCP/IP Registry Compatibility,Provides compatibility for legacy applications which interact with TCP/IP through the registry. If this service is stopped  certain applications may have impaired functionality.,C:\Windows\System32\drivers\tcpipreg.sys,6f37bf4b7135b88fc5e4856a906381fd,System32\drivers\tcpipreg.sys,SERVICE_KERNEL_DRIVER,,true,true,The file is signed and the signature was verified.,Microsoft Windows,Microsoft Windows Production PCA 2011
EE280KUW,TapiSrv,Telephony,Provides Telephony API (TAPI) support for programs that control telephony devices on the local computer and  through the LAN  on servers that are also running the service.,C:\Windows\System32\svchost.exe,b2a21dd4ad6ed25ca3440d6389675758,C:\Windows\System32\svchost.exe -k NetworkService,SERVICE_WIN32_SHARE_PROCESS,C:\Windows\System32\tapisrv.dll,true,true,The file is signed and the signature was verified.,Microsoft Windows,Microsoft Windows Production PCA 2011
EE280KUW,dam,Desktop Activity Moderator Driver,Controls activity of desktop applications,C:\Windows\System32\drivers\dam.sys,86dfb8678fdd1bea0d44677d832efd9a,system32\drivers\dam.sys,SERVICE_KERNEL_DRIVER,,true,true,The file is signed and the signature was verified.,Microsoft Windows,Microsoft Windows Production PCA 2011
EE280KUW,Mup,Mup,Multiple UNC Provider Driver,C:\Windows\System32\drivers\mup.sys,76446af1db85deb0a990e8fc2ce672b3,\SystemRoot\System32\Drivers\mup.sys,SERVICE_FILE_SYSTEM_DRIVER,,true,true,The file is signed and the signature was verified.,Microsoft Windows,Microsoft Windows Production PCA 2011
EE280KUW,PhoneSvc,Phone Service,Manages the telephony state on the device,C:\Windows\System32\svchost.exe,b2a21dd4ad6ed25ca3440d6389675758,C:\Windows\system32\svchost.exe -k LocalService,SERVICE_WIN32_SHARE_PROCESS,C:\Windows\System32\PhoneService.dll,true,true,The file is signed and the signature was verified.,Microsoft Windows,Microsoft Windows Production PCA 2011
EE280KUW,AppID,AppID Driver,Identifies an application and enforces software restriction policies.,C:\Windows\System32\drivers\appid.sys,ca698f305402841dbaa205c6e20f0dd6,system32\drivers\appid.sys,SERVICE_KERNEL_DRIVER,,true,true,The file is signed and the signature was verified.,Microsoft Windows,Microsoft Windows Production PCA 2011
EE280KUW,ahcache,Application Compatibility Cache,Cache Compatibility Data and Attributes for Individual PE File,C:\Windows\System32\drivers\ahcache.sys,238a51ed79264caee86adcbeb244b8d8,system32\DRIVERS\ahcache.sys,SERVICE_KERNEL_DRIVER,,true,true,The file is signed and the signature was verified.,Microsoft Windows,Microsoft Windows Production PCA 2011
EE280KUW,CertPropSvc,Certificate Propagation,Copies user certificates and root certificates from smart cards into the current user's certificate store  detects when a smart card is inserted into a smart card reader  and  if needed  installs the smart card Plug and Play minidriver.,C:\Windows\System32\svchost.exe,b2a21dd4ad6ed25ca3440d6389675758,C:\Windows\system32\svchost.exe -k netsvcs,SERVICE_WIN32_SHARE_PROCESS,C:\Windows\System32\certprop.dll,true,true,The file is signed and the signature was verified.,Microsoft Windows,Microsoft Windows Production PCA 2011
EE280KUW,HyperVideo,HyperVideo,,C:\Windows\System32\drivers\HyperVideo.sys,6cb935caa15c10b343e757a774e534b1,\SystemRoot\system32\DRIVERS\HyperVideo.sys,SERVICE_KERNEL_DRIVER,,true,true,The file is signed and the signature was verified.,Microsoft Windows,Microsoft Windows Production PCA 2011
EE280KUW,kbdclass,Keyboard Class Driver,,C:\Windows\System32\drivers\kbdclass.sys,de333806efb856b4272571902255853c,\SystemRoot\System32\drivers\kbdclass.sys,SERVICE_KERNEL_DRIVER,,true,true,The file is signed and the signature was verified.,Microsoft Windows,Microsoft Windows Production PCA 2011
EE280KUW,OneSyncSvc_6934d,Sync Host_6934d,This service synchronizes mail  contacts  calendar and various other user data. Mail and other applications dependent on this functionality will not work properly when this service is not running.,C:\Windows\System32\svchost.exe,b2a21dd4ad6ed25ca3440d6389675758,C:\Windows\system32\svchost.exe -k UnistackSvcGroup,SERVICE_WIN32_SHARE_PROCESS,,true,true,The file is signed and the signature was verified.,Microsoft Windows,Microsoft Windows Production PCA 2011
EE280KUW,RasPppoe,Remote Access PPPOE Driver,Remote Access PPPOE Driver,C:\Windows\System32\drivers\raspppoe.sys,f6e6e0dc93adc62f92ece39251992d11,\SystemRoot\System32\drivers\raspppoe.sys,SERVICE_KERNEL_DRIVER,,true,true,The file is signed and the signature was verified.,Microsoft Windows,Microsoft Windows Production PCA 2011
EE280KUW,nvme,nvme,,C:\Windows\System32\drivers\nvme.sys,919f96ead8e5e650f17275fa67447011,\SystemRoot\System32\drivers\nvme.sys,SERVICE_KERNEL_DRIVER,,true,true,The file is signed and the signature was verified.,Google Inc,Symantec Class 3 SHA256 Code Signing CA
EE280KUW,AppvVfs,AppvVfs,Microsoft App-V VFS Mini-Filter Driver,C:\Windows\System32\drivers\AppvVfs.sys,7c95332da421ba7d177471413e1cec16,\SystemRoot\system32\drivers\AppvVfs.sys,SERVICE_FILE_SYSTEM_DRIVER,,true,true,The file is signed and the signature was verified.,Microsoft Windows,Microsoft Windows Production PCA 2011
EE280KUW,LSI_SSS,LSI_SSS,,C:\Windows\System32\drivers\lsi_sss.sys,da273e6fc185441ed595ee69a1f8439c,\SystemRoot\System32\drivers\lsi_sss.sys,SERVICE_KERNEL_DRIVER,,true,true,The file is signed and the signature was verified.,Microsoft Windows,Microsoft Windows Production PCA 2011
EE280KUW,LSM,Local Session Manager,Core Windows Service that manages local user sessions. Stopping or disabling this service will result in system instability.,C:\Windows\System32\svchost.exe,b2a21dd4ad6ed25ca3440d6389675758,C:\Windows\system32\svchost.exe -k DcomLaunch,SERVICE_WIN32_SHARE_PROCESS,C:\Windows\System32\lsm.dll,true,true,The file is signed and the signature was verified.,Microsoft Windows,Microsoft Windows Production PCA 2011
EE280KUW,iaStorV,Intel RAID Controller Windows 7,,C:\Windows\System32\drivers\iaStorV.sys,5b555ebb9e283d27ae152162ebbd4b6c,\SystemRoot\System32\drivers\iaStorV.sys,SERVICE_KERNEL_DRIVER,,true,true,The file is signed and the signature was verified.,Microsoft Windows,Microsoft Windows Production PCA 2011
EE280KUW,IPNAT,IP Network Address Translator,,C:\Windows\System32\drivers\ipnat.sys,34adfad027306b6cf0218f6d7de2d9bf,System32\drivers\ipnat.sys,SERVICE_KERNEL_DRIVER,,true,true,The file is signed and the signature was verified.,Microsoft Windows,Microsoft Windows Production PCA 2011
EE280KUW,SiSRaid4,SiSRaid4,,C:\Windows\System32\drivers\sisraid4.sys,7b162cf0420332d02cd31620afba8e9a,\SystemRoot\System32\drivers\sisraid4.sys,SERVICE_KERNEL_DRIVER,,true,true,The file is signed and the signature was verified.,Microsoft Windows,Microsoft Windows Production PCA 2011
EE280KUW,i8042prt,i8042 Keyboard and PS/2 Mouse Port Driver,,C:\Windows\System32\drivers\i8042prt.sys,63aec1c7772282bec2738ff0bd0a89ee,\SystemRoot\System32\drivers\i8042prt.sys,SERVICE_KERNEL_DRIVER,,true,true,The file is signed and the signature was verified.,Microsoft Windows,Microsoft Windows Production PCA 2011
EE280KUW,sppsvc,Software Protection,Enables the download  installation and enforcement of digital licenses for Windows and Windows applications. If the service is disabled  the operating system and licensed applications may run in a notification mode. It is strongly recommended that you not disable the Software Protection service.,C:\Windows\System32\sppsvc.exe,932a68552dd45ee36a65d4f08fecfab5,C:\Windows\system32\sppsvc.exe,SERVICE_WIN32_OWN_PROCESS,,true,true,The file is signed and the signature was verified.,Microsoft Windows,Microsoft Windows Production PCA 2011
EE280KUW,UrsChipidea,Chipidea USB Role-Switch Driver,,C:\Windows\System32\drivers\urschipidea.sys,55243d34f34268eaeb52d5169f7d2872,\SystemRoot\System32\drivers\urschipidea.sys,SERVICE_KERNEL_DRIVER,,true,true,The file is signed and the signature was verified.,Microsoft Windows,Microsoft Windows Production PCA 2011
EE280KUW,ql40xx2i,QLogic iSCSI Miniport Inbox Driver,,C:\Windows\System32\drivers\ql40xx2i.sys,b7fe7943f770e7f2fecaea199817671d,\SystemRoot\System32\drivers\ql40xx2i.sys,SERVICE_KERNEL_DRIVER,,true,true,The file is signed and the signature was verified.,Microsoft Windows,Microsoft Windows Production PCA 2011
EE280KUW,lltdio,Link-Layer Topology Discovery Mapper I/O Driver,Link-Layer Topology Discovery Mapper I/O Driver,C:\Windows\System32\drivers\lltdio.sys,bf2efb329195b2d4a74e0d7a88312525,system32\drivers\lltdio.sys,SERVICE_KERNEL_DRIVER,,true,true,The file is signed and the signature was verified.,Microsoft Windows,Microsoft Windows Production PCA 2011
EE280KUW,megasas2i,megasas2i,,C:\Windows\System32\drivers\MegaSas2i.sys,ca0eb6d7ec9cdb92014419bccb079452,\SystemRoot\System32\drivers\MegaSas2i.sys,SERVICE_KERNEL_DRIVER,,true,true,The file is signed and the signature was verified.,Microsoft Windows,Microsoft Windows Production PCA 2011
EE280KUW,amdxata,amdxata,,C:\Windows\System32\drivers\amdxata.sys,54d4224ad517f682b8f424b44ab9fce2,\SystemRoot\System32\drivers\amdxata.sys,SERVICE_KERNEL_DRIVER,,true,true,The file is signed and the signature was verified.,Microsoft Windows,Microsoft Windows Production PCA 2011
EE280KUW,elxfcoe,elxfcoe,,C:\Windows\System32\drivers\elxfcoe.sys,477250a7e8157d5e99a4c57e84e66030,\SystemRoot\System32\drivers\elxfcoe.sys,SERVICE_KERNEL_DRIVER,,true,true,The file is signed and the signature was verified.,Microsoft Windows,Microsoft Windows Production PCA 2011
EE280KUW,TsUsbGD,Remote Desktop Generic USB Device,,C:\Windows\System32\drivers\TsUsbGD.sys,2809055ba28c7b986ef4b50b4c59e145,\SystemRoot\System32\drivers\TsUsbGD.sys,SERVICE_KERNEL_DRIVER,,true,true,The file is signed and the signature was verified.,Microsoft Windows,Microsoft Windows Production PCA 2011
EE280KUW,mfesapsn,McAfee Process Start Notification Service,,C:\Program Files\McAfee\WebAdvisor\mfesapsn.sys,7a1d9aa95c7e2cb78ef64b45d3603e59,\??\C:\Program Files\McAfee\WebAdvisor\mfesapsn.sys,SERVICE_KERNEL_DRIVER,,true,true,The file is signed and the signature was verified.,"""McAfee",VeriSign Class 3 Code Signing 2010 CA
EE280KUW,storflt,Microsoft Hyper-V Storage Accelerator,,C:\Windows\System32\drivers\vmstorfl.sys,0ea22178dc8ecdd0d773c20eb3bc373a,\SystemRoot\System32\drivers\vmstorfl.sys,SERVICE_KERNEL_DRIVER,,true,true,The file is signed and the signature was verified.,Microsoft Windows,Microsoft Windows Production PCA 2011
EE280KUW,storqosflt,Storage QoS Filter Driver,Provides Quality of Service for storage I/O traffic.,C:\Windows\System32\drivers\storqosflt.sys,eff444eb220b53a44e043281eb5b78d6,system32\drivers\storqosflt.sys,SERVICE_FILE_SYSTEM_DRIVER,,true,true,The file is signed and the signature was verified.,Microsoft Windows,Microsoft Windows Production PCA 2011
EE280KUW,usbehci,Microsoft USB 2.0 Enhanced Host Controller Miniport Driver,,C:\Windows\System32\drivers\usbehci.sys,3c9b3d3a420dcf40cbcd06c043361457,\SystemRoot\System32\drivers\usbehci.sys,SERVICE_KERNEL_DRIVER,,true,true,The file is signed and the signature was verified.,Microsoft Windows,Microsoft Windows Production PCA 2011
EE280KUW,VerifierExt,VerifierExt,,C:\Windows\System32\drivers\VerifierExt.sys,68ea4d491564569cf39f0f91a62c9fb2,system32\drivers\VerifierExt.sys,SERVICE_KERNEL_DRIVER,,true,true,The file is signed and the signature was verified.,Microsoft Windows,Microsoft Windows Production PCA 2011
EE280KUW,defragsvc,Optimize drives,Helps the computer run more efficiently by optimizing files on storage drives.,C:\Windows\System32\svchost.exe,b2a21dd4ad6ed25ca3440d6389675758,C:\Windows\system32\svchost.exe -k defragsvc,SERVICE_WIN32_OWN_PROCESS,C:\Windows\System32\defragsvc.dll,true,true,The file is signed and the signature was verified.,Microsoft Windows,Microsoft Windows Production PCA 2011
EE280KUW,SerCx,Serial UART Support Library,,C:\Windows\System32\drivers\SerCx.sys,2a91ff2e716d6311d4a421f2a3d35d03,system32\drivers\SerCx.sys,SERVICE_KERNEL_DRIVER,,true,true,The file is signed and the signature was verified.,Microsoft Windows,Microsoft Windows Production PCA 2011
EE280KUW,usbhub,Microsoft USB Standard Hub Driver,,C:\Windows\System32\drivers\usbhub.sys,b504ba9652359b17522b86e8cb26643f,\SystemRoot\System32\drivers\usbhub.sys,SERVICE_KERNEL_DRIVER,,true,true,The file is signed and the signature was verified.,Microsoft Windows,Microsoft Windows Production PCA 2011
EE280KUW,ufxsynopsys,USB Synopsys Controller,,C:\Windows\System32\drivers\ufxsynopsys.sys,f0a77732d31c04f02425c35a9b33fefb,\SystemRoot\System32\drivers\ufxsynopsys.sys,SERVICE_KERNEL_DRIVER,,true,true,The file is signed and the signature was verified.,Microsoft Windows,Microsoft Windows Production PCA 2011
EE280KUW,vmickvpexchange,Hyper-V Data Exchange Service,Provides a mechanism to exchange data between the virtual machine and the operating system running on the physical computer.,C:\Windows\System32\svchost.exe,b2a21dd4ad6ed25ca3440d6389675758,C:\Windows\system32\svchost.exe -k LocalSystemNetworkRestricted,SERVICE_WIN32_SHARE_PROCESS,C:\Windows\System32\icsvc.dll,true,true,The file is signed and the signature was verified.,Microsoft Windows,Microsoft Windows Production PCA 2011
