hostname,name,descriptivename,description,path,md5,arguments,type,servicedll,pathsignatureexists,pathsignatureverified,pathsignaturedescription,pathcertificatesubject,pathcertificateissuer
EE280KUW,FrameServer,Windows Camera Frame Server,Enables multiple clients to access video frames from camera devices.,C:\Windows\System32\svchost.exe,b2a21dd4ad6ed25ca3440d6389675758,C:\Windows\System32\svchost.exe -k Camera,SERVICE_WIN32_SHARE_PROCESS,C:\Windows\System32\FrameServer.dll,true,true,The file is signed and the signature was verified.,Microsoft Windows,Microsoft Windows Production PCA 2011
EE280KUW,UALSVC,User Access Logging Service,This service logs unique client access requests  in the form of IP addresses and user names  of installed products and roles on the local server. This information can be queried  via Powershell  by administrators needing to quantify client demand of server software for offline Client Access License (CAL) management. If the service is disabled  client requests will not be logged and will not be retrievable via Powershell queries. Stopping the service will not affect query of historical data (see supporting documentation for steps to delete historical data). The local system administrator must consult his  or her  Windows Server license terms to determine the number of CALs that are required for the server software to be appropriately licensed; use of the UAL service and data does not alter this obligation.,C:\Windows\System32\svchost.exe,b2a21dd4ad6ed25ca3440d6389675758,C:\Windows\system32\svchost.exe -k LocalSystemNetworkRestricted,SERVICE_WIN32_SHARE_PROCESS,C:\Windows\System32\ualsvc.dll,true,true,The file is signed and the signature was verified.,Microsoft Windows,Microsoft Windows Production PCA 2011
EE280KUW,ws2ifsl,Winsock IFS Driver,Winsock IFS Driver,C:\Windows\System32\drivers\ws2ifsl.sys,b034833879f6374bef099409e49e2c69,\SystemRoot\system32\drivers\ws2ifsl.sys,SERVICE_KERNEL_DRIVER,,true,true,The file is signed and the signature was verified.,Microsoft Windows,Microsoft Windows Production PCA 2011
EE280KUW,kdnic,Microsoft Kernel Debug Network Miniport (NDIS 6.20),,C:\Windows\System32\drivers\kdnic.sys,60eb4e20f02b79a2c7c1d130fddf0700,\SystemRoot\System32\drivers\kdnic.sys,SERVICE_KERNEL_DRIVER,,true,true,The file is signed and the signature was verified.,Microsoft Windows,Microsoft Windows Production PCA 2011
EE280KUW,Psched,QoS Packet Scheduler,QoS Packet Scheduler,C:\Windows\System32\drivers\pacer.sys,a13ab4752e2af21797a820d276981899,System32\drivers\pacer.sys,SERVICE_KERNEL_DRIVER,,true,true,The file is signed and the signature was verified.,Microsoft Windows,Microsoft Windows Production PCA 2011
EE280KUW,atapi,IDE Channel,,C:\Windows\System32\drivers\atapi.sys,0fda5ff7d1c601e07536e0886d1e5544,\SystemRoot\System32\drivers\atapi.sys,SERVICE_KERNEL_DRIVER,,true,true,The file is signed and the signature was verified.,Microsoft Windows,Microsoft Windows Production PCA 2011
EE280KUW,RasAcd,Remote Access Auto Connection Driver,Remote Access Auto Connection Driver,C:\Windows\System32\drivers\rasacd.sys,513e09ff6d037837b5f701e7a45226bf,System32\DRIVERS\rasacd.sys,SERVICE_KERNEL_DRIVER,,true,true,The file is signed and the signature was verified.,Microsoft Windows,Microsoft Windows Production PCA 2011
EE280KUW,cht4vbd,Chelsio Virtual Bus Driver,,C:\Windows\System32\drivers\cht4vx64.sys,96d9168681822deee637a80c93167d8c,\SystemRoot\System32\drivers\cht4vx64.sys,SERVICE_KERNEL_DRIVER,,true,true,The file is signed and the signature was verified.,Microsoft Windows,Microsoft Windows Production PCA 2011
EE280KUW,AsyncMac,RAS Asynchronous Media Driver,RAS Asynchronous Media Driver,C:\Windows\System32\drivers\asyncmac.sys,8668867a923d652509a65bb07667c4a6,\SystemRoot\System32\drivers\asyncmac.sys,SERVICE_KERNEL_DRIVER,,true,true,The file is signed and the signature was verified.,Microsoft Windows,Microsoft Windows Production PCA 2011
EE280KUW,SstpSvc,Secure Socket Tunneling Protocol Service,Provides support for the Secure Socket Tunneling Protocol (SSTP) to connect to remote computers using VPN. If this service is disabled  users will not be able to use SSTP to access remote servers.,C:\Windows\System32\svchost.exe,b2a21dd4ad6ed25ca3440d6389675758,C:\Windows\system32\svchost.exe -k LocalService,SERVICE_WIN32_SHARE_PROCESS,C:\Windows\System32\sstpsvc.dll,true,true,The file is signed and the signature was verified.,Microsoft Windows,Microsoft Windows Production PCA 2011
EE280KUW,Ucx01000,USB Host Support Library,,C:\Windows\System32\drivers\Ucx01000.sys,567737a6931fc1c20748cd78b042bb8e,system32\drivers\ucx01000.sys,SERVICE_KERNEL_DRIVER,,true,true,The file is signed and the signature was verified.,Microsoft Windows,Microsoft Windows Production PCA 2011
EE280KUW,vmictimesync,Hyper-V Time Synchronization Service,Synchronizes the system time of this virtual machine with the system time of the physical computer.,C:\Windows\System32\svchost.exe,b2a21dd4ad6ed25ca3440d6389675758,C:\Windows\system32\svchost.exe -k LocalServiceNetworkRestricted,SERVICE_WIN32_SHARE_PROCESS,C:\Windows\System32\icsvc.dll,true,true,The file is signed and the signature was verified.,Microsoft Windows,Microsoft Windows Production PCA 2011
EE280KUW,Netlogon,Netlogon,Maintains a secure channel between this computer and the domain controller for authenticating users and services. If this service is stopped  the computer may not authenticate users and services and the domain controller cannot register DNS records. If this service is disabled  any services that explicitly depend on it will fail to start.,C:\Windows\System32\lsass.exe,45648ffaef7fc8a07831d8d996d23212,C:\Windows\system32\lsass.exe,SERVICE_WIN32_SHARE_PROCESS,C:\Windows\System32\netlogon.dll,true,true,The file is signed and the signature was verified.,Microsoft Windows,Microsoft Windows Production PCA 2011
EE280KUW,PimIndexMaintenanceSvc_6934d,Contact Data_6934d,Indexes contact data for fast contact searching. If you stop or disable this service  contacts might be missing from your search results.,C:\Windows\System32\svchost.exe,b2a21dd4ad6ed25ca3440d6389675758,C:\Windows\system32\svchost.exe -k UnistackSvcGroup,SERVICE_WIN32_SHARE_PROCESS,,true,true,The file is signed and the signature was verified.,Microsoft Windows,Microsoft Windows Production PCA 2011
EE280KUW,mfencbdc,McAfee LLC. mfencbdc,McAfee Content driver Copyright (C) McAfee LLC  2018. All rights reserved.,C:\Windows\System32\drivers\mfencbdc.sys,165e407f0d78aca083a773542dee60b7,system32\DRIVERS\mfencbdc.sys,SERVICE_KERNEL_DRIVER,,true,true,The file is signed and the signature was verified.,Microsoft Windows Hardware Compatibility Publisher,Microsoft Windows Hardware Compatibility PCA
EE280KUW,UcmCx0101,USB Connector Manager KMDF Class Extension,,C:\Windows\System32\drivers\UcmCx.sys,04f80122810e9cd3808d8a14999f062d,System32\Drivers\UcmCx.sys,SERVICE_KERNEL_DRIVER,,true,true,The file is signed and the signature was verified.,Microsoft Windows,Microsoft Windows Production PCA 2011
EE280KUW,volmgr,Volume Manager Driver,,C:\Windows\System32\drivers\volmgr.sys,3fbc180a8dd4647e737159b854c10c8f,\SystemRoot\System32\drivers\volmgr.sys,SERVICE_KERNEL_DRIVER,,true,true,The file is signed and the signature was verified.,Microsoft Windows,Microsoft Windows Production PCA 2011
EE280KUW,icssvc,Windows Mobile Hotspot Service,Provides the ability to share a cellular data connection with another device.,C:\Windows\System32\svchost.exe,b2a21dd4ad6ed25ca3440d6389675758,C:\Windows\system32\svchost.exe -k LocalServiceNetworkRestricted,SERVICE_WIN32_SHARE_PROCESS,C:\Windows\System32\tetheringservice.dll,true,true,The file is signed and the signature was verified.,Microsoft Windows,Microsoft Windows Production PCA 2011
EE280KUW,WiaRpc,Still Image Acquisition Events,Launches applications associated with still image acquisition events.,C:\Windows\System32\svchost.exe,b2a21dd4ad6ed25ca3440d6389675758,C:\Windows\system32\svchost.exe -k LocalSystemNetworkRestricted,SERVICE_WIN32_SHARE_PROCESS,C:\Windows\System32\wiarpc.dll,true,true,The file is signed and the signature was verified.,Microsoft Windows,Microsoft Windows Production PCA 2011
EE280KUW,NdisTapi,Remote Access NDIS TAPI Driver,Remote Access NDIS TAPI Driver,C:\Windows\System32\drivers\ndistapi.sys,c5776295ebbee1c5f52ba3d8f3351da9,System32\DRIVERS\ndistapi.sys,SERVICE_KERNEL_DRIVER,,true,true,The file is signed and the signature was verified.,Microsoft Windows,Microsoft Windows Production PCA 2011
EE280KUW,wmiApSrv,WMI Performance Adapter,Provides performance library information from Windows Management Instrumentation (WMI) providers to clients on the network. This service only runs when Performance Data Helper is activated.,C:\Windows\System32\wbem\WmiApSrv.exe,900bc3d390f011a1a4b78ac2dde7257c,C:\Windows\system32\wbem\WmiApSrv.exe,SERVICE_WIN32_OWN_PROCESS,,true,true,The file is signed and the signature was verified.,Microsoft Windows,Microsoft Windows Production PCA 2011
EE280KUW,scmbus,Microsoft Storage Class Memory Bus Driver,,C:\Windows\System32\drivers\scmbus.sys,d858b930ce93b6d0427a2c76cae60ae9,\SystemRoot\System32\drivers\scmbus.sys,SERVICE_KERNEL_DRIVER,,true,true,The file is signed and the signature was verified.,Microsoft Windows,Microsoft Windows Production PCA 2011
EE280KUW,umbus,UMBus Enumerator Driver,,C:\Windows\System32\drivers\umbus.sys,d06ff1f78126695b5a7cbc4d7e248372,\SystemRoot\System32\drivers\umbus.sys,SERVICE_KERNEL_DRIVER,,true,true,The file is signed and the signature was verified.,Microsoft Windows,Microsoft Windows Production PCA 2011
EE280KUW,IPsecGW,Windows IPsec Gateway Driver,This service provides a optimized network data path for IPsec Gateway,C:\Windows\System32\drivers\ipsecgw.sys,fde9cf067df156179b667e64e3062e1e,system32\drivers\ipsecgw.sys,SERVICE_KERNEL_DRIVER,,true,true,The file is signed and the signature was verified.,Microsoft Windows,Microsoft Windows Production PCA 2011
EE280KUW,percsas2i,percsas2i,,C:\Windows\System32\drivers\percsas2i.sys,55fb640888818f36af076ae0c50b5e1e,\SystemRoot\System32\drivers\percsas2i.sys,SERVICE_KERNEL_DRIVER,,true,true,The file is signed and the signature was verified.,Microsoft Windows,Microsoft Windows Production PCA 2011
EE280KUW,Rasl2tp,WAN Miniport (L2TP),WAN Miniport (L2TP),C:\Windows\System32\drivers\rasl2tp.sys,80829f51ceb902d2e2ac86921645b0c0,\SystemRoot\System32\drivers\rasl2tp.sys,SERVICE_KERNEL_DRIVER,,true,true,The file is signed and the signature was verified.,Microsoft Windows,Microsoft Windows Production PCA 2011
EE280KUW,intelpep,Intel(R) Power Engine Plug-in Driver,,C:\Windows\System32\drivers\intelpep.sys,391c0a2338a06968bc25d4961bac0938,\SystemRoot\System32\drivers\intelpep.sys,SERVICE_KERNEL_DRIVER,,true,true,The file is signed and the signature was verified.,Microsoft Windows,Microsoft Windows Production PCA 2011
EE280KUW,EventSystem,COM+ Event System,Supports System Event Notification Service (SENS)  which provides automatic distribution of events to subscribing Component Object Model (COM) components. If the service is stopped  SENS will close and will not be able to provide logon and logoff notifications. If this service is disabled  any services that explicitly depend on it will fail to start.,C:\Windows\System32\svchost.exe,b2a21dd4ad6ed25ca3440d6389675758,C:\Windows\system32\svchost.exe -k LocalService,SERVICE_WIN32_SHARE_PROCESS,C:\Windows\System32\es.dll,true,true,The file is signed and the signature was verified.,Microsoft Windows,Microsoft Windows Production PCA 2011
EE280KUW,SerCx2,Serial UART Support Library,,C:\Windows\System32\drivers\SerCx2.sys,fac5b33bc1dd93f2cfdca1b956f49794,system32\drivers\SerCx2.sys,SERVICE_KERNEL_DRIVER,,true,true,The file is signed and the signature was verified.,Microsoft Windows,Microsoft Windows Production PCA 2011
EE280KUW,IKEEXT,IKE and AuthIP IPsec Keying Modules,The IKEEXT service hosts the Internet Key Exchange (IKE) and Authenticated Internet Protocol (AuthIP) keying modules. These keying modules are used for authentication and key exchange in Internet Protocol security (IPsec). Stopping or disabling the IKEEXT service will disable IKE and AuthIP key exchange with peer computers. IPsec is typically configured to use IKE or AuthIP; therefore  stopping or disabling the IKEEXT service might result in an IPsec failure and might compromise the security of the system. It is strongly recommended that you have the IKEEXT service running.,C:\Windows\System32\svchost.exe,b2a21dd4ad6ed25ca3440d6389675758,C:\Windows\system32\svchost.exe -k netsvcs,SERVICE_WIN32_SHARE_PROCESS,C:\Windows\System32\IKEEXT.DLL,true,true,The file is signed and the signature was verified.,Microsoft Windows,Microsoft Windows Production PCA 2011
EE280KUW,sfloppy,High-Capacity Floppy Disk Drive,,C:\Windows\System32\drivers\sfloppy.sys,e1bd53c04316a881a81a45dff90064b6,\SystemRoot\System32\drivers\sfloppy.sys,SERVICE_KERNEL_DRIVER,,true,true,The file is signed and the signature was verified.,Microsoft Windows,Microsoft Windows Production PCA 2011
EE280KUW,flpydisk,Floppy Disk Driver,,C:\Windows\System32\drivers\flpydisk.sys,c8b4c3ee7ad602f816f687795e701360,\SystemRoot\System32\drivers\flpydisk.sys,SERVICE_KERNEL_DRIVER,,true,true,The file is signed and the signature was verified.,Microsoft Windows,Microsoft Windows Production PCA 2011
EE280KUW,SysMain,Superfetch,Maintains and improves system performance over time.,C:\Windows\System32\svchost.exe,b2a21dd4ad6ed25ca3440d6389675758,C:\Windows\system32\svchost.exe -k LocalSystemNetworkRestricted,SERVICE_WIN32_SHARE_PROCESS,C:\Windows\System32\sysmain.dll,true,true,The file is signed and the signature was verified.,Microsoft Windows,Microsoft Windows Production PCA 2011
EE280KUW,qlfcoei,QLogic [FCoE] STOR Miniport Inbox Driver (wx64),,C:\Windows\System32\drivers\qlfcoei.sys,95dabf5df0cab0136d8dbc0366ec00a8,\SystemRoot\System32\drivers\qlfcoei.sys,SERVICE_KERNEL_DRIVER,,true,true,The file is signed and the signature was verified.,Microsoft Windows,Microsoft Windows Production PCA 2011
EE280KUW,bxois,QLogic Offload iSCSI Driver,,C:\Windows\System32\drivers\bxois.sys,8fa3accd897898ff586794d627122b53,\SystemRoot\System32\drivers\bxois.sys,SERVICE_KERNEL_DRIVER,,true,true,The file is signed and the signature was verified.,Microsoft Windows,Microsoft Windows Production PCA 2011
EE280KUW,AppReadiness,App Readiness,Gets apps ready for use the first time a user signs in to this PC and when adding new apps.,C:\Windows\System32\svchost.exe,b2a21dd4ad6ed25ca3440d6389675758,C:\Windows\System32\svchost.exe -k AppReadiness,SERVICE_WIN32_SHARE_PROCESS,C:\Windows\System32\AppReadiness.dll,true,true,The file is signed and the signature was verified.,Microsoft Windows,Microsoft Windows Production PCA 2011
EE280KUW,VMBusHID,VMBusHID,,C:\Windows\System32\drivers\VMBusHID.sys,a563a9318f30f7e41c9b658c9a7d8e00,\SystemRoot\System32\drivers\VMBusHID.sys,SERVICE_KERNEL_DRIVER,,true,true,The file is signed and the signature was verified.,Microsoft Windows,Microsoft Windows Production PCA 2011
EE280KUW,nsiproxy,NSI Proxy Service Driver,NSI Proxy Service,C:\Windows\System32\drivers\nsiproxy.sys,72be738f8291659c95e431205ab49e23,system32\drivers\nsiproxy.sys,SERVICE_KERNEL_DRIVER,,true,true,The file is signed and the signature was verified.,Microsoft Windows,Microsoft Windows Production PCA 2011
EE280KUW,VSTXRAID,VIA StorX Storage RAID Controller Windows Driver,,C:\Windows\System32\drivers\VSTXRAID.SYS,32563f270d321c9432050809df307a70,\SystemRoot\System32\drivers\vstxraid.sys,SERVICE_KERNEL_DRIVER,,true,true,The file is signed and the signature was verified.,Microsoft Windows,Microsoft Windows Production PCA 2011
EE280KUW,UmPass,Microsoft UMPass Driver,,C:\Windows\System32\drivers\umpass.sys,475e3e08e6e727f811adf379bf70b106,\SystemRoot\System32\drivers\umpass.sys,SERVICE_KERNEL_DRIVER,,true,true,The file is signed and the signature was verified.,Microsoft Windows,Microsoft Windows Production PCA 2011
EE280KUW,Tcpip6,@todo.dll -100;Microsoft IPv6 Protocol Driver,@todo.dll -100;Microsoft IPv6 Protocol Driver,C:\Windows\System32\drivers\tcpip.sys,da9b6d2e12bad21f8f2bb8b845cdb1f3,System32\drivers\tcpip.sys,SERVICE_KERNEL_DRIVER,,true,true,The file is signed and the signature was verified.,Microsoft Windows,Microsoft Windows Production PCA 2011
EE280KUW,LSI_SAS,LSI_SAS,,C:\Windows\System32\drivers\lsi_sas.sys,536da389b552a0062e0413e4960db95a,\SystemRoot\System32\drivers\lsi_sas.sys,SERVICE_KERNEL_DRIVER,,true,true,The file is signed and the signature was verified.,Microsoft Windows,Microsoft Windows Production PCA 2011
EE280KUW,Tcpip,TCP/IP Protocol Driver,TCP/IP Protocol Driver,C:\Windows\System32\drivers\tcpip.sys,da9b6d2e12bad21f8f2bb8b845cdb1f3,\SystemRoot\System32\drivers\tcpip.sys,SERVICE_KERNEL_DRIVER,,true,true,The file is signed and the signature was verified.,Microsoft Windows,Microsoft Windows Production PCA 2011
EE280KUW,SensrSvc,Sensor Monitoring Service,Monitors various sensors in order to expose data and adapt to system and user state.  If this service is stopped or disabled  the display brightness will not adapt to lighting conditions. Stopping this service may affect other system functionality and features as well.,C:\Windows\System32\svchost.exe,b2a21dd4ad6ed25ca3440d6389675758,C:\Windows\system32\svchost.exe -k LocalServiceAndNoImpersonation,SERVICE_WIN32_SHARE_PROCESS,C:\Windows\System32\sensrsvc.dll,true,true,The file is signed and the signature was verified.,Microsoft Windows,Microsoft Windows Production PCA 2011
EE280KUW,TrustedInstaller,Windows Modules Installer,Enables installation  modification  and removal of Windows updates and optional components. If this service is disabled  install or uninstall of Windows updates might fail for this computer.,C:\Windows\servicing\TrustedInstaller.exe,66d1de51afec7d3b67f8190ad8de7043,C:\Windows\servicing\TrustedInstaller.exe,SERVICE_WIN32_OWN_PROCESS,,true,true,The file is signed and the signature was verified.,Microsoft Windows,Microsoft Windows Production PCA 2011
EE280KUW,mrxsmb10,SMB 1.x MiniRedirector,Implements the SMB 1.x (CIFS) protocol. This protocol provides connectivity to network resources on pre-Windows Vista servers,C:\Windows\System32\drivers\mrxsmb10.sys,a73fbc5be362781aec12b3f982edcad0,system32\DRIVERS\mrxsmb10.sys,SERVICE_FILE_SYSTEM_DRIVER,,true,true,The file is signed and the signature was verified.,Microsoft Windows,Microsoft Windows Production PCA 2011
EE280KUW,UfxChipidea,USB Chipidea Controller,,C:\Windows\System32\drivers\UfxChipidea.sys,f167451fdd2990c619520270359fc69b,\SystemRoot\System32\drivers\UfxChipidea.sys,SERVICE_KERNEL_DRIVER,,true,true,The file is signed and the signature was verified.,Microsoft Windows,Microsoft Windows Production PCA 2011
EE280KUW,usbser,Microsoft USB Serial Driver,,C:\Windows\System32\drivers\usbser.sys,22ecee077c91f0343067fa714e75226b,\SystemRoot\System32\drivers\usbser.sys,SERVICE_KERNEL_DRIVER,,true,true,The file is signed and the signature was verified.,Microsoft Windows,Microsoft Windows Production PCA 2011
EE280KUW,AppMgmt,Application Management,Processes installation  removal  and enumeration requests for software deployed through Group Policy. If the service is disabled  users will be unable to install  remove  or enumerate software deployed through Group Policy. If this service is disabled  any services that explicitly depend on it will fail to start.,C:\Windows\System32\svchost.exe,b2a21dd4ad6ed25ca3440d6389675758,C:\Windows\system32\svchost.exe -k netsvcs,SERVICE_WIN32_SHARE_PROCESS,C:\Windows\System32\appmgmts.dll,true,true,The file is signed and the signature was verified.,Microsoft Windows,Microsoft Windows Production PCA 2011
EE280KUW,lmhosts,TCP/IP NetBIOS Helper,Provides support for the NetBIOS over TCP/IP (NetBT) service and NetBIOS name resolution for clients on the network  therefore enabling users to share files  print  and log on to the network. If this service is stopped  these functions might be unavailable. If this service is disabled  any services that explicitly depend on it will fail to start.,C:\Windows\System32\svchost.exe,b2a21dd4ad6ed25ca3440d6389675758,C:\Windows\System32\svchost.exe -k LocalServiceNetworkRestricted,SERVICE_WIN32_SHARE_PROCESS,C:\Windows\System32\lmhsvc.dll,true,true,The file is signed and the signature was verified.,Microsoft Windows,Microsoft Windows Production PCA 2011
EE280KUW,PrintNotify,Printer Extensions and Notifications,This service opens custom printer dialog boxes and handles notifications from a remote print server or a printer. If you turn off this service  you won’t be able to see printer extensions or notifications.,C:\Windows\System32\svchost.exe,b2a21dd4ad6ed25ca3440d6389675758,C:\Windows\system32\svchost.exe -k print,SERVICE_WIN32_SHARE_PROCESS,C:\Windows\System32\spool\drivers\x64\3\PrintConfig.dll,true,true,The file is signed and the signature was verified.,Microsoft Windows,Microsoft Windows Production PCA 2011
EE280KUW,WIMMount,WIMMount,WIM Image mount service driver,C:\Windows\System32\drivers\wimmount.sys,26c9216a11989f773a8e31cad15cd7be,system32\drivers\wimmount.sys,SERVICE_FILE_SYSTEM_DRIVER,,true,true,The file is signed and the signature was verified.,Microsoft Windows,Microsoft Windows Production PCA 2011
EE280KUW,stornvme,Microsoft Standard NVM Express Driver,,C:\Windows\System32\drivers\stornvme.sys,14ffd03724b2f4f479061e011092dbe7,\SystemRoot\System32\drivers\stornvme.sys,SERVICE_KERNEL_DRIVER,,true,true,The file is signed and the signature was verified.,Microsoft Windows,Microsoft Windows Production PCA 2011
EE280KUW,UevAgentDriver,UevAgentDriver,User Experience Virtualization Agent Driver,C:\Windows\System32\drivers\UevAgentDriver.sys,c25718f56708edeb6835bbd830b601d2,\SystemRoot\system32\drivers\UevAgentDriver.sys,SERVICE_FILE_SYSTEM_DRIVER,,true,true,The file is signed and the signature was verified.,Microsoft Windows,Microsoft Windows Production PCA 2011
EE280KUW,mpsdrv,Windows Firewall Authorization Driver,Windows Firewall Authorization Driver is a kernel mode driver that provides deep inspection services on inbound and outbound network traffic.,C:\Windows\System32\drivers\mpsdrv.sys,5fe5e5f5309c944d1bdeb1d2ab8fdfd2,System32\drivers\mpsdrv.sys,SERVICE_KERNEL_DRIVER,,true,true,The file is signed and the signature was verified.,Microsoft Windows,Microsoft Windows Production PCA 2011
EE280KUW,storufs,Microsoft Universal Flash Storage (UFS) Driver,,C:\Windows\System32\drivers\storufs.sys,6d278bb38b815ce457ceaf6414630a76,\SystemRoot\System32\drivers\storufs.sys,SERVICE_KERNEL_DRIVER,,true,true,The file is signed and the signature was verified.,Microsoft Windows,Microsoft Windows Production PCA 2011
EE280KUW,UcmTcpciCx0101,UCM-TCPCI KMDF Class Extension,,C:\Windows\System32\drivers\UcmTcpciCx.sys,413dc87852e27cb0c1d93a590a7479b4,System32\Drivers\UcmTcpciCx.sys,SERVICE_KERNEL_DRIVER,,true,true,The file is signed and the signature was verified.,Microsoft Windows,Microsoft Windows Production PCA 2011
EE280KUW,hyperkbd,hyperkbd,,C:\Windows\System32\drivers\hyperkbd.sys,a40830c7349d54c7f556fc36940b2e40,\SystemRoot\System32\drivers\hyperkbd.sys,SERVICE_KERNEL_DRIVER,,true,true,The file is signed and the signature was verified.,Microsoft Windows,Microsoft Windows Production PCA 2011
EE280KUW,LSI_SAS3i,LSI_SAS3i,,C:\Windows\System32\drivers\lsi_sas3i.sys,ff3d3146417a42296ccfebc44c037bdd,\SystemRoot\System32\drivers\lsi_sas3i.sys,SERVICE_KERNEL_DRIVER,,true,true,The file is signed and the signature was verified.,Microsoft Windows,Microsoft Windows Production PCA 2011
EE280KUW,volume,Volume driver,,C:\Windows\System32\drivers\volume.sys,f326847b1b7c711aa2d029c9eb56d0b9,\SystemRoot\System32\drivers\volume.sys,SERVICE_KERNEL_DRIVER,,true,true,The file is signed and the signature was verified.,Microsoft Windows,Microsoft Windows Production PCA 2011
EE280KUW,stisvc,Windows Image Acquisition (WIA),Provides image acquisition services for scanners and cameras,C:\Windows\System32\svchost.exe,b2a21dd4ad6ed25ca3440d6389675758,C:\Windows\system32\svchost.exe -k imgsvc,SERVICE_WIN32_OWN_PROCESS,C:\Windows\System32\wiaservc.dll,true,true,The file is signed and the signature was verified.,Microsoft Windows,Microsoft Windows Production PCA 2011
EE280KUW,ksthunk,Kernel Streaming Thunks,,C:\Windows\System32\drivers\ksthunk.sys,f356613c8aff6af3ebd2a2c7964721d7,\SystemRoot\system32\drivers\ksthunk.sys,SERVICE_KERNEL_DRIVER,,true,true,The file is signed and the signature was verified.,Microsoft Windows,Microsoft Windows Production PCA 2011
EE280KUW,HidBth,Microsoft Bluetooth HID Miniport,,C:\Windows\System32\drivers\hidbth.sys,0013abefdd668e4f2ef6e3968ac144d4,\SystemRoot\System32\drivers\hidbth.sys,SERVICE_KERNEL_DRIVER,,true,true,The file is signed and the signature was verified.,Microsoft Windows,Microsoft Windows Production PCA 2011
EE280KUW,WinMad,WinMad Service,,C:\Windows\System32\drivers\winmad.sys,eca8e2edd35fefb18ad677b508759b0f,\SystemRoot\System32\drivers\winmad.sys,SERVICE_KERNEL_DRIVER,,true,true,The file is signed and the signature was verified.,Microsoft Windows,Microsoft Windows Production PCA 2011
EE280KUW,FDResPub,Function Discovery Resource Publication,Publishes this computer and resources attached to this computer so they can be discovered over the network.  If this service is stopped  network resources will no longer be published and they will not be discovered by other computers on the network.,C:\Windows\System32\svchost.exe,b2a21dd4ad6ed25ca3440d6389675758,C:\Windows\system32\svchost.exe -k LocalServiceAndNoImpersonation,SERVICE_WIN32_SHARE_PROCESS,C:\Windows\System32\FDResPub.dll,true,true,The file is signed and the signature was verified.,Microsoft Windows,Microsoft Windows Production PCA 2011
