hostname,name,descriptivename,description,path,md5,arguments,type,servicedll,pathsignatureexists,pathsignatureverified,pathsignaturedescription,pathcertificatesubject,pathcertificateissuer
EE280KUW,tzautoupdate,Auto Time Zone Updater,Automatically sets the system time zone.,C:\Windows\System32\svchost.exe,b2a21dd4ad6ed25ca3440d6389675758,C:\Windows\system32\svchost.exe -k LocalService,SERVICE_WIN32_SHARE_PROCESS,C:\Windows\System32\tzautoupdate.dll,true,true,The file is signed and the signature was verified.,Microsoft Windows,Microsoft Windows Production PCA 2011
EE280KUW,Netman,Network Connections,Manages objects in the Network and Dial-Up Connections folder  in which you can view both local area network and remote connections.,C:\Windows\System32\svchost.exe,b2a21dd4ad6ed25ca3440d6389675758,C:\Windows\System32\svchost.exe -k LocalSystemNetworkRestricted,SERVICE_WIN32_SHARE_PROCESS,C:\Windows\System32\netman.dll,true,true,The file is signed and the signature was verified.,Microsoft Windows,Microsoft Windows Production PCA 2011
EE280KUW,Power,Power,Manages power policy and power policy notification delivery.,C:\Windows\System32\svchost.exe,b2a21dd4ad6ed25ca3440d6389675758,C:\Windows\system32\svchost.exe -k DcomLaunch,SERVICE_WIN32_SHARE_PROCESS,C:\Windows\System32\umpo.dll,true,true,The file is signed and the signature was verified.,Microsoft Windows,Microsoft Windows Production PCA 2011
EE280KUW,CDPSvc,Connected Devices Platform Service,This service is used for Connected Devices and Universal Glass scenarios,C:\Windows\System32\svchost.exe,b2a21dd4ad6ed25ca3440d6389675758,C:\Windows\system32\svchost.exe -k LocalService,SERVICE_WIN32_SHARE_PROCESS,C:\Windows\System32\cdpsvc.dll,true,true,The file is signed and the signature was verified.,Microsoft Windows,Microsoft Windows Production PCA 2011
EE280KUW,RasGre,WAN Miniport (GRE),WAN Miniport (GRE),C:\Windows\System32\drivers\rasgre.sys,17c8a19d2491f5dee04243228c316b54,\SystemRoot\System32\drivers\rasgre.sys,SERVICE_KERNEL_DRIVER,,true,true,The file is signed and the signature was verified.,Microsoft Windows,Microsoft Windows Production PCA 2011
EE280KUW,mshidumdf,Pass-through HID to UMDF Driver,,C:\Windows\System32\drivers\mshidumdf.sys,5897e500bc14cd88618f85ae58aa60a6,\SystemRoot\System32\drivers\mshidumdf.sys,SERVICE_KERNEL_DRIVER,,true,true,The file is signed and the signature was verified.,Microsoft Windows,Microsoft Windows Production PCA 2011
EE280KUW,b06bdrv,QLogic Network Adapter VBD,,C:\Windows\System32\drivers\bxvbda.sys,89710e56b7e9ffb583c364c157fc46b6,\SystemRoot\System32\drivers\bxvbda.sys,SERVICE_KERNEL_DRIVER,,true,true,The file is signed and the signature was verified.,Microsoft Windows,Microsoft Windows Production PCA 2011
EE280KUW,RmSvc,Radio Management Service,Radio Management and Airplane Mode Service,C:\Windows\System32\svchost.exe,b2a21dd4ad6ed25ca3440d6389675758,C:\Windows\System32\svchost.exe -k LocalServiceNetworkRestricted,SERVICE_WIN32_SHARE_PROCESS,C:\Windows\System32\RMapi.dll,true,true,The file is signed and the signature was verified.,Microsoft Windows,Microsoft Windows Production PCA 2011
EE280KUW,AJRouter,AllJoyn Router Service,Routes AllJoyn messages for the local AllJoyn clients. If this service is stopped the AllJoyn clients that do not have their own bundled routers will be unable to run.,C:\Windows\System32\svchost.exe,b2a21dd4ad6ed25ca3440d6389675758,C:\Windows\system32\svchost.exe -k LocalServiceNetworkRestricted,SERVICE_WIN32_SHARE_PROCESS,C:\Windows\System32\AJRouter.dll,true,true,The file is signed and the signature was verified.,Microsoft Windows,Microsoft Windows Production PCA 2011
EE280KUW,netkvm,Red Hat VirtIO Ethernet Adapter Service,,C:\Windows\System32\drivers\netkvm.sys,7a8bfa006a82ed402209ee011904d039,\SystemRoot\System32\drivers\netkvm.sys,SERVICE_KERNEL_DRIVER,,true,true,The file is signed and the signature was verified.,Google Inc,Symantec Class 3 SHA256 Code Signing CA
EE280KUW,AFD,Ancillary Function Driver for Winsock,Ancillary Function Driver for Winsock,C:\Windows\System32\drivers\afd.sys,c010b4e6ae2117fda28773e1566a86e7,\SystemRoot\system32\drivers\afd.sys,SERVICE_KERNEL_DRIVER,,true,true,The file is signed and the signature was verified.,Microsoft Windows,Microsoft Windows Production PCA 2011
EE280KUW,NetSetupSvc,Network Setup Service,The Network Setup Service manages the installation of network drivers and permits the configuration of low-level network settings.  If this service is stopped  any driver installations that are in-progress may be cancelled.,C:\Windows\System32\svchost.exe,b2a21dd4ad6ed25ca3440d6389675758,C:\Windows\System32\svchost.exe -k netsvcs,SERVICE_WIN32_SHARE_PROCESS,C:\Windows\System32\NetSetupSvc.dll,true,true,The file is signed and the signature was verified.,Microsoft Windows,Microsoft Windows Production PCA 2011
EE280KUW,acpitime,ACPI Wake Alarm Driver,,C:\Windows\System32\drivers\acpitime.sys,113a236aa6778198a918a8abf6dbb2a2,\SystemRoot\System32\drivers\acpitime.sys,SERVICE_KERNEL_DRIVER,,true,true,The file is signed and the signature was verified.,Microsoft Windows,Microsoft Windows Production PCA 2011
EE280KUW,FontCache,Windows Font Cache Service,Optimizes performance of applications by caching commonly used font data. Applications will start this service if it is not already running. It can be disabled  though doing so will degrade application performance.,C:\Windows\System32\svchost.exe,b2a21dd4ad6ed25ca3440d6389675758,C:\Windows\system32\svchost.exe -k LocalService,SERVICE_WIN32_SHARE_PROCESS,C:\Windows\System32\FntCache.dll,true,true,The file is signed and the signature was verified.,Microsoft Windows,Microsoft Windows Production PCA 2011
EE280KUW,SamSs,Security Accounts Manager,The startup of this service signals other services that the Security Accounts Manager (SAM) is ready to accept requests.  Disabling this service will prevent other services in the system from being notified when the SAM is ready  which may in turn cause those services to fail to start correctly. This service should not be disabled.,C:\Windows\System32\lsass.exe,45648ffaef7fc8a07831d8d996d23212,C:\Windows\system32\lsass.exe,SERVICE_WIN32_SHARE_PROCESS,,true,true,The file is signed and the signature was verified.,Microsoft Windows,Microsoft Windows Production PCA 2011
EE280KUW,w32time,Windows Time,Maintains date and time synchronization on all clients and servers in the network. If this service is stopped  date and time synchronization will be unavailable. If this service is disabled  any services that explicitly depend on it will fail to start.,C:\Windows\System32\svchost.exe,b2a21dd4ad6ed25ca3440d6389675758,C:\Windows\system32\svchost.exe -k LocalService,SERVICE_WIN32_SHARE_PROCESS,C:\Windows\System32\w32time.dll,true,true,The file is signed and the signature was verified.,Microsoft Windows,Microsoft Windows Production PCA 2011
EE280KUW,WalletService,WalletService,Hosts objects used by clients of the wallet,C:\Windows\System32\svchost.exe,b2a21dd4ad6ed25ca3440d6389675758,C:\Windows\System32\svchost.exe -k appmodel,SERVICE_WIN32_SHARE_PROCESS,C:\Windows\System32\WalletService.dll,true,true,The file is signed and the signature was verified.,Microsoft Windows,Microsoft Windows Production PCA 2011
EE280KUW,NgcCtnrSvc,Microsoft Passport Container,Manages local user identity keys used to authenticate user to identity providers as well as TPM virtual smart cards. If this service is disabled  local user identity keys and TPM virtual smart cards will not be accessible. It is recommended that you do not reconfigure this service.,C:\Windows\System32\svchost.exe,b2a21dd4ad6ed25ca3440d6389675758,C:\Windows\system32\svchost.exe -k LocalServiceNetworkRestricted,SERVICE_WIN32_SHARE_PROCESS,C:\Windows\System32\NgcCtnrSvc.dll,true,true,The file is signed and the signature was verified.,Microsoft Windows,Microsoft Windows Production PCA 2011
EE280KUW,pla,Performance Logs &amp; Alerts,Performance Logs and Alerts Collects performance data from local or remote computers based on preconfigured schedule parameters  then writes the data to a log or triggers an alert. If this service is stopped  performance information will not be collected. If this service is disabled  any services that explicitly depend on it will fail to start.,C:\Windows\System32\svchost.exe,b2a21dd4ad6ed25ca3440d6389675758,C:\Windows\System32\svchost.exe -k LocalServiceNoNetwork,SERVICE_WIN32_SHARE_PROCESS,C:\Windows\System32\pla.dll,true,true,The file is signed and the signature was verified.,Microsoft Windows,Microsoft Windows Production PCA 2011
EE280KUW,vmicvss,Hyper-V Volume Shadow Copy Requestor,Coordinates the communications that are required to use Volume Shadow Copy Service to back up applications and data on this virtual machine from the operating system on the physical computer.,C:\Windows\System32\svchost.exe,b2a21dd4ad6ed25ca3440d6389675758,C:\Windows\system32\svchost.exe -k LocalSystemNetworkRestricted,SERVICE_WIN32_SHARE_PROCESS,C:\Windows\System32\icsvcext.dll,true,true,The file is signed and the signature was verified.,Microsoft Windows,Microsoft Windows Production PCA 2011
EE280KUW,RasSstp,WAN Miniport (SSTP),WAN Miniport (SSTP),C:\Windows\System32\drivers\rassstp.sys,7d5ba24b2476b8cb6ae13e4a957faf1b,\SystemRoot\System32\drivers\rassstp.sys,SERVICE_KERNEL_DRIVER,,true,true,The file is signed and the signature was verified.,Microsoft Windows,Microsoft Windows Production PCA 2011
EE280KUW,srv2,Server SMB 2.xxx Driver,Enables connectivity from Windows Vista and later clients,C:\Windows\System32\drivers\srv2.sys,be685a3d94e8ee3578ff9e3b0b36e0f8,System32\DRIVERS\srv2.sys,SERVICE_FILE_SYSTEM_DRIVER,,true,true,The file is signed and the signature was verified.,Microsoft Windows,Microsoft Windows Production PCA 2011
EE280KUW,monitor,Microsoft Monitor Class Function Driver Service,,C:\Windows\System32\drivers\monitor.sys,80314dfe45256d5e7899cff12aef9eb7,\SystemRoot\System32\drivers\monitor.sys,SERVICE_KERNEL_DRIVER,,true,true,The file is signed and the signature was verified.,Microsoft Windows,Microsoft Windows Production PCA 2011
EE280KUW,mssmbios,Microsoft System Management BIOS Driver,,C:\Windows\System32\drivers\mssmbios.sys,15ab33ab2ba445f069539c767e348bda,\SystemRoot\System32\drivers\mssmbios.sys,SERVICE_KERNEL_DRIVER,,true,true,The file is signed and the signature was verified.,Microsoft Windows,Microsoft Windows Production PCA 2011
EE280KUW,QWAVE,Quality Windows Audio Video Experience,Quality Windows Audio Video Experience (qWave) is a networking platform for Audio Video (AV) streaming applications on IP home networks. qWave enhances AV streaming performance and reliability by ensuring network quality-of-service (QoS) for AV applications. It provides mechanisms for admission control  run time monitoring and enforcement  application feedback  and traffic prioritization.,C:\Windows\System32\svchost.exe,b2a21dd4ad6ed25ca3440d6389675758,C:\Windows\system32\svchost.exe -k LocalServiceAndNoImpersonation,SERVICE_WIN32_SHARE_PROCESS,C:\Windows\System32\qwave.dll,true,true,The file is signed and the signature was verified.,Microsoft Windows,Microsoft Windows Production PCA 2011
EE280KUW,vmicshutdown,Hyper-V Guest Shutdown Service,Provides a mechanism to shut down the operating system of this virtual machine from the management interfaces on the physical computer.,C:\Windows\System32\svchost.exe,b2a21dd4ad6ed25ca3440d6389675758,C:\Windows\system32\svchost.exe -k LocalSystemNetworkRestricted,SERVICE_WIN32_SHARE_PROCESS,C:\Windows\System32\icsvc.dll,true,true,The file is signed and the signature was verified.,Microsoft Windows,Microsoft Windows Production PCA 2011
EE280KUW,Filetrace,Filetrace,ETW File Trace Filter,C:\Windows\System32\drivers\filetrace.sys,828cee78970260b3fde9f550597578f5,system32\drivers\filetrace.sys,SERVICE_FILE_SYSTEM_DRIVER,,true,true,The file is signed and the signature was verified.,Microsoft Windows,Microsoft Windows Production PCA 2011
EE280KUW,partmgr,Partition driver,Disk class filter driver that manages and auctions out partitions to volume managers.,C:\Windows\System32\drivers\partmgr.sys,765ebe14576c5fa7a91988d9da15c004,\SystemRoot\System32\drivers\partmgr.sys,SERVICE_KERNEL_DRIVER,,true,true,The file is signed and the signature was verified.,Microsoft Windows,Microsoft Windows Production PCA 2011
EE280KUW,volsnap,Volume Shadow Copy driver,Volume class filter driver that takes and manages snapshots.,C:\Windows\System32\drivers\volsnap.sys,185b2ff58fad458fe30d2eb93e572d03,\SystemRoot\System32\drivers\volsnap.sys,SERVICE_KERNEL_DRIVER,,true,true,The file is signed and the signature was verified.,Microsoft Windows,Microsoft Windows Production PCA 2011
EE280KUW,RemoteAccess,Routing and Remote Access,Offers routing services to businesses in local area and wide area network environments.,C:\Windows\System32\svchost.exe,b2a21dd4ad6ed25ca3440d6389675758,C:\Windows\System32\svchost.exe -k netsvcs,SERVICE_WIN32_SHARE_PROCESS,C:\Windows\System32\mprdim.dll,true,true,The file is signed and the signature was verified.,Microsoft Windows,Microsoft Windows Production PCA 2011
EE280KUW,PolicyAgent,IPsec Policy Agent,"""Internet Protocol security (IPsec) supports network-level peer authentication  data origin authentication  data integrity  data confidentiality (encryption)  and replay protection.  This service enforces IPsec policies created through the IP Security Policies snap-in or the command-line tool """"netsh ipsec"""".  If you stop this service  you may experience network connectivity issues if your policy requires that connections use IPsec.  Also remote management of Windows Firewall is not available when this service is stopped.""",C:\Windows\System32\svchost.exe,b2a21dd4ad6ed25ca3440d6389675758,C:\Windows\system32\svchost.exe -k NetworkServiceNetworkRestricted,SERVICE_WIN32_SHARE_PROCESS,C:\Windows\System32\IPSECSVC.DLL,true,true,The file is signed and the signature was verified.,Microsoft Windows,Microsoft Windows Production PCA 2011
EE280KUW,mouclass,Mouse Class Driver,,C:\Windows\System32\drivers\mouclass.sys,1ce62a200c78e46b47ba9db80e99d622,\SystemRoot\System32\drivers\mouclass.sys,SERVICE_KERNEL_DRIVER,,true,true,The file is signed and the signature was verified.,Microsoft Windows,Microsoft Windows Production PCA 2011
EE280KUW,DcomLaunch,DCOM Server Process Launcher,The DCOMLAUNCH service launches COM and DCOM servers in response to object activation requests. If this service is stopped or disabled  programs using COM or DCOM will not function properly. It is strongly recommended that you have the DCOMLAUNCH service running.,C:\Windows\System32\svchost.exe,b2a21dd4ad6ed25ca3440d6389675758,C:\Windows\system32\svchost.exe -k DcomLaunch,SERVICE_WIN32_SHARE_PROCESS,C:\Windows\System32\rpcss.dll,true,true,The file is signed and the signature was verified.,Microsoft Windows,Microsoft Windows Production PCA 2011
EE280KUW,HidUsb,Microsoft HID Class Driver,,C:\Windows\System32\drivers\hidusb.sys,49e9f97dc7422fc5b19eedee6abfcae9,\SystemRoot\System32\drivers\hidusb.sys,SERVICE_KERNEL_DRIVER,,true,true,The file is signed and the signature was verified.,Microsoft Windows,Microsoft Windows Production PCA 2011
EE280KUW,fcvsc,fcvsc,,C:\Windows\System32\drivers\fcvsc.sys,2857914ad4f7518de69cc14d1009ce99,\SystemRoot\System32\drivers\fcvsc.sys,SERVICE_KERNEL_DRIVER,,true,true,The file is signed and the signature was verified.,Microsoft Windows,Microsoft Windows Production PCA 2011
EE280KUW,UASPStor,USB Attached SCSI (UAS) Driver,,C:\Windows\System32\drivers\uaspstor.sys,cf145f50478407242de57c4dfab723ee,\SystemRoot\System32\drivers\uaspstor.sys,SERVICE_KERNEL_DRIVER,,true,true,The file is signed and the signature was verified.,Microsoft Windows,Microsoft Windows Production PCA 2011
EE280KUW,WindowsTrustedRTProxy,Microsoft Windows Trusted Runtime Secure Service,,C:\Windows\System32\drivers\WindowsTrustedRTProxy.sys,8bd0e2ea197c67c2a7cfb9d64d299fad,\SystemRoot\System32\drivers\WindowsTrustedRTProxy.sys,SERVICE_KERNEL_DRIVER,,true,true,The file is signed and the signature was verified.,Microsoft Windows,Microsoft Windows Production PCA 2011
EE280KUW,UsoSvc,Update Orchestrator Service for Windows Update,UsoSvc,C:\Windows\System32\svchost.exe,b2a21dd4ad6ed25ca3440d6389675758,C:\Windows\system32\svchost.exe -k netsvcs,SERVICE_WIN32_SHARE_PROCESS,C:\Windows\System32\usocore.dll,true,true,The file is signed and the signature was verified.,Microsoft Windows,Microsoft Windows Production PCA 2011
EE280KUW,ClientAnalyticsService,ClientAnalyticsService,,C:\Program Files\Common Files\McAfee\ClientAnalytics\Legacy\McClientAnalytics.exe,53550ddbaac32f0c7756da648303fba9,"C:\Program Files\Common Files\McAfee\ClientAnalytics\Legacy\McClientAnalytics.exe""""""",SERVICE_WIN32_OWN_PROCESS,,true,true,The file is signed and the signature was verified.,"""McAfee",Symantec Class 3 SHA256 Code Signing CA
EE280KUW,FsDepends,File System Dependency Minifilter,This minifilter tracks the dependencies associated with the various nested volumes/filesystems,C:\Windows\System32\drivers\FsDepends.sys,1c1839872260811839f412301344edf7,System32\drivers\FsDepends.sys,SERVICE_FILE_SYSTEM_DRIVER,,true,true,The file is signed and the signature was verified.,Microsoft Windows,Microsoft Windows Production PCA 2011
EE280KUW,USBSTOR,USB Mass Storage Driver,,C:\Windows\System32\drivers\USBSTOR.SYS,cf7b8ff8e04342b3ab0c723390d158c8,\SystemRoot\System32\drivers\USBSTOR.SYS,SERVICE_KERNEL_DRIVER,,true,true,The file is signed and the signature was verified.,Microsoft Windows,Microsoft Windows Production PCA 2011
EE280KUW,UrsSynopsys,Synopsys USB Role-Switch Driver,,C:\Windows\System32\drivers\urssynopsys.sys,c6027a5825ae945193fecfc72bb9f865,\SystemRoot\System32\drivers\urssynopsys.sys,SERVICE_KERNEL_DRIVER,,true,true,The file is signed and the signature was verified.,Microsoft Windows,Microsoft Windows Production PCA 2011
EE280KUW,lltdsvc,Link-Layer Topology Discovery Mapper,Creates a Network Map  consisting of PC and device topology (connectivity) information  and metadata describing each PC and device.  If this service is disabled  the Network Map will not function properly.,C:\Windows\System32\svchost.exe,b2a21dd4ad6ed25ca3440d6389675758,C:\Windows\System32\svchost.exe -k LocalService,SERVICE_WIN32_SHARE_PROCESS,C:\Windows\System32\lltdsvc.dll,true,true,The file is signed and the signature was verified.,Microsoft Windows,Microsoft Windows Production PCA 2011
EE280KUW,EFS,Encrypting File System (EFS),Provides the core file encryption technology used to store encrypted files on NTFS file system volumes. If this service is stopped or disabled  applications will be unable to access encrypted files.,C:\Windows\System32\lsass.exe,45648ffaef7fc8a07831d8d996d23212,C:\Windows\System32\lsass.exe,SERVICE_WIN32_SHARE_PROCESS,C:\Windows\System32\efssvc.dll,true,true,The file is signed and the signature was verified.,Microsoft Windows,Microsoft Windows Production PCA 2011
EE280KUW,MsLldp,Microsoft Link-Layer Discovery Protocol,Microsoft Link-Layer Discovery Protocol Driver,C:\Windows\System32\drivers\mslldp.sys,3a798b95f21643ddf228d56a5c759863,system32\drivers\mslldp.sys,SERVICE_KERNEL_DRIVER,,true,true,The file is signed and the signature was verified.,Microsoft Windows,Microsoft Windows Production PCA 2011
EE280KUW,Audiosrv,Windows Audio,Manages audio for Windows-based programs.  If this service is stopped  audio devices and effects will not function properly.  If this service is disabled  any services that explicitly depend on it will fail to start,C:\Windows\System32\svchost.exe,b2a21dd4ad6ed25ca3440d6389675758,C:\Windows\System32\svchost.exe -k LocalServiceNetworkRestricted,SERVICE_WIN32_OWN_PROCESS,C:\Windows\System32\audiosrv.dll,true,true,The file is signed and the signature was verified.,Microsoft Windows,Microsoft Windows Production PCA 2011
EE280KUW,buttonconverter,Service for Portable Device Control devices,,C:\Windows\System32\drivers\buttonconverter.sys,7e56a9e799ef43cb992f6f4417bce10d,\SystemRoot\System32\drivers\buttonconverter.sys,SERVICE_KERNEL_DRIVER,,true,true,The file is signed and the signature was verified.,Microsoft Windows,Microsoft Windows Production PCA 2011
EE280KUW,SharedAccess,Internet Connection Sharing (ICS),Provides network address translation  addressing  name resolution and/or intrusion prevention services for a home or small office network.,C:\Windows\System32\svchost.exe,b2a21dd4ad6ed25ca3440d6389675758,C:\Windows\System32\svchost.exe -k netsvcs,SERVICE_WIN32_SHARE_PROCESS,C:\Windows\System32\ipnathlp.dll,true,true,The file is signed and the signature was verified.,Microsoft Windows,Microsoft Windows Production PCA 2011
EE280KUW,bfadi,bfadi,,C:\Windows\System32\drivers\bfadi.sys,b4148cc399b4b753f08c814e05c7adad,\SystemRoot\System32\drivers\bfadi.sys,SERVICE_KERNEL_DRIVER,,true,true,The file is signed and the signature was verified.,Microsoft Windows,Microsoft Windows Production PCA 2011
EE280KUW,fdc,Floppy Disk Controller Driver,,C:\Windows\System32\drivers\fdc.sys,86050e1f9d5b4b0f2321cab2fe54aeb8,\SystemRoot\System32\drivers\fdc.sys,SERVICE_KERNEL_DRIVER,,true,true,The file is signed and the signature was verified.,Microsoft Windows,Microsoft Windows Production PCA 2011
EE280KUW,luafv,UAC File Virtualization,Virtualizes file write failures to per-user locations.,C:\Windows\System32\drivers\luafv.sys,e34cf7979dd263dca827f355ca7f76de,\SystemRoot\system32\drivers\luafv.sys,SERVICE_FILE_SYSTEM_DRIVER,,true,true,The file is signed and the signature was verified.,Microsoft Windows,Microsoft Windows Production PCA 2011
EE280KUW,vmicguestinterface,Hyper-V Guest Service Interface,Provides an interface for the Hyper-V host to interact with specific services running inside the virtual machine.,C:\Windows\System32\svchost.exe,b2a21dd4ad6ed25ca3440d6389675758,C:\Windows\system32\svchost.exe -k LocalSystemNetworkRestricted,SERVICE_WIN32_SHARE_PROCESS,C:\Windows\System32\icsvc.dll,true,true,The file is signed and the signature was verified.,Microsoft Windows,Microsoft Windows Production PCA 2011
EE280KUW,DiagTrack,Connected User Experiences and Telemetry,The Connected User Experiences and Telemetry service enables features that support in-application and connected user experiences. Additionally  this service manages the event driven collection and transmission of diagnostic and usage information (used to improve the experience and quality of the Windows Platform) when the diagnostics and usage privacy option settings are enabled under Feedback and Diagnostics.,C:\Windows\System32\svchost.exe,b2a21dd4ad6ed25ca3440d6389675758,C:\Windows\System32\svchost.exe -k utcsvc,SERVICE_WIN32_OWN_PROCESS,C:\Windows\System32\diagtrack.dll,true,true,The file is signed and the signature was verified.,Microsoft Windows,Microsoft Windows Production PCA 2011
EE280KUW,msgpiowin32,Common Driver for Buttons  DockMode and Laptop/Slate Indicator,,C:\Windows\System32\drivers\msgpiowin32.sys,ab4d4c1208a5712e4f209fb0cb7050df,\SystemRoot\System32\drivers\msgpiowin32.sys,SERVICE_KERNEL_DRIVER,,true,true,The file is signed and the signature was verified.,Microsoft Windows,Microsoft Windows Production PCA 2011
EE280KUW,KPSSVC,KDC Proxy Server service (KPS),KDC Proxy Server service runs on edge servers to proxy Kerberos protocol messages to domain controllers on the corporate network.,C:\Windows\System32\svchost.exe,b2a21dd4ad6ed25ca3440d6389675758,C:\Windows\system32\svchost.exe -k KpsSvcGroup,SERVICE_WIN32_SHARE_PROCESS,C:\Windows\System32\kpssvc.dll,true,true,The file is signed and the signature was verified.,Microsoft Windows,Microsoft Windows Production PCA 2011
EE280KUW,WdNisDrv,Windows Defender Network Inspection System Driver,Helps guard against intrusion attempts targeting known and newly discovered vulnerabilities in network protocols,C:\Windows\System32\drivers\WdNisDrv.sys,83aa2129f6dcf3e3b000c54b4312ce73,system32\Drivers\WdNisDrv.sys,SERVICE_KERNEL_DRIVER,,true,true,The file is signed and the signature was verified.,Microsoft Windows,Microsoft Windows Production PCA 2011
EE280KUW,ClipSVC,Client License Service (ClipSVC),Provides infrastructure support for the Microsoft Store. This service is started on demand and if disabled applications bought using Windows Store will not behave correctly.,C:\Windows\System32\svchost.exe,b2a21dd4ad6ed25ca3440d6389675758,C:\Windows\System32\svchost.exe -k wsappx,SERVICE_WIN32_SHARE_PROCESS,C:\Windows\System32\ClipSVC.dll,true,true,The file is signed and the signature was verified.,Microsoft Windows,Microsoft Windows Production PCA 2011
EE280KUW,GoogleVssProvider,GoogleVssProvider,Google Vss Hardware Provider,C:\Windows\System32\dllhost.exe,b133e6406e7a11c5a3eeecff6d3cddc5,C:\Windows\system32\dllhost.exe /Processid:{A7CCA429-5F8F-4A5B-B524-82C38D561286},SERVICE_WIN32_OWN_PROCESS,,true,true,The file is signed and the signature was verified.,Microsoft Windows,Microsoft Windows Production PCA 2011
EE280KUW,mrxsmb20,SMB 2.0 MiniRedirector,Implements the SMB 2.0 protocol  which provides connectivity to network resources on Windows Vista and later servers,C:\Windows\System32\drivers\mrxsmb20.sys,5f233a8b501052b14fbfa8d9fb4aec46,system32\DRIVERS\mrxsmb20.sys,SERVICE_FILE_SYSTEM_DRIVER,,true,true,The file is signed and the signature was verified.,Microsoft Windows,Microsoft Windows Production PCA 2011
EE280KUW,storahci,Microsoft Standard SATA AHCI Driver,,C:\Windows\System32\drivers\storahci.sys,500ffbe28345c0e4f6613de5f7538cb1,\SystemRoot\System32\drivers\storahci.sys,SERVICE_KERNEL_DRIVER,,true,true,The file is signed and the signature was verified.,Microsoft Windows,Microsoft Windows Production PCA 2011
