hostname,name,descriptivename,description,path,md5,arguments,type,servicedll,pathsignatureexists,pathsignatureverified,pathsignaturedescription,pathcertificatesubject,pathcertificateissuer
NL930NGM,Ndisuio,NDIS Usermode I/O Protocol,,C:\Windows\System32\drivers\ndisuio.sys,da5de1fccc854cb78e65bab581edc83b,\SystemRoot\system32\DRIVERS\ndisuio.sys,SERVICE_KERNEL_DRIVER,,true,true,The file is signed and the signature was verified.,Microsoft Windows,Microsoft Windows Production PCA 2011
NL930NGM,sermouse,Serial Mouse Driver,,C:\Windows\System32\drivers\sermouse.sys,7d885724def0c227b6941e152f13a110,\SystemRoot\System32\drivers\sermouse.sys,SERVICE_KERNEL_DRIVER,,true,true,The file is signed and the signature was verified.,Microsoft Windows,Microsoft Windows Production PCA 2011
NL930NGM,MsBridge,Microsoft MAC Bridge,Microsoft MAC Bridge,C:\Windows\System32\drivers\bridge.sys,dfd0bb95e4a6b7832cd96fb3a8fbb518,\SystemRoot\system32\DRIVERS\bridge.sys,SERVICE_KERNEL_DRIVER,,true,true,The file is signed and the signature was verified.,Microsoft Windows,Microsoft Windows Production PCA 2011
NL930NGM,TermService,Remote Desktop Services,Allows users to connect interactively to a remote computer. Remote Desktop and Remote Desktop Session Host Server depend on this service.  To prevent remote use of this computer  clear the checkboxes on the Remote tab of the System properties control panel item.,C:\Windows\System32\svchost.exe,392a255b48ce8c257466fbc5c1b201b9,C:\Windows\System32\svchost.exe -k termsvcs,SERVICE_WIN32_SHARE_PROCESS,C:\Windows\System32\termsrv.dll,true,true,The file is signed and the signature was verified.,Microsoft Windows,Microsoft Windows Production PCA 2011
NL930NGM,flpydisk,Floppy Disk Driver,,C:\Windows\System32\drivers\flpydisk.sys,e661c854a33849a9063a234e9e0977f1,\SystemRoot\System32\drivers\flpydisk.sys,SERVICE_KERNEL_DRIVER,,true,true,The file is signed and the signature was verified.,Microsoft Windows,Microsoft Windows Production PCA 2011
NL930NGM,NdisImPlatform,Microsoft Network Adapter Multiplexor Protocol,Microsoft Network Adapter Multiplexor Protocol,C:\Windows\System32\drivers\NdisImPlatform.sys,689018dd9db326f9aad76f1ab674241d,\SystemRoot\system32\DRIVERS\NdisImPlatform.sys,SERVICE_KERNEL_DRIVER,,true,true,The file is signed and the signature was verified.,Microsoft Windows,Microsoft Windows Production PCA 2011
NL930NGM,srv2,Server SMB 2.xxx Driver,Enables connectivity from Windows Vista and later clients,C:\Windows\System32\drivers\srv2.sys,21ae582b93e25021a5cb64185168f6f2,System32\DRIVERS\srv2.sys,SERVICE_FILE_SYSTEM_DRIVER,,true,true,The file is signed and the signature was verified.,Microsoft Windows,Microsoft Windows Production PCA 2011
NL930NGM,mfeaack,McAfee Inc. mfeaack,,C:\Windows\System32\drivers\mfeaack.sys,c39c473c01b8eaaad6a0f5f242a77354,system32\drivers\mfeaack.sys,SERVICE_KERNEL_DRIVER,,true,true,The file is signed and the signature was verified.,Microsoft Windows Hardware Compatibility Publisher,Microsoft Windows Hardware Compatibility PCA
NL930NGM,AmdK8,AMD K8 Processor Driver,,C:\Windows\System32\drivers\amdk8.sys,8e4e9ae537eb8bb49f46b0df0dd0d46b,\SystemRoot\System32\drivers\amdk8.sys,SERVICE_KERNEL_DRIVER,,true,true,The file is signed and the signature was verified.,Microsoft Windows,Microsoft Windows Production PCA 2011
NL930NGM,1394ohci,1394 OHCI Compliant Host Controller,,C:\Windows\System32\drivers\1394ohci.sys,f9dd760a329d8bedecddf5f589f7941f,\SystemRoot\System32\drivers\1394ohci.sys,SERVICE_KERNEL_DRIVER,,true,true,The file is signed and the signature was verified.,Microsoft Windows,Microsoft Windows Production PCA 2011
NL930NGM,HidUsb,Microsoft HID Class Driver,,C:\Windows\System32\drivers\hidusb.sys,20e945d0d0a0e15295c1b29a4930c803,\SystemRoot\System32\drivers\hidusb.sys,SERVICE_KERNEL_DRIVER,,true,true,The file is signed and the signature was verified.,Microsoft Windows,Microsoft Windows Production PCA 2011
NL930NGM,swprv,Microsoft Software Shadow Copy Provider,Manages software-based volume shadow copies taken by the Volume Shadow Copy service. If this service is stopped  software-based volume shadow copies cannot be managed. If this service is disabled  any services that explicitly depend on it will fail to start.,C:\Windows\System32\svchost.exe,392a255b48ce8c257466fbc5c1b201b9,C:\Windows\System32\svchost.exe -k swprv,SERVICE_WIN32_OWN_PROCESS,C:\Windows\System32\swprv.dll,true,true,The file is signed and the signature was verified.,Microsoft Windows,Microsoft Windows Production PCA 2011
NL930NGM,mfefirek,McAfee Inc. mfefirek,,C:\Windows\System32\drivers\mfefirek.sys,364344fec7ba345f0929dc0093ea034b,system32\drivers\mfefirek.sys,SERVICE_KERNEL_DRIVER,,true,true,The file is signed and the signature was verified.,Microsoft Windows Hardware Compatibility Publisher,Microsoft Windows Hardware Compatibility PCA
NL930NGM,SNMPTRAP,SNMP Trap,Receives trap messages generated by local or remote Simple Network Management Protocol (SNMP) agents and forwards the messages to SNMP management programs running on this computer. If this service is stopped  SNMP-based programs on this computer will not receive SNMP trap messages. If this service is disabled  any services that explicitly depend on it will fail to start.,C:\Windows\System32\snmptrap.exe,879fe1513b65c40afdffaffb4d0b2536,C:\Windows\System32\snmptrap.exe,SERVICE_WIN32_OWN_PROCESS,,true,true,The file is signed and the signature was verified.,Microsoft Windows,Microsoft Windows Production PCA 2011
NL930NGM,AppXSvc,AppX Deployment Service (AppXSVC),Provides infrastructure support for deploying Store applications. This service is started on demand and if disabled Store applications will not be deployed to the system  and may not function properly.,C:\Windows\System32\svchost.exe,392a255b48ce8c257466fbc5c1b201b9,C:\Windows\system32\svchost.exe -k wsappx,SERVICE_WIN32_SHARE_PROCESS,C:\Windows\System32\appxdeploymentserver.dll,true,true,The file is signed and the signature was verified.,Microsoft Windows,Microsoft Windows Production PCA 2011
NL930NGM,LSM,Local Session Manager,Core Windows Service that manages local user sessions. Stopping or disabling this service will result in system instability.,C:\Windows\System32\svchost.exe,392a255b48ce8c257466fbc5c1b201b9,C:\Windows\system32\svchost.exe -k DcomLaunch,SERVICE_WIN32_SHARE_PROCESS,C:\Windows\System32\lsm.dll,true,true,The file is signed and the signature was verified.,Microsoft Windows,Microsoft Windows Production PCA 2011
NL930NGM,bowser,Browser Support Driver,Implements the kernel datagram receiver for the computer browser browser service.,C:\Windows\System32\drivers\bowser.sys,22e97910f3a2625dbebb6429bdc97796,system32\DRIVERS\bowser.sys,SERVICE_FILE_SYSTEM_DRIVER,,true,true,The file is signed and the signature was verified.,Microsoft Windows,Microsoft Windows Production PCA 2011
NL930NGM,Filetrace,Filetrace,ETW File Trace Filter,C:\Windows\System32\drivers\filetrace.sys,1f426376b0e010d68bac74f742befc4d,system32\drivers\filetrace.sys,SERVICE_FILE_SYSTEM_DRIVER,,true,true,The file is signed and the signature was verified.,Microsoft Windows,Microsoft Windows Production PCA 2011
NL930NGM,FxPPM,Power Framework Processor Driver,,C:\Windows\System32\drivers\fxppm.sys,1b059a7f98240853db4ed6a1e539cc39,\SystemRoot\System32\drivers\fxppm.sys,SERVICE_KERNEL_DRIVER,,true,true,The file is signed and the signature was verified.,Microsoft Windows,Microsoft Windows Production PCA 2011
NL930NGM,acpipagr,ACPI Processor Aggregator Driver,,C:\Windows\System32\drivers\acpipagr.sys,ab0eccb409f983930fd90fe8797f85a7,\SystemRoot\System32\drivers\acpipagr.sys,SERVICE_KERNEL_DRIVER,,true,true,The file is signed and the signature was verified.,Microsoft Windows,Microsoft Windows Production PCA 2011
NL930NGM,gpsvc,Group Policy Client,The service is responsible for applying settings configured by administrators for the computer and users through the Group Policy component. If the service is disabled  the settings will not be applied and applications and components will not be manageable through Group Policy. Any components or applications that depend on the Group Policy component might not be functional if the service is disabled.,C:\Windows\System32\svchost.exe,392a255b48ce8c257466fbc5c1b201b9,C:\Windows\system32\svchost.exe -k netsvcs,SERVICE_WIN32_SHARE_PROCESS,C:\Windows\System32\gpsvc.dll,true,true,The file is signed and the signature was verified.,Microsoft Windows,Microsoft Windows Production PCA 2011
NL930NGM,rdpbus,Remote Desktop Device Redirector Bus Driver,,C:\Windows\System32\drivers\rdpbus.sys,35ecf94a55875b58981e9b69dd3ae1ac,\SystemRoot\System32\drivers\rdpbus.sys,SERVICE_KERNEL_DRIVER,,true,true,The file is signed and the signature was verified.,Microsoft Windows,Microsoft Windows Production PCA 2011
NL930NGM,WmiAcpi,Microsoft Windows Management Interface for ACPI,,C:\Windows\System32\drivers\wmiacpi.sys,dd895d7d269fbc92af23012bd327746e,\SystemRoot\System32\drivers\wmiacpi.sys,SERVICE_KERNEL_DRIVER,,true,true,The file is signed and the signature was verified.,Microsoft Windows,Microsoft Windows Production PCA 2011
NL930NGM,vmicvss,Hyper-V Volume Shadow Copy Requestor,Coordinates the communications that are required to use Volume Shadow Copy Service to back up applications and data on this virtual machine from the operating system on the physical computer.,C:\Windows\System32\svchost.exe,392a255b48ce8c257466fbc5c1b201b9,C:\Windows\system32\svchost.exe -k LocalSystemNetworkRestricted,SERVICE_WIN32_SHARE_PROCESS,C:\Windows\System32\icsvc.dll,true,true,The file is signed and the signature was verified.,Microsoft Windows,Microsoft Windows Production PCA 2011
NL930NGM,NetBT,NetBT,This service implements NetBios over TCP/IP.,C:\Windows\System32\drivers\netbt.sys,a85a21935fa5e3c48422a72db06fd263,System32\DRIVERS\netbt.sys,SERVICE_KERNEL_DRIVER,,true,true,The file is signed and the signature was verified.,Microsoft Windows,Microsoft Windows Production PCA 2011
NL930NGM,DiagTrack,Diagnostics Tracking Service,The Diagnostics Tracking Service enables data collection about functional issues in Windows components.,C:\Windows\System32\svchost.exe,392a255b48ce8c257466fbc5c1b201b9,C:\Windows\System32\svchost.exe -k utcsvc,SERVICE_WIN32_OWN_PROCESS,C:\Windows\System32\diagtrack.dll,true,true,The file is signed and the signature was verified.,Microsoft Windows,Microsoft Windows Production PCA 2011
NL930NGM,HidBatt,HID UPS Battery Driver,,C:\Windows\System32\drivers\hidbatt.sys,43143d6f8277e360be46af311242d74f,\SystemRoot\System32\drivers\HidBatt.sys,SERVICE_KERNEL_DRIVER,,true,true,The file is signed and the signature was verified.,Microsoft Windows,Microsoft Windows Production PCA 2011
NL930NGM,IpFilterDriver,IP Traffic Filter Driver,IP Traffic Filter Driver,C:\Windows\System32\drivers\ipfltdrv.sys,a99324c59507a8cd1e17a695ff608415,system32\DRIVERS\ipfltdrv.sys,SERVICE_KERNEL_DRIVER,,true,true,The file is signed and the signature was verified.,Microsoft Windows,Microsoft Windows Production PCA 2011
NL930NGM,CLFS,Common Log (CLFS),General-purpose logging service,C:\Windows\System32\drivers\clfs.sys,c25e26c84fadf236b697b96c0c811923,\SystemRoot\System32\drivers\CLFS.sys,SERVICE_KERNEL_DRIVER,,true,true,The file is signed and the signature was verified.,Microsoft Windows,Microsoft Windows Production PCA 2011
NL930NGM,mshidumdf,Pass-through HID to UMDF Driver,Device Driver to provide pass-through interface between HIDCLASS and UMDF,C:\Windows\System32\drivers\mshidumdf.sys,2b910dbc368b940b3568de81a729779a,\SystemRoot\System32\drivers\mshidumdf.sys,SERVICE_KERNEL_DRIVER,,true,true,The file is signed and the signature was verified.,Microsoft Windows,Microsoft Windows Production PCA 2011
NL930NGM,DeviceAssociationService,Device Association Service,Enables pairing between the system and wired or wireless devices.,C:\Windows\System32\svchost.exe,392a255b48ce8c257466fbc5c1b201b9,C:\Windows\system32\svchost.exe -k LocalSystemNetworkRestricted,SERVICE_WIN32_SHARE_PROCESS,C:\Windows\System32\das.dll,true,true,The file is signed and the signature was verified.,Microsoft Windows,Microsoft Windows Production PCA 2011
NL930NGM,FontCache,Windows Font Cache Service,Optimizes performance of applications by caching commonly used font data. Applications will start this service if it is not already running. It can be disabled  though doing so will degrade application performance.,C:\Windows\System32\svchost.exe,392a255b48ce8c257466fbc5c1b201b9,C:\Windows\system32\svchost.exe -k LocalService,SERVICE_WIN32_SHARE_PROCESS,C:\Windows\System32\FntCache.dll,true,true,The file is signed and the signature was verified.,Microsoft Windows,Microsoft Windows Production PCA 2011
NL930NGM,SpbCx,Simple Peripheral Bus Support Library,,C:\Windows\System32\drivers\SpbCx.sys,466eb328ecc824bd01880652b892343e,system32\drivers\SpbCx.sys,SERVICE_KERNEL_DRIVER,,true,true,The file is signed and the signature was verified.,Microsoft Windows,Microsoft Windows Production PCA 2011
NL930NGM,NetTcpPortSharing,Net.Tcp Port Sharing Service,Provides ability to share TCP ports over the net.tcp protocol.,C:\Windows\Microsoft.NET\Framework64\v4.0.30319\SMSvcHost.exe,e2af999338de03f0d5829a955a5e5da7,C:\Windows\Microsoft.NET\Framework64\v4.0.30319\SMSvcHost.exe,SERVICE_WIN32_SHARE_PROCESS,,true,true,The file is signed and the signature was verified.,Microsoft Windows,Microsoft Windows Production PCA 2011
NL930NGM,THREADORDER,Thread Ordering Server,Provides ordered execution for a group of threads within a specific period of time.,C:\Windows\System32\svchost.exe,392a255b48ce8c257466fbc5c1b201b9,C:\Windows\system32\svchost.exe -k LocalService,SERVICE_WIN32_SHARE_PROCESS,C:\Windows\System32\mmcss.dll,true,true,The file is signed and the signature was verified.,Microsoft Windows,Microsoft Windows Production PCA 2011
NL930NGM,MSiSCSI,Microsoft iSCSI Initiator Service,Manages Internet SCSI (iSCSI) sessions from this computer to remote iSCSI target devices. If this service is stopped  this computer will not be able to login or access iSCSI targets. If this service is disabled  any services that explicitly depend on it will fail to start.,C:\Windows\System32\svchost.exe,392a255b48ce8c257466fbc5c1b201b9,C:\Windows\system32\svchost.exe -k netsvcs,SERVICE_WIN32_SHARE_PROCESS,C:\Windows\System32\iscsiexe.dll,true,true,The file is signed and the signature was verified.,Microsoft Windows,Microsoft Windows Production PCA 2011
NL930NGM,rdbss,Redirected Buffering Sub System,Provides the framework for network mini-redirectors,C:\Windows\System32\drivers\rdbss.sys,d6a7b5035244c299d12ac80b06da5798,system32\DRIVERS\rdbss.sys,SERVICE_FILE_SYSTEM_DRIVER,,true,true,The file is signed and the signature was verified.,Microsoft Windows,Microsoft Windows Production PCA 2011
NL930NGM,WinRM,Windows Remote Management (WS-Management),Windows Remote Management (WinRM) service implements the WS-Management protocol for remote management. WS-Management is a standard web services protocol used for remote software and hardware management. The WinRM service listens on the network for WS-Management requests and processes them. The WinRM Service needs to be configured with a listener using winrm.cmd command line tool or through Group Policy in order for it to listen over the network. The WinRM service provides access to WMI data and enables event collection. Event collection and subscription to events require that the service is running. WinRM messages use HTTP and HTTPS as transports. The WinRM service does not depend on IIS but is preconfigured to share a port with IIS on the same machine.  The WinRM service reserves the /wsman URL prefix. To prevent conflicts with IIS  administrators should ensure that any websites hosted on IIS do not use the /wsman URL prefix.,C:\Windows\System32\svchost.exe,392a255b48ce8c257466fbc5c1b201b9,C:\Windows\System32\svchost.exe -k NetworkService,SERVICE_WIN32_SHARE_PROCESS,C:\Windows\System32\WsmSvc.dll,true,true,The file is signed and the signature was verified.,Microsoft Windows,Microsoft Windows Production PCA 2011
NL930NGM,viaide,viaide,,C:\Windows\System32\drivers\viaide.sys,39ae0dba6648a56643ef037f8c3b952e,\SystemRoot\System32\drivers\viaide.sys,SERVICE_KERNEL_DRIVER,,true,true,The file is signed and the signature was verified.,Microsoft Windows,Microsoft Windows Production PCA 2011
NL930NGM,pciide,pciide,,C:\Windows\System32\drivers\pciide.sys,28761071e91573ece25ae9e1d9c2e874,\SystemRoot\System32\drivers\pciide.sys,SERVICE_KERNEL_DRIVER,,true,true,The file is signed and the signature was verified.,Microsoft Windows,Microsoft Windows Production PCA 2011
NL930NGM,KtmRm,KtmRm for Distributed Transaction Coordinator,Coordinates transactions between the Distributed Transaction Coordinator (MSDTC) and the Kernel Transaction Manager (KTM). If it is not needed  it is recommended that this service remain stopped. If it is needed  both MSDTC and KTM will start this service automatically. If this service is disabled  any MSDTC transaction interacting with a Kernel Resource Manager will fail and any services that explicitly depend on it will fail to start.,C:\Windows\System32\svchost.exe,392a255b48ce8c257466fbc5c1b201b9,C:\Windows\System32\svchost.exe -k NetworkServiceAndNoImpersonation,SERVICE_WIN32_SHARE_PROCESS,C:\Windows\System32\msdtckrm.dll,true,true,The file is signed and the signature was verified.,Microsoft Windows,Microsoft Windows Production PCA 2011
NL930NGM,swenum,Software Bus Driver,,C:\Windows\System32\drivers\swenum.sys,ad6005019d6150104d4c4d8a9c5a279e,\SystemRoot\System32\drivers\swenum.sys,SERVICE_KERNEL_DRIVER,,true,true,The file is signed and the signature was verified.,Microsoft Windows,Microsoft Windows Production PCA 2011
NL930NGM,NdisCap,Microsoft NDIS Capture,Microsoft NDIS Capture,C:\Windows\System32\drivers\ndiscap.sys,44452c91cbe3e393caeeef895e9f0736,\SystemRoot\system32\DRIVERS\ndiscap.sys,SERVICE_KERNEL_DRIVER,,true,true,The file is signed and the signature was verified.,Microsoft Windows,Microsoft Windows Production PCA 2011
NL930NGM,WdiServiceHost,Diagnostic Service Host,The Diagnostic Service Host is used by the Diagnostic Policy Service to host diagnostics that need to run in a Local Service context.  If this service is stopped  any diagnostics that depend on it will no longer function.,C:\Windows\System32\svchost.exe,392a255b48ce8c257466fbc5c1b201b9,C:\Windows\System32\svchost.exe -k LocalService,SERVICE_WIN32_SHARE_PROCESS,C:\Windows\System32\wdi.dll,true,true,The file is signed and the signature was verified.,Microsoft Windows,Microsoft Windows Production PCA 2011
NL930NGM,sppsvc,Software Protection,Enables the download  installation and enforcement of digital licenses for Windows and Windows applications. If the service is disabled  the operating system and licensed applications may run in a notification mode. It is strongly recommended that you not disable the Software Protection service.,C:\Windows\System32\sppsvc.exe,7025505cee0218da97c77e75915666c2,C:\Windows\system32\sppsvc.exe,SERVICE_WIN32_OWN_PROCESS,,true,true,The file is signed and the signature was verified.,Microsoft Windows,Microsoft Windows Production PCA 2011
NL930NGM,ql40xx2i,QLogic iSCSI Miniport Inbox Driver,,C:\Windows\System32\drivers\ql40xx2i.sys,b7fe7943f770e7f2fecaea199817671d,\SystemRoot\System32\drivers\ql40xx2i.sys,SERVICE_KERNEL_DRIVER,,true,true,The file is signed and the signature was verified.,Microsoft Windows,Microsoft Windows Production PCA 2011
NL930NGM,netvsc,netvsc,,C:\Windows\System32\drivers\netvsc63.sys,f9627e0c81c61aca722199a220d86fc8,\SystemRoot\System32\drivers\netvsc63.sys,SERVICE_KERNEL_DRIVER,,true,true,The file is signed and the signature was verified.,Microsoft Windows,Microsoft Windows Production PCA 2011
NL930NGM,uliagpkx,Uli AGP Bus Filter,,C:\Windows\System32\drivers\ULIAGPKX.SYS,63d002fd84071f27e70d1f6272703003,\SystemRoot\System32\drivers\uliagpkx.sys,SERVICE_KERNEL_DRIVER,,true,true,The file is signed and the signature was verified.,Microsoft Windows,Microsoft Windows Production PCA 2011
NL930NGM,netprofm,Network List Service,Identifies the networks to which the computer has connected  collects and stores properties for these networks  and notifies applications when these properties change.,C:\Windows\System32\svchost.exe,392a255b48ce8c257466fbc5c1b201b9,C:\Windows\System32\svchost.exe -k LocalService,SERVICE_WIN32_SHARE_PROCESS,C:\Windows\System32\netprofmsvc.dll,true,true,The file is signed and the signature was verified.,Microsoft Windows,Microsoft Windows Production PCA 2011
NL930NGM,cfn-hup,CloudFormation cfn-hup,CloudFormation cfn-hup for Windows,C:\Program Files\Amazon\cfn-bootstrap\winhup.exe,72b5cff69366680d3ac7f4bba760dc1e,C:\Program Files\Amazon\cfn-bootstrap\winhup.exe,SERVICE_WIN32_OWN_PROCESS,,false,false,The file is not signed.,,
NL930NGM,Browser,Computer Browser,Maintains an updated list of computers on the network and supplies this list to computers designated as browsers. If this service is stopped  this list will not be updated or maintained. If this service is disabled  any services that explicitly depend on it will fail to start.,C:\Windows\System32\svchost.exe,392a255b48ce8c257466fbc5c1b201b9,C:\Windows\System32\svchost.exe -k netsvcs,SERVICE_WIN32_SHARE_PROCESS,C:\Windows\System32\browser.dll,true,true,The file is signed and the signature was verified.,Microsoft Windows,Microsoft Windows Production PCA 2011
NL930NGM,lmhosts,TCP/IP NetBIOS Helper,Provides support for the NetBIOS over TCP/IP (NetBT) service and NetBIOS name resolution for clients on the network  therefore enabling users to share files  print  and log on to the network. If this service is stopped  these functions might be unavailable. If this service is disabled  any services that explicitly depend on it will fail to start.,C:\Windows\System32\svchost.exe,392a255b48ce8c257466fbc5c1b201b9,C:\Windows\system32\svchost.exe -k LocalServiceNetworkRestricted,SERVICE_WIN32_SHARE_PROCESS,C:\Windows\System32\lmhsvc.dll,true,true,The file is signed and the signature was verified.,Microsoft Windows,Microsoft Windows Production PCA 2011
NL930NGM,scfilter,Smart card PnP Class Filter Driver,Smart card reader filter driver enabling smart card PnP.,C:\Windows\System32\drivers\scfilter.sys,8521ab4a436377e7098131817a56eccb,System32\DRIVERS\scfilter.sys,SERVICE_KERNEL_DRIVER,,true,true,The file is signed and the signature was verified.,Microsoft Windows,Microsoft Windows Production PCA 2011
NL930NGM,FontCache3.0.0.0,Windows Presentation Foundation Font Cache 3.0.0.0,Optimizes performance of Windows Presentation Foundation (WPF) applications by caching commonly used font data. WPF applications will start this service if it is not already running. It can be disabled  though doing so will degrade the performance of WPF applications.,C:\Windows\Microsoft.Net\Framework64\v3.0\WPF\PresentationFontCache.exe,7ad9e05470b07b65d25cc7789e1bd0bf,C:\Windows\Microsoft.Net\Framework64\v3.0\WPF\PresentationFontCache.exe,SERVICE_WIN32_OWN_PROCESS,,true,true,The file is signed and the signature was verified.,Microsoft Windows,Microsoft Windows Production PCA 2011
NL930NGM,Wanarpv6,Remote Access IPv6 ARP Driver,Remote Access IPv6 ARP Driver,C:\Windows\System32\drivers\wanarp.sys,b07aea88ca227e997d623acda145cd4e,\SystemRoot\system32\DRIVERS\wanarp.sys,SERVICE_KERNEL_DRIVER,,true,true,The file is signed and the signature was verified.,Microsoft Windows,Microsoft Windows Production PCA 2011
NL930NGM,ALG,Application Layer Gateway Service,Provides support for 3rd party protocol plug-ins for Internet Connection Sharing,C:\Windows\System32\alg.exe,f73b906d0e1334b6c2a16a04ad6bd596,C:\Windows\System32\alg.exe,SERVICE_WIN32_OWN_PROCESS,,true,true,The file is signed and the signature was verified.,Microsoft Windows,Microsoft Windows Production PCA 2011
NL930NGM,volmgr,Volume Manager Driver,,C:\Windows\System32\drivers\volmgr.sys,06c57881bd294f17223ed1598aa67ec1,\SystemRoot\System32\drivers\volmgr.sys,SERVICE_KERNEL_DRIVER,,true,true,The file is signed and the signature was verified.,Microsoft Windows,Microsoft Windows Production PCA 2011
NL930NGM,UASPStor,USB Attached SCSI (UAS) Driver,,C:\Windows\System32\drivers\uaspstor.sys,d50e535613f54987559a79ae675db320,\SystemRoot\System32\drivers\uaspstor.sys,SERVICE_KERNEL_DRIVER,,true,true,The file is signed and the signature was verified.,Microsoft Windows,Microsoft Windows Production PCA 2011
NL930NGM,iphlpsvc,IP Helper,Provides tunnel connectivity using IPv6 transition technologies (6to4  ISATAP  Port Proxy  and Teredo)  and IP-HTTPS. If this service is stopped  the computer will not have the enhanced connectivity benefits that these technologies offer.,C:\Windows\System32\svchost.exe,392a255b48ce8c257466fbc5c1b201b9,C:\Windows\System32\svchost.exe -k NetSvcs,SERVICE_WIN32_SHARE_PROCESS,C:\Windows\System32\iphlpsvc.dll,true,true,The file is signed and the signature was verified.,Microsoft Windows,Microsoft Windows Production PCA 2011
NL930NGM,mrxsmb20,SMB 2.0 MiniRedirector,Implements the SMB 2.0 protocol  which provides connectivity to network resources on Windows Vista and later servers,C:\Windows\System32\drivers\mrxsmb20.sys,cfe5675ec44f15f0f2e41c994ccbf884,system32\DRIVERS\mrxsmb20.sys,SERVICE_FILE_SYSTEM_DRIVER,,true,true,The file is signed and the signature was verified.,Microsoft Windows,Microsoft Windows Production PCA 2011
NL930NGM,mfeplk,McAfee Inc. mfeplk,,C:\Windows\System32\drivers\mfeplk.sys,623c6654f3bb678f21167f5e9584f4f5,system32\drivers\mfeplk.sys,SERVICE_KERNEL_DRIVER,,true,true,The file is signed and the signature was verified.,Microsoft Windows Hardware Compatibility Publisher,Microsoft Windows Hardware Compatibility PCA
