hostname,name,descriptivename,description,path,md5,arguments,type,servicedll,pathsignatureexists,pathsignatureverified,pathsignaturedescription,pathcertificatesubject,pathcertificateissuer
NL930NGM,FsDepends,File System Dependency Minifilter,This minifilter tracks the dependencies associated with the various nested volumes/filesystems,C:\Windows\System32\drivers\FsDepends.sys,a5c32907d9488d4bed30689b3057f263,System32\drivers\FsDepends.sys,SERVICE_FILE_SYSTEM_DRIVER,,true,true,The file is signed and the signature was verified.,Microsoft Windows,Microsoft Windows Production PCA 2011
NL930NGM,mfeelamk,McAfee Inc. mfeelamk,,C:\Windows\System32\drivers\mfeelamk.sys,c2d0479fc5e19e0246c4395f4ba0b537,\SystemRoot\system32\drivers\mfeelamk.sys,SERVICE_KERNEL_DRIVER,,true,true,The file is signed and the signature was verified.,Microsoft Windows Hardware Compatibility Publisher,Microsoft Windows Hardware Compatibility PCA
NL930NGM,Netman,Network Connections,Manages objects in the Network and Dial-Up Connections folder  in which you can view both local area network and remote connections.,C:\Windows\System32\svchost.exe,392a255b48ce8c257466fbc5c1b201b9,C:\Windows\System32\svchost.exe -k LocalSystemNetworkRestricted,SERVICE_WIN32_SHARE_PROCESS,C:\Windows\System32\netman.dll,true,true,The file is signed and the signature was verified.,Microsoft Windows,Microsoft Windows Production PCA 2011
NL930NGM,Processor,Processor Driver,,C:\Windows\System32\drivers\processr.sys,1a49bf28deda983eaf583e7f59e4535e,\SystemRoot\System32\drivers\processr.sys,SERVICE_KERNEL_DRIVER,,true,true,The file is signed and the signature was verified.,Microsoft Windows,Microsoft Windows Production PCA 2011
NL930NGM,iaStorV,Intel RAID Controller Windows 7,,C:\Windows\System32\drivers\iaStorV.sys,d0d74099c0876b7af0b9da2da49175d6,\SystemRoot\System32\drivers\iaStorV.sys,SERVICE_KERNEL_DRIVER,,true,true,The file is signed and the signature was verified.,Microsoft Windows,Microsoft Windows Production PCA 2011
NL930NGM,usbehci,Microsoft USB 2.0 Enhanced Host Controller Miniport Driver,,C:\Windows\System32\drivers\usbehci.sys,3975d5d03513fb880d4a11ed5c0ac299,\SystemRoot\System32\drivers\usbehci.sys,SERVICE_KERNEL_DRIVER,,true,true,The file is signed and the signature was verified.,Microsoft Windows,Microsoft Windows Production PCA 2011
NL930NGM,LanmanWorkstation,Workstation,Creates and maintains client network connections to remote servers using the SMB protocol. If this service is stopped  these connections will be unavailable. If this service is disabled  any services that explicitly depend on it will fail to start.,C:\Windows\System32\svchost.exe,392a255b48ce8c257466fbc5c1b201b9,C:\Windows\System32\svchost.exe -k NetworkService,SERVICE_WIN32_SHARE_PROCESS,C:\Windows\System32\wkssvc.dll,true,true,The file is signed and the signature was verified.,Microsoft Windows,Microsoft Windows Production PCA 2011
NL930NGM,pci,PCI Bus Driver,,C:\Windows\System32\drivers\pci.sys,f7999ee803750e16288b8f9524f2d60d,\SystemRoot\System32\drivers\pci.sys,SERVICE_KERNEL_DRIVER,,true,true,The file is signed and the signature was verified.,Microsoft Windows,Microsoft Windows Production PCA 2011
NL930NGM,BITS,Background Intelligent Transfer Service,Transfers files in the background using idle network bandwidth. If the service is disabled  then any applications that depend on BITS  such as Windows Update or MSN Explorer  will be unable to automatically download programs and other information.,C:\Windows\System32\svchost.exe,392a255b48ce8c257466fbc5c1b201b9,C:\Windows\System32\svchost.exe -k netsvcs,SERVICE_WIN32_SHARE_PROCESS,C:\Windows\System32\qmgr.dll,true,true,The file is signed and the signature was verified.,Microsoft Windows,Microsoft Windows Production PCA 2011
NL930NGM,ShellHWDetection,Shell Hardware Detection,Provides notifications for AutoPlay hardware events.,C:\Windows\System32\svchost.exe,392a255b48ce8c257466fbc5c1b201b9,C:\Windows\System32\svchost.exe -k netsvcs,SERVICE_WIN32_SHARE_PROCESS,C:\Windows\System32\shsvcs.dll,true,true,The file is signed and the signature was verified.,Microsoft Windows,Microsoft Windows Production PCA 2011
NL930NGM,nvraid,nvraid,,C:\Windows\System32\drivers\nvraid.sys,0b86fc0cd920f1c56317d8bb961a1eb3,\SystemRoot\System32\drivers\nvraid.sys,SERVICE_KERNEL_DRIVER,,true,true,The file is signed and the signature was verified.,Microsoft Windows,Microsoft Windows Production PCA 2011
NL930NGM,usbprint,Microsoft USB PRINTER Class,,C:\Windows\System32\drivers\usbprint.sys,4693b048035cb50dd75e06c1388c66a2,\SystemRoot\System32\drivers\usbprint.sys,SERVICE_KERNEL_DRIVER,,true,true,The file is signed and the signature was verified.,Microsoft Windows,Microsoft Windows Production PCA 2011
NL930NGM,VSS,Volume Shadow Copy,Manages and implements Volume Shadow Copies used for backup and other purposes. If this service is stopped  shadow copies will be unavailable for backup and the backup may fail. If this service is disabled  any services that explicitly depend on it will fail to start.,C:\Windows\System32\VSSVC.exe,74b1754f8e5c11b4ded918046eb485e6,C:\Windows\system32\vssvc.exe,SERVICE_WIN32_OWN_PROCESS,,true,true,The file is signed and the signature was verified.,Microsoft Windows,Microsoft Windows Production PCA 2011
NL930NGM,mfencbdc,McAfee LLC. mfencbdc,McAfee Content driver Copyright (C) McAfee LLC  2018. All rights reserved.,C:\Windows\System32\drivers\mfencbdc.sys,78a22dea020843cb1ee8745526d7c496,system32\DRIVERS\mfencbdc.sys,SERVICE_KERNEL_DRIVER,,true,true,The file is signed and the signature was verified.,Microsoft Windows Hardware Compatibility Publisher,Microsoft Windows Hardware Compatibility PCA
NL930NGM,gagp30kx,Microsoft Generic AGPv3.0 Filter for K8 Processor Platforms,,C:\Windows\System32\drivers\GAGP30KX.SYS,f16db4b4b11aacc74be2a2034ecf2635,\SystemRoot\System32\drivers\gagp30kx.sys,SERVICE_KERNEL_DRIVER,,true,true,The file is signed and the signature was verified.,Microsoft Windows,Microsoft Windows Production PCA 2011
NL930NGM,Mup,Mup,Multiple UNC Provider Driver,C:\Windows\System32\drivers\mup.sys,e44f40d5cf4e10cf4c7df913269d5f39,\SystemRoot\System32\Drivers\mup.sys,SERVICE_FILE_SYSTEM_DRIVER,,true,true,The file is signed and the signature was verified.,Microsoft Windows,Microsoft Windows Production PCA 2011
NL930NGM,RemoteRegistry,Remote Registry,Enables remote users to modify registry settings on this computer. If this service is stopped  the registry can be modified only by users on this computer. If this service is disabled  any services that explicitly depend on it will fail to start.,C:\Windows\System32\svchost.exe,392a255b48ce8c257466fbc5c1b201b9,C:\Windows\system32\svchost.exe -k localService,SERVICE_WIN32_SHARE_PROCESS,C:\Windows\System32\regsvc.dll,true,true,The file is signed and the signature was verified.,Microsoft Windows,Microsoft Windows Production PCA 2011
NL930NGM,HyperVideo,HyperVideo,,C:\Windows\System32\drivers\HyperVideo.sys,1e3d772b4099cc39f31a4af95b0c12a5,\SystemRoot\system32\DRIVERS\HyperVideo.sys,SERVICE_KERNEL_DRIVER,,true,true,The file is signed and the signature was verified.,Microsoft Windows,Microsoft Windows Production PCA 2011
NL930NGM,mfevtp,McAfee Validation Trust Protection Service,Provides validation trust protection services,C:\Windows\System32\mfevtps.exe,243604a98993905b82bde7e7d8f2c8a9,"C:\WINDOWS\system32\mfevtps.exe""""""",SERVICE_WIN32_OWN_PROCESS,,true,true,The file is signed and the signature was verified.,"""McAfee",VeriSign Class 3 Code Signing 2010 CA
NL930NGM,LSI_SAS,LSI_SAS,,C:\Windows\System32\drivers\lsi_sas.sys,78b0b1cf322ce14b6b3ddd82d663a25c,\SystemRoot\System32\drivers\lsi_sas.sys,SERVICE_KERNEL_DRIVER,,true,true,The file is signed and the signature was verified.,Microsoft Windows,Microsoft Windows Production PCA 2011
NL930NGM,qlfcoei,QLogic [FCoE] STOR Miniport Inbox Driver (wx64),,C:\Windows\System32\drivers\qlfcoei.sys,1435603908f264bbf7e1ce210e7fe451,\SystemRoot\System32\drivers\qlfcoei.sys,SERVICE_KERNEL_DRIVER,,true,true,The file is signed and the signature was verified.,Microsoft Windows,Microsoft Windows Production PCA 2011
NL930NGM,intelide,intelide,,C:\Windows\System32\drivers\intelide.sys,4f1429e7a7964b6837f5db9e2a19c631,\SystemRoot\System32\drivers\intelide.sys,SERVICE_KERNEL_DRIVER,,true,true,The file is signed and the signature was verified.,Microsoft Windows,Microsoft Windows Production PCA 2011
NL930NGM,IPNAT,IP Network Address Translator,,C:\Windows\System32\drivers\ipnat.sys,8be3cedce3e87684309ed3333896ce5a,System32\drivers\ipnat.sys,SERVICE_KERNEL_DRIVER,,true,true,The file is signed and the signature was verified.,Microsoft Windows,Microsoft Windows Production PCA 2011
NL930NGM,amdxata,amdxata,,C:\Windows\System32\drivers\amdxata.sys,ff7d3f320df25a91803c3bdce73b6cb6,\SystemRoot\System32\drivers\amdxata.sys,SERVICE_KERNEL_DRIVER,,true,true,The file is signed and the signature was verified.,Microsoft Windows,Microsoft Windows Production PCA 2011
NL930NGM,VSTXRAID,VIA StorX Storage RAID Controller Windows Driver,,C:\Windows\System32\drivers\VSTXRAID.SYS,3866c248e862927d4910781f471cfdf5,\SystemRoot\System32\drivers\vstxraid.sys,SERVICE_KERNEL_DRIVER,,true,true,The file is signed and the signature was verified.,Microsoft Windows,Microsoft Windows Production PCA 2011
NL930NGM,vmickvpexchange,Hyper-V Data Exchange Service,Provides a mechanism to exchange data between the virtual machine and the operating system running on the physical computer.,C:\Windows\System32\svchost.exe,392a255b48ce8c257466fbc5c1b201b9,C:\Windows\system32\svchost.exe -k LocalSystemNetworkRestricted,SERVICE_WIN32_SHARE_PROCESS,C:\Windows\System32\icsvc.dll,true,true,The file is signed and the signature was verified.,Microsoft Windows,Microsoft Windows Production PCA 2011
NL930NGM,cdrom,CD-ROM Driver,,C:\Windows\System32\drivers\cdrom.sys,f067dd34df4f2cdbae05a8d6798b0e96,\SystemRoot\System32\drivers\cdrom.sys,SERVICE_KERNEL_DRIVER,,true,true,The file is signed and the signature was verified.,Microsoft Windows,Microsoft Windows Production PCA 2011
NL930NGM,mfesapsn,McAfee Process Start Notification Service,,C:\Program Files\McAfee\WebAdvisor\mfesapsn.sys,2e813665ec2d73c70c881bdb9f400b63,\??\C:\Program Files\McAfee\WebAdvisor\mfesapsn.sys,SERVICE_KERNEL_DRIVER,,true,true,The file is signed and the signature was verified.,"""McAfee",VeriSign Class 3 Code Signing 2010 CA
NL930NGM,Tcpip,TCP/IP Protocol Driver,TCP/IP Protocol Driver,C:\Windows\System32\drivers\tcpip.sys,ea7632faf96bed921dad40e6566c1c0b,\SystemRoot\System32\drivers\tcpip.sys,SERVICE_KERNEL_DRIVER,,true,true,The file is signed and the signature was verified.,Microsoft Windows,Microsoft Windows Production PCA 2011
NL930NGM,SerCx2,Serial UART Support Library,,C:\Windows\System32\drivers\SerCx2.sys,63749bd5e8e5dc15f2b015ac3eea376d,system32\drivers\SerCx2.sys,SERVICE_KERNEL_DRIVER,,true,true,The file is signed and the signature was verified.,Microsoft Windows,Microsoft Windows Production PCA 2011
NL930NGM,Spooler,Print Spooler,This service spools print jobs and handles interaction with the printer.  If you turn off this service  you won’t be able to print or see your printers.,C:\Windows\System32\spoolsv.exe,1a2b36ef5130c45f4ae08b298022cd75,C:\Windows\System32\spoolsv.exe,SERVICE_WIN32_OWN_PROCESS,,true,true,The file is signed and the signature was verified.,Microsoft Windows,Microsoft Windows Production PCA 2011
NL930NGM,storflt,Hyper-V Storage Accelerator,,C:\Windows\System32\drivers\vmstorfl.sys,bf065aa415401316e14aa0d48fe073db,\SystemRoot\System32\drivers\vmstorfl.sys,SERVICE_KERNEL_DRIVER,,true,true,The file is signed and the signature was verified.,Microsoft Windows,Microsoft Windows Production PCA 2011
NL930NGM,WPDBusEnum,Portable Device Enumerator Service,Enforces group policy for removable mass-storage devices. Enables applications such as Windows Media Player and Image Import Wizard to transfer and synchronize content using removable mass-storage devices.,C:\Windows\System32\svchost.exe,392a255b48ce8c257466fbc5c1b201b9,C:\Windows\system32\svchost.exe -k LocalSystemNetworkRestricted,SERVICE_WIN32_SHARE_PROCESS,C:\Windows\System32\wpdbusenum.dll,true,true,The file is signed and the signature was verified.,Microsoft Windows,Microsoft Windows Production PCA 2011
NL930NGM,WinNat,Windows NAT Driver,This service provides network address translation functionality,C:\Windows\System32\drivers\winnat.sys,56ebf09a970ff20686c0a2a325b9d37f,system32\drivers\winnat.sys,SERVICE_KERNEL_DRIVER,,true,true,The file is signed and the signature was verified.,Microsoft Windows,Microsoft Windows Production PCA 2011
NL930NGM,DsmSvc,Device Setup Manager,Enables the detection  download and installation of device-related software. If this service is disabled  devices may be configured with outdated software  and may not work correctly.,C:\Windows\System32\svchost.exe,392a255b48ce8c257466fbc5c1b201b9,C:\Windows\system32\svchost.exe -k netsvcs,SERVICE_WIN32_SHARE_PROCESS,C:\Windows\System32\DeviceSetupManager.dll,true,true,The file is signed and the signature was verified.,Microsoft Windows,Microsoft Windows Production PCA 2011
NL930NGM,Rasl2tp,WAN Miniport (L2TP),WAN Miniport (L2TP),C:\Windows\System32\drivers\rasl2tp.sys,f149c8d63749ba7a5190af81a92c5b99,\SystemRoot\System32\drivers\rasl2tp.sys,SERVICE_KERNEL_DRIVER,,true,true,The file is signed and the signature was verified.,Microsoft Windows,Microsoft Windows Production PCA 2011
NL930NGM,mfeavfk,McAfee Inc. mfeavfk,,C:\Windows\System32\drivers\mfeavfk.sys,5d180b41b3b1b8ccb279ed86a4bf7980,system32\drivers\mfeavfk.sys,SERVICE_KERNEL_DRIVER,,true,true,The file is signed and the signature was verified.,Microsoft Windows Hardware Compatibility Publisher,Microsoft Windows Hardware Compatibility PCA
NL930NGM,ClientAnalyticsService,ClientAnalyticsService,,C:\Program Files\Common Files\McAfee\ClientAnalytics\Legacy\McClientAnalytics.exe,554b4d901adbfd8faed3d704c2ac8d83,"C:\Program Files\Common Files\McAfee\ClientAnalytics\Legacy\McClientAnalytics.exe""""""",SERVICE_WIN32_OWN_PROCESS,,true,true,The file is signed and the signature was verified.,"""McAfee",Symantec Class 3 SHA256 Code Signing CA
NL930NGM,Modem,Modem,,C:\Windows\System32\drivers\modem.sys,ce44d68328d4d0b9de39aaaf0c8e0d41,system32\drivers\modem.sys,SERVICE_KERNEL_DRIVER,,true,true,The file is signed and the signature was verified.,Microsoft Windows,Microsoft Windows Production PCA 2011
NL930NGM,defragsvc,Optimize drives,Helps the computer run more efficiently by optimizing files on storage drives.,C:\Windows\System32\svchost.exe,392a255b48ce8c257466fbc5c1b201b9,C:\Windows\system32\svchost.exe -k defragsvc,SERVICE_WIN32_OWN_PROCESS,C:\Windows\System32\defragsvc.dll,true,true,The file is signed and the signature was verified.,Microsoft Windows,Microsoft Windows Production PCA 2011
NL930NGM,USBHUB3,SuperSpeed Hub,,C:\Windows\System32\drivers\USBHUB3.SYS,be76d5cd5ab470e6b08bc57cdf5fda66,\SystemRoot\System32\drivers\UsbHub3.sys,SERVICE_KERNEL_DRIVER,,true,true,The file is signed and the signature was verified.,Microsoft Windows,Microsoft Windows Production PCA 2011
NL930NGM,WEPHOSTSVC,Windows Encryption Provider Host Service,Windows Encryption Provider Host Service brokers encryption related functionalities from 3rd Party Encryption Providers to processes that need to evaluate and apply EAS policies. Stopping this will compromise EAS compliancy checks that have been established by the connected Mail Accounts,C:\Windows\System32\svchost.exe,392a255b48ce8c257466fbc5c1b201b9,C:\Windows\system32\svchost.exe -k WepHostSvcGroup,SERVICE_WIN32_SHARE_PROCESS,C:\Windows\System32\wephostsvc.dll,true,true,The file is signed and the signature was verified.,Microsoft Windows,Microsoft Windows Production PCA 2011
NL930NGM,srv,Server SMB 1.xxx Driver,Enables connectivity from Windows XP and earlier clients,C:\Windows\System32\drivers\srv.sys,592968ec3011e7a8340f8a4d4f43d7a0,System32\DRIVERS\srv.sys,SERVICE_FILE_SYSTEM_DRIVER,,true,true,The file is signed and the signature was verified.,Microsoft Windows,Microsoft Windows Production PCA 2011
NL930NGM,vhdmp,vhdmp,,C:\Windows\System32\drivers\vhdmp.sys,e9080dce5ab04ec13bccd9c53157f16d,\SystemRoot\System32\drivers\vhdmp.sys,SERVICE_KERNEL_DRIVER,,true,true,The file is signed and the signature was verified.,Microsoft Windows,Microsoft Windows Production PCA 2011
NL930NGM,AudioEndpointBuilder,Windows Audio Endpoint Builder,Manages audio devices for the Windows Audio service.  If this service is stopped  audio devices and effects will not function properly.  If this service is disabled  any services that explicitly depend on it will fail to start,C:\Windows\System32\svchost.exe,392a255b48ce8c257466fbc5c1b201b9,C:\Windows\System32\svchost.exe -k LocalSystemNetworkRestricted,SERVICE_WIN32_SHARE_PROCESS,C:\Windows\System32\AudioEndpointBuilder.dll,true,true,The file is signed and the signature was verified.,Microsoft Windows,Microsoft Windows Production PCA 2011
NL930NGM,smphost,Microsoft Storage Spaces SMP,Host service for the Microsoft Storage Spaces management provider. If this service is stopped or disabled  Storage Spaces cannot be managed.,C:\Windows\System32\svchost.exe,392a255b48ce8c257466fbc5c1b201b9,C:\Windows\System32\svchost.exe -k smphost,SERVICE_WIN32_OWN_PROCESS,C:\Windows\System32\smphost.dll,true,true,The file is signed and the signature was verified.,Microsoft Windows,Microsoft Windows Production PCA 2011
NL930NGM,DXGKrnl,LDDM Graphics Subsystem,Controls the underlying video driver stacks to provide fully-featured display capabilities.,C:\Windows\System32\drivers\dxgkrnl.sys,547e15d2d9c3891b58b5bf774bcf43b9,\SystemRoot\System32\drivers\dxgkrnl.sys,SERVICE_KERNEL_DRIVER,,true,true,The file is signed and the signature was verified.,Microsoft Windows,Microsoft Windows Production PCA 2011
NL930NGM,Eaphost,Extensible Authentication Protocol,The Extensible Authentication Protocol (EAP) service provides network authentication in such scenarios as 802.1x wired and wireless  VPN  and Network Access Protection (NAP).  EAP also provides application programming interfaces (APIs) that are used by network access clients  including wireless and VPN clients  during the authentication process.  If you disable this service  this computer is prevented from accessing networks that require EAP authentication.,C:\Windows\System32\svchost.exe,392a255b48ce8c257466fbc5c1b201b9,C:\Windows\System32\svchost.exe -k netsvcs,SERVICE_WIN32_SHARE_PROCESS,C:\Windows\System32\eapsvc.dll,true,true,The file is signed and the signature was verified.,Microsoft Windows,Microsoft Windows Production PCA 2011
NL930NGM,Wdf01000,Kernel Mode Driver Frameworks service,,C:\Windows\System32\drivers\Wdf01000.sys,9160daba45c37cc565720e6b2dd25fae,\SystemRoot\system32\drivers\Wdf01000.sys,SERVICE_KERNEL_DRIVER,,true,true,The file is signed and the signature was verified.,Microsoft Windows,Microsoft Windows Production PCA 2011
NL930NGM,vmicheartbeat,Hyper-V Heartbeat Service,Monitors the state of this virtual machine by reporting a heartbeat at regular intervals. This service helps you identify running virtual machines that have stopped responding.,C:\Windows\System32\svchost.exe,392a255b48ce8c257466fbc5c1b201b9,C:\Windows\system32\svchost.exe -k ICService,SERVICE_WIN32_SHARE_PROCESS,C:\Windows\System32\icsvc.dll,true,true,The file is signed and the signature was verified.,Microsoft Windows,Microsoft Windows Production PCA 2011
NL930NGM,nvstor,nvstor,,C:\Windows\System32\drivers\nvstor.sys,fd4d96e04f0bb21e6f83063344204d9a,\SystemRoot\System32\drivers\nvstor.sys,SERVICE_KERNEL_DRIVER,,true,true,The file is signed and the signature was verified.,Microsoft Windows,Microsoft Windows Production PCA 2011
NL930NGM,terminpt,Microsoft Remote Desktop Input Driver,,C:\Windows\System32\drivers\terminpt.sys,8febf0c5133406a5b72dc9d20fe21072,\SystemRoot\System32\drivers\terminpt.sys,SERVICE_KERNEL_DRIVER,,true,true,The file is signed and the signature was verified.,Microsoft Windows,Microsoft Windows Production PCA 2011
NL930NGM,vmictimesync,Hyper-V Time Synchronization Service,Synchronizes the system time of this virtual machine with the system time of the physical computer.,C:\Windows\System32\svchost.exe,392a255b48ce8c257466fbc5c1b201b9,C:\Windows\system32\svchost.exe -k LocalServiceNetworkRestricted,SERVICE_WIN32_SHARE_PROCESS,C:\Windows\System32\icsvc.dll,true,true,The file is signed and the signature was verified.,Microsoft Windows,Microsoft Windows Production PCA 2011
NL930NGM,HipShieldK,McAfee Inc. HipShieldK,,C:\Windows\System32\drivers\HipShieldK.sys,ee4988c38dcc0c2b848e7374c662fb94,system32\drivers\HipShieldK.sys,SERVICE_KERNEL_DRIVER,,true,true,The file is signed and the signature was verified.,Microsoft Windows Hardware Compatibility Publisher,Microsoft Windows Hardware Compatibility PCA
NL930NGM,tcpipreg,TCP/IP Registry Compatibility,Provides compatibility for legacy applications which interact with TCP/IP through the registry. If this service is stopped  certain applications may have impaired functionality.,C:\Windows\System32\drivers\tcpipreg.sys,95d0e7653d5dfcf4b789ba9457888500,System32\drivers\tcpipreg.sys,SERVICE_KERNEL_DRIVER,,true,true,The file is signed and the signature was verified.,Microsoft Windows,Microsoft Windows Production PCA 2011
NL930NGM,EFS,Encrypting File System (EFS),Provides the core file encryption technology used to store encrypted files on NTFS file system volumes. If this service is stopped or disabled  applications will be unable to access encrypted files.,C:\Windows\System32\lsass.exe,06ec8935b0d7de98f581ebe0b9ad032f,C:\Windows\System32\lsass.exe,SERVICE_WIN32_SHARE_PROCESS,C:\Windows\System32\efssvc.dll,true,true,The file is signed and the signature was verified.,Microsoft Windows,Microsoft Windows Production PCA 2011
NL930NGM,iaStorAV,Intel(R) SATA RAID Controller Windows,,C:\Windows\System32\drivers\iaStorAV.sys,ede6b051021ec01aa8dfe488951fb111,\SystemRoot\System32\drivers\iaStorAV.sys,SERVICE_KERNEL_DRIVER,,true,true,The file is signed and the signature was verified.,Microsoft Windows,Microsoft Windows Production PCA 2011
NL930NGM,wtlmdrv,Microsoft iSCSI Target LocalMount Adapter,,C:\Windows\System32\drivers\wtlmdrv.sys,41604a311a6fbbcab37ce8e52dc2c590,\SystemRoot\System32\drivers\wtlmdrv.sys,SERVICE_KERNEL_DRIVER,,true,true,The file is signed and the signature was verified.,Microsoft Windows,Microsoft Windows Production PCA 2011
NL930NGM,mountmgr,Mount Point Manager,Driver responsible with maintaining persistent drive letters and names for volumes,C:\Windows\System32\drivers\mountmgr.sys,9ebde6ae37e0cbedfd95dc920890205b,\SystemRoot\System32\drivers\mountmgr.sys,SERVICE_KERNEL_DRIVER,,true,true,The file is signed and the signature was verified.,Microsoft Windows,Microsoft Windows Production PCA 2011
NL930NGM,nsi,Network Store Interface Service,This service delivers network notifications (e.g. interface addition/deleting etc) to user mode clients. Stopping this service will cause loss of network connectivity. If this service is disabled  any other services that explicitly depend on this service will fail to start.,C:\Windows\System32\svchost.exe,392a255b48ce8c257466fbc5c1b201b9,C:\Windows\system32\svchost.exe -k LocalService,SERVICE_WIN32_SHARE_PROCESS,C:\Windows\System32\nsisvc.dll,true,true,The file is signed and the signature was verified.,Microsoft Windows,Microsoft Windows Production PCA 2011
NL930NGM,partmgr,Partition Manager,Disk class filter driver that auctions out partitions to volume managers,C:\Windows\System32\drivers\partmgr.sys,073b59958f8a13ccaa8f1e941d1b8913,\SystemRoot\System32\drivers\partmgr.sys,SERVICE_KERNEL_DRIVER,,true,true,The file is signed and the signature was verified.,Microsoft Windows,Microsoft Windows Production PCA 2011
NL930NGM,vdrvroot,Microsoft Virtual Drive Enumerator,,C:\Windows\System32\drivers\vdrvroot.sys,7ff8eaa6f00fb99c142049cffb1f529f,\SystemRoot\System32\drivers\vdrvroot.sys,SERVICE_KERNEL_DRIVER,,true,true,The file is signed and the signature was verified.,Microsoft Windows,Microsoft Windows Production PCA 2011
NL930NGM,NDIS,NDIS System Driver,NDIS System Driver,C:\Windows\System32\drivers\ndis.sys,91826ec50a764a456a55a8a037edb905,\SystemRoot\system32\drivers\ndis.sys,SERVICE_KERNEL_DRIVER,,true,true,The file is signed and the signature was verified.,Microsoft Windows,Microsoft Windows Production PCA 2011
NL930NGM,megasr,megasr,,C:\Windows\System32\drivers\megasr.sys,661a02d87c1cd53047d37fc8f8e3491c,\SystemRoot\System32\drivers\megasr.sys,SERVICE_KERNEL_DRIVER,,true,true,The file is signed and the signature was verified.,Microsoft Windows,Microsoft Windows Production PCA 2011
NL930NGM,RasMan,Remote Access Connection Manager,Manages dial-up and virtual private network (VPN) connections from this computer to the Internet or other remote networks. If this service is disabled  any services that explicitly depend on it will fail to start.,C:\Windows\System32\svchost.exe,392a255b48ce8c257466fbc5c1b201b9,C:\Windows\System32\svchost.exe -k netsvcs,SERVICE_WIN32_SHARE_PROCESS,C:\Windows\System32\rasmans.dll,true,true,The file is signed and the signature was verified.,Microsoft Windows,Microsoft Windows Production PCA 2011
NL930NGM,vxn,Intel(R) 10G Virtual Network Connection,,C:\Windows\System32\drivers\vxn64x64.sys,00be89148bd75e92cc8335245aa0a2d3,\SystemRoot\system32\DRIVERS\vxn64x64.sys,SERVICE_KERNEL_DRIVER,,true,true,The file is signed and the signature was verified.,Microsoft Windows Hardware Compatibility Publisher,Microsoft Windows Third Party Component CA 2012
NL930NGM,IPMIDRV,IPMIDRV,,C:\Windows\System32\drivers\IPMIDrv.sys,8f1baa389e07c0a2064a17bdb21e9d22,\SystemRoot\System32\drivers\IPMIDrv.sys,SERVICE_KERNEL_DRIVER,,true,true,The file is signed and the signature was verified.,Microsoft Windows,Microsoft Windows Production PCA 2011
