hostname,name,descriptivename,description,path,md5,arguments,type,servicedll,pathsignatureexists,pathsignatureverified,pathsignaturedescription,pathcertificatesubject,pathcertificateissuer
NL930NGM,sdbus,sdbus,,C:\Windows\System32\drivers\sdbus.sys,4b8db013a37346ace88d9a5ef93c3490,\SystemRoot\System32\drivers\sdbus.sys,SERVICE_KERNEL_DRIVER,,true,true,The file is signed and the signature was verified.,Microsoft Windows,Microsoft Windows Production PCA 2011
NL930NGM,mrxsmb,SMB MiniRedirector Wrapper and Engine,Implements the framework for the SMB filesystem redirector,C:\Windows\System32\drivers\mrxsmb.sys,3933fb5b131f4b5f3f14b8ae548aff90,system32\DRIVERS\mrxsmb.sys,SERVICE_FILE_SYSTEM_DRIVER,,true,true,The file is signed and the signature was verified.,Microsoft Windows,Microsoft Windows Production PCA 2011
NL930NGM,Vid,Vid,,C:\Windows\System32\drivers\Vid.sys,0c37d0d4b963f679604e42becef26e89,\SystemRoot\System32\drivers\Vid.sys,SERVICE_KERNEL_DRIVER,,true,true,The file is signed and the signature was verified.,Microsoft Windows,Microsoft Windows Production PCA 2011
NL930NGM,mfemms,McAfee Service Controller,Manages McAfee Services,C:\Program Files\Common Files\McAfee\SystemCore\mfemms.exe,111b7a5162c10cb56ce9f7be2e136a1c,C:\Program Files\Common Files\McAfee\SystemCore\mfemms.exe,SERVICE_WIN32_OWN_PROCESS,,true,true,The file is signed and the signature was verified.,"""McAfee",VeriSign Class 3 Code Signing 2010 CA
NL930NGM,mvumis,mvumis,,C:\Windows\System32\drivers\mvumis.sys,e6378a511ba10f1d1d4c8919ef6e7778,\SystemRoot\System32\drivers\mvumis.sys,SERVICE_KERNEL_DRIVER,,true,true,The file is signed and the signature was verified.,Microsoft Windows,Microsoft Windows Production PCA 2011
NL930NGM,GPIOClx0101,Microsoft GPIO Class Extension Driver,,C:\Windows\System32\drivers\msgpioclx.sys,e40e83ba829a9c7aa04212d888b0ed54,System32\Drivers\msgpioclx.sys,SERVICE_KERNEL_DRIVER,,true,true,The file is signed and the signature was verified.,Microsoft Windows,Microsoft Windows Production PCA 2011
NL930NGM,Winmgmt,Windows Management Instrumentation,Provides a common interface and object model to access management information about operating system  devices  applications and services. If this service is stopped  most Windows-based software will not function properly. If this service is disabled  any services that explicitly depend on it will fail to start.,C:\Windows\System32\svchost.exe,392a255b48ce8c257466fbc5c1b201b9,C:\Windows\system32\svchost.exe -k netsvcs,SERVICE_WIN32_SHARE_PROCESS,C:\Windows\System32\wbem\WMIsvc.dll,true,true,The file is signed and the signature was verified.,Microsoft Windows,Microsoft Windows Production PCA 2011
NL930NGM,LSI_SAS2,LSI_SAS2,,C:\Windows\System32\drivers\lsi_sas2.sys,c585762b168d75c9b3f8a29c13347634,\SystemRoot\System32\drivers\lsi_sas2.sys,SERVICE_KERNEL_DRIVER,,true,true,The file is signed and the signature was verified.,Microsoft Windows,Microsoft Windows Production PCA 2011
NL930NGM,AWSNVMe,AWSNVMe,,C:\Windows\System32\drivers\AWSNVMe.sys,438be13ce8874ef4234bd8b2f97f0f3b,\SystemRoot\System32\drivers\AWSNVMe.sys,SERVICE_KERNEL_DRIVER,,true,true,The file is signed and the signature was verified.,Microsoft Windows Hardware Compatibility Publisher,Microsoft Windows Hardware Compatibility PCA
NL930NGM,seclogon,Secondary Logon,Enables starting processes under alternate credentials. If this service is stopped  this type of logon access will be unavailable. If this service is disabled  any services that explicitly depend on it will fail to start.,C:\Windows\System32\svchost.exe,392a255b48ce8c257466fbc5c1b201b9,C:\Windows\system32\svchost.exe -k netsvcs,SERVICE_WIN32_SHARE_PROCESS,C:\Windows\System32\seclogon.dll,true,true,The file is signed and the signature was verified.,Microsoft Windows,Microsoft Windows Production PCA 2011
NL930NGM,WudfPf,User Mode Driver Frameworks Platform Driver,,C:\Windows\System32\drivers\WUDFPf.sys,aa64f3eb68d0a3806f19d20f7b567eba,system32\drivers\WudfPf.sys,SERVICE_KERNEL_DRIVER,,true,true,The file is signed and the signature was verified.,Microsoft Windows,Microsoft Windows Production PCA 2011
NL930NGM,monitor,Microsoft Monitor Class Function Driver Service,,C:\Windows\System32\drivers\monitor.sys,0d69393c46bbf28b7c7d4b65c22470df,\SystemRoot\System32\drivers\monitor.sys,SERVICE_KERNEL_DRIVER,,true,true,The file is signed and the signature was verified.,Microsoft Windows,Microsoft Windows Production PCA 2011
NL930NGM,Wecsvc,Windows Event Collector,This service manages persistent subscriptions to events from remote sources that support WS-Management protocol. This includes Windows Vista event logs  hardware and IPMI-enabled event sources. The service stores forwarded events in a local Event Log. If this service is stopped or disabled event subscriptions cannot be created and forwarded events cannot be accepted.,C:\Windows\System32\svchost.exe,392a255b48ce8c257466fbc5c1b201b9,C:\Windows\system32\svchost.exe -k NetworkService,SERVICE_WIN32_SHARE_PROCESS,C:\Windows\System32\wecsvc.dll,true,true,The file is signed and the signature was verified.,Microsoft Windows,Microsoft Windows Production PCA 2011
NL930NGM,SstpSvc,Secure Socket Tunneling Protocol Service,Provides support for the Secure Socket Tunneling Protocol (SSTP) to connect to remote computers using VPN. If this service is disabled  users will not be able to use SSTP to access remote servers.,C:\Windows\System32\svchost.exe,392a255b48ce8c257466fbc5c1b201b9,C:\Windows\system32\svchost.exe -k LocalService,SERVICE_WIN32_SHARE_PROCESS,C:\Windows\System32\sstpsvc.dll,true,true,The file is signed and the signature was verified.,Microsoft Windows,Microsoft Windows Production PCA 2011
NL930NGM,WcsPlugInService,Windows Color System,The WcsPlugInService service hosts third-party Windows Color System color device model and gamut map model plug-in modules. These plug-in modules are vendor-specific extensions to the Windows Color System baseline color device and gamut map models. Stopping or disabling the WcsPlugInService service will disable this extensibility feature  and the Windows Color System will use its baseline model processing rather than the vendor's desired processing. This might result in inaccurate color rendering.,C:\Windows\System32\svchost.exe,392a255b48ce8c257466fbc5c1b201b9,C:\Windows\system32\svchost.exe -k wcssvc,SERVICE_WIN32_SHARE_PROCESS,C:\Windows\System32\WcsPlugInService.dll,true,true,The file is signed and the signature was verified.,Microsoft Windows,Microsoft Windows Production PCA 2011
NL930NGM,napagent,Network Access Protection Agent,The Network Access Protection (NAP) agent service collects and manages health information for client computers on a network. Information collected by NAP agent is used to make sure that the client computer has the required software and settings. If a client computer is not compliant with health policy  it can be provided with restricted network access until its configuration is updated. Depending on the configuration of health policy  client computers might be automatically updated so that users quickly regain full network access without having to manually update their computer.,C:\Windows\System32\svchost.exe,392a255b48ce8c257466fbc5c1b201b9,C:\Windows\System32\svchost.exe -k NetworkService,SERVICE_WIN32_SHARE_PROCESS,C:\Windows\System32\QAGENTRT.DLL,true,true,The file is signed and the signature was verified.,Microsoft Windows,Microsoft Windows Production PCA 2011
NL930NGM,CmBatt,Microsoft ACPI Control Method Battery Driver,,C:\Windows\System32\drivers\CmBatt.sys,a5627e7b5b8d67fd0c05c04fb6f305b7,\SystemRoot\System32\drivers\CmBatt.sys,SERVICE_KERNEL_DRIVER,,true,true,The file is signed and the signature was verified.,Microsoft Windows,Microsoft Windows Production PCA 2011
NL930NGM,sacsvr,Special Administration Console Helper,Allows administrators to remotely access a command prompt using Emergency Management Services.,C:\Windows\System32\svchost.exe,392a255b48ce8c257466fbc5c1b201b9,C:\Windows\System32\svchost.exe -k netsvcs,SERVICE_WIN32_SHARE_PROCESS,C:\Windows\System32\sacsvr.dll,true,true,The file is signed and the signature was verified.,Microsoft Windows,Microsoft Windows Production PCA 2011
NL930NGM,PrintNotify,Printer Extensions and Notifications,This service opens custom printer dialog boxes and handles notifications from a remote print server or a printer. If you turn off this service  you won’t be able to see printer extensions or notifications.,C:\Windows\System32\svchost.exe,392a255b48ce8c257466fbc5c1b201b9,C:\Windows\system32\svchost.exe -k print,SERVICE_WIN32_SHARE_PROCESS,C:\Windows\System32\spool\drivers\x64\3\PrintConfig.dll,true,true,The file is signed and the signature was verified.,Microsoft Windows,Microsoft Windows Production PCA 2011
NL930NGM,kbdclass,Keyboard Class Driver,,C:\Windows\System32\drivers\kbdclass.sys,0855fac2738ea7a4fea55b046c031ddc,\SystemRoot\System32\drivers\kbdclass.sys,SERVICE_KERNEL_DRIVER,,true,true,The file is signed and the signature was verified.,Microsoft Windows,Microsoft Windows Production PCA 2011
NL930NGM,NdisTapi,Remote Access NDIS TAPI Driver,Remote Access NDIS TAPI Driver,C:\Windows\System32\drivers\ndistapi.sys,39607558ae472778b11c817234737178,\SystemRoot\system32\DRIVERS\ndistapi.sys,SERVICE_KERNEL_DRIVER,,true,true,The file is signed and the signature was verified.,Microsoft Windows,Microsoft Windows Production PCA 2011
NL930NGM,Power,Power,Manages power policy and power policy notification delivery.,C:\Windows\System32\svchost.exe,392a255b48ce8c257466fbc5c1b201b9,C:\Windows\system32\svchost.exe -k DcomLaunch,SERVICE_WIN32_SHARE_PROCESS,C:\Windows\System32\umpo.dll,true,true,The file is signed and the signature was verified.,Microsoft Windows,Microsoft Windows Production PCA 2011
NL930NGM,RpcLocator,Remote Procedure Call (RPC) Locator,In Windows 2003 and earlier versions of Windows  the Remote Procedure Call (RPC) Locator service manages the RPC name service database. In Windows Vista and later versions of Windows  this service does not provide any functionality and is present for application compatibility.,C:\Windows\System32\Locator.exe,7d3330da1ad07853a178466a3aa48d79,C:\Windows\system32\locator.exe,SERVICE_WIN32_OWN_PROCESS,,true,true,The file is signed and the signature was verified.,Microsoft Windows,Microsoft Windows Production PCA 2011
NL930NGM,TrustedInstaller,Windows Modules Installer,Enables installation  modification  and removal of Windows updates and optional components. If this service is disabled  install or uninstall of Windows updates might fail for this computer.,C:\Windows\servicing\TrustedInstaller.exe,54bfa90986379dbeb9ecd5dd2a0325ad,C:\Windows\servicing\TrustedInstaller.exe,SERVICE_WIN32_OWN_PROCESS,,true,true,The file is signed and the signature was verified.,Microsoft Windows,Microsoft Windows Production PCA 2011
NL930NGM,megasas,megasas,,C:\Windows\System32\drivers\megasas.sys,d5cf25273c204b8ee5d4760065ad4559,\SystemRoot\System32\drivers\megasas.sys,SERVICE_KERNEL_DRIVER,,true,true,The file is signed and the signature was verified.,Microsoft Windows,Microsoft Windows Production PCA 2011
NL930NGM,wercplsupport,Problem Reports and Solutions Control Panel Support,This service provides support for viewing  sending and deletion of system-level problem reports for the Problem Reports and Solutions control panel.,C:\Windows\System32\svchost.exe,392a255b48ce8c257466fbc5c1b201b9,C:\Windows\System32\svchost.exe -k netsvcs,SERVICE_WIN32_SHARE_PROCESS,C:\Windows\System32\wercplsupport.dll,true,true,The file is signed and the signature was verified.,Microsoft Windows,Microsoft Windows Production PCA 2011
NL930NGM,mfehidk,McAfee Inc. mfehidk,,C:\Windows\System32\drivers\mfehidk.sys,377958643ee68c83030a5b5a9b0b151a,\SystemRoot\system32\drivers\mfehidk.sys,SERVICE_KERNEL_DRIVER,,true,true,The file is signed and the signature was verified.,Microsoft Windows Hardware Compatibility Publisher,Microsoft Windows Hardware Compatibility PCA
NL930NGM,ADP80XX,ADP80XX,,C:\Windows\System32\drivers\adp80xx.sys,837ecd1fe08cc5c4443ca6f2dd49686d,\SystemRoot\System32\drivers\ADP80XX.SYS,SERVICE_KERNEL_DRIVER,,true,true,The file is signed and the signature was verified.,Microsoft Windows,Microsoft Windows Production PCA 2011
NL930NGM,mpsdrv,Windows Firewall Authorization Driver,Windows Firewall Authorization Driver is a kernel mode driver that provides deep inspection services on inbound and outbound network traffic.,C:\Windows\System32\drivers\mpsdrv.sys,0fd4a61ba52a9452dd00baae08a6e8a1,System32\drivers\mpsdrv.sys,SERVICE_KERNEL_DRIVER,,true,true,The file is signed and the signature was verified.,Microsoft Windows,Microsoft Windows Production PCA 2011
NL930NGM,ql2300i,QLogic Fibre Channel STOR Miniport Inbox Driver (wx64),,C:\Windows\System32\drivers\ql2300i.sys,1674a1023ec859a85be10baa55e98804,\SystemRoot\System32\drivers\ql2300i.sys,SERVICE_KERNEL_DRIVER,,true,true,The file is signed and the signature was verified.,Microsoft Windows,Microsoft Windows Production PCA 2011
NL930NGM,Netlogon,Netlogon,Maintains a secure channel between this computer and the domain controller for authenticating users and services. If this service is stopped  the computer may not authenticate users and services and the domain controller cannot register DNS records. If this service is disabled  any services that explicitly depend on it will fail to start.,C:\Windows\System32\lsass.exe,06ec8935b0d7de98f581ebe0b9ad032f,C:\Windows\system32\lsass.exe,SERVICE_WIN32_SHARE_PROCESS,C:\Windows\System32\netlogon.dll,true,true,The file is signed and the signature was verified.,Microsoft Windows,Microsoft Windows Production PCA 2011
NL930NGM,RDPDR,Remote Desktop Device Redirector Driver,Remote Desktop Device Redirector Driver,C:\Windows\System32\drivers\rdpdr.sys,37a7e066dc39a7ab560a8f2b9611f347,System32\drivers\rdpdr.sys,SERVICE_KERNEL_DRIVER,,true,true,The file is signed and the signature was verified.,Microsoft Windows,Microsoft Windows Production PCA 2011
NL930NGM,volsnap,Storage volumes,,C:\Windows\System32\drivers\volsnap.sys,744ad5403a2ae2c0c6f5b59dce832405,\SystemRoot\System32\drivers\volsnap.sys,SERVICE_KERNEL_DRIVER,,true,true,The file is signed and the signature was verified.,Microsoft Windows,Microsoft Windows Production PCA 2011
NL930NGM,Psched,QoS Packet Scheduler,QoS Packet Scheduler,C:\Windows\System32\drivers\pacer.sys,0ab9af8228bb34cdd0fbecf4c168a41b,\SystemRoot\system32\DRIVERS\pacer.sys,SERVICE_KERNEL_DRIVER,,true,true,The file is signed and the signature was verified.,Microsoft Windows,Microsoft Windows Production PCA 2011
NL930NGM,SerCx,Serial UART Support Library,,C:\Windows\System32\drivers\SerCx.sys,6c6d1cf5a4dd6f915dbb2346720a0aa9,system32\drivers\SerCx.sys,SERVICE_KERNEL_DRIVER,,true,true,The file is signed and the signature was verified.,Microsoft Windows,Microsoft Windows Production PCA 2011
NL930NGM,RemoteAccess,Routing and Remote Access,Offers routing services to businesses in local area and wide area network environments.,C:\Windows\System32\svchost.exe,392a255b48ce8c257466fbc5c1b201b9,C:\Windows\System32\svchost.exe -k netsvcs,SERVICE_WIN32_SHARE_PROCESS,C:\Windows\System32\mprdim.dll,true,true,The file is signed and the signature was verified.,Microsoft Windows,Microsoft Windows Production PCA 2011
NL930NGM,TsUsbFlt,TsUsbFlt,Remote Desktop USB Hub Class Filter Driver,C:\Windows\System32\drivers\TsUsbFlt.sys,73b3fffea95489f328c0baeb6d8e50e6,system32\drivers\tsusbflt.sys,SERVICE_KERNEL_DRIVER,,true,true,The file is signed and the signature was verified.,Microsoft Windows,Microsoft Windows Production PCA 2011
NL930NGM,DPS,Diagnostic Policy Service,The Diagnostic Policy Service enables problem detection  troubleshooting and resolution for Windows components.  If this service is stopped  diagnostics will no longer function.,C:\Windows\System32\svchost.exe,392a255b48ce8c257466fbc5c1b201b9,C:\Windows\System32\svchost.exe -k LocalServiceNoNetwork,SERVICE_WIN32_SHARE_PROCESS,C:\Windows\System32\dps.dll,true,true,The file is signed and the signature was verified.,Microsoft Windows,Microsoft Windows Production PCA 2011
NL930NGM,mouclass,Mouse Class Driver,,C:\Windows\System32\drivers\mouclass.sys,2d37064a5d8945ac858d655fd28756d1,\SystemRoot\System32\drivers\mouclass.sys,SERVICE_KERNEL_DRIVER,,true,true,The file is signed and the signature was verified.,Microsoft Windows,Microsoft Windows Production PCA 2011
NL930NGM,ec2winutildriver,EC2 Windows Utility Agent,,C:\Windows\System32\drivers\EC2WinUtilDriver.sys,dd2c98fe56f01eb2a8847a8c13445f6a,\SystemRoot\System32\drivers\EC2WinUtilDriver.sys,SERVICE_KERNEL_DRIVER,,true,true,The file is signed and the signature was verified.,Microsoft Windows Hardware Compatibility Publisher,Microsoft Windows Hardware Compatibility PCA
NL930NGM,Dfsc,DFS Namespace Client Driver,Client driver for access to DFS Namespaces,C:\Windows\System32\drivers\dfsc.sys,259c97cbedde4c3112e7e9daa1e71e4f,System32\Drivers\dfsc.sys,SERVICE_FILE_SYSTEM_DRIVER,,true,true,The file is signed and the signature was verified.,Microsoft Windows,Microsoft Windows Production PCA 2011
NL930NGM,FDResPub,Function Discovery Resource Publication,Publishes this computer and resources attached to this computer so they can be discovered over the network.  If this service is stopped  network resources will no longer be published and they will not be discovered by other computers on the network.,C:\Windows\System32\svchost.exe,392a255b48ce8c257466fbc5c1b201b9,C:\Windows\system32\svchost.exe -k LocalServiceAndNoImpersonation,SERVICE_WIN32_SHARE_PROCESS,C:\Windows\System32\FDResPub.dll,true,true,The file is signed and the signature was verified.,Microsoft Windows,Microsoft Windows Production PCA 2011
NL930NGM,usbccgp,Microsoft USB Generic Parent Driver,,C:\Windows\System32\drivers\usbccgp.sys,533b07175cf39a25c945bd9896acb8c9,\SystemRoot\System32\drivers\usbccgp.sys,SERVICE_KERNEL_DRIVER,,true,true,The file is signed and the signature was verified.,Microsoft Windows,Microsoft Windows Production PCA 2011
NL930NGM,XENBUS,AWS PV Bus,,C:\Windows\System32\drivers\xenbus.sys,dccaaad7e60f5b1f37a40f3894a6b1d9,\SystemRoot\system32\DRIVERS\xenbus.sys,SERVICE_KERNEL_DRIVER,,true,true,The file is signed and the signature was verified.,Microsoft Windows Hardware Compatibility Publisher,Microsoft Windows Hardware Compatibility PCA
NL930NGM,HpSAMD,HpSAMD,,C:\Windows\System32\drivers\HpSAMD.sys,373d6369858cfb859284a73c20d71144,\SystemRoot\System32\drivers\HpSAMD.sys,SERVICE_KERNEL_DRIVER,,true,true,The file is signed and the signature was verified.,Microsoft Windows,Microsoft Windows Production PCA 2011
NL930NGM,hidserv,Human Interface Device Service,Activates and maintains the use of hot buttons on keyboards  remote controls  and other multimedia devices. It is recommended that you keep this service running.,C:\Windows\System32\svchost.exe,392a255b48ce8c257466fbc5c1b201b9,C:\Windows\system32\svchost.exe -k LocalSystemNetworkRestricted,SERVICE_WIN32_SHARE_PROCESS,C:\Windows\System32\hidserv.dll,true,true,The file is signed and the signature was verified.,Microsoft Windows,Microsoft Windows Production PCA 2011
NL930NGM,PEAUTH,PEAUTH,,C:\Windows\System32\drivers\PEAuth.sys,4b39aedbf8e5b10fd2877e96d78efc3b,system32\drivers\peauth.sys,SERVICE_KERNEL_DRIVER,,true,true,The file is signed and the signature was verified.,Microsoft Windows,Microsoft Windows Production PCA 2011
NL930NGM,pcmcia,pcmcia,,C:\Windows\System32\drivers\pcmcia.sys,faa0eab4c2a1658e96c0544d7d3ddc9c,\SystemRoot\System32\drivers\pcmcia.sys,SERVICE_KERNEL_DRIVER,,true,true,The file is signed and the signature was verified.,Microsoft Windows,Microsoft Windows Production PCA 2011
NL930NGM,ScDeviceEnum,Smart Card Device Enumeration Service,Creates software device nodes for all smart card readers accessible to a given session. If this service is disabled  WinRT APIs will not be able to enumerate smart card readers.,C:\Windows\System32\svchost.exe,392a255b48ce8c257466fbc5c1b201b9,C:\Windows\system32\svchost.exe -k LocalSystemNetworkRestricted,SERVICE_WIN32_SHARE_PROCESS,C:\Windows\System32\ScDeviceEnum.dll,true,true,The file is signed and the signature was verified.,Microsoft Windows,Microsoft Windows Production PCA 2011
NL930NGM,BrokerInfrastructure,Background Tasks Infrastructure Service,Windows infrastructure service that controls which background tasks can run on the system.,C:\Windows\System32\svchost.exe,392a255b48ce8c257466fbc5c1b201b9,C:\Windows\system32\svchost.exe -k DcomLaunch,SERVICE_WIN32_SHARE_PROCESS,C:\Windows\System32\bisrv.dll,true,true,The file is signed and the signature was verified.,Microsoft Windows,Microsoft Windows Production PCA 2011
NL930NGM,mlx4_bus,Mellanox ConnectX Bus Enumerator,,C:\Windows\System32\drivers\mlx4_bus.sys,5b57113a2f5a78e1941bf43370161a47,\SystemRoot\System32\drivers\mlx4_bus.sys,SERVICE_KERNEL_DRIVER,,true,true,The file is signed and the signature was verified.,Microsoft Windows,Microsoft Windows Production PCA 2011
NL930NGM,MsLbfoProvider,Microsoft Load Balancing/Failover Provider,Microsoft Load Balancing/Failover Provider,C:\Windows\System32\drivers\MsLbfoProvider.sys,e233547fc6867960d28f7e0b6dfecd17,\SystemRoot\system32\DRIVERS\MsLbfoProvider.sys,SERVICE_KERNEL_DRIVER,,true,true,The file is signed and the signature was verified.,Microsoft Windows,Microsoft Windows Production PCA 2011
NL930NGM,NcaSvc,Network Connectivity Assistant,Provides DirectAccess status notification for UI components,C:\Windows\System32\svchost.exe,392a255b48ce8c257466fbc5c1b201b9,C:\Windows\System32\svchost.exe -k NetSvcs,SERVICE_WIN32_SHARE_PROCESS,C:\Windows\System32\NcaSvc.dll,true,true,The file is signed and the signature was verified.,Microsoft Windows,Microsoft Windows Production PCA 2011
NL930NGM,ebdrv,Broadcom NetXtreme II 10 GigE VBD,,C:\Windows\System32\drivers\evbda.sys,15bfb3e0543b5c073eb42e25f3a2a45f,\SystemRoot\System32\drivers\evbda.sys,SERVICE_KERNEL_DRIVER,,true,true,The file is signed and the signature was verified.,Microsoft Windows,Microsoft Windows Production PCA 2011
NL930NGM,hyperkbd,hyperkbd,,C:\Windows\System32\drivers\hyperkbd.sys,ad5b07e10d198db16f649950b6cc5b43,\SystemRoot\System32\drivers\hyperkbd.sys,SERVICE_KERNEL_DRIVER,,true,true,The file is signed and the signature was verified.,Microsoft Windows,Microsoft Windows Production PCA 2011
NL930NGM,acpiex,Microsoft ACPIEx Driver,,C:\Windows\System32\drivers\acpiex.sys,2cfa9ff7e111f643261ffc20fa7204f3,\SystemRoot\System32\Drivers\acpiex.sys,SERVICE_KERNEL_DRIVER,,true,true,The file is signed and the signature was verified.,Microsoft Windows,Microsoft Windows Production PCA 2011
NL930NGM,WerSvc,Windows Error Reporting Service,Allows errors to be reported when programs stop working or responding and allows existing solutions to be delivered. Also allows logs to be generated for diagnostic and repair services. If this service is stopped  error reporting might not work correctly and results of diagnostic services and repairs might not be displayed.,C:\Windows\System32\svchost.exe,392a255b48ce8c257466fbc5c1b201b9,C:\Windows\System32\svchost.exe -k WerSvcGroup,SERVICE_WIN32_OWN_PROCESS,C:\Windows\System32\wersvc.dll,true,true,The file is signed and the signature was verified.,Microsoft Windows,Microsoft Windows Production PCA 2011
NL930NGM,RdpVideoMiniport,Remote Desktop Video Miniport Driver,,C:\Windows\System32\drivers\rdpvideominiport.sys,5ff7f3e243e7d8cb6d996833f559f24e,System32\drivers\rdpvideominiport.sys,SERVICE_KERNEL_DRIVER,,true,true,The file is signed and the signature was verified.,Microsoft Windows,Microsoft Windows Production PCA 2011
NL930NGM,xenfilt,AWS Bus Filter,,C:\Windows\System32\drivers\xenfilt.sys,cac41da1de70f18112b43406af184514,\SystemRoot\system32\DRIVERS\xenfilt.sys,SERVICE_KERNEL_DRIVER,,true,true,The file is signed and the signature was verified.,Microsoft Windows Hardware Compatibility Publisher,Microsoft Windows Hardware Compatibility PCA
NL930NGM,SessionEnv,Remote Desktop Configuration,Remote Desktop Configuration service (RDCS) is responsible for all Remote Desktop Services and Remote Desktop related configuration and session maintenance activities that require SYSTEM context. These include per-session temporary folders  RD themes  and RD certificates.,C:\Windows\System32\svchost.exe,392a255b48ce8c257466fbc5c1b201b9,C:\Windows\System32\svchost.exe -k netsvcs,SERVICE_WIN32_SHARE_PROCESS,C:\Windows\System32\SessEnv.dll,true,true,The file is signed and the signature was verified.,Microsoft Windows,Microsoft Windows Production PCA 2011
NL930NGM,pcw,Performance Counters for Windows Driver,,C:\Windows\System32\drivers\pcw.sys,0e94775f06a5be293046ca883eb81ec9,\SystemRoot\System32\drivers\pcw.sys,SERVICE_KERNEL_DRIVER,,true,true,The file is signed and the signature was verified.,Microsoft Windows,Microsoft Windows Production PCA 2011
NL930NGM,gencounter,Microsoft Hyper-V Generation Counter,,C:\Windows\System32\drivers\vmgencounter.sys,2aeba490130ab1df90ffca51a07f4e87,\SystemRoot\System32\drivers\vmgencounter.sys,SERVICE_KERNEL_DRIVER,,true,true,The file is signed and the signature was verified.,Microsoft Windows,Microsoft Windows Production PCA 2011
NL930NGM,BasicDisplay,BasicDisplay,,C:\Windows\System32\drivers\BasicDisplay.sys,55826378f42b9138774e0f4ae259570a,\SystemRoot\System32\drivers\BasicDisplay.sys,SERVICE_KERNEL_DRIVER,,true,true,The file is signed and the signature was verified.,Microsoft Windows,Microsoft Windows Production PCA 2011
NL930NGM,svsvc,Spot Verifier,Verifies potential file system corruptions.,C:\Windows\System32\svchost.exe,392a255b48ce8c257466fbc5c1b201b9,C:\Windows\system32\svchost.exe -k LocalSystemNetworkRestricted,SERVICE_WIN32_SHARE_PROCESS,C:\Windows\System32\svsvc.dll,true,true,The file is signed and the signature was verified.,Microsoft Windows,Microsoft Windows Production PCA 2011
