hostname,name,descriptivename,description,path,md5,arguments,type,servicedll,pathsignatureexists,pathsignatureverified,pathsignaturedescription,pathcertificatesubject,pathcertificateissuer
NL930NGM,LSI_SAS3,LSI_SAS3,,C:\Windows\System32\drivers\lsi_sas3.sys,217cc1adf65b6b4e8ffe743ebef9fc1b,\SystemRoot\System32\drivers\lsi_sas3.sys,SERVICE_KERNEL_DRIVER,,true,true,The file is signed and the signature was verified.,Microsoft Windows,Microsoft Windows Production PCA 2011
NL930NGM,wuauserv,Windows Update,Enables the detection  download  and installation of updates for Windows and other programs. If this service is disabled  users of this computer will not be able to use Windows Update or its automatic updating feature  and programs will not be able to use the Windows Update Agent (WUA) API.,C:\Windows\System32\svchost.exe,392a255b48ce8c257466fbc5c1b201b9,C:\Windows\system32\svchost.exe -k netsvcs,SERVICE_WIN32_SHARE_PROCESS,C:\Windows\System32\wuaueng.dll,true,true,The file is signed and the signature was verified.,Microsoft Windows,Microsoft Windows Production PCA 2011
NL930NGM,LanmanServer,Server,Supports file  print  and named-pipe sharing over the network for this computer. If this service is stopped  these functions will be unavailable. If this service is disabled  any services that explicitly depend on it will fail to start.,C:\Windows\System32\svchost.exe,392a255b48ce8c257466fbc5c1b201b9,C:\Windows\system32\svchost.exe -k netsvcs,SERVICE_WIN32_SHARE_PROCESS,C:\Windows\System32\srvsvc.dll,true,true,The file is signed and the signature was verified.,Microsoft Windows,Microsoft Windows Production PCA 2011
NL930NGM,kbdhid,Keyboard HID Driver,,C:\Windows\System32\drivers\kbdhid.sys,ca4b3e75a8232354e3b2a8bc8658727f,\SystemRoot\System32\drivers\kbdhid.sys,SERVICE_KERNEL_DRIVER,,true,true,The file is signed and the signature was verified.,Microsoft Windows,Microsoft Windows Production PCA 2011
NL930NGM,msisadrv,msisadrv,,C:\Windows\System32\drivers\msisadrv.sys,af58e8e650200b7f873b9937afd0b960,\SystemRoot\System32\drivers\msisadrv.sys,SERVICE_KERNEL_DRIVER,,true,true,The file is signed and the signature was verified.,Microsoft Windows,Microsoft Windows Production PCA 2011
NL930NGM,mssmbios,Microsoft System Management BIOS Driver,,C:\Windows\System32\drivers\mssmbios.sys,08a446fe5cd319315079065f1220d6cf,\SystemRoot\System32\drivers\mssmbios.sys,SERVICE_KERNEL_DRIVER,,true,true,The file is signed and the signature was verified.,Microsoft Windows,Microsoft Windows Production PCA 2011
NL930NGM,ksthunk,Kernel Streaming Thunks,,C:\Windows\System32\drivers\ksthunk.sys,57a858e1ebafadf5f7d48eb2e3efa797,\SystemRoot\system32\drivers\ksthunk.sys,SERVICE_KERNEL_DRIVER,,true,true,The file is signed and the signature was verified.,Microsoft Windows,Microsoft Windows Production PCA 2011
NL930NGM,UmPass,Microsoft UMPass Driver,,C:\Windows\System32\drivers\umpass.sys,12b912b58b1114fa3b145cd4b5cc6c96,\SystemRoot\System32\drivers\umpass.sys,SERVICE_KERNEL_DRIVER,,true,true,The file is signed and the signature was verified.,Microsoft Windows,Microsoft Windows Production PCA 2011
NL930NGM,udfs,udfs,Reads/Writes UDF 1.02 1.5 2.0x 2.5 disc formats  usually found on C/DVD discs. (Core) (All pieces),C:\Windows\System32\drivers\udfs.sys,f3357ea666b54e00f0942e5a344cb15d,system32\DRIVERS\udfs.sys,SERVICE_FILE_SYSTEM_DRIVER,,true,true,The file is signed and the signature was verified.,Microsoft Windows,Microsoft Windows Production PCA 2011
NL930NGM,ErrDev,Microsoft Hardware Error Device Driver,,C:\Windows\System32\drivers\errdev.sys,106c15587155d0d82055163e142c15d9,\SystemRoot\System32\drivers\errdev.sys,SERVICE_KERNEL_DRIVER,,true,true,The file is signed and the signature was verified.,Microsoft Windows,Microsoft Windows Production PCA 2011
NL930NGM,b06bdrv,Broadcom NetXtreme II VBD,,C:\Windows\System32\drivers\bxvbda.sys,6ea8a24328e650dfe2ac9910782343c3,\SystemRoot\System32\drivers\bxvbda.sys,SERVICE_KERNEL_DRIVER,,true,true,The file is signed and the signature was verified.,Microsoft Windows,Microsoft Windows Production PCA 2011
NL930NGM,RDPDR,Remote Desktop Device Redirector Driver,Remote Desktop Device Redirector Driver,C:\Windows\System32\drivers\rdpdr.sys,00c8407e330e0dc176e4e40d034542a0,System32\drivers\rdpdr.sys,SERVICE_KERNEL_DRIVER,,true,true,The file is signed and the signature was verified.,Microsoft Windows,Microsoft Windows Production PCA 2011
NL930NGM,COMSysApp,COM+ System Application,Manages the configuration and tracking of Component Object Model (COM)+-based components. If the service is stopped  most COM+-based components will not function properly. If this service is disabled  any services that explicitly depend on it will fail to start.,C:\Windows\System32\dllhost.exe,28e6d713ba26365ca82027a2b94de740,C:\Windows\system32\dllhost.exe /Processid:{02D4B3F1-FD88-11D1-960D-00805FC79235},SERVICE_WIN32_OWN_PROCESS,,true,true,The file is signed and the signature was verified.,Microsoft Windows,Microsoft Windows Production PCA 2011
NL930NGM,tdx,NetIO Legacy TDI Support Driver,NetIO Legacy TDI Support Driver,C:\Windows\System32\drivers\tdx.sys,251725f196a3b456d40da808127750c3,\SystemRoot\system32\DRIVERS\tdx.sys,SERVICE_KERNEL_DRIVER,,true,true,The file is signed and the signature was verified.,Microsoft Windows,Microsoft Windows Production PCA 2011
NL930NGM,PolicyAgent,IPsec Policy Agent,"""Internet Protocol security (IPsec) supports network-level peer authentication  data origin authentication  data integrity  data confidentiality (encryption)  and replay protection.  This service enforces IPsec policies created through the IP Security Policies snap-in or the command-line tool """"netsh ipsec"""".  If you stop this service  you may experience network connectivity issues if your policy requires that connections use IPsec.  Also remote management of Windows Firewall is not available when this service is stopped.""",C:\Windows\System32\svchost.exe,392a255b48ce8c257466fbc5c1b201b9,C:\Windows\system32\svchost.exe -k NetworkServiceNetworkRestricted,SERVICE_WIN32_SHARE_PROCESS,C:\Windows\System32\IPSECSVC.DLL,true,true,The file is signed and the signature was verified.,Microsoft Windows,Microsoft Windows Production PCA 2011
NL930NGM,xenvbd,AWS PV Storage Host Adapter,,C:\Windows\System32\drivers\xenvbd.sys,48c6868ee8f0a5d949fcdae0969b7610,\SystemRoot\system32\DRIVERS\xenvbd.sys,SERVICE_KERNEL_DRIVER,,true,true,The file is signed and the signature was verified.,Microsoft Windows Hardware Compatibility Publisher,Microsoft Windows Hardware Compatibility PCA
NL930NGM,NDISWANLEGACY,Remote Access LEGACY NDIS WAN Driver,Remote Access LEGACY NDIS WAN Driver,C:\Windows\System32\drivers\ndiswan.sys,7c6354ae5829c737a7288a39a3c48ef6,\SystemRoot\system32\DRIVERS\ndiswan.sys,SERVICE_KERNEL_DRIVER,,true,true,The file is signed and the signature was verified.,Microsoft Windows,Microsoft Windows Production PCA 2011
NL930NGM,ModuleCoreService,McAfee Module Core Service,McAfee Module Core Service,C:\Program Files\Common Files\McAfee\ModuleCore\ModuleCoreService.exe,5db6fa537b66df306c7cf1d00213c33e,C:\Program Files\Common Files\McAfee\ModuleCore\ModuleCoreService.exe,SERVICE_WIN32_SHARE_PROCESS,,true,true,The file is signed and the signature was verified.,"""McAfee",Symantec Class 3 SHA256 Code Signing CA
NL930NGM,AcpiPmi,ACPI Power Meter Driver,,C:\Windows\System32\drivers\acpipmi.sys,92c2ed206818ddb10d41c533eb847e64,\SystemRoot\System32\drivers\acpipmi.sys,SERVICE_KERNEL_DRIVER,,true,true,The file is signed and the signature was verified.,Microsoft Windows,Microsoft Windows Production PCA 2011
NL930NGM,bxfcoe,Broadcom NetXtreme II Offload FCoE Driver,,C:\Windows\System32\drivers\bxfcoe.sys,4f1142ae9ac188558662a6943fbe7880,\SystemRoot\System32\drivers\bxfcoe.sys,SERVICE_KERNEL_DRIVER,,true,true,The file is signed and the signature was verified.,Microsoft Windows,Microsoft Windows Production PCA 2011
NL930NGM,vds,Virtual Disk,Provides management services for disks  volumes  file systems  and storage arrays.,C:\Windows\System32\vds.exe,99db5e9933d182fc66cd3d0403a78cea,C:\Windows\System32\vds.exe,SERVICE_WIN32_OWN_PROCESS,,true,true,The file is signed and the signature was verified.,Microsoft Windows,Microsoft Windows Production PCA 2011
NL930NGM,RasAgileVpn,WAN Miniport (IKEv2),WAN Miniport (IKEv2),C:\Windows\System32\drivers\agilevpn.sys,5bd8bfac427f71c6a033b379f20f64b0,\SystemRoot\system32\DRIVERS\AgileVpn.sys,SERVICE_KERNEL_DRIVER,,true,true,The file is signed and the signature was verified.,Microsoft Windows,Microsoft Windows Production PCA 2011
NL930NGM,cht4vbd,Chelsio T4 Virtual Bus Driver,,C:\Windows\System32\drivers\cht4vx64.sys,bee9a977f74094932d3b0e70baada146,\SystemRoot\System32\drivers\cht4vx64.sys,SERVICE_KERNEL_DRIVER,,true,true,The file is signed and the signature was verified.,Microsoft Windows,Microsoft Windows Production PCA 2011
NL930NGM,DeviceInstall,Device Install Service,Enables a computer to recognize and adapt to hardware changes with little or no user input. Stopping or disabling this service will result in system instability.,C:\Windows\System32\svchost.exe,392a255b48ce8c257466fbc5c1b201b9,C:\Windows\system32\svchost.exe -k DcomLaunch,SERVICE_WIN32_SHARE_PROCESS,C:\Windows\System32\umpnpmgr.dll,true,true,The file is signed and the signature was verified.,Microsoft Windows,Microsoft Windows Production PCA 2011
NL930NGM,fdPHost,Function Discovery Provider Host,The FDPHOST service hosts the Function Discovery (FD) network discovery providers. These FD providers supply network discovery services for the Simple Services Discovery Protocol (SSDP) and Web Services – Discovery (WS-D) protocol. Stopping or disabling the FDPHOST service will disable network discovery for these protocols when using FD. When this service is unavailable  network services using FD and relying on these discovery protocols will be unable to find network devices or resources.,C:\Windows\System32\svchost.exe,392a255b48ce8c257466fbc5c1b201b9,C:\Windows\system32\svchost.exe -k LocalService,SERVICE_WIN32_SHARE_PROCESS,C:\Windows\System32\fdPHost.dll,true,true,The file is signed and the signature was verified.,Microsoft Windows,Microsoft Windows Production PCA 2011
NL930NGM,SSDPSRV,SSDP Discovery,Discovers networked devices and services that use the SSDP discovery protocol  such as UPnP devices. Also announces SSDP devices and services running on the local computer. If this service is stopped  SSDP-based devices will not be discovered. If this service is disabled  any services that explicitly depend on it will fail to start.,C:\Windows\System32\svchost.exe,392a255b48ce8c257466fbc5c1b201b9,C:\Windows\system32\svchost.exe -k LocalServiceAndNoImpersonation,SERVICE_WIN32_SHARE_PROCESS,C:\Windows\System32\ssdpsrv.dll,true,true,The file is signed and the signature was verified.,Microsoft Windows,Microsoft Windows Production PCA 2011
NL930NGM,bfadfcoei,bfadfcoei,,C:\Windows\System32\drivers\bfadfcoei.sys,773be9f42e11356d877e6a92a4891b0e,\SystemRoot\System32\drivers\bfadfcoei.sys,SERVICE_KERNEL_DRIVER,,true,true,The file is signed and the signature was verified.,Microsoft Windows,Microsoft Windows Production PCA 2011
NL930NGM,mfencrk,McAfee LLC. mfencrk,McAfee Content driver Copyright (C) McAfee LLC  2018. All rights reserved.,C:\Windows\System32\drivers\mfencrk.sys,6303a7d85d974f5550c090a48d79e4d1,system32\DRIVERS\mfencrk.sys,SERVICE_KERNEL_DRIVER,,true,true,The file is signed and the signature was verified.,Microsoft Windows Hardware Compatibility Publisher,Microsoft Windows Hardware Compatibility PCA
NL930NGM,rdpbus,Remote Desktop Device Redirector Bus Driver,,C:\Windows\System32\drivers\rdpbus.sys,8765533b1902ccdd6e151b5a99b5b498,\SystemRoot\System32\drivers\rdpbus.sys,SERVICE_KERNEL_DRIVER,,true,true,The file is signed and the signature was verified.,Microsoft Windows,Microsoft Windows Production PCA 2011
NL930NGM,bfadi,bfadi,,C:\Windows\System32\drivers\bfadi.sys,4a78cdf72ee75da5e4c69e57133c4b20,\SystemRoot\System32\drivers\bfadi.sys,SERVICE_KERNEL_DRIVER,,true,true,The file is signed and the signature was verified.,Microsoft Windows,Microsoft Windows Production PCA 2011
NL930NGM,fcvsc,fcvsc,,C:\Windows\System32\drivers\fcvsc.sys,e0388cb7b9e9b77204491fbaa2d5b9d4,\SystemRoot\System32\drivers\fcvsc.sys,SERVICE_KERNEL_DRIVER,,true,true,The file is signed and the signature was verified.,Microsoft Windows,Microsoft Windows Production PCA 2011
NL930NGM,Themes,Themes,Provides user experience theme management.,C:\Windows\System32\svchost.exe,392a255b48ce8c257466fbc5c1b201b9,C:\Windows\System32\svchost.exe -k netsvcs,SERVICE_WIN32_SHARE_PROCESS,C:\Windows\System32\themeservice.dll,true,true,The file is signed and the signature was verified.,Microsoft Windows,Microsoft Windows Production PCA 2011
NL930NGM,WSService,Windows Store Service (WSService),Provides infrastructure support for Windows Store.This service is started on demand and if disabled applications bought using Windows Store will not behave correctly.,C:\Windows\System32\svchost.exe,392a255b48ce8c257466fbc5c1b201b9,C:\Windows\System32\svchost.exe -k wsappx,SERVICE_WIN32_SHARE_PROCESS,C:\Windows\System32\WSService.dll,true,true,The file is signed and the signature was verified.,Microsoft Windows,Microsoft Windows Production PCA 2011
NL930NGM,SiSRaid4,SiSRaid4,,C:\Windows\System32\drivers\sisraid4.sys,699bfaccfe4100bfd3efb08032229a5e,\SystemRoot\System32\drivers\sisraid4.sys,SERVICE_KERNEL_DRIVER,,true,true,The file is signed and the signature was verified.,Microsoft Windows,Microsoft Windows Production PCA 2011
NL930NGM,SystemEventsBroker,System Events Broker,Coordinates execution of background work for WinRT application. If this service is stopped or disabled  then background work might not be triggered.,C:\Windows\System32\svchost.exe,392a255b48ce8c257466fbc5c1b201b9,C:\Windows\system32\svchost.exe -k DcomLaunch,SERVICE_WIN32_SHARE_PROCESS,C:\Windows\System32\SystemEventsBrokerServer.dll,true,true,The file is signed and the signature was verified.,Microsoft Windows,Microsoft Windows Production PCA 2011
NL930NGM,elxfcoe,elxfcoe,,C:\Windows\System32\drivers\elxfcoe.sys,9be50a7860c13cc924e9f0a989f4abcb,\SystemRoot\System32\drivers\elxfcoe.sys,SERVICE_KERNEL_DRIVER,,true,true,The file is signed and the signature was verified.,Microsoft Windows,Microsoft Windows Production PCA 2011
NL930NGM,mshidkmdf,Pass-through HID to KMDF Filter Driver,Device Filter to provide pass-through interface between HIDCLASS and KMDF,C:\Windows\System32\drivers\mshidkmdf.sys,5d13bb98f852406796906fc4b1a2ed7b,\SystemRoot\System32\drivers\mshidkmdf.sys,SERVICE_KERNEL_DRIVER,,true,true,The file is signed and the signature was verified.,Microsoft Windows,Microsoft Windows Production PCA 2011
NL930NGM,dmvsc,dmvsc,,C:\Windows\System32\drivers\dmvsc.sys,ba78a69a7b732ffc35a4c897c64625f1,\SystemRoot\System32\drivers\dmvsc.sys,SERVICE_KERNEL_DRIVER,,true,true,The file is signed and the signature was verified.,Microsoft Windows,Microsoft Windows Production PCA 2011
NL930NGM,WinHttpAutoProxySvc,WinHTTP Web Proxy Auto-Discovery Service,WinHTTP implements the client HTTP stack and provides developers with a Win32 API and COM Automation component for sending HTTP requests and receiving responses. In addition  WinHTTP provides support for auto-discovering a proxy configuration via its implementation of the Web Proxy Auto-Discovery (WPAD) protocol.,C:\Windows\System32\svchost.exe,392a255b48ce8c257466fbc5c1b201b9,C:\Windows\system32\svchost.exe -k LocalService,SERVICE_WIN32_SHARE_PROCESS,C:\Windows\System32\winhttp.dll,true,true,The file is signed and the signature was verified.,Microsoft Windows,Microsoft Windows Production PCA 2011
NL930NGM,W32Time,Windows Time,Maintains date and time synchronization on all clients and servers in the network. If this service is stopped  date and time synchronization will be unavailable. If this service is disabled  any services that explicitly depend on it will fail to start.,C:\Windows\System32\svchost.exe,392a255b48ce8c257466fbc5c1b201b9,C:\Windows\system32\svchost.exe -k LocalService,SERVICE_WIN32_SHARE_PROCESS,C:\Windows\System32\w32time.dll,true,true,The file is signed and the signature was verified.,Microsoft Windows,Microsoft Windows Production PCA 2011
NL930NGM,ndfltr,NetworkDirect Service,,C:\Windows\System32\drivers\ndfltr.sys,97db964929936f92dabe54b501cb55e5,\SystemRoot\System32\drivers\ndfltr.sys,SERVICE_KERNEL_DRIVER,,true,true,The file is signed and the signature was verified.,Microsoft Windows,Microsoft Windows Production PCA 2011
NL930NGM,cdfs,CD/DVD File System Reader,ISO9660/Joliet File System Reader for CD/DVDs. (Core) (All pieces),C:\Windows\System32\drivers\cdfs.sys,dd8128b8e77107246f49a71d59c108d7,system32\DRIVERS\cdfs.sys,SERVICE_FILE_SYSTEM_DRIVER,,true,true,The file is signed and the signature was verified.,Microsoft Windows,Microsoft Windows Production PCA 2011
NL930NGM,vmbus,Virtual Machine Bus,,C:\Windows\System32\drivers\vmbus.sys,59a19b5567ac55e96f1cca1887e7660f,\SystemRoot\System32\drivers\vmbus.sys,SERVICE_KERNEL_DRIVER,,true,true,The file is signed and the signature was verified.,Microsoft Windows,Microsoft Windows Production PCA 2011
NL930NGM,CNG,CNG,,C:\Windows\System32\drivers\cng.sys,46c8491bf881193de3f8c2ccc36d2e30,\SystemRoot\System32\Drivers\cng.sys,SERVICE_KERNEL_DRIVER,,true,true,The file is signed and the signature was verified.,Microsoft Windows,Microsoft Windows Production PCA 2011
NL930NGM,tsusbhub,Remote Desktop USB Hub,,C:\Windows\System32\drivers\tsusbhub.sys,77c4c79ac29c8ef44323fd2ba7e30752,\SystemRoot\System32\drivers\tsusbhub.sys,SERVICE_KERNEL_DRIVER,,true,true,The file is signed and the signature was verified.,Microsoft Windows,Microsoft Windows Production PCA 2011
NL930NGM,SysMain,Superfetch,Maintains and improves system performance over time.,C:\Windows\System32\svchost.exe,392a255b48ce8c257466fbc5c1b201b9,C:\Windows\system32\svchost.exe -k LocalSystemNetworkRestricted,SERVICE_WIN32_SHARE_PROCESS,C:\Windows\System32\sysmain.dll,true,true,The file is signed and the signature was verified.,Microsoft Windows,Microsoft Windows Production PCA 2011
NL930NGM,vmbusr,Virtual Machine Bus Provider,,C:\Windows\System32\drivers\vmbusr.sys,23b67f3c3042fb89a55ef4f5a16bae42,\SystemRoot\System32\drivers\vmbusr.sys,SERVICE_KERNEL_DRIVER,,true,true,The file is signed and the signature was verified.,Microsoft Windows,Microsoft Windows Production PCA 2011
NL930NGM,stornvme,Microsoft Standard NVM Express Driver,,C:\Windows\System32\drivers\stornvme.sys,ae20639e2350ebe3d79b756978dbcfb0,\SystemRoot\System32\drivers\stornvme.sys,SERVICE_KERNEL_DRIVER,,true,true,The file is signed and the signature was verified.,Microsoft Windows,Microsoft Windows Production PCA 2011
NL930NGM,IEEtwCollectorService,Internet Explorer ETW Collector Service,ETW Collector Service for Internet Explorer. When running  this service collects real time ETW events and processes them.,C:\Windows\System32\IEEtwCollector.exe,f5763118c96cbd541daff107c32737a8,C:\Windows\system32\IEEtwCollector.exe /V,SERVICE_WIN32_OWN_PROCESS,,true,true,The file is signed and the signature was verified.,Microsoft Windows,Microsoft Windows Production PCA 2011
NL930NGM,arcsas,Adaptec SAS/SATA-II RAID Storport's Miniport Driver,,C:\Windows\System32\drivers\arcsas.sys,f2940982b88b4295a8cb70b5d53a869d,\SystemRoot\System32\drivers\arcsas.sys,SERVICE_KERNEL_DRIVER,,true,true,The file is signed and the signature was verified.,Microsoft Windows,Microsoft Windows Production PCA 2011
NL930NGM,upnphost,UPnP Device Host,Allows UPnP devices to be hosted on this computer. If this service is stopped  any hosted UPnP devices will stop functioning and no additional hosted devices can be added. If this service is disabled  any services that explicitly depend on it will fail to start.,C:\Windows\System32\svchost.exe,392a255b48ce8c257466fbc5c1b201b9,C:\Windows\system32\svchost.exe -k LocalServiceAndNoImpersonation,SERVICE_WIN32_SHARE_PROCESS,C:\Windows\System32\upnphost.dll,true,true,The file is signed and the signature was verified.,Microsoft Windows,Microsoft Windows Production PCA 2011
NL930NGM,stexstor,stexstor,,C:\Windows\System32\drivers\stexstor.sys,59541686923a1e14c6b348b041e63f28,\SystemRoot\System32\drivers\stexstor.sys,SERVICE_KERNEL_DRIVER,,true,true,The file is signed and the signature was verified.,Microsoft Windows,Microsoft Windows Production PCA 2011
NL930NGM,lltdsvc,Link-Layer Topology Discovery Mapper,Creates a Network Map  consisting of PC and device topology (connectivity) information  and metadata describing each PC and device.  If this service is disabled  the Network Map will not function properly.,C:\Windows\System32\svchost.exe,392a255b48ce8c257466fbc5c1b201b9,C:\Windows\System32\svchost.exe -k LocalService,SERVICE_WIN32_SHARE_PROCESS,C:\Windows\System32\lltdsvc.dll,true,true,The file is signed and the signature was verified.,Microsoft Windows,Microsoft Windows Production PCA 2011
NL930NGM,nsiproxy,NSI Proxy Service Driver,NSI Proxy Service,C:\Windows\System32\drivers\nsiproxy.sys,f9efee449b535e296b6b4d31b4646aa3,system32\drivers\nsiproxy.sys,SERVICE_KERNEL_DRIVER,,true,true,The file is signed and the signature was verified.,Microsoft Windows,Microsoft Windows Production PCA 2011
NL930NGM,McAWFwk,McAfee Activation Service,McAfee Activation Service,c:\Program Files\Common Files\McAfee\ActWiz\McAWFwk.exe,3b18f91300cfd7473a6c11dcc16ec041,c:\PROGRA~1\COMMON~1\mcafee\actwiz\mcawfwk.exe,SERVICE_WIN32_OWN_PROCESS,,true,true,The file is signed and the signature was verified.,"McAfee""",Symantec Class 3 SHA256 Code Signing CA
NL930NGM,USBSTOR,USB Mass Storage Driver,,C:\Windows\System32\drivers\USBSTOR.SYS,3cbb010af5a585f9451670d74b30c28e,\SystemRoot\System32\drivers\USBSTOR.SYS,SERVICE_KERNEL_DRIVER,,true,true,The file is signed and the signature was verified.,Microsoft Windows,Microsoft Windows Production PCA 2011
NL930NGM,WinVerbs,WinVerbs Service,,C:\Windows\System32\drivers\winverbs.sys,25663aa2e0ac33bf4e680f080a4e1944,\SystemRoot\System32\drivers\winverbs.sys,SERVICE_KERNEL_DRIVER,,true,true,The file is signed and the signature was verified.,Microsoft Windows,Microsoft Windows Production PCA 2011
NL930NGM,UEFI,Microsoft UEFI Driver,,C:\Windows\System32\drivers\uefi.sys,90b3c6723aae5ab9eb4e1feb9acb8592,\SystemRoot\System32\drivers\UEFI.sys,SERVICE_KERNEL_DRIVER,,true,true,The file is signed and the signature was verified.,Microsoft Windows,Microsoft Windows Production PCA 2011
NL930NGM,usbuhci,Microsoft USB Universal Host Controller Miniport Driver,,C:\Windows\System32\drivers\usbuhci.sys,161e97427c3b298bc36c4af7207a6947,\SystemRoot\System32\drivers\usbuhci.sys,SERVICE_KERNEL_DRIVER,,true,true,The file is signed and the signature was verified.,Microsoft Windows,Microsoft Windows Production PCA 2011
NL930NGM,NetBIOS,NetBIOS Interface,NetBIOS Interface,C:\Windows\System32\drivers\netbios.sys,f250acdbeb72e9bf503319dee8c306e1,system32\DRIVERS\netbios.sys,SERVICE_FILE_SYSTEM_DRIVER,,true,true,The file is signed and the signature was verified.,Microsoft Windows,Microsoft Windows Production PCA 2011
NL930NGM,lltdio,Link-Layer Topology Discovery Mapper I/O Driver,,C:\Windows\System32\drivers\lltdio.sys,9b5020f28ffb93a57910b5aac4a2f424,\SystemRoot\system32\DRIVERS\lltdio.sys,SERVICE_KERNEL_DRIVER,,true,true,The file is signed and the signature was verified.,Microsoft Windows,Microsoft Windows Production PCA 2011
NL930NGM,CompositeBus,Composite Bus Enumerator Driver,,C:\Windows\System32\drivers\CompositeBus.sys,b3d7c6250d8adc979b1aa63433fe56f0,\SystemRoot\System32\drivers\CompositeBus.sys,SERVICE_KERNEL_DRIVER,,true,true,The file is signed and the signature was verified.,Microsoft Windows,Microsoft Windows Production PCA 2011
NL930NGM,FileInfo,File Information FS MiniFilter,Collects information about files in memory to be consumed by other system services.,C:\Windows\System32\drivers\fileinfo.sys,13fd28dd4effbea2ca82c5db125141e6,\SystemRoot\System32\drivers\fileinfo.sys,SERVICE_FILE_SYSTEM_DRIVER,,true,true,The file is signed and the signature was verified.,Microsoft Windows,Microsoft Windows Production PCA 2011
NL930NGM,MpsSvc,Windows Firewall,Windows Firewall helps protect your computer by preventing unauthorized users from gaining access to your computer through the Internet or a network.,C:\Windows\System32\svchost.exe,392a255b48ce8c257466fbc5c1b201b9,C:\Windows\system32\svchost.exe -k LocalServiceNoNetwork,SERVICE_WIN32_SHARE_PROCESS,C:\Windows\System32\MPSSVC.dll,true,true,The file is signed and the signature was verified.,Microsoft Windows,Microsoft Windows Production PCA 2011
NL930NGM,spaceport,Storage Spaces Driver,,C:\Windows\System32\drivers\spaceport.sys,aeb39f149516950e814a092987893043,\SystemRoot\System32\drivers\spaceport.sys,SERVICE_KERNEL_DRIVER,,true,true,The file is signed and the signature was verified.,Microsoft Windows,Microsoft Windows Production PCA 2011
NL930NGM,wudfsvc,Windows Driver Foundation - User-mode Driver Framework,Creates and manages user-mode driver processes. This service cannot be stopped.,C:\Windows\System32\svchost.exe,392a255b48ce8c257466fbc5c1b201b9,C:\Windows\system32\svchost.exe -k LocalSystemNetworkRestricted,SERVICE_WIN32_SHARE_PROCESS,C:\Windows\System32\WUDFSvc.dll,true,true,The file is signed and the signature was verified.,Microsoft Windows,Microsoft Windows Production PCA 2011
NL930NGM,KPSSVC,KDC Proxy Server service (KPS),KDC Proxy Server service runs on edge servers to proxy Kerberos protocol messages to domain controllers on the corporate network.,C:\Windows\System32\svchost.exe,392a255b48ce8c257466fbc5c1b201b9,C:\Windows\system32\svchost.exe -k KpsSvcGroup,SERVICE_WIN32_SHARE_PROCESS,C:\Windows\System32\kpssvc.dll,true,true,The file is signed and the signature was verified.,Microsoft Windows,Microsoft Windows Production PCA 2011
