hostname,name,descriptivename,description,path,md5,arguments,type,servicedll,pathsignatureexists,pathsignatureverified,pathsignaturedescription,pathcertificatesubject,pathcertificateissuer
SB682YOC,SSDPSRV,SSDP Discovery,Discovers networked devices and services that use the SSDP discovery protocol  such as UPnP devices. Also announces SSDP devices and services running on the local computer. If this service is stopped  SSDP-based devices will not be discovered. If this service is disabled  any services that explicitly depend on it will fail to start.,C:\Windows\System32\svchost.exe,48a26c8bb897eec4f27dc5435e8c060c,C:\Windows\system32\svchost.exe -k LocalServiceAndNoImpersonation,SERVICE_WIN32_SHARE_PROCESS,C:\Windows\System32\ssdpsrv.dll,true,true,The file is signed and the signature was verified.,Microsoft Windows,Microsoft Windows Verification PCA
SB682YOC,WdiSystemHost,Diagnostic System Host,The Diagnostic System Host is used by the Diagnostic Policy Service to host diagnostics that need to run in a Local System context.  If this service is stopped  any diagnostics that depend on it will no longer function.,C:\Windows\System32\svchost.exe,48a26c8bb897eec4f27dc5435e8c060c,C:\Windows\System32\svchost.exe -k LocalSystemNetworkRestricted,SERVICE_WIN32_SHARE_PROCESS,C:\Windows\System32\wdi.dll,true,true,The file is signed and the signature was verified.,Microsoft Windows,Microsoft Windows Verification PCA
SB682YOC,TrustedInstaller,Windows Modules Installer,Enables installation  modification  and removal of Windows updates and optional components. If this service is disabled  install or uninstall of Windows updates might fail for this computer.,C:\Windows\servicing\TrustedInstaller.exe,10d8667748a0e0023de2a031025c0bc5,C:\Windows\servicing\TrustedInstaller.exe,SERVICE_WIN32_OWN_PROCESS,,true,true,The file is signed and the signature was verified.,Microsoft Windows,Microsoft Windows Verification PCA
SB682YOC,EapHost,Extensible Authentication Protocol,The Extensible Authentication Protocol (EAP) service provides network authentication in such scenarios as 802.1x wired and wireless  VPN  and Network Access Protection (NAP).  EAP also provides application programming interfaces (APIs) that are used by network access clients  including wireless and VPN clients  during the authentication process.  If you disable this service  this computer is prevented from accessing networks that require EAP authentication.,C:\Windows\System32\svchost.exe,48a26c8bb897eec4f27dc5435e8c060c,C:\Windows\System32\svchost.exe -k netsvcs,SERVICE_WIN32_SHARE_PROCESS,C:\Windows\System32\eapsvc.dll,true,true,The file is signed and the signature was verified.,Microsoft Windows,Microsoft Windows Verification PCA
SB682YOC,nvme,nvme,,C:\Windows\System32\drivers\nvme.sys,03c5543824cefe330b4518e9776a5d33,\SystemRoot\system32\drivers\nvme.sys,SERVICE_KERNEL_DRIVER,,true,true,The file is signed and the signature was verified.,Google Inc,Symantec Class 3 SHA256 Code Signing CA
SB682YOC,NDIS,NDIS System Driver,NDIS System Driver,C:\Windows\System32\drivers\ndis.sys,2bc7c2275abffec1e84b2d30da95aeb1,\SystemRoot\system32\drivers\ndis.sys,SERVICE_KERNEL_DRIVER,,true,true,The file is signed and the signature was verified.,Microsoft Windows,Microsoft Windows Verification PCA
SB682YOC,Brserid,Brother MFC Serial Port Interface Driver (WDM),,C:\Windows\System32\drivers\BrSerId.sys,26764a7126d1d3b3ad62f015d9a86123,\SystemRoot\System32\Drivers\Brserid.sys,SERVICE_KERNEL_DRIVER,,true,true,The file is signed and the signature was verified.,Microsoft Windows,Microsoft Windows Verification PCA
SB682YOC,nvraid,nvraid,,C:\Windows\System32\drivers\nvraid.sys,cd7982c1f2676101621c99651f869d29,\SystemRoot\system32\drivers\nvraid.sys,SERVICE_KERNEL_DRIVER,,true,true,The file is signed and the signature was verified.,Microsoft Windows,Microsoft Windows Verification PCA
SB682YOC,HTTP,HTTP,This service implements the hypertext transfer protocol (HTTP). If this service is disabled  any services that explicitly depend on it will fail to start.,C:\Windows\System32\drivers\http.sys,a2fd59ea34cd0790fa90ca625f8a6e2a,system32\drivers\HTTP.sys,SERVICE_KERNEL_DRIVER,,true,true,The file is signed and the signature was verified.,Microsoft Windows,Microsoft Windows Verification PCA
SB682YOC,WANARP,Remote Access IP ARP Driver,Remote Access IP ARP Driver,C:\Windows\System32\drivers\wanarp.sys,d8b87a38c3cedddf1b284652d8671352,system32\DRIVERS\wanarp.sys,SERVICE_KERNEL_DRIVER,,true,true,The file is signed and the signature was verified.,Microsoft Windows,Microsoft Windows Verification PCA
SB682YOC,Dnscache,DNS Client,The DNS Client service (dnscache) caches Domain Name System (DNS) names and registers the full computer name for this computer. If the service is stopped  DNS names will continue to be resolved. However  the results of DNS name queries will not be cached and the computer's name will not be registered. If the service is disabled  any services that explicitly depend on it will fail to start.,C:\Windows\System32\svchost.exe,48a26c8bb897eec4f27dc5435e8c060c,C:\Windows\system32\svchost.exe -k NetworkService,SERVICE_WIN32_SHARE_PROCESS,C:\Windows\System32\dnsrslvr.dll,true,true,The file is signed and the signature was verified.,Microsoft Windows,Microsoft Windows Verification PCA
SB682YOC,storvsc,storvsc,,C:\Windows\System32\drivers\storvsc.sys,81a827e2493b178f496d1adaeeb8f019,\SystemRoot\system32\drivers\storvsc.sys,SERVICE_KERNEL_DRIVER,,true,true,The file is signed and the signature was verified.,Microsoft Windows,Microsoft Windows Verification PCA
SB682YOC,AppHostSvc,Application Host Helper Service,Provides administrative services for IIS  for example configuration history and Application Pool account mapping. If this service is stopped  configuration history and locking down files or directories with Application Pool specific Access Control Entries will not work.,C:\Windows\System32\svchost.exe,48a26c8bb897eec4f27dc5435e8c060c,C:\WINDOWS\system32\svchost.exe -k apphost,SERVICE_WIN32_OWN_PROCESS SERVICE_WIN32_SHARE_PROCESS,C:\Windows\System32\inetsrv\apphostsvc.dll,true,true,The file is signed and the signature was verified.,Microsoft Windows,Microsoft Windows Production PCA 2011
SB682YOC,AcpiPmi,ACPI Power Meter Driver,,C:\Windows\System32\drivers\acpipmi.sys,71200b973db72efff781ae496869d70e,\SystemRoot\system32\drivers\acpipmi.sys,SERVICE_KERNEL_DRIVER,,true,true,The file is signed and the signature was verified.,Microsoft Windows,Microsoft Windows Verification PCA
SB682YOC,WmiAcpi,Microsoft Windows Management Interface for ACPI,,C:\Windows\System32\drivers\wmiacpi.sys,f8014a223a23ac2613faad12a4a7cb7e,\SystemRoot\system32\drivers\wmiacpi.sys,SERVICE_KERNEL_DRIVER,,true,true,The file is signed and the signature was verified.,Microsoft Windows,Microsoft Windows Verification PCA
SB682YOC,gpsvc,Group Policy Client,The service is responsible for applying settings configured by administrators for the computer and users through the Group Policy component. If the service is stopped or disabled  the settings will not be applied and applications and components will not be manageable through Group Policy. Any components or applications that depend on the Group Policy component might not be functional if the service is stopped or disabled.,C:\Windows\System32\svchost.exe,48a26c8bb897eec4f27dc5435e8c060c,C:\Windows\system32\svchost.exe -k netsvcs,SERVICE_WIN32_SHARE_PROCESS,C:\Windows\System32\gpsvc.dll,true,true,The file is signed and the signature was verified.,Microsoft Windows,Microsoft Windows Verification PCA
SB682YOC,usbhub,Microsoft USB Standard Hub Driver,,C:\Windows\System32\drivers\usbhub.sys,f025a4a416b18ed4119a4447ac564dc6,\SystemRoot\system32\drivers\usbhub.sys,SERVICE_KERNEL_DRIVER,,true,true,The file is signed and the signature was verified.,Microsoft Windows,Microsoft Windows Verification PCA
SB682YOC,isapnp,isapnp,,C:\Windows\System32\drivers\isapnp.sys,ba583b54bffcced2608c3fc40b466798,\SystemRoot\system32\drivers\isapnp.sys,SERVICE_KERNEL_DRIVER,,true,true,The file is signed and the signature was verified.,Microsoft Windows,Microsoft Windows Verification PCA
SB682YOC,MSDTC,Distributed Transaction Coordinator,Coordinates transactions that span multiple resource managers  such as databases  message queues  and file systems. If this service is stopped  these transactions will fail. If this service is disabled  any services that explicitly depend on it will fail to start.,C:\Windows\System32\msdtc.exe,e00a23062a1702f09cb3da58d71345ef,C:\Windows\System32\msdtc.exe,SERVICE_WIN32_OWN_PROCESS,,true,true,The file is signed and the signature was verified.,Microsoft Windows,Microsoft Windows Verification PCA
SB682YOC,hidserv,Human Interface Device Access,Enables generic input access to Human Interface Devices (HID)  which activates and maintains the use of predefined hot buttons on keyboards  remote controls  and other multimedia devices. If this service is stopped  hot buttons controlled by this service will no longer function. If this service is disabled  any services that explicitly depend on it will fail to start.,C:\Windows\System32\svchost.exe,48a26c8bb897eec4f27dc5435e8c060c,C:\Windows\system32\svchost.exe -k LocalSystemNetworkRestricted,SERVICE_WIN32_SHARE_PROCESS,C:\Windows\System32\hidserv.dll,true,true,The file is signed and the signature was verified.,Microsoft Windows,Microsoft Windows Verification PCA
SB682YOC,IPMIDRV,IPMIDRV,,C:\Windows\System32\drivers\IPMIDrv.sys,2c1e6e312c9e4572bec0cb3703efa129,\SystemRoot\system32\drivers\IPMIDrv.sys,SERVICE_KERNEL_DRIVER,,true,true,The file is signed and the signature was verified.,Microsoft Windows,Microsoft Windows Verification PCA
SB682YOC,WdiServiceHost,Diagnostic Service Host,The Diagnostic Service Host is used by the Diagnostic Policy Service to host diagnostics that need to run in a Local Service context.  If this service is stopped  any diagnostics that depend on it will no longer function.,C:\Windows\System32\svchost.exe,48a26c8bb897eec4f27dc5435e8c060c,C:\Windows\System32\svchost.exe -k LocalService,SERVICE_WIN32_SHARE_PROCESS,C:\Windows\System32\wdi.dll,true,true,The file is signed and the signature was verified.,Microsoft Windows,Microsoft Windows Verification PCA
SB682YOC,mfefire,McAfee Firewall Core Service,Provides firewall services to McAfee products,C:\Program Files\Common Files\McAfee\SystemCore\mfefire.exe,97a25df8f051a854cb86b8595a552d95,"C:\Program Files\Common Files\McAfee\SystemCore\mfefire.exe""""""",SERVICE_WIN32_OWN_PROCESS,,true,true,The file is signed and the signature was verified.,"""McAfee",VeriSign Class 3 Code Signing 2010 CA
SB682YOC,Dhcp,DHCP Client,Registers and updates IP addresses and DNS records for this computer. If this service is stopped  this computer will not receive dynamic IP addresses and DNS updates. If this service is disabled  any services that explicitly depend on it will fail to start.,C:\Windows\System32\svchost.exe,48a26c8bb897eec4f27dc5435e8c060c,C:\Windows\system32\svchost.exe -k LocalServiceNetworkRestricted,SERVICE_WIN32_SHARE_PROCESS,C:\Windows\System32\dhcpcore.dll,true,true,The file is signed and the signature was verified.,Microsoft Windows,Microsoft Windows Verification PCA
SB682YOC,sfloppy,High-Capacity Floppy Disk Drive,,C:\Windows\System32\drivers\sfloppy.sys,e72f7f7bdb2b55ca726467e67aab45b1,\SystemRoot\system32\drivers\sfloppy.sys,SERVICE_KERNEL_DRIVER,,true,true,The file is signed and the signature was verified.,Microsoft Windows,Microsoft Windows Verification PCA
SB682YOC,IpFilterDriver,IP Traffic Filter Driver,IP Traffic Filter Driver,C:\Windows\System32\drivers\ipfltdrv.sys,8861468adb7937debfb66b9288254ed0,system32\DRIVERS\ipfltdrv.sys,SERVICE_KERNEL_DRIVER,,true,true,The file is signed and the signature was verified.,Microsoft Windows,Microsoft Windows Verification PCA
SB682YOC,NlaSvc,Network Location Awareness,Collects and stores configuration information for the network and notifies programs when this information is modified. If this service is stopped  configuration information might be unavailable. If this service is disabled  any services that explicitly depend on it will fail to start.,C:\Windows\System32\svchost.exe,48a26c8bb897eec4f27dc5435e8c060c,C:\Windows\System32\svchost.exe -k NetworkService,SERVICE_WIN32_SHARE_PROCESS,C:\Windows\System32\nlasvc.dll,true,true,The file is signed and the signature was verified.,Microsoft Windows,Microsoft Windows Verification PCA
SB682YOC,adp94xx,adp94xx,,C:\Windows\System32\drivers\adp94xx.sys,05d7c90f209d18fc8aee1d7fe9637715,\SystemRoot\system32\drivers\adp94xx.sys,SERVICE_KERNEL_DRIVER,,true,true,The file is signed and the signature was verified.,Microsoft Windows,Microsoft Windows Verification PCA
SB682YOC,clr_optimization_v2.0.50727_64,Microsoft .NET Framework NGEN v2.0.50727_X64,Microsoft .NET Framework NGEN,C:\Windows\Microsoft.NET\Framework64\v2.0.50727\mscorsvw.exe,b8dcdb646f2ebc1cc86d582afdaf51ea,C:\Windows\Microsoft.NET\Framework64\v2.0.50727\mscorsvw.exe,SERVICE_WIN32_OWN_PROCESS,,true,true,The file is signed and the signature was verified.,Microsoft Windows,Microsoft Windows Verification PCA
SB682YOC,intelide,intelide,,C:\Windows\System32\drivers\intelide.sys,0f7c114e487847694d0d4713c73322c3,\SystemRoot\system32\drivers\intelide.sys,SERVICE_KERNEL_DRIVER,,true,true,The file is signed and the signature was verified.,Microsoft Windows,Microsoft Windows Verification PCA
SB682YOC,TsUsbGD,Remote Desktop Generic USB Device,,C:\Windows\System32\drivers\TsUsbGD.sys,e9e9349e8af7f32777900f145a68cb0d,\SystemRoot\system32\drivers\TsUsbGD.sys,SERVICE_KERNEL_DRIVER,,true,true,The file is signed and the signature was verified.,Microsoft Windows,Microsoft Windows Verification PCA
SB682YOC,blbdrive,blbdrive,,C:\Windows\System32\drivers\blbdrive.sys,498d3af442c02bfa6ac4088b97bfa246,\SystemRoot\system32\drivers\blbdrive.sys,SERVICE_KERNEL_DRIVER,,true,true,The file is signed and the signature was verified.,Microsoft Windows,Microsoft Windows Verification PCA
SB682YOC,Mup,Mup,Multiple UNC Provider Driver,C:\Windows\System32\drivers\mup.sys,fa51bf36cb0c5fff1169bb062a8783ec,\SystemRoot\System32\Drivers\mup.sys,SERVICE_FILE_SYSTEM_DRIVER,,true,true,The file is signed and the signature was verified.,Microsoft Windows,Microsoft Windows Verification PCA
SB682YOC,rdbss,Redirected Buffering Sub Sysytem,Provides the framework for network mini-redirectors,C:\Windows\System32\drivers\rdbss.sys,c1108c5d10d8a77e3e3a322deffc16bf,system32\DRIVERS\rdbss.sys,SERVICE_FILE_SYSTEM_DRIVER,,true,true,The file is signed and the signature was verified.,Microsoft Windows,Microsoft Windows Verification PCA
SB682YOC,WinHttpAutoProxySvc,WinHTTP Web Proxy Auto-Discovery Service,WinHTTP implements the client HTTP stack and provides developers with a Win32 API and COM Automation component for sending HTTP requests and receiving responses. In addition  WinHTTP provides support for auto-discovering a proxy configuration via its implementation of the Web Proxy Auto-Discovery (WPAD) protocol.,C:\Windows\System32\svchost.exe,48a26c8bb897eec4f27dc5435e8c060c,C:\Windows\system32\svchost.exe -k LocalService,SERVICE_WIN32_SHARE_PROCESS,C:\Windows\System32\winhttp.dll,true,true,The file is signed and the signature was verified.,Microsoft Windows,Microsoft Windows Verification PCA
SB682YOC,CompositeBus,Composite Bus Enumerator Driver,,C:\Windows\System32\drivers\CompositeBus.sys,d0c05cca9341f45bed94b68d10d728f6,\SystemRoot\system32\drivers\CompositeBus.sys,SERVICE_KERNEL_DRIVER,,true,true,The file is signed and the signature was verified.,Microsoft Windows,Microsoft Windows Verification PCA
SB682YOC,tunnel,Microsoft Tunnel Miniport Adapter Driver,,C:\Windows\System32\drivers\tunnel.sys,1b6bc19078c3ba29ced23efdb1181a8c,system32\DRIVERS\tunnel.sys,SERVICE_KERNEL_DRIVER,,true,true,The file is signed and the signature was verified.,Microsoft Windows,Microsoft Windows Verification PCA
SB682YOC,Serenum,Serenum Filter Driver,,C:\Windows\System32\drivers\serenum.sys,6a3b1553e6bee631578f6218a07d1966,\SystemRoot\system32\drivers\serenum.sys,SERVICE_KERNEL_DRIVER,,true,true,The file is signed and the signature was verified.,Microsoft Windows,Microsoft Windows Verification PCA
SB682YOC,AudioSrv,Windows Audio,Manages audio for Windows-based programs.  If this service is stopped  audio devices and effects will not function properly.  If this service is disabled  any services that explicitly depend on it will fail to start,C:\Windows\System32\svchost.exe,48a26c8bb897eec4f27dc5435e8c060c,C:\Windows\System32\svchost.exe -k LocalServiceNetworkRestricted,SERVICE_WIN32_SHARE_PROCESS,C:\Windows\System32\audiosrv.dll,true,true,The file is signed and the signature was verified.,Microsoft Windows,Microsoft Windows Verification PCA
SB682YOC,TDTCP,TDTCP,,C:\Windows\System32\drivers\tdtcp.sys,7e3d73b85a1d4cffacc77c055571f5a9,system32\drivers\tdtcp.sys,SERVICE_KERNEL_DRIVER,,true,true,The file is signed and the signature was verified.,Microsoft Windows,Microsoft Windows Verification PCA
SB682YOC,arcsas,arcsas,,C:\Windows\System32\drivers\arcsas.sys,33734e2fc27fff7acd213b73a8245fcd,\SystemRoot\system32\drivers\arcsas.sys,SERVICE_KERNEL_DRIVER,,true,true,The file is signed and the signature was verified.,Microsoft Windows,Microsoft Windows Verification PCA
SB682YOC,AppIDSvc,Application Identity,Determines and verifies the identity of an application. Disabling this service will prevent AppLocker from being enforced.,C:\Windows\System32\svchost.exe,48a26c8bb897eec4f27dc5435e8c060c,C:\Windows\system32\svchost.exe -k LocalServiceAndNoImpersonation,SERVICE_WIN32_SHARE_PROCESS,C:\Windows\System32\appidsvc.dll,true,true,The file is signed and the signature was verified.,Microsoft Windows,Microsoft Windows Verification PCA
SB682YOC,storflt,Disk Virtual Machine Bus Acceleration Filter Driver,,C:\Windows\System32\drivers\vmstorfl.sys,8e59a33ed8591af4b936220a53327a97,\SystemRoot\system32\drivers\vmstorfl.sys,SERVICE_KERNEL_DRIVER,,true,true,The file is signed and the signature was verified.,Microsoft Windows,Microsoft Windows Verification PCA
SB682YOC,Vid,Vid,,C:\Windows\System32\drivers\Vid.sys,f45885f5b3ee8455a78d8f4db1230714,\SystemRoot\system32\drivers\Vid.sys,SERVICE_KERNEL_DRIVER,,true,true,The file is signed and the signature was verified.,Microsoft Windows,Microsoft Windows Verification PCA
SB682YOC,usbohci,Microsoft USB Open Host Controller Miniport Driver,,C:\Windows\System32\drivers\usbohci.sys,f3f207a1401c14538681ec6506a58f8c,\SystemRoot\system32\drivers\usbohci.sys,SERVICE_KERNEL_DRIVER,,true,true,The file is signed and the signature was verified.,Microsoft Windows,Microsoft Windows Verification PCA
SB682YOC,PEAUTH,PEAUTH,,C:\Windows\System32\drivers\PEAuth.sys,38ce60494a149c3c4c2a73c14b275026,system32\drivers\peauth.sys,SERVICE_KERNEL_DRIVER,,true,true,The file is signed and the signature was verified.,Microsoft Windows,Microsoft Windows Verification PCA
SB682YOC,McAWFwk,McAfee Activation Service,McAfee Activation Service,c:\Program Files\Common Files\McAfee\ActWiz\McAWFwk.exe,e973b8eb6574ecfeb69750abc3f634f0,c:\PROGRA~1\COMMON~1\mcafee\actwiz\mcawfwk.exe,SERVICE_WIN32_OWN_PROCESS,,true,true,The file is signed and the signature was verified.,"McAfee""",Symantec Class 3 SHA256 Code Signing CA
SB682YOC,agp440,Intel AGP Bus Filter,,C:\Windows\System32\drivers\AGP440.sys,1b6241a8c717dc14fb8a3fa869e834f0,\SystemRoot\system32\drivers\agp440.sys,SERVICE_KERNEL_DRIVER,,true,true,The file is signed and the signature was verified.,Microsoft Windows,Microsoft Windows Verification PCA
SB682YOC,wuauserv,Windows Update,Enables the detection  download  and installation of updates for Windows and other programs. If this service is disabled  users of this computer will not be able to use Windows Update or its automatic updating feature  and programs will not be able to use the Windows Update Agent (WUA) API.,C:\Windows\System32\svchost.exe,48a26c8bb897eec4f27dc5435e8c060c,C:\Windows\system32\svchost.exe -k netsvcs,SERVICE_WIN32_SHARE_PROCESS,C:\Windows\System32\wuaueng.dll,true,true,The file is signed and the signature was verified.,Microsoft Windows,Microsoft Windows Verification PCA
SB682YOC,AeLookupSvc,Application Experience,Processes application compatibility cache requests for applications as they are launched,C:\Windows\System32\svchost.exe,48a26c8bb897eec4f27dc5435e8c060c,C:\Windows\system32\svchost.exe -k netsvcs,SERVICE_WIN32_SHARE_PROCESS,C:\Windows\System32\aelupsvc.dll,true,true,The file is signed and the signature was verified.,Microsoft Windows,Microsoft Windows Verification PCA
SB682YOC,NdisTapi,Remote Access NDIS TAPI Driver,Remote Access NDIS TAPI Driver,C:\Windows\System32\drivers\ndistapi.sys,e5424f49739008739a33c8d5e75afd02,system32\DRIVERS\ndistapi.sys,SERVICE_KERNEL_DRIVER,,true,true,The file is signed and the signature was verified.,Microsoft Windows,Microsoft Windows Verification PCA
SB682YOC,ql40xx,ql40xx,,C:\Windows\System32\drivers\ql40xx.sys,221bde3daa38b2aac77363a140b61f7b,\SystemRoot\system32\drivers\ql40xx.sys,SERVICE_KERNEL_DRIVER,,true,true,The file is signed and the signature was verified.,Microsoft Windows,Microsoft Windows Verification PCA
SB682YOC,nsi,Network Store Interface Service,This service delivers network notifications (e.g. interface addition/deleting etc) to user mode clients. Stopping this service will cause loss of network connectivity. If this service is disabled  any other services that explicitly depend on this service will fail to start.,C:\Windows\System32\svchost.exe,48a26c8bb897eec4f27dc5435e8c060c,C:\Windows\system32\svchost.exe -k LocalService,SERVICE_WIN32_SHARE_PROCESS,C:\Windows\System32\nsisvc.dll,true,true,The file is signed and the signature was verified.,Microsoft Windows,Microsoft Windows Verification PCA
SB682YOC,uliagpkx,Uli AGP Bus Filter,,C:\Windows\System32\drivers\ULIAGPKX.SYS,ebb6900c36f93bad3a47ab31d79ea573,\SystemRoot\system32\drivers\uliagpkx.sys,SERVICE_KERNEL_DRIVER,,true,true,The file is signed and the signature was verified.,Microsoft Windows,Microsoft Windows Verification PCA
SB682YOC,BrUsbMdm,Brother MFC USB Fax Only Modem,,C:\Windows\System32\drivers\BrUsbMdm.sys,5388efb2c73c91ee34d37434550d6e3d,\SystemRoot\System32\Drivers\BrUsbMdm.sys,SERVICE_KERNEL_DRIVER,,true,true,The file is signed and the signature was verified.,Microsoft Windows,Microsoft Windows Verification PCA
SB682YOC,BrUsbSer,Brother MFC USB Serial WDM Driver,,C:\Windows\System32\drivers\BrUsbSer.sys,03329a5a79f55227aaa458b857ec3927,\SystemRoot\System32\Drivers\BrUsbSer.sys,SERVICE_KERNEL_DRIVER,,true,true,The file is signed and the signature was verified.,Microsoft Windows,Microsoft Windows Verification PCA
SB682YOC,AppID,AppID Driver,Identifies an application and enforces software restriction policies.,C:\Windows\System32\drivers\appid.sys,ddb01915ac3320a4a286e60d9fe84c7e,\SystemRoot\system32\drivers\appid.sys,SERVICE_KERNEL_DRIVER,,true,true,The file is signed and the signature was verified.,Microsoft Windows,Microsoft Windows Verification PCA
SB682YOC,Compbatt,Compbatt,,C:\Windows\System32\drivers\compbatt.sys,d06578041331207673dca656830b6529,\SystemRoot\system32\drivers\compbatt.sys,SERVICE_KERNEL_DRIVER,,true,true,The file is signed and the signature was verified.,Microsoft Windows,Microsoft Windows Verification PCA
SB682YOC,defragsvc,Disk Defragmenter,Provides Disk Defragmentation Capabilities.,C:\Windows\System32\svchost.exe,48a26c8bb897eec4f27dc5435e8c060c,C:\Windows\system32\svchost.exe -k defragsvc,SERVICE_WIN32_OWN_PROCESS,C:\Windows\System32\defragsvc.dll,true,true,The file is signed and the signature was verified.,Microsoft Windows,Microsoft Windows Verification PCA
SB682YOC,CNG,CNG,,C:\Windows\System32\drivers\cng.sys,739f3e118f524793dc94f4397a40a873,\SystemRoot\System32\Drivers\cng.sys,SERVICE_KERNEL_DRIVER,,true,true,The file is signed and the signature was verified.,Microsoft Windows,Microsoft Windows Verification PCA
SB682YOC,ClientAnalyticsService,ClientAnalyticsService,,C:\Program Files\Common Files\McAfee\ClientAnalytics\Legacy\McClientAnalytics.exe,554b4d901adbfd8faed3d704c2ac8d83,"C:\Program Files\Common Files\McAfee\ClientAnalytics\Legacy\McClientAnalytics.exe""""""",SERVICE_WIN32_OWN_PROCESS,,true,true,The file is signed and the signature was verified.,"""McAfee",Symantec Class 3 SHA256 Code Signing CA
SB682YOC,sermouse,Serial Mouse Driver,,C:\Windows\System32\drivers\sermouse.sys,5b71e26ff0fcba6ce593f9ab657c23d7,\SystemRoot\system32\drivers\sermouse.sys,SERVICE_KERNEL_DRIVER,,true,true,The file is signed and the signature was verified.,Microsoft Windows,Microsoft Windows Verification PCA
SB682YOC,McAPExe,McAfee AP Service,McAfee AP Service,C:\Program Files\Common Files\McAfee\VSCore_18_6\mcapexe.exe,46b028cd07c479c7fac034f89ce98162,"C:\Program Files\Common Files\McAfee\VSCore_18_6\McApExe.exe""""""",SERVICE_WIN32_OWN_PROCESS,,true,true,The file is signed and the signature was verified.,"""McAfee",Symantec Class 3 SHA256 Code Signing CA
SB682YOC,Smb,Message-oriented TCP/IP and TCP/IPv6 Protocol (SMB session),Microsoft NetbiosSmb Device Driver,C:\Windows\System32\drivers\smb.sys,2ecab4afe9dce3a21d914594bafb96e6,system32\DRIVERS\smb.sys,SERVICE_KERNEL_DRIVER,,true,true,The file is signed and the signature was verified.,Microsoft Windows,Microsoft Windows Verification PCA
SB682YOC,w32time,Windows Time,Maintains date and time synchronization on all clients and servers in the network. If this service is stopped  date and time synchronization will be unavailable. If this service is disabled  any services that explicitly depend on it will fail to start.,C:\Windows\System32\svchost.exe,48a26c8bb897eec4f27dc5435e8c060c,C:\Windows\system32\svchost.exe -k LocalService,SERVICE_WIN32_SHARE_PROCESS,C:\Windows\System32\w32time.dll,true,true,The file is signed and the signature was verified.,Microsoft Windows,Microsoft Windows Verification PCA
