hostname,name,descriptivename,description,path,md5,arguments,type,servicedll,pathsignatureexists,pathsignatureverified,pathsignaturedescription,pathcertificatesubject,pathcertificateissuer
SB682YOC,ErrDev,Microsoft Hardware Error Device Driver,,C:\Windows\System32\drivers\errdev.sys,e3f2b8ff1ef0c06bbcb80e4755c60a3b,\SystemRoot\system32\drivers\errdev.sys,SERVICE_KERNEL_DRIVER,,true,true,The file is signed and the signature was verified.,Microsoft Windows,Microsoft Windows Verification PCA
SB682YOC,HpSAMD,HpSAMD,,C:\Windows\System32\drivers\HpSAMD.sys,1d97b93679f344226297a119a7b4a937,\SystemRoot\system32\drivers\HpSAMD.sys,SERVICE_KERNEL_DRIVER,,true,true,The file is signed and the signature was verified.,Microsoft Windows,Microsoft Windows Verification PCA
SB682YOC,srvnet,srvnet,,C:\Windows\System32\drivers\srvnet.sys,87a5f7f3a3baf3960d9f51cffbc212a0,System32\DRIVERS\srvnet.sys,SERVICE_FILE_SYSTEM_DRIVER,,true,true,The file is signed and the signature was verified.,Microsoft Windows,Microsoft Windows Verification PCA
SB682YOC,GoogleVssProvider,GoogleVssProvider,Google Vss Hardware Provider,C:\Windows\System32\dllhost.exe,60be3acd94cc42e9314b77d9fd9ea9ee,C:\Windows\system32\dllhost.exe /Processid:{3EAE8C5E-B51F-4CBD-9DCE-FA6AA0BDF8B8},SERVICE_WIN32_OWN_PROCESS,,true,true,The file is signed and the signature was verified.,Microsoft Windows,Microsoft Windows Verification PCA
SB682YOC,Tcpip,TCP/IP Protocol Driver,TCP/IP Protocol Driver,C:\Windows\System32\drivers\tcpip.sys,b4f2dad87bae9ba13013105ab775616c,\SystemRoot\System32\drivers\tcpip.sys,SERVICE_KERNEL_DRIVER,,true,true,The file is signed and the signature was verified.,Microsoft Windows,Microsoft Windows Verification PCA
SB682YOC,wercplsupport,Problem Reports and Solutions Control Panel Support,This service provides support for viewing  sending and deletion of system-level problem reports for the Problem Reports and Solutions control panel.,C:\Windows\System32\svchost.exe,48a26c8bb897eec4f27dc5435e8c060c,C:\Windows\System32\svchost.exe -k netsvcs,SERVICE_WIN32_SHARE_PROCESS,C:\Windows\System32\wercplsupport.dll,true,true,The file is signed and the signature was verified.,Microsoft Windows,Microsoft Windows Verification PCA
SB682YOC,Disk,Disk Driver,,C:\Windows\System32\drivers\disk.sys,68e0877e5a6fb0f4da18ce119aea92d4,\SystemRoot\system32\drivers\disk.sys,SERVICE_KERNEL_DRIVER,,true,true,The file is signed and the signature was verified.,Microsoft Windows,Microsoft Windows Verification PCA
SB682YOC,pci,PCI Bus Driver,,C:\Windows\System32\drivers\pci.sys,7e30b1a31f66b511ab8b96c42ef549b0,\SystemRoot\system32\drivers\pci.sys,SERVICE_KERNEL_DRIVER,,true,true,The file is signed and the signature was verified.,Microsoft Windows,Microsoft Windows Verification PCA
SB682YOC,CertPropSvc,Certificate Propagation,Copies user certificates and root certificates from smart cards into the current user's certificate store  detects when a smart card is inserted into a smart card reader  and  if needed  installs the smart card Plug and Play minidriver.,C:\Windows\System32\svchost.exe,48a26c8bb897eec4f27dc5435e8c060c,C:\Windows\system32\svchost.exe -k netsvcs,SERVICE_WIN32_SHARE_PROCESS,C:\Windows\System32\certprop.dll,true,true,The file is signed and the signature was verified.,Microsoft Windows,Microsoft Windows Verification PCA
SB682YOC,lltdsvc,Link-Layer Topology Discovery Mapper,Creates a Network Map  consisting of PC and device topology (connectivity) information  and metadata describing each PC and device.  If this service is disabled  the Network Map will not function properly.,C:\Windows\System32\svchost.exe,48a26c8bb897eec4f27dc5435e8c060c,C:\Windows\System32\svchost.exe -k LocalService,SERVICE_WIN32_SHARE_PROCESS,C:\Windows\System32\lltdsvc.dll,true,true,The file is signed and the signature was verified.,Microsoft Windows,Microsoft Windows Verification PCA
SB682YOC,mrxsmb,SMB MiniRedirector Wrapper and Engine,Implements the framework for the SMB filesystem redirector,C:\Windows\System32\drivers\mrxsmb.sys,a148745619bbaf21096e1379505ea991,system32\DRIVERS\mrxsmb.sys,SERVICE_FILE_SYSTEM_DRIVER,,true,true,The file is signed and the signature was verified.,Microsoft Windows,Microsoft Windows Verification PCA
SB682YOC,pciide,pciide,,C:\Windows\System32\drivers\pciide.sys,28761071e91573ece25ae9e1d9c2e874,\SystemRoot\system32\drivers\pciide.sys,SERVICE_KERNEL_DRIVER,,true,true,The file is signed and the signature was verified.,Microsoft Windows,Microsoft Windows Verification PCA
SB682YOC,NetTcpPortSharing,Net.Tcp Port Sharing Service,Provides ability to share TCP ports over the net.tcp protocol.,C:\Windows\Microsoft.NET\Framework64\v4.0.30319\SMSvcHost.exe,493b28fb6595885025d4db37aad143c4,C:\Windows\Microsoft.NET\Framework64\v4.0.30319\SMSvcHost.exe,SERVICE_WIN32_SHARE_PROCESS,,true,true,The file is signed and the signature was verified.,Microsoft Corporation,Microsoft Code Signing PCA
SB682YOC,mccspsvc,McAfee CSP Service,McAfee Cloud Platform Service,C:\Program Files\Common Files\McAfee\CSP\3.0.127.0\\McCSPServiceHost.exe,368173320b7789176e5ac1a3c605a92a,"C:\Program Files\Common Files\McAfee\CSP\3.0.127.0\\McCSPServiceHost.exe""""""",SERVICE_WIN32_OWN_PROCESS,,true,true,The file is signed and the signature was verified.,"""McAfee",Symantec Class 3 SHA256 Code Signing CA
SB682YOC,luafv,UAC File Virtualization,Virtualizes file write failures to per-user locations.,C:\Windows\System32\drivers\luafv.sys,1c4e9cc5c10baa4e551cd8ee104dc8f5,\SystemRoot\system32\drivers\luafv.sys,SERVICE_FILE_SYSTEM_DRIVER,,true,true,The file is signed and the signature was verified.,Microsoft Windows,Microsoft Windows Verification PCA
SB682YOC,AppMgmt,Application Management,Processes installation  removal  and enumeration requests for software deployed through Group Policy. If the service is disabled  users will be unable to install  remove  or enumerate software deployed through Group Policy. If this service is disabled  any services that explicitly depend on it will fail to start.,C:\Windows\System32\svchost.exe,48a26c8bb897eec4f27dc5435e8c060c,C:\Windows\system32\svchost.exe -k netsvcs,SERVICE_WIN32_SHARE_PROCESS,C:\Windows\System32\appmgmts.dll,true,true,The file is signed and the signature was verified.,Microsoft Windows,Microsoft Windows Verification PCA
SB682YOC,flpydisk,Floppy Disk Driver,,C:\Windows\System32\drivers\flpydisk.sys,e661c854a33849a9063a234e9e0977f1,\SystemRoot\system32\drivers\flpydisk.sys,SERVICE_KERNEL_DRIVER,,true,true,The file is signed and the signature was verified.,Microsoft Windows,Microsoft Windows Verification PCA
SB682YOC,msdsm,msdsm,,C:\Windows\System32\drivers\msdsm.sys,e249dcb05cc0d9adcdd4e27fcafabc32,\SystemRoot\system32\drivers\msdsm.sys,SERVICE_KERNEL_DRIVER,,true,true,The file is signed and the signature was verified.,Microsoft Windows,Microsoft Windows Verification PCA
SB682YOC,iaStorV,iaStorV,,C:\Windows\System32\drivers\iaStorV.sys,180b5fb21c7f2b1f6d96c966d3902240,\SystemRoot\system32\drivers\iaStorV.sys,SERVICE_KERNEL_DRIVER,,true,true,The file is signed and the signature was verified.,Microsoft Windows,Microsoft Windows Verification PCA
SB682YOC,swenum,Software Bus Driver,,C:\Windows\System32\drivers\swenum.sys,49016d42328c181853b8dd99c01bebc4,\SystemRoot\system32\drivers\swenum.sys,SERVICE_KERNEL_DRIVER,,true,true,The file is signed and the signature was verified.,Microsoft Windows,Microsoft Windows Verification PCA
SB682YOC,RDPCDD,RDPCDD,RDPDD Chained DD,C:\Windows\System32\drivers\RDPCDD.sys,3841ddf4764d19d8bcf2418f7bda5022,System32\DRIVERS\RDPCDD.sys,SERVICE_KERNEL_DRIVER,,true,true,The file is signed and the signature was verified.,Microsoft Windows,Microsoft Windows Verification PCA
SB682YOC,WerSvc,Windows Error Reporting Service,Allows errors to be reported when programs stop working or responding and allows existing solutions to be delivered. Also allows logs to be generated for diagnostic and repair services. If this service is stopped  error reporting might not work correctly and results of diagnostic services and repairs might not be displayed.,C:\Windows\System32\svchost.exe,48a26c8bb897eec4f27dc5435e8c060c,C:\Windows\System32\svchost.exe -k WerSvcGroup,SERVICE_WIN32_SHARE_PROCESS,C:\Windows\System32\wersvc.dll,true,true,The file is signed and the signature was verified.,Microsoft Windows,Microsoft Windows Verification PCA
SB682YOC,BrFiltUp,Brother USB Mass-Storage Upper Filter Driver,,C:\Windows\System32\drivers\BrFiltUp.sys,3521250b93a6146adaf625514d38182a,\SystemRoot\system32\drivers\BrFiltUp.sys,SERVICE_KERNEL_DRIVER,,true,true,The file is signed and the signature was verified.,Microsoft Windows,Microsoft Windows Verification PCA
SB682YOC,RSoPProv,Resultant Set of Policy Provider,Provides a network service that processes requests to simulate application of Group Policy settings for a target user or computer in various situations and computes the Resultant Set of Policy settings.,C:\Windows\System32\rsopprov.exe,67f17fbbb126052fd68bff53d0f2805f,C:\Windows\system32\RSoPProv.exe,SERVICE_WIN32_SHARE_PROCESS,,true,true,The file is signed and the signature was verified.,Microsoft Windows,Microsoft Windows Verification PCA
SB682YOC,i8042prt,i8042 Keyboard and PS/2 Mouse Port Driver,,C:\Windows\System32\drivers\i8042prt.sys,b7769eb284d90aba23094e6aadf47641,\SystemRoot\system32\drivers\i8042prt.sys,SERVICE_KERNEL_DRIVER,,true,true,The file is signed and the signature was verified.,Microsoft Windows,Microsoft Windows Verification PCA
SB682YOC,MSSQL$SQLEXPRESS,SQL Server (SQLEXPRESS),Provides storage  processing and controlled access of data  and rapid transaction processing.,C:\Program Files\Microsoft SQL Server\MSSQL14.SQLEXPRESS\MSSQL\Binn\sqlservr.exe,81acdf6fc955e2d4cc441754ca9011f6,"""C:\Program Files\Microsoft SQL Server\MSSQL14.SQLEXPRESS\MSSQL\Binn\sqlservr.exe"" -sSQLEXPRESS",SERVICE_WIN32_OWN_PROCESS,,true,true,The file is signed and the signature was verified.,Microsoft Corporation,Microsoft Code Signing PCA
SB682YOC,ksthunk,Kernel Streaming Thunks,,C:\Windows\System32\drivers\ksthunk.sys,9b5cd6d986e019e317dc966193be336c,\SystemRoot\system32\drivers\ksthunk.sys,SERVICE_KERNEL_DRIVER,,true,true,The file is signed and the signature was verified.,Microsoft Windows,Microsoft Windows Verification PCA
SB682YOC,ws2ifsl,Winsock IFS Driver,Winsock IFS Driver,C:\Windows\System32\drivers\ws2ifsl.sys,184197af6a36bf0fd043484603a22ac2,\SystemRoot\system32\drivers\ws2ifsl.sys,SERVICE_KERNEL_DRIVER,,true,true,The file is signed and the signature was verified.,Microsoft Windows,Microsoft Windows Verification PCA
SB682YOC,Spooler,Print Spooler,Loads files to memory for later printing,C:\Windows\System32\spoolsv.exe,be418a4e849ad3bb5c4ee0877f3d8dea,C:\Windows\System32\spoolsv.exe,SERVICE_WIN32_OWN_PROCESS,,true,true,The file is signed and the signature was verified.,Microsoft Windows,Microsoft Windows Verification PCA
SB682YOC,RasAgileVpn,WAN Miniport (IKEv2),WAN Miniport (IKEv2),C:\Windows\System32\drivers\agilevpn.sys,b1843c95319bacebe61461aec4eace45,system32\DRIVERS\AgileVpn.sys,SERVICE_KERNEL_DRIVER,,true,true,The file is signed and the signature was verified.,Microsoft Windows,Microsoft Windows Verification PCA
SB682YOC,upnphost,UPnP Device Host,Allows UPnP devices to be hosted on this computer. If this service is stopped  any hosted UPnP devices will stop functioning and no additional hosted devices can be added. If this service is disabled  any services that explicitly depend on it will fail to start.,C:\Windows\System32\svchost.exe,48a26c8bb897eec4f27dc5435e8c060c,C:\Windows\system32\svchost.exe -k LocalServiceAndNoImpersonation,SERVICE_WIN32_SHARE_PROCESS,C:\Windows\System32\upnphost.dll,true,true,The file is signed and the signature was verified.,Microsoft Windows,Microsoft Windows Verification PCA
SB682YOC,sffdisk,SFF Storage Class Driver,,C:\Windows\System32\drivers\sffdisk.sys,60be8e18508faedfb506e32f88cf1268,\SystemRoot\system32\drivers\sffdisk.sys,SERVICE_KERNEL_DRIVER,,true,true,The file is signed and the signature was verified.,Microsoft Windows,Microsoft Windows Verification PCA
SB682YOC,SNMPTRAP,SNMP Trap,Receives trap messages generated by local or remote Simple Network Management Protocol (SNMP) agents and forwards the messages to SNMP management programs running on this computer. If this service is stopped  SNMP-based programs on this computer will not receive SNMP trap messages. If this service is disabled  any services that explicitly depend on it will fail to start.,C:\Windows\System32\snmptrap.exe,a78ed5b97d219107bc697413557f375d,C:\Windows\System32\snmptrap.exe,SERVICE_WIN32_OWN_PROCESS,,true,true,The file is signed and the signature was verified.,Microsoft Windows,Microsoft Windows Verification PCA
SB682YOC,usbprint,Microsoft USB PRINTER Class,,C:\Windows\System32\drivers\usbprint.sys,fcf1a39c14cbbf2c0ca84c0c182fdbbd,\SystemRoot\system32\drivers\usbprint.sys,SERVICE_KERNEL_DRIVER,,true,true,The file is signed and the signature was verified.,Microsoft Windows,Microsoft Windows Verification PCA
SB682YOC,AmdK8,AMD K8 Processor Driver,,C:\Windows\System32\drivers\amdk8.sys,833c5e32a5be60632c35fb3f21435dc0,\SystemRoot\system32\drivers\amdk8.sys,SERVICE_KERNEL_DRIVER,,true,true,The file is signed and the signature was verified.,Microsoft Windows,Microsoft Windows Verification PCA
SB682YOC,ioatdma,Intel(R) QuickData Technology Device,,C:\Windows\System32\drivers\qd260x64.sys,a834a86643bb1d2bedbec11d015ba957,\SystemRoot\System32\Drivers\qd260x64.sys,SERVICE_KERNEL_DRIVER,,true,true,The file is signed and the signature was verified.,Microsoft Windows,Microsoft Windows Verification PCA
SB682YOC,megasas,megasas,,C:\Windows\System32\drivers\megasas.sys,4b5ff86dd2172217588b3292573c17ad,\SystemRoot\system32\drivers\megasas.sys,SERVICE_KERNEL_DRIVER,,true,true,The file is signed and the signature was verified.,Microsoft Windows,Microsoft Windows Verification PCA
SB682YOC,W3LOGSVC,W3C Logging Service,Provides W3C logging for Internet Information Services (IIS). If this service is stopped  W3C logging configured by IIS will not work.,C:\Windows\System32\svchost.exe,48a26c8bb897eec4f27dc5435e8c060c,C:\WINDOWS\system32\svchost.exe -k apphost,SERVICE_WIN32_SHARE_PROCESS,C:\Windows\System32\inetsrv\w3logsvc.dll,true,true,The file is signed and the signature was verified.,Microsoft Windows,Microsoft Windows Production PCA 2011
SB682YOC,intelppm,Intel Processor Driver,,C:\Windows\System32\drivers\intelppm.sys,5e903ef137d97c396dbe08b6a06720fe,system32\DRIVERS\intelppm.sys,SERVICE_KERNEL_DRIVER,,true,true,The file is signed and the signature was verified.,Microsoft Windows,Microsoft Windows Verification PCA
SB682YOC,DiagTrack,Diagnostics Tracking Service,The Diagnostics Tracking Service enables data collection about functional issues in Windows components.,C:\Windows\System32\svchost.exe,48a26c8bb897eec4f27dc5435e8c060c,C:\Windows\System32\svchost.exe -k utcsvc,SERVICE_WIN32_OWN_PROCESS,C:\Windows\System32\diagtrack.dll,true,true,The file is signed and the signature was verified.,Microsoft Windows,Microsoft Windows Verification PCA
SB682YOC,pla,Performance Logs &amp; Alerts,Performance Logs and Alerts Collects performance data from local or remote computers based on preconfigured schedule parameters  then writes the data to a log or triggers an alert. If this service is stopped  performance information will not be collected. If this service is disabled  any services that explicitly depend on it will fail to start.,C:\Windows\System32\svchost.exe,48a26c8bb897eec4f27dc5435e8c060c,C:\Windows\System32\svchost.exe -k LocalServiceNoNetwork,SERVICE_WIN32_SHARE_PROCESS,C:\Windows\System32\pla.dll,true,true,The file is signed and the signature was verified.,Microsoft Windows,Microsoft Windows Verification PCA
SB682YOC,mouhid,Mouse HID Driver,,C:\Windows\System32\drivers\mouhid.sys,777f5897579a6a733ec33f49729824f5,\SystemRoot\system32\drivers\mouhid.sys,SERVICE_KERNEL_DRIVER,,true,true,The file is signed and the signature was verified.,Microsoft Windows,Microsoft Windows Verification PCA
SB682YOC,PerfHost,Performance Counter DLL Host,Enables remote users and 64-bit processes to query performance counters provided by 32-bit DLLs. If this service is stopped  only local users and 32-bit processes will be able to query performance counters provided by 32-bit DLLs.,C:\Windows\SysWOW64\perfhost.exe,b3121d474987ae9ceac4ffe7644f842f,C:\Windows\SysWow64\perfhost.exe,SERVICE_WIN32_OWN_PROCESS,,true,true,The file is signed and the signature was verified.,Microsoft Windows,Microsoft Windows Verification PCA
SB682YOC,mountmgr,Mount Point Manager,Driver responsible with maintaining persistent drive letters and names for volumes,C:\Windows\System32\drivers\mountmgr.sys,6ed00270ad23d473c401dec0985519f1,\SystemRoot\System32\drivers\mountmgr.sys,SERVICE_KERNEL_DRIVER,,true,true,The file is signed and the signature was verified.,Microsoft Windows,Microsoft Windows Verification PCA
SB682YOC,MpsSvc,Windows Firewall,Windows Firewall helps protect your computer by preventing unauthorized users from gaining access to your computer through the Internet or a network.,C:\Windows\System32\svchost.exe,48a26c8bb897eec4f27dc5435e8c060c,C:\Windows\system32\svchost.exe -k LocalServiceNoNetwork,SERVICE_WIN32_SHARE_PROCESS,C:\Windows\System32\MPSSVC.dll,true,true,The file is signed and the signature was verified.,Microsoft Windows,Microsoft Windows Verification PCA
SB682YOC,msisadrv,msisadrv,,C:\Windows\System32\drivers\msisadrv.sys,3cf15e843e96100cdfb923bc274f838b,\SystemRoot\system32\drivers\msisadrv.sys,SERVICE_KERNEL_DRIVER,,true,true,The file is signed and the signature was verified.,Microsoft Windows,Microsoft Windows Verification PCA
SB682YOC,mfencrk,McAfee LLC. mfencrk,McAfee Content driver Copyright (C) McAfee LLC  2018. All rights reserved.,C:\Windows\System32\drivers\mfencrk.sys,f16d0ad9eace5877af40dd5c0fe03424,system32\DRIVERS\mfencrk.sys,SERVICE_KERNEL_DRIVER,,true,true,The file is signed and the signature was verified.,Microsoft Windows Hardware Compatibility Publisher,Microsoft Windows Hardware Compatibility PCA
SB682YOC,Netlogon,Netlogon,Maintains a secure channel between this computer and the domain controller for authenticating users and services. If this service is stopped  the computer may not authenticate users and services and the domain controller cannot register DNS records. If this service is disabled  any services that explicitly depend on it will fail to start.,C:\Windows\System32\lsass.exe,0f66352ecf107f57dd4a16aaddca4ec8,C:\Windows\system32\lsass.exe,SERVICE_WIN32_SHARE_PROCESS,,true,true,The file is signed and the signature was verified.,Microsoft Windows,Microsoft Windows Verification PCA
SB682YOC,TapiSrv,Telephony,Provides Telephony API (TAPI) support for programs that control telephony devices on the local computer and  through the LAN  on servers that are also running the service.,C:\Windows\System32\svchost.exe,48a26c8bb897eec4f27dc5435e8c060c,C:\Windows\System32\svchost.exe -k tapisrv,SERVICE_WIN32_OWN_PROCESS,C:\Windows\System32\tapisrv.dll,true,true,The file is signed and the signature was verified.,Microsoft Windows,Microsoft Windows Verification PCA
SB682YOC,rdpbus,Remote Desktop Device Redirector Bus Driver,,C:\Windows\System32\drivers\rdpbus.sys,b53dbc41d424bc680495922dc97d827f,\SystemRoot\system32\drivers\rdpbus.sys,SERVICE_KERNEL_DRIVER,,true,true,The file is signed and the signature was verified.,Microsoft Windows,Microsoft Windows Verification PCA
SB682YOC,seclogon,Secondary Logon,Enables starting processes under alternate credentials. If this service is stopped  this type of logon access will be unavailable. If this service is disabled  any services that explicitly depend on it will fail to start.,C:\Windows\System32\svchost.exe,48a26c8bb897eec4f27dc5435e8c060c,C:\Windows\system32\svchost.exe -k netsvcs,SERVICE_WIN32_SHARE_PROCESS,C:\Windows\System32\seclogon.dll,true,true,The file is signed and the signature was verified.,Microsoft Windows,Microsoft Windows Verification PCA
SB682YOC,atapi,atapi,,C:\Windows\System32\drivers\atapi.sys,20c7925a728519cf2fecb17a5b2692f6,\SystemRoot\system32\drivers\atapi.sys,SERVICE_KERNEL_DRIVER,,true,true,The file is signed and the signature was verified.,Microsoft Windows,Microsoft Windows Verification PCA
SB682YOC,KSecDD,KSecDD,,C:\Windows\System32\drivers\ksecdd.sys,12288451bf31fef60b164cdb72991c62,\SystemRoot\System32\Drivers\ksecdd.sys,SERVICE_KERNEL_DRIVER,,true,true,The file is signed and the signature was verified.,Microsoft Windows,Microsoft Windows Verification PCA
SB682YOC,clr_optimization_v4.0.30319_32,Microsoft .NET Framework NGEN v4.0.30319_X86,Microsoft .NET Framework NGEN,C:\Windows\Microsoft.NET\Framework\v4.0.30319\mscorsvw.exe,0a013afdfca448a71a66920885f05d20,C:\Windows\Microsoft.NET\Framework\v4.0.30319\mscorsvw.exe,SERVICE_WIN32_OWN_PROCESS,,true,true,The file is signed and the signature was verified.,Microsoft Dynamic Code Publisher,Microsoft Code Signing PCA
SB682YOC,HidUsb,Microsoft HID Class Driver,,C:\Windows\System32\drivers\hidusb.sys,1100d6a1640c0080d26f47b45b368420,\SystemRoot\system32\drivers\hidusb.sys,SERVICE_KERNEL_DRIVER,,true,true,The file is signed and the signature was verified.,Microsoft Windows,Microsoft Windows Verification PCA
SB682YOC,cfwids,McAfee Inc. cfwids,,C:\Windows\System32\drivers\cfwids.sys,668ffdb3cf31be344740b5f85c052fad,system32\drivers\cfwids.sys,SERVICE_KERNEL_DRIVER,,true,true,The file is signed and the signature was verified.,Microsoft Windows Hardware Compatibility Publisher,Microsoft Windows Hardware Compatibility PCA
SB682YOC,volsnap,Storage volumes,,C:\Windows\System32\drivers\volsnap.sys,6581c8aebe33cbb9aff7ace38449d35c,\SystemRoot\system32\drivers\volsnap.sys,SERVICE_KERNEL_DRIVER,,true,true,The file is signed and the signature was verified.,Microsoft Windows,Microsoft Windows Verification PCA
SB682YOC,swprv,Microsoft Software Shadow Copy Provider,Manages software-based volume shadow copies taken by the Volume Shadow Copy service. If this service is stopped  software-based volume shadow copies cannot be managed. If this service is disabled  any services that explicitly depend on it will fail to start.,C:\Windows\System32\svchost.exe,48a26c8bb897eec4f27dc5435e8c060c,C:\Windows\System32\svchost.exe -k swprv,SERVICE_WIN32_OWN_PROCESS,C:\Windows\System32\swprv.dll,true,true,The file is signed and the signature was verified.,Microsoft Windows,Microsoft Windows Verification PCA
SB682YOC,vmbus,vmbus,,C:\Windows\System32\drivers\vmbus.sys,ae99690bb6254ee243cc21c2692c9414,\SystemRoot\system32\drivers\vmbus.sys,SERVICE_KERNEL_DRIVER,,true,true,The file is signed and the signature was verified.,Microsoft Windows,Microsoft Windows Verification PCA
SB682YOC,eventlog,Windows Event Log,This service manages events and event logs. It supports logging events  querying events  subscribing to events  archiving event logs  and managing event metadata. It can display events in both XML and plain text format. Stopping this service may compromise security and reliability of the system.,C:\Windows\System32\svchost.exe,48a26c8bb897eec4f27dc5435e8c060c,C:\Windows\System32\svchost.exe -k LocalServiceNetworkRestricted,SERVICE_WIN32_SHARE_PROCESS,,true,true,The file is signed and the signature was verified.,Microsoft Windows,Microsoft Windows Verification PCA
SB682YOC,nsiproxy,NSI proxy service driver.,NSI proxy service.,C:\Windows\System32\drivers\nsiproxy.sys,f9efee449b535e296b6b4d31b4646aa3,system32\drivers\nsiproxy.sys,SERVICE_KERNEL_DRIVER,,true,true,The file is signed and the signature was verified.,Microsoft Windows,Microsoft Windows Verification PCA
SB682YOC,FltMgr,FltMgr,File System Filter Manager Driver,C:\Windows\System32\drivers\fltMgr.sys,f9130e6aa10ff6e083889884a4eedd18,\SystemRoot\system32\drivers\fltmgr.sys,SERVICE_FILE_SYSTEM_DRIVER,,true,true,The file is signed and the signature was verified.,Microsoft Windows,Microsoft Windows Verification PCA
SB682YOC,cdfs,CD/DVD File System Reader,ISO9660/Joliet File System Reader for CD/DVDs. (Core) (All pieces),C:\Windows\System32\drivers\cdfs.sys,d37230c42c03f49a77de87fab337e57b,system32\DRIVERS\cdfs.sys,SERVICE_FILE_SYSTEM_DRIVER,,true,true,The file is signed and the signature was verified.,Microsoft Windows,Microsoft Windows Verification PCA
SB682YOC,CLFS,Common Log (CLFS),General-purpose logging service,C:\Windows\System32\clfs.sys,3eb90cc1afb006fca6ade1660745360b,\SystemRoot\System32\CLFS.sys,SERVICE_KERNEL_DRIVER,,true,true,The file is signed and the signature was verified.,Microsoft Windows,Microsoft Windows Verification PCA
SB682YOC,mouclass,Mouse Class Driver,,C:\Windows\System32\drivers\mouclass.sys,fb651980d138b1cb7959e2e71c1801e0,\SystemRoot\system32\drivers\mouclass.sys,SERVICE_KERNEL_DRIVER,,true,true,The file is signed and the signature was verified.,Microsoft Windows,Microsoft Windows Verification PCA
SB682YOC,usbehci,Microsoft USB 2.0 Enhanced Host Controller Miniport Driver,,C:\Windows\System32\drivers\usbehci.sys,c216d1ebbe326d6bf35d25f71ec2c45e,\SystemRoot\system32\drivers\usbehci.sys,SERVICE_KERNEL_DRIVER,,true,true,The file is signed and the signature was verified.,Microsoft Windows,Microsoft Windows Verification PCA
SB682YOC,Wd,Wd,,C:\Windows\System32\drivers\wd.sys,f04648283cadf1816e98de8234b7bc76,\SystemRoot\system32\drivers\wd.sys,SERVICE_KERNEL_DRIVER,,true,true,The file is signed and the signature was verified.,Microsoft Windows,Microsoft Windows Verification PCA
SB682YOC,1394ohci,1394 OHCI Compliant Host Controller,,C:\Windows\System32\drivers\1394ohci.sys,9a8dab8919da6f9648b5ff935997abf2,\SystemRoot\system32\drivers\1394ohci.sys,SERVICE_KERNEL_DRIVER,,true,true,The file is signed and the signature was verified.,Microsoft Windows,Microsoft Windows Verification PCA
