hostname,name,descriptivename,description,path,md5,arguments,type,servicedll,pathsignatureexists,pathsignatureverified,pathsignaturedescription,pathcertificatesubject,pathcertificateissuer
WW367BFQ,mouhid,Mouse HID Driver,,C:\Windows\System32\drivers\mouhid.sys,bd60a11d11fa911ccbd5f23c72096d08,system32\DRIVERS\mouhid.sys,SERVICE_KERNEL_DRIVER,,true,true,The file is signed and the signature was verified.,Microsoft Windows,Microsoft Windows Verification PCA
WW367BFQ,Disk,Disk Driver,,C:\Windows\System32\drivers\disk.sys,47e2a2fad1329582c8a4bf8a85adf723,\SystemRoot\system32\drivers\disk.sys,SERVICE_KERNEL_DRIVER,,true,true,The file is signed and the signature was verified.,Microsoft Windows,Microsoft Windows Verification PCA
WW367BFQ,wudfsvc,Windows Driver Foundation - User-mode Driver Framework,Manages user-mode driver host processes.,C:\Windows\System32\svchost.exe,bb5e5748e7bcf3fefc70b960795a86e2,C:\Windows\system32\svchost.exe -k LocalSystemNetworkRestricted,SERVICE_WIN32_SHARE_PROCESS,C:\Windows\System32\WUDFSvc.dll,true,true,The file is signed and the signature was verified.,Microsoft Windows,Microsoft Windows Verification PCA
WW367BFQ,mfencbdc,McAfee LLC. mfencbdc,McAfee Content driver Copyright (C) McAfee LLC  2018. All rights reserved.,C:\Windows\System32\drivers\mfencbdc.sys,7b5ca883e528835347e47c69dfab8a15,system32\DRIVERS\mfencbdc.sys,SERVICE_KERNEL_DRIVER,,true,true,The file is signed and the signature was verified.,Microsoft Windows Hardware Compatibility Publisher,Microsoft Windows Hardware Compatibility PCA
WW367BFQ,COMSysApp,COM+ System Application,Manages the configuration and tracking of Component Object Model (COM)+-based components. If the service is stopped  most COM+-based components will not function properly. If this service is disabled  any services that explicitly depend on it will fail to start.,C:\Windows\System32\dllhost.exe,3d3702e07da713b335606ce8d33803e6,C:\Windows\system32\dllhost.exe /Processid:{02D4B3F1-FD88-11D1-960D-00805FC79235},SERVICE_WIN32_OWN_PROCESS,,true,true,The file is signed and the signature was verified.,Microsoft Windows,Microsoft Windows Verification PCA
WW367BFQ,msisadrv,msisadrv,,C:\Windows\System32\drivers\msisadrv.sys,71cb0aff5ba6615a0a82ea8090758380,\SystemRoot\system32\drivers\msisadrv.sys,SERVICE_KERNEL_DRIVER,,true,true,The file is signed and the signature was verified.,Microsoft Windows,Microsoft Windows Verification PCA
WW367BFQ,ohci1394,1394 OHCI Compliant Host Controller (Legacy),,C:\Windows\System32\drivers\ohci1394.sys,5ad63d42ffbbd3de93c02e29a27eb1ba,\SystemRoot\system32\drivers\ohci1394.sys,SERVICE_KERNEL_DRIVER,,true,true,The file is signed and the signature was verified.,Microsoft Windows,Microsoft Windows Verification PCA
WW367BFQ,bthserv,Bluetooth Support Service,The Bluetooth service supports discovery and association of remote Bluetooth devices.  Stopping or disabling this service may cause already installed Bluetooth devices to fail to operate properly and prevent new devices from being discovered or associated.,C:\Windows\System32\svchost.exe,bb5e5748e7bcf3fefc70b960795a86e2,C:\Windows\system32\svchost.exe -k bthsvcs,SERVICE_WIN32_SHARE_PROCESS,C:\Windows\System32\bthserv.dll,true,true,The file is signed and the signature was verified.,Microsoft Windows,Microsoft Windows Verification PCA
WW367BFQ,SENS,System Event Notification Service,Monitors system events and notifies subscribers to COM+ Event System of these events.,C:\Windows\System32\svchost.exe,bb5e5748e7bcf3fefc70b960795a86e2,C:\Windows\system32\svchost.exe -k netsvcs,SERVICE_WIN32_SHARE_PROCESS,C:\Windows\System32\Sens.dll,true,true,The file is signed and the signature was verified.,Microsoft Windows,Microsoft Windows Verification PCA
WW367BFQ,Mcx2Svc,Media Center Extender Service,Allows Media Center Extenders to locate and connect to the computer.,C:\Windows\System32\svchost.exe,bb5e5748e7bcf3fefc70b960795a86e2,C:\Windows\system32\svchost.exe -k LocalServiceAndNoImpersonation,SERVICE_WIN32_SHARE_PROCESS,C:\Windows\System32\Mcx2Svc.dll,true,true,The file is signed and the signature was verified.,Microsoft Windows,Microsoft Windows Verification PCA
WW367BFQ,McAPExe,McAfee AP Service,McAfee AP Service,C:\Program Files\Common Files\McAfee\VSCore_18_6\mcapexe.exe,63161c77be99577bd45627e3dc26f825,"C:\Program Files\Common Files\McAfee\VSCore_18_6\McApExe.exe""""""",SERVICE_WIN32_OWN_PROCESS,,true,true,The file is signed and the signature was verified.,"""McAfee",Symantec Class 3 SHA256 Code Signing CA
WW367BFQ,mpsdrv,Windows Firewall Authorization Driver,Windows Firewall Authorization Driver is a kernel mode driver that provides deep inspection services on inbound and outbound network traffic.,C:\Windows\System32\drivers\mpsdrv.sys,55e7fead4a17dd563384c0a85117d061,System32\drivers\mpsdrv.sys,SERVICE_KERNEL_DRIVER,,true,true,The file is signed and the signature was verified.,Microsoft Windows,Microsoft Windows Verification PCA
WW367BFQ,nvstor,nvstor,,C:\Windows\System32\drivers\nvstor.sys,aa97423688c6ab3f9798572e1c4cd9af,\SystemRoot\system32\drivers\nvstor.sys,SERVICE_KERNEL_DRIVER,,true,true,The file is signed and the signature was verified.,Microsoft Windows,Microsoft Windows Verification PCA
WW367BFQ,QWAVE,Quality Windows Audio Video Experience,Quality Windows Audio Video Experience (qWave) is a networking platform for Audio Video (AV) streaming applications on IP home networks. qWave enhances AV streaming performance and reliability by ensuring network quality-of-service (QoS) for AV applications. It provides mechanisms for admission control  run time monitoring and enforcement  application feedback  and traffic prioritization.,C:\Windows\System32\svchost.exe,bb5e5748e7bcf3fefc70b960795a86e2,C:\Windows\system32\svchost.exe -k LocalServiceAndNoImpersonation,SERVICE_WIN32_SHARE_PROCESS,C:\Windows\System32\qwave.dll,true,true,The file is signed and the signature was verified.,Microsoft Windows,Microsoft Windows Verification PCA
WW367BFQ,AppIDSvc,Application Identity,Determines and verifies the identity of an application. Disabling this service will prevent AppLocker from being enforced.,C:\Windows\System32\svchost.exe,bb5e5748e7bcf3fefc70b960795a86e2,C:\Windows\system32\svchost.exe -k LocalServiceAndNoImpersonation,SERVICE_WIN32_SHARE_PROCESS,C:\Windows\System32\appidsvc.dll,true,true,The file is signed and the signature was verified.,Microsoft Windows,Microsoft Windows Verification PCA
WW367BFQ,usbccgp,Microsoft USB Generic Parent Driver,,C:\Windows\System32\drivers\usbccgp.sys,d5f078fccf5bd63953338c67bbbe2adf,\SystemRoot\system32\drivers\usbccgp.sys,SERVICE_KERNEL_DRIVER,,true,true,The file is signed and the signature was verified.,Microsoft Windows,Microsoft Windows Verification PCA
WW367BFQ,IPBusEnum,PnP-X IP Bus Enumerator,The PnP-X bus enumerator service manages the virtual network bus. It discovers network connected devices using the SSDP/WS discovery protocols and gives them presence in PnP. If this service is stopped or disabled  presence of NCD devices will not be maintained in PnP. All pnpx based scenarios will stop functioning.,C:\Windows\System32\svchost.exe,bb5e5748e7bcf3fefc70b960795a86e2,C:\Windows\system32\svchost.exe -k LocalSystemNetworkRestricted,SERVICE_WIN32_SHARE_PROCESS,C:\Windows\System32\ipbusenum.dll,true,true,The file is signed and the signature was verified.,Microsoft Windows,Microsoft Windows Verification PCA
WW367BFQ,WinHttpAutoProxySvc,WinHTTP Web Proxy Auto-Discovery Service,WinHTTP implements the client HTTP stack and provides developers with a Win32 API and COM Automation component for sending HTTP requests and receiving responses. In addition  WinHTTP provides support for auto-discovering a proxy configuration via its implementation of the Web Proxy Auto-Discovery (WPAD) protocol.,C:\Windows\System32\svchost.exe,bb5e5748e7bcf3fefc70b960795a86e2,C:\Windows\system32\svchost.exe -k LocalService,SERVICE_WIN32_SHARE_PROCESS,C:\Windows\System32\winhttp.dll,true,true,The file is signed and the signature was verified.,Microsoft Windows,Microsoft Windows Verification PCA
WW367BFQ,DfsC,DFS Namespace Client Driver,Client driver for access to DFS Namespaces,C:\Windows\System32\drivers\dfsc.sys,83823a45ff4faefd391d3781ccca8b27,System32\Drivers\dfsc.sys,SERVICE_FILE_SYSTEM_DRIVER,,true,true,The file is signed and the signature was verified.,Microsoft Windows,Microsoft Windows Verification PCA
WW367BFQ,volmgrx,Dynamic Volume Manager,Extension of the volume manager driver that manages software RAID volumes (spanned  striped  mirrored  RAID-5) on dynamic disks,C:\Windows\System32\drivers\volmgrx.sys,f75ba3469523e518f4b626578fa0f281,\SystemRoot\System32\drivers\volmgrx.sys,SERVICE_KERNEL_DRIVER,,true,true,The file is signed and the signature was verified.,Microsoft Windows,Microsoft Windows Verification PCA
WW367BFQ,NlaSvc,Network Location Awareness,Collects and stores configuration information for the network and notifies programs when this information is modified. If this service is stopped  configuration information might be unavailable. If this service is disabled  any services that explicitly depend on it will fail to start.,C:\Windows\System32\svchost.exe,bb5e5748e7bcf3fefc70b960795a86e2,C:\Windows\System32\svchost.exe -k NetworkService,SERVICE_WIN32_SHARE_PROCESS,C:\Windows\System32\nlasvc.dll,true,true,The file is signed and the signature was verified.,Microsoft Windows,Microsoft Windows Verification PCA
WW367BFQ,srv2,Server SMB 2.xxx Driver,Enables connectivity from Windows Vista and later clients,C:\Windows\System32\drivers\srv2.sys,6aa2bf785be0870cd0831ee3eb3c513a,System32\DRIVERS\srv2.sys,SERVICE_FILE_SYSTEM_DRIVER,,true,true,The file is signed and the signature was verified.,Microsoft Windows,Microsoft Windows Verification PCA
WW367BFQ,msiserver,Windows Installer,Adds  modifies  and removes applications provided as a Windows Installer (*.msi) package. If this service is disabled  any services that explicitly depend on it will fail to start.,C:\Windows\System32\msiexec.exe,c3c7077e3b6a8457bb5a5957623000f4,C:\Windows\system32\msiexec.exe /V,SERVICE_WIN32_OWN_PROCESS,,true,true,The file is signed and the signature was verified.,Microsoft Windows,Microsoft Windows Verification PCA
WW367BFQ,nv_agp,NVIDIA nForce AGP Bus Filter,,C:\Windows\System32\drivers\NV_AGP.SYS,6ede458481ef8abf307370bda6e684ed,\SystemRoot\system32\drivers\nv_agp.sys,SERVICE_KERNEL_DRIVER,,true,true,The file is signed and the signature was verified.,Microsoft Windows,Microsoft Windows Verification PCA
WW367BFQ,clr_optimization_v4.0.30319_32,Microsoft .NET Framework NGEN v4.0.30319_X86,Microsoft .NET Framework NGEN,C:\Windows\Microsoft.NET\Framework\v4.0.30319\mscorsvw.exe,a43dc649ac90d2aa85624442e365988f,C:\Windows\Microsoft.NET\Framework\v4.0.30319\mscorsvw.exe,SERVICE_WIN32_OWN_PROCESS,,true,true,The file is signed and the signature was verified.,Microsoft Corporation,Microsoft Code Signing PCA
WW367BFQ,CryptSvc,Cryptographic Services,Provides four management services: Catalog Database Service  which confirms the signatures of Windows files and allows new programs to be installed; Protected Root Service  which adds and removes Trusted Root Certification Authority certificates from this computer; Automatic Root Certificate Update Service  which retrieves root certificates from Windows Update and enable scenarios such as SSL; and Key Service  which helps enroll this computer for certificates. If this service is stopped  these management services will not function properly. If this service is disabled  any services that explicitly depend on it will fail to start.,C:\Windows\System32\svchost.exe,bb5e5748e7bcf3fefc70b960795a86e2,C:\Windows\system32\svchost.exe -k NetworkService,SERVICE_WIN32_SHARE_PROCESS,C:\Windows\System32\cryptsvc.dll,true,true,The file is signed and the signature was verified.,Microsoft Windows,Microsoft Windows Verification PCA
WW367BFQ,VBoxVideo,VBoxVideo,,C:\Windows\System32\drivers\VBoxVideo.sys,393ff874d8ad2c5d5f10315beb35dadb,system32\DRIVERS\VBoxVideo.sys,SERVICE_KERNEL_DRIVER,,true,true,The file is signed and the signature was verified.,Oracle Corporation,VeriSign Class 3 Code Signing 2010 CA
WW367BFQ,MSTEE,Microsoft Streaming Tee/Sink-to-Sink Converter,,C:\Windows\System32\drivers\mstee.sys,2e739a4de7f15843e8d7d277ea11f959,system32\drivers\MSTEE.sys,SERVICE_KERNEL_DRIVER,,true,true,The file is signed and the signature was verified.,Microsoft Windows,Microsoft Windows Verification PCA
WW367BFQ,defragsvc,Disk Defragmenter,Provides Disk Defragmentation Capabilities.,C:\Windows\System32\svchost.exe,bb5e5748e7bcf3fefc70b960795a86e2,C:\Windows\system32\svchost.exe -k defragsvc,SERVICE_WIN32_OWN_PROCESS,C:\Windows\System32\defragsvc.dll,true,true,The file is signed and the signature was verified.,Microsoft Windows,Microsoft Windows Verification PCA
WW367BFQ,WdiSystemHost,Diagnostic System Host,The Diagnostic System Host is used by the Diagnostic Policy Service to host diagnostics that need to run in a Local System context.  If this service is stopped  any diagnostics that depend on it will no longer function.,C:\Windows\System32\svchost.exe,bb5e5748e7bcf3fefc70b960795a86e2,C:\Windows\System32\svchost.exe -k LocalSystemNetworkRestricted,SERVICE_WIN32_SHARE_PROCESS,C:\Windows\System32\wdi.dll,true,true,The file is signed and the signature was verified.,Microsoft Windows,Microsoft Windows Verification PCA
WW367BFQ,WANARP,Remote Access IP ARP Driver,Remote Access IP ARP Driver,C:\Windows\System32\drivers\wanarp.sys,f621822e112fff0aca2bb8c669c5558b,system32\DRIVERS\wanarp.sys,SERVICE_KERNEL_DRIVER,,true,true,The file is signed and the signature was verified.,Microsoft Windows,Microsoft Windows Verification PCA
WW367BFQ,BrUsbMdm,Brother MFC USB Fax Only Modem,,C:\Windows\System32\drivers\BrUsbMdm.sys,bb1a5efbbbe7035fe5db41897da6a7b8,\SystemRoot\System32\Drivers\BrUsbMdm.sys,SERVICE_KERNEL_DRIVER,,true,true,The file is signed and the signature was verified.,Microsoft Windows,Microsoft Windows Verification PCA
WW367BFQ,SSDPSRV,SSDP Discovery,Discovers networked devices and services that use the SSDP discovery protocol  such as UPnP devices. Also announces SSDP devices and services running on the local computer. If this service is stopped  SSDP-based devices will not be discovered. If this service is disabled  any services that explicitly depend on it will fail to start.,C:\Windows\System32\svchost.exe,bb5e5748e7bcf3fefc70b960795a86e2,C:\Windows\system32\svchost.exe -k LocalServiceAndNoImpersonation,SERVICE_WIN32_SHARE_PROCESS,C:\Windows\System32\ssdpsrv.dll,true,true,The file is signed and the signature was verified.,Microsoft Windows,Microsoft Windows Verification PCA
WW367BFQ,SessionEnv,Remote Desktop Configuration,Remote Desktop Configuration service (RDCS) is responsible for all Remote Desktop Services and Remote Desktop related configuration and session maintenance activities that require SYSTEM context. These include per-session temporary folders  RD themes  and RD certificates.,C:\Windows\System32\svchost.exe,bb5e5748e7bcf3fefc70b960795a86e2,C:\Windows\System32\svchost.exe -k netsvcs,SERVICE_WIN32_SHARE_PROCESS,C:\Windows\System32\SessEnv.dll,true,true,The file is signed and the signature was verified.,Microsoft Windows,Microsoft Windows Verification PCA
WW367BFQ,mfesapsn,McAfee Process Start Notification Service,,C:\Program Files\McAfee\WebAdvisor\mfesapsn.sys,edf6bdfaf46b83375d03d896cda6d971,\??\C:\Program Files\McAfee\WebAdvisor\mfesapsn.sys,SERVICE_KERNEL_DRIVER,,true,true,The file is signed and the signature was verified.,"""McAfee",VeriSign Class 3 Code Signing 2010 CA
WW367BFQ,Rasl2tp,WAN Miniport (L2TP),WAN Miniport (L2TP),C:\Windows\System32\drivers\rasl2tp.sys,37a8c1a500612c44abafd2500ddb05ed,system32\DRIVERS\rasl2tp.sys,SERVICE_KERNEL_DRIVER,,true,true,The file is signed and the signature was verified.,Microsoft Windows,Microsoft Windows Verification PCA
WW367BFQ,ACPI,Microsoft ACPI Driver,,C:\Windows\System32\drivers\acpi.sys,5ec814675fa92696c78c1d0540c0773f,\SystemRoot\system32\drivers\ACPI.sys,SERVICE_KERNEL_DRIVER,,true,true,The file is signed and the signature was verified.,Microsoft Windows,Microsoft Windows Verification PCA
WW367BFQ,KSecPkg,KSecPkg,,C:\Windows\System32\drivers\ksecpkg.sys,7850368e7e3a643e0150d07d308b55ce,\SystemRoot\System32\Drivers\ksecpkg.sys,SERVICE_KERNEL_DRIVER,,true,true,The file is signed and the signature was verified.,Microsoft Windows,Microsoft Windows Verification PCA
WW367BFQ,Processor,Processor Driver,,C:\Windows\System32\drivers\processr.sys,240d6aa8b04f32525757652c0efc38c1,\SystemRoot\system32\drivers\processr.sys,SERVICE_KERNEL_DRIVER,,true,true,The file is signed and the signature was verified.,Microsoft Windows,Microsoft Windows Verification PCA
WW367BFQ,Browser,Computer Browser,Maintains an updated list of computers on the network and supplies this list to computers designated as browsers. If this service is stopped  this list will not be updated or maintained. If this service is disabled  any services that explicitly depend on it will fail to start.,C:\Windows\System32\svchost.exe,bb5e5748e7bcf3fefc70b960795a86e2,C:\Windows\System32\svchost.exe -k netsvcs,SERVICE_WIN32_SHARE_PROCESS,C:\Windows\System32\browser.dll,true,true,The file is signed and the signature was verified.,Microsoft Windows,Microsoft Windows Verification PCA
WW367BFQ,KSecDD,KSecDD,,C:\Windows\System32\drivers\ksecdd.sys,5e6beede7f27408ada08e3ed42016e04,\SystemRoot\System32\Drivers\ksecdd.sys,SERVICE_KERNEL_DRIVER,,true,true,The file is signed and the signature was verified.,Microsoft Windows,Microsoft Windows Verification PCA
WW367BFQ,RasPppoe,Remote Access PPPOE Driver,Remote Access PPPOE Driver,C:\Windows\System32\drivers\raspppoe.sys,6058895f3fc10393140da2c612716740,system32\DRIVERS\raspppoe.sys,SERVICE_KERNEL_DRIVER,,true,true,The file is signed and the signature was verified.,Microsoft Windows,Microsoft Windows Verification PCA
WW367BFQ,HDAudBus,Microsoft UAA Bus Driver for High Definition Audio,,C:\Windows\System32\drivers\hdaudbus.sys,8b7e8b881368cb5ec9b10d670a86bcaa,system32\DRIVERS\HDAudBus.sys,SERVICE_KERNEL_DRIVER,,true,true,The file is signed and the signature was verified.,Microsoft Windows,Microsoft Windows Verification PCA
WW367BFQ,Parport,Parallel port driver,,C:\Windows\System32\drivers\parport.sys,b0900b229987459e828ee5543fd628f7,\SystemRoot\system32\drivers\parport.sys,SERVICE_KERNEL_DRIVER,,true,true,The file is signed and the signature was verified.,Microsoft Windows,Microsoft Windows Verification PCA
WW367BFQ,amdide,amdide,,C:\Windows\System32\drivers\amdide.sys,a65f9ed139ea508c677ac7851c610d32,\SystemRoot\system32\drivers\amdide.sys,SERVICE_KERNEL_DRIVER,,true,true,The file is signed and the signature was verified.,Microsoft Windows,Microsoft Windows Verification PCA
WW367BFQ,WebClient,WebClient,Enables Windows-based programs to create  access  and modify Internet-based files. If this service is stopped  these functions will not be available. If this service is disabled  any services that explicitly depend on it will fail to start.,C:\Windows\System32\svchost.exe,bb5e5748e7bcf3fefc70b960795a86e2,C:\Windows\system32\svchost.exe -k LocalService,SERVICE_WIN32_SHARE_PROCESS,C:\Windows\System32\WebClnt.dll,true,true,The file is signed and the signature was verified.,Microsoft Windows,Microsoft Windows Verification PCA
WW367BFQ,wcncsvc,Windows Connect Now - Config Registrar,WCNCSVC hosts the Windows Connect Now Configuration which is Microsoft's Implementation of Wi-Fi Protected Setup (WPS) protocol. This is used to configure Wireless LAN settings for an Access Point (AP) or a Wi-Fi Device. The service is started programmatically as needed.,C:\Windows\System32\svchost.exe,bb5e5748e7bcf3fefc70b960795a86e2,C:\Windows\System32\svchost.exe -k LocalServiceAndNoImpersonation,SERVICE_WIN32_SHARE_PROCESS,C:\Windows\System32\wcncsvc.dll,true,true,The file is signed and the signature was verified.,Microsoft Windows,Microsoft Windows Verification PCA
WW367BFQ,vwifibus,Virtual WiFi Bus Driver,Implements bus functionality for Virtual WiFi,C:\Windows\System32\drivers\vwifibus.sys,08f7ef0c8da1d57fd81a3c327e4cdc60,\SystemRoot\System32\drivers\vwifibus.sys,SERVICE_KERNEL_DRIVER,,true,true,The file is signed and the signature was verified.,Microsoft Windows,Microsoft Windows Verification PCA
WW367BFQ,upnphost,UPnP Device Host,Allows UPnP devices to be hosted on this computer. If this service is stopped  any hosted UPnP devices will stop functioning and no additional hosted devices can be added. If this service is disabled  any services that explicitly depend on it will fail to start.,C:\Windows\System32\svchost.exe,bb5e5748e7bcf3fefc70b960795a86e2,C:\Windows\system32\svchost.exe -k LocalServiceAndNoImpersonation,SERVICE_WIN32_SHARE_PROCESS,C:\Windows\System32\upnphost.dll,true,true,The file is signed and the signature was verified.,Microsoft Windows,Microsoft Windows Verification PCA
WW367BFQ,HidBatt,HID UPS Battery Driver,,C:\Windows\System32\drivers\hidbatt.sys,1434abe307cccb5470f67f90b5ae4ec0,\SystemRoot\system32\drivers\HidBatt.sys,SERVICE_KERNEL_DRIVER,,true,true,The file is signed and the signature was verified.,Microsoft Windows,Microsoft Windows Verification PCA
WW367BFQ,ksthunk,Kernel Streaming Thunks,,C:\Windows\System32\drivers\ksthunk.sys,8921d1ec2b23bc83cd9d264b797b109f,\SystemRoot\system32\drivers\ksthunk.sys,SERVICE_KERNEL_DRIVER,,true,true,The file is signed and the signature was verified.,Microsoft Windows,Microsoft Windows Verification PCA
WW367BFQ,W32Time,Windows Time,Maintains date and time synchronization on all clients and servers in the network. If this service is stopped  date and time synchronization will be unavailable. If this service is disabled  any services that explicitly depend on it will fail to start.,C:\Windows\System32\svchost.exe,bb5e5748e7bcf3fefc70b960795a86e2,C:\Windows\system32\svchost.exe -k LocalService,SERVICE_WIN32_SHARE_PROCESS,C:\Windows\System32\w32time.dll,true,true,The file is signed and the signature was verified.,Microsoft Windows,Microsoft Windows Verification PCA
WW367BFQ,amdxata,amdxata,,C:\Windows\System32\drivers\amdxata.sys,fa56c9ed256391096b34f290165e493f,\SystemRoot\system32\drivers\amdxata.sys,SERVICE_KERNEL_DRIVER,,true,true,The file is signed and the signature was verified.,Microsoft Windows,Microsoft Windows Verification PCA
WW367BFQ,EventSystem,COM+ Event System,Supports System Event Notification Service (SENS)  which provides automatic distribution of events to subscribing Component Object Model (COM) components. If the service is stopped  SENS will close and will not be able to provide logon and logoff notifications. If this service is disabled  any services that explicitly depend on it will fail to start.,C:\Windows\System32\svchost.exe,bb5e5748e7bcf3fefc70b960795a86e2,C:\Windows\system32\svchost.exe -k LocalService,SERVICE_WIN32_SHARE_PROCESS,C:\Windows\System32\es.dll,true,true,The file is signed and the signature was verified.,Microsoft Windows,Microsoft Windows Verification PCA
WW367BFQ,usbhub,Microsoft USB Standard Hub Driver,,C:\Windows\System32\drivers\usbhub.sys,e8ed64bb59510eb5ac33d26a98e6924d,system32\DRIVERS\usbhub.sys,SERVICE_KERNEL_DRIVER,,true,true,The file is signed and the signature was verified.,Microsoft Windows,Microsoft Windows Verification PCA
WW367BFQ,mssmbios,Microsoft System Management BIOS Driver,,C:\Windows\System32\drivers\mssmbios.sys,5118e05fe57a3d93b68353b7796359d3,system32\DRIVERS\mssmbios.sys,SERVICE_KERNEL_DRIVER,,true,true,The file is signed and the signature was verified.,Microsoft Windows,Microsoft Windows Verification PCA
WW367BFQ,UmRdpService,Remote Desktop Services UserMode Port Redirector,Allows the redirection of Printers/Drives/Ports for RDP connections,C:\Windows\System32\svchost.exe,bb5e5748e7bcf3fefc70b960795a86e2,C:\Windows\System32\svchost.exe -k LocalSystemNetworkRestricted,SERVICE_WIN32_SHARE_PROCESS,C:\Windows\System32\umrdp.dll,true,true,The file is signed and the signature was verified.,Microsoft Windows,Microsoft Windows Verification PCA
WW367BFQ,lmhosts,TCP/IP NetBIOS Helper,Provides support for the NetBIOS over TCP/IP (NetBT) service and NetBIOS name resolution for clients on the network  therefore enabling users to share files  print  and log on to the network. If this service is stopped  these functions might be unavailable. If this service is disabled  any services that explicitly depend on it will fail to start.,C:\Windows\System32\svchost.exe,bb5e5748e7bcf3fefc70b960795a86e2,C:\Windows\system32\svchost.exe -k LocalServiceNetworkRestricted,SERVICE_WIN32_SHARE_PROCESS,C:\Windows\System32\lmhsvc.dll,true,true,The file is signed and the signature was verified.,Microsoft Windows,Microsoft Windows Verification PCA
WW367BFQ,TermService,Remote Desktop Services,Allows users to connect interactively to a remote computer. Remote Desktop and Remote Desktop Session Host Server depend on this service.  To prevent remote use of this computer  clear the checkboxes on the Remote tab of the System properties control panel item.,C:\Windows\System32\svchost.exe,bb5e5748e7bcf3fefc70b960795a86e2,C:\Windows\System32\svchost.exe -k NetworkService,SERVICE_WIN32_SHARE_PROCESS,C:\Windows\System32\termsrv.dll,true,true,The file is signed and the signature was verified.,Microsoft Windows,Microsoft Windows Verification PCA
WW367BFQ,BITS,Background Intelligent Transfer Service,Transfers files in the background using idle network bandwidth. If the service is disabled  then any applications that depend on BITS  such as Windows Update or MSN Explorer  will be unable to automatically download programs and other information.,C:\Windows\System32\svchost.exe,bb5e5748e7bcf3fefc70b960795a86e2,C:\Windows\System32\svchost.exe -k netsvcs,SERVICE_WIN32_SHARE_PROCESS,C:\Windows\System32\qmgr.dll,true,true,The file is signed and the signature was verified.,Microsoft Windows,Microsoft Windows Verification PCA
