hostname,name,descriptivename,description,path,md5,arguments,type,servicedll,pathsignatureexists,pathsignatureverified,pathsignaturedescription,pathcertificatesubject,pathcertificateissuer
WW367BFQ,terminpt,Microsoft Remote Desktop Input Driver,,C:\Windows\System32\drivers\terminpt.sys,a85e7b58c102717f21c78e39f017d843,\SystemRoot\system32\drivers\terminpt.sys,SERVICE_KERNEL_DRIVER,,true,true,The file is signed and the signature was verified.,Microsoft Windows,Microsoft Windows Verification PCA
WW367BFQ,SstpSvc,Secure Socket Tunneling Protocol Service,Provides support for the Secure Socket Tunneling Protocol (SSTP) to connect to remote computers using VPN. If this service is disabled  users will not be able to use SSTP to access remote servers.,C:\Windows\System32\svchost.exe,bb5e5748e7bcf3fefc70b960795a86e2,C:\Windows\system32\svchost.exe -k LocalService,SERVICE_WIN32_SHARE_PROCESS,C:\Windows\System32\sstpsvc.dll,true,true,The file is signed and the signature was verified.,Microsoft Windows,Microsoft Windows Verification PCA
WW367BFQ,Tcpip,TCP/IP Protocol Driver,TCP/IP Protocol Driver,C:\Windows\System32\drivers\tcpip.sys,55194cfe8049b1140cba895b83231525,\SystemRoot\System32\drivers\tcpip.sys,SERVICE_KERNEL_DRIVER,,true,true,The file is signed and the signature was verified.,Microsoft Windows,Microsoft Windows Verification PCA
WW367BFQ,Wecsvc,Windows Event Collector,This service manages persistent subscriptions to events from remote sources that support WS-Management protocol. This includes Windows Vista event logs  hardware and IPMI-enabled event sources. The service stores forwarded events in a local Event Log. If this service is stopped or disabled event subscriptions cannot be created and forwarded events cannot be accepted.,C:\Windows\System32\svchost.exe,bb5e5748e7bcf3fefc70b960795a86e2,C:\Windows\system32\svchost.exe -k NetworkService,SERVICE_WIN32_SHARE_PROCESS,C:\Windows\System32\wecsvc.dll,true,true,The file is signed and the signature was verified.,Microsoft Windows,Microsoft Windows Verification PCA
WW367BFQ,wercplsupport,Problem Reports and Solutions Control Panel Support,This service provides support for viewing  sending and deletion of system-level problem reports for the Problem Reports and Solutions control panel.,C:\Windows\System32\svchost.exe,bb5e5748e7bcf3fefc70b960795a86e2,C:\Windows\System32\svchost.exe -k netsvcs,SERVICE_WIN32_SHARE_PROCESS,C:\Windows\System32\wercplsupport.dll,true,true,The file is signed and the signature was verified.,Microsoft Windows,Microsoft Windows Verification PCA
WW367BFQ,MMCSS,Multimedia Class Scheduler,Enables relative prioritization of work based on system-wide task priorities. This is intended mainly for multimedia applications.  If this service is stopped  individual tasks resort to their default priority.,C:\Windows\System32\svchost.exe,bb5e5748e7bcf3fefc70b960795a86e2,C:\Windows\system32\svchost.exe -k netsvcs,SERVICE_WIN32_SHARE_PROCESS,C:\Windows\System32\mmcss.dll,true,true,The file is signed and the signature was verified.,Microsoft Windows,Microsoft Windows Verification PCA
WW367BFQ,IPNAT,IP Network Address Translator,,C:\Windows\System32\drivers\ipnat.sys,62b79367cd40e650360f7d088eb1275b,System32\drivers\ipnat.sys,SERVICE_KERNEL_DRIVER,,true,true,The file is signed and the signature was verified.,Microsoft Windows,Microsoft Windows Verification PCA
WW367BFQ,WinDefend,Windows Defender,Protection against spyware and potentially unwanted software,C:\Windows\System32\svchost.exe,bb5e5748e7bcf3fefc70b960795a86e2,C:\Windows\System32\svchost.exe -k secsvcs,SERVICE_WIN32_SHARE_PROCESS,C:\Program Files\Windows Defender\MpSvc.dll,true,true,The file is signed and the signature was verified.,Microsoft Windows,Microsoft Windows Verification PCA
WW367BFQ,SiSRaid4,SiSRaid4,,C:\Windows\System32\drivers\sisraid4.sys,8fea09982d8a1526ec101a3d780002df,\SystemRoot\system32\drivers\sisraid4.sys,SERVICE_KERNEL_DRIVER,,true,true,The file is signed and the signature was verified.,Microsoft Windows,Microsoft Windows Verification PCA
WW367BFQ,iScsiPrt,iScsiPort Driver,,C:\Windows\System32\drivers\msiscsi.sys,d58bc0f5efa9efe4b26fca053ea55b77,\SystemRoot\system32\drivers\msiscsi.sys,SERVICE_KERNEL_DRIVER,,true,true,The file is signed and the signature was verified.,Microsoft Windows,Microsoft Windows Verification PCA
WW367BFQ,SCPolicySvc,Smart Card Removal Policy,Allows the system to be configured to lock the user desktop upon smart card removal.,C:\Windows\System32\svchost.exe,bb5e5748e7bcf3fefc70b960795a86e2,C:\Windows\system32\svchost.exe -k netsvcs,SERVICE_WIN32_SHARE_PROCESS,C:\Windows\System32\certprop.dll,true,true,The file is signed and the signature was verified.,Microsoft Windows,Microsoft Windows Verification PCA
WW367BFQ,ALG,Application Layer Gateway Service,Provides support for 3rd party protocol plug-ins for Internet Connection Sharing,C:\Windows\System32\alg.exe,6c89f8593d1857ee91046b393a81b516,C:\Windows\System32\alg.exe,SERVICE_WIN32_OWN_PROCESS,,true,true,The file is signed and the signature was verified.,Microsoft Windows,Microsoft Windows Verification PCA
WW367BFQ,RpcLocator,Remote Procedure Call (RPC) Locator,In Windows 2003 and earlier versions of Windows  the Remote Procedure Call (RPC) Locator service manages the RPC name service database. In Windows Vista and later versions of Windows  this service does not provide any functionality and is present for application compatibility.,C:\Windows\System32\Locator.exe,ceb1f6f2d1c13f1e4e501f4ba41202a3,C:\Windows\system32\locator.exe,SERVICE_WIN32_OWN_PROCESS,,true,true,The file is signed and the signature was verified.,Microsoft Windows,Microsoft Windows Verification PCA
WW367BFQ,DcomLaunch,DCOM Server Process Launcher,The DCOMLAUNCH service launches COM and DCOM servers in response to object activation requests. If this service is stopped or disabled  programs using COM or DCOM will not function properly. It is strongly recommended that you have the DCOMLAUNCH service running.,C:\Windows\System32\svchost.exe,bb5e5748e7bcf3fefc70b960795a86e2,C:\Windows\system32\svchost.exe -k DcomLaunch,SERVICE_WIN32_SHARE_PROCESS,C:\Windows\System32\rpcss.dll,true,true,The file is signed and the signature was verified.,Microsoft Windows,Microsoft Windows Verification PCA
WW367BFQ,NdisTapi,Remote Access NDIS TAPI Driver,Remote Access NDIS TAPI Driver,C:\Windows\System32\drivers\ndistapi.sys,8c9b79183c502462bd5c9edd6311f884,system32\DRIVERS\ndistapi.sys,SERVICE_KERNEL_DRIVER,,true,true,The file is signed and the signature was verified.,Microsoft Windows,Microsoft Windows Verification PCA
WW367BFQ,vhdmp,vhdmp,,C:\Windows\System32\drivers\vhdmp.sys,8cbc68c54bc9c92f361b6cd0a88af136,\SystemRoot\system32\drivers\vhdmp.sys,SERVICE_KERNEL_DRIVER,,true,true,The file is signed and the signature was verified.,Microsoft Windows,Microsoft Windows Verification PCA
WW367BFQ,WacomPen,Wacom Serial Pen HID Driver,,C:\Windows\System32\drivers\wacompen.sys,cba1e2cd77027b0e9dc93ac6009405da,\SystemRoot\system32\drivers\wacompen.sys,SERVICE_KERNEL_DRIVER,,true,true,The file is signed and the signature was verified.,Microsoft Windows,Microsoft Windows Verification PCA
WW367BFQ,Schedule,Task Scheduler,Enables a user to configure and schedule automated tasks on this computer. The service also hosts multiple Windows system-critical tasks. If this service is stopped or disabled  these tasks will not be run at their scheduled times. If this service is disabled  any services that explicitly depend on it will fail to start.,C:\Windows\System32\svchost.exe,bb5e5748e7bcf3fefc70b960795a86e2,C:\Windows\system32\svchost.exe -k netsvcs,SERVICE_WIN32_SHARE_PROCESS,C:\Windows\System32\schedsvc.dll,true,true,The file is signed and the signature was verified.,Microsoft Windows,Microsoft Windows Verification PCA
WW367BFQ,NetBIOS,NetBIOS Interface,NetBIOS Interface,C:\Windows\System32\drivers\netbios.sys,c8892c278eddb487033133379637789f,system32\DRIVERS\netbios.sys,SERVICE_FILE_SYSTEM_DRIVER,,true,true,The file is signed and the signature was verified.,Microsoft Windows,Microsoft Windows Verification PCA
WW367BFQ,mouclass,Mouse Class Driver,,C:\Windows\System32\drivers\mouclass.sys,6cc0f8586be31c06a8fa16fe4164a85c,system32\DRIVERS\mouclass.sys,SERVICE_KERNEL_DRIVER,,true,true,The file is signed and the signature was verified.,Microsoft Windows,Microsoft Windows Verification PCA
WW367BFQ,iirsp,iirsp,,C:\Windows\System32\drivers\iirsp.sys,ea5e7bc4e06030988249fdec0ff525b8,\SystemRoot\system32\drivers\iirsp.sys,SERVICE_KERNEL_DRIVER,,true,true,The file is signed and the signature was verified.,Microsoft Windows,Microsoft Windows Verification PCA
WW367BFQ,Smb,Message-oriented TCP/IP and TCP/IPv6 Protocol (SMB session),Microsoft NetbiosSmb Device Driver,C:\Windows\System32\drivers\smb.sys,5e4f389810f2694212622254b98cc41d,system32\DRIVERS\smb.sys,SERVICE_KERNEL_DRIVER,,true,true,The file is signed and the signature was verified.,Microsoft Windows,Microsoft Windows Verification PCA
WW367BFQ,RpcEptMapper,RPC Endpoint Mapper,Resolves RPC interfaces identifiers to transport endpoints. If this service is stopped or disabled  programs using Remote Procedure Call (RPC) services will not function properly.,C:\Windows\System32\svchost.exe,bb5e5748e7bcf3fefc70b960795a86e2,C:\Windows\system32\svchost.exe -k RPCSS,SERVICE_WIN32_SHARE_PROCESS,C:\Windows\System32\RpcEpMap.dll,true,true,The file is signed and the signature was verified.,Microsoft Windows,Microsoft Windows Verification PCA
WW367BFQ,adp94xx,adp94xx,,C:\Windows\System32\drivers\adp94xx.sys,16e8f2a1faaf7399cb9c2b1c063aa10f,\SystemRoot\system32\drivers\adp94xx.sys,SERVICE_KERNEL_DRIVER,,true,true,The file is signed and the signature was verified.,Microsoft Windows,Microsoft Windows Verification PCA
WW367BFQ,bowser,Browser Support Driver,Implements the kernel datagram receiver for the computer browser browser service.,C:\Windows\System32\drivers\bowser.sys,22e97910f3a2625dbebb6429bdc97796,system32\DRIVERS\bowser.sys,SERVICE_FILE_SYSTEM_DRIVER,,true,true,The file is signed and the signature was verified.,Microsoft Windows,Microsoft Windows Verification PCA
WW367BFQ,Wdf01000,Kernel Mode Driver Frameworks service,,C:\Windows\System32\drivers\Wdf01000.sys,dd046d701202d0f1c0982a4117ce13d1,\SystemRoot\system32\drivers\Wdf01000.sys,SERVICE_KERNEL_DRIVER,,true,true,The file is signed and the signature was verified.,Microsoft Windows,Microsoft Windows Verification PCA
WW367BFQ,ebdrv,Broadcom NetXtreme II 10 GigE VBD,,C:\Windows\System32\drivers\evbda.sys,451498346cb490b93c7be69b3d53081a,\SystemRoot\system32\drivers\evbda.sys,SERVICE_KERNEL_DRIVER,,true,true,The file is signed and the signature was verified.,Microsoft Windows,Microsoft Windows Verification PCA
WW367BFQ,udfs,udfs,Reads/Writes UDF 1.02 1.5 2.0x 2.5 disc formats  usually found on C/DVD discs. (Core) (All pieces),C:\Windows\System32\drivers\udfs.sys,d86efa84907e6290a606932693709a02,system32\DRIVERS\udfs.sys,SERVICE_FILE_SYSTEM_DRIVER,,true,true,The file is signed and the signature was verified.,Microsoft Windows,Microsoft Windows Verification PCA
WW367BFQ,RDPENCDD,RDP Encoder Mirror Driver,RDP Encoder Mirror Driver,C:\Windows\System32\drivers\RDPENCDD.sys,07af4479b58a7c4610b33bbee28d057f,system32\drivers\rdpencdd.sys,SERVICE_KERNEL_DRIVER,,true,true,The file is signed and the signature was verified.,Microsoft Windows,Microsoft Windows Verification PCA
WW367BFQ,nsi,Network Store Interface Service,This service delivers network notifications (e.g. interface addition/deleting etc) to user mode clients. Stopping this service will cause loss of network connectivity. If this service is disabled  any other services that explicitly depend on this service will fail to start.,C:\Windows\System32\svchost.exe,bb5e5748e7bcf3fefc70b960795a86e2,C:\Windows\system32\svchost.exe -k LocalService,SERVICE_WIN32_SHARE_PROCESS,C:\Windows\System32\nsisvc.dll,true,true,The file is signed and the signature was verified.,Microsoft Windows,Microsoft Windows Verification PCA
WW367BFQ,rdyboost,ReadyBoost,ReadyBoost,C:\Windows\System32\drivers\rdyboost.sys,9233765011c8673bab75d202042285f7,\SystemRoot\System32\drivers\rdyboost.sys,SERVICE_KERNEL_DRIVER,,true,true,The file is signed and the signature was verified.,Microsoft Windows,Microsoft Windows Verification PCA
WW367BFQ,nsiproxy,NSI proxy service driver.,NSI proxy service.,C:\Windows\System32\drivers\nsiproxy.sys,4e5a89715d2caf87d46dbab1c74b3a83,system32\drivers\nsiproxy.sys,SERVICE_KERNEL_DRIVER,,true,true,The file is signed and the signature was verified.,Microsoft Windows,Microsoft Windows Verification PCA
WW367BFQ,mfefire,McAfee Firewall Core Service,Provides firewall services to McAfee products,C:\Program Files\Common Files\McAfee\SystemCore\mfefire.exe,fd555efc1d5ba763f8eadab073a3e4bf,"C:\Program Files\Common Files\McAfee\SystemCore\mfefire.exe""""""",SERVICE_WIN32_OWN_PROCESS,,true,true,The file is signed and the signature was verified.,"""McAfee",VeriSign Class 3 Code Signing 2010 CA
WW367BFQ,FltMgr,FltMgr,File System Filter Manager Driver,C:\Windows\System32\drivers\fltMgr.sys,810e807dd2ffdfbe27cabc748ea249db,\SystemRoot\system32\drivers\fltmgr.sys,SERVICE_FILE_SYSTEM_DRIVER,,true,true,The file is signed and the signature was verified.,Microsoft Windows,Microsoft Windows Verification PCA
WW367BFQ,FontCache,Windows Font Cache Service,Optimizes performance of applications by caching commonly used font data. Applications will start this service if it is not already running. It can be disabled  though doing so will degrade application performance.,C:\Windows\System32\svchost.exe,bb5e5748e7bcf3fefc70b960795a86e2,C:\Windows\system32\svchost.exe -k LocalServiceAndNoImpersonation,SERVICE_WIN32_SHARE_PROCESS,C:\Windows\System32\FntCache.dll,true,true,The file is signed and the signature was verified.,Microsoft Windows,Microsoft Windows Verification PCA
WW367BFQ,SamSs,Security Accounts Manager,The startup of this service signals other services that the Security Accounts Manager (SAM) is ready to accept requests.  Disabling this service will prevent other services in the system from being notified when the SAM is ready  which may in turn cause those services to fail to start correctly. This service should not be disabled.,C:\Windows\System32\lsass.exe,18d5953fc74657ca3fb77fd92e0ac30b,C:\Windows\system32\lsass.exe,SERVICE_WIN32_SHARE_PROCESS,,true,true,The file is signed and the signature was verified.,Microsoft Windows,Microsoft Windows Verification PCA
WW367BFQ,W3SVC,World Wide Web Publishing Service,Provides Web connectivity and administration through the Internet Information Services Manager,C:\Windows\System32\svchost.exe,bb5e5748e7bcf3fefc70b960795a86e2,C:\WINDOWS\system32\svchost.exe -k iissvcs,SERVICE_WIN32_SHARE_PROCESS,C:\Windows\System32\inetsrv\iisw3adm.dll,true,true,The file is signed and the signature was verified.,Microsoft Windows,Microsoft Windows Production PCA 2011
WW367BFQ,mfeelamk,McAfee Inc. mfeelamk,,C:\Windows\System32\drivers\mfeelamk.sys,bad68ddc604029305a66768b8dd62269,\SystemRoot\system32\drivers\mfeelamk.sys,SERVICE_KERNEL_DRIVER,,true,true,The file is signed and the signature was verified.,Microsoft Windows Hardware Compatibility Publisher,Microsoft Windows Hardware Compatibility PCA
WW367BFQ,Wanarpv6,Remote Access IPv6 ARP Driver,Remote Access IPv6 ARP Driver,C:\Windows\System32\drivers\wanarp.sys,f621822e112fff0aca2bb8c669c5558b,system32\DRIVERS\wanarp.sys,SERVICE_KERNEL_DRIVER,,true,true,The file is signed and the signature was verified.,Microsoft Windows,Microsoft Windows Verification PCA
WW367BFQ,usbehci,Microsoft USB 2.0 Enhanced Host Controller Miniport Driver,,C:\Windows\System32\drivers\usbehci.sys,c216d1ebbe326d6bf35d25f71ec2c45e,\SystemRoot\system32\drivers\usbehci.sys,SERVICE_KERNEL_DRIVER,,true,true,The file is signed and the signature was verified.,Microsoft Windows,Microsoft Windows Verification PCA
WW367BFQ,Netlogon,Netlogon,Maintains a secure channel between this computer and the domain controller for authenticating users and services. If this service is stopped  the computer may not authenticate users and services and the domain controller cannot register DNS records. If this service is disabled  any services that explicitly depend on it will fail to start.,C:\Windows\System32\lsass.exe,18d5953fc74657ca3fb77fd92e0ac30b,C:\Windows\system32\lsass.exe,SERVICE_WIN32_SHARE_PROCESS,,true,true,The file is signed and the signature was verified.,Microsoft Windows,Microsoft Windows Verification PCA
WW367BFQ,sbp2port,sbp2port,,C:\Windows\System32\drivers\sbp2port.sys,6345d2afe7b8d82100ca940a3e3c48fb,\SystemRoot\system32\drivers\sbp2port.sys,SERVICE_KERNEL_DRIVER,,true,true,The file is signed and the signature was verified.,Microsoft Windows,Microsoft Windows Verification PCA
WW367BFQ,p2psvc,Peer Networking Grouping,Enables multi-party communication using Peer-to-Peer Grouping.  If disabled  some applications  such as HomeGroup  may not function.,C:\Windows\System32\svchost.exe,bb5e5748e7bcf3fefc70b960795a86e2,C:\Windows\System32\svchost.exe -k LocalServicePeerNet,SERVICE_WIN32_SHARE_PROCESS,C:\Windows\System32\p2psvc.dll,true,true,The file is signed and the signature was verified.,Microsoft Windows,Microsoft Windows Verification PCA
WW367BFQ,NdisCap,NDIS Capture LightWeight Filter,NDIS Capture LightWeight Filter,C:\Windows\System32\drivers\ndiscap.sys,9fbfdb754815213e44ae838487f5d10a,system32\DRIVERS\ndiscap.sys,SERVICE_KERNEL_DRIVER,,true,true,The file is signed and the signature was verified.,Microsoft Windows,Microsoft Windows Verification PCA
WW367BFQ,RDPDR,Remote Desktop Device Redirector Driver,Remote Desktop Device Redirector Driver,C:\Windows\System32\drivers\rdpdr.sys,c0c71b3e637b684ef6591e7afc10cd63,System32\drivers\rdpdr.sys,SERVICE_KERNEL_DRIVER,,true,true,The file is signed and the signature was verified.,Microsoft Windows,Microsoft Windows Production PCA 2011
WW367BFQ,sffp_mmc,SFF Storage Protocol Driver for MMC,,C:\Windows\System32\drivers\sffp_mmc.sys,0527a2476b9309fd0b6dfd5eba4f6343,\SystemRoot\system32\drivers\sffp_mmc.sys,SERVICE_KERNEL_DRIVER,,true,true,The file is signed and the signature was verified.,Microsoft Windows,Microsoft Windows Verification PCA
WW367BFQ,WudfPf,User Mode Driver Frameworks Platform Driver,,C:\Windows\System32\drivers\WUDFPf.sys,781e63aa799b9198844f47ec54758a70,system32\drivers\WudfPf.sys,SERVICE_KERNEL_DRIVER,,true,true,The file is signed and the signature was verified.,Microsoft Windows,Microsoft Windows Verification PCA
WW367BFQ,RDPDR,Terminal Server Device Redirector Driver,,C:\Windows\System32\drivers\rdpdr.sys,99fa38b2a5a8a7428333d921ffda6036,System32\drivers\rdpdr.sys,SERVICE_KERNEL_DRIVER,,true,true,The file is signed and the signature was verified.,Microsoft Windows,Microsoft Windows Verification PCA
WW367BFQ,mpio,mpio,,C:\Windows\System32\drivers\mpio.sys,e4f2f865846d7083f9397ce661683067,\SystemRoot\system32\drivers\mpio.sys,SERVICE_KERNEL_DRIVER,,true,true,The file is signed and the signature was verified.,Microsoft Windows,Microsoft Windows Verification PCA
WW367BFQ,TapiSrv,Telephony,Provides Telephony API (TAPI) support for programs that control telephony devices on the local computer and  through the LAN  on servers that are also running the service.,C:\Windows\System32\svchost.exe,bb5e5748e7bcf3fefc70b960795a86e2,C:\Windows\System32\svchost.exe -k NetworkService,SERVICE_WIN32_SHARE_PROCESS,C:\Windows\System32\tapisrv.dll,true,true,The file is signed and the signature was verified.,Microsoft Windows,Microsoft Windows Verification PCA
WW367BFQ,NetTcpActivator,Net.Tcp Listener Adapter,Receives activation requests over the net.tcp protocol and passes them to the Windows Process Activation Service.,C:\Windows\Microsoft.NET\Framework64\v4.0.30319\SMSvcHost.exe,2d8efef32ead0815a0ae792d9fd5b4c3,C:\Windows\Microsoft.NET\Framework64\v4.0.30319\SMSvcHost.exe,SERVICE_WIN32_SHARE_PROCESS,,true,true,The file is signed and the signature was verified.,Microsoft Corporation,Microsoft Code Signing PCA
WW367BFQ,swenum,Software Bus Driver,,C:\Windows\System32\drivers\swenum.sys,68e410af38ad070e8585fe2089e2a2f2,system32\DRIVERS\swenum.sys,SERVICE_KERNEL_DRIVER,,true,true,The file is signed and the signature was verified.,Microsoft Windows,Microsoft Windows Verification PCA
WW367BFQ,idsvc,Windows CardSpace,Securely enables the creation  management  and disclosure of digital identities.,C:\Windows\Microsoft.NET\Framework64\v3.0\Windows Communication Foundation\infocard.exe,96f3f3049389ef051bc16c50f6679876,C:\Windows\Microsoft.NET\Framework64\v3.0\Windows Communication Foundation\infocard.exe,SERVICE_WIN32_SHARE_PROCESS,,true,true,The file is signed and the signature was verified.,Microsoft Windows,Microsoft Windows Verification PCA
WW367BFQ,HomeGroupListener,HomeGroup Listener,Makes local computer changes associated with configuration and maintenance of the homegroup-joined computer. If this service is stopped or disabled  your computer will not work properly in a homegroup and your homegroup might not work properly. It is recommended that you keep this service running.,C:\Windows\System32\svchost.exe,bb5e5748e7bcf3fefc70b960795a86e2,C:\Windows\System32\svchost.exe -k LocalSystemNetworkRestricted,SERVICE_WIN32_SHARE_PROCESS,C:\Windows\System32\ListSvc.dll,true,true,The file is signed and the signature was verified.,Microsoft Windows,Microsoft Windows Verification PCA
WW367BFQ,dmvsc,dmvsc,,C:\Windows\System32\drivers\dmvsc.sys,6cad119062c341eff92965cb4714639b,\SystemRoot\system32\drivers\dmvsc.sys,SERVICE_KERNEL_DRIVER,,true,true,The file is signed and the signature was verified.,Microsoft Windows,Microsoft Windows Verification PCA
WW367BFQ,AudioEndpointBuilder,Windows Audio Endpoint Builder,Manages audio devices for the Windows Audio service.  If this service is stopped  audio devices and effects will not function properly.  If this service is disabled  any services that explicitly depend on it will fail to start,C:\Windows\System32\svchost.exe,bb5e5748e7bcf3fefc70b960795a86e2,C:\Windows\System32\svchost.exe -k LocalSystemNetworkRestricted,SERVICE_WIN32_SHARE_PROCESS,C:\Windows\System32\audiosrv.dll,true,true,The file is signed and the signature was verified.,Microsoft Windows,Microsoft Windows Verification PCA
WW367BFQ,vmbus,vmbus,,C:\Windows\System32\drivers\vmbus.sys,1879c5ea582df18e8e0e7a0e2ee612f0,\SystemRoot\system32\drivers\vmbus.sys,SERVICE_KERNEL_DRIVER,,true,true,The file is signed and the signature was verified.,Microsoft Windows,Microsoft Windows Verification PCA
WW367BFQ,MpsSvc,Windows Firewall,Windows Firewall helps protect your computer by preventing unauthorized users from gaining access to your computer through the Internet or a network.,C:\Windows\System32\svchost.exe,bb5e5748e7bcf3fefc70b960795a86e2,C:\Windows\system32\svchost.exe -k LocalServiceNoNetwork,SERVICE_WIN32_SHARE_PROCESS,C:\Windows\System32\MPSSVC.dll,true,true,The file is signed and the signature was verified.,Microsoft Windows,Microsoft Windows Verification PCA
WW367BFQ,intelide,intelide,,C:\Windows\System32\drivers\intelide.sys,8230c1c569e83f9fa301612824fd3f83,\SystemRoot\system32\drivers\intelide.sys,SERVICE_KERNEL_DRIVER,,true,true,The file is signed and the signature was verified.,Microsoft Windows,Microsoft Windows Verification PCA
WW367BFQ,mfefirek,McAfee Inc. mfefirek,,C:\Windows\System32\drivers\mfefirek.sys,2ef8e31204493010668a5b157e8f19ba,system32\drivers\mfefirek.sys,SERVICE_KERNEL_DRIVER,,true,true,The file is signed and the signature was verified.,Microsoft Windows Hardware Compatibility Publisher,Microsoft Windows Hardware Compatibility PCA
WW367BFQ,TCPIP6,Microsoft IPv6 Protocol Driver,Microsoft IPv6 Protocol Driver,C:\Windows\System32\drivers\tcpip.sys,55194cfe8049b1140cba895b83231525,system32\DRIVERS\tcpip.sys,SERVICE_KERNEL_DRIVER,,true,true,The file is signed and the signature was verified.,Microsoft Windows,Microsoft Windows Verification PCA
WW367BFQ,aliide,aliide,,C:\Windows\System32\drivers\aliide.sys,3e5c6162cc92a30b435733b7a893b9d9,\SystemRoot\system32\drivers\aliide.sys,SERVICE_KERNEL_DRIVER,,true,true,The file is signed and the signature was verified.,Microsoft Windows,Microsoft Windows Verification PCA
WW367BFQ,lltdsvc,Link-Layer Topology Discovery Mapper,Creates a Network Map  consisting of PC and device topology (connectivity) information  and metadata describing each PC and device.  If this service is disabled  the Network Map will not function properly.,C:\Windows\System32\svchost.exe,bb5e5748e7bcf3fefc70b960795a86e2,C:\Windows\System32\svchost.exe -k LocalService,SERVICE_WIN32_SHARE_PROCESS,C:\Windows\System32\lltdsvc.dll,true,true,The file is signed and the signature was verified.,Microsoft Windows,Microsoft Windows Verification PCA
WW367BFQ,TDTCP,TDTCP,,C:\Windows\System32\drivers\tdtcp.sys,1b71a58dd14653098e75b9452355bdbf,system32\drivers\tdtcp.sys,SERVICE_KERNEL_DRIVER,,true,true,The file is signed and the signature was verified.,Microsoft Windows,Microsoft Windows Verification PCA
WW367BFQ,VSS,Volume Shadow Copy,Manages and implements Volume Shadow Copies used for backup and other purposes. If this service is stopped  shadow copies will be unavailable for backup and the backup may fail. If this service is disabled  any services that explicitly depend on it will fail to start.,C:\Windows\System32\VSSVC.exe,715fe9836b3766bc2c65491131edfd66,C:\Windows\system32\vssvc.exe,SERVICE_WIN32_OWN_PROCESS,,true,true,The file is signed and the signature was verified.,Microsoft Windows,Microsoft Windows Verification PCA
WW367BFQ,pcw,Performance Counters for Windows Driver,,C:\Windows\System32\drivers\pcw.sys,dc4f693695ad91fba421ee45ba572cfe,\SystemRoot\System32\drivers\pcw.sys,SERVICE_KERNEL_DRIVER,,true,true,The file is signed and the signature was verified.,Microsoft Windows,Microsoft Windows Verification PCA
