hostname,name,descriptivename,description,path,md5,arguments,type,servicedll,pathsignatureexists,pathsignatureverified,pathsignaturedescription,pathcertificatesubject,pathcertificateissuer
WW367BFQ,BTHMODEM,Bluetooth Serial Communications Driver,,C:\Windows\System32\drivers\bthmodem.sys,2ccfa02df90f5e7fe7a8d91473adf64b,\SystemRoot\system32\drivers\bthmodem.sys,SERVICE_KERNEL_DRIVER,,true,true,The file is signed and the signature was verified.,Microsoft Windows,Microsoft Windows Verification PCA
WW367BFQ,Appinfo,Application Information,Facilitates the running of interactive applications with additional administrative privileges.  If this service is stopped  users will be unable to launch applications with the additional administrative privileges they may require to perform desired user tasks.,C:\Windows\System32\svchost.exe,bb5e5748e7bcf3fefc70b960795a86e2,C:\Windows\system32\svchost.exe -k netsvcs,SERVICE_WIN32_SHARE_PROCESS,C:\Windows\System32\appinfo.dll,true,true,The file is signed and the signature was verified.,Microsoft Windows,Microsoft Windows Verification PCA
WW367BFQ,LanmanServer,Server,Supports file  print  and named-pipe sharing over the network for this computer. If this service is stopped  these functions will be unavailable. If this service is disabled  any services that explicitly depend on it will fail to start.,C:\Windows\System32\svchost.exe,bb5e5748e7bcf3fefc70b960795a86e2,C:\Windows\system32\svchost.exe -k netsvcs,SERVICE_WIN32_SHARE_PROCESS,C:\Windows\System32\srvsvc.dll,true,true,The file is signed and the signature was verified.,Microsoft Windows,Microsoft Windows Verification PCA
WW367BFQ,amdsbs,amdsbs,,C:\Windows\System32\drivers\amdsbs.sys,32319e58910df4edd8a32db5e55596ee,\SystemRoot\system32\drivers\amdsbs.sys,SERVICE_KERNEL_DRIVER,,true,true,The file is signed and the signature was verified.,Microsoft Windows,Microsoft Windows Verification PCA
WW367BFQ,CscService,Offline Files,The Offline Files service performs maintenance activities on the Offline Files cache  responds to user logon and logoff events  implements the internals of the public API  and dispatches interesting events to those interested in Offline Files activities and changes in cache state.,C:\Windows\System32\svchost.exe,bb5e5748e7bcf3fefc70b960795a86e2,C:\Windows\System32\svchost.exe -k LocalSystemNetworkRestricted,SERVICE_WIN32_SHARE_PROCESS,C:\Windows\System32\cscsvc.dll,true,true,The file is signed and the signature was verified.,Microsoft Windows,Microsoft Windows Verification PCA
WW367BFQ,rspndr,Link-Layer Topology Discovery Responder,,C:\Windows\System32\drivers\rspndr.sys,9d2627176cce49d5e223c029fbb1335b,system32\DRIVERS\rspndr.sys,SERVICE_KERNEL_DRIVER,,true,true,The file is signed and the signature was verified.,Microsoft Windows,Microsoft Windows Verification PCA
WW367BFQ,MegaSR,MegaSR,,C:\Windows\System32\drivers\MegaSR.sys,2c1ea86cb8f151c7ca80946da7b97bdd,\SystemRoot\system32\drivers\MegaSR.sys,SERVICE_KERNEL_DRIVER,,true,true,The file is signed and the signature was verified.,Microsoft Windows,Microsoft Windows Verification PCA
WW367BFQ,viaide,viaide,,C:\Windows\System32\drivers\viaide.sys,d0afd60d0ea62c9bf6399d97396b719f,\SystemRoot\system32\drivers\viaide.sys,SERVICE_KERNEL_DRIVER,,true,true,The file is signed and the signature was verified.,Microsoft Windows,Microsoft Windows Verification PCA
WW367BFQ,SNMPTRAP,SNMP Trap,Receives trap messages generated by local or remote Simple Network Management Protocol (SNMP) agents and forwards the messages to SNMP management programs running on this computer. If this service is stopped  SNMP-based programs on this computer will not receive SNMP trap messages. If this service is disabled  any services that explicitly depend on it will fail to start.,C:\Windows\System32\snmptrap.exe,e7df88f61ca5c37a48f41aef5eaf32e9,C:\Windows\System32\snmptrap.exe,SERVICE_WIN32_OWN_PROCESS,,true,true,The file is signed and the signature was verified.,Microsoft Windows,Microsoft Windows Verification PCA
WW367BFQ,RdpVideoMiniport,Remote Desktop Video Miniport Driver,,C:\Windows\System32\drivers\rdpvideominiport.sys,f11ce3233136d88efa3df2cfd9cd9b89,System32\drivers\rdpvideominiport.sys,SERVICE_KERNEL_DRIVER,,true,true,The file is signed and the signature was verified.,Microsoft Windows,Microsoft Windows Production PCA 2011
WW367BFQ,Modem,Modem,,C:\Windows\System32\drivers\modem.sys,444ee5b04ea9e08e8aa777e2285127f6,system32\drivers\modem.sys,SERVICE_KERNEL_DRIVER,,true,true,The file is signed and the signature was verified.,Microsoft Windows,Microsoft Windows Verification PCA
WW367BFQ,1394ohci,1394 OHCI Compliant Host Controller,,C:\Windows\System32\drivers\1394ohci.sys,d6101493c94c62c697fd5b5b8775500c,\SystemRoot\system32\drivers\1394ohci.sys,SERVICE_KERNEL_DRIVER,,true,true,The file is signed and the signature was verified.,Microsoft Windows,Microsoft Windows Verification PCA
WW367BFQ,BFE,Base Filtering Engine,The Base Filtering Engine (BFE) is a service that manages firewall and Internet Protocol security (IPsec) policies and implements user mode filtering. Stopping or disabling the BFE service will significantly reduce the security of the system. It will also result in unpredictable behavior in IPsec management and firewall applications.,C:\Windows\System32\svchost.exe,bb5e5748e7bcf3fefc70b960795a86e2,C:\Windows\system32\svchost.exe -k LocalServiceNoNetwork,SERVICE_WIN32_SHARE_PROCESS,C:\Windows\System32\BFE.DLL,true,true,The file is signed and the signature was verified.,Microsoft Windows,Microsoft Windows Verification PCA
WW367BFQ,PeerDistSvc,BranchCache,This service caches network content from peers on the local subnet.,C:\Windows\System32\svchost.exe,bb5e5748e7bcf3fefc70b960795a86e2,C:\Windows\System32\svchost.exe -k PeerDist,SERVICE_WIN32_SHARE_PROCESS,C:\Windows\System32\peerdistsvc.dll,true,true,The file is signed and the signature was verified.,Microsoft Windows,Microsoft Windows Verification PCA
WW367BFQ,BDESVC,BitLocker Drive Encryption Service,BDESVC hosts the BitLocker Drive Encryption service. BitLocker Drive Encryption provides secure startup for the operating system  as well as full volume encryption for OS  fixed or removable volumes. This service allows BitLocker to prompt users for various actions related to their volumes when mounted  and unlocks volumes automatically without user interaction. Additionally  it stores recovery information to Active Directory  if available  and  if necessary  ensures the most recent recovery certificates are used.  Stopping or disabling the service would prevent users from leveraging this functionality.,C:\Windows\System32\svchost.exe,bb5e5748e7bcf3fefc70b960795a86e2,C:\Windows\System32\svchost.exe -k netsvcs,SERVICE_WIN32_SHARE_PROCESS,C:\Windows\System32\bdesvc.dll,true,true,The file is signed and the signature was verified.,Microsoft Windows,Microsoft Windows Verification PCA
WW367BFQ,Wlansvc,WLAN AutoConfig,The WLANSVC service provides the logic required to configure  discover  connect to  and disconnect from a wireless local area network (WLAN) as defined by IEEE 802.11 standards. It also contains the logic to turn your computer into a software access point so that other devices or computers can connect to your computer wirelessly using a WLAN adapter that can support this. Stopping or disabling the WLANSVC service will make all WLAN adapters on your computer inaccessible from the Windows networking UI. It is strongly recommended that you have the WLANSVC service running if your computer has a WLAN adapter.,C:\Windows\System32\svchost.exe,bb5e5748e7bcf3fefc70b960795a86e2,C:\Windows\system32\svchost.exe -k LocalSystemNetworkRestricted,SERVICE_WIN32_SHARE_PROCESS,C:\Windows\System32\wlansvc.dll,true,true,The file is signed and the signature was verified.,Microsoft Windows,Microsoft Windows Verification PCA
WW367BFQ,Serial,Serial,,C:\Windows\System32\drivers\serial.sys,97ebbb8505122fa747392e3bc8ca1c8c,\SystemRoot\system32\drivers\serial.sys,SERVICE_KERNEL_DRIVER,,true,true,The file is signed and the signature was verified.,Microsoft Windows,Microsoft Windows Verification PCA
WW367BFQ,usbohci,Microsoft USB Open Host Controller Miniport Driver,,C:\Windows\System32\drivers\usbohci.sys,5df671a42c42ddbedd3a4daf6b1d6c1f,system32\DRIVERS\usbohci.sys,SERVICE_KERNEL_DRIVER,,true,true,The file is signed and the signature was verified.,Microsoft Windows,Microsoft Windows Verification PCA
WW367BFQ,nvraid,nvraid,,C:\Windows\System32\drivers\nvraid.sys,146e4a66b0b63abd5cac6130cca7f568,\SystemRoot\system32\drivers\nvraid.sys,SERVICE_KERNEL_DRIVER,,true,true,The file is signed and the signature was verified.,Microsoft Windows,Microsoft Windows Verification PCA
WW367BFQ,VgaSave,VgaSave,,C:\Windows\System32\drivers\vga.sys,6628e5253ce4377516b4146639fd241d,\SystemRoot\System32\drivers\vga.sys,SERVICE_KERNEL_DRIVER,,true,true,The file is signed and the signature was verified.,Microsoft Windows,Microsoft Windows Verification PCA
WW367BFQ,ClientAnalyticsService,ClientAnalyticsService,,C:\Program Files\Common Files\McAfee\ClientAnalytics\Legacy\McClientAnalytics.exe,97cd4dbb028d54e3edaec39335e988d0,"C:\Program Files\Common Files\McAfee\ClientAnalytics\Legacy\McClientAnalytics.exe""""""",SERVICE_WIN32_OWN_PROCESS,,true,true,The file is signed and the signature was verified.,"""McAfee",Symantec Class 3 SHA256 Code Signing CA
WW367BFQ,BrFiltLo,Brother USB Mass-Storage Lower Filter Driver,,C:\Windows\System32\drivers\BrFiltLo.sys,9214fc43319a845a88e9c4bd1595e300,\SystemRoot\system32\drivers\BrFiltLo.sys,SERVICE_KERNEL_DRIVER,,true,true,The file is signed and the signature was verified.,Microsoft Windows,Microsoft Windows Verification PCA
WW367BFQ,SCardSvr,Smart Card,Manages access to smart cards read by this computer. If this service is stopped  this computer will be unable to read smart cards. If this service is disabled  any services that explicitly depend on it will fail to start.,C:\Windows\System32\svchost.exe,bb5e5748e7bcf3fefc70b960795a86e2,C:\Windows\system32\svchost.exe -k LocalServiceAndNoImpersonation,SERVICE_WIN32_SHARE_PROCESS,C:\Windows\System32\SCardSvr.dll,true,true,The file is signed and the signature was verified.,Microsoft Windows,Microsoft Windows Verification PCA
WW367BFQ,fdc,Floppy Disk Controller Driver,,C:\Windows\System32\drivers\fdc.sys,d55bf47d2662f107f5e6b9152473ea1d,\SystemRoot\system32\drivers\fdc.sys,SERVICE_KERNEL_DRIVER,,true,true,The file is signed and the signature was verified.,Microsoft Windows,Microsoft Windows Verification PCA
WW367BFQ,WSearch,Windows Search,Provides content indexing  property caching  and search results for files  e-mail  and other content.,C:\Windows\System32\SearchIndexer.exe,6e91711a1658baf6b732a69a51b8d5de,C:\Windows\system32\SearchIndexer.exe /Embedding,SERVICE_WIN32_OWN_PROCESS,,true,true,The file is signed and the signature was verified.,Microsoft Windows,Microsoft Windows Verification PCA
WW367BFQ,ql40xx,ql40xx,,C:\Windows\System32\drivers\ql40xx.sys,9804a315e396c4e436b9ba544a74aa0c,\SystemRoot\system32\drivers\ql40xx.sys,SERVICE_KERNEL_DRIVER,,true,true,The file is signed and the signature was verified.,Microsoft Windows,Microsoft Windows Verification PCA
WW367BFQ,blbdrive,blbdrive,,C:\Windows\System32\drivers\blbdrive.sys,42bb56dca592af1905c3fcea532cbc02,system32\DRIVERS\blbdrive.sys,SERVICE_KERNEL_DRIVER,,true,true,The file is signed and the signature was verified.,Microsoft Windows,Microsoft Windows Verification PCA
WW367BFQ,clr_optimization_v4.0.30319_64,Microsoft .NET Framework NGEN v4.0.30319_X64,Microsoft .NET Framework NGEN,C:\Windows\Microsoft.NET\Framework64\v4.0.30319\mscorsvw.exe,f9162f4c80e318273edcf4b9f8648f3f,C:\Windows\Microsoft.NET\Framework64\v4.0.30319\mscorsvw.exe,SERVICE_WIN32_OWN_PROCESS,,true,true,The file is signed and the signature was verified.,Microsoft Corporation,Microsoft Code Signing PCA
WW367BFQ,HomeGroupProvider,HomeGroup Provider,Performs networking tasks associated with configuration and maintenance of homegroups. If this service is stopped or disabled  your computer will be unable to detect other homegroups and your homegroup might not work properly. It is recommended that you keep this service running.,C:\Windows\System32\svchost.exe,bb5e5748e7bcf3fefc70b960795a86e2,C:\Windows\System32\svchost.exe -k LocalServiceNetworkRestricted,SERVICE_WIN32_SHARE_PROCESS,C:\Windows\System32\provsvc.dll,true,true,The file is signed and the signature was verified.,Microsoft Windows,Microsoft Windows Verification PCA
WW367BFQ,pci,PCI Bus Driver,,C:\Windows\System32\drivers\pci.sys,96a164fbddb9609a03e5d6ac5e6e77a1,\SystemRoot\system32\drivers\pci.sys,SERVICE_KERNEL_DRIVER,,true,true,The file is signed and the signature was verified.,Microsoft Windows,Microsoft Windows Verification PCA
WW367BFQ,MSiSCSI,Microsoft iSCSI Initiator Service,Manages Internet SCSI (iSCSI) sessions from this computer to remote iSCSI target devices. If this service is stopped  this computer will not be able to login or access iSCSI targets. If this service is disabled  any services that explicitly depend on it will fail to start.,C:\Windows\System32\svchost.exe,bb5e5748e7bcf3fefc70b960795a86e2,C:\Windows\system32\svchost.exe -k netsvcs,SERVICE_WIN32_SHARE_PROCESS,C:\Windows\System32\iscsiexe.dll,true,true,The file is signed and the signature was verified.,Microsoft Windows,Microsoft Windows Verification PCA
WW367BFQ,WwanSvc,WWAN AutoConfig,This service manages mobile broadband (GSM &amp; CDMA) data card/embedded module adapters and connections by auto-configuring the networks. It is strongly recommended that this service be kept running for best user experience of mobile broadband devices.,C:\Windows\System32\svchost.exe,bb5e5748e7bcf3fefc70b960795a86e2,C:\Windows\system32\svchost.exe -k LocalServiceNoNetwork,SERVICE_WIN32_SHARE_PROCESS,C:\Windows\System32\wwansvc.dll,true,true,The file is signed and the signature was verified.,Microsoft Windows,Microsoft Windows Verification PCA
WW367BFQ,ehRecvr,Windows Media Center Receiver Service,Windows Media Center Service for TV and FM broadcast reception,C:\Windows\ehome\ehrecvr.exe,676aba3933d07766dc7abba754e1d14a,C:\Windows\ehome\ehRecvr.exe,SERVICE_WIN32_OWN_PROCESS,,true,true,The file is signed and the signature was verified.,Microsoft Windows,Microsoft Windows Verification PCA
WW367BFQ,drmkaud,Microsoft Trusted Audio Drivers,,C:\Windows\System32\drivers\drmkaud.sys,e01c2eee649e598f5f798709637ff054,system32\drivers\drmkaud.sys,SERVICE_KERNEL_DRIVER,,true,true,The file is signed and the signature was verified.,Microsoft Windows,Microsoft Windows Verification PCA
WW367BFQ,CSC,Offline Files Driver,Allows network files to be used while the local computer is offline.,C:\Windows\System32\drivers\csc.sys,3f216d44c944ff3ec895490517c84adf,system32\drivers\csc.sys,SERVICE_KERNEL_DRIVER,,true,true,The file is signed and the signature was verified.,Microsoft Windows,Microsoft Windows Verification PCA
WW367BFQ,stisvc,Windows Image Acquisition (WIA),Provides image acquisition services for scanners and cameras,C:\Windows\System32\svchost.exe,bb5e5748e7bcf3fefc70b960795a86e2,C:\Windows\system32\svchost.exe -k imgsvc,SERVICE_WIN32_OWN_PROCESS,C:\Windows\System32\wiaservc.dll,true,true,The file is signed and the signature was verified.,Microsoft Windows,Microsoft Windows Verification PCA
WW367BFQ,WcsPlugInService,Windows Color System,The WcsPlugInService service hosts third-party Windows Color System color device model and gamut map model plug-in modules. These plug-in modules are vendor-specific extensions to the Windows Color System baseline color device and gamut map models. Stopping or disabling the WcsPlugInService service will disable this extensibility feature  and the Windows Color System will use its baseline model processing rather than the vendor's desired processing. This might result in inaccurate color rendering.,C:\Windows\System32\svchost.exe,bb5e5748e7bcf3fefc70b960795a86e2,C:\Windows\system32\svchost.exe -k wcssvc,SERVICE_WIN32_SHARE_PROCESS,C:\Windows\System32\WcsPlugInService.dll,true,true,The file is signed and the signature was verified.,Microsoft Windows,Microsoft Windows Verification PCA
WW367BFQ,Ndisuio,NDIS Usermode I/O Protocol,,C:\Windows\System32\drivers\ndisuio.sys,fa3486b9892a4e1ef4e53e5dbef0fb2d,system32\DRIVERS\ndisuio.sys,SERVICE_KERNEL_DRIVER,,true,true,The file is signed and the signature was verified.,Microsoft Windows,Microsoft Windows Verification PCA
WW367BFQ,SensrSvc,Adaptive Brightness,Monitors ambient light sensors to detect changes in ambient light and adjust the display brightness.  If this service is stopped or disabled  the display brightness will not adapt to lighting conditions.,C:\Windows\System32\svchost.exe,bb5e5748e7bcf3fefc70b960795a86e2,C:\Windows\system32\svchost.exe -k LocalServiceAndNoImpersonation,SERVICE_WIN32_SHARE_PROCESS,C:\Windows\System32\sensrsvc.dll,true,true,The file is signed and the signature was verified.,Microsoft Windows,Microsoft Windows Verification PCA
WW367BFQ,fdPHost,Function Discovery Provider Host,The FDPHOST service hosts the Function Discovery (FD) network discovery providers. These FD providers supply network discovery services for the Simple Services Discovery Protocol (SSDP) and Web Services  Discovery (WS-D) protocol. Stopping or disabling the FDPHOST service will disable network discovery for these protocols when using FD. When this service is unavailable  network services using FD and relying on these discovery protocols will be unable to find network devices or resources.,C:\Windows\System32\svchost.exe,bb5e5748e7bcf3fefc70b960795a86e2,C:\Windows\system32\svchost.exe -k LocalService,SERVICE_WIN32_SHARE_PROCESS,C:\Windows\System32\fdPHost.dll,true,true,The file is signed and the signature was verified.,Microsoft Windows,Microsoft Windows Verification PCA
WW367BFQ,PptpMiniport,WAN Miniport (PPTP),WAN Miniport (PPTP),C:\Windows\System32\drivers\raspptp.sys,9418abc6d9f90c7590f5df28447184f9,system32\DRIVERS\raspptp.sys,SERVICE_KERNEL_DRIVER,,true,true,The file is signed and the signature was verified.,Microsoft Windows,Microsoft Windows Verification PCA
WW367BFQ,wmiApSrv,WMI Performance Adapter,Provides performance library information from Windows Management Instrumentation (WMI) providers to clients on the network. This service only runs when Performance Data Helper is activated.,C:\Windows\System32\wbem\WmiApSrv.exe,ba47c47a84561890c4ef58b117190859,C:\Windows\system32\wbem\WmiApSrv.exe,SERVICE_WIN32_OWN_PROCESS,,true,true,The file is signed and the signature was verified.,Microsoft Windows,Microsoft Windows Verification PCA
WW367BFQ,0062601541359992mcinstcleanup,McAfee Application Installer Cleanup (0062601541359992),,C:\Users\$user\AppData\Local\Temp\0062601541359992mcinst.exe,6c5d2eddd5ffd62b9502298c37dd9f25,C:\Users\$user\AppData\Local\Temp\006260~1.EXE -cleanup -nolog,SERVICE_WIN32_OWN_PROCESS,,true,true,The file is signed and the signature was verified.,"McAfee""",VeriSign Class 3 Code Signing 2010 CA
WW367BFQ,RasSstp,WAN Miniport (SSTP),WAN Miniport (SSTP),C:\Windows\System32\drivers\rassstp.sys,b7ff2d82d464edcbac42d781f6450e64,system32\DRIVERS\rassstp.sys,SERVICE_KERNEL_DRIVER,,true,true,The file is signed and the signature was verified.,Microsoft Windows,Microsoft Windows Verification PCA
WW367BFQ,crcdisk,Crcdisk Filter Driver,,C:\Windows\System32\drivers\crcdisk.sys,53e4988fe67926714120a582c1e6da9d,\SystemRoot\system32\drivers\crcdisk.sys,SERVICE_KERNEL_DRIVER,,true,true,The file is signed and the signature was verified.,Microsoft Windows,Microsoft Windows Verification PCA
WW367BFQ,W3LOGSVC,W3C Logging Service,Provides W3C logging for Internet Information Services (IIS). If this service is stopped  W3C logging configured by IIS will not work.,C:\Windows\System32\svchost.exe,bb5e5748e7bcf3fefc70b960795a86e2,C:\WINDOWS\system32\svchost.exe -k apphost,SERVICE_WIN32_SHARE_PROCESS,C:\Windows\System32\inetsrv\w3logsvc.dll,true,true,The file is signed and the signature was verified.,Microsoft Windows,Microsoft Windows Production PCA 2011
WW367BFQ,SiSRaid2,SiSRaid2,,C:\Windows\System32\drivers\sisraid2.sys,11018e53206b019e0f165f09a1324759,\SystemRoot\system32\drivers\SiSRaid2.sys,SERVICE_KERNEL_DRIVER,,true,true,The file is signed and the signature was verified.,Microsoft Windows,Microsoft Windows Verification PCA
WW367BFQ,FontCache3.0.0.0,Windows Presentation Foundation Font Cache 3.0.0.0,Optimizes performance of Windows Presentation Foundation (WPF) applications by caching commonly used font data. WPF applications will start this service if it is not already running. It can be disabled  though doing so will degrade the performance of WPF applications.,C:\Windows\Microsoft.Net\Framework64\v3.0\WPF\PresentationFontCache.exe,9f6d8cb9ee41397bb81e456252ffc304,C:\Windows\Microsoft.Net\Framework64\v3.0\WPF\PresentationFontCache.exe,SERVICE_WIN32_OWN_PROCESS,,true,true,The file is signed and the signature was verified.,Microsoft Windows,Microsoft Windows Verification PCA
WW367BFQ,WmiAcpi,Microsoft Windows Management Interface for ACPI,,C:\Windows\System32\drivers\wmiacpi.sys,d15f34aee01f1eefa5e176bf1c77c647,\SystemRoot\system32\drivers\wmiacpi.sys,SERVICE_KERNEL_DRIVER,,true,true,The file is signed and the signature was verified.,Microsoft Windows,Microsoft Windows Verification PCA
WW367BFQ,IRENUM,IR Bus Enumerator,IR Bus Enumerator,C:\Windows\System32\drivers\irenum.sys,94fc503457bde6dc5b959f03fc42a2db,system32\drivers\irenum.sys,SERVICE_KERNEL_DRIVER,,true,true,The file is signed and the signature was verified.,Microsoft Windows,Microsoft Windows Verification PCA
WW367BFQ,Synth3dVsc,Synth3dVsc,,C:\Windows\System32\drivers\synth3dvsc.sys,ce28ccc93c3dd01f8e5b60c55d3035de,System32\drivers\synth3dvsc.sys,SERVICE_KERNEL_DRIVER,,true,true,The file is signed and the signature was verified.,Microsoft Windows,Microsoft Windows Verification PCA
WW367BFQ,MRxDAV,WebDav Client Redirector Driver,Network Redirector that provides WebDAV file access for the WebClient service,C:\Windows\System32\drivers\mrxdav.sys,d1acafff03e953daca471e5ec8e9344c,\SystemRoot\system32\drivers\mrxdav.sys,SERVICE_FILE_SYSTEM_DRIVER,,true,true,The file is signed and the signature was verified.,Microsoft Windows,Microsoft Windows Verification PCA
WW367BFQ,mshidkmdf,Pass-through HID to KMDF Filter Driver,Device Filter to provide pass-through interface between HIDCLASS and KMDF,C:\Windows\System32\drivers\mshidkmdf.sys,29a9589a246294470cde1456d9ee8582,\SystemRoot\System32\drivers\mshidkmdf.sys,SERVICE_KERNEL_DRIVER,,true,true,The file is signed and the signature was verified.,Microsoft Windows,Microsoft Windows Verification PCA
WW367BFQ,usbuhci,Microsoft USB Universal Host Controller Miniport Driver,,C:\Windows\System32\drivers\usbuhci.sys,1fb84236583a5864529816d160084a06,\SystemRoot\system32\drivers\usbuhci.sys,SERVICE_KERNEL_DRIVER,,true,true,The file is signed and the signature was verified.,Microsoft Windows,Microsoft Windows Verification PCA
WW367BFQ,dot3svc,Wired AutoConfig,The Wired AutoConfig (DOT3SVC) service is responsible for performing IEEE 802.1X authentication on Ethernet interfaces. If your current wired network deployment enforces 802.1X authentication  the DOT3SVC service should be configured to run for establishing Layer 2 connectivity and/or providing access to network resources. Wired networks that do not enforce 802.1X authentication are unaffected by the DOT3SVC service.,C:\Windows\System32\svchost.exe,bb5e5748e7bcf3fefc70b960795a86e2,C:\Windows\system32\svchost.exe -k LocalSystemNetworkRestricted,SERVICE_WIN32_SHARE_PROCESS,C:\Windows\System32\dot3svc.dll,true,true,The file is signed and the signature was verified.,Microsoft Windows,Microsoft Windows Verification PCA
WW367BFQ,usbcir,eHome Infrared Receiver (USBCIR),,C:\Windows\System32\drivers\usbcir.sys,8b8ea4e364e8d0c132bf6e42ccbcdc31,\SystemRoot\system32\drivers\usbcir.sys,SERVICE_KERNEL_DRIVER,,true,true,The file is signed and the signature was verified.,Microsoft Windows,Microsoft Windows Verification PCA
WW367BFQ,IPMIDRV,IPMIDRV,,C:\Windows\System32\drivers\IPMIDrv.sys,9aad41037b1c9b98da5bddb9b214565c,\SystemRoot\system32\drivers\IPMIDrv.sys,SERVICE_KERNEL_DRIVER,,true,true,The file is signed and the signature was verified.,Microsoft Windows,Microsoft Windows Verification PCA
WW367BFQ,Netman,Network Connections,Manages objects in the Network and Dial-Up Connections folder  in which you can view both local area network and remote connections.,C:\Windows\System32\svchost.exe,bb5e5748e7bcf3fefc70b960795a86e2,C:\Windows\System32\svchost.exe -k LocalSystemNetworkRestricted,SERVICE_WIN32_SHARE_PROCESS,C:\Windows\System32\netman.dll,true,true,The file is signed and the signature was verified.,Microsoft Windows,Microsoft Windows Verification PCA
WW367BFQ,IKEEXT,IKE and AuthIP IPsec Keying Modules,The IKEEXT service hosts the Internet Key Exchange (IKE) and Authenticated Internet Protocol (AuthIP) keying modules. These keying modules are used for authentication and key exchange in Internet Protocol security (IPsec). Stopping or disabling the IKEEXT service will disable IKE and AuthIP key exchange with peer computers. IPsec is typically configured to use IKE or AuthIP; therefore  stopping or disabling the IKEEXT service might result in an IPsec failure and might compromise the security of the system. It is strongly recommended that you have the IKEEXT service running.,C:\Windows\System32\svchost.exe,bb5e5748e7bcf3fefc70b960795a86e2,C:\Windows\system32\svchost.exe -k netsvcs,SERVICE_WIN32_SHARE_PROCESS,C:\Windows\System32\IKEEXT.DLL,true,true,The file is signed and the signature was verified.,Microsoft Windows,Microsoft Windows Verification PCA
WW367BFQ,E1G60,Intel(R) PRO/1000 NDIS 6 Adapter Driver,,C:\Windows\System32\drivers\E1G6032E.sys,7242d5fcb9f3620911b046e6e3089c18,system32\DRIVERS\E1G6032E.sys,SERVICE_KERNEL_DRIVER,,true,true,The file is signed and the signature was verified.,Microsoft Windows,Microsoft Windows Verification PCA
