hostname,name,descriptivename,description,path,md5,arguments,type,servicedll,pathsignatureexists,pathsignatureverified,pathsignaturedescription,pathcertificatesubject,pathcertificateissuer
WW367BFQ,Fax,Fax,Enables you to send and receive faxes  utilizing fax resources available on this computer or on the network.,C:\Windows\System32\FXSSVC.exe,c7493520ff6f1028299c787a0699fa38,C:\Windows\system32\fxssvc.exe,SERVICE_WIN32_OWN_PROCESS,,true,true,The file is signed and the signature was verified.,Microsoft Windows,Microsoft Windows Verification PCA
WW367BFQ,RemoteRegistry,Remote Registry,Enables remote users to modify registry settings on this computer. If this service is stopped  the registry can be modified only by users on this computer. If this service is disabled  any services that explicitly depend on it will fail to start.,C:\Windows\System32\svchost.exe,bb5e5748e7bcf3fefc70b960795a86e2,C:\Windows\system32\svchost.exe -k regsvc,SERVICE_WIN32_SHARE_PROCESS,C:\Windows\System32\regsvc.dll,true,true,The file is signed and the signature was verified.,Microsoft Windows,Microsoft Windows Verification PCA
WW367BFQ,UmPass,Microsoft UMPass Driver,,C:\Windows\System32\drivers\umpass.sys,b99de97e3deecd3495eefcd686d42909,\SystemRoot\system32\drivers\umpass.sys,SERVICE_KERNEL_DRIVER,,true,true,The file is signed and the signature was verified.,Microsoft Windows,Microsoft Windows Verification PCA
WW367BFQ,adpu320,adpu320,,C:\Windows\System32\drivers\adpu320.sys,97de582e63d88f3bc38c16814d7b8b0e,\SystemRoot\system32\drivers\adpu320.sys,SERVICE_KERNEL_DRIVER,,true,true,The file is signed and the signature was verified.,Microsoft Windows,Microsoft Windows Verification PCA
WW367BFQ,cmdide,cmdide,,C:\Windows\System32\drivers\cmdide.sys,bbf35abfec621d3ac3d9a1268b77dc3b,\SystemRoot\system32\drivers\cmdide.sys,SERVICE_KERNEL_DRIVER,,true,true,The file is signed and the signature was verified.,Microsoft Windows,Microsoft Windows Verification PCA
WW367BFQ,AsyncMac,RAS Asynchronous Media Driver,RAS Asynchronous Media Driver,C:\Windows\System32\drivers\asyncmac.sys,21240444605c39e4a0d555d5166a24c0,system32\DRIVERS\asyncmac.sys,SERVICE_KERNEL_DRIVER,,true,true,The file is signed and the signature was verified.,Microsoft Windows,Microsoft Windows Verification PCA
WW367BFQ,circlass,Consumer IR Devices,,C:\Windows\System32\drivers\circlass.sys,0e61df73bef522e05b683e19ccc7edff,\SystemRoot\system32\drivers\circlass.sys,SERVICE_KERNEL_DRIVER,,true,true,The file is signed and the signature was verified.,Microsoft Windows,Microsoft Windows Verification PCA
WW367BFQ,ProtectedStorage,Protected Storage,Provides protected storage for sensitive data  such as passwords  to prevent access by unauthorized services  processes  or users.,C:\Windows\System32\lsass.exe,18d5953fc74657ca3fb77fd92e0ac30b,C:\Windows\system32\lsass.exe,SERVICE_WIN32_SHARE_PROCESS,,true,true,The file is signed and the signature was verified.,Microsoft Windows,Microsoft Windows Verification PCA
WW367BFQ,NetPipeActivator,Net.Pipe Listener Adapter,Receives activation requests over the net.pipe protocol and passes them to the Windows Process Activation Service.,C:\Windows\Microsoft.NET\Framework64\v4.0.30319\SMSvcHost.exe,2d8efef32ead0815a0ae792d9fd5b4c3,C:\Windows\Microsoft.NET\Framework64\v4.0.30319\SMSvcHost.exe,SERVICE_WIN32_SHARE_PROCESS,,true,true,The file is signed and the signature was verified.,Microsoft Corporation,Microsoft Code Signing PCA
WW367BFQ,mfewfpk,McAfee Inc. mfewfpk,,C:\Windows\System32\drivers\mfewfpk.sys,3aaca15db94eb9c9e166d9d402df5f9f,\SystemRoot\system32\drivers\mfewfpk.sys,SERVICE_KERNEL_DRIVER,,true,true,The file is signed and the signature was verified.,Microsoft Windows Hardware Compatibility Publisher,Microsoft Windows Hardware Compatibility PCA
WW367BFQ,arc,arc,,C:\Windows\System32\drivers\arc.sys,fd8aa195c7dcedd556ccd170e443bc34,\SystemRoot\system32\drivers\arc.sys,SERVICE_KERNEL_DRIVER,,true,true,The file is signed and the signature was verified.,Microsoft Windows,Microsoft Windows Verification PCA
WW367BFQ,EFS,Encrypting File System (EFS),Provides the core file encryption technology used to store encrypted files on NTFS file system volumes. If this service is stopped or disabled  applications will be unable to access encrypted files.,C:\Windows\System32\lsass.exe,18d5953fc74657ca3fb77fd92e0ac30b,C:\Windows\System32\lsass.exe,SERVICE_WIN32_SHARE_PROCESS,,true,true,The file is signed and the signature was verified.,Microsoft Windows,Microsoft Windows Verification PCA
WW367BFQ,gagp30kx,Microsoft Generic AGPv3.0 Filter for K8 Processor Platforms,,C:\Windows\System32\drivers\GAGP30KX.SYS,b800b31b8fbae0d1512bc67ca863ef72,\SystemRoot\system32\drivers\gagp30kx.sys,SERVICE_KERNEL_DRIVER,,true,true,The file is signed and the signature was verified.,Microsoft Windows,Microsoft Windows Verification PCA
WW367BFQ,VBoxService,VirtualBox Guest Additions Service,Manages VM runtime information  time synchronization  remote sysprep execution and miscellaneous utilities for guest operating systems.,C:\Windows\System32\VBoxService.exe,efd086c5e128309b6d2055a19726a299,C:\Windows\System32\VBoxService.exe,SERVICE_WIN32_OWN_PROCESS,,true,true,The file is signed and the signature was verified.,Oracle Corporation,VeriSign Class 3 Code Signing 2010 CA
WW367BFQ,mfevtp,McAfee Validation Trust Protection Service,Provides validation trust protection services,C:\Windows\System32\mfevtps.exe,942a3a48d5d20a6f5f7178fec61046f6,"C:\WINDOWS\system32\mfevtps.exe""""""",SERVICE_WIN32_OWN_PROCESS,,true,true,The file is signed and the signature was verified.,"""McAfee",VeriSign Class 3 Code Signing 2010 CA
WW367BFQ,USBSTOR,USB Mass Storage Driver,,C:\Windows\System32\drivers\USBSTOR.SYS,1f0f2493ed621bb50c14b5ee1742e92b,\SystemRoot\system32\drivers\USBSTOR.SYS,SERVICE_KERNEL_DRIVER,,true,true,The file is signed and the signature was verified.,Microsoft Windows,Microsoft Windows Verification PCA
WW367BFQ,NetMsmqActivator,Net.Msmq Listener Adapter,Receives activation requests over the net.msmq and msmq.formatname protocols and passes them to the Windows Process Activation Service.,C:\Windows\Microsoft.NET\Framework64\v4.0.30319\SMSvcHost.exe,2d8efef32ead0815a0ae792d9fd5b4c3,C:\Windows\Microsoft.NET\Framework64\v4.0.30319\SMSvcHost.exe -NetMsmqActivator,SERVICE_WIN32_SHARE_PROCESS,,true,true,The file is signed and the signature was verified.,Microsoft Corporation,Microsoft Code Signing PCA
WW367BFQ,mfencrk,McAfee LLC. mfencrk,McAfee Content driver Copyright (C) McAfee LLC  2018. All rights reserved.,C:\Windows\System32\drivers\mfencrk.sys,0b89e8a910b261f1d37c0ad7026fc18a,system32\DRIVERS\mfencrk.sys,SERVICE_KERNEL_DRIVER,,true,true,The file is signed and the signature was verified.,Microsoft Windows Hardware Compatibility Publisher,Microsoft Windows Hardware Compatibility PCA
WW367BFQ,NetBT,NetBT,This service implements NetBios over TCP/IP.,C:\Windows\System32\drivers\netbt.sys,1cde51780196b8ef4209c0e0c316c7b8,System32\DRIVERS\netbt.sys,SERVICE_KERNEL_DRIVER,,true,true,The file is signed and the signature was verified.,Microsoft Windows,Microsoft Windows Verification PCA
WW367BFQ,WPCSvc,Parental Controls,This service is a stub for Windows Parental Control functionality that existed in Vista. It is provided for backward compatibility only.,C:\Windows\System32\svchost.exe,bb5e5748e7bcf3fefc70b960795a86e2,C:\Windows\system32\svchost.exe -k LocalServiceNetworkRestricted,SERVICE_WIN32_SHARE_PROCESS,C:\Windows\System32\wpcsvc.dll,true,true,The file is signed and the signature was verified.,Microsoft Windows,Microsoft Windows Verification PCA
WW367BFQ,nfrd960,nfrd960,,C:\Windows\System32\drivers\nfrd960.sys,50a6fedf6212d20ba608d49177e40da4,\SystemRoot\system32\drivers\nfrd960.sys,SERVICE_KERNEL_DRIVER,,true,true,The file is signed and the signature was verified.,Microsoft Windows,Microsoft Windows Verification PCA
WW367BFQ,WbioSrvc,Windows Biometric Service,The Windows biometric service gives client applications the ability to capture  compare  manipulate  and store biometric data without gaining direct access to any biometric hardware or samples. The service is hosted in a privileged SVCHOST process.,C:\Windows\System32\svchost.exe,bb5e5748e7bcf3fefc70b960795a86e2,C:\Windows\system32\svchost.exe -k WbioSvcGroup,SERVICE_WIN32_SHARE_PROCESS,C:\Windows\System32\wbiosrvc.dll,true,true,The file is signed and the signature was verified.,Microsoft Windows,Microsoft Windows Verification PCA
WW367BFQ,WinRM,Windows Remote Management (WS-Management),Windows Remote Management (WinRM) service implements the WS-Management protocol for remote management. WS-Management is a standard web services protocol used for remote software and hardware management. The WinRM service listens on the network for WS-Management requests and processes them. The WinRM Service needs to be configured with a listener using winrm.cmd command line tool or through Group Policy in order for it to listen over the network. The WinRM service provides access to WMI data and enables event collection. Event collection and subscription to events require that the service is running. WinRM messages use HTTP and HTTPS as transports. The WinRM service does not depend on IIS but is preconfigured to share a port with IIS on the same machine.  The WinRM service reserves the /wsman URL prefix. To prevent conflicts with IIS  administrators should ensure that any websites hosted on IIS do not use the /wsman URL prefix.,C:\Windows\System32\svchost.exe,bb5e5748e7bcf3fefc70b960795a86e2,C:\Windows\System32\svchost.exe -k NetworkService,SERVICE_WIN32_SHARE_PROCESS,C:\Windows\System32\WsmSvc.dll,true,true,The file is signed and the signature was verified.,Microsoft Windows,Microsoft Windows Verification PCA
WW367BFQ,mccspsvc,McAfee CSP Service,McAfee Cloud Platform Service,C:\Program Files\Common Files\McAfee\CSP\3.0.127.0\\McCSPServiceHost.exe,d289f3e441933c45a0ca8de5c4d22bd2,"C:\Program Files\Common Files\McAfee\CSP\3.0.127.0\\McCSPServiceHost.exe""""""",SERVICE_WIN32_OWN_PROCESS,,true,true,The file is signed and the signature was verified.,"""McAfee",Symantec Class 3 SHA256 Code Signing CA
WW367BFQ,MSPQM,Microsoft Streaming Quality Manager Proxy,,C:\Windows\System32\drivers\mspqm.sys,bee9df4c01ef16a77868cc1e71df6c37,system32\drivers\MSPQM.sys,SERVICE_KERNEL_DRIVER,,true,true,The file is signed and the signature was verified.,Microsoft Windows,Microsoft Windows Verification PCA
WW367BFQ,CertPropSvc,Certificate Propagation,Copies user certificates and root certificates from smart cards into the current user's certificate store  detects when a smart card is inserted into a smart card reader  and  if needed  installs the smart card Plug and Play minidriver.,C:\Windows\System32\svchost.exe,bb5e5748e7bcf3fefc70b960795a86e2,C:\Windows\system32\svchost.exe -k netsvcs,SERVICE_WIN32_SHARE_PROCESS,C:\Windows\System32\certprop.dll,true,true,The file is signed and the signature was verified.,Microsoft Windows,Microsoft Windows Verification PCA
WW367BFQ,mfehidk,McAfee Inc. mfehidk,,C:\Windows\System32\drivers\mfehidk.sys,d20fd935764d75df09e1a286cdee82be,\SystemRoot\system32\drivers\mfehidk.sys,SERVICE_KERNEL_DRIVER,,true,true,The file is signed and the signature was verified.,Microsoft Windows Hardware Compatibility Publisher,Microsoft Windows Hardware Compatibility PCA
WW367BFQ,KtmRm,KtmRm for Distributed Transaction Coordinator,Coordinates transactions between the Distributed Transaction Coordinator (MSDTC) and the Kernel Transaction Manager (KTM). If it is not needed  it is recommended that this service remain stopped. If it is needed  both MSDTC and KTM will start this service automatically. If this service is disabled  any MSDTC transaction interacting with a Kernel Resource Manager will fail and any services that explicitly depend on it will fail to start.,C:\Windows\System32\svchost.exe,bb5e5748e7bcf3fefc70b960795a86e2,C:\Windows\System32\svchost.exe -k NetworkServiceAndNoImpersonation,SERVICE_WIN32_SHARE_PROCESS,C:\Windows\System32\msdtckrm.dll,true,true,The file is signed and the signature was verified.,Microsoft Windows,Microsoft Windows Verification PCA
WW367BFQ,tssecsrv,Remote Desktop Services Security Filter Driver,Remote Desktop Services Security Filter Driver,C:\Windows\System32\drivers\tssecsrv.sys,931929423afe4910c35489c58b06999f,System32\DRIVERS\tssecsrv.sys,SERVICE_KERNEL_DRIVER,,true,true,The file is signed and the signature was verified.,Microsoft Windows,Microsoft Windows Verification PCA
WW367BFQ,srvnet,srvnet,,C:\Windows\System32\drivers\srvnet.sys,b0dca4653cfeaff11d69941629c9bfb4,System32\DRIVERS\srvnet.sys,SERVICE_FILE_SYSTEM_DRIVER,,true,true,The file is signed and the signature was verified.,Microsoft Windows,Microsoft Windows Verification PCA
WW367BFQ,fvevol,Bitlocker Drive Encryption Filter Driver,Bitlocker Drive Encryption Filter Driver,C:\Windows\System32\drivers\fvevol.sys,ed78411827baa7a301c7206d610cc931,\SystemRoot\System32\DRIVERS\fvevol.sys,SERVICE_KERNEL_DRIVER,,true,true,The file is signed and the signature was verified.,Microsoft Windows,Microsoft Windows Verification PCA
WW367BFQ,storflt,Disk Virtual Machine Bus Acceleration Filter Driver,,C:\Windows\System32\drivers\vmstorfl.sys,6568b5a8a5634fe769876059d68c2838,\SystemRoot\system32\drivers\vmstorfl.sys,SERVICE_KERNEL_DRIVER,,true,true,The file is signed and the signature was verified.,Microsoft Windows,Microsoft Windows Verification PCA
WW367BFQ,pciide,pciide,,C:\Windows\System32\drivers\pciide.sys,036ba4b565262f1adbde9a92186adbd4,\SystemRoot\system32\drivers\pciide.sys,SERVICE_KERNEL_DRIVER,,true,true,The file is signed and the signature was verified.,Microsoft Windows,Microsoft Windows Verification PCA
WW367BFQ,IpFilterDriver,IP Traffic Filter Driver,IP Traffic Filter Driver,C:\Windows\System32\drivers\ipfltdrv.sys,41a33dd3822239b76cdf1cc160d41993,system32\DRIVERS\ipfltdrv.sys,SERVICE_KERNEL_DRIVER,,true,true,The file is signed and the signature was verified.,Microsoft Windows,Microsoft Windows Verification PCA
WW367BFQ,isapnp,isapnp,,C:\Windows\System32\drivers\isapnp.sys,c2e251d642dad0ebee06076335e6ebfb,\SystemRoot\system32\drivers\isapnp.sys,SERVICE_KERNEL_DRIVER,,true,true,The file is signed and the signature was verified.,Microsoft Windows,Microsoft Windows Verification PCA
WW367BFQ,Wd,Wd,,C:\Windows\System32\drivers\wd.sys,1a4176e83c44924ee1a7b005b8d2b2a9,\SystemRoot\system32\drivers\wd.sys,SERVICE_KERNEL_DRIVER,,true,true,The file is signed and the signature was verified.,Microsoft Windows,Microsoft Windows Verification PCA
WW367BFQ,RasAuto,Remote Access Auto Connection Manager,Creates a connection to a remote network whenever a program references a remote DNS or NetBIOS name or address.,C:\Windows\System32\svchost.exe,bb5e5748e7bcf3fefc70b960795a86e2,C:\Windows\System32\svchost.exe -k netsvcs,SERVICE_WIN32_SHARE_PROCESS,C:\Windows\System32\rasauto.dll,true,true,The file is signed and the signature was verified.,Microsoft Windows,Microsoft Windows Verification PCA
WW367BFQ,uagp35,Microsoft AGPv3.5 Filter,,C:\Windows\System32\drivers\UAGP35.SYS,a2503138f027f59e4a87447c6400f28c,\SystemRoot\system32\drivers\uagp35.sys,SERVICE_KERNEL_DRIVER,,true,true,The file is signed and the signature was verified.,Microsoft Windows,Microsoft Windows Verification PCA
WW367BFQ,LSI_SAS,LSI_SAS,,C:\Windows\System32\drivers\lsi_sas.sys,f7a3794f89e0898e6c72dc0965b82baa,\SystemRoot\system32\drivers\lsi_sas.sys,SERVICE_KERNEL_DRIVER,,true,true,The file is signed and the signature was verified.,Microsoft Windows,Microsoft Windows Verification PCA
WW367BFQ,WMPNetworkSvc,Windows Media Player Network Sharing Service,Shares Windows Media Player libraries to other networked players and media devices using Universal Plug and Play,C:\Program Files\Windows Media Player\wmpnetwk.exe,e9a22d8431c99e7456a3ecbcc7f1bb3d,C:\Program Files\Windows Media Player\wmpnetwk.exe,SERVICE_WIN32_OWN_PROCESS,,true,true,The file is signed and the signature was verified.,Microsoft Windows,Microsoft Windows Verification PCA
WW367BFQ,sfloppy,High-Capacity Floppy Disk Drive,,C:\Windows\System32\drivers\sfloppy.sys,32367d075adeed5aef6a703b6f7f8c19,\SystemRoot\system32\drivers\sfloppy.sys,SERVICE_KERNEL_DRIVER,,true,true,The file is signed and the signature was verified.,Microsoft Windows,Microsoft Windows Verification PCA
WW367BFQ,arcsas,arcsas,,C:\Windows\System32\drivers\arcsas.sys,254bb43db22a3f8394a751825e1af594,\SystemRoot\system32\drivers\arcsas.sys,SERVICE_KERNEL_DRIVER,,true,true,The file is signed and the signature was verified.,Microsoft Windows,Microsoft Windows Verification PCA
WW367BFQ,WfpLwf,WFP Lightweight Filter,WFP Lightweight Filter,C:\Windows\System32\drivers\wfplwf.sys,3e857cfb2759549b025adf8e3ca49e8b,system32\DRIVERS\wfplwf.sys,SERVICE_KERNEL_DRIVER,,true,true,The file is signed and the signature was verified.,Microsoft Windows,Microsoft Windows Verification PCA
WW367BFQ,sppsvc,Software Protection,Enables the download  installation and enforcement of digital licenses for Windows and Windows applications. If the service is disabled  the operating system and licensed applications may run in a notification mode. It is strongly recommended that you not disable the Software Protection service.,C:\Windows\System32\sppsvc.exe,58da2b4313f1cc7e241bfb35676a4b8f,C:\Windows\system32\sppsvc.exe,SERVICE_WIN32_OWN_PROCESS,,true,true,The file is signed and the signature was verified.,Microsoft Windows,Microsoft Windows Verification PCA
WW367BFQ,adpahci,adpahci,,C:\Windows\System32\drivers\adpahci.sys,6069d6bec668cd6b8de51c5c372298e8,\SystemRoot\system32\drivers\adpahci.sys,SERVICE_KERNEL_DRIVER,,true,true,The file is signed and the signature was verified.,Microsoft Windows,Microsoft Windows Verification PCA
WW367BFQ,TBS,TPM Base Services,Enables access to the Trusted Platform Module (TPM)  which provides hardware-based cryptographic services to system components and applications.  If this service is stopped or disabled  applications will be unable to use keys protected by the TPM.,C:\Windows\System32\svchost.exe,bb5e5748e7bcf3fefc70b960795a86e2,C:\Windows\System32\svchost.exe -k LocalServiceAndNoImpersonation,SERVICE_WIN32_SHARE_PROCESS,C:\Windows\System32\tbssvc.dll,true,true,The file is signed and the signature was verified.,Microsoft Windows,Microsoft Windows Verification PCA
WW367BFQ,mfeplk,McAfee Inc. mfeplk,,C:\Windows\System32\drivers\mfeplk.sys,bf7fbb67c6417c88d0506f657923b5c0,system32\drivers\mfeplk.sys,SERVICE_KERNEL_DRIVER,,true,true,The file is signed and the signature was verified.,Microsoft Windows Hardware Compatibility Publisher,Microsoft Windows Hardware Compatibility PCA
WW367BFQ,Winmgmt,Windows Management Instrumentation,Provides a common interface and object model to access management information about operating system  devices  applications and services. If this service is stopped  most Windows-based software will not function properly. If this service is disabled  any services that explicitly depend on it will fail to start.,C:\Windows\System32\svchost.exe,bb5e5748e7bcf3fefc70b960795a86e2,C:\Windows\system32\svchost.exe -k netsvcs,SERVICE_WIN32_SHARE_PROCESS,C:\Windows\System32\wbem\WMIsvc.dll,true,true,The file is signed and the signature was verified.,Microsoft Windows,Microsoft Windows Verification PCA
WW367BFQ,stexstor,stexstor,,C:\Windows\System32\drivers\stexstor.sys,c434b4d3de7826f3eb5f6c72d3acd378,\SystemRoot\system32\drivers\stexstor.sys,SERVICE_KERNEL_DRIVER,,true,true,The file is signed and the signature was verified.,Microsoft Windows,Microsoft Windows Verification PCA
WW367BFQ,EapHost,Extensible Authentication Protocol,The Extensible Authentication Protocol (EAP) service provides network authentication in such scenarios as 802.1x wired and wireless  VPN  and Network Access Protection (NAP).  EAP also provides application programming interfaces (APIs) that are used by network access clients  including wireless and VPN clients  during the authentication process.  If you disable this service  this computer is prevented from accessing networks that require EAP authentication.,C:\Windows\System32\svchost.exe,bb5e5748e7bcf3fefc70b960795a86e2,C:\Windows\System32\svchost.exe -k netsvcs,SERVICE_WIN32_SHARE_PROCESS,C:\Windows\System32\eapsvc.dll,true,true,The file is signed and the signature was verified.,Microsoft Windows,Microsoft Windows Verification PCA
WW367BFQ,Serenum,Serenum Filter Driver,,C:\Windows\System32\drivers\serenum.sys,9070b0e4c7c1c67a5446908a45fe7006,\SystemRoot\system32\drivers\serenum.sys,SERVICE_KERNEL_DRIVER,,true,true,The file is signed and the signature was verified.,Microsoft Windows,Microsoft Windows Verification PCA
WW367BFQ,PlugPlay,Plug and Play,Enables a computer to recognize and adapt to hardware changes with little or no user input. Stopping or disabling this service will result in system instability.,C:\Windows\System32\svchost.exe,bb5e5748e7bcf3fefc70b960795a86e2,C:\Windows\system32\svchost.exe -k DcomLaunch,SERVICE_WIN32_SHARE_PROCESS,C:\Windows\System32\umpnpmgr.dll,true,true,The file is signed and the signature was verified.,Microsoft Windows,Microsoft Windows Verification PCA
WW367BFQ,eventlog,Windows Event Log,This service manages events and event logs. It supports logging events  querying events  subscribing to events  archiving event logs  and managing event metadata. It can display events in both XML and plain text format. Stopping this service may compromise security and reliability of the system.,C:\Windows\System32\svchost.exe,bb5e5748e7bcf3fefc70b960795a86e2,C:\Windows\System32\svchost.exe -k LocalServiceNetworkRestricted,SERVICE_WIN32_SHARE_PROCESS,,true,true,The file is signed and the signature was verified.,Microsoft Windows,Microsoft Windows Verification PCA
WW367BFQ,mrxsmb10,SMB 1.x MiniRedirector,Implements the SMB 1.x (CIFS) protocol. This protocol provides connectivity to network resources on pre-Windows Vista servers,C:\Windows\System32\drivers\mrxsmb10.sys,0d0663ec30972630f1c38c65932fce9b,system32\DRIVERS\mrxsmb10.sys,SERVICE_FILE_SYSTEM_DRIVER,,true,true,The file is signed and the signature was verified.,Microsoft Windows,Microsoft Windows Verification PCA
WW367BFQ,netprofm,Network List Service,Identifies the networks to which the computer has connected  collects and stores properties for these networks  and notifies applications when these properties change.,C:\Windows\System32\svchost.exe,bb5e5748e7bcf3fefc70b960795a86e2,C:\Windows\System32\svchost.exe -k LocalService,SERVICE_WIN32_SHARE_PROCESS,C:\Windows\System32\netprofm.dll,true,true,The file is signed and the signature was verified.,Microsoft Windows,Microsoft Windows Verification PCA
WW367BFQ,pla,Performance Logs &amp; Alerts,Performance Logs and Alerts Collects performance data from local or remote computers based on preconfigured schedule parameters  then writes the data to a log or triggers an alert. If this service is stopped  performance information will not be collected. If this service is disabled  any services that explicitly depend on it will fail to start.,C:\Windows\System32\svchost.exe,bb5e5748e7bcf3fefc70b960795a86e2,C:\Windows\System32\svchost.exe -k LocalServiceNoNetwork,SERVICE_WIN32_SHARE_PROCESS,C:\Windows\System32\pla.dll,true,true,The file is signed and the signature was verified.,Microsoft Windows,Microsoft Windows Verification PCA
WW367BFQ,Compbatt,Microsoft Composite Battery Driver,,C:\Windows\System32\drivers\compbatt.sys,efcd64c4792a8e886d8924f94f07ff50,\SystemRoot\system32\DRIVERS\compbatt.sys,SERVICE_KERNEL_DRIVER,,true,true,The file is signed and the signature was verified.,Microsoft Windows,Microsoft Windows Verification PCA
WW367BFQ,mfemms,McAfee Service Controller,Manages McAfee Services,C:\Program Files\Common Files\McAfee\SystemCore\mfemms.exe,572491e5aeb1cdd04f594e22e0252011,C:\Program Files\Common Files\McAfee\SystemCore\mfemms.exe,SERVICE_WIN32_OWN_PROCESS,,true,true,The file is signed and the signature was verified.,"""McAfee",VeriSign Class 3 Code Signing 2010 CA
WW367BFQ,AppHostSvc,Application Host Helper Service,Provides administrative services for IIS  for example configuration history and Application Pool account mapping. If this service is stopped  configuration history and locking down files or directories with Application Pool specific Access Control Entries will not work.,C:\Windows\System32\svchost.exe,bb5e5748e7bcf3fefc70b960795a86e2,C:\WINDOWS\system32\svchost.exe -k apphost,SERVICE_WIN32_OWN_PROCESS SERVICE_WIN32_SHARE_PROCESS,C:\Windows\System32\inetsrv\apphostsvc.dll,true,true,The file is signed and the signature was verified.,Microsoft Windows,Microsoft Windows Production PCA 2011
WW367BFQ,LSI_SAS2,LSI_SAS2,,C:\Windows\System32\drivers\lsi_sas2.sys,c585762b168d75c9b3f8a29c13347634,\SystemRoot\system32\drivers\lsi_sas2.sys,SERVICE_KERNEL_DRIVER,,true,true,The file is signed and the signature was verified.,Microsoft Windows,Microsoft Windows Verification PCA
WW367BFQ,FileInfo,File Information FS MiniFilter,Collects information about files in memory to be consumed by other system services.,C:\Windows\System32\drivers\fileinfo.sys,c058e4ee39e81ef3f8f7064b8d60f42d,\SystemRoot\system32\drivers\fileinfo.sys,SERVICE_FILE_SYSTEM_DRIVER,,true,true,The file is signed and the signature was verified.,Microsoft Windows,Microsoft Windows Verification PCA
WW367BFQ,WPDBusEnum,Portable Device Enumerator Service,Enforces group policy for removable mass-storage devices. Enables applications such as Windows Media Player and Image Import Wizard to transfer and synchronize content using removable mass-storage devices.,C:\Windows\System32\svchost.exe,bb5e5748e7bcf3fefc70b960795a86e2,C:\Windows\system32\svchost.exe -k LocalSystemNetworkRestricted,SERVICE_WIN32_SHARE_PROCESS,C:\Windows\System32\wpdbusenum.dll,true,true,The file is signed and the signature was verified.,Microsoft Windows,Microsoft Windows Verification PCA
