hostname,name,descriptivename,description,path,md5,arguments,type,servicedll,pathsignatureexists,pathsignatureverified,pathsignaturedescription,pathcertificatesubject,pathcertificateissuer
ET703OSY,Psched,QoS Packet Scheduler,QoS Packet Scheduler,C:\Windows\System32\drivers\pacer.sys,6c2e715780619f68adeeb240a9671983,system32\DRIVERS\pacer.sys,SERVICE_KERNEL_DRIVER,,true,true,The file is signed and the signature was verified.,Microsoft Windows,Microsoft Windows Verification PCA
ET703OSY,SENS,System Event Notification Service,Monitors system events and notifies subscribers to COM+ Event System of these events.,C:\Windows\System32\svchost.exe,3720c76ddafd3a8604dbaa1ea25c66c9,C:\Windows\system32\svchost.exe -k netsvcs,SERVICE_WIN32_SHARE_PROCESS,C:\Windows\System32\Sens.dll,true,true,The file is signed and the signature was verified.,Microsoft Windows,Microsoft Windows Verification PCA
ET703OSY,HipShieldK,McAfee Inc. HipShieldK,,C:\Windows\System32\drivers\HipShieldK.sys,ee4988c38dcc0c2b848e7374c662fb94,system32\drivers\HipShieldK.sys,SERVICE_KERNEL_DRIVER,,true,true,The file is signed and the signature was verified.,Microsoft Windows Hardware Compatibility Publisher,Microsoft Windows Hardware Compatibility PCA
ET703OSY,bowser,Browser Support Driver,Implements the kernel datagram receiver for the computer browser browser service.,C:\Windows\System32\drivers\bowser.sys,31c9492281fe3a4972667e45d3a55351,system32\DRIVERS\bowser.sys,SERVICE_FILE_SYSTEM_DRIVER,,true,true,The file is signed and the signature was verified.,Microsoft Windows,Microsoft Windows Verification PCA
ET703OSY,IpFilterDriver,IP Traffic Filter Driver,IP Traffic Filter Driver,C:\Windows\System32\drivers\ipfltdrv.sys,d3625298e8568319f9f43a7cb6500afa,system32\DRIVERS\ipfltdrv.sys,SERVICE_KERNEL_DRIVER,,true,true,The file is signed and the signature was verified.,Microsoft Windows,Microsoft Windows Verification PCA
ET703OSY,netkvm,Red Hat VirtIO Ethernet Adapter Service,,C:\Windows\System32\drivers\netkvm.sys,6595f0ce3b8c06d349d9b86280c399e5,system32\DRIVERS\netkvm.sys,SERVICE_KERNEL_DRIVER,,true,true,The file is signed and the signature was verified.,Google Inc,Symantec Class 3 SHA256 Code Signing CA
ET703OSY,RemoteRegistry,Remote Registry,Enables remote users to modify registry settings on this computer. If this service is stopped  the registry can be modified only by users on this computer. If this service is disabled  any services that explicitly depend on it will fail to start.,C:\Windows\System32\svchost.exe,3720c76ddafd3a8604dbaa1ea25c66c9,C:\Windows\system32\svchost.exe -k regsvc,SERVICE_WIN32_SHARE_PROCESS,C:\Windows\System32\regsvc.dll,true,true,The file is signed and the signature was verified.,Microsoft Windows,Microsoft Windows Verification PCA
ET703OSY,mfeelamk,McAfee Inc. mfeelamk,,C:\Windows\System32\drivers\mfeelamk.sys,b429095150b052bdb044f26c27d0e66c,\SystemRoot\system32\drivers\mfeelamk.sys,SERVICE_KERNEL_DRIVER,,true,true,The file is signed and the signature was verified.,Microsoft Windows Hardware Compatibility Publisher,Microsoft Windows Hardware Compatibility PCA
ET703OSY,w32time,Windows Time,Maintains date and time synchronization on all clients and servers in the network. If this service is stopped  date and time synchronization will be unavailable. If this service is disabled  any services that explicitly depend on it will fail to start.,C:\Windows\System32\svchost.exe,3720c76ddafd3a8604dbaa1ea25c66c9,C:\Windows\system32\svchost.exe -k LocalService,SERVICE_WIN32_SHARE_PROCESS,C:\Windows\System32\w32time.dll,true,true,The file is signed and the signature was verified.,Microsoft Windows,Microsoft Windows Verification PCA
ET703OSY,CompositeBus,Composite Bus Enumerator Driver,,C:\Windows\System32\drivers\CompositeBus.sys,b3d7c6250d8adc979b1aa63433fe56f0,\SystemRoot\system32\drivers\CompositeBus.sys,SERVICE_KERNEL_DRIVER,,true,true,The file is signed and the signature was verified.,Microsoft Windows,Microsoft Windows Verification PCA
ET703OSY,sfloppy,High-Capacity Floppy Disk Drive,,C:\Windows\System32\drivers\sfloppy.sys,1f7e6f5c775857c79e1c76d4379ea0ae,\SystemRoot\system32\drivers\sfloppy.sys,SERVICE_KERNEL_DRIVER,,true,true,The file is signed and the signature was verified.,Microsoft Windows,Microsoft Windows Verification PCA
ET703OSY,WdiServiceHost,Diagnostic Service Host,The Diagnostic Service Host is used by the Diagnostic Policy Service to host diagnostics that need to run in a Local Service context.  If this service is stopped  any diagnostics that depend on it will no longer function.,C:\Windows\System32\svchost.exe,3720c76ddafd3a8604dbaa1ea25c66c9,C:\Windows\System32\svchost.exe -k LocalService,SERVICE_WIN32_SHARE_PROCESS,C:\Windows\System32\wdi.dll,true,true,The file is signed and the signature was verified.,Microsoft Windows,Microsoft Windows Verification PCA
ET703OSY,AmdPPM,AMD Processor Driver,,C:\Windows\System32\drivers\amdppm.sys,a8167cc3fd47f9134be2db74d13af4e5,\SystemRoot\system32\drivers\amdppm.sys,SERVICE_KERNEL_DRIVER,,true,true,The file is signed and the signature was verified.,Microsoft Windows,Microsoft Windows Verification PCA
ET703OSY,PVPanic,QEMU PVPanic Service,,C:\Windows\System32\drivers\pvpanic.sys,5a657dba58502392446e3e51f8711fbb,\SystemRoot\system32\drivers\pvpanic.sys,SERVICE_KERNEL_DRIVER,,true,true,The file is signed and the signature was verified.,Google Inc,Symantec Class 3 SHA256 Code Signing CA
ET703OSY,Ndisuio,NDIS Usermode I/O Protocol,,C:\Windows\System32\drivers\ndisuio.sys,fc4d50325ba03399d2a2241be28c2145,system32\DRIVERS\ndisuio.sys,SERVICE_KERNEL_DRIVER,,true,true,The file is signed and the signature was verified.,Microsoft Windows,Microsoft Windows Verification PCA
ET703OSY,Wdf01000,Kernel Mode Driver Frameworks service,,C:\Windows\System32\drivers\Wdf01000.sys,c99ce080e68aa18784ee2b851c0e8e23,\SystemRoot\system32\drivers\Wdf01000.sys,SERVICE_KERNEL_DRIVER,,true,true,The file is signed and the signature was verified.,Microsoft Windows,Microsoft Windows Verification PCA
ET703OSY,flpydisk,Floppy Disk Driver,,C:\Windows\System32\drivers\flpydisk.sys,a7bfba6c06bba067df7b19139102de0e,\SystemRoot\system32\drivers\flpydisk.sys,SERVICE_KERNEL_DRIVER,,true,true,The file is signed and the signature was verified.,Microsoft Windows,Microsoft Windows Verification PCA
ET703OSY,nvme,nvme,,C:\Windows\System32\drivers\nvme.sys,01694a7a43948d8a2dda3fd4b09cb811,\SystemRoot\system32\drivers\nvme.sys,SERVICE_KERNEL_DRIVER,,true,true,The file is signed and the signature was verified.,Google Inc,Symantec Class 3 SHA256 Code Signing CA
ET703OSY,ModuleCoreService,McAfee Module Core Service,McAfee Module Core Service,C:\Program Files\Common Files\McAfee\ModuleCore\ModuleCoreService.exe,c26a93c642f45f1507a3abaa7e020afe,C:\Program Files\Common Files\McAfee\ModuleCore\ModuleCoreService.exe,SERVICE_WIN32_SHARE_PROCESS,,true,true,The file is signed and the signature was verified.,"""McAfee",Symantec Class 3 SHA256 Code Signing CA
ET703OSY,KSecDD,KSecDD,,C:\Windows\System32\drivers\ksecdd.sys,a1cabd3162b3cfd3805301b43725a975,\SystemRoot\System32\Drivers\ksecdd.sys,SERVICE_KERNEL_DRIVER,,true,true,The file is signed and the signature was verified.,Microsoft Windows,Microsoft Windows Verification PCA
ET703OSY,arcsas,arcsas,,C:\Windows\System32\drivers\arcsas.sys,e757764ad0539426f4b24345bfb80595,\SystemRoot\system32\drivers\arcsas.sys,SERVICE_KERNEL_DRIVER,,true,true,The file is signed and the signature was verified.,Microsoft Windows,Microsoft Windows Verification PCA
ET703OSY,Wd,Wd,,C:\Windows\System32\drivers\wd.sys,add698da461fcf2596b2e3bf5a7c9c27,\SystemRoot\system32\drivers\wd.sys,SERVICE_KERNEL_DRIVER,,true,true,The file is signed and the signature was verified.,Microsoft Windows,Microsoft Windows Verification PCA
ET703OSY,ProfSvc,User Profile Service,This service is responsible for loading and unloading user profiles. If this service is stopped or disabled  users will no longer be able to successfully logon or logoff  applications may have problems getting to users' data  and components registered to receive profile event notifications will not receive them.,C:\Windows\System32\svchost.exe,3720c76ddafd3a8604dbaa1ea25c66c9,C:\Windows\system32\svchost.exe -k netsvcs,SERVICE_WIN32_SHARE_PROCESS,C:\Windows\System32\profsvc.dll,true,true,The file is signed and the signature was verified.,Microsoft Windows,Microsoft Windows Verification PCA
ET703OSY,sbp2port,sbp2port,,C:\Windows\System32\drivers\sbp2port.sys,6345d2afe7b8d82100ca940a3e3c48fb,\SystemRoot\system32\drivers\sbp2port.sys,SERVICE_KERNEL_DRIVER,,true,true,The file is signed and the signature was verified.,Microsoft Windows,Microsoft Windows Verification PCA
ET703OSY,amdide,amdide,,C:\Windows\System32\drivers\amdide.sys,056ee55c3a6bcfaa4eec6eedf93b5170,\SystemRoot\system32\drivers\amdide.sys,SERVICE_KERNEL_DRIVER,,true,true,The file is signed and the signature was verified.,Microsoft Windows,Microsoft Windows Verification PCA
ET703OSY,wercplsupport,Problem Reports and Solutions Control Panel Support,This service provides support for viewing  sending and deletion of system-level problem reports for the Problem Reports and Solutions control panel.,C:\Windows\System32\svchost.exe,3720c76ddafd3a8604dbaa1ea25c66c9,C:\Windows\System32\svchost.exe -k netsvcs,SERVICE_WIN32_SHARE_PROCESS,C:\Windows\System32\wercplsupport.dll,true,true,The file is signed and the signature was verified.,Microsoft Windows,Microsoft Windows Verification PCA
ET703OSY,NetBT,NetBT,This service implements NetBios over TCP/IP.,C:\Windows\System32\drivers\netbt.sys,2c6fc1433867913fa903262fee4a1823,System32\DRIVERS\netbt.sys,SERVICE_KERNEL_DRIVER,,true,true,The file is signed and the signature was verified.,Microsoft Windows,Microsoft Windows Verification PCA
ET703OSY,USBSTOR,USB Mass Storage Driver,,C:\Windows\System32\drivers\USBSTOR.SYS,0539abd7cc0debf812156574ea74a0e9,\SystemRoot\system32\drivers\USBSTOR.SYS,SERVICE_KERNEL_DRIVER,,true,true,The file is signed and the signature was verified.,Microsoft Windows,Microsoft Windows Verification PCA
ET703OSY,Smb,Message-oriented TCP/IP and TCP/IPv6 Protocol (SMB session),Microsoft NetbiosSmb Device Driver,C:\Windows\System32\drivers\smb.sys,355bae38164318bd45542475ee435329,system32\DRIVERS\smb.sys,SERVICE_KERNEL_DRIVER,,true,true,The file is signed and the signature was verified.,Microsoft Windows,Microsoft Windows Verification PCA
ET703OSY,BrUsbSer,Brother MFC USB Serial WDM Driver,,C:\Windows\System32\drivers\BrUsbSer.sys,e87647eb44d6417c2d1a889686e899ad,\SystemRoot\System32\Drivers\BrUsbSer.sys,SERVICE_KERNEL_DRIVER,,true,true,The file is signed and the signature was verified.,Microsoft Windows,Microsoft Windows Verification PCA
ET703OSY,SessionEnv,Remote Desktop Configuration,Remote Desktop Configuration service (RDCS) is responsible for all Remote Desktop Services and Remote Desktop related configuration and session maintenance activities that require SYSTEM context. These include per-session temporary folders  RD themes  and RD certificates.,C:\Windows\System32\svchost.exe,3720c76ddafd3a8604dbaa1ea25c66c9,C:\Windows\System32\svchost.exe -k netsvcs,SERVICE_WIN32_SHARE_PROCESS,C:\Windows\System32\SessEnv.dll,true,true,The file is signed and the signature was verified.,Microsoft Windows,Microsoft Windows Verification PCA
ET703OSY,NdisWan,Remote Access NDIS WAN Driver,Remote Access NDIS WAN Driver,C:\Windows\System32\drivers\ndiswan.sys,513efc8f46efa6069099e88639e19e2d,system32\DRIVERS\ndiswan.sys,SERVICE_KERNEL_DRIVER,,true,true,The file is signed and the signature was verified.,Microsoft Windows,Microsoft Windows Verification PCA
ET703OSY,HidUsb,Microsoft HID Class Driver,,C:\Windows\System32\drivers\hidusb.sys,5511961dbb8ed16ada204d39758ab646,\SystemRoot\system32\drivers\hidusb.sys,SERVICE_KERNEL_DRIVER,,true,true,The file is signed and the signature was verified.,Microsoft Windows,Microsoft Windows Verification PCA
ET703OSY,SSDPSRV,SSDP Discovery,Discovers networked devices and services that use the SSDP discovery protocol  such as UPnP devices. Also announces SSDP devices and services running on the local computer. If this service is stopped  SSDP-based devices will not be discovered. If this service is disabled  any services that explicitly depend on it will fail to start.,C:\Windows\System32\svchost.exe,3720c76ddafd3a8604dbaa1ea25c66c9,C:\Windows\system32\svchost.exe -k LocalServiceAndNoImpersonation,SERVICE_WIN32_SHARE_PROCESS,C:\Windows\System32\ssdpsrv.dll,true,true,The file is signed and the signature was verified.,Microsoft Windows,Microsoft Windows Verification PCA
ET703OSY,mfesapsn,McAfee Process Start Notification Service,,C:\Program Files\McAfee\WebAdvisor\mfesapsn.sys,567df879597805e5abc3f7d3f015749b,\??\C:\Program Files\McAfee\WebAdvisor\mfesapsn.sys,SERVICE_KERNEL_DRIVER,,true,true,The file is signed and the signature was verified.,"""McAfee",VeriSign Class 3 Code Signing 2010 CA
ET703OSY,TrkWks,Distributed Link Tracking Client,Maintains links between NTFS files within a computer or across computers in a network.,C:\Windows\System32\svchost.exe,3720c76ddafd3a8604dbaa1ea25c66c9,C:\Windows\System32\svchost.exe -k LocalSystemNetworkRestricted,SERVICE_WIN32_SHARE_PROCESS,C:\Windows\System32\trkwks.dll,true,true,The file is signed and the signature was verified.,Microsoft Windows,Microsoft Windows Verification PCA
ET703OSY,NetTcpPortSharing,Net.Tcp Port Sharing Service,Provides ability to share TCP ports over the net.tcp protocol.,C:\Windows\Microsoft.NET\Framework64\v4.0.30319\SMSvcHost.exe,6ca3cc022e78fcd7eec86e8a41af961f,C:\Windows\Microsoft.NET\Framework64\v4.0.30319\SMSvcHost.exe,SERVICE_WIN32_SHARE_PROCESS,,true,true,The file is signed and the signature was verified.,Microsoft Corporation,Microsoft Code Signing PCA
ET703OSY,monitor,Microsoft Monitor Class Function Driver Service,,C:\Windows\System32\drivers\monitor.sys,89bef633d19bdc670898f98198a90162,system32\DRIVERS\monitor.sys,SERVICE_KERNEL_DRIVER,,true,true,The file is signed and the signature was verified.,Microsoft Windows,Microsoft Windows Verification PCA
ET703OSY,AeLookupSvc,Application Experience,Processes application compatibility cache requests for applications as they are launched,C:\Windows\System32\svchost.exe,3720c76ddafd3a8604dbaa1ea25c66c9,C:\Windows\system32\svchost.exe -k netsvcs,SERVICE_WIN32_SHARE_PROCESS,C:\Windows\System32\aelupsvc.dll,true,true,The file is signed and the signature was verified.,Microsoft Windows,Microsoft Windows Verification PCA
ET703OSY,storflt,Disk Virtual Machine Bus Acceleration Filter Driver,,C:\Windows\System32\drivers\vmstorfl.sys,a431a8b6c65ac6a8d5445673f7eac0ce,\SystemRoot\system32\drivers\vmstorfl.sys,SERVICE_KERNEL_DRIVER,,true,true,The file is signed and the signature was verified.,Microsoft Windows,Microsoft Windows Verification PCA
ET703OSY,ClientAnalyticsService,ClientAnalyticsService,,C:\Program Files\Common Files\McAfee\ClientAnalytics\Legacy\McClientAnalytics.exe,53550ddbaac32f0c7756da648303fba9,"C:\Program Files\Common Files\McAfee\ClientAnalytics\Legacy\McClientAnalytics.exe""""""",SERVICE_WIN32_OWN_PROCESS,,true,true,The file is signed and the signature was verified.,"""McAfee",Symantec Class 3 SHA256 Code Signing CA
ET703OSY,BrFiltLo,Brother USB Mass-Storage Lower Filter Driver,,C:\Windows\System32\drivers\BrFiltLo.sys,762da9f2584246605b6947e88078b213,\SystemRoot\system32\drivers\BrFiltLo.sys,SERVICE_KERNEL_DRIVER,,true,true,The file is signed and the signature was verified.,Microsoft Windows,Microsoft Windows Verification PCA
ET703OSY,Wanarpv6,Remote Access IPv6 ARP Driver,Remote Access IPv6 ARP Driver,C:\Windows\System32\drivers\wanarp.sys,8eaefc362ea4dd9f812b32bdb153722c,system32\DRIVERS\wanarp.sys,SERVICE_KERNEL_DRIVER,,true,true,The file is signed and the signature was verified.,Microsoft Windows,Microsoft Windows Verification PCA
ET703OSY,SamSs,Security Accounts Manager,The startup of this service signals other services that the Security Accounts Manager (SAM) is ready to accept requests.  Disabling this service will prevent other services in the system from being notified when the SAM is ready  which may in turn cause those services to fail to start correctly. This service should not be disabled.,C:\Windows\System32\lsass.exe,18d5953fc74657ca3fb77fd92e0ac30b,C:\Windows\system32\lsass.exe,SERVICE_WIN32_SHARE_PROCESS,,true,true,The file is signed and the signature was verified.,Microsoft Windows,Microsoft Windows Verification PCA
ET703OSY,megasas,megasas,,C:\Windows\System32\drivers\megasas.sys,f38c6cd88301e1323a2467bdef2e6239,\SystemRoot\system32\drivers\megasas.sys,SERVICE_KERNEL_DRIVER,,true,true,The file is signed and the signature was verified.,Microsoft Windows,Microsoft Windows Verification PCA
ET703OSY,wuauserv,Windows Update,Enables the detection  download  and installation of updates for Windows and other programs. If this service is disabled  users of this computer will not be able to use Windows Update or its automatic updating feature  and programs will not be able to use the Windows Update Agent (WUA) API.,C:\Windows\System32\svchost.exe,3720c76ddafd3a8604dbaa1ea25c66c9,C:\Windows\system32\svchost.exe -k netsvcs,SERVICE_WIN32_SHARE_PROCESS,C:\Windows\System32\wuaueng.dll,true,true,The file is signed and the signature was verified.,Microsoft Windows,Microsoft Windows Verification PCA
ET703OSY,mfencbdc,McAfee LLC. mfencbdc,McAfee Content driver Copyright (C) McAfee LLC  2018. All rights reserved.,C:\Windows\System32\drivers\mfencbdc.sys,492d198ab0b6b591c13e890fd407acc6,system32\DRIVERS\mfencbdc.sys,SERVICE_KERNEL_DRIVER,,true,true,The file is signed and the signature was verified.,Microsoft Windows Hardware Compatibility Publisher,Microsoft Windows Hardware Compatibility PCA
ET703OSY,HDAudBus,Microsoft UAA Bus Driver for High Definition Audio,,C:\Windows\System32\drivers\hdaudbus.sys,705a1efa049b6e6ef9294ea096890b0d,\SystemRoot\system32\drivers\HDAudBus.sys,SERVICE_KERNEL_DRIVER,,true,true,The file is signed and the signature was verified.,Microsoft Windows,Microsoft Windows Verification PCA
ET703OSY,SiSRaid4,SiSRaid4,,C:\Windows\System32\drivers\sisraid4.sys,41877fad5ddd1012447f4d669c76ca9b,\SystemRoot\system32\drivers\sisraid4.sys,SERVICE_KERNEL_DRIVER,,true,true,The file is signed and the signature was verified.,Microsoft Windows,Microsoft Windows Verification PCA
ET703OSY,vhdmp,vhdmp,,C:\Windows\System32\drivers\vhdmp.sys,0cd8a061e69a1d59b2405e4aa595b2e0,\SystemRoot\system32\drivers\vhdmp.sys,SERVICE_KERNEL_DRIVER,,true,true,The file is signed and the signature was verified.,Microsoft Windows,Microsoft Windows Verification PCA
ET703OSY,TDPIPE,TDPIPE,,C:\Windows\System32\drivers\tdpipe.sys,e11051c3c24cfef7be96a27bc058e20a,system32\drivers\tdpipe.sys,SERVICE_KERNEL_DRIVER,,true,true,The file is signed and the signature was verified.,Microsoft Windows,Microsoft Windows Verification PCA
ET703OSY,KSecPkg,KSecPkg,,C:\Windows\System32\drivers\ksecpkg.sys,e5cda53569971ad31ee7177a8b9b7d37,\SystemRoot\System32\Drivers\ksecpkg.sys,SERVICE_KERNEL_DRIVER,,true,true,The file is signed and the signature was verified.,Microsoft Windows,Microsoft Windows Verification PCA
ET703OSY,EFS,Encrypting File System (EFS),Provides the core file encryption technology used to store encrypted files on NTFS file system volumes. If this service is stopped or disabled  applications will be unable to access encrypted files.,C:\Windows\System32\lsass.exe,18d5953fc74657ca3fb77fd92e0ac30b,C:\Windows\System32\lsass.exe,SERVICE_WIN32_SHARE_PROCESS,,true,true,The file is signed and the signature was verified.,Microsoft Windows,Microsoft Windows Verification PCA
ET703OSY,PolicyAgent,IPsec Policy Agent,"""Internet Protocol security (IPsec) supports network-level peer authentication  data origin authentication  data integrity  data confidentiality (encryption)  and replay protection.  This service enforces IPsec policies created through the IP Security Policies snap-in or the command-line tool """"netsh ipsec"""".  If you stop this service  you may experience network connectivity issues if your policy requires that connections use IPsec.  Also remote management of Windows Firewall is not available when this service is stopped.""",C:\Windows\System32\svchost.exe,3720c76ddafd3a8604dbaa1ea25c66c9,C:\Windows\system32\svchost.exe -k NetworkServiceNetworkRestricted,SERVICE_WIN32_SHARE_PROCESS,C:\Windows\System32\IPSECSVC.DLL,true,true,The file is signed and the signature was verified.,Microsoft Windows,Microsoft Windows Verification PCA
ET703OSY,HidBatt,HID UPS Battery Driver,,C:\Windows\System32\drivers\hidbatt.sys,1434abe307cccb5470f67f90b5ae4ec0,\SystemRoot\system32\drivers\HidBatt.sys,SERVICE_KERNEL_DRIVER,,true,true,The file is signed and the signature was verified.,Microsoft Windows,Microsoft Windows Verification PCA
ET703OSY,NdisCap,NDIS Capture LightWeight Filter,NDIS Capture LightWeight Filter,C:\Windows\System32\drivers\ndiscap.sys,cc5679b9e5608525614fd5786410dbb4,system32\DRIVERS\ndiscap.sys,SERVICE_KERNEL_DRIVER,,true,true,The file is signed and the signature was verified.,Microsoft Windows,Microsoft Windows Verification PCA
ET703OSY,mccspsvc,McAfee CSP Service,McAfee Cloud Platform Service,C:\Program Files\Common Files\McAfee\CSP\3.0.127.0\\McCSPServiceHost.exe,d289f3e441933c45a0ca8de5c4d22bd2,"C:\Program Files\Common Files\McAfee\CSP\3.0.127.0\\McCSPServiceHost.exe""""""",SERVICE_WIN32_OWN_PROCESS,,true,true,The file is signed and the signature was verified.,"""McAfee",Symantec Class 3 SHA256 Code Signing CA
ET703OSY,CryptSvc,Cryptographic Services,Provides four management services: Catalog Database Service  which confirms the signatures of Windows files and allows new programs to be installed; Protected Root Service  which adds and removes Trusted Root Certification Authority certificates from this computer; Automatic Root Certificate Update Service  which retrieves root certificates from Windows Update and enable scenarios such as SSL; and Key Service  which helps enroll this computer for certificates. If this service is stopped  these management services will not function properly. If this service is disabled  any services that explicitly depend on it will fail to start.,C:\Windows\System32\svchost.exe,3720c76ddafd3a8604dbaa1ea25c66c9,C:\Windows\system32\svchost.exe -k NetworkService,SERVICE_WIN32_SHARE_PROCESS,C:\Windows\System32\cryptsvc.dll,true,true,The file is signed and the signature was verified.,Microsoft Windows,Microsoft Windows Verification PCA
ET703OSY,clr_optimization_v4.0.30319_64,Microsoft .NET Framework NGEN v4.0.30319_X64,Microsoft .NET Framework NGEN,C:\Windows\Microsoft.NET\Framework64\v4.0.30319\mscorsvw.exe,ff47d70bc280ca9f5df9b2c0c0d415cd,C:\Windows\Microsoft.NET\Framework64\v4.0.30319\mscorsvw.exe,SERVICE_WIN32_OWN_PROCESS,,true,true,The file is signed and the signature was verified.,Microsoft Dynamic Code Publisher,Microsoft Code Signing PCA
ET703OSY,MegaSR,MegaSR,,C:\Windows\System32\drivers\MegaSR.sys,74c8bb0324812761b8195e3e5d4c1bc0,\SystemRoot\system32\drivers\MegaSR.sys,SERVICE_KERNEL_DRIVER,,true,true,The file is signed and the signature was verified.,Microsoft Windows,Microsoft Windows Verification PCA
ET703OSY,KtmRm,KtmRm for Distributed Transaction Coordinator,Coordinates transactions between the Distributed Transaction Coordinator (MSDTC) and the Kernel Transaction Manager (KTM). If it is not needed  it is recommended that this service remain stopped. If it is needed  both MSDTC and KTM will start this service automatically. If this service is disabled  any MSDTC transaction interacting with a Kernel Resource Manager will fail and any services that explicitly depend on it will fail to start.,C:\Windows\System32\svchost.exe,3720c76ddafd3a8604dbaa1ea25c66c9,C:\Windows\System32\svchost.exe -k NetworkServiceAndNoImpersonation,SERVICE_WIN32_SHARE_PROCESS,C:\Windows\System32\msdtckrm.dll,true,true,The file is signed and the signature was verified.,Microsoft Windows,Microsoft Windows Verification PCA
ET703OSY,LSI_FC,LSI_FC,,C:\Windows\System32\drivers\lsi_fc.sys,aed5ae433dfd5ed0e676aab70f905b21,\SystemRoot\system32\drivers\lsi_fc.sys,SERVICE_KERNEL_DRIVER,,true,true,The file is signed and the signature was verified.,Microsoft Windows,Microsoft Windows Verification PCA
ET703OSY,ioatdma,Intel(R) QuickData Technology Device,,C:\Windows\System32\drivers\qd260x64.sys,0aef2882d603478cad9e5eb9a448b896,\SystemRoot\System32\Drivers\qd260x64.sys,SERVICE_KERNEL_DRIVER,,true,true,The file is signed and the signature was verified.,Microsoft Windows,Microsoft Windows Verification PCA
ET703OSY,PptpMiniport,WAN Miniport (PPTP),WAN Miniport (PPTP),C:\Windows\System32\drivers\raspptp.sys,0efa8a502e7073d733d77dde5ab7fe78,system32\DRIVERS\raspptp.sys,SERVICE_KERNEL_DRIVER,,true,true,The file is signed and the signature was verified.,Microsoft Windows,Microsoft Windows Verification PCA
ET703OSY,clr_optimization_v2.0.50727_32,Microsoft .NET Framework NGEN v2.0.50727_X86,Microsoft .NET Framework NGEN,C:\Windows\Microsoft.NET\Framework\v2.0.50727\mscorsvw.exe,3852d71dc5c574544f9f28bb233f0dd9,C:\Windows\Microsoft.NET\Framework\v2.0.50727\mscorsvw.exe,SERVICE_WIN32_OWN_PROCESS,,true,true,The file is signed and the signature was verified.,Microsoft Windows,Microsoft Windows Verification PCA
ET703OSY,IEEtwCollectorService,Internet Explorer ETW Collector Service,ETW Collector Service for Internet Explorer. When running  this service collects real time ETW events and processes them.,C:\Windows\System32\IEEtwCollector.exe,131191e84e6bf51e9e94287648b1dbfc,C:\Windows\system32\IEEtwCollector.exe /V,SERVICE_WIN32_OWN_PROCESS,,true,true,The file is signed and the signature was verified.,Microsoft Windows,Microsoft Windows Verification PCA
