hostname,name,descriptivename,description,path,md5,arguments,type,servicedll,pathsignatureexists,pathsignatureverified,pathsignaturedescription,pathcertificatesubject,pathcertificateissuer
ET703OSY,atapi,atapi,,C:\Windows\System32\drivers\atapi.sys,b1ade5e0e50aa22b791c712509a2fbe7,\SystemRoot\system32\drivers\atapi.sys,SERVICE_KERNEL_DRIVER,,true,true,The file is signed and the signature was verified.,Microsoft Windows,Microsoft Windows Verification PCA
ET703OSY,vds,Virtual Disk,Provides management services for disks  volumes  file systems  and storage arrays.,C:\Windows\System32\vds.exe,96892571d0876ce6903b5589feac5181,C:\Windows\System32\vds.exe,SERVICE_WIN32_OWN_PROCESS,,true,true,The file is signed and the signature was verified.,Microsoft Windows,Microsoft Windows Verification PCA
ET703OSY,rspndr,Link-Layer Topology Discovery Responder,,C:\Windows\System32\drivers\rspndr.sys,b566462b3e62928544999dce6da545b6,system32\DRIVERS\rspndr.sys,SERVICE_KERNEL_DRIVER,,true,true,The file is signed and the signature was verified.,Microsoft Windows,Microsoft Windows Verification PCA
ET703OSY,AppMgmt,Application Management,Processes installation  removal  and enumeration requests for software deployed through Group Policy. If the service is disabled  users will be unable to install  remove  or enumerate software deployed through Group Policy. If this service is disabled  any services that explicitly depend on it will fail to start.,C:\Windows\System32\svchost.exe,3720c76ddafd3a8604dbaa1ea25c66c9,C:\Windows\system32\svchost.exe -k netsvcs,SERVICE_WIN32_SHARE_PROCESS,C:\Windows\System32\appmgmts.dll,true,true,The file is signed and the signature was verified.,Microsoft Windows,Microsoft Windows Verification PCA
ET703OSY,mfefire,McAfee Firewall Core Service,Provides firewall services to McAfee products,C:\Program Files\Common Files\McAfee\SystemCore\mfefire.exe,b88f9de6d52d24e2371afb5163a64928,"C:\Program Files\Common Files\McAfee\SystemCore\mfefire.exe""""""",SERVICE_WIN32_OWN_PROCESS,,true,true,The file is signed and the signature was verified.,"""McAfee",VeriSign Class 3 Code Signing 2010 CA
ET703OSY,AFD,Ancillary Function Driver for Winsock,Ancillary Function Driver for Winsock,C:\Windows\System32\drivers\afd.sys,6355fd2c04f74d74a9fc45ece397bc17,\SystemRoot\system32\drivers\afd.sys,SERVICE_KERNEL_DRIVER,,true,true,The file is signed and the signature was verified.,Microsoft Windows,Microsoft Windows Verification PCA
ET703OSY,vmbus,vmbus,,C:\Windows\System32\drivers\vmbus.sys,ae99690bb6254ee243cc21c2692c9414,\SystemRoot\system32\drivers\vmbus.sys,SERVICE_KERNEL_DRIVER,,true,true,The file is signed and the signature was verified.,Microsoft Windows,Microsoft Windows Verification PCA
ET703OSY,uliagpkx,Uli AGP Bus Filter,,C:\Windows\System32\drivers\ULIAGPKX.SYS,ebb6900c36f93bad3a47ab31d79ea573,\SystemRoot\system32\drivers\uliagpkx.sys,SERVICE_KERNEL_DRIVER,,true,true,The file is signed and the signature was verified.,Microsoft Windows,Microsoft Windows Verification PCA
ET703OSY,stexstor,stexstor,,C:\Windows\System32\drivers\stexstor.sys,cd21554efcda7cdddb246c9cd6f4711d,\SystemRoot\system32\drivers\stexstor.sys,SERVICE_KERNEL_DRIVER,,true,true,The file is signed and the signature was verified.,Microsoft Windows,Microsoft Windows Verification PCA
ET703OSY,LSI_SAS,LSI_SAS,,C:\Windows\System32\drivers\lsi_sas.sys,50fca0dc7e30619f65813fcd7e0aa694,\SystemRoot\system32\drivers\lsi_sas.sys,SERVICE_KERNEL_DRIVER,,true,true,The file is signed and the signature was verified.,Microsoft Windows,Microsoft Windows Verification PCA
ET703OSY,nv_agp,NVIDIA nForce AGP Bus Filter,,C:\Windows\System32\drivers\NV_AGP.SYS,e25eedc86d9f40b03aca31c7018fef05,\SystemRoot\system32\drivers\nv_agp.sys,SERVICE_KERNEL_DRIVER,,true,true,The file is signed and the signature was verified.,Microsoft Windows,Microsoft Windows Verification PCA
ET703OSY,umbus,UMBus Enumerator Driver,,C:\Windows\System32\drivers\umbus.sys,9a348421e433d32ccba54f0cbe313153,system32\DRIVERS\umbus.sys,SERVICE_KERNEL_DRIVER,,true,true,The file is signed and the signature was verified.,Microsoft Windows,Microsoft Windows Verification PCA
ET703OSY,DXGKrnl,LDDM Graphics Subsystem,Controls the underlying video driver stacks to provide fully-featured display capabilities.,C:\Windows\System32\drivers\dxgkrnl.sys,563b076d8fd4ff14e1ac29fddf5d756d,\SystemRoot\System32\drivers\dxgkrnl.sys,SERVICE_KERNEL_DRIVER,,true,true,The file is signed and the signature was verified.,Microsoft Windows,Microsoft Windows Verification PCA
ET703OSY,WfpLwf,WFP Lightweight Filter,WFP Lightweight Filter,C:\Windows\System32\drivers\wfplwf.sys,14590e72b7d11ee853bb1f00dcc2ab40,\SystemRoot\system32\DRIVERS\wfplwf.sys,SERVICE_KERNEL_DRIVER,,true,true,The file is signed and the signature was verified.,Microsoft Windows,Microsoft Windows Verification PCA
ET703OSY,HTTP,HTTP,This service implements the hypertext transfer protocol (HTTP). If this service is disabled  any services that explicitly depend on it will fail to start.,C:\Windows\System32\drivers\http.sys,d8b2d8f9065665e80eb77c2f54be5bbc,system32\drivers\HTTP.sys,SERVICE_KERNEL_DRIVER,,true,true,The file is signed and the signature was verified.,Microsoft Windows,Microsoft Windows Verification PCA
ET703OSY,upnphost,UPnP Device Host,Allows UPnP devices to be hosted on this computer. If this service is stopped  any hosted UPnP devices will stop functioning and no additional hosted devices can be added. If this service is disabled  any services that explicitly depend on it will fail to start.,C:\Windows\System32\svchost.exe,3720c76ddafd3a8604dbaa1ea25c66c9,C:\Windows\system32\svchost.exe -k LocalServiceAndNoImpersonation,SERVICE_WIN32_SHARE_PROCESS,C:\Windows\System32\upnphost.dll,true,true,The file is signed and the signature was verified.,Microsoft Windows,Microsoft Windows Verification PCA
ET703OSY,LSI_SCSI,LSI_SCSI,,C:\Windows\System32\drivers\lsi_scsi.sys,ae911a0dac65589876513029904d31cc,\SystemRoot\system32\drivers\lsi_scsi.sys,SERVICE_KERNEL_DRIVER,,true,true,The file is signed and the signature was verified.,Microsoft Windows,Microsoft Windows Verification PCA
ET703OSY,WANARP,Remote Access IP ARP Driver,Remote Access IP ARP Driver,C:\Windows\System32\drivers\wanarp.sys,8eaefc362ea4dd9f812b32bdb153722c,system32\DRIVERS\wanarp.sys,SERVICE_KERNEL_DRIVER,,true,true,The file is signed and the signature was verified.,Microsoft Windows,Microsoft Windows Verification PCA
ET703OSY,SharedAccess,Internet Connection Sharing (ICS),Provides network address translation  addressing  name resolution and/or intrusion prevention services for a home or small office network.,C:\Windows\System32\svchost.exe,3720c76ddafd3a8604dbaa1ea25c66c9,C:\Windows\System32\svchost.exe -k netsvcs,SERVICE_WIN32_SHARE_PROCESS,C:\Windows\System32\ipnathlp.dll,true,true,The file is signed and the signature was verified.,Microsoft Windows,Microsoft Windows Verification PCA
ET703OSY,amdsata,amdsata,,C:\Windows\System32\drivers\amdsata.sys,d1a0bf8e58261cec440e647a28afce95,\SystemRoot\system32\drivers\amdsata.sys,SERVICE_KERNEL_DRIVER,,true,true,The file is signed and the signature was verified.,Microsoft Windows,Microsoft Windows Verification PCA
ET703OSY,blbdrive,blbdrive,,C:\Windows\System32\drivers\blbdrive.sys,c25c376563fe22d068192d06a971b98c,\SystemRoot\system32\drivers\blbdrive.sys,SERVICE_KERNEL_DRIVER,,true,true,The file is signed and the signature was verified.,Microsoft Windows,Microsoft Windows Verification PCA
ET703OSY,vsmraid,vsmraid,,C:\Windows\System32\drivers\vsmraid.sys,2e202bb256188450ada7b415cef54c93,\SystemRoot\system32\drivers\vsmraid.sys,SERVICE_KERNEL_DRIVER,,true,true,The file is signed and the signature was verified.,Microsoft Windows,Microsoft Windows Verification PCA
ET703OSY,Disk,Disk Driver,,C:\Windows\System32\drivers\disk.sys,1e1ce0da7793ca0785e4ab1b1c15e7b5,\SystemRoot\system32\drivers\disk.sys,SERVICE_KERNEL_DRIVER,,true,true,The file is signed and the signature was verified.,Microsoft Windows,Microsoft Windows Verification PCA
ET703OSY,dot3svc,Wired AutoConfig,The Wired AutoConfig (DOT3SVC) service is responsible for performing IEEE 802.1X authentication on Ethernet interfaces. If your current wired network deployment enforces 802.1X authentication  the DOT3SVC service should be configured to run for establishing Layer 2 connectivity and/or providing access to network resources. Wired networks that do not enforce 802.1X authentication are unaffected by the DOT3SVC service.,C:\Windows\System32\svchost.exe,3720c76ddafd3a8604dbaa1ea25c66c9,C:\Windows\system32\svchost.exe -k LocalSystemNetworkRestricted,SERVICE_WIN32_SHARE_PROCESS,C:\Windows\System32\dot3svc.dll,true,true,The file is signed and the signature was verified.,Microsoft Windows,Microsoft Windows Verification PCA
ET703OSY,FCRegSvc,Microsoft Fibre Channel Platform Registration Service,Registers the platform with all available Fibre Channel fabrics  and maintains the registrations.,C:\Windows\System32\svchost.exe,3720c76ddafd3a8604dbaa1ea25c66c9,C:\Windows\system32\svchost.exe -k LocalServiceNetworkRestricted,SERVICE_WIN32_SHARE_PROCESS,C:\Windows\System32\FCRegSvc.dll,true,true,The file is signed and the signature was verified.,Microsoft Windows,Microsoft Windows Verification PCA
ET703OSY,ws2ifsl,Winsock IFS Driver,Winsock IFS Driver,C:\Windows\System32\drivers\ws2ifsl.sys,89b4403781bedafb6bbdf6c7b99e327e,\SystemRoot\system32\drivers\ws2ifsl.sys,SERVICE_KERNEL_DRIVER,,true,true,The file is signed and the signature was verified.,Microsoft Windows,Microsoft Windows Verification PCA
ET703OSY,vioscsi,vioscsi,,C:\Windows\System32\drivers\vioscsi.sys,f4d343c48903cde3fed5f5c347ac45f0,\SystemRoot\system32\drivers\vioscsi.sys,SERVICE_KERNEL_DRIVER,,true,true,The file is signed and the signature was verified.,Google Inc,Symantec Class 3 SHA256 Code Signing CA
ET703OSY,Compbatt,Compbatt,,C:\Windows\System32\drivers\compbatt.sys,01693100244e66a19588a95248c9fabe,\SystemRoot\system32\drivers\compbatt.sys,SERVICE_KERNEL_DRIVER,,true,true,The file is signed and the signature was verified.,Microsoft Windows,Microsoft Windows Verification PCA
ET703OSY,TCPIP6,Microsoft IPv6 Protocol Driver,Microsoft IPv6 Protocol Driver,C:\Windows\System32\drivers\tcpip.sys,99476c87444d8fa89271f6e86cccec9e,system32\DRIVERS\tcpip.sys,SERVICE_KERNEL_DRIVER,,true,true,The file is signed and the signature was verified.,Microsoft Windows,Microsoft Windows Verification PCA
ET703OSY,isapnp,isapnp,,C:\Windows\System32\drivers\isapnp.sys,22b9e3054dd0f197ae25ff79835cbf9b,\SystemRoot\system32\drivers\isapnp.sys,SERVICE_KERNEL_DRIVER,,true,true,The file is signed and the signature was verified.,Microsoft Windows,Microsoft Windows Verification PCA
ET703OSY,WIMMount,WIMMount,WIM Image mount service driver,C:\Windows\System32\drivers\wimmount.sys,a01ef362aaa6d2b6e2aaf8acab0cc6ad,system32\drivers\wimmount.sys,SERVICE_FILE_SYSTEM_DRIVER,,true,true,The file is signed and the signature was verified.,Microsoft Windows,Microsoft Windows Verification PCA
ET703OSY,TermService,Remote Desktop Services,Allows users to connect interactively to a remote computer. Remote Desktop and Remote Desktop Session Host Server depend on this service.  To prevent remote use of this computer  clear the checkboxes on the Remote tab of the System properties control panel item.,C:\Windows\System32\svchost.exe,3720c76ddafd3a8604dbaa1ea25c66c9,C:\Windows\System32\svchost.exe -k termsvcs,SERVICE_WIN32_SHARE_PROCESS,C:\Windows\System32\termsrv.dll,true,true,The file is signed and the signature was verified.,Microsoft Windows,Microsoft Windows Verification PCA
ET703OSY,KeyIso,CNG Key Isolation,The CNG key isolation service is hosted in the LSA process. The service provides key process isolation to private keys and associated cryptographic operations as required by the Common Criteria. The service stores and uses long-lived keys in a secure process complying with Common Criteria requirements.,C:\Windows\System32\lsass.exe,18d5953fc74657ca3fb77fd92e0ac30b,C:\Windows\system32\lsass.exe,SERVICE_WIN32_SHARE_PROCESS,,true,true,The file is signed and the signature was verified.,Microsoft Windows,Microsoft Windows Verification PCA
ET703OSY,Modem,Modem,,C:\Windows\System32\drivers\modem.sys,c34a75a470f393d72eef46747c0041af,system32\drivers\modem.sys,SERVICE_KERNEL_DRIVER,,true,true,The file is signed and the signature was verified.,Microsoft Windows,Microsoft Windows Verification PCA
ET703OSY,msdsm,msdsm,,C:\Windows\System32\drivers\msdsm.sys,17dab8fc62489cb8ab5781bc34fb4942,\SystemRoot\system32\drivers\msdsm.sys,SERVICE_KERNEL_DRIVER,,true,true,The file is signed and the signature was verified.,Microsoft Windows,Microsoft Windows Verification PCA
ET703OSY,MMCSS,Multimedia Class Scheduler,Enables relative prioritization of work based on system-wide task priorities. This is intended mainly for multimedia applications.  If this service is stopped  individual tasks resort to their default priority.,C:\Windows\System32\svchost.exe,3720c76ddafd3a8604dbaa1ea25c66c9,C:\Windows\system32\svchost.exe -k netsvcs,SERVICE_WIN32_SHARE_PROCESS,C:\Windows\System32\mmcss.dll,true,true,The file is signed and the signature was verified.,Microsoft Windows,Microsoft Windows Verification PCA
ET703OSY,wmiApSrv,WMI Performance Adapter,Provides performance library information from Windows Management Instrumentation (WMI) providers to clients on the network. This service only runs when Performance Data Helper is activated.,C:\Windows\System32\wbem\WmiApSrv.exe,8a626a33d95d6bfcd8ae2f5280986131,C:\Windows\system32\wbem\WmiApSrv.exe,SERVICE_WIN32_OWN_PROCESS,,true,true,The file is signed and the signature was verified.,Microsoft Windows,Microsoft Windows Verification PCA
ET703OSY,mouclass,Mouse Class Driver,,C:\Windows\System32\drivers\mouclass.sys,2c116b660325038b20954eb1564defda,\SystemRoot\system32\drivers\mouclass.sys,SERVICE_KERNEL_DRIVER,,true,true,The file is signed and the signature was verified.,Microsoft Windows,Microsoft Windows Verification PCA
ET703OSY,usbuhci,Microsoft USB Universal Host Controller Miniport Driver,,C:\Windows\System32\drivers\usbuhci.sys,e4fe6ccc834010bd17fd34c6b174ec33,\SystemRoot\system32\drivers\usbuhci.sys,SERVICE_KERNEL_DRIVER,,true,true,The file is signed and the signature was verified.,Microsoft Windows,Microsoft Windows Verification PCA
ET703OSY,sppsvc,Software Protection,Enables the download  installation and enforcement of digital licenses for Windows and Windows applications. If the service is disabled  the operating system and licensed applications may run in a notification mode. It is strongly recommended that you not disable the Software Protection service.,C:\Windows\System32\sppsvc.exe,7025505cee0218da97c77e75915666c2,C:\Windows\system32\sppsvc.exe,SERVICE_WIN32_OWN_PROCESS,,true,true,The file is signed and the signature was verified.,Microsoft Windows,Microsoft Windows Verification PCA
ET703OSY,TapiSrv,Telephony,Provides Telephony API (TAPI) support for programs that control telephony devices on the local computer and  through the LAN  on servers that are also running the service.,C:\Windows\System32\svchost.exe,3720c76ddafd3a8604dbaa1ea25c66c9,C:\Windows\System32\svchost.exe -k tapisrv,SERVICE_WIN32_OWN_PROCESS,C:\Windows\System32\tapisrv.dll,true,true,The file is signed and the signature was verified.,Microsoft Windows,Microsoft Windows Verification PCA
ET703OSY,RDPREFMP,Reflector Display Driver used to gain access to graphics data,RDP Reflector Driver Miniport,C:\Windows\System32\drivers\RDPREFMP.sys,a653bfcff8202dd5335e11979b02f3a2,system32\drivers\rdprefmp.sys,SERVICE_KERNEL_DRIVER,,true,true,The file is signed and the signature was verified.,Microsoft Windows,Microsoft Windows Verification PCA
ET703OSY,mrxsmb,SMB MiniRedirector Wrapper and Engine,Implements the framework for the SMB filesystem redirector,C:\Windows\System32\drivers\mrxsmb.sys,eb3428581528ba6ee77dbe5ac620d660,system32\DRIVERS\mrxsmb.sys,SERVICE_FILE_SYSTEM_DRIVER,,true,true,The file is signed and the signature was verified.,Microsoft Windows,Microsoft Windows Verification PCA
ET703OSY,netprofm,Network List Service,Identifies the networks to which the computer has connected  collects and stores properties for these networks  and notifies applications when these properties change.,C:\Windows\System32\svchost.exe,3720c76ddafd3a8604dbaa1ea25c66c9,C:\Windows\System32\svchost.exe -k LocalService,SERVICE_WIN32_SHARE_PROCESS,C:\Windows\System32\netprofm.dll,true,true,The file is signed and the signature was verified.,Microsoft Windows,Microsoft Windows Verification PCA
ET703OSY,kbdclass,Keyboard Class Driver,,C:\Windows\System32\drivers\kbdclass.sys,ac867d9fd400ccf85e0bb29c3101628a,\SystemRoot\system32\drivers\kbdclass.sys,SERVICE_KERNEL_DRIVER,,true,true,The file is signed and the signature was verified.,Microsoft Windows,Microsoft Windows Verification PCA
ET703OSY,cfwids,McAfee Inc. cfwids,,C:\Windows\System32\drivers\cfwids.sys,88be3300147c68c1c3e10de8f115d022,system32\drivers\cfwids.sys,SERVICE_KERNEL_DRIVER,,true,true,The file is signed and the signature was verified.,Microsoft Windows Hardware Compatibility Publisher,Microsoft Windows Hardware Compatibility PCA
ET703OSY,McAPExe,McAfee AP Service,McAfee AP Service,C:\Program Files\Common Files\McAfee\VSCore_18_6\mcapexe.exe,3dc7d2d804d63dadca1a4fa7ca11fd43,"C:\Program Files\Common Files\McAfee\VSCore_18_6\McApExe.exe""""""",SERVICE_WIN32_OWN_PROCESS,,true,true,The file is signed and the signature was verified.,"""McAfee",Symantec Class 3 SHA256 Code Signing CA
ET703OSY,RpcEptMapper,RPC Endpoint Mapper,Resolves RPC interfaces identifiers to transport endpoints. If this service is stopped or disabled  programs using Remote Procedure Call (RPC) services will not function properly.,C:\Windows\System32\svchost.exe,3720c76ddafd3a8604dbaa1ea25c66c9,C:\Windows\system32\svchost.exe -k RPCSS,SERVICE_WIN32_SHARE_PROCESS,C:\Windows\System32\RpcEpMap.dll,true,true,The file is signed and the signature was verified.,Microsoft Windows,Microsoft Windows Verification PCA
ET703OSY,fdc,Floppy Disk Controller Driver,,C:\Windows\System32\drivers\fdc.sys,5eb25a5c9fea4c2e1b60dd553ffefcae,\SystemRoot\system32\drivers\fdc.sys,SERVICE_KERNEL_DRIVER,,true,true,The file is signed and the signature was verified.,Microsoft Windows,Microsoft Windows Verification PCA
ET703OSY,lltdio,Link-Layer Topology Discovery Mapper I/O Driver,,C:\Windows\System32\drivers\lltdio.sys,f24cf831a71d86ff687964c17ceb485c,system32\DRIVERS\lltdio.sys,SERVICE_KERNEL_DRIVER,,true,true,The file is signed and the signature was verified.,Microsoft Windows,Microsoft Windows Verification PCA
ET703OSY,WPDBusEnum,Portable Device Enumerator Service,Enforces group policy for removable mass-storage devices. Enables applications such as Windows Media Player and Image Import Wizard to transfer and synchronize content using removable mass-storage devices.,C:\Windows\System32\svchost.exe,3720c76ddafd3a8604dbaa1ea25c66c9,C:\Windows\system32\svchost.exe -k LocalSystemNetworkRestricted,SERVICE_WIN32_SHARE_PROCESS,C:\Windows\System32\wpdbusenum.dll,true,true,The file is signed and the signature was verified.,Microsoft Windows,Microsoft Windows Verification PCA
ET703OSY,Schedule,Task Scheduler,Enables a user to configure and schedule automated tasks on this computer. The service also hosts multiple Windows system-critical tasks. If this service is stopped or disabled  these tasks will not be run at their scheduled times. If this service is disabled  any services that explicitly depend on it will fail to start.,C:\Windows\System32\svchost.exe,3720c76ddafd3a8604dbaa1ea25c66c9,C:\Windows\system32\svchost.exe -k netsvcs,SERVICE_WIN32_SHARE_PROCESS,C:\Windows\System32\schedsvc.dll,true,true,The file is signed and the signature was verified.,Microsoft Windows,Microsoft Windows Verification PCA
ET703OSY,cdrom,cdrom,,C:\Windows\System32\drivers\cdrom.sys,7a2dcc0888ecbadc98c2eadfbb8a4a48,\SystemRoot\system32\drivers\cdrom.sys,SERVICE_KERNEL_DRIVER,,true,true,The file is signed and the signature was verified.,Microsoft Windows,Microsoft Windows Verification PCA
ET703OSY,Appinfo,Application Information,Facilitates the running of interactive applications with additional administrative privileges.  If this service is stopped  users will be unable to launch applications with the additional administrative privileges they may require to perform desired user tasks.,C:\Windows\System32\svchost.exe,3720c76ddafd3a8604dbaa1ea25c66c9,C:\Windows\system32\svchost.exe -k netsvcs,SERVICE_WIN32_SHARE_PROCESS,C:\Windows\System32\appinfo.dll,true,true,The file is signed and the signature was verified.,Microsoft Windows,Microsoft Windows Verification PCA
ET703OSY,adpahci,adpahci,,C:\Windows\System32\drivers\adpahci.sys,711ae0a5f623062aed66e813986a9e27,\SystemRoot\system32\drivers\adpahci.sys,SERVICE_KERNEL_DRIVER,,true,true,The file is signed and the signature was verified.,Microsoft Windows,Microsoft Windows Verification PCA
ET703OSY,discache,System Attribute Cache,Attribute Cache Indexer,C:\Windows\System32\drivers\discache.sys,8dbf4a28374acdf489921c2953bb8a4d,System32\drivers\discache.sys,SERVICE_KERNEL_DRIVER,,true,true,The file is signed and the signature was verified.,Microsoft Windows,Microsoft Windows Verification PCA
ET703OSY,iaStorV,iaStorV,,C:\Windows\System32\drivers\iaStorV.sys,e2155f85569606b828245287f34c4198,\SystemRoot\system32\drivers\iaStorV.sys,SERVICE_KERNEL_DRIVER,,true,true,The file is signed and the signature was verified.,Microsoft Windows,Microsoft Windows Verification PCA
ET703OSY,adpu320,adpu320,,C:\Windows\System32\drivers\adpu320.sys,47d9f43663fb1b6eab457e45be2f85a2,\SystemRoot\system32\drivers\adpu320.sys,SERVICE_KERNEL_DRIVER,,true,true,The file is signed and the signature was verified.,Microsoft Windows,Microsoft Windows Verification PCA
ET703OSY,amdsbs,amdsbs,,C:\Windows\System32\drivers\amdsbs.sys,c3871b0b6b0bec38e14662cdfc57801a,\SystemRoot\system32\drivers\amdsbs.sys,SERVICE_KERNEL_DRIVER,,true,true,The file is signed and the signature was verified.,Microsoft Windows,Microsoft Windows Verification PCA
ET703OSY,volsnap,Storage volumes,,C:\Windows\System32\drivers\volsnap.sys,055fddceb2d0ed9c1a672b543772e3b8,\SystemRoot\system32\drivers\volsnap.sys,SERVICE_KERNEL_DRIVER,,true,true,The file is signed and the signature was verified.,Microsoft Windows,Microsoft Windows Verification PCA
ET703OSY,sacdrv,sacdrv,,C:\Windows\System32\drivers\sacdrv.sys,1863de669dc7c3f142f44b56077e082f,\SystemRoot\system32\DRIVERS\sacdrv.sys,SERVICE_KERNEL_DRIVER,,true,true,The file is signed and the signature was verified.,Microsoft Windows,Microsoft Windows Verification PCA
ET703OSY,tssecsrv,Remote Desktop Services Security Filter Driver,Remote Desktop Services Security Filter Driver,C:\Windows\System32\drivers\tssecsrv.sys,b78f2f2ac9c6b524cb8699a5f3ad5054,System32\DRIVERS\tssecsrv.sys,SERVICE_KERNEL_DRIVER,,true,true,The file is signed and the signature was verified.,Microsoft Windows,Microsoft Windows Verification PCA
ET703OSY,sffp_mmc,SFF Storage Protocol Driver for MMC,,C:\Windows\System32\drivers\sffp_mmc.sys,7093d2b035b4f0f1a095134f50c140cb,\SystemRoot\system32\drivers\sffp_mmc.sys,SERVICE_KERNEL_DRIVER,,true,true,The file is signed and the signature was verified.,Microsoft Windows,Microsoft Windows Verification PCA
ET703OSY,defragsvc,Disk Defragmenter,Provides Disk Defragmentation Capabilities.,C:\Windows\System32\svchost.exe,3720c76ddafd3a8604dbaa1ea25c66c9,C:\Windows\system32\svchost.exe -k defragsvc,SERVICE_WIN32_OWN_PROCESS,C:\Windows\System32\defragsvc.dll,true,true,The file is signed and the signature was verified.,Microsoft Windows,Microsoft Windows Verification PCA
ET703OSY,CNG,CNG,,C:\Windows\System32\drivers\cng.sys,0e7f9998ac1fe972696442fd930c671f,\SystemRoot\System32\Drivers\cng.sys,SERVICE_KERNEL_DRIVER,,true,true,The file is signed and the signature was verified.,Microsoft Windows,Microsoft Windows Verification PCA
ET703OSY,McAWFwk,McAfee Activation Service,McAfee Activation Service,c:\Program Files\Common Files\McAfee\ActWiz\McAWFwk.exe,9b8f6c0ebab01e1a509e5751a4e80858,c:\PROGRA~1\COMMON~1\mcafee\actwiz\mcawfwk.exe,SERVICE_WIN32_OWN_PROCESS,,true,true,The file is signed and the signature was verified.,"McAfee""",Symantec Class 3 SHA256 Code Signing CA
ET703OSY,CLFS,Common Log (CLFS),General-purpose logging service,C:\Windows\System32\clfs.sys,3eb90cc1afb006fca6ade1660745360b,\SystemRoot\System32\CLFS.sys,SERVICE_KERNEL_DRIVER,,true,true,The file is signed and the signature was verified.,Microsoft Windows,Microsoft Windows Verification PCA
ET703OSY,b57nd60a,Broadcom NetXtreme Gigabit Ethernet - NDIS 6.0,,C:\Windows\System32\drivers\b57nd60a.sys,c1c600cde94c12c80c2f05a25b34277d,system32\DRIVERS\b57nd60a.sys,SERVICE_KERNEL_DRIVER,,true,true,The file is signed and the signature was verified.,Microsoft Windows,Microsoft Windows Verification PCA
ET703OSY,AppIDSvc,Application Identity,Determines and verifies the identity of an application. Disabling this service will prevent AppLocker from being enforced.,C:\Windows\System32\svchost.exe,3720c76ddafd3a8604dbaa1ea25c66c9,C:\Windows\system32\svchost.exe -k LocalServiceAndNoImpersonation,SERVICE_WIN32_SHARE_PROCESS,C:\Windows\System32\appidsvc.dll,true,true,The file is signed and the signature was verified.,Microsoft Windows,Microsoft Windows Verification PCA
ET703OSY,BITS,Background Intelligent Transfer Service,Transfers files in the background using idle network bandwidth. If the service is disabled  then any applications that depend on BITS  such as Windows Update or MSN Explorer  will be unable to automatically download programs and other information.,C:\Windows\System32\svchost.exe,3720c76ddafd3a8604dbaa1ea25c66c9,C:\Windows\System32\svchost.exe -k netsvcs,SERVICE_WIN32_SHARE_PROCESS,C:\Windows\System32\qmgr.dll,true,true,The file is signed and the signature was verified.,Microsoft Windows,Microsoft Windows Verification PCA
