hostname,name,descriptivename,description,path,md5,arguments,type,servicedll,pathsignatureexists,pathsignatureverified,pathsignaturedescription,pathcertificatesubject,pathcertificateissuer
ET703OSY,UmPass,Microsoft UMPass Driver,,C:\Windows\System32\drivers\umpass.sys,b99de97e3deecd3495eefcd686d42909,\SystemRoot\system32\drivers\umpass.sys,SERVICE_KERNEL_DRIVER,,true,true,The file is signed and the signature was verified.,Microsoft Windows,Microsoft Windows Verification PCA
ET703OSY,ql40xx,ql40xx,,C:\Windows\System32\drivers\ql40xx.sys,9804a315e396c4e436b9ba544a74aa0c,\SystemRoot\system32\drivers\ql40xx.sys,SERVICE_KERNEL_DRIVER,,true,true,The file is signed and the signature was verified.,Microsoft Windows,Microsoft Windows Verification PCA
ET703OSY,tunnel,Microsoft Tunnel Miniport Adapter Driver,,C:\Windows\System32\drivers\tunnel.sys,66e6f9153a37cdb07824945d137a390e,system32\DRIVERS\tunnel.sys,SERVICE_KERNEL_DRIVER,,true,true,The file is signed and the signature was verified.,Microsoft Windows,Microsoft Windows Verification PCA
ET703OSY,eventlog,Windows Event Log,This service manages events and event logs. It supports logging events  querying events  subscribing to events  archiving event logs  and managing event metadata. It can display events in both XML and plain text format. Stopping this service may compromise security and reliability of the system.,C:\Windows\System32\svchost.exe,3720c76ddafd3a8604dbaa1ea25c66c9,C:\Windows\System32\svchost.exe -k LocalServiceNetworkRestricted,SERVICE_WIN32_SHARE_PROCESS,,true,true,The file is signed and the signature was verified.,Microsoft Windows,Microsoft Windows Verification PCA
ET703OSY,WinHttpAutoProxySvc,WinHTTP Web Proxy Auto-Discovery Service,WinHTTP implements the client HTTP stack and provides developers with a Win32 API and COM Automation component for sending HTTP requests and receiving responses. In addition  WinHTTP provides support for auto-discovering a proxy configuration via its implementation of the Web Proxy Auto-Discovery (WPAD) protocol.,C:\Windows\System32\svchost.exe,3720c76ddafd3a8604dbaa1ea25c66c9,C:\Windows\system32\svchost.exe -k LocalService,SERVICE_WIN32_SHARE_PROCESS,C:\Windows\System32\winhttp.dll,true,true,The file is signed and the signature was verified.,Microsoft Windows,Microsoft Windows Verification PCA
ET703OSY,WacomPen,Wacom Serial Pen HID Driver,,C:\Windows\System32\drivers\wacompen.sys,a78040dec69569619f68d8f86d113602,\SystemRoot\system32\drivers\wacompen.sys,SERVICE_KERNEL_DRIVER,,true,true,The file is signed and the signature was verified.,Microsoft Windows,Microsoft Windows Verification PCA
ET703OSY,mfefirek,McAfee Inc. mfefirek,,C:\Windows\System32\drivers\mfefirek.sys,33f3d136090acd2b5b7306c3c1347b97,system32\drivers\mfefirek.sys,SERVICE_KERNEL_DRIVER,,true,true,The file is signed and the signature was verified.,Microsoft Windows Hardware Compatibility Publisher,Microsoft Windows Hardware Compatibility PCA
ET703OSY,IKEEXT,IKE and AuthIP IPsec Keying Modules,The IKEEXT service hosts the Internet Key Exchange (IKE) and Authenticated Internet Protocol (AuthIP) keying modules. These keying modules are used for authentication and key exchange in Internet Protocol security (IPsec). Stopping or disabling the IKEEXT service will disable IKE and AuthIP key exchange with peer computers. IPsec is typically configured to use IKE or AuthIP; therefore  stopping or disabling the IKEEXT service might result in an IPsec failure and might compromise the security of the system. It is strongly recommended that you have the IKEEXT service running.,C:\Windows\System32\svchost.exe,3720c76ddafd3a8604dbaa1ea25c66c9,C:\Windows\system32\svchost.exe -k netsvcs,SERVICE_WIN32_SHARE_PROCESS,C:\Windows\System32\IKEEXT.DLL,true,true,The file is signed and the signature was verified.,Microsoft Windows,Microsoft Windows Verification PCA
ET703OSY,luafv,UAC File Virtualization,Virtualizes file write failures to per-user locations.,C:\Windows\System32\drivers\luafv.sys,e35a0f37898a1520b9f7851a74c13bea,\SystemRoot\system32\drivers\luafv.sys,SERVICE_FILE_SYSTEM_DRIVER,,true,true,The file is signed and the signature was verified.,Microsoft Windows,Microsoft Windows Verification PCA
ET703OSY,srvnet,srvnet,,C:\Windows\System32\drivers\srvnet.sys,dd467243e8964549c87a1d1e426c92ee,System32\DRIVERS\srvnet.sys,SERVICE_FILE_SYSTEM_DRIVER,,true,true,The file is signed and the signature was verified.,Microsoft Windows,Microsoft Windows Verification PCA
ET703OSY,AppID,AppID Driver,Identifies an application and enforces software restriction policies.,C:\Windows\System32\drivers\appid.sys,c355fa783d3b5d3a9f7d9cd9c6dc8294,\SystemRoot\system32\drivers\appid.sys,SERVICE_KERNEL_DRIVER,,true,true,The file is signed and the signature was verified.,Microsoft Windows,Microsoft Windows Verification PCA
ET703OSY,nsiproxy,NSI proxy service driver.,NSI proxy service.,C:\Windows\System32\drivers\nsiproxy.sys,b51c54dd965f72838c37bbb7acc1f3ee,system32\drivers\nsiproxy.sys,SERVICE_KERNEL_DRIVER,,true,true,The file is signed and the signature was verified.,Microsoft Windows,Microsoft Windows Verification PCA
ET703OSY,IPNAT,IP Network Address Translator,,C:\Windows\System32\drivers\ipnat.sys,aeb09b2e0e3b026b6d14c1a9d2be9599,System32\drivers\ipnat.sys,SERVICE_KERNEL_DRIVER,,true,true,The file is signed and the signature was verified.,Microsoft Windows,Microsoft Windows Verification PCA
ET703OSY,vga,vga,,C:\Windows\System32\drivers\vgapnp.sys,e8d398ee3f5bbe0a01f3455db84c01e6,system32\DRIVERS\vgapnp.sys,SERVICE_KERNEL_DRIVER,,true,true,The file is signed and the signature was verified.,Microsoft Windows,Microsoft Windows Verification PCA
ET703OSY,ql2300,ql2300,,C:\Windows\System32\drivers\ql2300.sys,c0ec0cd79eaf98c91af0aab3be2ba15f,\SystemRoot\system32\drivers\ql2300.sys,SERVICE_KERNEL_DRIVER,,true,true,The file is signed and the signature was verified.,Microsoft Windows,Microsoft Windows Verification PCA
ET703OSY,MTConfig,Microsoft Input Configuration Driver,,C:\Windows\System32\drivers\MTConfig.sys,0937ea11f5c5610eb9c94dc5a1650804,\SystemRoot\system32\drivers\MTConfig.sys,SERVICE_KERNEL_DRIVER,,true,true,The file is signed and the signature was verified.,Microsoft Windows,Microsoft Windows Verification PCA
ET703OSY,rdbss,Redirected Buffering Sub Sysytem,Provides the framework for network mini-redirectors,C:\Windows\System32\drivers\rdbss.sys,63dba8aa055d05af1dd771ae13d31f93,system32\DRIVERS\rdbss.sys,SERVICE_FILE_SYSTEM_DRIVER,,true,true,The file is signed and the signature was verified.,Microsoft Windows,Microsoft Windows Verification PCA
ET703OSY,Serial,Serial port driver,,C:\Windows\System32\drivers\serial.sys,02cb14304bb7f2efc160ede8ed01e984,\SystemRoot\system32\drivers\serial.sys,SERVICE_KERNEL_DRIVER,,true,true,The file is signed and the signature was verified.,Microsoft Windows,Microsoft Windows Verification PCA
ET703OSY,Dnscache,DNS Client,The DNS Client service (dnscache) caches Domain Name System (DNS) names and registers the full computer name for this computer. If the service is stopped  DNS names will continue to be resolved. However  the results of DNS name queries will not be cached and the computer's name will not be registered. If the service is disabled  any services that explicitly depend on it will fail to start.,C:\Windows\System32\svchost.exe,3720c76ddafd3a8604dbaa1ea25c66c9,C:\Windows\system32\svchost.exe -k NetworkService,SERVICE_WIN32_SHARE_PROCESS,C:\Windows\System32\dnsrslvr.dll,true,true,The file is signed and the signature was verified.,Microsoft Windows,Microsoft Windows Verification PCA
ET703OSY,RpcLocator,Remote Procedure Call (RPC) Locator,In Windows 2003 and earlier versions of Windows  the Remote Procedure Call (RPC) Locator service manages the RPC name service database. In Windows Vista and later versions of Windows  this service does not provide any functionality and is present for application compatibility.,C:\Windows\System32\Locator.exe,2da0c84b7bce348f7d90497df3e0f4db,C:\Windows\system32\locator.exe,SERVICE_WIN32_OWN_PROCESS,,true,true,The file is signed and the signature was verified.,Microsoft Windows,Microsoft Windows Verification PCA
ET703OSY,clr_optimization_v4.0.30319_32,Microsoft .NET Framework NGEN v4.0.30319_X86,Microsoft .NET Framework NGEN,C:\Windows\Microsoft.NET\Framework\v4.0.30319\mscorsvw.exe,68fc05e776b303db5895b2d95d73b0f5,C:\Windows\Microsoft.NET\Framework\v4.0.30319\mscorsvw.exe,SERVICE_WIN32_OWN_PROCESS,,true,true,The file is signed and the signature was verified.,Microsoft Dynamic Code Publisher,Microsoft Code Signing PCA
ET703OSY,Power,Power,Manages power policy and power policy notification delivery.,C:\Windows\System32\svchost.exe,3720c76ddafd3a8604dbaa1ea25c66c9,C:\Windows\system32\svchost.exe -k DcomLaunch,SERVICE_WIN32_SHARE_PROCESS,C:\Windows\System32\umpo.dll,true,true,The file is signed and the signature was verified.,Microsoft Windows,Microsoft Windows Verification PCA
ET703OSY,mrxsmb20,SMB 2.0 MiniRedirector,Implements the SMB 2.0 protocol  which provides connectivity to network resources on Windows Vista and later servers,C:\Windows\System32\drivers\mrxsmb20.sys,0c34e09f70cc7811bdf588adefea33a7,system32\DRIVERS\mrxsmb20.sys,SERVICE_FILE_SYSTEM_DRIVER,,true,true,The file is signed and the signature was verified.,Microsoft Windows,Microsoft Windows Verification PCA
ET703OSY,LanmanWorkstation,Workstation,Creates and maintains client network connections to remote servers using the SMB protocol. If this service is stopped  these connections will be unavailable. If this service is disabled  any services that explicitly depend on it will fail to start.,C:\Windows\System32\svchost.exe,3720c76ddafd3a8604dbaa1ea25c66c9,C:\Windows\System32\svchost.exe -k NetworkService,SERVICE_WIN32_SHARE_PROCESS,C:\Windows\System32\wkssvc.dll,true,true,The file is signed and the signature was verified.,Microsoft Windows,Microsoft Windows Verification PCA
ET703OSY,usbehci,Microsoft USB 2.0 Enhanced Host Controller Miniport Driver,,C:\Windows\System32\drivers\usbehci.sys,8069350d7a17e69b88f58c7c10d14873,\SystemRoot\system32\drivers\usbehci.sys,SERVICE_KERNEL_DRIVER,,true,true,The file is signed and the signature was verified.,Microsoft Windows,Microsoft Windows Verification PCA
ET703OSY,DiagTrack,Diagnostics Tracking Service,The Diagnostics Tracking Service enables data collection about functional issues in Windows components.,C:\Windows\System32\svchost.exe,3720c76ddafd3a8604dbaa1ea25c66c9,C:\Windows\System32\svchost.exe -k utcsvc,SERVICE_WIN32_OWN_PROCESS,C:\Windows\System32\diagtrack.dll,true,true,The file is signed and the signature was verified.,Microsoft Windows,Microsoft Windows Verification PCA
ET703OSY,PEAUTH,PEAUTH,,C:\Windows\System32\drivers\PEAuth.sys,38ce60494a149c3c4c2a73c14b275026,system32\drivers\peauth.sys,SERVICE_KERNEL_DRIVER,,true,true,The file is signed and the signature was verified.,Microsoft Windows,Microsoft Windows Verification PCA
ET703OSY,pcw,Performance Counters for Windows Driver,,C:\Windows\System32\drivers\pcw.sys,dae006bb1d3ee6895a4c7191ae6d1dbe,\SystemRoot\System32\drivers\pcw.sys,SERVICE_KERNEL_DRIVER,,true,true,The file is signed and the signature was verified.,Microsoft Windows,Microsoft Windows Verification PCA
ET703OSY,TDTCP,TDTCP,,C:\Windows\System32\drivers\tdtcp.sys,65f33d5859a3bfdf10c62747db10c28b,system32\drivers\tdtcp.sys,SERVICE_KERNEL_DRIVER,,true,true,The file is signed and the signature was verified.,Microsoft Windows,Microsoft Windows Verification PCA
ET703OSY,0062601541359992mcinstcleanup,McAfee Application Installer Cleanup (0062601541359992),,C:\Users\$user\AppData\Local\Temp\0062601541359992mcinst.exe,fafa00045234cd78e26bada86a9f9bb5,C:\Users\$user\AppData\Local\Temp\006260~1.EXE -cleanup -nolog,SERVICE_WIN32_OWN_PROCESS,,true,true,The file is signed and the signature was verified.,"McAfee""",VeriSign Class 3 Code Signing 2010 CA
ET703OSY,AxInstSV,ActiveX Installer (AxInstSV),Provides User Account Control validation for the installation of ActiveX controls from the Internet and enables management of ActiveX control installation based on Group Policy settings. This service is started on demand and if disabled the installation of ActiveX controls will behave according to default browser settings.,C:\Windows\System32\svchost.exe,3720c76ddafd3a8604dbaa1ea25c66c9,C:\Windows\system32\svchost.exe -k AxInstSVGroup,SERVICE_WIN32_SHARE_PROCESS,C:\Windows\System32\AxInstSv.dll,true,true,The file is signed and the signature was verified.,Microsoft Windows,Microsoft Windows Verification PCA
ET703OSY,iScsiPrt,iScsiPort Driver,,C:\Windows\System32\drivers\msiscsi.sys,3de54f2df4935ba310eef88409eb6306,\SystemRoot\system32\drivers\msiscsi.sys,SERVICE_KERNEL_DRIVER,,true,true,The file is signed and the signature was verified.,Microsoft Windows,Microsoft Windows Verification PCA
ET703OSY,UxSms,Desktop Window Manager Session Manager,Provides Desktop Window Manager startup and maintenance services,C:\Windows\System32\svchost.exe,3720c76ddafd3a8604dbaa1ea25c66c9,C:\Windows\System32\svchost.exe -k LocalSystemNetworkRestricted,SERVICE_WIN32_SHARE_PROCESS,C:\Windows\System32\uxsms.dll,true,true,The file is signed and the signature was verified.,Microsoft Windows,Microsoft Windows Verification PCA
ET703OSY,udfs,udfs,Reads/Writes UDF 1.02 1.5 2.0x 2.5 disc formats  usually found on C/DVD discs. (Core) (All pieces),C:\Windows\System32\drivers\udfs.sys,69f7d994db0cda6ad7e26fe1adea240e,system32\DRIVERS\udfs.sys,SERVICE_FILE_SYSTEM_DRIVER,,true,true,The file is signed and the signature was verified.,Microsoft Windows,Microsoft Windows Verification PCA
ET703OSY,BFE,Base Filtering Engine,The Base Filtering Engine (BFE) is a service that manages firewall and Internet Protocol security (IPsec) policies and implements user mode filtering. Stopping or disabling the BFE service will significantly reduce the security of the system. It will also result in unpredictable behavior in IPsec management and firewall applications.,C:\Windows\System32\svchost.exe,3720c76ddafd3a8604dbaa1ea25c66c9,C:\Windows\system32\svchost.exe -k LocalServiceNoNetwork,SERVICE_WIN32_SHARE_PROCESS,C:\Windows\System32\BFE.DLL,true,true,The file is signed and the signature was verified.,Microsoft Windows,Microsoft Windows Verification PCA
ET703OSY,nvstor,nvstor,,C:\Windows\System32\drivers\nvstor.sys,2b56f2b57871f363f0ddab13ff7689ea,\SystemRoot\system32\drivers\nvstor.sys,SERVICE_KERNEL_DRIVER,,true,true,The file is signed and the signature was verified.,Microsoft Windows,Microsoft Windows Verification PCA
ET703OSY,MSiSCSI,Microsoft iSCSI Initiator Service,Manages Internet SCSI (iSCSI) sessions from this computer to remote iSCSI target devices. If this service is stopped  this computer will not be able to login or access iSCSI targets. If this service is disabled  any services that explicitly depend on it will fail to start.,C:\Windows\System32\svchost.exe,3720c76ddafd3a8604dbaa1ea25c66c9,C:\Windows\system32\svchost.exe -k netsvcs,SERVICE_WIN32_SHARE_PROCESS,C:\Windows\System32\iscsiexe.dll,true,true,The file is signed and the signature was verified.,Microsoft Windows,Microsoft Windows Verification PCA
ET703OSY,Mup,Mup,Multiple UNC Provider Driver,C:\Windows\System32\drivers\mup.sys,e44f40d5cf4e10cf4c7df913269d5f39,\SystemRoot\System32\Drivers\mup.sys,SERVICE_FILE_SYSTEM_DRIVER,,true,true,The file is signed and the signature was verified.,Microsoft Windows,Microsoft Windows Verification PCA
ET703OSY,hkmsvc,Health Key and Certificate Management,Provides X.509 certificate and key management services for the Network Access Protection Agent (NAPAgent). Enforcement technologies that use X.509 certificates may not function properly without this service,C:\Windows\System32\svchost.exe,3720c76ddafd3a8604dbaa1ea25c66c9,C:\Windows\System32\svchost.exe -k netsvcs,SERVICE_WIN32_SHARE_PROCESS,C:\Windows\System32\KMSVC.DLL,true,true,The file is signed and the signature was verified.,Microsoft Windows,Microsoft Windows Verification PCA
ET703OSY,RDPCDD,RDPCDD,RDPDD Chained DD,C:\Windows\System32\drivers\RDPCDD.sys,e2a522d6dc48e5e74f2f9cdc7cedde9f,System32\DRIVERS\RDPCDD.sys,SERVICE_KERNEL_DRIVER,,true,true,The file is signed and the signature was verified.,Microsoft Windows,Microsoft Windows Verification PCA
ET703OSY,tcpipreg,TCP/IP Registry Compatibility,Provides compatibility for legacy applications which interact with TCP/IP through the registry. If this service is stopped  certain applications may have impaired functionality.,C:\Windows\System32\drivers\tcpipreg.sys,0138ef1e34cfb66e4399fa8230691e50,System32\drivers\tcpipreg.sys,SERVICE_KERNEL_DRIVER,,true,true,The file is signed and the signature was verified.,Microsoft Windows,Microsoft Windows Verification PCA
ET703OSY,AudioSrv,Windows Audio,Manages audio for Windows-based programs.  If this service is stopped  audio devices and effects will not function properly.  If this service is disabled  any services that explicitly depend on it will fail to start,C:\Windows\System32\svchost.exe,3720c76ddafd3a8604dbaa1ea25c66c9,C:\Windows\System32\svchost.exe -k LocalServiceNetworkRestricted,SERVICE_WIN32_SHARE_PROCESS,C:\Windows\System32\audiosrv.dll,true,true,The file is signed and the signature was verified.,Microsoft Windows,Microsoft Windows Verification PCA
ET703OSY,mfeplk,McAfee Inc. mfeplk,,C:\Windows\System32\drivers\mfeplk.sys,532ce3116b0cbf432fd28536c4546309,system32\drivers\mfeplk.sys,SERVICE_KERNEL_DRIVER,,true,true,The file is signed and the signature was verified.,Microsoft Windows Hardware Compatibility Publisher,Microsoft Windows Hardware Compatibility PCA
ET703OSY,cmdide,cmdide,,C:\Windows\System32\drivers\cmdide.sys,0206237cc0c2286910066ef4a83f31dc,\SystemRoot\system32\drivers\cmdide.sys,SERVICE_KERNEL_DRIVER,,true,true,The file is signed and the signature was verified.,Microsoft Windows,Microsoft Windows Verification PCA
ET703OSY,sffdisk,SFF Storage Class Driver,,C:\Windows\System32\drivers\sffdisk.sys,0afac3014229246197deb60ae41e2ad8,\SystemRoot\system32\drivers\sffdisk.sys,SERVICE_KERNEL_DRIVER,,true,true,The file is signed and the signature was verified.,Microsoft Windows,Microsoft Windows Verification PCA
ET703OSY,FsDepends,File System Dependency Minifilter,This minifilter tracks the dependencies associated with the various nested volumes/filesystems,C:\Windows\System32\drivers\FsDepends.sys,4a4dfa224e459f1918d60ab3ed28b3cf,System32\drivers\FsDepends.sys,SERVICE_FILE_SYSTEM_DRIVER,,true,true,The file is signed and the signature was verified.,Microsoft Windows,Microsoft Windows Verification PCA
ET703OSY,aliide,aliide,,C:\Windows\System32\drivers\aliide.sys,0cfdef5c14468f4e762b0051465fde22,\SystemRoot\system32\drivers\aliide.sys,SERVICE_KERNEL_DRIVER,,true,true,The file is signed and the signature was verified.,Microsoft Windows,Microsoft Windows Verification PCA
ET703OSY,BrSerWdm,Brother WDM Serial driver,,C:\Windows\System32\drivers\BrSerWdm.sys,55513cc91a1e19d924acbf5920a62e4d,\SystemRoot\System32\Drivers\BrSerWdm.sys,SERVICE_KERNEL_DRIVER,,true,true,The file is signed and the signature was verified.,Microsoft Windows,Microsoft Windows Verification PCA
ET703OSY,McAfee WebAdvisor,McAfee WebAdvisor,McAfee WebAdvisor Service,C:\Program Files\McAfee\WebAdvisor\ServiceHost.exe,cfa0dfdb3dbb41768a13b9dcb6f174be,C:\Program Files\McAfee\WebAdvisor\ServiceHost.exe,SERVICE_WIN32_OWN_PROCESS,,true,true,The file is signed and the signature was verified.,"McAfee""",VeriSign Class 3 Code Signing 2010 CA
ET703OSY,mssmbios,Microsoft System Management BIOS Driver,,C:\Windows\System32\drivers\mssmbios.sys,525b6ad56d5e79bcf716ddc2e8316335,\SystemRoot\system32\drivers\mssmbios.sys,SERVICE_KERNEL_DRIVER,,true,true,The file is signed and the signature was verified.,Microsoft Windows,Microsoft Windows Verification PCA
ET703OSY,Processor,Processor Driver,,C:\Windows\System32\drivers\processr.sys,1a49bf28deda983eaf583e7f59e4535e,\SystemRoot\system32\drivers\processr.sys,SERVICE_KERNEL_DRIVER,,true,true,The file is signed and the signature was verified.,Microsoft Windows,Microsoft Windows Verification PCA
ET703OSY,BrFiltUp,Brother USB Mass-Storage Upper Filter Driver,,C:\Windows\System32\drivers\BrFiltUp.sys,6e0b43e1dc694069aead9ce9d3297fc0,\SystemRoot\system32\drivers\BrFiltUp.sys,SERVICE_KERNEL_DRIVER,,true,true,The file is signed and the signature was verified.,Microsoft Windows,Microsoft Windows Verification PCA
ET703OSY,ShellHWDetection,Shell Hardware Detection,Provides notifications for AutoPlay hardware events.,C:\Windows\System32\svchost.exe,3720c76ddafd3a8604dbaa1ea25c66c9,C:\Windows\System32\svchost.exe -k netsvcs,SERVICE_WIN32_SHARE_PROCESS,C:\Windows\System32\shsvcs.dll,true,true,The file is signed and the signature was verified.,Microsoft Windows,Microsoft Windows Verification PCA
ET703OSY,ksthunk,Kernel Streaming Thunks,,C:\Windows\System32\drivers\ksthunk.sys,a52a61c045d43998a246dc375deced0e,\SystemRoot\system32\drivers\ksthunk.sys,SERVICE_KERNEL_DRIVER,,true,true,The file is signed and the signature was verified.,Microsoft Windows,Microsoft Windows Verification PCA
ET703OSY,seclogon,Secondary Logon,Enables starting processes under alternate credentials. If this service is stopped  this type of logon access will be unavailable. If this service is disabled  any services that explicitly depend on it will fail to start.,C:\Windows\System32\svchost.exe,3720c76ddafd3a8604dbaa1ea25c66c9,C:\Windows\system32\svchost.exe -k netsvcs,SERVICE_WIN32_SHARE_PROCESS,C:\Windows\System32\seclogon.dll,true,true,The file is signed and the signature was verified.,Microsoft Windows,Microsoft Windows Verification PCA
ET703OSY,LanmanServer,Server,Supports file  print  and named-pipe sharing over the network for this computer. If this service is stopped  these functions will be unavailable. If this service is disabled  any services that explicitly depend on it will fail to start.,C:\Windows\System32\svchost.exe,3720c76ddafd3a8604dbaa1ea25c66c9,C:\Windows\system32\svchost.exe -k netsvcs,SERVICE_WIN32_SHARE_PROCESS,C:\Windows\System32\srvsvc.dll,true,true,The file is signed and the signature was verified.,Microsoft Windows,Microsoft Windows Verification PCA
ET703OSY,storvsp,storvsp,,C:\Windows\System32\drivers\storvsp.sys,e5c2c3da1177291b2a299af7dff0d8b5,\SystemRoot\system32\drivers\storvsp.sys,SERVICE_KERNEL_DRIVER,,true,true,The file is signed and the signature was verified.,Microsoft Windows,Microsoft Windows Verification PCA
ET703OSY,RasPppoe,Remote Access PPPOE Driver,Remote Access PPPOE Driver,C:\Windows\System32\drivers\raspppoe.sys,00bf891cd4b3685719097e5936860cbc,system32\DRIVERS\raspppoe.sys,SERVICE_KERNEL_DRIVER,,true,true,The file is signed and the signature was verified.,Microsoft Windows,Microsoft Windows Verification PCA
ET703OSY,Tcpip,TCP/IP Protocol Driver,TCP/IP Protocol Driver,C:\Windows\System32\drivers\tcpip.sys,99476c87444d8fa89271f6e86cccec9e,\SystemRoot\System32\drivers\tcpip.sys,SERVICE_KERNEL_DRIVER,,true,true,The file is signed and the signature was verified.,Microsoft Windows,Microsoft Windows Verification PCA
ET703OSY,stornvme,stornvme,,C:\Windows\System32\drivers\stornvme.sys,a557134eedd8bf2be6d054f6d0ef7651,\SystemRoot\system32\drivers\stornvme.sys,SERVICE_KERNEL_DRIVER,,true,true,The file is signed and the signature was verified.,Microsoft Windows,Microsoft Windows Verification PCA
ET703OSY,mfeaack,McAfee Inc. mfeaack,,C:\Windows\System32\drivers\mfeaack.sys,f8a641be7157137dba0586fecbbf0561,system32\drivers\mfeaack.sys,SERVICE_KERNEL_DRIVER,,true,true,The file is signed and the signature was verified.,Microsoft Windows Hardware Compatibility Publisher,Microsoft Windows Hardware Compatibility PCA
ET703OSY,Browser,Computer Browser,Maintains an updated list of computers on the network and supplies this list to computers designated as browsers. If this service is stopped  this list will not be updated or maintained. If this service is disabled  any services that explicitly depend on it will fail to start.,C:\Windows\System32\svchost.exe,3720c76ddafd3a8604dbaa1ea25c66c9,C:\Windows\System32\svchost.exe -k netsvcs,SERVICE_WIN32_SHARE_PROCESS,C:\Windows\System32\browser.dll,true,true,The file is signed and the signature was verified.,Microsoft Windows,Microsoft Windows Verification PCA
ET703OSY,Netlogon,Netlogon,Maintains a secure channel between this computer and the domain controller for authenticating users and services. If this service is stopped  the computer may not authenticate users and services and the domain controller cannot register DNS records. If this service is disabled  any services that explicitly depend on it will fail to start.,C:\Windows\System32\lsass.exe,18d5953fc74657ca3fb77fd92e0ac30b,C:\Windows\system32\lsass.exe,SERVICE_WIN32_SHARE_PROCESS,,true,true,The file is signed and the signature was verified.,Microsoft Windows,Microsoft Windows Verification PCA
ET703OSY,mpsdrv,Windows Firewall Authorization Driver,Windows Firewall Authorization Driver is a kernel mode driver that provides deep inspection services on inbound and outbound network traffic.,C:\Windows\System32\drivers\mpsdrv.sys,735a88cf638b8f0d07e2e4128c445aa7,System32\drivers\mpsdrv.sys,SERVICE_KERNEL_DRIVER,,true,true,The file is signed and the signature was verified.,Microsoft Windows,Microsoft Windows Verification PCA
ET703OSY,FontCache,Windows Font Cache Service,Optimizes performance of applications by caching commonly used font data. Applications will start this service if it is not already running. It can be disabled  though doing so will degrade application performance.,C:\Windows\System32\svchost.exe,3720c76ddafd3a8604dbaa1ea25c66c9,C:\Windows\system32\svchost.exe -k LocalService,SERVICE_WIN32_SHARE_PROCESS,C:\Windows\System32\FntCache.dll,true,true,The file is signed and the signature was verified.,Microsoft Windows,Microsoft Windows Verification PCA
