hostname,name,descriptivename,description,path,md5,arguments,type,servicedll,pathsignatureexists,pathsignatureverified,pathsignaturedescription,pathcertificatesubject,pathcertificateissuer
ET932KJK,partmgr,Partition Manager,Disk class filter driver that auctions out partitions to volume managers,C:\Windows\System32\drivers\partmgr.sys,37291405147599a367d51401e1d8b726,\SystemRoot\System32\drivers\partmgr.sys,SERVICE_KERNEL_DRIVER,,true,true,The file is signed and the signature was verified.,Microsoft Windows,Microsoft Windows Verification PCA
ET932KJK,ql2300,ql2300,,C:\Windows\System32\drivers\ql2300.sys,d8b5b3919be7f1940ac4d9a34b7659bb,\SystemRoot\system32\drivers\ql2300.sys,SERVICE_KERNEL_DRIVER,,true,true,The file is signed and the signature was verified.,Microsoft Windows,Microsoft Windows Verification PCA
ET932KJK,HTTP,HTTP,This service implements the hypertext transfer protocol (HTTP). If this service is disabled  any services that explicitly depend on it will fail to start.,C:\Windows\System32\drivers\http.sys,95c27bac9fc56c65eeed4d9021f4d79a,system32\drivers\HTTP.sys,SERVICE_KERNEL_DRIVER,,true,true,The file is signed and the signature was verified.,Microsoft Windows,Microsoft Windows Verification PCA
ET932KJK,mfesapsn,McAfee Process Start Notification Service,,C:\Program Files\McAfee\WebAdvisor\mfesapsn.sys,567df879597805e5abc3f7d3f015749b,\??\C:\Program Files\McAfee\WebAdvisor\mfesapsn.sys,SERVICE_KERNEL_DRIVER,,true,true,The file is signed and the signature was verified.,"""McAfee",VeriSign Class 3 Code Signing 2010 CA
ET932KJK,Wdf01000,Kernel Mode Driver Frameworks service,,C:\Windows\System32\drivers\Wdf01000.sys,5146a8c70ec322b3ff37556f90d6be52,\SystemRoot\system32\drivers\Wdf01000.sys,SERVICE_KERNEL_DRIVER,,true,true,The file is signed and the signature was verified.,Microsoft Windows,Microsoft Windows Verification PCA
ET932KJK,Browser,Computer Browser,Maintains an updated list of computers on the network and supplies this list to computers designated as browsers. If this service is stopped  this list will not be updated or maintained. If this service is disabled  any services that explicitly depend on it will fail to start.,C:\Windows\System32\svchost.exe,ef6a985f2225a97217fd856ace305923,C:\Windows\System32\svchost.exe -k netsvcs,SERVICE_WIN32_SHARE_PROCESS,C:\Windows\System32\browser.dll,true,true,The file is signed and the signature was verified.,Microsoft Windows,Microsoft Windows Verification PCA
ET932KJK,rdbss,Redirected Buffering Sub Sysytem,Provides the framework for network mini-redirectors,C:\Windows\System32\drivers\rdbss.sys,a6c93fdd95af323a33ca587382b35eb0,system32\DRIVERS\rdbss.sys,SERVICE_FILE_SYSTEM_DRIVER,,true,true,The file is signed and the signature was verified.,Microsoft Windows,Microsoft Windows Verification PCA
ET932KJK,srv2,Server SMB 2.xxx Driver,Enables connectivity from Windows Vista and later clients,C:\Windows\System32\drivers\srv2.sys,789436ab33de62168b44242ba3c3c573,System32\DRIVERS\srv2.sys,SERVICE_FILE_SYSTEM_DRIVER,,true,true,The file is signed and the signature was verified.,Microsoft Windows,Microsoft Windows Verification PCA
ET932KJK,COMSysApp,COM+ System Application,Manages the configuration and tracking of Component Object Model (COM)+-based components. If the service is stopped  most COM+-based components will not function properly. If this service is disabled  any services that explicitly depend on it will fail to start.,C:\Windows\System32\dllhost.exe,3a233ce6202040c469c16f7e8cd003f5,C:\Windows\system32\dllhost.exe /Processid:{02D4B3F1-FD88-11D1-960D-00805FC79235},SERVICE_WIN32_OWN_PROCESS,,true,true,The file is signed and the signature was verified.,Microsoft Windows,Microsoft Windows Verification PCA
ET932KJK,ALG,Application Layer Gateway Service,Provides support for 3rd party protocol plug-ins for Internet Connection Sharing,C:\Windows\System32\alg.exe,2ed4109c15111948ab2d212aa7ccf447,C:\Windows\System32\alg.exe,SERVICE_WIN32_OWN_PROCESS,,true,true,The file is signed and the signature was verified.,Microsoft Windows,Microsoft Windows Verification PCA
ET932KJK,PEAUTH,PEAUTH,,C:\Windows\System32\drivers\PEAuth.sys,afdd4786dff89f6a9a89bbf9c9623f3f,system32\drivers\peauth.sys,SERVICE_KERNEL_DRIVER,,true,true,The file is signed and the signature was verified.,Microsoft Windows,Microsoft Windows Verification PCA
ET932KJK,IKEEXT,IKE and AuthIP IPsec Keying Modules,The IKEEXT service hosts the Internet Key Exchange (IKE) and Authenticated Internet Protocol (AuthIP) keying modules. These keying modules are used for authentication and key exchange in Internet Protocol security (IPsec). Stopping or disabling the IKEEXT service will disable IKE and AuthIP key exchange with peer computers. IPsec is typically configured to use IKE or AuthIP; therefore  stopping or disabling the IKEEXT service might result in an IPsec failure and might compromise the security of the system. It is strongly recommended that you have the IKEEXT service running.,C:\Windows\System32\svchost.exe,ef6a985f2225a97217fd856ace305923,C:\Windows\system32\svchost.exe -k netsvcs,SERVICE_WIN32_SHARE_PROCESS,C:\Windows\System32\IKEEXT.DLL,true,true,The file is signed and the signature was verified.,Microsoft Windows,Microsoft Windows Verification PCA
ET932KJK,elxstor,elxstor,,C:\Windows\System32\drivers\elxstor.sys,6777c8eb5762dfb74f124708e2417314,\SystemRoot\system32\drivers\elxstor.sys,SERVICE_KERNEL_DRIVER,,true,true,The file is signed and the signature was verified.,Microsoft Windows,Microsoft Windows Verification PCA
ET932KJK,mfencrk,McAfee LLC. mfencrk,McAfee Content driver Copyright (C) McAfee LLC  2018. All rights reserved.,C:\Windows\System32\drivers\mfencrk.sys,ca7e0cdca216682f7e70cd4ecf902883,system32\DRIVERS\mfencrk.sys,SERVICE_KERNEL_DRIVER,,true,true,The file is signed and the signature was verified.,Microsoft Windows Hardware Compatibility Publisher,Microsoft Windows Hardware Compatibility PCA
ET932KJK,RasAgileVpn,WAN Miniport (IKEv2),WAN Miniport (IKEv2),C:\Windows\System32\drivers\agilevpn.sys,d4627669e0b2f7918a155bcbef4a7f82,system32\DRIVERS\AgileVpn.sys,SERVICE_KERNEL_DRIVER,,true,true,The file is signed and the signature was verified.,Microsoft Windows,Microsoft Windows Verification PCA
ET932KJK,WdiServiceHost,Diagnostic Service Host,The Diagnostic Service Host is used by the Diagnostic Policy Service to host diagnostics that need to run in a Local Service context.  If this service is stopped  any diagnostics that depend on it will no longer function.,C:\Windows\System32\svchost.exe,ef6a985f2225a97217fd856ace305923,C:\Windows\System32\svchost.exe -k LocalService,SERVICE_WIN32_SHARE_PROCESS,C:\Windows\System32\wdi.dll,true,true,The file is signed and the signature was verified.,Microsoft Windows,Microsoft Windows Verification PCA
ET932KJK,SCPolicySvc,Smart Card Removal Policy,Allows the system to be configured to lock the user desktop upon smart card removal.,C:\Windows\System32\svchost.exe,ef6a985f2225a97217fd856ace305923,C:\Windows\system32\svchost.exe -k netsvcs,SERVICE_WIN32_SHARE_PROCESS,C:\Windows\System32\certprop.dll,true,true,The file is signed and the signature was verified.,Microsoft Windows,Microsoft Windows Verification PCA
ET932KJK,stexstor,stexstor,,C:\Windows\System32\drivers\stexstor.sys,8b143e2d2acfab6cff5c3db6715dbb52,\SystemRoot\system32\drivers\stexstor.sys,SERVICE_KERNEL_DRIVER,,true,true,The file is signed and the signature was verified.,Microsoft Windows,Microsoft Windows Verification PCA
ET932KJK,luafv,UAC File Virtualization,Virtualizes file write failures to per-user locations.,C:\Windows\System32\drivers\luafv.sys,7c23315a8b137d045e665256d0162676,\SystemRoot\system32\drivers\luafv.sys,SERVICE_FILE_SYSTEM_DRIVER,,true,true,The file is signed and the signature was verified.,Microsoft Windows,Microsoft Windows Verification PCA
ET932KJK,LanmanWorkstation,Workstation,Creates and maintains client network connections to remote servers using the SMB protocol. If this service is stopped  these connections will be unavailable. If this service is disabled  any services that explicitly depend on it will fail to start.,C:\Windows\System32\svchost.exe,ef6a985f2225a97217fd856ace305923,C:\Windows\System32\svchost.exe -k NetworkService,SERVICE_WIN32_SHARE_PROCESS,C:\Windows\System32\wkssvc.dll,true,true,The file is signed and the signature was verified.,Microsoft Windows,Microsoft Windows Verification PCA
ET932KJK,CryptSvc,Cryptographic Services,Provides four management services: Catalog Database Service  which confirms the signatures of Windows files and allows new programs to be installed; Protected Root Service  which adds and removes Trusted Root Certification Authority certificates from this computer; Automatic Root Certificate Update Service  which retrieves root certificates from Windows Update and enable scenarios such as SSL; and Key Service  which helps enroll this computer for certificates. If this service is stopped  these management services will not function properly. If this service is disabled  any services that explicitly depend on it will fail to start.,C:\Windows\System32\svchost.exe,ef6a985f2225a97217fd856ace305923,C:\Windows\system32\svchost.exe -k NetworkService,SERVICE_WIN32_SHARE_PROCESS,C:\Windows\System32\cryptsvc.dll,true,true,The file is signed and the signature was verified.,Microsoft Windows,Microsoft Windows Verification PCA
ET932KJK,rspndr,Link-Layer Topology Discovery Responder,,C:\Windows\System32\drivers\rspndr.sys,2879f6e6b3d5b4d0dac6f343345b2a14,system32\DRIVERS\rspndr.sys,SERVICE_KERNEL_DRIVER,,true,true,The file is signed and the signature was verified.,Microsoft Windows,Microsoft Windows Verification PCA
ET932KJK,AsyncMac,RAS Asynchronous Media Driver,RAS Asynchronous Media Driver,C:\Windows\System32\drivers\asyncmac.sys,8668867a923d652509a65bb07667c4a6,system32\DRIVERS\asyncmac.sys,SERVICE_KERNEL_DRIVER,,true,true,The file is signed and the signature was verified.,Microsoft Windows,Microsoft Windows Verification PCA
ET932KJK,SharedAccess,Internet Connection Sharing (ICS),Provides network address translation  addressing  name resolution and/or intrusion prevention services for a home or small office network.,C:\Windows\System32\svchost.exe,ef6a985f2225a97217fd856ace305923,C:\Windows\System32\svchost.exe -k netsvcs,SERVICE_WIN32_SHARE_PROCESS,C:\Windows\System32\ipnathlp.dll,true,true,The file is signed and the signature was verified.,Microsoft Windows,Microsoft Windows Verification PCA
ET932KJK,NetTcpPortSharing,Net.Tcp Port Sharing Service,Provides ability to share TCP ports over the net.tcp protocol.,C:\Windows\Microsoft.NET\Framework64\v4.0.30319\SMSvcHost.exe,9284717f748dbd06a186ab2cc4f8abd2,C:\Windows\Microsoft.NET\Framework64\v4.0.30319\SMSvcHost.exe,SERVICE_WIN32_SHARE_PROCESS,,true,true,The file is signed and the signature was verified.,Microsoft Corporation,Microsoft Code Signing PCA
ET932KJK,kbdhid,Keyboard HID Driver,,C:\Windows\System32\drivers\kbdhid.sys,26bc0536a11591a94764363687a62e5a,\SystemRoot\system32\drivers\kbdhid.sys,SERVICE_KERNEL_DRIVER,,true,true,The file is signed and the signature was verified.,Microsoft Windows,Microsoft Windows Verification PCA
ET932KJK,WudfPf,User Mode Driver Frameworks Platform Driver,,C:\Windows\System32\drivers\WUDFPf.sys,460726e46700ad3960a8c3c145fd0258,system32\drivers\WudfPf.sys,SERVICE_KERNEL_DRIVER,,true,true,The file is signed and the signature was verified.,Microsoft Windows,Microsoft Windows Verification PCA
ET932KJK,FCRegSvc,Microsoft Fibre Channel Platform Registration Service,Registers the platform with all available Fibre Channel fabrics  and maintains the registrations.,C:\Windows\System32\svchost.exe,ef6a985f2225a97217fd856ace305923,C:\Windows\system32\svchost.exe -k LocalServiceNetworkRestricted,SERVICE_WIN32_SHARE_PROCESS,C:\Windows\System32\FCRegSvc.dll,true,true,The file is signed and the signature was verified.,Microsoft Windows,Microsoft Windows Verification PCA
ET932KJK,mfeplk,McAfee Inc. mfeplk,,C:\Windows\System32\drivers\mfeplk.sys,3bdd2733160d07a462f9735990a6efed,system32\drivers\mfeplk.sys,SERVICE_KERNEL_DRIVER,,true,true,The file is signed and the signature was verified.,Microsoft Windows Hardware Compatibility Publisher,Microsoft Windows Hardware Compatibility PCA
ET932KJK,arc,arc,,C:\Windows\System32\drivers\arc.sys,c21ec9b51592253762352c1772e1d40e,\SystemRoot\system32\drivers\arc.sys,SERVICE_KERNEL_DRIVER,,true,true,The file is signed and the signature was verified.,Microsoft Windows,Microsoft Windows Verification PCA
ET932KJK,TapiSrv,Telephony,Provides Telephony API (TAPI) support for programs that control telephony devices on the local computer and  through the LAN  on servers that are also running the service.,C:\Windows\System32\svchost.exe,ef6a985f2225a97217fd856ace305923,C:\Windows\System32\svchost.exe -k tapisrv,SERVICE_WIN32_OWN_PROCESS,C:\Windows\System32\tapisrv.dll,true,true,The file is signed and the signature was verified.,Microsoft Windows,Microsoft Windows Verification PCA
ET932KJK,BrFiltLo,Brother USB Mass-Storage Lower Filter Driver,,C:\Windows\System32\drivers\BrFiltLo.sys,2f79c8c2f358bef836a6e2f1c5e5d01d,\SystemRoot\system32\drivers\BrFiltLo.sys,SERVICE_KERNEL_DRIVER,,true,true,The file is signed and the signature was verified.,Microsoft Windows,Microsoft Windows Verification PCA
ET932KJK,RSoPProv,Resultant Set of Policy Provider,Provides a network service that processes requests to simulate application of Group Policy settings for a target user or computer in various situations and computes the Resultant Set of Policy settings.,C:\Windows\System32\rsopprov.exe,d0867c3fe7c1a6d9109f37451cbb7e36,C:\Windows\system32\RSoPProv.exe,SERVICE_WIN32_SHARE_PROCESS,,true,true,The file is signed and the signature was verified.,Microsoft Windows,Microsoft Windows Verification PCA
ET932KJK,amdxata,amdxata,,C:\Windows\System32\drivers\amdxata.sys,1c343e5fa1902b1d803230d07bfcddb4,\SystemRoot\system32\drivers\amdxata.sys,SERVICE_KERNEL_DRIVER,,true,true,The file is signed and the signature was verified.,Microsoft Windows,Microsoft Windows Verification PCA
ET932KJK,cdfs,CD/DVD File System Reader,ISO9660/Joliet File System Reader for CD/DVDs. (Core) (All pieces),C:\Windows\System32\drivers\cdfs.sys,34de990b1acb7e814c1f07765ddca56c,system32\DRIVERS\cdfs.sys,SERVICE_FILE_SYSTEM_DRIVER,,true,true,The file is signed and the signature was verified.,Microsoft Windows,Microsoft Windows Verification PCA
ET932KJK,swenum,Software Bus Driver,,C:\Windows\System32\drivers\swenum.sys,58afab03ef91bd8fd21f49b0017de701,\SystemRoot\system32\drivers\swenum.sys,SERVICE_KERNEL_DRIVER,,true,true,The file is signed and the signature was verified.,Microsoft Windows,Microsoft Windows Verification PCA
ET932KJK,HipShieldK,McAfee Inc. HipShieldK,,C:\Windows\System32\drivers\HipShieldK.sys,b695119a5fb2a1c30d24f3cc715f143d,system32\drivers\HipShieldK.sys,SERVICE_KERNEL_DRIVER,,true,true,The file is signed and the signature was verified.,Microsoft Windows Hardware Compatibility Publisher,Microsoft Windows Hardware Compatibility PCA
ET932KJK,ql40xx,ql40xx,,C:\Windows\System32\drivers\ql40xx.sys,d8e527ef6dc9964faee4bf5ee93bf730,\SystemRoot\system32\drivers\ql40xx.sys,SERVICE_KERNEL_DRIVER,,true,true,The file is signed and the signature was verified.,Microsoft Windows,Microsoft Windows Verification PCA
ET932KJK,swprv,Microsoft Software Shadow Copy Provider,Manages software-based volume shadow copies taken by the Volume Shadow Copy service. If this service is stopped  software-based volume shadow copies cannot be managed. If this service is disabled  any services that explicitly depend on it will fail to start.,C:\Windows\System32\svchost.exe,ef6a985f2225a97217fd856ace305923,C:\Windows\System32\svchost.exe -k swprv,SERVICE_WIN32_OWN_PROCESS,C:\Windows\System32\swprv.dll,true,true,The file is signed and the signature was verified.,Microsoft Windows,Microsoft Windows Verification PCA
ET932KJK,TermService,Remote Desktop Services,Allows users to connect interactively to a remote computer. Remote Desktop and Remote Desktop Session Host Server depend on this service.  To prevent remote use of this computer  clear the checkboxes on the Remote tab of the System properties control panel item.,C:\Windows\System32\svchost.exe,ef6a985f2225a97217fd856ace305923,C:\Windows\System32\svchost.exe -k termsvcs,SERVICE_WIN32_SHARE_PROCESS,C:\Windows\System32\termsrv.dll,true,true,The file is signed and the signature was verified.,Microsoft Windows,Microsoft Windows Verification PCA
ET932KJK,upnphost,UPnP Device Host,Allows UPnP devices to be hosted on this computer. If this service is stopped  any hosted UPnP devices will stop functioning and no additional hosted devices can be added. If this service is disabled  any services that explicitly depend on it will fail to start.,C:\Windows\System32\svchost.exe,ef6a985f2225a97217fd856ace305923,C:\Windows\system32\svchost.exe -k LocalServiceAndNoImpersonation,SERVICE_WIN32_SHARE_PROCESS,C:\Windows\System32\upnphost.dll,true,true,The file is signed and the signature was verified.,Microsoft Windows,Microsoft Windows Verification PCA
ET932KJK,sffdisk,SFF Storage Class Driver,,C:\Windows\System32\drivers\sffdisk.sys,92223d84f7784ec3b0208a59739a1f90,\SystemRoot\system32\drivers\sffdisk.sys,SERVICE_KERNEL_DRIVER,,true,true,The file is signed and the signature was verified.,Microsoft Windows,Microsoft Windows Verification PCA
ET932KJK,SstpSvc,Secure Socket Tunneling Protocol Service,Provides support for the Secure Socket Tunneling Protocol (SSTP) to connect to remote computers using VPN. If this service is disabled  users will not be able to use SSTP to access remote servers.,C:\Windows\System32\svchost.exe,ef6a985f2225a97217fd856ace305923,C:\Windows\system32\svchost.exe -k LocalService,SERVICE_WIN32_SHARE_PROCESS,C:\Windows\System32\sstpsvc.dll,true,true,The file is signed and the signature was verified.,Microsoft Windows,Microsoft Windows Verification PCA
ET932KJK,AcpiPmi,ACPI Power Meter Driver,,C:\Windows\System32\drivers\acpipmi.sys,947dfc5f7cce7d70da8593240a16172f,\SystemRoot\system32\drivers\acpipmi.sys,SERVICE_KERNEL_DRIVER,,true,true,The file is signed and the signature was verified.,Microsoft Windows,Microsoft Windows Verification PCA
ET932KJK,Dhcp,DHCP Client,Registers and updates IP addresses and DNS records for this computer. If this service is stopped  this computer will not receive dynamic IP addresses and DNS updates. If this service is disabled  any services that explicitly depend on it will fail to start.,C:\Windows\System32\svchost.exe,ef6a985f2225a97217fd856ace305923,C:\Windows\system32\svchost.exe -k LocalServiceNetworkRestricted,SERVICE_WIN32_SHARE_PROCESS,C:\Windows\System32\dhcpcore.dll,true,true,The file is signed and the signature was verified.,Microsoft Windows,Microsoft Windows Verification PCA
ET932KJK,TDTCP,TDTCP,,C:\Windows\System32\drivers\tdtcp.sys,a401f69dec4d45b5a401d3e4fc401b9b,system32\drivers\tdtcp.sys,SERVICE_KERNEL_DRIVER,,true,true,The file is signed and the signature was verified.,Microsoft Windows,Microsoft Windows Verification PCA
ET932KJK,NetMsmqActivator,Net.Msmq Listener Adapter,Receives activation requests over the net.msmq and msmq.formatname protocols and passes them to the Windows Process Activation Service.,C:\Windows\Microsoft.NET\Framework64\v4.0.30319\SMSvcHost.exe,9284717f748dbd06a186ab2cc4f8abd2,C:\Windows\Microsoft.NET\Framework64\v4.0.30319\SMSvcHost.exe -NetMsmqActivator,SERVICE_WIN32_SHARE_PROCESS,,true,true,The file is signed and the signature was verified.,Microsoft Corporation,Microsoft Code Signing PCA
ET932KJK,crcdisk,Crcdisk Filter Driver,,C:\Windows\System32\drivers\crcdisk.sys,7820023150d46bf7e365665b4ede98c4,\SystemRoot\system32\drivers\crcdisk.sys,SERVICE_KERNEL_DRIVER,,true,true,The file is signed and the signature was verified.,Microsoft Windows,Microsoft Windows Verification PCA
ET932KJK,WPDBusEnum,Portable Device Enumerator Service,Enforces group policy for removable mass-storage devices. Enables applications such as Windows Media Player and Image Import Wizard to transfer and synchronize content using removable mass-storage devices.,C:\Windows\System32\svchost.exe,ef6a985f2225a97217fd856ace305923,C:\Windows\system32\svchost.exe -k LocalSystemNetworkRestricted,SERVICE_WIN32_SHARE_PROCESS,C:\Windows\System32\wpdbusenum.dll,true,true,The file is signed and the signature was verified.,Microsoft Windows,Microsoft Windows Verification PCA
ET932KJK,MSiSCSI,Microsoft iSCSI Initiator Service,Manages Internet SCSI (iSCSI) sessions from this computer to remote iSCSI target devices. If this service is stopped  this computer will not be able to login or access iSCSI targets. If this service is disabled  any services that explicitly depend on it will fail to start.,C:\Windows\System32\svchost.exe,ef6a985f2225a97217fd856ace305923,C:\Windows\system32\svchost.exe -k netsvcs,SERVICE_WIN32_SHARE_PROCESS,C:\Windows\System32\iscsiexe.dll,true,true,The file is signed and the signature was verified.,Microsoft Windows,Microsoft Windows Verification PCA
ET932KJK,RDPDR,Terminal Server Device Redirector Driver,,C:\Windows\System32\drivers\rdpdr.sys,89223bb3b75e78fb8eab96856c7c86ae,System32\drivers\rdpdr.sys,SERVICE_KERNEL_DRIVER,,true,true,The file is signed and the signature was verified.,Microsoft Windows,Microsoft Windows Verification PCA
ET932KJK,HDAudBus,Microsoft UAA Bus Driver for High Definition Audio,,C:\Windows\System32\drivers\hdaudbus.sys,3ed1a8fe9c573a8807ffb86ac369ffde,\SystemRoot\system32\drivers\HDAudBus.sys,SERVICE_KERNEL_DRIVER,,true,true,The file is signed and the signature was verified.,Microsoft Windows,Microsoft Windows Verification PCA
ET932KJK,RpcSs,Remote Procedure Call (RPC),The RPCSS service is the Service Control Manager for COM and DCOM servers. It performs object activations requests  object exporter resolutions and distributed garbage collection for COM and DCOM servers. If this service is stopped or disabled  programs using COM or DCOM will not function properly. It is strongly recommended that you have the RPCSS service running,C:\Windows\System32\svchost.exe,ef6a985f2225a97217fd856ace305923,C:\Windows\system32\svchost.exe -k rpcss,SERVICE_WIN32_SHARE_PROCESS,C:\Windows\System32\rpcss.dll,true,true,The file is signed and the signature was verified.,Microsoft Windows,Microsoft Windows Verification PCA
ET932KJK,CmBatt,Microsoft ACPI Control Method Battery Driver,,C:\Windows\System32\drivers\CmBatt.sys,d3baa300df854dc81c70f2c66cc334a6,\SystemRoot\system32\drivers\CmBatt.sys,SERVICE_KERNEL_DRIVER,,true,true,The file is signed and the signature was verified.,Microsoft Windows,Microsoft Windows Verification PCA
ET932KJK,mfehidk,McAfee Inc. mfehidk,,C:\Windows\System32\drivers\mfehidk.sys,10ace11af33746c397be0e67a0e3d20b,\SystemRoot\system32\drivers\mfehidk.sys,SERVICE_KERNEL_DRIVER,,true,true,The file is signed and the signature was verified.,Microsoft Windows Hardware Compatibility Publisher,Microsoft Windows Hardware Compatibility PCA
ET932KJK,ohci1394,1394 OHCI Compliant Host Controller (Legacy),,C:\Windows\System32\drivers\ohci1394.sys,3f37b81ce9be289e1e50be9cb46d73ef,\SystemRoot\system32\drivers\ohci1394.sys,SERVICE_KERNEL_DRIVER,,true,true,The file is signed and the signature was verified.,Microsoft Windows,Microsoft Windows Verification PCA
ET932KJK,cfwids,McAfee Inc. cfwids,,C:\Windows\System32\drivers\cfwids.sys,992ed34ae28ebf141a28e05360a49920,system32\drivers\cfwids.sys,SERVICE_KERNEL_DRIVER,,true,true,The file is signed and the signature was verified.,Microsoft Windows Hardware Compatibility Publisher,Microsoft Windows Hardware Compatibility PCA
ET932KJK,mfeelamk,McAfee Inc. mfeelamk,,C:\Windows\System32\drivers\mfeelamk.sys,bad68ddc604029305a66768b8dd62269,\SystemRoot\system32\drivers\mfeelamk.sys,SERVICE_KERNEL_DRIVER,,true,true,The file is signed and the signature was verified.,Microsoft Windows Hardware Compatibility Publisher,Microsoft Windows Hardware Compatibility PCA
ET932KJK,lmhosts,TCP/IP NetBIOS Helper,Provides support for the NetBIOS over TCP/IP (NetBT) service and NetBIOS name resolution for clients on the network  therefore enabling users to share files  print  and log on to the network. If this service is stopped  these functions might be unavailable. If this service is disabled  any services that explicitly depend on it will fail to start.,C:\Windows\System32\svchost.exe,ef6a985f2225a97217fd856ace305923,C:\Windows\system32\svchost.exe -k LocalServiceNetworkRestricted,SERVICE_WIN32_SHARE_PROCESS,C:\Windows\System32\lmhsvc.dll,true,true,The file is signed and the signature was verified.,Microsoft Windows,Microsoft Windows Verification PCA
ET932KJK,TermDD,Terminal Device Driver,,C:\Windows\System32\drivers\termdd.sys,5a9b5907cc7c0d2905a7c9f47cd67de3,\SystemRoot\system32\drivers\termdd.sys,SERVICE_KERNEL_DRIVER,,true,true,The file is signed and the signature was verified.,Microsoft Windows,Microsoft Windows Verification PCA
ET932KJK,pci,PCI Bus Driver,,C:\Windows\System32\drivers\pci.sys,466f53cae174913aca56d7fa858ae995,\SystemRoot\system32\drivers\pci.sys,SERVICE_KERNEL_DRIVER,,true,true,The file is signed and the signature was verified.,Microsoft Windows,Microsoft Windows Verification PCA
ET932KJK,srv,Server SMB 1.xxx Driver,Enables connectivity from Windows XP and earlier clients,C:\Windows\System32\drivers\srv.sys,d7076ecedf2701af316a7a0d064fa860,System32\DRIVERS\srv.sys,SERVICE_FILE_SYSTEM_DRIVER,,true,true,The file is signed and the signature was verified.,Microsoft Windows,Microsoft Windows Verification PCA
ET932KJK,FileInfo,File Information FS MiniFilter,Collects information about files in memory to be consumed by other system services.,C:\Windows\System32\drivers\fileinfo.sys,37fb8a11a0aef4ed407fd57997fe5880,system32\drivers\fileinfo.sys,SERVICE_FILE_SYSTEM_DRIVER,,true,true,The file is signed and the signature was verified.,Microsoft Windows,Microsoft Windows Verification PCA
