hostname,name,descriptivename,description,path,md5,arguments,type,servicedll,pathsignatureexists,pathsignatureverified,pathsignaturedescription,pathcertificatesubject,pathcertificateissuer
ET932KJK,flpydisk,Floppy Disk Driver,,C:\Windows\System32\drivers\flpydisk.sys,e5a2e03e63271da39c642a1b030f51f1,\SystemRoot\system32\drivers\flpydisk.sys,SERVICE_KERNEL_DRIVER,,true,true,The file is signed and the signature was verified.,Microsoft Windows,Microsoft Windows Verification PCA
ET932KJK,uliagpkx,Uli AGP Bus Filter,,C:\Windows\System32\drivers\ULIAGPKX.SYS,69619e5934b97c317e9a2f376b463ddb,\SystemRoot\system32\drivers\uliagpkx.sys,SERVICE_KERNEL_DRIVER,,true,true,The file is signed and the signature was verified.,Microsoft Windows,Microsoft Windows Verification PCA
ET932KJK,SessionEnv,Remote Desktop Configuration,Remote Desktop Configuration service (RDCS) is responsible for all Remote Desktop Services and Remote Desktop related configuration and session maintenance activities that require SYSTEM context. These include per-session temporary folders  RD themes  and RD certificates.,C:\Windows\System32\svchost.exe,ef6a985f2225a97217fd856ace305923,C:\Windows\System32\svchost.exe -k netsvcs,SERVICE_WIN32_SHARE_PROCESS,C:\Windows\System32\SessEnv.dll,true,true,The file is signed and the signature was verified.,Microsoft Windows,Microsoft Windows Verification PCA
ET932KJK,SCardSvr,Smart Card,Manages access to smart cards read by this computer. If this service is stopped  this computer will be unable to read smart cards. If this service is disabled  any services that explicitly depend on it will fail to start.,C:\Windows\System32\svchost.exe,ef6a985f2225a97217fd856ace305923,C:\Windows\system32\svchost.exe -k LocalServiceAndNoImpersonation,SERVICE_WIN32_SHARE_PROCESS,C:\Windows\System32\SCardSvr.dll,true,true,The file is signed and the signature was verified.,Microsoft Windows,Microsoft Windows Verification PCA
ET932KJK,FDResPub,Function Discovery Resource Publication,Publishes this computer and resources attached to this computer so they can be discovered over the network.  If this service is stopped  network resources will no longer be published and they will not be discovered by other computers on the network.,C:\Windows\System32\svchost.exe,ef6a985f2225a97217fd856ace305923,C:\Windows\system32\svchost.exe -k LocalServiceAndNoImpersonation,SERVICE_WIN32_SHARE_PROCESS,C:\Windows\System32\FDResPub.dll,true,true,The file is signed and the signature was verified.,Microsoft Windows,Microsoft Windows Verification PCA
ET932KJK,udfs,udfs,Reads/Writes UDF 1.02 1.5 2.0x 2.5 disc formats  usually found on C/DVD discs. (Core) (All pieces),C:\Windows\System32\drivers\udfs.sys,35d45d424f96c2b3183c34a90cccfe09,system32\DRIVERS\udfs.sys,SERVICE_FILE_SYSTEM_DRIVER,,true,true,The file is signed and the signature was verified.,Microsoft Windows,Microsoft Windows Verification PCA
ET932KJK,dmvsc,dmvsc,,C:\Windows\System32\drivers\dmvsc.sys,cc3203eae9888e24cffd7be92f7f0c8d,\SystemRoot\system32\drivers\dmvsc.sys,SERVICE_KERNEL_DRIVER,,true,true,The file is signed and the signature was verified.,Microsoft Windows,Microsoft Windows Verification PCA
ET932KJK,UI0Detect,Interactive Services Detection,Enables user notification of user input for interactive services  which enables access to dialogs created by interactive services when they appear. If this service is stopped  notifications of new interactive service dialogs will no longer function and there might not be access to interactive service dialogs. If this service is disabled  both notifications of and access to new interactive service dialogs will no longer function.,C:\Windows\System32\UI0Detect.exe,31f424a12f07c5b43f1491acfcdfe925,C:\Windows\system32\UI0Detect.exe,SERVICE_WIN32_OWN_PROCESS,,true,true,The file is signed and the signature was verified.,Microsoft Windows,Microsoft Windows Verification PCA
ET932KJK,MMCSS,Multimedia Class Scheduler,Enables relative prioritization of work based on system-wide task priorities. This is intended mainly for multimedia applications.  If this service is stopped  individual tasks resort to their default priority.,C:\Windows\System32\svchost.exe,ef6a985f2225a97217fd856ace305923,C:\Windows\system32\svchost.exe -k netsvcs,SERVICE_WIN32_SHARE_PROCESS,C:\Windows\System32\mmcss.dll,true,true,The file is signed and the signature was verified.,Microsoft Windows,Microsoft Windows Verification PCA
ET932KJK,wuauserv,Windows Update,Enables the detection  download  and installation of updates for Windows and other programs. If this service is disabled  users of this computer will not be able to use Windows Update or its automatic updating feature  and programs will not be able to use the Windows Update Agent (WUA) API.,C:\Windows\System32\svchost.exe,ef6a985f2225a97217fd856ace305923,C:\Windows\system32\svchost.exe -k netsvcs,SERVICE_WIN32_SHARE_PROCESS,C:\Windows\System32\wuaueng.dll,true,true,The file is signed and the signature was verified.,Microsoft Windows,Microsoft Windows Verification PCA
ET932KJK,sppuinotify,SPP Notification Service,Provides Software Licensing activation and notification,C:\Windows\System32\svchost.exe,ef6a985f2225a97217fd856ace305923,C:\Windows\system32\svchost.exe -k LocalService,SERVICE_WIN32_SHARE_PROCESS,C:\Windows\System32\sppuinotify.dll,true,true,The file is signed and the signature was verified.,Microsoft Windows,Microsoft Windows Verification PCA
ET932KJK,msahci,msahci,,C:\Windows\System32\drivers\msahci.sys,09eb85702e9bac87326ea02c94c60435,\SystemRoot\system32\drivers\msahci.sys,SERVICE_KERNEL_DRIVER,,true,true,The file is signed and the signature was verified.,Microsoft Windows,Microsoft Windows Verification PCA
ET932KJK,BFE,Base Filtering Engine,The Base Filtering Engine (BFE) is a service that manages firewall and Internet Protocol security (IPsec) policies and implements user mode filtering. Stopping or disabling the BFE service will significantly reduce the security of the system. It will also result in unpredictable behavior in IPsec management and firewall applications.,C:\Windows\System32\svchost.exe,ef6a985f2225a97217fd856ace305923,C:\Windows\system32\svchost.exe -k LocalServiceNoNetwork,SERVICE_WIN32_SHARE_PROCESS,C:\Windows\System32\BFE.DLL,true,true,The file is signed and the signature was verified.,Microsoft Windows,Microsoft Windows Verification PCA
ET932KJK,NetBT,NetBT,This service implements NetBios over TCP/IP.,C:\Windows\System32\drivers\netbt.sys,2f12cb799460ba82462974c17bdcdf26,System32\DRIVERS\netbt.sys,SERVICE_KERNEL_DRIVER,,true,true,The file is signed and the signature was verified.,Microsoft Windows,Microsoft Windows Verification PCA
ET932KJK,TsUsbFlt,TsUsbFlt,Remote Desktop USB Hub Class Filter Driver,C:\Windows\System32\drivers\TsUsbFlt.sys,a328396be0a80669aa276be8a4ae2950,system32\drivers\tsusbflt.sys,SERVICE_KERNEL_DRIVER,,true,true,The file is signed and the signature was verified.,Microsoft Windows,Microsoft Windows Verification PCA
ET932KJK,Ndisuio,NDIS Usermode I/O Protocol,,C:\Windows\System32\drivers\ndisuio.sys,adf2fe42308c3fa5a3a9a41f8b1ddcbf,system32\DRIVERS\ndisuio.sys,SERVICE_KERNEL_DRIVER,,true,true,The file is signed and the signature was verified.,Microsoft Windows,Microsoft Windows Verification PCA
ET932KJK,hidserv,Human Interface Device Access,Enables generic input access to Human Interface Devices (HID)  which activates and maintains the use of predefined hot buttons on keyboards  remote controls  and other multimedia devices. If this service is stopped  hot buttons controlled by this service will no longer function. If this service is disabled  any services that explicitly depend on it will fail to start.,C:\Windows\System32\svchost.exe,ef6a985f2225a97217fd856ace305923,C:\Windows\system32\svchost.exe -k LocalSystemNetworkRestricted,SERVICE_WIN32_SHARE_PROCESS,C:\Windows\System32\hidserv.dll,true,true,The file is signed and the signature was verified.,Microsoft Windows,Microsoft Windows Verification PCA
ET932KJK,WinRM,Windows Remote Management (WS-Management),Windows Remote Management (WinRM) service implements the WS-Management protocol for remote management. WS-Management is a standard web services protocol used for remote software and hardware management. The WinRM service listens on the network for WS-Management requests and processes them. The WinRM Service needs to be configured with a listener using winrm.cmd command line tool or through Group Policy in order for it to listen over the network. The WinRM service provides access to WMI data and enables event collection. Event collection and subscription to events require that the service is running. WinRM messages use HTTP and HTTPS as transports. The WinRM service does not depend on IIS but is preconfigured to share a port with IIS on the same machine.  The WinRM service reserves the /wsman URL prefix. To prevent conflicts with IIS  administrators should ensure that any websites hosted on IIS do not use the /wsman URL prefix.,C:\Windows\System32\svchost.exe,ef6a985f2225a97217fd856ace305923,C:\Windows\System32\svchost.exe -k NetworkService,SERVICE_WIN32_SHARE_PROCESS,C:\Windows\System32\WsmSvc.dll,true,true,The file is signed and the signature was verified.,Microsoft Windows,Microsoft Windows Verification PCA
ET932KJK,UxSms,Desktop Window Manager Session Manager,Provides Desktop Window Manager startup and maintenance services,C:\Windows\System32\svchost.exe,ef6a985f2225a97217fd856ace305923,C:\Windows\System32\svchost.exe -k LocalSystemNetworkRestricted,SERVICE_WIN32_SHARE_PROCESS,C:\Windows\System32\uxsms.dll,true,true,The file is signed and the signature was verified.,Microsoft Windows,Microsoft Windows Verification PCA
ET932KJK,RemoteAccess,Routing and Remote Access,Offers routing services to businesses in local area and wide area network environments.,C:\Windows\System32\svchost.exe,ef6a985f2225a97217fd856ace305923,C:\Windows\System32\svchost.exe -k netsvcs,SERVICE_WIN32_SHARE_PROCESS,C:\Windows\System32\mprdim.dll,true,true,The file is signed and the signature was verified.,Microsoft Windows,Microsoft Windows Verification PCA
ET932KJK,i8042prt,i8042 Keyboard and PS/2 Mouse Port Driver,,C:\Windows\System32\drivers\i8042prt.sys,4f27dcd084043673224cb30aeff970b3,\SystemRoot\system32\drivers\i8042prt.sys,SERVICE_KERNEL_DRIVER,,true,true,The file is signed and the signature was verified.,Microsoft Windows,Microsoft Windows Verification PCA
ET932KJK,discache,System Attribute Cache,Attribute Cache Indexer,C:\Windows\System32\drivers\discache.sys,65481acf1b79eba8871caec86a1f2c4a,System32\drivers\discache.sys,SERVICE_KERNEL_DRIVER,,true,true,The file is signed and the signature was verified.,Microsoft Windows,Microsoft Windows Verification PCA
ET932KJK,AeLookupSvc,Application Experience,Processes application compatibility cache requests for applications as they are launched,C:\Windows\System32\svchost.exe,ef6a985f2225a97217fd856ace305923,C:\Windows\system32\svchost.exe -k netsvcs,SERVICE_WIN32_SHARE_PROCESS,C:\Windows\System32\aelupsvc.dll,true,true,The file is signed and the signature was verified.,Microsoft Windows,Microsoft Windows Verification PCA
ET932KJK,pcmcia,pcmcia,,C:\Windows\System32\drivers\pcmcia.sys,4b11397d59509d271136ea94f49dd5bc,\SystemRoot\system32\drivers\pcmcia.sys,SERVICE_KERNEL_DRIVER,,true,true,The file is signed and the signature was verified.,Microsoft Windows,Microsoft Windows Verification PCA
ET932KJK,mfefirek,McAfee Inc. mfefirek,,C:\Windows\System32\drivers\mfefirek.sys,e7109ae78acae0b339b4aca4f29d3178,system32\drivers\mfefirek.sys,SERVICE_KERNEL_DRIVER,,true,true,The file is signed and the signature was verified.,Microsoft Windows Hardware Compatibility Publisher,Microsoft Windows Hardware Compatibility PCA
ET932KJK,tunnel,Microsoft Tunnel Miniport Adapter Driver,,C:\Windows\System32\drivers\tunnel.sys,5e4230b15689e1517735076834fd1153,system32\DRIVERS\tunnel.sys,SERVICE_KERNEL_DRIVER,,true,true,The file is signed and the signature was verified.,Microsoft Windows,Microsoft Windows Verification PCA
ET932KJK,sffp_sd,SFF Storage Protocol Driver for SDBus,,C:\Windows\System32\drivers\sffp_sd.sys,6d12baede3bc103d93158d3bff4cc652,\SystemRoot\system32\drivers\sffp_sd.sys,SERVICE_KERNEL_DRIVER,,true,true,The file is signed and the signature was verified.,Microsoft Windows,Microsoft Windows Verification PCA
ET932KJK,mssmbios,Microsoft System Management BIOS Driver,,C:\Windows\System32\drivers\mssmbios.sys,0f0dd0c514ecb0da622696afcf7817cc,\SystemRoot\system32\drivers\mssmbios.sys,SERVICE_KERNEL_DRIVER,,true,true,The file is signed and the signature was verified.,Microsoft Windows,Microsoft Windows Verification PCA
ET932KJK,VgaSave,VgaSave,,C:\Windows\System32\drivers\vga.sys,63fe3ce23de0e421ffff03921d821c4a,\SystemRoot\System32\drivers\vga.sys,SERVICE_KERNEL_DRIVER,,true,true,The file is signed and the signature was verified.,Microsoft Windows,Microsoft Windows Verification PCA
ET932KJK,usbohci,Microsoft USB Open Host Controller Miniport Driver,,C:\Windows\System32\drivers\usbohci.sys,1a9c3e2dcfafcebdb68e588f3d2dea88,\SystemRoot\system32\drivers\usbohci.sys,SERVICE_KERNEL_DRIVER,,true,true,The file is signed and the signature was verified.,Microsoft Windows,Microsoft Windows Verification PCA
ET932KJK,Psched,QoS Packet Scheduler,QoS Packet Scheduler,C:\Windows\System32\drivers\pacer.sys,6c2e715780619f68adeeb240a9671983,system32\DRIVERS\pacer.sys,SERVICE_KERNEL_DRIVER,,true,true,The file is signed and the signature was verified.,Microsoft Windows,Microsoft Windows Verification PCA
ET932KJK,mpsdrv,Windows Firewall Authorization Driver,Windows Firewall Authorization Driver is a kernel mode driver that provides deep inspection services on inbound and outbound network traffic.,C:\Windows\System32\drivers\mpsdrv.sys,b20255268a12e9142b683bb8794ad4d5,System32\drivers\mpsdrv.sys,SERVICE_KERNEL_DRIVER,,true,true,The file is signed and the signature was verified.,Microsoft Windows,Microsoft Windows Verification PCA
ET932KJK,pciide,pciide,,C:\Windows\System32\drivers\pciide.sys,4c9990986402e3c9d77c493c91aa8b22,\SystemRoot\system32\drivers\pciide.sys,SERVICE_KERNEL_DRIVER,,true,true,The file is signed and the signature was verified.,Microsoft Windows,Microsoft Windows Verification PCA
ET932KJK,mfewfpk,McAfee Inc. mfewfpk,,C:\Windows\System32\drivers\mfewfpk.sys,62c99829bad7dd0e87c5e2a461c162bc,\SystemRoot\system32\drivers\mfewfpk.sys,SERVICE_KERNEL_DRIVER,,true,true,The file is signed and the signature was verified.,Microsoft Windows Hardware Compatibility Publisher,Microsoft Windows Hardware Compatibility PCA
ET932KJK,w32time,Windows Time,Maintains date and time synchronization on all clients and servers in the network. If this service is stopped  date and time synchronization will be unavailable. If this service is disabled  any services that explicitly depend on it will fail to start.,C:\Windows\System32\svchost.exe,ef6a985f2225a97217fd856ace305923,C:\Windows\system32\svchost.exe -k LocalService,SERVICE_WIN32_SHARE_PROCESS,C:\Windows\System32\w32time.dll,true,true,The file is signed and the signature was verified.,Microsoft Windows,Microsoft Windows Verification PCA
ET932KJK,WacomPen,Wacom Serial Pen HID Driver,,C:\Windows\System32\drivers\wacompen.sys,a031ca17d60ced74a7d3a20408d292c1,\SystemRoot\system32\drivers\wacompen.sys,SERVICE_KERNEL_DRIVER,,true,true,The file is signed and the signature was verified.,Microsoft Windows,Microsoft Windows Verification PCA
ET932KJK,WerSvc,Windows Error Reporting Service,Allows errors to be reported when programs stop working or responding and allows existing solutions to be delivered. Also allows logs to be generated for diagnostic and repair services. If this service is stopped  error reporting might not work correctly and results of diagnostic services and repairs might not be displayed.,C:\Windows\System32\svchost.exe,ef6a985f2225a97217fd856ace305923,C:\Windows\System32\svchost.exe -k WerSvcGroup,SERVICE_WIN32_SHARE_PROCESS,C:\Windows\System32\wersvc.dll,true,true,The file is signed and the signature was verified.,Microsoft Windows,Microsoft Windows Verification PCA
ET932KJK,dot3svc,Wired AutoConfig,The Wired AutoConfig (DOT3SVC) service is responsible for performing IEEE 802.1X authentication on Ethernet interfaces. If your current wired network deployment enforces 802.1X authentication  the DOT3SVC service should be configured to run for establishing Layer 2 connectivity and/or providing access to network resources. Wired networks that do not enforce 802.1X authentication are unaffected by the DOT3SVC service.,C:\Windows\System32\svchost.exe,ef6a985f2225a97217fd856ace305923,C:\Windows\system32\svchost.exe -k LocalSystemNetworkRestricted,SERVICE_WIN32_SHARE_PROCESS,C:\Windows\System32\dot3svc.dll,true,true,The file is signed and the signature was verified.,Microsoft Windows,Microsoft Windows Verification PCA
ET932KJK,WcsPlugInService,Windows Color System,The WcsPlugInService service hosts third-party Windows Color System color device model and gamut map model plug-in modules. These plug-in modules are vendor-specific extensions to the Windows Color System baseline color device and gamut map models. Stopping or disabling the WcsPlugInService service will disable this extensibility feature  and the Windows Color System will use its baseline model processing rather than the vendor's desired processing. This might result in inaccurate color rendering.,C:\Windows\System32\svchost.exe,ef6a985f2225a97217fd856ace305923,C:\Windows\system32\svchost.exe -k wcssvc,SERVICE_WIN32_SHARE_PROCESS,C:\Windows\System32\WcsPlugInService.dll,true,true,The file is signed and the signature was verified.,Microsoft Windows,Microsoft Windows Verification PCA
ET932KJK,s3cap,s3cap,,C:\Windows\System32\drivers\vms3cap.sys,9bfd081ea08d4d13a80125404c399faf,\SystemRoot\system32\drivers\vms3cap.sys,SERVICE_KERNEL_DRIVER,,true,true,The file is signed and the signature was verified.,Microsoft Windows,Microsoft Windows Verification PCA
ET932KJK,mshidkmdf,Pass-through HID to KMDF Filter Driver,Device Filter to provide pass-through interface between HIDCLASS and KMDF,C:\Windows\System32\drivers\mshidkmdf.sys,5606b0ba9c3b440d5edb98e802720aa3,\SystemRoot\System32\drivers\mshidkmdf.sys,SERVICE_KERNEL_DRIVER,,true,true,The file is signed and the signature was verified.,Microsoft Windows,Microsoft Windows Verification PCA
ET932KJK,IPMIDRV,IPMIDRV,,C:\Windows\System32\drivers\IPMIDrv.sys,7c51e65d636e4feddd2bc3898e180018,\SystemRoot\system32\drivers\IPMIDrv.sys,SERVICE_KERNEL_DRIVER,,true,true,The file is signed and the signature was verified.,Microsoft Windows,Microsoft Windows Verification PCA
ET932KJK,mpio,mpio,,C:\Windows\System32\drivers\mpio.sys,7eb89970e403aee1c05e5e657cc11b5b,\SystemRoot\system32\drivers\mpio.sys,SERVICE_KERNEL_DRIVER,,true,true,The file is signed and the signature was verified.,Microsoft Windows,Microsoft Windows Verification PCA
ET932KJK,stornvme,stornvme,,C:\Windows\System32\drivers\stornvme.sys,2896e287ade5315dcc4818b5796e472a,\SystemRoot\system32\drivers\stornvme.sys,SERVICE_KERNEL_DRIVER,,true,true,The file is signed and the signature was verified.,Microsoft Windows,Microsoft Windows Verification PCA
ET932KJK,clr_optimization_v4.0.30319_32,Microsoft .NET Framework NGEN v4.0.30319_X86,Microsoft .NET Framework NGEN,C:\Windows\Microsoft.NET\Framework\v4.0.30319\mscorsvw.exe,88f140a94f0563c405f6b5e9deee07f9,C:\Windows\Microsoft.NET\Framework\v4.0.30319\mscorsvw.exe,SERVICE_WIN32_OWN_PROCESS,,true,true,The file is signed and the signature was verified.,Microsoft Dynamic Code Publisher,Microsoft Code Signing PCA
ET932KJK,agp440,Intel AGP Bus Filter,,C:\Windows\System32\drivers\AGP440.sys,cdcb5ece884082025335479c98c1f140,\SystemRoot\system32\drivers\agp440.sys,SERVICE_KERNEL_DRIVER,,true,true,The file is signed and the signature was verified.,Microsoft Windows,Microsoft Windows Verification PCA
ET932KJK,mouclass,Mouse Class Driver,,C:\Windows\System32\drivers\mouclass.sys,788a006c4e529f24d97196c47680471a,\SystemRoot\system32\drivers\mouclass.sys,SERVICE_KERNEL_DRIVER,,true,true,The file is signed and the signature was verified.,Microsoft Windows,Microsoft Windows Verification PCA
ET932KJK,aspnet_state,ASP.NET State Service,Provides support for out-of-process session states for ASP.NET. If this service is stopped  out-of-process requests will not be processed. If this service is disabled  any services that explicitly depend on it will fail to start.,C:\Windows\Microsoft.NET\Framework64\v4.0.30319\aspnet_state.exe,cd902a0630658a05c9feb4e279f7c9d1,C:\Windows\Microsoft.NET\Framework64\v4.0.30319\aspnet_state.exe,SERVICE_WIN32_OWN_PROCESS,,true,true,The file is signed and the signature was verified.,Microsoft Corporation,Microsoft Code Signing PCA
ET932KJK,HidUsb,Microsoft HID Class Driver,,C:\Windows\System32\drivers\hidusb.sys,84f6e18ec0bb2a888ccb8b2aa296a050,\SystemRoot\system32\drivers\hidusb.sys,SERVICE_KERNEL_DRIVER,,true,true,The file is signed and the signature was verified.,Microsoft Windows,Microsoft Windows Verification PCA
ET932KJK,fdc,Floppy Disk Controller Driver,,C:\Windows\System32\drivers\fdc.sys,398cf6c7be20a5e6edcb18f8a562bf48,\SystemRoot\system32\drivers\fdc.sys,SERVICE_KERNEL_DRIVER,,true,true,The file is signed and the signature was verified.,Microsoft Windows,Microsoft Windows Verification PCA
ET932KJK,clr_optimization_v4.0.30319_64,Microsoft .NET Framework NGEN v4.0.30319_X64,Microsoft .NET Framework NGEN,C:\Windows\Microsoft.NET\Framework64\v4.0.30319\mscorsvw.exe,4048b028fa8c98ff9ebad21fdfa3d527,C:\Windows\Microsoft.NET\Framework64\v4.0.30319\mscorsvw.exe,SERVICE_WIN32_OWN_PROCESS,,true,true,The file is signed and the signature was verified.,Microsoft Dynamic Code Publisher,Microsoft Code Signing PCA
ET932KJK,LSI_SAS,LSI_SAS,,C:\Windows\System32\drivers\lsi_sas.sys,c2f4963a9cdd5c6f9db10eae75f861ad,\SystemRoot\system32\drivers\lsi_sas.sys,SERVICE_KERNEL_DRIVER,,true,true,The file is signed and the signature was verified.,Microsoft Windows,Microsoft Windows Verification PCA
ET932KJK,mrxsmb,SMB MiniRedirector Wrapper and Engine,Implements the framework for the SMB filesystem redirector,C:\Windows\System32\drivers\mrxsmb.sys,8be8142133b92b1b20801f2b70599ec1,system32\DRIVERS\mrxsmb.sys,SERVICE_FILE_SYSTEM_DRIVER,,true,true,The file is signed and the signature was verified.,Microsoft Windows,Microsoft Windows Verification PCA
ET932KJK,megasas,megasas,,C:\Windows\System32\drivers\megasas.sys,d47c61fe65570fbf0f72b6b5d0723158,\SystemRoot\system32\drivers\megasas.sys,SERVICE_KERNEL_DRIVER,,true,true,The file is signed and the signature was verified.,Microsoft Windows,Microsoft Windows Verification PCA
ET932KJK,CLFS,Common Log (CLFS),General-purpose logging service,C:\Windows\System32\clfs.sys,298069552ec719be32ca78a3ac8e8950,\SystemRoot\System32\CLFS.sys,SERVICE_KERNEL_DRIVER,,true,true,The file is signed and the signature was verified.,Microsoft Windows,Microsoft Windows Verification PCA
ET932KJK,vhdmp,vhdmp,,C:\Windows\System32\drivers\vhdmp.sys,96c97ab33d6f476f4864ad6a46d2c954,\SystemRoot\system32\drivers\vhdmp.sys,SERVICE_KERNEL_DRIVER,,true,true,The file is signed and the signature was verified.,Microsoft Windows,Microsoft Windows Verification PCA
ET932KJK,CNG,CNG,,C:\Windows\System32\drivers\cng.sys,9621e4fc95eb08f3b73317ba9fdf7268,\SystemRoot\System32\Drivers\cng.sys,SERVICE_KERNEL_DRIVER,,true,true,The file is signed and the signature was verified.,Microsoft Windows,Microsoft Windows Verification PCA
ET932KJK,gagp30kx,Microsoft Generic AGPv3.0 Filter for K8 Processor Platforms,,C:\Windows\System32\drivers\GAGP30KX.SYS,f718f556101279bd3f5bf4550d33ab50,\SystemRoot\system32\drivers\gagp30kx.sys,SERVICE_KERNEL_DRIVER,,true,true,The file is signed and the signature was verified.,Microsoft Windows,Microsoft Windows Verification PCA
ET932KJK,hkmsvc,Health Key and Certificate Management,Provides X.509 certificate and key management services for the Network Access Protection Agent (NAPAgent). Enforcement technologies that use X.509 certificates may not function properly without this service,C:\Windows\System32\svchost.exe,ef6a985f2225a97217fd856ace305923,C:\Windows\System32\svchost.exe -k netsvcs,SERVICE_WIN32_SHARE_PROCESS,C:\Windows\System32\KMSVC.DLL,true,true,The file is signed and the signature was verified.,Microsoft Windows,Microsoft Windows Verification PCA
ET932KJK,storvsc,storvsc,,C:\Windows\System32\drivers\storvsc.sys,a6a9c5b5b7bbd10ea92b237757681870,\SystemRoot\system32\drivers\storvsc.sys,SERVICE_KERNEL_DRIVER,,true,true,The file is signed and the signature was verified.,Microsoft Windows,Microsoft Windows Verification PCA
ET932KJK,PlugPlay,Plug and Play,Enables a computer to recognize and adapt to hardware changes with little or no user input. Stopping or disabling this service will result in system instability.,C:\Windows\System32\svchost.exe,ef6a985f2225a97217fd856ace305923,C:\Windows\system32\svchost.exe -k DcomLaunch,SERVICE_WIN32_SHARE_PROCESS,C:\Windows\System32\umpnpmgr.dll,true,true,The file is signed and the signature was verified.,Microsoft Windows,Microsoft Windows Verification PCA
ET932KJK,GoogleVssProvider,GoogleVssProvider,Google Vss Hardware Provider,C:\Windows\System32\dllhost.exe,3a233ce6202040c469c16f7e8cd003f5,C:\Windows\system32\dllhost.exe /Processid:{3EAE8C5E-B51F-4CBD-9DCE-FA6AA0BDF8B8},SERVICE_WIN32_OWN_PROCESS,,true,true,The file is signed and the signature was verified.,Microsoft Windows,Microsoft Windows Verification PCA
ET932KJK,usbuhci,Microsoft USB Universal Host Controller Miniport Driver,,C:\Windows\System32\drivers\usbuhci.sys,2983b899d37ad5bb8a0ec2fae9b48b9c,\SystemRoot\system32\drivers\usbuhci.sys,SERVICE_KERNEL_DRIVER,,true,true,The file is signed and the signature was verified.,Microsoft Windows,Microsoft Windows Verification PCA
