hostname,name,descriptivename,description,path,md5,arguments,type,servicedll,pathsignatureexists,pathsignatureverified,pathsignaturedescription,pathcertificatesubject,pathcertificateissuer
ET932KJK,pla,Performance Logs &amp; Alerts,Performance Logs and Alerts Collects performance data from local or remote computers based on preconfigured schedule parameters  then writes the data to a log or triggers an alert. If this service is stopped  performance information will not be collected. If this service is disabled  any services that explicitly depend on it will fail to start.,C:\Windows\System32\svchost.exe,ef6a985f2225a97217fd856ace305923,C:\Windows\System32\svchost.exe -k LocalServiceNoNetwork,SERVICE_WIN32_SHARE_PROCESS,C:\Windows\System32\pla.dll,true,true,The file is signed and the signature was verified.,Microsoft Windows,Microsoft Windows Verification PCA
ET932KJK,MTConfig,Microsoft Input Configuration Driver,,C:\Windows\System32\drivers\MTConfig.sys,a2f276d429b416d20e68a3d4e2ebbb3f,\SystemRoot\system32\drivers\MTConfig.sys,SERVICE_KERNEL_DRIVER,,true,true,The file is signed and the signature was verified.,Microsoft Windows,Microsoft Windows Verification PCA
ET932KJK,volmgr,Volume Manager Driver,,C:\Windows\System32\drivers\volmgr.sys,0241111c2ddd3302c6a064661d4ed6b6,\SystemRoot\system32\drivers\volmgr.sys,SERVICE_KERNEL_DRIVER,,true,true,The file is signed and the signature was verified.,Microsoft Windows,Microsoft Windows Verification PCA
ET932KJK,IPBusEnum,PnP-X IP Bus Enumerator,The PnP-X bus enumerator service manages the virtual network bus. It discovers network connected devices using the SSDP/WS discovery protocols and gives them presence in PnP. If this service is stopped or disabled  presence of NCD devices will not be maintained in PnP. All pnpx based scenarios will stop functioning.,C:\Windows\System32\svchost.exe,ef6a985f2225a97217fd856ace305923,C:\Windows\system32\svchost.exe -k LocalSystemNetworkRestricted,SERVICE_WIN32_SHARE_PROCESS,C:\Windows\System32\ipbusenum.dll,true,true,The file is signed and the signature was verified.,Microsoft Windows,Microsoft Windows Verification PCA
ET932KJK,mfeaack,McAfee Inc. mfeaack,,C:\Windows\System32\drivers\mfeaack.sys,c39c473c01b8eaaad6a0f5f242a77354,system32\drivers\mfeaack.sys,SERVICE_KERNEL_DRIVER,,true,true,The file is signed and the signature was verified.,Microsoft Windows Hardware Compatibility Publisher,Microsoft Windows Hardware Compatibility PCA
ET932KJK,wmiApSrv,WMI Performance Adapter,Provides performance library information from Windows Management Instrumentation (WMI) providers to clients on the network. This service only runs when Performance Data Helper is activated.,C:\Windows\System32\wbem\WmiApSrv.exe,411b325c471f45f18465b54d04c245fa,C:\Windows\system32\wbem\WmiApSrv.exe,SERVICE_WIN32_OWN_PROCESS,,true,true,The file is signed and the signature was verified.,Microsoft Windows,Microsoft Windows Verification PCA
ET932KJK,mfevtp,McAfee Validation Trust Protection Service,Provides validation trust protection services,C:\Windows\System32\mfevtps.exe,942a3a48d5d20a6f5f7178fec61046f6,"C:\WINDOWS\system32\mfevtps.exe""""""",SERVICE_WIN32_OWN_PROCESS,,true,true,The file is signed and the signature was verified.,"""McAfee",VeriSign Class 3 Code Signing 2010 CA
ET932KJK,intelide,intelide,,C:\Windows\System32\drivers\intelide.sys,cc39369fd028897b8426b0a798f78705,\SystemRoot\system32\drivers\intelide.sys,SERVICE_KERNEL_DRIVER,,true,true,The file is signed and the signature was verified.,Microsoft Windows,Microsoft Windows Verification PCA
ET932KJK,arcsas,arcsas,,C:\Windows\System32\drivers\arcsas.sys,d576d3a1d98d20c8ed9bfd0fd52de996,\SystemRoot\system32\drivers\arcsas.sys,SERVICE_KERNEL_DRIVER,,true,true,The file is signed and the signature was verified.,Microsoft Windows,Microsoft Windows Verification PCA
ET932KJK,rdpbus,Remote Desktop Device Redirector Bus Driver,,C:\Windows\System32\drivers\rdpbus.sys,721e1d2408cf01208168001fb75180c7,\SystemRoot\system32\drivers\rdpbus.sys,SERVICE_KERNEL_DRIVER,,true,true,The file is signed and the signature was verified.,Microsoft Windows,Microsoft Windows Verification PCA
ET932KJK,vds,Virtual Disk,Provides management services for disks  volumes  file systems  and storage arrays.,C:\Windows\System32\vds.exe,bf49f6a4f48c2fd2ba495f181e612349,C:\Windows\System32\vds.exe,SERVICE_WIN32_OWN_PROCESS,,true,true,The file is signed and the signature was verified.,Microsoft Windows,Microsoft Windows Verification PCA
ET932KJK,amdsbs,amdsbs,,C:\Windows\System32\drivers\amdsbs.sys,c79f54a2c112006c1cc7fd3e53123511,\SystemRoot\system32\drivers\amdsbs.sys,SERVICE_KERNEL_DRIVER,,true,true,The file is signed and the signature was verified.,Microsoft Windows,Microsoft Windows Verification PCA
ET932KJK,Vid,Vid,,C:\Windows\System32\drivers\Vid.sys,763119bdac4521d69ba0f528a88e6842,\SystemRoot\system32\drivers\Vid.sys,SERVICE_KERNEL_DRIVER,,true,true,The file is signed and the signature was verified.,Microsoft Windows,Microsoft Windows Verification PCA
ET932KJK,WMPNetworkSvc,Windows Media Player Network Sharing Service,Shares Windows Media Player libraries with other networked players and media devices using Universal Plug and Play,C:\Program Files\Windows Media Player\wmpnetwk.exe,126a1aee7dfcd8967a53b7ba270b1823,C:\Program Files\Windows Media Player\wmpnetwk.exe,SERVICE_WIN32_OWN_PROCESS,,true,true,The file is signed and the signature was verified.,Microsoft Windows,Microsoft Windows Production PCA 2011
ET932KJK,HidBatt,HID UPS Battery Driver,,C:\Windows\System32\drivers\hidbatt.sys,4f36fe83ebc141a0946b14d6da0d7600,\SystemRoot\system32\drivers\HidBatt.sys,SERVICE_KERNEL_DRIVER,,true,true,The file is signed and the signature was verified.,Microsoft Windows,Microsoft Windows Verification PCA
ET932KJK,lltdsvc,Link-Layer Topology Discovery Mapper,Creates a Network Map  consisting of PC and device topology (connectivity) information  and metadata describing each PC and device.  If this service is disabled  the Network Map will not function properly.,C:\Windows\System32\svchost.exe,ef6a985f2225a97217fd856ace305923,C:\Windows\System32\svchost.exe -k LocalService,SERVICE_WIN32_SHARE_PROCESS,C:\Windows\System32\lltdsvc.dll,true,true,The file is signed and the signature was verified.,Microsoft Windows,Microsoft Windows Verification PCA
ET932KJK,b06bdrv,Broadcom NetXtreme II VBD,,C:\Windows\System32\drivers\bxvbda.sys,ad2db0b8efc740e777f548546a1a2c0c,\SystemRoot\system32\drivers\bxvbda.sys,SERVICE_KERNEL_DRIVER,,true,true,The file is signed and the signature was verified.,Microsoft Windows,Microsoft Windows Verification PCA
ET932KJK,WIMMount,WIMMount,WIM Image mount service driver,C:\Windows\System32\drivers\wimmount.sys,ebad2ff82d66169315519dc587e6d233,system32\drivers\wimmount.sys,SERVICE_FILE_SYSTEM_DRIVER,,true,true,The file is signed and the signature was verified.,Microsoft Windows,Microsoft Windows Verification PCA
ET932KJK,SSDPSRV,SSDP Discovery,Discovers networked devices and services that use the SSDP discovery protocol  such as UPnP devices. Also announces SSDP devices and services running on the local computer. If this service is stopped  SSDP-based devices will not be discovered. If this service is disabled  any services that explicitly depend on it will fail to start.,C:\Windows\System32\svchost.exe,ef6a985f2225a97217fd856ace305923,C:\Windows\system32\svchost.exe -k LocalServiceAndNoImpersonation,SERVICE_WIN32_SHARE_PROCESS,C:\Windows\System32\ssdpsrv.dll,true,true,The file is signed and the signature was verified.,Microsoft Windows,Microsoft Windows Verification PCA
ET932KJK,BrSerWdm,Brother WDM Serial driver,,C:\Windows\System32\drivers\BrSerWdm.sys,8e434eb9fad960b5be37d93675eefa4f,\SystemRoot\System32\Drivers\BrSerWdm.sys,SERVICE_KERNEL_DRIVER,,true,true,The file is signed and the signature was verified.,Microsoft Windows,Microsoft Windows Verification PCA
ET932KJK,NdisCap,NDIS Capture LightWeight Filter,NDIS Capture LightWeight Filter,C:\Windows\System32\drivers\ndiscap.sys,01aa662f351f8faa7e8f7477cc155bc0,system32\DRIVERS\ndiscap.sys,SERVICE_KERNEL_DRIVER,,true,true,The file is signed and the signature was verified.,Microsoft Windows,Microsoft Windows Verification PCA
ET932KJK,SiSRaid2,SiSRaid2,,C:\Windows\System32\drivers\sisraid2.sys,761848d5a95266765a4ae8f181e927b3,\SystemRoot\system32\drivers\SiSRaid2.sys,SERVICE_KERNEL_DRIVER,,true,true,The file is signed and the signature was verified.,Microsoft Windows,Microsoft Windows Verification PCA
ET932KJK,PptpMiniport,WAN Miniport (PPTP),WAN Miniport (PPTP),C:\Windows\System32\drivers\raspptp.sys,06b45ec06b48a4c8cb14a3b0a8ec5cd9,system32\DRIVERS\raspptp.sys,SERVICE_KERNEL_DRIVER,,true,true,The file is signed and the signature was verified.,Microsoft Windows,Microsoft Windows Verification PCA
ET932KJK,aliide,aliide,,C:\Windows\System32\drivers\aliide.sys,143cb848bfa407a37af506d793c4dd1f,\SystemRoot\system32\drivers\aliide.sys,SERVICE_KERNEL_DRIVER,,true,true,The file is signed and the signature was verified.,Microsoft Windows,Microsoft Windows Verification PCA
ET932KJK,sbp2port,sbp2port,,C:\Windows\System32\drivers\sbp2port.sys,c1620b70340b9403282d79aed8babfa9,\SystemRoot\system32\drivers\sbp2port.sys,SERVICE_KERNEL_DRIVER,,true,true,The file is signed and the signature was verified.,Microsoft Windows,Microsoft Windows Verification PCA
ET932KJK,Modem,Modem,,C:\Windows\System32\drivers\modem.sys,131727c7a21f3590b8726fee00c44304,system32\drivers\modem.sys,SERVICE_KERNEL_DRIVER,,true,true,The file is signed and the signature was verified.,Microsoft Windows,Microsoft Windows Verification PCA
ET932KJK,nvraid,nvraid,,C:\Windows\System32\drivers\nvraid.sys,146e4a66b0b63abd5cac6130cca7f568,\SystemRoot\system32\drivers\nvraid.sys,SERVICE_KERNEL_DRIVER,,true,true,The file is signed and the signature was verified.,Microsoft Windows,Microsoft Windows Verification PCA
ET932KJK,W3SVC,World Wide Web Publishing Service,Provides Web connectivity and administration through the Internet Information Services Manager,C:\Windows\System32\svchost.exe,ef6a985f2225a97217fd856ace305923,C:\WINDOWS\system32\svchost.exe -k iissvcs,SERVICE_WIN32_SHARE_PROCESS,C:\Windows\System32\inetsrv\iisw3adm.dll,true,true,The file is signed and the signature was verified.,Microsoft Windows,Microsoft Windows Production PCA 2011
ET932KJK,isapnp,isapnp,,C:\Windows\System32\drivers\isapnp.sys,8ba5755167c484418549f5a42fb54765,\SystemRoot\system32\drivers\isapnp.sys,SERVICE_KERNEL_DRIVER,,true,true,The file is signed and the signature was verified.,Microsoft Windows,Microsoft Windows Verification PCA
ET932KJK,netprofm,Network List Service,Identifies the networks to which the computer has connected  collects and stores properties for these networks  and notifies applications when these properties change.,C:\Windows\System32\svchost.exe,ef6a985f2225a97217fd856ace305923,C:\Windows\System32\svchost.exe -k LocalService,SERVICE_WIN32_SHARE_PROCESS,C:\Windows\System32\netprofm.dll,true,true,The file is signed and the signature was verified.,Microsoft Windows,Microsoft Windows Verification PCA
ET932KJK,LSI_FC,LSI_FC,,C:\Windows\System32\drivers\lsi_fc.sys,92f4cb493f97eadfb718a6559a42fe85,\SystemRoot\system32\drivers\lsi_fc.sys,SERVICE_KERNEL_DRIVER,,true,true,The file is signed and the signature was verified.,Microsoft Windows,Microsoft Windows Verification PCA
ET932KJK,NdisWan,Remote Access NDIS WAN Driver,Remote Access NDIS WAN Driver,C:\Windows\System32\drivers\ndiswan.sys,e1fd5c85e093f927858daccec6955abe,system32\DRIVERS\ndiswan.sys,SERVICE_KERNEL_DRIVER,,true,true,The file is signed and the signature was verified.,Microsoft Windows,Microsoft Windows Verification PCA
ET932KJK,MSDTC,Distributed Transaction Coordinator,Coordinates transactions that span multiple resource managers  such as databases  message queues  and file systems. If this service is stopped  these transactions will fail. If this service is disabled  any services that explicitly depend on it will fail to start.,C:\Windows\System32\msdtc.exe,0f95bab36ba2a46c14da4f1965f5d0b0,C:\Windows\System32\msdtc.exe,SERVICE_WIN32_OWN_PROCESS,,true,true,The file is signed and the signature was verified.,Microsoft Windows,Microsoft Windows Verification PCA
ET932KJK,AudioEndpointBuilder,Windows Audio Endpoint Builder,Manages audio devices for the Windows Audio service.  If this service is stopped  audio devices and effects will not function properly.  If this service is disabled  any services that explicitly depend on it will fail to start,C:\Windows\System32\svchost.exe,ef6a985f2225a97217fd856ace305923,C:\Windows\System32\svchost.exe -k LocalSystemNetworkRestricted,SERVICE_WIN32_SHARE_PROCESS,C:\Windows\System32\audiosrv.dll,true,true,The file is signed and the signature was verified.,Microsoft Windows,Microsoft Windows Verification PCA
ET932KJK,lltdio,Link-Layer Topology Discovery Mapper I/O Driver,,C:\Windows\System32\drivers\lltdio.sys,5942228f6b45c48eb19783a3bcc1c00c,system32\DRIVERS\lltdio.sys,SERVICE_KERNEL_DRIVER,,true,true,The file is signed and the signature was verified.,Microsoft Windows,Microsoft Windows Verification PCA
ET932KJK,Spooler,Print Spooler,Loads files to memory for later printing,C:\Windows\System32\spoolsv.exe,f5fcf91355e0e31070938b7a8559508d,C:\Windows\System32\spoolsv.exe,SERVICE_WIN32_OWN_PROCESS,,true,true,The file is signed and the signature was verified.,Microsoft Windows,Microsoft Windows Verification PCA
ET932KJK,TsUsbGD,Remote Desktop Generic USB Device,,C:\Windows\System32\drivers\TsUsbGD.sys,98a95d81bad7ba3deccc6989ebbe133d,\SystemRoot\system32\drivers\TsUsbGD.sys,SERVICE_KERNEL_DRIVER,,true,true,The file is signed and the signature was verified.,Microsoft Windows,Microsoft Windows Verification PCA
ET932KJK,FontCache,Windows Font Cache Service,Optimizes performance of applications by caching commonly used font data. Applications will start this service if it is not already running. It can be disabled  though doing so will degrade application performance.,C:\Windows\System32\svchost.exe,ef6a985f2225a97217fd856ace305923,C:\Windows\system32\svchost.exe -k LocalService,SERVICE_WIN32_SHARE_PROCESS,C:\Windows\System32\FntCache.dll,true,true,The file is signed and the signature was verified.,Microsoft Windows,Microsoft Windows Verification PCA
ET932KJK,nsi,Network Store Interface Service,This service delivers network notifications (e.g. interface addition/deleting etc) to user mode clients. Stopping this service will cause loss of network connectivity. If this service is disabled  any other services that explicitly depend on this service will fail to start.,C:\Windows\System32\svchost.exe,ef6a985f2225a97217fd856ace305923,C:\Windows\system32\svchost.exe -k LocalService,SERVICE_WIN32_SHARE_PROCESS,C:\Windows\System32\nsisvc.dll,true,true,The file is signed and the signature was verified.,Microsoft Windows,Microsoft Windows Verification PCA
ET932KJK,b57nd60a,Broadcom NetXtreme Gigabit Ethernet - NDIS 6.0,,C:\Windows\System32\drivers\b57nd60a.sys,890d20298f97337ef9468f06c4a9737b,system32\DRIVERS\b57nd60a.sys,SERVICE_KERNEL_DRIVER,,true,true,The file is signed and the signature was verified.,Microsoft Windows,Microsoft Windows Verification PCA
ET932KJK,nsiproxy,NSI proxy service driver.,NSI proxy service.,C:\Windows\System32\drivers\nsiproxy.sys,662e2b31df902113c92bdb83ad599680,system32\drivers\nsiproxy.sys,SERVICE_KERNEL_DRIVER,,true,true,The file is signed and the signature was verified.,Microsoft Windows,Microsoft Windows Verification PCA
ET932KJK,sffp_mmc,SFF Storage Protocol Driver for MMC,,C:\Windows\System32\drivers\sffp_mmc.sys,20e6faff090d3a20d281a28d35c35f38,\SystemRoot\system32\drivers\sffp_mmc.sys,SERVICE_KERNEL_DRIVER,,true,true,The file is signed and the signature was verified.,Microsoft Windows,Microsoft Windows Verification PCA
ET932KJK,ModuleCoreService,McAfee Module Core Service,McAfee Module Core Service,C:\Program Files\Common Files\McAfee\ModuleCore\ModuleCoreService.exe,550b3b8b4c0f89f556e016474fd8b49e,C:\Program Files\Common Files\McAfee\ModuleCore\ModuleCoreService.exe,SERVICE_WIN32_SHARE_PROCESS,,true,true,The file is signed and the signature was verified.,"""McAfee",Symantec Class 3 SHA256 Code Signing CA
ET932KJK,Compbatt,Compbatt,,C:\Windows\System32\drivers\compbatt.sys,1bf54abb203e26c87a303e80097c36f4,\SystemRoot\system32\drivers\compbatt.sys,SERVICE_KERNEL_DRIVER,,true,true,The file is signed and the signature was verified.,Microsoft Windows,Microsoft Windows Verification PCA
ET932KJK,iScsiPrt,iScsiPort Driver,,C:\Windows\System32\drivers\msiscsi.sys,3de54f2df4935ba310eef88409eb6306,\SystemRoot\system32\drivers\msiscsi.sys,SERVICE_KERNEL_DRIVER,,true,true,The file is signed and the signature was verified.,Microsoft Windows,Microsoft Windows Verification PCA
ET932KJK,VMBusHID,VMBusHID,,C:\Windows\System32\drivers\VMBusHID.sys,3ed444d820c8a225c9d02ba308134676,\SystemRoot\system32\drivers\VMBusHID.sys,SERVICE_KERNEL_DRIVER,,true,true,The file is signed and the signature was verified.,Microsoft Windows,Microsoft Windows Verification PCA
ET932KJK,nvme,nvme,,C:\Windows\System32\drivers\nvme.sys,68940ed5f8ff2530d2d1af708697c552,\SystemRoot\system32\drivers\nvme.sys,SERVICE_KERNEL_DRIVER,,true,true,The file is signed and the signature was verified.,Google Inc,Symantec Class 3 SHA256 Code Signing CA
ET932KJK,netkvm,Red Hat VirtIO Ethernet Adapter Service,,C:\Windows\System32\drivers\netkvm.sys,ba10a720b73352c12b1e77d4e30eef73,system32\DRIVERS\netkvm.sys,SERVICE_KERNEL_DRIVER,,true,true,The file is signed and the signature was verified.,Google Inc,Symantec Class 3 SHA256 Code Signing CA
ET932KJK,Wd,Wd,,C:\Windows\System32\drivers\wd.sys,add698da461fcf2596b2e3bf5a7c9c27,\SystemRoot\system32\drivers\wd.sys,SERVICE_KERNEL_DRIVER,,true,true,The file is signed and the signature was verified.,Microsoft Windows,Microsoft Windows Verification PCA
ET932KJK,LanmanServer,Server,Supports file  print  and named-pipe sharing over the network for this computer. If this service is stopped  these functions will be unavailable. If this service is disabled  any services that explicitly depend on it will fail to start.,C:\Windows\System32\svchost.exe,ef6a985f2225a97217fd856ace305923,C:\Windows\system32\svchost.exe -k netsvcs,SERVICE_WIN32_SHARE_PROCESS,C:\Windows\System32\srvsvc.dll,true,true,The file is signed and the signature was verified.,Microsoft Windows,Microsoft Windows Verification PCA
ET932KJK,AppIDSvc,Application Identity,Determines and verifies the identity of an application. Disabling this service will prevent AppLocker from being enforced.,C:\Windows\System32\svchost.exe,ef6a985f2225a97217fd856ace305923,C:\Windows\system32\svchost.exe -k LocalServiceAndNoImpersonation,SERVICE_WIN32_SHARE_PROCESS,C:\Windows\System32\appidsvc.dll,true,true,The file is signed and the signature was verified.,Microsoft Windows,Microsoft Windows Verification PCA
ET932KJK,Processor,Processor Driver,,C:\Windows\System32\drivers\processr.sys,733b65c35cb23bb64733f59c9bc2524c,\SystemRoot\system32\drivers\processr.sys,SERVICE_KERNEL_DRIVER,,true,true,The file is signed and the signature was verified.,Microsoft Windows,Microsoft Windows Verification PCA
ET932KJK,WdiSystemHost,Diagnostic System Host,The Diagnostic System Host is used by the Diagnostic Policy Service to host diagnostics that need to run in a Local System context.  If this service is stopped  any diagnostics that depend on it will no longer function.,C:\Windows\System32\svchost.exe,ef6a985f2225a97217fd856ace305923,C:\Windows\System32\svchost.exe -k LocalSystemNetworkRestricted,SERVICE_WIN32_SHARE_PROCESS,C:\Windows\System32\wdi.dll,true,true,The file is signed and the signature was verified.,Microsoft Windows,Microsoft Windows Verification PCA
ET932KJK,Serial,Serial port driver,,C:\Windows\System32\drivers\serial.sys,91e6b1b53b77101d09ea714eb8d5d178,\SystemRoot\system32\drivers\serial.sys,SERVICE_KERNEL_DRIVER,,true,true,The file is signed and the signature was verified.,Microsoft Windows,Microsoft Windows Verification PCA
ET932KJK,tcpipreg,TCP/IP Registry Compatibility,Provides compatibility for legacy applications which interact with TCP/IP through the registry. If this service is stopped  certain applications may have impaired functionality.,C:\Windows\System32\drivers\tcpipreg.sys,d46c37b7de9ecd2fbc05606e8e217db7,System32\drivers\tcpipreg.sys,SERVICE_KERNEL_DRIVER,,true,true,The file is signed and the signature was verified.,Microsoft Windows,Microsoft Windows Verification PCA
ET932KJK,SNMPTRAP,SNMP Trap,Receives trap messages generated by local or remote Simple Network Management Protocol (SNMP) agents and forwards the messages to SNMP management programs running on this computer. If this service is stopped  SNMP-based programs on this computer will not receive SNMP trap messages. If this service is disabled  any services that explicitly depend on it will fail to start.,C:\Windows\System32\snmptrap.exe,00b826db16f74a8a1d33f7f556c0c306,C:\Windows\System32\snmptrap.exe,SERVICE_WIN32_OWN_PROCESS,,true,true,The file is signed and the signature was verified.,Microsoft Windows,Microsoft Windows Verification PCA
ET932KJK,storvsp,storvsp,,C:\Windows\System32\drivers\storvsp.sys,baa93a94abdd88c7f71db7607ddada42,\SystemRoot\system32\drivers\storvsp.sys,SERVICE_KERNEL_DRIVER,,true,true,The file is signed and the signature was verified.,Microsoft Windows,Microsoft Windows Verification PCA
ET932KJK,Mup,Mup,Multiple UNC Provider Driver,C:\Windows\System32\drivers\mup.sys,489a1b35f6e28772f483eb77a014559b,\SystemRoot\System32\Drivers\mup.sys,SERVICE_FILE_SYSTEM_DRIVER,,true,true,The file is signed and the signature was verified.,Microsoft Windows,Microsoft Windows Verification PCA
ET932KJK,cdrom,cdrom,,C:\Windows\System32\drivers\cdrom.sys,0323785b8acba0abd8850763f048ee7b,\SystemRoot\system32\drivers\cdrom.sys,SERVICE_KERNEL_DRIVER,,true,true,The file is signed and the signature was verified.,Microsoft Windows,Microsoft Windows Verification PCA
ET932KJK,VaultSvc,Credential Manager,Provides secure storage and retrieval of credentials to users  applications and security service packages.,C:\Windows\System32\lsass.exe,b5dc0149fa39466e4dc45f18bbfee436,C:\Windows\system32\lsass.exe,SERVICE_WIN32_SHARE_PROCESS,,true,true,The file is signed and the signature was verified.,Microsoft Windows,Microsoft Windows Verification PCA
ET932KJK,KtmRm,KtmRm for Distributed Transaction Coordinator,Coordinates transactions between the Distributed Transaction Coordinator (MSDTC) and the Kernel Transaction Manager (KTM). If it is not needed  it is recommended that this service remain stopped. If it is needed  both MSDTC and KTM will start this service automatically. If this service is disabled  any MSDTC transaction interacting with a Kernel Resource Manager will fail and any services that explicitly depend on it will fail to start.,C:\Windows\System32\svchost.exe,ef6a985f2225a97217fd856ace305923,C:\Windows\System32\svchost.exe -k NetworkServiceAndNoImpersonation,SERVICE_WIN32_SHARE_PROCESS,C:\Windows\System32\msdtckrm.dll,true,true,The file is signed and the signature was verified.,Microsoft Windows,Microsoft Windows Verification PCA
ET932KJK,seclogon,Secondary Logon,Enables starting processes under alternate credentials. If this service is stopped  this type of logon access will be unavailable. If this service is disabled  any services that explicitly depend on it will fail to start.,C:\Windows\System32\svchost.exe,ef6a985f2225a97217fd856ace305923,C:\Windows\system32\svchost.exe -k netsvcs,SERVICE_WIN32_SHARE_PROCESS,C:\Windows\System32\seclogon.dll,true,true,The file is signed and the signature was verified.,Microsoft Windows,Microsoft Windows Verification PCA
ET932KJK,mccspsvc,McAfee CSP Service,McAfee Cloud Platform Service,C:\Program Files\Common Files\McAfee\CSP\3.0.127.0\\McCSPServiceHost.exe,8e0e1d8d665539fbe11bda7227cb0fea,"C:\Program Files\Common Files\McAfee\CSP\3.0.127.0\\McCSPServiceHost.exe""""""",SERVICE_WIN32_OWN_PROCESS,,true,true,The file is signed and the signature was verified.,"""McAfee",Symantec Class 3 SHA256 Code Signing CA
ET932KJK,DXGKrnl,LDDM Graphics Subsystem,Controls the underlying video driver stacks to provide fully-featured display capabilities.,C:\Windows\System32\drivers\dxgkrnl.sys,2d9f37aa10663127bd4bcc67563ee068,\SystemRoot\System32\drivers\dxgkrnl.sys,SERVICE_KERNEL_DRIVER,,true,true,The file is signed and the signature was verified.,Microsoft Windows,Microsoft Windows Verification PCA
ET932KJK,AFD,Ancillary Function Driver for Winsock,Ancillary Function Driver for Winsock,C:\Windows\System32\drivers\afd.sys,821c3c70ce6a7fa181fc0db83264906c,\SystemRoot\system32\drivers\afd.sys,SERVICE_KERNEL_DRIVER,,true,true,The file is signed and the signature was verified.,Microsoft Windows,Microsoft Windows Verification PCA
ET932KJK,Appinfo,Application Information,Facilitates the running of interactive applications with additional administrative privileges.  If this service is stopped  users will be unable to launch applications with the additional administrative privileges they may require to perform desired user tasks.,C:\Windows\System32\svchost.exe,ef6a985f2225a97217fd856ace305923,C:\Windows\system32\svchost.exe -k netsvcs,SERVICE_WIN32_SHARE_PROCESS,C:\Windows\System32\appinfo.dll,true,true,The file is signed and the signature was verified.,Microsoft Windows,Microsoft Windows Verification PCA
