hostname,name,descriptivename,description,path,md5,arguments,type,servicedll,pathsignatureexists,pathsignatureverified,pathsignaturedescription,pathcertificatesubject,pathcertificateissuer
SE441YJP,DXGKrnl,LDDM Graphics Subsystem,Controls the underlying video driver stacks to provide fully-featured display capabilities.,C:\Windows\System32\drivers\dxgkrnl.sys,7499fdc171f204b91aa0bbfa36f996e9,\SystemRoot\System32\drivers\dxgkrnl.sys,SERVICE_KERNEL_DRIVER,,true,true,The file is signed and the signature was verified.,Microsoft Windows,Microsoft Windows Verification PCA
SE441YJP,LSI_SAS,LSI_SAS,,C:\Windows\System32\drivers\lsi_sas.sys,79128b1e59fe60486669ebf6ab7576eb,\SystemRoot\system32\drivers\lsi_sas.sys,SERVICE_KERNEL_DRIVER,,true,true,The file is signed and the signature was verified.,Microsoft Windows,Microsoft Windows Verification PCA
SE441YJP,EFS,Encrypting File System (EFS),Provides the core file encryption technology used to store encrypted files on NTFS file system volumes. If this service is stopped or disabled  applications will be unable to access encrypted files.,C:\Windows\System32\lsass.exe,cb3f2729430d14eb2936a8d6a9e2d792,C:\Windows\System32\lsass.exe,SERVICE_WIN32_SHARE_PROCESS,,true,true,The file is signed and the signature was verified.,Microsoft Windows,Microsoft Windows Verification PCA
SE441YJP,NetBIOS,NetBIOS Interface,NetBIOS Interface,C:\Windows\System32\drivers\netbios.sys,19369b20ce90fca2202a56f13245b308,system32\DRIVERS\netbios.sys,SERVICE_FILE_SYSTEM_DRIVER,,true,true,The file is signed and the signature was verified.,Microsoft Windows,Microsoft Windows Verification PCA
SE441YJP,aliide,aliide,,C:\Windows\System32\drivers\aliide.sys,e6ce3bd7f5a097c70b3305ead0eab86d,\SystemRoot\system32\drivers\aliide.sys,SERVICE_KERNEL_DRIVER,,true,true,The file is signed and the signature was verified.,Microsoft Windows,Microsoft Windows Verification PCA
SE441YJP,atapi,atapi,,C:\Windows\System32\drivers\atapi.sys,c27f2a49625d342f0499136e279f81a0,\SystemRoot\system32\drivers\atapi.sys,SERVICE_KERNEL_DRIVER,,true,true,The file is signed and the signature was verified.,Microsoft Windows,Microsoft Windows Verification PCA
SE441YJP,mrxsmb20,SMB 2.0 MiniRedirector,Implements the SMB 2.0 protocol  which provides connectivity to network resources on Windows Vista and later servers,C:\Windows\System32\drivers\mrxsmb20.sys,5f233a8b501052b14fbfa8d9fb4aec46,system32\DRIVERS\mrxsmb20.sys,SERVICE_FILE_SYSTEM_DRIVER,,true,true,The file is signed and the signature was verified.,Microsoft Windows,Microsoft Windows Verification PCA
SE441YJP,sffdisk,SFF Storage Class Driver,,C:\Windows\System32\drivers\sffdisk.sys,ab90e8ad8a5a07d9d8564bdb4e2f1f65,\SystemRoot\system32\drivers\sffdisk.sys,SERVICE_KERNEL_DRIVER,,true,true,The file is signed and the signature was verified.,Microsoft Windows,Microsoft Windows Verification PCA
SE441YJP,CmBatt,Microsoft ACPI Control Method Battery Driver,,C:\Windows\System32\drivers\CmBatt.sys,a73a5cb622720c100d6fb918194ff4f7,\SystemRoot\system32\drivers\CmBatt.sys,SERVICE_KERNEL_DRIVER,,true,true,The file is signed and the signature was verified.,Microsoft Windows,Microsoft Windows Verification PCA
SE441YJP,TrkWks,Distributed Link Tracking Client,Maintains links between NTFS files within a computer or across computers in a network.,C:\Windows\System32\svchost.exe,e86152d627c3ef720ba7910edc62b478,C:\Windows\System32\svchost.exe -k LocalSystemNetworkRestricted,SERVICE_WIN32_SHARE_PROCESS,C:\Windows\System32\trkwks.dll,true,true,The file is signed and the signature was verified.,Microsoft Windows,Microsoft Windows Verification PCA
SE441YJP,gpsvc,Group Policy Client,The service is responsible for applying settings configured by administrators for the computer and users through the Group Policy component. If the service is stopped or disabled  the settings will not be applied and applications and components will not be manageable through Group Policy. Any components or applications that depend on the Group Policy component might not be functional if the service is stopped or disabled.,C:\Windows\System32\svchost.exe,e86152d627c3ef720ba7910edc62b478,C:\Windows\system32\svchost.exe -k netsvcs,SERVICE_WIN32_SHARE_PROCESS,C:\Windows\System32\gpsvc.dll,true,true,The file is signed and the signature was verified.,Microsoft Windows,Microsoft Windows Verification PCA
SE441YJP,crcdisk,Crcdisk Filter Driver,,C:\Windows\System32\drivers\crcdisk.sys,3794c414eab02f28f497f5da9a08c2d5,\SystemRoot\system32\drivers\crcdisk.sys,SERVICE_KERNEL_DRIVER,,true,true,The file is signed and the signature was verified.,Microsoft Windows,Microsoft Windows Verification PCA
SE441YJP,MegaSR,MegaSR,,C:\Windows\System32\drivers\MegaSR.sys,74c8bb0324812761b8195e3e5d4c1bc0,\SystemRoot\system32\drivers\MegaSR.sys,SERVICE_KERNEL_DRIVER,,true,true,The file is signed and the signature was verified.,Microsoft Windows,Microsoft Windows Verification PCA
SE441YJP,eventlog,Windows Event Log,This service manages events and event logs. It supports logging events  querying events  subscribing to events  archiving event logs  and managing event metadata. It can display events in both XML and plain text format. Stopping this service may compromise security and reliability of the system.,C:\Windows\System32\svchost.exe,e86152d627c3ef720ba7910edc62b478,C:\Windows\System32\svchost.exe -k LocalServiceNetworkRestricted,SERVICE_WIN32_SHARE_PROCESS,,true,true,The file is signed and the signature was verified.,Microsoft Windows,Microsoft Windows Verification PCA
SE441YJP,usbccgp,Microsoft USB Generic Parent Driver,,C:\Windows\System32\drivers\usbccgp.sys,95fc67f250632f297acc29e0aab07bef,\SystemRoot\system32\drivers\usbccgp.sys,SERVICE_KERNEL_DRIVER,,true,true,The file is signed and the signature was verified.,Microsoft Windows,Microsoft Windows Verification PCA
SE441YJP,NetPipeActivator,Net.Pipe Listener Adapter,Receives activation requests over the net.pipe protocol and passes them to the Windows Process Activation Service.,C:\Windows\Microsoft.NET\Framework64\v4.0.30319\SMSvcHost.exe,bb12c21a39ebaff79237fa7222d6ef0b,C:\Windows\Microsoft.NET\Framework64\v4.0.30319\SMSvcHost.exe,SERVICE_WIN32_SHARE_PROCESS,,true,true,The file is signed and the signature was verified.,Microsoft Corporation,Microsoft Code Signing PCA
SE441YJP,LanmanWorkstation,Workstation,Creates and maintains client network connections to remote servers using the SMB protocol. If this service is stopped  these connections will be unavailable. If this service is disabled  any services that explicitly depend on it will fail to start.,C:\Windows\System32\svchost.exe,e86152d627c3ef720ba7910edc62b478,C:\Windows\System32\svchost.exe -k NetworkService,SERVICE_WIN32_SHARE_PROCESS,C:\Windows\System32\wkssvc.dll,true,true,The file is signed and the signature was verified.,Microsoft Windows,Microsoft Windows Verification PCA
SE441YJP,sfloppy,High-Capacity Floppy Disk Drive,,C:\Windows\System32\drivers\sfloppy.sys,83609c592b94125939c446e7abb4d4f5,\SystemRoot\system32\drivers\sfloppy.sys,SERVICE_KERNEL_DRIVER,,true,true,The file is signed and the signature was verified.,Microsoft Windows,Microsoft Windows Verification PCA
SE441YJP,srvnet,srvnet,,C:\Windows\System32\drivers\srvnet.sys,ee54d4516bdd52b2b62bc151da9f7b4c,System32\DRIVERS\srvnet.sys,SERVICE_FILE_SYSTEM_DRIVER,,true,true,The file is signed and the signature was verified.,Microsoft Windows,Microsoft Windows Verification PCA
SE441YJP,NdisWan,Remote Access NDIS WAN Driver,Remote Access NDIS WAN Driver,C:\Windows\System32\drivers\ndiswan.sys,d938617b91c4e44b968bcdc854a73653,system32\DRIVERS\ndiswan.sys,SERVICE_KERNEL_DRIVER,,true,true,The file is signed and the signature was verified.,Microsoft Windows,Microsoft Windows Verification PCA
SE441YJP,McAWFwk,McAfee Activation Service,McAfee Activation Service,c:\Program Files\Common Files\McAfee\ActWiz\McAWFwk.exe,da620dbb74edab2729b53dc2816a15d8,c:\PROGRA~1\COMMON~1\mcafee\actwiz\mcawfwk.exe,SERVICE_WIN32_OWN_PROCESS,,true,true,The file is signed and the signature was verified.,"McAfee""",Symantec Class 3 SHA256 Code Signing CA
SE441YJP,KeyIso,CNG Key Isolation,The CNG key isolation service is hosted in the LSA process. The service provides key process isolation to private keys and associated cryptographic operations as required by the Common Criteria. The service stores and uses long-lived keys in a secure process complying with Common Criteria requirements.,C:\Windows\System32\lsass.exe,cb3f2729430d14eb2936a8d6a9e2d792,C:\Windows\system32\lsass.exe,SERVICE_WIN32_SHARE_PROCESS,,true,true,The file is signed and the signature was verified.,Microsoft Windows,Microsoft Windows Verification PCA
SE441YJP,IPBusEnum,PnP-X IP Bus Enumerator,The PnP-X bus enumerator service manages the virtual network bus. It discovers network connected devices using the SSDP/WS discovery protocols and gives them presence in PnP. If this service is stopped or disabled  presence of NCD devices will not be maintained in PnP. All pnpx based scenarios will stop functioning.,C:\Windows\System32\svchost.exe,e86152d627c3ef720ba7910edc62b478,C:\Windows\system32\svchost.exe -k LocalSystemNetworkRestricted,SERVICE_WIN32_SHARE_PROCESS,C:\Windows\System32\ipbusenum.dll,true,true,The file is signed and the signature was verified.,Microsoft Windows,Microsoft Windows Verification PCA
SE441YJP,mshidkmdf,Pass-through HID to KMDF Filter Driver,Device Filter to provide pass-through interface between HIDCLASS and KMDF,C:\Windows\System32\drivers\mshidkmdf.sys,b3bdbec4c6e151f90b231dac1a6bd575,\SystemRoot\System32\drivers\mshidkmdf.sys,SERVICE_KERNEL_DRIVER,,true,true,The file is signed and the signature was verified.,Microsoft Windows,Microsoft Windows Verification PCA
SE441YJP,isapnp,isapnp,,C:\Windows\System32\drivers\isapnp.sys,8ba5755167c484418549f5a42fb54765,\SystemRoot\system32\drivers\isapnp.sys,SERVICE_KERNEL_DRIVER,,true,true,The file is signed and the signature was verified.,Microsoft Windows,Microsoft Windows Verification PCA
SE441YJP,hwpolicy,Hardware Policy Driver,Contains Processor and other policies,C:\Windows\System32\drivers\hwpolicy.sys,e630cc97fc267e92f7d9fa9fef060c6b,\SystemRoot\System32\drivers\hwpolicy.sys,SERVICE_KERNEL_DRIVER,,true,true,The file is signed and the signature was verified.,Microsoft Windows,Microsoft Windows Verification PCA
SE441YJP,rspndr,Link-Layer Topology Discovery Responder,,C:\Windows\System32\drivers\rspndr.sys,e9ee400793ad60feea199b27ff1bff15,system32\DRIVERS\rspndr.sys,SERVICE_KERNEL_DRIVER,,true,true,The file is signed and the signature was verified.,Microsoft Windows,Microsoft Windows Verification PCA
SE441YJP,storvsc,storvsc,,C:\Windows\System32\drivers\storvsc.sys,ca66e9e55867d42e641c54d57f92cbc2,\SystemRoot\system32\drivers\storvsc.sys,SERVICE_KERNEL_DRIVER,,true,true,The file is signed and the signature was verified.,Microsoft Windows,Microsoft Windows Verification PCA
SE441YJP,FileInfo,File Information FS MiniFilter,Collects information about files in memory to be consumed by other system services.,C:\Windows\System32\drivers\fileinfo.sys,643dfabdaae80b5fcb8bc29e6d5166b2,system32\drivers\fileinfo.sys,SERVICE_FILE_SYSTEM_DRIVER,,true,true,The file is signed and the signature was verified.,Microsoft Windows,Microsoft Windows Verification PCA
SE441YJP,CompositeBus,Composite Bus Enumerator Driver,,C:\Windows\System32\drivers\CompositeBus.sys,a053722366e52ebacdbebf418cfbc460,\SystemRoot\system32\drivers\CompositeBus.sys,SERVICE_KERNEL_DRIVER,,true,true,The file is signed and the signature was verified.,Microsoft Windows,Microsoft Windows Verification PCA
SE441YJP,partmgr,Partition Manager,Disk class filter driver that auctions out partitions to volume managers,C:\Windows\System32\drivers\partmgr.sys,0d7d7690ecc0a2fa5e4714bbcb834e97,\SystemRoot\System32\drivers\partmgr.sys,SERVICE_KERNEL_DRIVER,,true,true,The file is signed and the signature was verified.,Microsoft Windows,Microsoft Windows Verification PCA
SE441YJP,amdsata,amdsata,,C:\Windows\System32\drivers\amdsata.sys,41cecdbda84c37750d20aca2cdd07a1c,\SystemRoot\system32\drivers\amdsata.sys,SERVICE_KERNEL_DRIVER,,true,true,The file is signed and the signature was verified.,Microsoft Windows,Microsoft Windows Verification PCA
SE441YJP,Vid,Vid,,C:\Windows\System32\drivers\Vid.sys,e0b5bf49065f14fb159cb20c4f7ee05f,\SystemRoot\system32\drivers\Vid.sys,SERVICE_KERNEL_DRIVER,,true,true,The file is signed and the signature was verified.,Microsoft Windows,Microsoft Windows Verification PCA
SE441YJP,pciide,pciide,,C:\Windows\System32\drivers\pciide.sys,f3fd53424d50dc4501117e945b2ea243,\SystemRoot\system32\drivers\pciide.sys,SERVICE_KERNEL_DRIVER,,true,true,The file is signed and the signature was verified.,Microsoft Windows,Microsoft Windows Verification PCA
SE441YJP,monitor,Microsoft Monitor Class Function Driver Service,,C:\Windows\System32\drivers\monitor.sys,44b7c746aed63f0755ba48f841fed5a6,system32\DRIVERS\monitor.sys,SERVICE_KERNEL_DRIVER,,true,true,The file is signed and the signature was verified.,Microsoft Windows,Microsoft Windows Verification PCA
SE441YJP,IPNAT,IP Network Address Translator,,C:\Windows\System32\drivers\ipnat.sys,28e0b3cfcfbdfdc9a187cf3b4cd791c5,System32\drivers\ipnat.sys,SERVICE_KERNEL_DRIVER,,true,true,The file is signed and the signature was verified.,Microsoft Windows,Microsoft Windows Verification PCA
SE441YJP,dot3svc,Wired AutoConfig,The Wired AutoConfig (DOT3SVC) service is responsible for performing IEEE 802.1X authentication on Ethernet interfaces. If your current wired network deployment enforces 802.1X authentication  the DOT3SVC service should be configured to run for establishing Layer 2 connectivity and/or providing access to network resources. Wired networks that do not enforce 802.1X authentication are unaffected by the DOT3SVC service.,C:\Windows\System32\svchost.exe,e86152d627c3ef720ba7910edc62b478,C:\Windows\system32\svchost.exe -k LocalSystemNetworkRestricted,SERVICE_WIN32_SHARE_PROCESS,C:\Windows\System32\dot3svc.dll,true,true,The file is signed and the signature was verified.,Microsoft Windows,Microsoft Windows Verification PCA
SE441YJP,usbhub,Microsoft USB Standard Hub Driver,,C:\Windows\System32\drivers\usbhub.sys,64b262c3b3c31a66259fd55e1aaa06d6,\SystemRoot\system32\drivers\usbhub.sys,SERVICE_KERNEL_DRIVER,,true,true,The file is signed and the signature was verified.,Microsoft Windows,Microsoft Windows Verification PCA
SE441YJP,RDPENCDD,RDP Encoder Mirror Driver,RDP Encoder Mirror Driver,C:\Windows\System32\drivers\RDPENCDD.sys,f1e0b10261a93caf042d16b5c933f54d,system32\drivers\rdpencdd.sys,SERVICE_KERNEL_DRIVER,,true,true,The file is signed and the signature was verified.,Microsoft Windows,Microsoft Windows Verification PCA
SE441YJP,uliagpkx,Uli AGP Bus Filter,,C:\Windows\System32\drivers\ULIAGPKX.SYS,1584fce9635abbfda6f64a5414d52c3d,\SystemRoot\system32\drivers\uliagpkx.sys,SERVICE_KERNEL_DRIVER,,true,true,The file is signed and the signature was verified.,Microsoft Windows,Microsoft Windows Verification PCA
SE441YJP,Rasl2tp,WAN Miniport (L2TP),WAN Miniport (L2TP),C:\Windows\System32\drivers\rasl2tp.sys,81aa7e444096bb7c200d85bfee280a61,system32\DRIVERS\rasl2tp.sys,SERVICE_KERNEL_DRIVER,,true,true,The file is signed and the signature was verified.,Microsoft Windows,Microsoft Windows Verification PCA
SE441YJP,amdide,amdide,,C:\Windows\System32\drivers\amdide.sys,73ab3ca9031e9dc2814636044d8c97fd,\SystemRoot\system32\drivers\amdide.sys,SERVICE_KERNEL_DRIVER,,true,true,The file is signed and the signature was verified.,Microsoft Windows,Microsoft Windows Verification PCA
SE441YJP,CertPropSvc,Certificate Propagation,Copies user certificates and root certificates from smart cards into the current user's certificate store  detects when a smart card is inserted into a smart card reader  and  if needed  installs the smart card Plug and Play minidriver.,C:\Windows\System32\svchost.exe,e86152d627c3ef720ba7910edc62b478,C:\Windows\system32\svchost.exe -k netsvcs,SERVICE_WIN32_SHARE_PROCESS,C:\Windows\System32\certprop.dll,true,true,The file is signed and the signature was verified.,Microsoft Windows,Microsoft Windows Verification PCA
SE441YJP,volsnap,Storage volumes,,C:\Windows\System32\drivers\volsnap.sys,f7fd138f2fd45f1ea2878795f6b3d3f3,\SystemRoot\system32\drivers\volsnap.sys,SERVICE_KERNEL_DRIVER,,true,true,The file is signed and the signature was verified.,Microsoft Windows,Microsoft Windows Verification PCA
SE441YJP,IPMIDRV,IPMIDRV,,C:\Windows\System32\drivers\IPMIDrv.sys,e4868eea297c74578cc78fe72481a88b,\SystemRoot\system32\drivers\IPMIDrv.sys,SERVICE_KERNEL_DRIVER,,true,true,The file is signed and the signature was verified.,Microsoft Windows,Microsoft Windows Verification PCA
SE441YJP,NlaSvc,Network Location Awareness,Collects and stores configuration information for the network and notifies programs when this information is modified. If this service is stopped  configuration information might be unavailable. If this service is disabled  any services that explicitly depend on it will fail to start.,C:\Windows\System32\svchost.exe,e86152d627c3ef720ba7910edc62b478,C:\Windows\System32\svchost.exe -k NetworkService,SERVICE_WIN32_SHARE_PROCESS,C:\Windows\System32\nlasvc.dll,true,true,The file is signed and the signature was verified.,Microsoft Windows,Microsoft Windows Verification PCA
SE441YJP,aspnet_state,ASP.NET State Service,Provides support for out-of-process session states for ASP.NET. If this service is stopped  out-of-process requests will not be processed. If this service is disabled  any services that explicitly depend on it will fail to start.,C:\Windows\Microsoft.NET\Framework64\v4.0.30319\aspnet_state.exe,c9662bf329710df0254fe34f7cd3d99e,C:\Windows\Microsoft.NET\Framework64\v4.0.30319\aspnet_state.exe,SERVICE_WIN32_OWN_PROCESS,,true,true,The file is signed and the signature was verified.,Microsoft Corporation,Microsoft Code Signing PCA
SE441YJP,s3cap,s3cap,,C:\Windows\System32\drivers\vms3cap.sys,d092bf496192b9448db7ce09441aa4b6,\SystemRoot\system32\drivers\vms3cap.sys,SERVICE_KERNEL_DRIVER,,true,true,The file is signed and the signature was verified.,Microsoft Windows,Microsoft Windows Verification PCA
SE441YJP,uagp35,Microsoft AGPv3.5 Filter,,C:\Windows\System32\drivers\UAGP35.SYS,f2f023670f1d56cfe83c4e33e829b109,\SystemRoot\system32\drivers\uagp35.sys,SERVICE_KERNEL_DRIVER,,true,true,The file is signed and the signature was verified.,Microsoft Windows,Microsoft Windows Verification PCA
SE441YJP,rdpbus,Remote Desktop Device Redirector Bus Driver,,C:\Windows\System32\drivers\rdpbus.sys,85552793ff50859c68bf514a664b81de,\SystemRoot\system32\drivers\rdpbus.sys,SERVICE_KERNEL_DRIVER,,true,true,The file is signed and the signature was verified.,Microsoft Windows,Microsoft Windows Verification PCA
SE441YJP,McAfee WebAdvisor,McAfee WebAdvisor,McAfee WebAdvisor Service,C:\Program Files\McAfee\WebAdvisor\ServiceHost.exe,24bfd0bd08738bc01596a1eac43a1cc2,C:\Program Files\McAfee\WebAdvisor\ServiceHost.exe,SERVICE_WIN32_OWN_PROCESS,,true,true,The file is signed and the signature was verified.,"McAfee""",VeriSign Class 3 Code Signing 2010 CA
SE441YJP,Wdf01000,Kernel Mode Driver Frameworks service,,C:\Windows\System32\drivers\Wdf01000.sys,08fe665ddc55bfaf513a243fe7d7c3a1,\SystemRoot\system32\drivers\Wdf01000.sys,SERVICE_KERNEL_DRIVER,,true,true,The file is signed and the signature was verified.,Microsoft Windows,Microsoft Windows Verification PCA
SE441YJP,cfwids,McAfee Inc. cfwids,,C:\Windows\System32\drivers\cfwids.sys,d6691fd036493cda0aa602efc577113f,system32\drivers\cfwids.sys,SERVICE_KERNEL_DRIVER,,true,true,The file is signed and the signature was verified.,Microsoft Windows Hardware Compatibility Publisher,Microsoft Windows Hardware Compatibility PCA
SE441YJP,VMware NAT Service,VMware NAT Service,Network address translation for vir,C:\Windows\SysWOW64\vmnat.exe,4496d0e6722b1993a99ff8a0147445e0,C:\WINDOWS\SysWOW64\vmnat.exe,SERVICE_WIN32_OWN_PROCESS,,true,true,The file is signed and the signature was verified.,"VMware""",VeriSign Class 3 Code Signing 2010 CA
SE441YJP,WudfPf,User Mode Driver Frameworks Platform Driver,,C:\Windows\System32\drivers\WUDFPf.sys,6189e4e1eb44576cd6c760122dbd6c9d,system32\drivers\WudfPf.sys,SERVICE_KERNEL_DRIVER,,true,true,The file is signed and the signature was verified.,Microsoft Windows,Microsoft Windows Verification PCA
SE441YJP,sffp_mmc,SFF Storage Protocol Driver for MMC,,C:\Windows\System32\drivers\sffp_mmc.sys,01af7c0449bb0bf6fd56fdf7d689a080,\SystemRoot\system32\drivers\sffp_mmc.sys,SERVICE_KERNEL_DRIVER,,true,true,The file is signed and the signature was verified.,Microsoft Windows,Microsoft Windows Verification PCA
SE441YJP,lltdio,Link-Layer Topology Discovery Mapper I/O Driver,,C:\Windows\System32\drivers\lltdio.sys,ea3638ff90f6a94e31e4a090154c0d9d,system32\DRIVERS\lltdio.sys,SERVICE_KERNEL_DRIVER,,true,true,The file is signed and the signature was verified.,Microsoft Windows,Microsoft Windows Verification PCA
SE441YJP,TermDD,Terminal Device Driver,,C:\Windows\System32\drivers\termdd.sys,3760a6b2251ba0eabb5590513cbb13d4,\SystemRoot\system32\drivers\termdd.sys,SERVICE_KERNEL_DRIVER,,true,true,The file is signed and the signature was verified.,Microsoft Windows,Microsoft Windows Verification PCA
SE441YJP,Netlogon,Netlogon,Maintains a secure channel between this computer and the domain controller for authenticating users and services. If this service is stopped  the computer may not authenticate users and services and the domain controller cannot register DNS records. If this service is disabled  any services that explicitly depend on it will fail to start.,C:\Windows\System32\lsass.exe,cb3f2729430d14eb2936a8d6a9e2d792,C:\Windows\system32\lsass.exe,SERVICE_WIN32_SHARE_PROCESS,,true,true,The file is signed and the signature was verified.,Microsoft Windows,Microsoft Windows Verification PCA
SE441YJP,mfewfpk,McAfee Inc. mfewfpk,,C:\Windows\System32\drivers\mfewfpk.sys,756100d278c09e09449aeb5f5ecb06e8,\SystemRoot\system32\drivers\mfewfpk.sys,SERVICE_KERNEL_DRIVER,,true,true,The file is signed and the signature was verified.,Microsoft Windows Hardware Compatibility Publisher,Microsoft Windows Hardware Compatibility PCA
SE441YJP,hidserv,Human Interface Device Access,Enables generic input access to Human Interface Devices (HID)  which activates and maintains the use of predefined hot buttons on keyboards  remote controls  and other multimedia devices. If this service is stopped  hot buttons controlled by this service will no longer function. If this service is disabled  any services that explicitly depend on it will fail to start.,C:\Windows\System32\svchost.exe,e86152d627c3ef720ba7910edc62b478,C:\Windows\system32\svchost.exe -k LocalSystemNetworkRestricted,SERVICE_WIN32_SHARE_PROCESS,C:\Windows\System32\hidserv.dll,true,true,The file is signed and the signature was verified.,Microsoft Windows,Microsoft Windows Verification PCA
SE441YJP,Browser,Computer Browser,Maintains an updated list of computers on the network and supplies this list to computers designated as browsers. If this service is stopped  this list will not be updated or maintained. If this service is disabled  any services that explicitly depend on it will fail to start.,C:\Windows\System32\svchost.exe,e86152d627c3ef720ba7910edc62b478,C:\Windows\System32\svchost.exe -k netsvcs,SERVICE_WIN32_SHARE_PROCESS,C:\Windows\System32\browser.dll,true,true,The file is signed and the signature was verified.,Microsoft Windows,Microsoft Windows Verification PCA
SE441YJP,TCPIP6,Microsoft IPv6 Protocol Driver,Microsoft IPv6 Protocol Driver,C:\Windows\System32\drivers\tcpip.sys,60a6a0cf923df78879a9e588e3459e7a,system32\DRIVERS\tcpip.sys,SERVICE_KERNEL_DRIVER,,true,true,The file is signed and the signature was verified.,Microsoft Windows,Microsoft Windows Verification PCA
SE441YJP,NetTcpPortSharing,Net.Tcp Port Sharing Service,Provides ability to share TCP ports over the net.tcp protocol.,C:\Windows\Microsoft.NET\Framework64\v4.0.30319\SMSvcHost.exe,bb12c21a39ebaff79237fa7222d6ef0b,C:\Windows\Microsoft.NET\Framework64\v4.0.30319\SMSvcHost.exe,SERVICE_WIN32_SHARE_PROCESS,,true,true,The file is signed and the signature was verified.,Microsoft Corporation,Microsoft Code Signing PCA
SE441YJP,ioatdma,Intel(R) QuickData Technology Device,,C:\Windows\System32\drivers\qd260x64.sys,e6e07c39a1e8d177178d584307cae81b,\SystemRoot\System32\Drivers\qd260x64.sys,SERVICE_KERNEL_DRIVER,,true,true,The file is signed and the signature was verified.,Microsoft Windows,Microsoft Windows Verification PCA
SE441YJP,VMnetAdapter,VMware Virtual Ethernet Adapter Driver,Driver for VMware's Virtual Ethernet Adapters Ver. 2,C:\Windows\System32\drivers\vmnetadapter.sys,d1e92f26eccb0ccc339e06faf6dd6a9b,\SystemRoot\system32\DRIVERS\vmnetadapter.sys,SERVICE_KERNEL_DRIVER,,true,true,The file is signed and the signature was verified.,Microsoft Windows Hardware Compatibility Publisher,Microsoft Windows Hardware Compatibility PCA
SE441YJP,HpSAMD,HpSAMD,,C:\Windows\System32\drivers\HpSAMD.sys,b9813981aa94184180a36dbe7f1ae2fb,\SystemRoot\system32\drivers\HpSAMD.sys,SERVICE_KERNEL_DRIVER,,true,true,The file is signed and the signature was verified.,Microsoft Windows,Microsoft Windows Verification PCA
SE441YJP,Schedule,Task Scheduler,Enables a user to configure and schedule automated tasks on this computer. The service also hosts multiple Windows system-critical tasks. If this service is stopped or disabled  these tasks will not be run at their scheduled times. If this service is disabled  any services that explicitly depend on it will fail to start.,C:\Windows\System32\svchost.exe,e86152d627c3ef720ba7910edc62b478,C:\Windows\system32\svchost.exe -k netsvcs,SERVICE_WIN32_SHARE_PROCESS,C:\Windows\System32\schedsvc.dll,true,true,The file is signed and the signature was verified.,Microsoft Windows,Microsoft Windows Verification PCA
