hostname,name,descriptivename,description,path,md5,arguments,type,servicedll,pathsignatureexists,pathsignatureverified,pathsignaturedescription,pathcertificatesubject,pathcertificateissuer
SE441YJP,blbdrive,blbdrive,,C:\Windows\System32\drivers\blbdrive.sys,7911d207bad80f27273700d99bbff14d,\SystemRoot\system32\drivers\blbdrive.sys,SERVICE_KERNEL_DRIVER,,true,true,The file is signed and the signature was verified.,Microsoft Windows,Microsoft Windows Verification PCA
SE441YJP,w32time,Windows Time,Maintains date and time synchronization on all clients and servers in the network. If this service is stopped  date and time synchronization will be unavailable. If this service is disabled  any services that explicitly depend on it will fail to start.,C:\Windows\System32\svchost.exe,e86152d627c3ef720ba7910edc62b478,C:\Windows\system32\svchost.exe -k LocalService,SERVICE_WIN32_SHARE_PROCESS,C:\Windows\System32\w32time.dll,true,true,The file is signed and the signature was verified.,Microsoft Windows,Microsoft Windows Verification PCA
SE441YJP,PptpMiniport,WAN Miniport (PPTP),WAN Miniport (PPTP),C:\Windows\System32\drivers\raspptp.sys,0efa8a502e7073d733d77dde5ab7fe78,system32\DRIVERS\raspptp.sys,SERVICE_KERNEL_DRIVER,,true,true,The file is signed and the signature was verified.,Microsoft Windows,Microsoft Windows Verification PCA
SE441YJP,AeLookupSvc,Application Experience,Processes application compatibility cache requests for applications as they are launched,C:\Windows\System32\svchost.exe,e86152d627c3ef720ba7910edc62b478,C:\Windows\system32\svchost.exe -k netsvcs,SERVICE_WIN32_SHARE_PROCESS,C:\Windows\System32\aelupsvc.dll,true,true,The file is signed and the signature was verified.,Microsoft Windows,Microsoft Windows Verification PCA
SE441YJP,b06bdrv,Broadcom NetXtreme II VBD,,C:\Windows\System32\drivers\bxvbda.sys,9956da7fe89df05596f4560c1f5b55c6,\SystemRoot\system32\drivers\bxvbda.sys,SERVICE_KERNEL_DRIVER,,true,true,The file is signed and the signature was verified.,Microsoft Windows,Microsoft Windows Verification PCA
SE441YJP,AmdK8,AMD K8 Processor Driver,,C:\Windows\System32\drivers\amdk8.sys,af3fe3511c3fda8a770e71d6b93c8ebb,\SystemRoot\system32\drivers\amdk8.sys,SERVICE_KERNEL_DRIVER,,true,true,The file is signed and the signature was verified.,Microsoft Windows,Microsoft Windows Verification PCA
SE441YJP,mfemms,McAfee Service Controller,Manages McAfee Services,C:\Program Files\Common Files\McAfee\SystemCore\mfemms.exe,572491e5aeb1cdd04f594e22e0252011,C:\Program Files\Common Files\McAfee\SystemCore\mfemms.exe,SERVICE_WIN32_OWN_PROCESS,,true,true,The file is signed and the signature was verified.,"""McAfee",VeriSign Class 3 Code Signing 2010 CA
SE441YJP,FontCache,Windows Font Cache Service,Optimizes performance of applications by caching commonly used font data. Applications will start this service if it is not already running. It can be disabled  though doing so will degrade application performance.,C:\Windows\System32\svchost.exe,e86152d627c3ef720ba7910edc62b478,C:\Windows\system32\svchost.exe -k LocalService,SERVICE_WIN32_SHARE_PROCESS,C:\Windows\System32\FntCache.dll,true,true,The file is signed and the signature was verified.,Microsoft Windows,Microsoft Windows Verification PCA
SE441YJP,arcsas,arcsas,,C:\Windows\System32\drivers\arcsas.sys,4cb07baa0b44c8cb108010a347a51f27,\SystemRoot\system32\drivers\arcsas.sys,SERVICE_KERNEL_DRIVER,,true,true,The file is signed and the signature was verified.,Microsoft Windows,Microsoft Windows Verification PCA
SE441YJP,mfeaack,McAfee Inc. mfeaack,,C:\Windows\System32\drivers\mfeaack.sys,327ba4e6c07482477806bd76f3d4d38d,system32\drivers\mfeaack.sys,SERVICE_KERNEL_DRIVER,,true,true,The file is signed and the signature was verified.,Microsoft Windows Hardware Compatibility Publisher,Microsoft Windows Hardware Compatibility PCA
SE441YJP,1394ohci,1394 OHCI Compliant Host Controller,,C:\Windows\System32\drivers\1394ohci.sys,fd9461ae4a0a52810008cda1a06ac099,\SystemRoot\system32\drivers\1394ohci.sys,SERVICE_KERNEL_DRIVER,,true,true,The file is signed and the signature was verified.,Microsoft Windows,Microsoft Windows Verification PCA
SE441YJP,PolicyAgent,IPsec Policy Agent,"""Internet Protocol security (IPsec) supports network-level peer authentication  data origin authentication  data integrity  data confidentiality (encryption)  and replay protection.  This service enforces IPsec policies created through the IP Security Policies snap-in or the command-line tool """"netsh ipsec"""".  If you stop this service  you may experience network connectivity issues if your policy requires that connections use IPsec.  Also remote management of Windows Firewall is not available when this service is stopped.""",C:\Windows\System32\svchost.exe,e86152d627c3ef720ba7910edc62b478,C:\Windows\system32\svchost.exe -k NetworkServiceNetworkRestricted,SERVICE_WIN32_SHARE_PROCESS,C:\Windows\System32\IPSECSVC.DLL,true,true,The file is signed and the signature was verified.,Microsoft Windows,Microsoft Windows Verification PCA
SE441YJP,AppID,AppID Driver,Identifies an application and enforces software restriction policies.,C:\Windows\System32\drivers\appid.sys,06d4b9ceb7d7269e67129417819eba73,\SystemRoot\system32\drivers\appid.sys,SERVICE_KERNEL_DRIVER,,true,true,The file is signed and the signature was verified.,Microsoft Windows,Microsoft Windows Verification PCA
SE441YJP,UmRdpService,Remote Desktop Services UserMode Port Redirector,Allows the redirection of Printers/Drives/Ports for RDP connections,C:\Windows\System32\svchost.exe,e86152d627c3ef720ba7910edc62b478,C:\Windows\System32\svchost.exe -k LocalSystemNetworkRestricted,SERVICE_WIN32_SHARE_PROCESS,C:\Windows\System32\umrdp.dll,true,true,The file is signed and the signature was verified.,Microsoft Windows,Microsoft Windows Verification PCA
SE441YJP,netprofm,Network List Service,Identifies the networks to which the computer has connected  collects and stores properties for these networks  and notifies applications when these properties change.,C:\Windows\System32\svchost.exe,e86152d627c3ef720ba7910edc62b478,C:\Windows\System32\svchost.exe -k LocalService,SERVICE_WIN32_SHARE_PROCESS,C:\Windows\System32\netprofm.dll,true,true,The file is signed and the signature was verified.,Microsoft Windows,Microsoft Windows Verification PCA
SE441YJP,SiSRaid4,SiSRaid4,,C:\Windows\System32\drivers\sisraid4.sys,eb831136798fb56cbf32623ad203613e,\SystemRoot\system32\drivers\sisraid4.sys,SERVICE_KERNEL_DRIVER,,true,true,The file is signed and the signature was verified.,Microsoft Windows,Microsoft Windows Verification PCA
SE441YJP,VgaSave,VgaSave,,C:\Windows\System32\drivers\vga.sys,c8d9f586d548c979b7a7bbf56139b672,\SystemRoot\System32\drivers\vga.sys,SERVICE_KERNEL_DRIVER,,true,true,The file is signed and the signature was verified.,Microsoft Windows,Microsoft Windows Verification PCA
SE441YJP,mccspsvc,McAfee CSP Service,McAfee Cloud Platform Service,C:\Program Files\Common Files\McAfee\CSP\3.0.127.0\\McCSPServiceHost.exe,ed14d5f87c3bbd88bfae9112b681c380,"C:\Program Files\Common Files\McAfee\CSP\3.0.127.0\\McCSPServiceHost.exe""""""",SERVICE_WIN32_OWN_PROCESS,,true,true,The file is signed and the signature was verified.,"""McAfee",Symantec Class 3 SHA256 Code Signing CA
SE441YJP,usbohci,Microsoft USB Open Host Controller Miniport Driver,,C:\Windows\System32\drivers\usbohci.sys,cfaf532cf3279b1bae5862869732f2db,\SystemRoot\system32\drivers\usbohci.sys,SERVICE_KERNEL_DRIVER,,true,true,The file is signed and the signature was verified.,Microsoft Windows,Microsoft Windows Verification PCA
SE441YJP,BrUsbSer,Brother MFC USB Serial WDM Driver,,C:\Windows\System32\drivers\BrUsbSer.sys,b3c67b7eb038938823bc22fba7aa22fa,\SystemRoot\System32\Drivers\BrUsbSer.sys,SERVICE_KERNEL_DRIVER,,true,true,The file is signed and the signature was verified.,Microsoft Windows,Microsoft Windows Verification PCA
SE441YJP,kbdhid,Keyboard HID Driver,,C:\Windows\System32\drivers\kbdhid.sys,6a53ce2d0ae3befc8d78d36ea518a8b8,\SystemRoot\system32\drivers\kbdhid.sys,SERVICE_KERNEL_DRIVER,,true,true,The file is signed and the signature was verified.,Microsoft Windows,Microsoft Windows Verification PCA
SE441YJP,AsyncMac,RAS Asynchronous Media Driver,RAS Asynchronous Media Driver,C:\Windows\System32\drivers\asyncmac.sys,6a47478c713543a0d66fd8b198d0d862,system32\DRIVERS\asyncmac.sys,SERVICE_KERNEL_DRIVER,,true,true,The file is signed and the signature was verified.,Microsoft Windows,Microsoft Windows Verification PCA
SE441YJP,mfesapsn,McAfee Process Start Notification Service,,C:\Program Files\McAfee\WebAdvisor\mfesapsn.sys,3ad9e07e49faeafbd8444b3e1155b498,\??\C:\Program Files\McAfee\WebAdvisor\mfesapsn.sys,SERVICE_KERNEL_DRIVER,,true,true,The file is signed and the signature was verified.,"""McAfee",VeriSign Class 3 Code Signing 2010 CA
SE441YJP,EapHost,Extensible Authentication Protocol,The Extensible Authentication Protocol (EAP) service provides network authentication in such scenarios as 802.1x wired and wireless  VPN  and Network Access Protection (NAP).  EAP also provides application programming interfaces (APIs) that are used by network access clients  including wireless and VPN clients  during the authentication process.  If you disable this service  this computer is prevented from accessing networks that require EAP authentication.,C:\Windows\System32\svchost.exe,e86152d627c3ef720ba7910edc62b478,C:\Windows\System32\svchost.exe -k netsvcs,SERVICE_WIN32_SHARE_PROCESS,C:\Windows\System32\eapsvc.dll,true,true,The file is signed and the signature was verified.,Microsoft Windows,Microsoft Windows Verification PCA
SE441YJP,sacdrv,sacdrv,,C:\Windows\System32\drivers\sacdrv.sys,f484ee6421a8286f804e0ee202e767dc,\SystemRoot\system32\DRIVERS\sacdrv.sys,SERVICE_KERNEL_DRIVER,,true,true,The file is signed and the signature was verified.,Microsoft Windows,Microsoft Windows Verification PCA
SE441YJP,MSiSCSI,Microsoft iSCSI Initiator Service,Manages Internet SCSI (iSCSI) sessions from this computer to remote iSCSI target devices. If this service is stopped  this computer will not be able to login or access iSCSI targets. If this service is disabled  any services that explicitly depend on it will fail to start.,C:\Windows\System32\svchost.exe,e86152d627c3ef720ba7910edc62b478,C:\Windows\system32\svchost.exe -k netsvcs,SERVICE_WIN32_SHARE_PROCESS,C:\Windows\System32\iscsiexe.dll,true,true,The file is signed and the signature was verified.,Microsoft Windows,Microsoft Windows Verification PCA
SE441YJP,arc,arc,,C:\Windows\System32\drivers\arc.sys,168b35e0332a04c3fd06e477e63a5bf6,\SystemRoot\system32\drivers\arc.sys,SERVICE_KERNEL_DRIVER,,true,true,The file is signed and the signature was verified.,Microsoft Windows,Microsoft Windows Verification PCA
SE441YJP,iScsiPrt,iScsiPort Driver,,C:\Windows\System32\drivers\msiscsi.sys,1e893ddffbd087986501400f86ebc7ff,\SystemRoot\system32\drivers\msiscsi.sys,SERVICE_KERNEL_DRIVER,,true,true,The file is signed and the signature was verified.,Microsoft Windows,Microsoft Windows Verification PCA
SE441YJP,TapiSrv,Telephony,Provides Telephony API (TAPI) support for programs that control telephony devices on the local computer and  through the LAN  on servers that are also running the service.,C:\Windows\System32\svchost.exe,e86152d627c3ef720ba7910edc62b478,C:\Windows\System32\svchost.exe -k tapisrv,SERVICE_WIN32_OWN_PROCESS,C:\Windows\System32\tapisrv.dll,true,true,The file is signed and the signature was verified.,Microsoft Windows,Microsoft Windows Verification PCA
SE441YJP,AudioSrv,Windows Audio,Manages audio for Windows-based programs.  If this service is stopped  audio devices and effects will not function properly.  If this service is disabled  any services that explicitly depend on it will fail to start,C:\Windows\System32\svchost.exe,e86152d627c3ef720ba7910edc62b478,C:\Windows\System32\svchost.exe -k LocalServiceNetworkRestricted,SERVICE_WIN32_SHARE_PROCESS,C:\Windows\System32\audiosrv.dll,true,true,The file is signed and the signature was verified.,Microsoft Windows,Microsoft Windows Verification PCA
SE441YJP,vmci,VMware VMCI Bus Driver,,C:\Windows\System32\drivers\vmci.sys,8b1bd32003ee329b93d877084c5b0088,\SystemRoot\System32\drivers\vmci.sys,SERVICE_KERNEL_DRIVER,,true,true,The file is signed and the signature was verified.,Microsoft Windows Hardware Compatibility Publisher,Microsoft Windows Third Party Component CA 2012
SE441YJP,sppuinotify,SPP Notification Service,Provides Software Licensing activation and notification,C:\Windows\System32\svchost.exe,e86152d627c3ef720ba7910edc62b478,C:\Windows\system32\svchost.exe -k LocalService,SERVICE_WIN32_SHARE_PROCESS,C:\Windows\System32\sppuinotify.dll,true,true,The file is signed and the signature was verified.,Microsoft Windows,Microsoft Windows Verification PCA
SE441YJP,Power,Power,Manages power policy and power policy notification delivery.,C:\Windows\System32\svchost.exe,e86152d627c3ef720ba7910edc62b478,C:\Windows\system32\svchost.exe -k DcomLaunch,SERVICE_WIN32_SHARE_PROCESS,C:\Windows\System32\umpo.dll,true,true,The file is signed and the signature was verified.,Microsoft Windows,Microsoft Windows Verification PCA
SE441YJP,DiagTrack,Diagnostics Tracking Service,The Diagnostics Tracking Service enables data collection about functional issues in Windows components.,C:\Windows\System32\svchost.exe,e86152d627c3ef720ba7910edc62b478,C:\Windows\System32\svchost.exe -k utcsvc,SERVICE_WIN32_OWN_PROCESS,C:\Windows\System32\diagtrack.dll,true,true,The file is signed and the signature was verified.,Microsoft Windows,Microsoft Windows Verification PCA
SE441YJP,napagent,Network Access Protection Agent,The Network Access Protection (NAP) agent service collects and manages health information for client computers on a network. Information collected by NAP agent is used to make sure that the client computer has the required software and settings. If a client computer is not compliant with health policy  it can be provided with restricted network access until its configuration is updated. Depending on the configuration of health policy  client computers might be automatically updated so that users quickly regain full network access without having to manually update their computer.,C:\Windows\System32\svchost.exe,e86152d627c3ef720ba7910edc62b478,C:\Windows\System32\svchost.exe -k NetworkService,SERVICE_WIN32_SHARE_PROCESS,C:\Windows\System32\QAGENTRT.DLL,true,true,The file is signed and the signature was verified.,Microsoft Windows,Microsoft Windows Verification PCA
SE441YJP,NetBT,NetBT,This service implements NetBios over TCP/IP.,C:\Windows\System32\drivers\netbt.sys,b61706e4d8b290ffbba215d775f3bfc7,System32\DRIVERS\netbt.sys,SERVICE_KERNEL_DRIVER,,true,true,The file is signed and the signature was verified.,Microsoft Windows,Microsoft Windows Verification PCA
SE441YJP,ohci1394,1394 OHCI Compliant Host Controller (Legacy),,C:\Windows\System32\drivers\ohci1394.sys,199bc8e4edc34e715297a21fdd86b8f5,\SystemRoot\system32\drivers\ohci1394.sys,SERVICE_KERNEL_DRIVER,,true,true,The file is signed and the signature was verified.,Microsoft Windows,Microsoft Windows Verification PCA
SE441YJP,tdx,NetIO Legacy TDI Support Driver,NetIO Legacy TDI Support Driver,C:\Windows\System32\drivers\tdx.sys,8a0e80f1bbce83352a5c0b1a2630562e,system32\DRIVERS\tdx.sys,SERVICE_KERNEL_DRIVER,,true,true,The file is signed and the signature was verified.,Microsoft Windows,Microsoft Windows Verification PCA
SE441YJP,megasas,megasas,,C:\Windows\System32\drivers\megasas.sys,2b8abd6f261a6da99957322c3b4b3f2f,\SystemRoot\system32\drivers\megasas.sys,SERVICE_KERNEL_DRIVER,,true,true,The file is signed and the signature was verified.,Microsoft Windows,Microsoft Windows Verification PCA
SE441YJP,Appinfo,Application Information,Facilitates the running of interactive applications with additional administrative privileges.  If this service is stopped  users will be unable to launch applications with the additional administrative privileges they may require to perform desired user tasks.,C:\Windows\System32\svchost.exe,e86152d627c3ef720ba7910edc62b478,C:\Windows\system32\svchost.exe -k netsvcs,SERVICE_WIN32_SHARE_PROCESS,C:\Windows\System32\appinfo.dll,true,true,The file is signed and the signature was verified.,Microsoft Windows,Microsoft Windows Verification PCA
SE441YJP,RasAgileVpn,WAN Miniport (IKEv2),WAN Miniport (IKEv2),C:\Windows\System32\drivers\agilevpn.sys,e3f138a3e41a67ac3f088b4d7ca0ef78,system32\DRIVERS\AgileVpn.sys,SERVICE_KERNEL_DRIVER,,true,true,The file is signed and the signature was verified.,Microsoft Windows,Microsoft Windows Verification PCA
SE441YJP,Mup,Mup,Multiple UNC Provider Driver,C:\Windows\System32\drivers\mup.sys,50b8fa42e1fd87b2c04ccb241a9f3744,\SystemRoot\System32\Drivers\mup.sys,SERVICE_FILE_SYSTEM_DRIVER,,true,true,The file is signed and the signature was verified.,Microsoft Windows,Microsoft Windows Verification PCA
SE441YJP,0062601541359992mcinstcleanup,McAfee Application Installer Cleanup (0062601541359992),,C:\Users\$user\AppData\Local\Temp\0062601541359992mcinst.exe,7a752471bfb403e0cd8942ea0eb2fbfb,C:\Users\$user\AppData\Local\Temp\006260~1.EXE -cleanup -nolog,SERVICE_WIN32_OWN_PROCESS,,true,true,The file is signed and the signature was verified.,"McAfee""",VeriSign Class 3 Code Signing 2010 CA
SE441YJP,SSDPSRV,SSDP Discovery,Discovers networked devices and services that use the SSDP discovery protocol  such as UPnP devices. Also announces SSDP devices and services running on the local computer. If this service is stopped  SSDP-based devices will not be discovered. If this service is disabled  any services that explicitly depend on it will fail to start.,C:\Windows\System32\svchost.exe,e86152d627c3ef720ba7910edc62b478,C:\Windows\system32\svchost.exe -k LocalServiceAndNoImpersonation,SERVICE_WIN32_SHARE_PROCESS,C:\Windows\System32\ssdpsrv.dll,true,true,The file is signed and the signature was verified.,Microsoft Windows,Microsoft Windows Verification PCA
SE441YJP,SCPolicySvc,Smart Card Removal Policy,Allows the system to be configured to lock the user desktop upon smart card removal.,C:\Windows\System32\svchost.exe,e86152d627c3ef720ba7910edc62b478,C:\Windows\system32\svchost.exe -k netsvcs,SERVICE_WIN32_SHARE_PROCESS,C:\Windows\System32\certprop.dll,true,true,The file is signed and the signature was verified.,Microsoft Windows,Microsoft Windows Verification PCA
SE441YJP,usbehci,Microsoft USB 2.0 Enhanced Host Controller Miniport Driver,,C:\Windows\System32\drivers\usbehci.sys,8d38c1d98eab6b904ab76bae5182dcfb,\SystemRoot\system32\drivers\usbehci.sys,SERVICE_KERNEL_DRIVER,,true,true,The file is signed and the signature was verified.,Microsoft Windows,Microsoft Windows Verification PCA
SE441YJP,Filetrace,Filetrace,ETW File Trace Filter,C:\Windows\System32\drivers\filetrace.sys,fb235d2cd816eeab6441e27fe0b3377f,system32\drivers\filetrace.sys,SERVICE_FILE_SYSTEM_DRIVER,,true,true,The file is signed and the signature was verified.,Microsoft Windows,Microsoft Windows Verification PCA
SE441YJP,NetMsmqActivator,Net.Msmq Listener Adapter,Receives activation requests over the net.msmq and msmq.formatname protocols and passes them to the Windows Process Activation Service.,C:\Windows\Microsoft.NET\Framework64\v4.0.30319\SMSvcHost.exe,bb12c21a39ebaff79237fa7222d6ef0b,C:\Windows\Microsoft.NET\Framework64\v4.0.30319\SMSvcHost.exe -NetMsmqActivator,SERVICE_WIN32_SHARE_PROCESS,,true,true,The file is signed and the signature was verified.,Microsoft Corporation,Microsoft Code Signing PCA
SE441YJP,BITS,Background Intelligent Transfer Service,Transfers files in the background using idle network bandwidth. If the service is disabled  then any applications that depend on BITS  such as Windows Update or MSN Explorer  will be unable to automatically download programs and other information.,C:\Windows\System32\svchost.exe,e86152d627c3ef720ba7910edc62b478,C:\Windows\System32\svchost.exe -k netsvcs,SERVICE_WIN32_SHARE_PROCESS,C:\Windows\System32\qmgr.dll,true,true,The file is signed and the signature was verified.,Microsoft Windows,Microsoft Windows Verification PCA
SE441YJP,RDPDR,Terminal Server Device Redirector Driver,,C:\Windows\System32\drivers\rdpdr.sys,546cec6c4307580175ed875a31bec813,System32\drivers\rdpdr.sys,SERVICE_KERNEL_DRIVER,,true,true,The file is signed and the signature was verified.,Microsoft Windows,Microsoft Windows Verification PCA
SE441YJP,mpsdrv,Windows Firewall Authorization Driver,Windows Firewall Authorization Driver is a kernel mode driver that provides deep inspection services on inbound and outbound network traffic.,C:\Windows\System32\drivers\mpsdrv.sys,2e09008bee739deb27b82eea0432a458,System32\drivers\mpsdrv.sys,SERVICE_KERNEL_DRIVER,,true,true,The file is signed and the signature was verified.,Microsoft Windows,Microsoft Windows Verification PCA
SE441YJP,HidBatt,HID UPS Battery Driver,,C:\Windows\System32\drivers\hidbatt.sys,cef85e48af33e8031dae3b47f6021f53,\SystemRoot\system32\drivers\HidBatt.sys,SERVICE_KERNEL_DRIVER,,true,true,The file is signed and the signature was verified.,Microsoft Windows,Microsoft Windows Verification PCA
SE441YJP,TDPIPE,TDPIPE,,C:\Windows\System32\drivers\tdpipe.sys,b263f83d347ad12176f633007ceda091,system32\drivers\tdpipe.sys,SERVICE_KERNEL_DRIVER,,true,true,The file is signed and the signature was verified.,Microsoft Windows,Microsoft Windows Verification PCA
SE441YJP,MMCSS,Multimedia Class Scheduler,Enables relative prioritization of work based on system-wide task priorities. This is intended mainly for multimedia applications.  If this service is stopped  individual tasks resort to their default priority.,C:\Windows\System32\svchost.exe,e86152d627c3ef720ba7910edc62b478,C:\Windows\system32\svchost.exe -k netsvcs,SERVICE_WIN32_SHARE_PROCESS,C:\Windows\System32\mmcss.dll,true,true,The file is signed and the signature was verified.,Microsoft Windows,Microsoft Windows Verification PCA
SE441YJP,msiserver,Windows Installer,Adds  modifies  and removes applications provided as a Windows Installer (*.msi) package. If this service is disabled  any services that explicitly depend on it will fail to start.,C:\Windows\System32\msiexec.exe,953486e9b932a01a4d6c6d9156bc6c95,C:\Windows\system32\msiexec.exe /V,SERVICE_WIN32_OWN_PROCESS,,true,true,The file is signed and the signature was verified.,Microsoft Windows,Microsoft Windows Verification PCA
SE441YJP,SiSRaid2,SiSRaid2,,C:\Windows\System32\drivers\sisraid2.sys,d69d54199a624ad6bfd6b94cf040c4d4,\SystemRoot\system32\drivers\SiSRaid2.sys,SERVICE_KERNEL_DRIVER,,true,true,The file is signed and the signature was verified.,Microsoft Windows,Microsoft Windows Verification PCA
SE441YJP,mfefire,McAfee Firewall Core Service,Provides firewall services to McAfee products,C:\Program Files\Common Files\McAfee\SystemCore\mfefire.exe,f8c71d5951f6da53a95131b15fe460c3,"C:\Program Files\Common Files\McAfee\SystemCore\mfefire.exe""""""",SERVICE_WIN32_OWN_PROCESS,,true,true,The file is signed and the signature was verified.,"""McAfee",VeriSign Class 3 Code Signing 2010 CA
SE441YJP,BrFiltUp,Brother USB Mass-Storage Upper Filter Driver,,C:\Windows\System32\drivers\BrFiltUp.sys,aeecd03e4be38ab26cc1e073fcb8f2d8,\SystemRoot\system32\drivers\BrFiltUp.sys,SERVICE_KERNEL_DRIVER,,true,true,The file is signed and the signature was verified.,Microsoft Windows,Microsoft Windows Verification PCA
SE441YJP,sermouse,Serial Mouse Driver,,C:\Windows\System32\drivers\sermouse.sys,105ab1da4b8278c6396b4bf14aafbd88,\SystemRoot\system32\drivers\sermouse.sys,SERVICE_KERNEL_DRIVER,,true,true,The file is signed and the signature was verified.,Microsoft Windows,Microsoft Windows Verification PCA
SE441YJP,vioscsi,vioscsi,,C:\Windows\System32\drivers\vioscsi.sys,b90b76b23a4b8927901ce8f804143761,\SystemRoot\system32\drivers\vioscsi.sys,SERVICE_KERNEL_DRIVER,,true,true,The file is signed and the signature was verified.,Google Inc,Symantec Class 3 SHA256 Code Signing CA
SE441YJP,usbprint,Microsoft USB PRINTER Class,,C:\Windows\System32\drivers\usbprint.sys,220d11e40d1ed83e594f1c667dc42698,\SystemRoot\system32\drivers\usbprint.sys,SERVICE_KERNEL_DRIVER,,true,true,The file is signed and the signature was verified.,Microsoft Windows,Microsoft Windows Verification PCA
SE441YJP,RasPppoe,Remote Access PPPOE Driver,Remote Access PPPOE Driver,C:\Windows\System32\drivers\raspppoe.sys,737f91cff08f377646fa8c319bf0468e,system32\DRIVERS\raspppoe.sys,SERVICE_KERNEL_DRIVER,,true,true,The file is signed and the signature was verified.,Microsoft Windows,Microsoft Windows Verification PCA
SE441YJP,GoogleVssProvider,GoogleVssProvider,Google Vss Hardware Provider,C:\Windows\System32\dllhost.exe,7036f9ee72f3aa5a2f15530edf7c4969,C:\Windows\system32\dllhost.exe /Processid:{3EAE8C5E-B51F-4CBD-9DCE-FA6AA0BDF8B8},SERVICE_WIN32_OWN_PROCESS,,true,true,The file is signed and the signature was verified.,Microsoft Windows,Microsoft Windows Verification PCA
SE441YJP,Disk,Disk Driver,,C:\Windows\System32\drivers\disk.sys,14f92d51b729492dd3357377591f71d5,\SystemRoot\system32\drivers\disk.sys,SERVICE_KERNEL_DRIVER,,true,true,The file is signed and the signature was verified.,Microsoft Windows,Microsoft Windows Verification PCA
SE441YJP,BFE,Base Filtering Engine,The Base Filtering Engine (BFE) is a service that manages firewall and Internet Protocol security (IPsec) policies and implements user mode filtering. Stopping or disabling the BFE service will significantly reduce the security of the system. It will also result in unpredictable behavior in IPsec management and firewall applications.,C:\Windows\System32\svchost.exe,e86152d627c3ef720ba7910edc62b478,C:\Windows\system32\svchost.exe -k LocalServiceNoNetwork,SERVICE_WIN32_SHARE_PROCESS,C:\Windows\System32\BFE.DLL,true,true,The file is signed and the signature was verified.,Microsoft Windows,Microsoft Windows Verification PCA
