hostname,name,virtualpath,creator,comment,accountrunlevel,accountlogontype,execprogrampath,execarguments,signatureexists,signatureverified,description,certificatesubject,certificateissuer
WC0005TWT,RecordingRestart,\Microsoft\Windows\Media Center\RecordingRestart,,Restarts recordings after a power failure.,TASK_RUNLEVEL_LUA,TASK_LOGON_SERVICE_ACCOUNT,%SystemRoot%\ehome\ehrec,/RestartRecording,,,,,
WC0005TWT,SessionAgent,\Microsoft\Windows\SideShow\SessionAgent,Microsoft Corporation,This task manages the session behavior when multiple user accounts exist on a Windows SideShow-compatible device.,TASK_RUNLEVEL_LUA,TASK_LOGON_GROUP,,,,,,,
WC0005TWT,SystemDataProviders,\Microsoft\Windows\SideShow\SystemDataProviders,Microsoft Corporation,This task provides system data for the clock  power source  wireless network strength  and volume on a Windows SideShow-compatible device.,TASK_RUNLEVEL_LUA,TASK_LOGON_SERVICE_ACCOUNT,,,,,,,
WC0005TWT,GadgetManager,\Microsoft\Windows\SideShow\GadgetManager,Microsoft Corporation,This task manages and synchronizes metadata for the installed gadgets on a Windows SideShow-compatible device.,TASK_RUNLEVEL_LUA,TASK_LOGON_GROUP,,,,,,,
WC0005TWT,RegisterSearch,\Microsoft\Windows\Media Center\RegisterSearch,,Privileged Media Center Search registration job,TASK_RUNLEVEL_LUA,TASK_LOGON_SERVICE_ACCOUNT,%SystemRoot%\ehome\ehPrivJob.exe,/DoRegisterSearch $(Arg0),true,true,The file is signed and the signature was verified.,Microsoft Windows,Microsoft Windows Verification PCA
WC0005TWT,ConfigNotification,\Microsoft\Windows\WindowsBackup\ConfigNotification,Microsoft Corporation,This scheduled task notifies the user that Windows Backup has not been configured.,TASK_RUNLEVEL_LUA,TASK_LOGON_SERVICE_ACCOUNT,%systemroot%\System32\sdclt.exe,/CONFIGNOTIFICATION,true,true,The file is signed and the signature was verified.,Microsoft Windows,Microsoft Windows Verification PCA
WC0005TWT,OCURActivate,\Microsoft\Windows\Media Center\OCURActivate,,Privileged Media Center OCUR activation job,TASK_RUNLEVEL_LUA,TASK_LOGON_SERVICE_ACCOUNT,%SystemRoot%\ehome\ehPrivJob.exe,/OCURActivate,true,true,The file is signed and the signature was verified.,Microsoft Windows,Microsoft Windows Verification PCA
WC0005TWT,MsCtfMonitor,\Microsoft\Windows\TextServicesFramework\MsCtfMonitor,,TextServicesFramework monitor task,TASK_RUNLEVEL_LUA,TASK_LOGON_GROUP,,,,,,,
WC0005TWT,DispatchRecoveryTasks,\Microsoft\Windows\Media Center\DispatchRecoveryTasks,,Privileged Media Center Recovery Task Dispatcher job,TASK_RUNLEVEL_LUA,TASK_LOGON_SERVICE_ACCOUNT,%SystemRoot%\ehome\ehPrivJob.exe,/DoRecoveryTasks $(Arg0),true,true,The file is signed and the signature was verified.,Microsoft Windows,Microsoft Windows Verification PCA
WC0005TWT,HiveUploadTask,\Microsoft\Windows\User Profile Service\HiveUploadTask,Microsoft Corporation,This task will automatically upload a roaming user profile's registry hive to its network location.,TASK_RUNLEVEL_LUA,TASK_LOGON_SERVICE_ACCOUNT,,,,,,,
WC0005TWT,ObjectStoreRecoveryTask,\Microsoft\Windows\Media Center\ObjectStoreRecoveryTask,,Perform Object Store Recovery activities,TASK_RUNLEVEL_LUA,TASK_LOGON_SERVICE_ACCOUNT,%SystemRoot%\ehome\mcupdate.exe,-ObjectStoreRecoveryTask,true,true,The file is signed and the signature was verified.,Microsoft Windows,Microsoft Windows Verification PCA
WC0005TWT,ReindexSearchRoot,\Microsoft\Windows\Media Center\ReindexSearchRoot,,Privileged Media Center Search Reindexing job,TASK_RUNLEVEL_LUA,TASK_LOGON_SERVICE_ACCOUNT,%SystemRoot%\ehome\ehPrivJob.exe,/DoReindexSearchRoot,true,true,The file is signed and the signature was verified.,Microsoft Windows,Microsoft Windows Verification PCA
WC0005TWT,WindowsParentalControls,\Microsoft\Windows\Shell\WindowsParentalControls,Microsoft,Notifications for actions taken by Windows Parental Controls.,TASK_RUNLEVEL_LUA,TASK_LOGON_GROUP,,,,,,,
WC0005TWT,RemoteAssistanceTask,\Microsoft\Windows\RemoteAssistance\RemoteAssistanceTask,Microsoft,Checks group policy for changes relevant to Remote Assistance,TASK_RUNLEVEL_HIGHEST,TASK_LOGON_SERVICE_ACCOUNT,%windir%\system32\RAServer.exe,/offerraupdate,true,true,The file is signed and the signature was verified.,Microsoft Windows,Microsoft Windows Verification PCA
WC0005TWT,WinSAT,\Microsoft\Windows\Maintenance\WinSAT,Microsoft,Measures a system's performance and capabilities,TASK_RUNLEVEL_HIGHEST,TASK_LOGON_GROUP,,,,,,,
WC0005TWT,UPnPHostConfig,\Microsoft\Windows\UPnP\UPnPHostConfig,Microsoft,Set UPnPHost service to Auto-Start,TASK_RUNLEVEL_LUA,TASK_LOGON_SERVICE_ACCOUNT,sc.exe,config upnphost start= auto,,,,,
WC0005TWT,OCURDiscovery,\Microsoft\Windows\Media Center\OCURDiscovery,,Privileged Media Center OCUR discovery job,TASK_RUNLEVEL_LUA,TASK_LOGON_SERVICE_ACCOUNT,%SystemRoot%\ehome\ehPrivJob.exe,/OCURDiscovery $(Arg0),true,true,The file is signed and the signature was verified.,Microsoft Windows,Microsoft Windows Verification PCA
WC0005TWT,AD RMS Rights Policy Template Management (Automated),\Microsoft\Windows\Active Directory Rights Management Services Client\AD RMS Rights Policy Template Management (Automated),Microsoft Corporation,Updates the AD RMS rights policy templates for the user. This job does not provide a credential prompt if authentication to the template distribution web service on the server fails. In this case  it fails silently.,TASK_RUNLEVEL_LUA,TASK_LOGON_GROUP,,,,,,,
WC0005TWT,UserTask,\Microsoft\Windows\CertificateServicesClient\UserTask,Microsoft Corporation,Certificate Services Client automatically manages digital identities such as Certificates  Keys and Credentials for the users and the machine  enabling enrollment  roaming and other services.,TASK_RUNLEVEL_LUA,TASK_LOGON_GROUP,,,,,,,
WC0005TWT,AD RMS Rights Policy Template Management (Manual),\Microsoft\Windows\Active Directory Rights Management Services Client\AD RMS Rights Policy Template Management (Manual),Microsoft Corporation,Updates the AD RMS rights policy templates for the user. This job provides a credential prompt if authentication to the template distribution web service on the server fails.,TASK_RUNLEVEL_LUA,TASK_LOGON_GROUP,,,,,,,
WC0005TWT,SqlLiteRecoveryTask,\Microsoft\Windows\Media Center\SqlLiteRecoveryTask,,Perform Data Recovery activities,TASK_RUNLEVEL_LUA,TASK_LOGON_SERVICE_ACCOUNT,%SystemRoot%\ehome\mcupdate.exe,-SqlLiteRecoveryTask,true,true,The file is signed and the signature was verified.,Microsoft Windows,Microsoft Windows Verification PCA
WC0005TWT,SR,\Microsoft\Windows\SystemRestore\SR,Microsoft Corporation,This task creates regular system protection points.,TASK_RUNLEVEL_LUA,TASK_LOGON_SERVICE_ACCOUNT,%windir%\system32\rundll32.exe,/d srrstr.dll ExecuteScheduledSPPCreation,true,true,The file is signed and the signature was verified.,Microsoft Windows,Microsoft Windows Verification PCA
WC0005TWT,mcupdate,\Microsoft\Windows\Media Center\mcupdate,,Check for Media Center updates.,TASK_RUNLEVEL_LUA,TASK_LOGON_SERVICE_ACCOUNT,%SystemRoot%\ehome\mcupdate,$(Arg0),,,,,
WC0005TWT,IpAddressConflict2,\Microsoft\Windows\Tcpip\IpAddressConflict2,Microsoft Corporation,This event is triggered when an IP address conflict is detected.,TASK_RUNLEVEL_HIGHEST,TASK_LOGON_GROUP,%windir%\system32\rundll32.exe,ndfapi.dll NdfRunDllDuplicateIPDefendingSystem,true,true,The file is signed and the signature was verified.,Microsoft Windows,Microsoft Windows Verification PCA
WC0005TWT,IpAddressConflict1,\Microsoft\Windows\Tcpip\IpAddressConflict1,Microsoft Corporation,This event is triggered when an IP address conflict is detected.,TASK_RUNLEVEL_HIGHEST,TASK_LOGON_GROUP,%windir%\system32\rundll32.exe,ndfapi.dll NdfRunDllDuplicateIPOffendingSystem,true,true,The file is signed and the signature was verified.,Microsoft Windows,Microsoft Windows Verification PCA
WC0005TWT,PBDADiscoveryW2,\Microsoft\Windows\Media Center\PBDADiscoveryW2,,Privileged Media Center OCUR discovery job,TASK_RUNLEVEL_LUA,TASK_LOGON_SERVICE_ACCOUNT,%SystemRoot%\ehome\ehPrivJob.exe,/wait:90 /PBDADiscovery,true,true,The file is signed and the signature was verified.,Microsoft Windows,Microsoft Windows Verification PCA
WC0005TWT,Notifications,\Microsoft\Windows\Location\Notifications,,Location Activity,TASK_RUNLEVEL_LUA,TASK_LOGON_GROUP,%windir%\System32\LocationNotifications.exe,,true,true,The file is signed and the signature was verified.,Microsoft Windows,Microsoft Windows Verification PCA
WC0005TWT,LPRemove,\Microsoft\Windows\MUI\LPRemove,Microsoft Corporation,Launch language cleanup tool,TASK_RUNLEVEL_HIGHEST,TASK_LOGON_SERVICE_ACCOUNT,%windir%\system32\lpremove.exe,,true,true,The file is signed and the signature was verified.,Microsoft Windows,Microsoft Windows Verification PCA
WC0005TWT,Consolidator,\Microsoft\Windows\Customer Experience Improvement Program\Consolidator,Microsoft Corporation,If the user has consented to participate in the Windows Customer Experience Improvement Program  this job collects and sends usage data to Microsoft.,TASK_RUNLEVEL_LUA,TASK_LOGON_SERVICE_ACCOUNT,%SystemRoot%\System32\wsqmcons.exe,,true,true,The file is signed and the signature was verified.,Microsoft Windows,Microsoft Windows Verification PCA
WC0005TWT,WindowsParentalControlsMigration,\Microsoft\Windows\Shell\WindowsParentalControlsMigration,Microsoft,Migration for Windows Parental Controls.,TASK_RUNLEVEL_HIGHEST,TASK_LOGON_SERVICE_ACCOUNT,,,,,,,
WC0005TWT,PBDADiscovery,\Microsoft\Windows\Media Center\PBDADiscovery,,Privileged Media Center OCUR discovery job,TASK_RUNLEVEL_LUA,TASK_LOGON_SERVICE_ACCOUNT,%SystemRoot%\ehome\ehPrivJob.exe,/PBDADiscovery,true,true,The file is signed and the signature was verified.,Microsoft Windows,Microsoft Windows Verification PCA
WC0005TWT,Microsoft-Windows-DiskDiagnosticResolver,\Microsoft\Windows\DiskDiagnostic\Microsoft-Windows-DiskDiagnosticResolver,Microsoft Corporation,The Microsoft-Windows-DiskDiagnosticResolver warns users about faults reported by hard disks that support the Self Monitoring and Reporting Technology (S.M.A.R.T.) standard. This task is triggered automatically by the Diagnostic Policy Service when a S.M.A.R.T. fault is detected.,TASK_RUNLEVEL_HIGHEST,TASK_LOGON_GROUP,%windir%\system32\DFDWiz.exe,,true,true,The file is signed and the signature was verified.,Microsoft Windows,Microsoft Windows Verification PCA
WC0005TWT,AnalyzeSystem,\Microsoft\Windows\Power Efficiency Diagnostics\AnalyzeSystem,Microsoft Corporation,This job analyzes the system looking for conditions that may cause high energy use.,TASK_RUNLEVEL_LUA,TASK_LOGON_SERVICE_ACCOUNT,%SystemRoot%\System32\powercfg.exe,-energy -auto,true,true,The file is signed and the signature was verified.,Microsoft Windows,Microsoft Windows Verification PCA
WC0005TWT,SystemTask,\Microsoft\Windows\CertificateServicesClient\SystemTask,Microsoft Corporation,Certificate Services Client automatically manages digital identities such as Certificates  Keys and Credentials for the users and the machine  enabling enrollment  roaming and other services.,TASK_RUNLEVEL_LUA,TASK_LOGON_SERVICE_ACCOUNT,,,,,,,
WC0005TWT,PvrScheduleTask,\Microsoft\Windows\Media Center\PvrScheduleTask,,Perform PVR Scheduling activities,TASK_RUNLEVEL_LUA,TASK_LOGON_SERVICE_ACCOUNT,%SystemRoot%\ehome\mcupdate.exe,-PvrSchedule,true,true,The file is signed and the signature was verified.,Microsoft Windows,Microsoft Windows Verification PCA
WC0005TWT,VerifiedPublisherCertStoreCheck,\Microsoft\Windows\AppID\VerifiedPublisherCertStoreCheck,Microsoft Corporation,Inspects the AppID certificate cache for invalid or revoked certificates.,TASK_RUNLEVEL_LUA,TASK_LOGON_SERVICE_ACCOUNT,%windir%\system32\appidcertstorecheck.exe,,true,true,The file is signed and the signature was verified.,Microsoft Windows,Microsoft Windows Verification PCA
WC0005TWT,UsbCeip,\Microsoft\Windows\Customer Experience Improvement Program\UsbCeip,Microsoft Corporation,The USB CEIP (Customer Experience Improvement Program) task collects Universal Serial Bus related statistics and information about your machine and sends it to the Windows Device Connectivity engineering group at Microsoft.  The information received is used to help improve the reliability  stability  and overall functionality of USB in Windows.  If the user has not consented to participate in Windows CEIP  this task does not do anything.,TASK_RUNLEVEL_LUA,TASK_LOGON_SERVICE_ACCOUNT,,,,,,,
WC0005TWT,AitAgent,\Microsoft\Windows\Application Experience\AitAgent,Microsoft Corporation,Aggregates and uploads Application Telemetry information if opted-in to the Microsoft Customer Experience Improvement Program.,TASK_RUNLEVEL_LUA,TASK_LOGON_SERVICE_ACCOUNT,aitagent,,,,,,
WC0005TWT,UpdateRecordPath,\Microsoft\Windows\Media Center\UpdateRecordPath,,Privileged Media Center Recorder Permission setting job,TASK_RUNLEVEL_LUA,TASK_LOGON_SERVICE_ACCOUNT,%SystemRoot%\ehome\ehPrivJob.exe,/DoUpdateRecordPath $(Arg0),true,true,The file is signed and the signature was verified.,Microsoft Windows,Microsoft Windows Verification PCA
WC0005TWT,UninstallDeviceTask,\Microsoft\Windows\Bluetooth\UninstallDeviceTask,Microsoft,Uninstalls the PnP device associated with the specified Bluetooth service ID,TASK_RUNLEVEL_LUA,TASK_LOGON_SERVICE_ACCOUNT,BthUdTask.exe,$(Arg0),,,,,
WC0005TWT,PolicyConverter,\Microsoft\Windows\AppID\PolicyConverter,Microsoft Corporation,Converts the software restriction policies policy from XML into binary format.,TASK_RUNLEVEL_LUA,TASK_LOGON_SERVICE_ACCOUNT,%windir%\system32\appidpolicyconverter.exe,,true,true,The file is signed and the signature was verified.,Microsoft Windows,Microsoft Windows Verification PCA
WC0005TWT,G2MUpdateTask-S-1-5-21-2770109286-2944640460-1776573406-1001,\G2MUpdateTask-S-1-5-21-2770109286-2944640460-1776573406-1001,$domain\$user,Keeps GoToMeeting up to date. This task is removed when GoToMeeting is uninstalled.,TASK_RUNLEVEL_LUA,TASK_LOGON_INTERACTIVE_TOKEN,C:\Users\$user\AppData\Local\GoToMeeting\9508\g2mupdate.exe,,true,true,The file is signed and the signature was verified.,"""LogMeIn",Symantec Class 3 SHA256 Code Signing CA
WC0005TWT,Logon Synchronization,\Microsoft\Windows\Offline Files\Logon Synchronization,Microsoft Corporation,This task initiates synchronization of Offline Files when a user logs onto the system.,TASK_RUNLEVEL_LUA,TASK_LOGON_GROUP,,,,,,,
WC0005TWT,SystemSoundsService,\Microsoft\Windows\Multimedia\SystemSoundsService,,System Sounds User Mode Agent,TASK_RUNLEVEL_LUA,TASK_LOGON_GROUP,,,,,,,
WC0005TWT,CorruptionDetector,\Microsoft\Windows\MemoryDiagnostic\CorruptionDetector,Microsoft Corporation,Task for launching the Memory Diagnostic,TASK_RUNLEVEL_LUA,TASK_LOGON_GROUP,,,,,,,
WC0005TWT,RegIdleBackup,\Microsoft\Windows\Registry\RegIdleBackup,Microsoft Corporation,Registry Idle Backup Task,TASK_RUNLEVEL_LUA,TASK_LOGON_SERVICE_ACCOUNT,,,,,,,
WC0005TWT,MediaCenterRecoveryTask,\Microsoft\Windows\Media Center\MediaCenterRecoveryTask,,Perform Media Center Recovery activities,TASK_RUNLEVEL_LUA,TASK_LOGON_SERVICE_ACCOUNT,%SystemRoot%\ehome\mcupdate.exe,-MediaCenterRecoveryTask,true,true,The file is signed and the signature was verified.,Microsoft Windows,Microsoft Windows Verification PCA
WC0005TWT,ResolutionHost,\Microsoft\Windows\WDI\ResolutionHost,Microsoft Corporation,The Windows Diagnostic Infrastructure Resolution host enables interactive resolutions for system problems detected by the Diagnostic Policy Service. It is triggered when necessary by the Diagnostic Policy Service in the appropriate user session. If the Diagnostic Policy Service is not running  the task will not run,TASK_RUNLEVEL_HIGHEST,TASK_LOGON_GROUP,,,,,,,
WC0005TWT,HotStart,\Microsoft\Windows\MobilePC\HotStart,Microsoft Corporation,Launches applications configured for Windows HotStart,TASK_RUNLEVEL_LUA,TASK_LOGON_GROUP,,,,,,,
WC0005TWT,ehDRMInit,\Microsoft\Windows\Media Center\ehDRMInit,,Privileged Media Center DRM initialization job,TASK_RUNLEVEL_LUA,TASK_LOGON_SERVICE_ACCOUNT,%SystemRoot%\ehome\ehPrivJob.exe,/DRMInit,true,true,The file is signed and the signature was verified.,Microsoft Windows,Microsoft Windows Verification PCA
WC0005TWT,ConfigureInternetTimeService,\Microsoft\Windows\Media Center\ConfigureInternetTimeService,,Privileged Media Center Time Update Service setting job,TASK_RUNLEVEL_LUA,TASK_LOGON_SERVICE_ACCOUNT,%SystemRoot%\ehome\ehPrivJob.exe,/DoConfigureInternetTimeService,true,true,The file is signed and the signature was verified.,Microsoft Windows,Microsoft Windows Verification PCA
WC0005TWT,Scheduled,\Microsoft\Windows\Diagnosis\Scheduled,Microsoft Corporation,The Windows Scheduled Maintenance Task performs periodic maintenance of the computer system by fixing problems automatically or reporting them through the Action Center.,TASK_RUNLEVEL_HIGHEST,TASK_LOGON_GROUP,,,,,,,
WC0005TWT,MobilityManager,\Microsoft\Windows\Ras\MobilityManager,Microsoft Corporation,Provides support for the switching of mobility enabled VPN connections if their underlying interface goes down.,TASK_RUNLEVEL_LUA,TASK_LOGON_SERVICE_ACCOUNT,,,,,,,
WC0005TWT,QueueReporting,\Microsoft\Windows\Windows Error Reporting\QueueReporting,Microsoft Corporation,Windows Error Reporting task to process queued reports.,TASK_RUNLEVEL_LUA,TASK_LOGON_GROUP,%windir%\system32\wermgr.exe,-queuereporting,true,true,The file is signed and the signature was verified.,Microsoft Windows,Microsoft Windows Verification PCA
WC0005TWT,UserTask-Roam,\Microsoft\Windows\CertificateServicesClient\UserTask-Roam,Microsoft Corporation,Certificate Services Client automatically manages digital identities such as Certificates  Keys and Credentials for the users and the machine  enabling enrollment  roaming and other services.,TASK_RUNLEVEL_LUA,TASK_LOGON_GROUP,,,,,,,
WC0005TWT,Proxy,\Microsoft\Windows\Autochk\Proxy,Microsoft Corporation,This task collects and uploads autochk SQM data if opted-in to the Microsoft Customer Experience Improvement Program.,TASK_RUNLEVEL_LUA,TASK_LOGON_SERVICE_ACCOUNT,%windir%\system32\rundll32.exe,/d acproxy.dll PerformAutochkOperations,true,true,The file is signed and the signature was verified.,Microsoft Windows,Microsoft Windows Verification PCA
WC0005TWT,PvrRecoveryTask,\Microsoft\Windows\Media Center\PvrRecoveryTask,,Perform Pvr Recovery activities,TASK_RUNLEVEL_LUA,TASK_LOGON_SERVICE_ACCOUNT,%SystemRoot%\ehome\mcupdate.exe,-PvrRecoveryTask,true,true,The file is signed and the signature was verified.,Microsoft Windows,Microsoft Windows Verification PCA
WC0005TWT,GatherNetworkInfo,\Microsoft\Windows\NetTrace\GatherNetworkInfo,Microsoft,Network information collector,TASK_RUNLEVEL_HIGHEST,TASK_LOGON_GROUP,%windir%\system32\gatherNetworkInfo.vbs,,true,true,The file is signed and the signature was verified.,Microsoft Windows,Microsoft Windows Verification PCA
WC0005TWT,BfeOnServiceStartTypeChange,\Microsoft\Windows\Windows Filtering Platform\BfeOnServiceStartTypeChange,Microsoft Corporation,This task adjusts the start type for firewall-triggered services when the start type of the Base Filtering Engine (BFE) is disabled.,TASK_RUNLEVEL_LUA,TASK_LOGON_SERVICE_ACCOUNT,%windir%\system32\rundll32.exe,bfe.dll BfeOnServiceStartTypeChange,true,true,The file is signed and the signature was verified.,Microsoft Windows,Microsoft Windows Verification PCA
WC0005TWT,PBDADiscoveryW1,\Microsoft\Windows\Media Center\PBDADiscoveryW1,,Privileged Media Center OCUR discovery job,TASK_RUNLEVEL_LUA,TASK_LOGON_SERVICE_ACCOUNT,%SystemRoot%\ehome\ehPrivJob.exe,/wait:7 /PBDADiscovery,true,true,The file is signed and the signature was verified.,Microsoft Windows,Microsoft Windows Verification PCA
WC0005TWT,AutoWake,\Microsoft\Windows\SideShow\AutoWake,Microsoft Corporation,This task automatically wakes the computer and then puts it to sleep when automatic wake is turned on for a Windows SideShow-compatible device.,TASK_RUNLEVEL_LUA,TASK_LOGON_SERVICE_ACCOUNT,,,,,,,
WC0005TWT,InstallPlayReady,\Microsoft\Windows\Media Center\InstallPlayReady,,Privileged Media Center PlayReady install job,TASK_RUNLEVEL_LUA,TASK_LOGON_SERVICE_ACCOUNT,%SystemRoot%\ehome\ehPrivJob.exe,/InstallPlayReady $(Arg0),true,true,The file is signed and the signature was verified.,Microsoft Windows,Microsoft Windows Verification PCA
WC0005TWT,Calibration Loader,\Microsoft\Windows\WindowsColorSystem\Calibration Loader,Microsoft Corporation,This task applies color calibration settings.,TASK_RUNLEVEL_LUA,TASK_LOGON_GROUP,,,,,,,
WC0005TWT,RacTask,\Microsoft\Windows\RAC\RacTask,Microsoft Corporation,Microsoft Reliability Analysis task to process system reliability data.,TASK_RUNLEVEL_LUA,TASK_LOGON_SERVICE_ACCOUNT,,,,,,,
WC0005TWT,Interactive,\Microsoft\Windows\Task Manager\Interactive,Microsoft Corporation,Runs a task as the interactive user.,TASK_RUNLEVEL_LUA,TASK_LOGON_GROUP,,,,,,,
WC0005TWT,SvcRestartTask,\Microsoft\Windows\SoftwareProtectionPlatform\SvcRestartTask,Microsoft Corporation,This task restarts the Software Protection Platform service at the specified time,TASK_RUNLEVEL_LUA,TASK_LOGON_SERVICE_ACCOUNT,sc.exe,start sppsvc,,,,,
WC0005TWT,BackgroundConfigSurveyor,\Microsoft\Windows\PerfTrack\BackgroundConfigSurveyor,Microsoft Corporation,Performance Tracing Idle Task: Background configuration surveyor,TASK_RUNLEVEL_LUA,TASK_LOGON_SERVICE_ACCOUNT,,,,,,,
WC0005TWT,DecompressionFailureDetector,\Microsoft\Windows\MemoryDiagnostic\DecompressionFailureDetector,Microsoft Corporation,Task for launching the Memory Diagnostic,TASK_RUNLEVEL_LUA,TASK_LOGON_GROUP,,,,,,,
WC0005TWT,SynchronizeTime,\Microsoft\Windows\Time Synchronization\SynchronizeTime,Microsoft Corporation,Maintains date and time synchronization on all clients and servers in the network. If this service is stopped  date and time synchronization will be unavailable. If this service is disabled  any services that explicitly depend on it will fail to start.,TASK_RUNLEVEL_HIGHEST,TASK_LOGON_SERVICE_ACCOUNT,%windir%\system32\sc.exe,start w32time task_started,true,true,The file is signed and the signature was verified.,Microsoft Windows,Microsoft Windows Verification PCA
WC0005TWT,Background Synchronization,\Microsoft\Windows\Offline Files\Background Synchronization,Microsoft Corporation,This task controls periodic background synchronization of Offline Files when the user is working in an offline mode.,TASK_RUNLEVEL_LUA,TASK_LOGON_GROUP,,,,,,,
WC0005TWT,ProgramDataUpdater,\Microsoft\Windows\Application Experience\ProgramDataUpdater,Microsoft Corporation,Collects program telemetry information if opted-in to the Microsoft Customer Experience Improvement Program,TASK_RUNLEVEL_LUA,TASK_LOGON_SERVICE_ACCOUNT,%windir%\system32\rundll32.exe,aepdu.dll AePduRunUpdate,true,true,The file is signed and the signature was verified.,Microsoft Windows,Microsoft Windows Verification PCA
WC0005TWT,UpdateLibrary,\Microsoft\Windows\Windows Media Sharing\UpdateLibrary,Microsoft Corporation,This task updates the cached list of folders and the security permissions on any new files in a user’s shared media library.,TASK_RUNLEVEL_LUA,TASK_LOGON_GROUP,"""%ProgramFiles%\Windows Media Player\wmpnscfg.exe""",,,,,,
WC0005TWT,KernelCeipTask,\Microsoft\Windows\Customer Experience Improvement Program\KernelCeipTask,Microsoft Corporation,The Kernel CEIP (Customer Experience Improvement Program) task collects additional information about the system and sends this data to Microsoft.  If the user has not consented to participate in Windows CEIP  this task does nothing.,TASK_RUNLEVEL_LUA,TASK_LOGON_SERVICE_ACCOUNT,,,,,,,
WC0005TWT,ActivateWindowsSearch,\Microsoft\Windows\Media Center\ActivateWindowsSearch,,Privileged Media Center Search Reindexing job,TASK_RUNLEVEL_LUA,TASK_LOGON_SERVICE_ACCOUNT,%SystemRoot%\ehome\ehPrivJob.exe,/DoActivateWindowsSearch,true,true,The file is signed and the signature was verified.,Microsoft Windows,Microsoft Windows Verification PCA
WC0005TWT,ScheduledDefrag,\Microsoft\Windows\Defrag\ScheduledDefrag,Microsoft Corporation,This task defragments the computers hard disk drives.,TASK_RUNLEVEL_HIGHEST,TASK_LOGON_SERVICE_ACCOUNT,%windir%\system32\defrag.exe,-c,true,true,The file is signed and the signature was verified.,Microsoft Windows,Microsoft Windows Verification PCA
WC0005TWT,Microsoft-Windows-DiskDiagnosticDataCollector,\Microsoft\Windows\DiskDiagnostic\Microsoft-Windows-DiskDiagnosticDataCollector,Microsoft Corporation,The Windows Disk Diagnostic reports general disk and system information to Microsoft for users participating in the Customer Experience Program.,TASK_RUNLEVEL_LUA,TASK_LOGON_SERVICE_ACCOUNT,%windir%\system32\rundll32.exe,dfdts.dll DfdGetDefaultPolicyAndSMART,true,true,The file is signed and the signature was verified.,Microsoft Windows,Microsoft Windows Verification PCA
WC0005TWT,PeriodicScanRetry,\Microsoft\Windows\Media Center\PeriodicScanRetry,,Background periodic scanner - PeriodicScanRetry,TASK_RUNLEVEL_LUA,TASK_LOGON_SERVICE_ACCOUNT,%windir%\ehome\MCUpdate.exe,-pscn 0,true,true,The file is signed and the signature was verified.,Microsoft Windows,Microsoft Windows Verification PCA
