hostname,name,descriptivename,description,path,md5,arguments,type,servicedll,pathsignatureexists,pathsignatureverified,pathsignaturedescription,pathcertificatesubject,pathcertificateissuer
SE165YTQ,IKEEXT,IKE and AuthIP IPsec Keying Modules,The IKEEXT service hosts the Internet Key Exchange (IKE) and Authenticated Internet Protocol (AuthIP) keying modules. These keying modules are used for authentication and key exchange in Internet Protocol security (IPsec). Stopping or disabling the IKEEXT service will disable IKE and AuthIP key exchange with peer computers. IPsec is typically configured to use IKE or AuthIP; therefore  stopping or disabling the IKEEXT service might result in an IPsec failure and might compromise the security of the system. It is strongly recommended that you have the IKEEXT service running.,C:\Windows\System32\svchost.exe,f8bab354ff3af5b146e817943d4799c8,C:\Windows\system32\svchost.exe -k netsvcs,SERVICE_WIN32_SHARE_PROCESS,C:\Windows\System32\IKEEXT.DLL,true,true,The file is signed and the signature was verified.,Microsoft Windows,Microsoft Windows Verification PCA
SE165YTQ,QWAVEdrv,QWAVE driver,Quality Windows Audio/Video Experience component driver,C:\Windows\System32\drivers\qwavedrv.sys,5bccb0ea019f7d6e0c81665dd30e7a08,\SystemRoot\system32\drivers\qwavedrv.sys,SERVICE_KERNEL_DRIVER,,true,true,The file is signed and the signature was verified.,Microsoft Windows,Microsoft Windows Verification PCA
SE165YTQ,mfewfpk,McAfee Inc. mfewfpk,,C:\Windows\System32\drivers\mfewfpk.sys,e990e9421cc4db1a8dfe37bd3d147ef4,\SystemRoot\system32\drivers\mfewfpk.sys,SERVICE_KERNEL_DRIVER,,true,true,The file is signed and the signature was verified.,Microsoft Windows Hardware Compatibility Publisher,Microsoft Windows Hardware Compatibility PCA
SE165YTQ,Synth3dVsc,Synth3dVsc,,C:\Windows\System32\drivers\synth3dvsc.sys,a28dad0106358158338175b7c360b6e0,System32\drivers\synth3dvsc.sys,SERVICE_KERNEL_DRIVER,,true,true,The file is signed and the signature was verified.,Microsoft Windows,Microsoft Windows Verification PCA
SE165YTQ,W32Time,Windows Time,Maintains date and time synchronization on all clients and servers in the network. If this service is stopped  date and time synchronization will be unavailable. If this service is disabled  any services that explicitly depend on it will fail to start.,C:\Windows\System32\svchost.exe,f8bab354ff3af5b146e817943d4799c8,C:\Windows\system32\svchost.exe -k LocalService,SERVICE_WIN32_SHARE_PROCESS,C:\Windows\System32\w32time.dll,true,true,The file is signed and the signature was verified.,Microsoft Windows,Microsoft Windows Verification PCA
SE165YTQ,CryptSvc,Cryptographic Services,Provides four management services: Catalog Database Service  which confirms the signatures of Windows files and allows new programs to be installed; Protected Root Service  which adds and removes Trusted Root Certification Authority certificates from this computer; Automatic Root Certificate Update Service  which retrieves root certificates from Windows Update and enable scenarios such as SSL; and Key Service  which helps enroll this computer for certificates. If this service is stopped  these management services will not function properly. If this service is disabled  any services that explicitly depend on it will fail to start.,C:\Windows\System32\svchost.exe,f8bab354ff3af5b146e817943d4799c8,C:\Windows\system32\svchost.exe -k NetworkService,SERVICE_WIN32_SHARE_PROCESS,C:\Windows\System32\cryptsvc.dll,true,true,The file is signed and the signature was verified.,Microsoft Windows,Microsoft Windows Verification PCA
SE165YTQ,sffp_mmc,SFF Storage Protocol Driver for MMC,,C:\Windows\System32\drivers\sffp_mmc.sys,0b9ffec8862fd6130208f5d31fbe8bad,\SystemRoot\system32\drivers\sffp_mmc.sys,SERVICE_KERNEL_DRIVER,,true,true,The file is signed and the signature was verified.,Microsoft Windows,Microsoft Windows Verification PCA
SE165YTQ,p2pimsvc,Peer Networking Identity Manager,Provides identity services for the Peer Name Resolution Protocol (PNRP) and Peer-to-Peer Grouping services.  If disabled  the Peer Name Resolution Protocol (PNRP) and Peer-to-Peer Grouping services may not function  and some applications  such as HomeGroup and Remote Assistance  may not function correctly.,C:\Windows\System32\svchost.exe,f8bab354ff3af5b146e817943d4799c8,C:\Windows\System32\svchost.exe -k LocalServicePeerNet,SERVICE_WIN32_SHARE_PROCESS,C:\Windows\System32\pnrpsvc.dll,true,true,The file is signed and the signature was verified.,Microsoft Windows,Microsoft Windows Verification PCA
SE165YTQ,1394ohci,1394 OHCI Compliant Host Controller,,C:\Windows\System32\drivers\1394ohci.sys,7f51fbb65a0d865204e08f47444b8866,\SystemRoot\system32\drivers\1394ohci.sys,SERVICE_KERNEL_DRIVER,,true,true,The file is signed and the signature was verified.,Microsoft Windows,Microsoft Windows Verification PCA
SE165YTQ,Psched,QoS Packet Scheduler,QoS Packet Scheduler,C:\Windows\System32\drivers\pacer.sys,9ed8b78e4b764fd6d35db26369ea886f,system32\DRIVERS\pacer.sys,SERVICE_KERNEL_DRIVER,,true,true,The file is signed and the signature was verified.,Microsoft Windows,Microsoft Windows Verification PCA
SE165YTQ,vds,Virtual Disk,Provides management services for disks  volumes  file systems  and storage arrays.,C:\Windows\System32\vds.exe,8a89916abac4c5f597ed2247436813c2,C:\Windows\System32\vds.exe,SERVICE_WIN32_OWN_PROCESS,,true,true,The file is signed and the signature was verified.,Microsoft Windows,Microsoft Windows Verification PCA
SE165YTQ,W3LOGSVC,W3C Logging Service,Provides W3C logging for Internet Information Services (IIS). If this service is stopped  W3C logging configured by IIS will not work.,C:\Windows\System32\svchost.exe,f8bab354ff3af5b146e817943d4799c8,C:\WINDOWS\system32\svchost.exe -k apphost,SERVICE_WIN32_SHARE_PROCESS,C:\Windows\System32\inetsrv\w3logsvc.dll,true,true,The file is signed and the signature was verified.,Microsoft Windows,Microsoft Windows Production PCA 2011
SE165YTQ,IPNAT,IP Network Address Translator,,C:\Windows\System32\drivers\ipnat.sys,9763bcd97f2ce19b31e49e8628095f11,System32\drivers\ipnat.sys,SERVICE_KERNEL_DRIVER,,true,true,The file is signed and the signature was verified.,Microsoft Windows,Microsoft Windows Verification PCA
SE165YTQ,scfilter,Smart card PnP Class Filter Driver,Smart card reader filter driver enabling smart card PnP.,C:\Windows\System32\drivers\scfilter.sys,092d8eda57885383b6c3daeea4b8f1c4,System32\DRIVERS\scfilter.sys,SERVICE_KERNEL_DRIVER,,true,true,The file is signed and the signature was verified.,Microsoft Windows,Microsoft Windows Verification PCA
SE165YTQ,stexstor,stexstor,,C:\Windows\System32\drivers\stexstor.sys,09d91be0e4e111f6e109395b5a90d595,\SystemRoot\system32\drivers\stexstor.sys,SERVICE_KERNEL_DRIVER,,true,true,The file is signed and the signature was verified.,Microsoft Windows,Microsoft Windows Verification PCA
SE165YTQ,KSecPkg,KSecPkg,,C:\Windows\System32\drivers\ksecpkg.sys,7e4df1948a3960eb20ad0c6e1607a0ee,\SystemRoot\System32\Drivers\ksecpkg.sys,SERVICE_KERNEL_DRIVER,,true,true,The file is signed and the signature was verified.,Microsoft Windows,Microsoft Windows Verification PCA
SE165YTQ,ProfSvc,User Profile Service,This service is responsible for loading and unloading user profiles. If this service is stopped or disabled  users will no longer be able to successfully logon or logoff  applications may have problems getting to users' data  and components registered to receive profile event notifications will not receive them.,C:\Windows\System32\svchost.exe,f8bab354ff3af5b146e817943d4799c8,C:\Windows\system32\svchost.exe -k netsvcs,SERVICE_WIN32_SHARE_PROCESS,C:\Windows\System32\profsvc.dll,true,true,The file is signed and the signature was verified.,Microsoft Windows,Microsoft Windows Verification PCA
SE165YTQ,MpsSvc,Windows Firewall,Windows Firewall helps protect your computer by preventing unauthorized users from gaining access to your computer through the Internet or a network.,C:\Windows\System32\svchost.exe,f8bab354ff3af5b146e817943d4799c8,C:\Windows\system32\svchost.exe -k LocalServiceNoNetwork,SERVICE_WIN32_SHARE_PROCESS,C:\Windows\System32\MPSSVC.dll,true,true,The file is signed and the signature was verified.,Microsoft Windows,Microsoft Windows Verification PCA
SE165YTQ,AFD,Ancillary Function Driver for Winsock,Ancillary Function Driver for Winsock,C:\Windows\System32\drivers\afd.sys,a616c53606bf4d64f9454df97ece36f4,\SystemRoot\system32\drivers\afd.sys,SERVICE_KERNEL_DRIVER,,true,true,The file is signed and the signature was verified.,Microsoft Windows,Microsoft Windows Verification PCA
SE165YTQ,agp440,Intel AGP Bus Filter,,C:\Windows\System32\drivers\AGP440.sys,9e4718b306b6567190910df677c1f985,\SystemRoot\system32\drivers\agp440.sys,SERVICE_KERNEL_DRIVER,,true,true,The file is signed and the signature was verified.,Microsoft Windows,Microsoft Windows Verification PCA
SE165YTQ,UmRdpService,Remote Desktop Services UserMode Port Redirector,Allows the redirection of Printers/Drives/Ports for RDP connections,C:\Windows\System32\svchost.exe,f8bab354ff3af5b146e817943d4799c8,C:\Windows\System32\svchost.exe -k LocalSystemNetworkRestricted,SERVICE_WIN32_SHARE_PROCESS,C:\Windows\System32\umrdp.dll,true,true,The file is signed and the signature was verified.,Microsoft Windows,Microsoft Windows Verification PCA
SE165YTQ,tsusbhub,tsusbhub,,C:\Windows\System32\drivers\tsusbhub.sys,3fd0d44e1666be05109fc975ec293655,system32\drivers\tsusbhub.sys,SERVICE_KERNEL_DRIVER,,true,true,The file is signed and the signature was verified.,Microsoft Windows,Microsoft Windows Verification PCA
SE165YTQ,cmdide,cmdide,,C:\Windows\System32\drivers\cmdide.sys,69f37f7daa120f4d744c2fa84b48556b,\SystemRoot\system32\drivers\cmdide.sys,SERVICE_KERNEL_DRIVER,,true,true,The file is signed and the signature was verified.,Microsoft Windows,Microsoft Windows Verification PCA
SE165YTQ,arc,arc,,C:\Windows\System32\drivers\arc.sys,59430159526b8cddb92758bf2aa8fa21,\SystemRoot\system32\drivers\arc.sys,SERVICE_KERNEL_DRIVER,,true,true,The file is signed and the signature was verified.,Microsoft Windows,Microsoft Windows Verification PCA
SE165YTQ,fdPHost,Function Discovery Provider Host,The FDPHOST service hosts the Function Discovery (FD) network discovery providers. These FD providers supply network discovery services for the Simple Services Discovery Protocol (SSDP) and Web Services  Discovery (WS-D) protocol. Stopping or disabling the FDPHOST service will disable network discovery for these protocols when using FD. When this service is unavailable  network services using FD and relying on these discovery protocols will be unable to find network devices or resources.,C:\Windows\System32\svchost.exe,f8bab354ff3af5b146e817943d4799c8,C:\Windows\system32\svchost.exe -k LocalService,SERVICE_WIN32_SHARE_PROCESS,C:\Windows\System32\fdPHost.dll,true,true,The file is signed and the signature was verified.,Microsoft Windows,Microsoft Windows Verification PCA
SE165YTQ,ProtectedStorage,Protected Storage,Provides protected storage for sensitive data  such as passwords  to prevent access by unauthorized services  processes  or users.,C:\Windows\System32\lsass.exe,565754c13f1bdadb261de3d3ba78749c,C:\Windows\system32\lsass.exe,SERVICE_WIN32_SHARE_PROCESS,,true,true,The file is signed and the signature was verified.,Microsoft Windows,Microsoft Windows Verification PCA
SE165YTQ,BITS,Background Intelligent Transfer Service,Transfers files in the background using idle network bandwidth. If the service is disabled  then any applications that depend on BITS  such as Windows Update or MSN Explorer  will be unable to automatically download programs and other information.,C:\Windows\System32\svchost.exe,f8bab354ff3af5b146e817943d4799c8,C:\Windows\System32\svchost.exe -k netsvcs,SERVICE_WIN32_SHARE_PROCESS,C:\Windows\System32\qmgr.dll,true,true,The file is signed and the signature was verified.,Microsoft Windows,Microsoft Windows Verification PCA
SE165YTQ,mfeelamk,McAfee Inc. mfeelamk,,C:\Windows\System32\drivers\mfeelamk.sys,581dfe76a1d6f846591b61923c566d72,\SystemRoot\system32\drivers\mfeelamk.sys,SERVICE_KERNEL_DRIVER,,true,true,The file is signed and the signature was verified.,Microsoft Windows Hardware Compatibility Publisher,Microsoft Windows Hardware Compatibility PCA
SE165YTQ,storvsc,storvsc,,C:\Windows\System32\drivers\storvsc.sys,ac48cf22c5d473edccbe04098e34d8b8,\SystemRoot\system32\drivers\storvsc.sys,SERVICE_KERNEL_DRIVER,,true,true,The file is signed and the signature was verified.,Microsoft Windows,Microsoft Windows Verification PCA
SE165YTQ,EventSystem,COM+ Event System,Supports System Event Notification Service (SENS)  which provides automatic distribution of events to subscribing Component Object Model (COM) components. If the service is stopped  SENS will close and will not be able to provide logon and logoff notifications. If this service is disabled  any services that explicitly depend on it will fail to start.,C:\Windows\System32\svchost.exe,f8bab354ff3af5b146e817943d4799c8,C:\Windows\system32\svchost.exe -k LocalService,SERVICE_WIN32_SHARE_PROCESS,C:\Windows\System32\es.dll,true,true,The file is signed and the signature was verified.,Microsoft Windows,Microsoft Windows Verification PCA
SE165YTQ,mrxsmb,SMB MiniRedirector Wrapper and Engine,Implements the framework for the SMB filesystem redirector,C:\Windows\System32\drivers\mrxsmb.sys,e7f88772337521dee0d53c2922ca92b7,system32\DRIVERS\mrxsmb.sys,SERVICE_FILE_SYSTEM_DRIVER,,true,true,The file is signed and the signature was verified.,Microsoft Windows,Microsoft Windows Verification PCA
SE165YTQ,VBoxVideo,VBoxVideo,,C:\Windows\System32\drivers\VBoxVideo.sys,2f7b737b37ba2629d24798eedb1f797e,system32\DRIVERS\VBoxVideo.sys,SERVICE_KERNEL_DRIVER,,true,true,The file is signed and the signature was verified.,Oracle Corporation,VeriSign Class 3 Code Signing 2010 CA
SE165YTQ,NetBIOS,NetBIOS Interface,NetBIOS Interface,C:\Windows\System32\drivers\netbios.sys,2d8ef72268c88c0fc90535cb99740f35,system32\DRIVERS\netbios.sys,SERVICE_FILE_SYSTEM_DRIVER,,true,true,The file is signed and the signature was verified.,Microsoft Windows,Microsoft Windows Verification PCA
SE165YTQ,vwifibus,Virtual WiFi Bus Driver,Implements bus functionality for Virtual WiFi,C:\Windows\System32\drivers\vwifibus.sys,1d2f58c372b4768bc2fd6f5db21e233a,\SystemRoot\System32\drivers\vwifibus.sys,SERVICE_KERNEL_DRIVER,,true,true,The file is signed and the signature was verified.,Microsoft Windows,Microsoft Windows Verification PCA
SE165YTQ,W3SVC,World Wide Web Publishing Service,Provides Web connectivity and administration through the Internet Information Services Manager,C:\Windows\System32\svchost.exe,f8bab354ff3af5b146e817943d4799c8,C:\WINDOWS\system32\svchost.exe -k iissvcs,SERVICE_WIN32_SHARE_PROCESS,C:\Windows\System32\inetsrv\iisw3adm.dll,true,true,The file is signed and the signature was verified.,Microsoft Windows,Microsoft Windows Production PCA 2011
SE165YTQ,AudioSrv,Windows Audio,Manages audio for Windows-based programs.  If this service is stopped  audio devices and effects will not function properly.  If this service is disabled  any services that explicitly depend on it will fail to start,C:\Windows\System32\svchost.exe,f8bab354ff3af5b146e817943d4799c8,C:\Windows\System32\svchost.exe -k LocalServiceNetworkRestricted,SERVICE_WIN32_SHARE_PROCESS,C:\Windows\System32\audiosrv.dll,true,true,The file is signed and the signature was verified.,Microsoft Windows,Microsoft Windows Verification PCA
SE165YTQ,isapnp,isapnp,,C:\Windows\System32\drivers\isapnp.sys,ea6df1701547153958636fd6c356339d,\SystemRoot\system32\drivers\isapnp.sys,SERVICE_KERNEL_DRIVER,,true,true,The file is signed and the signature was verified.,Microsoft Windows,Microsoft Windows Verification PCA
SE165YTQ,mccspsvc,McAfee CSP Service,McAfee Cloud Platform Service,C:\Program Files\Common Files\McAfee\CSP\3.0.127.0\\McCSPServiceHost.exe,f4bed8a11e0dab58e51f90a90087d607,"C:\Program Files\Common Files\McAfee\CSP\3.0.127.0\\McCSPServiceHost.exe""""""",SERVICE_WIN32_OWN_PROCESS,,true,true,The file is signed and the signature was verified.,"""McAfee",Symantec Class 3 SHA256 Code Signing CA
SE165YTQ,gagp30kx,Microsoft Generic AGPv3.0 Filter for K8 Processor Platforms,,C:\Windows\System32\drivers\GAGP30KX.SYS,7290baceb15bc81787cc45370671b80c,\SystemRoot\system32\drivers\gagp30kx.sys,SERVICE_KERNEL_DRIVER,,true,true,The file is signed and the signature was verified.,Microsoft Windows,Microsoft Windows Verification PCA
SE165YTQ,mfeaack,McAfee Inc. mfeaack,,C:\Windows\System32\drivers\mfeaack.sys,df56a7fc544366aca2a60c4ccaf9a0ff,system32\drivers\mfeaack.sys,SERVICE_KERNEL_DRIVER,,true,true,The file is signed and the signature was verified.,Microsoft Windows Hardware Compatibility Publisher,Microsoft Windows Hardware Compatibility PCA
SE165YTQ,tcpipreg,TCP/IP Registry Compatibility,Provides compatibility for legacy applications which interact with TCP/IP through the registry. If this service is stopped  certain applications may have impaired functionality.,C:\Windows\System32\drivers\tcpipreg.sys,b2730b59548faf72614bd3f694ee1a55,System32\drivers\tcpipreg.sys,SERVICE_KERNEL_DRIVER,,true,true,The file is signed and the signature was verified.,Microsoft Windows,Microsoft Windows Verification PCA
SE165YTQ,CNG,CNG,,C:\Windows\System32\drivers\cng.sys,d38d1efff30db73d4ae351e40d46d888,\SystemRoot\System32\Drivers\cng.sys,SERVICE_KERNEL_DRIVER,,true,true,The file is signed and the signature was verified.,Microsoft Windows,Microsoft Windows Verification PCA
SE165YTQ,Wd,Wd,,C:\Windows\System32\drivers\wd.sys,72f207e9e867c74f6ddad23065cab382,\SystemRoot\system32\drivers\wd.sys,SERVICE_KERNEL_DRIVER,,true,true,The file is signed and the signature was verified.,Microsoft Windows,Microsoft Windows Verification PCA
SE165YTQ,vsmraid,vsmraid,,C:\Windows\System32\drivers\vsmraid.sys,12881d35191bbc1b5f5924f0ca8f399d,\SystemRoot\system32\drivers\vsmraid.sys,SERVICE_KERNEL_DRIVER,,true,true,The file is signed and the signature was verified.,Microsoft Windows,Microsoft Windows Verification PCA
SE165YTQ,usbohci,Microsoft USB Open Host Controller Miniport Driver,,C:\Windows\System32\drivers\usbohci.sys,208e4dd464913b9a010f942ef6913cd4,system32\DRIVERS\usbohci.sys,SERVICE_KERNEL_DRIVER,,true,true,The file is signed and the signature was verified.,Microsoft Windows,Microsoft Windows Verification PCA
SE165YTQ,AsyncMac,RAS Asynchronous Media Driver,RAS Asynchronous Media Driver,C:\Windows\System32\drivers\asyncmac.sys,471c63e814733fa468efbb00e8984627,system32\DRIVERS\asyncmac.sys,SERVICE_KERNEL_DRIVER,,true,true,The file is signed and the signature was verified.,Microsoft Windows,Microsoft Windows Verification PCA
SE165YTQ,SCardSvr,Smart Card,Manages access to smart cards read by this computer. If this service is stopped  this computer will be unable to read smart cards. If this service is disabled  any services that explicitly depend on it will fail to start.,C:\Windows\System32\svchost.exe,f8bab354ff3af5b146e817943d4799c8,C:\Windows\system32\svchost.exe -k LocalServiceAndNoImpersonation,SERVICE_WIN32_SHARE_PROCESS,C:\Windows\System32\SCardSvr.dll,true,true,The file is signed and the signature was verified.,Microsoft Windows,Microsoft Windows Verification PCA
SE165YTQ,BFE,Base Filtering Engine,The Base Filtering Engine (BFE) is a service that manages firewall and Internet Protocol security (IPsec) policies and implements user mode filtering. Stopping or disabling the BFE service will significantly reduce the security of the system. It will also result in unpredictable behavior in IPsec management and firewall applications.,C:\Windows\System32\svchost.exe,f8bab354ff3af5b146e817943d4799c8,C:\Windows\system32\svchost.exe -k LocalServiceNoNetwork,SERVICE_WIN32_SHARE_PROCESS,C:\Windows\System32\BFE.DLL,true,true,The file is signed and the signature was verified.,Microsoft Windows,Microsoft Windows Verification PCA
SE165YTQ,luafv,UAC File Virtualization,Virtualizes file write failures to per-user locations.,C:\Windows\System32\drivers\luafv.sys,a4f00deed8dce087947e22d627d50fd3,\SystemRoot\system32\drivers\luafv.sys,SERVICE_FILE_SYSTEM_DRIVER,,true,true,The file is signed and the signature was verified.,Microsoft Windows,Microsoft Windows Verification PCA
SE165YTQ,HpSAMD,HpSAMD,,C:\Windows\System32\drivers\HpSAMD.sys,c5fa4994882e278544228853328a32b2,\SystemRoot\system32\drivers\HpSAMD.sys,SERVICE_KERNEL_DRIVER,,true,true,The file is signed and the signature was verified.,Microsoft Windows,Microsoft Windows Verification PCA
SE165YTQ,AcpiPmi,ACPI Power Meter Driver,,C:\Windows\System32\drivers\acpipmi.sys,bff155aaf2acc8856e2640a69d3ed0b3,\SystemRoot\system32\drivers\acpipmi.sys,SERVICE_KERNEL_DRIVER,,true,true,The file is signed and the signature was verified.,Microsoft Windows,Microsoft Windows Verification PCA
SE165YTQ,NetTcpActivator,Net.Tcp Listener Adapter,Receives activation requests over the net.tcp protocol and passes them to the Windows Process Activation Service.,C:\Windows\Microsoft.NET\Framework64\v4.0.30319\SMSvcHost.exe,1e6be274762f542b334795c4dda8ef63,C:\Windows\Microsoft.NET\Framework64\v4.0.30319\SMSvcHost.exe,SERVICE_WIN32_SHARE_PROCESS,,true,true,The file is signed and the signature was verified.,Microsoft Corporation,Microsoft Code Signing PCA
SE165YTQ,mfencbdc,McAfee LLC. mfencbdc,McAfee Content driver Copyright (C) McAfee LLC  2018. All rights reserved.,C:\Windows\System32\drivers\mfencbdc.sys,e65adcef1d8821ae7ded80153df480ae,system32\DRIVERS\mfencbdc.sys,SERVICE_KERNEL_DRIVER,,true,true,The file is signed and the signature was verified.,Microsoft Windows Hardware Compatibility Publisher,Microsoft Windows Hardware Compatibility PCA
SE165YTQ,Mup,Mup,Multiple UNC Provider Driver,C:\Windows\System32\drivers\mup.sys,8bdd03a9597ee2558ebdfc4a680fd699,\SystemRoot\System32\Drivers\mup.sys,SERVICE_FILE_SYSTEM_DRIVER,,true,true,The file is signed and the signature was verified.,Microsoft Windows,Microsoft Windows Verification PCA
SE165YTQ,mfehidk,McAfee Inc. mfehidk,,C:\Windows\System32\drivers\mfehidk.sys,cfd1696be9fafd13bb1fa37cdd0feb6d,\SystemRoot\system32\drivers\mfehidk.sys,SERVICE_KERNEL_DRIVER,,true,true,The file is signed and the signature was verified.,Microsoft Windows Hardware Compatibility Publisher,Microsoft Windows Hardware Compatibility PCA
SE165YTQ,Serial,Serial,,C:\Windows\System32\drivers\serial.sys,b485c67f4615183baee14424e90516cf,\SystemRoot\system32\drivers\serial.sys,SERVICE_KERNEL_DRIVER,,true,true,The file is signed and the signature was verified.,Microsoft Windows,Microsoft Windows Verification PCA
SE165YTQ,pla,Performance Logs &amp; Alerts,Performance Logs and Alerts Collects performance data from local or remote computers based on preconfigured schedule parameters  then writes the data to a log or triggers an alert. If this service is stopped  performance information will not be collected. If this service is disabled  any services that explicitly depend on it will fail to start.,C:\Windows\System32\svchost.exe,f8bab354ff3af5b146e817943d4799c8,C:\Windows\System32\svchost.exe -k LocalServiceNoNetwork,SERVICE_WIN32_SHARE_PROCESS,C:\Windows\System32\pla.dll,true,true,The file is signed and the signature was verified.,Microsoft Windows,Microsoft Windows Verification PCA
SE165YTQ,hkmsvc,Health Key and Certificate Management,Provides X.509 certificate and key management services for the Network Access Protection Agent (NAPAgent). Enforcement technologies that use X.509 certificates may not function properly without this service,C:\Windows\System32\svchost.exe,f8bab354ff3af5b146e817943d4799c8,C:\Windows\System32\svchost.exe -k netsvcs,SERVICE_WIN32_SHARE_PROCESS,C:\Windows\System32\KMSVC.DLL,true,true,The file is signed and the signature was verified.,Microsoft Windows,Microsoft Windows Verification PCA
SE165YTQ,i8042prt,i8042 Keyboard and PS/2 Mouse Port Driver,,C:\Windows\System32\drivers\i8042prt.sys,e9fa0b92df82f829d9a42a0ac3ba656d,system32\DRIVERS\i8042prt.sys,SERVICE_KERNEL_DRIVER,,true,true,The file is signed and the signature was verified.,Microsoft Windows,Microsoft Windows Verification PCA
SE165YTQ,RpcLocator,Remote Procedure Call (RPC) Locator,In Windows 2003 and earlier versions of Windows  the Remote Procedure Call (RPC) Locator service manages the RPC name service database. In Windows Vista and later versions of Windows  this service does not provide any functionality and is present for application compatibility.,C:\Windows\System32\Locator.exe,f6e33ef10004525244aa5f8a14c902ea,C:\Windows\system32\locator.exe,SERVICE_WIN32_OWN_PROCESS,,true,true,The file is signed and the signature was verified.,Microsoft Windows,Microsoft Windows Verification PCA
SE165YTQ,AmdK8,AMD K8 Processor Driver,,C:\Windows\System32\drivers\amdk8.sys,2c742e2ce9f63941dc52ef0a21844bc7,\SystemRoot\system32\drivers\amdk8.sys,SERVICE_KERNEL_DRIVER,,true,true,The file is signed and the signature was verified.,Microsoft Windows,Microsoft Windows Verification PCA
SE165YTQ,wmiApSrv,WMI Performance Adapter,Provides performance library information from Windows Management Instrumentation (WMI) providers to clients on the network. This service only runs when Performance Data Helper is activated.,C:\Windows\System32\wbem\WmiApSrv.exe,fdc5611bcd40aebaceb9194c410c0b86,C:\Windows\system32\wbem\WmiApSrv.exe,SERVICE_WIN32_OWN_PROCESS,,true,true,The file is signed and the signature was verified.,Microsoft Windows,Microsoft Windows Verification PCA
SE165YTQ,McAfee WebAdvisor,McAfee WebAdvisor,McAfee WebAdvisor Service,C:\Program Files\McAfee\WebAdvisor\ServiceHost.exe,b60709eddf6bdc916d7e9aa00f2ff3d7,C:\Program Files\McAfee\WebAdvisor\ServiceHost.exe,SERVICE_WIN32_OWN_PROCESS,,true,true,The file is signed and the signature was verified.,"McAfee""",VeriSign Class 3 Code Signing 2010 CA
