hostname,name,descriptivename,description,path,md5,arguments,type,servicedll,pathsignatureexists,pathsignatureverified,pathsignaturedescription,pathcertificatesubject,pathcertificateissuer
SE165YTQ,MSDTC,Distributed Transaction Coordinator,Coordinates transactions that span multiple resource managers  such as databases  message queues  and file systems. If this service is stopped  these transactions will fail. If this service is disabled  any services that explicitly depend on it will fail to start.,C:\Windows\System32\msdtc.exe,dfd676a1181ce0fdc919c0865e5b0ec2,C:\Windows\System32\msdtc.exe,SERVICE_WIN32_OWN_PROCESS,,true,true,The file is signed and the signature was verified.,Microsoft Windows,Microsoft Windows Verification PCA
SE165YTQ,sppuinotify,SPP Notification Service,Provides Software Licensing activation and notification,C:\Windows\System32\svchost.exe,f8bab354ff3af5b146e817943d4799c8,C:\Windows\system32\svchost.exe -k LocalService,SERVICE_WIN32_SHARE_PROCESS,C:\Windows\System32\sppuinotify.dll,true,true,The file is signed and the signature was verified.,Microsoft Windows,Microsoft Windows Verification PCA
SE165YTQ,CmBatt,Microsoft ACPI Control Method Battery Driver,,C:\Windows\System32\drivers\CmBatt.sys,15beae0079d710f6b0eea1bf8d995112,system32\DRIVERS\CmBatt.sys,SERVICE_KERNEL_DRIVER,,true,true,The file is signed and the signature was verified.,Microsoft Windows,Microsoft Windows Verification PCA
SE165YTQ,AppID,AppID Driver,Identifies an application and enforces software restriction policies.,C:\Windows\System32\drivers\appid.sys,ecc7bee162bc221d7b4c7c08513c120a,\SystemRoot\system32\drivers\appid.sys,SERVICE_KERNEL_DRIVER,,true,true,The file is signed and the signature was verified.,Microsoft Windows,Microsoft Windows Verification PCA
SE165YTQ,p2psvc,Peer Networking Grouping,Enables multi-party communication using Peer-to-Peer Grouping.  If disabled  some applications  such as HomeGroup  may not function.,C:\Windows\System32\svchost.exe,f8bab354ff3af5b146e817943d4799c8,C:\Windows\System32\svchost.exe -k LocalServicePeerNet,SERVICE_WIN32_SHARE_PROCESS,C:\Windows\System32\p2psvc.dll,true,true,The file is signed and the signature was verified.,Microsoft Windows,Microsoft Windows Verification PCA
SE165YTQ,PNRPAutoReg,PNRP Machine Name Publication Service,This service publishes a machine name using the Peer Name Resolution Protocol.  Configuration is managed via the netsh context 'p2p pnrp peer' ,C:\Windows\System32\svchost.exe,f8bab354ff3af5b146e817943d4799c8,C:\Windows\System32\svchost.exe -k LocalServicePeerNet,SERVICE_WIN32_SHARE_PROCESS,C:\Windows\System32\pnrpauto.dll,true,true,The file is signed and the signature was verified.,Microsoft Windows,Microsoft Windows Verification PCA
SE165YTQ,MMCSS,Multimedia Class Scheduler,Enables relative prioritization of work based on system-wide task priorities. This is intended mainly for multimedia applications.  If this service is stopped  individual tasks resort to their default priority.,C:\Windows\System32\svchost.exe,f8bab354ff3af5b146e817943d4799c8,C:\Windows\system32\svchost.exe -k netsvcs,SERVICE_WIN32_SHARE_PROCESS,C:\Windows\System32\mmcss.dll,true,true,The file is signed and the signature was verified.,Microsoft Windows,Microsoft Windows Verification PCA
SE165YTQ,msiserver,Windows Installer,Adds  modifies  and removes applications provided as a Windows Installer (*.msi) package. If this service is disabled  any services that explicitly depend on it will fail to start.,C:\Windows\System32\msiexec.exe,28c59293bb2b030bae78ab932eb6f187,C:\Windows\system32\msiexec.exe /V,SERVICE_WIN32_OWN_PROCESS,,true,true,The file is signed and the signature was verified.,Microsoft Windows,Microsoft Windows Verification PCA
SE165YTQ,WmiAcpi,Microsoft Windows Management Interface for ACPI,,C:\Windows\System32\drivers\wmiacpi.sys,af156045df05a0fcc6d0561ad0a7ec8c,\SystemRoot\system32\drivers\wmiacpi.sys,SERVICE_KERNEL_DRIVER,,true,true,The file is signed and the signature was verified.,Microsoft Windows,Microsoft Windows Verification PCA
SE165YTQ,Winmgmt,Windows Management Instrumentation,Provides a common interface and object model to access management information about operating system  devices  applications and services. If this service is stopped  most Windows-based software will not function properly. If this service is disabled  any services that explicitly depend on it will fail to start.,C:\Windows\System32\svchost.exe,f8bab354ff3af5b146e817943d4799c8,C:\Windows\system32\svchost.exe -k netsvcs,SERVICE_WIN32_SHARE_PROCESS,C:\Windows\System32\wbem\WMIsvc.dll,true,true,The file is signed and the signature was verified.,Microsoft Windows,Microsoft Windows Verification PCA
SE165YTQ,Wlansvc,WLAN AutoConfig,The WLANSVC service provides the logic required to configure  discover  connect to  and disconnect from a wireless local area network (WLAN) as defined by IEEE 802.11 standards. It also contains the logic to turn your computer into a software access point so that other devices or computers can connect to your computer wirelessly using a WLAN adapter that can support this. Stopping or disabling the WLANSVC service will make all WLAN adapters on your computer inaccessible from the Windows networking UI. It is strongly recommended that you have the WLANSVC service running if your computer has a WLAN adapter.,C:\Windows\System32\svchost.exe,f8bab354ff3af5b146e817943d4799c8,C:\Windows\system32\svchost.exe -k LocalSystemNetworkRestricted,SERVICE_WIN32_SHARE_PROCESS,C:\Windows\System32\wlansvc.dll,true,true,The file is signed and the signature was verified.,Microsoft Windows,Microsoft Windows Verification PCA
SE165YTQ,FltMgr,FltMgr,File System Filter Manager Driver,C:\Windows\System32\drivers\fltMgr.sys,0755b217b9cac890e44cc736cf944ef9,\SystemRoot\system32\drivers\fltmgr.sys,SERVICE_FILE_SYSTEM_DRIVER,,true,true,The file is signed and the signature was verified.,Microsoft Windows,Microsoft Windows Verification PCA
SE165YTQ,THREADORDER,Thread Ordering Server,Provides ordered execution for a group of threads within a specific period of time.,C:\Windows\System32\svchost.exe,f8bab354ff3af5b146e817943d4799c8,C:\Windows\system32\svchost.exe -k LocalService,SERVICE_WIN32_SHARE_PROCESS,C:\Windows\System32\mmcss.dll,true,true,The file is signed and the signature was verified.,Microsoft Windows,Microsoft Windows Verification PCA
SE165YTQ,RasAcd,Remote Access Auto Connection Driver,Remote Access Auto Connection Driver,C:\Windows\System32\drivers\rasacd.sys,d124593bcf63b47ec168905d6d15a633,System32\DRIVERS\rasacd.sys,SERVICE_KERNEL_DRIVER,,true,true,The file is signed and the signature was verified.,Microsoft Windows,Microsoft Windows Verification PCA
SE165YTQ,monitor,Microsoft Monitor Class Function Driver Service,,C:\Windows\System32\drivers\monitor.sys,bf8103ef9ade2557b4655d64edd8b4d6,system32\DRIVERS\monitor.sys,SERVICE_KERNEL_DRIVER,,true,true,The file is signed and the signature was verified.,Microsoft Windows,Microsoft Windows Verification PCA
SE165YTQ,RemoteAccess,Routing and Remote Access,Offers routing services to businesses in local area and wide area network environments.,C:\Windows\System32\svchost.exe,f8bab354ff3af5b146e817943d4799c8,C:\Windows\System32\svchost.exe -k netsvcs,SERVICE_WIN32_SHARE_PROCESS,C:\Windows\System32\mprdim.dll,true,true,The file is signed and the signature was verified.,Microsoft Windows,Microsoft Windows Verification PCA
SE165YTQ,usbuhci,Microsoft USB Universal Host Controller Miniport Driver,,C:\Windows\System32\drivers\usbuhci.sys,3e4cd20ecf5007b23d92b2abba975a6b,\SystemRoot\system32\drivers\usbuhci.sys,SERVICE_KERNEL_DRIVER,,true,true,The file is signed and the signature was verified.,Microsoft Windows,Microsoft Windows Verification PCA
SE165YTQ,PcaSvc,Program Compatibility Assistant Service,This service provides support for the Program Compatibility Assistant (PCA).  PCA monitors programs installed and run by the user and detects known compatibility problems. If this service is stopped  PCA will not function properly.,C:\Windows\System32\svchost.exe,f8bab354ff3af5b146e817943d4799c8,C:\Windows\system32\svchost.exe -k LocalSystemNetworkRestricted,SERVICE_WIN32_SHARE_PROCESS,C:\Windows\System32\pcasvc.dll,true,true,The file is signed and the signature was verified.,Microsoft Windows,Microsoft Windows Verification PCA
SE165YTQ,Schedule,Task Scheduler,Enables a user to configure and schedule automated tasks on this computer. The service also hosts multiple Windows system-critical tasks. If this service is stopped or disabled  these tasks will not be run at their scheduled times. If this service is disabled  any services that explicitly depend on it will fail to start.,C:\Windows\System32\svchost.exe,f8bab354ff3af5b146e817943d4799c8,C:\Windows\system32\svchost.exe -k netsvcs,SERVICE_WIN32_SHARE_PROCESS,C:\Windows\System32\schedsvc.dll,true,true,The file is signed and the signature was verified.,Microsoft Windows,Microsoft Windows Verification PCA
SE165YTQ,usbhub,Microsoft USB Standard Hub Driver,,C:\Windows\System32\drivers\usbhub.sys,759783853d17cb66ada59692b794babc,system32\DRIVERS\usbhub.sys,SERVICE_KERNEL_DRIVER,,true,true,The file is signed and the signature was verified.,Microsoft Windows,Microsoft Windows Verification PCA
SE165YTQ,ALG,Application Layer Gateway Service,Provides support for 3rd party protocol plug-ins for Internet Connection Sharing,C:\Windows\System32\alg.exe,e1d4ca11cad15531d5ac93fde7972415,C:\Windows\System32\alg.exe,SERVICE_WIN32_OWN_PROCESS,,true,true,The file is signed and the signature was verified.,Microsoft Windows,Microsoft Windows Verification PCA
SE165YTQ,McAWFwk,McAfee Activation Service,McAfee Activation Service,c:\Program Files\Common Files\McAfee\ActWiz\McAWFwk.exe,ce4db57ab6c33ec08bba6d80275209aa,c:\PROGRA~1\COMMON~1\mcafee\actwiz\mcawfwk.exe,SERVICE_WIN32_OWN_PROCESS,,true,true,The file is signed and the signature was verified.,"McAfee""",Symantec Class 3 SHA256 Code Signing CA
SE165YTQ,ws2ifsl,Winsock IFS Driver,Winsock IFS Driver,C:\Windows\System32\drivers\ws2ifsl.sys,5db64ecb242b7fc5bc12cd7e1faa1a0e,\SystemRoot\system32\drivers\ws2ifsl.sys,SERVICE_KERNEL_DRIVER,,true,true,The file is signed and the signature was verified.,Microsoft Windows,Microsoft Windows Verification PCA
SE165YTQ,RasAgileVpn,WAN Miniport (IKEv2),WAN Miniport (IKEv2),C:\Windows\System32\drivers\agilevpn.sys,fc3e55c9aa94666f14908b8be84c73d4,system32\DRIVERS\AgileVpn.sys,SERVICE_KERNEL_DRIVER,,true,true,The file is signed and the signature was verified.,Microsoft Windows,Microsoft Windows Verification PCA
SE165YTQ,SiSRaid4,SiSRaid4,,C:\Windows\System32\drivers\sisraid4.sys,a2a8b0880d67293780c31d07690d3f4d,\SystemRoot\system32\drivers\sisraid4.sys,SERVICE_KERNEL_DRIVER,,true,true,The file is signed and the signature was verified.,Microsoft Windows,Microsoft Windows Verification PCA
SE165YTQ,VSS,Volume Shadow Copy,Manages and implements Volume Shadow Copies used for backup and other purposes. If this service is stopped  shadow copies will be unavailable for backup and the backup may fail. If this service is disabled  any services that explicitly depend on it will fail to start.,C:\Windows\System32\VSSVC.exe,1b321f696b86d8ef9628b0c8266a9858,C:\Windows\system32\vssvc.exe,SERVICE_WIN32_OWN_PROCESS,,true,true,The file is signed and the signature was verified.,Microsoft Windows,Microsoft Windows Verification PCA
SE165YTQ,WdiServiceHost,Diagnostic Service Host,The Diagnostic Service Host is used by the Diagnostic Policy Service to host diagnostics that need to run in a Local Service context.  If this service is stopped  any diagnostics that depend on it will no longer function.,C:\Windows\System32\svchost.exe,f8bab354ff3af5b146e817943d4799c8,C:\Windows\System32\svchost.exe -k LocalService,SERVICE_WIN32_SHARE_PROCESS,C:\Windows\System32\wdi.dll,true,true,The file is signed and the signature was verified.,Microsoft Windows,Microsoft Windows Verification PCA
SE165YTQ,drmkaud,Microsoft Trusted Audio Drivers,,C:\Windows\System32\drivers\drmkaud.sys,7a1f12d72a21b7afb39153288c5fd086,system32\drivers\drmkaud.sys,SERVICE_KERNEL_DRIVER,,true,true,The file is signed and the signature was verified.,Microsoft Windows,Microsoft Windows Verification PCA
SE165YTQ,intelide,intelide,,C:\Windows\System32\drivers\intelide.sys,37434b86f7479d444086bc9d2cc0f937,\SystemRoot\system32\drivers\intelide.sys,SERVICE_KERNEL_DRIVER,,true,true,The file is signed and the signature was verified.,Microsoft Windows,Microsoft Windows Verification PCA
SE165YTQ,HdAudAddService,Microsoft 1.1 UAA Function Driver for High Definition Audio Service,,C:\Windows\System32\drivers\HdAudio.sys,3b0edc79b6df89d9cb5cbcf6097ed1b4,system32\drivers\HdAudio.sys,SERVICE_KERNEL_DRIVER,,true,true,The file is signed and the signature was verified.,Microsoft Windows,Microsoft Windows Verification PCA
SE165YTQ,TermService,Remote Desktop Services,Allows users to connect interactively to a remote computer. Remote Desktop and Remote Desktop Session Host Server depend on this service.  To prevent remote use of this computer  clear the checkboxes on the Remote tab of the System properties control panel item.,C:\Windows\System32\svchost.exe,f8bab354ff3af5b146e817943d4799c8,C:\Windows\System32\svchost.exe -k NetworkService,SERVICE_WIN32_SHARE_PROCESS,C:\Windows\System32\termsrv.dll,true,true,The file is signed and the signature was verified.,Microsoft Windows,Microsoft Windows Verification PCA
SE165YTQ,Rasl2tp,WAN Miniport (L2TP),WAN Miniport (L2TP),C:\Windows\System32\drivers\rasl2tp.sys,5ba0041e716f27193baf558217a2973b,system32\DRIVERS\rasl2tp.sys,SERVICE_KERNEL_DRIVER,,true,true,The file is signed and the signature was verified.,Microsoft Windows,Microsoft Windows Verification PCA
SE165YTQ,WebClient,WebClient,Enables Windows-based programs to create  access  and modify Internet-based files. If this service is stopped  these functions will not be available. If this service is disabled  any services that explicitly depend on it will fail to start.,C:\Windows\System32\svchost.exe,f8bab354ff3af5b146e817943d4799c8,C:\Windows\system32\svchost.exe -k LocalService,SERVICE_WIN32_SHARE_PROCESS,C:\Windows\System32\WebClnt.dll,true,true,The file is signed and the signature was verified.,Microsoft Windows,Microsoft Windows Verification PCA
SE165YTQ,vmbus,vmbus,,C:\Windows\System32\drivers\vmbus.sys,aa0bf53c5b14fee3ccb6f7883d228f7e,\SystemRoot\system32\drivers\vmbus.sys,SERVICE_KERNEL_DRIVER,,true,true,The file is signed and the signature was verified.,Microsoft Windows,Microsoft Windows Verification PCA
SE165YTQ,LSI_FC,LSI_FC,,C:\Windows\System32\drivers\lsi_fc.sys,5479f01f648a115a49306c2c9a63c942,\SystemRoot\system32\drivers\lsi_fc.sys,SERVICE_KERNEL_DRIVER,,true,true,The file is signed and the signature was verified.,Microsoft Windows,Microsoft Windows Verification PCA
SE165YTQ,pciide,pciide,,C:\Windows\System32\drivers\pciide.sys,1299dc5d137958a91b518b9006b7341d,\SystemRoot\system32\drivers\pciide.sys,SERVICE_KERNEL_DRIVER,,true,true,The file is signed and the signature was verified.,Microsoft Windows,Microsoft Windows Verification PCA
SE165YTQ,TapiSrv,Telephony,Provides Telephony API (TAPI) support for programs that control telephony devices on the local computer and  through the LAN  on servers that are also running the service.,C:\Windows\System32\svchost.exe,f8bab354ff3af5b146e817943d4799c8,C:\Windows\System32\svchost.exe -k NetworkService,SERVICE_WIN32_SHARE_PROCESS,C:\Windows\System32\tapisrv.dll,true,true,The file is signed and the signature was verified.,Microsoft Windows,Microsoft Windows Verification PCA
SE165YTQ,blbdrive,blbdrive,,C:\Windows\System32\drivers\blbdrive.sys,6d429dc0f8cb5ecc38108a15caadbbc3,system32\DRIVERS\blbdrive.sys,SERVICE_KERNEL_DRIVER,,true,true,The file is signed and the signature was verified.,Microsoft Windows,Microsoft Windows Verification PCA
SE165YTQ,lmhosts,TCP/IP NetBIOS Helper,Provides support for the NetBIOS over TCP/IP (NetBT) service and NetBIOS name resolution for clients on the network  therefore enabling users to share files  print  and log on to the network. If this service is stopped  these functions might be unavailable. If this service is disabled  any services that explicitly depend on it will fail to start.,C:\Windows\System32\svchost.exe,f8bab354ff3af5b146e817943d4799c8,C:\Windows\system32\svchost.exe -k LocalServiceNetworkRestricted,SERVICE_WIN32_SHARE_PROCESS,C:\Windows\System32\lmhsvc.dll,true,true,The file is signed and the signature was verified.,Microsoft Windows,Microsoft Windows Verification PCA
SE165YTQ,Compbatt,Microsoft Composite Battery Driver,,C:\Windows\System32\drivers\compbatt.sys,4a7e53ddca1accd4f08111b6fccea9b5,\SystemRoot\system32\DRIVERS\compbatt.sys,SERVICE_KERNEL_DRIVER,,true,true,The file is signed and the signature was verified.,Microsoft Windows,Microsoft Windows Verification PCA
SE165YTQ,AmdPPM,AMD Processor Driver,,C:\Windows\System32\drivers\amdppm.sys,d5c8355c56cac68743021423e490b765,\SystemRoot\system32\drivers\amdppm.sys,SERVICE_KERNEL_DRIVER,,true,true,The file is signed and the signature was verified.,Microsoft Windows,Microsoft Windows Verification PCA
SE165YTQ,SENS,System Event Notification Service,Monitors system events and notifies subscribers to COM+ Event System of these events.,C:\Windows\System32\svchost.exe,f8bab354ff3af5b146e817943d4799c8,C:\Windows\system32\svchost.exe -k netsvcs,SERVICE_WIN32_SHARE_PROCESS,C:\Windows\System32\Sens.dll,true,true,The file is signed and the signature was verified.,Microsoft Windows,Microsoft Windows Verification PCA
SE165YTQ,KtmRm,KtmRm for Distributed Transaction Coordinator,Coordinates transactions between the Distributed Transaction Coordinator (MSDTC) and the Kernel Transaction Manager (KTM). If it is not needed  it is recommended that this service remain stopped. If it is needed  both MSDTC and KTM will start this service automatically. If this service is disabled  any MSDTC transaction interacting with a Kernel Resource Manager will fail and any services that explicitly depend on it will fail to start.,C:\Windows\System32\svchost.exe,f8bab354ff3af5b146e817943d4799c8,C:\Windows\System32\svchost.exe -k NetworkServiceAndNoImpersonation,SERVICE_WIN32_SHARE_PROCESS,C:\Windows\System32\msdtckrm.dll,true,true,The file is signed and the signature was verified.,Microsoft Windows,Microsoft Windows Verification PCA
SE165YTQ,Disk,Disk Driver,,C:\Windows\System32\drivers\disk.sys,74618d214cffe77d79dbf6e84f74b044,\SystemRoot\system32\drivers\disk.sys,SERVICE_KERNEL_DRIVER,,true,true,The file is signed and the signature was verified.,Microsoft Windows,Microsoft Windows Verification PCA
SE165YTQ,EFS,Encrypting File System (EFS),Provides the core file encryption technology used to store encrypted files on NTFS file system volumes. If this service is stopped or disabled  applications will be unable to access encrypted files.,C:\Windows\System32\lsass.exe,565754c13f1bdadb261de3d3ba78749c,C:\Windows\System32\lsass.exe,SERVICE_WIN32_SHARE_PROCESS,,true,true,The file is signed and the signature was verified.,Microsoft Windows,Microsoft Windows Verification PCA
SE165YTQ,volsnap,Storage volumes,,C:\Windows\System32\drivers\volsnap.sys,48532bc57a3cfee69679f5332720e7e7,\SystemRoot\system32\drivers\volsnap.sys,SERVICE_KERNEL_DRIVER,,true,true,The file is signed and the signature was verified.,Microsoft Windows,Microsoft Windows Verification PCA
SE165YTQ,HDAudBus,Microsoft UAA Bus Driver for High Definition Audio,,C:\Windows\System32\drivers\hdaudbus.sys,68011bfebd7318dc5422ec8284a90883,system32\DRIVERS\HDAudBus.sys,SERVICE_KERNEL_DRIVER,,true,true,The file is signed and the signature was verified.,Microsoft Windows,Microsoft Windows Verification PCA
SE165YTQ,mouhid,Mouse HID Driver,,C:\Windows\System32\drivers\mouhid.sys,2d99ce3784c858cd446bdfbeac715d33,system32\DRIVERS\mouhid.sys,SERVICE_KERNEL_DRIVER,,true,true,The file is signed and the signature was verified.,Microsoft Windows,Microsoft Windows Verification PCA
SE165YTQ,VMBusHID,VMBusHID,,C:\Windows\System32\drivers\VMBusHID.sys,e831dfae7a76a165d337d26a14d7d1a9,\SystemRoot\system32\drivers\VMBusHID.sys,SERVICE_KERNEL_DRIVER,,true,true,The file is signed and the signature was verified.,Microsoft Windows,Microsoft Windows Verification PCA
SE165YTQ,sffdisk,SFF Storage Class Driver,,C:\Windows\System32\drivers\sffdisk.sys,6eede911a6378aee2105e407b7445973,\SystemRoot\system32\drivers\sffdisk.sys,SERVICE_KERNEL_DRIVER,,true,true,The file is signed and the signature was verified.,Microsoft Windows,Microsoft Windows Verification PCA
SE165YTQ,nfrd960,nfrd960,,C:\Windows\System32\drivers\nfrd960.sys,af4a245910d430450d3807745959bf44,\SystemRoot\system32\drivers\nfrd960.sys,SERVICE_KERNEL_DRIVER,,true,true,The file is signed and the signature was verified.,Microsoft Windows,Microsoft Windows Verification PCA
SE165YTQ,TDPIPE,TDPIPE,,C:\Windows\System32\drivers\tdpipe.sys,9a7ec9b33ab0c617763fdb1faf81c0e9,system32\drivers\tdpipe.sys,SERVICE_KERNEL_DRIVER,,true,true,The file is signed and the signature was verified.,Microsoft Windows,Microsoft Windows Verification PCA
SE165YTQ,Power,Power,Manages power policy and power policy notification delivery.,C:\Windows\System32\svchost.exe,f8bab354ff3af5b146e817943d4799c8,C:\Windows\system32\svchost.exe -k DcomLaunch,SERVICE_WIN32_SHARE_PROCESS,C:\Windows\System32\umpo.dll,true,true,The file is signed and the signature was verified.,Microsoft Windows,Microsoft Windows Verification PCA
SE165YTQ,PerfHost,Performance Counter DLL Host,Enables remote users and 64-bit processes to query performance counters provided by 32-bit DLLs. If this service is stopped  only local users and 32-bit processes will be able to query performance counters provided by 32-bit DLLs.,C:\Windows\SysWOW64\perfhost.exe,c0bf02f7dea0026b517f45cfb8bdf5c9,C:\Windows\SysWow64\perfhost.exe,SERVICE_WIN32_OWN_PROCESS,,true,true,The file is signed and the signature was verified.,Microsoft Windows,Microsoft Windows Verification PCA
SE165YTQ,rdbss,Redirected Buffering Sub Sysytem,Provides the framework for network mini-redirectors,C:\Windows\System32\drivers\rdbss.sys,7d255dc5fbfec94b5650445a7aa6e051,system32\DRIVERS\rdbss.sys,SERVICE_FILE_SYSTEM_DRIVER,,true,true,The file is signed and the signature was verified.,Microsoft Windows,Microsoft Windows Verification PCA
SE165YTQ,MSiSCSI,Microsoft iSCSI Initiator Service,Manages Internet SCSI (iSCSI) sessions from this computer to remote iSCSI target devices. If this service is stopped  this computer will not be able to login or access iSCSI targets. If this service is disabled  any services that explicitly depend on it will fail to start.,C:\Windows\System32\svchost.exe,f8bab354ff3af5b146e817943d4799c8,C:\Windows\system32\svchost.exe -k netsvcs,SERVICE_WIN32_SHARE_PROCESS,C:\Windows\System32\iscsiexe.dll,true,true,The file is signed and the signature was verified.,Microsoft Windows,Microsoft Windows Verification PCA
SE165YTQ,FontCache,Windows Font Cache Service,Optimizes performance of applications by caching commonly used font data. Applications will start this service if it is not already running. It can be disabled  though doing so will degrade application performance.,C:\Windows\System32\svchost.exe,f8bab354ff3af5b146e817943d4799c8,C:\Windows\system32\svchost.exe -k LocalServiceAndNoImpersonation,SERVICE_WIN32_SHARE_PROCESS,C:\Windows\System32\FntCache.dll,true,true,The file is signed and the signature was verified.,Microsoft Windows,Microsoft Windows Verification PCA
SE165YTQ,fdc,Floppy Disk Controller Driver,,C:\Windows\System32\drivers\fdc.sys,9212848fde626e8d0932f3e90e434fe4,\SystemRoot\system32\drivers\fdc.sys,SERVICE_KERNEL_DRIVER,,true,true,The file is signed and the signature was verified.,Microsoft Windows,Microsoft Windows Verification PCA
SE165YTQ,vhdmp,vhdmp,,C:\Windows\System32\drivers\vhdmp.sys,37b94ef8cb0754f1d1a0d1eed1c6ca35,\SystemRoot\system32\drivers\vhdmp.sys,SERVICE_KERNEL_DRIVER,,true,true,The file is signed and the signature was verified.,Microsoft Windows,Microsoft Windows Verification PCA
SE165YTQ,wbengine,Block Level Backup Engine Service,The WBENGINE service is used by Windows Backup to perform backup and recovery operations. If this service is stopped by a user  it may cause the currently running backup or recovery operation to fail. Disabling this service may disable backup and recovery operations using Windows Backup on this computer.,C:\Windows\System32\wbengine.exe,fb1e3561f4b2e744f397ee3ea0d9cc93,C:\Windows\system32\wbengine.exe,SERVICE_WIN32_OWN_PROCESS,,true,true,The file is signed and the signature was verified.,Microsoft Windows,Microsoft Windows Verification PCA
SE165YTQ,NdisCap,NDIS Capture LightWeight Filter,NDIS Capture LightWeight Filter,C:\Windows\System32\drivers\ndiscap.sys,a577998c40f9fdd9cd963b74c58eaeef,system32\DRIVERS\ndiscap.sys,SERVICE_KERNEL_DRIVER,,true,true,The file is signed and the signature was verified.,Microsoft Windows,Microsoft Windows Verification PCA
SE165YTQ,usbprint,Microsoft USB PRINTER Class,,C:\Windows\System32\drivers\usbprint.sys,6a402b07442a38a45e59ff784d2be9cf,\SystemRoot\system32\drivers\usbprint.sys,SERVICE_KERNEL_DRIVER,,true,true,The file is signed and the signature was verified.,Microsoft Windows,Microsoft Windows Verification PCA
SE165YTQ,WerSvc,Windows Error Reporting Service,Allows errors to be reported when programs stop working or responding and allows existing solutions to be delivered. Also allows logs to be generated for diagnostic and repair services. If this service is stopped  error reporting might not work correctly and results of diagnostic services and repairs might not be displayed.,C:\Windows\System32\svchost.exe,f8bab354ff3af5b146e817943d4799c8,C:\Windows\System32\svchost.exe -k WerSvcGroup,SERVICE_WIN32_SHARE_PROCESS,C:\Windows\System32\wersvc.dll,true,true,The file is signed and the signature was verified.,Microsoft Windows,Microsoft Windows Verification PCA
