hostname,name,descriptivename,description,path,md5,arguments,type,servicedll,pathsignatureexists,pathsignatureverified,pathsignaturedescription,pathcertificatesubject,pathcertificateissuer
SE165YTQ,NetBT,NetBT,This service implements NetBios over TCP/IP.,C:\Windows\System32\drivers\netbt.sys,d702dcc271ecf1fcd3ae3b91e23cc5ca,System32\DRIVERS\netbt.sys,SERVICE_KERNEL_DRIVER,,true,true,The file is signed and the signature was verified.,Microsoft Windows,Microsoft Windows Verification PCA
SE165YTQ,clr_optimization_v4.0.30319_32,Microsoft .NET Framework NGEN v4.0.30319_X86,Microsoft .NET Framework NGEN,C:\Windows\Microsoft.NET\Framework\v4.0.30319\mscorsvw.exe,4d2999667e6726ccf4c44a71501b10f5,C:\Windows\Microsoft.NET\Framework\v4.0.30319\mscorsvw.exe,SERVICE_WIN32_OWN_PROCESS,,true,true,The file is signed and the signature was verified.,Microsoft Corporation,Microsoft Code Signing PCA
SE165YTQ,sermouse,Serial Mouse Driver,,C:\Windows\System32\drivers\sermouse.sys,859ac0b04647883bd2cfe7e29ed98268,\SystemRoot\system32\drivers\sermouse.sys,SERVICE_KERNEL_DRIVER,,true,true,The file is signed and the signature was verified.,Microsoft Windows,Microsoft Windows Verification PCA
SE165YTQ,SDRSVC,Windows Backup,Provides Windows Backup and Restore capabilities.,C:\Windows\System32\svchost.exe,f8bab354ff3af5b146e817943d4799c8,C:\Windows\system32\svchost.exe -k SDRSVC,SERVICE_WIN32_OWN_PROCESS,C:\Windows\System32\sdrsvc.dll,true,true,The file is signed and the signature was verified.,Microsoft Windows,Microsoft Windows Verification PCA
SE165YTQ,mfefirek,McAfee Inc. mfefirek,,C:\Windows\System32\drivers\mfefirek.sys,155dc446109eedad777cafb130ba9c70,system32\drivers\mfefirek.sys,SERVICE_KERNEL_DRIVER,,true,true,The file is signed and the signature was verified.,Microsoft Windows Hardware Compatibility Publisher,Microsoft Windows Hardware Compatibility PCA
SE165YTQ,Browser,Computer Browser,Maintains an updated list of computers on the network and supplies this list to computers designated as browsers. If this service is stopped  this list will not be updated or maintained. If this service is disabled  any services that explicitly depend on it will fail to start.,C:\Windows\System32\svchost.exe,f8bab354ff3af5b146e817943d4799c8,C:\Windows\System32\svchost.exe -k netsvcs,SERVICE_WIN32_SHARE_PROCESS,C:\Windows\System32\browser.dll,true,true,The file is signed and the signature was verified.,Microsoft Windows,Microsoft Windows Verification PCA
SE165YTQ,msdsm,msdsm,,C:\Windows\System32\drivers\msdsm.sys,c9d754439ddfac7d9d2ce06669b8c06f,\SystemRoot\system32\drivers\msdsm.sys,SERVICE_KERNEL_DRIVER,,true,true,The file is signed and the signature was verified.,Microsoft Windows,Microsoft Windows Verification PCA
SE165YTQ,seclogon,Secondary Logon,Enables starting processes under alternate credentials. If this service is stopped  this type of logon access will be unavailable. If this service is disabled  any services that explicitly depend on it will fail to start.,C:\Windows\System32\svchost.exe,f8bab354ff3af5b146e817943d4799c8,C:\Windows\system32\svchost.exe -k netsvcs,SERVICE_WIN32_SHARE_PROCESS,C:\Windows\System32\seclogon.dll,true,true,The file is signed and the signature was verified.,Microsoft Windows,Microsoft Windows Verification PCA
SE165YTQ,usbehci,Microsoft USB 2.0 Enhanced Host Controller Miniport Driver,,C:\Windows\System32\drivers\usbehci.sys,3fd3fbb2ade6c4a064644ea48f741a7f,\SystemRoot\system32\drivers\usbehci.sys,SERVICE_KERNEL_DRIVER,,true,true,The file is signed and the signature was verified.,Microsoft Windows,Microsoft Windows Verification PCA
SE165YTQ,E1G60,Intel(R) PRO/1000 NDIS 6 Adapter Driver,,C:\Windows\System32\drivers\E1G6032E.sys,206234dca31f55da6fea88ef848f467d,system32\DRIVERS\E1G6032E.sys,SERVICE_KERNEL_DRIVER,,true,true,The file is signed and the signature was verified.,Microsoft Windows,Microsoft Windows Verification PCA
SE165YTQ,sbp2port,sbp2port,,C:\Windows\System32\drivers\sbp2port.sys,f09f0a79ce7acea5097558c57cc86544,\SystemRoot\system32\drivers\sbp2port.sys,SERVICE_KERNEL_DRIVER,,true,true,The file is signed and the signature was verified.,Microsoft Windows,Microsoft Windows Verification PCA
SE165YTQ,kbdhid,Keyboard HID Driver,,C:\Windows\System32\drivers\kbdhid.sys,5ba4ae19d03471ea8e3a72a381fde80f,\SystemRoot\system32\drivers\kbdhid.sys,SERVICE_KERNEL_DRIVER,,true,true,The file is signed and the signature was verified.,Microsoft Windows,Microsoft Windows Verification PCA
SE165YTQ,VBoxMouse,VirtualBox Guest Mouse Service,,C:\Windows\System32\drivers\VBoxMouse.sys,4912492348afa42629f1eb66f5e83ec6,system32\DRIVERS\VBoxMouse.sys,SERVICE_KERNEL_DRIVER,,true,true,The file is signed and the signature was verified.,Oracle Corporation,VeriSign Class 3 Code Signing 2010 CA
SE165YTQ,VGPU,VGPU,,C:\Windows\System32\drivers\rdvgkmd.sys,0f7fc15c167e0485d0597eab1b314a01,System32\drivers\rdvgkmd.sys,SERVICE_KERNEL_DRIVER,,,,,,
SE165YTQ,LSI_SCSI,LSI_SCSI,,C:\Windows\System32\drivers\lsi_scsi.sys,dd570a96ece9fb0c5a4fec007a133aa2,\SystemRoot\system32\drivers\lsi_scsi.sys,SERVICE_KERNEL_DRIVER,,true,true,The file is signed and the signature was verified.,Microsoft Windows,Microsoft Windows Verification PCA
SE165YTQ,WinRM,Windows Remote Management (WS-Management),Windows Remote Management (WinRM) service implements the WS-Management protocol for remote management. WS-Management is a standard web services protocol used for remote software and hardware management. The WinRM service listens on the network for WS-Management requests and processes them. The WinRM Service needs to be configured with a listener using winrm.cmd command line tool or through Group Policy in order for it to listen over the network. The WinRM service provides access to WMI data and enables event collection. Event collection and subscription to events require that the service is running. WinRM messages use HTTP and HTTPS as transports. The WinRM service does not depend on IIS but is preconfigured to share a port with IIS on the same machine.  The WinRM service reserves the /wsman URL prefix. To prevent conflicts with IIS  administrators should ensure that any websites hosted on IIS do not use the /wsman URL prefix.,C:\Windows\System32\svchost.exe,f8bab354ff3af5b146e817943d4799c8,C:\Windows\System32\svchost.exe -k NetworkService,SERVICE_WIN32_SHARE_PROCESS,C:\Windows\System32\WsmSvc.dll,true,true,The file is signed and the signature was verified.,Microsoft Windows,Microsoft Windows Verification PCA
SE165YTQ,lltdsvc,Link-Layer Topology Discovery Mapper,Creates a Network Map  consisting of PC and device topology (connectivity) information  and metadata describing each PC and device.  If this service is disabled  the Network Map will not function properly.,C:\Windows\System32\svchost.exe,f8bab354ff3af5b146e817943d4799c8,C:\Windows\System32\svchost.exe -k LocalService,SERVICE_WIN32_SHARE_PROCESS,C:\Windows\System32\lltdsvc.dll,true,true,The file is signed and the signature was verified.,Microsoft Windows,Microsoft Windows Verification PCA
SE165YTQ,BrUsbSer,Brother MFC USB Serial WDM Driver,,C:\Windows\System32\drivers\BrUsbSer.sys,2f0e886076af407fb7436fcfd90ac168,\SystemRoot\System32\Drivers\BrUsbSer.sys,SERVICE_KERNEL_DRIVER,,true,true,The file is signed and the signature was verified.,Microsoft Windows,Microsoft Windows Verification PCA
SE165YTQ,adpu320,adpu320,,C:\Windows\System32\drivers\adpu320.sys,e2bd66fa0a6a49e08deff88b9856d435,\SystemRoot\system32\drivers\adpu320.sys,SERVICE_KERNEL_DRIVER,,true,true,The file is signed and the signature was verified.,Microsoft Windows,Microsoft Windows Verification PCA
SE165YTQ,amdsbs,amdsbs,,C:\Windows\System32\drivers\amdsbs.sys,55f00d800e958bcf5ab1bc771373e173,\SystemRoot\system32\drivers\amdsbs.sys,SERVICE_KERNEL_DRIVER,,true,true,The file is signed and the signature was verified.,Microsoft Windows,Microsoft Windows Verification PCA
SE165YTQ,AppIDSvc,Application Identity,Determines and verifies the identity of an application. Disabling this service will prevent AppLocker from being enforced.,C:\Windows\System32\svchost.exe,f8bab354ff3af5b146e817943d4799c8,C:\Windows\system32\svchost.exe -k LocalServiceAndNoImpersonation,SERVICE_WIN32_SHARE_PROCESS,C:\Windows\System32\appidsvc.dll,true,true,The file is signed and the signature was verified.,Microsoft Windows,Microsoft Windows Verification PCA
SE165YTQ,wcncsvc,Windows Connect Now - Config Registrar,WCNCSVC hosts the Windows Connect Now Configuration which is Microsoft's Implementation of Wi-Fi Protected Setup (WPS) protocol. This is used to configure Wireless LAN settings for an Access Point (AP) or a Wi-Fi Device. The service is started programmatically as needed.,C:\Windows\System32\svchost.exe,f8bab354ff3af5b146e817943d4799c8,C:\Windows\System32\svchost.exe -k LocalServiceAndNoImpersonation,SERVICE_WIN32_SHARE_PROCESS,C:\Windows\System32\wcncsvc.dll,true,true,The file is signed and the signature was verified.,Microsoft Windows,Microsoft Windows Verification PCA
SE165YTQ,SessionEnv,Remote Desktop Configuration,Remote Desktop Configuration service (RDCS) is responsible for all Remote Desktop Services and Remote Desktop related configuration and session maintenance activities that require SYSTEM context. These include per-session temporary folders  RD themes  and RD certificates.,C:\Windows\System32\svchost.exe,f8bab354ff3af5b146e817943d4799c8,C:\Windows\System32\svchost.exe -k netsvcs,SERVICE_WIN32_SHARE_PROCESS,C:\Windows\System32\SessEnv.dll,true,true,The file is signed and the signature was verified.,Microsoft Windows,Microsoft Windows Verification PCA
SE165YTQ,Ndisuio,NDIS Usermode I/O Protocol,,C:\Windows\System32\drivers\ndisuio.sys,3aa5351235b2daec0f60ca218ea04de0,system32\DRIVERS\ndisuio.sys,SERVICE_KERNEL_DRIVER,,true,true,The file is signed and the signature was verified.,Microsoft Windows,Microsoft Windows Verification PCA
SE165YTQ,RasAuto,Remote Access Auto Connection Manager,Creates a connection to a remote network whenever a program references a remote DNS or NetBIOS name or address.,C:\Windows\System32\svchost.exe,f8bab354ff3af5b146e817943d4799c8,C:\Windows\System32\svchost.exe -k netsvcs,SERVICE_WIN32_SHARE_PROCESS,C:\Windows\System32\rasauto.dll,true,true,The file is signed and the signature was verified.,Microsoft Windows,Microsoft Windows Verification PCA
SE165YTQ,CertPropSvc,Certificate Propagation,Copies user certificates and root certificates from smart cards into the current user's certificate store  detects when a smart card is inserted into a smart card reader  and  if needed  installs the smart card Plug and Play minidriver.,C:\Windows\System32\svchost.exe,f8bab354ff3af5b146e817943d4799c8,C:\Windows\system32\svchost.exe -k netsvcs,SERVICE_WIN32_SHARE_PROCESS,C:\Windows\System32\certprop.dll,true,true,The file is signed and the signature was verified.,Microsoft Windows,Microsoft Windows Verification PCA
SE165YTQ,WudfPf,User Mode Driver Frameworks Platform Driver,,C:\Windows\System32\drivers\WUDFPf.sys,04dfd3228e5da03585f348c0acfa1b1b,system32\drivers\WudfPf.sys,SERVICE_KERNEL_DRIVER,,true,true,The file is signed and the signature was verified.,Microsoft Windows,Microsoft Windows Verification PCA
SE165YTQ,pcmcia,pcmcia,,C:\Windows\System32\drivers\pcmcia.sys,abe1a46ef5a53e2ce60da70664833815,\SystemRoot\system32\drivers\pcmcia.sys,SERVICE_KERNEL_DRIVER,,true,true,The file is signed and the signature was verified.,Microsoft Windows,Microsoft Windows Verification PCA
SE165YTQ,MSPCLOCK,Microsoft Streaming Clock Proxy,,C:\Windows\System32\drivers\mspclock.sys,4421f4442bd66916f7098655ae6f14f2,system32\drivers\MSPCLOCK.sys,SERVICE_KERNEL_DRIVER,,true,true,The file is signed and the signature was verified.,Microsoft Windows,Microsoft Windows Verification PCA
SE165YTQ,wudfsvc,Windows Driver Foundation - User-mode Driver Framework,Manages user-mode driver host processes.,C:\Windows\System32\svchost.exe,f8bab354ff3af5b146e817943d4799c8,C:\Windows\system32\svchost.exe -k LocalSystemNetworkRestricted,SERVICE_WIN32_SHARE_PROCESS,C:\Windows\System32\WUDFSvc.dll,true,true,The file is signed and the signature was verified.,Microsoft Windows,Microsoft Windows Verification PCA
SE165YTQ,KeyIso,CNG Key Isolation,The CNG key isolation service is hosted in the LSA process. The service provides key process isolation to private keys and associated cryptographic operations as required by the Common Criteria. The service stores and uses long-lived keys in a secure process complying with Common Criteria requirements.,C:\Windows\System32\lsass.exe,565754c13f1bdadb261de3d3ba78749c,C:\Windows\system32\lsass.exe,SERVICE_WIN32_SHARE_PROCESS,,true,true,The file is signed and the signature was verified.,Microsoft Windows,Microsoft Windows Verification PCA
SE165YTQ,VaultSvc,Credential Manager,Provides secure storage and retrieval of credentials to users  applications and security service packages.,C:\Windows\System32\lsass.exe,565754c13f1bdadb261de3d3ba78749c,C:\Windows\system32\lsass.exe,SERVICE_WIN32_SHARE_PROCESS,,true,true,The file is signed and the signature was verified.,Microsoft Windows,Microsoft Windows Verification PCA
SE165YTQ,rdpbus,Remote Desktop Device Redirector Bus Driver,,C:\Windows\System32\drivers\rdpbus.sys,ae2b2b81db408b190ccec855a797280a,system32\DRIVERS\rdpbus.sys,SERVICE_KERNEL_DRIVER,,true,true,The file is signed and the signature was verified.,Microsoft Windows,Microsoft Windows Verification PCA
SE165YTQ,ebdrv,Broadcom NetXtreme II 10 GigE VBD,,C:\Windows\System32\drivers\evbda.sys,1558416f33de42d3b6f651fc083ac391,\SystemRoot\system32\drivers\evbda.sys,SERVICE_KERNEL_DRIVER,,true,true,The file is signed and the signature was verified.,Microsoft Windows,Microsoft Windows Verification PCA
SE165YTQ,SamSs,Security Accounts Manager,The startup of this service signals other services that the Security Accounts Manager (SAM) is ready to accept requests.  Disabling this service will prevent other services in the system from being notified when the SAM is ready  which may in turn cause those services to fail to start correctly. This service should not be disabled.,C:\Windows\System32\lsass.exe,565754c13f1bdadb261de3d3ba78749c,C:\Windows\system32\lsass.exe,SERVICE_WIN32_SHARE_PROCESS,,true,true,The file is signed and the signature was verified.,Microsoft Windows,Microsoft Windows Verification PCA
SE165YTQ,WMPNetworkSvc,Windows Media Player Network Sharing Service,Shares Windows Media Player libraries to other networked players and media devices using Universal Plug and Play,C:\Program Files\Windows Media Player\wmpnetwk.exe,5d79afd8b7372e95819076fa0cb94d07,C:\Program Files\Windows Media Player\wmpnetwk.exe,SERVICE_WIN32_OWN_PROCESS,,true,true,The file is signed and the signature was verified.,Microsoft Windows,Microsoft Windows Verification PCA
SE165YTQ,stisvc,Windows Image Acquisition (WIA),Provides image acquisition services for scanners and cameras,C:\Windows\System32\svchost.exe,f8bab354ff3af5b146e817943d4799c8,C:\Windows\system32\svchost.exe -k imgsvc,SERVICE_WIN32_OWN_PROCESS,C:\Windows\System32\wiaservc.dll,true,true,The file is signed and the signature was verified.,Microsoft Windows,Microsoft Windows Verification PCA
SE165YTQ,clr_optimization_v4.0.30319_64,Microsoft .NET Framework NGEN v4.0.30319_X64,Microsoft .NET Framework NGEN,C:\Windows\Microsoft.NET\Framework64\v4.0.30319\mscorsvw.exe,10702f46650074ff6be7bf1a172c2e98,C:\Windows\Microsoft.NET\Framework64\v4.0.30319\mscorsvw.exe,SERVICE_WIN32_OWN_PROCESS,,true,true,The file is signed and the signature was verified.,Microsoft Corporation,Microsoft Code Signing PCA
SE165YTQ,WacomPen,Wacom Serial Pen HID Driver,,C:\Windows\System32\drivers\wacompen.sys,0975be0160076de8da930f4d54d81787,\SystemRoot\system32\drivers\wacompen.sys,SERVICE_KERNEL_DRIVER,,true,true,The file is signed and the signature was verified.,Microsoft Windows,Microsoft Windows Verification PCA
SE165YTQ,Netlogon,Netlogon,Maintains a secure channel between this computer and the domain controller for authenticating users and services. If this service is stopped  the computer may not authenticate users and services and the domain controller cannot register DNS records. If this service is disabled  any services that explicitly depend on it will fail to start.,C:\Windows\System32\lsass.exe,565754c13f1bdadb261de3d3ba78749c,C:\Windows\system32\lsass.exe,SERVICE_WIN32_SHARE_PROCESS,,true,true,The file is signed and the signature was verified.,Microsoft Windows,Microsoft Windows Verification PCA
SE165YTQ,clr_optimization_v2.0.50727_64,Microsoft .NET Framework NGEN v2.0.50727_X64,Microsoft .NET Framework NGEN,C:\Windows\Microsoft.NET\Framework64\v2.0.50727\mscorsvw.exe,1bf97120c1c273eabb63cb4719b0c344,C:\Windows\Microsoft.NET\Framework64\v2.0.50727\mscorsvw.exe,SERVICE_WIN32_OWN_PROCESS,,true,true,The file is signed and the signature was verified.,Microsoft Windows,Microsoft Windows Verification PCA
SE165YTQ,BrFiltLo,Brother USB Mass-Storage Lower Filter Driver,,C:\Windows\System32\drivers\BrFiltLo.sys,496a931a2405361bede2fc2c1b5a3a81,\SystemRoot\system32\drivers\BrFiltLo.sys,SERVICE_KERNEL_DRIVER,,true,true,The file is signed and the signature was verified.,Microsoft Windows,Microsoft Windows Verification PCA
SE165YTQ,amdsata,amdsata,,C:\Windows\System32\drivers\amdsata.sys,738ad31d4587e555fa3a352d253c6060,\SystemRoot\system32\drivers\amdsata.sys,SERVICE_KERNEL_DRIVER,,true,true,The file is signed and the signature was verified.,Microsoft Windows,Microsoft Windows Verification PCA
SE165YTQ,TBS,TPM Base Services,Enables access to the Trusted Platform Module (TPM)  which provides hardware-based cryptographic services to system components and applications.  If this service is stopped or disabled  applications will be unable to use keys protected by the TPM.,C:\Windows\System32\svchost.exe,f8bab354ff3af5b146e817943d4799c8,C:\Windows\System32\svchost.exe -k LocalServiceAndNoImpersonation,SERVICE_WIN32_SHARE_PROCESS,C:\Windows\System32\tbssvc.dll,true,true,The file is signed and the signature was verified.,Microsoft Windows,Microsoft Windows Verification PCA
SE165YTQ,WbioSrvc,Windows Biometric Service,The Windows biometric service gives client applications the ability to capture  compare  manipulate  and store biometric data without gaining direct access to any biometric hardware or samples. The service is hosted in a privileged SVCHOST process.,C:\Windows\System32\svchost.exe,f8bab354ff3af5b146e817943d4799c8,C:\Windows\system32\svchost.exe -k WbioSvcGroup,SERVICE_WIN32_SHARE_PROCESS,C:\Windows\System32\wbiosrvc.dll,true,true,The file is signed and the signature was verified.,Microsoft Windows,Microsoft Windows Verification PCA
SE165YTQ,VgaSave,VgaSave,,C:\Windows\System32\drivers\vga.sys,be6e8e6d7e37b66db0bdc00bc6c96fd4,\SystemRoot\System32\drivers\vga.sys,SERVICE_KERNEL_DRIVER,,true,true,The file is signed and the signature was verified.,Microsoft Windows,Microsoft Windows Verification PCA
SE165YTQ,circlass,Consumer IR Devices,,C:\Windows\System32\drivers\circlass.sys,a1b18e4952c790024da64cd360df3ba9,\SystemRoot\system32\drivers\circlass.sys,SERVICE_KERNEL_DRIVER,,true,true,The file is signed and the signature was verified.,Microsoft Windows,Microsoft Windows Verification PCA
SE165YTQ,srvnet,srvnet,,C:\Windows\System32\drivers\srvnet.sys,f2db1522b53e9ad508be48fbc9bbdb42,System32\DRIVERS\srvnet.sys,SERVICE_FILE_SYSTEM_DRIVER,,true,true,The file is signed and the signature was verified.,Microsoft Windows,Microsoft Windows Verification PCA
SE165YTQ,Netman,Network Connections,Manages objects in the Network and Dial-Up Connections folder  in which you can view both local area network and remote connections.,C:\Windows\System32\svchost.exe,f8bab354ff3af5b146e817943d4799c8,C:\Windows\System32\svchost.exe -k LocalSystemNetworkRestricted,SERVICE_WIN32_SHARE_PROCESS,C:\Windows\System32\netman.dll,true,true,The file is signed and the signature was verified.,Microsoft Windows,Microsoft Windows Verification PCA
SE165YTQ,uagp35,Microsoft AGPv3.5 Filter,,C:\Windows\System32\drivers\UAGP35.SYS,36724527c86f6f602554dd8bddfd4ad6,\SystemRoot\system32\drivers\uagp35.sys,SERVICE_KERNEL_DRIVER,,true,true,The file is signed and the signature was verified.,Microsoft Windows,Microsoft Windows Verification PCA
SE165YTQ,RDPDR,Terminal Server Device Redirector Driver,,C:\Windows\System32\drivers\rdpdr.sys,2491a8b61b2809c2b5c3f7c96be3546c,System32\drivers\rdpdr.sys,SERVICE_KERNEL_DRIVER,,true,true,The file is signed and the signature was verified.,Microsoft Windows,Microsoft Windows Verification PCA
SE165YTQ,Modem,Modem,,C:\Windows\System32\drivers\modem.sys,a66a4fc9a99a101b1ead18ed2c46b56d,system32\drivers\modem.sys,SERVICE_KERNEL_DRIVER,,true,true,The file is signed and the signature was verified.,Microsoft Windows,Microsoft Windows Verification PCA
SE165YTQ,MSTEE,Microsoft Streaming Tee/Sink-to-Sink Converter,,C:\Windows\System32\drivers\mstee.sys,23b9667a972b8213b1d7eaac72c6a008,system32\drivers\MSTEE.sys,SERVICE_KERNEL_DRIVER,,true,true,The file is signed and the signature was verified.,Microsoft Windows,Microsoft Windows Verification PCA
SE165YTQ,RDPENCDD,RDP Encoder Mirror Driver,RDP Encoder Mirror Driver,C:\Windows\System32\drivers\RDPENCDD.sys,d23ff8ea5bd37a57bcd5c077466c3726,system32\drivers\rdpencdd.sys,SERVICE_KERNEL_DRIVER,,true,true,The file is signed and the signature was verified.,Microsoft Windows,Microsoft Windows Verification PCA
SE165YTQ,WinDefend,Windows Defender,Protection against spyware and potentially unwanted software,C:\Windows\System32\svchost.exe,f8bab354ff3af5b146e817943d4799c8,C:\Windows\System32\svchost.exe -k secsvcs,SERVICE_WIN32_SHARE_PROCESS,C:\Program Files\Windows Defender\MpSvc.dll,true,true,The file is signed and the signature was verified.,Microsoft Windows,Microsoft Windows Verification PCA
SE165YTQ,netprofm,Network List Service,Identifies the networks to which the computer has connected  collects and stores properties for these networks  and notifies applications when these properties change.,C:\Windows\System32\svchost.exe,f8bab354ff3af5b146e817943d4799c8,C:\Windows\System32\svchost.exe -k LocalService,SERVICE_WIN32_SHARE_PROCESS,C:\Windows\System32\netprofm.dll,true,true,The file is signed and the signature was verified.,Microsoft Windows,Microsoft Windows Verification PCA
SE165YTQ,mpio,mpio,,C:\Windows\System32\drivers\mpio.sys,e67fd6aff918cc8b8bfec6b2d0130fb9,\SystemRoot\system32\drivers\mpio.sys,SERVICE_KERNEL_DRIVER,,true,true,The file is signed and the signature was verified.,Microsoft Windows,Microsoft Windows Verification PCA
SE165YTQ,rspndr,Link-Layer Topology Discovery Responder,,C:\Windows\System32\drivers\rspndr.sys,b3f459452f7c02e35d398d488fe8bed0,system32\DRIVERS\rspndr.sys,SERVICE_KERNEL_DRIVER,,true,true,The file is signed and the signature was verified.,Microsoft Windows,Microsoft Windows Verification PCA
SE165YTQ,clr_optimization_v2.0.50727_32,Microsoft .NET Framework NGEN v2.0.50727_X86,Microsoft .NET Framework NGEN,C:\Windows\Microsoft.NET\Framework\v2.0.50727\mscorsvw.exe,7fe0e4c3cc53e94d6a4ada9e30bcd844,C:\Windows\Microsoft.NET\Framework\v2.0.50727\mscorsvw.exe,SERVICE_WIN32_OWN_PROCESS,,true,true,The file is signed and the signature was verified.,Microsoft Windows,Microsoft Windows Verification PCA
SE165YTQ,FDResPub,Function Discovery Resource Publication,Publishes this computer and resources attached to this computer so they can be discovered over the network.  If this service is stopped  network resources will no longer be published and they will not be discovered by other computers on the network.,C:\Windows\System32\svchost.exe,f8bab354ff3af5b146e817943d4799c8,C:\Windows\system32\svchost.exe -k LocalServiceAndNoImpersonation,SERVICE_WIN32_SHARE_PROCESS,C:\Windows\System32\FDResPub.dll,true,true,The file is signed and the signature was verified.,Microsoft Windows,Microsoft Windows Verification PCA
SE165YTQ,0062601541359992mcinstcleanup,McAfee Application Installer Cleanup (0062601541359992),,C:\Users\$user\AppData\Local\Temp\0062601541359992mcinst.exe,0b1ee65e06db000cd02ffe969b75fe0c,C:\Users\$user\AppData\Local\Temp\006260~1.EXE -cleanup -nolog,SERVICE_WIN32_OWN_PROCESS,,true,true,The file is signed and the signature was verified.,"McAfee""",VeriSign Class 3 Code Signing 2010 CA
SE165YTQ,BrSerWdm,Brother WDM Serial driver,,C:\Windows\System32\drivers\BrSerWdm.sys,cf170b79140e2d54207dd1eac1dd3d09,\SystemRoot\System32\Drivers\BrSerWdm.sys,SERVICE_KERNEL_DRIVER,,true,true,The file is signed and the signature was verified.,Microsoft Windows,Microsoft Windows Verification PCA
SE165YTQ,tssecsrv,Remote Desktop Services Security Filter Driver,Remote Desktop Services Security Filter Driver,C:\Windows\System32\drivers\tssecsrv.sys,eecbe75340b322b9c8e931f76e4af252,System32\DRIVERS\tssecsrv.sys,SERVICE_KERNEL_DRIVER,,true,true,The file is signed and the signature was verified.,Microsoft Windows,Microsoft Windows Verification PCA
SE165YTQ,usbcir,eHome Infrared Receiver (USBCIR),,C:\Windows\System32\drivers\usbcir.sys,9b8264f655b2c2addc3baa6f9662df52,\SystemRoot\system32\drivers\usbcir.sys,SERVICE_KERNEL_DRIVER,,true,true,The file is signed and the signature was verified.,Microsoft Windows,Microsoft Windows Verification PCA
SE165YTQ,BrFiltUp,Brother USB Mass-Storage Upper Filter Driver,,C:\Windows\System32\drivers\BrFiltUp.sys,6194bff9d06e389f40265d4e3f0c6db0,\SystemRoot\system32\drivers\BrFiltUp.sys,SERVICE_KERNEL_DRIVER,,true,true,The file is signed and the signature was verified.,Microsoft Windows,Microsoft Windows Verification PCA
SE165YTQ,MTConfig,Microsoft Input Configuration Driver,,C:\Windows\System32\drivers\MTConfig.sys,73562ab04885562312a930291bc4b9b4,\SystemRoot\system32\drivers\MTConfig.sys,SERVICE_KERNEL_DRIVER,,true,true,The file is signed and the signature was verified.,Microsoft Windows,Microsoft Windows Verification PCA
