hostname,name,descriptivename,description,path,md5,arguments,type,servicedll,pathsignatureexists,pathsignatureverified,pathsignaturedescription,pathcertificatesubject,pathcertificateissuer
SN0002NZU,scfilter,Smart card PnP Class Filter Driver,Smart card reader filter driver enabling smart card PnP.,C:\Windows\System32\drivers\scfilter.sys,932f71a6b4968e8ed5a1ceecf3ff7f26,System32\DRIVERS\scfilter.sys,SERVICE_KERNEL_DRIVER,,true,true,The file is signed and the signature was verified.,Microsoft Windows,Microsoft Windows Production PCA 2011
SN0002NZU,RasAcd,Remote Access Auto Connection Driver,Remote Access Auto Connection Driver,C:\Windows\System32\drivers\rasacd.sys,f944e2f374b97e58b6200fc71d20f027,System32\DRIVERS\rasacd.sys,SERVICE_KERNEL_DRIVER,,true,true,The file is signed and the signature was verified.,Microsoft Windows,Microsoft Windows Production PCA 2011
SN0002NZU,FDResPub,Function Discovery Resource Publication,Publishes this computer and resources attached to this computer so they can be discovered over the network.  If this service is stopped  network resources will no longer be published and they will not be discovered by other computers on the network.,C:\Windows\System32\svchost.exe,35f85dd31c8b764a6fd60b3b03a0b69d,C:\Windows\system32\svchost.exe -k LocalServiceAndNoImpersonation,SERVICE_WIN32_SHARE_PROCESS,C:\Windows\System32\FDResPub.dll,true,true,The file is signed and the signature was verified.,Microsoft Windows,Microsoft Windows Production PCA 2011
SN0002NZU,MsLbfoProvider,Microsoft Load Balancing/Failover Provider,Microsoft Load Balancing/Failover Provider,C:\Windows\System32\drivers\MsLbfoProvider.sys,5551b0af33b3948a9029ff8ecf9189ba,\SystemRoot\system32\DRIVERS\MsLbfoProvider.sys,SERVICE_KERNEL_DRIVER,,true,true,The file is signed and the signature was verified.,Microsoft Windows,Microsoft Windows Production PCA 2011
SN0002NZU,VMware NAT Service,VMware NAT Service,Network address translation for vir,C:\Windows\SysWOW64\vmnat.exe,77f77050e3fb5313f80e33652466bfa2,C:\WINDOWS\SysWOW64\vmnat.exe,SERVICE_WIN32_OWN_PROCESS,,true,true,The file is signed and the signature was verified.,"VMware""",VeriSign Class 3 Code Signing 2010 CA
SN0002NZU,LSM,Local Session Manager,Core Windows Service that manages local user sessions. Stopping or disabling this service will result in system instability.,C:\Windows\System32\svchost.exe,35f85dd31c8b764a6fd60b3b03a0b69d,C:\Windows\system32\svchost.exe -k DcomLaunch,SERVICE_WIN32_SHARE_PROCESS,C:\Windows\System32\lsm.dll,true,true,The file is signed and the signature was verified.,Microsoft Windows,Microsoft Windows Production PCA 2011
SN0002NZU,IKEEXT,IKE and AuthIP IPsec Keying Modules,The IKEEXT service hosts the Internet Key Exchange (IKE) and Authenticated Internet Protocol (AuthIP) keying modules. These keying modules are used for authentication and key exchange in Internet Protocol security (IPsec). Stopping or disabling the IKEEXT service will disable IKE and AuthIP key exchange with peer computers. IPsec is typically configured to use IKE or AuthIP; therefore  stopping or disabling the IKEEXT service might result in an IPsec failure and might compromise the security of the system. It is strongly recommended that you have the IKEEXT service running.,C:\Windows\System32\svchost.exe,35f85dd31c8b764a6fd60b3b03a0b69d,C:\Windows\system32\svchost.exe -k netsvcs,SERVICE_WIN32_SHARE_PROCESS,C:\Windows\System32\IKEEXT.DLL,true,true,The file is signed and the signature was verified.,Microsoft Windows,Microsoft Windows Production PCA 2011
SN0002NZU,xenfilt,AWS Bus Filter,,C:\Windows\System32\drivers\xenfilt.sys,c7ed29b272913b999ba05944524b40c0,\SystemRoot\system32\DRIVERS\xenfilt.sys,SERVICE_KERNEL_DRIVER,,true,true,The file is signed and the signature was verified.,Microsoft Windows Hardware Compatibility Publisher,Microsoft Windows Hardware Compatibility PCA
SN0002NZU,NdisVirtualBus,Microsoft Virtual Network Adapter Enumerator,,C:\Windows\System32\drivers\NdisVirtualBus.sys,d9b922acaf8419ab3cfb7fe61c690fd7,\SystemRoot\System32\drivers\NdisVirtualBus.sys,SERVICE_KERNEL_DRIVER,,true,true,The file is signed and the signature was verified.,Microsoft Windows,Microsoft Windows Production PCA 2011
SN0002NZU,GPIOClx0101,Microsoft GPIO Class Extension Driver,,C:\Windows\System32\drivers\msgpioclx.sys,29b4562e138693d94f331a931100f9ae,System32\Drivers\msgpioclx.sys,SERVICE_KERNEL_DRIVER,,true,true,The file is signed and the signature was verified.,Microsoft Windows,Microsoft Windows Production PCA 2011
SN0002NZU,mvumis,mvumis,,C:\Windows\System32\drivers\mvumis.sys,ed822879882cae442cfb599934ae9304,\SystemRoot\System32\drivers\mvumis.sys,SERVICE_KERNEL_DRIVER,,true,true,The file is signed and the signature was verified.,Microsoft Windows,Microsoft Windows Production PCA 2011
SN0002NZU,KtmRm,KtmRm for Distributed Transaction Coordinator,Coordinates transactions between the Distributed Transaction Coordinator (MSDTC) and the Kernel Transaction Manager (KTM). If it is not needed  it is recommended that this service remain stopped. If it is needed  both MSDTC and KTM will start this service automatically. If this service is disabled  any MSDTC transaction interacting with a Kernel Resource Manager will fail and any services that explicitly depend on it will fail to start.,C:\Windows\System32\svchost.exe,35f85dd31c8b764a6fd60b3b03a0b69d,C:\Windows\System32\svchost.exe -k NetworkServiceAndNoImpersonation,SERVICE_WIN32_SHARE_PROCESS,C:\Windows\System32\msdtckrm.dll,true,true,The file is signed and the signature was verified.,Microsoft Windows,Microsoft Windows Production PCA 2011
SN0002NZU,PlugPlay,Plug and Play,Enables a computer to recognize and adapt to hardware changes with little or no user input. Stopping or disabling this service will result in system instability.,C:\Windows\System32\svchost.exe,35f85dd31c8b764a6fd60b3b03a0b69d,C:\Windows\system32\svchost.exe -k DcomLaunch,SERVICE_WIN32_SHARE_PROCESS,C:\Windows\System32\umpnpmgr.dll,true,true,The file is signed and the signature was verified.,Microsoft Windows,Microsoft Windows Production PCA 2011
SN0002NZU,CertPropSvc,Certificate Propagation,Copies user certificates and root certificates from smart cards into the current user's certificate store  detects when a smart card is inserted into a smart card reader  and  if needed  installs the smart card Plug and Play minidriver.,C:\Windows\System32\svchost.exe,35f85dd31c8b764a6fd60b3b03a0b69d,C:\Windows\system32\svchost.exe -k netsvcs,SERVICE_WIN32_SHARE_PROCESS,C:\Windows\System32\certprop.dll,true,true,The file is signed and the signature was verified.,Microsoft Windows,Microsoft Windows Production PCA 2011
SN0002NZU,smphost,Microsoft Storage Spaces SMP,Host service for the Microsoft Storage Spaces management provider. If this service is stopped or disabled  Storage Spaces cannot be managed.,C:\Windows\System32\svchost.exe,35f85dd31c8b764a6fd60b3b03a0b69d,C:\Windows\System32\svchost.exe -k smphost,SERVICE_WIN32_OWN_PROCESS,C:\Windows\System32\smphost.dll,true,true,The file is signed and the signature was verified.,Microsoft Windows,Microsoft Windows Production PCA 2011
SN0002NZU,RDPDR,Remote Desktop Device Redirector Driver,Remote Desktop Device Redirector Driver,C:\Windows\System32\drivers\rdpdr.sys,dbd9336063745748cf1204f06410a60d,System32\drivers\rdpdr.sys,SERVICE_KERNEL_DRIVER,,true,true,The file is signed and the signature was verified.,Microsoft Windows,Microsoft Windows Production PCA 2011
SN0002NZU,UI0Detect,Interactive Services Detection,Enables user notification of user input for interactive services  which enables access to dialogs created by interactive services when they appear. If this service is stopped  notifications of new interactive service dialogs will no longer function and there might not be access to interactive service dialogs. If this service is disabled  both notifications of and access to new interactive service dialogs will no longer function.,C:\Windows\System32\UI0Detect.exe,f46313bdbe1a5a0d96b3a5f15eea597f,C:\Windows\system32\UI0Detect.exe,SERVICE_WIN32_OWN_PROCESS,,true,true,The file is signed and the signature was verified.,Microsoft Windows,Microsoft Windows Production PCA 2011
SN0002NZU,luafv,UAC File Virtualization,Virtualizes file write failures to per-user locations.,C:\Windows\System32\drivers\luafv.sys,a1b2fd56264110736dab75dd24ebaa3d,\SystemRoot\system32\drivers\luafv.sys,SERVICE_FILE_SYSTEM_DRIVER,,true,true,The file is signed and the signature was verified.,Microsoft Windows,Microsoft Windows Production PCA 2011
SN0002NZU,PolicyAgent,IPsec Policy Agent,"""Internet Protocol security (IPsec) supports network-level peer authentication  data origin authentication  data integrity  data confidentiality (encryption)  and replay protection.  This service enforces IPsec policies created through the IP Security Policies snap-in or the command-line tool """"netsh ipsec"""".  If you stop this service  you may experience network connectivity issues if your policy requires that connections use IPsec.  Also remote management of Windows Firewall is not available when this service is stopped.""",C:\Windows\System32\svchost.exe,35f85dd31c8b764a6fd60b3b03a0b69d,C:\Windows\system32\svchost.exe -k NetworkServiceNetworkRestricted,SERVICE_WIN32_SHARE_PROCESS,C:\Windows\System32\IPSECSVC.DLL,true,true,The file is signed and the signature was verified.,Microsoft Windows,Microsoft Windows Production PCA 2011
SN0002NZU,SCPolicySvc,Smart Card Removal Policy,Allows the system to be configured to lock the user desktop upon smart card removal.,C:\Windows\System32\svchost.exe,35f85dd31c8b764a6fd60b3b03a0b69d,C:\Windows\system32\svchost.exe -k netsvcs,SERVICE_WIN32_SHARE_PROCESS,C:\Windows\System32\certprop.dll,true,true,The file is signed and the signature was verified.,Microsoft Windows,Microsoft Windows Production PCA 2011
SN0002NZU,hkmsvc,Health Key and Certificate Management,Provides X.509 certificate and key management services for the Network Access Protection Agent (NAPAgent). Enforcement technologies that use X.509 certificates may not function properly without this service,C:\Windows\System32\svchost.exe,35f85dd31c8b764a6fd60b3b03a0b69d,C:\Windows\System32\svchost.exe -k netsvcs,SERVICE_WIN32_SHARE_PROCESS,C:\Windows\System32\KMSVC.DLL,true,true,The file is signed and the signature was verified.,Microsoft Windows,Microsoft Windows Production PCA 2011
SN0002NZU,KeyIso,CNG Key Isolation,The CNG key isolation service is hosted in the LSA process. The service provides key process isolation to private keys and associated cryptographic operations as required by the Common Criteria. The service stores and uses long-lived keys in a secure process complying with Common Criteria requirements.,C:\Windows\System32\lsass.exe,d75affef5f74a1a5e982ca1f60d2f8a3,C:\Windows\system32\lsass.exe,SERVICE_WIN32_SHARE_PROCESS,C:\Windows\System32\keyiso.dll,true,true,The file is signed and the signature was verified.,Microsoft Windows,Microsoft Windows Production PCA 2011
SN0002NZU,AmdPPM,AMD Processor Driver,,C:\Windows\System32\drivers\amdppm.sys,4d11196fc1edf7f565bfe452529a74c9,\SystemRoot\System32\drivers\amdppm.sys,SERVICE_KERNEL_DRIVER,,true,true,The file is signed and the signature was verified.,Microsoft Windows,Microsoft Windows Production PCA 2011
SN0002NZU,vmicvss,Hyper-V Volume Shadow Copy Requestor,Coordinates the communications that are required to use Volume Shadow Copy Service to back up applications and data on this virtual machine from the operating system on the physical computer.,C:\Windows\System32\svchost.exe,35f85dd31c8b764a6fd60b3b03a0b69d,C:\Windows\system32\svchost.exe -k LocalSystemNetworkRestricted,SERVICE_WIN32_SHARE_PROCESS,C:\Windows\System32\icsvc.dll,true,true,The file is signed and the signature was verified.,Microsoft Windows,Microsoft Windows Production PCA 2011
SN0002NZU,AppReadiness,App Readiness,Gets apps ready for use the first time a user signs in to this PC and when adding new apps.,C:\Windows\System32\svchost.exe,35f85dd31c8b764a6fd60b3b03a0b69d,C:\Windows\System32\svchost.exe -k AppReadiness,SERVICE_WIN32_SHARE_PROCESS,C:\Windows\System32\AppReadiness.dll,true,true,The file is signed and the signature was verified.,Microsoft Windows,Microsoft Windows Production PCA 2011
SN0002NZU,swprv,Microsoft Software Shadow Copy Provider,Manages software-based volume shadow copies taken by the Volume Shadow Copy service. If this service is stopped  software-based volume shadow copies cannot be managed. If this service is disabled  any services that explicitly depend on it will fail to start.,C:\Windows\System32\svchost.exe,35f85dd31c8b764a6fd60b3b03a0b69d,C:\Windows\System32\svchost.exe -k swprv,SERVICE_WIN32_OWN_PROCESS,C:\Windows\System32\swprv.dll,true,true,The file is signed and the signature was verified.,Microsoft Windows,Microsoft Windows Production PCA 2011
SN0002NZU,sermouse,Serial Mouse Driver,,C:\Windows\System32\drivers\sermouse.sys,93c60a303ac92b1c3eb188c04db7ae2d,\SystemRoot\System32\drivers\sermouse.sys,SERVICE_KERNEL_DRIVER,,true,true,The file is signed and the signature was verified.,Microsoft Windows,Microsoft Windows Production PCA 2011
SN0002NZU,CmBatt,Microsoft ACPI Control Method Battery Driver,,C:\Windows\System32\drivers\CmBatt.sys,d63a739a84a5ca7d1ee8a7a80652f327,\SystemRoot\System32\drivers\CmBatt.sys,SERVICE_KERNEL_DRIVER,,true,true,The file is signed and the signature was verified.,Microsoft Windows,Microsoft Windows Production PCA 2011
SN0002NZU,amdxata,amdxata,,C:\Windows\System32\drivers\amdxata.sys,0ec2e830fd9d4f751557e05a5dbbdac8,\SystemRoot\System32\drivers\amdxata.sys,SERVICE_KERNEL_DRIVER,,true,true,The file is signed and the signature was verified.,Microsoft Windows,Microsoft Windows Production PCA 2011
SN0002NZU,3ware,3ware,,C:\Windows\System32\drivers\3ware.sys,95fbe260254a1a827d582d53a2d68600,\SystemRoot\System32\drivers\3ware.sys,SERVICE_KERNEL_DRIVER,,true,true,The file is signed and the signature was verified.,Microsoft Windows,Microsoft Windows Production PCA 2011
SN0002NZU,USBHUB3,SuperSpeed Hub,,C:\Windows\System32\drivers\USBHUB3.SYS,d297259eae6df63cdd8e03bc3529579c,\SystemRoot\System32\drivers\UsbHub3.sys,SERVICE_KERNEL_DRIVER,,true,true,The file is signed and the signature was verified.,Microsoft Windows,Microsoft Windows Production PCA 2011
SN0002NZU,ebdrv,Broadcom NetXtreme II 10 GigE VBD,,C:\Windows\System32\drivers\evbda.sys,5bf0a0519c068c42581be9a50fd1d5f9,\SystemRoot\System32\drivers\evbda.sys,SERVICE_KERNEL_DRIVER,,true,true,The file is signed and the signature was verified.,Microsoft Windows,Microsoft Windows Production PCA 2011
SN0002NZU,PptpMiniport,WAN Miniport (PPTP),WAN Miniport (PPTP),C:\Windows\System32\drivers\raspptp.sys,5ca06754cd33eabfae285ede6234cd96,\SystemRoot\System32\drivers\raspptp.sys,SERVICE_KERNEL_DRIVER,,true,true,The file is signed and the signature was verified.,Microsoft Windows,Microsoft Windows Production PCA 2011
SN0002NZU,VSS,Volume Shadow Copy,Manages and implements Volume Shadow Copies used for backup and other purposes. If this service is stopped  shadow copies will be unavailable for backup and the backup may fail. If this service is disabled  any services that explicitly depend on it will fail to start.,C:\Windows\System32\VSSVC.exe,5aff50d338f48e913522d748a9ce67c0,C:\Windows\system32\vssvc.exe,SERVICE_WIN32_OWN_PROCESS,,true,true,The file is signed and the signature was verified.,Microsoft Windows,Microsoft Windows Production PCA 2011
SN0002NZU,HyperVideo,HyperVideo,,C:\Windows\System32\drivers\HyperVideo.sys,2ec8c4e8666aee7f4093d0aa6082e424,\SystemRoot\system32\DRIVERS\HyperVideo.sys,SERVICE_KERNEL_DRIVER,,true,true,The file is signed and the signature was verified.,Microsoft Windows,Microsoft Windows Production PCA 2011
SN0002NZU,SstpSvc,Secure Socket Tunneling Protocol Service,Provides support for the Secure Socket Tunneling Protocol (SSTP) to connect to remote computers using VPN. If this service is disabled  users will not be able to use SSTP to access remote servers.,C:\Windows\System32\svchost.exe,35f85dd31c8b764a6fd60b3b03a0b69d,C:\Windows\system32\svchost.exe -k LocalService,SERVICE_WIN32_SHARE_PROCESS,C:\Windows\System32\sstpsvc.dll,true,true,The file is signed and the signature was verified.,Microsoft Windows,Microsoft Windows Production PCA 2011
SN0002NZU,storvsp,storvsp,,C:\Windows\System32\drivers\storvsp.sys,a11358b45ba7bbf5ca760cb0b195b8a9,\SystemRoot\System32\drivers\storvsp.sys,SERVICE_KERNEL_DRIVER,,true,true,The file is signed and the signature was verified.,Microsoft Windows,Microsoft Windows Production PCA 2011
SN0002NZU,EFS,Encrypting File System (EFS),Provides the core file encryption technology used to store encrypted files on NTFS file system volumes. If this service is stopped or disabled  applications will be unable to access encrypted files.,C:\Windows\System32\lsass.exe,d75affef5f74a1a5e982ca1f60d2f8a3,C:\Windows\System32\lsass.exe,SERVICE_WIN32_SHARE_PROCESS,C:\Windows\System32\efssvc.dll,true,true,The file is signed and the signature was verified.,Microsoft Windows,Microsoft Windows Production PCA 2011
SN0002NZU,WmiAcpi,Microsoft Windows Management Interface for ACPI,,C:\Windows\System32\drivers\wmiacpi.sys,36747d84710ccbf0f84c6515b83d25b5,\SystemRoot\System32\drivers\wmiacpi.sys,SERVICE_KERNEL_DRIVER,,true,true,The file is signed and the signature was verified.,Microsoft Windows,Microsoft Windows Production PCA 2011
SN0002NZU,flpydisk,Floppy Disk Driver,,C:\Windows\System32\drivers\flpydisk.sys,272f550872077cdd388458ab831f9474,\SystemRoot\System32\drivers\flpydisk.sys,SERVICE_KERNEL_DRIVER,,true,true,The file is signed and the signature was verified.,Microsoft Windows,Microsoft Windows Production PCA 2011
SN0002NZU,WinVerbs,WinVerbs Service,,C:\Windows\System32\drivers\winverbs.sys,fb2fb03694643b5b89ae8397b9978311,\SystemRoot\System32\drivers\winverbs.sys,SERVICE_KERNEL_DRIVER,,true,true,The file is signed and the signature was verified.,Microsoft Windows,Microsoft Windows Production PCA 2011
SN0002NZU,Dhcp,DHCP Client,Registers and updates IP addresses and DNS records for this computer. If this service is stopped  this computer will not receive dynamic IP addresses and DNS updates. If this service is disabled  any services that explicitly depend on it will fail to start.,C:\Windows\System32\svchost.exe,35f85dd31c8b764a6fd60b3b03a0b69d,C:\Windows\system32\svchost.exe -k LocalServiceNetworkRestricted,SERVICE_WIN32_SHARE_PROCESS,C:\Windows\System32\dhcpcore.dll,true,true,The file is signed and the signature was verified.,Microsoft Windows,Microsoft Windows Production PCA 2011
SN0002NZU,DsmSvc,Device Setup Manager,Enables the detection  download and installation of device-related software. If this service is disabled  devices may be configured with outdated software  and may not work correctly.,C:\Windows\System32\svchost.exe,35f85dd31c8b764a6fd60b3b03a0b69d,C:\Windows\system32\svchost.exe -k netsvcs,SERVICE_WIN32_SHARE_PROCESS,C:\Windows\System32\DeviceSetupManager.dll,true,true,The file is signed and the signature was verified.,Microsoft Windows,Microsoft Windows Production PCA 2011
SN0002NZU,KSecPkg,KSecPkg,,C:\Windows\System32\drivers\ksecpkg.sys,5e3ef4b01c1f008bf71cc46d9a75053b,\SystemRoot\System32\Drivers\ksecpkg.sys,SERVICE_KERNEL_DRIVER,,true,true,The file is signed and the signature was verified.,Microsoft Windows,Microsoft Windows Production PCA 2011
SN0002NZU,TapiSrv,Telephony,Provides Telephony API (TAPI) support for programs that control telephony devices on the local computer and  through the LAN  on servers that are also running the service.,C:\Windows\System32\svchost.exe,35f85dd31c8b764a6fd60b3b03a0b69d,C:\Windows\System32\svchost.exe -k tapisrv,SERVICE_WIN32_OWN_PROCESS,C:\Windows\System32\tapisrv.dll,true,true,The file is signed and the signature was verified.,Microsoft Windows,Microsoft Windows Production PCA 2011
SN0002NZU,Filetrace,Filetrace,ETW File Trace Filter,C:\Windows\System32\drivers\filetrace.sys,a0503352fb7627208bd648a69bd23010,system32\drivers\filetrace.sys,SERVICE_FILE_SYSTEM_DRIVER,,true,true,The file is signed and the signature was verified.,Microsoft Windows,Microsoft Windows Production PCA 2011
SN0002NZU,wudfsvc,Windows Driver Foundation - User-mode Driver Framework,Creates and manages user-mode driver processes. This service cannot be stopped.,C:\Windows\System32\svchost.exe,35f85dd31c8b764a6fd60b3b03a0b69d,C:\Windows\system32\svchost.exe -k LocalSystemNetworkRestricted,SERVICE_WIN32_SHARE_PROCESS,C:\Windows\System32\WUDFSvc.dll,true,true,The file is signed and the signature was verified.,Microsoft Windows,Microsoft Windows Production PCA 2011
SN0002NZU,RdpVideoMiniport,Remote Desktop Video Miniport Driver,,C:\Windows\System32\drivers\rdpvideominiport.sys,0ac963ba94b5d5d2fa4500581b13ce69,System32\drivers\rdpvideominiport.sys,SERVICE_KERNEL_DRIVER,,true,true,The file is signed and the signature was verified.,Microsoft Windows,Microsoft Windows Production PCA 2011
SN0002NZU,AppID,AppID Driver,Identifies an application and enforces software restriction policies.,C:\Windows\System32\drivers\appid.sys,591b5e2c81e75cb5a5423db9a18cd456,\SystemRoot\system32\drivers\appid.sys,SERVICE_KERNEL_DRIVER,,true,true,The file is signed and the signature was verified.,Microsoft Windows,Microsoft Windows Production PCA 2011
SN0002NZU,tunnel,Microsoft Tunnel Miniport Adapter Driver,,C:\Windows\System32\drivers\tunnel.sys,426be82eade69b56d5e1cbcf62903d51,\SystemRoot\system32\DRIVERS\tunnel.sys,SERVICE_KERNEL_DRIVER,,true,true,The file is signed and the signature was verified.,Microsoft Windows,Microsoft Windows Production PCA 2011
SN0002NZU,volsnap,Storage volumes,,C:\Windows\System32\drivers\volsnap.sys,a7a322ce1fb34f5f760a652f21fdb273,\SystemRoot\System32\drivers\volsnap.sys,SERVICE_KERNEL_DRIVER,,true,true,The file is signed and the signature was verified.,Microsoft Windows,Microsoft Windows Production PCA 2011
SN0002NZU,VMnetUserif,VMware Virtual Ethernet Userif for VMnet,VMware Virtual Ethernet Userif for VMnet,C:\Windows\System32\drivers\vmnetuserif.sys,ecd95de99193c632f862f32415426b4c,\SystemRoot\system32\DRIVERS\vmnetuserif.sys,SERVICE_KERNEL_DRIVER,,true,true,The file is signed and the signature was verified.,Microsoft Windows Hardware Compatibility Publisher,Microsoft Windows Hardware Compatibility PCA
SN0002NZU,VSTXRAID,VIA StorX Storage RAID Controller Windows Driver,,C:\Windows\System32\drivers\VSTXRAID.SYS,a3da7b6b39691ebc061b9c5a63db9689,\SystemRoot\System32\drivers\vstxraid.sys,SERVICE_KERNEL_DRIVER,,true,true,The file is signed and the signature was verified.,Microsoft Windows,Microsoft Windows Production PCA 2011
SN0002NZU,TsUsbGD,Remote Desktop Generic USB Device,,C:\Windows\System32\drivers\TsUsbGD.sys,ff0bf15ee32e9a218cbb27c9c0b2e175,\SystemRoot\System32\drivers\TsUsbGD.sys,SERVICE_KERNEL_DRIVER,,true,true,The file is signed and the signature was verified.,Microsoft Windows,Microsoft Windows Production PCA 2011
SN0002NZU,Modem,Modem,,C:\Windows\System32\drivers\modem.sys,55d713098cabab23d32e9cf338eb1be4,system32\drivers\modem.sys,SERVICE_KERNEL_DRIVER,,true,true,The file is signed and the signature was verified.,Microsoft Windows,Microsoft Windows Production PCA 2011
SN0002NZU,AcpiPmi,ACPI Power Meter Driver,,C:\Windows\System32\drivers\acpipmi.sys,f22de304494f251858cc62dd01f8d2d5,\SystemRoot\System32\drivers\acpipmi.sys,SERVICE_KERNEL_DRIVER,,true,true,The file is signed and the signature was verified.,Microsoft Windows,Microsoft Windows Production PCA 2011
SN0002NZU,wuauserv,Windows Update,Enables the detection  download  and installation of updates for Windows and other programs. If this service is disabled  users of this computer will not be able to use Windows Update or its automatic updating feature  and programs will not be able to use the Windows Update Agent (WUA) API.,C:\Windows\System32\svchost.exe,35f85dd31c8b764a6fd60b3b03a0b69d,C:\Windows\system32\svchost.exe -k netsvcs,SERVICE_WIN32_SHARE_PROCESS,C:\Windows\System32\wuaueng.dll,true,true,The file is signed and the signature was verified.,Microsoft Windows,Microsoft Windows Production PCA 2011
SN0002NZU,hwpolicy,Hardware Policy Driver,Contains Processor and other policies,C:\Windows\System32\drivers\hwpolicy.sys,dd081799783096ea6081de54226a39d4,\SystemRoot\System32\drivers\hwpolicy.sys,SERVICE_KERNEL_DRIVER,,true,true,The file is signed and the signature was verified.,Microsoft Windows,Microsoft Windows Production PCA 2011
SN0002NZU,VerifierExt,VerifierExt,,C:\Windows\System32\drivers\VerifierExt.sys,da92145e30eb9e56949dd94d6b299f0e,system32\drivers\VerifierExt.sys,SERVICE_KERNEL_DRIVER,,true,true,The file is signed and the signature was verified.,Microsoft Windows,Microsoft Windows Production PCA 2011
SN0002NZU,arcsas,Adaptec SAS/SATA-II RAID Storport's Miniport Driver,,C:\Windows\System32\drivers\arcsas.sys,3438606dba8d29e1debff9d5950ba279,\SystemRoot\System32\drivers\arcsas.sys,SERVICE_KERNEL_DRIVER,,true,true,The file is signed and the signature was verified.,Microsoft Windows,Microsoft Windows Production PCA 2011
SN0002NZU,monitor,Microsoft Monitor Class Function Driver Service,,C:\Windows\System32\drivers\monitor.sys,3514bb67484772e324255671797de933,\SystemRoot\System32\drivers\monitor.sys,SERVICE_KERNEL_DRIVER,,true,true,The file is signed and the signature was verified.,Microsoft Windows,Microsoft Windows Production PCA 2011
SN0002NZU,Themes,Themes,Provides user experience theme management.,C:\Windows\System32\svchost.exe,35f85dd31c8b764a6fd60b3b03a0b69d,C:\Windows\System32\svchost.exe -k netsvcs,SERVICE_WIN32_SHARE_PROCESS,C:\Windows\System32\themeservice.dll,true,true,The file is signed and the signature was verified.,Microsoft Windows,Microsoft Windows Production PCA 2011
