hostname,name,descriptivename,description,path,md5,arguments,type,servicedll,pathsignatureexists,pathsignatureverified,pathsignaturedescription,pathcertificatesubject,pathcertificateissuer
SN0002NZU,MSDTC,Distributed Transaction Coordinator,Coordinates transactions that span multiple resource managers  such as databases  message queues  and file systems. If this service is stopped  these transactions will fail. If this service is disabled  any services that explicitly depend on it will fail to start.,C:\Windows\System32\msdtc.exe,5f4c497f1b50360da3ccca0dab86dba1,C:\Windows\System32\msdtc.exe,SERVICE_WIN32_OWN_PROCESS,,true,true,The file is signed and the signature was verified.,Microsoft Windows,Microsoft Windows Production PCA 2011
SN0002NZU,ksthunk,Kernel Streaming Thunks,,C:\Windows\System32\drivers\ksthunk.sys,0bf547d7462109900b7ba286d39c8ca4,\SystemRoot\system32\drivers\ksthunk.sys,SERVICE_KERNEL_DRIVER,,true,true,The file is signed and the signature was verified.,Microsoft Windows,Microsoft Windows Production PCA 2011
SN0002NZU,usbuhci,Microsoft USB Universal Host Controller Miniport Driver,,C:\Windows\System32\drivers\usbuhci.sys,33cf86d47fee84e9b5bcbbc8188e5fbd,\SystemRoot\System32\drivers\usbuhci.sys,SERVICE_KERNEL_DRIVER,,true,true,The file is signed and the signature was verified.,Microsoft Windows,Microsoft Windows Production PCA 2011
SN0002NZU,seclogon,Secondary Logon,Enables starting processes under alternate credentials. If this service is stopped  this type of logon access will be unavailable. If this service is disabled  any services that explicitly depend on it will fail to start.,C:\Windows\System32\svchost.exe,35f85dd31c8b764a6fd60b3b03a0b69d,C:\Windows\system32\svchost.exe -k netsvcs,SERVICE_WIN32_SHARE_PROCESS,C:\Windows\System32\seclogon.dll,true,true,The file is signed and the signature was verified.,Microsoft Windows,Microsoft Windows Production PCA 2011
SN0002NZU,cht4vbd,Chelsio T4 Virtual Bus Driver,,C:\Windows\System32\drivers\cht4vx64.sys,71e563b88fb0cd2e75a14115725ece02,\SystemRoot\System32\drivers\cht4vx64.sys,SERVICE_KERNEL_DRIVER,,true,true,The file is signed and the signature was verified.,Microsoft Windows,Microsoft Windows Production PCA 2011
SN0002NZU,VMnetBridge,VMware Bridge Protocol,VMware Bridge Protocol,C:\Windows\System32\drivers\vmnetbridge.sys,8cd3f0217598346787be4af8709435b3,\SystemRoot\system32\DRIVERS\vmnetbridge.sys,SERVICE_KERNEL_DRIVER,,true,true,The file is signed and the signature was verified.,Microsoft Windows Hardware Compatibility Publisher,Microsoft Windows Hardware Compatibility PCA
SN0002NZU,bfadi,bfadi,,C:\Windows\System32\drivers\bfadi.sys,392bc0d828cae788885d7e9644be9888,\SystemRoot\System32\drivers\bfadi.sys,SERVICE_KERNEL_DRIVER,,true,true,The file is signed and the signature was verified.,Microsoft Windows,Microsoft Windows Production PCA 2011
SN0002NZU,viaide,viaide,,C:\Windows\System32\drivers\viaide.sys,70224c8d1b63affe2ad9db3a167d9500,\SystemRoot\System32\drivers\viaide.sys,SERVICE_KERNEL_DRIVER,,true,true,The file is signed and the signature was verified.,Microsoft Windows,Microsoft Windows Production PCA 2011
SN0002NZU,ADP80XX,ADP80XX,,C:\Windows\System32\drivers\adp80xx.sys,e11e0fbc037a1cef3fbd00181e047049,\SystemRoot\System32\drivers\ADP80XX.SYS,SERVICE_KERNEL_DRIVER,,true,true,The file is signed and the signature was verified.,Microsoft Windows,Microsoft Windows Production PCA 2011
SN0002NZU,Browser,Computer Browser,Maintains an updated list of computers on the network and supplies this list to computers designated as browsers. If this service is stopped  this list will not be updated or maintained. If this service is disabled  any services that explicitly depend on it will fail to start.,C:\Windows\System32\svchost.exe,35f85dd31c8b764a6fd60b3b03a0b69d,C:\Windows\System32\svchost.exe -k netsvcs,SERVICE_WIN32_SHARE_PROCESS,C:\Windows\System32\browser.dll,true,true,The file is signed and the signature was verified.,Microsoft Windows,Microsoft Windows Production PCA 2011
SN0002NZU,VMUSBArbService,VMware USB Arbitration Service,Arbitration and enumeration of USB devices for virtual machines,C:\Program Files (x86)\Common Files\VMware\USB\vmware-usbarbitrator64.exe,2b8301f2b0ebd9389200e38ec6f26eae,C:\Program Files (x86)\Common Files\VMware\USB\vmware-usbarbitrator64.exe,SERVICE_WIN32_OWN_PROCESS,,true,true,The file is signed and the signature was verified.,"""VMware",VeriSign Class 3 Code Signing 2010 CA
SN0002NZU,umbus,UMBus Enumerator Driver,,C:\Windows\System32\drivers\umbus.sys,fd0eee4556dbea647b29c469c9961b4f,\SystemRoot\System32\drivers\umbus.sys,SERVICE_KERNEL_DRIVER,,true,true,The file is signed and the signature was verified.,Microsoft Windows,Microsoft Windows Production PCA 2011
SN0002NZU,hyperkbd,hyperkbd,,C:\Windows\System32\drivers\hyperkbd.sys,63e32db94a42cf355fdbc3e671811bf3,\SystemRoot\System32\drivers\hyperkbd.sys,SERVICE_KERNEL_DRIVER,,true,true,The file is signed and the signature was verified.,Microsoft Windows,Microsoft Windows Production PCA 2011
SN0002NZU,mountmgr,Mount Point Manager,Driver responsible with maintaining persistent drive letters and names for volumes,C:\Windows\System32\drivers\mountmgr.sys,0cd70875547d0af4682db9ea575476e5,\SystemRoot\System32\drivers\mountmgr.sys,SERVICE_KERNEL_DRIVER,,true,true,The file is signed and the signature was verified.,Microsoft Windows,Microsoft Windows Production PCA 2011
SN0002NZU,RDPDR,Remote Desktop Device Redirector Driver,Remote Desktop Device Redirector Driver,C:\Windows\System32\drivers\rdpdr.sys,bf44b99c766a1268c5d52ca5dff8dd92,System32\drivers\rdpdr.sys,SERVICE_KERNEL_DRIVER,,true,true,The file is signed and the signature was verified.,Microsoft Windows,Microsoft Windows Production PCA 2011
SN0002NZU,WFPLWFS,Microsoft Windows Filtering Platform,Microsoft Windows Filtering Platform,C:\Windows\System32\drivers\wfplwfs.sys,5090ef0c624b213b7effcbe46f82b27d,\SystemRoot\system32\DRIVERS\wfplwfs.sys,SERVICE_KERNEL_DRIVER,,true,true,The file is signed and the signature was verified.,Microsoft Windows,Microsoft Windows Production PCA 2011
SN0002NZU,RpcEptMapper,RPC Endpoint Mapper,Resolves RPC interfaces identifiers to transport endpoints. If this service is stopped or disabled  programs using Remote Procedure Call (RPC) services will not function properly.,C:\Windows\System32\svchost.exe,35f85dd31c8b764a6fd60b3b03a0b69d,C:\Windows\system32\svchost.exe -k RPCSS,SERVICE_WIN32_SHARE_PROCESS,C:\Windows\System32\RpcEpMap.dll,true,true,The file is signed and the signature was verified.,Microsoft Windows,Microsoft Windows Production PCA 2011
SN0002NZU,EventLog,Windows Event Log,This service manages events and event logs. It supports logging events  querying events  subscribing to events  archiving event logs  and managing event metadata. It can display events in both XML and plain text format. Stopping this service may compromise security and reliability of the system.,C:\Windows\System32\svchost.exe,35f85dd31c8b764a6fd60b3b03a0b69d,C:\Windows\System32\svchost.exe -k LocalServiceNetworkRestricted,SERVICE_WIN32_SHARE_PROCESS,,true,true,The file is signed and the signature was verified.,Microsoft Windows,Microsoft Windows Production PCA 2011
SN0002NZU,NcaSvc,Network Connectivity Assistant,Provides DirectAccess status notification for UI components,C:\Windows\System32\svchost.exe,35f85dd31c8b764a6fd60b3b03a0b69d,C:\Windows\System32\svchost.exe -k NetSvcs,SERVICE_WIN32_SHARE_PROCESS,C:\Windows\System32\NcaSvc.dll,true,true,The file is signed and the signature was verified.,Microsoft Windows,Microsoft Windows Production PCA 2011
SN0002NZU,Serial,Serial port driver,,C:\Windows\System32\drivers\serial.sys,87d63e1a0c2d287c72fb9caa322239c1,\SystemRoot\System32\drivers\serial.sys,SERVICE_KERNEL_DRIVER,,true,true,The file is signed and the signature was verified.,Microsoft Windows,Microsoft Windows Production PCA 2011
SN0002NZU,VMnetDHCP,VMware DHCP Service,DHCP service for vir,C:\Windows\SysWOW64\vmnetdhcp.exe,8318424e4ee0700b6862fd1c5978af54,C:\WINDOWS\SysWOW64\vmnetdhcp.exe,SERVICE_WIN32_OWN_PROCESS,,true,true,The file is signed and the signature was verified.,"VMware""",VeriSign Class 3 Code Signing 2010 CA
SN0002NZU,SharedAccess,Internet Connection Sharing (ICS),Provides network address translation  addressing  name resolution and/or intrusion prevention services for a home or small office network.,C:\Windows\System32\svchost.exe,35f85dd31c8b764a6fd60b3b03a0b69d,C:\Windows\System32\svchost.exe -k netsvcs,SERVICE_WIN32_SHARE_PROCESS,C:\Windows\System32\ipnathlp.dll,true,true,The file is signed and the signature was verified.,Microsoft Windows,Microsoft Windows Production PCA 2011
SN0002NZU,WacomPen,Wacom Serial Pen HID Driver,,C:\Windows\System32\drivers\wacompen.sys,2fd3fe79428ec7e3fb1583064d45b2fa,\SystemRoot\System32\drivers\wacompen.sys,SERVICE_KERNEL_DRIVER,,true,true,The file is signed and the signature was verified.,Microsoft Windows,Microsoft Windows Production PCA 2011
SN0002NZU,WSService,Windows Store Service (WSService),Provides infrastructure support for Windows Store.This service is started on demand and if disabled applications bought using Windows Store will not behave correctly.,C:\Windows\System32\svchost.exe,35f85dd31c8b764a6fd60b3b03a0b69d,C:\Windows\System32\svchost.exe -k wsappx,SERVICE_WIN32_SHARE_PROCESS,C:\Windows\System32\WSService.dll,true,true,The file is signed and the signature was verified.,Microsoft Windows,Microsoft Windows Production PCA 2011
SN0002NZU,vds,Virtual Disk,Provides management services for disks  volumes  file systems  and storage arrays.,C:\Windows\System32\vds.exe,9d4a6d3eb2add5081c4590de0ad72574,C:\Windows\System32\vds.exe,SERVICE_WIN32_OWN_PROCESS,,true,true,The file is signed and the signature was verified.,Microsoft Windows,Microsoft Windows Production PCA 2011
SN0002NZU,msisadrv,msisadrv,,C:\Windows\System32\drivers\msisadrv.sys,1ee5a6fd451a142eaa727ce90b730cd8,\SystemRoot\System32\drivers\msisadrv.sys,SERVICE_KERNEL_DRIVER,,true,true,The file is signed and the signature was verified.,Microsoft Windows,Microsoft Windows Production PCA 2011
SN0002NZU,MsBridge,Microsoft MAC Bridge,Microsoft MAC Bridge,C:\Windows\System32\drivers\bridge.sys,fd14efd4cbf4f0e5ae003725b0de9e40,\SystemRoot\system32\DRIVERS\bridge.sys,SERVICE_KERNEL_DRIVER,,true,true,The file is signed and the signature was verified.,Microsoft Windows,Microsoft Windows Production PCA 2011
SN0002NZU,USBSTOR,USB Mass Storage Driver,,C:\Windows\System32\drivers\USBSTOR.SYS,426ebfa9d9b2362f0a2abb2475f74b00,\SystemRoot\System32\drivers\USBSTOR.SYS,SERVICE_KERNEL_DRIVER,,true,true,The file is signed and the signature was verified.,Microsoft Windows,Microsoft Windows Production PCA 2011
SN0002NZU,b06bdrv,Broadcom NetXtreme II VBD,,C:\Windows\System32\drivers\bxvbda.sys,b7e1c8bb4fb20c9b85fb8f2d22adcdc9,\SystemRoot\System32\drivers\bxvbda.sys,SERVICE_KERNEL_DRIVER,,true,true,The file is signed and the signature was verified.,Microsoft Windows,Microsoft Windows Production PCA 2011
SN0002NZU,pciide,pciide,,C:\Windows\System32\drivers\pciide.sys,e9d5e4bc4d8d87a545d13b4ab81734cf,\SystemRoot\System32\drivers\pciide.sys,SERVICE_KERNEL_DRIVER,,true,true,The file is signed and the signature was verified.,Microsoft Windows,Microsoft Windows Production PCA 2011
SN0002NZU,RSoPProv,Resultant Set of Policy Provider,Provides a network service that processes requests to simulate application of Group Policy settings for a target user or computer in various situations and computes the Resultant Set of Policy settings.,C:\Windows\System32\rsopprov.exe,2a865280714c0d0854560ab33618c0d4,C:\Windows\system32\RSoPProv.exe,SERVICE_WIN32_SHARE_PROCESS,,true,true,The file is signed and the signature was verified.,Microsoft Windows,Microsoft Windows Production PCA 2011
SN0002NZU,vxn,Intel(R) 10G Virtual Network Connection,,C:\Windows\System32\drivers\vxn64x64.sys,76f8b90a38d5a112104b5d929f4b9e5d,\SystemRoot\system32\DRIVERS\vxn64x64.sys,SERVICE_KERNEL_DRIVER,,true,true,The file is signed and the signature was verified.,Microsoft Windows Hardware Compatibility Publisher,Microsoft Windows Third Party Component CA 2012
SN0002NZU,Netman,Network Connections,Manages objects in the Network and Dial-Up Connections folder  in which you can view both local area network and remote connections.,C:\Windows\System32\svchost.exe,35f85dd31c8b764a6fd60b3b03a0b69d,C:\Windows\System32\svchost.exe -k LocalSystemNetworkRestricted,SERVICE_WIN32_SHARE_PROCESS,C:\Windows\System32\netman.dll,true,true,The file is signed and the signature was verified.,Microsoft Windows,Microsoft Windows Production PCA 2011
SN0002NZU,DcomLaunch,DCOM Server Process Launcher,The DCOMLAUNCH service launches COM and DCOM servers in response to object activation requests. If this service is stopped or disabled  programs using COM or DCOM will not function properly. It is strongly recommended that you have the DCOMLAUNCH service running.,C:\Windows\System32\svchost.exe,35f85dd31c8b764a6fd60b3b03a0b69d,C:\Windows\system32\svchost.exe -k DcomLaunch,SERVICE_WIN32_SHARE_PROCESS,C:\Windows\System32\rpcss.dll,true,true,The file is signed and the signature was verified.,Microsoft Windows,Microsoft Windows Production PCA 2011
SN0002NZU,IPMIDRV,IPMIDRV,,C:\Windows\System32\drivers\IPMIDrv.sys,063a05fdbf8d610618feb51f9053157e,\SystemRoot\System32\drivers\IPMIDrv.sys,SERVICE_KERNEL_DRIVER,,true,true,The file is signed and the signature was verified.,Microsoft Windows,Microsoft Windows Production PCA 2011
SN0002NZU,FontCache3.0.0.0,Windows Presentation Foundation Font Cache 3.0.0.0,Optimizes performance of Windows Presentation Foundation (WPF) applications by caching commonly used font data. WPF applications will start this service if it is not already running. It can be disabled  though doing so will degrade the performance of WPF applications.,C:\Windows\Microsoft.Net\Framework64\v3.0\WPF\PresentationFontCache.exe,9f6b01ee54288da10d937b68c9b63343,C:\Windows\Microsoft.Net\Framework64\v3.0\WPF\PresentationFontCache.exe,SERVICE_WIN32_OWN_PROCESS,,true,true,The file is signed and the signature was verified.,Microsoft Windows,Microsoft Windows Production PCA 2011
SN0002NZU,BasicRender,BasicRender,,C:\Windows\System32\drivers\BasicRender.sys,e676b384e21cfa497ad2d326734ee303,\SystemRoot\System32\drivers\BasicRender.sys,SERVICE_KERNEL_DRIVER,,true,true,The file is signed and the signature was verified.,Microsoft Windows,Microsoft Windows Production PCA 2011
SN0002NZU,KSecDD,KSecDD,,C:\Windows\System32\drivers\ksecdd.sys,52ef84e0cea18f7a6f79cc811a95067f,\SystemRoot\System32\Drivers\ksecdd.sys,SERVICE_KERNEL_DRIVER,,true,true,The file is signed and the signature was verified.,Microsoft Windows,Microsoft Windows Production PCA 2011
SN0002NZU,vmicrdv,Hyper-V Remote Desktop Virtualization Service,Provides a platform for communication between the virtual machine and the operating system running on the physical computer.,C:\Windows\System32\svchost.exe,35f85dd31c8b764a6fd60b3b03a0b69d,C:\Windows\system32\svchost.exe -k ICService,SERVICE_WIN32_SHARE_PROCESS,C:\Windows\System32\icsvc.dll,true,true,The file is signed and the signature was verified.,Microsoft Windows,Microsoft Windows Production PCA 2011
SN0002NZU,IPNAT,IP Network Address Translator,,C:\Windows\System32\drivers\ipnat.sys,2f3f5610c012d7efba573f21a59ac99d,System32\drivers\ipnat.sys,SERVICE_KERNEL_DRIVER,,true,true,The file is signed and the signature was verified.,Microsoft Windows,Microsoft Windows Production PCA 2011
SN0002NZU,W3LOGSVC,W3C Logging Service,Provides W3C logging for Internet Information Services (IIS). If this service is stopped  W3C logging configured by IIS will not work.,C:\Windows\System32\svchost.exe,35f85dd31c8b764a6fd60b3b03a0b69d,C:\WINDOWS\system32\svchost.exe -k apphost,SERVICE_WIN32_SHARE_PROCESS,C:\Windows\System32\inetsrv\w3logsvc.dll,true,true,The file is signed and the signature was verified.,Microsoft Windows,Microsoft Windows Production PCA 2011
SN0002NZU,Tcpip,TCP/IP Protocol Driver,TCP/IP Protocol Driver,C:\Windows\System32\drivers\tcpip.sys,0bad922666a657e09edf192d01afa9ec,\SystemRoot\System32\drivers\tcpip.sys,SERVICE_KERNEL_DRIVER,,true,true,The file is signed and the signature was verified.,Microsoft Windows,Microsoft Windows Production PCA 2011
SN0002NZU,vmickvpexchange,Hyper-V Data Exchange Service,Provides a mechanism to exchange data between the virtual machine and the operating system running on the physical computer.,C:\Windows\System32\svchost.exe,35f85dd31c8b764a6fd60b3b03a0b69d,C:\Windows\system32\svchost.exe -k LocalSystemNetworkRestricted,SERVICE_WIN32_SHARE_PROCESS,C:\Windows\System32\icsvc.dll,true,true,The file is signed and the signature was verified.,Microsoft Windows,Microsoft Windows Production PCA 2011
SN0002NZU,svsvc,Spot Verifier,Verifies potential file system corruptions.,C:\Windows\System32\svchost.exe,35f85dd31c8b764a6fd60b3b03a0b69d,C:\Windows\system32\svchost.exe -k LocalSystemNetworkRestricted,SERVICE_WIN32_SHARE_PROCESS,C:\Windows\System32\svsvc.dll,true,true,The file is signed and the signature was verified.,Microsoft Windows,Microsoft Windows Production PCA 2011
SN0002NZU,vmictimesync,Hyper-V Time Synchronization Service,Synchronizes the system time of this virtual machine with the system time of the physical computer.,C:\Windows\System32\svchost.exe,35f85dd31c8b764a6fd60b3b03a0b69d,C:\Windows\system32\svchost.exe -k LocalServiceNetworkRestricted,SERVICE_WIN32_SHARE_PROCESS,C:\Windows\System32\icsvc.dll,true,true,The file is signed and the signature was verified.,Microsoft Windows,Microsoft Windows Production PCA 2011
SN0002NZU,HidBatt,HID UPS Battery Driver,,C:\Windows\System32\drivers\hidbatt.sys,944482ada479ed05415560e655477984,\SystemRoot\System32\drivers\HidBatt.sys,SERVICE_KERNEL_DRIVER,,true,true,The file is signed and the signature was verified.,Microsoft Windows,Microsoft Windows Production PCA 2011
SN0002NZU,Vid,Vid,,C:\Windows\System32\drivers\Vid.sys,633a6e655f2aa8ea15368f9864bd2f52,\SystemRoot\System32\drivers\Vid.sys,SERVICE_KERNEL_DRIVER,,true,true,The file is signed and the signature was verified.,Microsoft Windows,Microsoft Windows Production PCA 2011
SN0002NZU,FontCache,Windows Font Cache Service,Optimizes performance of applications by caching commonly used font data. Applications will start this service if it is not already running. It can be disabled  though doing so will degrade application performance.,C:\Windows\System32\svchost.exe,35f85dd31c8b764a6fd60b3b03a0b69d,C:\Windows\system32\svchost.exe -k LocalService,SERVICE_WIN32_SHARE_PROCESS,C:\Windows\System32\FntCache.dll,true,true,The file is signed and the signature was verified.,Microsoft Windows,Microsoft Windows Production PCA 2011
SN0002NZU,AppMgmt,Application Management,Processes installation  removal  and enumeration requests for software deployed through Group Policy. If the service is disabled  users will be unable to install  remove  or enumerate software deployed through Group Policy. If this service is disabled  any services that explicitly depend on it will fail to start.,C:\Windows\System32\svchost.exe,35f85dd31c8b764a6fd60b3b03a0b69d,C:\Windows\system32\svchost.exe -k netsvcs,SERVICE_WIN32_SHARE_PROCESS,C:\Windows\System32\appmgmts.dll,true,true,The file is signed and the signature was verified.,Microsoft Windows,Microsoft Windows Production PCA 2011
SN0002NZU,partmgr,Partition Manager,Disk class filter driver that auctions out partitions to volume managers,C:\Windows\System32\drivers\partmgr.sys,1e9efc04f2b2260349b095b64428d15d,\SystemRoot\System32\drivers\partmgr.sys,SERVICE_KERNEL_DRIVER,,true,true,The file is signed and the signature was verified.,Microsoft Windows,Microsoft Windows Production PCA 2011
SN0002NZU,ql2300i,QLogic Fibre Channel STOR Miniport Inbox Driver (wx64),,C:\Windows\System32\drivers\ql2300i.sys,a15dcd035698f3065b1cad0e3bc048c8,\SystemRoot\System32\drivers\ql2300i.sys,SERVICE_KERNEL_DRIVER,,true,true,The file is signed and the signature was verified.,Microsoft Windows,Microsoft Windows Production PCA 2011
SN0002NZU,VMAuthdService,VMware Authorization Service,Authorization and authentication service for starting and accessing virtual machines.,C:\Program Files (x86)\VMware\VMware Player\vmware-authd.exe,77c342711f0d757858ee0d511173b6a9,"C:\Program Files (x86)\VMware\VMware Player\vmware-authd.exe""""""",SERVICE_WIN32_OWN_PROCESS,,true,true,The file is signed and the signature was verified.,"""VMware",VeriSign Class 3 Code Signing 2010 CA
SN0002NZU,xeniface,AWS Interface,,C:\Windows\System32\drivers\xeniface.sys,1d6ed50868ab1b29f5a32015cdd73d7d,\SystemRoot\System32\drivers\xeniface.sys,SERVICE_KERNEL_DRIVER,,true,true,The file is signed and the signature was verified.,Microsoft Windows Hardware Compatibility Publisher,Microsoft Windows Hardware Compatibility PCA
SN0002NZU,uliagpkx,Uli AGP Bus Filter,,C:\Windows\System32\drivers\ULIAGPKX.SYS,333c4add207520df3cd1edc60c3093c5,\SystemRoot\System32\drivers\uliagpkx.sys,SERVICE_KERNEL_DRIVER,,true,true,The file is signed and the signature was verified.,Microsoft Windows,Microsoft Windows Production PCA 2011
SN0002NZU,sdstor,SD Storage Port Driver,,C:\Windows\System32\drivers\sdstor.sys,08322fd992e8bafb4aa5ca62bb9e00da,\SystemRoot\System32\drivers\sdstor.sys,SERVICE_KERNEL_DRIVER,,true,true,The file is signed and the signature was verified.,Microsoft Windows,Microsoft Windows Production PCA 2011
SN0002NZU,1394ohci,1394 OHCI Compliant Host Controller,,C:\Windows\System32\drivers\1394ohci.sys,1248f5da105d0d9d212a217670a1946e,\SystemRoot\System32\drivers\1394ohci.sys,SERVICE_KERNEL_DRIVER,,true,true,The file is signed and the signature was verified.,Microsoft Windows,Microsoft Windows Production PCA 2011
SN0002NZU,Ndisuio,NDIS Usermode I/O Protocol,,C:\Windows\System32\drivers\ndisuio.sys,c9b2c8dc3b395addfb8eedfe4b3acd74,\SystemRoot\system32\DRIVERS\ndisuio.sys,SERVICE_KERNEL_DRIVER,,true,true,The file is signed and the signature was verified.,Microsoft Windows,Microsoft Windows Production PCA 2011
SN0002NZU,vpci,Microsoft Hyper-V Virtual PCI Bus,,C:\Windows\System32\drivers\vpci.sys,599bd79ef77dcd91424ee4955ef1e02a,\SystemRoot\System32\drivers\vpci.sys,SERVICE_KERNEL_DRIVER,,true,true,The file is signed and the signature was verified.,Microsoft Windows,Microsoft Windows Production PCA 2011
SN0002NZU,WPDBusEnum,Portable Device Enumerator Service,Enforces group policy for removable mass-storage devices. Enables applications such as Windows Media Player and Image Import Wizard to transfer and synchronize content using removable mass-storage devices.,C:\Windows\System32\svchost.exe,35f85dd31c8b764a6fd60b3b03a0b69d,C:\Windows\system32\svchost.exe -k LocalSystemNetworkRestricted,SERVICE_WIN32_SHARE_PROCESS,C:\Windows\System32\wpdbusenum.dll,true,true,The file is signed and the signature was verified.,Microsoft Windows,Microsoft Windows Production PCA 2011
SN0002NZU,NlaSvc,Network Location Awareness,Collects and stores configuration information for the network and notifies programs when this information is modified. If this service is stopped  configuration information might be unavailable. If this service is disabled  any services that explicitly depend on it will fail to start.,C:\Windows\System32\svchost.exe,35f85dd31c8b764a6fd60b3b03a0b69d,C:\Windows\System32\svchost.exe -k NetworkService,SERVICE_WIN32_SHARE_PROCESS,C:\Windows\System32\nlasvc.dll,true,true,The file is signed and the signature was verified.,Microsoft Windows,Microsoft Windows Production PCA 2011
SN0002NZU,Wecsvc,Windows Event Collector,This service manages persistent subscriptions to events from remote sources that support WS-Management protocol. This includes Windows Vista event logs  hardware and IPMI-enabled event sources. The service stores forwarded events in a local Event Log. If this service is stopped or disabled event subscriptions cannot be created and forwarded events cannot be accepted.,C:\Windows\System32\svchost.exe,35f85dd31c8b764a6fd60b3b03a0b69d,C:\Windows\system32\svchost.exe -k NetworkService,SERVICE_WIN32_SHARE_PROCESS,C:\Windows\System32\wecsvc.dll,true,true,The file is signed and the signature was verified.,Microsoft Windows,Microsoft Windows Production PCA 2011
SN0002NZU,mrxsmb,SMB MiniRedirector Wrapper and Engine,Implements the framework for the SMB filesystem redirector,C:\Windows\System32\drivers\mrxsmb.sys,81e5c30c7e4912f846290288de2ade75,system32\DRIVERS\mrxsmb.sys,SERVICE_FILE_SYSTEM_DRIVER,,true,true,The file is signed and the signature was verified.,Microsoft Windows,Microsoft Windows Production PCA 2011
SN0002NZU,NDISWANLEGACY,Remote Access LEGACY NDIS WAN Driver,Remote Access LEGACY NDIS WAN Driver,C:\Windows\System32\drivers\ndiswan.sys,5dc728ded364c6acf30882e76aa46acd,\SystemRoot\system32\DRIVERS\ndiswan.sys,SERVICE_KERNEL_DRIVER,,true,true,The file is signed and the signature was verified.,Microsoft Windows,Microsoft Windows Production PCA 2011
SN0002NZU,bfadfcoei,bfadfcoei,,C:\Windows\System32\drivers\bfadfcoei.sys,8479c08b59a26cec10b50a2854e39bc9,\SystemRoot\System32\drivers\bfadfcoei.sys,SERVICE_KERNEL_DRIVER,,true,true,The file is signed and the signature was verified.,Microsoft Windows,Microsoft Windows Production PCA 2011
SN0002NZU,COMSysApp,COM+ System Application,Manages the configuration and tracking of Component Object Model (COM)+-based components. If the service is stopped  most COM+-based components will not function properly. If this service is disabled  any services that explicitly depend on it will fail to start.,C:\Windows\System32\dllhost.exe,dd86bde3290cdbc41769ef84218f9785,C:\Windows\system32\dllhost.exe /Processid:{02D4B3F1-FD88-11D1-960D-00805FC79235},SERVICE_WIN32_OWN_PROCESS,,true,true,The file is signed and the signature was verified.,Microsoft Windows,Microsoft Windows Production PCA 2011
