hostname,name,descriptivename,description,path,md5,arguments,type,servicedll,pathsignatureexists,pathsignatureverified,pathsignaturedescription,pathcertificatesubject,pathcertificateissuer
SN0002NZU,TCPIP6,Microsoft IPv6 Protocol Driver,Microsoft IPv6 Protocol Driver,C:\Windows\System32\drivers\tcpip.sys,0bad922666a657e09edf192d01afa9ec,\SystemRoot\system32\DRIVERS\tcpip.sys,SERVICE_KERNEL_DRIVER,,true,true,The file is signed and the signature was verified.,Microsoft Windows,Microsoft Windows Production PCA 2011
SN0002NZU,netvsc,netvsc,,C:\Windows\System32\drivers\netvsc63.sys,2774c2e2976c5cd7feb3315d668526cc,\SystemRoot\System32\drivers\netvsc63.sys,SERVICE_KERNEL_DRIVER,,true,true,The file is signed and the signature was verified.,Microsoft Windows,Microsoft Windows Production PCA 2011
SN0002NZU,smbdirect,smbdirect,,C:\Windows\System32\drivers\smbdirect.sys,b16f0d6fbc075b997468e2628e5e1785,System32\DRIVERS\smbdirect.sys,SERVICE_FILE_SYSTEM_DRIVER,,true,true,The file is signed and the signature was verified.,Microsoft Windows,Microsoft Windows Production PCA 2011
SN0002NZU,napagent,Network Access Protection Agent,The Network Access Protection (NAP) agent service collects and manages health information for client computers on a network. Information collected by NAP agent is used to make sure that the client computer has the required software and settings. If a client computer is not compliant with health policy  it can be provided with restricted network access until its configuration is updated. Depending on the configuration of health policy  client computers might be automatically updated so that users quickly regain full network access without having to manually update their computer.,C:\Windows\System32\svchost.exe,35f85dd31c8b764a6fd60b3b03a0b69d,C:\Windows\System32\svchost.exe -k NetworkService,SERVICE_WIN32_SHARE_PROCESS,C:\Windows\System32\QAGENTRT.DLL,true,true,The file is signed and the signature was verified.,Microsoft Windows,Microsoft Windows Production PCA 2011
SN0002NZU,DXGKrnl,LDDM Graphics Subsystem,Controls the underlying video driver stacks to provide fully-featured display capabilities.,C:\Windows\System32\drivers\dxgkrnl.sys,46c677a624649da4e47873516101c37f,\SystemRoot\System32\drivers\dxgkrnl.sys,SERVICE_KERNEL_DRIVER,,true,true,The file is signed and the signature was verified.,Microsoft Windows,Microsoft Windows Production PCA 2011
SN0002NZU,NdisTapi,Remote Access NDIS TAPI Driver,Remote Access NDIS TAPI Driver,C:\Windows\System32\drivers\ndistapi.sys,a9d5981284f731e60c573468409e5847,\SystemRoot\system32\DRIVERS\ndistapi.sys,SERVICE_KERNEL_DRIVER,,true,true,The file is signed and the signature was verified.,Microsoft Windows,Microsoft Windows Production PCA 2011
SN0002NZU,sacsvr,Special Administration Console Helper,Allows administrators to remotely access a command prompt using Emergency Management Services.,C:\Windows\System32\svchost.exe,35f85dd31c8b764a6fd60b3b03a0b69d,C:\Windows\System32\svchost.exe -k netsvcs,SERVICE_WIN32_SHARE_PROCESS,C:\Windows\System32\sacsvr.dll,true,true,The file is signed and the signature was verified.,Microsoft Windows,Microsoft Windows Production PCA 2011
SN0002NZU,WinRM,Windows Remote Management (WS-Management),Windows Remote Management (WinRM) service implements the WS-Management protocol for remote management. WS-Management is a standard web services protocol used for remote software and hardware management. The WinRM service listens on the network for WS-Management requests and processes them. The WinRM Service needs to be configured with a listener using winrm.cmd command line tool or through Group Policy in order for it to listen over the network. The WinRM service provides access to WMI data and enables event collection. Event collection and subscription to events require that the service is running. WinRM messages use HTTP and HTTPS as transports. The WinRM service does not depend on IIS but is preconfigured to share a port with IIS on the same machine.  The WinRM service reserves the /wsman URL prefix. To prevent conflicts with IIS  administrators should ensure that any websites hosted on IIS do not use the /wsman URL prefix.,C:\Windows\System32\svchost.exe,35f85dd31c8b764a6fd60b3b03a0b69d,C:\Windows\System32\svchost.exe -k NetworkService,SERVICE_WIN32_SHARE_PROCESS,C:\Windows\System32\WsmSvc.dll,true,true,The file is signed and the signature was verified.,Microsoft Windows,Microsoft Windows Production PCA 2011
SN0002NZU,kbdhid,Keyboard HID Driver,,C:\Windows\System32\drivers\kbdhid.sys,60e7f37065326f59f527d29bc1a436e0,\SystemRoot\System32\drivers\kbdhid.sys,SERVICE_KERNEL_DRIVER,,true,true,The file is signed and the signature was verified.,Microsoft Windows,Microsoft Windows Production PCA 2011
SN0002NZU,agp440,Intel AGP Bus Filter,,C:\Windows\System32\drivers\AGP440.sys,bcf39a3153b03eee3f4ab6178ff4da8a,\SystemRoot\System32\drivers\agp440.sys,SERVICE_KERNEL_DRIVER,,true,true,The file is signed and the signature was verified.,Microsoft Windows,Microsoft Windows Production PCA 2011
SN0002NZU,vmbus,Virtual Machine Bus,,C:\Windows\System32\drivers\vmbus.sys,c6dcd7ea3863931172796d096d8009b4,\SystemRoot\System32\drivers\vmbus.sys,SERVICE_KERNEL_DRIVER,,true,true,The file is signed and the signature was verified.,Microsoft Windows,Microsoft Windows Production PCA 2011
SN0002NZU,terminpt,Microsoft Remote Desktop Input Driver,,C:\Windows\System32\drivers\terminpt.sys,eff6a2c370ac089ca0c176f186471e7d,\SystemRoot\System32\drivers\terminpt.sys,SERVICE_KERNEL_DRIVER,,true,true,The file is signed and the signature was verified.,Microsoft Windows,Microsoft Windows Production PCA 2011
SN0002NZU,ndfltr,NetworkDirect Service,,C:\Windows\System32\drivers\ndfltr.sys,9c6bbdbc6d16ca4b30e7f2defc520b30,\SystemRoot\System32\drivers\ndfltr.sys,SERVICE_KERNEL_DRIVER,,true,true,The file is signed and the signature was verified.,Microsoft Windows,Microsoft Windows Production PCA 2011
SN0002NZU,SSDPSRV,SSDP Discovery,Discovers networked devices and services that use the SSDP discovery protocol  such as UPnP devices. Also announces SSDP devices and services running on the local computer. If this service is stopped  SSDP-based devices will not be discovered. If this service is disabled  any services that explicitly depend on it will fail to start.,C:\Windows\System32\svchost.exe,35f85dd31c8b764a6fd60b3b03a0b69d,C:\Windows\system32\svchost.exe -k LocalServiceAndNoImpersonation,SERVICE_WIN32_SHARE_PROCESS,C:\Windows\System32\ssdpsrv.dll,true,true,The file is signed and the signature was verified.,Microsoft Windows,Microsoft Windows Production PCA 2011
SN0002NZU,fdPHost,Function Discovery Provider Host,The FDPHOST service hosts the Function Discovery (FD) network discovery providers. These FD providers supply network discovery services for the Simple Services Discovery Protocol (SSDP) and Web Services  Discovery (WS-D) protocol. Stopping or disabling the FDPHOST service will disable network discovery for these protocols when using FD. When this service is unavailable  network services using FD and relying on these discovery protocols will be unable to find network devices or resources.,C:\Windows\System32\svchost.exe,35f85dd31c8b764a6fd60b3b03a0b69d,C:\Windows\system32\svchost.exe -k LocalService,SERVICE_WIN32_SHARE_PROCESS,C:\Windows\System32\fdPHost.dll,true,true,The file is signed and the signature was verified.,Microsoft Windows,Microsoft Windows Production PCA 2011
SN0002NZU,ws2ifsl,Winsock IFS Driver,Winsock IFS Driver,C:\Windows\System32\drivers\ws2ifsl.sys,385c0265a2e2729d29eb3e8ba002603f,\SystemRoot\system32\drivers\ws2ifsl.sys,SERVICE_KERNEL_DRIVER,,true,true,The file is signed and the signature was verified.,Microsoft Windows,Microsoft Windows Production PCA 2011
SN0002NZU,acpipagr,ACPI Processor Aggregator Driver,,C:\Windows\System32\drivers\acpipagr.sys,fbb0655dd3f8c6b9eaefa0cc9f5dd41a,\SystemRoot\System32\drivers\acpipagr.sys,SERVICE_KERNEL_DRIVER,,true,true,The file is signed and the signature was verified.,Microsoft Windows,Microsoft Windows Production PCA 2011
SN0002NZU,mrxsmb10,SMB 1.x MiniRedirector,Implements the SMB 1.x (CIFS) protocol. This protocol provides connectivity to network resources on pre-Windows Vista servers,C:\Windows\System32\drivers\mrxsmb10.sys,d81e0624632a5454576efcc0c2cf6a60,system32\DRIVERS\mrxsmb10.sys,SERVICE_FILE_SYSTEM_DRIVER,,true,true,The file is signed and the signature was verified.,Microsoft Windows,Microsoft Windows Production PCA 2011
SN0002NZU,KPSSVC,KDC Proxy Server service (KPS),KDC Proxy Server service runs on edge servers to proxy Kerberos protocol messages to domain controllers on the corporate network.,C:\Windows\System32\svchost.exe,35f85dd31c8b764a6fd60b3b03a0b69d,C:\Windows\system32\svchost.exe -k KpsSvcGroup,SERVICE_WIN32_SHARE_PROCESS,C:\Windows\System32\kpssvc.dll,true,true,The file is signed and the signature was verified.,Microsoft Windows,Microsoft Windows Production PCA 2011
SN0002NZU,BFE,Base Filtering Engine,The Base Filtering Engine (BFE) is a service that manages firewall and Internet Protocol security (IPsec) policies and implements user mode filtering. Stopping or disabling the BFE service will significantly reduce the security of the system. It will also result in unpredictable behavior in IPsec management and firewall applications.,C:\Windows\System32\svchost.exe,35f85dd31c8b764a6fd60b3b03a0b69d,C:\Windows\system32\svchost.exe -k LocalServiceNoNetwork,SERVICE_WIN32_SHARE_PROCESS,C:\Windows\System32\BFE.DLL,true,true,The file is signed and the signature was verified.,Microsoft Windows,Microsoft Windows Production PCA 2011
SN0002NZU,NetBIOS,NetBIOS Interface,NetBIOS Interface,C:\Windows\System32\drivers\netbios.sys,2c466cc1871b7354f11bf4cedb619667,system32\DRIVERS\netbios.sys,SERVICE_FILE_SYSTEM_DRIVER,,true,true,The file is signed and the signature was verified.,Microsoft Windows,Microsoft Windows Production PCA 2011
SN0002NZU,AppIDSvc,Application Identity,Determines and verifies the identity of an application. Disabling this service will prevent AppLocker from being enforced.,C:\Windows\System32\svchost.exe,35f85dd31c8b764a6fd60b3b03a0b69d,C:\Windows\system32\svchost.exe -k LocalServiceNetworkRestricted,SERVICE_WIN32_SHARE_PROCESS,C:\Windows\System32\appidsvc.dll,true,true,The file is signed and the signature was verified.,Microsoft Windows,Microsoft Windows Production PCA 2011
SN0002NZU,ALG,Application Layer Gateway Service,Provides support for 3rd party protocol plug-ins for Internet Connection Sharing,C:\Windows\System32\alg.exe,b737c72eebc2ec2cad8f284f3b400573,C:\Windows\System32\alg.exe,SERVICE_WIN32_OWN_PROCESS,,true,true,The file is signed and the signature was verified.,Microsoft Windows,Microsoft Windows Production PCA 2011
SN0002NZU,BrokerInfrastructure,Background Tasks Infrastructure Service,Windows infrastructure service that controls which background tasks can run on the system.,C:\Windows\System32\svchost.exe,35f85dd31c8b764a6fd60b3b03a0b69d,C:\Windows\system32\svchost.exe -k DcomLaunch,SERVICE_WIN32_SHARE_PROCESS,C:\Windows\System32\bisrv.dll,true,true,The file is signed and the signature was verified.,Microsoft Windows,Microsoft Windows Production PCA 2011
SN0002NZU,PSUAService,Panda Product Service,Panda Product Service,C:\Program Files (x86)\Panda Security\Panda Security Protection\PSUAService.exe,d2af384cab51a3a4f7f512d759db5a52,C:\Program Files (x86)\Panda Security\Panda Security Protection\PSUAService.exe,SERVICE_WIN32_OWN_PROCESS,,true,true,The file is signed and the signature was verified.,Panda Security S.L.,DigiCert Assured ID Code Signing CA-1
SN0002NZU,SpbCx,Simple Peripheral Bus Support Library,,C:\Windows\System32\drivers\SpbCx.sys,2035d78d8b22287ea6ede95096665d64,system32\drivers\SpbCx.sys,SERVICE_KERNEL_DRIVER,,true,true,The file is signed and the signature was verified.,Microsoft Windows,Microsoft Windows Production PCA 2011
SN0002NZU,DeviceAssociationService,Device Association Service,Enables pairing between the system and wired or wireless devices.,C:\Windows\System32\svchost.exe,35f85dd31c8b764a6fd60b3b03a0b69d,C:\Windows\system32\svchost.exe -k LocalSystemNetworkRestricted,SERVICE_WIN32_SHARE_PROCESS,C:\Windows\System32\das.dll,true,true,The file is signed and the signature was verified.,Microsoft Windows,Microsoft Windows Production PCA 2011
SN0002NZU,dot3svc,Wired AutoConfig,The Wired AutoConfig (DOT3SVC) service is responsible for performing IEEE 802.1X authentication on Ethernet interfaces. If your current wired network deployment enforces 802.1X authentication  the DOT3SVC service should be configured to run for establishing Layer 2 connectivity and/or providing access to network resources. Wired networks that do not enforce 802.1X authentication are unaffected by the DOT3SVC service.,C:\Windows\System32\svchost.exe,35f85dd31c8b764a6fd60b3b03a0b69d,C:\Windows\system32\svchost.exe -k LocalSystemNetworkRestricted,SERVICE_WIN32_SHARE_PROCESS,C:\Windows\System32\dot3svc.dll,true,true,The file is signed and the signature was verified.,Microsoft Windows,Microsoft Windows Production PCA 2011
SN0002NZU,pdc,pdc,Power Dependency Coordinator Driver,C:\Windows\System32\drivers\pdc.sys,7cbb8e7febd421b3431d9ce292f5284a,\SystemRoot\system32\drivers\pdc.sys,SERVICE_KERNEL_DRIVER,,true,true,The file is signed and the signature was verified.,Microsoft Windows,Microsoft Windows Production PCA 2011
SN0002NZU,cdrom,CD-ROM Driver,,C:\Windows\System32\drivers\cdrom.sys,cdb5c60004fbb089c459e8e71f719413,\SystemRoot\System32\drivers\cdrom.sys,SERVICE_KERNEL_DRIVER,,true,true,The file is signed and the signature was verified.,Microsoft Windows,Microsoft Windows Production PCA 2011
SN0002NZU,TsUsbFlt,TsUsbFlt,Remote Desktop USB Hub Class Filter Driver,C:\Windows\System32\drivers\TsUsbFlt.sys,a3a39a330f9df71843012722add70e9d,system32\drivers\tsusbflt.sys,SERVICE_KERNEL_DRIVER,,true,true,The file is signed and the signature was verified.,Microsoft Windows,Microsoft Windows Production PCA 2011
SN0002NZU,NanoServiceMain,Panda Protection Service,Panda Protection Service,C:\Program Files (x86)\Panda Security\Panda Security Protection\PSANHost.exe,ea6202a10a2106cfe355ca6c29e528b0,C:\Program Files (x86)\Panda Security\Panda Security Protection\PSANHost.exe,SERVICE_WIN32_OWN_PROCESS,,true,true,The file is signed and the signature was verified.,Panda Security S.L.,DigiCert Assured ID Code Signing CA-1
SN0002NZU,fdc,Floppy Disk Controller Driver,,C:\Windows\System32\drivers\fdc.sys,ee3d0fe10be846f8fc3cc363897fb293,\SystemRoot\System32\drivers\fdc.sys,SERVICE_KERNEL_DRIVER,,true,true,The file is signed and the signature was verified.,Microsoft Windows,Microsoft Windows Production PCA 2011
SN0002NZU,ahcache,Application Compatibility Cache,Cache Compatibility Data and Attributes for Individual PE File,C:\Windows\System32\drivers\ahcache.sys,07ad08040b05966ac2a8e5005ed7f0e3,system32\DRIVERS\ahcache.sys,SERVICE_KERNEL_DRIVER,,true,true,The file is signed and the signature was verified.,Microsoft Windows,Microsoft Windows Production PCA 2011
SN0002NZU,MpsSvc,Windows Firewall,Windows Firewall helps protect your computer by preventing unauthorized users from gaining access to your computer through the Internet or a network.,C:\Windows\System32\svchost.exe,35f85dd31c8b764a6fd60b3b03a0b69d,C:\Windows\system32\svchost.exe -k LocalServiceNoNetwork,SERVICE_WIN32_SHARE_PROCESS,C:\Windows\System32\MPSSVC.dll,true,true,The file is signed and the signature was verified.,Microsoft Windows,Microsoft Windows Production PCA 2011
SN0002NZU,PrintNotify,Printer Extensions and Notifications,This service opens custom printer dialog boxes and handles notifications from a remote print server or a printer. If you turn off this service  you wont be able to see printer extensions or notifications.,C:\Windows\System32\svchost.exe,35f85dd31c8b764a6fd60b3b03a0b69d,C:\Windows\system32\svchost.exe -k print,SERVICE_WIN32_SHARE_PROCESS,C:\Windows\System32\spool\drivers\x64\3\PrintConfig.dll,true,true,The file is signed and the signature was verified.,Microsoft Windows,Microsoft Windows Production PCA 2011
SN0002NZU,Dfsc,DFS Namespace Client Driver,Client driver for access to DFS Namespaces,C:\Windows\System32\drivers\dfsc.sys,0730fde68e2591b2a62fc2861c1753f1,System32\Drivers\dfsc.sys,SERVICE_FILE_SYSTEM_DRIVER,,true,true,The file is signed and the signature was verified.,Microsoft Windows,Microsoft Windows Production PCA 2011
SN0002NZU,iScsiPrt,iScsiPort Driver,,C:\Windows\System32\drivers\msiscsi.sys,271a7eba50b5d039d9dc7d182bdea4b3,\SystemRoot\System32\drivers\msiscsi.sys,SERVICE_KERNEL_DRIVER,,true,true,The file is signed and the signature was verified.,Microsoft Windows,Microsoft Windows Production PCA 2011
SN0002NZU,HpSAMD,HpSAMD,,C:\Windows\System32\drivers\HpSAMD.sys,ff741d22c4dd99b3aaf32ef769f5b540,\SystemRoot\System32\drivers\HpSAMD.sys,SERVICE_KERNEL_DRIVER,,true,true,The file is signed and the signature was verified.,Microsoft Windows,Microsoft Windows Production PCA 2011
SN0002NZU,WEPHOSTSVC,Windows Encryption Provider Host Service,Windows Encryption Provider Host Service brokers encryption related functionalities from 3rd Party Encryption Providers to processes that need to evaluate and apply EAS policies. Stopping this will compromise EAS compliancy checks that have been established by the connected Mail Accounts,C:\Windows\System32\svchost.exe,35f85dd31c8b764a6fd60b3b03a0b69d,C:\Windows\system32\svchost.exe -k WepHostSvcGroup,SERVICE_WIN32_SHARE_PROCESS,C:\Windows\System32\wephostsvc.dll,true,true,The file is signed and the signature was verified.,Microsoft Windows,Microsoft Windows Production PCA 2011
SN0002NZU,vmicshutdown,Hyper-V Guest Shutdown Service,Provides a mechanism to shut down the operating system of this virtual machine from the management interfaces on the physical computer.,C:\Windows\System32\svchost.exe,35f85dd31c8b764a6fd60b3b03a0b69d,C:\Windows\system32\svchost.exe -k LocalSystemNetworkRestricted,SERVICE_WIN32_SHARE_PROCESS,C:\Windows\System32\icsvc.dll,true,true,The file is signed and the signature was verified.,Microsoft Windows,Microsoft Windows Production PCA 2011
SN0002NZU,LanmanServer,Server,Supports file  print  and named-pipe sharing over the network for this computer. If this service is stopped  these functions will be unavailable. If this service is disabled  any services that explicitly depend on it will fail to start.,C:\Windows\System32\svchost.exe,35f85dd31c8b764a6fd60b3b03a0b69d,C:\Windows\system32\svchost.exe -k netsvcs,SERVICE_WIN32_SHARE_PROCESS,C:\Windows\System32\srvsvc.dll,true,true,The file is signed and the signature was verified.,Microsoft Windows,Microsoft Windows Production PCA 2011
SN0002NZU,UmPass,Microsoft UMPass Driver,,C:\Windows\System32\drivers\umpass.sys,e12337b5e8bc7d0a1fbb2349480ee793,\SystemRoot\System32\drivers\umpass.sys,SERVICE_KERNEL_DRIVER,,true,true,The file is signed and the signature was verified.,Microsoft Windows,Microsoft Windows Production PCA 2011
SN0002NZU,MSiSCSI,Microsoft iSCSI Initiator Service,Manages Internet SCSI (iSCSI) sessions from this computer to remote iSCSI target devices. If this service is stopped  this computer will not be able to login or access iSCSI targets. If this service is disabled  any services that explicitly depend on it will fail to start.,C:\Windows\System32\svchost.exe,35f85dd31c8b764a6fd60b3b03a0b69d,C:\Windows\system32\svchost.exe -k netsvcs,SERVICE_WIN32_SHARE_PROCESS,C:\Windows\System32\iscsiexe.dll,true,true,The file is signed and the signature was verified.,Microsoft Windows,Microsoft Windows Production PCA 2011
SN0002NZU,NetBT,NetBT,This service implements NetBios over TCP/IP.,C:\Windows\System32\drivers\netbt.sys,945a9ca8a238ce73565ebf62b14ff149,System32\DRIVERS\netbt.sys,SERVICE_KERNEL_DRIVER,,true,true,The file is signed and the signature was verified.,Microsoft Windows,Microsoft Windows Production PCA 2011
SN0002NZU,gencounter,Microsoft Hyper-V Generation Counter,,C:\Windows\System32\drivers\vmgencounter.sys,c3e5d6971c38aa813cc37995ab69046b,\SystemRoot\System32\drivers\vmgencounter.sys,SERVICE_KERNEL_DRIVER,,true,true,The file is signed and the signature was verified.,Microsoft Windows,Microsoft Windows Production PCA 2011
SN0002NZU,DeviceInstall,Device Install Service,Enables a computer to recognize and adapt to hardware changes with little or no user input. Stopping or disabling this service will result in system instability.,C:\Windows\System32\svchost.exe,35f85dd31c8b764a6fd60b3b03a0b69d,C:\Windows\system32\svchost.exe -k DcomLaunch,SERVICE_WIN32_SHARE_PROCESS,C:\Windows\System32\umpnpmgr.dll,true,true,The file is signed and the signature was verified.,Microsoft Windows,Microsoft Windows Production PCA 2011
SN0002NZU,Psched,QoS Packet Scheduler,QoS Packet Scheduler,C:\Windows\System32\drivers\pacer.sys,9e8f5c45ea87772dd7bfa10113913c55,\SystemRoot\system32\DRIVERS\pacer.sys,SERVICE_KERNEL_DRIVER,,true,true,The file is signed and the signature was verified.,Microsoft Windows,Microsoft Windows Production PCA 2011
SN0002NZU,Spooler,Print Spooler,This service spools print jobs and handles interaction with the printer.  If you turn off this service  you wont be able to print or see your printers.,C:\Windows\System32\spoolsv.exe,68bb7143fbc720437e13be1c7d93d118,C:\Windows\System32\spoolsv.exe,SERVICE_WIN32_OWN_PROCESS,,true,true,The file is signed and the signature was verified.,Microsoft Windows,Microsoft Windows Production PCA 2011
SN0002NZU,NdisImPlatform,Microsoft Network Adapter Multiplexor Protocol,Microsoft Network Adapter Multiplexor Protocol,C:\Windows\System32\drivers\NdisImPlatform.sys,b1a638f7f590fe13c4c53516d1c095aa,\SystemRoot\system32\DRIVERS\NdisImPlatform.sys,SERVICE_KERNEL_DRIVER,,true,true,The file is signed and the signature was verified.,Microsoft Windows,Microsoft Windows Production PCA 2011
SN0002NZU,udfs,udfs,Reads/Writes UDF 1.02 1.5 2.0x 2.5 disc formats  usually found on C/DVD discs. (Core) (All pieces),C:\Windows\System32\drivers\udfs.sys,a008e75751a4c3e13255178fba9a4288,system32\DRIVERS\udfs.sys,SERVICE_FILE_SYSTEM_DRIVER,,true,true,The file is signed and the signature was verified.,Microsoft Windows,Microsoft Windows Production PCA 2011
SN0002NZU,AudioEndpointBuilder,Windows Audio Endpoint Builder,Manages audio devices for the Windows Audio service.  If this service is stopped  audio devices and effects will not function properly.  If this service is disabled  any services that explicitly depend on it will fail to start,C:\Windows\System32\svchost.exe,35f85dd31c8b764a6fd60b3b03a0b69d,C:\Windows\System32\svchost.exe -k LocalSystemNetworkRestricted,SERVICE_WIN32_SHARE_PROCESS,C:\Windows\System32\AudioEndpointBuilder.dll,true,true,The file is signed and the signature was verified.,Microsoft Windows,Microsoft Windows Production PCA 2011
SN0002NZU,cfn-hup,CloudFormation cfn-hup,CloudFormation cfn-hup for Windows,C:\Program Files\Amazon\cfn-bootstrap\winhup.exe,913ab3d30ff69921b825f256e55afb2b,C:\Program Files\Amazon\cfn-bootstrap\winhup.exe,SERVICE_WIN32_OWN_PROCESS,,false,false,The file is not signed.,,
SN0002NZU,condrv,Console Driver,,C:\Windows\System32\drivers\condrv.sys,f9216765b94696f995e207980ca0a0cd,System32\drivers\condrv.sys,SERVICE_KERNEL_DRIVER,,true,true,The file is signed and the signature was verified.,Microsoft Windows,Microsoft Windows Production PCA 2011
SN0002NZU,LSI_SAS2,LSI_SAS2,,C:\Windows\System32\drivers\lsi_sas2.sys,42cf6705e6550ca0c24968c028895fdf,\SystemRoot\System32\drivers\lsi_sas2.sys,SERVICE_KERNEL_DRIVER,,true,true,The file is signed and the signature was verified.,Microsoft Windows,Microsoft Windows Production PCA 2011
SN0002NZU,CompositeBus,Composite Bus Enumerator Driver,,C:\Windows\System32\drivers\CompositeBus.sys,cde6877041d5fc2132a96a3afa627c7a,\SystemRoot\System32\drivers\CompositeBus.sys,SERVICE_KERNEL_DRIVER,,true,true,The file is signed and the signature was verified.,Microsoft Windows,Microsoft Windows Production PCA 2011
SN0002NZU,Power,Power,Manages power policy and power policy notification delivery.,C:\Windows\System32\svchost.exe,35f85dd31c8b764a6fd60b3b03a0b69d,C:\Windows\system32\svchost.exe -k DcomLaunch,SERVICE_WIN32_SHARE_PROCESS,C:\Windows\System32\umpo.dll,true,true,The file is signed and the signature was verified.,Microsoft Windows,Microsoft Windows Production PCA 2011
SN0002NZU,SENS,System Event Notification Service,Monitors system events and notifies subscribers to COM+ Event System of these events.,C:\Windows\System32\svchost.exe,35f85dd31c8b764a6fd60b3b03a0b69d,C:\Windows\system32\svchost.exe -k netsvcs,SERVICE_WIN32_SHARE_PROCESS,C:\Windows\System32\Sens.dll,true,true,The file is signed and the signature was verified.,Microsoft Windows,Microsoft Windows Production PCA 2011
SN0002NZU,mpsdrv,Windows Firewall Authorization Driver,Windows Firewall Authorization Driver is a kernel mode driver that provides deep inspection services on inbound and outbound network traffic.,C:\Windows\System32\drivers\mpsdrv.sys,fc334fa8b2db07ea5d33a38174bd379b,System32\drivers\mpsdrv.sys,SERVICE_KERNEL_DRIVER,,true,true,The file is signed and the signature was verified.,Microsoft Windows,Microsoft Windows Production PCA 2011
SN0002NZU,AppXSvc,AppX Deployment Service (AppXSVC),Provides infrastructure support for deploying Store applications. This service is started on demand and if disabled Store applications will not be deployed to the system  and may not function properly.,C:\Windows\System32\svchost.exe,35f85dd31c8b764a6fd60b3b03a0b69d,C:\Windows\system32\svchost.exe -k wsappx,SERVICE_WIN32_SHARE_PROCESS,C:\Windows\System32\appxdeploymentserver.dll,true,true,The file is signed and the signature was verified.,Microsoft Windows,Microsoft Windows Production PCA 2011
