hostname,name,descriptivename,description,path,md5,arguments,type,servicedll,pathsignatureexists,pathsignatureverified,pathsignaturedescription,pathcertificatesubject,pathcertificateissuer
SN0002NZU,DiagTrack,Diagnostics Tracking Service,The Diagnostics Tracking Service enables data collection about functional issues in Windows components.,C:\Windows\System32\svchost.exe,35f85dd31c8b764a6fd60b3b03a0b69d,C:\Windows\System32\svchost.exe -k utcsvc,SERVICE_WIN32_OWN_PROCESS,C:\Windows\System32\diagtrack.dll,true,true,The file is signed and the signature was verified.,Microsoft Windows,Microsoft Windows Production PCA 2011
SN0002NZU,WdiServiceHost,Diagnostic Service Host,The Diagnostic Service Host is used by the Diagnostic Policy Service to host diagnostics that need to run in a Local Service context.  If this service is stopped  any diagnostics that depend on it will no longer function.,C:\Windows\System32\svchost.exe,35f85dd31c8b764a6fd60b3b03a0b69d,C:\Windows\System32\svchost.exe -k LocalService,SERVICE_WIN32_SHARE_PROCESS,C:\Windows\System32\wdi.dll,true,true,The file is signed and the signature was verified.,Microsoft Windows,Microsoft Windows Production PCA 2011
SN0002NZU,UmRdpService,Remote Desktop Services UserMode Port Redirector,Allows the redirection of Printers/Drives/Ports for RDP connections,C:\Windows\System32\svchost.exe,35f85dd31c8b764a6fd60b3b03a0b69d,C:\Windows\System32\svchost.exe -k LocalSystemNetworkRestricted,SERVICE_WIN32_SHARE_PROCESS,C:\Windows\System32\umrdp.dll,true,true,The file is signed and the signature was verified.,Microsoft Windows,Microsoft Windows Production PCA 2011
SN0002NZU,SystemEventsBroker,System Events Broker,Coordinates execution of background work for WinRT application. If this service is stopped or disabled  then background work might not be triggered.,C:\Windows\System32\svchost.exe,35f85dd31c8b764a6fd60b3b03a0b69d,C:\Windows\system32\svchost.exe -k DcomLaunch,SERVICE_WIN32_SHARE_PROCESS,C:\Windows\System32\SystemEventsBrokerServer.dll,true,true,The file is signed and the signature was verified.,Microsoft Windows,Microsoft Windows Production PCA 2011
SN0002NZU,ql40xx2i,QLogic iSCSI Miniport Inbox Driver,,C:\Windows\System32\drivers\ql40xx2i.sys,496ac1f3c9171acb957e7402ef548bbb,\SystemRoot\System32\drivers\ql40xx2i.sys,SERVICE_KERNEL_DRIVER,,true,true,The file is signed and the signature was verified.,Microsoft Windows,Microsoft Windows Production PCA 2011
SN0002NZU,PerfHost,Performance Counter DLL Host,Enables remote users and 64-bit processes to query performance counters provided by 32-bit DLLs. If this service is stopped  only local users and 32-bit processes will be able to query performance counters provided by 32-bit DLLs.,C:\Windows\SysWOW64\perfhost.exe,871e7036d38fa59db1e5b84ab0c76c48,C:\Windows\SysWow64\perfhost.exe,SERVICE_WIN32_OWN_PROCESS,,true,true,The file is signed and the signature was verified.,Microsoft Windows,Microsoft Windows Production PCA 2011
SN0002NZU,ErrDev,Microsoft Hardware Error Device Driver,,C:\Windows\System32\drivers\errdev.sys,a0164d50bc54000bd85e1f930ac31a35,\SystemRoot\System32\drivers\errdev.sys,SERVICE_KERNEL_DRIVER,,true,true,The file is signed and the signature was verified.,Microsoft Windows,Microsoft Windows Production PCA 2011
SN0002NZU,SerCx2,Serial UART Support Library,,C:\Windows\System32\drivers\SerCx2.sys,1ee9ce51f9dab74ad6291e270cd50fe1,system32\drivers\SerCx2.sys,SERVICE_KERNEL_DRIVER,,true,true,The file is signed and the signature was verified.,Microsoft Windows,Microsoft Windows Production PCA 2011
SN0002NZU,TPM,TPM,TPM Driver,C:\Windows\System32\drivers\tpm.sys,6a4e408b4f89473509a4ab97a772e3a4,\SystemRoot\system32\drivers\tpm.sys,SERVICE_KERNEL_DRIVER,,true,true,The file is signed and the signature was verified.,Microsoft Windows,Microsoft Windows Production PCA 2011
SN0002NZU,nsiproxy,NSI Proxy Service Driver,NSI Proxy Service,C:\Windows\System32\drivers\nsiproxy.sys,bcca3c667fc846c74d9bcef43caeff66,system32\drivers\nsiproxy.sys,SERVICE_KERNEL_DRIVER,,true,true,The file is signed and the signature was verified.,Microsoft Windows,Microsoft Windows Production PCA 2011
SN0002NZU,Mup,Mup,Multiple UNC Provider Driver,C:\Windows\System32\drivers\mup.sys,1524c25cfa8e96cf61d16650784513b4,\SystemRoot\System32\Drivers\mup.sys,SERVICE_FILE_SYSTEM_DRIVER,,true,true,The file is signed and the signature was verified.,Microsoft Windows,Microsoft Windows Production PCA 2011
SN0002NZU,swenum,Software Bus Driver,,C:\Windows\System32\drivers\swenum.sys,9a47e343e4d8d49e038d65fe43085904,\SystemRoot\System32\drivers\swenum.sys,SERVICE_KERNEL_DRIVER,,true,true,The file is signed and the signature was verified.,Microsoft Windows,Microsoft Windows Production PCA 2011
SN0002NZU,WcsPlugInService,Windows Color System,The WcsPlugInService service hosts third-party Windows Color System color device model and gamut map model plug-in modules. These plug-in modules are vendor-specific extensions to the Windows Color System baseline color device and gamut map models. Stopping or disabling the WcsPlugInService service will disable this extensibility feature  and the Windows Color System will use its baseline model processing rather than the vendor's desired processing. This might result in inaccurate color rendering.,C:\Windows\System32\svchost.exe,35f85dd31c8b764a6fd60b3b03a0b69d,C:\Windows\system32\svchost.exe -k wcssvc,SERVICE_WIN32_SHARE_PROCESS,C:\Windows\System32\WcsPlugInService.dll,true,true,The file is signed and the signature was verified.,Microsoft Windows,Microsoft Windows Production PCA 2011
SN0002NZU,intelppm,Intel Processor Driver,,C:\Windows\System32\drivers\intelppm.sys,8deb08f04586428fad900f269d640430,\SystemRoot\System32\drivers\intelppm.sys,SERVICE_KERNEL_DRIVER,,true,true,The file is signed and the signature was verified.,Microsoft Windows,Microsoft Windows Production PCA 2011
SN0002NZU,Schedule,Task Scheduler,Enables a user to configure and schedule automated tasks on this computer. The service also hosts multiple Windows system-critical tasks. If this service is stopped or disabled  these tasks will not be run at their scheduled times. If this service is disabled  any services that explicitly depend on it will fail to start.,C:\Windows\System32\svchost.exe,35f85dd31c8b764a6fd60b3b03a0b69d,C:\Windows\system32\svchost.exe -k netsvcs,SERVICE_WIN32_SHARE_PROCESS,C:\Windows\System32\schedsvc.dll,true,true,The file is signed and the signature was verified.,Microsoft Windows,Microsoft Windows Production PCA 2011
SN0002NZU,nsi,Network Store Interface Service,This service delivers network notifications (e.g. interface addition/deleting etc) to user mode clients. Stopping this service will cause loss of network connectivity. If this service is disabled  any other services that explicitly depend on this service will fail to start.,C:\Windows\System32\svchost.exe,35f85dd31c8b764a6fd60b3b03a0b69d,C:\Windows\system32\svchost.exe -k LocalService,SERVICE_WIN32_SHARE_PROCESS,C:\Windows\System32\nsisvc.dll,true,true,The file is signed and the signature was verified.,Microsoft Windows,Microsoft Windows Production PCA 2011
SN0002NZU,FltMgr,FltMgr,File System Filter Manager Driver,C:\Windows\System32\drivers\fltMgr.sys,f0e80f507bdd5ce4b991c0718866ec36,\SystemRoot\system32\drivers\fltmgr.sys,SERVICE_FILE_SYSTEM_DRIVER,,true,true,The file is signed and the signature was verified.,Microsoft Windows,Microsoft Windows Production PCA 2011
SN0002NZU,CNG,CNG,,C:\Windows\System32\drivers\cng.sys,7c2479adcd1aabb242d7d24d9f65d8e9,\SystemRoot\System32\Drivers\cng.sys,SERVICE_KERNEL_DRIVER,,true,true,The file is signed and the signature was verified.,Microsoft Windows,Microsoft Windows Production PCA 2011
SN0002NZU,uagp35,Microsoft AGPv3.5 Filter,,C:\Windows\System32\drivers\UAGP35.SYS,e94735b704bb18448da2e5b7a98f795b,\SystemRoot\System32\drivers\uagp35.sys,SERVICE_KERNEL_DRIVER,,true,true,The file is signed and the signature was verified.,Microsoft Windows,Microsoft Windows Production PCA 2011
SN0002NZU,gpsvc,Group Policy Client,The service is responsible for applying settings configured by administrators for the computer and users through the Group Policy component. If the service is disabled  the settings will not be applied and applications and components will not be manageable through Group Policy. Any components or applications that depend on the Group Policy component might not be functional if the service is disabled.,C:\Windows\System32\svchost.exe,35f85dd31c8b764a6fd60b3b03a0b69d,C:\Windows\system32\svchost.exe -k netsvcs,SERVICE_WIN32_SHARE_PROCESS,C:\Windows\System32\gpsvc.dll,true,true,The file is signed and the signature was verified.,Microsoft Windows,Microsoft Windows Production PCA 2011
SN0002NZU,CLFS,Common Log (CLFS),General-purpose logging service,C:\Windows\System32\drivers\clfs.sys,a0d36657bc7de99219c4fd0fa828c90f,\SystemRoot\System32\drivers\CLFS.sys,SERVICE_KERNEL_DRIVER,,true,true,The file is signed and the signature was verified.,Microsoft Windows,Microsoft Windows Production PCA 2011
SN0002NZU,vpcivsp,Microsoft Hyper-V PCI Server,,C:\Windows\System32\drivers\vpcivsp.sys,6acd68d6b80b76bf41a51a3b465a86c2,\SystemRoot\System32\drivers\vpcivsp.sys,SERVICE_KERNEL_DRIVER,,true,true,The file is signed and the signature was verified.,Microsoft Windows,Microsoft Windows Production PCA 2011
SN0002NZU,WerSvc,Windows Error Reporting Service,Allows errors to be reported when programs stop working or responding and allows existing solutions to be delivered. Also allows logs to be generated for diagnostic and repair services. If this service is stopped  error reporting might not work correctly and results of diagnostic services and repairs might not be displayed.,C:\Windows\System32\svchost.exe,35f85dd31c8b764a6fd60b3b03a0b69d,C:\Windows\System32\svchost.exe -k WerSvcGroup,SERVICE_WIN32_OWN_PROCESS,C:\Windows\System32\wersvc.dll,true,true,The file is signed and the signature was verified.,Microsoft Windows,Microsoft Windows Production PCA 2011
SN0002NZU,elxfcoe,elxfcoe,,C:\Windows\System32\drivers\elxfcoe.sys,bf3b82b5a88054d3eabc53474610e9b3,\SystemRoot\System32\drivers\elxfcoe.sys,SERVICE_KERNEL_DRIVER,,true,true,The file is signed and the signature was verified.,Microsoft Windows,Microsoft Windows Production PCA 2011
SN0002NZU,isapnp,isapnp,,C:\Windows\System32\drivers\isapnp.sys,8d708f3fd464c46e413faefc35a6131c,\SystemRoot\System32\drivers\isapnp.sys,SERVICE_KERNEL_DRIVER,,true,true,The file is signed and the signature was verified.,Microsoft Windows,Microsoft Windows Production PCA 2011
SN0002NZU,SiSRaid4,SiSRaid4,,C:\Windows\System32\drivers\sisraid4.sys,41a1c3509b5f4086b330a440fa0fccbc,\SystemRoot\System32\drivers\sisraid4.sys,SERVICE_KERNEL_DRIVER,,true,true,The file is signed and the signature was verified.,Microsoft Windows,Microsoft Windows Production PCA 2011
SN0002NZU,mssmbios,Microsoft System Management BIOS Driver,,C:\Windows\System32\drivers\mssmbios.sys,cba407849b93fd4fcac5db1c4b6e9888,\SystemRoot\System32\drivers\mssmbios.sys,SERVICE_KERNEL_DRIVER,,true,true,The file is signed and the signature was verified.,Microsoft Windows,Microsoft Windows Production PCA 2011
SN0002NZU,Winmgmt,Windows Management Instrumentation,Provides a common interface and object model to access management information about operating system  devices  applications and services. If this service is stopped  most Windows-based software will not function properly. If this service is disabled  any services that explicitly depend on it will fail to start.,C:\Windows\System32\svchost.exe,35f85dd31c8b764a6fd60b3b03a0b69d,C:\Windows\system32\svchost.exe -k netsvcs,SERVICE_WIN32_SHARE_PROCESS,C:\Windows\System32\wbem\WMIsvc.dll,true,true,The file is signed and the signature was verified.,Microsoft Windows,Microsoft Windows Production PCA 2011
SN0002NZU,netprofm,Network List Service,Identifies the networks to which the computer has connected  collects and stores properties for these networks  and notifies applications when these properties change.,C:\Windows\System32\svchost.exe,35f85dd31c8b764a6fd60b3b03a0b69d,C:\Windows\System32\svchost.exe -k LocalService,SERVICE_WIN32_SHARE_PROCESS,C:\Windows\System32\netprofmsvc.dll,true,true,The file is signed and the signature was verified.,Microsoft Windows,Microsoft Windows Production PCA 2011
SN0002NZU,mouhid,Mouse HID Driver,,C:\Windows\System32\drivers\mouhid.sys,71e84aa52bdafb9d10c22b3af70b2ae6,\SystemRoot\System32\drivers\mouhid.sys,SERVICE_KERNEL_DRIVER,,true,true,The file is signed and the signature was verified.,Microsoft Windows,Microsoft Windows Production PCA 2011
SN0002NZU,tsusbhub,Remote Desktop USB Hub,,C:\Windows\System32\drivers\tsusbhub.sys,83934b01f4faf1848844492157b66bb1,\SystemRoot\System32\drivers\tsusbhub.sys,SERVICE_KERNEL_DRIVER,,true,true,The file is signed and the signature was verified.,Microsoft Windows,Microsoft Windows Production PCA 2011
SN0002NZU,IEEtwCollectorService,Internet Explorer ETW Collector Service,ETW Collector Service for Internet Explorer. When running  this service collects real time ETW events and processes them.,C:\Windows\System32\IEEtwCollector.exe,69b5c143b726d24d8880a91802a4118a,C:\Windows\system32\IEEtwCollector.exe /V,SERVICE_WIN32_OWN_PROCESS,,true,true,The file is signed and the signature was verified.,Microsoft Windows,Microsoft Windows Production PCA 2011
SN0002NZU,TrkWks,Distributed Link Tracking Client,Maintains links between NTFS files within a computer or across computers in a network.,C:\Windows\System32\svchost.exe,35f85dd31c8b764a6fd60b3b03a0b69d,C:\Windows\System32\svchost.exe -k LocalSystemNetworkRestricted,SERVICE_WIN32_SHARE_PROCESS,C:\Windows\System32\trkwks.dll,true,true,The file is signed and the signature was verified.,Microsoft Windows,Microsoft Windows Production PCA 2011
SN0002NZU,HidUsb,Microsoft HID Class Driver,,C:\Windows\System32\drivers\hidusb.sys,173d163ce4f539e6c18883be799bc1ed,\SystemRoot\System32\drivers\hidusb.sys,SERVICE_KERNEL_DRIVER,,true,true,The file is signed and the signature was verified.,Microsoft Windows,Microsoft Windows Production PCA 2011
SN0002NZU,usbhub,Microsoft USB Standard Hub Driver,,C:\Windows\System32\drivers\usbhub.sys,d1d98d5a42768ec424b5ae6fd6f3f9ea,\SystemRoot\System32\drivers\usbhub.sys,SERVICE_KERNEL_DRIVER,,true,true,The file is signed and the signature was verified.,Microsoft Windows,Microsoft Windows Production PCA 2011
SN0002NZU,hidserv,Human Interface Device Service,Activates and maintains the use of hot buttons on keyboards  remote controls  and other multimedia devices. It is recommended that you keep this service running.,C:\Windows\System32\svchost.exe,35f85dd31c8b764a6fd60b3b03a0b69d,C:\Windows\system32\svchost.exe -k LocalSystemNetworkRestricted,SERVICE_WIN32_SHARE_PROCESS,C:\Windows\System32\hidserv.dll,true,true,The file is signed and the signature was verified.,Microsoft Windows,Microsoft Windows Production PCA 2011
SN0002NZU,Panda VPN Service,Panda VPN Service,,C:\Program Files (x86)\Panda Security\Panda Security Protection\Hydra.Sdk.Windows.Service.exe,7966959f939561c822828731b71b668c,C:\Program Files (x86)\Panda Security\Panda Security Protection\Hydra.Sdk.Windows.Service.exe,SERVICE_WIN32_OWN_PROCESS,,true,true,The file is signed and the signature was verified.,AnchorFree Inc,Symantec Class 3 SHA256 Code Signing CA
SN0002NZU,RasPppoe,Remote Access PPPOE Driver,Remote Access PPPOE Driver,C:\Windows\System32\drivers\raspppoe.sys,1d232ef578bb31ae894e557604cd5da9,\SystemRoot\System32\drivers\raspppoe.sys,SERVICE_KERNEL_DRIVER,,true,true,The file is signed and the signature was verified.,Microsoft Windows,Microsoft Windows Production PCA 2011
SN0002NZU,RasMan,Remote Access Connection Manager,Manages dial-up and virtual private network (VPN) connections from this computer to the Internet or other remote networks. If this service is disabled  any services that explicitly depend on it will fail to start.,C:\Windows\System32\svchost.exe,35f85dd31c8b764a6fd60b3b03a0b69d,C:\Windows\System32\svchost.exe -k netsvcs,SERVICE_WIN32_SHARE_PROCESS,C:\Windows\System32\rasmans.dll,true,true,The file is signed and the signature was verified.,Microsoft Windows,Microsoft Windows Production PCA 2011
SN0002NZU,qlfcoei,QLogic [FCoE] STOR Miniport Inbox Driver (wx64),,C:\Windows\System32\drivers\qlfcoei.sys,5d2af7cb112d71e624d9a4819639edb0,\SystemRoot\System32\drivers\qlfcoei.sys,SERVICE_KERNEL_DRIVER,,true,true,The file is signed and the signature was verified.,Microsoft Windows,Microsoft Windows Production PCA 2011
SN0002NZU,stornvme,Microsoft Standard NVM Express Driver,,C:\Windows\System32\drivers\stornvme.sys,6cad745b7311b598fc32e8ef18ba5de9,\SystemRoot\System32\drivers\stornvme.sys,SERVICE_KERNEL_DRIVER,,true,true,The file is signed and the signature was verified.,Microsoft Windows,Microsoft Windows Production PCA 2011
SN0002NZU,acpiex,Microsoft ACPIEx Driver,,C:\Windows\System32\drivers\acpiex.sys,0087b4578247fb8299bf7d6fef682dba,\SystemRoot\System32\Drivers\acpiex.sys,SERVICE_KERNEL_DRIVER,,true,true,The file is signed and the signature was verified.,Microsoft Windows,Microsoft Windows Production PCA 2011
SN0002NZU,sppsvc,Software Protection,Enables the download  installation and enforcement of digital licenses for Windows and Windows applications. If the service is disabled  the operating system and licensed applications may run in a notification mode. It is strongly recommended that you not disable the Software Protection service.,C:\Windows\System32\sppsvc.exe,0557ba9aac6338425753b455188c56e4,C:\Windows\system32\sppsvc.exe,SERVICE_WIN32_OWN_PROCESS,,true,true,The file is signed and the signature was verified.,Microsoft Windows,Microsoft Windows Production PCA 2011
SN0002NZU,SiSRaid2,SiSRaid2,,C:\Windows\System32\drivers\sisraid2.sys,00640b611e91c52070bf7576e211e94b,\SystemRoot\System32\drivers\SiSRaid2.sys,SERVICE_KERNEL_DRIVER,,true,true,The file is signed and the signature was verified.,Microsoft Windows,Microsoft Windows Production PCA 2011
SN0002NZU,tdx,NetIO Legacy TDI Support Driver,NetIO Legacy TDI Support Driver,C:\Windows\System32\drivers\tdx.sys,fef254ef1bdc93ee28169b91a9f95cac,\SystemRoot\system32\DRIVERS\tdx.sys,SERVICE_KERNEL_DRIVER,,true,true,The file is signed and the signature was verified.,Microsoft Windows,Microsoft Windows Production PCA 2011
SN0002NZU,Netlogon,Netlogon,Maintains a secure channel between this computer and the domain controller for authenticating users and services. If this service is stopped  the computer may not authenticate users and services and the domain controller cannot register DNS records. If this service is disabled  any services that explicitly depend on it will fail to start.,C:\Windows\System32\lsass.exe,d75affef5f74a1a5e982ca1f60d2f8a3,C:\Windows\system32\lsass.exe,SERVICE_WIN32_SHARE_PROCESS,C:\Windows\System32\netlogon.dll,true,true,The file is signed and the signature was verified.,Microsoft Windows,Microsoft Windows Production PCA 2011
SN0002NZU,fcvsc,fcvsc,,C:\Windows\System32\drivers\fcvsc.sys,1f9868011df1d47a609dc1ea66596bfa,\SystemRoot\System32\drivers\fcvsc.sys,SERVICE_KERNEL_DRIVER,,true,true,The file is signed and the signature was verified.,Microsoft Windows,Microsoft Windows Production PCA 2011
SN0002NZU,wercplsupport,Problem Reports and Solutions Control Panel Support,This service provides support for viewing  sending and deletion of system-level problem reports for the Problem Reports and Solutions control panel.,C:\Windows\System32\svchost.exe,35f85dd31c8b764a6fd60b3b03a0b69d,C:\Windows\System32\svchost.exe -k netsvcs,SERVICE_WIN32_SHARE_PROCESS,C:\Windows\System32\wercplsupport.dll,true,true,The file is signed and the signature was verified.,Microsoft Windows,Microsoft Windows Production PCA 2011
SN0002NZU,LSI_SSS,LSI_SSS,,C:\Windows\System32\drivers\lsi_sss.sys,dd5f1a6ce1f9b224ecc8b72260c3276c,\SystemRoot\System32\drivers\lsi_sss.sys,SERVICE_KERNEL_DRIVER,,true,true,The file is signed and the signature was verified.,Microsoft Windows,Microsoft Windows Production PCA 2011
SN0002NZU,pci,PCI Bus Driver,,C:\Windows\System32\drivers\pci.sys,2c5af0f034a46a6d778e85e0cd170bdf,\SystemRoot\System32\drivers\pci.sys,SERVICE_KERNEL_DRIVER,,true,true,The file is signed and the signature was verified.,Microsoft Windows,Microsoft Windows Production PCA 2011
SN0002NZU,WinHttpAutoProxySvc,WinHTTP Web Proxy Auto-Discovery Service,WinHTTP implements the client HTTP stack and provides developers with a Win32 API and COM Automation component for sending HTTP requests and receiving responses. In addition  WinHTTP provides support for auto-discovering a proxy configuration via its implementation of the Web Proxy Auto-Discovery (WPAD) protocol.,C:\Windows\System32\svchost.exe,35f85dd31c8b764a6fd60b3b03a0b69d,C:\Windows\system32\svchost.exe -k LocalService,SERVICE_WIN32_SHARE_PROCESS,C:\Windows\System32\winhttp.dll,true,true,The file is signed and the signature was verified.,Microsoft Windows,Microsoft Windows Production PCA 2011
SN0002NZU,tcpipreg,TCP/IP Registry Compatibility,Provides compatibility for legacy applications which interact with TCP/IP through the registry. If this service is stopped  certain applications may have impaired functionality.,C:\Windows\System32\drivers\tcpipreg.sys,0128c0b60f8b3de76c70be0958f910c3,System32\drivers\tcpipreg.sys,SERVICE_KERNEL_DRIVER,,true,true,The file is signed and the signature was verified.,Microsoft Windows,Microsoft Windows Production PCA 2011
SN0002NZU,pcw,Performance Counters for Windows Driver,,C:\Windows\System32\drivers\pcw.sys,a6afe902b00b4fb537427bcc02846d95,\SystemRoot\System32\drivers\pcw.sys,SERVICE_KERNEL_DRIVER,,true,true,The file is signed and the signature was verified.,Microsoft Windows,Microsoft Windows Production PCA 2011
SN0002NZU,megasas,megasas,,C:\Windows\System32\drivers\megasas.sys,a75dae0806b2c22bb05424d6c18a0220,\SystemRoot\System32\drivers\megasas.sys,SERVICE_KERNEL_DRIVER,,true,true,The file is signed and the signature was verified.,Microsoft Windows,Microsoft Windows Production PCA 2011
SN0002NZU,intelide,intelide,,C:\Windows\System32\drivers\intelide.sys,4d560a2df83413425625e6ae0a924695,\SystemRoot\System32\drivers\intelide.sys,SERVICE_KERNEL_DRIVER,,true,true,The file is signed and the signature was verified.,Microsoft Windows,Microsoft Windows Production PCA 2011
SN0002NZU,CryptSvc,Cryptographic Services,Provides three management services: Catalog Database Service  which confirms the signatures of Windows files and allows new programs to be installed; Protected Root Service  which adds and removes Trusted Root Certification Authority certificates from this computer; and Automatic Root Certificate Update Service  which retrieves root certificates from Windows Update and enable scenarios such as SSL. If this service is stopped  these management services will not function properly. If this service is disabled  any services that explicitly depend on it will fail to start.,C:\Windows\System32\svchost.exe,35f85dd31c8b764a6fd60b3b03a0b69d,C:\Windows\system32\svchost.exe -k NetworkService,SERVICE_WIN32_SHARE_PROCESS,C:\Windows\System32\cryptsvc.dll,true,true,The file is signed and the signature was verified.,Microsoft Windows,Microsoft Windows Production PCA 2011
SN0002NZU,NetTcpPortSharing,Net.Tcp Port Sharing Service,Provides ability to share TCP ports over the net.tcp protocol.,C:\Windows\Microsoft.NET\Framework64\v4.0.30319\SMSvcHost.exe,1acec5484cac99f0abc04fec29183e99,C:\Windows\Microsoft.NET\Framework64\v4.0.30319\SMSvcHost.exe,SERVICE_WIN32_SHARE_PROCESS,,true,true,The file is signed and the signature was verified.,Microsoft Windows,Microsoft Windows Production PCA 2011
SN0002NZU,VMnetAdapter,VMware Virtual Ethernet Adapter Driver,Driver for VMware's Virtual Ethernet Adapters Ver. 2,C:\Windows\System32\drivers\vmnetadapter.sys,c5ac5ceed42fae1a02d13fae3c3a7bd8,\SystemRoot\system32\DRIVERS\vmnetadapter.sys,SERVICE_KERNEL_DRIVER,,true,true,The file is signed and the signature was verified.,Microsoft Windows Hardware Compatibility Publisher,Microsoft Windows Hardware Compatibility PCA
SN0002NZU,WudfPf,User Mode Driver Frameworks Platform Driver,,C:\Windows\System32\drivers\WUDFPf.sys,240adfa1993edf658fdbfa91bab70dec,system32\drivers\WudfPf.sys,SERVICE_KERNEL_DRIVER,,true,true,The file is signed and the signature was verified.,Microsoft Windows,Microsoft Windows Production PCA 2011
SN0002NZU,iaStorAV,Intel(R) SATA RAID Controller Windows,,C:\Windows\System32\drivers\iaStorAV.sys,813a64d6ae10d371f6a1df841bf149b7,\SystemRoot\System32\drivers\iaStorAV.sys,SERVICE_KERNEL_DRIVER,,true,true,The file is signed and the signature was verified.,Microsoft Windows,Microsoft Windows Production PCA 2011
SN0002NZU,FsDepends,File System Dependency Minifilter,This minifilter tracks the dependencies associated with the various nested volumes/filesystems,C:\Windows\System32\drivers\FsDepends.sys,9631fef2afe99785c5f2a95a611da63d,System32\drivers\FsDepends.sys,SERVICE_FILE_SYSTEM_DRIVER,,true,true,The file is signed and the signature was verified.,Microsoft Windows,Microsoft Windows Production PCA 2011
SN0002NZU,WinMad,WinMad Service,,C:\Windows\System32\drivers\winmad.sys,90f5662fb654557f57d28f5e756dea48,\SystemRoot\System32\drivers\winmad.sys,SERVICE_KERNEL_DRIVER,,true,true,The file is signed and the signature was verified.,Microsoft Windows,Microsoft Windows Production PCA 2011
SN0002NZU,Wanarp,Remote Access IP ARP Driver,Remote Access IP ARP Driver,C:\Windows\System32\drivers\wanarp.sys,b8300c1f2a548bc22c3cb45a95ba9f12,\SystemRoot\system32\DRIVERS\wanarp.sys,SERVICE_KERNEL_DRIVER,,true,true,The file is signed and the signature was verified.,Microsoft Windows,Microsoft Windows Production PCA 2011
