hostname,name,descriptivename,description,path,md5,arguments,type,servicedll,pathsignatureexists,pathsignatureverified,pathsignaturedescription,pathcertificatesubject,pathcertificateissuer
WL0007KSX,napagent,Network Access Protection Agent,The Network Access Protection (NAP) agent service collects and manages health information for client computers on a network. Information collected by NAP agent is used to make sure that the client computer has the required software and settings. If a client computer is not compliant with health policy  it can be provided with restricted network access until its configuration is updated. Depending on the configuration of health policy  client computers might be automatically updated so that users quickly regain full network access without having to manually update their computer.,C:\Windows\System32\svchost.exe,793714f016df50c2502afb5bd60031fb,C:\Windows\System32\svchost.exe -k NetworkService,SERVICE_WIN32_SHARE_PROCESS,C:\Windows\System32\QAGENTRT.DLL,true,true,The file is signed and the signature was verified.,Microsoft Windows,Microsoft Windows Verification PCA
WL0007KSX,sppsvc,Software Protection,Enables the download  installation and enforcement of digital licenses for Windows and Windows applications. If the service is disabled  the operating system and licensed applications may run in a notification mode. It is strongly recommended that you not disable the Software Protection service.,C:\Windows\System32\sppsvc.exe,b8af5936faecd0baabe07e45370663f1,C:\Windows\system32\sppsvc.exe,SERVICE_WIN32_OWN_PROCESS,,true,true,The file is signed and the signature was verified.,Microsoft Windows,Microsoft Windows Verification PCA
WL0007KSX,MSDTC,Distributed Transaction Coordinator,Coordinates transactions that span multiple resource managers  such as databases  message queues  and file systems. If this service is stopped  these transactions will fail. If this service is disabled  any services that explicitly depend on it will fail to start.,C:\Windows\System32\msdtc.exe,fe1aabaff01be63d69fd295ddb42646c,C:\Windows\System32\msdtc.exe,SERVICE_WIN32_OWN_PROCESS,,true,true,The file is signed and the signature was verified.,Microsoft Windows,Microsoft Windows Verification PCA
WL0007KSX,CscService,Offline Files,The Offline Files service performs maintenance activities on the Offline Files cache  responds to user logon and logoff events  implements the internals of the public API  and dispatches interesting events to those interested in Offline Files activities and changes in cache state.,C:\Windows\System32\svchost.exe,793714f016df50c2502afb5bd60031fb,C:\Windows\System32\svchost.exe -k LocalSystemNetworkRestricted,SERVICE_WIN32_SHARE_PROCESS,C:\Windows\System32\cscsvc.dll,true,true,The file is signed and the signature was verified.,Microsoft Windows,Microsoft Windows Verification PCA
WL0007KSX,KSecPkg,KSecPkg,,C:\Windows\System32\drivers\ksecpkg.sys,f1f3fddd902747743f498e73eec96799,\SystemRoot\System32\Drivers\ksecpkg.sys,SERVICE_KERNEL_DRIVER,,true,true,The file is signed and the signature was verified.,Microsoft Windows,Microsoft Windows Verification PCA
WL0007KSX,msiserver,Windows Installer,Adds  modifies  and removes applications provided as a Windows Installer (*.msi) package. If this service is disabled  any services that explicitly depend on it will fail to start.,C:\Windows\System32\msiexec.exe,8e9961ab79b1a01ec8e6767825484370,C:\Windows\system32\msiexec.exe /V,SERVICE_WIN32_OWN_PROCESS,,true,true,The file is signed and the signature was verified.,Microsoft Windows,Microsoft Windows Verification PCA
WL0007KSX,mouhid,Mouse HID Driver,,C:\Windows\System32\drivers\mouhid.sys,9863d258f28296b947523a24664ff428,system32\DRIVERS\mouhid.sys,SERVICE_KERNEL_DRIVER,,true,true,The file is signed and the signature was verified.,Microsoft Windows,Microsoft Windows Verification PCA
WL0007KSX,pciide,pciide,,C:\Windows\System32\drivers\pciide.sys,5142418258694d48c2d5884591a0b784,\SystemRoot\system32\drivers\pciide.sys,SERVICE_KERNEL_DRIVER,,true,true,The file is signed and the signature was verified.,Microsoft Windows,Microsoft Windows Verification PCA
WL0007KSX,storflt,Disk Virtual Machine Bus Acceleration Filter Driver,,C:\Windows\System32\drivers\vmstorfl.sys,8a904a3d26264b75a22038cdbf04bea9,\SystemRoot\system32\drivers\vmstorfl.sys,SERVICE_KERNEL_DRIVER,,true,true,The file is signed and the signature was verified.,Microsoft Windows,Microsoft Windows Verification PCA
WL0007KSX,SysMain,Superfetch,Maintains and improves system performance over time.,C:\Windows\System32\svchost.exe,793714f016df50c2502afb5bd60031fb,C:\Windows\system32\svchost.exe -k LocalSystemNetworkRestricted,SERVICE_WIN32_SHARE_PROCESS,C:\Windows\System32\sysmain.dll,true,true,The file is signed and the signature was verified.,Microsoft Windows,Microsoft Windows Verification PCA
WL0007KSX,NetBIOS,NetBIOS Interface,NetBIOS Interface,C:\Windows\System32\drivers\netbios.sys,7bbabac181974ffa533cd7a59bb8e582,system32\DRIVERS\netbios.sys,SERVICE_FILE_SYSTEM_DRIVER,,true,true,The file is signed and the signature was verified.,Microsoft Windows,Microsoft Windows Verification PCA
WL0007KSX,monitor,Microsoft Monitor Class Function Driver Service,,C:\Windows\System32\drivers\monitor.sys,376446859041e55fcf7e3dc4720c3c96,system32\DRIVERS\monitor.sys,SERVICE_KERNEL_DRIVER,,true,true,The file is signed and the signature was verified.,Microsoft Windows,Microsoft Windows Verification PCA
WL0007KSX,SamSs,Security Accounts Manager,The startup of this service signals other services that the Security Accounts Manager (SAM) is ready to accept requests.  Disabling this service will prevent other services in the system from being notified when the SAM is ready  which may in turn cause those services to fail to start correctly. This service should not be disabled.,C:\Windows\System32\lsass.exe,da975e35deb4ca4da28c30761f3a0de1,C:\Windows\system32\lsass.exe,SERVICE_WIN32_SHARE_PROCESS,,true,true,The file is signed and the signature was verified.,Microsoft Windows,Microsoft Windows Verification PCA
WL0007KSX,TDPIPE,TDPIPE,,C:\Windows\System32\drivers\tdpipe.sys,fb503a22211c0208c0826fd89397f545,system32\drivers\tdpipe.sys,SERVICE_KERNEL_DRIVER,,true,true,The file is signed and the signature was verified.,Microsoft Windows,Microsoft Windows Verification PCA
WL0007KSX,blbdrive,blbdrive,,C:\Windows\System32\drivers\blbdrive.sys,3bddf24b5bc7b52fbda1e463b9f95cd8,system32\DRIVERS\blbdrive.sys,SERVICE_KERNEL_DRIVER,,true,true,The file is signed and the signature was verified.,Microsoft Windows,Microsoft Windows Verification PCA
WL0007KSX,i8042prt,i8042 Keyboard and PS/2 Mouse Port Driver,,C:\Windows\System32\drivers\i8042prt.sys,0783fd2c936b14ca00584c8507651b23,system32\DRIVERS\i8042prt.sys,SERVICE_KERNEL_DRIVER,,true,true,The file is signed and the signature was verified.,Microsoft Windows,Microsoft Windows Verification PCA
WL0007KSX,RdpVideoMiniport,Remote Desktop Video Miniport Driver,,C:\Windows\System32\drivers\rdpvideominiport.sys,e1bc3846d597ecbb7f320e59b19b2e03,System32\drivers\rdpvideominiport.sys,SERVICE_KERNEL_DRIVER,,true,true,The file is signed and the signature was verified.,Microsoft Windows,Microsoft Windows Production PCA 2011
WL0007KSX,wbengine,Block Level Backup Engine Service,The WBENGINE service is used by Windows Backup to perform backup and recovery operations. If this service is stopped by a user  it may cause the currently running backup or recovery operation to fail. Disabling this service may disable backup and recovery operations using Windows Backup on this computer.,C:\Windows\System32\wbengine.exe,97661077fe8a0d3dd5ffc3f56a5a8c1d,C:\Windows\system32\wbengine.exe,SERVICE_WIN32_OWN_PROCESS,,true,true,The file is signed and the signature was verified.,Microsoft Windows,Microsoft Windows Verification PCA
WL0007KSX,CmBatt,Microsoft ACPI Control Method Battery Driver,,C:\Windows\System32\drivers\CmBatt.sys,1a17aa9c24050dfdf0a0935d8bcbca7a,system32\DRIVERS\CmBatt.sys,SERVICE_KERNEL_DRIVER,,true,true,The file is signed and the signature was verified.,Microsoft Windows,Microsoft Windows Verification PCA
WL0007KSX,WIMMount,WIMMount,WIM Image mount service driver,C:\Windows\System32\drivers\wimmount.sys,5ee9bf2e13cf305f24323ed88b53df72,system32\drivers\wimmount.sys,SERVICE_FILE_SYSTEM_DRIVER,,true,true,The file is signed and the signature was verified.,Microsoft Windows,Microsoft Windows Verification PCA
WL0007KSX,MTConfig,Microsoft Input Configuration Driver,,C:\Windows\System32\drivers\MTConfig.sys,2c0d5886a90af5fad924632967d54e1a,\SystemRoot\system32\drivers\MTConfig.sys,SERVICE_KERNEL_DRIVER,,true,true,The file is signed and the signature was verified.,Microsoft Windows,Microsoft Windows Verification PCA
WL0007KSX,iaStorV,iaStorV,,C:\Windows\System32\drivers\iaStorV.sys,10fba16e75d55ee523440ce3e13ba678,\SystemRoot\system32\drivers\iaStorV.sys,SERVICE_KERNEL_DRIVER,,true,true,The file is signed and the signature was verified.,Microsoft Windows,Microsoft Windows Verification PCA
WL0007KSX,TrkWks,Distributed Link Tracking Client,Maintains links between NTFS files within a computer or across computers in a network.,C:\Windows\System32\svchost.exe,793714f016df50c2502afb5bd60031fb,C:\Windows\System32\svchost.exe -k LocalSystemNetworkRestricted,SERVICE_WIN32_SHARE_PROCESS,C:\Windows\System32\trkwks.dll,true,true,The file is signed and the signature was verified.,Microsoft Windows,Microsoft Windows Verification PCA
WL0007KSX,vdrvroot,Microsoft Virtual Drive Enumerator Driver,,C:\Windows\System32\drivers\vdrvroot.sys,d0e4d67e5f987e0b64d2019b65b0a191,\SystemRoot\system32\drivers\vdrvroot.sys,SERVICE_KERNEL_DRIVER,,true,true,The file is signed and the signature was verified.,Microsoft Windows,Microsoft Windows Verification PCA
WL0007KSX,NetBT,NetBT,This service implements NetBios over TCP/IP.,C:\Windows\System32\drivers\netbt.sys,62978cd48ee840ca07ec5a41de0b9f03,System32\DRIVERS\netbt.sys,SERVICE_KERNEL_DRIVER,,true,true,The file is signed and the signature was verified.,Microsoft Windows,Microsoft Windows Verification PCA
WL0007KSX,stexstor,stexstor,,C:\Windows\System32\drivers\stexstor.sys,5986ecd64acfcef70352e7c4193703f4,\SystemRoot\system32\drivers\stexstor.sys,SERVICE_KERNEL_DRIVER,,true,true,The file is signed and the signature was verified.,Microsoft Windows,Microsoft Windows Verification PCA
WL0007KSX,swenum,Software Bus Driver,,C:\Windows\System32\drivers\swenum.sys,78a44f2230d961a8acc2c04fd3d841ae,system32\DRIVERS\swenum.sys,SERVICE_KERNEL_DRIVER,,true,true,The file is signed and the signature was verified.,Microsoft Windows,Microsoft Windows Verification PCA
WL0007KSX,vsmraid,vsmraid,,C:\Windows\System32\drivers\vsmraid.sys,1cc5ca4dd292d3f60dff6f23fa2f5a2f,\SystemRoot\system32\drivers\vsmraid.sys,SERVICE_KERNEL_DRIVER,,true,true,The file is signed and the signature was verified.,Microsoft Windows,Microsoft Windows Verification PCA
WL0007KSX,fdc,Floppy Disk Controller Driver,,C:\Windows\System32\drivers\fdc.sys,e987928cf26972b6a1e3f286ad861fc1,\SystemRoot\system32\drivers\fdc.sys,SERVICE_KERNEL_DRIVER,,true,true,The file is signed and the signature was verified.,Microsoft Windows,Microsoft Windows Verification PCA
WL0007KSX,NlaSvc,Network Location Awareness,Collects and stores configuration information for the network and notifies programs when this information is modified. If this service is stopped  configuration information might be unavailable. If this service is disabled  any services that explicitly depend on it will fail to start.,C:\Windows\System32\svchost.exe,793714f016df50c2502afb5bd60031fb,C:\Windows\System32\svchost.exe -k NetworkService,SERVICE_WIN32_SHARE_PROCESS,C:\Windows\System32\nlasvc.dll,true,true,The file is signed and the signature was verified.,Microsoft Windows,Microsoft Windows Verification PCA
WL0007KSX,WPCSvc,Parental Controls,This service is a stub for Windows Parental Control functionality that existed in Vista. It is provided for backward compatibility only.,C:\Windows\System32\svchost.exe,793714f016df50c2502afb5bd60031fb,C:\Windows\system32\svchost.exe -k LocalServiceNetworkRestricted,SERVICE_WIN32_SHARE_PROCESS,C:\Windows\System32\wpcsvc.dll,true,true,The file is signed and the signature was verified.,Microsoft Windows,Microsoft Windows Verification PCA
WL0007KSX,1394ohci,1394 OHCI Compliant Host Controller,,C:\Windows\System32\drivers\1394ohci.sys,837c813fb5d0da8739c401a28ffce356,\SystemRoot\system32\drivers\1394ohci.sys,SERVICE_KERNEL_DRIVER,,true,true,The file is signed and the signature was verified.,Microsoft Windows,Microsoft Windows Verification PCA
WL0007KSX,AFD,Ancillary Function Driver for Winsock,Ancillary Function Driver for Winsock,C:\Windows\System32\drivers\afd.sys,9a6fc3a651db3c3b316c57374aa390c5,\SystemRoot\system32\drivers\afd.sys,SERVICE_KERNEL_DRIVER,,true,true,The file is signed and the signature was verified.,Microsoft Windows,Microsoft Windows Verification PCA
WL0007KSX,mountmgr,Mount Point Manager,Driver responsible with maintaining persistent drive letters and names for volumes,C:\Windows\System32\drivers\mountmgr.sys,2580d41209bdf55e3009837590f5fe6c,\SystemRoot\System32\drivers\mountmgr.sys,SERVICE_KERNEL_DRIVER,,true,true,The file is signed and the signature was verified.,Microsoft Windows,Microsoft Windows Verification PCA
WL0007KSX,FontCache3.0.0.0,Windows Presentation Foundation Font Cache 3.0.0.0,Optimizes performance of Windows Presentation Foundation (WPF) applications by caching commonly used font data. WPF applications will start this service if it is not already running. It can be disabled  though doing so will degrade the performance of WPF applications.,C:\Windows\Microsoft.Net\Framework64\v3.0\WPF\PresentationFontCache.exe,da6dd17093aebbb63968ace8319e218c,C:\Windows\Microsoft.Net\Framework64\v3.0\WPF\PresentationFontCache.exe,SERVICE_WIN32_OWN_PROCESS,,true,true,The file is signed and the signature was verified.,Microsoft Windows,Microsoft Windows Verification PCA
WL0007KSX,amdsata,amdsata,,C:\Windows\System32\drivers\amdsata.sys,3f5f2561763712a4bb2986dfb950bb33,\SystemRoot\system32\drivers\amdsata.sys,SERVICE_KERNEL_DRIVER,,true,true,The file is signed and the signature was verified.,Microsoft Windows,Microsoft Windows Verification PCA
WL0007KSX,adpu320,adpu320,,C:\Windows\System32\drivers\adpu320.sys,451fe8a008437ea20f47f4835bfd415b,\SystemRoot\system32\drivers\adpu320.sys,SERVICE_KERNEL_DRIVER,,true,true,The file is signed and the signature was verified.,Microsoft Windows,Microsoft Windows Verification PCA
WL0007KSX,AcpiPmi,ACPI Power Meter Driver,,C:\Windows\System32\drivers\acpipmi.sys,1296a32d6bcb112a1d0fcf549fe47710,\SystemRoot\system32\drivers\acpipmi.sys,SERVICE_KERNEL_DRIVER,,true,true,The file is signed and the signature was verified.,Microsoft Windows,Microsoft Windows Verification PCA
WL0007KSX,VBoxVideo,VBoxVideo,,C:\Windows\System32\drivers\VBoxVideo.sys,14864803ebe6c6f463e0de6b12d77a70,system32\DRIVERS\VBoxVideo.sys,SERVICE_KERNEL_DRIVER,,true,true,The file is signed and the signature was verified.,Oracle Corporation,VeriSign Class 3 Code Signing 2010 CA
WL0007KSX,swprv,Microsoft Software Shadow Copy Provider,Manages software-based volume shadow copies taken by the Volume Shadow Copy service. If this service is stopped  software-based volume shadow copies cannot be managed. If this service is disabled  any services that explicitly depend on it will fail to start.,C:\Windows\System32\svchost.exe,793714f016df50c2502afb5bd60031fb,C:\Windows\System32\svchost.exe -k swprv,SERVICE_WIN32_OWN_PROCESS,C:\Windows\System32\swprv.dll,true,true,The file is signed and the signature was verified.,Microsoft Windows,Microsoft Windows Verification PCA
WL0007KSX,MSTEE,Microsoft Streaming Tee/Sink-to-Sink Converter,,C:\Windows\System32\drivers\mstee.sys,ad19eef8c2610a81dddb63de69e13898,system32\drivers\MSTEE.sys,SERVICE_KERNEL_DRIVER,,true,true,The file is signed and the signature was verified.,Microsoft Windows,Microsoft Windows Verification PCA
WL0007KSX,SharedAccess,Internet Connection Sharing (ICS),Provides network address translation  addressing  name resolution and/or intrusion prevention services for a home or small office network.,C:\Windows\System32\svchost.exe,793714f016df50c2502afb5bd60031fb,C:\Windows\System32\svchost.exe -k netsvcs,SERVICE_WIN32_SHARE_PROCESS,C:\Windows\System32\ipnathlp.dll,true,true,The file is signed and the signature was verified.,Microsoft Windows,Microsoft Windows Verification PCA
WL0007KSX,mpio,mpio,,C:\Windows\System32\drivers\mpio.sys,386a22e5f6cb45b37aff77cc33772e6c,\SystemRoot\system32\drivers\mpio.sys,SERVICE_KERNEL_DRIVER,,true,true,The file is signed and the signature was verified.,Microsoft Windows,Microsoft Windows Verification PCA
WL0007KSX,Disk,Disk Driver,,C:\Windows\System32\drivers\disk.sys,53d5463c507ad72b344a74438ad4cc04,\SystemRoot\system32\drivers\disk.sys,SERVICE_KERNEL_DRIVER,,true,true,The file is signed and the signature was verified.,Microsoft Windows,Microsoft Windows Verification PCA
WL0007KSX,wcncsvc,Windows Connect Now - Config Registrar,WCNCSVC hosts the Windows Connect Now Configuration which is Microsoft's Implementation of Wi-Fi Protected Setup (WPS) protocol. This is used to configure Wireless LAN settings for an Access Point (AP) or a Wi-Fi Device. The service is started programmatically as needed.,C:\Windows\System32\svchost.exe,793714f016df50c2502afb5bd60031fb,C:\Windows\System32\svchost.exe -k LocalServiceAndNoImpersonation,SERVICE_WIN32_SHARE_PROCESS,C:\Windows\System32\wcncsvc.dll,true,true,The file is signed and the signature was verified.,Microsoft Windows,Microsoft Windows Verification PCA
WL0007KSX,nsiproxy,NSI proxy service driver.,NSI proxy service.,C:\Windows\System32\drivers\nsiproxy.sys,84fcabf16ef2d945b390395e04107f37,system32\drivers\nsiproxy.sys,SERVICE_KERNEL_DRIVER,,true,true,The file is signed and the signature was verified.,Microsoft Windows,Microsoft Windows Verification PCA
WL0007KSX,MMCSS,Multimedia Class Scheduler,Enables relative prioritization of work based on system-wide task priorities. This is intended mainly for multimedia applications.  If this service is stopped  individual tasks resort to their default priority.,C:\Windows\System32\svchost.exe,793714f016df50c2502afb5bd60031fb,C:\Windows\system32\svchost.exe -k netsvcs,SERVICE_WIN32_SHARE_PROCESS,C:\Windows\System32\mmcss.dll,true,true,The file is signed and the signature was verified.,Microsoft Windows,Microsoft Windows Verification PCA
WL0007KSX,VBoxSF,VirtualBox Shared Folders,,C:\Windows\System32\drivers\VBoxSF.sys,49e858f5b94f8927b33d97daa1174573,\SystemRoot\System32\drivers\VBoxSF.sys,SERVICE_FILE_SYSTEM_DRIVER,,true,true,The file is signed and the signature was verified.,Oracle Corporation,VeriSign Class 3 Code Signing 2010 CA
WL0007KSX,WcsPlugInService,Windows Color System,The WcsPlugInService service hosts third-party Windows Color System color device model and gamut map model plug-in modules. These plug-in modules are vendor-specific extensions to the Windows Color System baseline color device and gamut map models. Stopping or disabling the WcsPlugInService service will disable this extensibility feature  and the Windows Color System will use its baseline model processing rather than the vendor's desired processing. This might result in inaccurate color rendering.,C:\Windows\System32\svchost.exe,793714f016df50c2502afb5bd60031fb,C:\Windows\system32\svchost.exe -k wcssvc,SERVICE_WIN32_SHARE_PROCESS,C:\Windows\System32\WcsPlugInService.dll,true,true,The file is signed and the signature was verified.,Microsoft Windows,Microsoft Windows Verification PCA
WL0007KSX,AppID,AppID Driver,Identifies an application and enforces software restriction policies.,C:\Windows\System32\drivers\appid.sys,2641c7dc965b15185f21e3b829cd3759,\SystemRoot\system32\drivers\appid.sys,SERVICE_KERNEL_DRIVER,,true,true,The file is signed and the signature was verified.,Microsoft Windows,Microsoft Windows Verification PCA
WL0007KSX,AudioEndpointBuilder,Windows Audio Endpoint Builder,Manages audio devices for the Windows Audio service.  If this service is stopped  audio devices and effects will not function properly.  If this service is disabled  any services that explicitly depend on it will fail to start,C:\Windows\System32\svchost.exe,793714f016df50c2502afb5bd60031fb,C:\Windows\System32\svchost.exe -k LocalSystemNetworkRestricted,SERVICE_WIN32_SHARE_PROCESS,C:\Windows\System32\audiosrv.dll,true,true,The file is signed and the signature was verified.,Microsoft Windows,Microsoft Windows Verification PCA
WL0007KSX,BrFiltLo,Brother USB Mass-Storage Lower Filter Driver,,C:\Windows\System32\drivers\BrFiltLo.sys,a89b1795f4661617342741a4463d0cb3,\SystemRoot\system32\drivers\BrFiltLo.sys,SERVICE_KERNEL_DRIVER,,true,true,The file is signed and the signature was verified.,Microsoft Windows,Microsoft Windows Verification PCA
WL0007KSX,MSPCLOCK,Microsoft Streaming Clock Proxy,,C:\Windows\System32\drivers\mspclock.sys,222874468ff7d6376334d65bbffc16f7,system32\drivers\MSPCLOCK.sys,SERVICE_KERNEL_DRIVER,,true,true,The file is signed and the signature was verified.,Microsoft Windows,Microsoft Windows Verification PCA
WL0007KSX,storvsc,storvsc,,C:\Windows\System32\drivers\storvsc.sys,b0262b2d112d1aeb2a2f3ff49b626206,\SystemRoot\system32\drivers\storvsc.sys,SERVICE_KERNEL_DRIVER,,true,true,The file is signed and the signature was verified.,Microsoft Windows,Microsoft Windows Verification PCA
WL0007KSX,Browser,Computer Browser,Maintains an updated list of computers on the network and supplies this list to computers designated as browsers. If this service is stopped  this list will not be updated or maintained. If this service is disabled  any services that explicitly depend on it will fail to start.,C:\Windows\System32\svchost.exe,793714f016df50c2502afb5bd60031fb,C:\Windows\System32\svchost.exe -k netsvcs,SERVICE_WIN32_SHARE_PROCESS,C:\Windows\System32\browser.dll,true,true,The file is signed and the signature was verified.,Microsoft Windows,Microsoft Windows Verification PCA
WL0007KSX,ehRecvr,Windows Media Center Receiver Service,Windows Media Center Service for TV and FM broadcast reception,C:\Windows\ehome\ehrecvr.exe,545ffc3ea42a4867cf5c3a06d0fdb5cc,C:\Windows\ehome\ehRecvr.exe,SERVICE_WIN32_OWN_PROCESS,,true,true,The file is signed and the signature was verified.,Microsoft Windows,Microsoft Windows Verification PCA
WL0007KSX,LSI_SAS2,LSI_SAS2,,C:\Windows\System32\drivers\lsi_sas2.sys,fa693df0ab9a9f19c738898d47997103,\SystemRoot\system32\drivers\lsi_sas2.sys,SERVICE_KERNEL_DRIVER,,true,true,The file is signed and the signature was verified.,Microsoft Windows,Microsoft Windows Verification PCA
WL0007KSX,vwifibus,Virtual WiFi Bus Driver,Implements bus functionality for Virtual WiFi,C:\Windows\System32\drivers\vwifibus.sys,55f89939c3498031b18c44dbb2a77387,\SystemRoot\System32\drivers\vwifibus.sys,SERVICE_KERNEL_DRIVER,,true,true,The file is signed and the signature was verified.,Microsoft Windows,Microsoft Windows Verification PCA
WL0007KSX,s3cap,s3cap,,C:\Windows\System32\drivers\vms3cap.sys,2800eaec83205735c1f6e62ae78b2c61,\SystemRoot\system32\drivers\vms3cap.sys,SERVICE_KERNEL_DRIVER,,true,true,The file is signed and the signature was verified.,Microsoft Windows,Microsoft Windows Verification PCA
WL0007KSX,TCPIP6,Microsoft IPv6 Protocol Driver,Microsoft IPv6 Protocol Driver,C:\Windows\System32\drivers\tcpip.sys,1bbda24f0b1dbd394246adeb7b49290b,system32\DRIVERS\tcpip.sys,SERVICE_KERNEL_DRIVER,,true,true,The file is signed and the signature was verified.,Microsoft Windows,Microsoft Windows Verification PCA
WL0007KSX,eventlog,Windows Event Log,This service manages events and event logs. It supports logging events  querying events  subscribing to events  archiving event logs  and managing event metadata. It can display events in both XML and plain text format. Stopping this service may compromise security and reliability of the system.,C:\Windows\System32\svchost.exe,793714f016df50c2502afb5bd60031fb,C:\Windows\System32\svchost.exe -k LocalServiceNetworkRestricted,SERVICE_WIN32_SHARE_PROCESS,,true,true,The file is signed and the signature was verified.,Microsoft Windows,Microsoft Windows Verification PCA
WL0007KSX,LSI_SAS,LSI_SAS,,C:\Windows\System32\drivers\lsi_sas.sys,957acc6a631568e8680bf44ee0f83913,\SystemRoot\system32\drivers\lsi_sas.sys,SERVICE_KERNEL_DRIVER,,true,true,The file is signed and the signature was verified.,Microsoft Windows,Microsoft Windows Verification PCA
WL0007KSX,cdrom,CD-ROM Driver,,C:\Windows\System32\drivers\cdrom.sys,c3491eec936a066ed6c86625f10af123,system32\DRIVERS\cdrom.sys,SERVICE_KERNEL_DRIVER,,true,true,The file is signed and the signature was verified.,Microsoft Windows,Microsoft Windows Verification PCA
WL0007KSX,idsvc,Windows CardSpace,Securely enables the creation  management  and disclosure of digital identities.,C:\Windows\Microsoft.NET\Framework64\v3.0\Windows Communication Foundation\infocard.exe,c29314f30a61183547c1c5035643618f,C:\Windows\Microsoft.NET\Framework64\v3.0\Windows Communication Foundation\infocard.exe,SERVICE_WIN32_SHARE_PROCESS,,true,true,The file is signed and the signature was verified.,Microsoft Windows,Microsoft Windows Verification PCA
WL0007KSX,CNG,CNG,,C:\Windows\System32\drivers\cng.sys,5ffaca963684e9dce348f4889861ea6c,\SystemRoot\System32\Drivers\cng.sys,SERVICE_KERNEL_DRIVER,,true,true,The file is signed and the signature was verified.,Microsoft Windows,Microsoft Windows Verification PCA
