hostname,name,descriptivename,description,path,md5,arguments,type,servicedll,pathsignatureexists,pathsignatureverified,pathsignaturedescription,pathcertificatesubject,pathcertificateissuer
WL0007KSX,elxstor,elxstor,,C:\Windows\System32\drivers\elxstor.sys,229c4dbca06e68ea44c9a9a6da2ea2b1,\SystemRoot\system32\drivers\elxstor.sys,SERVICE_KERNEL_DRIVER,,true,true,The file is signed and the signature was verified.,Microsoft Windows,Microsoft Windows Verification PCA
WL0007KSX,RDPDR,Terminal Server Device Redirector Driver,,C:\Windows\System32\drivers\rdpdr.sys,f43eec81d8aafb5e3decf44e05f49bac,System32\drivers\rdpdr.sys,SERVICE_KERNEL_DRIVER,,true,true,The file is signed and the signature was verified.,Microsoft Windows,Microsoft Windows Verification PCA
WL0007KSX,WmiAcpi,Microsoft Windows Management Interface for ACPI,,C:\Windows\System32\drivers\wmiacpi.sys,0a833b34e721ffa92886db3b777dae56,\SystemRoot\system32\drivers\wmiacpi.sys,SERVICE_KERNEL_DRIVER,,true,true,The file is signed and the signature was verified.,Microsoft Windows,Microsoft Windows Verification PCA
WL0007KSX,b06bdrv,Broadcom NetXtreme II VBD,,C:\Windows\System32\drivers\bxvbda.sys,3dd2537ab28496f754081b7a0d49c8f0,\SystemRoot\system32\drivers\bxvbda.sys,SERVICE_KERNEL_DRIVER,,true,true,The file is signed and the signature was verified.,Microsoft Windows,Microsoft Windows Verification PCA
WL0007KSX,WinHttpAutoProxySvc,WinHTTP Web Proxy Auto-Discovery Service,WinHTTP implements the client HTTP stack and provides developers with a Win32 API and COM Automation component for sending HTTP requests and receiving responses. In addition  WinHTTP provides support for auto-discovering a proxy configuration via its implementation of the Web Proxy Auto-Discovery (WPAD) protocol.,C:\Windows\System32\svchost.exe,793714f016df50c2502afb5bd60031fb,C:\Windows\system32\svchost.exe -k LocalService,SERVICE_WIN32_SHARE_PROCESS,C:\Windows\System32\winhttp.dll,true,true,The file is signed and the signature was verified.,Microsoft Windows,Microsoft Windows Verification PCA
WL0007KSX,p2pimsvc,Peer Networking Identity Manager,Provides identity services for the Peer Name Resolution Protocol (PNRP) and Peer-to-Peer Grouping services.  If disabled  the Peer Name Resolution Protocol (PNRP) and Peer-to-Peer Grouping services may not function  and some applications  such as HomeGroup and Remote Assistance  may not function correctly.,C:\Windows\System32\svchost.exe,793714f016df50c2502afb5bd60031fb,C:\Windows\System32\svchost.exe -k LocalServicePeerNet,SERVICE_WIN32_SHARE_PROCESS,C:\Windows\System32\pnrpsvc.dll,true,true,The file is signed and the signature was verified.,Microsoft Windows,Microsoft Windows Verification PCA
WL0007KSX,Processor,Processor Driver,,C:\Windows\System32\drivers\processr.sys,b94e0f0640eb34ccda0e6f95c0c2e22f,\SystemRoot\system32\drivers\processr.sys,SERVICE_KERNEL_DRIVER,,true,true,The file is signed and the signature was verified.,Microsoft Windows,Microsoft Windows Verification PCA
WL0007KSX,iirsp,iirsp,,C:\Windows\System32\drivers\iirsp.sys,9d4ca10071f0954ccb41782b63f66e16,\SystemRoot\system32\drivers\iirsp.sys,SERVICE_KERNEL_DRIVER,,true,true,The file is signed and the signature was verified.,Microsoft Windows,Microsoft Windows Verification PCA
WL0007KSX,RasAgileVpn,WAN Miniport (IKEv2),WAN Miniport (IKEv2),C:\Windows\System32\drivers\agilevpn.sys,257820a7a378343fcc8b8c0a2f7e35aa,system32\DRIVERS\AgileVpn.sys,SERVICE_KERNEL_DRIVER,,true,true,The file is signed and the signature was verified.,Microsoft Windows,Microsoft Windows Verification PCA
WL0007KSX,E1G60,Intel(R) PRO/1000 NDIS 6 Adapter Driver,,C:\Windows\System32\drivers\E1G6032E.sys,127b84002839a272c0696638c3d506aa,system32\DRIVERS\E1G6032E.sys,SERVICE_KERNEL_DRIVER,,true,true,The file is signed and the signature was verified.,Microsoft Windows,Microsoft Windows Verification PCA
WL0007KSX,seclogon,Secondary Logon,Enables starting processes under alternate credentials. If this service is stopped  this type of logon access will be unavailable. If this service is disabled  any services that explicitly depend on it will fail to start.,C:\Windows\System32\svchost.exe,793714f016df50c2502afb5bd60031fb,C:\Windows\system32\svchost.exe -k netsvcs,SERVICE_WIN32_SHARE_PROCESS,C:\Windows\System32\seclogon.dll,true,true,The file is signed and the signature was verified.,Microsoft Windows,Microsoft Windows Verification PCA
WL0007KSX,adpahci,adpahci,,C:\Windows\System32\drivers\adpahci.sys,e9b9b7c47ba8f626078e56e10f71f786,\SystemRoot\system32\drivers\adpahci.sys,SERVICE_KERNEL_DRIVER,,true,true,The file is signed and the signature was verified.,Microsoft Windows,Microsoft Windows Verification PCA
WL0007KSX,mssmbios,Microsoft System Management BIOS Driver,,C:\Windows\System32\drivers\mssmbios.sys,fe3b31b62788984c9e94bb24a281b16e,system32\DRIVERS\mssmbios.sys,SERVICE_KERNEL_DRIVER,,true,true,The file is signed and the signature was verified.,Microsoft Windows,Microsoft Windows Verification PCA
WL0007KSX,AmdK8,AMD K8 Processor Driver,,C:\Windows\System32\drivers\amdk8.sys,4faed103700376b59724be18634f1dee,\SystemRoot\system32\drivers\amdk8.sys,SERVICE_KERNEL_DRIVER,,true,true,The file is signed and the signature was verified.,Microsoft Windows,Microsoft Windows Verification PCA
WL0007KSX,msisadrv,msisadrv,,C:\Windows\System32\drivers\msisadrv.sys,eafc12250843a37a81a37f290e58d4f9,\SystemRoot\system32\drivers\msisadrv.sys,SERVICE_KERNEL_DRIVER,,true,true,The file is signed and the signature was verified.,Microsoft Windows,Microsoft Windows Verification PCA
WL0007KSX,DcomLaunch,DCOM Server Process Launcher,The DCOMLAUNCH service launches COM and DCOM servers in response to object activation requests. If this service is stopped or disabled  programs using COM or DCOM will not function properly. It is strongly recommended that you have the DCOMLAUNCH service running.,C:\Windows\System32\svchost.exe,793714f016df50c2502afb5bd60031fb,C:\Windows\system32\svchost.exe -k DcomLaunch,SERVICE_WIN32_SHARE_PROCESS,C:\Windows\System32\rpcss.dll,true,true,The file is signed and the signature was verified.,Microsoft Windows,Microsoft Windows Verification PCA
WL0007KSX,pcmcia,pcmcia,,C:\Windows\System32\drivers\pcmcia.sys,515b34616e8d5821b82e60ae80ecee50,\SystemRoot\system32\drivers\pcmcia.sys,SERVICE_KERNEL_DRIVER,,true,true,The file is signed and the signature was verified.,Microsoft Windows,Microsoft Windows Verification PCA
WL0007KSX,IKEEXT,IKE and AuthIP IPsec Keying Modules,The IKEEXT service hosts the Internet Key Exchange (IKE) and Authenticated Internet Protocol (AuthIP) keying modules. These keying modules are used for authentication and key exchange in Internet Protocol security (IPsec). Stopping or disabling the IKEEXT service will disable IKE and AuthIP key exchange with peer computers. IPsec is typically configured to use IKE or AuthIP; therefore  stopping or disabling the IKEEXT service might result in an IPsec failure and might compromise the security of the system. It is strongly recommended that you have the IKEEXT service running.,C:\Windows\System32\svchost.exe,793714f016df50c2502afb5bd60031fb,C:\Windows\system32\svchost.exe -k netsvcs,SERVICE_WIN32_SHARE_PROCESS,C:\Windows\System32\IKEEXT.DLL,true,true,The file is signed and the signature was verified.,Microsoft Windows,Microsoft Windows Verification PCA
WL0007KSX,rdbss,Redirected Buffering Sub Sysytem,Provides the framework for network mini-redirectors,C:\Windows\System32\drivers\rdbss.sys,84c275591d26d7b9e0641cbc786f7644,system32\DRIVERS\rdbss.sys,SERVICE_FILE_SYSTEM_DRIVER,,true,true,The file is signed and the signature was verified.,Microsoft Windows,Microsoft Windows Verification PCA
WL0007KSX,srv,Server SMB 1.xxx Driver,Enables connectivity from Windows XP and earlier clients,C:\Windows\System32\drivers\srv.sys,ba6a188833ee781ce2cef9a9b4c1662f,System32\DRIVERS\srv.sys,SERVICE_FILE_SYSTEM_DRIVER,,true,true,The file is signed and the signature was verified.,Microsoft Windows,Microsoft Windows Verification PCA
WL0007KSX,WinDefend,Windows Defender,Protection against spyware and potentially unwanted software,C:\Windows\System32\svchost.exe,793714f016df50c2502afb5bd60031fb,C:\Windows\System32\svchost.exe -k secsvcs,SERVICE_WIN32_SHARE_PROCESS,C:\Program Files\Windows Defender\MpSvc.dll,true,true,The file is signed and the signature was verified.,Microsoft Windows,Microsoft Windows Verification PCA
WL0007KSX,ws2ifsl,Winsock IFS Driver,Winsock IFS Driver,C:\Windows\System32\drivers\ws2ifsl.sys,5597de1e00bbdeb38fd12c29dbe9f59f,\SystemRoot\system32\drivers\ws2ifsl.sys,SERVICE_KERNEL_DRIVER,,true,true,The file is signed and the signature was verified.,Microsoft Windows,Microsoft Windows Verification PCA
WL0007KSX,vmbus,vmbus,,C:\Windows\System32\drivers\vmbus.sys,64cfe346ce9acc7bd01fdfa94150c538,\SystemRoot\system32\drivers\vmbus.sys,SERVICE_KERNEL_DRIVER,,true,true,The file is signed and the signature was verified.,Microsoft Windows,Microsoft Windows Verification PCA
WL0007KSX,RdpVideoMiniport,Remote Desktop Video Miniport Driver,,C:\Windows\System32\drivers\rdpvideominiport.sys,572d824b904773bc275b7f10eb1ad2ac,System32\drivers\rdpvideominiport.sys,SERVICE_KERNEL_DRIVER,,true,true,The file is signed and the signature was verified.,Microsoft Windows,Microsoft Windows Verification PCA
WL0007KSX,discache,System Attribute Cache,Attribute Cache Indexer,C:\Windows\System32\drivers\discache.sys,1cf32257a9f4d46c8eac70e4b91644a9,System32\drivers\discache.sys,SERVICE_KERNEL_DRIVER,,true,true,The file is signed and the signature was verified.,Microsoft Windows,Microsoft Windows Verification PCA
WL0007KSX,TapiSrv,Telephony,Provides Telephony API (TAPI) support for programs that control telephony devices on the local computer and  through the LAN  on servers that are also running the service.,C:\Windows\System32\svchost.exe,793714f016df50c2502afb5bd60031fb,C:\Windows\System32\svchost.exe -k NetworkService,SERVICE_WIN32_SHARE_PROCESS,C:\Windows\System32\tapisrv.dll,true,true,The file is signed and the signature was verified.,Microsoft Windows,Microsoft Windows Verification PCA
WL0007KSX,nv_agp,NVIDIA nForce AGP Bus Filter,,C:\Windows\System32\drivers\NV_AGP.SYS,10b22ae0e08c973dfa6c6960ca119762,\SystemRoot\system32\drivers\nv_agp.sys,SERVICE_KERNEL_DRIVER,,true,true,The file is signed and the signature was verified.,Microsoft Windows,Microsoft Windows Verification PCA
WL0007KSX,W32Time,Windows Time,Maintains date and time synchronization on all clients and servers in the network. If this service is stopped  date and time synchronization will be unavailable. If this service is disabled  any services that explicitly depend on it will fail to start.,C:\Windows\System32\svchost.exe,793714f016df50c2502afb5bd60031fb,C:\Windows\system32\svchost.exe -k LocalService,SERVICE_WIN32_SHARE_PROCESS,C:\Windows\System32\w32time.dll,true,true,The file is signed and the signature was verified.,Microsoft Windows,Microsoft Windows Verification PCA
WL0007KSX,mrxsmb10,SMB 1.x MiniRedirector,Implements the SMB 1.x (CIFS) protocol. This protocol provides connectivity to network resources on pre-Windows Vista servers,C:\Windows\System32\drivers\mrxsmb10.sys,863083e0c438c2c993c9ba375e668678,system32\DRIVERS\mrxsmb10.sys,SERVICE_FILE_SYSTEM_DRIVER,,true,true,The file is signed and the signature was verified.,Microsoft Windows,Microsoft Windows Verification PCA
WL0007KSX,hidserv,Human Interface Device Access,Enables generic input access to Human Interface Devices (HID)  which activates and maintains the use of predefined hot buttons on keyboards  remote controls  and other multimedia devices. If this service is stopped  hot buttons controlled by this service will no longer function. If this service is disabled  any services that explicitly depend on it will fail to start.,C:\Windows\System32\svchost.exe,793714f016df50c2502afb5bd60031fb,C:\Windows\system32\svchost.exe -k LocalSystemNetworkRestricted,SERVICE_WIN32_SHARE_PROCESS,C:\Windows\System32\hidserv.dll,true,true,The file is signed and the signature was verified.,Microsoft Windows,Microsoft Windows Verification PCA
WL0007KSX,DfsC,DFS Namespace Client Driver,Client driver for access to DFS Namespaces,C:\Windows\System32\drivers\dfsc.sys,3a0008e14c5952fe7c04d105725abd4c,System32\Drivers\dfsc.sys,SERVICE_FILE_SYSTEM_DRIVER,,true,true,The file is signed and the signature was verified.,Microsoft Windows,Microsoft Windows Verification PCA
WL0007KSX,Serial,Serial,,C:\Windows\System32\drivers\serial.sys,0fd7ebd780bc1ad1099cfc23ac0806b1,\SystemRoot\system32\drivers\serial.sys,SERVICE_KERNEL_DRIVER,,true,true,The file is signed and the signature was verified.,Microsoft Windows,Microsoft Windows Verification PCA
WL0007KSX,viaide,viaide,,C:\Windows\System32\drivers\viaide.sys,be9075ebc317f968d030072b26591f8d,\SystemRoot\system32\drivers\viaide.sys,SERVICE_KERNEL_DRIVER,,true,true,The file is signed and the signature was verified.,Microsoft Windows,Microsoft Windows Verification PCA
WL0007KSX,Mcx2Svc,Media Center Extender Service,Allows Media Center Extenders to locate and connect to the computer.,C:\Windows\System32\svchost.exe,793714f016df50c2502afb5bd60031fb,C:\Windows\system32\svchost.exe -k LocalServiceAndNoImpersonation,SERVICE_WIN32_SHARE_PROCESS,C:\Windows\System32\Mcx2Svc.dll,true,true,The file is signed and the signature was verified.,Microsoft Windows,Microsoft Windows Verification PCA
WL0007KSX,LSI_SCSI,LSI_SCSI,,C:\Windows\System32\drivers\lsi_scsi.sys,be4fe3cb1aa77b09c48f4fc8defba825,\SystemRoot\system32\drivers\lsi_scsi.sys,SERVICE_KERNEL_DRIVER,,true,true,The file is signed and the signature was verified.,Microsoft Windows,Microsoft Windows Verification PCA
WL0007KSX,rdpbus,Remote Desktop Device Redirector Bus Driver,,C:\Windows\System32\drivers\rdpbus.sys,d04e36e3238a695f2f24acc496f2c705,\SystemRoot\System32\drivers\rdpbus.sys,SERVICE_KERNEL_DRIVER,,true,true,The file is signed and the signature was verified.,Microsoft Windows,Microsoft Windows Production PCA 2011
WL0007KSX,TermService,Remote Desktop Services,Allows users to connect interactively to a remote computer. Remote Desktop and Remote Desktop Session Host Server depend on this service.  To prevent remote use of this computer  clear the checkboxes on the Remote tab of the System properties control panel item.,C:\Windows\System32\svchost.exe,793714f016df50c2502afb5bd60031fb,C:\Windows\System32\svchost.exe -k NetworkService,SERVICE_WIN32_SHARE_PROCESS,C:\Windows\System32\termsrv.dll,true,true,The file is signed and the signature was verified.,Microsoft Windows,Microsoft Windows Verification PCA
WL0007KSX,pcw,Performance Counters for Windows Driver,,C:\Windows\System32\drivers\pcw.sys,7803c5da78b007a79832baba172951a8,\SystemRoot\System32\drivers\pcw.sys,SERVICE_KERNEL_DRIVER,,true,true,The file is signed and the signature was verified.,Microsoft Windows,Microsoft Windows Verification PCA
WL0007KSX,bowser,Browser Support Driver,Implements the kernel datagram receiver for the computer browser browser service.,C:\Windows\System32\drivers\bowser.sys,4dd64c239f270344dcd611bc47f593bc,system32\DRIVERS\bowser.sys,SERVICE_FILE_SYSTEM_DRIVER,,true,true,The file is signed and the signature was verified.,Microsoft Windows,Microsoft Windows Verification PCA
WL0007KSX,IPBusEnum,PnP-X IP Bus Enumerator,The PnP-X bus enumerator service manages the virtual network bus. It discovers network connected devices using the SSDP/WS discovery protocols and gives them presence in PnP. If this service is stopped or disabled  presence of NCD devices will not be maintained in PnP. All pnpx based scenarios will stop functioning.,C:\Windows\System32\svchost.exe,793714f016df50c2502afb5bd60031fb,C:\Windows\system32\svchost.exe -k LocalSystemNetworkRestricted,SERVICE_WIN32_SHARE_PROCESS,C:\Windows\System32\ipbusenum.dll,true,true,The file is signed and the signature was verified.,Microsoft Windows,Microsoft Windows Verification PCA
WL0007KSX,Mup,Mup,Multiple UNC Provider Driver,C:\Windows\System32\drivers\mup.sys,c1539ecc4b444770b9c1d6ce066223fa,\SystemRoot\System32\Drivers\mup.sys,SERVICE_FILE_SYSTEM_DRIVER,,true,true,The file is signed and the signature was verified.,Microsoft Windows,Microsoft Windows Verification PCA
WL0007KSX,VaultSvc,Credential Manager,Provides secure storage and retrieval of credentials to users  applications and security service packages.,C:\Windows\System32\lsass.exe,da975e35deb4ca4da28c30761f3a0de1,C:\Windows\system32\lsass.exe,SERVICE_WIN32_SHARE_PROCESS,,true,true,The file is signed and the signature was verified.,Microsoft Windows,Microsoft Windows Verification PCA
WL0007KSX,VBoxGuest,VirtualBox Guest Driver,,C:\Windows\System32\drivers\VBoxGuest.sys,c9db5ade567fb56477c1dcceea195038,\SystemRoot\system32\DRIVERS\VBoxGuest.sys,SERVICE_KERNEL_DRIVER,,true,true,The file is signed and the signature was verified.,Oracle Corporation,VeriSign Class 3 Code Signing 2010 CA
WL0007KSX,hkmsvc,Health Key and Certificate Management,Provides X.509 certificate and key management services for the Network Access Protection Agent (NAPAgent). Enforcement technologies that use X.509 certificates may not function properly without this service,C:\Windows\System32\svchost.exe,793714f016df50c2502afb5bd60031fb,C:\Windows\System32\svchost.exe -k netsvcs,SERVICE_WIN32_SHARE_PROCESS,C:\Windows\System32\KMSVC.DLL,true,true,The file is signed and the signature was verified.,Microsoft Windows,Microsoft Windows Verification PCA
WL0007KSX,RDPDR,Remote Desktop Device Redirector Driver,Remote Desktop Device Redirector Driver,C:\Windows\System32\drivers\rdpdr.sys,d8dd14fa53cca705c5eb044e46e5bac5,System32\drivers\rdpdr.sys,SERVICE_KERNEL_DRIVER,,true,true,The file is signed and the signature was verified.,Microsoft Windows,Microsoft Windows Production PCA 2011
WL0007KSX,MegaSR,MegaSR,,C:\Windows\System32\drivers\MegaSR.sys,5b25a6ba19808142434f45d1f0bb57eb,\SystemRoot\system32\drivers\MegaSR.sys,SERVICE_KERNEL_DRIVER,,true,true,The file is signed and the signature was verified.,Microsoft Windows,Microsoft Windows Verification PCA
WL0007KSX,BDESVC,BitLocker Drive Encryption Service,BDESVC hosts the BitLocker Drive Encryption service. BitLocker Drive Encryption provides secure startup for the operating system  as well as full volume encryption for OS  fixed or removable volumes. This service allows BitLocker to prompt users for various actions related to their volumes when mounted  and unlocks volumes automatically without user interaction. Additionally  it stores recovery information to Active Directory  if available  and  if necessary  ensures the most recent recovery certificates are used.  Stopping or disabling the service would prevent users from leveraging this functionality.,C:\Windows\System32\svchost.exe,793714f016df50c2502afb5bd60031fb,C:\Windows\System32\svchost.exe -k netsvcs,SERVICE_WIN32_SHARE_PROCESS,C:\Windows\System32\bdesvc.dll,true,true,The file is signed and the signature was verified.,Microsoft Windows,Microsoft Windows Verification PCA
WL0007KSX,volsnap,Storage volumes,,C:\Windows\System32\drivers\volsnap.sys,c63175da6616c4eed130f8a2582e5823,\SystemRoot\system32\drivers\volsnap.sys,SERVICE_KERNEL_DRIVER,,true,true,The file is signed and the signature was verified.,Microsoft Windows,Microsoft Windows Verification PCA
WL0007KSX,lmhosts,TCP/IP NetBIOS Helper,Provides support for the NetBIOS over TCP/IP (NetBT) service and NetBIOS name resolution for clients on the network  therefore enabling users to share files  print  and log on to the network. If this service is stopped  these functions might be unavailable. If this service is disabled  any services that explicitly depend on it will fail to start.,C:\Windows\System32\svchost.exe,793714f016df50c2502afb5bd60031fb,C:\Windows\system32\svchost.exe -k LocalServiceNetworkRestricted,SERVICE_WIN32_SHARE_PROCESS,C:\Windows\System32\lmhsvc.dll,true,true,The file is signed and the signature was verified.,Microsoft Windows,Microsoft Windows Verification PCA
WL0007KSX,WudfPf,User Mode Driver Frameworks Platform Driver,,C:\Windows\System32\drivers\WUDFPf.sys,df9a7f4e6d37c58d8ad9e782934f00da,system32\drivers\WudfPf.sys,SERVICE_KERNEL_DRIVER,,true,true,The file is signed and the signature was verified.,Microsoft Windows,Microsoft Windows Verification PCA
WL0007KSX,ehSched,Windows Media Center Scheduler Service,Starts and stops recording of TV programs within Windows Media Center,C:\Windows\ehome\ehsched.exe,72de7bd4afe258e2061b6bbf35df596a,C:\Windows\ehome\ehsched.exe,SERVICE_WIN32_OWN_PROCESS,,true,true,The file is signed and the signature was verified.,Microsoft Windows,Microsoft Windows Verification PCA
WL0007KSX,Dnscache,DNS Client,The DNS Client service (dnscache) caches Domain Name System (DNS) names and registers the full computer name for this computer. If the service is stopped  DNS names will continue to be resolved. However  the results of DNS name queries will not be cached and the computer's name will not be registered. If the service is disabled  any services that explicitly depend on it will fail to start.,C:\Windows\System32\svchost.exe,793714f016df50c2502afb5bd60031fb,C:\Windows\system32\svchost.exe -k NetworkService,SERVICE_WIN32_SHARE_PROCESS,C:\Windows\System32\dnsrslvr.dll,true,true,The file is signed and the signature was verified.,Microsoft Windows,Microsoft Windows Verification PCA
WL0007KSX,defragsvc,Disk Defragmenter,Provides Disk Defragmentation Capabilities.,C:\Windows\System32\svchost.exe,793714f016df50c2502afb5bd60031fb,C:\Windows\system32\svchost.exe -k defragsvc,SERVICE_WIN32_OWN_PROCESS,C:\Windows\System32\defragsvc.dll,true,true,The file is signed and the signature was verified.,Microsoft Windows,Microsoft Windows Verification PCA
WL0007KSX,clr_optimization_v2.0.50727_64,Microsoft .NET Framework NGEN v2.0.50727_X64,Microsoft .NET Framework NGEN,C:\Windows\Microsoft.NET\Framework64\v2.0.50727\mscorsvw.exe,d0c52475db56d0212a3001663641a2b5,C:\Windows\Microsoft.NET\Framework64\v2.0.50727\mscorsvw.exe,SERVICE_WIN32_OWN_PROCESS,,true,true,The file is signed and the signature was verified.,Microsoft Windows,Microsoft Windows Verification PCA
WL0007KSX,IPMIDRV,IPMIDRV,,C:\Windows\System32\drivers\IPMIDrv.sys,3bcadd26066db2550fc843dcd751c3c8,\SystemRoot\system32\drivers\IPMIDrv.sys,SERVICE_KERNEL_DRIVER,,true,true,The file is signed and the signature was verified.,Microsoft Windows,Microsoft Windows Verification PCA
WL0007KSX,uagp35,Microsoft AGPv3.5 Filter,,C:\Windows\System32\drivers\UAGP35.SYS,c78dcce7a11572f54d475632c1d9e3d2,\SystemRoot\system32\drivers\uagp35.sys,SERVICE_KERNEL_DRIVER,,true,true,The file is signed and the signature was verified.,Microsoft Windows,Microsoft Windows Verification PCA
WL0007KSX,Smb,Message-oriented TCP/IP and TCP/IPv6 Protocol (SMB session),Microsoft NetbiosSmb Device Driver,C:\Windows\System32\drivers\smb.sys,ebb8e7165eafd8b112fd6612730061a9,system32\DRIVERS\smb.sys,SERVICE_KERNEL_DRIVER,,true,true,The file is signed and the signature was verified.,Microsoft Windows,Microsoft Windows Verification PCA
WL0007KSX,TDTCP,TDTCP,,C:\Windows\System32\drivers\tdtcp.sys,9321d8bc5055450423a4666f3dc2de94,system32\drivers\tdtcp.sys,SERVICE_KERNEL_DRIVER,,true,true,The file is signed and the signature was verified.,Microsoft Windows,Microsoft Windows Verification PCA
WL0007KSX,HidIr,Microsoft Infrared HID Driver,,C:\Windows\System32\drivers\hidir.sys,99a94d5aa03ab06f71c82dddc5af1167,\SystemRoot\system32\drivers\hidir.sys,SERVICE_KERNEL_DRIVER,,true,true,The file is signed and the signature was verified.,Microsoft Windows,Microsoft Windows Verification PCA
WL0007KSX,rdpbus,Remote Desktop Device Redirector Bus Driver,,C:\Windows\System32\drivers\rdpbus.sys,72c73f43258ccd41309c9630ed00449c,system32\DRIVERS\rdpbus.sys,SERVICE_KERNEL_DRIVER,,true,true,The file is signed and the signature was verified.,Microsoft Windows,Microsoft Windows Verification PCA
WL0007KSX,vds,Virtual Disk,Provides management services for disks  volumes  file systems  and storage arrays.,C:\Windows\System32\vds.exe,0af0c7214326c0f9d423b02ef736d337,C:\Windows\System32\vds.exe,SERVICE_WIN32_OWN_PROCESS,,true,true,The file is signed and the signature was verified.,Microsoft Windows,Microsoft Windows Verification PCA
WL0007KSX,NanoServiceMain,Panda Protection Service,Panda Protection Service,C:\Program Files (x86)\Panda Security\Panda Security Protection\PSANHost.exe,8ed35abf71688fee7923337e15df40c9,C:\Program Files (x86)\Panda Security\Panda Security Protection\PSANHost.exe,SERVICE_WIN32_OWN_PROCESS,,true,true,The file is signed and the signature was verified.,Panda Security S.L.,DigiCert Assured ID Code Signing CA-1
WL0007KSX,udfs,udfs,Reads/Writes UDF 1.02 1.5 2.0x 2.5 disc formats  usually found on C/DVD discs. (Core) (All pieces),C:\Windows\System32\drivers\udfs.sys,e3fb349f9d49c903771642cd3c615496,system32\DRIVERS\udfs.sys,SERVICE_FILE_SYSTEM_DRIVER,,true,true,The file is signed and the signature was verified.,Microsoft Windows,Microsoft Windows Verification PCA
WL0007KSX,NDIS,NDIS System Driver,NDIS System Driver,C:\Windows\System32\drivers\ndis.sys,6afaffc04cf111910a3d40d73657af23,\SystemRoot\system32\drivers\ndis.sys,SERVICE_KERNEL_DRIVER,,true,true,The file is signed and the signature was verified.,Microsoft Windows,Microsoft Windows Verification PCA
