hostname,name,descriptivename,description,path,md5,arguments,type,servicedll,pathsignatureexists,pathsignatureverified,pathsignaturedescription,pathcertificatesubject,pathcertificateissuer
WL0007KSX,mshidkmdf,Pass-through HID to KMDF Filter Driver,Device Filter to provide pass-through interface between HIDCLASS and KMDF,C:\Windows\System32\drivers\mshidkmdf.sys,be0c113a39ed1cc1cacd4758bbdcf60c,\SystemRoot\System32\drivers\mshidkmdf.sys,SERVICE_KERNEL_DRIVER,,true,true,The file is signed and the signature was verified.,Microsoft Windows,Microsoft Windows Verification PCA
WL0007KSX,CLFS,Common Log (CLFS),General-purpose logging service,C:\Windows\System32\clfs.sys,c186b0218ed1894da59be304de71231a,\SystemRoot\System32\CLFS.sys,SERVICE_KERNEL_DRIVER,,true,true,The file is signed and the signature was verified.,Microsoft Windows,Microsoft Windows Verification PCA
WL0007KSX,wuauserv,Windows Update,Enables the detection  download  and installation of updates for Windows and other programs. If this service is disabled  users of this computer will not be able to use Windows Update or its automatic updating feature  and programs will not be able to use the Windows Update Agent (WUA) API.,C:\Windows\System32\svchost.exe,793714f016df50c2502afb5bd60031fb,C:\Windows\system32\svchost.exe -k netsvcs,SERVICE_WIN32_SHARE_PROCESS,C:\Windows\System32\wuaueng.dll,true,true,The file is signed and the signature was verified.,Microsoft Windows,Microsoft Windows Verification PCA
WL0007KSX,gagp30kx,Microsoft Generic AGPv3.0 Filter for K8 Processor Platforms,,C:\Windows\System32\drivers\GAGP30KX.SYS,373d42641fc46af9e608732093de8008,\SystemRoot\system32\drivers\gagp30kx.sys,SERVICE_KERNEL_DRIVER,,true,true,The file is signed and the signature was verified.,Microsoft Windows,Microsoft Windows Verification PCA
WL0007KSX,VGPU,VGPU,,C:\Windows\System32\drivers\rdvgkmd.sys,f5cc45e473964d680a6eeff1d104683c,System32\drivers\rdvgkmd.sys,SERVICE_KERNEL_DRIVER,,,,,,
WL0007KSX,wmiApSrv,WMI Performance Adapter,Provides performance library information from Windows Management Instrumentation (WMI) providers to clients on the network. This service only runs when Performance Data Helper is activated.,C:\Windows\System32\wbem\WmiApSrv.exe,c36c4d8bc60dc0092972585f725b1769,C:\Windows\system32\wbem\WmiApSrv.exe,SERVICE_WIN32_OWN_PROCESS,,true,true,The file is signed and the signature was verified.,Microsoft Windows,Microsoft Windows Verification PCA
WL0007KSX,CSC,Offline Files Driver,Allows network files to be used while the local computer is offline.,C:\Windows\System32\drivers\csc.sys,70f5391776777f64d993f93f4388efde,system32\drivers\csc.sys,SERVICE_KERNEL_DRIVER,,true,true,The file is signed and the signature was verified.,Microsoft Windows,Microsoft Windows Verification PCA
WL0007KSX,msahci,msahci,,C:\Windows\System32\drivers\msahci.sys,c6f2df4f3e2a27b74c5e804d41b55d38,\SystemRoot\system32\drivers\msahci.sys,SERVICE_KERNEL_DRIVER,,true,true,The file is signed and the signature was verified.,Microsoft Windows,Microsoft Windows Verification PCA
WL0007KSX,Power,Power,Manages power policy and power policy notification delivery.,C:\Windows\System32\svchost.exe,793714f016df50c2502afb5bd60031fb,C:\Windows\system32\svchost.exe -k DcomLaunch,SERVICE_WIN32_SHARE_PROCESS,C:\Windows\System32\umpo.dll,true,true,The file is signed and the signature was verified.,Microsoft Windows,Microsoft Windows Verification PCA
WL0007KSX,CertPropSvc,Certificate Propagation,Copies user certificates and root certificates from smart cards into the current user's certificate store  detects when a smart card is inserted into a smart card reader  and  if needed  installs the smart card Plug and Play minidriver.,C:\Windows\System32\svchost.exe,793714f016df50c2502afb5bd60031fb,C:\Windows\system32\svchost.exe -k netsvcs,SERVICE_WIN32_SHARE_PROCESS,C:\Windows\System32\certprop.dll,true,true,The file is signed and the signature was verified.,Microsoft Windows,Microsoft Windows Verification PCA
WL0007KSX,crcdisk,Crcdisk Filter Driver,,C:\Windows\System32\drivers\crcdisk.sys,8a70d6810f2d72d8f280933335819dfc,\SystemRoot\system32\drivers\crcdisk.sys,SERVICE_KERNEL_DRIVER,,true,true,The file is signed and the signature was verified.,Microsoft Windows,Microsoft Windows Verification PCA
WL0007KSX,wudfsvc,Windows Driver Foundation - User-mode Driver Framework,Manages user-mode driver host processes.,C:\Windows\System32\svchost.exe,793714f016df50c2502afb5bd60031fb,C:\Windows\system32\svchost.exe -k LocalSystemNetworkRestricted,SERVICE_WIN32_SHARE_PROCESS,C:\Windows\System32\WUDFSvc.dll,true,true,The file is signed and the signature was verified.,Microsoft Windows,Microsoft Windows Verification PCA
WL0007KSX,wercplsupport,Problem Reports and Solutions Control Panel Support,This service provides support for viewing  sending and deletion of system-level problem reports for the Problem Reports and Solutions control panel.,C:\Windows\System32\svchost.exe,793714f016df50c2502afb5bd60031fb,C:\Windows\System32\svchost.exe -k netsvcs,SERVICE_WIN32_SHARE_PROCESS,C:\Windows\System32\wercplsupport.dll,true,true,The file is signed and the signature was verified.,Microsoft Windows,Microsoft Windows Verification PCA
WL0007KSX,WSearch,Windows Search,Provides content indexing  property caching  and search results for files  e-mail  and other content.,C:\Windows\System32\SearchIndexer.exe,418557f7696dd43add790d2131b3b16f,C:\Windows\system32\SearchIndexer.exe /Embedding,SERVICE_WIN32_OWN_PROCESS,,true,true,The file is signed and the signature was verified.,Microsoft Windows,Microsoft Windows Verification PCA
WL0007KSX,sermouse,Serial Mouse Driver,,C:\Windows\System32\drivers\sermouse.sys,0500700502e76758072354d1a78982ad,\SystemRoot\system32\drivers\sermouse.sys,SERVICE_KERNEL_DRIVER,,true,true,The file is signed and the signature was verified.,Microsoft Windows,Microsoft Windows Verification PCA
WL0007KSX,iphlpsvc,IP Helper,Provides tunnel connectivity using IPv6 transition technologies (6to4  ISATAP  Port Proxy  and Teredo)  and IP-HTTPS. If this service is stopped  the computer will not have the enhanced connectivity benefits that these technologies offer.,C:\Windows\System32\svchost.exe,793714f016df50c2502afb5bd60031fb,C:\Windows\System32\svchost.exe -k NetSvcs,SERVICE_WIN32_SHARE_PROCESS,C:\Windows\System32\iphlpsvc.dll,true,true,The file is signed and the signature was verified.,Microsoft Windows,Microsoft Windows Verification PCA
WL0007KSX,b57nd60a,Broadcom NetXtreme Gigabit Ethernet - NDIS 6.0,,C:\Windows\System32\drivers\b57nd60a.sys,713a1446e3764e1b5febb8c46b3d3465,system32\DRIVERS\b57nd60a.sys,SERVICE_KERNEL_DRIVER,,true,true,The file is signed and the signature was verified.,Microsoft Windows,Microsoft Windows Verification PCA
WL0007KSX,vga,vga,,C:\Windows\System32\drivers\vgapnp.sys,5acc7b521ef75a7806db0e27e627748a,system32\DRIVERS\vgapnp.sys,SERVICE_KERNEL_DRIVER,,true,true,The file is signed and the signature was verified.,Microsoft Windows,Microsoft Windows Verification PCA
WL0007KSX,Brserid,Brother MFC Serial Port Interface Driver (WDM),,C:\Windows\System32\drivers\BrSerId.sys,c6de0c76bb48a81b5a317f76c52b358e,\SystemRoot\System32\Drivers\Brserid.sys,SERVICE_KERNEL_DRIVER,,true,true,The file is signed and the signature was verified.,Microsoft Windows,Microsoft Windows Verification PCA
WL0007KSX,ohci1394,1394 OHCI Compliant Host Controller (Legacy),,C:\Windows\System32\drivers\ohci1394.sys,06bb6c418e93d4c4ed7f3bf6cf559ca1,\SystemRoot\system32\drivers\ohci1394.sys,SERVICE_KERNEL_DRIVER,,true,true,The file is signed and the signature was verified.,Microsoft Windows,Microsoft Windows Verification PCA
WL0007KSX,PSUAService,Panda Product Service,Panda Product Service,C:\Program Files (x86)\Panda Security\Panda Security Protection\PSUAService.exe,3a1bfe9b3a0dd3c4687832d76ecc6140,C:\Program Files (x86)\Panda Security\Panda Security Protection\PSUAService.exe,SERVICE_WIN32_OWN_PROCESS,,true,true,The file is signed and the signature was verified.,Panda Security S.L.,DigiCert Assured ID Code Signing CA-1
WL0007KSX,SNMPTRAP,SNMP Trap,Receives trap messages generated by local or remote Simple Network Management Protocol (SNMP) agents and forwards the messages to SNMP management programs running on this computer. If this service is stopped  SNMP-based programs on this computer will not receive SNMP trap messages. If this service is disabled  any services that explicitly depend on it will fail to start.,C:\Windows\System32\snmptrap.exe,096e6e0dcc2ac226333b6417fccf9f20,C:\Windows\System32\snmptrap.exe,SERVICE_WIN32_OWN_PROCESS,,true,true,The file is signed and the signature was verified.,Microsoft Windows,Microsoft Windows Verification PCA
WL0007KSX,CryptSvc,Cryptographic Services,Provides four management services: Catalog Database Service  which confirms the signatures of Windows files and allows new programs to be installed; Protected Root Service  which adds and removes Trusted Root Certification Authority certificates from this computer; Automatic Root Certificate Update Service  which retrieves root certificates from Windows Update and enable scenarios such as SSL; and Key Service  which helps enroll this computer for certificates. If this service is stopped  these management services will not function properly. If this service is disabled  any services that explicitly depend on it will fail to start.,C:\Windows\System32\svchost.exe,793714f016df50c2502afb5bd60031fb,C:\Windows\system32\svchost.exe -k NetworkService,SERVICE_WIN32_SHARE_PROCESS,C:\Windows\System32\cryptsvc.dll,true,true,The file is signed and the signature was verified.,Microsoft Windows,Microsoft Windows Verification PCA
WL0007KSX,dot3svc,Wired AutoConfig,The Wired AutoConfig (DOT3SVC) service is responsible for performing IEEE 802.1X authentication on Ethernet interfaces. If your current wired network deployment enforces 802.1X authentication  the DOT3SVC service should be configured to run for establishing Layer 2 connectivity and/or providing access to network resources. Wired networks that do not enforce 802.1X authentication are unaffected by the DOT3SVC service.,C:\Windows\System32\svchost.exe,793714f016df50c2502afb5bd60031fb,C:\Windows\system32\svchost.exe -k LocalSystemNetworkRestricted,SERVICE_WIN32_SHARE_PROCESS,C:\Windows\System32\dot3svc.dll,true,true,The file is signed and the signature was verified.,Microsoft Windows,Microsoft Windows Verification PCA
WL0007KSX,Fax,Fax,Enables you to send and receive faxes  utilizing fax resources available on this computer or on the network.,C:\Windows\System32\FXSSVC.exe,23f02e965b5e9d19f8a95c9e8ad6b5bf,C:\Windows\system32\fxssvc.exe,SERVICE_WIN32_OWN_PROCESS,,true,true,The file is signed and the signature was verified.,Microsoft Windows,Microsoft Windows Verification PCA
WL0007KSX,flpydisk,Floppy Disk Driver,,C:\Windows\System32\drivers\flpydisk.sys,b7f59cc478e926f90eecf684425b382e,\SystemRoot\system32\drivers\flpydisk.sys,SERVICE_KERNEL_DRIVER,,true,true,The file is signed and the signature was verified.,Microsoft Windows,Microsoft Windows Verification PCA
WL0007KSX,arcsas,arcsas,,C:\Windows\System32\drivers\arcsas.sys,702314e175d93abd4494b2487272e5a1,\SystemRoot\system32\drivers\arcsas.sys,SERVICE_KERNEL_DRIVER,,true,true,The file is signed and the signature was verified.,Microsoft Windows,Microsoft Windows Verification PCA
WL0007KSX,circlass,Consumer IR Devices,,C:\Windows\System32\drivers\circlass.sys,eb6e5391c3cb32fb3eff71029b568004,\SystemRoot\system32\drivers\circlass.sys,SERVICE_KERNEL_DRIVER,,true,true,The file is signed and the signature was verified.,Microsoft Windows,Microsoft Windows Verification PCA
WL0007KSX,RdpVideoMiniport,Remote Desktop Video Miniport Driver,,C:\Windows\System32\drivers\rdpvideominiport.sys,1030cda75ad64f32f226fbbf59e38e32,System32\drivers\rdpvideominiport.sys,SERVICE_KERNEL_DRIVER,,true,true,The file is signed and the signature was verified.,Microsoft Windows,Microsoft Windows Production PCA 2011
WL0007KSX,dmvsc,dmvsc,,C:\Windows\System32\drivers\dmvsc.sys,0cbf95da68e2ff8450e99c79aedb0289,\SystemRoot\system32\drivers\dmvsc.sys,SERVICE_KERNEL_DRIVER,,true,true,The file is signed and the signature was verified.,Microsoft Windows,Microsoft Windows Verification PCA
WL0007KSX,SstpSvc,Secure Socket Tunneling Protocol Service,Provides support for the Secure Socket Tunneling Protocol (SSTP) to connect to remote computers using VPN. If this service is disabled  users will not be able to use SSTP to access remote servers.,C:\Windows\System32\svchost.exe,793714f016df50c2502afb5bd60031fb,C:\Windows\system32\svchost.exe -k LocalService,SERVICE_WIN32_SHARE_PROCESS,C:\Windows\System32\sstpsvc.dll,true,true,The file is signed and the signature was verified.,Microsoft Windows,Microsoft Windows Verification PCA
WL0007KSX,rdyboost,ReadyBoost,ReadyBoost,C:\Windows\System32\drivers\rdyboost.sys,f31c15398d39e5b345929219fafed28a,\SystemRoot\System32\drivers\rdyboost.sys,SERVICE_KERNEL_DRIVER,,true,true,The file is signed and the signature was verified.,Microsoft Windows,Microsoft Windows Verification PCA
WL0007KSX,WPDBusEnum,Portable Device Enumerator Service,Enforces group policy for removable mass-storage devices. Enables applications such as Windows Media Player and Image Import Wizard to transfer and synchronize content using removable mass-storage devices.,C:\Windows\System32\svchost.exe,793714f016df50c2502afb5bd60031fb,C:\Windows\system32\svchost.exe -k LocalSystemNetworkRestricted,SERVICE_WIN32_SHARE_PROCESS,C:\Windows\System32\wpdbusenum.dll,true,true,The file is signed and the signature was verified.,Microsoft Windows,Microsoft Windows Verification PCA
WL0007KSX,DPS,Diagnostic Policy Service,The Diagnostic Policy Service enables problem detection  troubleshooting and resolution for Windows components.  If this service is stopped  diagnostics will no longer function.,C:\Windows\System32\svchost.exe,793714f016df50c2502afb5bd60031fb,C:\Windows\System32\svchost.exe -k LocalServiceNoNetwork,SERVICE_WIN32_SHARE_PROCESS,C:\Windows\System32\dps.dll,true,true,The file is signed and the signature was verified.,Microsoft Windows,Microsoft Windows Verification PCA
WL0007KSX,clr_optimization_v4.0.30319_64,Microsoft .NET Framework NGEN v4.0.30319_X64,Microsoft .NET Framework NGEN,C:\Windows\Microsoft.NET\Framework64\v4.0.30319\mscorsvw.exe,e13d6ff3fef4e1ba696fc48d47173b71,C:\Windows\Microsoft.NET\Framework64\v4.0.30319\mscorsvw.exe,SERVICE_WIN32_OWN_PROCESS,,true,true,The file is signed and the signature was verified.,Microsoft Corporation,Microsoft Code Signing PCA
WL0007KSX,sppuinotify,SPP Notification Service,Provides Software Licensing activation and notification,C:\Windows\System32\svchost.exe,793714f016df50c2502afb5bd60031fb,C:\Windows\system32\svchost.exe -k LocalService,SERVICE_WIN32_SHARE_PROCESS,C:\Windows\System32\sppuinotify.dll,true,true,The file is signed and the signature was verified.,Microsoft Windows,Microsoft Windows Verification PCA
WL0007KSX,lltdio,Link-Layer Topology Discovery Mapper I/O Driver,,C:\Windows\System32\drivers\lltdio.sys,032e6f68cffc37b1672a4048fa55621c,system32\DRIVERS\lltdio.sys,SERVICE_KERNEL_DRIVER,,true,true,The file is signed and the signature was verified.,Microsoft Windows,Microsoft Windows Verification PCA
WL0007KSX,UmPass,Microsoft UMPass Driver,,C:\Windows\System32\drivers\umpass.sys,9a6e890b9b2063f6081b8f97413a1eca,\SystemRoot\system32\drivers\umpass.sys,SERVICE_KERNEL_DRIVER,,true,true,The file is signed and the signature was verified.,Microsoft Windows,Microsoft Windows Verification PCA
WL0007KSX,FltMgr,FltMgr,File System Filter Manager Driver,C:\Windows\System32\drivers\fltMgr.sys,21ee5e308be5838145e766b8722e9b90,\SystemRoot\system32\drivers\fltmgr.sys,SERVICE_FILE_SYSTEM_DRIVER,,true,true,The file is signed and the signature was verified.,Microsoft Windows,Microsoft Windows Verification PCA
WL0007KSX,RDPENCDD,RDP Encoder Mirror Driver,RDP Encoder Mirror Driver,C:\Windows\System32\drivers\RDPENCDD.sys,5e578903c495c5068178270ef9bed8d2,system32\drivers\rdpencdd.sys,SERVICE_KERNEL_DRIVER,,true,true,The file is signed and the signature was verified.,Microsoft Windows,Microsoft Windows Verification PCA
WL0007KSX,MSKSSRV,Microsoft Streaming Service Proxy,,C:\Windows\System32\drivers\mskssrv.sys,f38008d0c443d2628be1fdb60da8fe02,system32\drivers\MSKSSRV.sys,SERVICE_KERNEL_DRIVER,,true,true,The file is signed and the signature was verified.,Microsoft Windows,Microsoft Windows Verification PCA
WL0007KSX,WfpLwf,WFP Lightweight Filter,WFP Lightweight Filter,C:\Windows\System32\drivers\wfplwf.sys,e24f44f063ab9aa2a526dc48a5ef40ef,system32\DRIVERS\wfplwf.sys,SERVICE_KERNEL_DRIVER,,true,true,The file is signed and the signature was verified.,Microsoft Windows,Microsoft Windows Verification PCA
WL0007KSX,umbus,UMBus Enumerator Driver,,C:\Windows\System32\drivers\umbus.sys,7a8bff8a7060808a6625c561ff741972,system32\DRIVERS\umbus.sys,SERVICE_KERNEL_DRIVER,,true,true,The file is signed and the signature was verified.,Microsoft Windows,Microsoft Windows Verification PCA
WL0007KSX,RasPppoe,Remote Access PPPOE Driver,Remote Access PPPOE Driver,C:\Windows\System32\drivers\raspppoe.sys,8ef44fd26988d673174dce509e45ae52,system32\DRIVERS\raspppoe.sys,SERVICE_KERNEL_DRIVER,,true,true,The file is signed and the signature was verified.,Microsoft Windows,Microsoft Windows Verification PCA
WL0007KSX,KSecDD,KSecDD,,C:\Windows\System32\drivers\ksecdd.sys,ffc36d9bab473200151f99816852a883,\SystemRoot\System32\Drivers\ksecdd.sys,SERVICE_KERNEL_DRIVER,,true,true,The file is signed and the signature was verified.,Microsoft Windows,Microsoft Windows Verification PCA
WL0007KSX,sffp_sd,SFF Storage Protocol Driver for SDBus,,C:\Windows\System32\drivers\sffp_sd.sys,18c1bb092b9b6f3e73c8c6d9b28cf98c,\SystemRoot\system32\drivers\sffp_sd.sys,SERVICE_KERNEL_DRIVER,,true,true,The file is signed and the signature was verified.,Microsoft Windows,Microsoft Windows Verification PCA
WL0007KSX,p2psvc,Peer Networking Grouping,Enables multi-party communication using Peer-to-Peer Grouping.  If disabled  some applications  such as HomeGroup  may not function.,C:\Windows\System32\svchost.exe,793714f016df50c2502afb5bd60031fb,C:\Windows\System32\svchost.exe -k LocalServicePeerNet,SERVICE_WIN32_SHARE_PROCESS,C:\Windows\System32\p2psvc.dll,true,true,The file is signed and the signature was verified.,Microsoft Windows,Microsoft Windows Verification PCA
WL0007KSX,HpSAMD,HpSAMD,,C:\Windows\System32\drivers\HpSAMD.sys,c32bd0088fa600fa4069087b89d71f21,\SystemRoot\system32\drivers\HpSAMD.sys,SERVICE_KERNEL_DRIVER,,true,true,The file is signed and the signature was verified.,Microsoft Windows,Microsoft Windows Verification PCA
WL0007KSX,ErrDev,Microsoft Hardware Error Device Driver,,C:\Windows\System32\drivers\errdev.sys,777a353aa22c56cf69e49c3b9ab157ef,\SystemRoot\system32\drivers\errdev.sys,SERVICE_KERNEL_DRIVER,,true,true,The file is signed and the signature was verified.,Microsoft Windows,Microsoft Windows Verification PCA
WL0007KSX,Winmgmt,Windows Management Instrumentation,Provides a common interface and object model to access management information about operating system  devices  applications and services. If this service is stopped  most Windows-based software will not function properly. If this service is disabled  any services that explicitly depend on it will fail to start.,C:\Windows\System32\svchost.exe,793714f016df50c2502afb5bd60031fb,C:\Windows\system32\svchost.exe -k netsvcs,SERVICE_WIN32_SHARE_PROCESS,C:\Windows\System32\wbem\WMIsvc.dll,true,true,The file is signed and the signature was verified.,Microsoft Windows,Microsoft Windows Verification PCA
WL0007KSX,sffdisk,SFF Storage Class Driver,,C:\Windows\System32\drivers\sffdisk.sys,318b47babd1ccf2a29f12bc3e98ed52b,\SystemRoot\system32\drivers\sffdisk.sys,SERVICE_KERNEL_DRIVER,,true,true,The file is signed and the signature was verified.,Microsoft Windows,Microsoft Windows Verification PCA
WL0007KSX,PcaSvc,Program Compatibility Assistant Service,This service provides support for the Program Compatibility Assistant (PCA).  PCA monitors programs installed and run by the user and detects known compatibility problems. If this service is stopped  PCA will not function properly.,C:\Windows\System32\svchost.exe,793714f016df50c2502afb5bd60031fb,C:\Windows\system32\svchost.exe -k LocalSystemNetworkRestricted,SERVICE_WIN32_SHARE_PROCESS,C:\Windows\System32\pcasvc.dll,true,true,The file is signed and the signature was verified.,Microsoft Windows,Microsoft Windows Verification PCA
WL0007KSX,rdpbus,Remote Desktop Device Redirector Bus Driver,,C:\Windows\System32\drivers\rdpbus.sys,5aa157e6790fe9d744151384ef2946cf,\SystemRoot\System32\drivers\rdpbus.sys,SERVICE_KERNEL_DRIVER,,true,true,The file is signed and the signature was verified.,Microsoft Windows,Microsoft Windows Production PCA 2011
WL0007KSX,Wdf01000,Kernel Mode Driver Frameworks service,,C:\Windows\System32\drivers\Wdf01000.sys,502bb32aaac4f272b2ccbee958cc0944,\SystemRoot\system32\drivers\Wdf01000.sys,SERVICE_KERNEL_DRIVER,,true,true,The file is signed and the signature was verified.,Microsoft Windows,Microsoft Windows Verification PCA
WL0007KSX,HdAudAddService,Microsoft 1.1 UAA Function Driver for High Definition Audio Service,,C:\Windows\System32\drivers\HdAudio.sys,932c7b2d1ba74a6d9bf2492720211a34,system32\drivers\HdAudio.sys,SERVICE_KERNEL_DRIVER,,true,true,The file is signed and the signature was verified.,Microsoft Windows,Microsoft Windows Verification PCA
WL0007KSX,UI0Detect,Interactive Services Detection,Enables user notification of user input for interactive services  which enables access to dialogs created by interactive services when they appear. If this service is stopped  notifications of new interactive service dialogs will no longer function and there might not be access to interactive service dialogs. If this service is disabled  both notifications of and access to new interactive service dialogs will no longer function.,C:\Windows\System32\UI0Detect.exe,ef7d079a6dd3300f547e47254102c09b,C:\Windows\system32\UI0Detect.exe,SERVICE_WIN32_OWN_PROCESS,,true,true,The file is signed and the signature was verified.,Microsoft Windows,Microsoft Windows Verification PCA
WL0007KSX,usbehci,Microsoft USB 2.0 Enhanced Host Controller Miniport Driver,,C:\Windows\System32\drivers\usbehci.sys,337def7376607397b3ba07b81508ed64,\SystemRoot\system32\drivers\usbehci.sys,SERVICE_KERNEL_DRIVER,,true,true,The file is signed and the signature was verified.,Microsoft Windows,Microsoft Windows Verification PCA
WL0007KSX,sbp2port,sbp2port,,C:\Windows\System32\drivers\sbp2port.sys,11e35a0faf4a91d26d1fbc18925e2409,\SystemRoot\system32\drivers\sbp2port.sys,SERVICE_KERNEL_DRIVER,,true,true,The file is signed and the signature was verified.,Microsoft Windows,Microsoft Windows Verification PCA
WL0007KSX,EventSystem,COM+ Event System,Supports System Event Notification Service (SENS)  which provides automatic distribution of events to subscribing Component Object Model (COM) components. If the service is stopped  SENS will close and will not be able to provide logon and logoff notifications. If this service is disabled  any services that explicitly depend on it will fail to start.,C:\Windows\System32\svchost.exe,793714f016df50c2502afb5bd60031fb,C:\Windows\system32\svchost.exe -k LocalService,SERVICE_WIN32_SHARE_PROCESS,C:\Windows\System32\es.dll,true,true,The file is signed and the signature was verified.,Microsoft Windows,Microsoft Windows Verification PCA
WL0007KSX,RpcEptMapper,RPC Endpoint Mapper,Resolves RPC interfaces identifiers to transport endpoints. If this service is stopped or disabled  programs using Remote Procedure Call (RPC) services will not function properly.,C:\Windows\System32\svchost.exe,793714f016df50c2502afb5bd60031fb,C:\Windows\system32\svchost.exe -k RPCSS,SERVICE_WIN32_SHARE_PROCESS,C:\Windows\System32\RpcEpMap.dll,true,true,The file is signed and the signature was verified.,Microsoft Windows,Microsoft Windows Verification PCA
WL0007KSX,RpcSs,Remote Procedure Call (RPC),The RPCSS service is the Service Control Manager for COM and DCOM servers. It performs object activations requests  object exporter resolutions and distributed garbage collection for COM and DCOM servers. If this service is stopped or disabled  programs using COM or DCOM will not function properly. It is strongly recommended that you have the RPCSS service running,C:\Windows\System32\svchost.exe,793714f016df50c2502afb5bd60031fb,C:\Windows\system32\svchost.exe -k rpcss,SERVICE_WIN32_SHARE_PROCESS,C:\Windows\System32\rpcss.dll,true,true,The file is signed and the signature was verified.,Microsoft Windows,Microsoft Windows Verification PCA
WL0007KSX,LSI_FC,LSI_FC,,C:\Windows\System32\drivers\lsi_fc.sys,f9a319ba8222a35f11c53296b349a9ad,\SystemRoot\system32\drivers\lsi_fc.sys,SERVICE_KERNEL_DRIVER,,true,true,The file is signed and the signature was verified.,Microsoft Windows,Microsoft Windows Verification PCA
WL0007KSX,VMBusHID,VMBusHID,,C:\Windows\System32\drivers\VMBusHID.sys,66be03756c6031372a52706548bf1abf,\SystemRoot\system32\drivers\VMBusHID.sys,SERVICE_KERNEL_DRIVER,,true,true,The file is signed and the signature was verified.,Microsoft Windows,Microsoft Windows Verification PCA
WL0007KSX,NetTcpPortSharing,Net.Tcp Port Sharing Service,Provides ability to share TCP ports over the net.tcp protocol.,C:\Windows\Microsoft.NET\Framework64\v4.0.30319\SMSvcHost.exe,ddd810d603f6addda44c90f5b307bd01,C:\Windows\Microsoft.NET\Framework64\v4.0.30319\SMSvcHost.exe,SERVICE_WIN32_SHARE_PROCESS,,true,true,The file is signed and the signature was verified.,Microsoft Corporation,Microsoft Code Signing PCA
