hostname,name,descriptivename,description,path,md5,arguments,type,servicedll,pathsignatureexists,pathsignatureverified,pathsignaturedescription,pathcertificatesubject,pathcertificateissuer
WN0003DTX,intelide,intelide,,C:\Windows\System32\drivers\intelide.sys,fae974d5f2db7e90be4d9a5d4f61d3d4,\SystemRoot\system32\drivers\intelide.sys,SERVICE_KERNEL_DRIVER,,true,true,The file is signed and the signature was verified.,Microsoft Windows,Microsoft Windows Verification PCA
WN0003DTX,SysMain,Superfetch,Maintains and improves system performance over time.,C:\Windows\System32\svchost.exe,4e13a941b99fe98effb858ff11a4415e,C:\Windows\system32\svchost.exe -k LocalSystemNetworkRestricted,SERVICE_WIN32_SHARE_PROCESS,C:\Windows\System32\sysmain.dll,true,true,The file is signed and the signature was verified.,Microsoft Windows,Microsoft Windows Verification PCA
WN0003DTX,mpio,mpio,,C:\Windows\System32\drivers\mpio.sys,eee09c175c4f71d81690b796f83a7a23,\SystemRoot\system32\drivers\mpio.sys,SERVICE_KERNEL_DRIVER,,true,true,The file is signed and the signature was verified.,Microsoft Windows,Microsoft Windows Verification PCA
WN0003DTX,EFS,Encrypting File System (EFS),Provides the core file encryption technology used to store encrypted files on NTFS file system volumes. If this service is stopped or disabled  applications will be unable to access encrypted files.,C:\Windows\System32\lsass.exe,e96666a4903239614350e69350a5931c,C:\Windows\System32\lsass.exe,SERVICE_WIN32_SHARE_PROCESS,,true,true,The file is signed and the signature was verified.,Microsoft Windows,Microsoft Windows Verification PCA
WN0003DTX,USBSTOR,USB Mass Storage Driver,,C:\Windows\System32\drivers\USBSTOR.SYS,4b32c1e2cfd3591e3fe99a79501918bc,\SystemRoot\system32\drivers\USBSTOR.SYS,SERVICE_KERNEL_DRIVER,,true,true,The file is signed and the signature was verified.,Microsoft Windows,Microsoft Windows Verification PCA
WN0003DTX,WerSvc,Windows Error Reporting Service,Allows errors to be reported when programs stop working or responding and allows existing solutions to be delivered. Also allows logs to be generated for diagnostic and repair services. If this service is stopped  error reporting might not work correctly and results of diagnostic services and repairs might not be displayed.,C:\Windows\System32\svchost.exe,4e13a941b99fe98effb858ff11a4415e,C:\Windows\System32\svchost.exe -k WerSvcGroup,SERVICE_WIN32_SHARE_PROCESS,C:\Windows\System32\wersvc.dll,true,true,The file is signed and the signature was verified.,Microsoft Windows,Microsoft Windows Verification PCA
WN0003DTX,Fax,Fax,Enables you to send and receive faxes  utilizing fax resources available on this computer or on the network.,C:\Windows\System32\FXSSVC.exe,d2b0db999c8c99fa9075a116eb3aa22f,C:\Windows\system32\fxssvc.exe,SERVICE_WIN32_OWN_PROCESS,,true,true,The file is signed and the signature was verified.,Microsoft Windows,Microsoft Windows Verification PCA
WN0003DTX,wercplsupport,Problem Reports and Solutions Control Panel Support,This service provides support for viewing  sending and deletion of system-level problem reports for the Problem Reports and Solutions control panel.,C:\Windows\System32\svchost.exe,4e13a941b99fe98effb858ff11a4415e,C:\Windows\System32\svchost.exe -k netsvcs,SERVICE_WIN32_SHARE_PROCESS,C:\Windows\System32\wercplsupport.dll,true,true,The file is signed and the signature was verified.,Microsoft Windows,Microsoft Windows Verification PCA
WN0003DTX,MSTEE,Microsoft Streaming Tee/Sink-to-Sink Converter,,C:\Windows\System32\drivers\mstee.sys,cff6440664c8358bb5e0a56e5a33c027,system32\drivers\MSTEE.sys,SERVICE_KERNEL_DRIVER,,true,true,The file is signed and the signature was verified.,Microsoft Windows,Microsoft Windows Verification PCA
WN0003DTX,iScsiPrt,iScsiPort Driver,,C:\Windows\System32\drivers\msiscsi.sys,a3a323ae7ad55067b5f461f652c6f3e1,\SystemRoot\system32\drivers\msiscsi.sys,SERVICE_KERNEL_DRIVER,,true,true,The file is signed and the signature was verified.,Microsoft Windows,Microsoft Windows Verification PCA
WN0003DTX,FDResPub,Function Discovery Resource Publication,Publishes this computer and resources attached to this computer so they can be discovered over the network.  If this service is stopped  network resources will no longer be published and they will not be discovered by other computers on the network.,C:\Windows\System32\svchost.exe,4e13a941b99fe98effb858ff11a4415e,C:\Windows\system32\svchost.exe -k LocalServiceAndNoImpersonation,SERVICE_WIN32_SHARE_PROCESS,C:\Windows\System32\FDResPub.dll,true,true,The file is signed and the signature was verified.,Microsoft Windows,Microsoft Windows Verification PCA
WN0003DTX,PptpMiniport,WAN Miniport (PPTP),WAN Miniport (PPTP),C:\Windows\System32\drivers\raspptp.sys,a64583c30c43905a450d9a6b657c79fe,system32\DRIVERS\raspptp.sys,SERVICE_KERNEL_DRIVER,,true,true,The file is signed and the signature was verified.,Microsoft Windows,Microsoft Windows Verification PCA
WN0003DTX,Dnscache,DNS Client,The DNS Client service (dnscache) caches Domain Name System (DNS) names and registers the full computer name for this computer. If the service is stopped  DNS names will continue to be resolved. However  the results of DNS name queries will not be cached and the computer's name will not be registered. If the service is disabled  any services that explicitly depend on it will fail to start.,C:\Windows\System32\svchost.exe,4e13a941b99fe98effb858ff11a4415e,C:\Windows\system32\svchost.exe -k NetworkService,SERVICE_WIN32_SHARE_PROCESS,C:\Windows\System32\dnsrslvr.dll,true,true,The file is signed and the signature was verified.,Microsoft Windows,Microsoft Windows Verification PCA
WN0003DTX,drmkaud,Microsoft Trusted Audio Drivers,,C:\Windows\System32\drivers\drmkaud.sys,e39b18857c40054b791513ef6c690d0a,system32\drivers\drmkaud.sys,SERVICE_KERNEL_DRIVER,,true,true,The file is signed and the signature was verified.,Microsoft Windows,Microsoft Windows Verification PCA
WN0003DTX,seclogon,Secondary Logon,Enables starting processes under alternate credentials. If this service is stopped  this type of logon access will be unavailable. If this service is disabled  any services that explicitly depend on it will fail to start.,C:\Windows\System32\svchost.exe,4e13a941b99fe98effb858ff11a4415e,C:\Windows\system32\svchost.exe -k netsvcs,SERVICE_WIN32_SHARE_PROCESS,C:\Windows\System32\seclogon.dll,true,true,The file is signed and the signature was verified.,Microsoft Windows,Microsoft Windows Verification PCA
WN0003DTX,VMware NAT Service,VMware NAT Service,Network address translation for vir,C:\Windows\SysWOW64\vmnat.exe,acce4a063b5b6151658775a99fa4ed20,C:\WINDOWS\SysWOW64\vmnat.exe,SERVICE_WIN32_OWN_PROCESS,,true,true,The file is signed and the signature was verified.,"VMware""",VeriSign Class 3 Code Signing 2010 CA
WN0003DTX,hcw85cir,Hauppauge Consumer Infrared Receiver,,C:\Windows\System32\drivers\hcw85cir.sys,90bf9d5c11eb4445cd8c6cc2eb1b5dd7,\SystemRoot\system32\drivers\hcw85cir.sys,SERVICE_KERNEL_DRIVER,,true,true,The file is signed and the signature was verified.,Microsoft Windows,Microsoft Windows Verification PCA
WN0003DTX,usbuhci,Microsoft USB Universal Host Controller Miniport Driver,,C:\Windows\System32\drivers\usbuhci.sys,9abb33de8ad88853d8ac6d403617bf0a,\SystemRoot\system32\drivers\usbuhci.sys,SERVICE_KERNEL_DRIVER,,true,true,The file is signed and the signature was verified.,Microsoft Windows,Microsoft Windows Verification PCA
WN0003DTX,Processor,Processor Driver,,C:\Windows\System32\drivers\processr.sys,c18ea75d8e90fd47f8f671b19e718800,\SystemRoot\system32\drivers\processr.sys,SERVICE_KERNEL_DRIVER,,true,true,The file is signed and the signature was verified.,Microsoft Windows,Microsoft Windows Verification PCA
WN0003DTX,stisvc,Windows Image Acquisition (WIA),Provides image acquisition services for scanners and cameras,C:\Windows\System32\svchost.exe,4e13a941b99fe98effb858ff11a4415e,C:\Windows\system32\svchost.exe -k imgsvc,SERVICE_WIN32_OWN_PROCESS,C:\Windows\System32\wiaservc.dll,true,true,The file is signed and the signature was verified.,Microsoft Windows,Microsoft Windows Verification PCA
WN0003DTX,vmbus,vmbus,,C:\Windows\System32\drivers\vmbus.sys,b2adcc6d775f24f8cfc56f7f33eaa697,\SystemRoot\system32\drivers\vmbus.sys,SERVICE_KERNEL_DRIVER,,true,true,The file is signed and the signature was verified.,Microsoft Windows,Microsoft Windows Verification PCA
WN0003DTX,NdisTapi,Remote Access NDIS TAPI Driver,Remote Access NDIS TAPI Driver,C:\Windows\System32\drivers\ndistapi.sys,68de9e6e04d13c93d2d308e90e9bd763,system32\DRIVERS\ndistapi.sys,SERVICE_KERNEL_DRIVER,,true,true,The file is signed and the signature was verified.,Microsoft Windows,Microsoft Windows Verification PCA
WN0003DTX,Rasl2tp,WAN Miniport (L2TP),WAN Miniport (L2TP),C:\Windows\System32\drivers\rasl2tp.sys,de8c5c5fb680625416949c1c9c7119a5,system32\DRIVERS\rasl2tp.sys,SERVICE_KERNEL_DRIVER,,true,true,The file is signed and the signature was verified.,Microsoft Windows,Microsoft Windows Verification PCA
WN0003DTX,NdisCap,NDIS Capture LightWeight Filter,NDIS Capture LightWeight Filter,C:\Windows\System32\drivers\ndiscap.sys,9124cfdb841e57b028670f66333cb6a3,system32\DRIVERS\ndiscap.sys,SERVICE_KERNEL_DRIVER,,true,true,The file is signed and the signature was verified.,Microsoft Windows,Microsoft Windows Verification PCA
WN0003DTX,RdpVideoMiniport,Remote Desktop Video Miniport Driver,,C:\Windows\System32\drivers\rdpvideominiport.sys,1d2e5096fe5f3e389cfbd487194d56e0,System32\drivers\rdpvideominiport.sys,SERVICE_KERNEL_DRIVER,,true,true,The file is signed and the signature was verified.,Microsoft Windows,Microsoft Windows Verification PCA
WN0003DTX,UxSms,Desktop Window Manager Session Manager,Provides Desktop Window Manager startup and maintenance services,C:\Windows\System32\svchost.exe,4e13a941b99fe98effb858ff11a4415e,C:\Windows\System32\svchost.exe -k LocalSystemNetworkRestricted,SERVICE_WIN32_SHARE_PROCESS,C:\Windows\System32\uxsms.dll,true,true,The file is signed and the signature was verified.,Microsoft Windows,Microsoft Windows Verification PCA
WN0003DTX,ql40xx,ql40xx,,C:\Windows\System32\drivers\ql40xx.sys,a424fe037bbe6009dd5e253a6ca9126f,\SystemRoot\system32\drivers\ql40xx.sys,SERVICE_KERNEL_DRIVER,,true,true,The file is signed and the signature was verified.,Microsoft Windows,Microsoft Windows Verification PCA
WN0003DTX,usbehci,Microsoft USB 2.0 Enhanced Host Controller Miniport Driver,,C:\Windows\System32\drivers\usbehci.sys,595aa587bc5d9b9282ee9ad501c016e8,\SystemRoot\system32\drivers\usbehci.sys,SERVICE_KERNEL_DRIVER,,true,true,The file is signed and the signature was verified.,Microsoft Windows,Microsoft Windows Verification PCA
WN0003DTX,srv2,Server SMB 2.xxx Driver,Enables connectivity from Windows Vista and later clients,C:\Windows\System32\drivers\srv2.sys,f7128e8c66d6b8c0ae51628a9c63875d,System32\DRIVERS\srv2.sys,SERVICE_FILE_SYSTEM_DRIVER,,true,true,The file is signed and the signature was verified.,Microsoft Windows,Microsoft Windows Verification PCA
WN0003DTX,MSDTC,Distributed Transaction Coordinator,Coordinates transactions that span multiple resource managers  such as databases  message queues  and file systems. If this service is stopped  these transactions will fail. If this service is disabled  any services that explicitly depend on it will fail to start.,C:\Windows\System32\msdtc.exe,fd5899aba4de6e957fb56a530ecaeed0,C:\Windows\System32\msdtc.exe,SERVICE_WIN32_OWN_PROCESS,,true,true,The file is signed and the signature was verified.,Microsoft Windows,Microsoft Windows Verification PCA
WN0003DTX,defragsvc,Disk Defragmenter,Provides Disk Defragmentation Capabilities.,C:\Windows\System32\svchost.exe,4e13a941b99fe98effb858ff11a4415e,C:\Windows\system32\svchost.exe -k defragsvc,SERVICE_WIN32_OWN_PROCESS,C:\Windows\System32\defragsvc.dll,true,true,The file is signed and the signature was verified.,Microsoft Windows,Microsoft Windows Verification PCA
WN0003DTX,Mup,Mup,Multiple UNC Provider Driver,C:\Windows\System32\drivers\mup.sys,1524c25cfa8e96cf61d16650784513b4,\SystemRoot\System32\Drivers\mup.sys,SERVICE_FILE_SYSTEM_DRIVER,,true,true,The file is signed and the signature was verified.,Microsoft Windows,Microsoft Windows Verification PCA
WN0003DTX,VMUSBArbService,VMware USB Arbitration Service,Arbitration and enumeration of USB devices for virtual machines,C:\Program Files (x86)\Common Files\VMware\USB\vmware-usbarbitrator64.exe,12a465316298c1e6f41024e5cf989e99,C:\Program Files (x86)\Common Files\VMware\USB\vmware-usbarbitrator64.exe,SERVICE_WIN32_OWN_PROCESS,,true,true,The file is signed and the signature was verified.,"""VMware",VeriSign Class 3 Code Signing 2010 CA
WN0003DTX,uagp35,Microsoft AGPv3.5 Filter,,C:\Windows\System32\drivers\UAGP35.SYS,4c301fff7e8c0da89f1c022fc3ea9d35,\SystemRoot\system32\drivers\uagp35.sys,SERVICE_KERNEL_DRIVER,,true,true,The file is signed and the signature was verified.,Microsoft Windows,Microsoft Windows Verification PCA
WN0003DTX,RemoteRegistry,Remote Registry,Enables remote users to modify registry settings on this computer. If this service is stopped  the registry can be modified only by users on this computer. If this service is disabled  any services that explicitly depend on it will fail to start.,C:\Windows\System32\svchost.exe,4e13a941b99fe98effb858ff11a4415e,C:\Windows\system32\svchost.exe -k regsvc,SERVICE_WIN32_SHARE_PROCESS,C:\Windows\System32\regsvc.dll,true,true,The file is signed and the signature was verified.,Microsoft Windows,Microsoft Windows Verification PCA
WN0003DTX,Brserid,Brother MFC Serial Port Interface Driver (WDM),,C:\Windows\System32\drivers\BrSerId.sys,6fff1ae3cdf201df869a4155b3c33133,\SystemRoot\System32\Drivers\Brserid.sys,SERVICE_KERNEL_DRIVER,,true,true,The file is signed and the signature was verified.,Microsoft Windows,Microsoft Windows Verification PCA
WN0003DTX,sbp2port,sbp2port,,C:\Windows\System32\drivers\sbp2port.sys,9ed4260e483dcf3e2dd092639712ecbd,\SystemRoot\system32\drivers\sbp2port.sys,SERVICE_KERNEL_DRIVER,,true,true,The file is signed and the signature was verified.,Microsoft Windows,Microsoft Windows Verification PCA
WN0003DTX,Filetrace,Filetrace,ETW File Trace Filter,C:\Windows\System32\drivers\filetrace.sys,b81799e72ef4f9d6e315a251abf7809b,system32\drivers\filetrace.sys,SERVICE_FILE_SYSTEM_DRIVER,,true,true,The file is signed and the signature was verified.,Microsoft Windows,Microsoft Windows Verification PCA
WN0003DTX,ALG,Application Layer Gateway Service,Provides support for 3rd party protocol plug-ins for Internet Connection Sharing,C:\Windows\System32\alg.exe,4ce591007697eb3b03b9180402f90da9,C:\Windows\System32\alg.exe,SERVICE_WIN32_OWN_PROCESS,,true,true,The file is signed and the signature was verified.,Microsoft Windows,Microsoft Windows Verification PCA
WN0003DTX,PEAUTH,PEAUTH,,C:\Windows\System32\drivers\PEAuth.sys,1787c503c27bd6f12282948822af057b,system32\drivers\peauth.sys,SERVICE_KERNEL_DRIVER,,true,true,The file is signed and the signature was verified.,Microsoft Windows,Microsoft Windows Verification PCA
WN0003DTX,HTTP,HTTP,This service implements the hypertext transfer protocol (HTTP). If this service is disabled  any services that explicitly depend on it will fail to start.,C:\Windows\System32\drivers\http.sys,0aac8bbb61449a21f5a07d2f56de26b9,system32\drivers\HTTP.sys,SERVICE_KERNEL_DRIVER,,true,true,The file is signed and the signature was verified.,Microsoft Windows,Microsoft Windows Verification PCA
WN0003DTX,aliide,aliide,,C:\Windows\System32\drivers\aliide.sys,e71dc763fc2e904b74e735334ad28b86,\SystemRoot\system32\drivers\aliide.sys,SERVICE_KERNEL_DRIVER,,true,true,The file is signed and the signature was verified.,Microsoft Windows,Microsoft Windows Verification PCA
WN0003DTX,nvstor,nvstor,,C:\Windows\System32\drivers\nvstor.sys,9a0b2cc2b8b557450eee152f3c6603c2,\SystemRoot\system32\drivers\nvstor.sys,SERVICE_KERNEL_DRIVER,,true,true,The file is signed and the signature was verified.,Microsoft Windows,Microsoft Windows Verification PCA
WN0003DTX,PerfHost,Performance Counter DLL Host,Enables remote users and 64-bit processes to query performance counters provided by 32-bit DLLs. If this service is stopped  only local users and 32-bit processes will be able to query performance counters provided by 32-bit DLLs.,C:\Windows\SysWOW64\perfhost.exe,4035f753485b2d2ffb1942122f62d99b,C:\Windows\SysWow64\perfhost.exe,SERVICE_WIN32_OWN_PROCESS,,true,true,The file is signed and the signature was verified.,Microsoft Windows,Microsoft Windows Verification PCA
WN0003DTX,WudfPf,User Mode Driver Frameworks Platform Driver,,C:\Windows\System32\drivers\WUDFPf.sys,9abe0461db2aa53b8b136e021c67d68a,system32\drivers\WudfPf.sys,SERVICE_KERNEL_DRIVER,,true,true,The file is signed and the signature was verified.,Microsoft Windows,Microsoft Windows Verification PCA
WN0003DTX,arc,arc,,C:\Windows\System32\drivers\arc.sys,cf5328d4aad4ac38db7d1e5129cb303f,\SystemRoot\system32\drivers\arc.sys,SERVICE_KERNEL_DRIVER,,true,true,The file is signed and the signature was verified.,Microsoft Windows,Microsoft Windows Verification PCA
WN0003DTX,AppID,AppID Driver,Identifies an application and enforces software restriction policies.,C:\Windows\System32\drivers\appid.sys,d5ac80ddc5e5978321c6c9d30e206677,\SystemRoot\system32\drivers\appid.sys,SERVICE_KERNEL_DRIVER,,true,true,The file is signed and the signature was verified.,Microsoft Windows,Microsoft Windows Verification PCA
WN0003DTX,PolicyAgent,IPsec Policy Agent,"""Internet Protocol security (IPsec) supports network-level peer authentication  data origin authentication  data integrity  data confidentiality (encryption)  and replay protection.  This service enforces IPsec policies created through the IP Security Policies snap-in or the command-line tool """"netsh ipsec"""".  If you stop this service  you may experience network connectivity issues if your policy requires that connections use IPsec.  Also remote management of Windows Firewall is not available when this service is stopped.""",C:\Windows\System32\svchost.exe,4e13a941b99fe98effb858ff11a4415e,C:\Windows\system32\svchost.exe -k NetworkServiceNetworkRestricted,SERVICE_WIN32_SHARE_PROCESS,C:\Windows\System32\IPSECSVC.DLL,true,true,The file is signed and the signature was verified.,Microsoft Windows,Microsoft Windows Verification PCA
WN0003DTX,MRxDAV,WebDav Client Redirector Driver,Network Redirector that provides WebDAV file access for the WebClient service,C:\Windows\System32\drivers\mrxdav.sys,d8430ad40f4f851a4a1b5ac975a4ef39,\SystemRoot\system32\drivers\mrxdav.sys,SERVICE_FILE_SYSTEM_DRIVER,,true,true,The file is signed and the signature was verified.,Microsoft Windows,Microsoft Windows Verification PCA
WN0003DTX,Tcpip,TCP/IP Protocol Driver,TCP/IP Protocol Driver,C:\Windows\System32\drivers\tcpip.sys,0c1f3a8b6bd2ccb415d82a94ddfae3a2,\SystemRoot\System32\drivers\tcpip.sys,SERVICE_KERNEL_DRIVER,,true,true,The file is signed and the signature was verified.,Microsoft Windows,Microsoft Windows Verification PCA
WN0003DTX,rdpbus,Remote Desktop Device Redirector Bus Driver,,C:\Windows\System32\drivers\rdpbus.sys,8d1fe03338838a6f462de40a14fd6e08,\SystemRoot\System32\drivers\rdpbus.sys,SERVICE_KERNEL_DRIVER,,true,true,The file is signed and the signature was verified.,Microsoft Windows,Microsoft Windows Production PCA 2011
WN0003DTX,adpahci,adpahci,,C:\Windows\System32\drivers\adpahci.sys,14d2d1d6fe232c3ea39d78912cd31ebe,\SystemRoot\system32\drivers\adpahci.sys,SERVICE_KERNEL_DRIVER,,true,true,The file is signed and the signature was verified.,Microsoft Windows,Microsoft Windows Verification PCA
WN0003DTX,WPDBusEnum,Portable Device Enumerator Service,Enforces group policy for removable mass-storage devices. Enables applications such as Windows Media Player and Image Import Wizard to transfer and synchronize content using removable mass-storage devices.,C:\Windows\System32\svchost.exe,4e13a941b99fe98effb858ff11a4415e,C:\Windows\system32\svchost.exe -k LocalSystemNetworkRestricted,SERVICE_WIN32_SHARE_PROCESS,C:\Windows\System32\wpdbusenum.dll,true,true,The file is signed and the signature was verified.,Microsoft Windows,Microsoft Windows Verification PCA
WN0003DTX,FsDepends,File System Dependency Minifilter,This minifilter tracks the dependencies associated with the various nested volumes/filesystems,C:\Windows\System32\drivers\FsDepends.sys,e491742d7b0ae40ccce6ed9b17be16e3,System32\drivers\FsDepends.sys,SERVICE_FILE_SYSTEM_DRIVER,,true,true,The file is signed and the signature was verified.,Microsoft Windows,Microsoft Windows Verification PCA
WN0003DTX,pcmcia,pcmcia,,C:\Windows\System32\drivers\pcmcia.sys,afce94a2246a24ac4635f6b173995216,\SystemRoot\system32\drivers\pcmcia.sys,SERVICE_KERNEL_DRIVER,,true,true,The file is signed and the signature was verified.,Microsoft Windows,Microsoft Windows Verification PCA
WN0003DTX,WPCSvc,Parental Controls,This service is a stub for Windows Parental Control functionality that existed in Vista. It is provided for backward compatibility only.,C:\Windows\System32\svchost.exe,4e13a941b99fe98effb858ff11a4415e,C:\Windows\system32\svchost.exe -k LocalServiceNetworkRestricted,SERVICE_WIN32_SHARE_PROCESS,C:\Windows\System32\wpcsvc.dll,true,true,The file is signed and the signature was verified.,Microsoft Windows,Microsoft Windows Verification PCA
WN0003DTX,Serial,Serial,,C:\Windows\System32\drivers\serial.sys,90eae82f2578bb48ed67243b5c9dc50b,\SystemRoot\system32\drivers\serial.sys,SERVICE_KERNEL_DRIVER,,true,true,The file is signed and the signature was verified.,Microsoft Windows,Microsoft Windows Verification PCA
WN0003DTX,monitor,Microsoft Monitor Class Function Driver Service,,C:\Windows\System32\drivers\monitor.sys,2b464eb48e78b3b62f02a6e9627db515,system32\DRIVERS\monitor.sys,SERVICE_KERNEL_DRIVER,,true,true,The file is signed and the signature was verified.,Microsoft Windows,Microsoft Windows Verification PCA
WN0003DTX,TCPIP6,Microsoft IPv6 Protocol Driver,Microsoft IPv6 Protocol Driver,C:\Windows\System32\drivers\tcpip.sys,0c1f3a8b6bd2ccb415d82a94ddfae3a2,system32\DRIVERS\tcpip.sys,SERVICE_KERNEL_DRIVER,,true,true,The file is signed and the signature was verified.,Microsoft Windows,Microsoft Windows Verification PCA
WN0003DTX,amdide,amdide,,C:\Windows\System32\drivers\amdide.sys,9e59723dbe132eeafa404491407b7e75,\SystemRoot\system32\drivers\amdide.sys,SERVICE_KERNEL_DRIVER,,true,true,The file is signed and the signature was verified.,Microsoft Windows,Microsoft Windows Verification PCA
WN0003DTX,cmdide,cmdide,,C:\Windows\System32\drivers\cmdide.sys,aa550a1ab9c076c4fdc4bba76e20a73d,\SystemRoot\system32\drivers\cmdide.sys,SERVICE_KERNEL_DRIVER,,true,true,The file is signed and the signature was verified.,Microsoft Windows,Microsoft Windows Verification PCA
WN0003DTX,storvsc,storvsc,,C:\Windows\System32\drivers\storvsc.sys,469a7ce5f98a41e598dd1354488b7b98,\SystemRoot\system32\drivers\storvsc.sys,SERVICE_KERNEL_DRIVER,,true,true,The file is signed and the signature was verified.,Microsoft Windows,Microsoft Windows Verification PCA
WN0003DTX,usbohci,Microsoft USB Open Host Controller Miniport Driver,,C:\Windows\System32\drivers\usbohci.sys,a4087273d05c2a68107ee0102dda4a4e,system32\DRIVERS\usbohci.sys,SERVICE_KERNEL_DRIVER,,true,true,The file is signed and the signature was verified.,Microsoft Windows,Microsoft Windows Verification PCA
WN0003DTX,RpcEptMapper,RPC Endpoint Mapper,Resolves RPC interfaces identifiers to transport endpoints. If this service is stopped or disabled  programs using Remote Procedure Call (RPC) services will not function properly.,C:\Windows\System32\svchost.exe,4e13a941b99fe98effb858ff11a4415e,C:\Windows\system32\svchost.exe -k RPCSS,SERVICE_WIN32_SHARE_PROCESS,C:\Windows\System32\RpcEpMap.dll,true,true,The file is signed and the signature was verified.,Microsoft Windows,Microsoft Windows Verification PCA
WN0003DTX,VBoxMouse,VirtualBox Guest Mouse Service,,C:\Windows\System32\drivers\VBoxMouse.sys,6de34b1da20dc4a9514e41dbaa5316e2,system32\DRIVERS\VBoxMouse.sys,SERVICE_KERNEL_DRIVER,,true,true,The file is signed and the signature was verified.,Oracle Corporation,VeriSign Class 3 Code Signing 2010 CA
WN0003DTX,RasAgileVpn,WAN Miniport (IKEv2),WAN Miniport (IKEv2),C:\Windows\System32\drivers\agilevpn.sys,257820a7a378343fcc8b8c0a2f7e35aa,system32\DRIVERS\AgileVpn.sys,SERVICE_KERNEL_DRIVER,,true,true,The file is signed and the signature was verified.,Microsoft Windows,Microsoft Windows Verification PCA
WN0003DTX,viaide,viaide,,C:\Windows\System32\drivers\viaide.sys,b713f6979e3f12ddd8ecf305d9fde5c7,\SystemRoot\system32\drivers\viaide.sys,SERVICE_KERNEL_DRIVER,,true,true,The file is signed and the signature was verified.,Microsoft Windows,Microsoft Windows Verification PCA
WN0003DTX,AmdPPM,AMD Processor Driver,,C:\Windows\System32\drivers\amdppm.sys,e548318c7a9e6db6574d98dc1e74b5c8,\SystemRoot\system32\drivers\amdppm.sys,SERVICE_KERNEL_DRIVER,,true,true,The file is signed and the signature was verified.,Microsoft Windows,Microsoft Windows Verification PCA
WN0003DTX,tssecsrv,Remote Desktop Services Security Filter Driver,Remote Desktop Services Security Filter Driver,C:\Windows\System32\drivers\tssecsrv.sys,3a5d7909009358e3356673622350145f,System32\DRIVERS\tssecsrv.sys,SERVICE_KERNEL_DRIVER,,true,true,The file is signed and the signature was verified.,Microsoft Windows,Microsoft Windows Verification PCA
WN0003DTX,rdbss,Redirected Buffering Sub Sysytem,Provides the framework for network mini-redirectors,C:\Windows\System32\drivers\rdbss.sys,8cc8eaf0bcfa64c79ca52da7a8d1d2a9,system32\DRIVERS\rdbss.sys,SERVICE_FILE_SYSTEM_DRIVER,,true,true,The file is signed and the signature was verified.,Microsoft Windows,Microsoft Windows Verification PCA
