hostname,name,descriptivename,description,path,md5,arguments,type,servicedll,pathsignatureexists,pathsignatureverified,pathsignaturedescription,pathcertificatesubject,pathcertificateissuer
WN0003DTX,luafv,UAC File Virtualization,Virtualizes file write failures to per-user locations.,C:\Windows\System32\drivers\luafv.sys,39317e16b1dbefd33b84b2e5628c4c18,\SystemRoot\system32\drivers\luafv.sys,SERVICE_FILE_SYSTEM_DRIVER,,true,true,The file is signed and the signature was verified.,Microsoft Windows,Microsoft Windows Verification PCA
WN0003DTX,WebClient,WebClient,Enables Windows-based programs to create  access  and modify Internet-based files. If this service is stopped  these functions will not be available. If this service is disabled  any services that explicitly depend on it will fail to start.,C:\Windows\System32\svchost.exe,4e13a941b99fe98effb858ff11a4415e,C:\Windows\system32\svchost.exe -k LocalService,SERVICE_WIN32_SHARE_PROCESS,C:\Windows\System32\WebClnt.dll,true,true,The file is signed and the signature was verified.,Microsoft Windows,Microsoft Windows Verification PCA
WN0003DTX,NetMsmqActivator,Net.Msmq Listener Adapter,Receives activation requests over the net.msmq and msmq.formatname protocols and passes them to the Windows Process Activation Service.,C:\Windows\Microsoft.NET\Framework64\v4.0.30319\SMSvcHost.exe,6beda8978a243e9e44f7490e3c6fd8a8,C:\Windows\Microsoft.NET\Framework64\v4.0.30319\SMSvcHost.exe -NetMsmqActivator,SERVICE_WIN32_SHARE_PROCESS,,true,true,The file is signed and the signature was verified.,Microsoft Corporation,Microsoft Code Signing PCA
WN0003DTX,RasMan,Remote Access Connection Manager,Manages dial-up and virtual private network (VPN) connections from this computer to the Internet or other remote networks. If this service is disabled  any services that explicitly depend on it will fail to start.,C:\Windows\System32\svchost.exe,4e13a941b99fe98effb858ff11a4415e,C:\Windows\System32\svchost.exe -k netsvcs,SERVICE_WIN32_SHARE_PROCESS,C:\Windows\System32\rasmans.dll,true,true,The file is signed and the signature was verified.,Microsoft Windows,Microsoft Windows Verification PCA
WN0003DTX,mssmbios,Microsoft System Management BIOS Driver,,C:\Windows\System32\drivers\mssmbios.sys,2207c30641dc7ca2706ec9b51033df94,system32\DRIVERS\mssmbios.sys,SERVICE_KERNEL_DRIVER,,true,true,The file is signed and the signature was verified.,Microsoft Windows,Microsoft Windows Verification PCA
WN0003DTX,SDRSVC,Windows Backup,Provides Windows Backup and Restore capabilities.,C:\Windows\System32\svchost.exe,4e13a941b99fe98effb858ff11a4415e,C:\Windows\system32\svchost.exe -k SDRSVC,SERVICE_WIN32_OWN_PROCESS,C:\Windows\System32\sdrsvc.dll,true,true,The file is signed and the signature was verified.,Microsoft Windows,Microsoft Windows Verification PCA
WN0003DTX,KeyIso,CNG Key Isolation,The CNG key isolation service is hosted in the LSA process. The service provides key process isolation to private keys and associated cryptographic operations as required by the Common Criteria. The service stores and uses long-lived keys in a secure process complying with Common Criteria requirements.,C:\Windows\System32\lsass.exe,e96666a4903239614350e69350a5931c,C:\Windows\system32\lsass.exe,SERVICE_WIN32_SHARE_PROCESS,,true,true,The file is signed and the signature was verified.,Microsoft Windows,Microsoft Windows Verification PCA
WN0003DTX,isapnp,isapnp,,C:\Windows\System32\drivers\isapnp.sys,77c71caaa481fc08c101f05a3b168f08,\SystemRoot\system32\drivers\isapnp.sys,SERVICE_KERNEL_DRIVER,,true,true,The file is signed and the signature was verified.,Microsoft Windows,Microsoft Windows Verification PCA
WN0003DTX,CSC,Offline Files Driver,Allows network files to be used while the local computer is offline.,C:\Windows\System32\drivers\csc.sys,70f5391776777f64d993f93f4388efde,system32\drivers\csc.sys,SERVICE_KERNEL_DRIVER,,true,true,The file is signed and the signature was verified.,Microsoft Windows,Microsoft Windows Verification PCA
WN0003DTX,MSPCLOCK,Microsoft Streaming Clock Proxy,,C:\Windows\System32\drivers\mspclock.sys,695d6b22c7ea2c208a416fc827ee03b0,system32\drivers\MSPCLOCK.sys,SERVICE_KERNEL_DRIVER,,true,true,The file is signed and the signature was verified.,Microsoft Windows,Microsoft Windows Verification PCA
WN0003DTX,VBoxGuest,VirtualBox Guest Driver,,C:\Windows\System32\drivers\VBoxGuest.sys,75360119fb42363ce1f089116ebfacec,\SystemRoot\system32\DRIVERS\VBoxGuest.sys,SERVICE_KERNEL_DRIVER,,true,true,The file is signed and the signature was verified.,Oracle Corporation,VeriSign Class 3 Code Signing 2010 CA
WN0003DTX,volmgrx,Dynamic Volume Manager,Extension of the volume manager driver that manages software RAID volumes (spanned  striped  mirrored  RAID-5) on dynamic disks,C:\Windows\System32\drivers\volmgrx.sys,300073fc3c9c64274f832ac7038fe8bb,\SystemRoot\System32\drivers\volmgrx.sys,SERVICE_KERNEL_DRIVER,,true,true,The file is signed and the signature was verified.,Microsoft Windows,Microsoft Windows Verification PCA
WN0003DTX,WfpLwf,WFP Lightweight Filter,WFP Lightweight Filter,C:\Windows\System32\drivers\wfplwf.sys,b0886e603574146b5a75a3bdb7760442,system32\DRIVERS\wfplwf.sys,SERVICE_KERNEL_DRIVER,,true,true,The file is signed and the signature was verified.,Microsoft Windows,Microsoft Windows Verification PCA
WN0003DTX,RDPENCDD,RDP Encoder Mirror Driver,RDP Encoder Mirror Driver,C:\Windows\System32\drivers\RDPENCDD.sys,f325bc78693efb223e28afc2fe2b6a79,system32\drivers\rdpencdd.sys,SERVICE_KERNEL_DRIVER,,true,true,The file is signed and the signature was verified.,Microsoft Windows,Microsoft Windows Verification PCA
WN0003DTX,HomeGroupProvider,HomeGroup Provider,Performs networking tasks associated with configuration and maintenance of homegroups. If this service is stopped or disabled  your computer will be unable to detect other homegroups and your homegroup might not work properly. It is recommended that you keep this service running.,C:\Windows\System32\svchost.exe,4e13a941b99fe98effb858ff11a4415e,C:\Windows\System32\svchost.exe -k LocalServiceNetworkRestricted,SERVICE_WIN32_SHARE_PROCESS,C:\Windows\System32\provsvc.dll,true,true,The file is signed and the signature was verified.,Microsoft Windows,Microsoft Windows Verification PCA
WN0003DTX,VMnetUserif,VMware Virtual Ethernet Userif for VMnet,VMware Virtual Ethernet Userif for VMnet,C:\Windows\System32\drivers\vmnetuserif.sys,ecd95de99193c632f862f32415426b4c,\SystemRoot\system32\DRIVERS\vmnetuserif.sys,SERVICE_KERNEL_DRIVER,,true,true,The file is signed and the signature was verified.,Microsoft Windows Hardware Compatibility Publisher,Microsoft Windows Hardware Compatibility PCA
WN0003DTX,AeLookupSvc,Application Experience,Processes application compatibility cache requests for applications as they are launched,C:\Windows\System32\svchost.exe,4e13a941b99fe98effb858ff11a4415e,C:\Windows\system32\svchost.exe -k netsvcs,SERVICE_WIN32_SHARE_PROCESS,C:\Windows\System32\aelupsvc.dll,true,true,The file is signed and the signature was verified.,Microsoft Windows,Microsoft Windows Verification PCA
WN0003DTX,MegaSR,MegaSR,,C:\Windows\System32\drivers\MegaSR.sys,4a8f4463b98f2db1dd56868cd3f9f837,\SystemRoot\system32\drivers\MegaSR.sys,SERVICE_KERNEL_DRIVER,,true,true,The file is signed and the signature was verified.,Microsoft Windows,Microsoft Windows Verification PCA
WN0003DTX,VMnetDHCP,VMware DHCP Service,DHCP service for vir,C:\Windows\SysWOW64\vmnetdhcp.exe,a327aa9ecfee9034580ba7f6566053b2,C:\WINDOWS\SysWOW64\vmnetdhcp.exe,SERVICE_WIN32_OWN_PROCESS,,true,true,The file is signed and the signature was verified.,"VMware""",VeriSign Class 3 Code Signing 2010 CA
WN0003DTX,sppuinotify,SPP Notification Service,Provides Software Licensing activation and notification,C:\Windows\System32\svchost.exe,4e13a941b99fe98effb858ff11a4415e,C:\Windows\system32\svchost.exe -k LocalService,SERVICE_WIN32_SHARE_PROCESS,C:\Windows\System32\sppuinotify.dll,true,true,The file is signed and the signature was verified.,Microsoft Windows,Microsoft Windows Verification PCA
WN0003DTX,iaStorV,iaStorV,,C:\Windows\System32\drivers\iaStorV.sys,380650f12334f39b2278b519d26a7ffd,\SystemRoot\system32\drivers\iaStorV.sys,SERVICE_KERNEL_DRIVER,,true,true,The file is signed and the signature was verified.,Microsoft Windows,Microsoft Windows Verification PCA
WN0003DTX,AFD,Ancillary Function Driver for Winsock,Ancillary Function Driver for Winsock,C:\Windows\System32\drivers\afd.sys,edc248065aba52eaf72cbd3f7065ca2a,\SystemRoot\system32\drivers\afd.sys,SERVICE_KERNEL_DRIVER,,true,true,The file is signed and the signature was verified.,Microsoft Windows,Microsoft Windows Verification PCA
WN0003DTX,FileInfo,File Information FS MiniFilter,Collects information about files in memory to be consumed by other system services.,C:\Windows\System32\drivers\fileinfo.sys,639589b249406b0e132f3aaffee5e24d,\SystemRoot\system32\drivers\fileinfo.sys,SERVICE_FILE_SYSTEM_DRIVER,,true,true,The file is signed and the signature was verified.,Microsoft Windows,Microsoft Windows Verification PCA
WN0003DTX,HDAudBus,Microsoft UAA Bus Driver for High Definition Audio,,C:\Windows\System32\drivers\hdaudbus.sys,6c74436b1261f499669220fcbc8990c5,system32\DRIVERS\HDAudBus.sys,SERVICE_KERNEL_DRIVER,,true,true,The file is signed and the signature was verified.,Microsoft Windows,Microsoft Windows Verification PCA
WN0003DTX,NetTcpActivator,Net.Tcp Listener Adapter,Receives activation requests over the net.tcp protocol and passes them to the Windows Process Activation Service.,C:\Windows\Microsoft.NET\Framework64\v4.0.30319\SMSvcHost.exe,6beda8978a243e9e44f7490e3c6fd8a8,C:\Windows\Microsoft.NET\Framework64\v4.0.30319\SMSvcHost.exe,SERVICE_WIN32_SHARE_PROCESS,,true,true,The file is signed and the signature was verified.,Microsoft Corporation,Microsoft Code Signing PCA
WN0003DTX,rdyboost,ReadyBoost,ReadyBoost,C:\Windows\System32\drivers\rdyboost.sys,3cb2a0097bfc4562582daab8fab7786d,\SystemRoot\System32\drivers\rdyboost.sys,SERVICE_KERNEL_DRIVER,,true,true,The file is signed and the signature was verified.,Microsoft Windows,Microsoft Windows Verification PCA
WN0003DTX,ShellHWDetection,Shell Hardware Detection,Provides notifications for AutoPlay hardware events.,C:\Windows\System32\svchost.exe,4e13a941b99fe98effb858ff11a4415e,C:\Windows\System32\svchost.exe -k netsvcs,SERVICE_WIN32_SHARE_PROCESS,C:\Windows\System32\shsvcs.dll,true,true,The file is signed and the signature was verified.,Microsoft Windows,Microsoft Windows Verification PCA
WN0003DTX,p2psvc,Peer Networking Grouping,Enables multi-party communication using Peer-to-Peer Grouping.  If disabled  some applications  such as HomeGroup  may not function.,C:\Windows\System32\svchost.exe,4e13a941b99fe98effb858ff11a4415e,C:\Windows\System32\svchost.exe -k LocalServicePeerNet,SERVICE_WIN32_SHARE_PROCESS,C:\Windows\System32\p2psvc.dll,true,true,The file is signed and the signature was verified.,Microsoft Windows,Microsoft Windows Verification PCA
WN0003DTX,ehSched,Windows Media Center Scheduler Service,Starts and stops recording of TV programs within Windows Media Center,C:\Windows\ehome\ehsched.exe,0910f91049c3f21f4f070020c7dd1d7f,C:\Windows\ehome\ehsched.exe,SERVICE_WIN32_OWN_PROCESS,,true,true,The file is signed and the signature was verified.,Microsoft Windows,Microsoft Windows Verification PCA
WN0003DTX,wbengine,Block Level Backup Engine Service,The WBENGINE service is used by Windows Backup to perform backup and recovery operations. If this service is stopped by a user  it may cause the currently running backup or recovery operation to fail. Disabling this service may disable backup and recovery operations using Windows Backup on this computer.,C:\Windows\System32\wbengine.exe,5d34383ffe188035360cc0a8f1c2771e,C:\Windows\system32\wbengine.exe,SERVICE_WIN32_OWN_PROCESS,,true,true,The file is signed and the signature was verified.,Microsoft Windows,Microsoft Windows Verification PCA
WN0003DTX,mouclass,Mouse Class Driver,,C:\Windows\System32\drivers\mouclass.sys,100ef9a07ff53bab2702ce58d88eeec1,system32\DRIVERS\mouclass.sys,SERVICE_KERNEL_DRIVER,,true,true,The file is signed and the signature was verified.,Microsoft Windows,Microsoft Windows Verification PCA
WN0003DTX,Compbatt,Microsoft Composite Battery Driver,,C:\Windows\System32\drivers\compbatt.sys,787fadb281816b3ed677a74fd9b5c522,\SystemRoot\system32\DRIVERS\compbatt.sys,SERVICE_KERNEL_DRIVER,,true,true,The file is signed and the signature was verified.,Microsoft Windows,Microsoft Windows Verification PCA
WN0003DTX,AppMgmt,Application Management,Processes installation  removal  and enumeration requests for software deployed through Group Policy. If the service is disabled  users will be unable to install  remove  or enumerate software deployed through Group Policy. If this service is disabled  any services that explicitly depend on it will fail to start.,C:\Windows\System32\svchost.exe,4e13a941b99fe98effb858ff11a4415e,C:\Windows\system32\svchost.exe -k netsvcs,SERVICE_WIN32_SHARE_PROCESS,C:\Windows\System32\appmgmts.dll,true,true,The file is signed and the signature was verified.,Microsoft Windows,Microsoft Windows Verification PCA
WN0003DTX,RemoteAccess,Routing and Remote Access,Offers routing services to businesses in local area and wide area network environments.,C:\Windows\System32\svchost.exe,4e13a941b99fe98effb858ff11a4415e,C:\Windows\System32\svchost.exe -k netsvcs,SERVICE_WIN32_SHARE_PROCESS,C:\Windows\System32\mprdim.dll,true,true,The file is signed and the signature was verified.,Microsoft Windows,Microsoft Windows Verification PCA
WN0003DTX,ProtectedStorage,Protected Storage,Provides protected storage for sensitive data  such as passwords  to prevent access by unauthorized services  processes  or users.,C:\Windows\System32\lsass.exe,e96666a4903239614350e69350a5931c,C:\Windows\system32\lsass.exe,SERVICE_WIN32_SHARE_PROCESS,,true,true,The file is signed and the signature was verified.,Microsoft Windows,Microsoft Windows Verification PCA
WN0003DTX,usbprint,Microsoft USB PRINTER Class,,C:\Windows\System32\drivers\usbprint.sys,6382bb9808fdd1d72e7040ad290c40a6,\SystemRoot\system32\drivers\usbprint.sys,SERVICE_KERNEL_DRIVER,,true,true,The file is signed and the signature was verified.,Microsoft Windows,Microsoft Windows Verification PCA
WN0003DTX,Wlansvc,WLAN AutoConfig,The WLANSVC service provides the logic required to configure  discover  connect to  and disconnect from a wireless local area network (WLAN) as defined by IEEE 802.11 standards. It also contains the logic to turn your computer into a software access point so that other devices or computers can connect to your computer wirelessly using a WLAN adapter that can support this. Stopping or disabling the WLANSVC service will make all WLAN adapters on your computer inaccessible from the Windows networking UI. It is strongly recommended that you have the WLANSVC service running if your computer has a WLAN adapter.,C:\Windows\System32\svchost.exe,4e13a941b99fe98effb858ff11a4415e,C:\Windows\system32\svchost.exe -k LocalSystemNetworkRestricted,SERVICE_WIN32_SHARE_PROCESS,C:\Windows\System32\wlansvc.dll,true,true,The file is signed and the signature was verified.,Microsoft Windows,Microsoft Windows Verification PCA
WN0003DTX,MSKSSRV,Microsoft Streaming Service Proxy,,C:\Windows\System32\drivers\mskssrv.sys,2894c6b632704a2e60eebc9a06a405a4,system32\drivers\MSKSSRV.sys,SERVICE_KERNEL_DRIVER,,true,true,The file is signed and the signature was verified.,Microsoft Windows,Microsoft Windows Verification PCA
WN0003DTX,KtmRm,KtmRm for Distributed Transaction Coordinator,Coordinates transactions between the Distributed Transaction Coordinator (MSDTC) and the Kernel Transaction Manager (KTM). If it is not needed  it is recommended that this service remain stopped. If it is needed  both MSDTC and KTM will start this service automatically. If this service is disabled  any MSDTC transaction interacting with a Kernel Resource Manager will fail and any services that explicitly depend on it will fail to start.,C:\Windows\System32\svchost.exe,4e13a941b99fe98effb858ff11a4415e,C:\Windows\System32\svchost.exe -k NetworkServiceAndNoImpersonation,SERVICE_WIN32_SHARE_PROCESS,C:\Windows\System32\msdtckrm.dll,true,true,The file is signed and the signature was verified.,Microsoft Windows,Microsoft Windows Verification PCA
WN0003DTX,WinHttpAutoProxySvc,WinHTTP Web Proxy Auto-Discovery Service,WinHTTP implements the client HTTP stack and provides developers with a Win32 API and COM Automation component for sending HTTP requests and receiving responses. In addition  WinHTTP provides support for auto-discovering a proxy configuration via its implementation of the Web Proxy Auto-Discovery (WPAD) protocol.,C:\Windows\System32\svchost.exe,4e13a941b99fe98effb858ff11a4415e,C:\Windows\system32\svchost.exe -k LocalService,SERVICE_WIN32_SHARE_PROCESS,C:\Windows\System32\winhttp.dll,true,true,The file is signed and the signature was verified.,Microsoft Windows,Microsoft Windows Verification PCA
WN0003DTX,amdsbs,amdsbs,,C:\Windows\System32\drivers\amdsbs.sys,150f3bbb85a77e6c95bd438951df3182,\SystemRoot\system32\drivers\amdsbs.sys,SERVICE_KERNEL_DRIVER,,true,true,The file is signed and the signature was verified.,Microsoft Windows,Microsoft Windows Verification PCA
WN0003DTX,fvevol,Bitlocker Drive Encryption Filter Driver,Bitlocker Drive Encryption Filter Driver,C:\Windows\System32\drivers\fvevol.sys,6a7a3aa1e6fc81b9d6639842ae411f6f,\SystemRoot\System32\DRIVERS\fvevol.sys,SERVICE_KERNEL_DRIVER,,true,true,The file is signed and the signature was verified.,Microsoft Windows,Microsoft Windows Verification PCA
WN0003DTX,msiserver,Windows Installer,Adds  modifies  and removes applications provided as a Windows Installer (*.msi) package. If this service is disabled  any services that explicitly depend on it will fail to start.,C:\Windows\System32\msiexec.exe,5e08acbcf3d8077a17be604f8d9bf295,C:\Windows\system32\msiexec.exe /V,SERVICE_WIN32_OWN_PROCESS,,true,true,The file is signed and the signature was verified.,Microsoft Windows,Microsoft Windows Verification PCA
WN0003DTX,UI0Detect,Interactive Services Detection,Enables user notification of user input for interactive services  which enables access to dialogs created by interactive services when they appear. If this service is stopped  notifications of new interactive service dialogs will no longer function and there might not be access to interactive service dialogs. If this service is disabled  both notifications of and access to new interactive service dialogs will no longer function.,C:\Windows\System32\UI0Detect.exe,17ecaf8c14292fd68dc42502e5438488,C:\Windows\system32\UI0Detect.exe,SERVICE_WIN32_OWN_PROCESS,,true,true,The file is signed and the signature was verified.,Microsoft Windows,Microsoft Windows Verification PCA
WN0003DTX,WdiServiceHost,Diagnostic Service Host,The Diagnostic Service Host is used by the Diagnostic Policy Service to host diagnostics that need to run in a Local Service context.  If this service is stopped  any diagnostics that depend on it will no longer function.,C:\Windows\System32\svchost.exe,4e13a941b99fe98effb858ff11a4415e,C:\Windows\System32\svchost.exe -k LocalService,SERVICE_WIN32_SHARE_PROCESS,C:\Windows\System32\wdi.dll,true,true,The file is signed and the signature was verified.,Microsoft Windows,Microsoft Windows Verification PCA
WN0003DTX,nsiproxy,NSI proxy service driver.,NSI proxy service.,C:\Windows\System32\drivers\nsiproxy.sys,750c6d83c0b02bfffab87c3680d49795,system32\drivers\nsiproxy.sys,SERVICE_KERNEL_DRIVER,,true,true,The file is signed and the signature was verified.,Microsoft Windows,Microsoft Windows Verification PCA
WN0003DTX,Parport,Parallel port driver,,C:\Windows\System32\drivers\parport.sys,e3bc60c3e7b317dca3f0a6f346939a8a,\SystemRoot\system32\drivers\parport.sys,SERVICE_KERNEL_DRIVER,,true,true,The file is signed and the signature was verified.,Microsoft Windows,Microsoft Windows Verification PCA
WN0003DTX,BrUsbMdm,Brother MFC USB Fax Only Modem,,C:\Windows\System32\drivers\BrUsbMdm.sys,bbdc55c9507ba71e24ca520c41dde599,\SystemRoot\System32\Drivers\BrUsbMdm.sys,SERVICE_KERNEL_DRIVER,,true,true,The file is signed and the signature was verified.,Microsoft Windows,Microsoft Windows Verification PCA
WN0003DTX,FltMgr,FltMgr,File System Filter Manager Driver,C:\Windows\System32\drivers\fltMgr.sys,3ccc9de778319a191b5ef43255e36515,\SystemRoot\system32\drivers\fltmgr.sys,SERVICE_FILE_SYSTEM_DRIVER,,true,true,The file is signed and the signature was verified.,Microsoft Windows,Microsoft Windows Verification PCA
WN0003DTX,Modem,Modem,,C:\Windows\System32\drivers\modem.sys,42e53698cabeaf0c59244229808ca1e8,system32\drivers\modem.sys,SERVICE_KERNEL_DRIVER,,true,true,The file is signed and the signature was verified.,Microsoft Windows,Microsoft Windows Verification PCA
WN0003DTX,RDPDR,Terminal Server Device Redirector Driver,,C:\Windows\System32\drivers\rdpdr.sys,e12ed6f61d37adef7df8e1c172533f2c,System32\drivers\rdpdr.sys,SERVICE_KERNEL_DRIVER,,true,true,The file is signed and the signature was verified.,Microsoft Windows,Microsoft Windows Verification PCA
WN0003DTX,BTHMODEM,Bluetooth Serial Communications Driver,,C:\Windows\System32\drivers\bthmodem.sys,df7ae823665e3f30b985324da20eb54a,\SystemRoot\system32\drivers\bthmodem.sys,SERVICE_KERNEL_DRIVER,,true,true,The file is signed and the signature was verified.,Microsoft Windows,Microsoft Windows Verification PCA
WN0003DTX,SNMPTRAP,SNMP Trap,Receives trap messages generated by local or remote Simple Network Management Protocol (SNMP) agents and forwards the messages to SNMP management programs running on this computer. If this service is stopped  SNMP-based programs on this computer will not receive SNMP trap messages. If this service is disabled  any services that explicitly depend on it will fail to start.,C:\Windows\System32\snmptrap.exe,7c522e9695c24ab6a80e96251ab756d9,C:\Windows\System32\snmptrap.exe,SERVICE_WIN32_OWN_PROCESS,,true,true,The file is signed and the signature was verified.,Microsoft Windows,Microsoft Windows Verification PCA
WN0003DTX,SessionEnv,Remote Desktop Configuration,Remote Desktop Configuration service (RDCS) is responsible for all Remote Desktop Services and Remote Desktop related configuration and session maintenance activities that require SYSTEM context. These include per-session temporary folders  RD themes  and RD certificates.,C:\Windows\System32\svchost.exe,4e13a941b99fe98effb858ff11a4415e,C:\Windows\System32\svchost.exe -k netsvcs,SERVICE_WIN32_SHARE_PROCESS,C:\Windows\System32\SessEnv.dll,true,true,The file is signed and the signature was verified.,Microsoft Windows,Microsoft Windows Verification PCA
WN0003DTX,sffp_sd,SFF Storage Protocol Driver for SDBus,,C:\Windows\System32\drivers\sffp_sd.sys,bbf6a0511bd55562021e12f995caa165,\SystemRoot\system32\drivers\sffp_sd.sys,SERVICE_KERNEL_DRIVER,,true,true,The file is signed and the signature was verified.,Microsoft Windows,Microsoft Windows Verification PCA
WN0003DTX,wmiApSrv,WMI Performance Adapter,Provides performance library information from Windows Management Instrumentation (WMI) providers to clients on the network. This service only runs when Performance Data Helper is activated.,C:\Windows\System32\wbem\WmiApSrv.exe,480683095ecb448bbf8db550fdb1a5fa,C:\Windows\system32\wbem\WmiApSrv.exe,SERVICE_WIN32_OWN_PROCESS,,true,true,The file is signed and the signature was verified.,Microsoft Windows,Microsoft Windows Verification PCA
WN0003DTX,Serenum,Serenum Filter Driver,,C:\Windows\System32\drivers\serenum.sys,7b3e757a4a4e00497fbdda38191e8d14,\SystemRoot\system32\drivers\serenum.sys,SERVICE_KERNEL_DRIVER,,true,true,The file is signed and the signature was verified.,Microsoft Windows,Microsoft Windows Verification PCA
WN0003DTX,WSearch,Windows Search,Provides content indexing  property caching  and search results for files  e-mail  and other content.,C:\Windows\System32\SearchIndexer.exe,47e3f24fdac4609e3af6c9c82bdac2f5,C:\Windows\system32\SearchIndexer.exe /Embedding,SERVICE_WIN32_OWN_PROCESS,,true,true,The file is signed and the signature was verified.,Microsoft Windows,Microsoft Windows Verification PCA
WN0003DTX,hidserv,Human Interface Device Access,Enables generic input access to Human Interface Devices (HID)  which activates and maintains the use of predefined hot buttons on keyboards  remote controls  and other multimedia devices. If this service is stopped  hot buttons controlled by this service will no longer function. If this service is disabled  any services that explicitly depend on it will fail to start.,C:\Windows\System32\svchost.exe,4e13a941b99fe98effb858ff11a4415e,C:\Windows\system32\svchost.exe -k LocalSystemNetworkRestricted,SERVICE_WIN32_SHARE_PROCESS,C:\Windows\System32\hidserv.dll,true,true,The file is signed and the signature was verified.,Microsoft Windows,Microsoft Windows Verification PCA
WN0003DTX,SCPolicySvc,Smart Card Removal Policy,Allows the system to be configured to lock the user desktop upon smart card removal.,C:\Windows\System32\svchost.exe,4e13a941b99fe98effb858ff11a4415e,C:\Windows\system32\svchost.exe -k netsvcs,SERVICE_WIN32_SHARE_PROCESS,C:\Windows\System32\certprop.dll,true,true,The file is signed and the signature was verified.,Microsoft Windows,Microsoft Windows Verification PCA
WN0003DTX,RDPDR,Remote Desktop Device Redirector Driver,Remote Desktop Device Redirector Driver,C:\Windows\System32\drivers\rdpdr.sys,7a4dc1982a347f6f5520a9c88a3e7f0f,System32\drivers\rdpdr.sys,SERVICE_KERNEL_DRIVER,,true,true,The file is signed and the signature was verified.,Microsoft Windows,Microsoft Windows Production PCA 2011
WN0003DTX,cdrom,CD-ROM Driver,,C:\Windows\System32\drivers\cdrom.sys,3d5370ab95fd83302f7c2c81847e7370,system32\DRIVERS\cdrom.sys,SERVICE_KERNEL_DRIVER,,true,true,The file is signed and the signature was verified.,Microsoft Windows,Microsoft Windows Verification PCA
