hostname,name,descriptivename,description,path,md5,arguments,type,servicedll,pathsignatureexists,pathsignatureverified,pathsignaturedescription,pathcertificatesubject,pathcertificateissuer
WN0003DTX,gagp30kx,Microsoft Generic AGPv3.0 Filter for K8 Processor Platforms,,C:\Windows\System32\drivers\GAGP30KX.SYS,6c652ee9d68d660cee5927ada9b97f30,\SystemRoot\system32\drivers\gagp30kx.sys,SERVICE_KERNEL_DRIVER,,true,true,The file is signed and the signature was verified.,Microsoft Windows,Microsoft Windows Verification PCA
WN0003DTX,usbcir,eHome Infrared Receiver (USBCIR),,C:\Windows\System32\drivers\usbcir.sys,94b242862723902ab5ffe579e42a430c,\SystemRoot\system32\drivers\usbcir.sys,SERVICE_KERNEL_DRIVER,,true,true,The file is signed and the signature was verified.,Microsoft Windows,Microsoft Windows Verification PCA
WN0003DTX,WacomPen,Wacom Serial Pen HID Driver,,C:\Windows\System32\drivers\wacompen.sys,84d3d07c828abf8c0c71b17c70f6fdb7,\SystemRoot\system32\drivers\wacompen.sys,SERVICE_KERNEL_DRIVER,,true,true,The file is signed and the signature was verified.,Microsoft Windows,Microsoft Windows Verification PCA
WN0003DTX,QWAVE,Quality Windows Audio Video Experience,Quality Windows Audio Video Experience (qWave) is a networking platform for Audio Video (AV) streaming applications on IP home networks. qWave enhances AV streaming performance and reliability by ensuring network quality-of-service (QoS) for AV applications. It provides mechanisms for admission control  run time monitoring and enforcement  application feedback  and traffic prioritization.,C:\Windows\System32\svchost.exe,4e13a941b99fe98effb858ff11a4415e,C:\Windows\system32\svchost.exe -k LocalServiceAndNoImpersonation,SERVICE_WIN32_SHARE_PROCESS,C:\Windows\System32\qwave.dll,true,true,The file is signed and the signature was verified.,Microsoft Windows,Microsoft Windows Verification PCA
WN0003DTX,TBS,TPM Base Services,Enables access to the Trusted Platform Module (TPM)  which provides hardware-based cryptographic services to system components and applications.  If this service is stopped or disabled  applications will be unable to use keys protected by the TPM.,C:\Windows\System32\svchost.exe,4e13a941b99fe98effb858ff11a4415e,C:\Windows\System32\svchost.exe -k LocalServiceAndNoImpersonation,SERVICE_WIN32_SHARE_PROCESS,C:\Windows\System32\tbssvc.dll,true,true,The file is signed and the signature was verified.,Microsoft Windows,Microsoft Windows Verification PCA
WN0003DTX,WdiSystemHost,Diagnostic System Host,The Diagnostic System Host is used by the Diagnostic Policy Service to host diagnostics that need to run in a Local System context.  If this service is stopped  any diagnostics that depend on it will no longer function.,C:\Windows\System32\svchost.exe,4e13a941b99fe98effb858ff11a4415e,C:\Windows\System32\svchost.exe -k LocalSystemNetworkRestricted,SERVICE_WIN32_SHARE_PROCESS,C:\Windows\System32\wdi.dll,true,true,The file is signed and the signature was verified.,Microsoft Windows,Microsoft Windows Verification PCA
WN0003DTX,lltdio,Link-Layer Topology Discovery Mapper I/O Driver,,C:\Windows\System32\drivers\lltdio.sys,032e6f68cffc37b1672a4048fa55621c,system32\DRIVERS\lltdio.sys,SERVICE_KERNEL_DRIVER,,true,true,The file is signed and the signature was verified.,Microsoft Windows,Microsoft Windows Verification PCA
WN0003DTX,adpu320,adpu320,,C:\Windows\System32\drivers\adpu320.sys,c2414bfe15c3d91d729562aa1de7407e,\SystemRoot\system32\drivers\adpu320.sys,SERVICE_KERNEL_DRIVER,,true,true,The file is signed and the signature was verified.,Microsoft Windows,Microsoft Windows Verification PCA
WN0003DTX,Netlogon,Netlogon,Maintains a secure channel between this computer and the domain controller for authenticating users and services. If this service is stopped  the computer may not authenticate users and services and the domain controller cannot register DNS records. If this service is disabled  any services that explicitly depend on it will fail to start.,C:\Windows\System32\lsass.exe,e96666a4903239614350e69350a5931c,C:\Windows\system32\lsass.exe,SERVICE_WIN32_SHARE_PROCESS,,true,true,The file is signed and the signature was verified.,Microsoft Windows,Microsoft Windows Verification PCA
WN0003DTX,BITS,Background Intelligent Transfer Service,Transfers files in the background using idle network bandwidth. If the service is disabled  then any applications that depend on BITS  such as Windows Update or MSN Explorer  will be unable to automatically download programs and other information.,C:\Windows\System32\svchost.exe,4e13a941b99fe98effb858ff11a4415e,C:\Windows\System32\svchost.exe -k netsvcs,SERVICE_WIN32_SHARE_PROCESS,C:\Windows\System32\qmgr.dll,true,true,The file is signed and the signature was verified.,Microsoft Windows,Microsoft Windows Verification PCA
WN0003DTX,AppIDSvc,Application Identity,Determines and verifies the identity of an application. Disabling this service will prevent AppLocker from being enforced.,C:\Windows\System32\svchost.exe,4e13a941b99fe98effb858ff11a4415e,C:\Windows\system32\svchost.exe -k LocalServiceAndNoImpersonation,SERVICE_WIN32_SHARE_PROCESS,C:\Windows\System32\appidsvc.dll,true,true,The file is signed and the signature was verified.,Microsoft Windows,Microsoft Windows Verification PCA
WN0003DTX,ehRecvr,Windows Media Center Receiver Service,Windows Media Center Service for TV and FM broadcast reception,C:\Windows\ehome\ehrecvr.exe,079683b37f2620249440941e901a832c,C:\Windows\ehome\ehRecvr.exe,SERVICE_WIN32_OWN_PROCESS,,true,true,The file is signed and the signature was verified.,Microsoft Windows,Microsoft Windows Verification PCA
WN0003DTX,COMSysApp,COM+ System Application,Manages the configuration and tracking of Component Object Model (COM)+-based components. If the service is stopped  most COM+-based components will not function properly. If this service is disabled  any services that explicitly depend on it will fail to start.,C:\Windows\System32\dllhost.exe,2ca70a44330d73344946db025d1f2656,C:\Windows\system32\dllhost.exe /Processid:{02D4B3F1-FD88-11D1-960D-00805FC79235},SERVICE_WIN32_OWN_PROCESS,,true,true,The file is signed and the signature was verified.,Microsoft Windows,Microsoft Windows Verification PCA
WN0003DTX,WIMMount,WIMMount,WIM Image mount service driver,C:\Windows\System32\drivers\wimmount.sys,fb23e40a68d1578bcfd5919487440347,system32\drivers\wimmount.sys,SERVICE_FILE_SYSTEM_DRIVER,,true,true,The file is signed and the signature was verified.,Microsoft Windows,Microsoft Windows Verification PCA
WN0003DTX,swenum,Software Bus Driver,,C:\Windows\System32\drivers\swenum.sys,7d1afaef505a127ebd505acf24b8b47e,system32\DRIVERS\swenum.sys,SERVICE_KERNEL_DRIVER,,true,true,The file is signed and the signature was verified.,Microsoft Windows,Microsoft Windows Verification PCA
WN0003DTX,TsUsbFlt,TsUsbFlt,Remote Desktop USB Hub Class Filter Driver,C:\Windows\System32\drivers\TsUsbFlt.sys,eafdea0e5dced726d13c23c2dc4c5526,system32\drivers\tsusbflt.sys,SERVICE_KERNEL_DRIVER,,true,true,The file is signed and the signature was verified.,Microsoft Windows,Microsoft Windows Verification PCA
WN0003DTX,TrkWks,Distributed Link Tracking Client,Maintains links between NTFS files within a computer or across computers in a network.,C:\Windows\System32\svchost.exe,4e13a941b99fe98effb858ff11a4415e,C:\Windows\System32\svchost.exe -k LocalSystemNetworkRestricted,SERVICE_WIN32_SHARE_PROCESS,C:\Windows\System32\trkwks.dll,true,true,The file is signed and the signature was verified.,Microsoft Windows,Microsoft Windows Verification PCA
WN0003DTX,CertPropSvc,Certificate Propagation,Copies user certificates and root certificates from smart cards into the current user's certificate store  detects when a smart card is inserted into a smart card reader  and  if needed  installs the smart card Plug and Play minidriver.,C:\Windows\System32\svchost.exe,4e13a941b99fe98effb858ff11a4415e,C:\Windows\system32\svchost.exe -k netsvcs,SERVICE_WIN32_SHARE_PROCESS,C:\Windows\System32\certprop.dll,true,true,The file is signed and the signature was verified.,Microsoft Windows,Microsoft Windows Verification PCA
WN0003DTX,mrxsmb,SMB MiniRedirector Wrapper and Engine,Implements the framework for the SMB filesystem redirector,C:\Windows\System32\drivers\mrxsmb.sys,d3f42797244f4324b43da62c3967391d,system32\DRIVERS\mrxsmb.sys,SERVICE_FILE_SYSTEM_DRIVER,,true,true,The file is signed and the signature was verified.,Microsoft Windows,Microsoft Windows Verification PCA
WN0003DTX,AxInstSV,ActiveX Installer (AxInstSV),Provides User Account Control validation for the installation of ActiveX controls from the Internet and enables management of ActiveX control installation based on Group Policy settings. This service is started on demand and if disabled the installation of ActiveX controls will behave according to default browser settings.,C:\Windows\System32\svchost.exe,4e13a941b99fe98effb858ff11a4415e,C:\Windows\system32\svchost.exe -k AxInstSVGroup,SERVICE_WIN32_SHARE_PROCESS,C:\Windows\System32\AxInstSv.dll,true,true,The file is signed and the signature was verified.,Microsoft Windows,Microsoft Windows Verification PCA
WN0003DTX,NetTcpPortSharing,Net.Tcp Port Sharing Service,Provides ability to share TCP ports over the net.tcp protocol.,C:\Windows\Microsoft.NET\Framework64\v4.0.30319\SMSvcHost.exe,6beda8978a243e9e44f7490e3c6fd8a8,C:\Windows\Microsoft.NET\Framework64\v4.0.30319\SMSvcHost.exe,SERVICE_WIN32_SHARE_PROCESS,,true,true,The file is signed and the signature was verified.,Microsoft Corporation,Microsoft Code Signing PCA
WN0003DTX,Dhcp,DHCP Client,Registers and updates IP addresses and DNS records for this computer. If this service is stopped  this computer will not receive dynamic IP addresses and DNS updates. If this service is disabled  any services that explicitly depend on it will fail to start.,C:\Windows\System32\svchost.exe,4e13a941b99fe98effb858ff11a4415e,C:\Windows\system32\svchost.exe -k LocalServiceNetworkRestricted,SERVICE_WIN32_SHARE_PROCESS,C:\Windows\System32\dhcpcore.dll,true,true,The file is signed and the signature was verified.,Microsoft Windows,Microsoft Windows Verification PCA
WN0003DTX,BrUsbSer,Brother MFC USB Serial WDM Driver,,C:\Windows\System32\drivers\BrUsbSer.sys,556087ea7edf7f1e6a904b5e202952cd,\SystemRoot\System32\Drivers\BrUsbSer.sys,SERVICE_KERNEL_DRIVER,,true,true,The file is signed and the signature was verified.,Microsoft Windows,Microsoft Windows Verification PCA
WN0003DTX,LSI_FC,LSI_FC,,C:\Windows\System32\drivers\lsi_fc.sys,ceea17c4902a6d501e111f07820936f9,\SystemRoot\system32\drivers\lsi_fc.sys,SERVICE_KERNEL_DRIVER,,true,true,The file is signed and the signature was verified.,Microsoft Windows,Microsoft Windows Verification PCA
WN0003DTX,ql2300,ql2300,,C:\Windows\System32\drivers\ql2300.sys,7d9bb926ab2350ef63ba8625e7877c8c,\SystemRoot\system32\drivers\ql2300.sys,SERVICE_KERNEL_DRIVER,,true,true,The file is signed and the signature was verified.,Microsoft Windows,Microsoft Windows Verification PCA
WN0003DTX,LSI_SAS2,LSI_SAS2,,C:\Windows\System32\drivers\lsi_sas2.sys,0e2e3327a2290fb12f4c8d5272e53cfb,\SystemRoot\system32\drivers\lsi_sas2.sys,SERVICE_KERNEL_DRIVER,,true,true,The file is signed and the signature was verified.,Microsoft Windows,Microsoft Windows Verification PCA
WN0003DTX,gpsvc,Group Policy Client,The service is responsible for applying settings configured by administrators for the computer and users through the Group Policy component. If the service is stopped or disabled  the settings will not be applied and applications and components will not be manageable through Group Policy. Any components or applications that depend on the Group Policy component might not be functional if the service is stopped or disabled.,C:\Windows\System32\svchost.exe,4e13a941b99fe98effb858ff11a4415e,C:\Windows\system32\svchost.exe -k netsvcs,SERVICE_WIN32_SHARE_PROCESS,C:\Windows\System32\gpsvc.dll,true,true,The file is signed and the signature was verified.,Microsoft Windows,Microsoft Windows Verification PCA
WN0003DTX,msdsm,msdsm,,C:\Windows\System32\drivers\msdsm.sys,4c8f6f5adf05af6a27da1d34a0227193,\SystemRoot\system32\drivers\msdsm.sys,SERVICE_KERNEL_DRIVER,,true,true,The file is signed and the signature was verified.,Microsoft Windows,Microsoft Windows Verification PCA
WN0003DTX,MMCSS,Multimedia Class Scheduler,Enables relative prioritization of work based on system-wide task priorities. This is intended mainly for multimedia applications.  If this service is stopped  individual tasks resort to their default priority.,C:\Windows\System32\svchost.exe,4e13a941b99fe98effb858ff11a4415e,C:\Windows\system32\svchost.exe -k netsvcs,SERVICE_WIN32_SHARE_PROCESS,C:\Windows\System32\mmcss.dll,true,true,The file is signed and the signature was verified.,Microsoft Windows,Microsoft Windows Verification PCA
WN0003DTX,Netman,Network Connections,Manages objects in the Network and Dial-Up Connections folder  in which you can view both local area network and remote connections.,C:\Windows\System32\svchost.exe,4e13a941b99fe98effb858ff11a4415e,C:\Windows\System32\svchost.exe -k LocalSystemNetworkRestricted,SERVICE_WIN32_SHARE_PROCESS,C:\Windows\System32\netman.dll,true,true,The file is signed and the signature was verified.,Microsoft Windows,Microsoft Windows Verification PCA
WN0003DTX,bthserv,Bluetooth Support Service,The Bluetooth service supports discovery and association of remote Bluetooth devices.  Stopping or disabling this service may cause already installed Bluetooth devices to fail to operate properly and prevent new devices from being discovered or associated.,C:\Windows\System32\svchost.exe,4e13a941b99fe98effb858ff11a4415e,C:\Windows\system32\svchost.exe -k bthsvcs,SERVICE_WIN32_SHARE_PROCESS,C:\Windows\System32\bthserv.dll,true,true,The file is signed and the signature was verified.,Microsoft Windows,Microsoft Windows Verification PCA
WN0003DTX,DcomLaunch,DCOM Server Process Launcher,The DCOMLAUNCH service launches COM and DCOM servers in response to object activation requests. If this service is stopped or disabled  programs using COM or DCOM will not function properly. It is strongly recommended that you have the DCOMLAUNCH service running.,C:\Windows\System32\svchost.exe,4e13a941b99fe98effb858ff11a4415e,C:\Windows\system32\svchost.exe -k DcomLaunch,SERVICE_WIN32_SHARE_PROCESS,C:\Windows\System32\rpcss.dll,true,true,The file is signed and the signature was verified.,Microsoft Windows,Microsoft Windows Verification PCA
WN0003DTX,RpcLocator,Remote Procedure Call (RPC) Locator,In Windows 2003 and earlier versions of Windows  the Remote Procedure Call (RPC) Locator service manages the RPC name service database. In Windows Vista and later versions of Windows  this service does not provide any functionality and is present for application compatibility.,C:\Windows\System32\Locator.exe,66cca391ed9b87a4d5d990aea6ea351a,C:\Windows\system32\locator.exe,SERVICE_WIN32_OWN_PROCESS,,true,true,The file is signed and the signature was verified.,Microsoft Windows,Microsoft Windows Verification PCA
WN0003DTX,IKEEXT,IKE and AuthIP IPsec Keying Modules,The IKEEXT service hosts the Internet Key Exchange (IKE) and Authenticated Internet Protocol (AuthIP) keying modules. These keying modules are used for authentication and key exchange in Internet Protocol security (IPsec). Stopping or disabling the IKEEXT service will disable IKE and AuthIP key exchange with peer computers. IPsec is typically configured to use IKE or AuthIP; therefore  stopping or disabling the IKEEXT service might result in an IPsec failure and might compromise the security of the system. It is strongly recommended that you have the IKEEXT service running.,C:\Windows\System32\svchost.exe,4e13a941b99fe98effb858ff11a4415e,C:\Windows\system32\svchost.exe -k netsvcs,SERVICE_WIN32_SHARE_PROCESS,C:\Windows\System32\IKEEXT.DLL,true,true,The file is signed and the signature was verified.,Microsoft Windows,Microsoft Windows Verification PCA
WN0003DTX,SiSRaid2,SiSRaid2,,C:\Windows\System32\drivers\sisraid2.sys,95bd0fb0ed54b308fb468d378083b2de,\SystemRoot\system32\drivers\SiSRaid2.sys,SERVICE_KERNEL_DRIVER,,true,true,The file is signed and the signature was verified.,Microsoft Windows,Microsoft Windows Verification PCA
WN0003DTX,E1G60,Intel(R) PRO/1000 NDIS 6 Adapter Driver,,C:\Windows\System32\drivers\E1G6032E.sys,011d87925df2e30696d6b97448df4e7f,system32\DRIVERS\E1G6032E.sys,SERVICE_KERNEL_DRIVER,,true,true,The file is signed and the signature was verified.,Microsoft Windows,Microsoft Windows Verification PCA
WN0003DTX,amdxata,amdxata,,C:\Windows\System32\drivers\amdxata.sys,ab35fafe89ae3b0a92e57862be8918c4,\SystemRoot\system32\drivers\amdxata.sys,SERVICE_KERNEL_DRIVER,,true,true,The file is signed and the signature was verified.,Microsoft Windows,Microsoft Windows Verification PCA
WN0003DTX,tcpipreg,TCP/IP Registry Compatibility,Provides compatibility for legacy applications which interact with TCP/IP through the registry. If this service is stopped  certain applications may have impaired functionality.,C:\Windows\System32\drivers\tcpipreg.sys,374498c274d34f04e369ae381a7d5247,System32\drivers\tcpipreg.sys,SERVICE_KERNEL_DRIVER,,true,true,The file is signed and the signature was verified.,Microsoft Windows,Microsoft Windows Verification PCA
WN0003DTX,AudioSrv,Windows Audio,Manages audio for Windows-based programs.  If this service is stopped  audio devices and effects will not function properly.  If this service is disabled  any services that explicitly depend on it will fail to start,C:\Windows\System32\svchost.exe,4e13a941b99fe98effb858ff11a4415e,C:\Windows\System32\svchost.exe -k LocalServiceNetworkRestricted,SERVICE_WIN32_SHARE_PROCESS,C:\Windows\System32\audiosrv.dll,true,true,The file is signed and the signature was verified.,Microsoft Windows,Microsoft Windows Verification PCA
WN0003DTX,VMBusHID,VMBusHID,,C:\Windows\System32\drivers\VMBusHID.sys,8685e9c28b03ff0bfa4108e8a8be3719,\SystemRoot\system32\drivers\VMBusHID.sys,SERVICE_KERNEL_DRIVER,,true,true,The file is signed and the signature was verified.,Microsoft Windows,Microsoft Windows Verification PCA
WN0003DTX,RpcSs,Remote Procedure Call (RPC),The RPCSS service is the Service Control Manager for COM and DCOM servers. It performs object activations requests  object exporter resolutions and distributed garbage collection for COM and DCOM servers. If this service is stopped or disabled  programs using COM or DCOM will not function properly. It is strongly recommended that you have the RPCSS service running,C:\Windows\System32\svchost.exe,4e13a941b99fe98effb858ff11a4415e,C:\Windows\system32\svchost.exe -k rpcss,SERVICE_WIN32_SHARE_PROCESS,C:\Windows\System32\rpcss.dll,true,true,The file is signed and the signature was verified.,Microsoft Windows,Microsoft Windows Verification PCA
WN0003DTX,WMPNetworkSvc,Windows Media Player Network Sharing Service,Shares Windows Media Player libraries to other networked players and media devices using Universal Plug and Play,C:\Program Files\Windows Media Player\wmpnetwk.exe,b251081b603426f055f7a639b7ce01f3,C:\Program Files\Windows Media Player\wmpnetwk.exe,SERVICE_WIN32_OWN_PROCESS,,true,true,The file is signed and the signature was verified.,Microsoft Windows,Microsoft Windows Verification PCA
WN0003DTX,Mcx2Svc,Media Center Extender Service,Allows Media Center Extenders to locate and connect to the computer.,C:\Windows\System32\svchost.exe,4e13a941b99fe98effb858ff11a4415e,C:\Windows\system32\svchost.exe -k LocalServiceAndNoImpersonation,SERVICE_WIN32_SHARE_PROCESS,C:\Windows\System32\Mcx2Svc.dll,true,true,The file is signed and the signature was verified.,Microsoft Windows,Microsoft Windows Verification PCA
WN0003DTX,msisadrv,msisadrv,,C:\Windows\System32\drivers\msisadrv.sys,781e5b0718a1df4d1952b7baf1300bd8,\SystemRoot\system32\drivers\msisadrv.sys,SERVICE_KERNEL_DRIVER,,true,true,The file is signed and the signature was verified.,Microsoft Windows,Microsoft Windows Verification PCA
WN0003DTX,crcdisk,Crcdisk Filter Driver,,C:\Windows\System32\drivers\crcdisk.sys,8d0d65ad91ed63e669dc0241ab7289b4,\SystemRoot\system32\drivers\crcdisk.sys,SERVICE_KERNEL_DRIVER,,true,true,The file is signed and the signature was verified.,Microsoft Windows,Microsoft Windows Verification PCA
WN0003DTX,TabletInputService,Tablet PC Input Service,Enables Tablet PC pen and ink functionality,C:\Windows\System32\svchost.exe,4e13a941b99fe98effb858ff11a4415e,C:\Windows\System32\svchost.exe -k LocalSystemNetworkRestricted,SERVICE_WIN32_SHARE_PROCESS,C:\Windows\System32\TabSvc.dll,true,true,The file is signed and the signature was verified.,Microsoft Windows,Microsoft Windows Verification PCA
WN0003DTX,RasPppoe,Remote Access PPPOE Driver,Remote Access PPPOE Driver,C:\Windows\System32\drivers\raspppoe.sys,0efb3c5e5ce2dc260a32b5afa0377192,system32\DRIVERS\raspppoe.sys,SERVICE_KERNEL_DRIVER,,true,true,The file is signed and the signature was verified.,Microsoft Windows,Microsoft Windows Verification PCA
WN0003DTX,HidBth,Microsoft Bluetooth HID Miniport,,C:\Windows\System32\drivers\hidbth.sys,2e14d9590fb183f5557182d8b2ff757a,\SystemRoot\system32\drivers\hidbth.sys,SERVICE_KERNEL_DRIVER,,true,true,The file is signed and the signature was verified.,Microsoft Windows,Microsoft Windows Verification PCA
WN0003DTX,sffdisk,SFF Storage Class Driver,,C:\Windows\System32\drivers\sffdisk.sys,ff1464e7717ab9517761a68e10c19057,\SystemRoot\system32\drivers\sffdisk.sys,SERVICE_KERNEL_DRIVER,,true,true,The file is signed and the signature was verified.,Microsoft Windows,Microsoft Windows Verification PCA
WN0003DTX,SstpSvc,Secure Socket Tunneling Protocol Service,Provides support for the Secure Socket Tunneling Protocol (SSTP) to connect to remote computers using VPN. If this service is disabled  users will not be able to use SSTP to access remote servers.,C:\Windows\System32\svchost.exe,4e13a941b99fe98effb858ff11a4415e,C:\Windows\system32\svchost.exe -k LocalService,SERVICE_WIN32_SHARE_PROCESS,C:\Windows\System32\sstpsvc.dll,true,true,The file is signed and the signature was verified.,Microsoft Windows,Microsoft Windows Verification PCA
WN0003DTX,storflt,Disk Virtual Machine Bus Acceleration Filter Driver,,C:\Windows\System32\drivers\vmstorfl.sys,f310fba50e423026a6ebf269d99fd23a,\SystemRoot\system32\drivers\vmstorfl.sys,SERVICE_KERNEL_DRIVER,,true,true,The file is signed and the signature was verified.,Microsoft Windows,Microsoft Windows Verification PCA
WN0003DTX,nfrd960,nfrd960,,C:\Windows\System32\drivers\nfrd960.sys,4328116ca0b2d10991182502b54c82c5,\SystemRoot\system32\drivers\nfrd960.sys,SERVICE_KERNEL_DRIVER,,true,true,The file is signed and the signature was verified.,Microsoft Windows,Microsoft Windows Verification PCA
WN0003DTX,wcncsvc,Windows Connect Now - Config Registrar,WCNCSVC hosts the Windows Connect Now Configuration which is Microsoft's Implementation of Wi-Fi Protected Setup (WPS) protocol. This is used to configure Wireless LAN settings for an Access Point (AP) or a Wi-Fi Device. The service is started programmatically as needed.,C:\Windows\System32\svchost.exe,4e13a941b99fe98effb858ff11a4415e,C:\Windows\System32\svchost.exe -k LocalServiceAndNoImpersonation,SERVICE_WIN32_SHARE_PROCESS,C:\Windows\System32\wcncsvc.dll,true,true,The file is signed and the signature was verified.,Microsoft Windows,Microsoft Windows Verification PCA
WN0003DTX,Appinfo,Application Information,Facilitates the running of interactive applications with additional administrative privileges.  If this service is stopped  users will be unable to launch applications with the additional administrative privileges they may require to perform desired user tasks.,C:\Windows\System32\svchost.exe,4e13a941b99fe98effb858ff11a4415e,C:\Windows\system32\svchost.exe -k netsvcs,SERVICE_WIN32_SHARE_PROCESS,C:\Windows\System32\appinfo.dll,true,true,The file is signed and the signature was verified.,Microsoft Windows,Microsoft Windows Verification PCA
WN0003DTX,AsyncMac,RAS Asynchronous Media Driver,RAS Asynchronous Media Driver,C:\Windows\System32\drivers\asyncmac.sys,fc6ac4ec7d8a0ca31fa445d6b90ba266,system32\DRIVERS\asyncmac.sys,SERVICE_KERNEL_DRIVER,,true,true,The file is signed and the signature was verified.,Microsoft Windows,Microsoft Windows Verification PCA
WN0003DTX,pci,PCI Bus Driver,,C:\Windows\System32\drivers\pci.sys,2b9b0a138a8a347cecb157c571de2b7d,\SystemRoot\system32\drivers\pci.sys,SERVICE_KERNEL_DRIVER,,true,true,The file is signed and the signature was verified.,Microsoft Windows,Microsoft Windows Verification PCA
WN0003DTX,i8042prt,i8042 Keyboard and PS/2 Mouse Port Driver,,C:\Windows\System32\drivers\i8042prt.sys,dfe1318ebdc49b5f19d8948906cb5202,system32\DRIVERS\i8042prt.sys,SERVICE_KERNEL_DRIVER,,true,true,The file is signed and the signature was verified.,Microsoft Windows,Microsoft Windows Verification PCA
WN0003DTX,ErrDev,Microsoft Hardware Error Device Driver,,C:\Windows\System32\drivers\errdev.sys,2618f33ab887116f72833cbddcfd62a3,\SystemRoot\system32\drivers\errdev.sys,SERVICE_KERNEL_DRIVER,,true,true,The file is signed and the signature was verified.,Microsoft Windows,Microsoft Windows Verification PCA
WN0003DTX,vga,vga,,C:\Windows\System32\drivers\vgapnp.sys,da2edba91d51aab8ec24c1d2b5177602,system32\DRIVERS\vgapnp.sys,SERVICE_KERNEL_DRIVER,,true,true,The file is signed and the signature was verified.,Microsoft Windows,Microsoft Windows Verification PCA
