hostname,name,descriptivename,description,path,md5,arguments,type,servicedll,pathsignatureexists,pathsignatureverified,pathsignaturedescription,pathcertificatesubject,pathcertificateissuer
WN0003DTX,vdrvroot,Microsoft Virtual Drive Enumerator Driver,,C:\Windows\System32\drivers\vdrvroot.sys,4c0b7725ecc1fd1f20149e279008d206,\SystemRoot\system32\drivers\vdrvroot.sys,SERVICE_KERNEL_DRIVER,,true,true,The file is signed and the signature was verified.,Microsoft Windows,Microsoft Windows Verification PCA
WN0003DTX,SSDPSRV,SSDP Discovery,Discovers networked devices and services that use the SSDP discovery protocol  such as UPnP devices. Also announces SSDP devices and services running on the local computer. If this service is stopped  SSDP-based devices will not be discovered. If this service is disabled  any services that explicitly depend on it will fail to start.,C:\Windows\System32\svchost.exe,4e13a941b99fe98effb858ff11a4415e,C:\Windows\system32\svchost.exe -k LocalServiceAndNoImpersonation,SERVICE_WIN32_SHARE_PROCESS,C:\Windows\System32\ssdpsrv.dll,true,true,The file is signed and the signature was verified.,Microsoft Windows,Microsoft Windows Verification PCA
WN0003DTX,BrFiltLo,Brother USB Mass-Storage Lower Filter Driver,,C:\Windows\System32\drivers\BrFiltLo.sys,a5874139d3773bf59693f663c227c537,\SystemRoot\system32\drivers\BrFiltLo.sys,SERVICE_KERNEL_DRIVER,,true,true,The file is signed and the signature was verified.,Microsoft Windows,Microsoft Windows Verification PCA
WN0003DTX,DPS,Diagnostic Policy Service,The Diagnostic Policy Service enables problem detection  troubleshooting and resolution for Windows components.  If this service is stopped  diagnostics will no longer function.,C:\Windows\System32\svchost.exe,4e13a941b99fe98effb858ff11a4415e,C:\Windows\System32\svchost.exe -k LocalServiceNoNetwork,SERVICE_WIN32_SHARE_PROCESS,C:\Windows\System32\dps.dll,true,true,The file is signed and the signature was verified.,Microsoft Windows,Microsoft Windows Verification PCA
WN0003DTX,circlass,Consumer IR Devices,,C:\Windows\System32\drivers\circlass.sys,85359caed67fef7f00700bfe55026657,\SystemRoot\system32\drivers\circlass.sys,SERVICE_KERNEL_DRIVER,,true,true,The file is signed and the signature was verified.,Microsoft Windows,Microsoft Windows Verification PCA
WN0003DTX,amdsata,amdsata,,C:\Windows\System32\drivers\amdsata.sys,0823f71e35c737f8911c244472687542,\SystemRoot\system32\drivers\amdsata.sys,SERVICE_KERNEL_DRIVER,,true,true,The file is signed and the signature was verified.,Microsoft Windows,Microsoft Windows Verification PCA
WN0003DTX,stexstor,stexstor,,C:\Windows\System32\drivers\stexstor.sys,c38c30358aed18b12e91652fd85fbfe7,\SystemRoot\system32\drivers\stexstor.sys,SERVICE_KERNEL_DRIVER,,true,true,The file is signed and the signature was verified.,Microsoft Windows,Microsoft Windows Verification PCA
WN0003DTX,megasas,megasas,,C:\Windows\System32\drivers\megasas.sys,57abe66250f720e5a8eafca81e55d837,\SystemRoot\system32\drivers\megasas.sys,SERVICE_KERNEL_DRIVER,,true,true,The file is signed and the signature was verified.,Microsoft Windows,Microsoft Windows Verification PCA
WN0003DTX,HidBatt,HID UPS Battery Driver,,C:\Windows\System32\drivers\hidbatt.sys,af40853ef51886cf2146b112d57e519d,\SystemRoot\system32\drivers\HidBatt.sys,SERVICE_KERNEL_DRIVER,,true,true,The file is signed and the signature was verified.,Microsoft Windows,Microsoft Windows Verification PCA
WN0003DTX,Wanarpv6,Remote Access IPv6 ARP Driver,Remote Access IPv6 ARP Driver,C:\Windows\System32\drivers\wanarp.sys,0516f8d9ee3ec1d5ed83980513492065,system32\DRIVERS\wanarp.sys,SERVICE_KERNEL_DRIVER,,true,true,The file is signed and the signature was verified.,Microsoft Windows,Microsoft Windows Verification PCA
WN0003DTX,HomeGroupListener,HomeGroup Listener,Makes local computer changes associated with configuration and maintenance of the homegroup-joined computer. If this service is stopped or disabled  your computer will not work properly in a homegroup and your homegroup might not work properly. It is recommended that you keep this service running.,C:\Windows\System32\svchost.exe,4e13a941b99fe98effb858ff11a4415e,C:\Windows\System32\svchost.exe -k LocalSystemNetworkRestricted,SERVICE_WIN32_SHARE_PROCESS,C:\Windows\System32\ListSvc.dll,true,true,The file is signed and the signature was verified.,Microsoft Windows,Microsoft Windows Verification PCA
WN0003DTX,usbhub,Microsoft USB Standard Hub Driver,,C:\Windows\System32\drivers\usbhub.sys,55968edaa9803cf01033cab38b0ce953,system32\DRIVERS\usbhub.sys,SERVICE_KERNEL_DRIVER,,true,true,The file is signed and the signature was verified.,Microsoft Windows,Microsoft Windows Verification PCA
WN0003DTX,usbccgp,Microsoft USB Generic Parent Driver,,C:\Windows\System32\drivers\usbccgp.sys,6a7b84bd58218ab20b9ffccaa721b96d,\SystemRoot\system32\drivers\usbccgp.sys,SERVICE_KERNEL_DRIVER,,true,true,The file is signed and the signature was verified.,Microsoft Windows,Microsoft Windows Verification PCA
WN0003DTX,WwanSvc,WWAN AutoConfig,This service manages mobile broadband (GSM &amp; CDMA) data card/embedded module adapters and connections by auto-configuring the networks. It is strongly recommended that this service be kept running for best user experience of mobile broadband devices.,C:\Windows\System32\svchost.exe,4e13a941b99fe98effb858ff11a4415e,C:\Windows\system32\svchost.exe -k LocalServiceNoNetwork,SERVICE_WIN32_SHARE_PROCESS,C:\Windows\System32\wwansvc.dll,true,true,The file is signed and the signature was verified.,Microsoft Windows,Microsoft Windows Verification PCA
WN0003DTX,ebdrv,Broadcom NetXtreme II 10 GigE VBD,,C:\Windows\System32\drivers\evbda.sys,8e668b8fc0f918567a2826ac4a693156,\SystemRoot\system32\drivers\evbda.sys,SERVICE_KERNEL_DRIVER,,true,true,The file is signed and the signature was verified.,Microsoft Windows,Microsoft Windows Verification PCA
WN0003DTX,partmgr,Partition Manager,Disk class filter driver that auctions out partitions to volume managers,C:\Windows\System32\drivers\partmgr.sys,bd45b0c1a246312abbab043a19b38bb4,\SystemRoot\System32\drivers\partmgr.sys,SERVICE_KERNEL_DRIVER,,true,true,The file is signed and the signature was verified.,Microsoft Windows,Microsoft Windows Verification PCA
WN0003DTX,clr_optimization_v4.0.30319_64,Microsoft .NET Framework NGEN v4.0.30319_X64,Microsoft .NET Framework NGEN,C:\Windows\Microsoft.NET\Framework64\v4.0.30319\mscorsvw.exe,ccbe8fd4882b381c1058a85fbb80387c,C:\Windows\Microsoft.NET\Framework64\v4.0.30319\mscorsvw.exe,SERVICE_WIN32_OWN_PROCESS,,true,true,The file is signed and the signature was verified.,Microsoft Corporation,Microsoft Code Signing PCA
WN0003DTX,adp94xx,adp94xx,,C:\Windows\System32\drivers\adp94xx.sys,50b22ffbd83d0eb91802f62f72452c7f,\SystemRoot\system32\drivers\adp94xx.sys,SERVICE_KERNEL_DRIVER,,true,true,The file is signed and the signature was verified.,Microsoft Windows,Microsoft Windows Verification PCA
WN0003DTX,PNRPAutoReg,PNRP Machine Name Publication Service,This service publishes a machine name using the Peer Name Resolution Protocol.  Configuration is managed via the netsh context 'p2p pnrp peer' ,C:\Windows\System32\svchost.exe,4e13a941b99fe98effb858ff11a4415e,C:\Windows\System32\svchost.exe -k LocalServicePeerNet,SERVICE_WIN32_SHARE_PROCESS,C:\Windows\System32\pnrpauto.dll,true,true,The file is signed and the signature was verified.,Microsoft Windows,Microsoft Windows Verification PCA
WN0003DTX,RDPCDD,RDPCDD,RDPDD Chained DD,C:\Windows\System32\drivers\RDPCDD.sys,71bf5f2ad8670f53b02dceaa45ced4c9,System32\DRIVERS\RDPCDD.sys,SERVICE_KERNEL_DRIVER,,true,true,The file is signed and the signature was verified.,Microsoft Windows,Microsoft Windows Verification PCA
WN0003DTX,Psched,QoS Packet Scheduler,QoS Packet Scheduler,C:\Windows\System32\drivers\pacer.sys,6aa1074c4fdbf82d874c18d4f2737f04,system32\DRIVERS\pacer.sys,SERVICE_KERNEL_DRIVER,,true,true,The file is signed and the signature was verified.,Microsoft Windows,Microsoft Windows Verification PCA
WN0003DTX,WbioSrvc,Windows Biometric Service,The Windows biometric service gives client applications the ability to capture  compare  manipulate  and store biometric data without gaining direct access to any biometric hardware or samples. The service is hosted in a privileged SVCHOST process.,C:\Windows\System32\svchost.exe,4e13a941b99fe98effb858ff11a4415e,C:\Windows\system32\svchost.exe -k WbioSvcGroup,SERVICE_WIN32_SHARE_PROCESS,C:\Windows\System32\wbiosrvc.dll,true,true,The file is signed and the signature was verified.,Microsoft Windows,Microsoft Windows Verification PCA
WN0003DTX,terminpt,Microsoft Remote Desktop Input Driver,,C:\Windows\System32\drivers\terminpt.sys,2fd6aecd9ea27d4ef58de9eb08bdbcca,\SystemRoot\system32\drivers\terminpt.sys,SERVICE_KERNEL_DRIVER,,true,true,The file is signed and the signature was verified.,Microsoft Windows,Microsoft Windows Verification PCA
WN0003DTX,EventSystem,COM+ Event System,Supports System Event Notification Service (SENS)  which provides automatic distribution of events to subscribing Component Object Model (COM) components. If the service is stopped  SENS will close and will not be able to provide logon and logoff notifications. If this service is disabled  any services that explicitly depend on it will fail to start.,C:\Windows\System32\svchost.exe,4e13a941b99fe98effb858ff11a4415e,C:\Windows\system32\svchost.exe -k LocalService,SERVICE_WIN32_SHARE_PROCESS,C:\Windows\System32\es.dll,true,true,The file is signed and the signature was verified.,Microsoft Windows,Microsoft Windows Verification PCA
WN0003DTX,KSecPkg,KSecPkg,,C:\Windows\System32\drivers\ksecpkg.sys,90d5eeeb87df045f79edf7fc9d963663,\SystemRoot\System32\Drivers\ksecpkg.sys,SERVICE_KERNEL_DRIVER,,true,true,The file is signed and the signature was verified.,Microsoft Windows,Microsoft Windows Verification PCA
WN0003DTX,mountmgr,Mount Point Manager,Driver responsible with maintaining persistent drive letters and names for volumes,C:\Windows\System32\drivers\mountmgr.sys,88d628690bc3cf11fc98d65c5a73e4d7,\SystemRoot\System32\drivers\mountmgr.sys,SERVICE_KERNEL_DRIVER,,true,true,The file is signed and the signature was verified.,Microsoft Windows,Microsoft Windows Verification PCA
WN0003DTX,mshidkmdf,Pass-through HID to KMDF Filter Driver,Device Filter to provide pass-through interface between HIDCLASS and KMDF,C:\Windows\System32\drivers\mshidkmdf.sys,615257f0a7e4a63e8764045a5399c219,\SystemRoot\System32\drivers\mshidkmdf.sys,SERVICE_KERNEL_DRIVER,,true,true,The file is signed and the signature was verified.,Microsoft Windows,Microsoft Windows Verification PCA
WN0003DTX,LanmanServer,Server,Supports file  print  and named-pipe sharing over the network for this computer. If this service is stopped  these functions will be unavailable. If this service is disabled  any services that explicitly depend on it will fail to start.,C:\Windows\System32\svchost.exe,4e13a941b99fe98effb858ff11a4415e,C:\Windows\system32\svchost.exe -k netsvcs,SERVICE_WIN32_SHARE_PROCESS,C:\Windows\System32\srvsvc.dll,true,true,The file is signed and the signature was verified.,Microsoft Windows,Microsoft Windows Verification PCA
WN0003DTX,SENS,System Event Notification Service,Monitors system events and notifies subscribers to COM+ Event System of these events.,C:\Windows\System32\svchost.exe,4e13a941b99fe98effb858ff11a4415e,C:\Windows\system32\svchost.exe -k netsvcs,SERVICE_WIN32_SHARE_PROCESS,C:\Windows\System32\Sens.dll,true,true,The file is signed and the signature was verified.,Microsoft Windows,Microsoft Windows Verification PCA
WN0003DTX,VBoxVideo,VBoxVideo,,C:\Windows\System32\drivers\VBoxVideo.sys,5b8d794d8cd77dbdfe2907a3a069c14f,system32\DRIVERS\VBoxVideo.sys,SERVICE_KERNEL_DRIVER,,true,true,The file is signed and the signature was verified.,Oracle Corporation,VeriSign Class 3 Code Signing 2010 CA
WN0003DTX,SCardSvr,Smart Card,Manages access to smart cards read by this computer. If this service is stopped  this computer will be unable to read smart cards. If this service is disabled  any services that explicitly depend on it will fail to start.,C:\Windows\System32\svchost.exe,4e13a941b99fe98effb858ff11a4415e,C:\Windows\system32\svchost.exe -k LocalServiceAndNoImpersonation,SERVICE_WIN32_SHARE_PROCESS,C:\Windows\System32\SCardSvr.dll,true,true,The file is signed and the signature was verified.,Microsoft Windows,Microsoft Windows Verification PCA
WN0003DTX,SharedAccess,Internet Connection Sharing (ICS),Provides network address translation  addressing  name resolution and/or intrusion prevention services for a home or small office network.,C:\Windows\System32\svchost.exe,4e13a941b99fe98effb858ff11a4415e,C:\Windows\System32\svchost.exe -k netsvcs,SERVICE_WIN32_SHARE_PROCESS,C:\Windows\System32\ipnathlp.dll,true,true,The file is signed and the signature was verified.,Microsoft Windows,Microsoft Windows Verification PCA
WN0003DTX,PlugPlay,Plug and Play,Enables a computer to recognize and adapt to hardware changes with little or no user input. Stopping or disabling this service will result in system instability.,C:\Windows\System32\svchost.exe,4e13a941b99fe98effb858ff11a4415e,C:\Windows\system32\svchost.exe -k DcomLaunch,SERVICE_WIN32_SHARE_PROCESS,C:\Windows\System32\umpnpmgr.dll,true,true,The file is signed and the signature was verified.,Microsoft Windows,Microsoft Windows Verification PCA
WN0003DTX,arcsas,arcsas,,C:\Windows\System32\drivers\arcsas.sys,ec005bb43247db63967e628f5095ce4d,\SystemRoot\system32\drivers\arcsas.sys,SERVICE_KERNEL_DRIVER,,true,true,The file is signed and the signature was verified.,Microsoft Windows,Microsoft Windows Verification PCA
WN0003DTX,VMAuthdService,VMware Authorization Service,Authorization and authentication service for starting and accessing virtual machines.,C:\Program Files (x86)\VMware\VMware Player\vmware-authd.exe,c8fdfa23778aa3a5bb9dd4c5f712f74b,"C:\Program Files (x86)\VMware\VMware Player\vmware-authd.exe""""""",SERVICE_WIN32_OWN_PROCESS,,true,true,The file is signed and the signature was verified.,"""VMware",VeriSign Class 3 Code Signing 2010 CA
WN0003DTX,b06bdrv,Broadcom NetXtreme II VBD,,C:\Windows\System32\drivers\bxvbda.sys,fb55ce39d698c83628d0a3ab704f73b3,\SystemRoot\system32\drivers\bxvbda.sys,SERVICE_KERNEL_DRIVER,,true,true,The file is signed and the signature was verified.,Microsoft Windows,Microsoft Windows Verification PCA
WN0003DTX,TDPIPE,TDPIPE,,C:\Windows\System32\drivers\tdpipe.sys,512c4c8a4dce1564f2358b643caa8585,system32\drivers\tdpipe.sys,SERVICE_KERNEL_DRIVER,,true,true,The file is signed and the signature was verified.,Microsoft Windows,Microsoft Windows Verification PCA
WN0003DTX,rdpbus,Remote Desktop Device Redirector Bus Driver,,C:\Windows\System32\drivers\rdpbus.sys,001f37a1e6fa4e89c61c8f011b9d7fb0,system32\DRIVERS\rdpbus.sys,SERVICE_KERNEL_DRIVER,,true,true,The file is signed and the signature was verified.,Microsoft Windows,Microsoft Windows Verification PCA
WN0003DTX,THREADORDER,Thread Ordering Server,Provides ordered execution for a group of threads within a specific period of time.,C:\Windows\System32\svchost.exe,4e13a941b99fe98effb858ff11a4415e,C:\Windows\system32\svchost.exe -k LocalService,SERVICE_WIN32_SHARE_PROCESS,C:\Windows\System32\mmcss.dll,true,true,The file is signed and the signature was verified.,Microsoft Windows,Microsoft Windows Verification PCA
WN0003DTX,Schedule,Task Scheduler,Enables a user to configure and schedule automated tasks on this computer. The service also hosts multiple Windows system-critical tasks. If this service is stopped or disabled  these tasks will not be run at their scheduled times. If this service is disabled  any services that explicitly depend on it will fail to start.,C:\Windows\System32\svchost.exe,4e13a941b99fe98effb858ff11a4415e,C:\Windows\system32\svchost.exe -k netsvcs,SERVICE_WIN32_SHARE_PROCESS,C:\Windows\System32\schedsvc.dll,true,true,The file is signed and the signature was verified.,Microsoft Windows,Microsoft Windows Verification PCA
WN0003DTX,IpFilterDriver,IP Traffic Filter Driver,IP Traffic Filter Driver,C:\Windows\System32\drivers\ipfltdrv.sys,a16f23ebf141d2532c7155495bbdfcfd,system32\DRIVERS\ipfltdrv.sys,SERVICE_KERNEL_DRIVER,,true,true,The file is signed and the signature was verified.,Microsoft Windows,Microsoft Windows Verification PCA
WN0003DTX,iphlpsvc,IP Helper,Provides tunnel connectivity using IPv6 transition technologies (6to4  ISATAP  Port Proxy  and Teredo)  and IP-HTTPS. If this service is stopped  the computer will not have the enhanced connectivity benefits that these technologies offer.,C:\Windows\System32\svchost.exe,4e13a941b99fe98effb858ff11a4415e,C:\Windows\System32\svchost.exe -k NetSvcs,SERVICE_WIN32_SHARE_PROCESS,C:\Windows\System32\iphlpsvc.dll,true,true,The file is signed and the signature was verified.,Microsoft Windows,Microsoft Windows Verification PCA
WN0003DTX,TsUsbGD,Remote Desktop Generic USB Device,,C:\Windows\System32\drivers\TsUsbGD.sys,4a112eb44f435aebf35c9ec99e4207c1,\SystemRoot\system32\drivers\TsUsbGD.sys,SERVICE_KERNEL_DRIVER,,true,true,The file is signed and the signature was verified.,Microsoft Windows,Microsoft Windows Verification PCA
WN0003DTX,NativeWifiP,NativeWiFi Filter,,C:\Windows\System32\drivers\nwifi.sys,0aaf3db95156e4b28aeb4f272d06dd5f,system32\DRIVERS\nwifi.sys,SERVICE_KERNEL_DRIVER,,true,true,The file is signed and the signature was verified.,Microsoft Windows,Microsoft Windows Verification PCA
WN0003DTX,tsusbhub,tsusbhub,,C:\Windows\System32\drivers\tsusbhub.sys,45b2d41c2b3d85919276dff37139bd10,system32\drivers\tsusbhub.sys,SERVICE_KERNEL_DRIVER,,true,true,The file is signed and the signature was verified.,Microsoft Windows,Microsoft Windows Verification PCA
WN0003DTX,lmhosts,TCP/IP NetBIOS Helper,Provides support for the NetBIOS over TCP/IP (NetBT) service and NetBIOS name resolution for clients on the network  therefore enabling users to share files  print  and log on to the network. If this service is stopped  these functions might be unavailable. If this service is disabled  any services that explicitly depend on it will fail to start.,C:\Windows\System32\svchost.exe,4e13a941b99fe98effb858ff11a4415e,C:\Windows\system32\svchost.exe -k LocalServiceNetworkRestricted,SERVICE_WIN32_SHARE_PROCESS,C:\Windows\System32\lmhsvc.dll,true,true,The file is signed and the signature was verified.,Microsoft Windows,Microsoft Windows Verification PCA
WN0003DTX,Browser,Computer Browser,Maintains an updated list of computers on the network and supplies this list to computers designated as browsers. If this service is stopped  this list will not be updated or maintained. If this service is disabled  any services that explicitly depend on it will fail to start.,C:\Windows\System32\svchost.exe,4e13a941b99fe98effb858ff11a4415e,C:\Windows\System32\svchost.exe -k netsvcs,SERVICE_WIN32_SHARE_PROCESS,C:\Windows\System32\browser.dll,true,true,The file is signed and the signature was verified.,Microsoft Windows,Microsoft Windows Verification PCA
WN0003DTX,blbdrive,blbdrive,,C:\Windows\System32\drivers\blbdrive.sys,37e3a486ae2a440bad1ad1ce7d96e028,system32\DRIVERS\blbdrive.sys,SERVICE_KERNEL_DRIVER,,true,true,The file is signed and the signature was verified.,Microsoft Windows,Microsoft Windows Verification PCA
WN0003DTX,FontCache3.0.0.0,Windows Presentation Foundation Font Cache 3.0.0.0,Optimizes performance of Windows Presentation Foundation (WPF) applications by caching commonly used font data. WPF applications will start this service if it is not already running. It can be disabled  though doing so will degrade the performance of WPF applications.,C:\Windows\Microsoft.Net\Framework64\v3.0\WPF\PresentationFontCache.exe,44692afd93c60070499700939304b8fd,C:\Windows\Microsoft.Net\Framework64\v3.0\WPF\PresentationFontCache.exe,SERVICE_WIN32_OWN_PROCESS,,true,true,The file is signed and the signature was verified.,Microsoft Windows,Microsoft Windows Verification PCA
WN0003DTX,nsi,Network Store Interface Service,This service delivers network notifications (e.g. interface addition/deleting etc) to user mode clients. Stopping this service will cause loss of network connectivity. If this service is disabled  any other services that explicitly depend on this service will fail to start.,C:\Windows\System32\svchost.exe,4e13a941b99fe98effb858ff11a4415e,C:\Windows\system32\svchost.exe -k LocalService,SERVICE_WIN32_SHARE_PROCESS,C:\Windows\System32\nsisvc.dll,true,true,The file is signed and the signature was verified.,Microsoft Windows,Microsoft Windows Verification PCA
WN0003DTX,kbdclass,Keyboard Class Driver,,C:\Windows\System32\drivers\kbdclass.sys,1556af85daea1be6c60bc0675adc41bb,system32\DRIVERS\kbdclass.sys,SERVICE_KERNEL_DRIVER,,true,true,The file is signed and the signature was verified.,Microsoft Windows,Microsoft Windows Verification PCA
WN0003DTX,WcsPlugInService,Windows Color System,The WcsPlugInService service hosts third-party Windows Color System color device model and gamut map model plug-in modules. These plug-in modules are vendor-specific extensions to the Windows Color System baseline color device and gamut map models. Stopping or disabling the WcsPlugInService service will disable this extensibility feature  and the Windows Color System will use its baseline model processing rather than the vendor's desired processing. This might result in inaccurate color rendering.,C:\Windows\System32\svchost.exe,4e13a941b99fe98effb858ff11a4415e,C:\Windows\system32\svchost.exe -k wcssvc,SERVICE_WIN32_SHARE_PROCESS,C:\Windows\System32\WcsPlugInService.dll,true,true,The file is signed and the signature was verified.,Microsoft Windows,Microsoft Windows Verification PCA
WN0003DTX,CmBatt,Microsoft ACPI Control Method Battery Driver,,C:\Windows\System32\drivers\CmBatt.sys,476e5bb61b842645e373f23a8c3ed5b6,system32\DRIVERS\CmBatt.sys,SERVICE_KERNEL_DRIVER,,true,true,The file is signed and the signature was verified.,Microsoft Windows,Microsoft Windows Verification PCA
WN0003DTX,HidIr,Microsoft Infrared HID Driver,,C:\Windows\System32\drivers\hidir.sys,45f81f5d4cb3ef0ab1b51bb20dd0b185,\SystemRoot\system32\drivers\hidir.sys,SERVICE_KERNEL_DRIVER,,true,true,The file is signed and the signature was verified.,Microsoft Windows,Microsoft Windows Verification PCA
WN0003DTX,agp440,Intel AGP Bus Filter,,C:\Windows\System32\drivers\AGP440.sys,592217b9f072842497d8dbff590f8b99,\SystemRoot\system32\drivers\agp440.sys,SERVICE_KERNEL_DRIVER,,true,true,The file is signed and the signature was verified.,Microsoft Windows,Microsoft Windows Verification PCA
WN0003DTX,upnphost,UPnP Device Host,Allows UPnP devices to be hosted on this computer. If this service is stopped  any hosted UPnP devices will stop functioning and no additional hosted devices can be added. If this service is disabled  any services that explicitly depend on it will fail to start.,C:\Windows\System32\svchost.exe,4e13a941b99fe98effb858ff11a4415e,C:\Windows\system32\svchost.exe -k LocalServiceAndNoImpersonation,SERVICE_WIN32_SHARE_PROCESS,C:\Windows\System32\upnphost.dll,true,true,The file is signed and the signature was verified.,Microsoft Windows,Microsoft Windows Verification PCA
WN0003DTX,mouhid,Mouse HID Driver,,C:\Windows\System32\drivers\mouhid.sys,bd42683384d9a34cd06239ad76ddc6d2,system32\DRIVERS\mouhid.sys,SERVICE_KERNEL_DRIVER,,true,true,The file is signed and the signature was verified.,Microsoft Windows,Microsoft Windows Verification PCA
WN0003DTX,Power,Power,Manages power policy and power policy notification delivery.,C:\Windows\System32\svchost.exe,4e13a941b99fe98effb858ff11a4415e,C:\Windows\system32\svchost.exe -k DcomLaunch,SERVICE_WIN32_SHARE_PROCESS,C:\Windows\System32\umpo.dll,true,true,The file is signed and the signature was verified.,Microsoft Windows,Microsoft Windows Verification PCA
WN0003DTX,PcaSvc,Program Compatibility Assistant Service,This service provides support for the Program Compatibility Assistant (PCA).  PCA monitors programs installed and run by the user and detects known compatibility problems. If this service is stopped  PCA will not function properly.,C:\Windows\System32\svchost.exe,4e13a941b99fe98effb858ff11a4415e,C:\Windows\system32\svchost.exe -k LocalSystemNetworkRestricted,SERVICE_WIN32_SHARE_PROCESS,C:\Windows\System32\pcasvc.dll,true,true,The file is signed and the signature was verified.,Microsoft Windows,Microsoft Windows Verification PCA
WN0003DTX,vhdmp,vhdmp,,C:\Windows\System32\drivers\vhdmp.sys,c3b4ef4010e20d12102d05a60dfa00a1,\SystemRoot\system32\drivers\vhdmp.sys,SERVICE_KERNEL_DRIVER,,true,true,The file is signed and the signature was verified.,Microsoft Windows,Microsoft Windows Verification PCA
WN0003DTX,hcmon,VMware hcmon,VMware USB Host Controller Monitor,C:\Windows\System32\drivers\hcmon.sys,41db77a5dd02e15dc5c79af5b91508eb,\SystemRoot\system32\DRIVERS\hcmon.sys,SERVICE_KERNEL_DRIVER,,true,true,The file is signed and the signature was verified.,Microsoft Windows Hardware Compatibility Publisher,Microsoft Windows Hardware Compatibility PCA
WN0003DTX,vsmraid,vsmraid,,C:\Windows\System32\drivers\vsmraid.sys,76c9ac88d5da091433b9e8d6cb1463e5,\SystemRoot\system32\drivers\vsmraid.sys,SERVICE_KERNEL_DRIVER,,true,true,The file is signed and the signature was verified.,Microsoft Windows,Microsoft Windows Verification PCA
WN0003DTX,PNRPsvc,Peer Name Resolution Protocol,Enables serverless peer name resolution over the Internet using the Peer Name Resolution Protocol (PNRP). If disabled  some peer-to-peer and collaborative applications  such as Remote Assistance  may not function.,C:\Windows\System32\svchost.exe,4e13a941b99fe98effb858ff11a4415e,C:\Windows\System32\svchost.exe -k LocalServicePeerNet,SERVICE_WIN32_SHARE_PROCESS,C:\Windows\System32\pnrpsvc.dll,true,true,The file is signed and the signature was verified.,Microsoft Windows,Microsoft Windows Verification PCA
